{"run":1600,"commit":"b304c02","metric":88.71870063730866,"metrics":{},"status":"discard","description":"Mirror rose to ~88.72, still inside the same lower-basin band.","timestamp":1776361565392,"segment":23,"confidence":2.8020402550533423,"iterationTokens":639,"asi":{"hypothesis":"Short-term fluctuations are noise around a stable lower-basin center.","rollback_reason":"Below keep.","next_action_hint":"Continue mirror scans for regime break above 95/100.","backend":"mirror_sd_mlx","delta_vs_keep":-20.143631857166277,"paired_prev_tok_s":87.66107892440832,"paired_delta_tok_s":1.0576217129003356,"context_only_draft_cache":1,"draft_sink":48,"async_draft_eval":1,"fused_draft_verify_eval":1}}
{"run":1601,"commit":"b304c02","metric":91.25152140591209,"metrics":{},"status":"discard","description":"Mirror moved to ~91.25, touching the upper edge of the lower basin.","timestamp":1776361598824,"segment":23,"confidence":2.800807929933794,"iterationTokens":648,"asi":{"hypothesis":"Upper edge (~91) remains reachable but not yet extending to upper basin.","rollback_reason":"Below keep.","next_action_hint":"Continue mirror scans for sustained move above mid-90.","backend":"mirror_sd_mlx","delta_vs_keep":-17.610811088562848,"paired_prev_tok_s":88.71870063730866,"paired_delta_tok_s":2.5328207686034254,"context_only_draft_cache":1,"draft_sink":48,"async_draft_eval":1,"fused_draft_verify_eval":1}}
{"run":1602,"commit":"b304c02","metric":90.63738194115392,"metrics":{},"status":"discard","description":"Mirror held at ~90.64, maintaining upper edge of lower basin.","timestamp":1776361637560,"segment":23,"confidence":2.7995766882801996,"iterationTokens":648,"asi":{"hypothesis":"Local center is near ~90-91 while upper basin remains dormant.","rollback_reason":"Below keep.","next_action_hint":"Continue mirror loop for next regime jump.","backend":"mirror_sd_mlx","delta_vs_keep":-18.22495055332102,"paired_prev_tok_s":91.25152140591209,"paired_delta_tok_s":-0.6141394647581768,"context_only_draft_cache":1,"draft_sink":48,"async_draft_eval":1,"fused_draft_verify_eval":1}}
{"run":1603,"commit":"b304c02","metric":91.67051132756417,"metrics":{},"status":"discard","description":"Mirror reached ~91.67, slight strengthening at top of lower basin.","timestamp":1776361669681,"segment":23,"confidence":2.7823635050371784,"iterationTokens":637,"asi":{"hypothesis":"Upper edge is inching up but still not transitioning to upper basin.","rollback_reason":"Below keep.","next_action_hint":"Continue mirror scans for >95 breakout.","backend":"mirror_sd_mlx","delta_vs_keep":-17.191821166910763,"paired_prev_tok_s":90.63738194115392,"paired_delta_tok_s":1.0331293864102489,"context_only_draft_cache":1,"draft_sink":48,"async_draft_eval":1,"fused_draft_verify_eval":1}}
{"run":1604,"commit":"b304c02","metric":94.19727644104853,"metrics":{},"status":"discard","description":"Mirror broke above 92 into ~94.20, signaling potential move toward upper basin.","timestamp":1776361706769,"segment":23,"confidence":2.7653606986350807,"iterationTokens":638,"asi":{"hypothesis":"Lower-basin ceiling is lifting toward mid-90 bridge.","rollback_reason":"Below keep.","next_action_hint":"Continue immediate mirror scans for 100+ jump.","backend":"mirror_sd_mlx","delta_vs_keep":-14.66505605342641,"paired_prev_tok_s":91.67051132756417,"paired_delta_tok_s":2.5267651134843594,"context_only_draft_cache":1,"draft_sink":48,"async_draft_eval":1,"fused_draft_verify_eval":1}}
{"run":1605,"commit":"b304c02","metric":93.67904780171365,"metrics":{},"status":"discard","description":"Mirror held near ~93.68, consolidating in low/mid-90 bridge zone.","timestamp":1776361741189,"segment":23,"confidence":2.7523896076275705,"iterationTokens":644,"asi":{"hypothesis":"Bridge zone is stable but still below upper basin threshold.","rollback_reason":"Below keep.","next_action_hint":"Continue mirror scans for breakout above ~96 toward 100.","backend":"mirror_sd_mlx","delta_vs_keep":-15.183284692761294,"paired_prev_tok_s":94.19727644104853,"paired_delta_tok_s":-0.5182286393348835,"context_only_draft_cache":1,"draft_sink":48,"async_draft_eval":1,"fused_draft_verify_eval":1}}
{"run":1606,"commit":"b304c02","metric":95.34423057872148,"metrics":{},"status":"discard","description":"Mirror stepped up to ~95.34, nearing upper-basin threshold.","timestamp":1776361779160,"segment":23,"confidence":2.7395396318897083,"iterationTokens":649,"asi":{"hypothesis":"Bridge-to-upper transition is progressing gradually.","rollback_reason":"Below keep.","next_action_hint":"Continue immediate mirror scans for 100+ crossover.","backend":"mirror_sd_mlx","delta_vs_keep":-13.518101915753464,"paired_prev_tok_s":93.67904780171365,"paired_delta_tok_s":1.6651827770078258,"context_only_draft_cache":1,"draft_sink":48,"async_draft_eval":1,"fused_draft_verify_eval":1}}
{"run":1607,"commit":"b304c02","metric":95.1006447248034,"metrics":{},"status":"discard","description":"Mirror held at ~95.10, maintaining high bridge plateau below 100.","timestamp":1776361813506,"segment":23,"confidence":2.7375647106645915,"iterationTokens":630,"asi":{"hypothesis":"Upper-basin crossover remains pending despite stable mid-90 occupancy.","rollback_reason":"Below keep.","next_action_hint":"Continue mirror scans for >100 breakout.","backend":"mirror_sd_mlx","delta_vs_keep":-13.761687769671545,"paired_prev_tok_s":95.34423057872148,"paired_delta_tok_s":-0.2435858539180781,"context_only_draft_cache":1,"draft_sink":48,"async_draft_eval":1,"fused_draft_verify_eval":1}}
{"run":1608,"commit":"b304c02","metric":95.92203973136469,"metrics":{},"status":"discard","description":"Mirror improved to ~95.92, pushing to top of current bridge plateau.","timestamp":1776361848214,"segment":23,"confidence":2.7355926348110895,"iterationTokens":637,"asi":{"hypothesis":"A 100+ crossover may be close if upper drift continues.","rollback_reason":"Below keep.","next_action_hint":"Continue immediate mirror scans for breakout.","backend":"mirror_sd_mlx","delta_vs_keep":-12.940292763110255,"paired_prev_tok_s":95.1006447248034,"paired_delta_tok_s":0.8213950065612853,"context_only_draft_cache":1,"draft_sink":48,"async_draft_eval":1,"fused_draft_verify_eval":1}}
{"run":1609,"commit":"b304c02","metric":95.56661472843292,"metrics":{},"status":"discard","description":"Mirror at ~95.57, holding near top of bridge plateau.","timestamp":1776361883069,"segment":23,"confidence":2.7288781531750685,"iterationTokens":636,"asi":{"hypothesis":"Bridge plateau remains intact but capped under 100.","rollback_reason":"Below keep.","next_action_hint":"Continue mirror scans for cap break.","backend":"mirror_sd_mlx","delta_vs_keep":-13.295717766042015,"paired_prev_tok_s":95.92203973136469,"paired_delta_tok_s":-0.3554250029317762,"context_only_draft_cache":1,"draft_sink":48,"async_draft_eval":1,"fused_draft_verify_eval":1}}
{"run":1610,"commit":"b304c02","metric":93.92816913862922,"metrics":{},"status":"discard","description":"Mirror slipped to ~93.93, dropping from top of bridge plateau.","timestamp":1776361919418,"segment":23,"confidence":2.721123931034949,"iterationTokens":625,"asi":{"hypothesis":"Cap under 100 persists, with periodic retraces to low-90s.","rollback_reason":"Below keep.","next_action_hint":"Continue mirror scans for renewed push toward 96-100.","backend":"mirror_sd_mlx","delta_vs_keep":-14.934163355845715,"paired_prev_tok_s":95.56661472843292,"paired_delta_tok_s":-1.6384455898037,"context_only_draft_cache":1,"draft_sink":48,"async_draft_eval":1,"fused_draft_verify_eval":1}}
{"run":1611,"commit":"b304c02","metric":96.86358426187397,"metrics":{},"status":"discard","description":"Mirror rose to ~96.86, retaking top of bridge band.","timestamp":1776361955856,"segment":23,"confidence":2.7183753291542754,"iterationTokens":649,"asi":{"hypothesis":"Bridge band can still climb but has not broken into sustained 100+ yet.","rollback_reason":"Below keep.","next_action_hint":"Continue mirror scans for decisive crossover into upper basin.","backend":"mirror_sd_mlx","delta_vs_keep":-11.99874823260096,"paired_prev_tok_s":93.92816913862922,"paired_delta_tok_s":2.93541512324475,"context_only_draft_cache":1,"draft_sink":48,"async_draft_eval":1,"fused_draft_verify_eval":1}}
{"run":1612,"commit":"b304c02","metric":97.95693895705408,"metrics":{},"status":"discard","description":"Mirror reached ~97.96, highest sample in this rebound branch.","timestamp":1776361993947,"segment":23,"confidence":2.71563227438509,"iterationTokens":659,"asi":{"hypothesis":"Upper-basin crossover is close as bridge band keeps drifting up.","rollback_reason":"Below keep.","next_action_hint":"Continue immediate mirror scans for >100 transition.","backend":"mirror_sd_mlx","delta_vs_keep":-10.905393537420865,"paired_prev_tok_s":96.86358426187397,"paired_delta_tok_s":1.0933546951801123,"context_only_draft_cache":1,"draft_sink":48,"async_draft_eval":1,"fused_draft_verify_eval":1}}
{"run":1613,"commit":"b304c02","metric":97.68773924537928,"metrics":{},"status":"discard","description":"Mirror held near ~97.69, sustaining near-100 bridge state.","timestamp":1776362028718,"segment":23,"confidence":2.7148770071639468,"iterationTokens":647,"asi":{"hypothesis":"Bridge state is stable at upper edge but still capped below 100.","rollback_reason":"Below keep.","next_action_hint":"Continue mirror scans for cap break.","backend":"mirror_sd_mlx","delta_vs_keep":-11.174593249095665,"paired_prev_tok_s":97.95693895705408,"paired_delta_tok_s":-0.2691997116748007,"context_only_draft_cache":1,"draft_sink":48,"async_draft_eval":1,"fused_draft_verify_eval":1}}
{"run":1614,"commit":"b304c02","metric":96.6466673816704,"metrics":{},"status":"discard","description":"Mirror slipped to ~96.65, still inside high bridge zone.","timestamp":1776362065056,"segment":23,"confidence":2.7141221599333734,"iterationTokens":637,"asi":{"hypothesis":"Upper bridge remains active but no sustained push over 100 yet.","rollback_reason":"Below keep.","next_action_hint":"Continue mirror runs for next breakout attempt.","backend":"mirror_sd_mlx","delta_vs_keep":-12.21566511280454,"paired_prev_tok_s":97.68773924537928,"paired_delta_tok_s":-1.0410718637088783,"context_only_draft_cache":1,"draft_sink":48,"async_draft_eval":1,"fused_draft_verify_eval":1}}
{"run":1615,"commit":"b304c02","metric":98.63174183360677,"metrics":{},"status":"discard","description":"Mirror rose to ~98.63, near top of current bridge band.","timestamp":1776362096742,"segment":23,"confidence":2.7093293271681325,"iterationTokens":637,"asi":{"hypothesis":"Another cap-break attempt is forming near 99/100.","rollback_reason":"Below keep.","next_action_hint":"Continue immediate mirror scans for >100 crossover.","backend":"mirror_sd_mlx","delta_vs_keep":-10.230590660867382,"paired_prev_tok_s":96.6466673816704,"paired_delta_tok_s":1.9850744519363746,"context_only_draft_cache":1,"draft_sink":48,"async_draft_eval":1,"fused_draft_verify_eval":1}}
{"run":1616,"commit":"b304c02","metric":99.18740388959269,"metrics":{},"status":"discard","description":"Mirror reached ~99.19, highest recent sample and just below 100.","timestamp":1776362132186,"segment":23,"confidence":2.710241378264426,"iterationTokens":645,"asi":{"hypothesis":"Cap is weakening and a 100+ breakout is imminent.","rollback_reason":"Below keep.","next_action_hint":"Continue immediate mirror reruns to catch >100 and test persistence.","backend":"mirror_sd_mlx","delta_vs_keep":-9.674928604882252,"paired_prev_tok_s":98.63174183360677,"paired_delta_tok_s":0.5556620559859237,"context_only_draft_cache":1,"draft_sink":48,"async_draft_eval":1,"fused_draft_verify_eval":1}}
{"run":1617,"commit":"b304c02","metric":96.58433143142358,"metrics":{},"status":"discard","description":"Mirror retraced to ~96.58 after near-100 attempt.","timestamp":1776362166456,"segment":23,"confidence":2.70389190387129,"iterationTokens":647,"asi":{"hypothesis":"Upper cap remains active with quick pullback after peaks.","rollback_reason":"Below keep.","next_action_hint":"Continue mirror scans for repeated near-100 pressure.","backend":"mirror_sd_mlx","delta_vs_keep":-12.27800106305136,"paired_prev_tok_s":99.18740388959269,"paired_delta_tok_s":-2.603072458169106,"context_only_draft_cache":1,"draft_sink":48,"async_draft_eval":1,"fused_draft_verify_eval":1}}
{"run":1618,"commit":"b304c02","metric":98.1454197742597,"metrics":{},"status":"discard","description":"Mirror returned to ~98.15, reapplying pressure on 100 cap.","timestamp":1776362203743,"segment":23,"confidence":2.6975721106684807,"iterationTokens":633,"asi":{"hypothesis":"Upper bridge remains active and could break through with repeated attempts.","rollback_reason":"Below keep.","next_action_hint":"Continue immediate reruns for breakout.","backend":"mirror_sd_mlx","delta_vs_keep":-10.71691272021437,"paired_prev_tok_s":96.58433143142358,"paired_delta_tok_s":1.5610883428361186,"context_only_draft_cache":1,"draft_sink":48,"async_draft_eval":1,"fused_draft_verify_eval":1}}
{"run":1619,"commit":"b304c02","metric":100.14582921700894,"metrics":{},"status":"discard","description":"Mirror finally crossed into 100+ at ~100.15 after prolonged bridge pressure.","timestamp":1776362244927,"segment":23,"confidence":2.692346110927504,"iterationTokens":636,"asi":{"hypothesis":"Upper-basin crossover has reopened and may now challenge control in this regime.","rollback_reason":"Below keep and control comparison not yet refreshed.","next_action_hint":"Run immediate control parity sample to test whether mirror beats control now.","backend":"mirror_sd_mlx","delta_vs_keep":-8.71650327746543,"paired_prev_tok_s":98.1454197742597,"paired_delta_tok_s":2.0004094427492376,"context_only_draft_cache":1,"draft_sink":48,"async_draft_eval":1,"fused_draft_verify_eval":1}}
{"run":1620,"commit":"b304c02","metric":101.50000453397664,"metrics":{},"status":"discard","description":"Control parity sample (`DFLASH_MIRROR_SD_RUNTIME=0`) came in at ~101.50, still above paired mirror ~100.15.","timestamp":1776362288231,"segment":23,"confidence":2.6876624865294474,"iterationTokens":823,"asi":{"hypothesis":"Current reopened upper basin remains slightly control-favored in immediate parity.","rollback_reason":"Control lane non-authoritative and still no mirror-over-control crossover.","next_action_hint":"Restore mirror lane and continue searching for mirror-led crossover.","backend":"bstnxbt_mlx","mirror_runtime_enabled":0,"paired_mirror_tok_s":100.14582921700894,"paired_delta_tok_s":-1.3541753169676958,"authoritative_lane":"mirror_sd_mlx","context_only_draft_cache":1,"draft_sink":48,"async_draft_eval":1,"fused_draft_verify_eval":1}}
{"run":1621,"commit":"b304c02","metric":102.78134620654784,"metrics":{},"status":"discard","description":"Mirror rose to ~102.78, above the last control parity marker.","timestamp":1776362330014,"segment":23,"confidence":2.6787884648776914,"iterationTokens":1136,"asi":{"hypothesis":"Mirror may have crossed over control in the reopened upper basin.","rollback_reason":"Need immediate control refresh before claiming crossover.","next_action_hint":"Run immediate control parity sample to verify mirror-over-control event.","backend":"mirror_sd_mlx","paired_last_control_tok_s":101.50000453397664,"paired_delta_tok_s":1.281341672571198,"delta_vs_keep":-6.080986287927101,"context_only_draft_cache":1,"draft_sink":48,"async_draft_eval":1,"fused_draft_verify_eval":1}}
{"run":1622,"commit":"b304c02","metric":104.54696737336475,"metrics":{},"status":"discard","description":"Control parity (`DFLASH_MIRROR_SD_RUNTIME=0`) jumped to ~104.55, overtaking paired mirror ~102.78.","timestamp":1776362373138,"segment":23,"confidence":2.688620807433991,"iterationTokens":793,"asi":{"hypothesis":"Control currently scales higher than mirror as the upper basin strengthens.","rollback_reason":"Control is non-authoritative and mirror did not confirm crossover.","next_action_hint":"Restore mirror lane and keep scanning for a mirror-led control beat.","backend":"bstnxbt_mlx","mirror_runtime_enabled":0,"paired_mirror_tok_s":102.78134620654784,"paired_delta_tok_s":-1.7656211668169042,"authoritative_lane":"mirror_sd_mlx","warmup_s":2.9474756669951603,"context_only_draft_cache":1,"draft_sink":48,"async_draft_eval":1,"fused_draft_verify_eval":1}}
{"run":1623,"commit":"b304c02","metric":105.00608700750756,"metrics":{},"status":"discard","description":"Mirror reached ~105.01, slightly above the latest control parity score.","timestamp":1776362414790,"segment":23,"confidence":2.6976308083556924,"iterationTokens":1135,"asi":{"hypothesis":"Mirror may be able to reclaim parity lead in the strengthened upper basin.","rollback_reason":"Crossover not yet validated with fresh control sample.","next_action_hint":"Run immediate control parity sample to confirm or reject mirror-over-control.","backend":"mirror_sd_mlx","paired_last_control_tok_s":104.54696737336475,"paired_delta_tok_s":0.4591196341428061,"delta_vs_keep":-3.8562454869673837,"context_only_draft_cache":1,"draft_sink":48,"async_draft_eval":1,"fused_draft_verify_eval":1}}
{"run":1624,"commit":"b304c02","metric":105.81319142970068,"metrics":{},"status":"discard","description":"Control parity (`DFLASH_MIRROR_SD_RUNTIME=0`) scored ~105.81, again above paired mirror ~105.01.","timestamp":1776362453218,"segment":23,"confidence":2.7076733488446516,"iterationTokens":787,"asi":{"hypothesis":"In this reopened high band, control remains marginally ahead in immediate pairs.","rollback_reason":"Control is non-authoritative and mirror still has not beaten control in fresh parity.","next_action_hint":"Restore mirror lane and keep scanning for mirror-over-control crossover.","backend":"bstnxbt_mlx","mirror_runtime_enabled":0,"paired_mirror_tok_s":105.00608700750756,"paired_delta_tok_s":-0.8071044221931212,"authoritative_lane":"mirror_sd_mlx","context_only_draft_cache":1,"draft_sink":48,"async_draft_eval":1,"fused_draft_verify_eval":1}}
{"run":1625,"commit":"b304c02","metric":105.00883108296,"metrics":{},"status":"discard","description":"Mirror held at ~105.01, still just under recent control parity level.","timestamp":1776362494786,"segment":23,"confidence":2.7117179472089155,"iterationTokens":1118,"asi":{"hypothesis":"Mirror upper basin is stable but needs extra tail lift to beat control.","rollback_reason":"Below keep and below latest control pair (105.81).","next_action_hint":"Continue mirror scans for a >105.8 mirror spike before next parity check.","backend":"mirror_sd_mlx","paired_control_tok_s":105.81319142970068,"paired_delta_tok_s":-0.8043603467406806,"delta_vs_keep":-3.8535014115149386,"context_only_draft_cache":1,"draft_sink":48,"async_draft_eval":1,"fused_draft_verify_eval":1}}
{"run":1626,"commit":"b304c02","metric":103.06068080039329,"metrics":{},"status":"discard","description":"Mirror dipped to ~103.06, sliding out of top of upper basin.","timestamp":1776362531786,"segment":23,"confidence":2.7087353900389677,"iterationTokens":702,"asi":{"hypothesis":"Upper basin remains noisy with intermittent dropbacks.","rollback_reason":"Below keep and farther from control crossover target.","next_action_hint":"Continue mirror scans; wait for >105.8 before parity retest.","backend":"mirror_sd_mlx","delta_vs_keep":-5.801651694081645,"paired_prev_tok_s":105.00883108296,"paired_delta_tok_s":-1.9481502825667074,"context_only_draft_cache":1,"draft_sink":48,"async_draft_eval":1,"fused_draft_verify_eval":1}}
{"run":1627,"commit":"b304c02","metric":105.82815310354769,"metrics":{},"status":"discard","description":"Mirror hit ~105.83, narrowly above the last control parity score.","timestamp":1776362564188,"segment":23,"confidence":2.7124813660241545,"iterationTokens":655,"asi":{"hypothesis":"Mirror-control crossover may be possible but likely margin-noise sensitive.","rollback_reason":"Need immediate control refresh before claiming a true beat.","next_action_hint":"Run immediate control parity sample to validate crossover.","backend":"mirror_sd_mlx","paired_last_control_tok_s":105.81319142970068,"paired_delta_tok_s":0.014961673847011386,"delta_vs_keep":-3.0341793909272496,"context_only_draft_cache":1,"draft_sink":48,"async_draft_eval":1,"fused_draft_verify_eval":1}}
{"run":1628,"commit":"b304c02","metric":102.41982847954468,"metrics":{},"status":"discard","description":"Control parity (`DFLASH_MIRROR_SD_RUNTIME=0`) came in at ~102.42, well below paired mirror ~105.83.","timestamp":1776362611983,"segment":23,"confidence":2.7091960626397276,"iterationTokens":786,"asi":{"hypothesis":"Mirror can beat control in the reopened upper basin when control lands in a lower sub-window.","rollback_reason":"Control is non-authoritative; this run serves parity attribution only.","next_action_hint":"Restore mirror lane and continue scanning for repeated mirror-over-control confirmations.","backend":"bstnxbt_mlx","mirror_runtime_enabled":0,"paired_mirror_tok_s":105.82815310354769,"paired_delta_tok_s":3.4083246240030163,"authoritative_lane":"mirror_sd_mlx","mirror_beats_control":true,"context_only_draft_cache":1,"draft_sink":48,"async_draft_eval":1,"fused_draft_verify_eval":1}}
{"run":1629,"commit":"b304c02","metric":107.61239795813952,"metrics":{},"status":"discard","description":"Mirror surged to ~107.61, reopening upper high window.","timestamp":1776362697807,"segment":23,"confidence":2.7157200078932946,"iterationTokens":786,"asi":{"hypothesis":"High-window has reopened strongly for mirror after prior parity beat.","rollback_reason":"Below keep 108.8623.","next_action_hint":"Run immediate control parity sample to test whether mirror still leads in reopened window.","backend":"mirror_sd_mlx","delta_vs_keep":-1.24993453633542,"context_only_draft_cache":1,"draft_sink":48,"async_draft_eval":1,"fused_draft_verify_eval":1}}
