{"run":1712,"commit":"cb4dd2f","metric":9.208630257751793,"metrics":{},"status":"discard","description":"Mirror remained in soft 103 tok/s band with eval_s ~9.21; speculative metrics still unchanged.","timestamp":1776370011619,"segment":24,"confidence":null,"iterationTokens":1142,"asi":{"hypothesis":"Current regime remains eval-bound with limited short-run movement in acceptance statistics.","rollback_reason":"Primary metric above baseline best.","next_action_hint":"Continue loop for regime transition detection; no structural probe until new collapse or clear high-window breakout.","diagnostic_findings":{"completion_tok_s":103.01930829894803,"dflash_eval_s":9.208630257751793,"dflash_total_s":9.731083458056673,"dflash_acceptance_rate":0.6972201352366642,"dflash_draft_steps":96}}}
{"run":1713,"commit":"cb4dd2f","metric":9.213580540148541,"metrics":{},"status":"discard","description":"Control parity telemetry in soft-band regime matched mirror closely (eval_s ~9.21, tok/s ~102.82), reinforcing shared behavior.","timestamp":1776370052367,"segment":24,"confidence":null,"iterationTokens":1323,"asi":{"hypothesis":"Outside collapse spikes, mirror/control should remain near-parity on eval_s and acceptance if bottleneck is shared.","rollback_reason":"Primary metric did not improve vs baseline.","next_action_hint":"Restore mirror lane and continue continuous monitoring for next regime shift.","backend":"bstnxbt_mlx","paired_mirror_eval_s":9.208630257751793,"paired_delta_eval_s":0.004950282396748147,"paired_control_tok_s":102.82372887481124,"paired_mirror_tok_s":103.01930829894803,"dflash_acceptance_rate":0.6972201352366642,"dflash_draft_steps":96}}
{"run":1714,"commit":"cb4dd2f","metric":9.210368335712701,"metrics":{},"status":"discard","description":"Mirror soft-band telemetry remained stable (~103.00 tok/s, eval_s ~9.21) with fixed acceptance counters.","timestamp":1776370082674,"segment":24,"confidence":null,"iterationTokens":1284,"asi":{"hypothesis":"Current regime is a shared soft plateau around eval_s~9.2 without structural changes.","rollback_reason":"Primary metric above baseline best.","next_action_hint":"Continue loop; watch for either sub-9 breakout or renewed collapse for targeted parity attribution.","diagnostic_findings":{"completion_tok_s":103.000645254618,"dflash_eval_s":9.210368335712701,"dflash_total_s":9.731719041941687,"dflash_acceptance_rate":0.6972201352366642,"dflash_draft_steps":96}}}
{"run":1715,"commit":"cb4dd2f","metric":9.204389871796593,"metrics":{},"status":"discard","description":"Mirror soft plateau persisted (~103.08 tok/s, eval_s ~9.20) with no change in speculative acceptance profile.","timestamp":1776370123908,"segment":24,"confidence":null,"iterationTokens":1447,"asi":{"hypothesis":"Short-run repeats in the shared soft plateau should continue to cluster tightly around eval_s~9.2.","rollback_reason":"Primary metric still above baseline best.","next_action_hint":"Continue autonomous loop awaiting regime shift (sub-9 breakout or collapse transition).","diagnostic_findings":{"completion_tok_s":103.07730464185586,"dflash_eval_s":9.204389871796593,"dflash_total_s":9.723365833982825,"dflash_acceptance_rate":0.6972201352366642,"dflash_draft_steps":96}}}
{"run":1716,"commit":"cb4dd2f","metric":9.249202626873739,"metrics":{},"status":"discard","description":"Mirror soft plateau drifted slightly slower (~102.57 tok/s, eval_s ~9.25) with stable acceptance counters.","timestamp":1776370157162,"segment":24,"confidence":null,"iterationTokens":1140,"asi":{"hypothesis":"Current shared soft regime may oscillate narrowly around eval_s~9.2-9.3 without code changes.","rollback_reason":"Primary metric remains above baseline best.","next_action_hint":"Continue loop and only branch into parity/mitigation on clear regime transition.","diagnostic_findings":{"completion_tok_s":102.57256338235042,"dflash_eval_s":9.249202626873739,"dflash_total_s":9.7704338330077,"dflash_acceptance_rate":0.6972201352366642,"dflash_draft_steps":96}}}
{"run":1717,"commit":"cb4dd2f","metric":9.405006038490683,"metrics":{},"status":"discard","description":"Mirror remained in softened plateau (~100.92 tok/s) with eval_s drifting up to ~9.41; acceptance unchanged.","timestamp":1776370188283,"segment":24,"confidence":null,"iterationTokens":1156,"asi":{"hypothesis":"Softened regime continues to vary mainly via eval-time inflation at constant speculative structure.","rollback_reason":"Primary metric above baseline and trending worse.","next_action_hint":"Continue monitoring for either collapse transition or return toward sub-9 eval_s band.","diagnostic_findings":{"completion_tok_s":100.91877477489133,"dflash_eval_s":9.405006038490683,"dflash_total_s":9.931974583072588,"dflash_acceptance_rate":0.6972201352366642,"dflash_draft_steps":96}}}
{"run":1718,"commit":"cb4dd2f","metric":9.368439369252883,"metrics":{},"status":"discard","description":"Mirror stayed in low-101 soft band with eval_s ~9.37 and unchanged acceptance counters.","timestamp":1776370219224,"segment":24,"confidence":null,"iterationTokens":1137,"asi":{"hypothesis":"No-code soft-band samples should keep speculative counters fixed and vary mostly in eval_s.","rollback_reason":"Primary metric remains above baseline best.","next_action_hint":"Continue autonomous loop for regime transition detection.","diagnostic_findings":{"completion_tok_s":101.25137821223224,"dflash_eval_s":9.368439369252883,"dflash_total_s":9.900245000026189,"dflash_acceptance_rate":0.6972201352366642,"dflash_draft_steps":96}}}
{"run":1719,"commit":"cb4dd2f","metric":9.7052870382322,"metrics":{},"status":"discard","description":"Mirror soft regime slipped further (~97.80 tok/s, eval_s ~9.71) while speculative acceptance remained constant.","timestamp":1776370253266,"segment":24,"confidence":null,"iterationTokens":1161,"asi":{"hypothesis":"Soft-band degradation continues to be explained by eval-time inflation, not acceptance changes.","rollback_reason":"Primary metric above baseline and worsened versus recent soft-band samples.","next_action_hint":"Continue loop and watch for transition into either deep collapse or renewed high-window recovery.","diagnostic_findings":{"completion_tok_s":97.79902296023678,"dflash_eval_s":9.7052870382322,"dflash_total_s":10.24700104095973,"dflash_acceptance_rate":0.6972201352366642,"dflash_draft_steps":96}}}
{"run":1720,"commit":"cb4dd2f","metric":9.149076421977952,"metrics":{},"status":"discard","description":"Mirror sample bounced back from 9.7 softening to eval_s ~9.15 with throughput ~103.48; acceptance remained fixed.","timestamp":1776370343270,"segment":24,"confidence":null,"iterationTokens":8588,"asi":{"hypothesis":"Soft plateau should continue mean-reverting around eval_s~9.2 with unchanged speculative counters.","rollback_reason":"Primary metric still above baseline best (8.79).","next_action_hint":"Continue mirror-only monitoring until a clear regime break (sub-9 re-entry or collapse) occurs.","diagnostic_findings":{"completion_tok_s":103.4794780786221,"dflash_eval_s":9.149076421977952,"dflash_total_s":9.686837999965064,"dflash_acceptance_rate":0.6972201352366642,"dflash_draft_steps":96}}}
{"run":1721,"commit":"cb4dd2f","metric":8.913320918218233,"metrics":{},"status":"discard","description":"Mirror sample re-entered near-high window (~106.21 tok/s) with eval_s ~8.91, still just above baseline floor.","timestamp":1776370372201,"segment":24,"confidence":null,"iterationTokens":1138,"asi":{"hypothesis":"Soft regime can transiently approach high-window eval levels without changing speculative acceptance profile.","rollback_reason":"Primary metric did not beat baseline 8.79.","next_action_hint":"Continue loop for potential sub-8.9 re-entry; no parity check needed unless collapse or significant divergence appears.","diagnostic_findings":{"completion_tok_s":106.2108795502058,"dflash_eval_s":8.913320918218233,"dflash_total_s":9.43092954205349,"dflash_acceptance_rate":0.6972201352366642}}}
{"run":1722,"commit":"cb4dd2f","metric":8.91214379365556,"metrics":{},"status":"discard","description":"Mirror remained near high-window (~105.96 tok/s) with eval_s ~8.91 and unchanged acceptance stats.","timestamp":1776370403256,"segment":24,"confidence":null,"iterationTokens":1128,"asi":{"hypothesis":"Near-high-window repeats should cluster around ~8.9 eval_s in current regime.","rollback_reason":"Primary metric still above baseline floor.","next_action_hint":"Continue monitoring for true baseline break (<8.79) or renewed collapse transition.","diagnostic_findings":{"completion_tok_s":105.9626963192308,"dflash_eval_s":8.91214379365556,"dflash_total_s":9.43666191608645,"dflash_acceptance_rate":0.6972201352366642}}}
{"run":1723,"commit":"cb4dd2f","metric":8.914917456335388,"metrics":{},"status":"discard","description":"Mirror near-high repeat stayed ~106.04 tok/s with eval_s ~8.91 and fixed acceptance profile.","timestamp":1776370432833,"segment":24,"confidence":null,"iterationTokens":1131,"asi":{"hypothesis":"Current regime remains tightly clustered near eval_s~8.91 when high-window is open.","rollback_reason":"Primary metric above baseline best.","next_action_hint":"Continue loop for regime shift detection.","diagnostic_findings":{"completion_tok_s":106.03683318259708,"dflash_eval_s":8.914917456335388,"dflash_total_s":9.436448207939975,"dflash_acceptance_rate":0.6972201352366642}}}
{"run":1724,"commit":"cb4dd2f","metric":8.887282996322028,"metrics":{},"status":"discard","description":"Mirror high-window sample improved to eval_s ~8.89 (~106.44 tok/s) but still above baseline floor.","timestamp":1776370463478,"segment":24,"confidence":null,"iterationTokens":1086,"asi":{"hypothesis":"High-window drift may tighten toward baseline without code changes, with stable acceptance.","rollback_reason":"Primary metric improved locally but remains above best baseline (8.786).","next_action_hint":"Continue loop for possible baseline break or next collapse transition.","diagnostic_findings":{"completion_tok_s":106.44446431394026,"dflash_eval_s":8.887282996322028,"dflash_total_s":9.406147625064477,"dflash_acceptance_rate":0.6972201352366642}}}
{"run":1725,"commit":"cb4dd2f","metric":8.987954625859857,"metrics":{},"status":"discard","description":"Mirror sample softened slightly (~105.33 tok/s, eval_s ~8.99) with unchanged speculative telemetry profile.","timestamp":1776370494624,"segment":24,"confidence":null,"iterationTokens":1183,"asi":{"hypothesis":"Near-high regime remains dominated by small eval_s drift while acceptance is invariant.","rollback_reason":"Primary metric above baseline best.","next_action_hint":"Continue loop; watch for regime break points.","diagnostic_findings":{"completion_tok_s":105.33205150902333,"dflash_eval_s":8.987954625859857,"dflash_total_s":9.507432000013068,"dflash_acceptance_rate":0.6972201352366642}}}
{"run":1726,"commit":"cb4dd2f","metric":9.07550925842952,"metrics":{},"status":"discard","description":"Mirror soft-high sample (~104.45 tok/s) with eval_s ~9.08; acceptance counters unchanged.","timestamp":1776370526423,"segment":24,"confidence":null,"iterationTokens":1085,"asi":{"hypothesis":"Soft-high plateau continues to fluctuate within ~9.0-9.2 eval range without structural shifts.","rollback_reason":"Primary metric above baseline best.","next_action_hint":"Continue autonomous monitoring for collapse/high-window transitions.","diagnostic_findings":{"completion_tok_s":104.45006447691054,"dflash_eval_s":9.07550925842952,"dflash_total_s":9.596061207936145,"dflash_acceptance_rate":0.6972201352366642}}}
{"run":1727,"commit":"cb4dd2f","metric":9.119611792848445,"metrics":{},"status":"discard","description":"Mirror remained on soft plateau (~103.95 tok/s, eval_s ~9.12) with stable acceptance telemetry.","timestamp":1776370560022,"segment":24,"confidence":null,"iterationTokens":1096,"asi":{"hypothesis":"Without structural changes, this regime should keep acceptance fixed and vary mostly in eval latency.","rollback_reason":"Primary metric above baseline best.","next_action_hint":"Continue baseline loop and reserve parity checks for regime transitions only.","diagnostic_findings":{"completion_tok_s":103.95274079067019,"dflash_eval_s":9.119611792848445,"dflash_total_s":9.640965707949363,"dflash_acceptance_rate":0.6972201352366642}}}
{"run":1728,"commit":"cb4dd2f","metric":9.482034456916153,"metrics":{},"status":"discard","description":"Mirror soft regime degraded toward ~99.94 tok/s with eval_s ~9.48; acceptance remained constant.","timestamp":1776370590533,"segment":24,"confidence":null,"iterationTokens":1091,"asi":{"hypothesis":"Near-100 troughs in the soft regime are still eval-latency driven with no acceptance shift.","rollback_reason":"Primary metric above baseline and worse than recent samples.","next_action_hint":"Continue monitoring for either deeper collapse or rebound toward high-window.","diagnostic_findings":{"completion_tok_s":99.94127961777112,"dflash_eval_s":9.482034456916153,"dflash_total_s":10.018630667007528,"dflash_acceptance_rate":0.6972201352366642}}}
{"run":1729,"commit":"cb4dd2f","metric":9.185056168120354,"metrics":{},"status":"discard","description":"Mirror sample returned to mid-soft band (~103.22 tok/s, eval_s ~9.19) with stable speculative counters.","timestamp":1776370631859,"segment":24,"confidence":null,"iterationTokens":1475,"asi":{"hypothesis":"Soft regime remains bounded and acceptance-invariant under unchanged keep shape.","rollback_reason":"Primary metric above baseline best.","next_action_hint":"Continue autonomous monitoring for regime transition.","diagnostic_findings":{"completion_tok_s":103.21535182849982,"dflash_eval_s":9.185056168120354,"dflash_total_s":9.707557667046785,"dflash_acceptance_rate":0.6972201352366642}}}
{"run":1730,"commit":"cb4dd2f","metric":9.175578371156007,"metrics":{},"status":"discard","description":"Mirror repeat held soft-band center (~103.25 tok/s, eval_s ~9.18) with unchanged acceptance.","timestamp":1776370660720,"segment":24,"confidence":null,"iterationTokens":1080,"asi":{"hypothesis":"Consecutive repeats should confirm soft-band center before next regime shift.","rollback_reason":"Primary metric above baseline best.","next_action_hint":"Continue loop for transition detection.","diagnostic_findings":{"completion_tok_s":103.2535410917079,"dflash_eval_s":9.175578371156007,"dflash_total_s":9.7051598749822,"dflash_acceptance_rate":0.6972201352366642}}}
{"run":1731,"commit":"cb4dd2f","metric":9.134209045325406,"metrics":{},"status":"discard","description":"Mirror sample ticked slightly faster (~103.72 tok/s, eval_s ~9.13) but remained in shared soft band.","timestamp":1776370691678,"segment":24,"confidence":null,"iterationTokens":1076,"asi":{"hypothesis":"Soft-band fluctuation remains small and acceptance-invariant.","rollback_reason":"Primary metric above baseline best.","next_action_hint":"Continue loop and defer parity until collapse transition.","diagnostic_findings":{"completion_tok_s":103.7230037670059,"dflash_eval_s":9.134209045325406,"dflash_total_s":9.66251187492162,"dflash_acceptance_rate":0.6972201352366642}}}
{"run":1732,"commit":"cb4dd2f","metric":17.100525083602406,"metrics":{},"status":"discard","description":"Mirror hard-collapse reappeared: throughput dropped to ~57.10 tok/s and eval_s jumped to ~17.10 while acceptance counters stayed fixed.","timestamp":1776370734016,"segment":24,"confidence":null,"iterationTokens":1083,"asi":{"hypothesis":"Regime transitions into collapse are marked by sharp eval inflation rather than speculative-quality degradation.","rollback_reason":"Primary eval metric massively worse than baseline.","next_action_hint":"Run immediate control parity telemetry in this degraded window to confirm shared collapse attribution.","diagnostic_findings":{"completion_tok_s":57.100709124204585,"dflash_eval_s":17.100525083602406,"dflash_total_s":17.73463341605384,"dflash_draft_s":0.2748905374901369,"dflash_verify_s":0.12638166593387723,"dflash_acceptance_rate":0.6972201352366642,"dflash_full_accept_rate":0.4479166666666667,"dflash_draft_steps":96}}}
{"run":1733,"commit":"cb4dd2f","metric":14.57426699763164,"metrics":{},"status":"discard","description":"Immediate control parity in degraded window also collapsed (eval_s ~14.57, tok/s ~66.65), confirming shared collapse with similar acceptance profile.","timestamp":1776370778900,"segment":24,"confidence":null,"iterationTokens":1328,"asi":{"hypothesis":"Collapse is shared runtime-state behavior; control should show similarly inflated eval_s during mirror collapse windows.","rollback_reason":"Primary metric still far above baseline.","next_action_hint":"Restore mirror lane and continue rebound tracking from collapse with telemetry.","backend":"bstnxbt_mlx","paired_mirror_eval_s":17.100525083602406,"paired_delta_eval_s":-2.5262580859707664,"paired_control_tok_s":66.64639433502326,"paired_mirror_tok_s":57.100709124204585,"dflash_acceptance_rate":0.6972201352366642,"dflash_draft_steps":96,"shared_collapse_confirmed":true}}
{"run":1734,"commit":"cb4dd2f","metric":12.372330875485204,"metrics":{},"status":"discard","description":"Mirror rebound after collapse moved back to ~77.93 tok/s with eval_s ~12.37; acceptance counters stayed fixed.","timestamp":1776370813489,"segment":24,"confidence":null,"iterationTokens":1231,"asi":{"hypothesis":"Post-collapse recovery remains primarily eval_s contraction rather than acceptance changes.","rollback_reason":"Primary metric still above baseline best.","next_action_hint":"Continue rebound tracking until eval_s approaches soft/high bands.","diagnostic_findings":{"completion_tok_s":77.9258492946244,"dflash_eval_s":12.372330875485204,"dflash_total_s":12.931208291091025,"dflash_acceptance_rate":0.6972201352366642}}}
{"run":1735,"commit":"cb4dd2f","metric":11.279433296294883,"metrics":{},"status":"discard","description":"Mirror recovery advanced to ~85.27 tok/s with eval_s ~11.28; speculative acceptance remained unchanged.","timestamp":1776370845293,"segment":24,"confidence":null,"iterationTokens":1091,"asi":{"hypothesis":"Recovery branch continues through eval_s contraction with fixed speculative structure.","rollback_reason":"Primary metric still above baseline.","next_action_hint":"Continue monitoring rebound toward soft-band re-entry.","diagnostic_findings":{"completion_tok_s":85.26934549669068,"dflash_eval_s":11.279433296294883,"dflash_total_s":11.819546250044368,"dflash_acceptance_rate":0.6972201352366642}}}
{"run":1736,"commit":"cb4dd2f","metric":10.42096520634368,"metrics":{},"status":"discard","description":"Mirror rebound continued to ~91.96 tok/s with eval_s ~10.42 and unchanged acceptance profile.","timestamp":1776370879648,"segment":24,"confidence":null,"iterationTokens":1083,"asi":{"hypothesis":"Collapse recovery remains eval-contraction dominant with stable speculative counters.","rollback_reason":"Primary metric still above baseline best.","next_action_hint":"Continue loop toward soft/high re-entry, then reassess parity as needed.","diagnostic_findings":{"completion_tok_s":91.95566073346413,"dflash_eval_s":10.42096520634368,"dflash_total_s":10.942298791953363,"dflash_acceptance_rate":0.6972201352366642}}}
{"run":1737,"commit":"cb4dd2f","metric":10.02694341482129,"metrics":{},"status":"discard","description":"Mirror recovery approached ~95.34 tok/s with eval_s ~10.03, continuing contraction from collapse.","timestamp":1776370910567,"segment":24,"confidence":null,"iterationTokens":1091,"asi":{"hypothesis":"Recovery branch should continue toward soft-band re-entry via monotonic eval contraction.","rollback_reason":"Primary metric still above baseline.","next_action_hint":"Continue loop to observe transition back into ~9.x soft band.","diagnostic_findings":{"completion_tok_s":95.34023071201611,"dflash_eval_s":10.02694341482129,"dflash_total_s":10.549445000011474,"dflash_acceptance_rate":0.6972201352366642}}}
{"run":1738,"commit":"cb4dd2f","metric":9.695140294148587,"metrics":{},"status":"discard","description":"Mirror remained in post-collapse recovery/soft band (~98.34 tok/s, eval_s ~9.70) with constant acceptance profile.","timestamp":1776370946613,"segment":24,"confidence":null,"iterationTokens":1130,"asi":{"hypothesis":"After collapse recovery, eval_s may stabilize in upper-9/low-10 before returning to high-window lows.","rollback_reason":"Primary metric above baseline best.","next_action_hint":"Continue loop for either re-entry into sub-9 eval band or next collapse transition.","diagnostic_findings":{"completion_tok_s":98.34448016167192,"dflash_eval_s":9.695140294148587,"dflash_total_s":10.210580207989551,"dflash_acceptance_rate":0.6972201352366642}}}
{"run":1739,"commit":"9a55d76","metric":8.756755876354873,"metrics":{},"status":"keep","description":"Unchanged mirror telemetry run achieved new best eval-phase time (~8.757s) alongside high throughput (~108.27 tok/s), indicating temporary high-window re-entry with lower eval latency.","timestamp":1776371014310,"segment":24,"confidence":0.07698341716769971,"iterationTokens":8903,"asi":{"hypothesis":"In the same keep-shape config, regime reopenings can produce real eval_s improvements without structural code changes.","diagnostic_findings":{"completion_tok_s":108.2686560318083,"dflash_eval_s":8.756755876354873,"dflash_total_s":9.265700333053246,"dflash_draft_s":0.17439987533725798,"dflash_verify_s":0.11382508359383792,"dflash_acceptance_rate":0.6972201352366642,"dflash_draft_steps":96},"next_action_hint":"Immediately rerun unchanged mirror to test whether the lower eval_s persists or snaps back into soft-band drift."}}
