{"run":895,"commit":"8b55918","metric":103.62006932579453,"metrics":{},"status":"discard","description":"Mirror anchor after draft-window=4096 probe (restored keep shape).","timestamp":1776296164692,"segment":23,"confidence":4.163080025672603,"iterationTokens":848,"asi":{"hypothesis":"Restored window=1024 should return to current ~105 band.","rollback_reason":"Anchor dipped to ~103.62, indicating ongoing local jitter.","next_action_hint":"Use paired control sample to classify whether this dip is shared.","backend":"mirror_sd_mlx","context_only_draft_cache":1,"draft_sink":48,"stability_probe":true,"delta_vs_keep":-3.239930674205473}}
{"run":896,"commit":"8b55918","metric":105.97164355097078,"metrics":{},"status":"discard","description":"Control symmetry check after mirror 103.62 anchor dip (mirror disabled).","timestamp":1776296206733,"segment":23,"confidence":4.194231833745355,"iterationTokens":705,"asi":{"hypothesis":"If dip is shared, control should also land low; otherwise mirror-local jitter likely.","rollback_reason":"Control rebounded to ~105.97 (still below keep), indicating mirror-local dip on prior sample.","next_action_hint":"Return to mirror immediately to check whether it rejoins high-105 band.","backend":"bstnxbt_mlx","mirror_runtime_enabled":0,"context_only_draft_cache":1,"draft_sink":48,"paired_mirror_tok_s":103.62006932579453,"paired_delta_tok_s":-2.351574225176252}}
{"run":897,"commit":"8b55918","metric":105.49252570180523,"metrics":{},"status":"discard","description":"Mirror follow-up after control 105.97 symmetry check.","timestamp":1776296239407,"segment":23,"confidence":4.237902351041721,"iterationTokens":667,"asi":{"hypothesis":"Mirror should rejoin high-105 band if prior 103.62 was local jitter.","rollback_reason":"Recovered to ~105.49 but still below keep.","next_action_hint":"Continue structural exploration with immediate paired confirms for any near-keep spikes.","backend":"mirror_sd_mlx","context_only_draft_cache":1,"draft_sink":48,"paired_control_tok_s":105.97164355097078,"paired_delta_tok_s":-0.4791178491655427,"delta_vs_keep":-1.3674742981947736}}
{"run":898,"commit":"8b55918","metric":105.37457994435721,"metrics":{},"status":"discard","description":"Draft-window extension probe: DFLASH_DRAFT_WINDOW=3072.","timestamp":1776296273243,"segment":23,"confidence":4.287349887477008,"iterationTokens":706,"asi":{"hypothesis":"A larger-than-2048 draft window might improve context-only draft-cache behavior without the 4096 penalty.","rollback_reason":"No improvement; ~105.37 still below keep.","next_action_hint":"Add draft_window=3072 to do-not-retry set; large-window extension remains non-winning.","backend":"mirror_sd_mlx","context_only_draft_cache":1,"draft_sink":48,"draft_window":3072,"delta_vs_keep":-1.4854200556427857}}
{"run":899,"commit":"8b55918","metric":105.53427791707364,"metrics":{},"status":"discard","description":"Mirror anchor after draft-window=3072 probe (restored keep shape).","timestamp":1776296310385,"segment":23,"confidence":4.3287084727404,"iterationTokens":857,"asi":{"hypothesis":"Restored window=1024 should remain around high-105 after large-window probes.","rollback_reason":"Anchor stable near ~105.53 but still below keep.","next_action_hint":"Window/sink large-range extensions now heavily exhausted; prioritize structural/algorithmic paths.","backend":"mirror_sd_mlx","context_only_draft_cache":1,"draft_sink":48,"stability_probe":true,"delta_vs_keep":-1.3257220829263594}}
{"run":900,"commit":"8b55918","metric":104.20232111936713,"metrics":{},"status":"discard","description":"Mirror baseline continuation sample after user resume request.","timestamp":1776296932596,"segment":23,"confidence":4.375933532804751,"iterationTokens":857,"asi":{"hypothesis":"Keep-shape mirror should hold in restored ~105 regime while searching for structural gains.","rollback_reason":"Sample fell to low-104 and remains below keep.","next_action_hint":"Take paired control sample to distinguish shared dip from mirror-local jitter before next candidate.","backend":"mirror_sd_mlx","context_only_draft_cache":1,"draft_sink":48,"delta_vs_keep":-2.657678880632874}}
{"run":901,"commit":"8b55918","metric":104.8114462900316,"metrics":{},"status":"discard","description":"Control parity sample after mirror low-104 dip (mirror disabled).","timestamp":1776296966067,"segment":23,"confidence":4.381740930965635,"iterationTokens":684,"asi":{"hypothesis":"If dip is shared, control should land in same low/mid-104 band.","rollback_reason":"Control also low (~104.81) and below keep.","next_action_hint":"Return to mirror and continue in-band structural experiments with immediate control confirmation.","backend":"bstnxbt_mlx","mirror_runtime_enabled":0,"context_only_draft_cache":1,"draft_sink":48,"paired_mirror_tok_s":104.20232111936713,"paired_delta_tok_s":-0.6091251706644685}}
{"run":902,"commit":"8b55918","metric":21.810411723472484,"metrics":{},"status":"discard","description":"Mirror block-size extension beyond prior sweep: DFLASH_BLOCK_TOKENS=25.","timestamp":1776297067974,"segment":23,"confidence":4.375933532804751,"iterationTokens":2387,"asi":{"hypothesis":"Larger speculative block above 24 might unlock better amortization if acceptance stays sufficient.","rollback_reason":"Catastrophic collapse to ~21.81 tok/s indicates a hard block-size cliff.","next_action_hint":"Add block_tokens=25 to hard do-not-retry list; avoid further upward block expansion without profiling proof.","backend":"mirror_sd_mlx","context_only_draft_cache":1,"draft_sink":48,"block_tokens":25,"severe_cliff":true,"delta_vs_keep":-85.04958827652753}}
{"run":903,"commit":"8b55918","metric":40.483751775530784,"metrics":{},"status":"discard","description":"Post-revert mirror anchor after block_tokens=25 cliff probe.","timestamp":1776297123390,"segment":23,"confidence":4.3287084727404,"iterationTokens":882,"asi":{"hypothesis":"Restoring keep-shape after block-size cliff should recover to prior high-100 band quickly.","rollback_reason":"Anchor remained deeply collapsed at ~40.48 tok/s.","next_action_hint":"Run immediate control symmetry check to classify shared collapse versus mirror-local degradation.","backend":"mirror_sd_mlx","context_only_draft_cache":1,"draft_sink":48,"post_probe_collapse":true,"delta_vs_keep":-66.37624822446922}}
{"run":904,"commit":"8b55918","metric":49.5077520123309,"metrics":{},"status":"discard","description":"Control symmetry check after mirror post-cliff collapse (mirror disabled).","timestamp":1776297176810,"segment":23,"confidence":4.287349887477008,"iterationTokens":713,"asi":{"hypothesis":"If collapse is shared regime instability, control should also be severely degraded.","rollback_reason":"Control also collapsed to ~49.51, confirming shared slowdown.","next_action_hint":"Return to mirror and run short recovery bundle before any further candidate probes.","backend":"bstnxbt_mlx","mirror_runtime_enabled":0,"context_only_draft_cache":1,"draft_sink":48,"paired_mirror_tok_s":40.483751775530784,"paired_delta_tok_s":-9.024000236800118,"shared_collapse_confirmed":true}}
{"run":905,"commit":"8b55918","metric":92.15952503328134,"metrics":{},"status":"discard","description":"Mirror recovery sample after shared collapse from block_tokens=25 probe.","timestamp":1776297207397,"segment":23,"confidence":4.237902351041721,"iterationTokens":648,"asi":{"hypothesis":"Shared post-probe collapse should rebound quickly toward prior bands once keep-shape restored.","rollback_reason":"Recovered sharply to ~92.16 but still below keep.","next_action_hint":"Continue recovery bundle; once >100 returns, resume structural experiments.","backend":"mirror_sd_mlx","context_only_draft_cache":1,"draft_sink":48,"delta_vs_keep":-14.70047496671867}}
{"run":906,"commit":"8b55918","metric":85.48803432541074,"metrics":{},"status":"discard","description":"Mirror recovery follow-up after rebound to 92.16.","timestamp":1776297239129,"segment":23,"confidence":4.194231833745355,"iterationTokens":582,"asi":{"hypothesis":"Recovery might oscillate before stabilizing back into high-90/100 bands.","rollback_reason":"Dropped to mid-80s; rebound not yet stable.","next_action_hint":"Keep short recovery bundle and interleave control check if oscillation persists.","backend":"mirror_sd_mlx","context_only_draft_cache":1,"draft_sink":48,"stability_probe":true,"delta_vs_keep":-21.371965674589262}}
{"run":907,"commit":"8b55918","metric":46.49483373483995,"metrics":{},"status":"discard","description":"Control parity check during unstable recovery phase (mirror disabled).","timestamp":1776297286642,"segment":23,"confidence":4.163080025672603,"iterationTokens":689,"asi":{"hypothesis":"Control should indicate whether mid-80 mirror run is part of shared instability wave.","rollback_reason":"Control collapsed to ~46.49, confirming severe shared instability.","next_action_hint":"Return to mirror and continue recovery sampling; avoid candidate probes during collapse trough.","backend":"bstnxbt_mlx","mirror_runtime_enabled":0,"context_only_draft_cache":1,"draft_sink":48,"paired_mirror_tok_s":85.48803432541074,"paired_delta_tok_s":38.99320059057079,"shared_collapse_confirmed":true}}
{"run":908,"commit":"8b55918","metric":83.12235151505276,"metrics":{},"status":"discard","description":"Mirror recovery sample after control deep-collapse check.","timestamp":1776297318637,"segment":23,"confidence":4.13238755347489,"iterationTokens":674,"asi":{"hypothesis":"Mirror should rebound from collapse trough if slowdown is shared transient instability.","rollback_reason":"Recovered to low-80s but far below keep.","next_action_hint":"Continue recovery bundle; wait for stable >95 before new candidate testing.","backend":"mirror_sd_mlx","context_only_draft_cache":1,"draft_sink":48,"delta_vs_keep":-23.737648484947236}}
{"run":909,"commit":"8b55918","metric":70.54364444083774,"metrics":{},"status":"discard","description":"Mirror recovery follow-up showing continued oscillation.","timestamp":1776297350848,"segment":23,"confidence":4.1092062481480225,"iterationTokens":575,"asi":{"hypothesis":"Recovery may remain non-monotonic with repeated dips before full rebound.","rollback_reason":"Dropped back to ~70.54 and remains far below keep.","next_action_hint":"Interleave control check to confirm shared low-band oscillation.","backend":"mirror_sd_mlx","context_only_draft_cache":1,"draft_sink":48,"stability_probe":true,"delta_vs_keep":-36.31635555916226}}
{"run":910,"commit":"8b55918","metric":54.03022616526887,"metrics":{},"status":"discard","description":"Control parity check during mirror low-70 oscillation (mirror disabled).","timestamp":1776297397830,"segment":23,"confidence":4.081870260871337,"iterationTokens":675,"asi":{"hypothesis":"Control should show similar degradation if oscillation is shared.","rollback_reason":"Control also collapsed to ~54.03, confirming shared trough.","next_action_hint":"Return to mirror and continue recovery-only sampling until >95 resumes.","backend":"bstnxbt_mlx","mirror_runtime_enabled":0,"context_only_draft_cache":1,"draft_sink":48,"paired_mirror_tok_s":70.54364444083774,"paired_delta_tok_s":16.513418275568867,"shared_collapse_confirmed":true}}
{"run":911,"commit":"8b55918","metric":61.537740086159594,"metrics":{},"status":"discard","description":"Mirror recovery sample after control ~54 collapse confirmation.","timestamp":1776297453469,"segment":23,"confidence":4.00463467847868,"iterationTokens":1453,"asi":{"hypothesis":"Mirror should rebound from trough once shared instability wave starts to lift.","rollback_reason":"Recovered only to ~61.54 and remains deeply below keep.","next_action_hint":"Continue recovery bundle and defer candidate tests while in sub-80 regime.","backend":"mirror_sd_mlx","context_only_draft_cache":1,"draft_sink":48,"delta_vs_keep":-45.322259913840405}}
{"run":912,"commit":"8b55918","metric":66.44310932590767,"metrics":{},"status":"discard","description":"Mirror recovery follow-up (continued climb within degraded band).","timestamp":1776297489008,"segment":23,"confidence":3.932470853271118,"iterationTokens":620,"asi":{"hypothesis":"Shared recovery should move mirror upward from low-60 toward higher bands.","rollback_reason":"Improved to ~66.44 but still far below keep.","next_action_hint":"Keep recovery monitoring; interleave control check once mirror reaches/approaches 70+ consistently.","backend":"mirror_sd_mlx","context_only_draft_cache":1,"draft_sink":48,"stability_probe":true,"delta_vs_keep":-40.41689067409233}}
{"run":913,"commit":"8b55918","metric":71.17508610580167,"metrics":{},"status":"discard","description":"Mirror recovery monitoring sample crossing back into low-70s.","timestamp":1776297524996,"segment":23,"confidence":3.909258992924917,"iterationTokens":593,"asi":{"hypothesis":"Recovery wave should continue gradually upward from high-60 into 70+ band.","rollback_reason":"Still deeply below keep despite rebound to ~71.18.","next_action_hint":"Run paired control check to verify shared recovery pace.","backend":"mirror_sd_mlx","context_only_draft_cache":1,"draft_sink":48,"delta_vs_keep":-35.68491389419833}}
{"run":914,"commit":"8b55918","metric":79.04777307938383,"metrics":{},"status":"discard","description":"Control parity check during mirror low-70 recovery (mirror disabled).","timestamp":1776297564936,"segment":23,"confidence":3.890319919446734,"iterationTokens":665,"asi":{"hypothesis":"Control should show a similar rebound trend if slowdown remains shared.","rollback_reason":"Control higher at ~79.05 but still far below keep.","next_action_hint":"Return to mirror and continue recovery tracking toward 80+ and 90+ bands.","backend":"bstnxbt_mlx","mirror_runtime_enabled":0,"context_only_draft_cache":1,"draft_sink":48,"paired_mirror_tok_s":71.17508610580167,"paired_delta_tok_s":-7.872686973582168}}
{"run":915,"commit":"8b55918","metric":82.95032683930387,"metrics":{},"status":"discard","description":"Mirror recovery sample after control rebound to ~79.","timestamp":1776297601822,"segment":23,"confidence":3.8864521934321403,"iterationTokens":627,"asi":{"hypothesis":"Mirror should continue climbing toward control as shared recovery progresses.","rollback_reason":"Improved to ~82.95 but still below keep.","next_action_hint":"Continue monitoring; once stable above 90, resume structural candidates.","backend":"mirror_sd_mlx","context_only_draft_cache":1,"draft_sink":48,"paired_control_tok_s":79.04777307938383,"paired_delta_tok_s":3.9025537599200426,"delta_vs_keep":-23.909673160696126}}
{"run":916,"commit":"8b55918","metric":83.02864496324482,"metrics":{},"status":"discard","description":"Mirror recovery monitoring sample holding low-80 band.","timestamp":1776297643130,"segment":23,"confidence":3.8825921503059555,"iterationTokens":791,"asi":{"hypothesis":"Recovery may plateau temporarily in low-80s before next climb.","rollback_reason":"Still well below keep.","next_action_hint":"Keep recovery bundle and avoid candidate probes until >90 resumes.","backend":"mirror_sd_mlx","context_only_draft_cache":1,"draft_sink":48,"stability_probe":true,"delta_vs_keep":-23.831355036755177}}
{"run":917,"commit":"8b55918","metric":104.07185538032088,"metrics":{},"status":"discard","description":"Mirror recovery continuation after low-80 plateau; first re-entry sample back in low-104 band.","timestamp":1776300897380,"segment":23,"confidence":3.8864521934321403,"iterationTokens":791,"asi":{"hypothesis":"Recovered regime should continue climbing from low-80s back into prior low/mid-104 zone.","rollback_reason":"Still below keep despite rebound to ~104.07.","next_action_hint":"Take paired control sample to confirm shared re-entry into low-104 band.","backend":"mirror_sd_mlx","context_only_draft_cache":1,"draft_sink":48,"warmup_s_spike":2.9394378339638934,"delta_vs_keep":-2.788144619679121}}
{"run":918,"commit":"8b55918","metric":106.11709572378098,"metrics":{},"status":"discard","description":"Control parity check after mirror re-entry to low-104 (mirror disabled).","timestamp":1776300933001,"segment":23,"confidence":3.890319919446734,"iterationTokens":785,"asi":{"hypothesis":"Control should track mirror recovery and clarify whether low-104 sample was mirror-local jitter.","rollback_reason":"Control rebounded to high-106 but still below keep.","next_action_hint":"Run immediate mirror follow-up to see if mirror rejoins high-105/106 band or remains lagging.","backend":"bstnxbt_mlx","mirror_runtime_enabled":0,"context_only_draft_cache":1,"draft_sink":48,"paired_mirror_tok_s":104.07185538032088,"paired_delta_tok_s":-2.045240343460097}}
{"run":919,"commit":"8b55918","metric":105.37629008787722,"metrics":{},"status":"discard","description":"Mirror follow-up after control high-106 parity sample.","timestamp":1776300968680,"segment":23,"confidence":3.909258992924917,"iterationTokens":694,"asi":{"hypothesis":"Mirror should partially rejoin control if low-104 dip was local jitter.","rollback_reason":"Mirror recovered to ~105.38 but stayed below control and below keep.","next_action_hint":"Continue paired monitoring; candidate testing should require mirror/control both in stable high-105+ band.","backend":"mirror_sd_mlx","context_only_draft_cache":1,"draft_sink":48,"paired_control_tok_s":106.11709572378098,"paired_delta_tok_s":-0.7408056359037611,"delta_vs_keep":-1.483709912122783}}
{"run":920,"commit":"8b55918","metric":105.0842991673585,"metrics":{},"status":"discard","description":"Mirror stability sample in restored high-104/105 band.","timestamp":1776301005009,"segment":23,"confidence":3.932470853271118,"iterationTokens":928,"asi":{"hypothesis":"Unchanged mirror config should remain near low/mid-105 as regime stabilizes post-collapse.","rollback_reason":"Still below keep at ~105.08.","next_action_hint":"Take control pair sample to maintain parity estimate in this band.","backend":"mirror_sd_mlx","context_only_draft_cache":1,"draft_sink":48,"stability_probe":true,"delta_vs_keep":-1.775700832641502}}
{"run":921,"commit":"8b55918","metric":28.897907397123173,"metrics":{},"status":"discard","description":"Control parity sample during restored 105 band suddenly collapsed (mirror disabled).","timestamp":1776301068003,"segment":23,"confidence":3.909258992924917,"iterationTokens":682,"asi":{"hypothesis":"Control should stay near mirror around ~105 if regime remains stable.","rollback_reason":"Catastrophic control collapse to ~28.90 indicates a fresh shared instability wave.","next_action_hint":"Run mirror follow-up immediately to characterize collapse symmetry and recovery onset.","backend":"bstnxbt_mlx","mirror_runtime_enabled":0,"context_only_draft_cache":1,"draft_sink":48,"paired_mirror_tok_s":105.0842991673585,"paired_delta_tok_s":76.18639177023533,"severe_collapse":true}}
{"run":922,"commit":"8b55918","metric":35.38786097190291,"metrics":{},"status":"discard","description":"Mirror follow-up after catastrophic control collapse sample.","timestamp":1776301117998,"segment":23,"confidence":3.890319919446734,"iterationTokens":665,"asi":{"hypothesis":"If collapse is shared, mirror should also drop sharply on immediate follow-up.","rollback_reason":"Mirror also collapsed to ~35.39, confirming shared fresh trough.","next_action_hint":"Enter recovery-only bundle (mirror/control pairs) until >=90 returns before any candidate probing.","backend":"mirror_sd_mlx","context_only_draft_cache":1,"draft_sink":48,"paired_control_tok_s":28.897907397123173,"paired_delta_tok_s":6.489953574779738,"shared_collapse_confirmed":true,"delta_vs_keep":-71.4721390280971}}
{"run":923,"commit":"8b55918","metric":69.08241853989816,"metrics":{},"status":"discard","description":"Mirror recovery sample after fresh shared trough (~35 tok/s).","timestamp":1776301155125,"segment":23,"confidence":3.8864521934321403,"iterationTokens":683,"asi":{"hypothesis":"Recovery should rebound quickly from collapse trough toward at least high-60/70 band.","rollback_reason":"Recovered to ~69.08 but remains far below keep.","next_action_hint":"Take paired control recovery sample to confirm shared rebound pace.","backend":"mirror_sd_mlx","context_only_draft_cache":1,"draft_sink":48,"delta_vs_keep":-37.77758146010184}}
{"run":924,"commit":"8b55918","metric":58.63553478623812,"metrics":{},"status":"discard","description":"Control recovery parity sample after mirror rebound to ~69 (mirror disabled).","timestamp":1776301205292,"segment":23,"confidence":3.8825921503059555,"iterationTokens":683,"asi":{"hypothesis":"Control should show comparable recovery trajectory if slowdown remains shared.","rollback_reason":"Control stayed degraded at ~58.64, confirming continued shared trough behavior.","next_action_hint":"Return to mirror and continue recovery monitoring until 90+ returns.","backend":"bstnxbt_mlx","mirror_runtime_enabled":0,"context_only_draft_cache":1,"draft_sink":48,"paired_mirror_tok_s":69.08241853989816,"paired_delta_tok_s":10.446883753660043,"shared_recovery":true}}
{"run":925,"commit":"8b55918","metric":67.58026294656504,"metrics":{},"status":"discard","description":"Mirror recovery continuation in post-collapse degraded band.","timestamp":1776301242882,"segment":23,"confidence":3.8776494095667675,"iterationTokens":640,"asi":{"hypothesis":"Recovery should fluctuate but trend upward from 60s band.","rollback_reason":"Still around high-60 and far below keep.","next_action_hint":"Continue recovery bundle; avoid any tuning probes until stable >90.","backend":"mirror_sd_mlx","context_only_draft_cache":1,"draft_sink":48,"delta_vs_keep":-39.27973705343495}}
