{"run":958,"commit":"8b55918","metric":104.54984851923078,"metrics":{},"status":"discard","description":"Mirror baseline continuation after user confirmation.","timestamp":1776302578815,"segment":23,"confidence":3.263149545130338,"iterationTokens":662,"asi":{"hypothesis":"Mirror should remain in current low/mid-104 recovery plateau unless another instability wave hits.","rollback_reason":"Still below keep at ~104.55.","next_action_hint":"Run paired control sample to keep parity mapping current in this plateau band.","backend":"mirror_sd_mlx","context_only_draft_cache":1,"draft_sink":48,"delta_vs_keep":-2.3101514807692243}}
{"run":959,"commit":"8b55918","metric":104.39587691330078,"metrics":{},"status":"discard","description":"Control parity sample after mirror 104.55 plateau run (mirror disabled).","timestamp":1776302619086,"segment":23,"confidence":3.3500547528551414,"iterationTokens":665,"asi":{"hypothesis":"Control should remain near mirror in low/mid-104 band if recovery plateau is shared.","rollback_reason":"Control near mirror and still below keep.","next_action_hint":"Return to mirror and continue monitoring; only attempt new candidates once sustained high-105+ appears.","backend":"bstnxbt_mlx","mirror_runtime_enabled":0,"context_only_draft_cache":1,"draft_sink":48,"paired_mirror_tok_s":104.54984851923078,"paired_delta_tok_s":0.15397160592999706}}
{"run":960,"commit":"8b55918","metric":103.86053136865151,"metrics":{},"status":"discard","description":"Mirror follow-up completing current low-104 parity bundle.","timestamp":1776302653437,"segment":23,"confidence":3.44197397808287,"iterationTokens":636,"asi":{"hypothesis":"Mirror should stay near control in low/mid-104 shared plateau.","rollback_reason":"Mirror dipped to ~103.86, still below keep.","next_action_hint":"Continue paired monitoring; avoid reading sub-1 tok/s ordering flips as real backend advantage.","backend":"mirror_sd_mlx","context_only_draft_cache":1,"draft_sink":48,"paired_control_tok_s":104.39587691330078,"paired_delta_tok_s":-0.5353455446492725,"delta_vs_keep":-2.9994686313484893}}
{"run":961,"commit":"8b55918","metric":104.27137929842893,"metrics":{},"status":"discard","description":"Mirror stability continuation in low-104 plateau.","timestamp":1776302694127,"segment":23,"confidence":3.526831348805472,"iterationTokens":834,"asi":{"hypothesis":"Repeated unchanged runs should maintain low-104 regime map for parity tracking.","rollback_reason":"Still below keep.","next_action_hint":"Take paired control sample to confirm shared low-104 clustering.","backend":"mirror_sd_mlx","context_only_draft_cache":1,"draft_sink":48,"stability_probe":true,"delta_vs_keep":-2.5886207015710716}}
{"run":962,"commit":"8b55918","metric":104.54172141832017,"metrics":{},"status":"discard","description":"Control parity sample for mirror low-104 plateau run (mirror disabled).","timestamp":1776302739697,"segment":23,"confidence":3.57776203552662,"iterationTokens":643,"asi":{"hypothesis":"Control should remain near mirror if plateau is shared and backend-neutral.","rollback_reason":"Control near mirror and below keep.","next_action_hint":"Run mirror follow-up to complete bundle and watch for any upward drift.","backend":"bstnxbt_mlx","mirror_runtime_enabled":0,"context_only_draft_cache":1,"draft_sink":48,"paired_mirror_tok_s":104.27137929842893,"paired_delta_tok_s":-0.2703421198912382}}
{"run":963,"commit":"8b55918","metric":103.99774421772464,"metrics":{},"status":"discard","description":"Mirror follow-up completing low-104 parity bundle.","timestamp":1776302776391,"segment":23,"confidence":3.606470217310721,"iterationTokens":606,"asi":{"hypothesis":"Mirror should stay close to control in low-104 shared plateau.","rollback_reason":"Mirror dipped to ~104.00 and remains below keep.","next_action_hint":"Continue paired monitoring; postpone candidate changes until sustained high-105 reappears.","backend":"mirror_sd_mlx","context_only_draft_cache":1,"draft_sink":48,"paired_control_tok_s":104.54172141832017,"paired_delta_tok_s":-0.5439772005955319,"delta_vs_keep":-2.862255782275361}}
{"run":964,"commit":"8b55918","metric":104.3988947563374,"metrics":{},"status":"discard","description":"Split-chunk high extension probe: DFLASH_BSTNXBT_SPLIT_CHUNK_SIZE=31.","timestamp":1776302809863,"segment":23,"confidence":3.6356428382018873,"iterationTokens":738,"asi":{"hypothesis":"Chunk size 31 might land between known non-winners 30 and 32 and recover throughput.","rollback_reason":"No gain; ~104.40 below keep.","next_action_hint":"Add split_chunk_size=31 to do-not-retry set; high chunk region remains exhausted.","backend":"mirror_sd_mlx","context_only_draft_cache":1,"draft_sink":48,"split_chunk_size":31,"delta_vs_keep":-2.4611052436625895}}
{"run":965,"commit":"8b55918","metric":103.57252382739412,"metrics":{},"status":"discard","description":"Mirror anchor after split_chunk_size=31 probe (restored keep shape).","timestamp":1776302856261,"segment":23,"confidence":3.6503412496837155,"iterationTokens":864,"asi":{"hypothesis":"Restored default chunk should return near current low-104 plateau after high-chunk probe.","rollback_reason":"Anchor ~103.57 remains below keep.","next_action_hint":"Take control parity sample to check whether this dip is shared.","backend":"mirror_sd_mlx","context_only_draft_cache":1,"draft_sink":48,"stability_probe":true,"delta_vs_keep":-3.2874761726058774}}
{"run":966,"commit":"8b55918","metric":104.07384876648942,"metrics":{},"status":"discard","description":"Control parity sample after mirror 103.57 anchor (mirror disabled).","timestamp":1776302902352,"segment":23,"confidence":3.696374987227978,"iterationTokens":679,"asi":{"hypothesis":"Control should land near mirror if low-103/104 dip is shared jitter.","rollback_reason":"Control near mirror and still below keep.","next_action_hint":"Return to mirror and continue parity monitoring; no evidence of robust backend edge.","backend":"bstnxbt_mlx","mirror_runtime_enabled":0,"context_only_draft_cache":1,"draft_sink":48,"paired_mirror_tok_s":103.57252382739412,"paired_delta_tok_s":-0.5013249390953034}}
{"run":967,"commit":"8b55918","metric":105.02168386147324,"metrics":{},"status":"discard","description":"Mirror follow-up after control 104.07 parity sample.","timestamp":1776302935828,"segment":23,"confidence":3.695007333158515,"iterationTokens":630,"asi":{"hypothesis":"Mirror should rebound toward low-105 after low-103/104 dip.","rollback_reason":"Low-105 still below keep.","next_action_hint":"Continue paired monitoring and hold structural probes for sustained high-105/106 windows.","backend":"mirror_sd_mlx","context_only_draft_cache":1,"draft_sink":48,"paired_control_tok_s":104.07384876648942,"paired_delta_tok_s":0.947835094983822,"delta_vs_keep":-1.838316138526761}}
{"run":968,"commit":"8b55918","metric":104.0420140381663,"metrics":{},"status":"discard","description":"Split-chunk high extension probe: DFLASH_BSTNXBT_SPLIT_CHUNK_SIZE=29.","timestamp":1776302967898,"segment":23,"confidence":3.7282852666592508,"iterationTokens":650,"asi":{"hypothesis":"Chunk size 29 might outperform nearby high values in current low-105 regime.","rollback_reason":"No gain; ~104.04 below keep.","next_action_hint":"Add split_chunk_size=29 to do-not-retry set; high chunk corridor is fully exhausted.","backend":"mirror_sd_mlx","context_only_draft_cache":1,"draft_sink":48,"split_chunk_size":29,"delta_vs_keep":-2.8179859618336995}}
{"run":969,"commit":"8b55918","metric":104.14922132277447,"metrics":{},"status":"discard","description":"Mirror anchor after split_chunk_size=29 probe (restored keep shape).","timestamp":1776303011071,"segment":23,"confidence":3.734648961705352,"iterationTokens":847,"asi":{"hypothesis":"Restored default chunk should hold around low-104/105 after high-chunk probe.","rollback_reason":"Anchor still below keep at ~104.15.","next_action_hint":"Continue parity tracking; split-chunk family now exhausted through 32 except keep=8.","backend":"mirror_sd_mlx","context_only_draft_cache":1,"draft_sink":48,"stability_probe":true,"delta_vs_keep":-2.710778677225522}}
{"run":970,"commit":"8b55918","metric":104.27333962778042,"metrics":{},"status":"discard","description":"Control parity sample after mirror 104.15 anchor (mirror disabled).","timestamp":1776303054732,"segment":23,"confidence":3.753423999804446,"iterationTokens":692,"asi":{"hypothesis":"Control should remain within same low-104 plateau if regime remains shared.","rollback_reason":"Control near mirror and below keep.","next_action_hint":"Return to mirror; continue low-104 monitoring until high-105 reappears.","backend":"bstnxbt_mlx","mirror_runtime_enabled":0,"context_only_draft_cache":1,"draft_sink":48,"paired_mirror_tok_s":104.14922132277447,"paired_delta_tok_s":-0.12411830500595472}}
{"run":971,"commit":"8b55918","metric":104.83170192547172,"metrics":{},"status":"discard","description":"Mirror follow-up after control 104.27 parity sample.","timestamp":1776303094353,"segment":23,"confidence":3.7742622934668355,"iterationTokens":623,"asi":{"hypothesis":"Mirror should drift toward upper-104 as shared plateau remains stable.","rollback_reason":"Still below keep at ~104.83.","next_action_hint":"Continue monitoring and require sustained >105.5 before structural retests.","backend":"mirror_sd_mlx","context_only_draft_cache":1,"draft_sink":48,"paired_control_tok_s":104.27333962778042,"paired_delta_tok_s":0.5583622976913026,"delta_vs_keep":-2.0282980745282795}}
{"run":972,"commit":"8b55918","metric":103.75494227576846,"metrics":{},"status":"discard","description":"Mirror stability sample showing renewed dip from upper-104.","timestamp":1776303132031,"segment":23,"confidence":3.807419701280683,"iterationTokens":845,"asi":{"hypothesis":"Current plateau may still oscillate between low-103 and upper-104.","rollback_reason":"Sample dropped to ~103.75 and remains below keep.","next_action_hint":"Take paired control sample to confirm shared dip.","backend":"mirror_sd_mlx","context_only_draft_cache":1,"draft_sink":48,"delta_vs_keep":-3.1050577242315396}}
{"run":973,"commit":"8b55918","metric":103.7858744105929,"metrics":{},"status":"discard","description":"Control parity sample after mirror low-103 dip (mirror disabled).","timestamp":1776303177113,"segment":23,"confidence":3.8147457537802376,"iterationTokens":647,"asi":{"hypothesis":"Control should show similar low-103 if dip is shared instability.","rollback_reason":"Control matched mirror (~103.79), confirming shared low-103 patch.","next_action_hint":"Return to mirror and continue parity tracking; no signal for backend-specific regression.","backend":"bstnxbt_mlx","mirror_runtime_enabled":0,"context_only_draft_cache":1,"draft_sink":48,"paired_mirror_tok_s":103.75494227576846,"paired_delta_tok_s":-0.030932134824434607}}
{"run":974,"commit":"8b55918","metric":104.9450481584254,"metrics":{},"status":"discard","description":"Mirror follow-up after shared low-103 parity sample.","timestamp":1776303210998,"segment":23,"confidence":3.8221000535021763,"iterationTokens":629,"asi":{"hypothesis":"Mirror should rebound back toward upper-104 after shared dip.","rollback_reason":"Recovered to ~104.95 but still below keep.","next_action_hint":"Continue monitoring; require sustained >105.5 and confirmation before any keep consideration.","backend":"mirror_sd_mlx","context_only_draft_cache":1,"draft_sink":48,"paired_control_tok_s":103.7858744105929,"paired_delta_tok_s":1.1591737478325002,"delta_vs_keep":-1.9149518415745983}}
{"run":975,"commit":"8b55918","metric":102.83928701256454,"metrics":{},"status":"discard","description":"Mirror stability sample showing another local dip to low-103.","timestamp":1776303248256,"segment":23,"confidence":3.822316170689777,"iterationTokens":690,"asi":{"hypothesis":"Regime remains jittery with recurrent dips from upper-104 back to low-103.","rollback_reason":"Low-103 sample below keep.","next_action_hint":"Take paired control sample to confirm whether this dip is shared.","backend":"mirror_sd_mlx","context_only_draft_cache":1,"draft_sink":48,"delta_vs_keep":-4.360712987435455}}
{"run":976,"commit":"8b55918","metric":105.1711975091861,"metrics":{},"status":"discard","description":"Control parity sample after mirror low-103 dip (mirror disabled).","timestamp":1776303301663,"segment":23,"confidence":3.8350359178841456,"iterationTokens":645,"asi":{"hypothesis":"Control should reveal whether mirror low-103 run was shared or mirror-local jitter.","rollback_reason":"Control rebounded to ~105.17 but still below keep.","next_action_hint":"Run immediate mirror follow-up to test if mirror rejoins high-105 neighborhood.","backend":"bstnxbt_mlx","mirror_runtime_enabled":0,"context_only_draft_cache":1,"draft_sink":48,"paired_mirror_tok_s":102.83928701256454,"paired_delta_tok_s":-2.3319104966215525}}
{"run":977,"commit":"8b55918","metric":104.1841929350784,"metrics":{},"status":"discard","description":"Mirror follow-up after control rebound to ~105.17.","timestamp":1776303338655,"segment":23,"confidence":3.872126010189082,"iterationTokens":646,"asi":{"hypothesis":"Mirror should rebound toward control if prior low-103 run was transient.","rollback_reason":"Mirror stayed lower at ~104.18 and below keep.","next_action_hint":"Continue paired monitoring; backend ordering keeps flipping within jitter band.","backend":"mirror_sd_mlx","context_only_draft_cache":1,"draft_sink":48,"paired_control_tok_s":105.1711975091861,"paired_delta_tok_s":-0.9870045741076935,"delta_vs_keep":-2.8058070649215505}}
{"run":978,"commit":"8b55918","metric":103.82653988214588,"metrics":{},"status":"discard","description":"Mirror stability continuation in low-103/104 oscillation band.","timestamp":1776303374589,"segment":23,"confidence":3.9039801226967046,"iterationTokens":648,"asi":{"hypothesis":"Current regime remains oscillatory around low-104 with frequent backend ordering flips.","rollback_reason":"Sample below keep.","next_action_hint":"Take control pair sample to maintain parity estimate and avoid over-interpreting single-run dips.","backend":"mirror_sd_mlx","context_only_draft_cache":1,"draft_sink":48,"delta_vs_keep":-3.163460117854067}}
{"run":979,"commit":"8b55918","metric":104.48757955586542,"metrics":{},"status":"discard","description":"Control parity sample after mirror 103.83 dip (mirror disabled).","timestamp":1776303418500,"segment":23,"confidence":3.9517848222820087,"iterationTokens":655,"asi":{"hypothesis":"Control should remain close to mirror in shared low-104 oscillation regime.","rollback_reason":"Control slightly above mirror and still below keep.","next_action_hint":"Return to mirror and continue parity monitoring; no candidate signal yet.","backend":"bstnxbt_mlx","mirror_runtime_enabled":0,"context_only_draft_cache":1,"draft_sink":48,"paired_mirror_tok_s":103.82653988214588,"paired_delta_tok_s":-0.6610396737195359}}
{"run":980,"commit":"8b55918","metric":104.83950208165304,"metrics":{},"status":"discard","description":"Mirror follow-up after control 104.49 parity sample.","timestamp":1776303451012,"segment":23,"confidence":3.971945846520717,"iterationTokens":619,"asi":{"hypothesis":"Mirror should remain in upper-104 neighborhood in current oscillatory regime.","rollback_reason":"Upper-104 still below keep.","next_action_hint":"Continue monitoring; require reproducible >106 before any keep challenge.","backend":"mirror_sd_mlx","context_only_draft_cache":1,"draft_sink":48,"paired_control_tok_s":104.48757955586542,"paired_delta_tok_s":0.35192252578762556,"delta_vs_keep":-2.020497918346955}}
{"run":981,"commit":"8b55918","metric":104.21344861823457,"metrics":{},"status":"discard","description":"Mirror stability sample in low-104 band.","timestamp":1776303484354,"segment":23,"confidence":3.9955140046177604,"iterationTokens":624,"asi":{"hypothesis":"Regime remains bounded around low/upper-104 without sustained high-105 break.","rollback_reason":"Low-104 remains below keep.","next_action_hint":"Take control pair sample to confirm continued shared low-104 clustering.","backend":"mirror_sd_mlx","context_only_draft_cache":1,"draft_sink":48,"delta_vs_keep":-2.7765513817654326}}
{"run":982,"commit":"8b55918","metric":104.67195048017727,"metrics":{},"status":"discard","description":"Control parity sample after mirror 104.21 run (mirror disabled).","timestamp":1776303523900,"segment":23,"confidence":4.019363522868224,"iterationTokens":653,"asi":{"hypothesis":"Control should remain close to mirror in low/mid-104 shared regime.","rollback_reason":"Control slightly above mirror and still below keep.","next_action_hint":"Return to mirror and continue parity monitoring while awaiting higher-band recovery.","backend":"bstnxbt_mlx","mirror_runtime_enabled":0,"context_only_draft_cache":1,"draft_sink":48,"paired_mirror_tok_s":104.21344861823457,"paired_delta_tok_s":-0.4585018619426986}}
{"run":983,"commit":"8b55918","metric":103.4167612785024,"metrics":{},"status":"discard","description":"Mirror follow-up after control 104.67 sample (dip to low-103).","timestamp":1776303564900,"segment":23,"confidence":4.019233198836018,"iterationTokens":632,"asi":{"hypothesis":"Mirror may continue oscillating within shared low-103/104 jitter band.","rollback_reason":"Low-103 remains below keep.","next_action_hint":"Continue paired bundles; no near-keep signal yet.","backend":"mirror_sd_mlx","context_only_draft_cache":1,"draft_sink":48,"paired_control_tok_s":104.67195048017727,"paired_delta_tok_s":-1.255189201674876,"delta_vs_keep":-3.443238721497594}}
{"run":984,"commit":"8b55918","metric":103.70000398962566,"metrics":{},"status":"discard","description":"Mirror stability continuation in low-103/104 band.","timestamp":1776303601744,"segment":23,"confidence":4.021641810922658,"iterationTokens":750,"asi":{"hypothesis":"Current regime remains low-103/104 clustered without sustained upward breakout.","rollback_reason":"Still below keep.","next_action_hint":"Take control pair sample to confirm shared clustering persists.","backend":"mirror_sd_mlx","context_only_draft_cache":1,"draft_sink":48,"delta_vs_keep":-3.1599960103743348}}
{"run":985,"commit":"8b55918","metric":104.35179865005148,"metrics":{},"status":"discard","description":"Control parity sample after mirror 103.70 run (mirror disabled).","timestamp":1776303650106,"segment":23,"confidence":4.028691310244139,"iterationTokens":631,"asi":{"hypothesis":"Control should remain near mirror if low-103/104 region is shared jitter.","rollback_reason":"Control near mirror and below keep.","next_action_hint":"Return to mirror and continue parity tracking.","backend":"bstnxbt_mlx","mirror_runtime_enabled":0,"context_only_draft_cache":1,"draft_sink":48,"paired_mirror_tok_s":103.70000398962566,"paired_delta_tok_s":-0.6517946604258189}}
{"run":986,"commit":"8b55918","metric":105.00643651142168,"metrics":{},"status":"discard","description":"Mirror follow-up after control 104.35 parity sample.","timestamp":1776303691186,"segment":23,"confidence":4.035765566969048,"iterationTokens":609,"asi":{"hypothesis":"Mirror may rebound from low-103/104 toward low-105 in shared regime.","rollback_reason":"Low-105 still below keep.","next_action_hint":"Continue paired checks and wait for reproducible >106 before any keep attempt.","backend":"mirror_sd_mlx","context_only_draft_cache":1,"draft_sink":48,"paired_control_tok_s":104.35179865005148,"paired_delta_tok_s":0.6546378613701999,"delta_vs_keep":-1.8535634885783152}}
{"run":987,"commit":"8b55918","metric":104.41323420130466,"metrics":{},"status":"discard","description":"Mirror stability sample after low-105 rebound.","timestamp":1776303725501,"segment":23,"confidence":4.05305524598738,"iterationTokens":637,"asi":{"hypothesis":"Mirror should remain within low/mid-104 to low-105 jitter envelope.","rollback_reason":"Sample below keep.","next_action_hint":"Take control parity sample to maintain envelope estimate and avoid overfitting to single oscillations.","backend":"mirror_sd_mlx","context_only_draft_cache":1,"draft_sink":48,"delta_vs_keep":-2.4467657986953344}}
{"run":988,"commit":"8b55918","metric":104.43132281785721,"metrics":{},"status":"discard","description":"Control parity sample after mirror 104.41 run (mirror disabled).","timestamp":1776303772844,"segment":23,"confidence":4.073624117042183,"iterationTokens":654,"asi":{"hypothesis":"Control should closely match mirror in shared low-104 regime.","rollback_reason":"Control nearly identical to mirror and below keep.","next_action_hint":"Return to mirror and continue parity tracking; no actionable backend divergence.","backend":"bstnxbt_mlx","mirror_runtime_enabled":0,"context_only_draft_cache":1,"draft_sink":48,"paired_mirror_tok_s":104.41323420130466,"paired_delta_tok_s":-0.01808861655254551}}
{"run":989,"commit":"8b55918","metric":101.54892942057825,"metrics":{},"status":"discard","description":"Mirror follow-up after near-identical 104.41 control parity sample.","timestamp":1776303812802,"segment":23,"confidence":4.055944757054534,"iterationTokens":659,"asi":{"hypothesis":"Mirror should stay in low-104 envelope absent instability shift.","rollback_reason":"Dropped to ~101.55, indicating another downward jitter swing.","next_action_hint":"Continue paired monitoring; avoid candidate probes during fresh downward movement.","backend":"mirror_sd_mlx","context_only_draft_cache":1,"draft_sink":48,"paired_control_tok_s":104.43132281785721,"paired_delta_tok_s":-2.8823933972789564,"delta_vs_keep":-5.311070579421749}}
