{"run":355,"commit":"bf01e15","metric":32.1009214018866,"metrics":{},"status":"discard","description":"Test whether long-context DFlash prefers more cache reservation than the 1024-token recovery lane by raising `INITIAL_CACHE_BLOCKS` from 256 to 512 on the explicit-request 4000-token DFlash shape. It did not beat the cache256 point.","timestamp":1776188379745,"segment":20,"confidence":null,"iterationTokens":1071,"asi":{"hypothesis":"At 4000 tokens, the explicit DFlash lane may need more initial cache reservation than the shorter-context recovery optimum at 256 blocks.","context_tokens":4000,"lane":"explicit_dflash_request_driven_thinking_cache512","rollback_reason":"Throughput improved over the original explicit fixed-block baseline (~32.10 vs ~30.41) but remained below the explicit cache256 recovery point (~30.41 fixed / ~32.09 adaptive / ~32.83 broader / ~36.07 stock).","next_action_hint":"Do not assume larger cache reservation keeps helping at 4000; the best explicit fixed point is still around cache256 among tested values.","learning":"At 4000 tokens on the explicit DFlash lane, increasing `INITIAL_CACHE_BLOCKS` from 256 to 512 does not improve over the stronger cache256 configurations."}}
{"run":356,"commit":"bf01e15","metric":32.900174254181856,"metrics":{},"status":"discard","description":"Combine the two best explicit-request long-context DFlash levers at 4000 tokens: larger cache reservation (`INITIAL_CACHE_BLOCKS=512`) plus tail-only adaptive block sizing from 768. The combination improves over each lever alone, but still does not beat stock.","timestamp":1776188537001,"segment":20,"confidence":null,"iterationTokens":1147,"asi":{"hypothesis":"If cache reservation and tail-only adaptive block sizing address different parts of the 4000-token slowdown, combining them on the explicit DFlash lane may finally beat stock.","context_tokens":4000,"lane":"explicit_dflash_request_driven_thinking_cache512_adaptive_from_768","rollback_reason":"Although the combination improved DFlash to ~32.90 tok/s, it still remained below the matched 4000-token stock checkpoint (~36.07 tok/s).","next_action_hint":"The combination is the strongest 4000-token explicit DFlash result so far, but still short of stock. Continue searching for long-context-specific levers rather than sweeping upward yet.","learning":"At 4000 tokens, larger cache reservation and tail-only adaptive block sizing do stack on the explicit DFlash lane (~32.90 tok/s), but the combined result still trails stock."}}
{"run":357,"commit":"bf01e15","metric":33.783202742651554,"metrics":{},"status":"discard","description":"Test the broader normal-request 4000-token DFlash lane with a larger cache reservation (`INITIAL_CACHE_BLOCKS=512`). This beats all prior 4000-token DFlash variants so far, but still does not catch stock.","timestamp":1776188686836,"segment":20,"confidence":null,"iterationTokens":1095,"asi":{"hypothesis":"Since larger initial cache reservation helped both the 1024-token instability and the explicit 4000-token DFlash lane, the broader 4000-token lane may also improve enough with `INITIAL_CACHE_BLOCKS=512` to surpass stock.","context_tokens":4000,"lane":"broader_request_driven_thinking_cache512","rollback_reason":"Throughput improved to ~33.78 tok/s but still remained below the matched 4000-token stock checkpoint (~36.07 tok/s).","next_action_hint":"Use broader 4000-token DFlash + cache512 as the new strongest long-context DFlash baseline if continuing 4000-token tuning before moving upward.","learning":"At 4000 tokens, the strongest DFlash result so far is now the broader normal-request lane with `INITIAL_CACHE_BLOCKS=512` at ~33.78 tok/s, but stock is still faster at ~36.07 tok/s."}}
{"run":358,"commit":"bf01e15","metric":33.191577097629015,"metrics":{},"status":"discard","description":"Continue the long-context cache-reservation bracket on the stronger broader 4000-token DFlash lane by increasing `INITIAL_CACHE_BLOCKS` to 1024. It remained strong but turned over below the 512-block point.","timestamp":1776188837958,"segment":20,"confidence":null,"iterationTokens":986,"asi":{"hypothesis":"If the broader 4000-token DFlash lane is still under-reserved at 512 initial cache blocks, pushing to 1024 may finally catch or exceed stock.","context_tokens":4000,"lane":"broader_request_driven_thinking_cache1024","rollback_reason":"Throughput slipped to ~33.19 tok/s, below the broader 4000-token cache512 point (~33.78) and below stock (~36.07).","next_action_hint":"The broader 4000-token cache-reservation optimum is below 1024. Narrow around the 512 region if continuing this lever.","learning":"At 4000 tokens on the broader DFlash lane, the cache-reservation benefit turns over by 1024 blocks; 512 remains the strongest tested point so far."}}
{"run":359,"commit":"bf01e15","metric":28.651669960652235,"metrics":{},"status":"discard","description":"Narrow the broader 4000-token cache-reservation bracket by testing `INITIAL_CACHE_BLOCKS=768`. It collapsed badly relative to the stronger 512-block point.","timestamp":1776189005177,"segment":20,"confidence":null,"iterationTokens":952,"asi":{"hypothesis":"If the broader 4000-token DFlash cache-reservation optimum lies between 512 and 1024, 768 may outperform both endpoints.","context_tokens":4000,"lane":"broader_request_driven_thinking_cache768","rollback_reason":"Throughput collapsed to ~28.65 tok/s, far below the broader 4000-token cache512 point (~33.78) and below stock (~36.07).","next_action_hint":"Treat 768 as a bad/unstable point and keep 512 as the only strong broader 4000-token cache-reservation setting found so far.","learning":"The broader 4000-token DFlash lane has a very non-monotonic cache-reservation landscape: 768 blocks is dramatically worse than both 512 and 1024."}}
{"run":360,"commit":"bf01e15","metric":31.382235854333793,"metrics":{},"status":"discard","description":"Test a much later tail-only adaptive-block start (`DFLASH_BSTNXBT_ADAPTIVE_BLOCK_START=1536`) on the strongest broader 4000-token DFlash point (cache512). It still regressed.","timestamp":1776189167066,"segment":20,"confidence":null,"iterationTokens":1146,"asi":{"hypothesis":"Adaptive block sizing hurt the broader 4000-token DFlash lane when started at 768, but a much later tail-only start at 1536 may preserve the stronger mid-decode region while still helping the tail.","context_tokens":4000,"lane":"broader_request_driven_thinking_cache512_adaptive_from_1536","rollback_reason":"Throughput reached only ~31.38 tok/s, below the broader fixed cache512 baseline (~33.78) and below stock (~36.07).","next_action_hint":"Prune adaptive-block experiments for the broader 4000-token lane; that branch appears consistently harmful regardless of where the shrink starts.","learning":"On the broader 4000-token DFlash lane, adaptive block sizing is not just too early at 768 — even a very late start at 1536 still hurts throughput."}}
{"run":361,"commit":"bf01e15","metric":33.40222634196659,"metrics":{},"status":"discard","description":"Establish the 8000-token DFlash checkpoint on the strongest current long-context shape so far: broader normal-request DFlash with request-driven thinking, block 15, and INITIAL_CACHE_BLOCKS=512. Under normal EOS semantics it stopped early at 5465 tokens.","timestamp":1776189381960,"segment":20,"confidence":null,"iterationTokens":1416,"asi":{"hypothesis":"Before sweeping still longer contexts, the next honest checkpoint is to see how far the strongest current long-context DFlash shape gets at an 8000-token target under normal EOS semantics.","context_tokens_target":8000,"context_tokens_actual":5465,"lane":"broader_request_driven_thinking_cache512","rollback_reason":"This is a characterization checkpoint for a longer workload, not a primary-metric improvement over the shorter-context baseline in this sweep.","next_action_hint":"Run the matched stock comparison at the same 8000-token target and same EOS semantics before drawing any conclusion about DFlash leadership at this length.","learning":"At an 8000-token target under normal EOS semantics, the strongest current DFlash shape generated 5465 tokens at about 33.40 tok/s before stopping."}}
{"run":362,"commit":"bf01e15","metric":35.69636474884029,"metrics":{},"status":"discard","description":"Matched stock comparison at an 8000-token target under the same server settings and normal EOS semantics as the new DFlash checkpoint. Like DFlash, stock also stopped early at 5465 tokens, but it was faster.","timestamp":1776189567126,"segment":20,"confidence":null,"iterationTokens":993,"asi":{"hypothesis":"At the 8000-token target under normal EOS semantics, the strongest current long-context DFlash shape may still beat stock on the same real server workload.","context_tokens_target":8000,"context_tokens_actual":5465,"lane":"stock_same_server_settings","rollback_reason":"Matched stock was faster than DFlash at this target length (35.70 tok/s stock vs 33.40 tok/s DFlash over the same 5465 generated tokens).","next_action_hint":"Do not claim long-context victory yet: at both 4000 and 8000 targets under normal EOS semantics, stock remains ahead. Continue tuning before sweeping to 16k/32k/64k/128k if the goal is DFlash > stock.","learning":"At an 8000-token target under normal EOS semantics, both stock and DFlash stopped at 5465 generated tokens, and stock was still faster (~35.70 tok/s vs ~33.40 tok/s)."}}
{"type":"config","name":"Qwen forced-length long-context DFlash vs stock sweep (ignore_eos=1)","metricName":"completion_tok_s","metricUnit":"","bestDirection":"higher"}
{"run":363,"commit":"0a6039a","metric":22.281479432539463,"metrics":{},"status":"keep","description":"Establish the first forced-length long-context checkpoint at 8000 completion tokens under ignore_eos=1 using the strongest current long-context DFlash shape: broader normal-request DFlash with request-driven thinking and INITIAL_CACHE_BLOCKS=512.","timestamp":1776189973921,"segment":21,"confidence":null,"iterationTokens":377,"asi":{"hypothesis":"To characterize true long-context behavior beyond the prompt's natural EOS point, the first honest forced-length checkpoint should be an 8000-token DFlash run under ignore_eos=1 on the strongest current long-context shape.","context_tokens":8000,"ignore_eos":true,"lane":"broader_request_driven_thinking_cache512","learning":"At a forced 8000-token target under ignore_eos=1, the strongest current DFlash shape delivers about 22.28 tok/s on the real server path."}}
{"run":364,"commit":"0a6039a","metric":22.533961513470093,"metrics":{},"status":"discard","description":"Correct the forced-length 8000-token stock comparison by explicitly disabling model-settings DFlash in-repo, since preserved autoresearch model settings had left DFlash enabled and made earlier supposed stock comparisons untrustworthy. On the corrected run, stock is slightly faster than DFlash.","timestamp":1776190401417,"segment":21,"confidence":null,"iterationTokens":2697,"asi":{"hypothesis":"The earlier no-EOS 8k 'stock' comparison was suspect because preserved model settings still had dflash_enabled=true; explicitly disabling it should yield the honest stock baseline.","context_tokens":8000,"ignore_eos":true,"lane":"corrected_stock_same_server_settings","rollback_reason":"Corrected stock is slightly faster than the 8k DFlash checkpoint (22.53 tok/s stock vs 22.28 tok/s DFlash), so DFlash does not yet lead at forced 8k.","next_action_hint":"Treat prior long-context stock comparisons as suspect unless model-settings DFlash was explicitly disabled; continue tuning DFlash against this corrected 8k stock baseline.","learning":"With model-settings DFlash explicitly disabled, the forced-length 8k stock baseline is ~22.53 tok/s, slightly ahead of the current DFlash checkpoint at ~22.28 tok/s."}}
{"run":365,"commit":"f1e54c4","metric":23.31265528414908,"metrics":{},"status":"keep","description":"At forced 8000 tokens under ignore_eos=1, add explicit request-level DFlash on top of the strongest current long-context DFlash shape (cache512, request-driven thinking). This finally beats the corrected 8k stock baseline on the real server path.","timestamp":1776190786131,"segment":21,"confidence":4.084154597462051,"iterationTokens":1929,"asi":{"hypothesis":"The corrected 8k no-EOS DFlash-vs-stock gap is now small enough that explicit request-level DFlash may recover the missing margin on top of the strongest current long-context shape.","context_tokens":8000,"ignore_eos":true,"lane":"explicit_request_dflash_request_driven_thinking_cache512","beats_stock_tok_s":22.533961513470093,"learning":"At forced 8000 tokens under ignore_eos=1, explicit request-level DFlash lifts throughput to ~23.31 tok/s and honestly beats the corrected stock baseline of ~22.53 tok/s on the real server path."}}
{"run":366,"commit":"570fe49","metric":14.70825218008612,"metrics":{},"status":"keep","description":"Establish the forced-length 16000-token DFlash checkpoint under ignore_eos=1 using the current 8k-winning long-context shape: explicit request-level DFlash, request-driven thinking, and INITIAL_CACHE_BLOCKS=512 on the real server path.","timestamp":1776191920668,"segment":21,"confidence":2,"iterationTokens":1553,"asi":{"hypothesis":"The honest next step after the corrected 8k no-EOS win is to see how the same winning DFlash shape scales to a forced 16000-token target.","context_tokens":16000,"ignore_eos":true,"lane":"explicit_request_dflash_request_driven_thinking_cache512","learning":"At a forced 16000-token target under ignore_eos=1, the current 8k-winning DFlash shape delivers about 14.71 tok/s on the real server path."}}
{"run":367,"commit":"570fe49","metric":22.025128055493738,"metrics":{},"status":"discard","description":"Matched forced-length 16000-token stock comparison under ignore_eos=1, with model-settings DFlash explicitly disabled in-repo. Stock is much faster than the current 16k DFlash shape on the real server path.","timestamp":1776192707953,"segment":21,"confidence":4.0225095082118045,"iterationTokens":1857,"asi":{"hypothesis":"After the corrected no-EOS 8k DFlash win, the same shape may continue to beat stock at a forced 16000-token target.","context_tokens":16000,"ignore_eos":true,"lane":"corrected_stock_same_server_settings","rollback_reason":"Corrected stock is far faster than the current 16k DFlash checkpoint (22.03 tok/s stock vs 14.71 tok/s DFlash), so DFlash is not yet competitive at 16k.","next_action_hint":"Do not sweep upward blindly from the current 16k DFlash shape. Tune 16k specifically before attempting 32k/64k/128k if the goal is DFlash > stock.","learning":"At a forced 16000-token target under ignore_eos=1, corrected stock is much faster than the current DFlash shape: ~22.03 tok/s vs ~14.71 tok/s."}}
{"run":368,"commit":"570fe49","metric":14.741785190555493,"metrics":{},"status":"discard","description":"Test whether the forced-length 16k DFlash shape is under-reserved on cache by increasing `INITIAL_CACHE_BLOCKS` from 512 to 1024. It was effectively flat and did not improve competitiveness versus stock.","timestamp":1776193847765,"segment":21,"confidence":1.339181322075055,"iterationTokens":1484,"asi":{"hypothesis":"At 16000 forced tokens, DFlash may need substantially more initial cache reservation than at 8k to remain competitive with stock.","context_tokens":16000,"ignore_eos":true,"lane":"explicit_request_dflash_request_driven_thinking_cache1024","rollback_reason":"Throughput was effectively flat (~14.74 tok/s) versus the 16k DFlash baseline at cache512 (~14.71 tok/s), and still far below corrected stock (~22.03 tok/s).","next_action_hint":"Cache reservation is not the missing 16k lever; try long-tail adaptive behavior or other long-context-specific controls instead.","learning":"At forced 16k, increasing `INITIAL_CACHE_BLOCKS` from 512 to 1024 does not materially improve the DFlash path."}}
{"run":369,"commit":"570fe49","metric":12.388244595407619,"metrics":{},"status":"discard","description":"Test a 16k-specific tail-only adaptive block path by enabling adaptive block sizing from token 2048 on the explicit-request DFlash lane under ignore_eos=1. It regressed badly.","timestamp":1776195177791,"segment":21,"confidence":0.8008963450711244,"iterationTokens":1077,"asi":{"hypothesis":"At forced 16000 tokens, the long tail may benefit from shrinking the speculative block after enough prefix has accumulated, even if cache reservation alone did not help.","context_tokens":16000,"ignore_eos":true,"lane":"explicit_request_dflash_request_driven_thinking_cache512_adaptive_from_2048","rollback_reason":"Throughput collapsed to ~12.39 tok/s, well below the 16k DFlash baseline (~14.71) and far below corrected stock (~22.03).","next_action_hint":"Do not continue this early adaptive-shrink branch at 16k. Use the new oMLX experimental DFlash integration doc lead next and compare its intended runtime shape to the current implementation.","learning":"At forced 16k, tail-only adaptive block sizing starting as early as 2048 is strongly harmful on the explicit DFlash lane."}}
{"run":370,"commit":"570fe49","metric":0,"metrics":{},"status":"crash","description":"Attempt to benchmark the forced-length 16k broader normal-request DFlash lane under ignore_eos=1 was interrupted before completion, so no valid metric was produced.","timestamp":1776195317028,"segment":21,"confidence":0.8008963450711244,"iterationTokens":10949,"asi":{"hypothesis":"The broader 16k no-EOS DFlash lane might outperform the explicit-request 16k DFlash shape just as it did on some shorter contexts.","rollback_reason":"Run aborted before producing a valid measurement.","next_action_hint":"Resume by re-reading context and using the newly provided oMLX experimental DFlash integration doc to guide the next long-context experiments.","learning":"No valid result from this run; do not infer anything about the broader 16k DFlash lane from the aborted attempt."}}
{"run":371,"commit":"570fe49","metric":11.86115513754155,"metrics":{},"status":"discard","description":"Use the upstream experimental integration doc as a long-context clue and test a larger draft KV window (`DFLASH_DRAFT_WINDOW=2048`) on the forced-length 16k explicit-request DFlash lane. It regressed badly.","timestamp":1776196736780,"segment":21,"confidence":0.2562396229597869,"iterationTokens":22541,"asi":{"hypothesis":"The upstream DFlash integration docs highlight draft sink/window sizing as a long-context lever; enlarging the draft window may improve 16k DFlash throughput.","context_tokens":16000,"ignore_eos":true,"lane":"explicit_request_dflash_request_driven_thinking_cache512_draft_window2048","rollback_reason":"Throughput collapsed to ~11.86 tok/s, well below the 16k DFlash baseline (~14.71) and far below corrected stock (~22.03).","next_action_hint":"Do not increase the draft window on this 16k lane again without stronger evidence. If this lever is revisited, try smaller-than-default rather than larger-than-default values.","learning":"On the forced-length 16k DFlash lane, enlarging the draft KV window from its current effective default is strongly harmful."}}
{"run":372,"commit":"570fe49","metric":11.193837337236499,"metrics":{},"status":"discard","description":"Use the upstream experimental integration doc to test the opposite draft-window direction at forced 16k: shrink the draft KV window to `DFLASH_DRAFT_WINDOW=512` on the explicit-request DFlash lane. It regressed even more than the enlarged-window test.","timestamp":1776198206149,"segment":21,"confidence":0.2906400810386727,"iterationTokens":1033,"asi":{"hypothesis":"If the default draft window is too large for long forced-length DFlash, shrinking it may reduce stale draft-cache overhead and improve 16k throughput.","context_tokens":16000,"ignore_eos":true,"lane":"explicit_request_dflash_request_driven_thinking_cache512_draft_window512","rollback_reason":"Throughput fell further to ~11.19 tok/s, below both the 16k DFlash baseline (~14.71) and the larger-window 2048 test (~11.86).","next_action_hint":"Prune the draft-window branch for the current 16k DFlash lane; neither larger nor smaller windows helped here.","learning":"On the forced-length 16k DFlash lane, changing the draft KV window away from the current default is strongly harmful in both directions."}}
{"run":373,"commit":"570fe49","metric":11.921367141795239,"metrics":{},"status":"discard","description":"Use the upstream experimental integration doc to test a larger draft-cache sink (`DFLASH_DRAFT_SINK=128`) on the forced-length 16k explicit-request DFlash lane. It regressed badly.","timestamp":1776199585535,"segment":21,"confidence":0.32249213833560464,"iterationTokens":1084,"asi":{"hypothesis":"If long forced-length DFlash suffers because too little early context is retained in the draft cache sink, increasing the sink size may improve 16k throughput.","context_tokens":16000,"ignore_eos":true,"lane":"explicit_request_dflash_request_driven_thinking_cache512_draft_sink128","rollback_reason":"Throughput fell to ~11.92 tok/s, well below the 16k DFlash baseline (~14.71) and far below corrected stock (~22.03).","next_action_hint":"Prune the draft sink/window tuning branch for the current 16k lane; the upstream cache-window knobs do not transfer as wins here.","learning":"On the forced-length 16k DFlash lane, increasing the draft cache sink from the current default is strongly harmful."}}
