{"run":714,"commit":"8b55918","metric":106.0436061769658,"metrics":{},"status":"discard","description":"Control parity check during stable high-band window (mirror disabled).","timestamp":1776285874130,"segment":23,"confidence":3.802184442324622,"iterationTokens":718,"asi":{"hypothesis":"In recovered stable band, mirror/control should remain close and ordering may continue to flip within noise.","rollback_reason":"Comparison-only run; control slightly below current mirror anchor.","next_action_hint":"Run mirror follow-up and continue emphasizing robust >106.86 improvements only.","backend":"bstnxbt_mlx","mirror_runtime_enabled":0,"context_only_draft_cache":1,"draft_sink":48,"paired_mirror_tok_s":106.42107740478221,"paired_delta_tok_s":0.37747122781640796}}
{"run":715,"commit":"8b55918","metric":105.10663152855493,"metrics":{},"status":"discard","description":"Mirror follow-up after control parity sample in high band.","timestamp":1776285907217,"segment":23,"confidence":3.8749393622881447,"iterationTokens":637,"asi":{"hypothesis":"Mirror should stay near paired control if regime remains stable; large divergence would indicate local jitter.","rollback_reason":"Mirror dipped to 105.11 (below both control pair and keep).","next_action_hint":"Treat this as local jitter; keep requiring repeated evidence before interpreting small deltas.","backend":"mirror_sd_mlx","context_only_draft_cache":1,"draft_sink":48,"paired_control_tok_s":106.0436061769658,"paired_delta_tok_s":-0.9369746484108697,"delta_vs_keep":-1.7533684714450655}}
{"run":716,"commit":"8b55918","metric":104.95560961580996,"metrics":{},"status":"discard","description":"2D neighborhood probe: DFLASH_DRAFT_SINK=42 with DFLASH_DRAFT_WINDOW=1040.","timestamp":1776285941903,"segment":23,"confidence":3.9369495922293956,"iterationTokens":823,"asi":{"hypothesis":"Near-keep sink and near-keep window values might combine into a local optimum that beats the default pair (48,1024).","rollback_reason":"Combination regressed materially (104.96 vs 106.86).","next_action_hint":"Avoid sink/window cross-product churn; independent near-keep one-dimensional probes did not compose positively.","backend":"mirror_sd_mlx","context_only_draft_cache":1,"draft_sink":42,"draft_window":1040,"delta_vs_keep":-1.9043903841900363}}
{"run":717,"commit":"8b55918","metric":105.14530312070774,"metrics":{},"status":"discard","description":"Mirror structural loop refactor: collapse split-start dual loops into single per-layer loop in mirror target forward path.","timestamp":1776286040978,"segment":23,"confidence":3.993325558737651,"iterationTokens":3954,"asi":{"hypothesis":"Removing split/slice loop overhead in mirror target forward should reduce Python overhead while preserving output parity.","rollback_reason":"Regression versus keep and current anchors (105.15 vs 106.86).","next_action_hint":"Revert single-loop refactor; preserve current split-structured implementation despite apparent redundancy.","backend":"mirror_sd_mlx","context_only_draft_cache":1,"draft_sink":48,"optimization":"mirror_single_loop_refactor","delta_vs_keep":-1.7146968792922466}}
{"run":718,"commit":"8b55918","metric":105.15891017431184,"metrics":{},"status":"discard","description":"Post-revert mirror anchor after single-loop refactor regression.","timestamp":1776286077995,"segment":23,"confidence":4.040751143052859,"iterationTokens":838,"asi":{"hypothesis":"Reverted keep-shape baseline should recover toward prior high-106 band if regression was patch-induced.","rollback_reason":"Anchor stayed low at 105.16, indicating local regime dip/noise persists.","next_action_hint":"Run control symmetry check to determine whether dip is shared across backends.","backend":"mirror_sd_mlx","context_only_draft_cache":1,"draft_sink":48,"stability_probe":true,"delta_vs_keep":-1.7010898256881473}}
{"run":719,"commit":"8b55918","metric":105.0746691354504,"metrics":{},"status":"discard","description":"Control symmetry check after 105.16 mirror dip (mirror disabled).","timestamp":1776286117591,"segment":23,"confidence":4.126786652239145,"iterationTokens":716,"asi":{"hypothesis":"If mirror dip is global, control should land in a similar band.","rollback_reason":"Control matched mirror dip closely (~105.07), confirming shared local slowdown.","next_action_hint":"Treat this as regime jitter; continue requiring paired evidence for any new candidate claims.","backend":"bstnxbt_mlx","mirror_runtime_enabled":0,"context_only_draft_cache":1,"draft_sink":48,"paired_mirror_tok_s":105.15891017431184,"paired_delta_tok_s":0.08424103886143774}}
{"run":720,"commit":"8b55918","metric":105.16202224363268,"metrics":{},"status":"discard","description":"Mirror follow-up after control symmetry run in ~105 local band.","timestamp":1776286151614,"segment":23,"confidence":4.205121090387984,"iterationTokens":646,"asi":{"hypothesis":"Immediate mirror rerun should confirm whether the ~105 dip is transient or sustained.","rollback_reason":"Mirror repeated ~105.16, supporting sustained local lower band.","next_action_hint":"Pause micro-tuning and wait for next rebound into high-106 band before further candidate probes.","backend":"mirror_sd_mlx","context_only_draft_cache":1,"draft_sink":48,"paired_control_tok_s":105.0746691354504,"paired_delta_tok_s":0.08735310818227912,"stability_probe":true}}
{"run":721,"commit":"8b55918","metric":11.429451555911605,"metrics":{},"status":"discard","description":"Structural backend path check: disable native drafter integration (DFLASH_USE_MLX_NATIVE_DRAFTER=0).","timestamp":1776286289537,"segment":23,"confidence":4.126786652239145,"iterationTokens":4182,"asi":{"hypothesis":"Non-native drafter path might provide an alternative combined DFlash+mirror operating point with better throughput.","rollback_reason":"Catastrophic regression to 11.43 tok/s (request ~89.6s).","next_action_hint":"Mark non-native drafter path as non-viable for authoritative lane; keep native integration mandatory.","backend":"zlab_spec_generate_or_non_native_path","native_mlx_drafter":0,"catastrophic":true}}
{"run":722,"commit":"8b55918","metric":67.43928350995259,"metrics":{},"status":"discard","description":"Post-revert anchor after catastrophic non-native-drafter probe.","timestamp":1776286342514,"segment":23,"confidence":4.040751143052859,"iterationTokens":1173,"asi":{"hypothesis":"Restoring native keep-shape config should return quickly to prior high-105/106 band.","rollback_reason":"Throughput remained in a depressed ~67 tok/s trough.","next_action_hint":"Run immediate control symmetry check to classify this as shared instability after catastrophic path probe.","backend":"mirror_sd_mlx","context_only_draft_cache":1,"draft_sink":48,"collapse_regime":true}}
{"run":723,"commit":"8b55918","metric":70.43789360582365,"metrics":{},"status":"discard","description":"Control symmetry check after ~67 mirror post-revert trough (mirror disabled).","timestamp":1776286388095,"segment":23,"confidence":3.993325558737651,"iterationTokens":686,"asi":{"hypothesis":"If trough is global, control should remain similarly depressed.","rollback_reason":"Control also low (~70.44), confirming shared instability window.","next_action_hint":"Run mirror follow-up recovery probe before resuming any candidate tuning.","backend":"bstnxbt_mlx","mirror_runtime_enabled":0,"context_only_draft_cache":1,"draft_sink":48,"collapse_regime":true,"paired_delta_tok_s":-2.998610095871062}}
{"run":724,"commit":"8b55918","metric":77.32100415045785,"metrics":{},"status":"discard","description":"Mirror recovery follow-up after shared ~67-70 trough window.","timestamp":1776286422989,"segment":23,"confidence":3.9369495922293956,"iterationTokens":613,"asi":{"hypothesis":"Mirror should rebound upward from trough on immediate rerun if instability wave is passing.","rollback_reason":"Only partial recovery to 77.32, still far below keep.","next_action_hint":"Continue sparse recovery probes until high-100 band returns; avoid tuning conclusions in this band.","backend":"mirror_sd_mlx","context_only_draft_cache":1,"draft_sink":48,"collapse_regime":true,"paired_control_tok_s":70.43789360582365,"paired_delta_tok_s":6.883110544634194}}
{"run":725,"commit":"8b55918","metric":79.40404241963344,"metrics":{},"status":"discard","description":"Additional mirror recovery probe after post-nonnative collapse wave.","timestamp":1776286465782,"segment":23,"confidence":3.8749393622881447,"iterationTokens":1035,"asi":{"hypothesis":"Repeated unchanged runs should continue rebounding from ~67-77 trough toward high-100 band.","rollback_reason":"Recovery still limited to high-70s.","next_action_hint":"Run paired control sample to confirm rebound pace is shared and avoid backend-overfitting.","backend":"mirror_sd_mlx","context_only_draft_cache":1,"draft_sink":48,"stability_probe":true}}
{"run":726,"commit":"8b55918","metric":88.44493995053234,"metrics":{},"status":"discard","description":"Control pair sample during rebound from post-nonnative trough (mirror disabled).","timestamp":1776286511069,"segment":23,"confidence":3.802184442324622,"iterationTokens":662,"asi":{"hypothesis":"If rebound is global, control should rise similarly and potentially lead in noisy recovery.","rollback_reason":"Control rebounded higher to 88.44, still below high-band baseline.","next_action_hint":"Run immediate mirror follow-up to complete pair and track ordering flips during recovery.","backend":"bstnxbt_mlx","mirror_runtime_enabled":0,"context_only_draft_cache":1,"draft_sink":48,"paired_mirror_tok_s":79.40404241963344,"paired_delta_tok_s":-9.040897530898897}}
{"run":727,"commit":"8b55918","metric":91.77887445425664,"metrics":{},"status":"discard","description":"Mirror follow-up after control-leading rebound sample.","timestamp":1776286543127,"segment":23,"confidence":3.737311852941658,"iterationTokens":648,"asi":{"hypothesis":"Mirror should continue recovery and potentially close the temporary control lead.","rollback_reason":"Mirror recovered to 91.78 and flipped above control, but still below high-band and keep.","next_action_hint":"Continue stability recovery tracking until >100 band returns before new candidate testing.","backend":"mirror_sd_mlx","context_only_draft_cache":1,"draft_sink":48,"paired_control_tok_s":88.44493995053234,"paired_delta_tok_s":3.3339345037243,"stability_probe":true}}
{"run":728,"commit":"8b55918","metric":94.46454015151777,"metrics":{},"status":"discard","description":"Additional mirror recovery probe (unchanged keep config).","timestamp":1776286574863,"segment":23,"confidence":3.6629406311936155,"iterationTokens":627,"asi":{"hypothesis":"Throughput should continue climbing from low-90 rebound toward the high-100 band as instability fades.","rollback_reason":"Still below keep at 94.46.","next_action_hint":"Keep monitoring; resume structural probes only once recovery stabilizes above ~100.","backend":"mirror_sd_mlx","context_only_draft_cache":1,"draft_sink":48,"stability_probe":true}}
{"run":729,"commit":"8b55918","metric":97.30226230834417,"metrics":{},"status":"discard","description":"Control pair probe as rebound approaches high-90 band (mirror disabled).","timestamp":1776286613820,"segment":23,"confidence":3.6188030363910926,"iterationTokens":659,"asi":{"hypothesis":"Control should climb alongside mirror if recovery is global and not backend-specific.","rollback_reason":"Control reached high-90s, confirming shared recovery trend.","next_action_hint":"Run immediate mirror follow-up; if >100 resumes, restart structural candidate tests.","backend":"bstnxbt_mlx","mirror_runtime_enabled":0,"context_only_draft_cache":1,"draft_sink":48,"paired_mirror_tok_s":94.46454015151777,"paired_delta_tok_s":-2.837722156826404}}
{"run":730,"commit":"8b55918","metric":98.20497952030311,"metrics":{},"status":"discard","description":"Mirror follow-up after control high-90 recovery sample.","timestamp":1776286647113,"segment":23,"confidence":3.5876329504667037,"iterationTokens":638,"asi":{"hypothesis":"Mirror should continue rebound into high-90/100 band and potentially retake pair lead.","rollback_reason":"Mirror improved to 98.20 and slightly exceeded paired control, still below keep.","next_action_hint":"Continue recovery tracking until stable >100 before introducing new candidate changes.","backend":"mirror_sd_mlx","context_only_draft_cache":1,"draft_sink":48,"paired_control_tok_s":97.30226230834417,"paired_delta_tok_s":0.9027172119589433,"stability_probe":true}}
{"run":731,"commit":"8b55918","metric":99.97252667134592,"metrics":{},"status":"discard","description":"Recovery monitoring run on unchanged mirror keep config approaching >100 band.","timestamp":1776286684681,"segment":23,"confidence":3.341395294575517,"iterationTokens":670,"asi":{"hypothesis":"Continued reruns should complete rebound into stable >100 regime.","rollback_reason":"Still just under 100 and below keep.","next_action_hint":"Take one more anchor/paired sample; if >100 holds, resume structural candidate probes.","backend":"mirror_sd_mlx","context_only_draft_cache":1,"draft_sink":48,"stability_probe":true}}
{"run":732,"commit":"8b55918","metric":101.74890410282119,"metrics":{},"status":"discard","description":"Rebound checkpoint run: mirror keep-shape crossed back into >100 band.","timestamp":1776286716901,"segment":23,"confidence":3.1661856324640483,"iterationTokens":572,"asi":{"hypothesis":"Recovery wave should return benchmark to >100 throughput regime on unchanged config.","rollback_reason":"Recovered >100 but still below keep.","next_action_hint":"Resume structural candidate tests with immediate paired confirmation for any near-keep samples.","backend":"mirror_sd_mlx","context_only_draft_cache":1,"draft_sink":48,"stability_probe":true}}
{"run":733,"commit":"8b55918","metric":103.16904830127912,"metrics":{},"status":"discard","description":"Split-SDPA chunk extension beyond prior sweep: DFLASH_BSTNXBT_SPLIT_CHUNK_SIZE=25.","timestamp":1776286756896,"segment":23,"confidence":3.2352533581963114,"iterationTokens":641,"asi":{"hypothesis":"Chunk size 25 might transfer long-context gains without the cliffs seen at some large values.","rollback_reason":"Regression versus keep (103.17 vs 106.86).","next_action_hint":"Add chunk size 25 to do-not-retry set; large-chunk region remains non-winning for 1024 lane.","backend":"mirror_sd_mlx","context_only_draft_cache":1,"draft_sink":48,"split_chunk_size":25,"delta_vs_keep":-3.6909516987208817}}
{"run":734,"commit":"8b55918","metric":104.13295944759577,"metrics":{},"status":"discard","description":"Split-SDPA chunk extension: DFLASH_BSTNXBT_SPLIT_CHUNK_SIZE=26.","timestamp":1776286791156,"segment":23,"confidence":3.3158078347027278,"iterationTokens":683,"asi":{"hypothesis":"Chunk 26 might outperform 25 and approach prior high-band if chunk-size optimum shifts with recovered regime.","rollback_reason":"Still below keep (104.13 vs 106.86).","next_action_hint":"Add chunk size 26 to do-not-retry set; stop extending this family without new profiling evidence.","backend":"mirror_sd_mlx","context_only_draft_cache":1,"draft_sink":48,"split_chunk_size":26,"delta_vs_keep":-2.727040552404232}}
{"run":735,"commit":"8b55918","metric":104.65793655040379,"metrics":{},"status":"discard","description":"Mirror anchor after split-chunk extension tests (unchanged keep config).","timestamp":1776286834331,"segment":23,"confidence":3.4513823283415936,"iterationTokens":863,"asi":{"hypothesis":"Reverting chunk overrides should return to current recovered baseline band.","rollback_reason":"Anchor landed lower at 104.66, still below keep.","next_action_hint":"Run control symmetry check to determine if this dip is shared regime movement.","backend":"mirror_sd_mlx","context_only_draft_cache":1,"draft_sink":48,"stability_probe":true,"delta_vs_keep":-2.202063449596217}}
{"run":736,"commit":"8b55918","metric":105.10347194681195,"metrics":{},"status":"discard","description":"Control symmetry check after 104.66 mirror anchor dip (mirror disabled).","timestamp":1776286875016,"segment":23,"confidence":3.611978307951476,"iterationTokens":693,"asi":{"hypothesis":"If dip is global, control should sit in similar band.","rollback_reason":"Control also in mid-105 band, indicating shared local jitter.","next_action_hint":"Run immediate mirror follow-up; continue paired interpretation rather than single-run conclusions.","backend":"bstnxbt_mlx","mirror_runtime_enabled":0,"context_only_draft_cache":1,"draft_sink":48,"paired_mirror_tok_s":104.65793655040379,"paired_delta_tok_s":-0.445535396408165}}
{"run":737,"commit":"8b55918","metric":105.25603028255395,"metrics":{},"status":"discard","description":"Mirror follow-up after mid-105 control symmetry sample.","timestamp":1776286910950,"segment":23,"confidence":3.6430278443779227,"iterationTokens":633,"asi":{"hypothesis":"Mirror should stay near control if this is shared jitter rather than backend-specific drift.","rollback_reason":"Mirror remained in mid-105 band and slightly above paired control, still below keep.","next_action_hint":"Maintain paired-bundle monitoring and seek only structural candidates that can clear 106.86 robustly.","backend":"mirror_sd_mlx","context_only_draft_cache":1,"draft_sink":48,"paired_control_tok_s":105.10347194681195,"paired_delta_tok_s":0.15255833574200048,"delta_vs_keep":-1.6039697174460525}}
{"run":738,"commit":"8b55918","metric":104.88878536635838,"metrics":{},"status":"discard","description":"Mirror stability-bundle sample (unchanged keep config).","timestamp":1776286957558,"segment":23,"confidence":3.688322393549395,"iterationTokens":928,"asi":{"hypothesis":"Bundle sampling should estimate current local median and jitter before further candidate probes.","rollback_reason":"Sample below keep and below recent high-end rebounds.","next_action_hint":"Collect paired control sample to complete bundle and track ordering/variance.","backend":"mirror_sd_mlx","context_only_draft_cache":1,"draft_sink":48,"bundle_tracking":true,"delta_vs_keep":-1.9712146336416159}}
{"run":739,"commit":"8b55918","metric":105.2411217694636,"metrics":{},"status":"discard","description":"Control sample for current stability bundle (mirror disabled).","timestamp":1776286993905,"segment":23,"confidence":3.759313721387734,"iterationTokens":677,"asi":{"hypothesis":"Bundle control sample should land near mirror sample if local jitter dominates.","rollback_reason":"Control slightly above paired mirror; still below keep.","next_action_hint":"Run mirror follow-up to complete mini-bundle and reassess median band.","backend":"bstnxbt_mlx","mirror_runtime_enabled":0,"context_only_draft_cache":1,"draft_sink":48,"bundle_tracking":true,"paired_mirror_tok_s":104.88878536635838,"paired_delta_tok_s":-0.3523364031052158}}
{"run":740,"commit":"8b55918","metric":105.10408550829264,"metrics":{},"status":"discard","description":"Mirror follow-up completing current mirror/control/mirror stability mini-bundle.","timestamp":1776287034915,"segment":23,"confidence":3.829539824666601,"iterationTokens":633,"asi":{"hypothesis":"Bundle follow-up should clarify current local median and whether mirror/control ordering is stable.","rollback_reason":"Mirror settled near ~105 and below keep.","next_action_hint":"Treat current median band as ~105; prioritize only higher-leverage structural ideas once instability clears further.","backend":"mirror_sd_mlx","context_only_draft_cache":1,"draft_sink":48,"bundle_tracking":true,"paired_control_tok_s":105.2411217694636,"paired_delta_tok_s":-0.1370362611709548,"delta_vs_keep":-1.7559144917073595}}
{"run":741,"commit":"8b55918","metric":105.25250921424929,"metrics":{},"status":"discard","description":"Context-only sink extension below prior sweep: DFLASH_DRAFT_SINK=39.","timestamp":1776287072940,"segment":23,"confidence":3.91624614942682,"iterationTokens":723,"asi":{"hypothesis":"Sink 39 could uncover a lower-sink optimum beyond previously tested floor 40.","rollback_reason":"Below keep (105.25 vs 106.86).","next_action_hint":"Add sink 39 to do-not-retry set; lower-than-40 extension does not help.","backend":"mirror_sd_mlx","context_only_draft_cache":1,"draft_sink":39,"delta_vs_keep":-1.6074907857507126}}
{"run":742,"commit":"8b55918","metric":105.16799399594275,"metrics":{},"status":"discard","description":"Context-only sink extension above prior sweep: DFLASH_DRAFT_SINK=58.","timestamp":1776287107441,"segment":23,"confidence":3.993091078073708,"iterationTokens":635,"asi":{"hypothesis":"Upper sink extension beyond 57 might recover throughput if the optimum shifted upward.","rollback_reason":"Below keep (105.17 vs 106.86).","next_action_hint":"Add sink 58 to do-not-retry set; upper extension still non-winning.","backend":"mirror_sd_mlx","context_only_draft_cache":1,"draft_sink":58,"delta_vs_keep":-1.6920060040572495}}
{"run":743,"commit":"8b55918","metric":105.26117234524584,"metrics":{},"status":"discard","description":"Recovery lever recheck in current band: AR_INITIAL_CACHE_BLOCKS=256.","timestamp":1776287163467,"segment":23,"confidence":4.051049393321195,"iterationTokens":1061,"asi":{"hypothesis":"Higher initial cache reservation might recover additional throughput in current mid-105 local regime.","rollback_reason":"No improvement versus keep or local baseline (105.26 tok/s).","next_action_hint":"Keep cache-reservation family deprioritized; current lane remains insensitive above baseline.","backend":"mirror_sd_mlx","context_only_draft_cache":1,"draft_sink":48,"initial_cache_blocks":256,"delta_vs_keep":-1.5988276547541684}}
