{"run":864,"commit":"8b55918","metric":75.7900088440786,"metrics":{},"status":"discard","description":"Control parity sample during recovery climb (~mid-70s, mirror disabled).","timestamp":1776295022535,"segment":23,"confidence":4.810413795937079,"iterationTokens":705,"asi":{"hypothesis":"Control should track mirror closely if rebound is shared regime recovery.","rollback_reason":"Control matched mirror (~75.79 vs 75.51) and remains far below keep.","next_action_hint":"Return to mirror and keep recovery bundle until entering higher bands.","backend":"bstnxbt_mlx","mirror_runtime_enabled":0,"context_only_draft_cache":1,"draft_sink":48,"paired_mirror_tok_s":75.50564263517079,"paired_delta_tok_s":-0.2843662089078027,"shared_recovery":true}}
{"run":865,"commit":"8b55918","metric":70.44412974191275,"metrics":{},"status":"discard","description":"Mirror follow-up after control ~75.79 parity sample.","timestamp":1776295056294,"segment":23,"confidence":4.772337632481539,"iterationTokens":668,"asi":{"hypothesis":"Mirror should hold mid-70 recovery band if parity trend remains stable.","rollback_reason":"Mirror slipped back to ~70.44, confirming ongoing oscillation.","next_action_hint":"Maintain recovery monitoring; do not infer directional backend advantage in this unstable band.","backend":"mirror_sd_mlx","context_only_draft_cache":1,"draft_sink":48,"paired_control_tok_s":75.7900088440786,"paired_delta_tok_s":-5.345879102165853,"delta_vs_keep":-36.41587025808725}}
{"run":866,"commit":"8b55918","metric":73.50256996817373,"metrics":{},"status":"discard","description":"Mirror recovery monitoring sample (oscillating 70s band).","timestamp":1776295088745,"segment":23,"confidence":4.752057332860783,"iterationTokens":716,"asi":{"hypothesis":"Recovery could drift upward from low-70 oscillation toward mid/high-70 before larger rebound.","rollback_reason":"Still deep below keep at ~73.50.","next_action_hint":"Continue short monitoring bundle and wait for >85 before resuming structural probes.","backend":"mirror_sd_mlx","context_only_draft_cache":1,"draft_sink":48,"stability_probe":true,"delta_vs_keep":-33.35743003182627}}
{"run":867,"commit":"8b55918","metric":75.8166022819856,"metrics":{},"status":"discard","description":"Mirror recovery monitoring sample (high-70 edge).","timestamp":1776295120194,"segment":23,"confidence":4.683561899280193,"iterationTokens":608,"asi":{"hypothesis":"Rebound may continue through high-70s as collapse wave dissipates.","rollback_reason":"Still well below keep despite local high in current trough band.","next_action_hint":"Interleave control check to confirm shared rebound before attempting new candidates.","backend":"mirror_sd_mlx","context_only_draft_cache":1,"draft_sink":48,"stability_probe":true,"delta_vs_keep":-31.043397718014397}}
{"run":868,"commit":"8b55918","metric":76.94868963417737,"metrics":{},"status":"discard","description":"Control parity check during high-70 recovery edge (mirror disabled).","timestamp":1776295156268,"segment":23,"confidence":4.627686000142546,"iterationTokens":690,"asi":{"hypothesis":"Control should mirror the rebound if recovery is shared system behavior.","rollback_reason":"Control landed close to mirror (~76.95 vs 75.82), still far below keep.","next_action_hint":"Switch back to mirror and keep monitoring until clear escape from 70s trough.","backend":"bstnxbt_mlx","mirror_runtime_enabled":0,"context_only_draft_cache":1,"draft_sink":48,"paired_mirror_tok_s":75.8166022819856,"paired_delta_tok_s":-1.1320873521917645,"shared_recovery":true}}
{"run":869,"commit":"8b55918","metric":78.83612448207406,"metrics":{},"status":"discard","description":"Mirror follow-up after control ~76.95 parity check (recovery continues).","timestamp":1776295188406,"segment":23,"confidence":4.570651658143847,"iterationTokens":666,"asi":{"hypothesis":"Mirror may continue climbing through upper-70s as collapse wave unwinds.","rollback_reason":"Still substantially below keep despite rebound to ~78.84.","next_action_hint":"Keep recovery monitoring; wait for return to >90 before evaluating structural code candidates.","backend":"mirror_sd_mlx","context_only_draft_cache":1,"draft_sink":48,"paired_control_tok_s":76.94868963417737,"paired_delta_tok_s":1.887434847896695,"delta_vs_keep":-28.023875517925944}}
{"run":870,"commit":"8b55918","metric":81.2820833127926,"metrics":{},"status":"discard","description":"Mirror recovery monitoring sample crossing into low-80s.","timestamp":1776295218219,"segment":23,"confidence":4.519658217931763,"iterationTokens":707,"asi":{"hypothesis":"Collapse recovery may re-enter 80s before larger rebound to historical 100+ band.","rollback_reason":"Still below keep by wide margin.","next_action_hint":"Continue monitoring rebound trajectory and defer risky candidate probes until regime normalizes further.","backend":"mirror_sd_mlx","context_only_draft_cache":1,"draft_sink":48,"stability_probe":true,"delta_vs_keep":-25.5779166872074}}
{"run":871,"commit":"8b55918","metric":79.31903600622371,"metrics":{},"status":"discard","description":"Mirror recovery monitoring sample after low-80 uptick.","timestamp":1776295251792,"segment":23,"confidence":4.496448745899759,"iterationTokens":588,"asi":{"hypothesis":"Recovery should hold around high-70/low-80 as regime stabilizes.","rollback_reason":"Still below keep; rebound remains incomplete.","next_action_hint":"Interleave control check if oscillation widens; continue waiting for >90 re-entry.","backend":"mirror_sd_mlx","context_only_draft_cache":1,"draft_sink":48,"stability_probe":true,"delta_vs_keep":-27.540963993776288}}
{"run":872,"commit":"8b55918","metric":80.89230026384205,"metrics":{},"status":"discard","description":"Control parity check during high-70/low-80 recovery band (mirror disabled).","timestamp":1776295289453,"segment":23,"confidence":4.473476427854516,"iterationTokens":701,"asi":{"hypothesis":"Control should remain close to mirror if recovery remains shared.","rollback_reason":"Control close to mirror and still far below keep.","next_action_hint":"Switch back to mirror and continue monitoring climb toward 90+ before new tuning probes.","backend":"bstnxbt_mlx","mirror_runtime_enabled":0,"context_only_draft_cache":1,"draft_sink":48,"paired_mirror_tok_s":79.31903600622371,"paired_delta_tok_s":-1.5732642576183398,"shared_recovery":true}}
{"run":873,"commit":"8b55918","metric":83.9580463121583,"metrics":{},"status":"discard","description":"Mirror follow-up after control ~80.89 parity sample (recovery up to mid-80s).","timestamp":1776295320305,"segment":23,"confidence":4.459517926789703,"iterationTokens":647,"asi":{"hypothesis":"Mirror may continue rebound toward 90+ as shared collapse dissipates.","rollback_reason":"Despite rebound to ~83.96, still below keep.","next_action_hint":"Continue monitoring until >90 band; then re-attempt structural candidates with immediate paired confirmation.","backend":"mirror_sd_mlx","context_only_draft_cache":1,"draft_sink":48,"paired_control_tok_s":80.89230026384205,"paired_delta_tok_s":3.0657460483162535,"delta_vs_keep":-22.901953687841694}}
{"run":874,"commit":"8b55918","metric":86.01254061365948,"metrics":{},"status":"discard","description":"Mirror recovery monitoring sample entering mid-80s.","timestamp":1776295350215,"segment":23,"confidence":4.44564626364232,"iterationTokens":674,"asi":{"hypothesis":"Recovery trend should continue from mid-80s toward prior 90+ band.","rollback_reason":"Still below keep by ~20.85 tok/s.","next_action_hint":"Maintain recovery bundle; defer new candidate probes until at least low-90 range reappears.","backend":"mirror_sd_mlx","context_only_draft_cache":1,"draft_sink":48,"stability_probe":true,"delta_vs_keep":-20.84745938634052}}
{"run":875,"commit":"8b55918","metric":84.59792183625778,"metrics":{},"status":"discard","description":"Control parity sample while mirror rebound reached mid-80s (mirror disabled).","timestamp":1776295388196,"segment":23,"confidence":4.408773772481357,"iterationTokens":701,"asi":{"hypothesis":"Control should remain near mirror if rebound is still shared.","rollback_reason":"Control stayed close (~84.60), still far below keep.","next_action_hint":"Return to mirror and continue recovery tracking toward 90+ band.","backend":"bstnxbt_mlx","mirror_runtime_enabled":0,"context_only_draft_cache":1,"draft_sink":48,"paired_mirror_tok_s":86.01254061365948,"paired_delta_tok_s":1.4146187774016956,"shared_recovery":true}}
{"run":876,"commit":"8b55918","metric":87.06858544835674,"metrics":{},"status":"discard","description":"Mirror follow-up after control ~84.60 sample (recovery to upper-80s).","timestamp":1776295423076,"segment":23,"confidence":4.37149665042996,"iterationTokens":645,"asi":{"hypothesis":"Mirror rebound should continue toward 90+ after mid-80 parity checkpoint.","rollback_reason":"Upper-80 recovery still below keep by ~19.79 tok/s.","next_action_hint":"Keep monitoring until low-90/higher before retrying structural candidates.","backend":"mirror_sd_mlx","context_only_draft_cache":1,"draft_sink":48,"paired_control_tok_s":84.59792183625778,"paired_delta_tok_s":2.4706636120989605,"delta_vs_keep":-19.791414551643257}}
{"run":877,"commit":"8b55918","metric":88.8831880587787,"metrics":{},"status":"discard","description":"Mirror recovery monitoring sample approaching 90 tok/s.","timestamp":1776295454103,"segment":23,"confidence":4.361305944899742,"iterationTokens":688,"asi":{"hypothesis":"Shared rebound should continue from upper-80s into low-90s.","rollback_reason":"Still below keep despite continued climb.","next_action_hint":"Continue short recovery bundle; once 90+ stabilizes, resume structural search.","backend":"mirror_sd_mlx","context_only_draft_cache":1,"draft_sink":48,"stability_probe":true,"delta_vs_keep":-17.976811941221303}}
{"run":878,"commit":"8b55918","metric":85.34374171401917,"metrics":{},"status":"discard","description":"Mirror recovery sample after near-90 run (oscillation persists).","timestamp":1776295487009,"segment":23,"confidence":4.351162641418472,"iterationTokens":584,"asi":{"hypothesis":"Recovery band may still oscillate before fully re-entering 90+ range.","rollback_reason":"Dropped back to mid-80s; still far below keep.","next_action_hint":"Take paired control check to confirm this dip is shared before any new candidate.","backend":"mirror_sd_mlx","context_only_draft_cache":1,"draft_sink":48,"stability_probe":true,"delta_vs_keep":-21.516258285980832}}
{"run":879,"commit":"8b55918","metric":87.95623687596095,"metrics":{},"status":"discard","description":"Control parity check after mirror mid-80 dip (mirror disabled).","timestamp":1776295523679,"segment":23,"confidence":4.28843135566513,"iterationTokens":727,"asi":{"hypothesis":"Control should remain in similar rebound band if oscillation is shared.","rollback_reason":"Control at ~87.96 confirms shared upper-80 oscillation; still below keep.","next_action_hint":"Return to mirror and continue monitoring until 90+ stabilizes for structural retries.","backend":"bstnxbt_mlx","mirror_runtime_enabled":0,"context_only_draft_cache":1,"draft_sink":48,"paired_mirror_tok_s":85.34374171401917,"paired_delta_tok_s":-2.6124951619417796,"shared_recovery":true}}
{"run":880,"commit":"8b55918","metric":88.13448441788334,"metrics":{},"status":"discard","description":"Mirror follow-up after control ~87.96 check (upper-80 band holds).","timestamp":1776295554838,"segment":23,"confidence":4.263569012713269,"iterationTokens":657,"asi":{"hypothesis":"Mirror should hold near control in upper-80 rebound band.","rollback_reason":"Upper-80 persists but still below keep by ~18.73 tok/s.","next_action_hint":"Need further recovery before meaningful structural A/B attempts; continue short monitoring bundles.","backend":"mirror_sd_mlx","context_only_draft_cache":1,"draft_sink":48,"paired_control_tok_s":87.95623687596095,"paired_delta_tok_s":0.17824754192238512,"delta_vs_keep":-18.72551558211666}}
{"run":881,"commit":"8b55918","metric":92.46567859096834,"metrics":{},"status":"discard","description":"Mirror recovery sample re-entering low-90 band after prolonged collapse.","timestamp":1776295605955,"segment":23,"confidence":4.199289811132159,"iterationTokens":1453,"asi":{"hypothesis":"Collapse recovery should eventually regain low-90 throughput before returning to historical 100+ regime.","rollback_reason":"Recovered to ~92.47 but still below keep by ~14.39 tok/s.","next_action_hint":"Now that 90+ has returned, try one structural candidate with immediate paired control confirmation.","backend":"mirror_sd_mlx","context_only_draft_cache":1,"draft_sink":48,"stability_probe":true,"delta_vs_keep":-14.394321409031667}}
{"run":882,"commit":"8b55918","metric":93.18332435603617,"metrics":{},"status":"discard","description":"Mirror recovery monitoring sample holding low-90 band.","timestamp":1776295651391,"segment":23,"confidence":4.171470004630757,"iterationTokens":1638,"asi":{"hypothesis":"Recovered regime should stabilize in low-90s before further climb.","rollback_reason":"Still below keep despite incremental gain.","next_action_hint":"Run paired control sample to verify shared low-90 stabilization.","backend":"mirror_sd_mlx","context_only_draft_cache":1,"draft_sink":48,"stability_probe":true,"delta_vs_keep":-13.676675643963833}}
{"run":883,"commit":"8b55918","metric":94.98059002286608,"metrics":{},"status":"discard","description":"Control parity sample during low-90 recovery stabilization (mirror disabled).","timestamp":1776295694413,"segment":23,"confidence":4.12581290278828,"iterationTokens":672,"asi":{"hypothesis":"Control should remain near mirror as shared recovery continues.","rollback_reason":"Control slightly higher at ~94.98 but still below keep.","next_action_hint":"Return to mirror; if >95 persists, consider one structural retry with immediate control confirmation.","backend":"bstnxbt_mlx","mirror_runtime_enabled":0,"context_only_draft_cache":1,"draft_sink":48,"paired_mirror_tok_s":93.18332435603617,"paired_delta_tok_s":-1.7972656668299125,"shared_recovery":true}}
{"run":884,"commit":"8b55918","metric":98.4514247077955,"metrics":{},"status":"discard","description":"Mirror follow-up after control 94.98 sample (rebound into high-90s).","timestamp":1776295725833,"segment":23,"confidence":4.095420725928318,"iterationTokens":652,"asi":{"hypothesis":"Recovered regime should climb from low-90s back toward high-90s/100.","rollback_reason":"High-90 rebound still below keep by ~8.41 tok/s.","next_action_hint":"With 98+ restored, run one structural candidate test plus immediate parity checks.","backend":"mirror_sd_mlx","context_only_draft_cache":1,"draft_sink":48,"paired_control_tok_s":94.98059002286608,"paired_delta_tok_s":3.4708346849294216,"delta_vs_keep":-8.4085752922045}}
{"run":885,"commit":"8b55918","metric":100.2507157124406,"metrics":{},"status":"discard","description":"Mirror recovery monitoring sample crossing back above 100 tok/s.","timestamp":1776295772367,"segment":23,"confidence":4.072893213853826,"iterationTokens":1291,"asi":{"hypothesis":"Rebound should continue from high-90 into 100+ before returning to prior local medians.","rollback_reason":"100+ restored but still below keep by ~6.61 tok/s.","next_action_hint":"Take paired control sample to confirm shared 100+ re-entry; then test one structural candidate.","backend":"mirror_sd_mlx","context_only_draft_cache":1,"draft_sink":48,"stability_probe":true,"delta_vs_keep":-6.609284287559397}}
{"run":886,"commit":"8b55918","metric":103.5225720314024,"metrics":{},"status":"discard","description":"Control parity sample after mirror re-entered 100+ band (mirror disabled).","timestamp":1776295809126,"segment":23,"confidence":4.064675302478134,"iterationTokens":723,"asi":{"hypothesis":"Control should also re-enter 100+ if recovery is shared, possibly slightly ahead during rebound.","rollback_reason":"Control at ~103.52 still below keep.","next_action_hint":"Return to mirror and then run one structural candidate while in restored 100+ regime.","backend":"bstnxbt_mlx","mirror_runtime_enabled":0,"context_only_draft_cache":1,"draft_sink":48,"paired_mirror_tok_s":100.2507157124406,"paired_delta_tok_s":-3.2718563189617926,"shared_recovery":true}}
{"run":887,"commit":"8b55918","metric":100.54192408291344,"metrics":{},"status":"discard","description":"Mirror follow-up after control 103.52 sample (100+ band maintained).","timestamp":1776295841564,"segment":23,"confidence":3.9723300444797123,"iterationTokens":675,"asi":{"hypothesis":"Mirror should stay around 100+ while recovery stabilizes.","rollback_reason":"Still well below keep despite maintaining ~100.54.","next_action_hint":"Proceed with one structural experiment in this restored band, then immediate parity checks.","backend":"mirror_sd_mlx","context_only_draft_cache":1,"draft_sink":48,"paired_control_tok_s":103.5225720314024,"paired_delta_tok_s":-2.9806479484889636,"delta_vs_keep":-6.318075917086563}}
{"run":888,"commit":"8b55918","metric":103.65434018083324,"metrics":{},"status":"discard","description":"Structural allocator trim: reuse preallocated block-token buffer per request instead of per-step mx.full allocations.","timestamp":1776295896328,"segment":23,"confidence":3.928383369021717,"iterationTokens":1631,"asi":{"hypothesis":"Reusing a fixed block-token buffer should reduce per-step allocation overhead in speculative loop.","rollback_reason":"No win; landed at ~103.65, below keep.","next_action_hint":"Mark block-token buffer reuse as non-winning in current regime; continue pursuing higher-leverage acceptance/algorithmic ideas.","backend":"mirror_sd_mlx","optimization":"block_token_buffer_reuse","delta_vs_keep":-3.205659819166762}}
{"run":889,"commit":"8b55918","metric":105.48776534435832,"metrics":{},"status":"discard","description":"Control parity sample after block-buffer structural attempt (mirror disabled).","timestamp":1776295946964,"segment":23,"confidence":3.999656751775554,"iterationTokens":934,"asi":{"hypothesis":"If structural result was regime-limited, control should land in similar or higher restored band.","rollback_reason":"Control recovered to ~105.49 but still below keep.","next_action_hint":"Run mirror follow-up to complete parity cycle in restored high-100/105 regime.","backend":"bstnxbt_mlx","mirror_runtime_enabled":0,"context_only_draft_cache":1,"draft_sink":48,"paired_mirror_tok_s":103.65434018083324,"paired_delta_tok_s":-1.8334251635250802}}
{"run":890,"commit":"8b55918","metric":104.48788786305705,"metrics":{},"status":"discard","description":"Mirror follow-up after control recovery to 105.49.","timestamp":1776295976232,"segment":23,"confidence":4.073564176652795,"iterationTokens":651,"asi":{"hypothesis":"Mirror should rejoin restored ~105 band after control rebound.","rollback_reason":"Mirror remained lower at ~104.49 and below keep.","next_action_hint":"Continue paired monitoring and only trust improvements with immediate confirmations.","backend":"mirror_sd_mlx","context_only_draft_cache":1,"draft_sink":48,"paired_control_tok_s":105.48776534435832,"paired_delta_tok_s":-0.9998774813012735,"delta_vs_keep":-2.372112136942952}}
{"run":891,"commit":"8b55918","metric":105.29398950725182,"metrics":{},"status":"discard","description":"Recheck near-keep block-size candidate in restored regime: DFLASH_BLOCK_TOKENS=22.","timestamp":1776296012615,"segment":23,"confidence":4.102765030917205,"iterationTokens":904,"asi":{"hypothesis":"Previously near-keep block=22 might improve in post-collapse recovered regime.","rollback_reason":"Still below keep at ~105.29.","next_action_hint":"Keep block=22 in do-not-retry; near-keep historical spike does not reproduce as winner.","backend":"mirror_sd_mlx","context_only_draft_cache":1,"draft_sink":48,"block_tokens":22,"recheck":true,"delta_vs_keep":-1.5660104927481808}}
{"run":892,"commit":"8b55918","metric":105.2832818173023,"metrics":{},"status":"discard","description":"Sink extension above prior neighborhood: DFLASH_DRAFT_SINK=64.","timestamp":1776296051342,"segment":23,"confidence":4.123874818963675,"iterationTokens":993,"asi":{"hypothesis":"Larger sink might improve long-range draft cache anchoring and acceptance.","rollback_reason":"No improvement; ~105.28 remains below keep.","next_action_hint":"Add sink=64 to do-not-retry set for context-only draft-cache mode.","backend":"mirror_sd_mlx","context_only_draft_cache":1,"draft_sink":64,"delta_vs_keep":-1.5767181826977001}}
{"run":893,"commit":"8b55918","metric":105.18815267584615,"metrics":{},"status":"discard","description":"Mirror anchor after sink=64 probe (restored keep shape).","timestamp":1776296096624,"segment":23,"confidence":4.156468941905962,"iterationTokens":867,"asi":{"hypothesis":"Reverting sink override should return to restored ~105 regime.","rollback_reason":"Anchor at ~105.19 still below keep.","next_action_hint":"Proceed with structural exploration in current restored 105 band.","backend":"mirror_sd_mlx","context_only_draft_cache":1,"draft_sink":48,"stability_probe":true,"delta_vs_keep":-1.6718473241538492}}
{"run":894,"commit":"8b55918","metric":105.05237011941021,"metrics":{},"status":"discard","description":"Draft-window extension probe beyond prior sweep: DFLASH_DRAFT_WINDOW=4096.","timestamp":1776296125979,"segment":23,"confidence":4.189582401911315,"iterationTokens":644,"asi":{"hypothesis":"Larger draft window could improve context-only draft cache hit behavior at 1024 decode length.","rollback_reason":"No improvement; ~105.05 remains below keep.","next_action_hint":"Add draft_window=4096 to do-not-retry set for context-only mode.","backend":"mirror_sd_mlx","context_only_draft_cache":1,"draft_sink":48,"draft_window":4096,"delta_vs_keep":-1.8076298805897886}}
