{"run":1906,"commit":"c50119f","metric":8.920103539247066,"metrics":{},"status":"discard","description":"High-soft re-entry sample (~106.24 tok/s, eval_s ~8.92) with watchdog idle.","timestamp":1776386522409,"segment":24,"confidence":0.07693240353692765,"iterationTokens":1412,"asi":{"hypothesis":"Recovery has returned to high-soft band after collapse cycle.","rollback_reason":"Primary metric above best floor.","next_action_hint":"Continue unchanged loop for near-best retest.","diagnostic_findings":{"completion_tok_s":106.24381627799765,"dflash_eval_s":8.920103539247066,"safe_mode_activations":0}}}
{"run":1907,"commit":"c50119f","metric":8.786684879334643,"metrics":{},"status":"discard","description":"Near-best high-window retest (~107.94 tok/s, eval_s ~8.787) with watchdog inactive.","timestamp":1776386551273,"segment":24,"confidence":0.07751532728477545,"iterationTokens":1402,"asi":{"hypothesis":"High-soft floor remains reproducible after collapse/recovery cycle.","rollback_reason":"Primary metric above current best floor.","next_action_hint":"Continue unchanged loop to test whether new floor can be beaten again.","diagnostic_findings":{"completion_tok_s":107.93535826244496,"dflash_eval_s":8.786684879334643,"safe_mode_activations":0}}}
{"run":1908,"commit":"c50119f","metric":8.796132215298712,"metrics":{},"status":"discard","description":"Another near-best high-window run (~107.85 tok/s, eval_s ~8.796) with watchdog inactive.","timestamp":1776386579377,"segment":24,"confidence":0.07940565081820125,"iterationTokens":1451,"asi":{"hypothesis":"Recovered regime can sustain near-best throughput with stable telemetry.","rollback_reason":"Primary metric above best floor.","next_action_hint":"Continue unchanged loop for additional floor retests.","diagnostic_findings":{"completion_tok_s":107.84742416958488,"dflash_eval_s":8.796132215298712,"safe_mode_activations":0}}}
{"run":1909,"commit":"3a712da","metric":8.775649875635281,"metrics":{},"status":"keep","description":"Unchanged loop produced another local-best telemetry sample (~108.07 tok/s, eval_s ~8.776) after full collapse/recovery cycle, with watchdog inactive.","timestamp":1776386613065,"segment":24,"confidence":0.08113531481785782,"iterationTokens":1425,"asi":{"hypothesis":"Post-recovery high-window performance can return to (or slightly surpass) prior local floor without additional tuning.","diagnostic_findings":{"completion_tok_s":108.07208170096077,"dflash_eval_s":8.775649875635281,"safe_mode_activations":0,"spike_events":0},"next_action_hint":"Continue unchanged loop and watch for repeatability or next transition edge."}}
{"run":1910,"commit":"2b7a082","metric":8.756666628294624,"metrics":{},"status":"keep","description":"Follow-up run achieved a stronger local best (~108.46 tok/s, eval_s ~8.757) with stable watchdog-idle telemetry.","timestamp":1776386645391,"segment":24,"confidence":0.08145757352379054,"iterationTokens":1717,"asi":{"hypothesis":"Recovered high-window can produce repeat low-eval samples without intervention.","diagnostic_findings":{"completion_tok_s":108.45685772858708,"dflash_eval_s":8.756666628294624,"safe_mode_activations":0,"spike_events":0},"next_action_hint":"Keep looping unchanged for repeatability and transition tracking."}}
{"run":1911,"commit":"81d8869","metric":8.740623873425648,"metrics":{},"status":"keep","description":"Another improved local-best run (~108.55 tok/s, eval_s ~8.741) in stable high window, watchdog still inactive.","timestamp":1776386674399,"segment":24,"confidence":0.08188437534867153,"iterationTokens":1505,"asi":{"hypothesis":"Current regime supports repeat near-peak throughput with unchanged settings.","diagnostic_findings":{"completion_tok_s":108.54531086979914,"dflash_eval_s":8.740623873425648,"safe_mode_activations":0},"next_action_hint":"Continue unchanged loop to check if this level is repeatable or followed by another collapse edge."}}
{"run":1912,"commit":"81d8869","metric":8.748481709510088,"metrics":{},"status":"discard","description":"Near-best confirmation stayed high (~108.57 tok/s, eval_s ~8.748) with no collapse activity, but above latest floor.","timestamp":1776386699463,"segment":24,"confidence":0.08331283669693595,"iterationTokens":1489,"asi":{"hypothesis":"High-window performance remains stable with tight jitter around current local best.","rollback_reason":"Primary metric above current best floor.","next_action_hint":"Continue unchanged loop and monitor transition risk.","diagnostic_findings":{"completion_tok_s":108.57388907148412,"dflash_eval_s":8.748481709510088,"safe_mode_activations":0}}}
{"run":1913,"commit":"81d8869","metric":8.750068123219535,"metrics":{},"status":"discard","description":"High-window sample remained near best (~108.53 tok/s, eval_s ~8.750) with watchdog idle.","timestamp":1776386727263,"segment":24,"confidence":0.08435760958947472,"iterationTokens":1443,"asi":{"hypothesis":"Current performance is stable around a narrow high-window band.","rollback_reason":"Primary metric above latest floor.","next_action_hint":"Continue unchanged loop for repeatability and edge detection.","diagnostic_findings":{"completion_tok_s":108.5293453636589,"dflash_eval_s":8.750068123219535,"safe_mode_activations":0}}}
{"run":1914,"commit":"81d8869","metric":8.747963749803603,"metrics":{},"status":"discard","description":"Near-best high-window repeat (~108.51 tok/s, eval_s ~8.748) with stable watchdog-idle telemetry.","timestamp":1776386755679,"segment":24,"confidence":0.08416191599367207,"iterationTokens":1405,"asi":{"hypothesis":"High-window throughput remains reproducible across consecutive runs.","rollback_reason":"Primary metric above best known floor.","next_action_hint":"Continue unchanged loop; prioritize transition capture and true floor improvements.","diagnostic_findings":{"completion_tok_s":108.50822694852437,"dflash_eval_s":8.747963749803603,"safe_mode_activations":0}}}
{"run":1915,"commit":"81d8869","metric":8.747673709876835,"metrics":{},"status":"discard","description":"Another near-best high sample (~108.49 tok/s, eval_s ~8.748) with no collapse activity.","timestamp":1776386783207,"segment":24,"confidence":0.08396712824026695,"iterationTokens":1597,"asi":{"hypothesis":"Current high window is stable and repeatable around ~8.75 eval_s.","rollback_reason":"Primary metric above best known floor.","next_action_hint":"Continue unchanged loop until a true floor improvement or a new transition edge appears.","diagnostic_findings":{"completion_tok_s":108.49007546899179,"dflash_eval_s":8.747673709876835,"safe_mode_activations":0}}}
{"run":1916,"commit":"81d8869","metric":8.742296624230221,"metrics":{},"status":"discard","description":"Sustained high-window sample (~108.47 tok/s, eval_s ~8.742) with watchdog idle; still narrowly above best known floor.","timestamp":1776386810826,"segment":24,"confidence":0.08418781801631894,"iterationTokens":1429,"asi":{"hypothesis":"Performance remains tightly clustered near the current local optimum.","rollback_reason":"Primary metric above best known floor.","next_action_hint":"Continue unchanged loop for potential new floor break or next collapse transition.","diagnostic_findings":{"completion_tok_s":108.46847299971945,"dflash_eval_s":8.742296624230221,"safe_mode_activations":0}}}
{"run":1917,"commit":"81d8869","metric":8.760217127390206,"metrics":{},"status":"discard","description":"High-window remained stable (~108.31 tok/s, eval_s ~8.760) with no collapse triggers.","timestamp":1776386842171,"segment":24,"confidence":0.08440967092188778,"iterationTokens":1436,"asi":{"hypothesis":"Recovered regime is now in a tight stable band near local best.","rollback_reason":"Primary metric above best known floor.","next_action_hint":"Continue unchanged loop and guard for transition edge.","diagnostic_findings":{"completion_tok_s":108.31438896295028,"dflash_eval_s":8.760217127390206,"safe_mode_activations":0}}}
{"run":1918,"commit":"e299525","metric":8.731937211123295,"metrics":{},"status":"keep","description":"New best telemetry floor in unchanged high window (~108.66 tok/s, eval_s ~8.7319) with watchdog inactive.","timestamp":1776386868795,"segment":24,"confidence":0.08641763096561124,"iterationTokens":1408,"asi":{"hypothesis":"Steady unchanged looping can still uncover marginally better eval-time lows within the stable high regime.","diagnostic_findings":{"completion_tok_s":108.65995238274418,"dflash_eval_s":8.731937211123295,"safe_mode_activations":0,"spike_events":0},"next_action_hint":"Continue unchanged loop for repeatability and collapse-edge detection."}}
{"run":1919,"commit":"e299525","metric":8.748192788800225,"metrics":{},"status":"discard","description":"Confirmation run remained in high window (~108.57 tok/s, eval_s ~8.748) with watchdog idle, above new best floor.","timestamp":1776386894888,"segment":24,"confidence":0.08711037852461086,"iterationTokens":1529,"asi":{"hypothesis":"The new floor is likely real but still within tight jitter band.","rollback_reason":"Primary metric above best known floor.","next_action_hint":"Continue unchanged loop for confidence accumulation.","diagnostic_findings":{"completion_tok_s":108.56612574915513,"dflash_eval_s":8.748192788800225,"safe_mode_activations":0}}}
{"run":1920,"commit":"e299525","metric":8.741818994400091,"metrics":{},"status":"discard","description":"High-window run stayed near optimum (~108.56 tok/s, eval_s ~8.742), watchdog inactive.","timestamp":1776386923272,"segment":24,"confidence":0.08731864439584315,"iterationTokens":1425,"asi":{"hypothesis":"Performance remains tightly clustered in a stable near-best band.","rollback_reason":"Primary metric above best known floor.","next_action_hint":"Continue unchanged loop for floor break or collapse transition.","diagnostic_findings":{"completion_tok_s":108.55742893421598,"dflash_eval_s":8.741818994400091,"safe_mode_activations":0}}}
{"run":1921,"commit":"e299525","metric":8.734505165950395,"metrics":{},"status":"discard","description":"High-window sample near current best (~108.58 tok/s, eval_s ~8.7345) with watchdog idle.","timestamp":1776386987464,"segment":24,"confidence":0.08810739809504213,"iterationTokens":3186,"asi":{"hypothesis":"Current regime remains tightly clustered around the new floor.","rollback_reason":"Primary metric above best known floor.","next_action_hint":"Continue unchanged loop and monitor for next transition.","diagnostic_findings":{"completion_tok_s":108.58301262853348,"dflash_eval_s":8.734505165950395,"safe_mode_activations":0}}}
{"run":1922,"commit":"e299525","metric":8.74434887606185,"metrics":{},"status":"discard","description":"High-window near-best repeat (~108.57 tok/s, eval_s ~8.744) with no collapse events.","timestamp":1776387018603,"segment":24,"confidence":0.0885734282418236,"iterationTokens":1458,"asi":{"hypothesis":"Recovered state is stable with low jitter around the local optimum.","rollback_reason":"Primary metric above best known floor.","next_action_hint":"Continue unchanged loop until interrupted or transition occurs.","diagnostic_findings":{"completion_tok_s":108.56931996688466,"dflash_eval_s":8.74434887606185,"safe_mode_activations":0}}}
{"run":1923,"commit":"e299525","metric":9.009211088065058,"metrics":{},"status":"discard","description":"Loop sample: soft-high band run (~104.93 tok/s, eval_s ~9.009) with watchdog idle.","timestamp":1776388128611,"segment":24,"confidence":0.08910214828347773,"iterationTokens":1458,"asi":{"hypothesis":"Continue unchanged mirror loop to track regime stability and capture transitions.","rollback_reason":"Primary metric above best known floor.","next_action_hint":"Keep unchanged loop running and watch for either new low floor or collapse edge.","diagnostic_findings":{"completion_tok_s":104.93419580293971,"dflash_eval_s":9.009211088065058,"safe_mode_activations":0,"spike_events":0}}}
{"run":1924,"commit":"e299525","metric":8.845087875961326,"metrics":{},"status":"discard","description":"Loop sample: high-window run (~106.72 tok/s, eval_s ~8.845) with stable no-activation telemetry.","timestamp":1776388158300,"segment":24,"confidence":0.08928806377200978,"iterationTokens":1474,"asi":{"hypothesis":"Continue unchanged loop to validate high-window stability over time.","rollback_reason":"Primary metric above best known floor.","next_action_hint":"Keep loop running; transition-check only on new hard degradation.","diagnostic_findings":{"completion_tok_s":106.71661643484819,"dflash_eval_s":8.845087875961326,"safe_mode_activations":0}}}
{"run":1925,"commit":"e299525","metric":8.892788708093576,"metrics":{},"status":"discard","description":"Loop sample: high-window but softer run (~106.10 tok/s, eval_s ~8.893), watchdog idle.","timestamp":1776388188308,"segment":24,"confidence":0.08947475672417897,"iterationTokens":1424,"asi":{"hypothesis":"High regime remains stable with small jitter and no collapse signals.","rollback_reason":"Primary metric above best known floor.","next_action_hint":"Continue unchanged loop and monitor for floor improvement.","diagnostic_findings":{"completion_tok_s":106.1014201041012,"dflash_eval_s":8.892788708093576,"safe_mode_activations":0}}}
{"run":1926,"commit":"e299525","metric":9.209080290282145,"metrics":{},"status":"discard","description":"Loop sample: soft-band drift (~102.53 tok/s, eval_s ~9.209) without collapse triggers.","timestamp":1776388215172,"segment":24,"confidence":0.09019398074699425,"iterationTokens":1403,"asi":{"hypothesis":"Regime may wobble within high-soft/soft boundary while remaining activation-free.","rollback_reason":"Primary metric above best known floor.","next_action_hint":"Continue unchanged loop and watch for transition edge.","diagnostic_findings":{"completion_tok_s":102.52921671044528,"dflash_eval_s":9.209080290282145,"safe_mode_activations":0,"eval_step_max_s":0.11275841598398983}}}
{"run":1927,"commit":"e299525","metric":19.77775170619134,"metrics":{},"status":"discard","description":"Hard collapse transition: throughput dropped (~40.69 tok/s, eval_s ~19.78) and watchdog activated early at step 7.","timestamp":1776388259622,"segment":24,"confidence":0.08947475672417897,"iterationTokens":1432,"asi":{"hypothesis":"Collapse episodes recur abruptly even after stable high-window stretches.","rollback_reason":"Primary metric catastrophically above best floor.","next_action_hint":"Run immediate control parity check (DFLASH_MIRROR_SD_RUNTIME=0) to confirm shared attribution for this transition.","diagnostic_findings":{"completion_tok_s":40.68968223189121,"dflash_eval_s":19.77775170619134,"safe_mode_activations":1,"safe_mode_step":7,"severe_spike_events":30}}}
{"run":1928,"commit":"e299525","metric":28.067988961818628,"metrics":{},"status":"discard","description":"Immediate control parity check also hard-collapsed (~29.11 tok/s, eval_s ~28.07), confirming shared instability in this transition.","timestamp":1776388315884,"segment":24,"confidence":0.08928806377200978,"iterationTokens":1505,"asi":{"hypothesis":"Transition collapse is shared runtime behavior, not mirror-only.","rollback_reason":"Parity diagnostic non-authoritative lane; metric far above best.","next_action_hint":"Resume unchanged mirror loop to observe recovery ladder.","parity_check":{"lane":"control_DFLASH_MIRROR_SD_RUNTIME=0","completion_tok_s":29.107950610982147,"dflash_eval_s":28.067988961818628,"safe_mode_step":29,"severe_spike_events":77}}}
{"run":1929,"commit":"e299525","metric":25.223990166094154,"metrics":{},"status":"discard","description":"Post-parity mirror remained in deep collapse (~32.36 tok/s, eval_s ~25.22) with safe-mode activation at step 25.","timestamp":1776388366604,"segment":24,"confidence":0.08910214828347773,"iterationTokens":1448,"asi":{"hypothesis":"Shared collapse episode persists across immediate follow-up runs.","rollback_reason":"Primary metric catastrophically above best floor.","next_action_hint":"Continue unchanged mirror loop to track rebound progression.","diagnostic_findings":{"completion_tok_s":32.361878744930635,"dflash_eval_s":25.223990166094154,"safe_mode_step":25,"severe_spike_events":76}}}
{"run":1930,"commit":"e299525","metric":19.081912667490542,"metrics":{},"status":"discard","description":"Collapse rebound stage improved but still degraded (~43.20 tok/s, eval_s ~19.08); safe mode activated at step 30.","timestamp":1776388408069,"segment":24,"confidence":0.0885734282418236,"iterationTokens":1422,"asi":{"hypothesis":"Recovery is occurring in stages with activation moving later as eval pressure eases.","rollback_reason":"Primary metric still far above best floor.","next_action_hint":"Continue unchanged loop to observe further rebound.","diagnostic_findings":{"completion_tok_s":43.20496816617179,"dflash_eval_s":19.081912667490542,"safe_mode_step":30,"severe_spike_events":50}}}
{"run":1931,"commit":"e299525","metric":14.536104212282225,"metrics":{},"status":"discard","description":"Rebound advanced (~59.10 tok/s, eval_s ~14.54) with late safe-mode activation at step 54.","timestamp":1776388445941,"segment":24,"confidence":0.08805094589233221,"iterationTokens":1419,"asi":{"hypothesis":"Collapse intensity is reducing as recovery progresses through staged rebound.","rollback_reason":"Primary metric above best floor.","next_action_hint":"Continue unchanged loop for activation-free recovery.","diagnostic_findings":{"completion_tok_s":59.10033888927227,"dflash_eval_s":14.536104212282225,"safe_mode_step":54,"severe_spike_events":2}}}
{"run":1932,"commit":"e299525","metric":12.233672999660484,"metrics":{},"status":"discard","description":"Rebound continued (~73.55 tok/s, eval_s ~12.23) with very-late safe-mode activation (step 80).","timestamp":1776388479549,"segment":24,"confidence":0.08720798547061613,"iterationTokens":1405,"asi":{"hypothesis":"Recovery is approaching activation-free behavior as triggers move to request tail.","rollback_reason":"Primary metric above best floor.","next_action_hint":"Continue unchanged loop toward soft/high band re-entry.","diagnostic_findings":{"completion_tok_s":73.54653657314208,"dflash_eval_s":12.233672999660484,"safe_mode_step":80,"severe_spike_events":10}}}
{"run":1933,"commit":"e299525","metric":11.659609793685377,"metrics":{},"status":"discard","description":"Rebound climbed further (~76.89 tok/s, eval_s ~11.66) with safe mode only activating near tail (step 76).","timestamp":1776388512956,"segment":24,"confidence":0.08640404091436675,"iterationTokens":1422,"asi":{"hypothesis":"Collapse wave is fading as activation is pushed later and spike count shrinks.","rollback_reason":"Primary metric above best floor.","next_action_hint":"Continue unchanged loop until safe-mode deactivates entirely.","diagnostic_findings":{"completion_tok_s":76.88812147592607,"dflash_eval_s":11.659609793685377,"safe_mode_step":76,"severe_spike_events":2}}}
{"run":1934,"commit":"e299525","metric":14.002967407228425,"metrics":{},"status":"discard","description":"Recovery whipsaw sample regressed (~61.21 tok/s, eval_s ~14.00) with safe-mode activation at step 57.","timestamp":1776388550425,"segment":24,"confidence":0.08567238394367005,"iterationTokens":1428,"asi":{"hypothesis":"Rebound path remains non-monotonic with intermittent re-degradation before full recovery.","rollback_reason":"Primary metric above best floor.","next_action_hint":"Continue unchanged mirror loop to ride out whipsaw and capture stabilization.","diagnostic_findings":{"completion_tok_s":61.214088791968884,"dflash_eval_s":14.002967407228425,"safe_mode_step":57,"severe_spike_events":9}}}
{"run":1935,"commit":"e299525","metric":12.744147500605322,"metrics":{},"status":"discard","description":"Rebound resumed upward (~69.88 tok/s, eval_s ~12.74) with tail-end safe-mode activation at step 74.","timestamp":1776388583690,"segment":24,"confidence":0.08490053045100268,"iterationTokens":1453,"asi":{"hypothesis":"Recovery remains active; late activation indicates reduced collapse severity.","rollback_reason":"Primary metric above best floor.","next_action_hint":"Continue unchanged loop toward activation-free recovery.","diagnostic_findings":{"completion_tok_s":69.88438953453928,"dflash_eval_s":12.744147500605322,"safe_mode_step":74,"severe_spike_events":2}}}
{"run":1936,"commit":"e299525","metric":10.953790451632813,"metrics":{},"status":"discard","description":"Rebound entered near-soft range (~83.85 tok/s, eval_s ~10.95) with activation only at late tail (step 83).","timestamp":1776388614728,"segment":24,"confidence":0.08461956433926314,"iterationTokens":1407,"asi":{"hypothesis":"Collapse wave is nearing completion as safe mode triggers only at the very end.","rollback_reason":"Primary metric above best floor.","next_action_hint":"Continue unchanged loop; expect activation-free samples soon.","diagnostic_findings":{"completion_tok_s":83.84624563443876,"dflash_eval_s":10.953790451632813,"safe_mode_step":83,"severe_spike_events":2}}}
{"run":1937,"commit":"e299525","metric":12.831275708507746,"metrics":{},"status":"discard","description":"Loop sample entered degraded band (~63.07 tok/s, eval_s ~12.83) with early safe-mode activation at step 10.","timestamp":1776388695962,"segment":24,"confidence":0.08434045172761766,"iterationTokens":11384,"asi":{"hypothesis":"Keep unchanged loop to map recurrent collapse/rebound behavior and trigger timing.","rollback_reason":"Primary metric above best floor.","next_action_hint":"Continue mirror loop; run parity check only if a new hard transition deepens sharply.","diagnostic_findings":{"completion_tok_s":63.07388742340345,"dflash_eval_s":12.831275708507746,"safe_mode_step":10,"severe_spike_events":2}}}
