{"run":1199,"commit":"db2e923","metric":106.89841491485289,"metrics":{},"status":"discard","description":"Mirror follow-up sample remained in high-106 band.","timestamp":1776317782306,"segment":23,"confidence":3.035562538219421,"iterationTokens":603,"asi":{"hypothesis":"Regime center may be slightly below 107 right now.","rollback_reason":"~106.90 below keep.","next_action_hint":"Take control parity sample to verify shared center before any new exploration.","backend":"mirror_sd_mlx","context_only_draft_cache":1,"draft_sink":48,"async_draft_eval":1,"fused_draft_verify_eval":1,"paired_prev_tok_s":106.95853022376471,"paired_delta_tok_s":-0.06011530891181856,"delta_vs_keep":-1.4166953649598173}}
{"run":1200,"commit":"db2e923","metric":106.96320217858238,"metrics":{},"status":"discard","description":"Control parity sample for mirror high-106 regime (`DFLASH_MIRROR_SD_RUNTIME=0`).","timestamp":1776317823098,"segment":23,"confidence":3.0401895050527004,"iterationTokens":745,"asi":{"hypothesis":"Control should match mirror if current regime center is shared.","rollback_reason":"Control ~106.96 nearly matches mirror ~106.90; parity backend remains non-authoritative.","next_action_hint":"Re-enable mirror runtime and continue scanning for next >108.32 window.","backend":"bstnxbt_mlx","mirror_runtime_enabled":0,"context_only_draft_cache":1,"draft_sink":48,"async_draft_eval":1,"fused_draft_verify_eval":1,"paired_mirror_tok_s":106.89841491485289,"paired_delta_tok_s":-0.0647872637294916,"authoritative_lane":"mirror_sd_mlx"}}
{"run":1201,"commit":"db2e923","metric":107.00385746768245,"metrics":{},"status":"discard","description":"Mirror anchor after control parity check; slight uptick to ~107.00.","timestamp":1776317853274,"segment":23,"confidence":3.06824256108318,"iterationTokens":722,"asi":{"hypothesis":"Mirror should hover around ~107 while waiting for next high-window breakout.","rollback_reason":"~107.00 below keep 108.315.","next_action_hint":"Continue mirror sampling; hold code constant in this shared regime.","backend":"mirror_sd_mlx","context_only_draft_cache":1,"draft_sink":48,"async_draft_eval":1,"fused_draft_verify_eval":1,"paired_control_tok_s":106.96320217858238,"paired_delta_tok_s":0.040655289100072704,"delta_vs_keep":-1.3112528121302582}}
{"run":1202,"commit":"db2e923","metric":106.86220641566378,"metrics":{},"status":"discard","description":"Mirror follow-up dipped slightly within shared high-106/107 regime.","timestamp":1776317884719,"segment":23,"confidence":3.055688335616056,"iterationTokens":670,"asi":{"hypothesis":"Current window still centered just below 107.","rollback_reason":"~106.86 below keep.","next_action_hint":"Continue mirror-only sampling; if band persists, wait for next spontaneous high-window shift.","backend":"mirror_sd_mlx","context_only_draft_cache":1,"draft_sink":48,"async_draft_eval":1,"fused_draft_verify_eval":1,"paired_prev_tok_s":107.00385746768245,"paired_delta_tok_s":-0.1416510520186738,"delta_vs_keep":-1.4529038641489256}}
{"run":1203,"commit":"db2e923","metric":107.04948659178298,"metrics":{},"status":"discard","description":"Mirror sample rebounded to ~107.05 from high-106 dip.","timestamp":1776317928336,"segment":23,"confidence":3.070061749965061,"iterationTokens":1367,"asi":{"hypothesis":"Small oscillations around 107 persist without configuration changes.","rollback_reason":"Still below keep 108.315.","next_action_hint":"Continue mirror-only sampling; trigger parity check if sustained shift >0.5 tok/s appears.","backend":"mirror_sd_mlx","context_only_draft_cache":1,"draft_sink":48,"async_draft_eval":1,"fused_draft_verify_eval":1,"delta_vs_keep":-1.265623688029734}}
{"run":1204,"commit":"db2e923","metric":107.00218958701575,"metrics":{},"status":"discard","description":"Mirror continuity sample remained near 107.00.","timestamp":1776317967813,"segment":23,"confidence":3.076459005960955,"iterationTokens":608,"asi":{"hypothesis":"Regime remains locked near ~107 with low short-term variance.","rollback_reason":"Below keep.","next_action_hint":"Continue scans for occasional high-window breakouts; no code change yet.","backend":"mirror_sd_mlx","context_only_draft_cache":1,"draft_sink":48,"async_draft_eval":1,"fused_draft_verify_eval":1,"paired_prev_tok_s":107.04948659178298,"paired_delta_tok_s":-0.04729700476723493,"delta_vs_keep":-1.3129206927969632}}
{"run":1205,"commit":"db2e923","metric":107.02526820609732,"metrics":{},"status":"discard","description":"Mirror sample held steady in ~107.0 cluster.","timestamp":1776318003518,"segment":23,"confidence":3.0647117289706483,"iterationTokens":643,"asi":{"hypothesis":"Current local median is stable around 107.0 under combo defaults.","rollback_reason":"No improvement vs keep.","next_action_hint":"Take control parity check now to confirm shared median before deciding on next major bet.","backend":"mirror_sd_mlx","context_only_draft_cache":1,"draft_sink":48,"async_draft_eval":1,"fused_draft_verify_eval":1,"delta_vs_keep":-1.2898420737153937,"steady_cluster":true}}
{"run":1206,"commit":"db2e923","metric":107.03125022402739,"metrics":{},"status":"discard","description":"Control parity check for mirror ~107.0 steady cluster (`DFLASH_MIRROR_SD_RUNTIME=0`).","timestamp":1776318051657,"segment":23,"confidence":3.062651179835294,"iterationTokens":697,"asi":{"hypothesis":"Control should match mirror if the ~107 plateau is shared.","rollback_reason":"Control ~107.03 effectively matched mirror ~107.03; parity backend remains non-authoritative.","next_action_hint":"Restore mirror runtime and continue high-band monitoring; no evidence yet for new code bet.","backend":"bstnxbt_mlx","mirror_runtime_enabled":0,"context_only_draft_cache":1,"draft_sink":48,"async_draft_eval":1,"fused_draft_verify_eval":1,"paired_mirror_tok_s":107.02526820609732,"paired_delta_tok_s":-0.005982017930065494,"authoritative_lane":"mirror_sd_mlx","shared_plateau":true}}
{"run":1207,"commit":"db2e923","metric":106.67742284046736,"metrics":{},"status":"discard","description":"Mirror sample dipped from ~107 plateau into high-106.","timestamp":1776318114855,"segment":23,"confidence":3.0675068242234933,"iterationTokens":2368,"asi":{"hypothesis":"Current plateau may be broad (106.6–107.1) with no immediate >108 window.","rollback_reason":"Below keep by ~1.64 tok/s.","next_action_hint":"Continue monitoring; if dip persists, run control parity to confirm shared downward drift.","backend":"mirror_sd_mlx","context_only_draft_cache":1,"draft_sink":48,"async_draft_eval":1,"fused_draft_verify_eval":1,"delta_vs_keep":-1.6376874393453507,"downward_drift":true}}
{"run":1208,"commit":"db2e923","metric":107.01500888192722,"metrics":{},"status":"discard","description":"Mirror rebound from high-106 dip back to ~107.0.","timestamp":1776318149622,"segment":23,"confidence":3.073780368378679,"iterationTokens":638,"asi":{"hypothesis":"Dip was transient and regime remains near ~107 center.","rollback_reason":"Still below best 108.315.","next_action_hint":"Take control parity sample to validate shared ~107 center after rebound.","backend":"mirror_sd_mlx","context_only_draft_cache":1,"draft_sink":48,"async_draft_eval":1,"fused_draft_verify_eval":1,"paired_prev_tok_s":106.67742284046736,"paired_delta_tok_s":0.3375860414598606,"delta_vs_keep":-1.300101397885496}}
{"run":1209,"commit":"db2e923","metric":106.90809289187078,"metrics":{},"status":"discard","description":"Control parity sample after mirror rebound to ~107.0 (`DFLASH_MIRROR_SD_RUNTIME=0`).","timestamp":1776318190580,"segment":23,"confidence":3.0834752261337686,"iterationTokens":740,"asi":{"hypothesis":"Control should remain near mirror in current ~107 regime.","rollback_reason":"Control ~106.91 matches mirror ~107.02; parity backend remains non-authoritative.","next_action_hint":"Restore mirror runtime and continue sampling for next high-window breakout.","backend":"bstnxbt_mlx","mirror_runtime_enabled":0,"context_only_draft_cache":1,"draft_sink":48,"async_draft_eval":1,"fused_draft_verify_eval":1,"paired_mirror_tok_s":107.01500888192722,"paired_delta_tok_s":0.10691599005643602,"authoritative_lane":"mirror_sd_mlx","shared_plateau":true}}
{"run":1210,"commit":"db2e923","metric":106.92292155920502,"metrics":{},"status":"discard","description":"Mirror anchor after control parity sample; stayed near ~106.9.","timestamp":1776318224708,"segment":23,"confidence":3.093231433525849,"iterationTokens":821,"asi":{"hypothesis":"Shared plateau remains around high-106/low-107.","rollback_reason":"Below keep.","next_action_hint":"Keep scanning for spontaneous high-window shift; no config changes.","backend":"mirror_sd_mlx","context_only_draft_cache":1,"draft_sink":48,"async_draft_eval":1,"fused_draft_verify_eval":1,"paired_control_tok_s":106.90809289187078,"paired_delta_tok_s":0.01482866733424574,"delta_vs_keep":-1.392188720607694}}
{"run":1211,"commit":"db2e923","metric":106.77512172784769,"metrics":{},"status":"discard","description":"Mirror sample drifted slightly lower within shared ~107 plateau.","timestamp":1776318258186,"segment":23,"confidence":3.1132869650438715,"iterationTokens":640,"asi":{"hypothesis":"Plateau variability spans roughly 106.7–107.1 in current regime.","rollback_reason":"Still below keep.","next_action_hint":"Continue monitoring; if this lower center persists, pause parity checks and wait for regime shift.","backend":"mirror_sd_mlx","context_only_draft_cache":1,"draft_sink":48,"async_draft_eval":1,"fused_draft_verify_eval":1,"paired_prev_tok_s":106.92292155920502,"paired_delta_tok_s":-0.14779983135732733,"delta_vs_keep":-1.5399885529650197}}
{"run":1212,"commit":"db2e923","metric":106.97594694421664,"metrics":{},"status":"discard","description":"Mirror sample rebounded back toward ~107 after brief dip.","timestamp":1776318292674,"segment":23,"confidence":3.120937461064448,"iterationTokens":666,"asi":{"hypothesis":"Regime remains stable around ~107 with bounded jitter.","rollback_reason":"Below keep 108.315.","next_action_hint":"Continue autonomous loop; pursue next structural candidate only when sustained high-window returns.","backend":"mirror_sd_mlx","context_only_draft_cache":1,"draft_sink":48,"async_draft_eval":1,"fused_draft_verify_eval":1,"paired_prev_tok_s":106.77512172784769,"paired_delta_tok_s":0.2008252163689566,"delta_vs_keep":-1.3391633365960713}}
{"run":1213,"commit":"db2e923","metric":107.32283681504119,"metrics":{},"status":"discard","description":"Mirror recovery sample climbed from ~107.0 cluster into low-107.3.","timestamp":1776318386160,"segment":23,"confidence":3.130015390839205,"iterationTokens":666,"asi":{"hypothesis":"Current regime may be rebounding from ~107.0 toward prior high-107/108 windows.","rollback_reason":"Still below keep 108.315.","next_action_hint":"Continue mirror sampling and confirm whether this is sustained uplift or jitter.","backend":"mirror_sd_mlx","context_only_draft_cache":1,"draft_sink":48,"async_draft_eval":1,"fused_draft_verify_eval":1,"delta_vs_keep":-0.9922734647715172,"rebound_hint":true}}
{"run":1214,"commit":"db2e923","metric":108.03417393108029,"metrics":{},"status":"discard","description":"Mirror follow-up jumped back into >108 band.","timestamp":1776318419169,"segment":23,"confidence":3.139146284964175,"iterationTokens":632,"asi":{"hypothesis":"A renewed high-band window may be opening under unchanged combo defaults.","rollback_reason":"Above 108 but still below keep 108.315.","next_action_hint":"Run immediate mirror follow-up and then control parity to verify window stability.","backend":"mirror_sd_mlx","context_only_draft_cache":1,"draft_sink":48,"async_draft_eval":1,"fused_draft_verify_eval":1,"paired_prev_tok_s":107.32283681504119,"paired_delta_tok_s":0.7113371160391007,"delta_vs_keep":-0.28113634873241344,"high_band_reentry":true}}
{"run":1215,"commit":"376d1cc","metric":108.31592853569666,"metrics":{},"status":"keep","description":"Mirror high-band follow-up produced a marginal new best under unchanged combo defaults.","timestamp":1776318454291,"segment":23,"confidence":3.1273748049545342,"iterationTokens":678,"asi":{"hypothesis":"If the >108 window is real, immediate follow-up should match or exceed the prior ~108.03 sample.","backend":"mirror_sd_mlx","context_only_draft_cache":1,"draft_sink":48,"async_draft_eval":1,"fused_draft_verify_eval":1,"paired_prev_tok_s":108.03417393108029,"paired_delta_tok_s":0.2817546046163656,"delta_vs_keep":0.0008182558839465844,"near_tie_break":true}}
{"run":1216,"commit":"376d1cc","metric":108.39788582386612,"metrics":{},"status":"discard","description":"Control parity check after marginal mirror keep (`DFLASH_MIRROR_SD_RUNTIME=0`) in same high-band window.","timestamp":1776318496507,"segment":23,"confidence":3.1253298606717377,"iterationTokens":899,"asi":{"hypothesis":"Control parity run quantifies whether mirror-side gain reflects a shared regime shift.","rollback_reason":"Control hit ~108.40, but parity backend remains non-authoritative for the active mirror objective.","next_action_hint":"Re-enable mirror runtime immediately and test whether mirror also sustains >108.3 in this window.","backend":"bstnxbt_mlx","mirror_runtime_enabled":0,"context_only_draft_cache":1,"draft_sink":48,"async_draft_eval":1,"fused_draft_verify_eval":1,"paired_mirror_tok_s":108.31592853569666,"paired_delta_tok_s":-0.08195728816945454,"authoritative_lane":"mirror_sd_mlx"}}
{"run":1217,"commit":"366dfde","metric":108.4714694943864,"metrics":{},"status":"keep","description":"Mirror anchor after control parity detour; clear new best in same high-band window.","timestamp":1776318545390,"segment":23,"confidence":3.1680486787186926,"iterationTokens":1160,"asi":{"hypothesis":"If high-band uplift is shared and stable, mirror should also improve after control-side >108 sample.","backend":"mirror_sd_mlx","context_only_draft_cache":1,"draft_sink":48,"async_draft_eval":1,"fused_draft_verify_eval":1,"paired_control_tok_s":108.39788582386612,"paired_delta_tok_s":0.07358367052028073,"delta_vs_keep":0.1555409586897402,"breakout_followthrough":true}}
{"run":1218,"commit":"366dfde","metric":108.23711104413313,"metrics":{},"status":"discard","description":"Immediate mirror follow-up after new 108.47 keep remained in >108 band.","timestamp":1776318579588,"segment":23,"confidence":3.177297753149583,"iterationTokens":754,"asi":{"hypothesis":"Post-keep follow-up should stay in high-108 window if uplift is stable.","rollback_reason":"Strong at ~108.24 but below new keep 108.47.","next_action_hint":"Take control parity sample to verify shared >108 window before additional structural bets.","backend":"mirror_sd_mlx","context_only_draft_cache":1,"draft_sink":48,"async_draft_eval":1,"fused_draft_verify_eval":1,"paired_keep_tok_s":108.4714694943864,"paired_delta_tok_s":-0.2343584502532702,"delta_vs_keep":-0.2343584502532702,"high_band_stable":true}}
{"run":1219,"commit":"366dfde","metric":108.42116725715563,"metrics":{},"status":"discard","description":"Control parity check in sustained >108 window (`DFLASH_MIRROR_SD_RUNTIME=0`).","timestamp":1776318630632,"segment":23,"confidence":3.1863323035262296,"iterationTokens":802,"asi":{"hypothesis":"Control should remain near mirror when high-band window is shared.","rollback_reason":"Control ~108.42 is strong but parity backend remains non-authoritative for mirror objective.","next_action_hint":"Re-enable mirror runtime and continue mirror-side scans for >108.47 confirmations.","backend":"bstnxbt_mlx","mirror_runtime_enabled":0,"context_only_draft_cache":1,"draft_sink":48,"async_draft_eval":1,"fused_draft_verify_eval":1,"paired_mirror_tok_s":108.23711104413313,"paired_delta_tok_s":-0.1840562130224984,"authoritative_lane":"mirror_sd_mlx"}}
{"run":1220,"commit":"366dfde","metric":108.23167126668656,"metrics":{},"status":"discard","description":"Mirror anchor after control parity detour; held >108 but below latest best.","timestamp":1776318673695,"segment":23,"confidence":3.195418379357236,"iterationTokens":1108,"asi":{"hypothesis":"Mirror should stay within the >108 band while this high-window persists.","rollback_reason":"~108.23 remains below keep 108.47.","next_action_hint":"Continue mirror scans; watch for >108.47 breakout and immediate confirmation.","backend":"mirror_sd_mlx","context_only_draft_cache":1,"draft_sink":48,"async_draft_eval":1,"fused_draft_verify_eval":1,"paired_control_tok_s":108.42116725715563,"paired_delta_tok_s":-0.18949599046907217,"delta_vs_keep":-0.23979822769984557,"high_band_stable":true}}
{"run":1221,"commit":"366dfde","metric":108.44177617203852,"metrics":{},"status":"discard","description":"Mirror sample approached best, holding near top of current high-window.","timestamp":1776318703863,"segment":23,"confidence":3.219401595469223,"iterationTokens":688,"asi":{"hypothesis":"If high-window remains active, mirror should repeatedly land near 108.4+.","rollback_reason":"~108.44 is close but still below keep 108.47.","next_action_hint":"Run another mirror sample to attempt a clean >108.47 exceedance in same window.","backend":"mirror_sd_mlx","context_only_draft_cache":1,"draft_sink":48,"async_draft_eval":1,"fused_draft_verify_eval":1,"paired_prev_tok_s":108.23167126668656,"paired_delta_tok_s":0.21010490535196524,"delta_vs_keep":-0.02969332234788906,"near_best":true}}
{"run":1222,"commit":"366dfde","metric":108.4248059538062,"metrics":{},"status":"discard","description":"Mirror follow-up remained in the 108.4 high-window cluster.","timestamp":1776318737372,"segment":23,"confidence":3.235287160868207,"iterationTokens":721,"asi":{"hypothesis":"Current window is stable around low/mid-108 with minor jitter.","rollback_reason":"~108.42 still below keep 108.47.","next_action_hint":"Take a control parity sample to validate shared high-window, then continue mirror scans.","backend":"mirror_sd_mlx","context_only_draft_cache":1,"draft_sink":48,"async_draft_eval":1,"fused_draft_verify_eval":1,"paired_prev_tok_s":108.44177617203852,"paired_delta_tok_s":-0.0169702182323267,"delta_vs_keep":-0.04666354058021576,"high_window_cluster":true}}
{"run":1223,"commit":"366dfde","metric":108.28323574432876,"metrics":{},"status":"discard","description":"Control parity sample during mirror 108.4 high-window cluster (`DFLASH_MIRROR_SD_RUNTIME=0`).","timestamp":1776318785960,"segment":23,"confidence":3.24133753180099,"iterationTokens":785,"asi":{"hypothesis":"Control should remain in same high window if uplift is shared.","rollback_reason":"Control ~108.28 confirms shared high window but parity backend is non-authoritative.","next_action_hint":"Restore mirror runtime and continue mirror scans for >108.47 confirmations.","backend":"bstnxbt_mlx","mirror_runtime_enabled":0,"context_only_draft_cache":1,"draft_sink":48,"async_draft_eval":1,"fused_draft_verify_eval":1,"paired_mirror_tok_s":108.4248059538062,"paired_delta_tok_s":0.1415702094774482,"authoritative_lane":"mirror_sd_mlx","shared_high_window":true}}
{"run":1224,"commit":"366dfde","metric":108.4041418055336,"metrics":{},"status":"discard","description":"Mirror anchor after control high-window parity; remained in low/mid-108 band.","timestamp":1776318821967,"segment":23,"confidence":3.2724335383289618,"iterationTokens":714,"asi":{"hypothesis":"Mirror should stay near 108.3-108.4 while shared high-window persists.","rollback_reason":"~108.40 still below keep 108.47.","next_action_hint":"Continue mirror scans for clean >108.47; avoid code churn during stable high window.","backend":"mirror_sd_mlx","context_only_draft_cache":1,"draft_sink":48,"async_draft_eval":1,"fused_draft_verify_eval":1,"paired_control_tok_s":108.28323574432876,"paired_delta_tok_s":0.12090606120484707,"delta_vs_keep":-0.0673276888528007}}
{"run":1225,"commit":"366dfde","metric":108.26482893464207,"metrics":{},"status":"discard","description":"Mirror follow-up remained in >108 band with minor dip.","timestamp":1776318858337,"segment":23,"confidence":3.277493849859726,"iterationTokens":711,"asi":{"hypothesis":"Window remains stable but with normal jitter around low/mid-108.","rollback_reason":"Still below keep 108.47.","next_action_hint":"Continue mirror-only scans for >108.47 breakout.","backend":"mirror_sd_mlx","context_only_draft_cache":1,"draft_sink":48,"async_draft_eval":1,"fused_draft_verify_eval":1,"paired_prev_tok_s":108.4041418055336,"paired_delta_tok_s":-0.13931287089152844,"delta_vs_keep":-0.2066405597443323}}
{"run":1226,"commit":"366dfde","metric":108.33419702584764,"metrics":{},"status":"discard","description":"Mirror sample returned to low-108.33 after prior dip.","timestamp":1776318899740,"segment":23,"confidence":3.2888284224285576,"iterationTokens":661,"asi":{"hypothesis":"Regime still supports repeated 108.3-class samples without code changes.","rollback_reason":"Still below keep 108.47.","next_action_hint":"Maintain mirror scans; watch for sustained upshift or a fresh instability break.","backend":"mirror_sd_mlx","context_only_draft_cache":1,"draft_sink":48,"async_draft_eval":1,"fused_draft_verify_eval":1,"paired_prev_tok_s":108.26482893464207,"paired_delta_tok_s":0.06936809120557268,"delta_vs_keep":-0.1372724685387608}}
{"run":1227,"commit":"366dfde","metric":108.29828086024239,"metrics":{},"status":"discard","description":"Mirror continuity sample stayed near 108.30 despite warmup variance.","timestamp":1776318936706,"segment":23,"confidence":3.3202806146615735,"iterationTokens":695,"asi":{"hypothesis":"High window remains stable even with occasional warmup fluctuations.","rollback_reason":"Still below keep.","next_action_hint":"Continue loop and avoid structural changes while current high-window remains intact.","backend":"mirror_sd_mlx","context_only_draft_cache":1,"draft_sink":48,"async_draft_eval":1,"fused_draft_verify_eval":1,"warmup_s":2.1733305000234395,"delta_vs_keep":-0.17318863414400118}}
