{"run":2442,"commit":"26f9501","metric":86.44985573343787,"metrics":{},"status":"discard","description":"Control improved to ~86.45 tok/s with fused-only/safe_mode=0 and eval_s ~11.10, still elevated versus historical floor but continuing toward healthy regime.","timestamp":1776479897036,"segment":25,"confidence":3.0077406739773402,"iterationTokens":4067,"asi":{"hypothesis":"If shelf recovery continues, control should keep trending upward as fused wait compresses toward floor values.","rollback_reason":"No code changes; monitoring sample.","next_action_hint":"Run another control sample; if trend holds toward ~10 eval_s, take matched DDTree/control pair for regime confirmation.","diagnostic_findings":{"completion_tok_s":86.44985573343787,"dflash_eval_s":11.096374496817589,"safe_mode_active":0,"verify_eval_wait_fused_steps":96,"verify_eval_wait_unfused_steps":0}}}
{"run":2443,"commit":"26f9501","metric":85.72486528217898,"metrics":{},"status":"discard","description":"Control remained near upper-shelf recovery (~85.7 tok/s, fused-only, safe_mode=0) with eval_s ~11.18; healthy trend but still above floor.","timestamp":1776479927007,"segment":25,"confidence":3.090292072578389,"iterationTokens":4074,"asi":{"hypothesis":"Upper shelf can stabilize around mid-80 tok/s before final return to ~9s eval floor.","rollback_reason":"No code changes; monitoring sample.","next_action_hint":"Take one more control sample; if stable or improving, run a matched DDTree sample for shelf parity tracking.","diagnostic_findings":{"completion_tok_s":85.72486528217898,"dflash_eval_s":11.182438334915787,"safe_mode_active":0,"verify_eval_wait_fused_steps":96,"verify_eval_wait_unfused_steps":0}}}
{"run":2444,"commit":"26f9501","metric":86.2522150168603,"metrics":{},"status":"discard","description":"Follow-up control held near ~86.3 tok/s with fused-only/safe_mode=0 and eval_s ~11.12; plateau persists above historical floor.","timestamp":1776479955490,"segment":25,"confidence":3.114781281547451,"iterationTokens":4097,"asi":{"hypothesis":"Recovery has reached a provisional upper shelf near mid-80s before any true floor re-entry.","rollback_reason":"No code changes; monitoring run.","next_action_hint":"Take matched DDTree sample to track shelf parity, but avoid optimization conclusions until floor regime returns.","diagnostic_findings":{"completion_tok_s":86.2522150168603,"dflash_eval_s":11.121997540583834,"safe_mode_active":0,"verify_eval_wait_fused_steps":96,"verify_eval_wait_unfused_steps":0}}}
{"run":2445,"commit":"26f9501","metric":79.92971778608754,"metrics":{},"status":"discard","description":"Matched DDTree baseline in upper recovery shelf came in at ~79.9 tok/s (tree_build ~2.58s), still trailing control shelf (~86 tok/s) but much closer than collapse windows.","timestamp":1776479986315,"segment":25,"confidence":3.1055616090358606,"iterationTokens":4111,"asi":{"hypothesis":"In fused-only recovery shelves, DDTree should remain behind control but with compressed gap relative to high-window floors.","rollback_reason":"No code changes; parity attribution run in non-floor regime.","next_action_hint":"Continue control monitoring for floor re-entry before trying new DDTree optimization variants.","diagnostic_findings":{"completion_tok_s":79.92971778608754,"dflash_ddtree_tree_build_s":2.575260125,"dflash_ddtree_cycles_completed":98,"dflash_ddtree_avg_acceptance":10.448979591836734}}}
{"run":2446,"commit":"26f9501","metric":81.98250346089684,"metrics":{},"status":"discard","description":"Control slipped from high-80 shelf to ~82.0 tok/s while remaining fused-only and safe-mode idle; still in inflated non-floor regime.","timestamp":1776480018207,"segment":25,"confidence":3.0641520240916673,"iterationTokens":1633,"asi":{"hypothesis":"Upper-shelf recovery remains noisy and can wobble several tok/s run-to-run before floor re-entry.","rollback_reason":"No code changes; monitoring-only run.","next_action_hint":"Continue passive control sampling; resume variant probing only when floor-like timing is restored.","diagnostic_findings":{"completion_tok_s":81.98250346089684,"dflash_eval_s":11.713057334301993,"safe_mode_active":0,"verify_eval_wait_fused_steps":96,"verify_eval_wait_unfused_steps":0}}}
{"run":2447,"commit":"26f9501","metric":85.6032618186408,"metrics":{},"status":"discard","description":"Control remained in the same fused-only upper shelf (~85.6 tok/s, eval_s ~11.22); no return to high-window floor yet.","timestamp":1776480063997,"segment":25,"confidence":3.132214502245309,"iterationTokens":4767,"asi":{"hypothesis":"Current regime is stuck in an elevated fused-wait shelf with limited short-run variance around mid/high-80 tok/s.","rollback_reason":"No code changes; monitoring sample.","next_action_hint":"Continue passive monitoring and avoid variant keeps/discards based on this shelf behavior.","diagnostic_findings":{"completion_tok_s":85.6032618186408,"dflash_eval_s":11.219986951793544,"safe_mode_active":0,"verify_eval_wait_fused_steps":96,"verify_eval_wait_unfused_steps":0}}}
{"run":2448,"commit":"26f9501","metric":83.63944948466532,"metrics":{},"status":"discard","description":"Control dipped to ~83.6 tok/s but stayed fused-only with safe_mode=0; still in elevated shelf around eval_s ~11.47.","timestamp":1776480097209,"segment":25,"confidence":3.123473372052989,"iterationTokens":4153,"asi":{"hypothesis":"Upper-shelf runs can oscillate in low/mid-80s without indicating a real regime change.","rollback_reason":"No code changes; monitoring-only sample.","next_action_hint":"Continue passive monitoring and wait for eval floor (~9s) before evaluating new optimization variants.","diagnostic_findings":{"completion_tok_s":83.63944948466532,"dflash_eval_s":11.473632871755399,"safe_mode_active":0,"verify_eval_wait_fused_steps":96,"verify_eval_wait_unfused_steps":0}}}
{"run":2449,"commit":"26f9501","metric":87.2840360729171,"metrics":{},"status":"discard","description":"Control reached ~87.3 tok/s with fused-only/safe_mode=0 and improved eval_s ~11.00, indicating continued rebound but still not at historical floor.","timestamp":1776480126477,"segment":25,"confidence":3.138418377347872,"iterationTokens":4118,"asi":{"hypothesis":"Rebound should continue to tighten eval wait toward floor before restoring full high-window throughput.","rollback_reason":"No code changes; monitoring-only run.","next_action_hint":"Continue monitoring for further eval_s contraction; defer fresh optimization edits until floor regime returns.","diagnostic_findings":{"completion_tok_s":87.2840360729171,"dflash_eval_s":11.000813210033812,"safe_mode_active":0,"verify_eval_wait_fused_steps":96,"verify_eval_wait_unfused_steps":0}}}
{"run":2450,"commit":"26f9501","metric":86.23142463859634,"metrics":{},"status":"discard","description":"Control stayed around ~86.2 tok/s in fused-only/safe_mode=0 shelf with eval_s ~11.12; still not back to historical floor zone.","timestamp":1776480156155,"segment":25,"confidence":3.155259675611511,"iterationTokens":4095,"asi":{"hypothesis":"The regime can hover near mid-80 tok/s with stable acceptance while fused wait remains elevated.","rollback_reason":"No code changes; monitoring-only run.","next_action_hint":"Continue passive parity monitoring and avoid variant attribution until eval floor recovery.","diagnostic_findings":{"completion_tok_s":86.23142463859634,"dflash_eval_s":11.117923162179068,"safe_mode_active":0,"verify_eval_wait_fused_steps":96,"verify_eval_wait_unfused_steps":0}}}
{"run":2451,"commit":"26f9501","metric":85.77419512722635,"metrics":{},"status":"discard","description":"Control continues fused-only upper-shelf behavior (~85.8 tok/s, eval_s ~11.19) with stable acceptance and no safe-mode events.","timestamp":1776480189365,"segment":25,"confidence":3.1631327960238407,"iterationTokens":4211,"asi":{"hypothesis":"Upper-shelf state can persist for many runs with minimal structural telemetry change.","rollback_reason":"No code changes; monitoring-only run.","next_action_hint":"Keep passive monitoring and wait for near-floor eval before restarting optimization probes.","diagnostic_findings":{"completion_tok_s":85.77419512722635,"dflash_eval_s":11.186140915611759,"safe_mode_active":0,"verify_eval_wait_fused_steps":96,"verify_eval_wait_unfused_steps":0}}}
{"run":2452,"commit":"26f9501","metric":84.97594134190162,"metrics":{},"status":"discard","description":"Control remains in fused-only upper shelf (~85.0 tok/s, eval_s ~11.30) with stable acceptance and no safe-mode/collapse events.","timestamp":1776480221304,"segment":25,"confidence":3.1670156693213456,"iterationTokens":4172,"asi":{"hypothesis":"Without floor re-entry, repeated control runs should cluster in a narrow upper-shelf band around mid-80 tok/s.","rollback_reason":"No code changes; monitoring run.","next_action_hint":"Continue passive sampling; hold off on new optimization probes until eval_s returns near historical ~9s floor.","diagnostic_findings":{"completion_tok_s":84.97594134190162,"dflash_eval_s":11.297352168359794,"safe_mode_active":0,"verify_eval_wait_fused_steps":96,"verify_eval_wait_unfused_steps":0}}}
{"run":2453,"commit":"26f9501","metric":79.97625028391914,"metrics":{},"status":"discard","description":"Matched DDTree shelf sample stayed near prior level (~80.0 tok/s, tree_build ~2.57s), maintaining the compressed but still real gap vs control upper shelf.","timestamp":1776480257296,"segment":25,"confidence":3.189281187442783,"iterationTokens":4275,"asi":{"hypothesis":"DDTree shelf performance should remain near ~80 tok/s with stable cycles/acceptance while control shelf remains mid-80s.","rollback_reason":"No code changes; parity tracking in non-floor regime.","next_action_hint":"Continue control monitoring for floor re-entry; defer fresh DDTree optimization until baseline regime normalizes.","diagnostic_findings":{"completion_tok_s":79.97625028391914,"dflash_ddtree_tree_build_s":2.569298546,"dflash_ddtree_cycles_completed":98,"dflash_ddtree_avg_acceptance":10.448979591836734}}}
{"run":2454,"commit":"26f9501","metric":84.36098887128495,"metrics":{},"status":"discard","description":"Control remains in fused-only non-floor shelf (~84.4 tok/s, eval_s ~11.39), with stable acceptance and no collapse triggers.","timestamp":1776480287785,"segment":25,"confidence":3.1897363070643636,"iterationTokens":1624,"asi":{"hypothesis":"Absent a regime shift, control should continue clustering in the low/mid-80 band with elevated fused wait.","rollback_reason":"No code changes; monitoring-only run.","next_action_hint":"Continue passive monitoring and wait for clear floor re-entry before any new optimization probe.","diagnostic_findings":{"completion_tok_s":84.36098887128495,"dflash_eval_s":11.386562039842829,"safe_mode_active":0,"verify_eval_wait_fused_steps":96,"verify_eval_wait_unfused_steps":0}}}
{"run":2455,"commit":"26f9501","metric":83.5011451185214,"metrics":{},"status":"discard","description":"Control dipped again to ~83.5 tok/s while staying fused-only and safe_mode=0; still consistent with persistent non-floor upper shelf.","timestamp":1776480322395,"segment":25,"confidence":3.211284646947579,"iterationTokens":4312,"asi":{"hypothesis":"Upper-shelf behavior remains noisy around low/mid-80 tok/s without structural telemetry changes.","rollback_reason":"No code changes; monitoring-only sample.","next_action_hint":"Continue passive monitoring until true floor regime returns before pursuing new optimization edits.","diagnostic_findings":{"completion_tok_s":83.5011451185214,"dflash_eval_s":11.499746131245047,"safe_mode_active":0,"verify_eval_wait_fused_steps":96,"verify_eval_wait_unfused_steps":0}}}
{"run":2456,"commit":"26f9501","metric":106.49236861084512,"metrics":{},"status":"discard","description":"Control abruptly re-entered near-floor high window (~106.5 tok/s, eval_s ~8.87) with fused-only/safe_mode=0, indicating the inflated shelf has cleared.","timestamp":1776480536780,"segment":25,"confidence":3.1897363070643636,"iterationTokens":4312,"asi":{"hypothesis":"If the shared shelf self-resolves, control should recover to near-floor eval (~8.8–9.0) without code changes.","rollback_reason":"No code changes; monitoring/parity run only.","next_action_hint":"Immediately run matched DDTree baseline in this recovered floor window, then follow with a control parity run for attribution.","diagnostic_findings":{"completion_tok_s":106.49236861084512,"dflash_eval_s":8.87238763354253,"safe_mode_active":0,"verify_eval_wait_fused_steps":96,"verify_eval_wait_unfused_steps":0}}}
{"run":2457,"commit":"26f9501","metric":101.519170189002,"metrics":{},"status":"discard","description":"Matched DDTree baseline in recovered floor window delivered ~101.5 tok/s (tree_build ~1.97s), improving sharply vs shelf but still trailing no-DDTree control (~106.5).","timestamp":1776480564401,"segment":25,"confidence":3.2205724467708383,"iterationTokens":4531,"asi":{"hypothesis":"When floor returns, DDTree should rebound into its prior ~101–103 band while retaining a real gap vs control.","rollback_reason":"No code changes; parity-attribution run only.","next_action_hint":"Run immediate control parity sample to confirm window persistence, then gate any new DDTree variant tests on sustained floor behavior.","diagnostic_findings":{"completion_tok_s":101.519170189002,"dflash_ddtree_tree_build_s":1.9746911710000001,"dflash_ddtree_cycles_completed":98,"dflash_ddtree_avg_acceptance":10.448979591836734}}}
{"run":2458,"commit":"26f9501","metric":106.37877172507591,"metrics":{},"status":"discard","description":"Immediate control parity held in the near-floor high window (~106.4 tok/s, eval_s ~8.90), confirming stable attribution conditions after the DDTree check.","timestamp":1776480588647,"segment":25,"confidence":3.2107769261786894,"iterationTokens":1669,"asi":{"hypothesis":"If floor recovery is real, immediate control follow-up should remain fused-only near ~8.8–9.0 eval.","rollback_reason":"No code changes; control parity validation run.","next_action_hint":"With stable floor confirmed, run one lightweight DDTree variant A/B from non-stale code-level search space, bracketed by control/DDTree baselines.","diagnostic_findings":{"completion_tok_s":106.37877172507591,"dflash_eval_s":8.899011491797864,"safe_mode_active":0,"verify_eval_wait_fused_steps":96,"verify_eval_wait_unfused_steps":0}}}
{"run":2459,"commit":"26f9501","metric":51.286744797538574,"metrics":{},"status":"discard","description":"DDTree per-cycle top-k config/cast micro-trim variant regressed catastrophically (~51.3 tok/s; tree_build ~4.13s), far below recovered-floor DDTree baseline (~101.5).","timestamp":1776480841207,"segment":25,"confidence":3.189281187442783,"iterationTokens":1507,"asi":{"hypothesis":"Caching top-k env flags once per request and removing redundant per-cycle casts/int coercions would trim native DDTree tree-build overhead.","rollback_reason":"Primary metric collapsed severely and tree_build time roughly doubled; variant is non-viable.","next_action_hint":"Revert this micro-trim and re-establish post-revert DDTree/control parity to separate code impact from concurrent regime drift.","diagnostic_findings":{"completion_tok_s":51.286744797538574,"dflash_ddtree_tree_build_s":4.130349168,"dflash_ddtree_cycles_completed":98,"dflash_ddtree_avg_acceptance":10.448979591836734}}}
{"run":2460,"commit":"26f9501","metric":87.61474743131426,"metrics":{},"status":"discard","description":"Immediate control parity after the DDTree variant showed a concurrent drop to ~87.6 tok/s (fused-only, safe_mode=0, eval_s ~10.93), indicating a fresh shared shelf relapse.","timestamp":1776480848038,"segment":25,"confidence":3.2107769261786894,"iterationTokens":1507,"asi":{"hypothesis":"Part of the DDTree trough may coincide with a new shared regime downswing rather than code-only effects.","rollback_reason":"No code changes in control path; attribution sample after variant failure.","next_action_hint":"After revert, rerun baseline DDTree and control to confirm recovery and avoid over-attributing collapse-window deltas.","diagnostic_findings":{"completion_tok_s":87.61474743131426,"dflash_eval_s":10.933675958658569,"safe_mode_active":0,"verify_eval_wait_fused_steps":96,"verify_eval_wait_unfused_steps":0}}}
{"run":2461,"commit":"26f9501","metric":52.72783900508047,"metrics":{},"status":"discard","description":"Post-revert DDTree baseline remained severely degraded (~52.7 tok/s; tree_build ~3.99s), showing the trough persisted beyond the discarded code variant.","timestamp":1776480914770,"segment":25,"confidence":3.189281187442783,"iterationTokens":1256,"asi":{"hypothesis":"If the catastrophic DDTree result was mostly regime-driven, reverting code would not immediately restore ~101 tok/s.","rollback_reason":"No code retained; this is attribution follow-up after reverting the failed variant.","next_action_hint":"Run immediate no-DDTree control parity to confirm shared collapse depth and switch back to passive monitoring.","diagnostic_findings":{"completion_tok_s":52.72783900508047,"dflash_ddtree_tree_build_s":3.990293956,"dflash_ddtree_cycles_completed":98,"dflash_ddtree_avg_acceptance":10.448979591836734}}}
{"run":2462,"commit":"26f9501","metric":59.89859355278745,"metrics":{},"status":"discard","description":"Immediate control parity also collapsed (~59.9 tok/s) with safe mode reactivation, mixed fused/unfused execution, and inflated eval (~14.23s), confirming a shared instability wave.","timestamp":1776480922825,"segment":25,"confidence":3.180990460020673,"iterationTokens":1256,"asi":{"hypothesis":"Current trough is shared across DDTree and control, not a persistent regression from discarded code.","rollback_reason":"No code changes; parity-attribution run.","next_action_hint":"Pause new code probes and resume passive control monitoring until fused-only near-floor behavior returns.","diagnostic_findings":{"completion_tok_s":59.89859355278745,"dflash_eval_s":14.226980045554228,"safe_mode_active":1,"safe_mode_step":50,"verify_eval_wait_fused_steps":50,"verify_eval_wait_unfused_steps":53}}}
{"run":2463,"commit":"26f9501","metric":42.10809720079039,"metrics":{},"status":"discard","description":"Control deepened into severe shared trough (~42.1 tok/s): early safe-mode activation (step ~6), mostly unfused verify waits, and large eval inflation (~19.3s).","timestamp":1776480994436,"segment":25,"confidence":3.1789667328630307,"iterationTokens":8476,"asi":{"hypothesis":"After relapse, collapse can deepen into early-step safe-mode with high unfused share before rebound starts.","rollback_reason":"No code changes; monitoring-only run in instability wave.","next_action_hint":"Continue passive control monitoring through rebound ladder; defer all optimization A/B until fused-only near-floor regime returns.","diagnostic_findings":{"completion_tok_s":42.10809720079039,"dflash_eval_s":19.300041582086124,"safe_mode_active":1,"safe_mode_step":6,"verify_eval_wait_fused_steps":6,"verify_eval_wait_unfused_steps":100}}}
{"run":2464,"commit":"26f9501","metric":56.1036530713987,"metrics":{},"status":"discard","description":"Control partially rebounded to ~56.1 tok/s but remained in safe-mode mixed fused/unfused regime with inflated eval (~15.18s); trough recovery is incomplete.","timestamp":1776481033350,"segment":25,"confidence":3.154933097944751,"iterationTokens":4234,"asi":{"hypothesis":"After deep collapse, recovery should pass through mixed-mode safe-mode shelves before returning to fused-only timing.","rollback_reason":"No code changes; monitoring-only run.","next_action_hint":"Keep passive control loop; resume DDTree variant probing only after stable fused-only near-floor re-entry.","diagnostic_findings":{"completion_tok_s":56.1036530713987,"dflash_eval_s":15.17726162855979,"safe_mode_active":1,"safe_mode_step":53,"verify_eval_wait_fused_steps":53,"verify_eval_wait_unfused_steps":50}}}
{"run":2465,"commit":"26f9501","metric":64.1008939737758,"metrics":{},"status":"discard","description":"Control continued rebound to ~64.1 tok/s with later safe-mode trigger (step ~61), mixed fused/unfused waits, and still-inflated eval (~13.55s).","timestamp":1776481065535,"segment":25,"confidence":3.1069171523012873,"iterationTokens":4239,"asi":{"hypothesis":"Recovery ladder should improve tok/s while safe-mode activation drifts later before eventually clearing.","rollback_reason":"No code changes; monitoring-only run.","next_action_hint":"Continue passive monitoring until safe_mode clears and fused-only near-floor timing returns before any variant A/B.","diagnostic_findings":{"completion_tok_s":64.1008939737758,"dflash_eval_s":13.549267084337771,"safe_mode_active":1,"safe_mode_step":61,"verify_eval_wait_fused_steps":61,"verify_eval_wait_unfused_steps":41}}}
{"run":2466,"commit":"26f9501","metric":57.77884208040552,"metrics":{},"status":"discard","description":"Control stayed in the same mixed-mode rebound shelf (~57.8 tok/s) with safe_mode still active (step ~57) and eval remaining elevated (~14.87s).","timestamp":1776481104324,"segment":25,"confidence":3.0603408368265588,"iterationTokens":4240,"asi":{"hypothesis":"Rebound can wobble within mid-50/60 band before clearing safe mode and unfused share.","rollback_reason":"No code changes; monitoring-only run.","next_action_hint":"Continue passive monitoring for safe_mode clearance and fused-only re-entry before further DDTree comparisons.","diagnostic_findings":{"completion_tok_s":57.77884208040552,"dflash_eval_s":14.86643400695175,"safe_mode_active":1,"safe_mode_step":57,"verify_eval_wait_fused_steps":57,"verify_eval_wait_unfused_steps":46}}}
