{"run":271,"commit":"2fc35e5","metric":87.2900904346002,"metrics":{},"status":"discard","description":"Add mx.async_eval(draft_logits) before the blocking draft-logit eval in the bstnxbt loop, matching the external loop more closely in isolation. It remained in the high band but did not improve the authoritative workload.","timestamp":1776145528569,"segment":19,"confidence":19.3147211318025,"iterationTokens":1223,"asi":{"hypothesis":"Giving MLX a chance to start draft-logit evaluation asynchronously before the blocking eval may overlap a bit of work and recover a small throughput gain.","rollback_reason":"No primary-metric improvement over the current best 87.73 tok/s keep.","next_action_hint":"Stop spending more authority-lane runs on isolated async-eval overlap hints unless a profiler points to a specific stall they can hide.","learning":"The isolated async-eval hint is not enough to move the authoritative benchmark; earlier broader ports that included it were likewise not predictive of a keep."}}
{"run":272,"commit":"594b30a","metric":96.94800072316905,"metrics":{},"status":"keep","description":"Retune the authoritative normal-EOS thinking workload by overriding DFLASH_BLOCK_TOKENS=13. Despite earlier non-monotonic block-size behavior, this unexplored value produced a large new best on the honest settings-driven Qwen benchmark.","timestamp":1776145573306,"segment":19,"confidence":33.08220543543439,"iterationTokens":1299,"asi":{"hypothesis":"The normal-EOS thinking block-size neighborhood remains strongly non-monotonic, so an untested nearby value like 13 could still unlock a better acceptance/throughput point on the real server path.","learning":"The earlier assumption that larger-than-11 block sizes would necessarily regress on the current authoritative workload was too pessimistic. At least on the present kept server/runtime path, block size 13 is a major real win.","files":[".omlx-autoresearch/workload.env"]}}
{"run":273,"commit":"5980a90","metric":97.21426156609625,"metrics":{},"status":"keep","description":"Immediate confirmation rerun of the new authoritative normal-EOS thinking retune at DFLASH_BLOCK_TOKENS=13. The result repeated slightly higher, confirming the new block-size point is a real win on the honest server path.","timestamp":1776145603858,"segment":19,"confidence":25.006175855954012,"iterationTokens":770,"asi":{"hypothesis":"If DFLASH_BLOCK_TOKENS=13 is a real acceptance/throughput optimum rather than noise, an immediate rerun should remain in the same elevated band.","learning":"The 13-token block-size retune is robust on the authoritative workload, with back-to-back runs in the 96.9–97.2 tok/s band."}}
{"run":274,"commit":"00ed859","metric":101.80886758956423,"metrics":{},"status":"keep","description":"Continue the reopened authoritative normal-EOS thinking block-size sweep by increasing DFLASH_BLOCK_TOKENS from 13 to 14. The honest settings-driven server benchmark jumped again into the 100+ tok/s band.","timestamp":1776145637339,"segment":19,"confidence":25.324107215764254,"iterationTokens":838,"asi":{"hypothesis":"Since 13 unexpectedly beat the old 11 optimum by a large margin, the true normal-EOS thinking optimum may have shifted upward further on the current kept runtime path.","learning":"The authoritative normal-EOS thinking block-size neighborhood is even more non-monotonic than previously believed. On the current kept path, 14 beats both 13 and the old 11 default by a large margin.","files":[".omlx-autoresearch/workload.env"]}}
{"run":275,"commit":"00ed859","metric":45.31377724814807,"metrics":{},"status":"discard","description":"Immediate confirmation rerun of the new DFLASH_BLOCK_TOKENS=14 retune on the authoritative normal-EOS thinking workload. The first run looked exceptional, but the confirmation collapsed badly, so treat 14 as unstable/non-keep for now.","timestamp":1776145681031,"segment":19,"confidence":21.847659856711356,"iterationTokens":741,"asi":{"hypothesis":"If 14 were a real optimum, an immediate rerun would stay near the new 100+ tok/s band.","rollback_reason":"Confirmation collapsed to 45.31 tok/s, indicating the 14-token block-size point is unstable or shape-sensitive on the authoritative lane.","next_action_hint":"Fall back to the stable 13-token keep and continue exploring nearby values from there rather than trusting 14.","learning":"The reopened upper block-size neighborhood is extremely unstable: 14 can spike very high once, then collapse catastrophically on immediate rerun. It is not safe to keep without a stable confirmation."}}
{"run":276,"commit":"5980a90","metric":55.195349030921435,"metrics":{},"status":"discard","description":"Continue the reopened upper block-size sweep by overriding DFLASH_BLOCK_TOKENS=15 on the authoritative normal-EOS thinking workload. It regressed sharply, so 15 is not viable.","timestamp":1776145757067,"segment":19,"confidence":20.173148768246513,"iterationTokens":1558,"asi":{"hypothesis":"If the current stable optimum at 13 sits on a broader higher-band plateau, 15 might also perform well.","rollback_reason":"Primary metric collapsed to 55.20 tok/s, far below the current best and below the stable 13-token keep.","next_action_hint":"Restore/retain the stable 13-token override and explore the lower side of the reopened neighborhood instead, or verify whether 12 behaves differently on the current kept runtime path than older historical results suggested.","learning":"The reopened upper block-size neighborhood does not stay good indefinitely: 15 is clearly bad, and 14 is unstable. 13 remains the only stable keep found there so far."}}
{"run":277,"commit":"5980a90","metric":79.60198308840894,"metrics":{},"status":"discard","description":"Re-test DFLASH_BLOCK_TOKENS=12 on the current kept server/runtime path for the authoritative normal-EOS thinking workload. It stayed well below the new best, so 12 remains a non-keep here too.","timestamp":1776145815954,"segment":19,"confidence":18.73704997530739,"iterationTokens":1369,"asi":{"hypothesis":"The block-size landscape changed enough after the new keeps that 12 might deserve a fresh honest check on the current path.","rollback_reason":"Primary metric was materially below the current best and below the stable 13-token keep.","next_action_hint":"Return the workload override to the stable 13-token keep before further experiments, and explore only values or runtime changes with a stronger reason than 12.","learning":"Even on the current kept path, 12 is not competitive with 13 on the authoritative workload."}}
{"run":278,"commit":"ad9e696","metric":97.65882556569417,"metrics":{},"status":"keep","description":"Restore the stable DFLASH_BLOCK_TOKENS=13 override and re-test explicit request-level dflash=true on the authoritative workload by setting BENCHMARK_DFLASH=1. On top of the new 13-token baseline, the explicit request-level DFlash override now produces a small but real new best.","timestamp":1776145868085,"segment":19,"confidence":16.145194548859614,"iterationTokens":1115,"asi":{"hypothesis":"Although explicit request-level dflash=true previously regressed on the older baseline, the newly discovered 13-token optimum may have changed the request/path interaction enough that forcing DFlash again becomes beneficial.","learning":"The value of explicit request-level DFlash forcing is workload/path-state dependent. It was a regression on the older baseline, but on top of the new stable 13-token retune it becomes a small real win.","files":[".omlx-autoresearch/workload.env"]}}
{"run":279,"commit":"ad9e696","metric":97.63005271352539,"metrics":{},"status":"discard","description":"Immediate confirmation rerun of the new explicit-request DFlash + block-13 authoritative baseline. It stayed in the same elevated band but did not beat the new best, so record it as confirmation rather than a new improvement.","timestamp":1776145897553,"segment":19,"confidence":14.183255606645028,"iterationTokens":797,"asi":{"hypothesis":"If the explicit request-level DFlash override is a real win on top of the 13-token baseline, an immediate rerun should stay near the new 97.66 tok/s result.","rollback_reason":"No further primary-metric improvement over the newly kept 97.66 tok/s result.","next_action_hint":"Use the new explicit-request + block-13 baseline for further nearby tuning or runtime-path investigations.","learning":"The explicit-request DFlash win on top of the 13-token baseline appears stable in the ~97.6 tok/s band."}}
{"run":280,"commit":"a4f3582","metric":97.71913145469084,"metrics":{},"status":"keep","description":"Build on the new explicit-request DFlash + block-13 baseline by also sending explicit request-level enable_thinking=true (ENABLE_THINKING=1 while SETTINGS_ENABLE_THINKING remains 1). This produced a small additional best on the authoritative workload.","timestamp":1776145932558,"segment":19,"confidence":9.519468862513156,"iterationTokens":903,"asi":{"hypothesis":"Once explicit request-level dflash=true is back in play on top of the 13-token optimum, making the request shape fully explicit for thinking as well may tighten the path further.","learning":"On the new high-band baseline, explicit request-level thinking is slightly beneficial rather than neutral. The current fastest authority lane is now the fully explicit request shape on top of settings-driven defaults.","files":[".omlx-autoresearch/workload.env"]}}
{"run":281,"commit":"a4f3582","metric":97.6131053695158,"metrics":{},"status":"discard","description":"Immediate confirmation rerun of the new fully explicit request-shape baseline (BENCHMARK_DFLASH=1, ENABLE_THINKING=1, SETTINGS_ENABLE_THINKING=1, DFLASH_BLOCK_TOKENS=13). It stayed in the same high band but did not beat the new best.","timestamp":1776145961884,"segment":19,"confidence":7.16383279687157,"iterationTokens":763,"asi":{"hypothesis":"If the fully explicit request-shape lane is a real small win, an immediate rerun should remain near the new 97.72 tok/s result.","rollback_reason":"No further primary-metric improvement over the newly kept 97.72 tok/s result.","next_action_hint":"Use the new fully explicit block-13 baseline for further tuning and stop spending more reruns on simple confirmations.","learning":"The fully explicit request-shape baseline appears stable in the ~97.6–97.7 tok/s band."}}
{"run":282,"commit":"c194b1f","metric":102.16230280107179,"metrics":{},"status":"keep","description":"Retest DFLASH_BLOCK_TOKENS=14 on top of the new fully explicit request-shape baseline (explicit dflash + explicit thinking). On this lane, 14 jumps into the 102 tok/s band and beats the current best.","timestamp":1776145999757,"segment":19,"confidence":6.3970130517467325,"iterationTokens":917,"asi":{"hypothesis":"The earlier instability of 14 may have been tied to the older request shape; on the new fully explicit fast lane, 14 could become the true optimum.","learning":"The optimal/unstable block-size behavior depends on the exact request shape. After restoring explicit request-level dflash and thinking, block size 14 becomes a strong win again on the authoritative workload.","files":[".omlx-autoresearch/workload.env"]}}
{"run":283,"commit":"ed3db41","metric":102.2806129545587,"metrics":{},"status":"keep","description":"Immediate confirmation rerun of the new fully explicit request-shape retune at DFLASH_BLOCK_TOKENS=14. The result repeated slightly higher, confirming the 102 tok/s lane is real on the authoritative workload.","timestamp":1776146030254,"segment":19,"confidence":5.743335296559873,"iterationTokens":746,"asi":{"hypothesis":"If block size 14 is truly optimal on the fully explicit request-shape lane, an immediate rerun should stay in the same 102 tok/s band or better.","learning":"The fully explicit authoritative lane with DFLASH_BLOCK_TOKENS=14 is stable across back-to-back runs in the 102.1–102.3 tok/s band."}}
{"run":284,"commit":"063f905","metric":106.96350384945964,"metrics":{},"status":"keep","description":"Continue the fully explicit request-shape block-size sweep by increasing DFLASH_BLOCK_TOKENS from 14 to 15. The authoritative workload jumped again, now into the 106.96 tok/s band.","timestamp":1776146067228,"segment":19,"confidence":6.518509803277553,"iterationTokens":848,"asi":{"hypothesis":"With the fully explicit request shape active, the true optimum may continue to move upward beyond 14.","learning":"On the fully explicit authoritative lane, the speculative block-size optimum continues upward at least through 15, reaching a new 106.96 tok/s best.","files":[".omlx-autoresearch/workload.env"]}}
{"run":285,"commit":"5df52cb","metric":107.09621078129186,"metrics":{},"status":"keep","description":"Immediate confirmation rerun of the new fully explicit request-shape retune at DFLASH_BLOCK_TOKENS=15. The result repeated slightly higher, confirming the 107 tok/s lane is real on the authoritative workload.","timestamp":1776146099152,"segment":19,"confidence":6.345986529027036,"iterationTokens":698,"asi":{"hypothesis":"If 15 is the new true optimum on the fully explicit authoritative lane, an immediate rerun should remain in the same elevated band or better.","learning":"The fully explicit authoritative lane with DFLASH_BLOCK_TOKENS=15 is stable across back-to-back runs around 107 tok/s."}}
{"run":286,"commit":"5df52cb","metric":90.14497109921949,"metrics":{},"status":"discard","description":"Continue the fully explicit block-size sweep by increasing DFLASH_BLOCK_TOKENS from 15 to 16 on the authoritative workload. It regressed materially, so the current optimum does not extend to 16.","timestamp":1776146133217,"segment":19,"confidence":6.474699215527489,"iterationTokens":806,"asi":{"hypothesis":"If the fully explicit optimum continues upward past 15, 16 might yield another gain.","rollback_reason":"Primary metric regressed materially below the current best 107.10 tok/s keep.","next_action_hint":"Return to the kept 15-token baseline and explore other nearby levers rather than pushing block size higher.","learning":"On the fully explicit authoritative lane, the sweet spot now appears to peak at 15; 16 falls off sharply."}}
{"run":287,"commit":"5df52cb","metric":106.97299991959399,"metrics":{},"status":"discard","description":"Probe WARMUP_ENABLE_THINKING=1 on the new fully explicit 15-token authoritative baseline. It held the same high band but did not beat the current best.","timestamp":1776146186990,"segment":19,"confidence":6.330218188968051,"iterationTokens":1446,"asi":{"hypothesis":"Explicit thinking on the warmup request might better align compile/warmup shape with the new fully explicit measured request and recover a tiny gain.","rollback_reason":"No primary-metric improvement over the current best 107.10 tok/s keep.","next_action_hint":"Leave warmup-thinking behavior alone on the new lane and focus on other runtime or block-size-adjacent levers.","learning":"On the new fully explicit 15-token lane, explicit warmup thinking is essentially neutral."}}
{"run":288,"commit":"5df52cb","metric":107.06445478988138,"metrics":{},"status":"discard","description":"Probe the new explicit DFlash + block-15 fast lane with request-level thinking only again (SETTINGS_ENABLE_THINKING=0 while ENABLE_THINKING=1 and BENCHMARK_DFLASH=1). It stayed effectively tied with the best band but did not improve on it.","timestamp":1776146232083,"segment":19,"confidence":6.2207879451170465,"iterationTokens":1012,"asi":{"hypothesis":"The earlier client-driven-thinking collapse may have been specific to the older baseline; on the new explicit DFlash + block-15 lane, request-level thinking alone might now be viable or even faster.","rollback_reason":"No primary-metric improvement over the current best 107.10 tok/s keep.","next_action_hint":"Record that client-requested thinking is no longer catastrophic on the new fast lane, then keep optimizing from the current best.","learning":"A major productization constraint has softened: on the new explicit DFlash + block-15 lane, client-requested thinking alone is no longer a throughput collapse and appears roughly tied with the settings-driven fast path."}}
{"run":289,"commit":"e9874e2","metric":107.15471686690158,"metrics":{},"status":"keep","description":"Re-test the broader normal-request path on the new block-15 lane by removing request-level dflash forcing (BENCHMARK_DFLASH=0) and keeping thinking request-driven (ENABLE_THINKING=1, SETTINGS_ENABLE_THINKING=0). On the current path this actually edges out the explicit fast lane, giving a new best while broadening end-to-end behavior.","timestamp":1776146273433,"segment":19,"confidence":6.126233128824983,"iterationTokens":1033,"asi":{"hypothesis":"The newer fast lane may have reduced enough friction that the broader normal request path can now match or slightly beat the explicit override path, improving true end-to-end usability and the primary metric at once.","learning":"A key productization barrier is gone on the current lane: normal requests without request-level dflash forcing can now slightly outperform the explicit fast path while retaining the 107 tok/s-class throughput.","files":[".omlx-autoresearch/workload.env"]}}
{"run":290,"commit":"e9874e2","metric":106.99891828069487,"metrics":{},"status":"discard","description":"Immediate confirmation rerun of the new broader normal-request + block-15 baseline (no request-level dflash forcing, request-driven thinking). It stayed in the same high band but did not beat the new best.","timestamp":1776146306878,"segment":19,"confidence":5.879105807683954,"iterationTokens":834,"asi":{"hypothesis":"If the broader normal-request path is a real win on the new lane, an immediate rerun should remain near the new 107.15 tok/s result.","rollback_reason":"No further primary-metric improvement over the newly kept 107.15 tok/s result.","next_action_hint":"Use the broader normal-request + block-15 lane as the active baseline for further tuning and productization work.","learning":"The broader normal-request lane appears stable in the ~107 tok/s band, not a one-off spike."}}
{"run":291,"commit":"e9874e2","metric":90.78699714756354,"metrics":{},"status":"discard","description":"Continue the broader normal-request lane sweep by increasing DFLASH_BLOCK_TOKENS from 15 to 16. It regressed materially, so 15 remains the better point here too.","timestamp":1776146347356,"segment":19,"confidence":6.0972388126701365,"iterationTokens":940,"asi":{"hypothesis":"If the broader normal-request lane shifts the optimum upward, 16 might outperform 15 here even though it regressed on the explicit lane.","rollback_reason":"Primary metric regressed materially below the current best 107.15 tok/s keep.","next_action_hint":"Keep 15 as the active broader-lane block size and explore other nearby levers rather than pushing higher.","learning":"The broader normal-request lane shares the same sharp upper cliff: 16 is bad here too, so the sweet spot still appears to peak at 15."}}
{"run":292,"commit":"e9874e2","metric":107.04694443630251,"metrics":{},"status":"discard","description":"Re-test the broader normal-request lane with thinking driven only by model settings again (ENABLE_THINKING=0, SETTINGS_ENABLE_THINKING=1) on the new 15-token regime. It stayed effectively tied with the best band but did not improve on it.","timestamp":1776146400637,"segment":19,"confidence":5.8521603765819075,"iterationTokens":1367,"asi":{"hypothesis":"The new 15-token broader lane may have removed the old dependence on request-driven thinking, allowing settings-driven thinking-only requests to match or beat the best path.","rollback_reason":"No primary-metric improvement over the current best 107.15 tok/s keep.","next_action_hint":"Treat both request-driven and settings-driven thinking as viable on the new broader lane, then keep optimizing from the current best.","learning":"Another productization barrier is gone: settings-driven thinking-only is now effectively tied with the best broader-lane throughput on the new 15-token path."}}
{"run":293,"commit":"e9874e2","metric":102.16178850960642,"metrics":{},"status":"discard","description":"Probe DFLASH_BLOCK_TOKENS=14 on the broader normal-request lane. It stayed strong but remained well below the current 15-token best, so 15 is still the better point here.","timestamp":1776146465195,"segment":19,"confidence":5.62602247515306,"iterationTokens":1002,"asi":{"hypothesis":"If the broader lane shifted the optimum back down slightly, 14 might outperform 15 here even though 15 won the first sweep.","rollback_reason":"Primary metric was materially below the current best 107.15 tok/s keep.","next_action_hint":"Stick with 15 as the active broader-lane block size and move on to other levers.","learning":"The broader normal-request lane still clearly prefers 15 over 14."}}
{"run":294,"commit":"e9874e2","metric":103.58929750581264,"metrics":{},"status":"discard","description":"Probe the broader normal-request lane with both request-driven and settings-driven thinking enabled together (ENABLE_THINKING=1, SETTINGS_ENABLE_THINKING=1) on the 15-token baseline. It regressed materially below the best broader path.","timestamp":1776180935250,"segment":19,"confidence":5.332700857950457,"iterationTokens":1451,"asi":{"hypothesis":"If request-driven and settings-driven thinking each work well independently on the new 15-token lane, enabling both together might preserve or slightly improve the best path.","rollback_reason":"Primary metric regressed materially below the current best 107.15 tok/s keep.","next_action_hint":"Keep only one thinking-control path active at a time on the broader lane; the dual-enable shape is not competitive.","learning":"On the broader normal-request lane, request-driven and settings-driven thinking are individually viable, but turning on both together is clearly worse."}}
