{"run":1343,"commit":"addb9d2","metric":108.47800595758473,"metrics":{},"status":"discard","description":"Mirror sample dipped to ~108.48, still above old pre-breakout plateau.","timestamp":1776323295988,"segment":23,"confidence":3.825931302751839,"iterationTokens":661,"asi":{"hypothesis":"Window remains elevated even with occasional lower-side samples.","rollback_reason":"Below current keep.","next_action_hint":"Continue mirror-only sampling to determine whether this is temporary dip or sustained downshift.","backend":"mirror_sd_mlx","context_only_draft_cache":1,"draft_sink":48,"async_draft_eval":1,"fused_draft_verify_eval":1,"paired_prev_tok_s":108.53202408781013,"paired_delta_tok_s":-0.05401813022539979,"delta_vs_keep":-0.3308891939412403}}
{"run":1344,"commit":"addb9d2","metric":108.6044346969442,"metrics":{},"status":"discard","description":"Mirror sample rebounded to ~108.60 from prior dip.","timestamp":1776323326412,"segment":23,"confidence":3.8214053434799817,"iterationTokens":685,"asi":{"hypothesis":"Recent dip was transient; high-window remains active.","rollback_reason":"Still below keep 108.8089.","next_action_hint":"Continue high-window sampling for next top-tail spike.","backend":"mirror_sd_mlx","context_only_draft_cache":1,"draft_sink":48,"async_draft_eval":1,"fused_draft_verify_eval":1,"paired_prev_tok_s":108.47800595758473,"paired_delta_tok_s":0.1264287393594738,"delta_vs_keep":-0.20446045458176915}}
{"run":1345,"commit":"addb9d2","metric":108.71194652609496,"metrics":{},"status":"discard","description":"Mirror sample reached ~108.712, nearly matching prior peak window.","timestamp":1776323356596,"segment":23,"confidence":3.814124771451626,"iterationTokens":654,"asi":{"hypothesis":"Top-tail remains reachable in current window with repeated scans.","rollback_reason":"Missed keep by a small margin (~0.097 tok/s).","next_action_hint":"Continue immediate mirror follow-ups while top-tail is active.","backend":"mirror_sd_mlx","context_only_draft_cache":1,"draft_sink":48,"async_draft_eval":1,"fused_draft_verify_eval":1,"delta_vs_keep":-0.09694862543101863,"near_best":true}}
{"run":1346,"commit":"addb9d2","metric":108.52135933416282,"metrics":{},"status":"discard","description":"Mirror sample fell back to ~108.52 after near-best hit.","timestamp":1776323388876,"segment":23,"confidence":3.810503217009312,"iterationTokens":637,"asi":{"hypothesis":"High-window remains open but with normal oscillation away from top-tail samples.","rollback_reason":"Below keep.","next_action_hint":"Continue mirror sampling; if several lows persist, run control parity to check shared drift.","backend":"mirror_sd_mlx","context_only_draft_cache":1,"draft_sink":48,"async_draft_eval":1,"fused_draft_verify_eval":1,"paired_prev_tok_s":108.71194652609496,"paired_delta_tok_s":-0.19058719193214435,"delta_vs_keep":-0.2875358173629417}}
{"run":1347,"commit":"addb9d2","metric":108.63232521853287,"metrics":{},"status":"discard","description":"Mirror sample returned to ~108.63, re-centering within high-window.","timestamp":1776323417232,"segment":23,"confidence":3.8001105401440998,"iterationTokens":683,"asi":{"hypothesis":"High-window remains stable around mid/high-108 despite intermittent dips.","rollback_reason":"Still below keep 108.8089.","next_action_hint":"Continue mirror loop; look for another top-tail >108.81 sample.","backend":"mirror_sd_mlx","context_only_draft_cache":1,"draft_sink":48,"async_draft_eval":1,"fused_draft_verify_eval":1,"paired_prev_tok_s":108.52135933416282,"paired_delta_tok_s":0.11096588437005023,"delta_vs_keep":-0.17656993299289148}}
{"run":1348,"commit":"addb9d2","metric":108.72081240789366,"metrics":{},"status":"discard","description":"Control parity check in active high-window (`DFLASH_MIRROR_SD_RUNTIME=0`) hit ~108.72.","timestamp":1776323461377,"segment":23,"confidence":3.7897743985708323,"iterationTokens":793,"asi":{"hypothesis":"Shared high-window should keep control near or above mirror in short windows.","rollback_reason":"Control exceeded mirror keep-level but parity backend remains non-authoritative for mirror objective.","next_action_hint":"Restore mirror runtime and continue mirror-side top-tail hunting in the open high-window.","backend":"bstnxbt_mlx","mirror_runtime_enabled":0,"context_only_draft_cache":1,"draft_sink":48,"async_draft_eval":1,"fused_draft_verify_eval":1,"paired_mirror_tok_s":108.63232521853287,"paired_delta_tok_s":-0.08848718936079512,"authoritative_lane":"mirror_sd_mlx","shared_high_window":true}}
{"run":1349,"commit":"addb9d2","metric":108.66018731239095,"metrics":{},"status":"discard","description":"Mirror anchor after control parity remained strong at ~108.66.","timestamp":1776323506993,"segment":23,"confidence":3.734159890906436,"iterationTokens":1203,"asi":{"hypothesis":"High-window continues to support stable mid/high-108 mirror throughput.","rollback_reason":"Below keep 108.8089.","next_action_hint":"Continue mirror scanning for a top-tail exceedance.","backend":"mirror_sd_mlx","context_only_draft_cache":1,"draft_sink":48,"async_draft_eval":1,"fused_draft_verify_eval":1,"paired_control_tok_s":108.72081240789366,"paired_delta_tok_s":-0.06062509550271815,"delta_vs_keep":-0.1487078391350202,"high_window_stable":true}}
{"run":1350,"commit":"addb9d2","metric":108.60186133429566,"metrics":{},"status":"discard","description":"Mirror sample held at ~108.60 with warmup variance; steady-state unchanged.","timestamp":1776323540029,"segment":23,"confidence":3.6843831963482985,"iterationTokens":657,"asi":{"hypothesis":"Warmup jitter is not materially affecting request throughput in current high-window.","rollback_reason":"Still below keep.","next_action_hint":"Continue mirror scans; prioritize repeated high-window anchors over new code probes.","backend":"mirror_sd_mlx","context_only_draft_cache":1,"draft_sink":48,"async_draft_eval":1,"fused_draft_verify_eval":1,"warmup_s":1.9997874170076102,"delta_vs_keep":-0.2070338172303143}}
{"run":1351,"commit":"addb9d2","metric":108.67908059880385,"metrics":{},"status":"discard","description":"Mirror sample climbed to ~108.68, near upper half of active high-window.","timestamp":1776323577769,"segment":23,"confidence":3.68258605833159,"iterationTokens":664,"asi":{"hypothesis":"Continued scanning in active window may produce another >108.80 top-tail run.","rollback_reason":"Still below keep 108.8089.","next_action_hint":"Run immediate follow-up while high-window is favorable.","backend":"mirror_sd_mlx","context_only_draft_cache":1,"draft_sink":48,"async_draft_eval":1,"fused_draft_verify_eval":1,"paired_prev_tok_s":108.60186133429566,"paired_delta_tok_s":0.0772192645081912,"delta_vs_keep":-0.1298145527221231,"near_best_band":true}}
{"run":1352,"commit":"addb9d2","metric":108.64364238650636,"metrics":{},"status":"discard","description":"Immediate follow-up after 108.68 remained high at ~108.64.","timestamp":1776323611620,"segment":23,"confidence":3.680790672646417,"iterationTokens":682,"asi":{"hypothesis":"Window remains stable but top-tail >108.80 events are sparse.","rollback_reason":"Below keep.","next_action_hint":"Continue loop; parity check can be deferred while mirror/control already known near-tied in this window.","backend":"mirror_sd_mlx","context_only_draft_cache":1,"draft_sink":48,"async_draft_eval":1,"fused_draft_verify_eval":1,"paired_prev_tok_s":108.67908059880385,"paired_delta_tok_s":-0.03543821229749186,"delta_vs_keep":-0.16525276501961728}}
{"run":1353,"commit":"addb9d2","metric":108.59508345392844,"metrics":{},"status":"discard","description":"Mirror sample at ~108.60 with elevated warmup variance; high-window intact.","timestamp":1776323642707,"segment":23,"confidence":3.6813095058749483,"iterationTokens":717,"asi":{"hypothesis":"Steady-state remains robust despite warmup-time swings.","rollback_reason":"No improvement vs keep.","next_action_hint":"Continue mirror scans for another top-tail event.","backend":"mirror_sd_mlx","context_only_draft_cache":1,"draft_sink":48,"async_draft_eval":1,"fused_draft_verify_eval":1,"warmup_s":2.0747837079688907,"delta_vs_keep":-0.2138116975975352}}
{"run":1354,"commit":"addb9d2","metric":108.5798233617349,"metrics":{},"status":"discard","description":"Mirror sample remained in high-window (~108.58) with no new peak.","timestamp":1776323675335,"segment":23,"confidence":3.681828485390471,"iterationTokens":607,"asi":{"hypothesis":"Window remains open but currently centered below 108.81 top-tail.","rollback_reason":"Below keep.","next_action_hint":"Continue mirror-only loop; reintroduce parity if band drifts materially.","backend":"mirror_sd_mlx","context_only_draft_cache":1,"draft_sink":48,"async_draft_eval":1,"fused_draft_verify_eval":1,"delta_vs_keep":-0.22907178979106604}}
{"run":1355,"commit":"addb9d2","metric":108.72881000601213,"metrics":{},"status":"discard","description":"Mirror sample reached ~108.73, near current peak but still below keep.","timestamp":1776323712367,"segment":23,"confidence":3.670160325518827,"iterationTokens":611,"asi":{"hypothesis":"Top-tail remains reachable and may break through again with continued scans.","rollback_reason":"Missed keep by ~0.080 tok/s.","next_action_hint":"Continue immediate mirror follow-ups while top-tail remains active.","backend":"mirror_sd_mlx","context_only_draft_cache":1,"draft_sink":48,"async_draft_eval":1,"fused_draft_verify_eval":1,"paired_prev_tok_s":108.5798233617349,"paired_delta_tok_s":0.14898664427723304,"delta_vs_keep":-0.08008514551383253,"near_best":true}}
{"run":1356,"commit":"addb9d2","metric":108.59609499079284,"metrics":{},"status":"discard","description":"Mirror follow-up settled back to ~108.60 after near-best attempt.","timestamp":1776323742388,"segment":23,"confidence":3.658565887633604,"iterationTokens":707,"asi":{"hypothesis":"Top-tail hits are sparse; median high-window remains around upper-108.5/low-108.6.","rollback_reason":"Below keep.","next_action_hint":"Continue mirror scanning; avoid code changes while high-window remains healthy.","backend":"mirror_sd_mlx","context_only_draft_cache":1,"draft_sink":48,"async_draft_eval":1,"fused_draft_verify_eval":1,"warmup_s":2.0911279579158872,"delta_vs_keep":-0.21280016073311944}}
{"run":1357,"commit":"addb9d2","metric":108.63124481625226,"metrics":{},"status":"discard","description":"Mirror high-window continuity sample remained at ~108.63.","timestamp":1776323825414,"segment":23,"confidence":3.6870313646809834,"iterationTokens":9149,"asi":{"hypothesis":"Current high-window remains stable around mid/high-108 and may still surface >108.81 tail hits.","rollback_reason":"Strong result but below keep 108.8089.","next_action_hint":"Continue mirror-only scans while high-window remains open.","backend":"mirror_sd_mlx","context_only_draft_cache":1,"draft_sink":48,"async_draft_eval":1,"fused_draft_verify_eval":1,"warmup_s":1.9886549580842257,"delta_vs_keep":-0.1776503352737056,"high_window_stable":true}}
{"run":1358,"commit":"addb9d2","metric":108.53804247663713,"metrics":{},"status":"discard","description":"Mirror sample dipped to ~108.54 but stayed inside active high-window.","timestamp":1776323856129,"segment":23,"confidence":3.693850481273569,"iterationTokens":665,"asi":{"hypothesis":"High-window remains open despite occasional lower-edge oscillations.","rollback_reason":"Below current keep.","next_action_hint":"Continue mirror sampling; if repeated sub-108.45 appears, run control parity spot-check.","backend":"mirror_sd_mlx","context_only_draft_cache":1,"draft_sink":48,"async_draft_eval":1,"fused_draft_verify_eval":1,"paired_prev_tok_s":108.63124481625226,"paired_delta_tok_s":-0.09320233961513348,"delta_vs_keep":-0.270852674888833,"high_window_stable":true}}
{"run":1359,"commit":"addb9d2","metric":108.53257431913248,"metrics":{},"status":"discard","description":"Second consecutive mirror sample near lower edge (~108.53) in high-window.","timestamp":1776323889440,"segment":23,"confidence":3.6996813669557778,"iterationTokens":680,"asi":{"hypothesis":"This may be a temporary local dip within the open high-window.","rollback_reason":"Below keep and below recent mid-108.6 center.","next_action_hint":"Take a control parity spot-check now to confirm whether lower-edge drift is shared.","backend":"mirror_sd_mlx","context_only_draft_cache":1,"draft_sink":48,"async_draft_eval":1,"fused_draft_verify_eval":1,"paired_prev_tok_s":108.53804247663713,"paired_delta_tok_s":-0.005468157504654581,"delta_vs_keep":-0.2763208323934838,"plateau_lower_edge":true}}
{"run":1360,"commit":"addb9d2","metric":108.66600177033438,"metrics":{},"status":"discard","description":"Control parity spot-check during mirror lower-edge dip (`DFLASH_MIRROR_SD_RUNTIME=0`) stayed in high-window.","timestamp":1776323929886,"segment":23,"confidence":3.705530690299168,"iterationTokens":845,"asi":{"hypothesis":"If mirror lower-edge dip is regime noise, control should remain elevated and comparable.","rollback_reason":"Control ~108.67 indicates shared high-window; parity backend remains non-authoritative.","next_action_hint":"Restore mirror runtime and continue high-window scanning for top-tail mirror peaks.","backend":"bstnxbt_mlx","mirror_runtime_enabled":0,"context_only_draft_cache":1,"draft_sink":48,"async_draft_eval":1,"fused_draft_verify_eval":1,"paired_mirror_tok_s":108.53257431913248,"paired_delta_tok_s":-0.13342745120189423,"authoritative_lane":"mirror_sd_mlx","shared_high_window":true}}
{"run":1361,"commit":"addb9d2","metric":108.55332774209407,"metrics":{},"status":"discard","description":"Mirror anchor after control parity remained in high-window at ~108.55.","timestamp":1776323969179,"segment":23,"confidence":3.7073683870275005,"iterationTokens":1125,"asi":{"hypothesis":"Post-parity mirror should remain within the shared 108.5+ regime.","rollback_reason":"Below keep 108.8089.","next_action_hint":"Continue mirror high-window scans for another top-tail >108.81 event.","backend":"mirror_sd_mlx","context_only_draft_cache":1,"draft_sink":48,"async_draft_eval":1,"fused_draft_verify_eval":1,"paired_control_tok_s":108.66600177033438,"paired_delta_tok_s":-0.11267402824030884,"delta_vs_keep":-0.2555672489312882,"high_window_stable":true}}
{"run":1362,"commit":"addb9d2","metric":108.59892434101782,"metrics":{},"status":"discard","description":"Mirror sample recovered to ~108.60 within active high-window.","timestamp":1776324001417,"segment":23,"confidence":3.7092079074109097,"iterationTokens":685,"asi":{"hypothesis":"High-window median remains near ~108.6 while top-tail >108.8 appears intermittently.","rollback_reason":"Still below keep.","next_action_hint":"Continue mirror scans; maintain current shape.","backend":"mirror_sd_mlx","context_only_draft_cache":1,"draft_sink":48,"async_draft_eval":1,"fused_draft_verify_eval":1,"paired_prev_tok_s":108.55332774209407,"paired_delta_tok_s":0.04559659892374849,"delta_vs_keep":-0.209970649,"high_window_stable":true}}
{"run":1363,"commit":"addb9d2","metric":108.77917717638168,"metrics":{},"status":"discard","description":"Mirror scan reached ~108.78, nearly matching current peak window.","timestamp":1776324033780,"segment":23,"confidence":3.7101569391703095,"iterationTokens":685,"asi":{"hypothesis":"Top-tail remains active and may exceed 108.81 with continued immediate reruns.","rollback_reason":"Missed keep by a narrow margin.","next_action_hint":"Run immediate mirror follow-up while near-best regime is active.","backend":"mirror_sd_mlx","context_only_draft_cache":1,"draft_sink":48,"async_draft_eval":1,"fused_draft_verify_eval":1,"warmup_s":2.1513132080435753,"delta_vs_keep":-0.02971781441116054,"near_best":true}}
{"run":1364,"commit":"addb9d2","metric":108.58035680763325,"metrics":{},"status":"discard","description":"Immediate follow-up fell back to ~108.58 after near-best attempt.","timestamp":1776324065093,"segment":23,"confidence":3.7111064566893823,"iterationTokens":667,"asi":{"hypothesis":"Top-tail spikes are sporadic within an otherwise stable ~108.55–108.70 window.","rollback_reason":"Below keep.","next_action_hint":"Continue mirror high-window scans; no structural changes.","backend":"mirror_sd_mlx","context_only_draft_cache":1,"draft_sink":48,"async_draft_eval":1,"fused_draft_verify_eval":1,"paired_prev_tok_s":108.77917717638168,"paired_delta_tok_s":-0.1988203687484283,"delta_vs_keep":-0.22853818315958882}}
{"run":1365,"commit":"addb9d2","metric":108.71194844204537,"metrics":{},"status":"discard","description":"Mirror sample again reached ~108.712, near the current top-tail.","timestamp":1776324094505,"segment":23,"confidence":3.714153123741965,"iterationTokens":710,"asi":{"hypothesis":"Current window still supports repeat near-peak hits close to keep.","rollback_reason":"Still narrowly below keep 108.8089.","next_action_hint":"Continue immediate mirror follow-ups to hunt another >108.81 spike.","backend":"mirror_sd_mlx","context_only_draft_cache":1,"draft_sink":48,"async_draft_eval":1,"fused_draft_verify_eval":1,"delta_vs_keep":-0.0969467094806102,"near_best":true}}
{"run":1366,"commit":"addb9d2","metric":108.51993038309169,"metrics":{},"status":"discard","description":"Immediate follow-up dropped to ~108.52, confirming top-tail spikes are intermittent.","timestamp":1776324128614,"segment":23,"confidence":3.717204797283485,"iterationTokens":635,"asi":{"hypothesis":"The high-window remains open but with sporadic peaks rather than continuous climb.","rollback_reason":"Below keep and below recent near-best sample.","next_action_hint":"Continue sampling; if this lower side persists for multiple runs, recheck control parity.","backend":"mirror_sd_mlx","context_only_draft_cache":1,"draft_sink":48,"async_draft_eval":1,"fused_draft_verify_eval":1,"warmup_s":2.0189180829329416,"paired_prev_tok_s":108.71194844204537,"paired_delta_tok_s":-0.1920180589536786,"delta_vs_keep":-0.288964768434289,"high_window_jitter":true}}
{"run":1367,"commit":"addb9d2","metric":108.66146093010447,"metrics":{},"status":"discard","description":"Mirror sample rebounded to ~108.66 after local dip, sustaining high-window.","timestamp":1776324177775,"segment":23,"confidence":3.7149577869793466,"iterationTokens":1250,"asi":{"hypothesis":"Current high-window remains healthy despite intermittent lower-edge samples.","rollback_reason":"Still below keep 108.8089.","next_action_hint":"Continue mirror high-window scans for another top-tail exceedance.","backend":"mirror_sd_mlx","context_only_draft_cache":1,"draft_sink":48,"async_draft_eval":1,"fused_draft_verify_eval":1,"paired_prev_tok_s":108.51993038309169,"paired_delta_tok_s":0.14153054701278334,"delta_vs_keep":-0.1474342214215108,"high_window_stable":true}}
{"run":1368,"commit":"addb9d2","metric":108.71158009040064,"metrics":{},"status":"discard","description":"Mirror sample again hit ~108.71 near current peak while high-window remains open.","timestamp":1776324207744,"segment":23,"confidence":3.712713491621156,"iterationTokens":689,"asi":{"hypothesis":"Top-tail remains reachable repeatedly; another marginal exceedance is plausible.","rollback_reason":"Still narrowly below keep 108.8089.","next_action_hint":"Continue immediate mirror scans while near-best region remains active.","backend":"mirror_sd_mlx","context_only_draft_cache":1,"draft_sink":48,"async_draft_eval":1,"fused_draft_verify_eval":1,"warmup_s":2.1918039999436587,"delta_vs_keep":-0.09731506112534014,"near_best":true}}
{"run":1369,"commit":"b304c02","metric":108.86233249447494,"metrics":{},"status":"keep","description":"Immediate mirror follow-up from near-best region broke through to a fresh all-time best in the reopened high-window.","timestamp":1776324240707,"segment":23,"confidence":3.729060476812811,"iterationTokens":662,"asi":{"hypothesis":"With repeated near-best (~108.71) hits, an immediate rerun can capture a top-tail >108.81 event.","backend":"mirror_sd_mlx","context_only_draft_cache":1,"draft_sink":48,"async_draft_eval":1,"fused_draft_verify_eval":1,"paired_prev_tok_s":108.71158009040064,"paired_delta_tok_s":0.1507524040743026,"delta_vs_keep":0.05343734307422609,"high_window_breakthrough":true}}
{"run":1370,"commit":"b304c02","metric":108.64656451987715,"metrics":{},"status":"discard","description":"Immediate mirror confirmation after 108.86 keep stayed high at ~108.65.","timestamp":1776324270762,"segment":23,"confidence":3.7299058257480797,"iterationTokens":800,"asi":{"hypothesis":"Post-keep rerun should remain in open high-window even if top-tail spike is not repeated.","rollback_reason":"Strong but below latest keep 108.8623.","next_action_hint":"Take control parity sample to verify shared high-window at the new peak regime.","backend":"mirror_sd_mlx","context_only_draft_cache":1,"draft_sink":48,"async_draft_eval":1,"fused_draft_verify_eval":1,"paired_keep_tok_s":108.86233249447494,"paired_delta_tok_s":-0.21576797459778382,"delta_vs_keep":-0.21576797459778382,"high_window_stable":true}}
{"run":1371,"commit":"b304c02","metric":108.80010883561047,"metrics":{},"status":"discard","description":"Control parity check after 108.86 mirror keep (`DFLASH_MIRROR_SD_RUNTIME=0`) landed near 108.80.","timestamp":1776324313886,"segment":23,"confidence":3.7259866476129173,"iterationTokens":814,"asi":{"hypothesis":"Shared high-window should keep control close to mirror peak regime.","rollback_reason":"Control remained near mirror peak but parity backend is non-authoritative.","next_action_hint":"Restore mirror runtime and continue mirror-side scans around the new best regime.","backend":"bstnxbt_mlx","mirror_runtime_enabled":0,"context_only_draft_cache":1,"draft_sink":48,"async_draft_eval":1,"fused_draft_verify_eval":1,"paired_mirror_tok_s":108.64656451987715,"paired_delta_tok_s":-0.15354431573332117,"authoritative_lane":"mirror_sd_mlx","shared_high_window":true}}
