{"run":2417,"commit":"26f9501","metric":106.64099322519738,"metrics":{},"status":"discard","description":"Control re-entered healthy fused-only high window (~106.6 tok/s, safe_mode=0), reopening reliable A/B conditions.","timestamp":1776478733973,"segment":25,"confidence":4.733201409651859,"iterationTokens":4250,"asi":{"hypothesis":"Passive monitoring should eventually return to stable fused-only control behavior after collapse oscillations.","rollback_reason":"No code changes; stability-gating sample only.","next_action_hint":"Run immediate matched DDTree baseline and then evaluate a code-level DDTree overhead optimization in this stable window.","diagnostic_findings":{"completion_tok_s":106.64099322519738,"dflash_eval_s":8.871523419744335,"safe_mode_active":0,"verify_eval_wait_fused_steps":96,"verify_eval_wait_unfused_steps":0}}}
{"run":2418,"commit":"26f9501","metric":101.43347423184495,"metrics":{},"status":"discard","description":"Matched DDTree baseline in recovered high window landed at ~101.4 tok/s (budget-13 + unnormalized), preserving ~5.2 tok/s gap vs control.","timestamp":1776478763202,"segment":25,"confidence":4.795624679041117,"iterationTokens":4139,"asi":{"hypothesis":"Stable-window DDTree should return near its known budget-13 baseline before testing code edits.","rollback_reason":"No code changes; baseline anchoring run only.","next_action_hint":"Proceed with a code-level DDTree tree-build micro-optimization and re-run matched DDTree/control checks.","diagnostic_findings":{"completion_tok_s":101.43347423184495,"dflash_ddtree_tree_build_s":1.971906093,"dflash_ddtree_tree_verify_s":0.140933381,"dflash_ddtree_cycles_completed":98}}}
{"run":2419,"commit":"26f9501","metric":101.80238563868274,"metrics":{},"status":"discard","description":"Code-level fast-path detection refactor (avoid per-cycle dfs_order.tolist in tree-aware mode) was effectively flat in this window (~101.8 tok/s vs ~101.4 baseline), with no material tree-build reduction.","timestamp":1776478904167,"segment":25,"confidence":4.934689817390486,"iterationTokens":7305,"asi":{"hypothesis":"Replacing dfs prefix checks with child-order path checks should trim Python/list conversion overhead in native DDTree tree-build/commit bookkeeping.","rollback_reason":"Primary gain was marginal and within expected drift/noise; no robust uplift signal.","next_action_hint":"Discard and pivot to larger tree-build overhead levers (e.g., top-k/compile path allocation reductions) once stable window persists.","diagnostic_findings":{"completion_tok_s":101.80238563868274,"dflash_ddtree_tree_build_s":1.965941709,"dflash_ddtree_tree_verify_s":0.138986256,"dflash_ddtree_commit_s":0.013278667}}}
{"run":2420,"commit":"26f9501","metric":106.39231717566544,"metrics":{},"status":"discard","description":"Control remained stable in fused-only high window (~106.4 tok/s), confirming healthy parity conditions after the non-winning DDTree code probe.","timestamp":1776478930384,"segment":25,"confidence":5.082061136530693,"iterationTokens":2160,"asi":{"hypothesis":"If regime stayed healthy, immediate post-probe control should remain fused-only with safe_mode=0.","rollback_reason":"No code changes; control parity confirmation sample.","next_action_hint":"Continue DDTree code-level overhead experiments while this stable window holds.","diagnostic_findings":{"completion_tok_s":106.39231717566544,"dflash_eval_s":8.871088751242496,"safe_mode_active":0,"verify_eval_wait_fused_steps":96,"verify_eval_wait_unfused_steps":0}}}
{"run":2421,"commit":"26f9501","metric":22.29282582610219,"metrics":{},"status":"discard","description":"NumPy-side top-k sort/scoring refactor was catastrophic (~22.3 tok/s): tree_build exploded (~9.95s vs ~1.97s) and total eval time ballooned.","timestamp":1776479042759,"segment":25,"confidence":4.934689817390486,"iterationTokens":6718,"asi":{"hypothesis":"Moving tiny top-k sort/scoring work from MLX kernels to NumPy after one sync would reduce kernel-launch overhead in unnormalized mode.","rollback_reason":"Primary metric collapsed severely due massive tree-build inflation in the new NumPy path.","next_action_hint":"Do not retry NumPy top-k postprocessing path; revert to MLX-side top-k processing and run immediate DDTree back-check.","diagnostic_findings":{"completion_tok_s":22.29282582610219,"dflash_ddtree_tree_build_s":9.947374125,"dflash_ddtree_tree_verify_s":0.5313865010000001,"dflash_ddtree_cycles_completed":98}}}
{"run":2422,"commit":"26f9501","metric":34.35498780162013,"metrics":{},"status":"discard","description":"Post-revert DDTree back-check remained deeply degraded (~34.4 tok/s; tree_build ~6.20s), indicating the collapse persisted beyond the discarded NumPy variant.","timestamp":1776479095264,"segment":25,"confidence":4.795624679041117,"iterationTokens":1818,"asi":{"hypothesis":"If the catastrophic NumPy path was the sole cause, immediate revert should restore DDTree near ~101 tok/s baseline.","rollback_reason":"No code retained; this is attribution follow-up showing continued regime degradation.","next_action_hint":"Run immediate no-DDTree control parity check to determine whether this is shared regime collapse versus DDTree-specific instability.","diagnostic_findings":{"completion_tok_s":34.35498780162013,"dflash_ddtree_tree_build_s":6.19871441,"dflash_ddtree_tree_verify_s":0.276798455,"dflash_ddtree_cycles_completed":98}}}
{"run":2423,"commit":"26f9501","metric":46.36749294613479,"metrics":{},"status":"discard","description":"Immediate control parity also collapsed (~46.4 tok/s, safe_mode active with mixed fused/unfused), confirming DDTree trough was part of a shared regime wave.","timestamp":1776479133868,"segment":25,"confidence":4.733201409651859,"iterationTokens":1754,"asi":{"hypothesis":"If DDTree post-revert collapse is regime-driven, no-DDTree control should simultaneously show safe-mode activation and major eval inflation.","rollback_reason":"No code changes; attribution run confirms shared instability.","next_action_hint":"Pause new optimization probes and return to passive control monitoring until fused-only high window returns.","diagnostic_findings":{"completion_tok_s":46.36749294613479,"dflash_eval_s":18.14607771660667,"safe_mode_active":1,"safe_mode_step":45,"verify_eval_wait_fused_steps":45,"verify_eval_wait_unfused_steps":58}}}
{"run":2424,"commit":"26f9501","metric":54.008594064749566,"metrics":{},"status":"discard","description":"Control moved into partial recovery shelf (~54.0 tok/s) but remained unstable (safe_mode active, unfused share still substantial).","timestamp":1776479176255,"segment":25,"confidence":4.672382350267365,"iterationTokens":4545,"asi":{"hypothesis":"After severe collapse, control should recover through intermediate shelves before returning to fused-only high window.","rollback_reason":"No code changes; monitoring-only sample.","next_action_hint":"Continue passive control monitoring until safe_mode clears and unfused steps return to zero.","diagnostic_findings":{"completion_tok_s":54.008594064749566,"dflash_eval_s":15.813339367741719,"safe_mode_active":1,"safe_mode_step":57,"verify_eval_wait_fused_steps":57,"verify_eval_wait_unfused_steps":46}}}
{"run":2425,"commit":"26f9501","metric":53.2560149139106,"metrics":{},"status":"discard","description":"Control remained in low-50s recovery shelf with safe mode still active and unfused verify share present; no full high-window re-entry yet.","timestamp":1776479219159,"segment":25,"confidence":4.487976043827732,"iterationTokens":4349,"asi":{"hypothesis":"Recovery can plateau around low-50 tok/s while safe_mode and unfused waits persist.","rollback_reason":"No code changes; monitoring-only run.","next_action_hint":"Continue passive control sampling; require safe_mode=0 and unfused=0 before new optimization A/B.","diagnostic_findings":{"completion_tok_s":53.2560149139106,"dflash_eval_s":16.022256295080297,"safe_mode_active":1,"safe_mode_step":56,"verify_eval_wait_fused_steps":56,"verify_eval_wait_unfused_steps":47}}}
{"run":2426,"commit":"26f9501","metric":46.58161837767518,"metrics":{},"status":"discard","description":"Control fell back from low-50s shelf to ~46.6 tok/s with increased spike activity and safe-mode step shifting earlier; instability persists.","timestamp":1776479256907,"segment":25,"confidence":4.2468622487579335,"iterationTokens":4216,"asi":{"hypothesis":"Unstable recovery shelves can relapse with higher spike counts and earlier safe-mode activation.","rollback_reason":"No code changes; monitoring-only run.","next_action_hint":"Maintain passive parity sampling and defer optimization edits until stable fused-only window returns.","diagnostic_findings":{"completion_tok_s":46.58161837767518,"dflash_eval_s":17.889756451244466,"safe_mode_active":1,"safe_mode_step":39,"collapse_spike_events":57,"verify_eval_wait_unfused_steps":62}}}
{"run":2427,"commit":"26f9501","metric":54.03621562223049,"metrics":{},"status":"discard","description":"Control remained in unstable recovery shelf (~54.0 tok/s) with early safe-mode trigger and heavily unfused execution.","timestamp":1776479350856,"segment":25,"confidence":4.2365467470640255,"iterationTokens":11271,"asi":{"hypothesis":"Current wave has not yet exited collapse; control should stay in low/mid shelves with safe-mode active.","rollback_reason":"No code changes; monitoring-only sample in shared instability regime.","next_action_hint":"Continue passive control sampling until safe_mode=0 and unfused steps return to zero before new A/B probes.","diagnostic_findings":{"completion_tok_s":54.03621562223049,"dflash_eval_s":14.921537670772523,"safe_mode_active":1,"safe_mode_step":8,"verify_eval_wait_fused_steps":8,"verify_eval_wait_unfused_steps":96}}}
{"run":2428,"commit":"26f9501","metric":61.45428059362214,"metrics":{},"status":"discard","description":"Control improved to a mid-recovery shelf (~61.5 tok/s) but still remained in safe-mode with mostly unfused execution.","timestamp":1776479386748,"segment":25,"confidence":4.197555480572945,"iterationTokens":4219,"asi":{"hypothesis":"Recovery should climb through mid shelves before full high-window return, while safe-mode remains active.","rollback_reason":"No code changes; this is continued regime monitoring.","next_action_hint":"Keep passive control loop; only resume DDTree optimization after fused-only/safe_mode=0 re-entry.","diagnostic_findings":{"completion_tok_s":61.45428059362214,"dflash_eval_s":13.132963663432747,"safe_mode_active":1,"safe_mode_step":10,"verify_eval_wait_fused_steps":10,"verify_eval_wait_unfused_steps":94}}}
{"run":2429,"commit":"26f9501","metric":67.67583594140795,"metrics":{},"status":"discard","description":"Control entered fused-only watchdog-idle shelf (~67.7 tok/s) but with inflated fused wait/eval (~14.34s), i.e., fused-only non-spike inflation rather than full high-window recovery.","timestamp":1776479419182,"segment":25,"confidence":4.121903961632058,"iterationTokens":4199,"asi":{"hypothesis":"Recovery can pass through fused-only inflated shelves before returning to the true high window floor.","rollback_reason":"No code changes; this is still regime characterization.","next_action_hint":"Keep sampling control until eval_s returns near historical floor (~8.8–9.0) before resuming DDTree A/B.","diagnostic_findings":{"completion_tok_s":67.67583594140795,"dflash_eval_s":14.338898583315313,"safe_mode_active":0,"verify_eval_wait_fused_steps":96,"verify_eval_wait_unfused_steps":0}}}
{"run":2430,"commit":"26f9501","metric":68.29630650773822,"metrics":{},"status":"discard","description":"Second control sample stayed in fused-only inflated shelf (~68.3 tok/s, eval_s ~14.17) with watchdog idle; still far from true high-window floor.","timestamp":1776479450850,"segment":25,"confidence":4.048931064306607,"iterationTokens":4197,"asi":{"hypothesis":"Fused-only non-spike inflation shelf can persist across consecutive runs before clearing to near-floor timing.","rollback_reason":"No code changes; still stability monitoring.","next_action_hint":"Continue control sampling and wait for eval_s near ~8.8–9.0 before restarting DDTree variant tests.","diagnostic_findings":{"completion_tok_s":68.29630650773822,"dflash_eval_s":14.167556250351481,"safe_mode_active":0,"verify_eval_wait_fused_steps":96,"verify_eval_wait_unfused_steps":0}}}
{"run":2431,"commit":"26f9501","metric":65.31240984311697,"metrics":{},"status":"discard","description":"Control remained fused-only and safe-mode idle but still on inflated shelf (~65.3 tok/s, eval_s ~14.83), confirming no true floor recovery yet.","timestamp":1776479484963,"segment":25,"confidence":3.991421225645893,"iterationTokens":4121,"asi":{"hypothesis":"Fused-only inflation shelf can oscillate around mid-60s tok/s before the high-window floor reopens.","rollback_reason":"No code changes; monitoring run.","next_action_hint":"Continue passive control sampling and avoid new optimization probes until eval_s approaches prior ~8.8–9.0 floor.","diagnostic_findings":{"completion_tok_s":65.31240984311697,"dflash_eval_s":14.826759623363614,"safe_mode_active":0,"verify_eval_wait_fused_steps":96,"verify_eval_wait_unfused_steps":0}}}
{"run":2432,"commit":"26f9501","metric":60.74941778000086,"metrics":{},"status":"discard","description":"Control slipped from fused-only shelf back into mixed-mode recovery (~60.7 tok/s) with safe-mode reactivating and unfused share returning.","timestamp":1776479518928,"segment":25,"confidence":3.93552221330458,"iterationTokens":4105,"asi":{"hypothesis":"Current recovery remains unstable and can revert from fused-only shelves back to safe-mode mixed execution.","rollback_reason":"No code changes; monitoring-only sample.","next_action_hint":"Keep passive control monitoring; delay DDTree A/B until stable high-window floor returns.","diagnostic_findings":{"completion_tok_s":60.74941778000086,"dflash_eval_s":13.281674205325544,"safe_mode_active":1,"safe_mode_step":10,"verify_eval_wait_fused_steps":10,"verify_eval_wait_unfused_steps":94}}}
{"run":2433,"commit":"26f9501","metric":61.893503915510514,"metrics":{},"status":"discard","description":"Control held in unstable mid-recovery (~61.9 tok/s) with safe mode active and unfused-heavy verify waits; still below high-window criteria.","timestamp":1776479557872,"segment":25,"confidence":3.612027173392251,"iterationTokens":4390,"asi":{"hypothesis":"Mid-recovery mixed-mode shelf should persist while safe_mode remains on and unfused share dominates.","rollback_reason":"No code changes; regime-monitoring run.","next_action_hint":"Continue passive control sampling and postpone new variant probes until stable fused-only near-floor window returns.","diagnostic_findings":{"completion_tok_s":61.893503915510514,"dflash_eval_s":13.021365452790633,"safe_mode_active":1,"safe_mode_step":10,"verify_eval_wait_fused_steps":10,"verify_eval_wait_unfused_steps":94}}}
{"run":2434,"commit":"26f9501","metric":70.79917335027926,"metrics":{},"status":"discard","description":"Control improved further to ~70.8 tok/s in fused-only watchdog-idle mode, but eval remains inflated (~13.68s) versus true high-window floor.","timestamp":1776479590324,"segment":25,"confidence":3.432544867613672,"iterationTokens":4208,"asi":{"hypothesis":"Recovery is climbing within fused-only inflation shelves before full return to ~8.8–9.0 eval floor.","rollback_reason":"No code changes; monitoring-only progression sample.","next_action_hint":"Continue control monitoring; resume DDTree optimization only after floor-like fused timings return.","diagnostic_findings":{"completion_tok_s":70.79917335027926,"dflash_eval_s":13.676661879988387,"safe_mode_active":0,"verify_eval_wait_fused_steps":96,"verify_eval_wait_unfused_steps":0}}}
{"run":2435,"commit":"26f9501","metric":70.9241559814558,"metrics":{},"status":"discard","description":"Control remained on fused-only inflated shelf (~70.9 tok/s, eval_s ~13.63) with watchdog idle; still not back to high-window floor behavior.","timestamp":1776479621960,"segment":25,"confidence":3.300234265534407,"iterationTokens":4097,"asi":{"hypothesis":"Fused-only shelf can stabilize around ~70 tok/s while eval wait remains elevated versus historical floor.","rollback_reason":"No code changes; monitoring-only run.","next_action_hint":"Continue passive monitoring and defer DDTree probes until control re-enters near-floor (~8.8–9.0 eval_s) regime.","diagnostic_findings":{"completion_tok_s":70.9241559814558,"dflash_eval_s":13.630218290374614,"safe_mode_active":0,"verify_eval_wait_fused_steps":96,"verify_eval_wait_unfused_steps":0}}}
{"run":2436,"commit":"26f9501","metric":71.6058180152921,"metrics":{},"status":"discard","description":"Control continued fused-only shelf climb (~71.6 tok/s) but eval remains high (~13.49s), still far from historical high-window floor.","timestamp":1776479652729,"segment":25,"confidence":3.19779931228978,"iterationTokens":4115,"asi":{"hypothesis":"The current regime is a prolonged fused-only inflation shelf rather than full recovery to floor performance.","rollback_reason":"No code changes; monitoring-only progression sample.","next_action_hint":"Keep passive monitoring; do not attribute optimization wins/losses until floor-like control returns.","diagnostic_findings":{"completion_tok_s":71.6058180152921,"dflash_eval_s":13.489874289254658,"safe_mode_active":0,"verify_eval_wait_fused_steps":96,"verify_eval_wait_unfused_steps":0}}}
{"run":2437,"commit":"26f9501","metric":71.14831781282122,"metrics":{},"status":"discard","description":"Matched DDTree baseline in fused-only inflated shelf reached ~71.1 tok/s (tree_build ~2.91s), nearly matching control shelf throughput; this is regime inflation, not a new DDTree win.","timestamp":1776479702352,"segment":25,"confidence":3.117279874376748,"iterationTokens":4805,"asi":{"hypothesis":"During shared fused-only inflation shelves, DDTree and control should compress toward similar tok/s while absolute timings remain far above floor.","rollback_reason":"No code changes; attribution sample only in non-floor regime.","next_action_hint":"Keep monitoring until floor returns before treating DDTree/control deltas as optimization signal.","diagnostic_findings":{"completion_tok_s":71.14831781282122,"dflash_ddtree_tree_build_s":2.910696413,"dflash_ddtree_cycles_completed":98,"dflash_ddtree_avg_acceptance":10.448979591836734}}}
{"run":2438,"commit":"26f9501","metric":77.42173329510081,"metrics":{},"status":"discard","description":"Immediate control parity after DDTree shelf sample rose to ~77.4 tok/s (fused-only, safe_mode=0) with lower but still-inflated eval (~12.44s).","timestamp":1776479734201,"segment":25,"confidence":3.150249074524395,"iterationTokens":1705,"asi":{"hypothesis":"Shared inflated shelf can continue rebounding in fused-only mode and narrow DDTree/control gaps without reflecting true optimization signal.","rollback_reason":"No code changes; parity attribution sample only.","next_action_hint":"Keep monitoring until eval approaches known floor before resuming candidate optimization edits.","diagnostic_findings":{"completion_tok_s":77.42173329510081,"dflash_eval_s":12.444793703150935,"safe_mode_active":0,"verify_eval_wait_fused_steps":96,"verify_eval_wait_unfused_steps":0}}}
{"run":2439,"commit":"26f9501","metric":70.88450773832531,"metrics":{},"status":"discard","description":"Control stayed in fused-only inflated band (~70.9 tok/s, eval_s ~13.63) with no safe-mode activation; floor recovery still absent.","timestamp":1776479766120,"segment":25,"confidence":3.3032570661168617,"iterationTokens":4137,"asi":{"hypothesis":"Even with watchdog idle and fused-only steps, this regime can remain throughput-limited by elevated fused wait times.","rollback_reason":"No code changes; monitoring-only sample.","next_action_hint":"Continue passive parity loop and defer optimization claims until control floor returns.","diagnostic_findings":{"completion_tok_s":70.88450773832531,"dflash_eval_s":13.628283790312707,"safe_mode_active":0,"verify_eval_wait_fused_steps":96,"verify_eval_wait_unfused_steps":0}}}
{"run":2440,"commit":"26f9501","metric":81.23828271748856,"metrics":{},"status":"discard","description":"Control continued rebound within fused-only mode (~81.2 tok/s, eval_s ~11.82), still above floor but approaching healthier timing.","timestamp":1776479839716,"segment":25,"confidence":2.9581010634733684,"iterationTokens":16565,"asi":{"hypothesis":"As inflated shelf heals, fused-only eval wait should decline steadily alongside tok/s gains before full floor re-entry.","rollback_reason":"No code changes; monitoring sample.","next_action_hint":"Continue control sampling; if eval_s approaches ~9.x, trigger matched DDTree/control parity check.","diagnostic_findings":{"completion_tok_s":81.23828271748856,"dflash_eval_s":11.822759204776958,"safe_mode_active":0,"verify_eval_wait_fused_steps":96,"verify_eval_wait_unfused_steps":0}}}
{"run":2441,"commit":"26f9501","metric":84.42437536258892,"metrics":{},"status":"discard","description":"Control climbed to ~84.4 tok/s with fused-only watchdog-idle behavior and further eval contraction (~11.35s), still above floor but trending healthier.","timestamp":1776479868561,"segment":25,"confidence":2.9536217763471386,"iterationTokens":4060,"asi":{"hypothesis":"If recovery is progressing, each successive fused-only run should reduce eval_s and improve tok/s toward the historical high window.","rollback_reason":"No code changes; monitoring-only sample.","next_action_hint":"Continue control tracking and trigger matched DDTree sample once eval_s gets near ~10 or lower.","diagnostic_findings":{"completion_tok_s":84.42437536258892,"dflash_eval_s":11.349982874118723,"safe_mode_active":0,"verify_eval_wait_fused_steps":96,"verify_eval_wait_unfused_steps":0}}}
