{"run":528,"commit":"8b55918","metric":104.60876169898101,"metrics":{},"status":"discard","description":"Paired control check for current keep: disable mirror runtime with context-only draft cache + sink=48 active.","timestamp":1776276292322,"segment":23,"confidence":9.234763829794593,"iterationTokens":742,"asi":{"hypothesis":"Mirror with context-only sink=48 should stay ahead of contemporaneous bstnxbt control.","rollback_reason":"Control probe is comparison-only and not a mirror keep candidate.","next_action_hint":"Mirror currently shows a larger paired edge (~+2.25 tok/s) in this sample; run one more paired cycle to confirm robustness.","backend":"bstnxbt_mlx","mirror_runtime_enabled":0,"context_only_draft_cache":1,"draft_sink":48,"paired_delta_tok_s":2.249477123255934}}
{"run":529,"commit":"8b55918","metric":72.34323189852495,"metrics":{},"status":"discard","description":"Second paired mirror run after control sample under context-only sink=48 keep.","timestamp":1776276321853,"segment":23,"confidence":9.143832027946393,"iterationTokens":692,"asi":{"hypothesis":"Immediate paired mirror rerun should remain near prior 106 band if control comparison reflects stable conditions.","rollback_reason":"Severe transient collapse to 72.34 tok/s on unchanged keep configuration.","next_action_hint":"Mark this as renewed instability episode and avoid over-interpreting single-run paired deltas; gather an immediate control sample for symmetry.","backend":"mirror_sd_mlx","context_only_draft_cache":1,"draft_sink":48,"collapse_regime":true}}
{"run":530,"commit":"8b55918","metric":56.31425484107399,"metrics":{},"status":"discard","description":"Symmetry check after renewed collapse: disable mirror runtime (control) with context-only sink=48 settings present.","timestamp":1776276364176,"segment":23,"confidence":9.04333276239446,"iterationTokens":728,"asi":{"hypothesis":"If collapse is global/systemic, control should also drop sharply in the same window.","rollback_reason":"Control also collapsed to 56.31 tok/s, confirming regime instability rather than mirror-only failure.","next_action_hint":"Treat current window as unstable; rely on multi-run medians/pairs before drawing backend conclusions.","backend":"bstnxbt_mlx","mirror_runtime_enabled":0,"context_only_draft_cache":1,"draft_sink":48,"collapse_regime":true}}
{"run":531,"commit":"8b55918","metric":64.42017961495567,"metrics":{},"status":"discard","description":"Recovery probe: unchanged mirror keep rerun after control collapse sample.","timestamp":1776276396882,"segment":23,"confidence":8.915580897210633,"iterationTokens":651,"asi":{"hypothesis":"If collapse is transient, rerun should recover toward normal ~106 band.","rollback_reason":"Still in low band at 64.42 tok/s.","next_action_hint":"Pause fine-grained tuning and continue occasional stability probes until throughput recovers.","backend":"mirror_sd_mlx","context_only_draft_cache":1,"draft_sink":48,"stability_probe":true}}
{"run":532,"commit":"8b55918","metric":64.81386124316494,"metrics":{},"status":"discard","description":"Second recovery probe on unchanged sink=48 context-only mirror keep.","timestamp":1776276427816,"segment":23,"confidence":8.791388161556345,"iterationTokens":600,"asi":{"hypothesis":"Additional rerun may recover out of low-throughput trough.","rollback_reason":"Still stuck around mid-60 tok/s.","next_action_hint":"Record renewed instability in ideas; avoid claiming micro-optimization effects until stable conditions return.","backend":"mirror_sd_mlx","context_only_draft_cache":1,"draft_sink":48,"stability_probe":true}}
{"run":533,"commit":"8b55918","metric":80.25119957762746,"metrics":{},"status":"discard","description":"Context-only sink sweep: DFLASH_DRAFT_SINK=56.","timestamp":1776276496224,"segment":23,"confidence":8.515643994580245,"iterationTokens":3856,"asi":{"hypothesis":"A slightly larger sink (56) may preserve more anchor context than 48 while keeping lower overhead than 64.","rollback_reason":"Severe regression in this run (80.25 vs 106.86 keep), likely within unstable regime but clearly non-winning sample.","next_action_hint":"Do not advance sink upward without stable-window confirmation; prioritize stability checks before further sink micro-sweeps.","backend":"mirror_sd_mlx","context_only_draft_cache":1,"draft_sink":56}}
{"run":534,"commit":"8b55918","metric":84.57325615699165,"metrics":{},"status":"discard","description":"Stability rerun of unchanged keep after sink=56 regression sample.","timestamp":1776276523601,"segment":23,"confidence":8.256671358638643,"iterationTokens":620,"asi":{"hypothesis":"If sink=56 regression was isolated, baseline keep config should quickly rebound toward 106+.","rollback_reason":"Baseline still degraded (84.57), indicating persistent instability window.","next_action_hint":"Continue minimal probing and avoid concluding sink-ordering from current unstable band.","backend":"mirror_sd_mlx","context_only_draft_cache":1,"draft_sink":48,"stability_probe":true}}
{"run":535,"commit":"8b55918","metric":82.39574783396017,"metrics":{},"status":"discard","description":"Control symmetry check in current low band: disable mirror runtime while context-only sink=48 remains active.","timestamp":1776276558085,"segment":23,"confidence":8.007772483647843,"iterationTokens":698,"asi":{"hypothesis":"If low-band behavior is global, control should be similarly degraded.","rollback_reason":"Control is also low (82.40), indicating shared instability rather than mirror-only collapse.","next_action_hint":"Keep treating this period as unstable; use occasional paired checks but avoid new micro-keeps from this band.","backend":"bstnxbt_mlx","mirror_runtime_enabled":0,"context_only_draft_cache":1,"draft_sink":48,"collapse_regime":true}}
{"run":536,"commit":"8b55918","metric":77.35636072539137,"metrics":{},"status":"discard","description":"Additional unchanged mirror keep rerun during sustained instability period.","timestamp":1776276593672,"segment":23,"confidence":7.773440686059269,"iterationTokens":843,"asi":{"hypothesis":"Periodic unchanged reruns will show whether throughput band is recovering.","rollback_reason":"Still low at 77.36 tok/s.","next_action_hint":"Continue low-frequency stability checks; avoid introducing new code changes while band is unstable.","backend":"mirror_sd_mlx","context_only_draft_cache":1,"draft_sink":48,"stability_probe":true}}
{"run":537,"commit":"8b55918","metric":81.17840040567455,"metrics":{},"status":"discard","description":"Context-only sink sweep: DFLASH_DRAFT_SINK=40.","timestamp":1776276635692,"segment":23,"confidence":7.0691125821401855,"iterationTokens":1460,"asi":{"hypothesis":"A smaller sink than 48 may further reduce draft attention overhead and improve throughput.","rollback_reason":"Non-winning sample (81.18 vs 106.86 keep) under unstable regime.","next_action_hint":"Add sink=40 to tentative non-win list; revisit only if stable regime returns and sink tuning remains promising.","backend":"mirror_sd_mlx","context_only_draft_cache":1,"draft_sink":40}}
{"run":538,"commit":"8b55918","metric":81.34522386973488,"metrics":{},"status":"discard","description":"Baseline keep rerun after sink=40 probe (unchanged config).","timestamp":1776276668221,"segment":23,"confidence":6.48181481727834,"iterationTokens":611,"asi":{"hypothesis":"If sink=40 result was specific, baseline should rebound upward quickly.","rollback_reason":"Baseline remained low at 81.35 tok/s.","next_action_hint":"Continue to treat current measurement window as unstable and defer new micro-tuning decisions.","backend":"mirror_sd_mlx","context_only_draft_cache":1,"draft_sink":48,"stability_probe":true}}
{"run":539,"commit":"8b55918","metric":76.87059483522579,"metrics":{},"status":"discard","description":"Re-opened block-size check under new context-only keep shape: DFLASH_BLOCK_TOKENS=16.","timestamp":1776276716621,"segment":23,"confidence":6.435309955243953,"iterationTokens":2956,"asi":{"hypothesis":"Context-only draft cache might shift the mirror block-size optimum, making 16 viable again.","rollback_reason":"Non-winning sample (76.87 vs 106.86 keep) even under the new context-only configuration.","next_action_hint":"Keep block size 15; context-only mode does not justify reopening block size 16 on this lane.","backend":"mirror_sd_mlx","context_only_draft_cache":1,"draft_sink":48,"dflash_block_tokens":16}}
{"run":540,"commit":"8b55918","metric":94.52167509374799,"metrics":{},"status":"discard","description":"Baseline recovery probe after block-size=16 check reverted to keep config.","timestamp":1776276747935,"segment":23,"confidence":6.389467653347321,"iterationTokens":654,"asi":{"hypothesis":"After reverting block-size stress test, baseline keep config should rebound toward high-100 band.","rollback_reason":"Partial recovery only (94.52), still below stable-keep expectation.","next_action_hint":"Continue sparse stability checks and avoid adopting new tweaks until runs consistently return to ~106 band.","backend":"mirror_sd_mlx","context_only_draft_cache":1,"draft_sink":48,"stability_probe":true}}
{"run":541,"commit":"8b55918","metric":94.99477824429594,"metrics":{},"status":"discard","description":"Control pair run after partial baseline recovery: disable mirror runtime with context-only sink=48 config.","timestamp":1776276781718,"segment":23,"confidence":6.1280878351748305,"iterationTokens":709,"asi":{"hypothesis":"If current ~95 band is global, control should be close to mirror baseline in this window.","rollback_reason":"Control run is comparison-only; not a mirror keep candidate.","next_action_hint":"Mirror/control are near-tied again in this mid-band; continue waiting for stable high-band conditions before fine tuning.","backend":"bstnxbt_mlx","mirror_runtime_enabled":0,"context_only_draft_cache":1,"draft_sink":48,"paired_delta_tok_s":-0.47310315054795193}}
{"run":542,"commit":"8b55918","metric":96.89540971818757,"metrics":{},"status":"discard","description":"Context-only keep shape chunk retune: DFLASH_BSTNXBT_SPLIT_CHUNK_SIZE=6.","timestamp":1776276825920,"segment":23,"confidence":5.887252589597123,"iterationTokens":1090,"asi":{"hypothesis":"With context-only draft cache enabled, a smaller split chunk (6) might improve short-lane scheduling.","rollback_reason":"Below keep (96.90 vs 106.86).","next_action_hint":"Add chunk size 6 to mirror do-not-retry set; default 8 remains preferred.","backend":"mirror_sd_mlx","context_only_draft_cache":1,"draft_sink":48,"split_chunk_size":6}}
{"run":543,"commit":"8b55918","metric":91.4340367184832,"metrics":{},"status":"discard","description":"Baseline re-anchor after split_chunk_size=6 discard (keep config restored).","timestamp":1776276853292,"segment":23,"confidence":5.86492508588998,"iterationTokens":650,"asi":{"hypothesis":"After reverting failed chunk retune, baseline should move back toward current keep band.","rollback_reason":"Baseline remained in lower regime at 91.43.","next_action_hint":"Continue instability tracking; avoid broadening chunk sweeps until high band returns.","backend":"mirror_sd_mlx","context_only_draft_cache":1,"draft_sink":48,"stability_probe":true}}
{"run":544,"commit":"8b55918","metric":95.55200331598184,"metrics":{},"status":"discard","description":"Ongoing unchanged baseline check for sink=48 context-only keep.","timestamp":1776276898532,"segment":23,"confidence":5.842766297189291,"iterationTokens":1188,"asi":{"hypothesis":"Periodic reruns may show recovery from degraded 80–95 regime back to high-band performance.","rollback_reason":"Still below keep at 95.55 tok/s.","next_action_hint":"Maintain conservative experimentation and continue paired checks; current regime still too unstable for tiny optimizations.","backend":"mirror_sd_mlx","context_only_draft_cache":1,"draft_sink":48,"stability_probe":true}}
{"run":545,"commit":"8b55918","metric":97.90700705913001,"metrics":{},"status":"discard","description":"Paired control check after 95.55 mirror sample: disable mirror runtime with context-only sink=48 config.","timestamp":1776276935589,"segment":23,"confidence":5.522522077377192,"iterationTokens":694,"asi":{"hypothesis":"Control comparison will show whether current ~95 sample reflects global drift or mirror-specific dip.","rollback_reason":"Control run is comparison-only; not a mirror keep candidate.","next_action_hint":"Mirror trailed this paired control sample (~-2.36 tok/s); continue tracking paired medians before drawing conclusions.","backend":"bstnxbt_mlx","mirror_runtime_enabled":0,"context_only_draft_cache":1,"draft_sink":48,"paired_delta_tok_s":-2.3550037431481665}}
{"run":546,"commit":"8b55918","metric":99.18437399927751,"metrics":{},"status":"discard","description":"Mirror follow-up run after paired 97.91 control sample.","timestamp":1776276963436,"segment":23,"confidence":5.358368591869116,"iterationTokens":663,"asi":{"hypothesis":"Mirror may recover relative to control on immediate follow-up if prior lag was noise.","rollback_reason":"Still below keep despite recovering above paired control (99.18 vs 97.91 control).","next_action_hint":"Continue using paired windows; backend ordering remains noisy in degraded band.","backend":"mirror_sd_mlx","context_only_draft_cache":1,"draft_sink":48,"paired_control_tok_s":97.90700705913001,"paired_delta_tok_s":1.277366940147501}}
{"run":547,"commit":"8b55918","metric":99.43927513462386,"metrics":{},"status":"discard","description":"Context-only keep shape cache-reservation probe: INITIAL_CACHE_BLOCKS=24.","timestamp":1776276999036,"segment":23,"confidence":5.136960130963281,"iterationTokens":863,"asi":{"hypothesis":"A slight cache reservation bump from 16 to 24 might stabilize throughput with context-only draft cache enabled.","rollback_reason":"Below keep (99.44 vs 106.86).","next_action_hint":"Add 24 to mirror cache do-not-retry list under current lane; default reservation remains preferred.","backend":"mirror_sd_mlx","context_only_draft_cache":1,"draft_sink":48,"initial_cache_blocks":24}}
{"run":548,"commit":"8b55918","metric":99.89759277285006,"metrics":{},"status":"discard","description":"Baseline re-anchor run after INITIAL_CACHE_BLOCKS=24 probe reverted.","timestamp":1776277026778,"segment":23,"confidence":4.933122876253365,"iterationTokens":636,"asi":{"hypothesis":"Keep config should resume near its current operating band after reverting cache-reservation probe.","rollback_reason":"Still below keep at 99.90 tok/s.","next_action_hint":"Current regime appears centered around ~100; prioritize robust multi-run validation before accepting further micro changes.","backend":"mirror_sd_mlx","context_only_draft_cache":1,"draft_sink":48,"stability_probe":true}}
{"run":549,"commit":"8b55918","metric":105.04646941351466,"metrics":{},"status":"discard","description":"Context-only draft cache implementation tweak: pre-trim old cache slices before append to reduce concat/window churn in ContextOnlyDraftKVCache.","timestamp":1776277164510,"segment":23,"confidence":5.136960130963281,"iterationTokens":5883,"asi":{"hypothesis":"Trimming old sink+tail before append should reduce intermediate tensor work and improve context-only draft cache performance.","rollback_reason":"Recovered toward high band but still below keep (105.05 vs 106.86).","next_action_hint":"Do not keep this code change under current evidence; if stability returns and this pattern recurs, re-test with paired baseline/control.","backend":"mirror_sd_mlx","context_only_draft_cache":1,"draft_sink":48,"optimization":"pretrim_old_before_append"}}
{"run":550,"commit":"8b55918","metric":106.3043110811762,"metrics":{},"status":"discard","description":"Post-revert baseline rerun (unchanged keep config) after context-cache pretrim experiment.","timestamp":1776277192182,"segment":23,"confidence":5.358368591869116,"iterationTokens":691,"asi":{"hypothesis":"If prior run benefited from temporary regime recovery, reverted baseline should also return near high-band performance.","rollback_reason":"Recovered strongly to 106.30 but still below keep (106.86).","next_action_hint":"High-band appears restored; resume targeted tuning around context-only keep shape.","backend":"mirror_sd_mlx","context_only_draft_cache":1,"draft_sink":48,"stability_recovered":true}}
{"run":551,"commit":"8b55918","metric":106.63846440284267,"metrics":{},"status":"discard","description":"Context-only sink neighborhood sweep: DFLASH_DRAFT_SINK=44.","timestamp":1776277228259,"segment":23,"confidence":5.371074748775659,"iterationTokens":785,"asi":{"hypothesis":"A slightly smaller sink than 48 may further reduce overhead while preserving quality in stable high-band conditions.","rollback_reason":"Below keep (106.64 vs 106.86).","next_action_hint":"Keep sink=48; add 44 as non-winning neighbor in current high-band regime.","backend":"mirror_sd_mlx","context_only_draft_cache":1,"draft_sink":44}}
{"run":552,"commit":"8b55918","metric":106.18384494133093,"metrics":{},"status":"discard","description":"Context-only sink neighborhood sweep: DFLASH_DRAFT_SINK=52.","timestamp":1776277267927,"segment":23,"confidence":5.5137920841677435,"iterationTokens":694,"asi":{"hypothesis":"A slightly larger sink than 48 may improve acceptance enough to offset extra attention cost.","rollback_reason":"Below keep (106.18 vs 106.86).","next_action_hint":"Keep sink=48 as local optimum among tested nearby values.","backend":"mirror_sd_mlx","context_only_draft_cache":1,"draft_sink":52}}
{"run":553,"commit":"8b55918","metric":101.8750797376364,"metrics":{},"status":"discard","description":"Baseline rerun after sink-neighborhood sweeps (unchanged keep config).","timestamp":1776277297449,"segment":23,"confidence":5.371074748775659,"iterationTokens":590,"asi":{"hypothesis":"After nearby sink sweeps, baseline should remain close to high-band values.","rollback_reason":"Dropped to 101.88, indicating continued regime volatility.","next_action_hint":"Maintain paired mirror/control checks when variance spikes; avoid overinterpreting single runs.","backend":"mirror_sd_mlx","context_only_draft_cache":1,"draft_sink":48,"stability_probe":true}}
{"run":554,"commit":"8b55918","metric":58.80965187098457,"metrics":{},"status":"discard","description":"Paired control check after 101.88 mirror sample (mirror disabled).","timestamp":1776277338693,"segment":23,"confidence":5.080383177487162,"iterationTokens":694,"asi":{"hypothesis":"Control rerun will indicate whether mirror dip is backend-specific or global instability.","rollback_reason":"Control collapsed to 58.81, confirming severe global instability in this pairing window.","next_action_hint":"Tag this interval as unstable; do not make backend-rank conclusions from this pair.","backend":"bstnxbt_mlx","mirror_runtime_enabled":0,"context_only_draft_cache":1,"draft_sink":48,"collapse_regime":true}}
{"run":555,"commit":"8b55918","metric":59.69387897478699,"metrics":{},"status":"discard","description":"Mirror follow-up run after paired control collapse sample.","timestamp":1776277377493,"segment":23,"confidence":4.938112937037325,"iterationTokens":616,"asi":{"hypothesis":"If control collapse was global, mirror should also collapse in the same period.","rollback_reason":"Mirror also collapsed to 59.69 tok/s, confirming global degraded window.","next_action_hint":"Run occasional recovery probes only; suspend micro-optimization inference until throughput normalizes.","backend":"mirror_sd_mlx","context_only_draft_cache":1,"draft_sink":48,"collapse_regime":true}}
{"run":556,"commit":"8b55918","metric":67.47005725902723,"metrics":{},"status":"discard","description":"Recovery probe after renewed ~59 collapse pair (unchanged keep config).","timestamp":1776277434530,"segment":23,"confidence":4.803593860487517,"iterationTokens":1429,"asi":{"hypothesis":"Throughput should begin rebounding upward after severe transient collapse episodes.","rollback_reason":"Only partial recovery to 67.47 tok/s.","next_action_hint":"Continue sparse recovery probes; avoid introducing new tuning dimensions in this unstable trough.","backend":"mirror_sd_mlx","context_only_draft_cache":1,"draft_sink":48,"stability_probe":true}}
{"run":557,"commit":"8b55918","metric":66.17634347600185,"metrics":{},"status":"discard","description":"Control symmetry check in current ~67 trough (mirror disabled).","timestamp":1776277471880,"segment":23,"confidence":4.586103649898073,"iterationTokens":675,"asi":{"hypothesis":"If the trough is global, control should mirror the same low throughput region.","rollback_reason":"Control also low at 66.18, confirming shared instability.","next_action_hint":"Keep treating this window as unstable and continue only coarse recovery monitoring.","backend":"bstnxbt_mlx","mirror_runtime_enabled":0,"context_only_draft_cache":1,"draft_sink":48,"collapse_regime":true}}
{"run":558,"commit":"8b55918","metric":68.69489864313695,"metrics":{},"status":"discard","description":"Mirror follow-up after trough control symmetry check (unchanged keep config).","timestamp":1776277503239,"segment":23,"confidence":4.392903008953494,"iterationTokens":618,"asi":{"hypothesis":"Mirror throughput may start recovering from the ~66 trough on immediate rerun.","rollback_reason":"Only slight rebound to 68.69; still far below stable high band.","next_action_hint":"Continue low-frequency monitoring and avoid adding new parameter sweeps until this trough resolves.","backend":"mirror_sd_mlx","context_only_draft_cache":1,"draft_sink":48,"stability_probe":true}}
