{"run":1793,"commit":"54028e7","metric":9.619307289714925,"metrics":{},"status":"discard","description":"Soft-band oscillation improved modestly (~99.19 tok/s, eval_s ~9.62) but remains above high-window best.","timestamp":1776372950888,"segment":24,"confidence":0.06677780057043141,"iterationTokens":1871,"asi":{"hypothesis":"Post-collapse regime has settled into a shared soft-band pocket with eval-driven jitter and fixed acceptance.","rollback_reason":"Primary metric still above best 8.743.","next_action_hint":"Continue unchanged mirror loop and wait for either high-window breakout (<8.9) or new collapse transition for parity check.","diagnostic_findings":{"completion_tok_s":99.19361956412055,"dflash_eval_s":9.619307289714925,"dflash_total_s":10.127612291020341,"dflash_acceptance_rate":0.6972201352366642}}}
{"run":1794,"commit":"54028e7","metric":9.1643676267704,"metrics":{},"status":"discard","description":"Post-recovery run improved into upper soft band (~103.89 tok/s, eval_s ~9.16) with unchanged acceptance signature.","timestamp":1776373005738,"segment":24,"confidence":0.06823683425989961,"iterationTokens":8479,"asi":{"hypothesis":"Current oscillation may continue climbing from ~9.6 toward low-9/high-8 window before next transition.","rollback_reason":"Primary metric remains above best (~8.743).","next_action_hint":"Continue unchanged mirror loop and watch for either sub-9 re-entry or renewed collapse onset.","diagnostic_findings":{"completion_tok_s":103.8869653004878,"dflash_eval_s":9.1643676267704,"dflash_total_s":9.664558500051498,"dflash_acceptance_rate":0.6972201352366642}}}
{"run":1795,"commit":"54028e7","metric":9.006238380097784,"metrics":{},"status":"discard","description":"Further rebound approached sub-9 threshold (~105.61 tok/s, eval_s ~9.01) with fixed speculative counters.","timestamp":1776373033109,"segment":24,"confidence":0.06978000156344003,"iterationTokens":1165,"asi":{"hypothesis":"Recovery wave is nearing prior high-soft boundary and may cross into high window on near-term repeats.","rollback_reason":"Primary metric still above best.","next_action_hint":"Run unchanged mirror again to test for sub-9 crossing and potential high-window reopen.","diagnostic_findings":{"completion_tok_s":105.60815530081162,"dflash_eval_s":9.006238380097784,"dflash_total_s":9.50509112502914,"dflash_acceptance_rate":0.6972201352366642}}}
{"run":1796,"commit":"54028e7","metric":8.999075745698065,"metrics":{},"status":"discard","description":"Recovered to just-under-9 eval band (~105.55 tok/s, eval_s ~8.999) while acceptance remained invariant.","timestamp":1776373065615,"segment":24,"confidence":0.07033965867566637,"iterationTokens":1145,"asi":{"hypothesis":"Sub-9 re-entry marks transition back toward high window, but true improvement needs sustained movement toward prior ~8.74 floor.","rollback_reason":"Primary metric still above best (~8.743).","next_action_hint":"Continue unchanged mirror loop for high-window verification and possible new low.","diagnostic_findings":{"completion_tok_s":105.55498574662636,"dflash_eval_s":8.999075745698065,"dflash_total_s":9.503879124997184,"dflash_acceptance_rate":0.6972201352366642}}}
{"run":1797,"commit":"54028e7","metric":8.958372240420431,"metrics":{},"status":"discard","description":"Upper-soft/high run held strong (~106.13 tok/s, eval_s ~8.958) but still above best floor.","timestamp":1776373092289,"segment":24,"confidence":0.07090836561524475,"iterationTokens":1205,"asi":{"hypothesis":"Current regime is drifting upward toward high window without structural telemetry changes.","rollback_reason":"Primary metric not below best.","next_action_hint":"Keep unchanged loop; seek either sustained <8.9 band or new collapse transition.","diagnostic_findings":{"completion_tok_s":106.13302484213764,"dflash_eval_s":8.958372240420431,"dflash_total_s":9.456880416953936,"dflash_acceptance_rate":0.6972201352366642}}}
{"run":1798,"commit":"54028e7","metric":8.970949831651524,"metrics":{},"status":"discard","description":"Repeat sample stayed in near-high soft band (~105.92 tok/s, eval_s ~8.971) with stable speculative telemetry.","timestamp":1776373121013,"segment":24,"confidence":0.07846532478275159,"iterationTokens":1136,"asi":{"hypothesis":"Near-high pocket is persistent but currently bounded above the best eval floor.","rollback_reason":"Primary metric above best.","next_action_hint":"Continue unchanged loop and monitor for breakout below ~8.9 or onset of next collapse.","diagnostic_findings":{"completion_tok_s":105.92328837841048,"dflash_eval_s":8.970949831651524,"dflash_total_s":9.471922000055201,"dflash_acceptance_rate":0.6972201352366642}}}
{"run":1799,"commit":"54028e7","metric":8.98107958107721,"metrics":{},"status":"discard","description":"Another near-high run (~105.86 tok/s, eval_s ~8.98) reinforced stable acceptance-invariant soft/high pocket.","timestamp":1776373146918,"segment":24,"confidence":0.08803773319229227,"iterationTokens":1142,"asi":{"hypothesis":"Current post-collapse pocket has stabilized around ~8.95–9.00 eval_s pending next regime transition.","rollback_reason":"Primary metric still above best.","next_action_hint":"Continue unchanged monitoring; parity checks not needed unless a hard drop returns.","diagnostic_findings":{"completion_tok_s":105.85751506582088,"dflash_eval_s":8.98107958107721,"dflash_total_s":9.482322499970905,"dflash_acceptance_rate":0.6972201352366642}}}
{"run":1800,"commit":"54028e7","metric":9.06771454506088,"metrics":{},"status":"discard","description":"Soft/high pocket loosened slightly (~104.88 tok/s, eval_s ~9.07) but speculative telemetry stayed fixed.","timestamp":1776373172855,"segment":24,"confidence":0.09132304993851238,"iterationTokens":1163,"asi":{"hypothesis":"Current regime is mild jitter around low-9 eval_s rather than decisive breakout.","rollback_reason":"Primary metric above best floor.","next_action_hint":"Continue unchanged loop and track whether jitter trends upward (collapse precursor) or back toward <9.","diagnostic_findings":{"completion_tok_s":104.88325618592907,"dflash_eval_s":9.06771454506088,"dflash_total_s":9.57286362501327,"dflash_acceptance_rate":0.6972201352366642}}}
{"run":1801,"commit":"54028e7","metric":9.066326416446827,"metrics":{},"status":"discard","description":"Back-to-back repeat nearly identical (~104.88 tok/s, eval_s ~9.066), confirming stable low-9 plateau with unchanged acceptance.","timestamp":1776373198379,"segment":24,"confidence":0.09489811760170924,"iterationTokens":1140,"asi":{"hypothesis":"This regime is currently stationary around ~9.06 eval_s and not moving toward best without a broader transition.","rollback_reason":"Primary metric not improved.","next_action_hint":"Continue unchanged loop to catch transition edges (sub-9 breakout or renewed collapse).","diagnostic_findings":{"completion_tok_s":104.88298671730418,"dflash_eval_s":9.066326416446827,"dflash_total_s":9.569892499945126,"dflash_acceptance_rate":0.6972201352366642}}}
{"run":1802,"commit":"54028e7","metric":9.13318645535037,"metrics":{},"status":"discard","description":"Plateau drifted slightly softer (~104.11 tok/s, eval_s ~9.13) while acceptance and draft-step telemetry stayed constant.","timestamp":1776373226597,"segment":24,"confidence":0.09524302150364566,"iterationTokens":1155,"asi":{"hypothesis":"Small eval_s drift within the low-9 plateau is regime noise, not structural speculative change.","rollback_reason":"Primary metric above best.","next_action_hint":"Continue unchanged loop; wait for meaningful transition before parity checks.","diagnostic_findings":{"completion_tok_s":104.11410601008389,"dflash_eval_s":9.13318645535037,"dflash_total_s":9.635549791972153,"dflash_acceptance_rate":0.6972201352366642}}}
{"run":1803,"commit":"54028e7","metric":9.195763376657851,"metrics":{},"status":"discard","description":"Low-9 plateau softened further (~103.51 tok/s, eval_s ~9.20) with no change in speculative structure.","timestamp":1776373252637,"segment":24,"confidence":0.09559044163315207,"iterationTokens":1140,"asi":{"hypothesis":"This may be gradual drift within the same regime rather than collapse onset, given unchanged telemetry shape.","rollback_reason":"Primary metric remains above best.","next_action_hint":"Keep unchanged loop; trigger parity only if eval_s accelerates into clear degraded range.","diagnostic_findings":{"completion_tok_s":103.50606014901726,"dflash_eval_s":9.195763376657851,"dflash_total_s":9.696982959052548,"dflash_acceptance_rate":0.6972201352366642}}}
{"run":1804,"commit":"54028e7","metric":9.24180687603075,"metrics":{},"status":"discard","description":"Soft-band drift continued (~103.06 tok/s, eval_s ~9.24) while acceptance and draft cadence stayed invariant.","timestamp":1776373278837,"segment":24,"confidence":0.09526868348058948,"iterationTokens":1155,"asi":{"hypothesis":"The regime is slowly softening but still far from hard-collapse behavior.","rollback_reason":"Primary metric above best.","next_action_hint":"Continue unchanged mirror runs; parity remains unnecessary unless eval_s sharply jumps.","diagnostic_findings":{"completion_tok_s":103.05616288717405,"dflash_eval_s":9.24180687603075,"dflash_total_s":9.746596666052938,"dflash_acceptance_rate":0.6972201352366642}}}
{"run":1805,"commit":"54028e7","metric":9.34981954318937,"metrics":{},"status":"discard","description":"Soft-band slipped further (~101.87 tok/s, eval_s ~9.35) with unchanged acceptance profile.","timestamp":1776373308144,"segment":24,"confidence":0.09494908414221259,"iterationTokens":1127,"asi":{"hypothesis":"A gentle pre-collapse softening may be underway, still dominated by eval_s drift.","rollback_reason":"Primary metric remains above best.","next_action_hint":"Continue unchanged mirror loop and watch for acceleration toward >=10 eval_s before parity check.","diagnostic_findings":{"completion_tok_s":101.87148901274239,"dflash_eval_s":9.34981954318937,"dflash_total_s":9.857572249951772,"dflash_acceptance_rate":0.6972201352366642}}}
{"run":1806,"commit":"54028e7","metric":9.346586287836544,"metrics":{},"status":"discard","description":"Near-identical follow-up held at ~9.35 eval_s (~101.96 tok/s), reinforcing current softened plateau.","timestamp":1776373335838,"segment":24,"confidence":0.09222713924246848,"iterationTokens":1167,"asi":{"hypothesis":"The system is currently pinned in a stable ~9.35 eval pocket rather than transitioning.","rollback_reason":"Primary metric still not competitive with best.","next_action_hint":"Continue unchanged loop; fire parity only on abrupt degradation transition.","diagnostic_findings":{"completion_tok_s":101.95637506814427,"dflash_eval_s":9.346586287836544,"dflash_total_s":9.851150041911751,"dflash_acceptance_rate":0.6972201352366642}}}
{"run":1807,"commit":"54028e7","metric":9.519099670811556,"metrics":{},"status":"discard","description":"Softened into lower soft band (~100.18 tok/s, eval_s ~9.52) with acceptance invariants unchanged.","timestamp":1776373363878,"segment":24,"confidence":0.09072699024234786,"iterationTokens":1156,"asi":{"hypothesis":"Current plateau is drifting upward in eval_s but still below collapse threshold.","rollback_reason":"Primary metric above best.","next_action_hint":"Continue unchanged mirror loop; watch for crossing into >=10 eval_s trend.","diagnostic_findings":{"completion_tok_s":100.18324695788777,"dflash_eval_s":9.519099670811556,"dflash_total_s":10.030669166939333,"dflash_acceptance_rate":0.6972201352366642}}}
{"run":1808,"commit":"54028e7","metric":9.40015866572503,"metrics":{},"status":"discard","description":"Recovered a bit within soft band (~101.41 tok/s, eval_s ~9.40) while structural speculative telemetry stayed fixed.","timestamp":1776373391101,"segment":24,"confidence":0.09037653418089225,"iterationTokens":1157,"asi":{"hypothesis":"The current state is an oscillatory soft pocket around ~9.4–9.5 eval_s.","rollback_reason":"Primary metric still above best.","next_action_hint":"Continue unchanged monitoring; parity only if a hard transition appears.","diagnostic_findings":{"completion_tok_s":101.40986742851936,"dflash_eval_s":9.40015866572503,"dflash_total_s":9.901835624943487,"dflash_acceptance_rate":0.6972201352366642}}}
{"run":1809,"commit":"54028e7","metric":9.549760671099648,"metrics":{},"status":"discard","description":"Soft pocket softened again (~99.78 tok/s, eval_s ~9.55) with acceptance profile unchanged.","timestamp":1776373418780,"segment":24,"confidence":0.09002877515269779,"iterationTokens":1150,"asi":{"hypothesis":"Post-recovery regime remains eval-jitter dominated and can dip below/above 100 tok/s without structural changes.","rollback_reason":"Primary metric above best.","next_action_hint":"Continue unchanged loop; still below collapse threshold so defer parity check.","diagnostic_findings":{"completion_tok_s":99.78382526067027,"dflash_eval_s":9.549760671099648,"dflash_total_s":10.06578574993182,"dflash_acceptance_rate":0.6972201352366642}}}
{"run":1810,"commit":"54028e7","metric":9.497594952234067,"metrics":{},"status":"discard","description":"Minor rebound within same soft pocket (~100.43 tok/s, eval_s ~9.50), acceptance structure unchanged.","timestamp":1776373445459,"segment":24,"confidence":0.08196719260245504,"iterationTokens":1133,"asi":{"hypothesis":"Current oscillation band is ~9.4–9.6 eval_s with no speculative-structure movement.","rollback_reason":"Primary metric remains above best.","next_action_hint":"Continue unchanged loop; watch for regime break either direction.","diagnostic_findings":{"completion_tok_s":100.42591892436822,"dflash_eval_s":9.497594952234067,"dflash_total_s":10.006509915925562,"dflash_acceptance_rate":0.6972201352366642}}}
{"run":1811,"commit":"54028e7","metric":9.582335294340737,"metrics":{},"status":"discard","description":"Soft-band oscillation tilted slightly slower (~99.57 tok/s, eval_s ~9.58) with acceptance counters unchanged.","timestamp":1776373472350,"segment":24,"confidence":0.07689670536158355,"iterationTokens":1167,"asi":{"hypothesis":"Current regime remains a stable soft pocket around ~9.4–9.6 eval_s rather than immediate collapse.","rollback_reason":"Primary metric still above best.","next_action_hint":"Continue unchanged mirror loop; parity checks remain transition-triggered only.","diagnostic_findings":{"completion_tok_s":99.56696029490605,"dflash_eval_s":9.582335294340737,"dflash_total_s":10.092641750001349,"dflash_acceptance_rate":0.6972201352366642}}}
{"run":1812,"commit":"54028e7","metric":9.4407712520333,"metrics":{},"status":"discard","description":"Soft-pocket sample (~101.00 tok/s, eval_s ~9.44) stayed within newly observed 9.0–9.6 band with invariant acceptance.","timestamp":1776373518434,"segment":24,"confidence":0.07782924435875707,"iterationTokens":1856,"asi":{"hypothesis":"Current regime remains stable soft-band oscillation with no structural speculative changes.","rollback_reason":"Primary metric above best 8.743.","next_action_hint":"Continue unchanged mirror loop for potential high-window breakout or next hard transition.","diagnostic_findings":{"completion_tok_s":101.0022318004601,"dflash_eval_s":9.4407712520333,"dflash_total_s":9.94622579193674,"dflash_acceptance_rate":0.6972201352366642}}}
{"run":1813,"commit":"54028e7","metric":9.389016205561347,"metrics":{},"status":"discard","description":"Another soft-band point (~101.53 tok/s, eval_s ~9.39) confirmed stable oscillation with unchanged acceptance metrics.","timestamp":1776373544907,"segment":24,"confidence":0.0787846791243664,"iterationTokens":1152,"asi":{"hypothesis":"Soft-pocket stationarity persists until a discrete regime transition occurs.","rollback_reason":"Primary metric still above best.","next_action_hint":"Continue unchanged monitoring and reserve parity checks for abrupt degraded jumps.","diagnostic_findings":{"completion_tok_s":101.53138504100643,"dflash_eval_s":9.389016205561347,"dflash_total_s":9.892369749955833,"dflash_acceptance_rate":0.6972201352366642}}}
{"run":1814,"commit":"54028e7","metric":9.292608041781932,"metrics":{},"status":"discard","description":"Soft pocket firmed slightly (~102.52 tok/s, eval_s ~9.29) with acceptance profile unchanged.","timestamp":1776373571252,"segment":24,"confidence":0.07927560544427226,"iterationTokens":1125,"asi":{"hypothesis":"Current state remains bounded oscillation in low-9s, awaiting next regime shift.","rollback_reason":"Primary metric remains above best.","next_action_hint":"Continue unchanged loop and monitor for breakout below 9.0 or renewed collapse onset.","diagnostic_findings":{"completion_tok_s":102.51633638976132,"dflash_eval_s":9.292608041781932,"dflash_total_s":9.796049791038968,"dflash_acceptance_rate":0.6972201352366642}}}
{"run":1815,"commit":"54028e7","metric":9.358127993880771,"metrics":{},"status":"discard","description":"Another soft-band run (~101.75 tok/s, eval_s ~9.36) kept the same acceptance-invariant profile.","timestamp":1776373598868,"segment":24,"confidence":0.07955940397832771,"iterationTokens":1202,"asi":{"hypothesis":"Low-9 oscillation continues as a stable regime with eval-driven variability only.","rollback_reason":"Primary metric above best.","next_action_hint":"Keep unchanged mirror loop; transition-aware parity checks only when hard degradation appears.","diagnostic_findings":{"completion_tok_s":101.75202024110312,"dflash_eval_s":9.358127993880771,"dflash_total_s":9.866134834010154,"dflash_acceptance_rate":0.6972201352366642}}}
{"run":1816,"commit":"54028e7","metric":8.749532917747274,"metrics":{},"status":"discard","description":"High-window re-entry sample (~108.21 tok/s, eval_s ~8.750) approached the best floor but did not beat 8.743.","timestamp":1776374804627,"segment":24,"confidence":0.07927560544427226,"iterationTokens":10025,"asi":{"hypothesis":"The softened low-9 pocket can reopen into high-window lows without structural telemetry changes.","rollback_reason":"Primary metric remained above current best.","next_action_hint":"Continue unchanged mirror loop while high window is open; verify if a lower-than-8.743 sample appears.","diagnostic_findings":{"completion_tok_s":108.20924248690709,"dflash_eval_s":8.749532917747274,"dflash_total_s":9.270429000025615,"dflash_acceptance_rate":0.6972201352366642}}}
{"run":1817,"commit":"54028e7","metric":8.781215994968079,"metrics":{},"status":"discard","description":"High-window continuation stayed strong (~107.97 tok/s, eval_s ~8.781) with unchanged acceptance profile but did not beat the best floor.","timestamp":1776375712671,"segment":24,"confidence":0.07925325816551651,"iterationTokens":10025,"asi":{"hypothesis":"The reopened high-window can revisit sub-8.8 eval_s without structural telemetry movement.","rollback_reason":"Primary metric above current best (~8.743).","next_action_hint":"Continue unchanged mirror loop while high-window conditions persist.","diagnostic_findings":{"completion_tok_s":107.97471234993553,"dflash_eval_s":8.781215994968079,"dflash_total_s":9.29499316692818,"dflash_acceptance_rate":0.6972201352366642}}}
{"run":1818,"commit":"54028e7","metric":9.118424997548573,"metrics":{},"status":"discard","description":"Single-run softening to ~9.12 eval_s (~102.39 tok/s) with unchanged acceptance; likely within regime jitter, though draft/verify phase times were elevated this sample.","timestamp":1776375746439,"segment":24,"confidence":0.08040636009807714,"iterationTokens":1188,"asi":{"hypothesis":"High-window can slip back into low-9 pocket without any acceptance-structure change.","rollback_reason":"Primary metric regressed versus best.","next_action_hint":"Run another unchanged mirror sample to see if this is transient jitter or a sustained drift.","diagnostic_findings":{"completion_tok_s":102.39289649295266,"dflash_eval_s":9.118424997548573,"dflash_total_s":9.744847249938175,"dflash_draft_s":0.2108393837697804,"dflash_verify_s":0.16250612656585872,"dflash_acceptance_rate":0.6972201352366642}}}
{"run":1819,"commit":"54028e7","metric":8.846862751292065,"metrics":{},"status":"discard","description":"Reopened stronger high-soft sample (~106.96 tok/s, eval_s ~8.847) with invariant acceptance, still short of best 8.743.","timestamp":1776375780448,"segment":24,"confidence":0.08509481157338676,"iterationTokens":1233,"asi":{"hypothesis":"Regime remains capable of returning near high-window lows after brief softening.","rollback_reason":"Primary metric did not beat best floor.","next_action_hint":"Keep unchanged mirror loop while high-soft window is open; look for sub-8.80/near-8.74 retest.","diagnostic_findings":{"completion_tok_s":106.95675577115895,"dflash_eval_s":8.846862751292065,"dflash_total_s":9.372296415967867,"dflash_acceptance_rate":0.6972201352366642}}}
{"run":1820,"commit":"54028e7","metric":21.43983820755966,"metrics":{},"status":"discard","description":"Hard collapse onset on unchanged mirror lane: throughput fell to ~45.82 tok/s with eval_s spiking to ~21.44 while acceptance stayed fixed.","timestamp":1776375821043,"segment":24,"confidence":0.08040636009807714,"iterationTokens":1208,"asi":{"hypothesis":"Collapse events remain eval-phase inflations rather than speculative-quality degradation.","rollback_reason":"Primary metric catastrophically worse than best.","next_action_hint":"Run immediate control parity check (DFLASH_MIRROR_SD_RUNTIME=0) to confirm shared attribution in this collapse window.","diagnostic_findings":{"completion_tok_s":45.82371925084312,"dflash_eval_s":21.43983820755966,"dflash_total_s":22.142427291953936,"dflash_draft_s":0.3391135836718604,"dflash_verify_s":0.13786433439236134,"dflash_acceptance_rate":0.6972201352366642,"dflash_draft_steps":96}}}
