{"run":128,"commit":"e7b14c4","metric":27.307180892200954,"metrics":{},"status":"discard","description":"Run the rollback-correct adaptive hybrid with a later 160-token speculative cutoff before falling back to plain greedy on the corrected target cache. This is materially worse than the 128-token cutoff, so the useful speculative window does not extend that far on the benchmark workload.","timestamp":1776018559679,"segment":4,"confidence":58.24324799523699,"iterationTokens":3167,"asi":{"hypothesis":"If the fixed 128-token cutoff is switching to greedy slightly too early, pushing the speculative region later to 160 tokens might preserve more of the early DFlash benefit without paying too much late-phase replay cost.","rollback_reason":"The 160-token cutoff regressed badly, so extending the speculative region deeper into the low-acceptance tail is not beneficial on this workload.","next_action_hint":"If continuing fixed-cutoff sweeps, search closer to the 128-token region rather than later. Acceptance-based fallback may still be more promising than another wide fixed-cutoff jump.","learning":"The adaptive speculative window is bounded on both sides: 96 is too early and 160 is too late. The best fixed-cutoff region appears to be somewhere near 128 tokens for the current workload.","acceptance_learning":"Late-phase acceptance collapse hurts enough that keeping rollback-correct DFlash active through 160 generated tokens is clearly too expensive."}}
{"run":129,"commit":"e7b14c4","metric":28.114097680303082,"metrics":{},"status":"discard","description":"Refine the rollback-correct adaptive hybrid around the current best fixed cutoff by switching from corrected DFlash to plain greedy at 136 generated tokens. This remains below the earlier 128-token cutoff result and below the kept baseline.","timestamp":1776018657123,"segment":4,"confidence":58.993920430805666,"iterationTokens":3250,"asi":{"hypothesis":"The best fixed speculative cutoff might lie near 128 but not exactly on it; moving the adaptive handoff slightly later to 136 tokens could recover a bit more early-DFlash benefit without paying too much low-acceptance tail cost.","rollback_reason":"The 136-token cutoff still underperformed the earlier 128-token adaptive variant and did not beat the kept baseline.","next_action_hint":"Deprioritize further fixed-cutoff sweeps unless an acceptance-based trigger suggests a narrower window. The fixed-cutoff optimum appears to be near 128 and still below the baseline.","learning":"The adaptive-cutoff surface is fairly flat but does not cross the baseline in the nearby region tested so far. 128 remains the best fixed cutoff tried, with 96/136/160 all worse.","acceptance_learning":"A slightly later fixed switch at 136 does not help, which suggests the remaining gain is not in simple cutoff tuning but in a more responsive acceptance-based fallback or better rollback economics."}}
{"run":130,"commit":"e7b14c4","metric":28.07940926303932,"metrics":{},"status":"discard","description":"Add an acceptance-triggered adaptive fallback on top of the rollback-correct accepted-span replay path: after at least 64 generated tokens, stop speculative decoding once the last 8 speculative steps average below 1.75 accepted tokens and finish with plain greedy generation on the corrected target cache. This did not beat the earlier best fixed cutoff or the kept baseline.","timestamp":1776019128435,"segment":4,"confidence":59.88608582697188,"iterationTokens":3250,"asi":{"hypothesis":"A rolling acceptance-based fallback should outperform fixed cutoffs by switching from rollback-correct DFlash to plain greedy near the real point where speculative usefulness collapses on a given prompt.","rollback_reason":"The first acceptance-triggered rule still stayed below both the best fixed 128-token cutoff and the kept cached-mask hybrid baseline.","next_action_hint":"If continuing adaptive policies, tune around stricter/later fallback thresholds or shorter windows, but do not spend too many more cycles here unless one variant clearly surpasses the fixed-cutoff control.","learning":"Acceptance-triggered fallback is viable to test but not automatically better than a tuned fixed cutoff. This first rule likely falls back too early or too noisily for the benchmark workload.","acceptance_learning":"A rule of window=8, threshold=1.75, min_tokens=64 underperformed the simpler 128-token cutoff. The adaptive trigger needs tighter calibration if it is going to help."}}
{"run":131,"commit":"e7b14c4","metric":28.083114351680315,"metrics":{},"status":"discard","description":"Tune the acceptance-triggered adaptive fallback later and tighter: after at least 96 generated tokens, stop speculative decoding only when the last 6 speculative steps average below 1.5 accepted tokens, then finish with plain greedy generation on the corrected target cache. This still does not beat the best fixed cutoff or the kept baseline.","timestamp":1776019170094,"segment":4,"confidence":61.87830845511981,"iterationTokens":1183,"asi":{"hypothesis":"The earlier adaptive fallback likely switched too early; delaying the minimum speculative region and requiring a tighter rolling-acceptance collapse should approximate the useful 128-token fixed cutoff more closely while remaining prompt-adaptive.","rollback_reason":"Even with a later and tighter trigger, the adaptive rule still underperformed the fixed-cutoff control and the kept baseline.","next_action_hint":"Deprioritize more acceptance-trigger tuning unless a very targeted rule is motivated by traces. The adaptive-policy path is not obviously outperforming the simpler fixed cutoff.","learning":"Later/tighter rolling-acceptance fallback remains close to the earlier adaptive result but does not improve it. The adaptive-policy surface appears fairly flat and still below the fixed 128-token cutoff.","acceptance_learning":"A window=6, threshold=1.5, min_tokens=96 trigger is not enough to beat the fixed 128-token cutoff. Acceptance-triggered fallback is not currently delivering extra value over simple fixed scheduling."}}
{"run":132,"commit":"e7b14c4","metric":28.113443399703552,"metrics":{},"status":"discard","description":"Add an opt-in sequential-verify hybrid path that feeds the speculative block through the target one token at a time, stopping at first mismatch so the target cache naturally ends at the accepted span with no rollback or replay. This makes low acceptance less pathological and is competitive, but it still does not beat the kept baseline.","timestamp":1776019308138,"segment":4,"confidence":63.609960008673184,"iterationTokens":6224,"asi":{"hypothesis":"Because rollback-correct replay is expensive and low acceptance is common, a token-by-token verify path that stops at first mismatch could turn low acceptance into a compute savings instead of paying full-block verify plus replay overhead.","rollback_reason":"The sequential-verify path remained below the kept cached-mask hybrid baseline on the primary metric, so it is not a win yet.","next_action_hint":"Validate continuation parity on the sequential-verify path; if correct, it is a useful alternative control because it avoids rollback complexity entirely. Then profile where its remaining cost lives before abandoning it.","learning":"Sequential verify is more competitive than many of the replay-based correctness fixes and avoids the linear-cache rollback problem by construction. Its remaining gap is now about efficiency, not obvious correctness debt.","verify_learning":"With low acceptance, token-by-token verification can be viable. It does not automatically beat the baseline, but it is close enough to justify parity checking and targeted profiling."}}
{"run":133,"commit":"e7b14c4","metric":28.039912499142282,"metrics":{},"status":"discard","description":"Combine the parity-correct sequential-verify hybrid path with a 128-token adaptive handoff to plain greedy generation on the existing target cache. This underperformed plain sequential verify and did not beat the kept baseline.","timestamp":1776019432245,"segment":4,"confidence":64.88896714972455,"iterationTokens":4848,"asi":{"hypothesis":"If sequential verify is correct and competitive but suffers from late low-acceptance overhead, the best fixed-cutoff idea might transfer and improve it by switching to plain greedy for the second half of the decode.","rollback_reason":"Sequential verify plus a 128-token handoff still stayed below both the kept baseline and the no-cutoff sequential-verify control, so this combination is not a win.","next_action_hint":"Do not spend more time mixing fixed cutoffs into sequential verify unless a profile suggests a very specific late-phase bottleneck. Sequential verify’s remaining cost likely needs different treatment.","learning":"Sequential verify is not obviously improved by the same fixed-cutoff strategy that marginally helped the replay-based rollback-correct path. Its cost structure appears different enough that the simple transfer does not help.","verify_learning":"The parity-correct sequential-verify path remains a useful control, but fixed late fallback did not improve it. The remaining gap likely sits in per-step bridge/target call overhead rather than just late acceptance collapse."}}
{"run":134,"commit":"e7b14c4","metric":28.319602329724457,"metrics":{},"status":"discard","description":"Run the parity-correct sequential-verify hybrid path with a smaller speculative block size of 8. With low acceptance, shrinking the drafted block reduces wasted draft work enough to nearly tie the kept baseline, but this run still did not beat it.","timestamp":1776019560795,"segment":4,"confidence":65.26733256577407,"iterationTokens":8142,"asi":{"hypothesis":"On the sequential-verify path, low acceptance makes large drafted blocks wasteful; reducing block_size from 16 to 8 could fit the real acceptance regime better and close the remaining throughput gap.","rollback_reason":"This run came very close but still remained slightly below the kept e7b14c4 baseline, so it is not a primary-metric win yet.","next_action_hint":"Because this result is near-tied, consider a confirmation rerun of the same sequential-verify block_size=8 variant before abandoning it. If it repeatedly stays just under the baseline, then it is a useful correctness control but not a keep.","learning":"Sequential verify plus block_size=8 is the strongest sequential-verify variant so far and one of the closest correctness-preserving paths to the kept baseline. The sequential path appears more compatible with smaller blocks than the older replay-based fixes.","verify_learning":"On the parity-correct sequential-verify path, smaller speculative blocks help materially. That suggests its remaining cost is sensitive to draft overproduction rather than just target-call overhead."}}
{"run":135,"commit":"e7b14c4","metric":28.013966658589943,"metrics":{},"status":"discard","description":"Confirmation rerun for the parity-correct sequential-verify hybrid with block_size=8. The first near-tie did not reproduce; this rerun came in lower and confirms the variant is still below the kept baseline.","timestamp":1776019633495,"segment":4,"confidence":67.6778013601647,"iterationTokens":2952,"asi":{"hypothesis":"The first sequential-verify block_size=8 result was close enough to the baseline that it might have been a real near-tie worth confirming before dropping.","rollback_reason":"The confirmation run came in materially lower, so the apparent near-tie was not stable enough to justify keeping the variant.","next_action_hint":"Treat sequential-verify block_size=8 as an interesting but still sub-baseline correctness-preserving control, not a winning serving path. Move on to a different structural lever.","learning":"Sequential verify with block_size=8 is not stable at the near-baseline level on rerun. Its earlier closeness was likely noise rather than a reproducible win.","verify_learning":"A confirmation rerun matters here: despite one promising sample, the sequential-verify block_size=8 variant still belongs in the discard pile."}}
{"run":136,"commit":"e7b14c4","metric":28.075694633760847,"metrics":{},"status":"discard","description":"Implement an opt-in MLX-native target sequential-verify path: run the parity-correct token-by-token verify loop directly against the native Qwen3.5/Omni target instead of the torch bridge, so the target cache naturally stays at the accepted span without rollback or replay. This still does not beat the kept baseline on the full server benchmark.","timestamp":1776019783963,"segment":4,"confidence":69.04924642672002,"iterationTokens":6232,"asi":{"hypothesis":"If sequential verify is the right correctness shape, then moving it onto the native MLX target path should remove bridge overhead and outperform the hybrid sequential-verify variant.","rollback_reason":"The native-target sequential-verify path remained below the kept cached-mask hybrid baseline, so it is not a win yet.","next_action_hint":"Use native-target sequential verify as another correctness-preserving control, but do not assume bridge removal alone will unlock a win. The remaining bottleneck is likely low acceptance and per-step target work itself.","learning":"Native-target sequential verify does not materially outperform the hybrid sequential-verify path on the real workload. That implies the main remaining limit is not just bridge overhead.","verify_learning":"Sequential verify is viable on both hybrid and native target paths, but neither path beats the kept baseline. Low acceptance remains the dominant structural problem."}}
{"run":137,"commit":"e7b14c4","metric":28.200678434925486,"metrics":{},"status":"discard","description":"Run the parity-correct sequential-verify hybrid path with an even smaller speculative block size of 4. This reduces draft overproduction further and improves on the confirmed block_size=8 sequential result, but it still does not beat the kept baseline.","timestamp":1776019921694,"segment":4,"confidence":68.92360353826322,"iterationTokens":12561,"asi":{"hypothesis":"If sequential verify is limited by wasted drafted tokens under low acceptance, shrinking the speculative block from 8 to 4 should fit the real acceptance distribution better and improve throughput further.","rollback_reason":"Even with block_size=4, the sequential-verify path remained below the kept e7b14c4 baseline, so it is not a win.","next_action_hint":"Sequential verify seems to prefer smaller blocks than the replay-based paths, but the gain still isn’t enough. Unless a confirmation rerun surprises us, the next experiments should move to different structural levers rather than more block-size shrinking.","learning":"Sequential verify benefits from smaller blocks, but the improvement from 8 to 4 still stops short of a real win. The path is useful as a correctness-preserving control, not yet as the new serving baseline.","verify_learning":"On the parity-correct sequential-verify path, block_size=4 currently outperforms block_size=8, which supports the idea that low-acceptance workloads punish over-large draft blocks."}}
{"run":138,"commit":"e7b14c4","metric":28.2229032774198,"metrics":{},"status":"discard","description":"Run the parity-correct sequential-verify hybrid path with a very small speculative block size of 2. This is the strongest sequential-verify result so far and improves on the block_size=4 variant, but it still does not beat the kept baseline.","timestamp":1776020011941,"segment":4,"confidence":68.2662249967447,"iterationTokens":2831,"asi":{"hypothesis":"If the sequential-verify path prefers ever smaller blocks under low acceptance, reducing the speculative block to 2 may minimize draft overproduction enough to close the remaining throughput gap.","rollback_reason":"Even though block_size=2 is the best sequential-verify variant so far, this run still remained below the kept e7b14c4 baseline, so it is not a win.","next_action_hint":"If this branch stays alive, block_size=2 is now the right sequential-verify control to confirm or profile. Otherwise, move to a larger structural change rather than more block-size nudging.","learning":"Sequential verify continues to improve as the speculative block shrinks, which reinforces the idea that over-drafting is its main cost. However, even the smallest practical block tested so far still falls short of the kept baseline.","verify_learning":"On the parity-correct sequential-verify path, the ranking is now roughly block_size=2 > 4 > 8 > 16. Smaller blocks fit the observed low-acceptance regime better, but not enough yet to win."}}
{"run":139,"commit":"e7b14c4","metric":28.064766739540772,"metrics":{},"status":"discard","description":"Confirmation rerun for the parity-correct sequential-verify hybrid with block_size=2. The first result did not reproduce; this rerun came in lower and confirms the variant is still below the kept baseline.","timestamp":1776020090371,"segment":4,"confidence":68.92360353826322,"iterationTokens":3097,"asi":{"hypothesis":"The first block_size=2 sequential-verify result was close enough to the baseline that it was worth checking whether it represented a stable improvement trend.","rollback_reason":"The confirmation run came in lower, so the initial block_size=2 sample was not a reproducible win.","next_action_hint":"Treat sequential-verify block_size=2 as another sub-baseline correctness-preserving control and move on to larger structural ideas rather than more block-size tweaks.","learning":"Sequential verify with block_size=2 is not a stable near-baseline improvement. The sequential branch still has not produced a reproducible primary-metric win despite better-fitting smaller blocks.","verify_learning":"Confirmation reruns matter here too: the apparent improvement trend for smaller sequential blocks is real in direction, but not enough to turn the branch into a winner on this workload."}}
{"run":140,"commit":"e7b14c4","metric":27.826959824752972,"metrics":{},"status":"discard","description":"Add an env-gated packed-QKV patch for Qwen3.5/Qwen3Next attention that fuses q_proj/k_proj/v_proj into one matmul, then benchmark it on the stock path first. This regressed throughput in this environment.","timestamp":1776020238730,"segment":4,"confidence":69.5937658076371,"iterationTokens":6938,"asi":{"hypothesis":"One of the remaining public high-signal levers is reducing attention projection dispatch count; packing Q/K/V into a single matmul might raise the target-side speed floor for both stock and corrected DFlash paths.","rollback_reason":"The packed-QKV attention patch reduced the primary metric on the stock path, so it is not a win to carry forward into DFlash variants.","next_action_hint":"Do not prioritize the packed-QKV attention route in this environment. Return focus to acceptance/correctness structure rather than projection-dispatch count.","learning":"The public packed-QKV idea does not transfer as a win here, at least with this straightforward patch. Either the current MLX stack already optimizes the relevant path sufficiently or the added patching overhead outweighs the dispatch reduction.","target_speed_learning":"Stock target throughput regressed under the packed-QKV patch, so the main remaining ceiling is unlikely to be raw target Q/K/V projection dispatch count in this setup."}}
{"run":141,"commit":"e7b14c4","metric":27.748026155058188,"metrics":{},"status":"discard","description":"Combine the parity-correct sequential-verify path at block_size=2 with a 128-token handoff to plain greedy generation. This clearly regressed, so the fixed-cutoff idea does not transfer to the strongest small-block sequential variant either.","timestamp":1776020334704,"segment":4,"confidence":69.33526178911569,"iterationTokens":3857,"asi":{"hypothesis":"Because block_size=2 is the best sequential-verify fit for the low-acceptance regime so far, combining it with the previously best 128-token cutoff might finally beat the baseline by trimming late-phase speculative overhead.","rollback_reason":"The combination regressed badly, so this fixed-cutoff strategy is not compatible with the small-block sequential path on the benchmark workload.","next_action_hint":"Drop the sequential-cutoff branch. Move on to larger structural changes rather than combining two individually weak knobs.","learning":"The best small-block sequential variant does not benefit from the same fixed-cutoff idea that slightly helped the replay-based path. These two branches do not compose well.","verify_learning":"Sequential verify and fixed late fallback are not complementary in this workload. The remaining gap is elsewhere."}}
