{"run":374,"commit":"570fe49","metric":11.938647333146157,"metrics":{},"status":"discard","description":"Re-run the previously aborted forced-length 16k broader normal-request DFlash lane under ignore_eos=1 with cache512. It completed this time and was clearly worse than the explicit-request DFlash baseline.","timestamp":1776200959698,"segment":21,"confidence":0.36218500325089464,"iterationTokens":999,"asi":{"hypothesis":"The broader 16k no-EOS DFlash lane might outperform the explicit-request 16k DFlash shape, just as the broader shape helped at some shorter lengths.","context_tokens":16000,"ignore_eos":true,"lane":"broader_request_driven_thinking_cache512","rollback_reason":"Throughput was only ~11.94 tok/s, below the explicit-request 16k DFlash baseline (~14.71) and far below corrected stock (~22.03).","next_action_hint":"Prune the broader 16k DFlash branch; if continuing 16k tuning, stay on the explicit-request DFlash shape.","learning":"At forced 16k, the broader normal-request DFlash lane is worse than the explicit-request DFlash lane and not competitive with stock."}}
{"run":375,"commit":"570fe49","metric":11.62074812471882,"metrics":{},"status":"discard","description":"Test a long-context-only split-SDPA idea by lowering the exact-KV threshold to 512 on the forced-length 16k explicit DFlash lane. Although this was only a mild regression at 1k, it is strongly harmful at 16k.","timestamp":1776202397780,"segment":21,"confidence":0.5705625530695967,"iterationTokens":1862,"asi":{"hypothesis":"Earlier split-SDPA activation may matter much more at 16k KV lengths than it did on the 1k authority lane, and could improve the explicit DFlash path there.","context_tokens":16000,"ignore_eos":true,"lane":"explicit_request_dflash_request_driven_thinking_cache512_split_threshold512","rollback_reason":"Throughput dropped to ~11.62 tok/s, well below the 16k DFlash baseline (~14.71) and far below corrected stock (~22.03).","next_action_hint":"Prune earlier split-SDPA activation for the current 16k DFlash lane; it does not transfer as a long-context win here.","learning":"At forced 16k, lowering the split-SDPA exact-KV threshold to 512 is strongly harmful on the explicit DFlash lane."}}
{"run":376,"commit":"570fe49","metric":11.030176508928527,"metrics":{},"status":"discard","description":"Use the upstream experimental integration doc to test the last obvious draft-cache branch on the forced-length 16k explicit DFlash lane: shrink the draft cache sink to `DFLASH_DRAFT_SINK=32`. It regressed even further.","timestamp":1776203919334,"segment":21,"confidence":0.7592961368255327,"iterationTokens":2932,"asi":{"hypothesis":"If the default draft cache sink is too large for forced 16k DFlash, shrinking it may reduce stale sink overhead and improve throughput.","context_tokens":16000,"ignore_eos":true,"lane":"explicit_request_dflash_request_driven_thinking_cache512_draft_sink32","rollback_reason":"Throughput dropped further to ~11.03 tok/s, below the 16k DFlash baseline (~14.71) and below the larger-sink test (~11.92).","next_action_hint":"Prune the draft sink/window branch completely for the current 16k lane; neither direction helps.","learning":"On the forced-length 16k DFlash lane, shrinking the draft cache sink is strongly harmful; the draft cache tuning branch is exhausted here."}}
{"run":377,"commit":"570fe49","metric":0,"metrics":{},"status":"crash","description":"Attempt to test `DFLASH_BLOCK_TOKENS=13` on the forced-length 16k explicit-request DFlash lane did not return a usable experiment result before interruption, so this run is invalid and should not inform decisions.","timestamp":1776205467980,"segment":21,"confidence":0.7592961368255327,"iterationTokens":1474,"asi":{"hypothesis":"A smaller fixed speculative block size may improve the forced-length 16k explicit-request DFlash lane relative to the current block-15 baseline.","context_tokens":16000,"ignore_eos":true,"lane":"explicit_request_dflash_request_driven_thinking_cache512_block13","rollback_reason":"The experiment did not return a usable result before interruption, so the outcome is unknown and must be treated as invalid.","next_action_hint":"Re-run the 16k explicit-request DFlash block-size sweep cleanly when resuming long-context tuning.","error_detail":"run_experiment returned no result / interrupted before metrics were available"}}
{"run":378,"commit":"570fe49","metric":11.29533083435672,"metrics":{},"status":"discard","description":"Test whether the 1024-lane cache reservation sweet spot transfers upward by lowering the forced-length 16k explicit-request DFlash lane from `INITIAL_CACHE_BLOCKS=512` to `256`. It regressed badly.","timestamp":1776206935868,"segment":21,"confidence":0.980728136591028,"iterationTokens":1474,"asi":{"hypothesis":"Since `INITIAL_CACHE_BLOCKS=256` was the strongest stabilizer on the slowed 1024-token lane, it might also improve the 16k explicit-request DFlash lane relative to cache512.","context_tokens":16000,"ignore_eos":true,"lane":"explicit_request_dflash_request_driven_thinking_cache256_block15","rollback_reason":"Throughput fell to ~11.30 tok/s, well below the 16k DFlash baseline at cache512 (~14.71) and far below corrected stock (~22.03).","next_action_hint":"Do not transfer the 1024-lane cache256 assumption directly to 16k. If cache tuning continues at 16k, prefer bracketing above 512 or combine with a different lever.","learning":"At forced 16k, lowering INITIAL_CACHE_BLOCKS from 512 to 256 is strongly harmful on the explicit-request DFlash lane."}}
{"run":379,"commit":"570fe49","metric":10.778192146170277,"metrics":{},"status":"discard","description":"Cleanly re-run the previously interrupted forced-length 16k explicit-request DFlash block-size test at `DFLASH_BLOCK_TOKENS=13`. It completed this time and regressed badly.","timestamp":1776208444375,"segment":21,"confidence":1.1350676588845436,"iterationTokens":1104,"asi":{"hypothesis":"A smaller fixed speculative block size may improve the forced-length 16k explicit-request DFlash lane relative to the current block-15 baseline.","context_tokens":16000,"ignore_eos":true,"lane":"explicit_request_dflash_request_driven_thinking_cache512_block13","rollback_reason":"Throughput fell to ~10.78 tok/s, well below the 16k DFlash baseline (~14.71) and far below corrected stock (~22.03).","next_action_hint":"Do not pursue smaller fixed block sizes below 15 on the current 16k explicit DFlash lane; if block-size tuning continues, look upward instead.","learning":"At forced 16k, `DFLASH_BLOCK_TOKENS=13` is strongly harmful on the explicit-request DFlash lane."}}
{"run":380,"commit":"570fe49","metric":11.1546047658048,"metrics":{},"status":"discard","description":"Continue the forced-length 16k explicit-request DFlash block-size sweep by increasing the fixed speculative block from 15 to `16`. It also regressed badly.","timestamp":1776209906042,"segment":21,"confidence":1.2310833518360829,"iterationTokens":1050,"asi":{"hypothesis":"A slightly larger fixed speculative block may improve the forced-length 16k explicit-request DFlash lane if long-tail acceptance benefits from fewer verify cycles.","context_tokens":16000,"ignore_eos":true,"lane":"explicit_request_dflash_request_driven_thinking_cache512_block16","rollback_reason":"Throughput fell to ~11.15 tok/s, well below the 16k DFlash baseline (~14.71) and far below corrected stock (~22.03).","next_action_hint":"The local fixed-block neighborhood around 15 looks peaked already at 16k. Shift to long-tail-only adaptive/gated ideas rather than more nearby fixed block sweeps.","learning":"At forced 16k, `DFLASH_BLOCK_TOKENS=16` is strongly harmful on the explicit-request DFlash lane."}}
{"run":381,"commit":"570fe49","metric":12.196603740573158,"metrics":{},"status":"discard","description":"Test a long-tail-only adaptive block path on the forced-length 16k explicit-request DFlash lane by enabling adaptive block sizing only after token 8192. This improves over other failed 16k retunes, but is still well below the baseline and stock.","timestamp":1776211249382,"segment":21,"confidence":1.3152039118313115,"iterationTokens":1186,"asi":{"hypothesis":"A very-late adaptive block fallback may help the 16k DFlash tail without harming the earlier, healthier portion of decode, unlike earlier always-on or too-early adaptive variants.","context_tokens":16000,"ignore_eos":true,"lane":"explicit_request_dflash_request_driven_thinking_cache512_block15_adaptive_from8192","rollback_reason":"Throughput reached only ~12.20 tok/s, still below the 16k DFlash baseline (~14.71) and far below corrected stock (~22.03).","next_action_hint":"If adaptive block sizing is revisited at 16k, push it even later or make it more selective; this start point is not enough.","learning":"At forced 16k, tail-only adaptive block sizing starting at 8192 is less harmful than earlier adaptive variants, but still not competitive."}}
{"run":382,"commit":"570fe49","metric":12.063297932237514,"metrics":{},"status":"discard","description":"Refine the long-tail-only adaptive block idea on the forced-length 16k explicit-request DFlash lane by delaying the start further to token 12000. It remained well below the baseline and slightly worse than starting at 8192.","timestamp":1776212604109,"segment":21,"confidence":1.2472620253702342,"iterationTokens":1108,"asi":{"hypothesis":"If adaptive block resizing only needs to act in the very final tail, starting it later than 8192 may preserve more of the healthy early decode while still helping 16k completion throughput.","context_tokens":16000,"ignore_eos":true,"lane":"explicit_request_dflash_request_driven_thinking_cache512_block15_adaptive_from12000","rollback_reason":"Throughput was only ~12.06 tok/s, still below both the 16k DFlash baseline (~14.71) and the already-discarded adaptive-from-8192 result (~12.20).","next_action_hint":"Deprioritize the current adaptive-block branch for 16k unless a more selective trigger than a simple token threshold is introduced.","learning":"At forced 16k, delaying adaptive block sizing from 8192 to 12000 does not rescue the DFlash tail and is slightly worse."}}
{"run":383,"commit":"570fe49","metric":11.82163136945937,"metrics":{},"status":"discard","description":"Bracket the forced-length 16k explicit-request DFlash cache reservation more finely by raising `INITIAL_CACHE_BLOCKS` from 512 to `768`. It regressed, so the 16k cache sweet spot still points back to 512 rather than upward.","timestamp":1776213979592,"segment":21,"confidence":1.3844817567871275,"iterationTokens":1223,"asi":{"hypothesis":"The current 16k explicit-request DFlash baseline may prefer a slightly larger cache reservation than 512, even though 1024 was flat, so 768 could be a better midpoint.","context_tokens":16000,"ignore_eos":true,"lane":"explicit_request_dflash_request_driven_thinking_cache768_block15","rollback_reason":"Throughput fell to ~11.82 tok/s, below the 16k DFlash baseline (~14.71) and below corrected stock (~22.03).","next_action_hint":"Treat 512 as the working cache-reservation anchor for the 16k explicit lane unless a different interacting lever emerges.","learning":"At forced 16k, increasing INITIAL_CACHE_BLOCKS from 512 to 768 is harmful on the explicit-request DFlash lane; the cache bracket still points back to 512."}}
{"run":384,"commit":"570fe49","metric":11.259629202456168,"metrics":{},"status":"discard","description":"Close the last nearby fixed-block gap on the forced-length 16k explicit-request DFlash lane by testing `DFLASH_BLOCK_TOKENS=14`. It also regressed badly.","timestamp":1776215475940,"segment":21,"confidence":1.466250563905977,"iterationTokens":13713,"asi":{"hypothesis":"If block 15 is not truly the local optimum at 16k, block 14 could recover some tail performance without the severe regressions seen at 13 or 16.","context_tokens":16000,"ignore_eos":true,"lane":"explicit_request_dflash_request_driven_thinking_cache512_block14","rollback_reason":"Throughput fell to ~11.26 tok/s, well below the 16k DFlash baseline (~14.71) and far below corrected stock (~22.03).","next_action_hint":"Treat the local fixed-block neighborhood around 15 as exhausted at 16k; shift to a different class of lever rather than more nearby fixed sweeps.","learning":"At forced 16k, `DFLASH_BLOCK_TOKENS=14` is strongly harmful on the explicit-request DFlash lane, so blocks 13/14/16 all fail relative to the block-15 baseline."}}
{"run":385,"commit":"a7076c1","metric":24.76192205103355,"metrics":{},"status":"keep","description":"Retune the forced-length 16k explicit-request DFlash lane for long KV lengths by increasing the split-SDPA chunk size from the default 8 to `16`. This is a major honest win: it lifts 16k DFlash well above the old 14.71 baseline and above corrected 16k stock (~22.03).","timestamp":1776216157193,"segment":21,"confidence":3.3303025363732517,"iterationTokens":1330,"asi":{"hypothesis":"The 16k DFlash tail may be dominated by split full-attention chunking overhead rather than the draft/cache knobs already tried; a larger split-SDPA chunk size could materially improve throughput only at long KV lengths.","context_tokens":16000,"ignore_eos":true,"lane":"explicit_request_dflash_request_driven_thinking_cache512_block15_split_chunk16","prior_dflash_baseline_tok_s":14.70825218008612,"corrected_stock_tok_s":22.025128055493738,"learning":"At forced 16k, `DFLASH_BSTNXBT_SPLIT_CHUNK_SIZE=16` is a real long-context lever: throughput jumps to ~24.76 tok/s, beating both the old DFlash baseline and corrected stock.","next_action_hint":"Confirm this 16k split-chunk win with a rerun, then bracket nearby chunk sizes (e.g. 12, 24, 32) before moving up to 32k."}}
{"run":386,"commit":"7e2556e","metric":26.141692375507816,"metrics":{},"status":"keep","description":"Confirmation rerun for the forced-length 16k explicit-request DFlash split-SDPA retune at `DFLASH_BSTNXBT_SPLIT_CHUNK_SIZE=16`. It repeated stronger and clearly validates the long-context win over stock.","timestamp":1776216793725,"segment":21,"confidence":4.6691328216148404,"iterationTokens":1119,"asi":{"hypothesis":"If the 16k split-chunk retune is a real long-context lever rather than noise, a clean rerun should stay above both the old DFlash baseline and corrected stock.","context_tokens":16000,"ignore_eos":true,"lane":"explicit_request_dflash_request_driven_thinking_cache512_block15_split_chunk16","prior_dflash_baseline_tok_s":14.70825218008612,"corrected_stock_tok_s":22.025128055493738,"learning":"The 16k split-SDPA chunk retune is robust: a confirmation rerun improved further to ~26.14 tok/s, well above corrected stock.","next_action_hint":"Bracket nearby split chunk sizes around 16 on the 16k lane, then carry the winning long-context shape upward to 32k."}}
{"run":387,"commit":"7e2556e","metric":11.83648539662241,"metrics":{},"status":"discard","description":"Bracket the new 16k split-SDPA long-context win downward by reducing `DFLASH_BSTNXBT_SPLIT_CHUNK_SIZE` from 16 to `12` on the explicit-request DFlash lane. It collapsed badly, showing the new win is not a broad plateau.","timestamp":1776218175148,"segment":21,"confidence":5.182815703559079,"iterationTokens":1154,"asi":{"hypothesis":"If the 16k split-SDPA chunk-size improvement is broad rather than sharp, chunk 12 might preserve most of the gain while using smaller work units.","context_tokens":16000,"ignore_eos":true,"lane":"explicit_request_dflash_request_driven_thinking_cache512_block15_split_chunk12","rollback_reason":"Throughput dropped to ~11.84 tok/s, below the old 16k DFlash baseline (~14.71) and far below both chunk16 keeps and corrected stock (~22.03).","next_action_hint":"Keep chunk 16 as the working 16k shape and bracket upward rather than downward next.","learning":"At forced 16k, the split-SDPA chunk-size win is sharply peaked: chunk 12 collapses while chunk 16 is a real win."}}
{"run":388,"commit":"7e2556e","metric":24.852110443005234,"metrics":{},"status":"discard","description":"Bracket the new 16k split-SDPA long-context win upward by increasing `DFLASH_BSTNXBT_SPLIT_CHUNK_SIZE` from 16 to `24` on the explicit-request DFlash lane. It stayed strong and still beat stock, but did not beat the confirmed chunk-16 best.","timestamp":1776218846350,"segment":21,"confidence":4.6691328216148404,"iterationTokens":1037,"asi":{"hypothesis":"If the 16k split-SDPA chunk-size win continues upward, chunk 24 might outperform chunk 16 on the long-context explicit DFlash lane.","context_tokens":16000,"ignore_eos":true,"lane":"explicit_request_dflash_request_driven_thinking_cache512_block15_split_chunk24","rollback_reason":"Throughput was strong at ~24.85 tok/s and still above corrected stock, but it did not exceed the confirmed chunk-16 best (~26.14 tok/s).","next_action_hint":"Keep chunk 16 as the 16k winner for now; if bracketing continues, test one larger point (e.g. 32) before moving the winning shape to 32k.","learning":"At forced 16k, larger split-SDPA chunks remain a real lever, but chunk 24 is slightly worse than chunk 16."}}
{"run":389,"commit":"7e2556e","metric":21.100986210814412,"metrics":{},"status":"discard","description":"Carry the newly validated 16k long-context winner upward unchanged to establish the first forced-length 32k explicit-request DFlash checkpoint: request-level DFlash, request-driven thinking, cache512, block15, split chunk16. It produced a strong 32k DFlash baseline but is not a keep yet because this workload change still needs a corrected stock comparison.","timestamp":1776220451033,"segment":21,"confidence":4.248092849781752,"iterationTokens":6317,"asi":{"hypothesis":"The same split-SDPA chunk-size retune that rescued forced 16k may transfer upward and provide a competitive forced 32k DFlash baseline on the real server path.","context_tokens":32000,"ignore_eos":true,"lane":"explicit_request_dflash_request_driven_thinking_cache512_block15_split_chunk16","rollback_reason":"This establishes a new 32k DFlash checkpoint (~21.10 tok/s), but it is below the current session best metric and cannot be judged as a keep until matched against corrected 32k stock.","next_action_hint":"Run the corrected forced-length 32k stock comparison next with DFlash explicitly disabled in both workload env and model settings, then decide whether 32k DFlash is honestly ahead.","learning":"The 16k-winning split-SDPA retune transfers surprisingly well to forced 32k, yielding an initial DFlash baseline of ~21.10 tok/s on the real server path."}}
{"run":390,"commit":"7e2556e","metric":16.274691977260286,"metrics":{},"status":"discard","description":"Run the corrected forced-length 32k stock comparison by explicitly disabling DFlash in both workload env and the Qwen model-settings stanza. Corrected stock lands at ~16.27 tok/s, which confirms the carried-up DFlash shape (~21.10 tok/s) is honestly ahead at 32k.","timestamp":1776222474187,"segment":21,"confidence":3.7204713004073855,"iterationTokens":2749,"asi":{"hypothesis":"A corrected forced-length 32k stock run is required to tell whether the new long-context DFlash shape is truly competitive or only looks good in isolation.","context_tokens":32000,"ignore_eos":true,"lane":"corrected_stock","rollback_reason":"This is a stock checkpoint, not a code improvement, so it should not replace the current kept baseline despite being essential for honest comparison.","next_action_hint":"Restore the winning DFlash 32k shape and continue upward to 64k or bracket nearby long-context split chunk sizes there.","learning":"Corrected forced-length 32k stock is ~16.27 tok/s. The carried-up explicit-request DFlash shape with split chunk16 at ~21.10 tok/s honestly beats stock at 32k."}}
{"run":391,"commit":"7e2556e","metric":21.312043678553465,"metrics":{},"status":"discard","description":"Carry the validated long-context DFlash winner further upward to establish the first forced-length 64k explicit-request checkpoint: request-level DFlash, request-driven thinking, cache512, block15, split chunk16. It holds up surprisingly well at ~21.31 tok/s, but still needs the corrected 64k stock comparison.","timestamp":1776225515896,"segment":21,"confidence":3.3094331461428212,"iterationTokens":1985,"asi":{"hypothesis":"If the 16k split-SDPA chunk-size retune is addressing true long-KV overhead, the same explicit DFlash shape may transfer upward to 64k rather than collapsing again.","context_tokens":64000,"ignore_eos":true,"lane":"explicit_request_dflash_request_driven_thinking_cache512_block15_split_chunk16","rollback_reason":"This establishes a strong new 64k DFlash checkpoint, but it cannot be treated as a keep until matched against corrected 64k stock on the same real server path.","next_action_hint":"Run corrected forced-length 64k stock next with DFlash explicitly disabled in both workload env and model settings.","learning":"The current long-context DFlash winner transfers strongly to forced 64k, yielding an initial explicit-request DFlash baseline of ~21.31 tok/s on the real server path."}}
{"run":392,"commit":"7e2556e","metric":0,"metrics":{},"status":"crash","description":"Attempt to run the corrected forced-length 64k stock comparison was interrupted before a usable result returned, so this stock checkpoint is invalid and should not inform decisions.","timestamp":1776227961212,"segment":21,"confidence":3.3094331461428212,"iterationTokens":2351,"asi":{"hypothesis":"A corrected forced-length 64k stock run is needed to tell whether the carried-up long-context DFlash shape is honestly ahead at 64k.","context_tokens":64000,"ignore_eos":true,"lane":"corrected_stock","rollback_reason":"The experiment was interrupted before returning usable metrics, so the outcome is unknown and must be treated as invalid.","next_action_hint":"Re-run corrected 64k stock cleanly with DFlash explicitly disabled in workload env and the Qwen model-settings stanza.","error_detail":"run_experiment aborted before metrics were available"}}
