{"run":1455,"commit":"b304c02","metric":99.00224261839362,"metrics":{},"status":"discard","description":"Mirror recovery advanced to ~99.00, approaching 100+ re-entry.","timestamp":1776353736895,"segment":23,"confidence":3.4742680575283447,"iterationTokens":687,"asi":{"hypothesis":"Mid-recovery plateau is lifting and likely to cross 100 with continued runs.","rollback_reason":"Below keep/high-window.","next_action_hint":"Continue mirror scans to confirm 100+ transition.","backend":"mirror_sd_mlx","context_only_draft_cache":1,"draft_sink":48,"async_draft_eval":1,"fused_draft_verify_eval":1,"request_s":10.343200041912496,"paired_prev_tok_s":97.08546250268947,"paired_delta_tok_s":1.9167801157041435,"delta_vs_keep":-9.860089876081332,"recovery_stage":"97->99"}}
{"run":1456,"commit":"b304c02","metric":93.19859088613066,"metrics":{},"status":"discard","description":"Mirror sample fell back to ~93.20 after nearing 99, showing oscillatory recovery.","timestamp":1776353764745,"segment":23,"confidence":3.467887500764227,"iterationTokens":691,"asi":{"hypothesis":"Recovery is non-monotonic; short jumps toward 100 can revert before stabilization.","rollback_reason":"Below keep.","next_action_hint":"Continue mirror tracking; avoid structural conclusions during oscillation.","backend":"mirror_sd_mlx","context_only_draft_cache":1,"draft_sink":48,"async_draft_eval":1,"fused_draft_verify_eval":1,"request_s":10.987290583085269,"paired_prev_tok_s":99.00224261839362,"paired_delta_tok_s":-5.803651732262957,"delta_vs_keep":-15.663741608344287,"oscillatory_recovery":true}}
{"run":1457,"commit":"b304c02","metric":98.7925223081207,"metrics":{},"status":"discard","description":"Mirror bounced back to ~98.79, confirming ongoing oscillatory rebound around upper-90s.","timestamp":1776353790612,"segment":23,"confidence":3.457677777721565,"iterationTokens":727,"asi":{"hypothesis":"Current regime is cycling in the 93–99 band before a stable 100+ step.","rollback_reason":"Below keep.","next_action_hint":"Continue mirror scans; parity check only if control divergence is suspected.","backend":"mirror_sd_mlx","context_only_draft_cache":1,"draft_sink":48,"async_draft_eval":1,"fused_draft_verify_eval":1,"request_s":10.365156957996078,"paired_prev_tok_s":93.19859088613066,"paired_delta_tok_s":5.593931421990045,"delta_vs_keep":-10.069810186354246,"oscillatory_recovery":true}}
{"run":1458,"commit":"b304c02","metric":100.7786607318514,"metrics":{},"status":"discard","description":"Mirror recovery re-entered 100+ at ~100.78 after oscillating in upper-90s.","timestamp":1776353819292,"segment":23,"confidence":3.446430650967515,"iterationTokens":730,"asi":{"hypothesis":"Recovery is progressing toward the usual 103/107/108 ladders.","rollback_reason":"Still below keep/high-window.","next_action_hint":"Continue mirror sequence to track climb through low-100s.","backend":"mirror_sd_mlx","context_only_draft_cache":1,"draft_sink":48,"async_draft_eval":1,"fused_draft_verify_eval":1,"request_s":10.160881208023056,"paired_prev_tok_s":98.7925223081207,"paired_delta_tok_s":1.9861384237306943,"delta_vs_keep":-8.083671762623542,"recovery_stage":"98.8->100.8"}}
{"run":1459,"commit":"b304c02","metric":102.22387210151996,"metrics":{},"status":"discard","description":"Mirror recovery climbed to ~102.22, extending 100+ re-entry.","timestamp":1776353850055,"segment":23,"confidence":3.443226462228399,"iterationTokens":738,"asi":{"hypothesis":"Rebound is following expected staged path through low-100s.","rollback_reason":"Below keep 108.8623.","next_action_hint":"Continue mirror scans for 105+/107+ transition.","backend":"mirror_sd_mlx","context_only_draft_cache":1,"draft_sink":48,"async_draft_eval":1,"fused_draft_verify_eval":1,"request_s":10.017229625023901,"paired_prev_tok_s":100.7786607318514,"paired_delta_tok_s":1.4452113696685662,"delta_vs_keep":-6.638460392954987,"recovery_stage":"100.8->102.2"}}
{"run":1460,"commit":"b304c02","metric":103.05497145577993,"metrics":{},"status":"discard","description":"Mirror sample reached ~103.05, continuing steady ladder upward.","timestamp":1776353878382,"segment":23,"confidence":3.440028225902179,"iterationTokens":703,"asi":{"hypothesis":"Rebound remains intact and may next target 105+ then 107+ bands.","rollback_reason":"Below keep.","next_action_hint":"Continue mirror-only scans during active recovery.","backend":"mirror_sd_mlx","context_only_draft_cache":1,"draft_sink":48,"async_draft_eval":1,"fused_draft_verify_eval":1,"request_s":9.936444458086044,"paired_prev_tok_s":102.22387210151996,"paired_delta_tok_s":0.8310993542599707,"delta_vs_keep":-5.807361038695012,"recovery_stage":"102.2->103.1"}}
{"run":1461,"commit":"b304c02","metric":102.54740720169457,"metrics":{},"status":"discard","description":"Mirror sample eased to ~102.55 with warmup variance; low-100 recovery band persists.","timestamp":1776353909503,"segment":23,"confidence":3.4365255215786537,"iterationTokens":693,"asi":{"hypothesis":"Recovery remains stable but may oscillate around ~102-103 before next jump.","rollback_reason":"Below keep.","next_action_hint":"Continue mirror scans; no parity check needed while pattern remains shared historically.","backend":"mirror_sd_mlx","context_only_draft_cache":1,"draft_sink":48,"async_draft_eval":1,"fused_draft_verify_eval":1,"warmup_s":2.018261499935761,"paired_prev_tok_s":103.05497145577993,"paired_delta_tok_s":-0.5075642540853653,"delta_vs_keep":-6.314925292780375,"recovery_stage":"~102-103 plateau"}}
{"run":1462,"commit":"b304c02","metric":102.21534711677582,"metrics":{},"status":"discard","description":"Mirror sample held near ~102.22, confirming sticky low-100 recovery plateau.","timestamp":1776353936993,"segment":23,"confidence":3.4330299430442115,"iterationTokens":714,"asi":{"hypothesis":"Current regime is pausing around 102 before further climb.","rollback_reason":"Below keep.","next_action_hint":"Continue mirror scans for breakout toward 105+/107+.","backend":"mirror_sd_mlx","context_only_draft_cache":1,"draft_sink":48,"async_draft_eval":1,"fused_draft_verify_eval":1,"paired_prev_tok_s":102.54740720169457,"paired_delta_tok_s":-0.33206008491875394,"delta_vs_keep":-6.646985377699122,"recovery_stage":"~102 plateau"}}
{"run":1463,"commit":"b304c02","metric":99.88553563452916,"metrics":{},"status":"discard","description":"Mirror dipped to ~99.89, slipping just below 100 from the ~102 plateau.","timestamp":1776353968015,"segment":23,"confidence":3.4311274369499625,"iterationTokens":667,"asi":{"hypothesis":"Recovery remains oscillatory and not yet locked into sustained 100+ ascent.","rollback_reason":"Below keep.","next_action_hint":"Continue mirror scans; parity check if prolonged sub-100 persists.","backend":"mirror_sd_mlx","context_only_draft_cache":1,"draft_sink":48,"async_draft_eval":1,"fused_draft_verify_eval":1,"warmup_s":2.0235359580256045,"paired_prev_tok_s":102.21534711677582,"paired_delta_tok_s":-2.3298114822466633,"delta_vs_keep":-8.97679685994578,"oscillatory_recovery":true}}
{"run":1464,"commit":"b304c02","metric":100.32728879873726,"metrics":{},"status":"discard","description":"Mirror recovered back above 100 (~100.33), keeping the low-100 oscillation band.","timestamp":1776353997009,"segment":23,"confidence":3.428690807597723,"iterationTokens":736,"asi":{"hypothesis":"Current recovery regime is bounded around ~99.8–103 before next macro-step.","rollback_reason":"Below keep.","next_action_hint":"Continue mirror measurements; postpone parity unless clear divergence appears.","backend":"mirror_sd_mlx","context_only_draft_cache":1,"draft_sink":48,"async_draft_eval":1,"fused_draft_verify_eval":1,"paired_prev_tok_s":99.88553563452916,"paired_delta_tok_s":0.4417531642081033,"delta_vs_keep":-8.53504369573768,"oscillatory_recovery":true}}
{"run":1465,"commit":"b304c02","metric":105.61660474173323,"metrics":{},"status":"discard","description":"Mirror jumped to ~105.62, indicating recovery is re-entering upper-mid performance tiers.","timestamp":1776354054233,"segment":23,"confidence":3.4311274369499625,"iterationTokens":3149,"asi":{"hypothesis":"Oscillatory low-100 band is resolving upward toward prior 107/108 windows.","rollback_reason":"Still below keep 108.8623.","next_action_hint":"Continue immediate mirror scans to test 107+/108+ re-entry.","backend":"mirror_sd_mlx","context_only_draft_cache":1,"draft_sink":48,"async_draft_eval":1,"fused_draft_verify_eval":1,"request_s":9.69544516701717,"paired_prev_tok_s":100.32728879873726,"paired_delta_tok_s":5.2893159429959695,"delta_vs_keep":-3.2457277527417165,"recovery_stage":"100->105.6"}}
{"run":1466,"commit":"b304c02","metric":106.06996967647376,"metrics":{},"status":"discard","description":"Mirror rose to ~106.07, continuing climb toward the 107/108 band.","timestamp":1776354081852,"segment":23,"confidence":3.4330299430442115,"iterationTokens":747,"asi":{"hypothesis":"Recovery trajectory is now in late stage and may soon reconnect with high-window.","rollback_reason":"Below keep.","next_action_hint":"Continue mirror scans for 107+ and potential 108+ re-entry.","backend":"mirror_sd_mlx","context_only_draft_cache":1,"draft_sink":48,"async_draft_eval":1,"fused_draft_verify_eval":1,"request_s":9.654004834010266,"paired_prev_tok_s":105.61660474173323,"paired_delta_tok_s":0.4533649347405378,"delta_vs_keep":-2.7923628180011884,"recovery_stage":"105.6->106.1"}}
{"run":1467,"commit":"b304c02","metric":103.01559500968833,"metrics":{},"status":"discard","description":"Mirror fell back to ~103.02 after touching 106, showing continued late-stage oscillation.","timestamp":1776354108454,"segment":23,"confidence":3.431726141773237,"iterationTokens":709,"asi":{"hypothesis":"Recovery is not yet stabilized; upper steps can temporarily retrace to low-100s.","rollback_reason":"Below keep.","next_action_hint":"Continue mirror scanning; parity check only if prolonged drop below ~103 recurs.","backend":"mirror_sd_mlx","context_only_draft_cache":1,"draft_sink":48,"async_draft_eval":1,"fused_draft_verify_eval":1,"paired_prev_tok_s":106.06996967647376,"paired_delta_tok_s":-3.0543746667854275,"delta_vs_keep":-5.846737484786614,"oscillatory_recovery":true}}
{"run":1468,"commit":"b304c02","metric":105.95203764385303,"metrics":{},"status":"discard","description":"Mirror rebounded to ~105.95, recovering the upper-mid band.","timestamp":1776354133970,"segment":23,"confidence":3.4342288903873768,"iterationTokens":708,"asi":{"hypothesis":"Late-stage recovery remains oscillatory between ~103 and ~106 while trending upward overall.","rollback_reason":"Below keep.","next_action_hint":"Continue mirror scans for breakout into sustained 107+.","backend":"mirror_sd_mlx","context_only_draft_cache":1,"draft_sink":48,"async_draft_eval":1,"fused_draft_verify_eval":1,"paired_prev_tok_s":103.01559500968833,"paired_delta_tok_s":2.9364426341647043,"delta_vs_keep":-2.9102948506219035,"oscillatory_recovery":true}}
{"run":1469,"commit":"b304c02","metric":106.24577384509625,"metrics":{},"status":"discard","description":"Mirror edged up to ~106.25, near top of current recovery oscillation.","timestamp":1776354159906,"segment":23,"confidence":3.441563663623601,"iterationTokens":666,"asi":{"hypothesis":"Recovery envelope is expanding upward and may soon test 107+ zone.","rollback_reason":"Below keep 108.8623.","next_action_hint":"Continue immediate mirror scans to catch any 107+/108 re-entry.","backend":"mirror_sd_mlx","context_only_draft_cache":1,"draft_sink":48,"async_draft_eval":1,"fused_draft_verify_eval":1,"paired_prev_tok_s":105.95203764385303,"paired_delta_tok_s":0.2937362012432221,"delta_vs_keep":-2.6165586493786894,"recovery_stage":"~106 upper edge"}}
{"run":1470,"commit":"b304c02","metric":105.81980965638283,"metrics":{},"status":"discard","description":"Mirror eased slightly to ~105.82, staying in upper-mid recovery band.","timestamp":1776354185265,"segment":23,"confidence":3.4489298349109845,"iterationTokens":692,"asi":{"hypothesis":"Current regime remains in a 105–106 oscillation before next step-up.","rollback_reason":"Below keep.","next_action_hint":"Continue mirror scans; trigger parity only if sustained downturn below ~103 returns.","backend":"mirror_sd_mlx","context_only_draft_cache":1,"draft_sink":48,"async_draft_eval":1,"fused_draft_verify_eval":1,"paired_prev_tok_s":106.24577384509625,"paired_delta_tok_s":-0.4259641887134226,"delta_vs_keep":-3.042522838092106,"recovery_stage":"~105-106 plateau"}}
{"run":1471,"commit":"b304c02","metric":103.94717575126907,"metrics":{},"status":"discard","description":"Mirror dropped to ~103.95, widening ongoing 103–106 recovery oscillation.","timestamp":1776354211881,"segment":23,"confidence":3.4418898603414703,"iterationTokens":692,"asi":{"hypothesis":"Recovery remains unstable with broad oscillation but still far above collapse zone.","rollback_reason":"Below keep.","next_action_hint":"Continue mirror scans; parity check if repeated low-side drift accumulates.","backend":"mirror_sd_mlx","context_only_draft_cache":1,"draft_sink":48,"async_draft_eval":1,"fused_draft_verify_eval":1,"warmup_s":2.0021180419716984,"paired_prev_tok_s":105.81980965638283,"paired_delta_tok_s":-1.872633905113757,"delta_vs_keep":-4.915156743205875,"oscillatory_recovery":true}}
{"run":1472,"commit":"b304c02","metric":104.48776347129062,"metrics":{},"status":"discard","description":"Mirror rebounded to ~104.49, keeping the broad 103–106 post-collapse oscillation.","timestamp":1776354241004,"segment":23,"confidence":3.4348785672967663,"iterationTokens":719,"asi":{"hypothesis":"Current regime is stabilizing in a mid-100 band before eventual 107/108 retest.","rollback_reason":"Below keep.","next_action_hint":"Continue mirror-only scans for upward breakout.","backend":"mirror_sd_mlx","context_only_draft_cache":1,"draft_sink":48,"async_draft_eval":1,"fused_draft_verify_eval":1,"paired_prev_tok_s":103.94717575126907,"paired_delta_tok_s":0.5405877200215491,"delta_vs_keep":-4.374569023184322,"oscillatory_recovery":true}}
{"run":1473,"commit":"b304c02","metric":103.6009914680626,"metrics":{},"status":"discard","description":"Mirror slid to ~103.60, near lower side of current mid-100 oscillation band.","timestamp":1776354271423,"segment":23,"confidence":3.434083816106086,"iterationTokens":930,"asi":{"hypothesis":"Post-collapse regime remains broad and choppy around ~103-106.","rollback_reason":"Below keep.","next_action_hint":"Continue mirror scans; parity check if multiple low-side samples persist.","backend":"mirror_sd_mlx","context_only_draft_cache":1,"draft_sink":48,"async_draft_eval":1,"fused_draft_verify_eval":1,"paired_prev_tok_s":104.48776347129062,"paired_delta_tok_s":-0.8867720032280193,"delta_vs_keep":-5.261341026412339,"oscillatory_recovery":true}}
{"run":1474,"commit":"b304c02","metric":103.79511007388598,"metrics":{},"status":"discard","description":"Mirror sample held around ~103.80, reinforcing low-side 103–104 pocket.","timestamp":1776354299272,"segment":23,"confidence":3.433567531989388,"iterationTokens":675,"asi":{"hypothesis":"Regime is temporarily anchored near lower half of the 103–106 recovery range.","rollback_reason":"Below keep.","next_action_hint":"Run one more mirror sample; parity-check if low-side pocket persists.","backend":"mirror_sd_mlx","context_only_draft_cache":1,"draft_sink":48,"async_draft_eval":1,"fused_draft_verify_eval":1,"paired_prev_tok_s":103.6009914680626,"paired_delta_tok_s":0.19411860582338883,"delta_vs_keep":-5.067222420588951,"low_side_pocket":true}}
{"run":1475,"commit":"b304c02","metric":103.20772906667374,"metrics":{},"status":"discard","description":"Mirror dipped to ~103.21, extending low-side 103–104 cluster.","timestamp":1776354332346,"segment":23,"confidence":3.43489462614846,"iterationTokens":685,"asi":{"hypothesis":"Current post-collapse recovery has settled into a shared lower sub-window near 103.x.","rollback_reason":"Below keep and third low-side sample in sequence.","next_action_hint":"Run control parity spot-check now to confirm this lower pocket is shared.","backend":"mirror_sd_mlx","context_only_draft_cache":1,"draft_sink":48,"async_draft_eval":1,"fused_draft_verify_eval":1,"paired_prev_tok_s":103.79511007388598,"paired_delta_tok_s":-0.5873810072122433,"delta_vs_keep":-5.654603427801197,"low_side_pocket":true,"shared_check_due":true}}
{"run":1476,"commit":"b304c02","metric":104.32336953921615,"metrics":{},"status":"discard","description":"Control parity spot-check (`DFLASH_MIRROR_SD_RUNTIME=0`) landed at ~104.32, confirming shared lower sub-window.","timestamp":1776354379176,"segment":23,"confidence":3.438426023316138,"iterationTokens":834,"asi":{"hypothesis":"Mirror low-side 103–104 cluster is regime-shared rather than backend-specific.","rollback_reason":"Control lane non-authoritative and below keep.","next_action_hint":"Restore mirror lane and continue scanning for rebound toward 106+/107+.","backend":"bstnxbt_mlx","mirror_runtime_enabled":0,"context_only_draft_cache":1,"draft_sink":48,"async_draft_eval":1,"fused_draft_verify_eval":1,"paired_mirror_tok_s":103.20772906667374,"paired_delta_tok_s":-1.115640472542412,"authoritative_lane":"mirror_sd_mlx","shared_low_window_confirmed":true}}
{"run":1477,"commit":"b304c02","metric":102.30172427809752,"metrics":{},"status":"discard","description":"Mirror anchor after parity check returned ~102.30, staying within shared low-window.","timestamp":1776354418963,"segment":23,"confidence":3.4409411268632044,"iterationTokens":1140,"asi":{"hypothesis":"Shared lower recovery band currently spans roughly 102–104.","rollback_reason":"Below keep.","next_action_hint":"Continue mirror scans for rebound breakout; avoid structural edits in unstable regime.","backend":"mirror_sd_mlx","context_only_draft_cache":1,"draft_sink":48,"async_draft_eval":1,"fused_draft_verify_eval":1,"warmup_s":2.0301613330375403,"paired_control_tok_s":104.32336953921615,"paired_delta_tok_s":-2.02164526111863,"delta_vs_keep":-6.560608216377415,"shared_low_window_confirmed":true}}
{"run":1478,"commit":"b304c02","metric":107.15410016462006,"metrics":{},"status":"discard","description":"Mirror jumped from low-window back to ~107.15, indicating renewed climb toward high band.","timestamp":1776355711294,"segment":23,"confidence":3.443459912546391,"iterationTokens":1140,"asi":{"hypothesis":"Shared lower pocket can break upward quickly without config changes.","rollback_reason":"Below keep 108.8623.","next_action_hint":"Continue mirror scans for 108+ re-entry and possible top-tail reopening.","backend":"mirror_sd_mlx","context_only_draft_cache":1,"draft_sink":48,"async_draft_eval":1,"fused_draft_verify_eval":1,"warmup_s":2.255677792010829,"paired_prev_tok_s":102.30172427809752,"paired_delta_tok_s":4.852375886522547,"delta_vs_keep":-1.7082323298548785}}
{"run":1479,"commit":"b304c02","metric":107.33969306120947,"metrics":{},"status":"discard","description":"Mirror improved to ~107.34, strengthening re-entry into upper-107 band.","timestamp":1776355738958,"segment":23,"confidence":3.4483140773747043,"iterationTokens":708,"asi":{"hypothesis":"Current regime is climbing from 102-104 pocket toward 108 window.","rollback_reason":"Below keep.","next_action_hint":"Continue mirror-only scans while upswing is active.","backend":"mirror_sd_mlx","context_only_draft_cache":1,"draft_sink":48,"async_draft_eval":1,"fused_draft_verify_eval":1,"paired_prev_tok_s":107.15410016462006,"paired_delta_tok_s":0.18559289658940564,"delta_vs_keep":-1.522639433265469}}
{"run":1480,"commit":"b304c02","metric":107.73493145814973,"metrics":{},"status":"discard","description":"Mirror reached ~107.73, edging closer to 108+ after prolonged recovery.","timestamp":1776355764746,"segment":23,"confidence":3.4531819471275766,"iterationTokens":648,"asi":{"hypothesis":"Upswing is intact and approaching low-108 re-entry.","rollback_reason":"Below keep 108.8623.","next_action_hint":"Continue immediate mirror reruns for potential 108+ and top-tail events.","backend":"mirror_sd_mlx","context_only_draft_cache":1,"draft_sink":48,"async_draft_eval":1,"fused_draft_verify_eval":1,"paired_prev_tok_s":107.33969306120947,"paired_delta_tok_s":0.395238396940267,"delta_vs_keep":-1.1274010363252085}}
{"run":1481,"commit":"b304c02","metric":56.983886834152976,"metrics":{},"status":"discard","description":"Mirror hard-collapsed to ~56.98 from upper-107 upswing, repeating abrupt instability signature.","timestamp":1776355804495,"segment":23,"confidence":3.4483140773747043,"iterationTokens":664,"asi":{"hypothesis":"Regime remains non-stationary with sudden collapse events even during upward phases.","rollback_reason":"Catastrophically below keep/high-window.","next_action_hint":"Run immediate mirror follow-up to map collapse depth and recovery onset before parity check.","backend":"mirror_sd_mlx","context_only_draft_cache":1,"draft_sink":48,"async_draft_eval":1,"fused_draft_verify_eval":1,"request_s":17.96999216603581,"paired_prev_tok_s":107.73493145814973,"paired_delta_tok_s":-50.75104462399675,"delta_vs_keep":-51.87844566032197,"collapse_reappeared":true}}
{"run":1482,"commit":"b304c02","metric":23.44155913112984,"metrics":{},"status":"discard","description":"Immediate mirror follow-up collapsed further to ~23.44 tok/s, an extreme trough event.","timestamp":1776355866866,"segment":23,"confidence":3.443459912546391,"iterationTokens":745,"asi":{"hypothesis":"Current collapse episode is deeper than recent ~55-60 troughs and can hit very low throughput states.","rollback_reason":"Catastrophically below keep and below prior collapse floor.","next_action_hint":"Run control parity check now to confirm shared extreme-collapse behavior.","backend":"mirror_sd_mlx","context_only_draft_cache":1,"draft_sink":48,"async_draft_eval":1,"fused_draft_verify_eval":1,"request_s":43.68310120806564,"paired_prev_tok_s":56.983886834152976,"paired_delta_tok_s":-33.54232770302313,"delta_vs_keep":-85.4207733633451,"extreme_collapse":true}}
