{"run":2318,"commit":"68fb119","metric":8.900776956113987,"metrics":{},"status":"discard","description":"Mirror sample remained stable (~106.01 tok/s, eval_s ~8.90) with fused-only waits and zero collapse events.","timestamp":1776455191210,"segment":24,"confidence":0.04223469661427571,"iterationTokens":3909,"asi":{"hypothesis":"Stable shelf should retain fused-only verify execution and no safe-mode activation.","rollback_reason":"Primary metric did not improve over floor and run is unchanged baseline sampling.","next_action_hint":"Keep mirror monitoring; trigger parity only on fresh collapse transitions.","diagnostic_findings":{"completion_tok_s":106.01393601263734,"dflash_eval_s":8.900776956113987,"safe_mode_active":0,"spike_events":0,"verify_eval_wait_fused_steps":96,"verify_eval_wait_fused_mean_s":0.0927161870325411,"verify_eval_wait_unfused_steps":0,"verify_eval_wait_unfused_mean_s":0,"draft_sync_eval_wait_steps":0,"async_submit_calls":96,"async_unconsumed_steps":0,"thermal_warning_samples":0,"performance_warning_samples":0}}}
{"run":2319,"commit":"069982a","metric":8.79558045649901,"metrics":{},"status":"keep","description":"Telemetry refinement: split unfused wait attribution into target-posterior vs draft-logits buckets end-to-end (runtime→API→harness). Near-floor sample (~107.57 tok/s, eval_s ~8.80).","timestamp":1776455515619,"segment":24,"confidence":0.04250918111387826,"iterationTokens":33685,"asi":{"hypothesis":"Separating unfused wait into target-posterior and draft-logits components will improve collapse attribution without materially impacting throughput.","diagnostic_findings":{"completion_tok_s":107.56687865840605,"dflash_eval_s":8.79558045649901,"safe_mode_active":0,"spike_events":0,"verify_eval_wait_unfused_target_posterior_steps":0,"verify_eval_wait_unfused_draft_logits_steps":0,"verify_eval_wait_fused_steps":96,"verify_eval_wait_fused_mean_s":0.09162041231563005,"thermal_warning_samples":0,"performance_warning_samples":0},"learning":"New component fields are now exposed in usage and METRIC output, ready for next collapse-edge parity capture."}}
{"run":2320,"commit":"069982a","metric":8.775111669790931,"metrics":{},"status":"discard","description":"Post-keep confirmation run on unchanged code hit a lower near-floor sample (~107.73 tok/s, eval_s ~8.78), fused-only and stable.","timestamp":1776455553227,"segment":24,"confidence":0.042873830744066206,"iterationTokens":7381,"asi":{"hypothesis":"Telemetry split patch should be perf-neutral and maintain healthy fused-only behavior in baseline windows.","rollback_reason":"No code delta from prior keep; sample is treated as confirmation/noise characterization rather than a new change.","next_action_hint":"Continue mirror monitoring until next collapse edge, then capture immediate control parity with new unfused component metrics.","diagnostic_findings":{"completion_tok_s":107.73178000470185,"dflash_eval_s":8.775111669790931,"safe_mode_active":0,"spike_events":0,"verify_eval_wait_fused_steps":96,"verify_eval_wait_unfused_steps":0,"verify_eval_wait_unfused_target_posterior_steps":0,"verify_eval_wait_unfused_draft_logits_steps":0,"thermal_warning_samples":0,"performance_warning_samples":0}}}
{"run":2321,"commit":"069982a","metric":8.783253747154959,"metrics":{},"status":"discard","description":"Mirror follow-up remained healthy near-floor (~107.82 tok/s, eval_s ~8.78); unfused component buckets remained zero in fused-only regime.","timestamp":1776455620105,"segment":24,"confidence":0.04312571544141301,"iterationTokens":6957,"asi":{"hypothesis":"New unfused split metrics should stay zero in healthy fused-only runs and not perturb throughput.","rollback_reason":"No new code change; confirmation sample only.","next_action_hint":"Continue monitoring for next collapse transition to populate unfused target-posterior vs draft-logits buckets.","diagnostic_findings":{"completion_tok_s":107.82167310652643,"dflash_eval_s":8.783253747154959,"safe_mode_active":0,"spike_events":0,"verify_eval_wait_fused_steps":96,"verify_eval_wait_unfused_steps":0,"verify_eval_wait_unfused_target_posterior_steps":0,"verify_eval_wait_unfused_draft_logits_steps":0,"thermal_warning_samples":0,"performance_warning_samples":0}}}
{"run":2322,"commit":"069982a","metric":8.775896374252625,"metrics":{},"status":"discard","description":"Additional mirror monitor run stayed near-floor (~107.86 tok/s, eval_s ~8.78), fused-only with unfused component buckets at zero.","timestamp":1776455652950,"segment":24,"confidence":0.04338057728582335,"iterationTokens":4195,"asi":{"hypothesis":"In healthy windows, new unfused wait-component telemetry should remain inactive and low-overhead.","rollback_reason":"No new code change; this is stability monitoring only.","next_action_hint":"Keep sampling until a fresh collapse edge appears, then run immediate control parity to compare new unfused component metrics.","diagnostic_findings":{"completion_tok_s":107.86355465741745,"dflash_eval_s":8.775896374252625,"safe_mode_active":0,"spike_events":0,"verify_eval_wait_fused_steps":96,"verify_eval_wait_unfused_steps":0,"verify_eval_wait_unfused_target_posterior_steps":0,"verify_eval_wait_unfused_draft_logits_steps":0,"thermal_warning_samples":0,"performance_warning_samples":0}}}
{"run":2323,"commit":"069982a","metric":8.774085418670438,"metrics":{},"status":"discard","description":"Mirror monitoring stayed in healthy fused-only band (~107.91 tok/s, eval_s ~8.77); unfused split-component telemetry remained zero as expected.","timestamp":1776455719090,"segment":24,"confidence":0.04344648073372301,"iterationTokens":7715,"asi":{"hypothesis":"Until collapse recurs, unfused component counters should remain at zero under fused-only operation.","rollback_reason":"No code delta; run was monitoring-only.","next_action_hint":"Keep sampling for transition onset and trigger immediate control parity when unfused steps appear.","diagnostic_findings":{"completion_tok_s":107.91029109037245,"dflash_eval_s":8.774085418670438,"safe_mode_active":0,"spike_events":0,"verify_eval_wait_fused_steps":96,"verify_eval_wait_unfused_steps":0,"verify_eval_wait_unfused_target_posterior_steps":0,"verify_eval_wait_unfused_draft_logits_steps":0,"thermal_warning_samples":0,"performance_warning_samples":0}}}
{"type":"config","name":"Mirror SD + DDTree authoritative Qwen1024 tok/s loop","metricName":"completion_tok_s","metricUnit":"","bestDirection":"higher"}
{"run":2324,"commit":"240bd51","metric":52.23044409255855,"metrics":{},"status":"keep","description":"Re-initialized tok/s-focused segment and captured authoritative baseline after metric reset; collapse window active (safe mode on), so this serves as new tok/s baseline anchor.","timestamp":1776473686742,"segment":25,"confidence":null,"iterationTokens":17553}
{"run":2325,"commit":"e913f7f","metric":58.95397329023788,"metrics":{},"status":"keep","description":"DDTree wrapper path with tuned defaults (budget 12 + block-size alignment) improved tok/s in current collapse window versus tok/s baseline anchor.","timestamp":1776473722657,"segment":25,"confidence":null,"iterationTokens":4309}
{"run":2326,"commit":"c93b33b","metric":64.41392928007268,"metrics":{},"status":"keep","description":"Native DDTree runtime with block-size alignment (budget 12) outperformed wrapper path in the same degraded lane window, reducing tree build/verify time and lifting tok/s.","timestamp":1776473757271,"segment":25,"confidence":2.23142552983889,"iterationTokens":1571}
{"run":2327,"commit":"dd6bac1","metric":77.11865089335035,"metrics":{},"status":"keep","description":"Control baseline (Mirror + BSTNXBT, no DDTree) re-entered healthy fused regime and outperformed DDTree paths in this window; updates tok/s best for the new segment.","timestamp":1776473794626,"segment":25,"confidence":4.085564420646683,"iterationTokens":1797}
{"run":2328,"commit":"dd6bac1","metric":71.89003758655771,"metrics":{},"status":"discard","description":"Native DDTree retest (budget 12) stayed below the recovered Mirror+Bstnxbt control baseline in the same window; keep DDTree as non-default experimental path.","timestamp":1776473829268,"segment":25,"confidence":3.3290324030221607,"iterationTokens":4158}
{"run":2329,"commit":"dd6bac1","metric":67.74501929207047,"metrics":{},"status":"discard","description":"Native DDTree budget-10 probe improved over some degraded DDTree samples but remained below current Mirror+Bstnxbt tok/s baseline; keep DDTree budget 10 as non-winning on this lane.","timestamp":1776473877841,"segment":25,"confidence":3.8478792669378166,"iterationTokens":3113}
{"run":2330,"commit":"9500132","metric":95.52899169722832,"metrics":{},"status":"keep","description":"Native DDTree: removed eager mx.eval(verify_logits) sync in tree-verify path to defer synchronization to downstream posterior/commit flow; major tok/s uplift in healthy window.","timestamp":1776473961126,"segment":25,"confidence":4.925300993265619,"iterationTokens":3385}
{"run":2331,"commit":"494b20d","metric":106.93367318769768,"metrics":{},"status":"keep","description":"Control baseline rerun after native sync-deferral change confirms no-DDTree Mirror+Bstnxbt still leads in healthy window (~106.9 tok/s), while DDTree improved but remains below control.","timestamp":1776473991330,"segment":25,"confidence":6.023033305668567,"iterationTokens":1717}
{"run":2332,"commit":"494b20d","metric":95.44023778517285,"metrics":{},"status":"discard","description":"Replication confirmed native DDTree sync-deferral uplift is stable (~95.4 tok/s), but it remains below the healthy Mirror+Bstnxbt control baseline (~106.9 tok/s), so DDTree stays experimental.","timestamp":1776474021468,"segment":25,"confidence":4.228738188221715,"iterationTokens":4098}
{"run":2333,"commit":"a31420f","metric":95.02754085448555,"metrics":{},"status":"keep","description":"Added optional DDTree top-k unnormalized scoring fast-path (env-gated, default off); baseline run with flag off remained in expected native DDTree healthy band (~95 tok/s), showing no default-path regression.","timestamp":1776474297551,"segment":25,"confidence":3.0328704804542386,"iterationTokens":9760,"asi":{"hypothesis":"A gated top-k score path that skips full-vocab logsumexp can reduce tree-build overhead when enabled, while default-off behavior stays neutral.","diagnostic_findings":{"completion_tok_s":95.02754085448555,"dflash_eval_s":10.769295542,"dflash_ddtree_tree_build_s":2.1204811290000003,"dflash_ddtree_tree_verify_s":0.149412295,"dflash_ddtree_native_runtime":1},"next_action_hint":"Run matched native DDTree trial with DFLASH_DDTREE_TOPK_UNNORMALIZED=1 to measure real tok/s effect."}}
{"run":2334,"commit":"f115bca","metric":97.15231295778426,"metrics":{},"status":"keep","description":"Enable unnormalized DDTree top-k scoring (skip full-vocab logsumexp) improved native DDTree healthy-window throughput (~95.0 → ~97.2 tok/s) and reduced tree-build time.","timestamp":1776474331230,"segment":25,"confidence":3.0115166528342834,"iterationTokens":2105,"asi":{"hypothesis":"Skipping per-step full-vocab logsumexp in DDTree top-k tree construction should cut tree-build overhead without harming acceptance/verification correctness.","diagnostic_findings":{"completion_tok_s":97.15231295778426,"dflash_eval_s":10.53354925,"dflash_ddtree_tree_build_s":2.064863549,"dflash_ddtree_tree_verify_s":0.14947228599999998,"dflash_ddtree_avg_acceptance":9.941747572815533,"dflash_ddtree_fast_path_ratio":1},"next_action_hint":"Replicate with one more native DDTree run under DFLASH_DDTREE_TOPK_UNNORMALIZED=1, then compare against no-DDTree control in the same window."}}
{"run":2335,"commit":"f115bca","metric":96.7672390951613,"metrics":{},"status":"discard","description":"Replication run for unnormalized DDTree top-k scoring stayed in the same improved band (~96.8 tok/s) but did not exceed the first sample; treat as confirmation/noise, no new code delta.","timestamp":1776474366524,"segment":25,"confidence":4.330823592988421,"iterationTokens":1827,"asi":{"hypothesis":"The unnormalized top-k scoring optimization should replicate near ~97 tok/s in healthy windows.","rollback_reason":"No additional code change and sample was slightly below prior result.","next_action_hint":"Run matched no-DDTree control baseline next to measure remaining gap to lane leader.","diagnostic_findings":{"completion_tok_s":96.7672390951613,"dflash_eval_s":10.575918458,"dflash_ddtree_tree_build_s":2.070813625,"dflash_ddtree_avg_acceptance":9.941747572815533}}}
{"run":2336,"commit":"f115bca","metric":26.51704773552463,"metrics":{},"status":"discard","description":"Control parity check hit a severe shared collapse window (~26.5 tok/s, safe mode active, unfused-dominant); not a code regression signal for the DDTree change.","timestamp":1776474440746,"segment":25,"confidence":2.985725495183765,"iterationTokens":2255,"asi":{"hypothesis":"No-DDTree control should be sampled after DDTree improvements to quantify remaining leader gap in matched windows.","rollback_reason":"Primary metric regressed sharply due instability window and this run is diagnostic-only.","next_action_hint":"Run native DDTree with DFLASH_DDTREE_TOPK_UNNORMALIZED=1 immediately in this degraded window to test relative robustness vs collapsed control.","diagnostic_findings":{"completion_tok_s":26.51704773552463,"dflash_eval_s":30.37514779472258,"safe_mode_active":1,"verify_eval_wait_unfused_steps":100,"dflash_acceptance_rate":0.7276326207442597}}}
{"run":2337,"commit":"f115bca","metric":24.866599511606356,"metrics":{},"status":"discard","description":"Immediate native-DDTree parity run in the same degraded window also collapsed (~24.9 tok/s), indicating the unnormalized top-k path does not harden against collapse-regime troughs.","timestamp":1776474503443,"segment":25,"confidence":2.607365290732973,"iterationTokens":4411,"asi":{"hypothesis":"If DDTree unnormalized top-k were more robust, it might outperform collapsed control in immediate edge windows.","rollback_reason":"Primary metric remained deeply regressed and did not show robustness advantage over control.","next_action_hint":"De-prioritize collapse-hardening claims for this tweak; continue targeting healthy-window DDTree overhead reduction while maintaining honest control parity checks.","diagnostic_findings":{"completion_tok_s":24.866599511606356,"dflash_eval_s":41.171413417000004,"dflash_ddtree_tree_build_s":8.714265541,"dflash_ddtree_avg_acceptance":9.941747572815533}}}
{"run":2338,"commit":"f115bca","metric":55.60960272203544,"metrics":{},"status":"discard","description":"Native DDTree unnormalized budget-10 probe regressed sharply in the current degraded window versus budget-12 behavior; keep budget-10 as non-winning for this lane.","timestamp":1776474554494,"segment":25,"confidence":2.36426672582976,"iterationTokens":2179,"asi":{"hypothesis":"Lower DDTree budget (10) plus unnormalized top-k might reduce tree-build overhead enough to raise tok/s.","rollback_reason":"Primary metric regressed in-window and did not show an advantage over budget-12 native behavior.","next_action_hint":"Return to budget 12 and focus on reducing healthy-window overhead without shrinking acceptance depth.","diagnostic_findings":{"completion_tok_s":55.60960272203544,"dflash_eval_s":18.407668875,"dflash_ddtree_tree_build_s":3.6773822050000002,"dflash_ddtree_avg_acceptance":8.677966101694915}}}
{"run":2339,"commit":"f115bca","metric":64.1161955768236,"metrics":{},"status":"discard","description":"Native DDTree unnormalized path with reduced fp32 casting did not show a clear uplift in this window (~64 tok/s); result is below recent improved-band samples and inconclusive under drift.","timestamp":1776474635410,"segment":25,"confidence":2.5563990660134692,"iterationTokens":2932,"asi":{"hypothesis":"Avoiding unnecessary fp32 casting in unnormalized top-k mode could further reduce DDTree tree-build overhead.","rollback_reason":"Primary metric regressed versus recent DDTree healthy-band samples and did not provide robust evidence of improvement.","next_action_hint":"Revert this variant; continue from prior kept unnormalized top-k path and prioritize matched healthy-window A/Bs.","diagnostic_findings":{"completion_tok_s":64.1161955768236,"dflash_eval_s":15.964774959000001,"dflash_ddtree_tree_build_s":3.249585703,"dflash_ddtree_avg_acceptance":9.941747572815533}}}
{"run":2340,"commit":"e4b22bb","metric":97.33485668415808,"metrics":{},"status":"keep","description":"Native DDTree + unnormalized top-k confirmation sample in healthy window (~97.3 tok/s); also updated/pruned autoresearch.ideas.md with current DDTree findings and stale do-not-retry entries.","timestamp":1776474705194,"segment":25,"confidence":2.36426672582976,"iterationTokens":3507,"asi":{"hypothesis":"The kept unnormalized top-k path should repeatedly hit the ~97 tok/s native DDTree band in healthy windows.","diagnostic_findings":{"completion_tok_s":97.33485668415808,"dflash_eval_s":10.514051,"dflash_ddtree_tree_build_s":2.067315835,"dflash_ddtree_avg_acceptance":9.941747572815533},"next_action_hint":"Continue with matched no-DDTree control parity checks in healthy windows and target remaining ~9–11 tok/s overhead gap."}}
{"run":2341,"commit":"55f5c25","metric":107.0418427504313,"metrics":{},"status":"keep","description":"Matched no-DDTree control parity in healthy window confirms lane leader remains ~107 tok/s; native DDTree (with unnormalized top-k) still trails by roughly ~9–10 tok/s.","timestamp":1776474741600,"segment":25,"confidence":2.612521066142408,"iterationTokens":1844,"asi":{"hypothesis":"A healthy-window control parity run is needed to quantify the remaining DDTree overhead gap after latest keeps.","diagnostic_findings":{"completion_tok_s":107.0418427504313,"dflash_eval_s":8.871678751078434,"safe_mode_active":0,"verify_eval_wait_unfused_steps":0},"next_action_hint":"Focus next DDTree work on reducing per-cycle overhead in healthy windows (tree build/commit path) while preserving acceptance behavior and honest parity checks."}}
{"run":2342,"commit":"55f5c25","metric":97.27111614416151,"metrics":{},"status":"discard","description":"Immediate DDTree re-check in the same healthy window stayed near ~97.3 tok/s, confirming consistent DDTree band but still ~9–10 tok/s below control parity.","timestamp":1776474775412,"segment":25,"confidence":2.7895845795587975,"iterationTokens":4384,"asi":{"hypothesis":"Back-to-back healthy-window sampling should stabilize the DDTree-vs-control gap estimate.","rollback_reason":"No new code delta and primary metric remains below control leader.","next_action_hint":"Continue DDTree overhead work (tree build + commit path) and re-run matched parity checks after each meaningful change.","diagnostic_findings":{"completion_tok_s":97.27111614416151,"dflash_eval_s":10.520719958,"dflash_ddtree_tree_build_s":2.06771859,"dflash_ddtree_avg_acceptance":9.941747572815533}}}
{"run":2343,"commit":"828f148","metric":97.36545002599776,"metrics":{},"status":"keep","description":"Add env-gated DDTree top-k skip-sort path (default off) and verify default-path parity: native DDTree stayed in expected ~97 tok/s healthy band.","timestamp":1776474990230,"segment":25,"confidence":3.3718539127212246,"iterationTokens":17813,"asi":{"hypothesis":"Skipping in-topk sort may reduce DDTree tree-build overhead when enabled, while default-off path remains neutral.","diagnostic_findings":{"completion_tok_s":97.36545002599776,"dflash_eval_s":10.510753958,"dflash_ddtree_tree_build_s":2.052080419,"dflash_ddtree_avg_acceptance":9.941747572815533},"next_action_hint":"Run immediate A/B with DFLASH_DDTREE_TOPK_SKIP_SORT=1 in the same lane window."}}
{"run":2344,"commit":"828f148","metric":96.79448763639078,"metrics":{},"status":"discard","description":"Top-k skip-sort variant (DFLASH_DDTREE_TOPK_SKIP_SORT=1) was slightly worse than sorted top-k baseline in matched healthy window; keep sorted top-k path.","timestamp":1776475029334,"segment":25,"confidence":4.56217923709483,"iterationTokens":2224,"asi":{"hypothesis":"Skipping in-topk sorting would lower tree-build overhead enough to improve native DDTree tok/s.","rollback_reason":"Primary metric regressed versus immediate sorted-topk baseline and build time did not improve.","next_action_hint":"Drop skip-sort path and continue with sorted unnormalized top-k while targeting other overheads.","diagnostic_findings":{"completion_tok_s":96.79448763639078,"dflash_eval_s":10.572783959,"dflash_ddtree_tree_build_s":2.074436584,"dflash_ddtree_avg_acceptance":9.941747572815533}}}
{"run":2345,"commit":"828f148","metric":97.45397871775369,"metrics":{},"status":"discard","description":"Re-anchored native DDTree healthy-window baseline before budget sweep: ~97.45 tok/s with budget 12 and unnormalized top-k.","timestamp":1776475216117,"segment":25,"confidence":4.663264521119079,"iterationTokens":2224,"asi":{"hypothesis":"Need a fresh same-window native DDTree baseline to judge budget variants without drift bias.","rollback_reason":"No code change; baseline characterization run only.","next_action_hint":"Test DFLASH_DDTREE_BUDGET=14 immediately in the same lane window.","diagnostic_findings":{"completion_tok_s":97.45397871775369,"dflash_eval_s":10.501306792,"dflash_ddtree_tree_build_s":2.050762379,"dflash_ddtree_cycles_completed":103,"dflash_ddtree_avg_acceptance":9.941747572815533}}}
