{"run":2004,"commit":"7f0ef90","metric":8.835073706577532,"metrics":{},"status":"discard","description":"High-window sample (~107.05 tok/s, eval_s ~8.84) with watchdog idle and stable acceptance structure.","timestamp":1776391346829,"segment":24,"confidence":0.06300541454041,"iterationTokens":11906,"asi":{"hypothesis":"After degraded oscillation, the lane has re-entered healthy high-soft conditions without collapse triggers.","rollback_reason":"Primary metric above current best floor.","next_action_hint":"Continue unchanged loop for near-floor retests; parity only on fresh hard transition.","diagnostic_findings":{"completion_tok_s":107.05488699548846,"dflash_eval_s":8.835073706577532,"safe_mode_activations":0}}}
{"run":2005,"commit":"7f0ef90","metric":8.841895086225122,"metrics":{},"status":"discard","description":"Near-identical high-window confirmation (~107.08 tok/s, eval_s ~8.84), watchdog inactive.","timestamp":1776391372473,"segment":24,"confidence":0.0635266334555945,"iterationTokens":1470,"asi":{"hypothesis":"System is in a stable high-soft plateau after rebound.","rollback_reason":"Primary metric above current best floor.","next_action_hint":"Continue unchanged loop for lower-floor retest; no parity needed in stable mode.","diagnostic_findings":{"completion_tok_s":107.07983962711094,"dflash_eval_s":8.841895086225122,"safe_mode_activations":0}}}
{"run":2006,"commit":"7f0ef90","metric":8.839711586246267,"metrics":{},"status":"discard","description":"Another high-soft repeat (~107.01 tok/s, eval_s ~8.84) with stable telemetry and no collapse events.","timestamp":1776391397769,"segment":24,"confidence":0.06405654798267985,"iterationTokens":1418,"asi":{"hypothesis":"Recovered regime is currently stationary around ~8.84 eval_s.","rollback_reason":"Primary metric above current best floor.","next_action_hint":"Continue unchanged loop and watch for either floor break or fresh transition collapse.","diagnostic_findings":{"completion_tok_s":107.00949043041265,"dflash_eval_s":8.839711586246267,"safe_mode_activations":0}}}
{"run":2007,"commit":"7f0ef90","metric":8.830170539557002,"metrics":{},"status":"discard","description":"High-window low-soft sample (~107.11 tok/s, eval_s ~8.83), watchdog idle.","timestamp":1776391422777,"segment":24,"confidence":0.06438193302880361,"iterationTokens":1418,"asi":{"hypothesis":"Recovered band is holding with small jitter around ~8.83–8.84 eval_s.","rollback_reason":"Primary metric above current best floor.","next_action_hint":"Continue unchanged loop for potential floor retest.","diagnostic_findings":{"completion_tok_s":107.11073083158291,"dflash_eval_s":8.830170539557002,"safe_mode_activations":0}}}
{"run":2008,"commit":"7f0ef90","metric":8.842747250571847,"metrics":{},"status":"discard","description":"High-soft sample (~106.87 tok/s, eval_s ~8.84), no collapse or safe-mode activity.","timestamp":1776391450835,"segment":24,"confidence":0.06471064063875212,"iterationTokens":1433,"asi":{"hypothesis":"Environment remains in healthy high-window state.","rollback_reason":"Primary metric above current best floor.","next_action_hint":"Continue unchanged loop and monitor for either floor touch or transition collapse.","diagnostic_findings":{"completion_tok_s":106.86790905889023,"dflash_eval_s":8.842747250571847,"safe_mode_activations":0}}}
{"run":2009,"commit":"7f0ef90","metric":14.481786453863606,"metrics":{},"status":"discard","description":"Fresh collapse transition (~56.66 tok/s, eval_s ~14.48) with safe mode activation at step 28.","timestamp":1776391485217,"segment":24,"confidence":0.06438193302880361,"iterationTokens":1401,"asi":{"hypothesis":"Shared collapse cycle has re-triggered after stable high-window runs.","rollback_reason":"Primary metric far above best floor.","next_action_hint":"Run immediate control parity check for this transition.","diagnostic_findings":{"completion_tok_s":56.65637793456758,"dflash_eval_s":14.481786453863606,"safe_mode_step":28,"severe_spike_events":5}}}
{"run":2010,"commit":"7f0ef90","metric":16.619214669568464,"metrics":{},"status":"discard","description":"Immediate control parity also collapsed (~50.86 tok/s, eval_s ~16.62), confirming shared degradation.","timestamp":1776391528741,"segment":24,"confidence":0.06405654798267985,"iterationTokens":1469,"asi":{"hypothesis":"Current transition is shared across mirror/control, not mirror-specific.","rollback_reason":"Parity diagnostic lane; metric far above best floor.","next_action_hint":"Resume unchanged mirror loop to track rebound ladder.","parity_check":{"lane":"control_DFLASH_MIRROR_SD_RUNTIME=0","completion_tok_s":50.86485812580849,"dflash_eval_s":16.619214669568464,"safe_mode_step":55,"severe_spike_events":38}}}
{"run":2011,"commit":"7f0ef90","metric":15.591182084172033,"metrics":{},"status":"discard","description":"Post-parity mirror remains degraded (~54.89 tok/s, eval_s ~15.59) with safe mode still active at step 55.","timestamp":1776391566434,"segment":24,"confidence":0.0635266334555945,"iterationTokens":1421,"asi":{"hypothesis":"Shared collapse is persisting immediately after parity confirmation.","rollback_reason":"Primary metric above best floor.","next_action_hint":"Continue unchanged mirror loop to capture rebound progression.","diagnostic_findings":{"completion_tok_s":54.89480020002565,"dflash_eval_s":15.591182084172033,"safe_mode_step":55,"severe_spike_events":16}}}
{"run":2012,"commit":"7f0ef90","metric":18.068787590251304,"metrics":{},"status":"discard","description":"Collapse deepened again (~46.14 tok/s, eval_s ~18.07) with safe mode active from step 39.","timestamp":1776391607848,"segment":24,"confidence":0.06300541454041,"iterationTokens":1412,"asi":{"hypothesis":"Current collapse wave is still in trough phase with large eval inflation.","rollback_reason":"Primary metric far above best floor.","next_action_hint":"Continue unchanged mirror loop to map trough-to-recovery ladder.","diagnostic_findings":{"completion_tok_s":46.14375645198818,"dflash_eval_s":18.068787590251304,"safe_mode_step":39,"severe_spike_events":36}}}
{"run":2013,"commit":"7f0ef90","metric":15.7955139123369,"metrics":{},"status":"discard","description":"Trough rebound step (~53.78 tok/s, eval_s ~15.80) with safe mode still active at step 50.","timestamp":1776391643840,"segment":24,"confidence":0.06237108364853259,"iterationTokens":1465,"asi":{"hypothesis":"Collapse ladder is rebounding in oscillatory steps while remaining heavily degraded.","rollback_reason":"Primary metric above best floor.","next_action_hint":"Continue unchanged mirror loop for further rebound mapping.","diagnostic_findings":{"completion_tok_s":53.777126032572625,"dflash_eval_s":15.7955139123369,"safe_mode_step":50,"severe_spike_events":16}}}
{"run":2014,"commit":"7f0ef90","metric":14.574371541501023,"metrics":{},"status":"discard","description":"Rebound improved (~59.10 tok/s, eval_s ~14.57) with safe mode shifting later to step 60.","timestamp":1776391682548,"segment":24,"confidence":0.061749398177458066,"iterationTokens":1416,"asi":{"hypothesis":"Collapse recovery ladder is progressing with later watchdog activation.","rollback_reason":"Primary metric above best floor.","next_action_hint":"Continue unchanged mirror loop; expect eventual transition to watchdog-idle mode.","diagnostic_findings":{"completion_tok_s":59.10021907522433,"dflash_eval_s":14.574371541501023,"safe_mode_step":60,"severe_spike_events":16}}}
{"run":2015,"commit":"7f0ef90","metric":16.31206492113415,"metrics":{},"status":"discard","description":"Recovery wobbled back down (~51.00 tok/s, eval_s ~16.31) with safe mode still active at step 55.","timestamp":1776391720158,"segment":24,"confidence":0.060571839493770534,"iterationTokens":1415,"asi":{"hypothesis":"Rebound remains non-monotonic and can re-dip while in collapse cycle.","rollback_reason":"Primary metric above best floor.","next_action_hint":"Continue unchanged mirror loop for full cycle mapping.","diagnostic_findings":{"completion_tok_s":51.997126346115834,"dflash_eval_s":16.31206492113415,"safe_mode_step":55,"severe_spike_events":30}}}
{"run":2016,"commit":"7f0ef90","metric":16.121141620445997,"metrics":{},"status":"discard","description":"Collapse band held (~52.43 tok/s, eval_s ~16.12) with safe mode active at step 46.","timestamp":1776391759756,"segment":24,"confidence":0.05943835236614403,"iterationTokens":1417,"asi":{"hypothesis":"Current regime remains in oscillatory trough with persistent watchdog intervention.","rollback_reason":"Primary metric above best floor.","next_action_hint":"Continue unchanged mirror loop; wait for later-step activation drift and watchdog-idle transition.","diagnostic_findings":{"completion_tok_s":52.42726213542314,"dflash_eval_s":16.121141620445997,"safe_mode_step":46,"severe_spike_events":20}}}
{"run":2017,"commit":"7f0ef90","metric":14.826382458326407,"metrics":{},"status":"discard","description":"Rebound improved (~57.95 tok/s, eval_s ~14.83) with late safe mode at step 57.","timestamp":1776391794877,"segment":24,"confidence":0.05897707523869455,"iterationTokens":1423,"asi":{"hypothesis":"Collapse ladder is trending upward again after trough oscillation.","rollback_reason":"Primary metric above best floor.","next_action_hint":"Continue unchanged loop for sub-13 and eventual watchdog-idle recovery.","diagnostic_findings":{"completion_tok_s":57.952554229208296,"dflash_eval_s":14.826382458326407,"safe_mode_step":57,"severe_spike_events":3}}}
{"run":2018,"commit":"7f0ef90","metric":16.120121625834145,"metrics":{},"status":"discard","description":"Recovery re-dipped (~52.98 tok/s, eval_s ~16.12) with safe mode still active at step 56.","timestamp":1776391831857,"segment":24,"confidence":0.058522902548788565,"iterationTokens":1420,"asi":{"hypothesis":"Current rebound remains unstable with recurring pullbacks.","rollback_reason":"Primary metric above best floor.","next_action_hint":"Continue unchanged mirror loop and monitor for sustained downward eval trend.","diagnostic_findings":{"completion_tok_s":52.98190349254213,"dflash_eval_s":16.120121625834145,"safe_mode_step":56,"severe_spike_events":35}}}
{"run":2019,"commit":"7f0ef90","metric":17.88335929636378,"metrics":{},"status":"discard","description":"Another trough dip (~46.58 tok/s, eval_s ~17.88) with safe mode active from step 40.","timestamp":1776391872198,"segment":24,"confidence":0.05824687525651232,"iterationTokens":1415,"asi":{"hypothesis":"Collapse cycle remains active with repeated deep relapses.","rollback_reason":"Primary metric far above best floor.","next_action_hint":"Continue unchanged loop; trigger parity only if a materially new transition edge appears.","diagnostic_findings":{"completion_tok_s":46.584013933524645,"dflash_eval_s":17.88335929636378,"safe_mode_step":40,"severe_spike_events":27}}}
{"run":2020,"commit":"7f0ef90","metric":19.094224793836474,"metrics":{},"status":"discard","description":"Cycle hit a deeper trough (~43.18 tok/s, eval_s ~19.09) with safe mode re-entering early (step 29).","timestamp":1776391915156,"segment":24,"confidence":0.057981374805440085,"iterationTokens":1463,"asi":{"hypothesis":"The active collapse wave is still unstable and can deepen before recovering.","rollback_reason":"Primary metric far above best floor.","next_action_hint":"Continue unchanged mirror loop; maintain transition-aware parity policy (no additional parity unless a new regime edge appears).","diagnostic_findings":{"completion_tok_s":43.177195095315476,"dflash_eval_s":19.094224793836474,"safe_mode_step":29,"severe_spike_events":33}}}
{"run":2021,"commit":"7f0ef90","metric":19.070665624109097,"metrics":{},"status":"discard","description":"Trough persisted (~42.26 tok/s, eval_s ~19.07) with very early safe-mode activation at step 6.","timestamp":1776391973616,"segment":24,"confidence":0.05793197819433568,"iterationTokens":2110,"asi":{"hypothesis":"Current collapse wave is still in severe early-spike mode.","rollback_reason":"Primary metric far above best floor.","next_action_hint":"Continue unchanged mirror loop to observe eventual rebound progression.","diagnostic_findings":{"completion_tok_s":42.26301350514805,"dflash_eval_s":19.070665624109097,"safe_mode_step":6,"severe_spike_events":17}}}
{"run":2022,"commit":"7f0ef90","metric":10.53716996370349,"metrics":{},"status":"discard","description":"Strong rebound step (~90.92 tok/s, eval_s ~10.54): watchdog idle, acceptance back to baseline structure.","timestamp":1776392005232,"segment":24,"confidence":0.05789057610654688,"iterationTokens":1511,"asi":{"hypothesis":"Cycle exited severe spike mode into broad-inflation recovery.","rollback_reason":"Primary metric above best floor.","next_action_hint":"Continue unchanged mirror loop toward low-soft/high-soft re-entry; parity only on fresh hard edge.","diagnostic_findings":{"completion_tok_s":90.91878426061801,"dflash_eval_s":10.53716996370349,"safe_mode_activations":0,"dflash_draft_steps":96}}}
{"run":2023,"commit":"7f0ef90","metric":11.96860124100931,"metrics":{},"status":"discard","description":"Broad-inflation rebound sample (~80.48 tok/s, eval_s ~11.97) with watchdog idle.","timestamp":1776392107548,"segment":24,"confidence":0.05686782804184321,"iterationTokens":11084,"asi":{"hypothesis":"Cycle is recovering from severe trough into non-spike inflation mode.","rollback_reason":"Primary metric above best floor.","next_action_hint":"Continue unchanged mirror loop toward low-soft re-entry.","diagnostic_findings":{"completion_tok_s":80.4780909452939,"dflash_eval_s":11.96860124100931,"safe_mode_activations":0}}}
{"run":2024,"commit":"7f0ef90","metric":9.981895917560905,"metrics":{},"status":"discard","description":"Recovery tightened to sub-10 band (~95.58 tok/s, eval_s ~9.98), watchdog inactive.","timestamp":1776392138746,"segment":24,"confidence":0.05588451383994124,"iterationTokens":1414,"asi":{"hypothesis":"Rebound is progressing toward low-soft/high-soft levels without spike triggers.","rollback_reason":"Primary metric above best floor.","next_action_hint":"Continue unchanged loop for possible low-9 retest.","diagnostic_findings":{"completion_tok_s":95.57669604025152,"dflash_eval_s":9.981895917560905,"safe_mode_activations":0}}}
{"run":2025,"commit":"7f0ef90","metric":11.280609127832577,"metrics":{},"status":"discard","description":"Recovery wobble up (~85.03 tok/s, eval_s ~11.28) with watchdog idle.","timestamp":1776392168990,"segment":24,"confidence":0.0555513863102087,"iterationTokens":1415,"asi":{"hypothesis":"Current rebound remains non-monotonic in non-spike inflation mode.","rollback_reason":"Primary metric above best floor.","next_action_hint":"Continue unchanged mirror loop through wobble phase.","diagnostic_findings":{"completion_tok_s":85.02903067287488,"dflash_eval_s":11.280609127832577,"safe_mode_activations":0}}}
{"run":2026,"commit":"7f0ef90","metric":11.026901335455477,"metrics":{},"status":"discard","description":"Recovery sample (~86.98 tok/s, eval_s ~11.03), watchdog idle and structure stable.","timestamp":1776392201402,"segment":24,"confidence":0.05521997085885104,"iterationTokens":1409,"asi":{"hypothesis":"Broad-inflation rebound is continuing but still above low-soft floor.","rollback_reason":"Primary metric above best floor.","next_action_hint":"Continue unchanged loop to test sub-10 return.","diagnostic_findings":{"completion_tok_s":86.98128375856005,"dflash_eval_s":11.026901335455477,"safe_mode_activations":0}}}
{"run":2027,"commit":"7f0ef90","metric":11.469122624373995,"metrics":{},"status":"discard","description":"Recovery wobble (~83.75 tok/s, eval_s ~11.47), still watchdog-idle.","timestamp":1776392239010,"segment":24,"confidence":0.05402514017087697,"iterationTokens":1409,"asi":{"hypothesis":"Current mode remains broad inflation with gradual but noisy improvement.","rollback_reason":"Primary metric above best floor.","next_action_hint":"Continue unchanged loop until low-soft/high-soft return or fresh hard transition.","diagnostic_findings":{"completion_tok_s":83.75038960795035,"dflash_eval_s":11.469122624373995,"safe_mode_activations":0}}}
{"run":2028,"commit":"7f0ef90","metric":11.278971834573895,"metrics":{},"status":"discard","description":"Broad-inflation sample (~85.08 tok/s, eval_s ~11.28), watchdog still idle.","timestamp":1776392278268,"segment":24,"confidence":0.053070528465337885,"iterationTokens":1411,"asi":{"hypothesis":"Recovery remains in mid-band plateau with stable speculative structure.","rollback_reason":"Primary metric above best floor.","next_action_hint":"Continue unchanged loop; seek sub-10 return.","diagnostic_findings":{"completion_tok_s":85.08265148154372,"dflash_eval_s":11.278971834573895,"safe_mode_activations":0}}}
{"run":2029,"commit":"7f0ef90","metric":11.30518612510059,"metrics":{},"status":"discard","description":"Mid-band recovery plateau (~84.94 tok/s, eval_s ~11.31), watchdog idle.","timestamp":1776392309408,"segment":24,"confidence":0.052118329275770946,"iterationTokens":1405,"asi":{"hypothesis":"Rebound remains steady but not yet approaching low-9 window.","rollback_reason":"Primary metric above best floor.","next_action_hint":"Continue unchanged loop; monitor for acceleration toward sub-10.","diagnostic_findings":{"completion_tok_s":84.94070583560358,"dflash_eval_s":11.30518612510059,"safe_mode_activations":0}}}
{"run":2030,"commit":"7f0ef90","metric":11.24279953748919,"metrics":{},"status":"discard","description":"Another stable mid-band sample (~85.12 tok/s, eval_s ~11.24), watchdog inactive.","timestamp":1776392338573,"segment":24,"confidence":0.05137741939849949,"iterationTokens":1407,"asi":{"hypothesis":"Recovery has entered a temporary flat plateau around ~11.2 eval_s.","rollback_reason":"Primary metric above best floor.","next_action_hint":"Continue unchanged loop for eventual break toward sub-10 or fresh transition.","diagnostic_findings":{"completion_tok_s":85.12258990362143,"dflash_eval_s":11.24279953748919,"safe_mode_activations":0}}}
{"run":2031,"commit":"7f0ef90","metric":10.994250415475108,"metrics":{},"status":"discard","description":"Recovery improved slightly (~87.19 tok/s, eval_s ~10.99) with watchdog idle.","timestamp":1776392373424,"segment":24,"confidence":0.050226616511388884,"iterationTokens":1415,"asi":{"hypothesis":"Mid-band plateau is beginning to trend downward again.","rollback_reason":"Primary metric above best floor.","next_action_hint":"Continue unchanged loop and monitor for sub-10 re-entry.","diagnostic_findings":{"completion_tok_s":87.19146798290558,"dflash_eval_s":10.994250415475108,"safe_mode_activations":0}}}
{"run":2032,"commit":"7f0ef90","metric":10.818401917465962,"metrics":{},"status":"discard","description":"Recovery continued (~88.66 tok/s, eval_s ~10.82), watchdog inactive.","timestamp":1776392403856,"segment":24,"confidence":0.04920251183102165,"iterationTokens":1403,"asi":{"hypothesis":"Broad inflation is gradually relaxing toward soft-band levels.","rollback_reason":"Primary metric above best floor.","next_action_hint":"Continue unchanged loop for sub-10 and low-soft retest.","diagnostic_findings":{"completion_tok_s":88.66209216545656,"dflash_eval_s":10.818401917465962,"safe_mode_activations":0}}}
{"run":2033,"commit":"7f0ef90","metric":10.812871125410311,"metrics":{},"status":"discard","description":"Near-identical follow-up (~88.67 tok/s, eval_s ~10.81), watchdog idle.","timestamp":1776392433580,"segment":24,"confidence":0.04918729555167531,"iterationTokens":1412,"asi":{"hypothesis":"Current rebound has settled into a short stable shelf around ~10.8 eval_s.","rollback_reason":"Primary metric above best floor.","next_action_hint":"Continue unchanged loop for further descent toward low-soft band.","diagnostic_findings":{"completion_tok_s":88.66847070885339,"dflash_eval_s":10.812871125410311,"safe_mode_activations":0}}}
{"run":2034,"commit":"7f0ef90","metric":10.721706875832751,"metrics":{},"status":"discard","description":"Shelf improved slightly (~89.35 tok/s, eval_s ~10.72) with watchdog still inactive.","timestamp":1776392468040,"segment":24,"confidence":0.049172088680937046,"iterationTokens":1432,"asi":{"hypothesis":"Rebound is slowly descending from the ~10.8 shelf toward soft-band.","rollback_reason":"Primary metric above best floor.","next_action_hint":"Continue unchanged loop.","diagnostic_findings":{"completion_tok_s":89.35086855739107,"dflash_eval_s":10.721706875832751,"safe_mode_activations":0}}}
{"run":2035,"commit":"7f0ef90","metric":10.746975249261595,"metrics":{},"status":"discard","description":"Follow-up stayed on ~10.7 shelf (~89.21 tok/s, watchdog idle).","timestamp":1776392502131,"segment":24,"confidence":0.049113517235806245,"iterationTokens":1403,"asi":{"hypothesis":"Recovery currently stabilized in a narrow non-spike band.","rollback_reason":"Primary metric above best floor.","next_action_hint":"Continue unchanged loop for lower-band break.","diagnostic_findings":{"completion_tok_s":89.21057160117473,"dflash_eval_s":10.746975249261595,"safe_mode_activations":0}}}
{"run":2036,"commit":"7f0ef90","metric":10.538533626357093,"metrics":{},"status":"discard","description":"Shelf descended again (~90.89 tok/s, eval_s ~10.54), watchdog idle.","timestamp":1776392532711,"segment":24,"confidence":0.049036261028877176,"iterationTokens":1394,"asi":{"hypothesis":"Recovery trend resumed downward from the ~10.7 shelf.","rollback_reason":"Primary metric above best floor.","next_action_hint":"Continue unchanged loop toward sub-10 and low-soft band.","diagnostic_findings":{"completion_tok_s":90.89085531790448,"dflash_eval_s":10.538533626357093,"safe_mode_activations":0}}}
