{"run":253,"commit":"a8e40e8","metric":86.06426126820742,"metrics":{},"status":"discard","description":"Productize the fast Qwen path further by fixing DFlash streaming detokenization, injecting the missing reasoning `<think>` prefix on the DFlash stream, and writing greedy-compatible sampling defaults into fast model settings so normal chat/API requests can stay on the server-side DFlash path without request-level sampling glue.","timestamp":1776136778859,"segment":19,"confidence":3.2665988354931175,"iterationTokens":574,"asi":{"hypothesis":"Server-side fixes to DFlash streaming text assembly and settings-driven greedy defaults should make chat/API usage sane without costing throughput on the authoritative model-settings-driven benchmark.","rollback_reason":"The authoritative benchmark stayed in the high band but did not beat the current best settings-driven baseline; first run was 86.06 tok/s versus the stronger existing ~86.97 keep.","next_action_hint":"Keep the loop honest by not promoting this as a throughput keep yet; if these productization fixes are still wanted, re-land them more surgically or pair them with a compensating throughput win.","learning":"Two real server-side issues were validated despite the non-keep: DFlash streaming needed a proper streaming detokenizer, and DFlash streaming needed the synthetic `<think>` prefix to surface Qwen reasoning as `reasoning_content` instead of plain content."}}
{"run":254,"commit":"a8e40e8","metric":83.55367231579645,"metrics":{},"status":"discard","description":"Confirm the benchmark impact of the same server-side productization bundle (DFlash stream detokenizer + injected think prefix + greedy-compatible fast model defaults) on the authoritative workload.","timestamp":1776136786229,"segment":19,"confidence":3.523507080565512,"iterationTokens":574,"asi":{"hypothesis":"If the first 86.06 tok/s run was just noise, a confirmation run of the same server-side productization bundle might climb back to or above the best settings-driven baseline.","rollback_reason":"The confirmation run fell further to 83.55 tok/s, reinforcing that this bundle is not a throughput keep on the authoritative benchmark as-is.","next_action_hint":"Split the bundle next time: isolate the chat/usefulness fixes from the model-default changes, and re-benchmark each separately against the authoritative workload.","learning":"The productization bundle improved server-side reasoning surfacing and normal-request DFlash selection, but as a combined change it regressed the benchmark enough that it should not be kept wholesale."}}
{"run":255,"commit":"a8e40e8","metric":0,"metrics":{},"status":"crash","description":"Re-landed isolated server-side DFlash reasoning/stream correctness fixes plus an env-gated adaptive-block helper. The authoritative run crashed in scripts/siliconflash_benchmark.py because the benchmark assumed message.content was always a string; with the current reasoning behavior the response returned content=None, so slicing text_preview raised TypeError before throughput could be recorded.","timestamp":1776142503165,"segment":19,"confidence":3.523507080565512,"iterationTokens":574,"asi":{"hypothesis":"Pure server-side DFlash reasoning/output fixes can be benchmarked in isolation without harming the authoritative throughput lane; env-gated adaptive block logic should stay inactive by default.","rollback_reason":"Benchmark harness crash: scripts/siliconflash_benchmark.py slices message.content unconditionally, but current server response can return content=None for reasoning-heavy output.","next_action_hint":"Patch the benchmark harness to tolerate content=None (and preferably include reasoning_content preview), then rerun ./autoresearch.sh to measure the isolated server-side bundle honestly.","error_details":"TypeError: 'NoneType' object is not subscriptable at scripts/siliconflash_benchmark.py line 54 when building text_preview."}}
{"run":256,"commit":"a8e40e8","metric":0,"metrics":{},"status":"crash","description":"Patched the in-repo benchmark harness to tolerate reasoning-only responses with content=None, then reran the authoritative workload. The run crashed earlier in autoresearch.sh because it imports apply_dflash_fast_model_settings from omlx.model_settings, but that helper is absent on the reverted code path.","timestamp":1776142641252,"segment":19,"confidence":3.523507080565512,"iterationTokens":10378,"asi":{"hypothesis":"Make the experiment loop robust to reasoning-only server responses first, then re-measure the authoritative workload.","rollback_reason":"Autoresearch startup crash: autoresearch.sh imports apply_dflash_fast_model_settings from omlx.model_settings, but the helper is missing from the current reverted tree.","next_action_hint":"Restore the in-repo apply_dflash_fast_model_settings helper and its focused tests, then rerun ./autoresearch.sh.","error_details":"ImportError: cannot import name 'apply_dflash_fast_model_settings' from 'omlx.model_settings'"}}
{"run":257,"commit":"8088295","metric":87.47260310764815,"metrics":{},"status":"keep","description":"Restore the in-repo apply_dflash_fast_model_settings helper expected by autoresearch.sh and harden scripts/siliconflash_benchmark.py against reasoning-only responses with content=None. This unblocked the authoritative normal-EOS thinking benchmark and produced a new best throughput while preserving the settings-driven path.","timestamp":1776142755413,"segment":19,"confidence":3.9142091548258136,"iterationTokens":10554,"asi":{"hypothesis":"Restoring the repo-local fast-path model-settings helper and making the benchmark harness tolerate reasoning-only responses will unblock honest benchmarking of the productized settings-driven Qwen lane without changing the measured generation path.","unblocked_failure_modes":["ImportError from missing apply_dflash_fast_model_settings in autoresearch.sh","TypeError in scripts/siliconflash_benchmark.py when message.content is None"],"learning":"The benchmark lane can legitimately return reasoning-heavy responses where content is absent until the final answer, so the harness must not assume content is always a string. The settings-driven helper remains part of the real benchmarked path and its absence masked the true throughput.","files":["omlx/model_settings.py","scripts/siliconflash_benchmark.py","tests/test_model_settings.py","tests/test_siliconflash_benchmark.py"]}}
{"run":258,"commit":"8088295","metric":0,"metrics":{},"status":"crash","description":"Re-landed the pure server-side DFlash reasoning/runtime fixes (streaming detokenizer, think-prefix injection, incomplete-open-think parsing) and verified the focused test suite. The authoritative benchmark crashed before measurement because the current in-repo scripts/siliconflash_benchmark.py still slices message.content unconditionally; the response again returned content=None under the reasoning path.","timestamp":1776143113267,"segment":19,"confidence":3.9142091548258136,"iterationTokens":30675,"asi":{"hypothesis":"The surgical DFlash runtime/thinking fixes are benchmark-neutral or better on the authoritative settings-driven Qwen path once the harness tolerates reasoning-only responses.","rollback_reason":"Benchmark harness crash: scripts/siliconflash_benchmark.py in the current tree still assumes message.content is always a string and raised TypeError when content=None.","next_action_hint":"Reapply the repo-local benchmark harness guard for content=None on top of the current runtime/thinking changes, rerun focused tests, then benchmark again.","error_details":"TypeError: 'NoneType' object is not subscriptable at scripts/siliconflash_benchmark.py line 54"}}
{"run":259,"commit":"2fc35e5","metric":87.7280558254956,"metrics":{},"status":"keep","description":"Re-land the pure server-side DFlash reasoning/runtime fixes surgically: use a streaming detokenizer for bstnxbt streaming output assembly, inject the scheduler-equivalent synthetic <think> prefix when the prompt ends in an open thinking tag, and treat incomplete open-think tails as reasoning instead of normal content. Also reapply the repo-local benchmark guard for content=None so reasoning-heavy responses benchmark cleanly. This slightly improves the authoritative normal-EOS thinking workload while restoring the useful server behavior.","timestamp":1776143278399,"segment":19,"confidence":4.457692720879126,"iterationTokens":13696,"asi":{"hypothesis":"Pure server-side DFlash reasoning/output fixes can be landed without dragging down the authoritative settings-driven throughput lane if the benchmark harness also tolerates reasoning-only responses.","learning":"The DFlash stream assembly bug was real: prefix-unstable decode needs a streaming detokenizer, and Qwen thinking prompts need the synthetic <think> prefix for server-side reasoning parsing to behave like the stock scheduler. Incomplete open-think tails also need parser support on the non-stream path.","files":["omlx/dflash/runtime.py","omlx/api/thinking.py","scripts/siliconflash_benchmark.py","tests/test_dflash_runtime_dispatch.py","tests/test_thinking.py","tests/test_siliconflash_benchmark.py"]}}
{"run":260,"commit":"2fc35e5","metric":87.53608031642695,"metrics":{},"status":"discard","description":"Confirmation rerun of the surgical server-side DFlash reasoning/runtime keep. It stayed in the same high band but did not beat the new best, so treat it as confirmation noise rather than a new improvement.","timestamp":1776143316457,"segment":19,"confidence":4.614566512870831,"iterationTokens":1149,"asi":{"hypothesis":"The surgical server-side reasoning/runtime fixes should hold roughly the same authoritative throughput band on rerun.","rollback_reason":"No further primary-metric improvement over the newly kept 87.73 tok/s result.","next_action_hint":"Use the restored stable server-side baseline to investigate the remaining productization gap between benchmark request shape and plain launcher/API/chat request shapes, or probe long-decode-specific mitigations behind env gates.","learning":"The new server-side keep appears stable in the upper-87 tok/s band on the authoritative benchmark, but the incremental gain over the prior keep is small enough that extra reruns are just measuring noise now."}}
{"run":261,"commit":"2fc35e5","metric":73.49661691791553,"metrics":{},"status":"discard","description":"Taught scripts/siliconflash_start_qwen35_fast.sh to use the shared apply_dflash_fast_model_settings helper and added auth to launcher warmup/example requests. Live smoke confirmed plain requests without sampling params now stay on DFlash, but the immediate authoritative ./autoresearch.sh run regressed sharply, so this launcher-only productization change is not safe to keep yet.","timestamp":1776143609250,"segment":19,"confidence":3.7175485928135976,"iterationTokens":10533,"asi":{"hypothesis":"Unifying the launcher onto the shared fast-path model-settings helper would fix normal plain-request fallback to stock generation without perturbing the benchmark lane.","rollback_reason":"Authoritative benchmark regressed heavily to 73.50 tok/s immediately after the launcher-script-only change, so the change is not safe to land as-is.","next_action_hint":"Revisit launcher/defaulting separately from the benchmark lane. Compare launcher-applied settings versus autoresearch-applied settings on disk and isolate the exact field difference that makes plain requests stay on DFlash without dragging down the benchmark run.","learning":"The plain launcher failure mode is real and now explained: absent sampling params were leaving temperature non-greedy, so DFlash fell back with reason 'temperature must be 0'. However, fixing the launcher by switching it to the shared helper unexpectedly correlated with a large benchmark regression, so the remaining productization/defaulting work still needs finer isolation."}}
{"run":262,"commit":"2fc35e5","metric":87.49798767731525,"metrics":{},"status":"discard","description":"Minimal launcher-only productization patch: set the greedy sampling fields directly in scripts/siliconflash_start_qwen35_fast.sh model settings (temperature/top_p/top_k/min_p/force_sampling) and add auth to launcher warmup/example requests. The authoritative benchmark stayed in the high-87 tok/s band but did not beat the current best, so this is a functional no-improvement change under autoresearch rules.","timestamp":1776143701867,"segment":19,"confidence":4.432346180176682,"iterationTokens":4085,"asi":{"hypothesis":"A minimal launcher fix that only adds the missing greedy sampling fields and warmup auth can restore plain-request DFlash behavior without perturbing the authoritative benchmark lane.","rollback_reason":"No primary-metric improvement over the current best 87.73 tok/s keep.","next_action_hint":"If launcher usability remains a priority, re-land this as a productization-only branch after autoresearch finalization, or bundle it with a true benchmark win. In the meantime, focus the optimization loop on remaining measurable gaps such as plain-request parity investigation or long-decode-specific mitigations.","learning":"The launcher/defaulting root cause is now isolated: compared with autoresearch’s helper, the launcher was missing the greedy sampling fields. Adding only those fields appears benchmark-neutral-ish (87.50 tok/s) rather than catastrophically bad, unlike the earlier helper-based launcher rewrite."}}
{"run":263,"commit":"2fc35e5","metric":87.60403852375605,"metrics":{},"status":"discard","description":"Probe the authoritative settings-driven baseline with the benchmark request also explicitly sending chat_template_kwargs.enable_thinking=true (ENABLE_THINKING=1 while SETTINGS_ENABLE_THINKING stays 1). Throughput remained high but did not beat the current best.","timestamp":1776143766769,"segment":19,"confidence":5.7672834626192415,"iterationTokens":2411,"asi":{"hypothesis":"Making the benchmark request shape explicitly match the thinking-enabled semantics might tighten warmup/compile alignment and slightly improve the authoritative lane.","rollback_reason":"No primary-metric improvement over the current 87.73 tok/s best.","next_action_hint":"Keep the current settings-driven request shape as the benchmark authority and look elsewhere for measurable wins, such as long-decode-specific mitigations or other runtime-path bottlenecks.","learning":"On top of the settings-driven baseline, explicitly sending enable_thinking=true is roughly neutral on the authoritative workload rather than a clear win or collapse."}}
{"run":264,"commit":"2fc35e5","metric":87.50302741034751,"metrics":{},"status":"discard","description":"Probe explicit WARMUP_ENABLE_THINKING=1 on the authoritative settings-driven baseline while leaving the benchmark request shape unchanged. The warmup request became more shape-explicit, but throughput did not beat the current best.","timestamp":1776143806042,"segment":19,"confidence":6.051515090726232,"iterationTokens":972,"asi":{"hypothesis":"Explicitly enabling thinking on the warmup request might better align compile/warmup behavior with the real benchmark request and recover a small throughput gain.","rollback_reason":"No primary-metric improvement over the current best 87.73 tok/s keep.","next_action_hint":"Leave the benchmark/warmup contract unchanged and focus future experiments on other runtime levers rather than more request-shape nudges.","learning":"The current benchmark lane does not appear bottlenecked by whether the warmup payload explicitly carries enable_thinking when settings already force thinking."}}
{"run":265,"commit":"2fc35e5","metric":87.62765193209934,"metrics":{},"status":"discard","description":"Add an env-gated late-tail adaptive block-size fallback to the bstnxbt runtime and probe it on the authoritative workload with DFLASH_BSTNXBT_ADAPTIVE_BLOCK=1 starting at 768 generated tokens. The idea was to shrink speculation only when the late acceptance tail collapses, but it did not beat the current best on the 1024-token benchmark.","timestamp":1776143914757,"segment":19,"confidence":6.155564460036277,"iterationTokens":7922,"asi":{"hypothesis":"A late-only adaptive block fallback can help the long decode tail without touching the early fast path, potentially improving the authoritative 1024-token benchmark.","rollback_reason":"No primary-metric improvement over the current best 87.73 tok/s keep.","next_action_hint":"Keep adaptive block sizing as a long-decode-specific idea for 4k/8k/16k investigations rather than the 1024-token authority lane, or retest with much later thresholds outside the benchmark-critical region.","learning":"The adaptive helper is benchmark-neutral-ish at 1024 with a 768-token start threshold. That supports the idea that it may be more relevant to the much longer 4k+ collapse than to the authoritative 1024-token workload."}}
{"run":266,"commit":"2fc35e5","metric":87.52015975817525,"metrics":{},"status":"discard","description":"Probe a slightly deeper DFlash-path warmup by setting WARMUP_MAX_TOKENS=32 on the authoritative settings-driven benchmark. The idea was to precompile a bit more of the thinking-enabled path without changing the measured request, but it did not beat the current best.","timestamp":1776143960859,"segment":19,"confidence":7.004036933821116,"iterationTokens":1372,"asi":{"hypothesis":"Increasing DFlash warmup depth from the current default to 32 tokens might better precompile the thinking-enabled path and recover a small throughput gain.","rollback_reason":"No primary-metric improvement over the current 87.73 tok/s keep.","next_action_hint":"Keep the current warmup depth; more minor warmup-depth nudges are unlikely to matter compared with larger runtime or long-decode bottlenecks.","learning":"The authoritative lane is not obviously under-warmed at 16 tokens; raising warmup depth to 32 was effectively neutral."}}
{"run":267,"commit":"2fc35e5","metric":87.2996143756886,"metrics":{},"status":"discard","description":"Probe DFLASH_BSTNXBT_SPLIT_CHUNK_SIZE=10 on the authoritative normal-EOS thinking workload. The larger split-SDPA chunk kept the run in the high band but was slightly slower than the current best.","timestamp":1776144011746,"segment":19,"confidence":8.24839233074115,"iterationTokens":1761,"asi":{"hypothesis":"A somewhat larger split-SDPA chunk may reduce overhead on the thinking-enabled authority lane without breaking the tuned path.","rollback_reason":"No primary-metric improvement over the current best 87.73 tok/s keep.","next_action_hint":"Stop spending more authority-lane runs on split chunk retunes; earlier chunk-size experiments were already mostly bad and this one confirms the pattern.","learning":"Split chunk retunes remain unpromising on the authoritative thinking benchmark. Even when they do not collapse throughput, they still fail to beat the default path."}}
{"run":268,"commit":"2fc35e5","metric":87.57034142182,"metrics":{},"status":"discard","description":"Probe a much deeper DFlash warmup by setting WARMUP_MAX_TOKENS=64 on the authoritative settings-driven benchmark. Throughput remained high but did not beat the current best, while warmup time increased materially.","timestamp":1776144057297,"segment":19,"confidence":9.382601391457047,"iterationTokens":1202,"asi":{"hypothesis":"A 64-token DFlash warmup might eliminate any residual path-specific compile cost and lift the authoritative benchmark slightly.","rollback_reason":"No primary-metric improvement over the current best 87.73 tok/s keep.","next_action_hint":"Treat the current warmup depth as sufficient; additional warmup-token increases are just adding startup cost without helping the measured request.","learning":"The authoritative lane is not materially limited by warmup depth. Raising warmup to 64 only increased warmup_s and left completion throughput essentially unchanged."}}
{"run":269,"commit":"2fc35e5","metric":87.44766514202335,"metrics":{},"status":"discard","description":"Reuse a persistent block-token buffer inside the bstnxbt generate loop instead of allocating a fresh mx.full(...) block every cycle. The change preserved behavior and stayed in the high band, but it did not beat the current best on the authoritative workload.","timestamp":1776145433229,"segment":19,"confidence":10.878462702215545,"iterationTokens":4098,"asi":{"hypothesis":"Reusing the speculative block-token buffer each cycle can shave a small amount of Python/MLX allocation overhead from the bstnxbt loop.","rollback_reason":"No primary-metric improvement over the current best 87.73 tok/s keep.","next_action_hint":"Look for larger runtime-side overheads than per-cycle block-token allocation; this path appears too small to move the authoritative benchmark materially.","learning":"Per-cycle block-token buffer allocation is not a dominant bottleneck on the current 1024-token authority lane."}}
{"run":270,"commit":"2fc35e5","metric":87.40690836165732,"metrics":{},"status":"discard","description":"Slice committed_hidden to the accepted prefix immediately after verify, matching the external loop more closely and avoiding carrying rejected-step hidden states into the next cycle. It preserved correctness and stayed in-band, but did not beat the current best.","timestamp":1776145484649,"segment":19,"confidence":13.665691548398007,"iterationTokens":1610,"asi":{"hypothesis":"Trimming committed hidden states earlier can shave a small amount of array work from each speculative cycle without changing semantics.","rollback_reason":"No primary-metric improvement over the current best 87.73 tok/s keep.","next_action_hint":"Keep searching for larger runtime-side overheads; this particular hidden-state trim is not enough to move the authoritative benchmark.","learning":"Carrying the full verify hidden block until after commit does not appear to be a dominant cost on the current authority lane."}}
