{"run":683,"commit":"8b55918","metric":106.0817144134424,"metrics":{},"status":"discard","description":"Structural hot-loop trim: cache target embed_tokens callable and avoid per-iteration forced-prefix list/allocation churn when no thinking-budget queue.","timestamp":1776284604342,"segment":23,"confidence":2.3340497551232002,"iterationTokens":3656,"asi":{"hypothesis":"Reducing Python overhead in bstnxbt/mirror decode loop should lift throughput in the recovered ~100+ band.","rollback_reason":"Improved over recent trough samples but still below keep (106.08 vs 106.86).","next_action_hint":"Revert this loop micro-optimization; pursue larger structural levers or require immediate confirmation only if future changes exceed keep.","backend":"mirror_sd_mlx","context_only_draft_cache":1,"draft_sink":48,"optimization":"bstnxbt_loop_embed_cache_and_force_prefix_fastpath"}}
{"run":684,"commit":"8b55918","metric":105.39412501378008,"metrics":{},"status":"discard","description":"Post-revert anchor on unchanged mirror keep config after loop micro-optimization trial.","timestamp":1776284633451,"segment":23,"confidence":2.3403706889629348,"iterationTokens":774,"asi":{"hypothesis":"If candidate effect was non-positive, reverted baseline should remain in current recovered high-100 band.","rollback_reason":"Anchor remains below keep (105.39 vs 106.86).","next_action_hint":"Continue structural exploration with immediate paired validation in current stable window.","backend":"mirror_sd_mlx","context_only_draft_cache":1,"draft_sink":48,"stability_probe":true}}
{"run":685,"commit":"8b55918","metric":104.01558391437845,"metrics":{},"status":"discard","description":"Control pair run after 105.39 mirror anchor (mirror disabled).","timestamp":1776284667999,"segment":23,"confidence":2.3396032599037193,"iterationTokens":679,"asi":{"hypothesis":"Current recovered window should keep mirror/control relatively close; pairing guards against over-claiming backend edge.","rollback_reason":"Comparison-only run; control slightly below paired mirror this time.","next_action_hint":"Ordering still flips but gap is modest; continue targeting >106.86 structural wins only.","backend":"bstnxbt_mlx","mirror_runtime_enabled":0,"context_only_draft_cache":1,"draft_sink":48,"paired_mirror_tok_s":105.39412501378008,"paired_delta_tok_s":1.3785410994016245}}
{"run":686,"commit":"8b55918","metric":106.56566655832981,"metrics":{},"status":"discard","description":"Mirror follow-up after control pair in recovered high-band window.","timestamp":1776284712051,"segment":23,"confidence":2.341307904906078,"iterationTokens":644,"asi":{"hypothesis":"Mirror rerun should remain in high-100 band and may approach historical keep-level throughput as regime recovers.","rollback_reason":"Strong sample but still below keep by ~0.29 tok/s (106.57 vs 106.86).","next_action_hint":"Run immediate unchanged confirmation to verify whether this is a near-keep transient or sustained rebound.","backend":"mirror_sd_mlx","context_only_draft_cache":1,"draft_sink":48,"paired_control_tok_s":104.01558391437845,"paired_delta_tok_s":2.5500826439513617,"near_keep_delta":-0.29433344167019443}}
{"run":687,"commit":"8b55918","metric":106.47474316914841,"metrics":{},"status":"discard","description":"Immediate confirmation rerun for near-keep mirror rebound sample.","timestamp":1776284739379,"segment":23,"confidence":2.419580186576206,"iterationTokens":804,"asi":{"hypothesis":"If 106.57 was sustained recovery, immediate rerun should stay near that level and potentially exceed keep.","rollback_reason":"Confirmation stayed high but still below keep (106.47 vs 106.86).","next_action_hint":"Treat this as recovered baseline band, not a new winner; continue searching for structural >106.86 gains.","backend":"mirror_sd_mlx","context_only_draft_cache":1,"draft_sink":48,"near_keep_confirmation":true,"delta_vs_keep":-0.3852568308515884}}
{"run":688,"commit":"8b55918","metric":106.66912321225898,"metrics":{},"status":"discard","description":"Structural runtime config-cache: skip redundant full-attention split reconfiguration when settings are unchanged between warmup and benchmark requests.","timestamp":1776284839502,"segment":23,"confidence":2.5047013010269255,"iterationTokens":4298,"asi":{"hypothesis":"Avoiding repeated per-layer split-SDPA attribute writes on unchanged runtime settings should reduce request overhead and improve 1024-lane throughput.","rollback_reason":"Near-keep but still below winner (106.67 vs 106.86).","next_action_hint":"Revert this config-cache optimization for now; only re-open if paired confirmations can show a robust >106.86 gain.","backend":"mirror_sd_mlx","context_only_draft_cache":1,"draft_sink":48,"optimization":"split_config_cache_skip_reapply","delta_vs_keep":-0.19087678774101283}}
{"run":689,"commit":"8b55918","metric":106.65541831988818,"metrics":{},"status":"discard","description":"Post-revert anchor after split-config-cache structural trial.","timestamp":1776284870806,"segment":23,"confidence":2.594555436096887,"iterationTokens":986,"asi":{"hypothesis":"If the candidate had little real effect, reverted baseline should land in the same near-keep band.","rollback_reason":"Anchor matched candidate level (~106.66), still below keep.","next_action_hint":"Treat prior near-keep structural sample as noise-equivalent to baseline; keep searching for higher-leverage changes.","backend":"mirror_sd_mlx","context_only_draft_cache":1,"draft_sink":48,"stability_probe":true,"delta_vs_keep":-0.2045816801118108}}
{"run":690,"commit":"8b55918","metric":106.50400814282783,"metrics":{},"status":"discard","description":"High-exit sweep gap fill: DFLASH_MIRROR_SD_EXIT_LAYER=27.","timestamp":1776284907814,"segment":23,"confidence":2.67024893653663,"iterationTokens":885,"asi":{"hypothesis":"Untested high split layer 27 might outperform adjacent tested high exits while avoiding 30/31 cliffs.","rollback_reason":"Near-keep sample but still below winner (106.50 vs 106.86).","next_action_hint":"Mark exit layer 27 non-winning; continue to close remaining high-exit gap at 29 only if needed.","backend":"mirror_sd_mlx","context_only_draft_cache":1,"draft_sink":48,"mirror_exit_layer":27,"delta_vs_keep":-0.3559918571721761}}
{"run":691,"commit":"8b55918","metric":106.16420815722032,"metrics":{},"status":"discard","description":"High-exit sweep gap fill: DFLASH_MIRROR_SD_EXIT_LAYER=29.","timestamp":1776284935228,"segment":23,"confidence":2.723385946263545,"iterationTokens":678,"asi":{"hypothesis":"High split layer 29 might be viable even if 30/31 are cliff points.","rollback_reason":"Below keep (106.16 vs 106.86).","next_action_hint":"Add exit layer 29 to do-not-retry set and consider high-exit region fully exhausted.","backend":"mirror_sd_mlx","context_only_draft_cache":1,"draft_sink":48,"mirror_exit_layer":29,"delta_vs_keep":-0.6957918427796874}}
{"run":692,"commit":"8b55918","metric":105.71086790268383,"metrics":{},"status":"discard","description":"Split-SDPA chunk sweep extension: DFLASH_BSTNXBT_SPLIT_CHUNK_SIZE=21.","timestamp":1776284974235,"segment":23,"confidence":2.770106183118362,"iterationTokens":1090,"asi":{"hypothesis":"Chunk size 21 may reveal a late non-monotonic pocket not covered by prior even/odd tests.","rollback_reason":"Still below keep (105.71 vs 106.86).","next_action_hint":"Add chunk size 21 to do-not-retry set; extended large-chunk region remains non-winning on 1024 lane.","backend":"mirror_sd_mlx","context_only_draft_cache":1,"draft_sink":48,"split_chunk_size":21,"delta_vs_keep":-1.1491320973161745}}
{"run":693,"commit":"8b55918","metric":105.91084248917292,"metrics":{},"status":"discard","description":"Split-SDPA chunk sweep extension: DFLASH_BSTNXBT_SPLIT_CHUNK_SIZE=22.","timestamp":1776285001789,"segment":23,"confidence":2.7899165391440173,"iterationTokens":667,"asi":{"hypothesis":"Chunk size 22 could outperform neighboring large chunks by better balancing split attention overhead.","rollback_reason":"Below keep (105.91 vs 106.86).","next_action_hint":"Add chunk size 22 to do-not-retry set; no evidence large-chunk sweep can beat default 8.","backend":"mirror_sd_mlx","context_only_draft_cache":1,"draft_sink":48,"split_chunk_size":22,"delta_vs_keep":-0.9491575108270806}}
{"run":694,"commit":"8b55918","metric":105.85440091504412,"metrics":{},"status":"discard","description":"Split-SDPA chunk sweep extension: DFLASH_BSTNXBT_SPLIT_CHUNK_SIZE=23.","timestamp":1776285030804,"segment":23,"confidence":2.8161906993943284,"iterationTokens":653,"asi":{"hypothesis":"Chunk size 23 might uncover an odd-sized sweet spot in the large-chunk region.","rollback_reason":"Below keep (105.85 vs 106.86).","next_action_hint":"Add chunk size 23 to do-not-retry set and close remaining untested 17–24 sweep gap.","backend":"mirror_sd_mlx","context_only_draft_cache":1,"draft_sink":48,"split_chunk_size":23,"delta_vs_keep":-1.0055990849558778}}
{"run":695,"commit":"8b55918","metric":105.68993478551663,"metrics":{},"status":"discard","description":"Context-only sink gap fill: DFLASH_DRAFT_SINK=45.","timestamp":1776285077935,"segment":23,"confidence":2.849632769381764,"iterationTokens":1548,"asi":{"hypothesis":"Untested sink 45 might outperform nearby non-winning 44/46 and beat keep in recovered high band.","rollback_reason":"Below keep (105.69 vs 106.86).","next_action_hint":"Add sink 45 to do-not-retry set; context-only sink neighborhood remains exhausted around keep=48.","backend":"mirror_sd_mlx","context_only_draft_cache":1,"draft_sink":45,"delta_vs_keep":-1.1700652144833734}}
{"run":696,"commit":"8b55918","metric":105.97718023595459,"metrics":{},"status":"discard","description":"Context-only sink gap fill: DFLASH_DRAFT_SINK=51.","timestamp":1776285106936,"segment":23,"confidence":2.888228427608669,"iterationTokens":651,"asi":{"hypothesis":"Untested sink 51 may outperform adjacent failed values 50/52 by reducing cache-trim overhead balance.","rollback_reason":"Below keep (105.98 vs 106.86).","next_action_hint":"Add sink 51 to do-not-retry set; keep sink 48 remains strongest.","backend":"mirror_sd_mlx","context_only_draft_cache":1,"draft_sink":51,"delta_vs_keep":-0.8828197640454124}}
{"run":697,"commit":"8b55918","metric":105.69142609384396,"metrics":{},"status":"discard","description":"Context-only sink gap fill: DFLASH_DRAFT_SINK=53.","timestamp":1776285142120,"segment":23,"confidence":2.9007053800860794,"iterationTokens":622,"asi":{"hypothesis":"Sink 53 could be a local optimum in the upper sink region not covered by earlier sparse sweep.","rollback_reason":"Below keep (105.69 vs 106.86).","next_action_hint":"Add sink 53 to do-not-retry set; upper sink values continue to underperform.","backend":"mirror_sd_mlx","context_only_draft_cache":1,"draft_sink":53,"delta_vs_keep":-1.1685739061560494}}
{"run":698,"commit":"8b55918","metric":105.99825565556223,"metrics":{},"status":"discard","description":"Context-only draft-window gap fill: DFLASH_DRAFT_WINDOW=1000 (sink=48).","timestamp":1776285197325,"segment":23,"confidence":2.913290599459628,"iterationTokens":2045,"asi":{"hypothesis":"A near-default window just below 1024 might trim cache work without harming context utility.","rollback_reason":"Below keep (106.00 vs 106.86).","next_action_hint":"Add window 1000 to do-not-retry set; near-default downward trim is non-winning.","backend":"mirror_sd_mlx","context_only_draft_cache":1,"draft_sink":48,"draft_window":1000,"delta_vs_keep":-0.8617443444377716}}
{"run":699,"commit":"8b55918","metric":106.53551100973695,"metrics":{},"status":"discard","description":"Context-only draft-window gap fill: DFLASH_DRAFT_WINDOW=1040 (sink=48).","timestamp":1776285231938,"segment":23,"confidence":2.921939065847344,"iterationTokens":658,"asi":{"hypothesis":"A slight window increase above default 1024 may improve acceptance/context retention enough to offset extra cache cost.","rollback_reason":"Near-keep but still below winner (106.54 vs 106.86).","next_action_hint":"Add window 1040 to do-not-retry set; keep default window 1024 remains best among tested nearby values.","backend":"mirror_sd_mlx","context_only_draft_cache":1,"draft_sink":48,"draft_window":1040,"delta_vs_keep":-0.3244889902630489}}
{"run":700,"commit":"8b55918","metric":106.42690080598126,"metrics":{},"status":"discard","description":"Context-only draft-window gap fill: DFLASH_DRAFT_WINDOW=1056 (sink=48).","timestamp":1776285262674,"segment":23,"confidence":2.930639033223776,"iterationTokens":712,"asi":{"hypothesis":"Midpoint window between 1040 and 1088 might capture any narrow local optimum above default.","rollback_reason":"Below keep (106.43 vs 106.86).","next_action_hint":"Add window 1056 to do-not-retry set; nearby >1024 windows remain non-winning.","backend":"mirror_sd_mlx","context_only_draft_cache":1,"draft_sink":48,"draft_window":1056,"delta_vs_keep":-0.4330991940187391}}
{"run":701,"commit":"8b55918","metric":106.53877990157243,"metrics":{},"status":"discard","description":"Control pair anchor in recovered high band (mirror disabled).","timestamp":1776285306975,"segment":23,"confidence":2.9896471308627888,"iterationTokens":991,"asi":{"hypothesis":"Control should be near mirror in current stable high-band window, helping classify whether mirror-specific tuning still has headroom.","rollback_reason":"Comparison-only run; control landed at 106.54 (near historical top band but below keep).","next_action_hint":"Run immediate mirror follow-up to complete pair and evaluate backend ordering at high throughput.","backend":"bstnxbt_mlx","mirror_runtime_enabled":0,"context_only_draft_cache":1,"draft_sink":48}}
{"run":702,"commit":"8b55918","metric":106.3511030032926,"metrics":{},"status":"discard","description":"Mirror follow-up after 106.54 control anchor in high band.","timestamp":1776285336067,"segment":23,"confidence":3.057560340856306,"iterationTokens":607,"asi":{"hypothesis":"Mirror should remain in the same high band and potentially retake a small lead if ordering continues to flip.","rollback_reason":"Mirror remained high but trailed paired control slightly (106.35 vs 106.54) and still below keep.","next_action_hint":"Continue structural-only experiments; current mirror/control near-parity persists without new winner.","backend":"mirror_sd_mlx","context_only_draft_cache":1,"draft_sink":48,"paired_control_tok_s":106.53877990157243,"paired_delta_tok_s":-0.18767689827983536,"delta_vs_keep":-0.5088969967073974}}
{"run":703,"commit":"8b55918","metric":106.51348188378032,"metrics":{},"status":"discard","description":"Context-only sink gap fill: DFLASH_DRAFT_SINK=54.","timestamp":1776285390000,"segment":23,"confidence":3.103626686907939,"iterationTokens":1887,"asi":{"hypothesis":"Upper sink 54 may smooth cache retention balance better than nearby tested values.","rollback_reason":"Near-keep but still below winner (106.51 vs 106.86).","next_action_hint":"Add sink 54 to do-not-retry set; continue avoiding sink micro-churn without new rationale.","backend":"mirror_sd_mlx","context_only_draft_cache":1,"draft_sink":54,"delta_vs_keep":-0.3465181162196781}}
{"run":704,"commit":"8b55918","metric":106.2542801585232,"metrics":{},"status":"discard","description":"Context-only sink gap fill: DFLASH_DRAFT_SINK=55.","timestamp":1776285421511,"segment":23,"confidence":3.1523213474269105,"iterationTokens":633,"asi":{"hypothesis":"Sink 55 might outperform adjacent upper sink values and approach or exceed keep.","rollback_reason":"Below keep (106.25 vs 106.86).","next_action_hint":"Add sink 55 to do-not-retry set; sink sweep around 48 appears fully exhausted.","backend":"mirror_sd_mlx","context_only_draft_cache":1,"draft_sink":55,"delta_vs_keep":-0.6057198414768025}}
{"run":705,"commit":"8b55918","metric":106.55840305165083,"metrics":{},"status":"discard","description":"Context-only sink lower-gap test: DFLASH_DRAFT_SINK=43.","timestamp":1776285459523,"segment":23,"confidence":3.1493026317162705,"iterationTokens":884,"asi":{"hypothesis":"Untested lower sink 43 might provide a tighter cache-retention balance than nearby 44/46 values.","rollback_reason":"Near-keep but still below winner (106.56 vs 106.86).","next_action_hint":"Add sink 43 to do-not-retry set; keep sink 48 still leads.","backend":"mirror_sd_mlx","context_only_draft_cache":1,"draft_sink":43,"delta_vs_keep":-0.3015969483491745}}
{"run":706,"commit":"8b55918","metric":106.62177584486855,"metrics":{},"status":"discard","description":"Context-only sink lower-gap test: DFLASH_DRAFT_SINK=42.","timestamp":1776285491035,"segment":23,"confidence":3.173523389664768,"iterationTokens":642,"asi":{"hypothesis":"Sink 42 could improve throughput by preserving less sink context while keeping enough anchoring signal.","rollback_reason":"Near-keep but still below winner (106.62 vs 106.86).","next_action_hint":"Add sink 42 to do-not-retry set; no lower-sink gap tested so far has beaten 48.","backend":"mirror_sd_mlx","context_only_draft_cache":1,"draft_sink":42,"delta_vs_keep":-0.23822415513145442}}
{"run":707,"commit":"8b55918","metric":106.41565873176377,"metrics":{},"status":"discard","description":"Context-only sink lower-gap test: DFLASH_DRAFT_SINK=41.","timestamp":1776285524814,"segment":23,"confidence":3.166346335395454,"iterationTokens":659,"asi":{"hypothesis":"Sink 41 may be a better low-sink operating point than 40/42 under current recovered regime.","rollback_reason":"Below keep (106.42 vs 106.86).","next_action_hint":"Add sink 41 to do-not-retry set; lower-sink gap appears exhausted.","backend":"mirror_sd_mlx","context_only_draft_cache":1,"draft_sink":41,"delta_vs_keep":-0.4443412682362399}}
{"run":708,"commit":"8b55918","metric":105.86863860662446,"metrics":{},"status":"discard","description":"Context-only sink extension: DFLASH_DRAFT_SINK=57.","timestamp":1776285573146,"segment":23,"confidence":3.1665070546409644,"iterationTokens":965,"asi":{"hypothesis":"Slightly above previously tested 56 may reclaim performance if upper sink optimum is narrow.","rollback_reason":"Below keep (105.87 vs 106.86).","next_action_hint":"Add sink 57 to do-not-retry set; upper sink extension continues to underperform.","backend":"mirror_sd_mlx","context_only_draft_cache":1,"draft_sink":57,"delta_vs_keep":-0.9913613933755504}}
{"run":709,"commit":"8b55918","metric":105.83386348909721,"metrics":{},"status":"discard","description":"Context-only draft-window gap fill: DFLASH_DRAFT_WINDOW=1032.","timestamp":1776285605306,"segment":23,"confidence":3.3468347262969007,"iterationTokens":696,"asi":{"hypothesis":"A very near-default window (1032) might hit a narrow local optimum missed by sparse window sweeps.","rollback_reason":"Below keep (105.83 vs 106.86).","next_action_hint":"Add window 1032 to do-not-retry set; near-default window micro-sweep remains non-winning.","backend":"mirror_sd_mlx","context_only_draft_cache":1,"draft_sink":48,"draft_window":1032,"delta_vs_keep":-1.0261365109027851}}
{"run":710,"commit":"8b55918","metric":106.08720353114357,"metrics":{},"status":"discard","description":"Context-only draft-window gap fill: DFLASH_DRAFT_WINDOW=1016.","timestamp":1776285640163,"segment":23,"confidence":3.5988322811046234,"iterationTokens":643,"asi":{"hypothesis":"Slightly below-default window 1016 could reduce trim overhead while preserving enough context to maintain acceptance.","rollback_reason":"Below keep (106.09 vs 106.86).","next_action_hint":"Add window 1016 to do-not-retry set; default 1024 still dominates nearby values.","backend":"mirror_sd_mlx","context_only_draft_cache":1,"draft_sink":48,"draft_window":1016,"delta_vs_keep":-0.7727964688564212}}
{"run":711,"commit":"8b55918","metric":106.5421496911429,"metrics":{},"status":"discard","description":"Unchanged mirror anchor after extended sink/window gap-fill sweep.","timestamp":1776285677845,"segment":23,"confidence":3.6188030363910926,"iterationTokens":1016,"asi":{"hypothesis":"Reverting to keep shape should remain in high recovered band if no global collapse wave is active.","rollback_reason":"Strong anchor but still below keep (106.54 vs 106.86).","next_action_hint":"Current band is stable/high; prioritize structural experiments over further sink/window micro-churn.","backend":"mirror_sd_mlx","context_only_draft_cache":1,"draft_sink":48,"stability_probe":true,"delta_vs_keep":-0.3178503088570895}}
{"run":712,"commit":"8b55918","metric":106.4517390421813,"metrics":{},"status":"discard","description":"Combined structural attempt: split-config cache (skip redundant reconfigure/hook checks), capture-layer frozenset, and loop-level embed/forced-prefix allocation trims.","timestamp":1776285797343,"segment":23,"confidence":3.6629406311936155,"iterationTokens":5912,"asi":{"hypothesis":"Stacking multiple low-level Python overhead trims in bstnxbt/mirror hot path may combine into a measurable throughput gain above keep.","rollback_reason":"Did not beat keep (106.45 vs 106.86).","next_action_hint":"Revert combined micro-structural patch; individual low-level Python trims appear noise-equivalent in current regime.","backend":"mirror_sd_mlx","context_only_draft_cache":1,"draft_sink":48,"optimization":"combined_split_cache_plus_loop_trim_plus_capture_frozenset","delta_vs_keep":-0.40826095781870364}}
{"run":713,"commit":"8b55918","metric":106.42107740478221,"metrics":{},"status":"discard","description":"Post-revert anchor after combined micro-structural patch attempt.","timestamp":1776285834240,"segment":23,"confidence":3.737311852941658,"iterationTokens":877,"asi":{"hypothesis":"Reverted keep-shape baseline should remain in the same high-106 band if candidate patch had no true gain.","rollback_reason":"Anchor remained below keep (106.42 vs 106.86).","next_action_hint":"Continue searching for non-micro structural changes; current baseline appears stable around ~106.4-106.6.","backend":"mirror_sd_mlx","context_only_draft_cache":1,"draft_sink":48,"stability_probe":true,"delta_vs_keep":-0.438922595217791}}
