{"run":2492,"commit":"26f9501","metric":94.82897989329739,"metrics":{},"status":"discard","description":"Control climbed to ~94.8 tok/s in fused-only/safe_mode=0 mode with eval ~10.05; strongest rebound in this wave but still above near-floor threshold.","timestamp":1776482094384,"segment":25,"confidence":3.1338357019169423,"iterationTokens":4251,"asi":{"hypothesis":"The regime may continue tightening from high shelf toward floor without code changes.","rollback_reason":"No code changes; monitoring-only run.","next_action_hint":"Take immediate follow-up control samples to confirm whether eval continues contracting toward ~9s before enabling DDTree parity checks.","diagnostic_findings":{"completion_tok_s":94.82897989329739,"dflash_eval_s":10.048817675560713,"safe_mode_active":0,"verify_eval_wait_fused_steps":96,"verify_eval_wait_unfused_steps":0}}}
{"run":2493,"commit":"26f9501","metric":94.13007660666568,"metrics":{},"status":"discard","description":"Follow-up control stayed near the new high shelf (~94.1 tok/s, fused-only/safe_mode=0) with eval ~10.12, confirming rebound but still above floor.","timestamp":1776482124539,"segment":25,"confidence":3.143918515756658,"iterationTokens":4250,"asi":{"hypothesis":"If this is still shelf mode, repeated high samples should remain around ~10.0+ eval rather than returning to ~8.8–9.0.","rollback_reason":"No code changes; monitoring-only run.","next_action_hint":"Take one more control sample to test persistence; only re-enable DDTree parity if eval contracts near floor.","diagnostic_findings":{"completion_tok_s":94.13007660666568,"dflash_eval_s":10.119767708121799,"safe_mode_active":0,"verify_eval_wait_fused_steps":96,"verify_eval_wait_unfused_steps":0}}}
{"run":2494,"commit":"26f9501","metric":97.56612069797409,"metrics":{},"status":"discard","description":"Control reached a stronger fused-only shelf sample (~97.6 tok/s) with eval ~9.75, closer to floor but still above strict ~8.8–9.0 gate.","timestamp":1776482154822,"segment":25,"confidence":3.1540664199787267,"iterationTokens":4118,"asi":{"hypothesis":"Rebound is tightening toward floor and may soon re-open valid parity-testing conditions if eval continues to contract.","rollback_reason":"No code changes; monitoring-only run.","next_action_hint":"Run immediate confirmation control sample; if eval holds near <=9.2, take matched DDTree baseline + control parity sequence.","diagnostic_findings":{"completion_tok_s":97.56612069797409,"dflash_eval_s":9.751897292910144,"safe_mode_active":0,"verify_eval_wait_fused_steps":96,"verify_eval_wait_unfused_steps":0}}}
{"run":2495,"commit":"26f9501","metric":94.13007660666568,"metrics":{},"status":"discard","description":"Confirmation control sample remained fused-only and fast (~94.1 tok/s) but eval stayed around ~10.12, indicating shelf stability rather than full floor return.","timestamp":1776482162917,"segment":25,"confidence":3.2099694418967015,"iterationTokens":4118,"asi":{"hypothesis":"Without further contraction, this remains an elevated shelf and DDTree conclusions could still be confounded.","rollback_reason":"No code changes; monitoring-only confirmation run.","next_action_hint":"Continue control monitoring until eval repeatedly lands near ~8.8–9.0 before running DDTree parity probes.","diagnostic_findings":{"completion_tok_s":94.13007660666568,"dflash_eval_s":10.119767708121799,"safe_mode_active":0,"verify_eval_wait_fused_steps":96,"verify_eval_wait_unfused_steps":0}}}
{"run":2496,"commit":"26f9501","metric":106.99388731959085,"metrics":{},"status":"discard","description":"Control re-entered near-floor fused-only regime (~107.0 tok/s, eval ~8.85, safe_mode=0), reopening conditions for strict DDTree parity checks if sustained.","timestamp":1776482348145,"segment":25,"confidence":3.210862513380896,"iterationTokens":4118,"asi":{"hypothesis":"The inflated shelf can self-resolve back to floor behavior without code changes.","rollback_reason":"No code changes; monitoring-only sample.","next_action_hint":"Take immediate control confirmation sample; if floor-like metrics persist, run matched DDTree baseline and parity control.","diagnostic_findings":{"completion_tok_s":106.99388731959085,"dflash_eval_s":8.847744618076831,"safe_mode_active":0,"verify_eval_wait_fused_steps":96,"verify_eval_wait_unfused_steps":0}}}
{"run":2497,"commit":"26f9501","metric":107.08271228442268,"metrics":{},"status":"discard","description":"Second consecutive control sample held near-floor fused-only timing (~107.1 tok/s, eval ~8.83, safe_mode=0), satisfying stability gate for DDTree parity checks.","timestamp":1776482374856,"segment":25,"confidence":3.2076570626462755,"iterationTokens":4274,"asi":{"hypothesis":"The lane has re-entered a stable floor pocket suitable for matched DDTree/control attribution.","rollback_reason":"No code changes; confirmation monitoring run.","next_action_hint":"Run immediate DDTree baseline (budget 13 + unnormalized) followed by no-DDTree parity control.","diagnostic_findings":{"completion_tok_s":107.08271228442268,"dflash_eval_s":8.831204420188442,"safe_mode_active":0,"verify_eval_wait_fused_steps":96,"verify_eval_wait_unfused_steps":0}}}
{"run":2498,"commit":"26f9501","metric":28.024438742569515,"metrics":{},"status":"discard","description":"DDTree baseline attempt was invalid: ddtree backend failed to load (`No module named 'ddtree_mlx'`), so requests fell back off DFlash and throughput collapsed (~28.0 tok/s).","timestamp":1776482499213,"segment":25,"confidence":3.2044580056248724,"iterationTokens":34519,"asi":{"hypothesis":"Run native DDTree baseline immediately after floor re-entry for matched parity.","rollback_reason":"Configuration/runtime issue: ddtree module path unresolved caused fallback, making this sample unusable for DDTree attribution.","next_action_hint":"Re-run DDTree baseline with explicit DFLASH_DDTREE_PATH=/tmp/ddtree-mlx (and native/runtime flags), then pair with immediate no-DDTree control.","error_details":{"availability_reason":"ddtree_mlx native backend unavailable (No module named 'ddtree_mlx')","dflash_fallback":true,"completion_tok_s":28.024438742569515}}}
{"run":2499,"commit":"26f9501","metric":44.23723584353789,"metrics":{},"status":"discard","description":"Native DDTree baseline with explicit DDTREE path ran correctly but collapsed (~44.2 tok/s): tree_build inflated to ~4.75s despite budget-13/unnormalized settings.","timestamp":1776482557984,"segment":25,"confidence":3.171761420830124,"iterationTokens":7672,"asi":{"hypothesis":"With floor-like control conditions, DDTree baseline should return to ~101–103 tok/s.","rollback_reason":"Primary metric catastrophically below expected DDTree band; likely unstable DDTree runtime/environment interaction in this window.","next_action_hint":"Run immediate no-DDTree control parity to separate shared regime collapse from DDTree-path-specific degradation.","diagnostic_findings":{"completion_tok_s":44.23723584353789,"dflash_eval_s":23.140501458,"dflash_ddtree_tree_build_s":4.754133628,"dflash_ddtree_cycles_completed":98,"dflash_ddtree_avg_acceptance":10.448979591836734,"dflash_ddtree_native_runtime":1}}}
{"run":2500,"commit":"26f9501","metric":43.00339376685994,"metrics":{},"status":"discard","description":"Immediate no-DDTree control parity also collapsed (~43.0 tok/s) with early safe-mode (step 6), unfused-dominant verify waits, and inflated eval (~18.76s), confirming shared instability wave.","timestamp":1776482598799,"segment":25,"confidence":3.139725333782629,"iterationTokens":2585,"asi":{"hypothesis":"The DDTree collapse sample was at least partly regime-driven rather than a deterministic DDTree-path regression.","rollback_reason":"No code changes; parity attribution run in fresh collapse wave.","next_action_hint":"Pause DDTree probing and resume passive control monitoring until fused-only near-floor conditions return.","diagnostic_findings":{"completion_tok_s":43.00339376685994,"dflash_eval_s":18.758837217232212,"safe_mode_active":1,"safe_mode_step":6,"verify_eval_wait_fused_steps":6,"verify_eval_wait_unfused_steps":100}}}
{"run":2501,"commit":"26f9501","metric":96.63478256493103,"metrics":{},"status":"discard","description":"Control rebounded from the collapse wave to fused-only/safe_mode=0 (~96.6 tok/s), but eval is still elevated (~9.88), so conditions remain non-floor for DDTree attribution.","timestamp":1776482628446,"segment":25,"confidence":3.171761420830124,"iterationTokens":4332,"asi":{"hypothesis":"Post-collapse recovery should pass through an inflated fused-only shelf before true floor re-entry.","rollback_reason":"No code changes; monitoring-only rebound sample.","next_action_hint":"Continue passive control monitoring and wait for repeated ~8.8–9.0 eval before reattempting DDTree parity probes.","diagnostic_findings":{"completion_tok_s":96.63478256493103,"dflash_eval_s":9.879896046360955,"safe_mode_active":0,"verify_eval_wait_fused_steps":96,"verify_eval_wait_unfused_steps":0}}}
{"run":2502,"commit":"26f9501","metric":70.69529594616326,"metrics":{},"status":"discard","description":"Control dropped to a fused-only degraded shelf (~70.7 tok/s, eval ~13.72) without safe-mode activation, reinforcing non-spike inflation behavior in this wave.","timestamp":1776482681372,"segment":25,"confidence":3.1452343952144592,"iterationTokens":6079,"asi":{"hypothesis":"Recovery can regress into a fused-only high-latency shelf even with safe_mode=0.","rollback_reason":"No code changes; monitoring-only sample.","next_action_hint":"Keep passive monitoring and avoid DDTree A/B until eval contracts back toward repeated ~8.8–9.0 floor values.","diagnostic_findings":{"completion_tok_s":70.69529594616326,"dflash_eval_s":13.722099789534695,"safe_mode_active":0,"verify_eval_wait_fused_steps":96,"verify_eval_wait_unfused_steps":0}}}
{"run":2503,"commit":"26f9501","metric":82.8443999041695,"metrics":{},"status":"discard","description":"Control climbed from deep collapse into fused-only/safe_mode=0 shelf (~82.8 tok/s) but eval remains inflated (~11.62), so still non-floor attribution conditions.","timestamp":1776482752866,"segment":25,"confidence":3.143918515756658,"iterationTokens":3337,"asi":{"hypothesis":"Recovery should pass through fused-only elevated shelves before any true floor return.","rollback_reason":"No code changes; monitoring-only control sample.","next_action_hint":"Continue passive control monitoring; wait for repeated ~8.8–9.0 eval before DDTree parity attempts.","diagnostic_findings":{"completion_tok_s":82.8443999041695,"dflash_eval_s":11.620908006676473,"safe_mode_active":0,"verify_eval_wait_fused_steps":96,"verify_eval_wait_unfused_steps":0}}}
{"run":2504,"commit":"26f9501","metric":85.87149325880934,"metrics":{},"status":"discard","description":"Control improved modestly on the fused-only shelf (~85.9 tok/s, safe_mode=0), but eval remains elevated (~11.18) versus floor gate.","timestamp":1776482780911,"segment":25,"confidence":3.1540664199787267,"iterationTokens":4160,"asi":{"hypothesis":"This wave can climb within a fused-only inflated shelf before true floor timing returns.","rollback_reason":"No code changes; monitoring-only sample.","next_action_hint":"Continue passive control runs and defer DDTree checks until repeated ~8.8–9.0 eval samples appear.","diagnostic_findings":{"completion_tok_s":85.87149325880934,"dflash_eval_s":11.183799875550903,"safe_mode_active":0,"verify_eval_wait_fused_steps":96,"verify_eval_wait_unfused_steps":0}}}
{"run":2505,"commit":"26f9501","metric":84.49529550123721,"metrics":{},"status":"discard","description":"Control stayed in the same fused-only/safe_mode=0 inflation shelf (~84.5 tok/s, eval ~11.34) with no structural recovery signal.","timestamp":1776482810194,"segment":25,"confidence":3.186534616661596,"iterationTokens":4104,"asi":{"hypothesis":"Near-term behavior remains shelf oscillation with elevated eval rather than floor re-entry.","rollback_reason":"No code changes; monitoring-only sample.","next_action_hint":"Continue passive monitoring and hold DDTree probes until sustained near-floor eval (~8.8–9.0) returns.","diagnostic_findings":{"completion_tok_s":84.49529550123721,"dflash_eval_s":11.34105632698629,"safe_mode_active":0,"verify_eval_wait_fused_steps":96,"verify_eval_wait_unfused_steps":0}}}
{"run":2506,"commit":"26f9501","metric":88.18440179177149,"metrics":{},"status":"discard","description":"Control continued shelf rebound (~88.2 tok/s, fused-only/safe_mode=0), but eval is still elevated (~10.89), so floor gate remains unmet.","timestamp":1776482843171,"segment":25,"confidence":3.219678226206998,"iterationTokens":4098,"asi":{"hypothesis":"The regime is trending upward within an inflated fused-only shelf but not yet at true floor timing.","rollback_reason":"No code changes; monitoring-only sample.","next_action_hint":"Take additional control samples; only re-enable DDTree parity when eval repeatedly contracts near ~8.8–9.0.","diagnostic_findings":{"completion_tok_s":88.18440179177149,"dflash_eval_s":10.885617917752825,"safe_mode_active":0,"verify_eval_wait_fused_steps":96,"verify_eval_wait_unfused_steps":0}}}
{"run":2507,"commit":"26f9501","metric":88.8424451891175,"metrics":{},"status":"discard","description":"Control held upper fused-only shelf (~88.8 tok/s, safe_mode=0) with eval still inflated (~10.81), so not yet a trustworthy floor window.","timestamp":1776482871621,"segment":25,"confidence":3.2391252148431176,"iterationTokens":4108,"asi":{"hypothesis":"Current rebound remains shelf-level and should not be used for DDTree promotion decisions.","rollback_reason":"No code changes; monitoring-only sample.","next_action_hint":"Continue passive control monitoring; trigger DDTree parity only after repeated near-floor eval contraction.","diagnostic_findings":{"completion_tok_s":88.8424451891175,"dflash_eval_s":10.814269085531123,"safe_mode_active":0,"verify_eval_wait_fused_steps":96,"verify_eval_wait_unfused_steps":0}}}
{"run":2508,"commit":"26f9501","metric":89.84723108214908,"metrics":{},"status":"discard","description":"Control nudged higher within fused-only shelf (~89.8 tok/s, safe_mode=0), but eval remains above floor (~10.69), so still a non-floor monitoring regime.","timestamp":1776482918998,"segment":25,"confidence":3.2239283673758687,"iterationTokens":4805,"asi":{"hypothesis":"Shelf rebound can approach low-90s without restoring true near-floor eval timing.","rollback_reason":"No code changes; monitoring-only sample.","next_action_hint":"Keep passive control loop and hold DDTree experiments until floor-like eval (~8.8–9.0) is sustained across multiple runs.","diagnostic_findings":{"completion_tok_s":89.84723108214908,"dflash_eval_s":10.685609541716985,"safe_mode_active":0,"verify_eval_wait_fused_steps":96,"verify_eval_wait_unfused_steps":0}}}
{"run":2509,"commit":"26f9501","metric":91.43788972493836,"metrics":{},"status":"discard","description":"Control moved into low-90 fused-only shelf (~91.4 tok/s, safe_mode=0), but eval remains above floor (~10.48), so DDTree attribution gate still closed.","timestamp":1776482946455,"segment":25,"confidence":3.244666188937447,"iterationTokens":4120,"asi":{"hypothesis":"This regime can improve steadily without reaching true floor timing, so promotion decisions must remain gated.","rollback_reason":"No code changes; monitoring-only control run.","next_action_hint":"Continue passive monitoring until repeated eval near ~8.8–9.0 appears before any DDTree variant testing.","diagnostic_findings":{"completion_tok_s":91.43788972493836,"dflash_eval_s":10.48437199392356,"safe_mode_active":0,"verify_eval_wait_fused_steps":96,"verify_eval_wait_unfused_steps":0}}}
{"run":2510,"commit":"26f9501","metric":90.8489409899008,"metrics":{},"status":"discard","description":"Control remained in low-90 fused-only shelf (~90.8 tok/s, safe_mode=0) with eval still elevated (~10.55), indicating continued non-floor inflation.","timestamp":1776482975468,"segment":25,"confidence":3.265672528551242,"iterationTokens":4116,"asi":{"hypothesis":"Even as throughput rises, elevated eval suggests this is still shelf behavior and not yet reliable floor re-entry.","rollback_reason":"No code changes; monitoring-only sample.","next_action_hint":"Continue passive monitoring and keep DDTree A/B paused until repeated near-floor eval values are observed.","diagnostic_findings":{"completion_tok_s":90.8489409899008,"dflash_eval_s":10.553965709521435,"safe_mode_active":0,"verify_eval_wait_fused_steps":96,"verify_eval_wait_unfused_steps":0}}}
{"run":2511,"commit":"26f9501","metric":86.84213215653037,"metrics":{},"status":"discard","description":"Control slipped back within the fused-only shelf (~86.8 tok/s, safe_mode=0) and stayed off-floor (`dflash_eval_s` ~11.04).","timestamp":1776483007085,"segment":25,"confidence":3.266780829746092,"iterationTokens":4166,"asi":{"hypothesis":"Current regime remains oscillatory within an elevated fused-only band rather than converging to floor.","rollback_reason":"No code changes; monitoring-only sample.","next_action_hint":"Continue passive monitoring; keep DDTree probes paused until repeated floor-like eval readings are observed.","diagnostic_findings":{"completion_tok_s":86.84213215653037,"dflash_eval_s":11.040579751250334,"safe_mode_active":0,"verify_eval_wait_fused_steps":96,"verify_eval_wait_unfused_steps":0}}}
{"run":2512,"commit":"26f9501","metric":93.58647891665667,"metrics":{},"status":"discard","description":"Control advanced to a stronger fused-only shelf (~93.6 tok/s, safe_mode=0) with eval contracting (~10.20) but still above near-floor gate.","timestamp":1776483073150,"segment":25,"confidence":3.267889883464987,"iterationTokens":7262,"asi":{"hypothesis":"This rebound is tightening and may approach floor, but current timing still indicates shelf mode.","rollback_reason":"No code changes; monitoring-only sample.","next_action_hint":"Take immediate follow-up controls; only resume DDTree parity once eval repeatedly reaches ~8.8–9.0.","diagnostic_findings":{"completion_tok_s":93.58647891665667,"dflash_eval_s":10.199198829010129,"safe_mode_active":0,"verify_eval_wait_fused_steps":96,"verify_eval_wait_unfused_steps":0}}}
{"run":2513,"commit":"26f9501","metric":96.97990197320667,"metrics":{},"status":"discard","description":"Control reached a higher fused-only shelf sample (~97.0 tok/s, safe_mode=0) with eval ~9.85; improved but still above strict near-floor gate.","timestamp":1776483101762,"segment":25,"confidence":3.2801740431291018,"iterationTokens":4116,"asi":{"hypothesis":"Recovery is continuing toward floor, but this may still be an elevated shelf rather than stable floor re-entry.","rollback_reason":"No code changes; monitoring-only control run.","next_action_hint":"Take immediate confirmation control samples; resume DDTree parity only if eval repeatedly contracts near ~8.8–9.0.","diagnostic_findings":{"completion_tok_s":96.97990197320667,"dflash_eval_s":9.846722288639285,"safe_mode_active":0,"verify_eval_wait_fused_steps":96,"verify_eval_wait_unfused_steps":0}}}
{"run":2514,"commit":"26f9501","metric":98.05146492828955,"metrics":{},"status":"discard","description":"Control reached upper rebound shelf (~98.1 tok/s, fused-only/safe_mode=0) with eval ~9.74; closer to floor but still above strict ~8.8–9.0 gate.","timestamp":1776483134766,"segment":25,"confidence":3.2925509047918333,"iterationTokens":4146,"asi":{"hypothesis":"The shelf is tightening toward floor and may soon permit valid DDTree parity checks if contraction continues.","rollback_reason":"No code changes; monitoring-only sample.","next_action_hint":"Collect immediate confirmation controls; resume DDTree only after repeated near-floor eval readings.","diagnostic_findings":{"completion_tok_s":98.05146492828955,"dflash_eval_s":9.743415203993209,"safe_mode_active":0,"verify_eval_wait_fused_steps":96,"verify_eval_wait_unfused_steps":0}}}
{"run":2515,"commit":"26f9501","metric":93.10787342141015,"metrics":{},"status":"discard","description":"Follow-up control dropped from ~98 to ~93 tok/s while remaining fused-only/safe_mode=0; eval rebounded to ~10.24, indicating shelf variability rather than stable floor return.","timestamp":1776483168590,"segment":25,"confidence":3.3081522907582945,"iterationTokens":4144,"asi":{"hypothesis":"Near-floor-looking spikes can revert quickly, so repeated confirmations are required before reopening DDTree parity tests.","rollback_reason":"No code changes; monitoring-only sample.","next_action_hint":"Keep passive monitoring and require multiple consecutive ~8.8–9.0 eval samples before DDTree A/B.","diagnostic_findings":{"completion_tok_s":93.10787342141015,"dflash_eval_s":10.240482583176345,"safe_mode_active":0,"verify_eval_wait_fused_steps":96,"verify_eval_wait_unfused_steps":0}}}
{"run":2516,"commit":"26f9501","metric":95.7870563991429,"metrics":{},"status":"discard","description":"Control remained in high fused-only shelf (~95.8 tok/s) but eval held around ~9.97, still above strict near-floor criterion.","timestamp":1776483197469,"segment":25,"confidence":3.3304748059392435,"iterationTokens":4168,"asi":{"hypothesis":"Despite improved throughput, this is still shelf behavior unless eval repeatedly reaches ~8.8–9.0.","rollback_reason":"No code changes; monitoring-only sample.","next_action_hint":"Continue control monitoring; do not resume DDTree parity until stable near-floor eval is observed across consecutive runs.","diagnostic_findings":{"completion_tok_s":95.7870563991429,"dflash_eval_s":9.97405245655682,"safe_mode_active":0,"verify_eval_wait_fused_steps":96,"verify_eval_wait_unfused_steps":0}}}
