{"run":2566,"commit":"26f9501","metric":107.00611757070095,"metrics":{},"status":"discard","description":"Control stayed in near-floor fused-only mode (~107.0 tok/s, eval ~8.84, safe_mode=0); floor behavior is back but needs extended streak confirmation.","timestamp":1776490524754,"segment":25,"confidence":3.4849518841025175,"iterationTokens":7426,"asi":{"hypothesis":"Floor conditions may be re-forming after rebound shelves and collapse spikes.","rollback_reason":"No code changes; monitoring-only control sample.","next_action_hint":"Continue passive controls and require a longer uninterrupted near-floor streak before DDTree re-entry.","diagnostic_findings":{"completion_tok_s":107.00611757070095,"dflash_eval_s":8.84387433307711,"safe_mode_active":0,"verify_eval_wait_fused_steps":96,"verify_eval_wait_unfused_steps":0}}}
{"run":2567,"commit":"26f9501","metric":106.49477236731637,"metrics":{},"status":"discard","description":"Control remained near-floor and fused-only (106.5 tok/s, eval ~8.89, safe_mode=0), extending the recovery streak.","timestamp":1776490553913,"segment":25,"confidence":3.4880902788992123,"iterationTokens":4140,"asi":{"hypothesis":"Near-floor control may now be sustained long enough to reopen DDTree attribution soon.","rollback_reason":"No code changes; monitoring-only control sample.","next_action_hint":"Continue collecting uninterrupted near-floor controls; only then reopen DDTree triplets.","diagnostic_findings":{"completion_tok_s":106.49477236731637,"dflash_eval_s":8.885147537919693,"safe_mode_active":0,"verify_eval_wait_fused_steps":96,"verify_eval_wait_unfused_steps":0}}}
{"run":2568,"commit":"26f9501","metric":40.3762121910154,"metrics":{},"status":"discard","description":"Control abruptly collapsed again (~40.4 tok/s): safe mode activated at step 22 with heavy unfused verify (83/105) and eval surged to ~20.15s.","timestamp":1776490600579,"segment":25,"confidence":3.482946626030553,"iterationTokens":4140,"asi":{"hypothesis":"Near-floor streak might persist long enough for extended stability, but regime snapped back into collapse.","rollback_reason":"No code changes; collapse sample invalidates immediate DDTree re-entry.","next_action_hint":"Return to passive control monitoring and require a longer uninterrupted floor streak before DDTree attempts.","diagnostic_findings":{"completion_tok_s":40.3762121910154,"dflash_eval_s":20.14625908585731,"safe_mode_active":1,"safe_mode_step":22,"verify_eval_wait_fused_steps":22,"verify_eval_wait_unfused_steps":83,"collapse_spike_events":48,"collapse_severe_spike_events":48}}}
{"run":2569,"commit":"26f9501","metric":69.35676935746783,"metrics":{},"status":"discard","description":"Control rebounded to ~69.4 tok/s with safe_mode=0/fused-only, but eval remained highly elevated (~13.98), indicating rebound shelf not true floor recovery.","timestamp":1776490612235,"segment":25,"confidence":3.4748355886684013,"iterationTokens":4140,"asi":{"hypothesis":"After collapse, lane may rebound without re-entering true floor timing.","rollback_reason":"No code changes; monitoring-only sample remains outside stability gate.","next_action_hint":"Continue passive control monitoring and wait for sustained near-floor eval before DDTree re-entry.","diagnostic_findings":{"completion_tok_s":69.35676935746783,"dflash_eval_s":13.984078375040554,"safe_mode_active":0,"verify_eval_wait_fused_steps":96,"verify_eval_wait_unfused_steps":0}}}
{"run":2570,"commit":"26f9501","metric":22.078747397792853,"metrics":{},"status":"discard","description":"Control collapsed severely again (~22.1 tok/s): safe mode step 8 with dominant unfused waits (96/104), massive spikes, and eval ~36.34s.","timestamp":1776490679713,"segment":25,"confidence":3.4686485160804095,"iterationTokens":4926,"asi":{"hypothesis":"Monitoring run would confirm whether rebound could continue; instead it entered a deep collapse state.","rollback_reason":"No code changes; collapse sample invalid for attribution and indicates renewed instability wave.","next_action_hint":"Stay in passive control monitoring mode and avoid DDTree tests until a long uninterrupted floor streak returns.","diagnostic_findings":{"completion_tok_s":22.078747397792853,"dflash_eval_s":36.33522762230132,"safe_mode_active":1,"safe_mode_step":8,"verify_eval_wait_fused_steps":8,"verify_eval_wait_unfused_steps":96,"collapse_spike_events":96,"collapse_severe_spike_events":96}}}
{"run":2571,"commit":"26f9501","metric":43.57271737410541,"metrics":{},"status":"discard","description":"Control improved from deep collapse to ~43.6 tok/s but remained unstable: safe mode step 6, mostly unfused waits (100/106), eval still ~18.53s.","timestamp":1776490691161,"segment":25,"confidence":3.4327372410216617,"iterationTokens":4926,"asi":{"hypothesis":"Follow-up monitoring should show whether deep collapse is easing; it improved but stayed far from stable floor.","rollback_reason":"No code changes; still unstable collapse/recovery regime.","next_action_hint":"Continue passive controls only and wait for sustained fused-only near-floor behavior before DDTree re-entry.","diagnostic_findings":{"completion_tok_s":43.57271737410541,"dflash_eval_s":18.534489339217544,"safe_mode_active":1,"safe_mode_step":6,"verify_eval_wait_fused_steps":6,"verify_eval_wait_unfused_steps":100,"collapse_spike_events":17,"collapse_severe_spike_events":17}}}
{"run":2572,"commit":"26f9501","metric":51.16353904834718,"metrics":{},"status":"discard","description":"Control remains unstable (~51.2 tok/s): safe mode step 7, mostly unfused waits (99/106), and elevated eval (~15.80s).","timestamp":1776490740085,"segment":25,"confidence":3.416539263101243,"iterationTokens":5400,"asi":{"hypothesis":"Post-collapse samples may recover gradually, but this run stayed in collapse/recovery regime.","rollback_reason":"No code changes; still outside stable floor gate.","next_action_hint":"Continue passive monitoring and hold DDTree attempts until an extended fused-only near-floor streak returns.","diagnostic_findings":{"completion_tok_s":51.16353904834718,"dflash_eval_s":15.803643626044504,"safe_mode_active":1,"safe_mode_step":7,"verify_eval_wait_fused_steps":7,"verify_eval_wait_unfused_steps":99,"collapse_spike_events":6,"collapse_severe_spike_events":6}}}
{"run":2573,"commit":"26f9501","metric":75.14952848418133,"metrics":{},"status":"discard","description":"Control entered a fused-only rebound shelf (~75.1 tok/s, safe_mode=0) but with high eval (~12.86), not true near-floor recovery.","timestamp":1776490751595,"segment":25,"confidence":3.4436761072152744,"iterationTokens":5400,"asi":{"hypothesis":"Regime might rebound from collapse into safe_mode=0 without yet recovering floor timing.","rollback_reason":"No code changes; monitoring-only sample still above floor eval band.","next_action_hint":"Continue passive controls and require repeated ~8.8–9.0 eval before DDTree re-entry.","diagnostic_findings":{"completion_tok_s":75.14952848418133,"dflash_eval_s":12.85642871062737,"safe_mode_active":0,"verify_eval_wait_fused_steps":96,"verify_eval_wait_unfused_steps":0}}}
{"run":2574,"commit":"26f9501","metric":108.8734434733355,"metrics":{},"status":"discard","description":"Control hit strong near-floor sample (~108.9 tok/s, eval ~8.71) with fused-only verify and safe_mode=0.","timestamp":1776490782715,"segment":25,"confidence":3.416539263101243,"iterationTokens":4895,"asi":{"hypothesis":"Despite oscillation, lane can still re-enter true floor quickly; need uninterrupted streak rather than isolated peaks.","rollback_reason":"No code changes; single monitoring sample only.","next_action_hint":"Continue passive controls and require a longer stable run sequence before reopening DDTree attribution.","diagnostic_findings":{"completion_tok_s":108.8734434733355,"dflash_eval_s":8.711104959133081,"safe_mode_active":0,"verify_eval_wait_fused_steps":96,"verify_eval_wait_unfused_steps":0}}}
{"run":2575,"commit":"26f9501","metric":108.6776883318383,"metrics":{},"status":"discard","description":"Control delivered another near-floor fused-only sample (~108.7 tok/s, eval ~8.73, safe_mode=0), reinforcing that floor remains reachable but intermittent.","timestamp":1776490811634,"segment":25,"confidence":3.4289654254914623,"iterationTokens":4285,"asi":{"hypothesis":"Near-floor pocket may be reappearing in bursts despite collapse oscillation.","rollback_reason":"No code changes; still monitoring for sustained streak before DDTree re-entry.","next_action_hint":"Keep passive controls until uninterrupted near-floor streak is long enough to safely reopen DDTree triplets.","diagnostic_findings":{"completion_tok_s":108.6776883318383,"dflash_eval_s":8.733871045871638,"safe_mode_active":0,"verify_eval_wait_fused_steps":96,"verify_eval_wait_unfused_steps":0}}}
{"run":2576,"commit":"26f9501","metric":108.72429278732496,"metrics":{},"status":"discard","description":"Control produced another near-floor fused-only sample (~108.7 tok/s, eval ~8.73, safe_mode=0), extending current healthy mini-streak.","timestamp":1776490854610,"segment":25,"confidence":3.444123106093265,"iterationTokens":4627,"asi":{"hypothesis":"Recent floor-quality samples may indicate a longer stable window is forming again.","rollback_reason":"No code changes; monitoring-only control sample.","next_action_hint":"Run at least one more control confirmation before considering DDTree baseline re-entry.","diagnostic_findings":{"completion_tok_s":108.72429278732496,"dflash_eval_s":8.730108837829903,"safe_mode_active":0,"verify_eval_wait_fused_steps":96,"verify_eval_wait_unfused_steps":0}}}
{"run":2577,"commit":"26f9501","metric":108.66515277911454,"metrics":{},"status":"discard","description":"Control delivered third straight near-floor fused-only sample (~108.7 tok/s, eval ~8.73, safe_mode=0), meeting the strict timing gate again.","timestamp":1776490886859,"segment":25,"confidence":3.4312923144797165,"iterationTokens":4137,"asi":{"hypothesis":"An uninterrupted near-floor streak may finally be stable enough for another cautious DDTree attribution cycle.","rollback_reason":"No code changes; control confirmation sample only.","next_action_hint":"Run DDTree baseline with guarded path next, then immediate no-DDTree parity to verify whether stability holds.","diagnostic_findings":{"completion_tok_s":108.66515277911454,"dflash_eval_s":8.73483075585682,"safe_mode_active":0,"verify_eval_wait_fused_steps":96,"verify_eval_wait_unfused_steps":0}}}
{"run":2578,"commit":"26f9501","metric":103.37279702586316,"metrics":{},"status":"discard","description":"DDTree baseline in recovered floor window returned to expected band (~103.4 tok/s, eval ~9.90, tree_build ~1.93s) but still trails control by ~5.3 tok/s.","timestamp":1776490917791,"segment":25,"confidence":3.411012005066727,"iterationTokens":4151,"asi":{"hypothesis":"With floor gate restored, DDTree baseline should be reproducible near prior ~103 tok/s healthy-window behavior.","rollback_reason":"No code changes; baseline attribution run only and still below control.","next_action_hint":"Run immediate no-DDTree parity control to confirm gap remains DDTree-specific in this window.","diagnostic_findings":{"completion_tok_s":103.37279702586316,"dflash_eval_s":9.899897958,"dflash_ddtree_tree_build_s":1.929140454,"dflash_ddtree_tree_verify_s":0.128711955,"dflash_ddtree_cycles_completed":98}}}
{"run":2579,"commit":"26f9501","metric":108.51711617621197,"metrics":{},"status":"discard","description":"Immediate no-DDTree parity after DDTree baseline stayed near floor (~108.5 tok/s, eval ~8.74), confirming DDTree gap (~5.1 tok/s) is DDTree-specific in this window.","timestamp":1776490954308,"segment":25,"confidence":3.4142985775501478,"iterationTokens":1648,"asi":{"hypothesis":"If window is stable, control parity should remain near floor and isolate DDTree overhead.","rollback_reason":"No code changes; parity attribution sample only.","next_action_hint":"Proceed with one DDTree code-level candidate plus immediate control parity while floor streak holds.","diagnostic_findings":{"completion_tok_s":108.51711617621197,"dflash_eval_s":8.740862624137662,"safe_mode_active":0,"verify_eval_wait_fused_steps":96,"verify_eval_wait_unfused_steps":0,"ddtree_gap_tok_s_vs_prior_baseline":-5.14431915034881}}}
{"run":2580,"commit":"26f9501","metric":108.66515277911454,"metrics":{},"status":"discard","description":"Additional control confirmation remained near-floor (~108.7 tok/s, eval ~8.73, fused-only, safe_mode=0), keeping the window stable for cautious DDTree candidate testing.","timestamp":1776490960877,"segment":25,"confidence":3.4175914894872026,"iterationTokens":1648,"asi":{"hypothesis":"Near-floor control window can stay stable across consecutive parity checks.","rollback_reason":"No code changes; control confirmation sample.","next_action_hint":"Try one narrowly scoped DDTree code-level tree-build candidate, then immediate no-DDTree parity.","diagnostic_findings":{"completion_tok_s":108.66515277911454,"dflash_eval_s":8.73483075585682,"safe_mode_active":0,"verify_eval_wait_fused_steps":96,"verify_eval_wait_unfused_steps":0}}}
{"run":2581,"commit":"26f9501","metric":103.25092919267595,"metrics":{},"status":"discard","description":"DDTree candidate (skip redundant float32 cast when logits already float32) regressed slightly (~103.25 vs ~103.37 baseline); tiny tree_build drop not enough.","timestamp":1776491008613,"segment":25,"confidence":3.452619028923704,"iterationTokens":5753,"asi":{"hypothesis":"Avoiding an unnecessary per-cycle float32 cast in tree-build path could trim DDTree overhead.","rollback_reason":"Primary metric regressed and gain is noise-level despite minor tree_build reduction.","next_action_hint":"Discard this micro-trim and continue searching for higher-leverage tree-build optimizations.","diagnostic_findings":{"completion_tok_s":103.25092919267595,"dflash_eval_s":9.911815834,"dflash_ddtree_tree_build_s":1.925859045,"delta_vs_ddtree_baseline_tok_s":-0.12186783318721099,"delta_tree_build_s":-0.0032814089999999405}}}
