{"run":208,"commit":"e5e9041","metric":42.42563228684819,"metrics":{},"status":"discard","description":"Test whether the corrected external-draft keep still wants split full-attention SDPA by disabling it (`DFLASH_BSTNXBT_SPLIT_SDPA=0`) while keeping the aligned official-Qwen server workload otherwise unchanged. This dropped the honest server path to 42.43 tok/s versus the kept ~72–73 tok/s band, so discard; split SDPA remains essential in the current high-throughput external-draft path.","timestamp":1776115910817,"segment":13,"confidence":4.359236820133827,"iterationTokens":1252}
{"run":209,"commit":"e5e9041","metric":13.825935420179096,"metrics":{},"status":"discard","description":"Test the strongest remaining target-side parity idea by giving the oMLX DFlash runtime a separately loaded external bstnxbt target bundle (`DFLASH_BSTNXBT_EXTERNAL_TARGET=1`) while keeping the corrected external draft integration and aligned official-Qwen server workload unchanged. This was catastrophically bad on the honest server path at 13.83 tok/s, so discard; the remaining gap is not solved by swapping in the full external target loader.","timestamp":1776117644038,"segment":13,"confidence":3.315624754567262,"iterationTokens":24796}
{"run":210,"commit":"e5e9041","metric":51.95803317266982,"metrics":{},"status":"discard","description":"Re-run the current best corrected external-draft configuration unchanged to tighten the noise band before further code changes. Instead of reproducing the earlier 73.07 / 72.11 tok/s results, clean confirmation reruns came in at 38.06 and then 51.96 tok/s, both far below the original keep band. Discard this rerun pair as unstable/non-reproducible; the external-draft path is still promising, but its variance now needs explanation before treating 72–73 tok/s as steady-state.","timestamp":1776117784408,"segment":13,"confidence":3.74360295268172,"iterationTokens":1942}
{"type":"config","name":"Aligned official-Qwen DFlash server benchmark with warmed DFlash path","metricName":"completion_tok_s","metricUnit":"","bestDirection":"higher"}
{"run":211,"commit":"7bf4fa5","metric":72.98179522482702,"metrics":{},"status":"keep","description":"Make the benchmark warm the actual configured generation path instead of only stock one-token load warmup: parameterize `autoresearch.sh` with `WARMUP_DFLASH` and `WARMUP_MAX_TOKENS`, send fully greedy warmup params, and use a distinct warmup prompt so we warm DFlash compilation/runtime without warming the benchmark prefix. On the new warmed-DFlash-path benchmark segment, the corrected external-draft keep immediately reproduces the high band at 72.98 tok/s, showing the earlier 38/52 reruns were mostly cold-path benchmark noise rather than the steady-state ceiling.","timestamp":1776118005815,"segment":14,"confidence":null,"iterationTokens":464}
{"run":212,"commit":"7bf4fa5","metric":18.09712687345201,"metrics":{},"status":"discard","description":"Match the external benchmark more closely by loading the env-gated external draft bundle with `lazy=True` instead of `lazy=False` in `omlx/dflash/drafter.py`, while keeping the warmed-DFlash-path benchmark and the rest of the corrected external-draft keep unchanged. This collapsed the honest server path to 18.10 tok/s, so discard; eager external draft loading is currently essential in oMLX.","timestamp":1776118148986,"segment":14,"confidence":null,"iterationTokens":1381}
{"run":213,"commit":"7c0df8a","metric":84.0736680737933,"metrics":{},"status":"keep","description":"Port the external runtime’s `block_tokens` control into the live in-tree bstnxbt path via `DFLASH_BLOCK_TOKENS`, then test the strongest external direct hint on the warmed-DFlash-path benchmark: reduce effective speculative block size from the draft default 16 to 12 while keeping the exact external draft integration and all other warmed-path keep settings unchanged. This produced 83.53 tok/s and then 84.07 tok/s on immediate confirmation, lifting the honest oMLX server path above the aligned external ceiling.","timestamp":1776119033269,"segment":14,"confidence":1,"iterationTokens":319}
{"run":214,"commit":"7c0df8a","metric":33.709735485901696,"metrics":{},"status":"discard","description":"Test the nearest plausible follow-up to the new `DFLASH_BLOCK_TOKENS=12` keep by lowering the external-runtime-inspired block override to 10 on the warmed-DFlash-path benchmark. Despite looking competitive in a direct external scout, the honest oMLX server path collapsed to 33.71 tok/s, so discard; the warmed server optimum is not following the direct sweep monotonically and 12 remains the current best.","timestamp":1776119296108,"segment":14,"confidence":0.44046889426712327,"iterationTokens":2728}
{"type":"config","name":"Aligned official-Qwen DFlash server benchmark with block-matched DFlash warmup","metricName":"completion_tok_s","metricUnit":"","bestDirection":"higher"}
{"run":215,"commit":"480f3cd","metric":84.51616821651925,"metrics":{},"status":"keep","description":"Make the DFlash warmup benchmark contract follow the configured speculative block size by default: when `WARMUP_DFLASH=1` and no explicit warmup token count is set, `autoresearch.sh` now uses `DFLASH_BLOCK_TOKENS` (or 16 if unset) instead of a fixed token count. This avoids measuring cold block-size-specific DFlash compilation for tuned block schedules. On the fresh block-matched warmed-path segment, the current best external-draft + `DFLASH_BLOCK_TOKENS=12` configuration establishes an honest baseline at 84.52 tok/s.","timestamp":1776119545106,"segment":15,"confidence":null,"iterationTokens":506}
{"type":"config","name":"OmniCoder main-workload transfer of warmed external-draft DFlash path","metricName":"completion_tok_s","metricUnit":"","bestDirection":"higher"}
{"run":216,"commit":"5f086e9","metric":27.0895756216278,"metrics":{},"status":"keep","description":"Start the Omni transfer segment by applying the current best warmed-DFlash-path learnings to the real OmniCoder 256-token main workload: warmed DFlash path enabled, exact external draft integration, split SDPA on, recurrent kernels on, and `DFLASH_BLOCK_TOKENS=12`. This establishes the first honest Omni transfer baseline at 27.09 tok/s.","timestamp":1776120055011,"segment":16,"confidence":null,"iterationTokens":347}
{"run":217,"commit":"5f086e9","metric":17.186574051624213,"metrics":{},"status":"discard","description":"Test the strongest Omni transfer candidate suggested by a quick direct scout: lower `DFLASH_BLOCK_TOKENS` from 12 to 8 while keeping the warmed external-draft path otherwise unchanged on the real OmniCoder 256-token workload. The honest server path regressed hard to 17.19 tok/s versus the 27.09 transfer baseline, so discard; direct in-process block sweeps are not predictive on Omni either.","timestamp":1776120258379,"segment":16,"confidence":null,"iterationTokens":2278}
{"type":"config","name":"Aligned official-Qwen DFlash server benchmark with thinking enabled","metricName":"completion_tok_s","metricUnit":"","bestDirection":"higher"}
{"run":218,"commit":"9d4dbd0","metric":30.686099263326327,"metrics":{},"status":"keep","description":"Re-target autoresearch to the honest warmed Qwen3.5 DFlash server benchmark with thinking enabled by wiring thinking controls through the harness and benchmarking the current bstnxbt external-draft path on a reasoning prompt.","timestamp":1776130189945,"segment":17,"confidence":null,"iterationTokens":107,"asi":{"hypothesis":"The first step toward 60-80 tok/s with thinking tokens is to benchmark the actual thinking-enabled DFlash server path honestly, using warmed DFlash requests and the same Qwen serving stack.","learning":"Current thinking-enabled warmed Qwen DFlash throughput is about 30.69 tok/s on a 1024-token reasoning workload. The main remaining gap is now in thinking-mode runtime/integration behavior rather than no-thinking benchmark plumbing.","next_action_hint":"Compare thinking-enabled request routing and prompt/rendered-shape behavior against the fast no-thinking path, then remove any avoidable thinking-mode fallback or shape penalties without cheating semantics."}}
{"type":"config","name":"Aligned official-Qwen DFlash server benchmark with thinking enabled (math prompt)","metricName":"completion_tok_s","metricUnit":"","bestDirection":"higher"}
{"run":219,"commit":"cbd77c6","metric":31.240246559162713,"metrics":{},"status":"keep","description":"Correct the thinking-enabled Qwen benchmark workload to use the intended math reasoning prompt from workload.env and re-anchor the warmed DFlash server baseline on that real thinking workload.","timestamp":1776130300889,"segment":18,"confidence":null,"iterationTokens":110,"asi":{"hypothesis":"The thinking benchmark should be anchored on the intended reasoning prompt, not the fallback explanatory prompt, before tuning for 60-80 tok/s.","learning":"On the corrected math reasoning workload, the current warmed Qwen thinking-enabled DFlash server path runs at about 31.24 tok/s for 1024 tokens.","next_action_hint":"Attack the biggest likely lever next: tune DFlash block sizing and thinking-budget/request-shape behavior specifically for the thinking-enabled workload."}}
{"run":220,"commit":"daeee90","metric":34.95313851665878,"metrics":{},"status":"keep","description":"Retune the bstnxbt speculative block size for the thinking-enabled Qwen math workload by lowering DFLASH_BLOCK_TOKENS from 12 to 8.","timestamp":1776130378454,"segment":18,"confidence":null,"iterationTokens":3332,"asi":{"hypothesis":"Thinking-enabled decoding likely has lower acceptance than the no-thinking path, so a smaller speculative block may reduce wasted draft/verify work and improve honest server throughput.","learning":"On the thinking-enabled warmed Qwen math workload, DFLASH_BLOCK_TOKENS=8 improved throughput from about 31.24 tok/s to 34.95 tok/s.","next_action_hint":"Continue the thinking-specific block-size sweep around 8 and then test other thinking-shape knobs such as thinking_budget once the block-size neighborhood is mapped."}}
{"run":221,"commit":"daeee90","metric":30.434267499142404,"metrics":{},"status":"discard","description":"Probe a smaller speculative block on the thinking-enabled Qwen math workload by lowering DFLASH_BLOCK_TOKENS from 8 to 6.","timestamp":1776130439704,"segment":18,"confidence":4.606685386345534,"iterationTokens":843,"asi":{"hypothesis":"If the thinking-enabled path still has low acceptance, shrinking the speculative block further from 8 to 6 might reduce wasted work and improve throughput.","rollback_reason":"DFLASH_BLOCK_TOKENS=6 regressed the honest thinking-enabled server benchmark from 34.95 tok/s to 30.43 tok/s.","next_action_hint":"Keep the new 8-token block baseline and continue sweeping nearby values upward instead of shrinking further.","learning":"The thinking-enabled path benefits from a smaller block than the no-thinking path, but 6 is too small and loses throughput."}}
{"run":222,"commit":"b0707e6","metric":53.40207622121796,"metrics":{},"status":"keep","description":"Continue the thinking-specific speculative block retune by increasing DFLASH_BLOCK_TOKENS from 8 to 10 on the warmed Qwen math workload.","timestamp":1776130504487,"segment":18,"confidence":9.80856925375827,"iterationTokens":1279,"asi":{"hypothesis":"The thinking-enabled workload may prefer a slightly larger speculative block than 8 once the block is reduced below the no-thinking default, improving acceptance enough to outweigh extra draft work.","learning":"On the thinking-enabled warmed Qwen math workload, DFLASH_BLOCK_TOKENS=10 jumped throughput from 34.95 tok/s to 53.40 tok/s.","next_action_hint":"Confirm the 10-token block with a rerun, then sweep the immediate neighborhood (9, 11, 12) to see whether the 60-80 tok/s target is reachable on honest server benchmarks."}}
{"run":223,"commit":"e7a10f8","metric":63.954490716040745,"metrics":{},"status":"keep","description":"Confirm the thinking-specific DFLASH_BLOCK_TOKENS=10 retune on the warmed Qwen math workload; the rerun climbed further into the 60+ tok/s band.","timestamp":1776130549026,"segment":18,"confidence":7.239472874987731,"iterationTokens":1213,"asi":{"hypothesis":"If the 10-token speculative block is a real fit for thinking-enabled Qwen, a confirmation run should stay high and potentially climb further once compile/warm shape effects settle.","learning":"The thinking-enabled warmed Qwen DFlash server path reached 63.95 tok/s on confirmation with DFLASH_BLOCK_TOKENS=10, crossing the target band.","next_action_hint":"Keep pressure on robustness by probing the immediate neighborhood (9 and 11) and then broadening the out-of-box fast path to default to the thinking-capable tuned settings where safe."}}
{"run":224,"commit":"dffe295","metric":68.18870027498261,"metrics":{},"status":"keep","description":"Continue the thinking-specific block-size sweep by increasing DFLASH_BLOCK_TOKENS from 10 to 11 on the warmed Qwen math workload.","timestamp":1776130599006,"segment":18,"confidence":2.769676415890374,"iterationTokens":1144,"asi":{"hypothesis":"The thinking-enabled workload may still benefit from a slightly larger speculative block than 10 if acceptance remains strong enough to amortize the extra verify work.","learning":"On the thinking-enabled warmed Qwen math workload, DFLASH_BLOCK_TOKENS=11 improved throughput further to 68.19 tok/s.","next_action_hint":"Probe the immediate neighborhood at 12 and then productize the tuned thinking-capable defaults into the fast launcher and benchmark-facing path."}}
{"run":225,"commit":"dffe295","metric":64.73451711274906,"metrics":{},"status":"discard","description":"Probe the next larger speculative block on the thinking-enabled Qwen math workload by increasing DFLASH_BLOCK_TOKENS from 11 to 12.","timestamp":1776130642483,"segment":18,"confidence":2.4987754866475345,"iterationTokens":787,"asi":{"hypothesis":"If the thinking-enabled path still benefits from more drafted tokens per cycle, DFLASH_BLOCK_TOKENS=12 might improve on the new 11-token baseline.","rollback_reason":"DFLASH_BLOCK_TOKENS=12 regressed the honest thinking-enabled server benchmark from 68.19 tok/s to 64.73 tok/s.","next_action_hint":"Keep 11 as the current thinking-specific block-size baseline and use it as the productized default for the thinking-capable fast path.","learning":"The thinking-enabled tuned block-size optimum is narrower and lower than the no-thinking path; 12 gives back part of the gain achieved at 11."}}
{"run":226,"commit":"ea303a4","metric":72.75886314756582,"metrics":{},"status":"keep","description":"Sweep the lower neighbor of the new thinking-specific block-size baseline by reducing DFLASH_BLOCK_TOKENS from 11 to 9, while also productizing thinking-aware defaults in the fast Qwen launcher.","timestamp":1776130793837,"segment":18,"confidence":3.5198696769161266,"iterationTokens":5358,"asi":{"hypothesis":"The thinking-enabled workload may sit on a narrow optimum below 11, and the fast launcher should automatically choose a thinking-capable block size when thinking is enabled.","learning":"On the honest warmed Qwen math workload with thinking enabled, DFLASH_BLOCK_TOKENS=9 reached 72.76 tok/s. The fast launcher now also supports thinking-aware warmup and block-size defaults.","next_action_hint":"Confirm the 9-token block, then keep broadening the out-of-box path so thinking-capable DFlash is easier to invoke outside autoresearch."}}
{"run":227,"commit":"ea303a4","metric":69.90419476087517,"metrics":{},"status":"discard","description":"Test a bounded thinking budget of 256 on top of the tuned thinking-enabled Qwen DFlash path.","timestamp":1776130844569,"segment":18,"confidence":4.715681544744847,"iterationTokens":1468,"asi":{"hypothesis":"A bounded thinking budget might regularize the thinking-enabled decode shape enough to improve speculative acceptance on top of the tuned 9-token block.","rollback_reason":"Adding THINKING_BUDGET=256 regressed the honest thinking-enabled server benchmark from 72.76 tok/s to 69.90 tok/s.","next_action_hint":"Keep unlimited thinking on the tuned path and continue broadening out-of-box support around the 9-token block baseline.","learning":"The tuned thinking-enabled DFlash path is already strong without an explicit thinking budget; constraining it to 256 tokens gives back some throughput."}}
{"run":228,"commit":"4ab4c5e","metric":76.23005716737715,"metrics":{},"status":"keep","description":"Promote the tuned thinking-capable speculative block into the default thinking path by defaulting DFLASH_BLOCK_TOKENS to 9 when thinking is enabled in the autoresearch harness and fast Qwen launcher, then benchmark without an explicit workload override.","timestamp":1776130939185,"segment":18,"confidence":4.648479190208547,"iterationTokens":2983,"asi":{"hypothesis":"The tuned 9-token speculative block should be the default for thinking-enabled Qwen requests so the fast path works out of the box without per-workload manual overrides.","learning":"With the thinking-aware default promoted into the harness and fast launcher, the honest warmed Qwen thinking benchmark reached 76.23 tok/s without an explicit block-token override in workload.env.","next_action_hint":"Keep broadening the default thinking-capable path across launchers and user-facing flows, then verify the tuned path remains visible and routable in normal oMLX usage."}}
{"run":229,"commit":"688e0a2","metric":72.99567483750928,"metrics":{},"status":"keep","description":"Remove the harness-only thinking block-size fallback and rely on the general runtime-level thinking-aware DFlash block-size default instead.","timestamp":1776131334073,"segment":18,"confidence":5.445945000344397,"iterationTokens":22652,"asi":{"hypothesis":"Once the general DFlash runtime knows when a request is thinking-enabled, the tuned 9-token block should work without any autoresearch-specific fallback logic.","learning":"The thinking-enabled warmed Qwen DFlash benchmark stayed in the 70+ tok/s band at 73.00 tok/s after removing the harness-only fallback, confirming the runtime-level default works.","next_action_hint":"Keep pushing the general-path rollout so normal oMLX requests pick up the tuned thinking DFlash behavior without benchmark- or launcher-specific glue."}}
{"run":230,"commit":"688e0a2","metric":72.49537014024058,"metrics":{},"status":"discard","description":"Retune split-attention chunking for the thinking-enabled Qwen path by setting DFLASH_BSTNXBT_SPLIT_CHUNK_SIZE=6.","timestamp":1776131383456,"segment":18,"confidence":7.0124988721003465,"iterationTokens":1472,"asi":{"hypothesis":"The thinking-tuned 9-token speculative block may benefit from a smaller split-SDPA chunk size than the no-thinking path.","rollback_reason":"Setting DFLASH_BSTNXBT_SPLIT_CHUNK_SIZE=6 was slightly slower than the current thinking-enabled baseline, landing at 72.50 tok/s versus 73.00 tok/s.","next_action_hint":"Keep the default split-SDPA chunking and continue targeting higher-leverage thinking-path defaults rather than this chunk-size retune.","learning":"The current default split-attention chunking is already a good fit for the tuned thinking-enabled DFlash path."}}
{"run":231,"commit":"688e0a2","metric":22.027243177127325,"metrics":{},"status":"discard","description":"Match the autoresearch warmup token count to the thinking-enabled runtime default block size instead of the old 16-token fallback.","timestamp":1776131495568,"segment":18,"confidence":5.445945000344397,"iterationTokens":2768,"asi":{"hypothesis":"The honest warmup should mirror the runtime’s thinking-aware 9-token block default; using a mismatched 16-token warmup may leave residual cold-shape cost in the measured request.","rollback_reason":"Changing the default DFlash warmup length for the thinking path collapsed the honest benchmark from the 70+ tok/s band to 22.03 tok/s.","next_action_hint":"Revert the warmup-token change; the prior distinct warmup shape is currently more representative for this thinking-enabled path than a naively block-matched 9-token warmup.","learning":"For the thinking-enabled DFlash path, simply matching warmup token count to the runtime block size is not sufficient and can badly under-warm the measured request."}}
{"run":232,"commit":"688e0a2","metric":38.812483244132856,"metrics":{},"status":"discard","description":"Change the default warmup prompt for thinking-enabled runs to a short reasoning prompt instead of the generic warmup text.","timestamp":1776131619480,"segment":18,"confidence":4.592296850544559,"iterationTokens":4327,"asi":{"hypothesis":"A reasoning-shaped warmup prompt might better compile the thinking-enabled DFlash path than the generic distinct warmup prompt and improve the measured request.","rollback_reason":"Switching the default thinking warmup prompt regressed the honest benchmark from the 70+ tok/s band down to 38.81 tok/s.","next_action_hint":"Keep the generic distinct warmup prompt; for this workload it warms the runtime path more effectively than a short reasoning prompt.","learning":"On the tuned thinking-enabled DFlash path, warmup prompt shape is highly sensitive and the generic distinct prompt currently performs much better than a short reasoning-style warmup."}}
