{"run":1511,"commit":"b304c02","metric":81.20071889391144,"metrics":{},"status":"discard","description":"Mirror plunged back to ~81.20 from ~98 upper edge, reaffirming wide oscillation amplitude.","timestamp":1776356868576,"segment":23,"confidence":3.2992245370639726,"iterationTokens":686,"asi":{"hypothesis":"Regime remains unstable with repeated swings between low-80s and high-90s.","rollback_reason":"Below keep.","next_action_hint":"Continue mirror tracking; parity check only if collapse deepens below ~75 again.","backend":"mirror_sd_mlx","context_only_draft_cache":1,"draft_sink":48,"async_draft_eval":1,"fused_draft_verify_eval":1,"warmup_s":2.18058087490499,"paired_prev_tok_s":98.29591457083681,"paired_delta_tok_s":-17.095195676925368,"delta_vs_keep":-27.661613600563506,"oscillatory_recovery":true}}
{"run":1512,"commit":"b304c02","metric":84.96951276392144,"metrics":{},"status":"discard","description":"Mirror recovered modestly to ~84.97 within the lower half of current oscillation band.","timestamp":1776356899357,"segment":23,"confidence":3.295094908052126,"iterationTokens":736,"asi":{"hypothesis":"Near-term regime may be re-centering in low/mid-80s before another jump.","rollback_reason":"Below keep.","next_action_hint":"Continue mirror sequence to observe next directional move.","backend":"mirror_sd_mlx","context_only_draft_cache":1,"draft_sink":48,"async_draft_eval":1,"fused_draft_verify_eval":1,"warmup_s":2.1911387090804055,"paired_prev_tok_s":81.20071889391144,"paired_delta_tok_s":3.768793870010005,"delta_vs_keep":-23.892819730553498,"oscillatory_recovery":true}}
{"run":1513,"commit":"b304c02","metric":84.06693070036006,"metrics":{},"status":"discard","description":"Mirror held around ~84.07, indicating temporary stabilization in mid-80s pocket.","timestamp":1776356932333,"segment":23,"confidence":3.2890491723218713,"iterationTokens":714,"asi":{"hypothesis":"Current local center may be hovering around ~84 before another volatility swing.","rollback_reason":"Below keep.","next_action_hint":"Continue mirror scans for breakout from this pocket.","backend":"mirror_sd_mlx","context_only_draft_cache":1,"draft_sink":48,"async_draft_eval":1,"fused_draft_verify_eval":1,"paired_prev_tok_s":84.96951276392144,"paired_delta_tok_s":-0.9025820635613875,"delta_vs_keep":-24.79540179411488,"mid80_pocket":true}}
{"run":1514,"commit":"b304c02","metric":82.51933296468492,"metrics":{},"status":"discard","description":"Mirror drifted down to ~82.52, still within lower oscillation envelope.","timestamp":1776356967277,"segment":23,"confidence":3.28302908805616,"iterationTokens":675,"asi":{"hypothesis":"Mid-80 stabilization is weak and can slide toward low-80s quickly.","rollback_reason":"Below keep.","next_action_hint":"Continue mirror tracking; parity check only if deeper sub-80 trough returns.","backend":"mirror_sd_mlx","context_only_draft_cache":1,"draft_sink":48,"async_draft_eval":1,"fused_draft_verify_eval":1,"warmup_s":2.0778894999530166,"paired_prev_tok_s":84.06693070036006,"paired_delta_tok_s":-1.5475977356751378,"delta_vs_keep":-26.34299952979002,"oscillatory_recovery":true}}
{"run":1515,"commit":"b304c02","metric":79.83359399575482,"metrics":{},"status":"discard","description":"Mirror slipped just below 80 to ~79.83, probing deeper low side again.","timestamp":1776357003172,"segment":23,"confidence":3.2783114072775104,"iterationTokens":721,"asi":{"hypothesis":"Low-side trough may be re-forming from the mid-80 pocket.","rollback_reason":"Below keep.","next_action_hint":"Run immediate mirror follow-up; parity-check if sub-80 persists.","backend":"mirror_sd_mlx","context_only_draft_cache":1,"draft_sink":48,"async_draft_eval":1,"fused_draft_verify_eval":1,"warmup_s":2.110312749980949,"paired_prev_tok_s":82.51933296468492,"paired_delta_tok_s":-2.685738968930096,"delta_vs_keep":-29.028738498720116,"sub80_probe":true}}
{"run":1516,"commit":"b304c02","metric":89.09316092967251,"metrics":{},"status":"discard","description":"Immediate mirror follow-up rebounded to ~89.09, clearing sub-80 probe.","timestamp":1776357032272,"segment":23,"confidence":3.2736072655658837,"iterationTokens":722,"asi":{"hypothesis":"Recent sub-80 dip was transient within the broader oscillatory band.","rollback_reason":"Below keep.","next_action_hint":"Continue mirror scans through this volatile mid-band.","backend":"mirror_sd_mlx","context_only_draft_cache":1,"draft_sink":48,"async_draft_eval":1,"fused_draft_verify_eval":1,"paired_prev_tok_s":79.83359399575482,"paired_delta_tok_s":9.259566933917691,"delta_vs_keep":-19.76917156480243,"oscillatory_recovery":true}}
{"run":1517,"commit":"b304c02","metric":76.07702434676226,"metrics":{},"status":"discard","description":"Mirror dropped sharply to ~76.08, reopening deeper trough within the oscillatory regime.","timestamp":1776357065726,"segment":23,"confidence":3.2662031969376004,"iterationTokens":683,"asi":{"hypothesis":"Volatility remains extreme with recurrent returns to 70s after mid-band rebounds.","rollback_reason":"Below keep/high-window.","next_action_hint":"Run one more mirror sample; parity-check if deep-70s persists.","backend":"mirror_sd_mlx","context_only_draft_cache":1,"draft_sink":48,"async_draft_eval":1,"fused_draft_verify_eval":1,"warmup_s":2.1510538749862462,"paired_prev_tok_s":89.09316092967251,"paired_delta_tok_s":-13.01613658291025,"delta_vs_keep":-32.785308147712676,"deep_trough_reopened":true}}
{"run":1518,"commit":"b304c02","metric":90.52752483405946,"metrics":{},"status":"discard","description":"Mirror snapped back to ~90.53, showing the deep-70 trough was short-lived this cycle.","timestamp":1776357099974,"segment":23,"confidence":3.258832544976733,"iterationTokens":737,"asi":{"hypothesis":"Current regime alternates quickly between deep troughs and low-90 recoveries.","rollback_reason":"Below keep.","next_action_hint":"Continue mirror scans without parity unless prolonged low-band persists.","backend":"mirror_sd_mlx","context_only_draft_cache":1,"draft_sink":48,"async_draft_eval":1,"fused_draft_verify_eval":1,"paired_prev_tok_s":76.07702434676226,"paired_delta_tok_s":14.450500487297202,"delta_vs_keep":-18.33480766041548,"oscillatory_recovery":true}}
{"run":1519,"commit":"b304c02","metric":88.79597812715093,"metrics":{},"status":"discard","description":"Mirror held near ~88.80, maintaining low-90/high-80 recovery band.","timestamp":1776357130289,"segment":23,"confidence":3.2529495574498957,"iterationTokens":688,"asi":{"hypothesis":"After recent volatility, local center may be settling around high-80s/low-90s.","rollback_reason":"Below keep.","next_action_hint":"Continue mirror sequence for any step-up toward mid/high-90s.","backend":"mirror_sd_mlx","context_only_draft_cache":1,"draft_sink":48,"async_draft_eval":1,"fused_draft_verify_eval":1,"paired_prev_tok_s":90.52752483405946,"paired_delta_tok_s":-1.7315467069085244,"delta_vs_keep":-20.06635436732401,"recovery_stage":"~89-91 pocket"}}
{"run":1520,"commit":"b304c02","metric":90.87833253896234,"metrics":{},"status":"discard","description":"Mirror moved up to ~90.88, sustaining low-90 band.","timestamp":1776357164107,"segment":23,"confidence":3.249096408602224,"iterationTokens":697,"asi":{"hypothesis":"Recovery pocket currently centered near ~90 with moderate oscillation.","rollback_reason":"Below keep.","next_action_hint":"Continue mirror scans for potential push into upper-90s/100+.","backend":"mirror_sd_mlx","context_only_draft_cache":1,"draft_sink":48,"async_draft_eval":1,"fused_draft_verify_eval":1,"paired_prev_tok_s":88.79597812715093,"paired_delta_tok_s":2.0823544118114143,"delta_vs_keep":-17.9840009555126,"recovery_stage":"~90 pocket"}}
{"run":1521,"commit":"b304c02","metric":89.18406789346481,"metrics":{},"status":"discard","description":"Mirror eased to ~89.18, remaining in the same high-80/low-90 pocket.","timestamp":1776357198047,"segment":23,"confidence":3.231038032217333,"iterationTokens":669,"asi":{"hypothesis":"Current regime is temporarily stable but capped below mid-90s.","rollback_reason":"Below keep.","next_action_hint":"Continue mirror sampling for cap-break attempts.","backend":"mirror_sd_mlx","context_only_draft_cache":1,"draft_sink":48,"async_draft_eval":1,"fused_draft_verify_eval":1,"paired_prev_tok_s":90.87833253896234,"paired_delta_tok_s":-1.6942646454975285,"delta_vs_keep":-19.67826560101013,"recovery_stage":"~89-91 pocket"}}
{"run":1522,"commit":"b304c02","metric":91.10454496114205,"metrics":{},"status":"discard","description":"Mirror nudged up to ~91.10, staying in narrow low-90 pocket.","timestamp":1776357228337,"segment":23,"confidence":3.2122260330968144,"iterationTokens":679,"asi":{"hypothesis":"Recovery is stable but currently range-bound around ~89-91.","rollback_reason":"Below keep.","next_action_hint":"Continue mirror scans for breakout into mid/high-90s.","backend":"mirror_sd_mlx","context_only_draft_cache":1,"draft_sink":48,"async_draft_eval":1,"fused_draft_verify_eval":1,"paired_prev_tok_s":89.18406789346481,"paired_delta_tok_s":1.9204770676772382,"delta_vs_keep":-17.75778853333289,"recovery_stage":"~90 pocket"}}
{"run":1523,"commit":"b304c02","metric":92.45066825197246,"metrics":{},"status":"discard","description":"Mirror improved to ~92.45, slightly extending top of current pocket.","timestamp":1776357257079,"segment":23,"confidence":3.2085957623512975,"iterationTokens":674,"asi":{"hypothesis":"Range ceiling may be drifting upward from ~91 toward low-90s.","rollback_reason":"Below keep.","next_action_hint":"Continue mirror scans for follow-through into mid/high-90s.","backend":"mirror_sd_mlx","context_only_draft_cache":1,"draft_sink":48,"async_draft_eval":1,"fused_draft_verify_eval":1,"paired_prev_tok_s":91.10454496114205,"paired_delta_tok_s":1.346123290830415,"delta_vs_keep":-16.41166524250248,"recovery_stage":"91->92.5"}}
{"run":1524,"commit":"b304c02","metric":91.96690318693149,"metrics":{},"status":"discard","description":"Mirror held around ~91.97, keeping stable low-90 plateau.","timestamp":1776357285638,"segment":23,"confidence":3.2068584559968922,"iterationTokens":677,"asi":{"hypothesis":"Regime currently centered in low-90s with limited upward momentum.","rollback_reason":"Below keep.","next_action_hint":"Continue mirror measurements; wait for breakout.","backend":"mirror_sd_mlx","context_only_draft_cache":1,"draft_sink":48,"async_draft_eval":1,"fused_draft_verify_eval":1,"paired_prev_tok_s":92.45066825197246,"paired_delta_tok_s":-0.4837650650409685,"delta_vs_keep":-16.89543030754345,"low90_plateau":true}}
{"run":1525,"commit":"b304c02","metric":87.18469024105046,"metrics":{},"status":"discard","description":"Mirror slipped to ~87.18, breaking below the low-90 plateau.","timestamp":1776357315502,"segment":23,"confidence":3.2059157948751364,"iterationTokens":662,"asi":{"hypothesis":"Current band remains fragile and can retrace to high-80s quickly.","rollback_reason":"Below keep.","next_action_hint":"Continue mirror scans to see if this is transient or start of another downswing.","backend":"mirror_sd_mlx","context_only_draft_cache":1,"draft_sink":48,"async_draft_eval":1,"fused_draft_verify_eval":1,"paired_prev_tok_s":91.96690318693149,"paired_delta_tok_s":-4.78221294588103,"delta_vs_keep":-21.67764295342448,"possible_downswing":true}}
{"run":1526,"commit":"b304c02","metric":86.17065418346263,"metrics":{},"status":"discard","description":"Mirror remained low at ~86.17, reinforcing drift from low-90 plateau into high-80s.","timestamp":1776357347711,"segment":23,"confidence":3.203407628759776,"iterationTokens":687,"asi":{"hypothesis":"A new downswing branch may be forming within the broader unstable regime.","rollback_reason":"Below keep.","next_action_hint":"Continue mirror tracking; parity check if descent reaches low-80/sub-80 again.","backend":"mirror_sd_mlx","context_only_draft_cache":1,"draft_sink":48,"async_draft_eval":1,"fused_draft_verify_eval":1,"warmup_s":2.172884542029351,"paired_prev_tok_s":87.18469024105046,"paired_delta_tok_s":-1.0140360575878313,"delta_vs_keep":-22.69167901101231,"possible_downswing":true}}
{"run":1527,"commit":"b304c02","metric":90.68347946124872,"metrics":{},"status":"discard","description":"Mirror rebounded to ~90.68, recovering most of the recent downswing.","timestamp":1776357378173,"segment":23,"confidence":3.1968900331411056,"iterationTokens":755,"asi":{"hypothesis":"Current regime remains oscillatory around high-80/low-90 rather than trending.","rollback_reason":"Below keep.","next_action_hint":"Continue mirror scans for either 95+ breakout or renewed low-band slide.","backend":"mirror_sd_mlx","context_only_draft_cache":1,"draft_sink":48,"async_draft_eval":1,"fused_draft_verify_eval":1,"paired_prev_tok_s":86.17065418346263,"paired_delta_tok_s":4.512825277786089,"delta_vs_keep":-18.178853733226212,"oscillatory_recovery":true}}
{"run":1528,"commit":"b304c02","metric":87.10727202079521,"metrics":{},"status":"discard","description":"Mirror drifted back to ~87.11, staying within high-80/low-90 oscillation zone.","timestamp":1776357409554,"segment":23,"confidence":3.1868985132199303,"iterationTokens":692,"asi":{"hypothesis":"No directional breakout yet; regime remains bounded.","rollback_reason":"Below keep.","next_action_hint":"Continue mirror-only scans.","backend":"mirror_sd_mlx","context_only_draft_cache":1,"draft_sink":48,"async_draft_eval":1,"fused_draft_verify_eval":1,"paired_prev_tok_s":90.68347946124872,"paired_delta_tok_s":-3.5762074404535094,"delta_vs_keep":-21.75506,"oscillatory_recovery":true}}
{"run":1529,"commit":"b304c02","metric":89.25045751418295,"metrics":{},"status":"discard","description":"Mirror returned to ~89.25, preserving the narrow high-80/low-90 range.","timestamp":1776357441835,"segment":23,"confidence":3.1703027166025755,"iterationTokens":676,"asi":{"hypothesis":"The system is currently trapped in a bounded plateau without upward follow-through.","rollback_reason":"Below keep.","next_action_hint":"Continue mirror sampling until range break occurs.","backend":"mirror_sd_mlx","context_only_draft_cache":1,"draft_sink":48,"async_draft_eval":1,"fused_draft_verify_eval":1,"paired_prev_tok_s":87.10727202079521,"paired_delta_tok_s":2.1431854933877412,"delta_vs_keep":-19.61187498029199,"range_bound":true}}
{"run":1530,"commit":"b304c02","metric":88.6361831219665,"metrics":{},"status":"discard","description":"Mirror sample at ~88.64 keeps the same bounded oscillation pattern.","timestamp":1776357473019,"segment":23,"confidence":3.1538788700114897,"iterationTokens":665,"asi":{"hypothesis":"Plateau remains stable in upper-80s with no breakout signal yet.","rollback_reason":"Below keep.","next_action_hint":"Continue mirror measurements.","backend":"mirror_sd_mlx","context_only_draft_cache":1,"draft_sink":48,"async_draft_eval":1,"fused_draft_verify_eval":1,"warmup_s":2.193174208048731,"paired_prev_tok_s":89.25045751418295,"paired_delta_tok_s":-0.6142743922164494,"delta_vs_keep":-20.22614937250844,"range_bound":true}}
{"run":1531,"commit":"b304c02","metric":89.83331391123276,"metrics":{},"status":"discard","description":"Mirror rose to ~89.83, still inside unchanged high-80/low-90 corridor.","timestamp":1776357502251,"segment":23,"confidence":3.150462532771312,"iterationTokens":676,"asi":{"hypothesis":"Corridor persists and remains the dominant local regime.","rollback_reason":"Below keep.","next_action_hint":"Keep scanning for a range break.","backend":"mirror_sd_mlx","context_only_draft_cache":1,"draft_sink":48,"async_draft_eval":1,"fused_draft_verify_eval":1,"paired_prev_tok_s":88.6361831219665,"paired_delta_tok_s":1.1971307892662644,"delta_vs_keep":-19.029018583242173,"range_bound":true}}
{"run":1532,"commit":"b304c02","metric":84.59679835846092,"metrics":{},"status":"discard","description":"Mirror dropped to ~84.60, breaking below the recent 88–91 corridor.","timestamp":1776357534711,"segment":23,"confidence":3.147053588796175,"iterationTokens":696,"asi":{"hypothesis":"Bounded range is broadening downward again.","rollback_reason":"Below keep.","next_action_hint":"Continue mirror samples to see if this becomes a new lower pocket.","backend":"mirror_sd_mlx","context_only_draft_cache":1,"draft_sink":48,"async_draft_eval":1,"fused_draft_verify_eval":1,"paired_prev_tok_s":89.83331391123276,"paired_delta_tok_s":-5.236515552771848,"delta_vs_keep":-24.265534136014022,"range_expanding_down":true}}
{"run":1533,"commit":"b304c02","metric":89.99071596726402,"metrics":{},"status":"discard","description":"Mirror rebounded to ~89.99, returning to upper edge of current volatile band.","timestamp":1776357566315,"segment":23,"confidence":3.1425693429681787,"iterationTokens":676,"asi":{"hypothesis":"Downward break to mid-80s was transient within ongoing oscillation.","rollback_reason":"Below keep.","next_action_hint":"Continue mirror tracking for any sustained move above 90/95.","backend":"mirror_sd_mlx","context_only_draft_cache":1,"draft_sink":48,"async_draft_eval":1,"fused_draft_verify_eval":1,"paired_prev_tok_s":84.59679835846092,"paired_delta_tok_s":5.393917608803098,"delta_vs_keep":-18.871616527210893,"range_bound":true}}
{"run":1534,"commit":"b304c02","metric":72.77280785159886,"metrics":{},"status":"discard","description":"Mirror collapsed back to ~72.77 from ~90, reopening deep-degraded branch.","timestamp":1776357601712,"segment":23,"confidence":3.1380978581868213,"iterationTokens":683,"asi":{"hypothesis":"Regime remains prone to abrupt deep drops despite temporary upper-band rebounds.","rollback_reason":"Below keep/high-window.","next_action_hint":"Run immediate mirror follow-up; parity check if deep-70s persists.","backend":"mirror_sd_mlx","context_only_draft_cache":1,"draft_sink":48,"async_draft_eval":1,"fused_draft_verify_eval":1,"paired_prev_tok_s":89.99071596726402,"paired_delta_tok_s":-17.21790811566516,"delta_vs_keep":-36.089524642876086,"deep_branch_reopened":true}}
{"run":1535,"commit":"b304c02","metric":90.87427889622852,"metrics":{},"status":"discard","description":"Immediate mirror follow-up rebounded to ~90.87, marking the deep-70 drop as transient this cycle.","timestamp":1776357631642,"segment":23,"confidence":3.130935497384689,"iterationTokens":702,"asi":{"hypothesis":"Observed behavior remains rapid toggling between deep and low-90 states.","rollback_reason":"Below keep.","next_action_hint":"Continue mirror scans; defer parity unless low-band persists consecutively.","backend":"mirror_sd_mlx","context_only_draft_cache":1,"draft_sink":48,"async_draft_eval":1,"fused_draft_verify_eval":1,"paired_prev_tok_s":72.77280785159886,"paired_delta_tok_s":18.10147104462966,"delta_vs_keep":-17.98805359824642,"oscillatory_recovery":true}}
{"run":1536,"commit":"b304c02","metric":87.76167762659598,"metrics":{},"status":"discard","description":"Mirror eased to ~87.76, staying within high-80/low-90 oscillation envelope.","timestamp":1776357664555,"segment":23,"confidence":3.123805756721245,"iterationTokens":846,"asi":{"hypothesis":"Current local regime remains range-bound with no sustained breakout.","rollback_reason":"Below keep.","next_action_hint":"Continue mirror sampling.","backend":"mirror_sd_mlx","context_only_draft_cache":1,"draft_sink":48,"async_draft_eval":1,"fused_draft_verify_eval":1,"paired_prev_tok_s":90.87427889622852,"paired_delta_tok_s":-3.112601269632541,"delta_vs_keep":-21.10065486787896,"range_bound":true}}
{"run":1537,"commit":"b304c02","metric":91.7329696137444,"metrics":{},"status":"discard","description":"Mirror climbed to ~91.73, touching upper side of the current bounded range.","timestamp":1776357696164,"segment":23,"confidence":3.115645410944061,"iterationTokens":645,"asi":{"hypothesis":"Upper side remains capped in low-90s until regime shifts.","rollback_reason":"Below keep.","next_action_hint":"Continue mirror scans for rare breakout attempts.","backend":"mirror_sd_mlx","context_only_draft_cache":1,"draft_sink":48,"async_draft_eval":1,"fused_draft_verify_eval":1,"paired_prev_tok_s":87.76167762659598,"paired_delta_tok_s":3.9712919871484256,"delta_vs_keep":-17.129362880730532,"range_bound":true}}
{"run":1538,"commit":"b304c02","metric":88.18320286937491,"metrics":{},"status":"discard","description":"Mirror returned to ~88.18, continuing repetitive high-80/low-90 oscillation.","timestamp":1776357726052,"segment":23,"confidence":3.1075275887709046,"iterationTokens":650,"asi":{"hypothesis":"No trend change yet; range behavior persists.","rollback_reason":"Below keep.","next_action_hint":"Keep mirror loop running for eventual range break.","backend":"mirror_sd_mlx","context_only_draft_cache":1,"draft_sink":48,"async_draft_eval":1,"fused_draft_verify_eval":1,"paired_prev_tok_s":91.7329696137444,"paired_delta_tok_s":-3.5497667443694985,"delta_vs_keep":-20.67912962510003,"range_bound":true}}
{"run":1539,"commit":"b304c02","metric":75.8069044392296,"metrics":{},"status":"discard","description":"Mirror fell to ~75.81, breaking out of the high-80/low-90 corridor into deep trough again.","timestamp":1776357759282,"segment":23,"confidence":3.100459562651242,"iterationTokens":651,"asi":{"hypothesis":"Range has re-expanded downward; deep-70 branch remains active.","rollback_reason":"Below keep/high-window.","next_action_hint":"Run immediate mirror follow-up; parity-check if deep trough persists.","backend":"mirror_sd_mlx","context_only_draft_cache":1,"draft_sink":48,"async_draft_eval":1,"fused_draft_verify_eval":1,"paired_prev_tok_s":88.18320286937491,"paired_delta_tok_s":-12.376298430145312,"delta_vs_keep":-33.05542805524534,"deep_branch_reopened":true}}
