{"run":774,"commit":"8b55918","metric":104.58862683495808,"metrics":{},"status":"discard","description":"Structural eval-point tweak: avoid forcing committed hidden-state eval in each verify step (eval posterior only).","timestamp":1776289005808,"segment":23,"confidence":4.411067665099776,"iterationTokens":2583,"asi":{"hypothesis":"Deferring committed_hidden evaluation may reduce per-block synchronization overhead in the mirror decode loop.","rollback_reason":"Regression versus keep and current local baseline (104.59 vs 106.86).","next_action_hint":"Revert this eval deferral; current explicit eval behavior appears safer/faster in this workload.","backend":"mirror_sd_mlx","context_only_draft_cache":1,"draft_sink":48,"optimization":"defer_committed_hidden_eval","delta_vs_keep":-2.271373165041933}}
{"run":775,"commit":"8b55918","metric":104.52159324287689,"metrics":{},"status":"discard","description":"Post-revert mirror anchor after committed-hidden eval deferral trial.","timestamp":1776289037402,"segment":23,"confidence":4.527785208151041,"iterationTokens":656,"asi":{"hypothesis":"Reverted keep-shape baseline should recover if candidate regression was patch-driven.","rollback_reason":"Anchor stayed in low-104 band, below keep and below recent local median.","next_action_hint":"Take control symmetry sample to classify this as shared dip versus mirror-specific movement.","backend":"mirror_sd_mlx","context_only_draft_cache":1,"draft_sink":48,"stability_probe":true,"delta_vs_keep":-2.338406757123122}}
{"run":776,"commit":"8b55918","metric":28.92630322285063,"metrics":{},"status":"discard","description":"Control symmetry check after low-104 mirror dip (mirror disabled).","timestamp":1776289105065,"segment":23,"confidence":4.411067665099776,"iterationTokens":702,"asi":{"hypothesis":"If mirror dip was global, control should also decline in the same window.","rollback_reason":"Control collapsed catastrophically to 28.93 tok/s, confirming renewed severe instability wave.","next_action_hint":"Run immediate mirror follow-up to classify rebound path; defer all tuning claims in this trough.","backend":"bstnxbt_mlx","mirror_runtime_enabled":0,"context_only_draft_cache":1,"draft_sink":48,"collapse_regime":true,"paired_mirror_tok_s":104.52159324287689,"paired_delta_tok_s":75.59529002002625}}
{"run":777,"commit":"8b55918","metric":27.991377179731387,"metrics":{},"status":"discard","description":"Mirror follow-up after catastrophic control collapse sample.","timestamp":1776289164955,"segment":23,"confidence":4.393820829039771,"iterationTokens":668,"asi":{"hypothesis":"Mirror should reveal whether collapse was global by landing in similarly degraded band.","rollback_reason":"Mirror also collapsed catastrophically to 27.99 tok/s.","next_action_hint":"Remain in recovery-monitoring mode only; wait for regime to rebound before any candidate tests.","backend":"mirror_sd_mlx","context_only_draft_cache":1,"draft_sink":48,"collapse_regime":true,"paired_control_tok_s":28.92630322285063,"paired_delta_tok_s":-0.9349260431192447}}
{"run":778,"commit":"8b55918","metric":64.58963406244183,"metrics":{},"status":"discard","description":"Recovery probe after shared ~28 tok/s collapse trough.","timestamp":1776289202428,"segment":23,"confidence":4.362268147215566,"iterationTokens":639,"asi":{"hypothesis":"Repeated unchanged runs should climb out of catastrophic trough toward normal band.","rollback_reason":"Partial rebound to 64.59 only, still far below keep.","next_action_hint":"Continue paired recovery probes; do not test new candidates until >100 resumes.","backend":"mirror_sd_mlx","context_only_draft_cache":1,"draft_sink":48,"stability_probe":true}}
{"run":779,"commit":"8b55918","metric":38.69232894778883,"metrics":{},"status":"discard","description":"Control pair sample during rebound attempt from catastrophic trough (mirror disabled).","timestamp":1776289262207,"segment":23,"confidence":4.327279934025387,"iterationTokens":663,"asi":{"hypothesis":"If rebound is global, control should recover in the same direction as mirror, though with noisy ordering.","rollback_reason":"Control fell back to 38.69 while paired mirror was 64.59, confirming severe oscillatory instability.","next_action_hint":"Run immediate mirror follow-up; keep all optimization conclusions suspended in this window.","backend":"bstnxbt_mlx","mirror_runtime_enabled":0,"context_only_draft_cache":1,"draft_sink":48,"collapse_regime":true,"paired_mirror_tok_s":64.58963406244183,"paired_delta_tok_s":25.897305114652998}}
{"run":780,"commit":"8b55918","metric":83.69433211356508,"metrics":{},"status":"discard","description":"Mirror follow-up after low control oscillation sample in collapse window.","timestamp":1776289295243,"segment":23,"confidence":4.278955506076369,"iterationTokens":670,"asi":{"hypothesis":"Mirror may rebound sharply on immediate rerun even while control remains unstable in collapse-recovery oscillations.","rollback_reason":"Rebounded to 83.69 but still below high-band and keep.","next_action_hint":"Continue recovery monitoring and require >100 stabilization before candidate testing.","backend":"mirror_sd_mlx","context_only_draft_cache":1,"draft_sink":48,"collapse_regime":true,"paired_control_tok_s":38.69232894778883,"paired_delta_tok_s":45.00200316577625}}
{"run":781,"commit":"8b55918","metric":61.57386312026905,"metrics":{},"status":"discard","description":"Control follow-up during latest collapse-recovery oscillation (mirror disabled).","timestamp":1776289354246,"segment":23,"confidence":4.249588377159977,"iterationTokens":2130,"asi":{"hypothesis":"Control should remain in similarly depressed/recovering band during ongoing instability.","rollback_reason":"Control remained low at 61.57, confirming collapse regime still active.","next_action_hint":"Run immediate mirror follow-up and continue stability-only tracking.","backend":"bstnxbt_mlx","mirror_runtime_enabled":0,"context_only_draft_cache":1,"draft_sink":48,"collapse_regime":true,"paired_mirror_tok_s":83.69433211356508,"paired_delta_tok_s":22.12046899329603}}
{"run":782,"commit":"8b55918","metric":65.13290029599894,"metrics":{},"status":"discard","description":"Mirror follow-up after low control sample in active collapse regime.","timestamp":1776289392201,"segment":23,"confidence":4.22062160278242,"iterationTokens":645,"asi":{"hypothesis":"Mirror should remain in the same depressed band if instability persists.","rollback_reason":"Mirror stayed low at 65.13, confirming ongoing trough.","next_action_hint":"Keep recovery monitoring; defer all candidate tuning until >100 band reappears.","backend":"mirror_sd_mlx","context_only_draft_cache":1,"draft_sink":48,"collapse_regime":true,"paired_control_tok_s":61.57386312026905,"paired_delta_tok_s":3.559037175729888}}
{"run":783,"commit":"8b55918","metric":73.2605163631191,"metrics":{},"status":"discard","description":"Additional mirror recovery probe in prolonged collapse window.","timestamp":1776289429655,"segment":23,"confidence":4.157433574651198,"iterationTokens":639,"asi":{"hypothesis":"Repeated unchanged runs should continue climbing out of low-60s trough.","rollback_reason":"Only partial rebound to 73.26, still far below keep.","next_action_hint":"Run control pair sample to verify shared rebound trajectory.","backend":"mirror_sd_mlx","context_only_draft_cache":1,"draft_sink":48,"stability_probe":true}}
{"run":784,"commit":"8b55918","metric":75.89378105778289,"metrics":{},"status":"discard","description":"Control pair sample after 73.26 mirror recovery probe (mirror disabled).","timestamp":1776289474714,"segment":23,"confidence":4.09610964751564,"iterationTokens":650,"asi":{"hypothesis":"If recovery is global, control should rise into the same mid-70s band.","rollback_reason":"Control slightly above mirror in same depressed band; still far below keep.","next_action_hint":"Run immediate mirror follow-up and continue waiting for >100 recovery before candidate testing.","backend":"bstnxbt_mlx","mirror_runtime_enabled":0,"context_only_draft_cache":1,"draft_sink":48,"paired_mirror_tok_s":73.2605163631191,"paired_delta_tok_s":-2.633264694663782}}
{"run":785,"commit":"8b55918","metric":74.71272083296242,"metrics":{},"status":"discard","description":"Mirror follow-up after control mid-70 sample in collapse-recovery regime.","timestamp":1776289508624,"segment":23,"confidence":4.051049393321195,"iterationTokens":648,"asi":{"hypothesis":"Mirror should stay near control while trough persists and recovery remains slow.","rollback_reason":"Mirror remained in mid-70s, well below keep.","next_action_hint":"Keep stability monitoring until throughput re-enters high-100 band.","backend":"mirror_sd_mlx","context_only_draft_cache":1,"draft_sink":48,"paired_control_tok_s":75.89378105778289,"paired_delta_tok_s":-1.1810602248204678,"stability_probe":true}}
{"run":786,"commit":"8b55918","metric":81.83726825057028,"metrics":{},"status":"discard","description":"Additional mirror recovery probe in prolonged instability window.","timestamp":1776289544320,"segment":23,"confidence":3.993091078073708,"iterationTokens":643,"asi":{"hypothesis":"Throughput should gradually climb from mid-70s toward prior bands under unchanged config.","rollback_reason":"Rebounded to 81.84 but still below keep.","next_action_hint":"Run paired control sample to validate shared rebound and avoid backend-specific inference.","backend":"mirror_sd_mlx","context_only_draft_cache":1,"draft_sink":48,"stability_probe":true}}
{"run":787,"commit":"8b55918","metric":86.22559701124952,"metrics":{},"status":"discard","description":"Control pair sample after 81.84 mirror rebound (mirror disabled).","timestamp":1776289585791,"segment":23,"confidence":3.91624614942682,"iterationTokens":657,"asi":{"hypothesis":"If recovery is global, control should continue rising alongside mirror.","rollback_reason":"Control rose to 86.23 and led this pair; still below keep.","next_action_hint":"Run immediate mirror follow-up to track ordering flips as recovery progresses.","backend":"bstnxbt_mlx","mirror_runtime_enabled":0,"context_only_draft_cache":1,"draft_sink":48,"paired_mirror_tok_s":81.83726825057028,"paired_delta_tok_s":-4.388328760679239}}
{"run":788,"commit":"8b55918","metric":85.95743595017856,"metrics":{},"status":"discard","description":"Mirror follow-up after control-leading rebound pair.","timestamp":1776289618293,"segment":23,"confidence":3.829539824666601,"iterationTokens":636,"asi":{"hypothesis":"Mirror should converge toward control as shared recovery continues.","rollback_reason":"Mirror nearly matched control (85.96 vs 86.23), still below keep.","next_action_hint":"Continue recovery monitoring until >100 band returns before resuming candidate experiments.","backend":"mirror_sd_mlx","context_only_draft_cache":1,"draft_sink":48,"paired_control_tok_s":86.22559701124952,"paired_delta_tok_s":-0.2681610610709622,"stability_probe":true}}
{"run":789,"commit":"8b55918","metric":88.9809671971067,"metrics":{},"status":"discard","description":"Additional mirror recovery probe approaching high-90 band.","timestamp":1776289656126,"segment":23,"confidence":3.759313721387734,"iterationTokens":627,"asi":{"hypothesis":"Recovery should continue from mid-80s toward high-90s under unchanged keep config.","rollback_reason":"Rebounded to 88.98 but still below keep.","next_action_hint":"Run control pair to confirm shared upward trend and avoid backend-overfitting.","backend":"mirror_sd_mlx","context_only_draft_cache":1,"draft_sink":48,"stability_probe":true}}
{"run":790,"commit":"8b55918","metric":88.22560547868736,"metrics":{},"status":"discard","description":"Control pair sample after 88.98 mirror recovery point (mirror disabled).","timestamp":1776289697179,"segment":23,"confidence":3.688322393549395,"iterationTokens":663,"asi":{"hypothesis":"Control should remain in similar upper-80 band if recovery is shared.","rollback_reason":"Control matched mirror band closely and remains below keep.","next_action_hint":"Run mirror follow-up; continue monitoring until >100 returns.","backend":"bstnxbt_mlx","mirror_runtime_enabled":0,"context_only_draft_cache":1,"draft_sink":48,"paired_mirror_tok_s":88.9809671971067,"paired_delta_tok_s":0.7553617184193459}}
{"run":791,"commit":"8b55918","metric":90.56728263521298,"metrics":{},"status":"discard","description":"Mirror follow-up after control upper-80 recovery sample.","timestamp":1776289730425,"segment":23,"confidence":3.6430278443779227,"iterationTokens":629,"asi":{"hypothesis":"Mirror should continue upward recovery and may retake slight lead in noisy band.","rollback_reason":"Mirror improved to 90.57 but still below keep.","next_action_hint":"Continue recovery tracking until at least high-90/100 before candidate tests.","backend":"mirror_sd_mlx","context_only_draft_cache":1,"draft_sink":48,"paired_control_tok_s":88.22560547868736,"paired_delta_tok_s":2.3416771565256216,"stability_probe":true}}
{"run":792,"commit":"8b55918","metric":90.73687726181538,"metrics":{},"status":"discard","description":"Additional mirror recovery probe (upper-80 to low-90 plateau).","timestamp":1776289762066,"segment":23,"confidence":3.611978307951476,"iterationTokens":637,"asi":{"hypothesis":"Repeated unchanged runs may continue climbing from low-90 plateau toward high-90/100.","rollback_reason":"Throughput plateaued near 90.7 and remains below keep.","next_action_hint":"Run control check to verify whether both backends are plateauing similarly in this band.","backend":"mirror_sd_mlx","context_only_draft_cache":1,"draft_sink":48,"stability_probe":true}}
{"run":793,"commit":"8b55918","metric":92.57316037341694,"metrics":{},"status":"discard","description":"Control check after mirror ~90.7 plateau sample (mirror disabled).","timestamp":1776289804759,"segment":23,"confidence":3.4513823283415936,"iterationTokens":677,"asi":{"hypothesis":"If plateau is shared, control should land in similar low-90 band.","rollback_reason":"Control slightly higher (92.57) but still below keep; shared depressed regime persists.","next_action_hint":"Run mirror follow-up and continue tracking rebound before new candidate tests.","backend":"bstnxbt_mlx","mirror_runtime_enabled":0,"context_only_draft_cache":1,"draft_sink":48,"paired_mirror_tok_s":90.73687726181538,"paired_delta_tok_s":-1.8362831116015665}}
{"run":794,"commit":"8b55918","metric":95.50293965192465,"metrics":{},"status":"discard","description":"Mirror follow-up after control low-90 sample; recovery approaching baseline band.","timestamp":1776289837499,"segment":23,"confidence":3.307603587349735,"iterationTokens":646,"asi":{"hypothesis":"Mirror should continue recovering and close control gap as instability wave fades.","rollback_reason":"Recovered to 95.50 but still below keep.","next_action_hint":"One more paired cycle if >100 returns, then resume structural candidate exploration.","backend":"mirror_sd_mlx","context_only_draft_cache":1,"draft_sink":48,"paired_control_tok_s":92.57316037341694,"paired_delta_tok_s":2.929779278507704,"stability_probe":true}}
{"run":795,"commit":"8b55918","metric":96.28420653083944,"metrics":{},"status":"discard","description":"Mirror recovery probe crossing back near baseline threshold.","timestamp":1776289867292,"segment":23,"confidence":3.224809427403203,"iterationTokens":629,"asi":{"hypothesis":"Continued unchanged reruns should cross back into high-90/100 band as trough decays.","rollback_reason":"Improved to 96.28 but still below keep.","next_action_hint":"Run control pair; if both cross >100, resume structural-only candidate tests.","backend":"mirror_sd_mlx","context_only_draft_cache":1,"draft_sink":48,"stability_probe":true}}
{"run":796,"commit":"8b55918","metric":97.61272231251617,"metrics":{},"status":"discard","description":"Control pair during rebound toward high-100 regime (mirror disabled).","timestamp":1776289909205,"segment":23,"confidence":3.1631200232701824,"iterationTokens":665,"asi":{"hypothesis":"Control should track mirror upward if recovery is shared.","rollback_reason":"Control reached upper-90s and remains below keep.","next_action_hint":"Run mirror follow-up; if >100 returns, restart structural probes.","backend":"bstnxbt_mlx","mirror_runtime_enabled":0,"context_only_draft_cache":1,"draft_sink":48,"paired_mirror_tok_s":96.28420653083944,"paired_delta_tok_s":-1.328515781676726}}
{"run":797,"commit":"8b55918","metric":98.44265962957503,"metrics":{},"status":"discard","description":"Mirror follow-up after control upper-90 sample.","timestamp":1776289941968,"segment":23,"confidence":3.140610104339613,"iterationTokens":622,"asi":{"hypothesis":"Mirror should continue upward recovery and remain near control as shared regime normalizes.","rollback_reason":"Mirror reached high-90s but still below keep.","next_action_hint":"Continue one more paired cycle; resume structural tests once >100 band is re-established.","backend":"mirror_sd_mlx","context_only_draft_cache":1,"draft_sink":48,"paired_control_tok_s":97.61272231251617,"paired_delta_tok_s":0.8299373170588547,"stability_probe":true}}
{"run":798,"commit":"8b55918","metric":100.45506110322745,"metrics":{},"status":"discard","description":"Mirror recovery checkpoint crossing back into >100 band.","timestamp":1776289975311,"segment":23,"confidence":3.1232835850553666,"iterationTokens":632,"asi":{"hypothesis":"Recovery wave should re-enter >100 throughput regime on unchanged keep shape.","rollback_reason":"Recovered >100 but still below keep.","next_action_hint":"Run control pair in >100 band; if stable, resume structural candidate exploration.","backend":"mirror_sd_mlx","context_only_draft_cache":1,"draft_sink":48,"stability_probe":true,"delta_vs_keep":-6.404938896772559}}
{"run":799,"commit":"8b55918","metric":101.87103211915097,"metrics":{},"status":"discard","description":"Control pair after mirror re-entered >100 band (mirror disabled).","timestamp":1776290014891,"segment":23,"confidence":3.098477257716692,"iterationTokens":698,"asi":{"hypothesis":"Control should similarly re-enter >100 if recovery is shared.","rollback_reason":"Control also >100 and above paired mirror, still below keep.","next_action_hint":"Run mirror follow-up and resume structural-only probes once >100 stability is confirmed across pair.","backend":"bstnxbt_mlx","mirror_runtime_enabled":0,"context_only_draft_cache":1,"draft_sink":48,"paired_mirror_tok_s":100.45506110322745,"paired_delta_tok_s":-1.4159710159235228}}
{"run":800,"commit":"8b55918","metric":101.66906297983468,"metrics":{},"status":"discard","description":"Mirror follow-up after control >100 recovery pair.","timestamp":1776290046354,"segment":23,"confidence":3.085669123019216,"iterationTokens":636,"asi":{"hypothesis":"Mirror should remain in >100 band if recovery has stabilized.","rollback_reason":"Mirror stayed >100 but still significantly below keep.","next_action_hint":"Resume structural candidate testing in recovered band; require immediate confirmation for any near-keep sample.","backend":"mirror_sd_mlx","context_only_draft_cache":1,"draft_sink":48,"paired_control_tok_s":101.87103211915097,"paired_delta_tok_s":-0.20196913931628566,"delta_vs_keep":-5.190937020165333}}
{"run":801,"commit":"8b55918","metric":100.55324373094865,"metrics":{},"status":"discard","description":"Mirror block-size extension: DFLASH_BLOCK_TOKENS=13 (previously untested on this mirror keep shape).","timestamp":1776290090170,"segment":23,"confidence":3.068989983806848,"iterationTokens":1196,"asi":{"hypothesis":"A smaller speculative block might outperform 15 in the current recovered ~100 regime by reducing reject/verify overhead.","rollback_reason":"Regression versus keep and current 15-token baseline.","next_action_hint":"Add mirror block_tokens=13 to do-not-retry set for this lane and keep block 15.","backend":"mirror_sd_mlx","context_only_draft_cache":1,"draft_sink":48,"block_tokens":13,"delta_vs_keep":-6.306756269051336}}
{"run":802,"commit":"8b55918","metric":103.79065860007839,"metrics":{},"status":"discard","description":"Mirror block-size extension: DFLASH_BLOCK_TOKENS=18.","timestamp":1776290128707,"segment":23,"confidence":3.116851675517076,"iterationTokens":739,"asi":{"hypothesis":"Larger block size 18 might improve acceptance amortization beyond tested 17 on mirror lane.","rollback_reason":"Below keep (103.79 vs 106.86).","next_action_hint":"Add block_tokens=18 to mirror do-not-retry set; larger blocks remain non-winning.","backend":"mirror_sd_mlx","context_only_draft_cache":1,"draft_sink":48,"block_tokens":18,"delta_vs_keep":-3.06934139992161}}
{"run":803,"commit":"8b55918","metric":104.43808662914995,"metrics":{},"status":"discard","description":"Mirror anchor after block-size extension probes (restored keep shape).","timestamp":1776290171903,"segment":23,"confidence":3.134486171473337,"iterationTokens":809,"asi":{"hypothesis":"Reverting block-size overrides should return to current recovered baseline band.","rollback_reason":"Anchor in low-104 band, below keep and below recent local highs.","next_action_hint":"Take paired control sample to classify this as shared local dip.","backend":"mirror_sd_mlx","context_only_draft_cache":1,"draft_sink":48,"stability_probe":true,"delta_vs_keep":-2.42191337085005}}
