{"run":559,"commit":"8b55918","metric":91.20315576882385,"metrics":{},"status":"discard","description":"A/B probe: disable context-only native draft cache (DFLASH_BSTNXBT_CONTEXT_ONLY_DRAFT_CACHE=0) under mirror keep shape.","timestamp":1776277600126,"segment":23,"confidence":4.197846525055362,"iterationTokens":10724,"asi":{"hypothesis":"Context-only draft cache may no longer be beneficial in the current unstable regime; disabling it might improve throughput.","rollback_reason":"Below current keep (91.20 vs 106.86).","next_action_hint":"Keep context-only draft cache enabled for mirror lane.","backend":"mirror_sd_mlx","context_only_draft_cache":0}}
{"run":560,"commit":"8b55918","metric":98.76274108065633,"metrics":{},"status":"discard","description":"Context-only draft-cache neighborhood: set DFLASH_DRAFT_WINDOW=896 with sink=48.","timestamp":1776277638428,"segment":23,"confidence":4.042601314132555,"iterationTokens":796,"asi":{"hypothesis":"A mildly smaller context window than 1024 may reduce draft attention cost while preserving enough history.","rollback_reason":"Non-winning sample (98.76 vs 106.86 keep).","next_action_hint":"Treat 896 as non-winning in current regime; keep default window unless stable re-tests suggest otherwise.","backend":"mirror_sd_mlx","context_only_draft_cache":1,"draft_sink":48,"draft_window":896}}
{"run":561,"commit":"8b55918","metric":99.72107800260476,"metrics":{},"status":"discard","description":"Context-only draft-cache neighborhood: set DFLASH_DRAFT_WINDOW=1152 with sink=48.","timestamp":1776277672953,"segment":23,"confidence":3.4998733498649597,"iterationTokens":707,"asi":{"hypothesis":"A mildly larger context window than 1024 may improve acceptance enough to outweigh additional attention cost.","rollback_reason":"Below keep (99.72 vs 106.86).","next_action_hint":"Treat 1152 as non-winning; retain default window 1024 for this lane.","backend":"mirror_sd_mlx","context_only_draft_cache":1,"draft_sink":48,"draft_window":1152}}
{"run":562,"commit":"8b55918","metric":100.47965707965265,"metrics":{},"status":"discard","description":"Baseline re-anchor after window-neighborhood probes (unchanged keep config).","timestamp":1776277700915,"segment":23,"confidence":3.126585796339703,"iterationTokens":621,"asi":{"hypothesis":"After reverting non-winning window probes, baseline should return toward keep band.","rollback_reason":"Still below keep at 100.48.","next_action_hint":"Continue paired mirror/control tracking; environment remains in a lower-throughput regime.","backend":"mirror_sd_mlx","context_only_draft_cache":1,"draft_sink":48,"stability_probe":true}}
{"run":563,"commit":"8b55918","metric":98.4912140632879,"metrics":{},"status":"discard","description":"Paired control run after 100.48 mirror baseline (mirror disabled) under context-only sink=48 shape.","timestamp":1776277737696,"segment":23,"confidence":3.1114185106373773,"iterationTokens":659,"asi":{"hypothesis":"Control comparison will indicate whether current ~100 mirror band is backend-specific or shared drift.","rollback_reason":"Control run is comparison-only; not a mirror keep candidate.","next_action_hint":"Mirror currently leads this pair by ~1.99 tok/s; repeat paired checks before asserting a durable edge.","backend":"bstnxbt_mlx","mirror_runtime_enabled":0,"context_only_draft_cache":1,"draft_sink":48,"paired_delta_tok_s":1.9884430163647524}}
{"run":564,"commit":"8b55918","metric":99.22994237022174,"metrics":{},"status":"discard","description":"Mirror follow-up run after paired control sample in ~98–100 regime.","timestamp":1776277770429,"segment":23,"confidence":3.085669123019216,"iterationTokens":666,"asi":{"hypothesis":"Mirror should stay above recent control sample if its current edge is real in this regime.","rollback_reason":"Still below keep at 99.23 despite remaining above immediate control sample.","next_action_hint":"Maintain context-only sink=48 keep and continue low-noise paired validation; avoid new broad sweeps.","backend":"mirror_sd_mlx","context_only_draft_cache":1,"draft_sink":48,"paired_control_tok_s":98.4912140632879,"paired_delta_tok_s":0.7387283069338405}}
{"run":565,"commit":"8b55918","metric":94.67063275574552,"metrics":{},"status":"discard","description":"Re-opened split check under context-only keep shape: DFLASH_MIRROR_SD_EXIT_LAYER=15.","timestamp":1776277813472,"segment":23,"confidence":3.0108707858061625,"iterationTokens":1098,"asi":{"hypothesis":"Context-only draft-cache mode might shift mirror split optimum and make exit layer 15 competitive.","rollback_reason":"Still non-winning at 94.67 vs 106.86 keep.","next_action_hint":"Keep exit layer 14; treat layer 15 as bad even with context-only draft cache enabled.","backend":"mirror_sd_mlx","context_only_draft_cache":1,"draft_sink":48,"mirror_exit_layer":15}}
{"run":566,"commit":"8b55918","metric":98.65547710596941,"metrics":{},"status":"discard","description":"Baseline recovery probe after exit_layer=15 reopen check (reverted to keep config).","timestamp":1776277842226,"segment":23,"confidence":2.8741788163496667,"iterationTokens":625,"asi":{"hypothesis":"After reverting failed exit-layer retune, baseline should recover toward current operating band.","rollback_reason":"Recovered to 98.66 but still below keep.","next_action_hint":"Continue with cautious paired monitoring and avoid reopening more exit-layer values under current volatility.","backend":"mirror_sd_mlx","context_only_draft_cache":1,"draft_sink":48,"stability_probe":true}}
{"run":567,"commit":"8b55918","metric":90.93489777170906,"metrics":{},"status":"discard","description":"Paired control run after 98.66 mirror baseline (mirror disabled) with context-only sink=48 settings.","timestamp":1776277876001,"segment":23,"confidence":2.650584688942367,"iterationTokens":673,"asi":{"hypothesis":"Control comparison will show whether current mirror recovery is backend-specific or shared.","rollback_reason":"Control run is comparison-only; not a mirror keep candidate.","next_action_hint":"This pair shows a large mirror lead (~+7.72 tok/s), but given known instability continue paired repeats before declaring robust separation.","backend":"bstnxbt_mlx","mirror_runtime_enabled":0,"context_only_draft_cache":1,"draft_sink":48,"paired_delta_tok_s":7.72057933426035}}
{"run":568,"commit":"8b55918","metric":96.68656106933771,"metrics":{},"status":"discard","description":"Mirror follow-up after paired low control sample to test persistence of apparent mirror lead.","timestamp":1776277906245,"segment":23,"confidence":2.455546381327449,"iterationTokens":661,"asi":{"hypothesis":"If the large paired lead was real, immediate mirror rerun should remain clearly above control sample.","rollback_reason":"Mirror remained above paired control but still below keep at 96.69.","next_action_hint":"Backend ranking remains volatile; continue focusing on robust multi-run medians and avoid single-pair conclusions.","backend":"mirror_sd_mlx","context_only_draft_cache":1,"draft_sink":48,"paired_control_tok_s":90.93489777170906,"paired_delta_tok_s":5.751663297628649}}
{"run":569,"commit":"8b55918","metric":93.5202036639508,"metrics":{},"status":"discard","description":"Stability-lever probe under context-only keep shape: INITIAL_CACHE_BLOCKS=48.","timestamp":1776277944360,"segment":23,"confidence":2.318193250488377,"iterationTokens":969,"asi":{"hypothesis":"An intermediate cache reservation (48) might smooth current variability and improve throughput over default 16.","rollback_reason":"Non-winning sample (93.52 vs 106.86 keep).","next_action_hint":"Add 48 to mirror cache do-not-retry set for current lane.","backend":"mirror_sd_mlx","context_only_draft_cache":1,"draft_sink":48,"initial_cache_blocks":48}}
{"run":570,"commit":"8b55918","metric":96.98586128005795,"metrics":{},"status":"discard","description":"Stability-lever probe under context-only keep shape: INITIAL_CACHE_BLOCKS=96.","timestamp":1776277978828,"segment":23,"confidence":2.2213972854276136,"iterationTokens":714,"asi":{"hypothesis":"A larger intermediate reservation (96) could improve stability without the heavy overhead of 128+.","rollback_reason":"Below keep (96.99 vs 106.86).","next_action_hint":"Add 96 to mirror cache do-not-retry set; default reservation still best.","backend":"mirror_sd_mlx","context_only_draft_cache":1,"draft_sink":48,"initial_cache_blocks":96}}
{"run":571,"commit":"8b55918","metric":96.93668594326506,"metrics":{},"status":"discard","description":"Baseline re-anchor after cache-reservation probes (unchanged keep config).","timestamp":1776278010424,"segment":23,"confidence":2.2000348835553662,"iterationTokens":601,"asi":{"hypothesis":"After reverting failed reservation probes, baseline should recover to its current operating band.","rollback_reason":"Still far below best keep at 96.94.","next_action_hint":"Continue conservative paired monitoring; no evidence yet for a better reservation override.","backend":"mirror_sd_mlx","context_only_draft_cache":1,"draft_sink":48,"stability_probe":true}}
{"run":572,"commit":"8b55918","metric":91.3500107615115,"metrics":{},"status":"discard","description":"Context-only keep shape chunk sweep extension: DFLASH_BSTNXBT_SPLIT_CHUNK_SIZE=5.","timestamp":1776278069483,"segment":23,"confidence":2.1790794376457594,"iterationTokens":1157,"asi":{"hypothesis":"An even smaller split chunk (5) might reduce per-step latency under current regime better than chunk 6.","rollback_reason":"Non-winning sample (91.35 vs 106.86 keep).","next_action_hint":"Add chunk size 5 to mirror do-not-retry set; keep default chunk 8.","backend":"mirror_sd_mlx","context_only_draft_cache":1,"draft_sink":48,"split_chunk_size":5}}
{"run":573,"commit":"8b55918","metric":91.11545189288995,"metrics":{},"status":"discard","description":"Context-only keep shape chunk sweep extension: DFLASH_BSTNXBT_SPLIT_CHUNK_SIZE=4.","timestamp":1776278108263,"segment":23,"confidence":2.030433730748457,"iterationTokens":752,"asi":{"hypothesis":"Further reducing split chunk size to 4 might better fit this lane's short decode dynamics.","rollback_reason":"Non-winning sample (91.12 vs 106.86 keep).","next_action_hint":"Add chunk size 4 to mirror do-not-retry set; very small chunk sizes appear consistently poor.","backend":"mirror_sd_mlx","context_only_draft_cache":1,"draft_sink":48,"split_chunk_size":4}}
{"run":574,"commit":"8b55918","metric":97.54217725470478,"metrics":{},"status":"discard","description":"Baseline re-anchor after very-small split-chunk sweeps (keep config restored).","timestamp":1776278144833,"segment":23,"confidence":1.9016761255221144,"iterationTokens":812,"asi":{"hypothesis":"Reverting tiny chunk-size probes should restore baseline behavior around current operating band.","rollback_reason":"Still below keep at 97.54.","next_action_hint":"Keep chunk size default 8 and avoid further small-chunk sweeps.","backend":"mirror_sd_mlx","context_only_draft_cache":1,"draft_sink":48,"stability_probe":true}}
{"run":575,"commit":"8b55918","metric":99.02906227697153,"metrics":{},"status":"discard","description":"Paired control run after 97.54 mirror baseline (mirror disabled) under context-only sink=48 shape.","timestamp":1776278181750,"segment":23,"confidence":1.8861173031547707,"iterationTokens":668,"asi":{"hypothesis":"Control pairing will show whether mirror remains advantaged in the current ~98 band.","rollback_reason":"Control run is comparison-only; not a mirror keep candidate.","next_action_hint":"This pair favored control by ~1.49 tok/s; continue paired repeats before inferring directional change.","backend":"bstnxbt_mlx","mirror_runtime_enabled":0,"context_only_draft_cache":1,"draft_sink":48,"paired_delta_tok_s":-1.4868850222667518}}
{"run":576,"commit":"8b55918","metric":96.86524272981029,"metrics":{},"status":"discard","description":"Mirror follow-up after paired control-leading sample to check immediate rebound.","timestamp":1776278210083,"segment":23,"confidence":1.8731468647364584,"iterationTokens":654,"asi":{"hypothesis":"Mirror may rebound over control on immediate rerun if prior pair reflected local variance.","rollback_reason":"Mirror remained below paired control and below keep (96.87 vs 99.03 control; keep 106.86).","next_action_hint":"Treat backend delta as unresolved in this regime; continue conservative paired monitoring.","backend":"mirror_sd_mlx","context_only_draft_cache":1,"draft_sink":48,"paired_control_tok_s":99.02906227697153,"paired_delta_tok_s":-2.163819547161239}}
{"run":577,"commit":"8b55918","metric":96.34600106818,"metrics":{},"status":"discard","description":"A/B recheck under context-only mode: revert DFLASH_DRAFT_SINK to 64 (from keep at 48).","timestamp":1776278250145,"segment":23,"confidence":1.8396344663988635,"iterationTokens":1085,"asi":{"hypothesis":"The tiny sink=48 gain may be noise; sink=64 might be equal or better under current regime.","rollback_reason":"Non-winning sample (96.35 vs 106.86 keep).","next_action_hint":"Continue treating sink=48 as preferred setting in this lane.","backend":"mirror_sd_mlx","context_only_draft_cache":1,"draft_sink":64}}
{"run":578,"commit":"8b55918","metric":98.01551251034132,"metrics":{},"status":"discard","description":"Unchanged baseline rerun for current keep shape after sink=64 A/B check.","timestamp":1776278281235,"segment":23,"confidence":1.771870786509614,"iterationTokens":689,"asi":{"hypothesis":"Baseline should remain in current operating band after reverting sink A/B probe.","rollback_reason":"Still below keep at 98.02.","next_action_hint":"Continue paired mirror/control checks and avoid new broad sweeps until high-band stability returns.","backend":"mirror_sd_mlx","context_only_draft_cache":1,"draft_sink":48,"stability_probe":true}}
{"run":579,"commit":"8b55918","metric":98.57479362939439,"metrics":{},"status":"discard","description":"Paired control run after 98.02 mirror baseline (mirror disabled) under context-only sink=48 shape.","timestamp":1776278314353,"segment":23,"confidence":1.7483889836818702,"iterationTokens":674,"asi":{"hypothesis":"Immediate control pair will help determine if mirror retains an edge in the current ~98 band.","rollback_reason":"Control run is comparison-only; not a mirror keep candidate.","next_action_hint":"Pair slightly favors control (~0.56 tok/s); treat delta as noise-prone and continue paired repeats.","backend":"bstnxbt_mlx","mirror_runtime_enabled":0,"context_only_draft_cache":1,"draft_sink":48,"paired_delta_tok_s":-0.5592811190530647}}
{"run":580,"commit":"8b55918","metric":96.78669587475315,"metrics":{},"status":"discard","description":"Mirror follow-up after near-tie control pair in ~98 regime.","timestamp":1776278343889,"segment":23,"confidence":1.7311704600479414,"iterationTokens":657,"asi":{"hypothesis":"Mirror may recover over control on immediate follow-up if pair gap was noise.","rollback_reason":"Mirror remained below paired control and below keep (96.79 vs 98.57 control).","next_action_hint":"No robust backend separation in current regime; continue conservative monitoring instead of tuning churn.","backend":"mirror_sd_mlx","context_only_draft_cache":1,"draft_sink":48,"paired_control_tok_s":98.57479362939439,"paired_delta_tok_s":-1.788097754641235}}
{"run":581,"commit":"8b55918","metric":98.67930621245685,"metrics":{},"status":"discard","description":"Context-only draft-window extension: DFLASH_DRAFT_WINDOW=2048 with sink=48.","timestamp":1776278411137,"segment":23,"confidence":1.7143231287256842,"iterationTokens":2604,"asi":{"hypothesis":"A much larger context-only draft window may increase acceptance enough to improve throughput despite higher attention cost.","rollback_reason":"Non-winning sample (98.68 vs 106.86 keep).","next_action_hint":"Add 2048 to context-only window do-not-retry set for this 1024 lane.","backend":"mirror_sd_mlx","context_only_draft_cache":1,"draft_sink":48,"draft_window":2048}}
{"run":582,"commit":"8b55918","metric":103.62177324183617,"metrics":{},"status":"discard","description":"Baseline recovery probe after window=2048 discard (keep config restored).","timestamp":1776278454434,"segment":23,"confidence":1.7493529588927812,"iterationTokens":788,"asi":{"hypothesis":"Throughput may recover toward higher band once non-winning window override is removed.","rollback_reason":"Recovered to 103.62 but still below keep 106.86.","next_action_hint":"Use this higher-band window to run one or two targeted A/B checks for robust directionality.","backend":"mirror_sd_mlx","context_only_draft_cache":1,"draft_sink":48,"stability_probe":true}}
{"run":583,"commit":"8b55918","metric":98.3833028477824,"metrics":{},"status":"discard","description":"Paired control run after 103.62 mirror recovery sample (mirror disabled).","timestamp":1776278500080,"segment":23,"confidence":1.7200861152048277,"iterationTokens":696,"asi":{"hypothesis":"If mirror recovery reflects backend advantage, control should remain materially lower in the same window.","rollback_reason":"Control run is comparison-only; not a mirror keep candidate.","next_action_hint":"This pair shows a sizeable mirror lead (~+5.24 tok/s); repeat one more A/B cycle before trusting it under known regime volatility.","backend":"bstnxbt_mlx","mirror_runtime_enabled":0,"context_only_draft_cache":1,"draft_sink":48,"paired_delta_tok_s":5.238470394053767}}
{"run":584,"commit":"8b55918","metric":98.01281177721276,"metrics":{},"status":"discard","description":"Mirror follow-up run after control pair to test persistence of apparent +5 tok/s edge.","timestamp":1776278545570,"segment":23,"confidence":1.6860593968830726,"iterationTokens":647,"asi":{"hypothesis":"If prior mirror lead was robust, immediate mirror rerun should stay well above the control sample.","rollback_reason":"Mirror fell to near control (~98.01 vs 98.38), indicating the large lead was not stable.","next_action_hint":"Treat current backend delta as noise-driven; continue conservative monitoring and avoid over-claiming pairwise spikes.","backend":"mirror_sd_mlx","context_only_draft_cache":1,"draft_sink":48,"paired_control_tok_s":98.3833028477824,"paired_delta_tok_s":-0.3704910705696467}}
{"run":585,"commit":"8b55918","metric":99.6418791559394,"metrics":{},"status":"discard","description":"Unchanged baseline monitoring run (context-only sink=48 keep shape).","timestamp":1776278577330,"segment":23,"confidence":1.7298803183762155,"iterationTokens":765,"asi":{"hypothesis":"Repeated unchanged runs will indicate whether the regime is recovering toward historical high-band values.","rollback_reason":"Still below keep at 99.64.","next_action_hint":"Keep monitoring in paired mirror/control bundles; defer additional tuning until variance narrows.","backend":"mirror_sd_mlx","context_only_draft_cache":1,"draft_sink":48,"stability_probe":true}}
{"run":586,"commit":"8b55918","metric":104.97328268842094,"metrics":{},"status":"discard","description":"Paired control run after 99.64 mirror baseline (mirror disabled) with context-only sink=48 settings.","timestamp":1776278624785,"segment":23,"confidence":1.7408820310835085,"iterationTokens":1152,"asi":{"hypothesis":"Control pair will show whether the latest mirror sample reflects backend gain or local dip.","rollback_reason":"Control run is comparison-only; not a mirror keep candidate.","next_action_hint":"This pair strongly favored control (~-5.33 tok/s for mirror); run immediate mirror follow-up to check if this is another transient ordering flip.","backend":"bstnxbt_mlx","mirror_runtime_enabled":0,"context_only_draft_cache":1,"draft_sink":48,"paired_delta_tok_s":-5.331403532481539}}
{"run":587,"commit":"8b55918","metric":102.33054654925004,"metrics":{},"status":"discard","description":"Immediate mirror follow-up after control-leading pair to test ordering persistence.","timestamp":1776278653726,"segment":23,"confidence":1.7562958807045475,"iterationTokens":669,"asi":{"hypothesis":"If control's +5 tok/s lead was transient, immediate mirror rerun should close or reverse the gap.","rollback_reason":"Mirror improved but still trailed paired control (102.33 vs 104.97).","next_action_hint":"Ordering remains unstable but currently control-leaning; continue paired bundles before changing code direction.","backend":"mirror_sd_mlx","context_only_draft_cache":1,"draft_sink":48,"paired_control_tok_s":104.97328268842094,"paired_delta_tok_s":-2.642736139170901}}
{"run":588,"commit":"8b55918","metric":101.50019988561597,"metrics":{},"status":"discard","description":"Re-check context-only cache off in recovered band: DFLASH_BSTNXBT_CONTEXT_ONLY_DRAFT_CACHE=0.","timestamp":1776278693661,"segment":23,"confidence":1.76329413296352,"iterationTokens":817,"asi":{"hypothesis":"Context-only cache advantage might have inverted; retest without it under current higher-band window.","rollback_reason":"Still below keep (101.50 vs 106.86).","next_action_hint":"Keep context-only cache enabled in mirror keep configuration.","backend":"mirror_sd_mlx","context_only_draft_cache":0}}
{"run":589,"commit":"8b55918","metric":105.80733703655588,"metrics":{},"status":"discard","description":"Context-only draft-window sweep extension: DFLASH_DRAFT_WINDOW=512 with sink=48.","timestamp":1776278746148,"segment":23,"confidence":1.798687509513037,"iterationTokens":1062,"asi":{"hypothesis":"A substantially smaller context-only window may cut draft attention cost enough to improve throughput on 1024 lane.","rollback_reason":"Close but still below keep (105.81 vs 106.86).","next_action_hint":"Given proximity to keep, run a confirmation sample for window=512 before final pruning.","backend":"mirror_sd_mlx","context_only_draft_cache":1,"draft_sink":48,"draft_window":512}}
