{"run":1228,"commit":"366dfde","metric":108.12486611624603,"metrics":{},"status":"discard","description":"Mirror sample eased from ~108.30 to ~108.12 within stable high-window.","timestamp":1776318971775,"segment":23,"confidence":3.356814419025732,"iterationTokens":635,"asi":{"hypothesis":"High-window variance remains bounded around ~108.1–108.4.","rollback_reason":"Below keep 108.47.","next_action_hint":"Continue mirror sampling and only reintroduce parity checks if drift widens materially.","backend":"mirror_sd_mlx","context_only_draft_cache":1,"draft_sink":48,"async_draft_eval":1,"fused_draft_verify_eval":1,"delta_vs_keep":-0.34660337814036496}}
{"run":1229,"commit":"366dfde","metric":108.22036254703195,"metrics":{},"status":"discard","description":"Mirror sample rebounded slightly within 108.1–108.3 cluster.","timestamp":1776319009564,"segment":23,"confidence":3.3565965601179153,"iterationTokens":753,"asi":{"hypothesis":"Window remains stable with tight oscillation around low/mid-108.","rollback_reason":"Still below keep.","next_action_hint":"Continue mirror scans for >108.47 breakout.","backend":"mirror_sd_mlx","context_only_draft_cache":1,"draft_sink":48,"async_draft_eval":1,"fused_draft_verify_eval":1,"paired_prev_tok_s":108.12486611624603,"paired_delta_tok_s":0.09549643078592161,"delta_vs_keep":-0.2511069473544434}}
{"run":1230,"commit":"366dfde","metric":108.28830756937678,"metrics":{},"status":"discard","description":"Mirror sample moved toward upper end of current high-window.","timestamp":1776319041219,"segment":23,"confidence":3.3563787294865772,"iterationTokens":647,"asi":{"hypothesis":"Sustained window may still produce edge breakthroughs with continued sampling.","rollback_reason":"~108.29 remains below keep 108.47.","next_action_hint":"Continue mirror scans; no structural changes while window remains productive.","backend":"mirror_sd_mlx","context_only_draft_cache":1,"draft_sink":48,"async_draft_eval":1,"fused_draft_verify_eval":1,"paired_prev_tok_s":108.22036254703195,"paired_delta_tok_s":0.067945022344824,"delta_vs_keep":-0.1831619249996199}}
{"run":1231,"commit":"366dfde","metric":108.34469079699288,"metrics":{},"status":"discard","description":"Mirror sample reached 108.34 but did not exceed current best.","timestamp":1776319071929,"segment":23,"confidence":3.3643207355406637,"iterationTokens":666,"asi":{"hypothesis":"High-window remains active and near-best repeats are possible.","rollback_reason":"Still below keep 108.47.","next_action_hint":"Continue autonomous sampling; trigger parity check if mirror drifts below ~107.8.","backend":"mirror_sd_mlx","context_only_draft_cache":1,"draft_sink":48,"async_draft_eval":1,"fused_draft_verify_eval":1,"paired_prev_tok_s":108.28830756937678,"paired_delta_tok_s":0.05638322761610337,"delta_vs_keep":-0.12677869738351474}}
{"run":1232,"commit":"366dfde","metric":108.27881127688174,"metrics":{},"status":"discard","description":"Mirror continuity sample held in high-108 cluster.","timestamp":1776319107413,"segment":23,"confidence":3.37675373177843,"iterationTokens":791,"asi":{"hypothesis":"Sustained high-window should continue yielding 108.2–108.4 samples.","rollback_reason":"Still below keep 108.47.","next_action_hint":"Continue loop; await either >108.47 breakout or regime shift.","backend":"mirror_sd_mlx","context_only_draft_cache":1,"draft_sink":48,"async_draft_eval":1,"fused_draft_verify_eval":1,"delta_vs_keep":-0.19265821749465678}}
{"run":1233,"commit":"366dfde","metric":108.35422971818095,"metrics":{},"status":"discard","description":"Mirror continuity sample in sustained high-window; remained near 108.35.","timestamp":1776319318985,"segment":23,"confidence":3.3723562875123565,"iterationTokens":791,"asi":{"hypothesis":"Current regime should continue yielding low/mid-108 mirror samples without code changes.","rollback_reason":"108.35 is strong but below keep 108.47.","next_action_hint":"Continue mirror sampling for potential >108.47 breakout, then immediately confirm.","backend":"mirror_sd_mlx","context_only_draft_cache":1,"draft_sink":48,"async_draft_eval":1,"fused_draft_verify_eval":1,"delta_vs_keep":-0.11723977620544743}}
{"run":1234,"commit":"366dfde","metric":108.15404865339868,"metrics":{},"status":"discard","description":"Mirror sample dipped to low-108 while staying in recovered high band.","timestamp":1776319343501,"segment":23,"confidence":3.348793886000879,"iterationTokens":710,"asi":{"hypothesis":"High-window jitter should remain bounded around ~108.1–108.4.","rollback_reason":"Below keep 108.47.","next_action_hint":"Continue mirror scans; trigger parity check if several sub-108.1 samples appear.","backend":"mirror_sd_mlx","context_only_draft_cache":1,"draft_sink":48,"async_draft_eval":1,"fused_draft_verify_eval":1,"paired_prev_tok_s":108.35422971818095,"paired_delta_tok_s":-0.20018106478226352,"delta_vs_keep":-0.31742084098771517}}
{"run":1235,"commit":"366dfde","metric":108.18166638707655,"metrics":{},"status":"discard","description":"Mirror follow-up stabilized around 108.18 after low-108 dip.","timestamp":1776319367454,"segment":23,"confidence":3.3254011754299744,"iterationTokens":677,"asi":{"hypothesis":"Current high-window center may be near ~108.2.","rollback_reason":"Still below keep 108.47.","next_action_hint":"Run one more mirror sample, then do control parity spot-check.","backend":"mirror_sd_mlx","context_only_draft_cache":1,"draft_sink":48,"async_draft_eval":1,"fused_draft_verify_eval":1,"paired_prev_tok_s":108.15404865339868,"paired_delta_tok_s":0.02761773367786788,"delta_vs_keep":-0.28980310730985015}}
{"run":1236,"commit":"366dfde","metric":107.92104173782589,"metrics":{},"status":"discard","description":"Mirror sample dropped below 108, suggesting local downward drift from high-window peak.","timestamp":1776319393260,"segment":23,"confidence":3.3181220834114242,"iterationTokens":667,"asi":{"hypothesis":"Short-term drift could be shared regime noise rather than mirror-specific regression.","rollback_reason":"107.92 is below keep and below recent ~108.2 center.","next_action_hint":"Take immediate control parity sample to test whether drift is shared.","backend":"mirror_sd_mlx","context_only_draft_cache":1,"draft_sink":48,"async_draft_eval":1,"fused_draft_verify_eval":1,"paired_prev_tok_s":108.18166638707655,"paired_delta_tok_s":-0.2606246492506541,"delta_vs_keep":-0.5504277565605139}}
{"run":1237,"commit":"366dfde","metric":107.8444540129728,"metrics":{},"status":"discard","description":"Control parity check after mirror dip (`DFLASH_MIRROR_SD_RUNTIME=0`) confirmed shared sub-108 drift.","timestamp":1776319421916,"segment":23,"confidence":3.2926919797516465,"iterationTokens":843,"asi":{"hypothesis":"If drift is shared, control should also land below prior 108.2 center.","rollback_reason":"Control at 107.84 confirms shared shift; parity backend remains non-authoritative.","next_action_hint":"Restore mirror runtime and continue monitoring for rebound into >108.2 band.","backend":"bstnxbt_mlx","mirror_runtime_enabled":0,"context_only_draft_cache":1,"draft_sink":48,"async_draft_eval":1,"fused_draft_verify_eval":1,"paired_mirror_tok_s":107.92104173782589,"paired_delta_tok_s":0.07658772485309157,"authoritative_lane":"mirror_sd_mlx","shared_drift":true}}
{"run":1238,"commit":"366dfde","metric":108.2971450500366,"metrics":{},"status":"discard","description":"Mirror re-anchor after control parity drift check; returned to 108.30 high band.","timestamp":1776319560717,"segment":23,"confidence":3.2858967943557924,"iterationTokens":19056,"asi":{"hypothesis":"Sub-108 dip was transient shared noise; mirror should rebound near 108.2+.","rollback_reason":"Still below keep 108.47.","next_action_hint":"Proceed with one structural major-bet probe while high-window is stable.","backend":"mirror_sd_mlx","context_only_draft_cache":1,"draft_sink":48,"async_draft_eval":1,"fused_draft_verify_eval":1,"paired_control_tok_s":107.8444540129728,"paired_delta_tok_s":0.4526910370638086,"delta_vs_keep":-0.17432444434979985,"recovered_high_band":true}}
{"run":1239,"commit":"366dfde","metric":108.41933247524297,"metrics":{},"status":"discard","description":"Major-bet probe: env-gated split-SDPA exact-KV threshold override (`DFLASH_BSTNXBT_SPLIT_EXACT_KV_THRESHOLD=1088`) to delay split activation near 1024 lane tail.","timestamp":1776319632440,"segment":23,"confidence":3.269882003901709,"iterationTokens":3322,"asi":{"hypothesis":"Slightly delaying split-SDPA activation from 1024→1088 may trim tail overhead and improve 1024-token throughput.","rollback_reason":"Result 108.42 is near-best but still below keep 108.47; no primary improvement.","next_action_hint":"Revert this threshold override and return to baseline shape; consider only one further split-threshold variant if high-window persists.","backend":"mirror_sd_mlx","split_sdpa":1,"split_exact_kv_threshold":1088,"context_only_draft_cache":1,"draft_sink":48,"async_draft_eval":1,"fused_draft_verify_eval":1,"delta_vs_keep":-0.05213701914342612,"major_bet":true}}
{"run":1240,"commit":"366dfde","metric":107.03295537124148,"metrics":{},"status":"discard","description":"Mirror sample dropped sharply out of the 108-high window to ~107.03 after threshold probe rollback.","timestamp":1776319672572,"segment":23,"confidence":3.2756934168534557,"iterationTokens":1913,"asi":{"hypothesis":"This is likely another shared regime shift rather than a code-effect, since baseline shape was restored.","rollback_reason":"Large drop below keep and below recent 108.2–108.4 cluster.","next_action_hint":"Take immediate control parity sample to confirm whether the downturn is shared.","backend":"mirror_sd_mlx","context_only_draft_cache":1,"draft_sink":48,"async_draft_eval":1,"fused_draft_verify_eval":1,"delta_vs_keep":-1.43851412293391,"regime_shift_hint":true}}
{"run":1241,"commit":"366dfde","metric":106.99879716413817,"metrics":{},"status":"discard","description":"Control parity check after mirror downturn (`DFLASH_MIRROR_SD_RUNTIME=0`) showed same low-107 regime.","timestamp":1776319704538,"segment":23,"confidence":3.2807652584946667,"iterationTokens":804,"asi":{"hypothesis":"If downturn is shared, control should also drop to ~107.","rollback_reason":"Control ~106.999 matches mirror ~107.03; parity backend remains non-authoritative.","next_action_hint":"Restore mirror runtime and continue recovery monitoring; defer structural bets until >108 window returns.","backend":"bstnxbt_mlx","mirror_runtime_enabled":0,"context_only_draft_cache":1,"draft_sink":48,"async_draft_eval":1,"fused_draft_verify_eval":1,"paired_mirror_tok_s":107.03295537124148,"paired_delta_tok_s":0.03415820710331421,"authoritative_lane":"mirror_sd_mlx","shared_downshift":true}}
{"run":1242,"commit":"366dfde","metric":106.86102293463128,"metrics":{},"status":"discard","description":"Mirror anchor after parity check held in low-107 regime (~106.86).","timestamp":1776319735967,"segment":23,"confidence":3.283680073086997,"iterationTokens":1142,"asi":{"hypothesis":"Post-shift center may now be around high-106/low-107 for both backends.","rollback_reason":"Below keep by ~1.61 tok/s.","next_action_hint":"Continue recovery sampling; wait for sustained rebound before any new major bet.","backend":"mirror_sd_mlx","context_only_draft_cache":1,"draft_sink":48,"async_draft_eval":1,"fused_draft_verify_eval":1,"paired_control_tok_s":106.99879716413817,"paired_delta_tok_s":-0.13777422950688617,"delta_vs_keep":-1.6104465595441086}}
{"run":1243,"commit":"366dfde","metric":106.86920793883746,"metrics":{},"status":"discard","description":"Mirror continuity sample stayed flat in ~106.87 band.","timestamp":1776319761600,"segment":23,"confidence":3.328745910712038,"iterationTokens":695,"asi":{"hypothesis":"Shared low-107 plateau is currently stable.","rollback_reason":"No improvement; still well below keep.","next_action_hint":"Continue mirror-only monitoring; trigger control parity only if drift >0.5 tok/s emerges.","backend":"mirror_sd_mlx","context_only_draft_cache":1,"draft_sink":48,"async_draft_eval":1,"fused_draft_verify_eval":1,"paired_prev_tok_s":106.86102293463128,"paired_delta_tok_s":0.008185004206175472,"delta_vs_keep":-1.60226155533793,"stable_low_107":true}}
{"run":1244,"commit":"366dfde","metric":106.93393793079554,"metrics":{},"status":"discard","description":"Mirror sample ticked up slightly to ~106.93 but stayed in low-107 regime.","timestamp":1776319786661,"segment":23,"confidence":3.37506594508494,"iterationTokens":676,"asi":{"hypothesis":"Current regime center remains around 106.9–107.0.","rollback_reason":"Still below keep 108.47.","next_action_hint":"Continue recovery scans; if three consecutive >107.5 appear, re-open major-bet testing.","backend":"mirror_sd_mlx","context_only_draft_cache":1,"draft_sink":48,"async_draft_eval":1,"fused_draft_verify_eval":1,"paired_prev_tok_s":106.86920793883746,"paired_delta_tok_s":0.06472999195807722,"delta_vs_keep":-1.5375315633798476}}
{"run":1245,"commit":"366dfde","metric":45.98975304279534,"metrics":{},"status":"discard","description":"Severe collapse on unchanged mirror keep shape (throughput fell to ~46 tok/s).","timestamp":1776319845667,"segment":23,"confidence":3.328745910712038,"iterationTokens":1201,"asi":{"hypothesis":"Abrupt collapse is likely regime instability, not a deterministic code change.","rollback_reason":"Catastrophic drop far below keep and recent low-107 plateau.","next_action_hint":"Run immediate control parity sample to confirm shared collapse, then continue recovery tracking.","backend":"mirror_sd_mlx","context_only_draft_cache":1,"draft_sink":48,"async_draft_eval":1,"fused_draft_verify_eval":1,"request_s":22.265829500043765,"delta_vs_keep":-62.48171645138005,"collapse_wave":true}}
{"run":1246,"commit":"366dfde","metric":59.24674147201837,"metrics":{},"status":"discard","description":"Control parity after mirror collapse (`DFLASH_MIRROR_SD_RUNTIME=0`) also degraded sharply, confirming shared collapse.","timestamp":1776319882147,"segment":23,"confidence":3.283680073086997,"iterationTokens":785,"asi":{"hypothesis":"Collapse should affect both mirror and control if driven by shared runtime regime.","rollback_reason":"Control improved over mirror but still catastrophically low vs normal band; parity backend non-authoritative.","next_action_hint":"Restore mirror runtime and run recovery-only sampling until throughput re-enters >=100 then >=107 bands.","backend":"bstnxbt_mlx","mirror_runtime_enabled":0,"context_only_draft_cache":1,"draft_sink":48,"async_draft_eval":1,"fused_draft_verify_eval":1,"paired_mirror_tok_s":45.98975304279534,"paired_delta_tok_s":-13.25698842922303,"authoritative_lane":"mirror_sd_mlx","shared_collapse":true}}
{"run":1247,"commit":"366dfde","metric":71.45110673720386,"metrics":{},"status":"discard","description":"Mirror recovery sample after shared collapse improved to ~71.45 but remains deeply degraded.","timestamp":1776319916706,"segment":23,"confidence":3.2807652584946667,"iterationTokens":1127,"asi":{"hypothesis":"Post-collapse recovery should climb in staged bands (60→70→80...).","rollback_reason":"Still far below keep and below prior 106/108 regimes.","next_action_hint":"Continue recovery-only mirror sampling; defer all structural changes until stable high band returns.","backend":"mirror_sd_mlx","context_only_draft_cache":1,"draft_sink":48,"async_draft_eval":1,"fused_draft_verify_eval":1,"request_s":14.331478499923833,"delta_vs_keep":-37.02036275757966,"recovery_phase":true}}
{"run":1248,"commit":"366dfde","metric":82.74886169827751,"metrics":{},"status":"discard","description":"Mirror recovery advanced to ~82.75 tok/s after collapse, continuing staged rebound.","timestamp":1776319957895,"segment":23,"confidence":3.2756934168534557,"iterationTokens":1101,"asi":{"hypothesis":"Recovery wave should continue climbing after 71 band if collapse is transient.","rollback_reason":"Still far below keep and below pre-collapse 107+ plateaus.","next_action_hint":"Keep recovery sampling; add parity check once mirror reaches ~90+ to verify shared climb.","backend":"mirror_sd_mlx","context_only_draft_cache":1,"draft_sink":48,"async_draft_eval":1,"fused_draft_verify_eval":1,"request_s":12.374792583053932,"delta_vs_keep":-25.722607796505994,"recovery_phase":true}}
{"run":1249,"commit":"366dfde","metric":88.43524563408947,"metrics":{},"status":"discard","description":"Mirror recovery continued to ~88.44 tok/s, approaching pre-collapse lower bands.","timestamp":1776319988420,"segment":23,"confidence":3.269882003901709,"iterationTokens":684,"asi":{"hypothesis":"Recovery staircase remains active; next band should cross 90 if regime normalizes.","rollback_reason":"Still below keep and below low-107 plateau.","next_action_hint":"Run next mirror sample; if >90 appears, perform control parity check.","backend":"mirror_sd_mlx","context_only_draft_cache":1,"draft_sink":48,"async_draft_eval":1,"fused_draft_verify_eval":1,"request_s":11.579093749984168,"delta_vs_keep":-20.036223860694033,"recovery_phase":true}}
{"run":1250,"commit":"366dfde","metric":93.15296696193938,"metrics":{},"status":"discard","description":"Mirror recovery reached ~93.15 tok/s, crossing back into low-90 band.","timestamp":1776320018221,"segment":23,"confidence":3.253072615478117,"iterationTokens":666,"asi":{"hypothesis":"Collapse recovery is continuing upward and may soon re-enter 100+ regime.","rollback_reason":"Still below keep and historical 106/108 windows.","next_action_hint":"Take control parity sample now to validate shared recovery trajectory.","backend":"mirror_sd_mlx","context_only_draft_cache":1,"draft_sink":48,"async_draft_eval":1,"fused_draft_verify_eval":1,"request_s":10.992671875050291,"delta_vs_keep":-15.318502532844125,"recovery_phase":true}}
{"run":1251,"commit":"366dfde","metric":94.46708628089004,"metrics":{},"status":"discard","description":"Control parity in recovery band (`DFLASH_MIRROR_SD_RUNTIME=0`) matched mirror low-90 resurgence.","timestamp":1776320050440,"segment":23,"confidence":3.2469127770300186,"iterationTokens":761,"asi":{"hypothesis":"Recovery climb should be shared across backends if collapse is environmental.","rollback_reason":"Control remained below high-window/keep; parity backend non-authoritative.","next_action_hint":"Restore mirror runtime and continue recovery scans toward 100+ and 107+ re-entry.","backend":"bstnxbt_mlx","mirror_runtime_enabled":0,"context_only_draft_cache":1,"draft_sink":48,"async_draft_eval":1,"fused_draft_verify_eval":1,"paired_mirror_tok_s":93.15296696193938,"paired_delta_tok_s":-1.3141193189506637,"authoritative_lane":"mirror_sd_mlx","shared_recovery":true}}
{"run":1252,"commit":"366dfde","metric":97.06412576789273,"metrics":{},"status":"discard","description":"Mirror anchor after control parity climbed into high-90 recovery band.","timestamp":1776320084865,"segment":23,"confidence":3.2230244882151835,"iterationTokens":741,"asi":{"hypothesis":"Recovery trajectory is continuing toward 100+ after low-90 parity confirmation.","rollback_reason":"Still below keep and far from 107/108 operating bands.","next_action_hint":"Continue mirror-only recovery sampling until stable 100+ then reassess.","backend":"mirror_sd_mlx","context_only_draft_cache":1,"draft_sink":48,"async_draft_eval":1,"fused_draft_verify_eval":1,"paired_control_tok_s":94.46708628089004,"paired_delta_tok_s":2.5970394870026925,"delta_vs_keep":-11.407343726890774,"recovery_phase":true}}
{"run":1253,"commit":"366dfde","metric":100.5975492855724,"metrics":{},"status":"discard","description":"Mirror recovery crossed back above 100 tok/s after collapse wave.","timestamp":1776320131700,"segment":23,"confidence":3.234755075149149,"iterationTokens":1129,"asi":{"hypothesis":"Recovery staircase should re-enter 100+ before potentially returning to 107+ regime.","rollback_reason":"Improved recovery but still below keep by ~7.87 tok/s.","next_action_hint":"Continue mirror sampling to test whether 100+ consolidates or quickly reverts.","backend":"mirror_sd_mlx","context_only_draft_cache":1,"draft_sink":48,"async_draft_eval":1,"fused_draft_verify_eval":1,"request_s":10.179174416000023,"delta_vs_keep":-7.873920209211096,"recovery_phase":true}}
{"run":1254,"commit":"366dfde","metric":102.3997124310463,"metrics":{},"status":"discard","description":"Mirror recovery continued to ~102.40, indicating sustained climb after collapse.","timestamp":1776320157659,"segment":23,"confidence":3.2384388372102264,"iterationTokens":685,"asi":{"hypothesis":"If recovery remains monotonic, next samples should approach mid-100s.","rollback_reason":"Still below keep and below 107+/108 windows.","next_action_hint":"Continue mirror-only recovery loop; run parity check near 104+.","backend":"mirror_sd_mlx","context_only_draft_cache":1,"draft_sink":48,"async_draft_eval":1,"fused_draft_verify_eval":1,"request_s":10.0000280829845,"delta_vs_keep":-6.071757063737192,"recovery_phase":true}}
{"run":1255,"commit":"366dfde","metric":102.62436465213726,"metrics":{},"status":"discard","description":"Mirror recovery held around ~102.6, maintaining post-collapse 100+ band.","timestamp":1776320185827,"segment":23,"confidence":3.2663178047198063,"iterationTokens":664,"asi":{"hypothesis":"Recovery has stabilized above 100 and may continue toward 104+.","rollback_reason":"Still below keep 108.47.","next_action_hint":"Continue mirror sampling; parity check once mirror reaches ~104 to confirm shared progression.","backend":"mirror_sd_mlx","context_only_draft_cache":1,"draft_sink":48,"async_draft_eval":1,"fused_draft_verify_eval":1,"request_s":9.978137291967869,"delta_vs_keep":-5.84710484264623,"recovery_phase":true}}
