{"run":316,"commit":"e9874e2","metric":104.78894875667702,"metrics":{},"status":"discard","description":"Add a no-tool non-stream server fast path that skips sanitize_tool_call_markup for reasoning when no tools were requested, with focused endpoint coverage. Correct but not faster on the authoritative broader lane.","timestamp":1776184281538,"segment":19,"confidence":2.506300760306566,"iterationTokens":26702,"asi":{"hypothesis":"The benchmark uses no tools but still pays reasoning tool-markup sanitization over a large thinking string; skipping that work might improve the current broader 15-token lane.","rollback_reason":"Primary metric stayed below the current best 107.15 tok/s keep.","next_action_hint":"Stop spending authority-lane time on small non-stream server postprocessing trims unless profiling shows otherwise; they are not the main limiter.","learning":"No-tool reasoning sanitization overhead is also not a dominant limiter on the current fast lane."}}
{"run":317,"commit":"e9874e2","metric":105.62804271540054,"metrics":{},"status":"discard","description":"Probe a more shape-matched but distinct reasoning warmup prompt on the broader 15-token authority lane, replacing the tiny default thinking warmup with a polynomial-style reasoning prompt. It did not beat the current best.","timestamp":1776184331976,"segment":19,"confidence":2.452290985125882,"iterationTokens":2740,"asi":{"hypothesis":"The current thinking warmup prompt is much shorter and structurally different from the benchmark request; a distinct but closely shape-matched polynomial reasoning warmup may better prime request-shape-specific compilation and recover throughput.","rollback_reason":"Primary metric stayed below the current best 107.15 tok/s keep.","next_action_hint":"Do not spend more authority-lane time on warmup-prompt retuning without stronger evidence; generic shape matching alone is not the missing lever now.","learning":"On the current broader 15-token winner, a more benchmark-like reasoning warmup prompt does not materially improve throughput."}}
{"run":318,"commit":"e9874e2","metric":105.09100583085338,"metrics":{},"status":"discard","description":"Probe WARMUP_MAX_TOKENS=16 on the broader 15-token authority lane, motivated by the finding that the exact-small-proj pad-to-16 path is performance-critical even though the winning speculative block size is 15. It did not improve the benchmark.","timestamp":1776184404879,"segment":19,"confidence":2.500439235067838,"iterationTokens":4396,"asi":{"hypothesis":"Because the winning 15-token lane still relies on pad-to-16 behavior internally, a 16-token DFlash warmup might better prime the true hot path than the current block-matched 15-token warmup.","rollback_reason":"Primary metric stayed below the current best 107.15 tok/s keep.","next_action_hint":"Do not spend more time on 15-vs-16 warmup token nudges for the authority lane; the internal pad-to-16 win does not translate into a better 16-token warmup setting.","learning":"The current broader 15-token winner is not materially under-warmed by using a 15-token DFlash warmup instead of 16."}}
{"run":319,"commit":"e9874e2","metric":103.636908660802,"metrics":{},"status":"discard","description":"Clean rerun of the exact current broader winner to check whether the present fast family would re-hit or exceed the 107.15 keep. It stayed in the high band but below the peak.","timestamp":1776184451722,"segment":19,"confidence":2.6735321716175147,"iterationTokens":1691,"asi":{"hypothesis":"The current broader winner might re-hit or slightly exceed the existing 107.15 tok/s best on a clean rerun, clarifying whether the peak is still live.","rollback_reason":"No primary-metric improvement over the current best 107.15 tok/s keep.","next_action_hint":"Assume the current 15-token fast family is noisy in roughly the 103–107 tok/s band unless a changed configuration clearly exceeds it twice.","learning":"The existing 107.15 keep remains plausible but not trivially reproducible on every rerun; noise management still matters at the current frontier."}}
{"run":320,"commit":"e9874e2","metric":50.173554032581386,"metrics":{},"status":"discard","description":"Re-probe the formerly strong fully explicit 15-token lane by combining explicit request-level DFlash with both request-driven and settings-driven thinking enabled (`BENCHMARK_DFLASH=1`, `ENABLE_THINKING=1`, `SETTINGS_ENABLE_THINKING=1`). On the current tree this collapsed badly, so it is no longer a safe competitor to the broader winner.","timestamp":1776184550978,"segment":19,"confidence":2.4665153895756795,"iterationTokens":1691,"asi":{"hypothesis":"The nearest credible competitor to the broader 107.15 tok/s winner is the fully explicit 15-token lane; rechecking it might reveal a more stable or slightly faster shape on the current tree.","rollback_reason":"Primary metric collapsed to 50.17 tok/s, far below the current best 107.15 tok/s keep.","next_action_hint":"Treat the broader normal-request lane as the only trustworthy authority baseline for now; the formerly strong fully explicit variant is no longer stable on the current tree.","learning":"The 15-token family has shifted again: explicit request-level DFlash plus both settings- and request-driven thinking is now a major cliff instead of a near-tie with the broader winner."}}
{"run":321,"commit":"e9874e2","metric":63.46732076022393,"metrics":{},"status":"discard","description":"Re-probe the broader 15-token lane with settings-driven thinking only (`BENCHMARK_DFLASH=0`, `ENABLE_THINKING=0`, `SETTINGS_ENABLE_THINKING=1`). This had once been effectively tied with the winner, but on the current tree it regressed badly.","timestamp":1776184606677,"segment":19,"confidence":2.310763831115882,"iterationTokens":1527,"asi":{"hypothesis":"Settings-driven thinking only had previously landed near the broader 107 tok/s winner; rechecking it would show whether it remained a viable productized peer or had drifted into a slower path.","rollback_reason":"Primary metric regressed sharply to 63.47 tok/s, far below the current best 107.15 tok/s keep.","next_action_hint":"Treat request-driven thinking on the broader lane as the only trustworthy authority shape for now; do not assume settings-driven thinking remains equivalent without fresh proof.","learning":"The broader 15-token family has also shifted: settings-driven thinking only is no longer near-tied and is now a major cliff on the current tree."}}
{"run":322,"commit":"e9874e2","metric":77.54410523499737,"metrics":{},"status":"discard","description":"Clean rerun of the exact current winner after pruning stale ideas. This time it collapsed well below the historical ~103–107 band, but the server log still showed DFlash requested and runtime path selected, so treat this as a real instability/noise event rather than a silent fallback.","timestamp":1776184666463,"segment":19,"confidence":2.3294282348557402,"iterationTokens":1586,"asi":{"hypothesis":"The exact broader winner would still reproduce in roughly the historical high band once the stale side branches were pruned away.","rollback_reason":"No primary-metric improvement; rerun collapsed to 77.54 tok/s despite DFlash staying on-path.","next_action_hint":"Investigate request-shape/server-state instability around the current winner instead of assuming the 107 tok/s peak is immediately reproducible; check whether repeated clean reruns bounce back before changing code.","learning":"The current broader winner can still hit a much slower ~77 tok/s regime while remaining on the intended DFlash runtime path, so there is real run-to-run instability beyond simple fallback detection."}}
{"run":323,"commit":"e9874e2","metric":80.72865494736678,"metrics":{},"status":"discard","description":"Immediate unchanged rerun of the exact broader winner after the unexpected 77 tok/s dip. It stayed low again, while server logs still showed DFlash requested and runtime path selected, confirming a real instability band rather than a fallback blip.","timestamp":1776184713491,"segment":19,"confidence":2.3792607585850982,"iterationTokens":1191,"asi":{"hypothesis":"If the prior 77 tok/s run was just transient noise, an immediate unchanged rerun of the exact winner should bounce back toward the historical 103–107 tok/s band.","rollback_reason":"No primary-metric improvement; repeated unchanged rerun stayed far below the historical winner band while still using the intended DFlash runtime path.","next_action_hint":"Pivot from micro-tuning to diagnosing why the same authority config now reproducibly lands in a slower ~78–81 tok/s regime despite DFlash being on-path.","learning":"The current broader winner is not just occasionally noisy; back-to-back unchanged reruns can stay in a distinctly slower band while still using the intended DFlash runtime path."}}
{"run":324,"commit":"e9874e2","metric":89.1193100753625,"metrics":{},"status":"discard","description":"Re-probe the simpler explicit-request DFlash shape on the 15-token regime (`BENCHMARK_DFLASH=1`, request-driven thinking only). Under the current instability it is healthier than the broader reruns, but still far below the historical best.","timestamp":1776184766398,"segment":19,"confidence":2.4152239359277075,"iterationTokens":1739,"asi":{"hypothesis":"If the broader normal-request lane has drifted into a slower regime, the simpler explicit request-level DFlash shape might now be the more stable/faster member of the 15-token family.","rollback_reason":"No primary-metric improvement over the current best 107.15 tok/s keep.","next_action_hint":"Treat explicit request-level DFlash as a possible diagnostic fallback shape during the current instability, but not as a keep candidate unless it clearly climbs back into the old high band.","learning":"During the current instability window, the simpler explicit-request DFlash shape performs better than the broader lane (~89 vs ~78–81 tok/s) but still remains well below the historical frontier."}}
{"run":325,"commit":"e9874e2","metric":87.6095914356201,"metrics":{},"status":"discard","description":"Probe whether the current instability shifted the explicit-request local optimum downward by retesting `DFLASH_BLOCK_TOKENS=14` on the explicit DFlash + request-driven thinking lane. It was worse than block 15 under the current regime.","timestamp":1776184802854,"segment":19,"confidence":2.4834503044392537,"iterationTokens":1021,"asi":{"hypothesis":"Since the historical 15-token winner is currently unstable, the neighboring explicit-request point at block 14 might now outperform it on the current tree.","rollback_reason":"Primary metric remained below the current best 107.15 tok/s keep and below the current explicit block-15 diagnostic rerun.","next_action_hint":"Under the current instability, explicit-request block 15 still dominates explicit-request block 14; look elsewhere for the shifted bottleneck.","learning":"The present slowdown is not explained by a simple shift of the explicit-request local optimum from block 15 down to 14."}}
{"run":326,"commit":"e9874e2","metric":88.24057249605725,"metrics":{},"status":"discard","description":"Probe whether the broader request-driven lane's local optimum has shifted downward under the current instability by retesting `DFLASH_BLOCK_TOKENS=13`. It recovered above the recent 77–81 tok/s reruns, but still did not approach the historical best.","timestamp":1776184881241,"segment":19,"confidence":2.506300760306566,"iterationTokens":17085,"asi":{"hypothesis":"The current slowdown may reflect a shifted block-size optimum on the broader request-driven lane, with 13 now outperforming the unstable 15-token setting.","rollback_reason":"Primary metric remained well below the current best 107.15 tok/s keep.","next_action_hint":"Under the current unstable regime, block 13 is healthier than the recent slow block-15 reruns but still not a frontier configuration; continue investigating instability causes rather than simply shifting the block size downward.","learning":"The current broader-lane slowdown is not just the original optimum disappearing entirely: block 13 can outperform today's slow block-15 reruns, but it still does not recover the old 100+ tok/s band."}}
{"run":327,"commit":"e9874e2","metric":94.33157802027668,"metrics":{},"status":"discard","description":"Probe the adjacent broader request-driven authority shape at `DFLASH_BLOCK_TOKENS=14` under the current instability. It beat block 13 and the recent slow block-15 reruns, but still stayed below the historical best.","timestamp":1776184937009,"segment":19,"confidence":2.5627431574858477,"iterationTokens":1305,"asi":{"hypothesis":"If the broader-lane slowdown reflects a shifted local optimum, block 14 may now outperform both unstable block 15 reruns and the fallback block 13 point.","rollback_reason":"Primary metric remained below the current best 107.15 tok/s keep.","next_action_hint":"Under the current slower regime, block 14 looks like the healthiest nearby fallback point, but the real task is still to recover the missing gap back to the old 100+ tok/s band.","learning":"The current slowdown does appear to have a nearby performance ridge: broader-lane block 14 outperforms block 13 and recent block-15 reruns, but does not recover the historical frontier."}}
{"run":328,"commit":"e9874e2","metric":94.67857483536316,"metrics":{},"status":"discard","description":"Immediate unchanged confirmation rerun of broader-lane `DFLASH_BLOCK_TOKENS=14` under the current instability. It repeated almost exactly, confirming this is a stable fallback ridge rather than a one-off spike, but it still does not beat the historical best.","timestamp":1776184984389,"segment":19,"confidence":2.6513122460994527,"iterationTokens":1443,"asi":{"hypothesis":"If broader-lane block 14 is a real shifted local optimum under the current slowdown, an immediate rerun should reproduce near the first sample.","rollback_reason":"Primary metric remained below the current best 107.15 tok/s keep.","next_action_hint":"Treat broader-lane block 14 as a stable diagnostic fallback point during the present instability, but keep searching for the cause of the missing gap back to the old frontier.","learning":"Under the current slower regime, broader-lane block 14 is reproducibly around 94.3–94.7 tok/s and is much more stable than recent block-15 reruns."}}
{"run":329,"commit":"e9874e2","metric":79.89096314054268,"metrics":{},"status":"discard","description":"Remove the explicit block override and re-test the broader request-driven authority lane on the runtime's default normal-EOS thinking block size. It did not recover the current slowdown.","timestamp":1776185038404,"segment":19,"confidence":2.7201224916224906,"iterationTokens":1287,"asi":{"hypothesis":"If the current instability is tied to the explicit block-15 override, removing the override and falling back to the runtime's normal-EOS thinking default may restore the old lane more cleanly.","rollback_reason":"Primary metric remained far below the current best 107.15 tok/s keep.","next_action_hint":"The explicit block-15 override is not the sole source of the current slowdown; continue diagnosing the changed regime rather than simply reverting to the generic runtime default.","learning":"Under the current regime, the old runtime default is also slow (~79.9 tok/s), so the instability is not specific to the explicit block-15 override."}}
{"run":330,"commit":"e9874e2","metric":93.1301669870318,"metrics":{},"status":"discard","description":"Probe whether the current stable fallback ridge (block 14) benefits from reintroducing explicit request-level `dflash=true` on top of the broader request-driven lane. It remained slightly worse than the broader block-14 shape.","timestamp":1776185081224,"segment":19,"confidence":2.869126822474359,"iterationTokens":988,"asi":{"hypothesis":"Even though explicit request-level DFlash is not part of the current best broader lane, it might help the current stable fallback ridge at block 14 under the slowdown regime.","rollback_reason":"Primary metric remained below the current best 107.15 tok/s keep and below the broader block-14 fallback sample.","next_action_hint":"Keep the current fallback interpretation simple: broader request-driven block 14 is stronger than the same point with explicit request-level DFlash.","learning":"Under the current slower regime, explicit request-level DFlash does not improve the stable broader block-14 fallback ridge."}}
{"run":331,"commit":"e9874e2","metric":99.28148620404485,"metrics":{},"status":"discard","description":"Probe `INITIAL_CACHE_BLOCKS=64` on the broader request-driven block-15 authority lane to see whether a larger initial cache reservation restores the current slowdown. It lifted the current slow regime substantially, but still did not beat the historical best.","timestamp":1776185152179,"segment":19,"confidence":2.9098450360933685,"iterationTokens":5619,"asi":{"hypothesis":"The current instability may be tied to the server starting with too few initial cache blocks; raising `INITIAL_CACHE_BLOCKS` from 16 to 64 may reduce early cache-management overhead and restore the broader winner.","rollback_reason":"Primary metric improved relative to recent slow reruns but remained below the current best 107.15 tok/s keep.","next_action_hint":"This is a promising instability lever. Continue bracketing larger `INITIAL_CACHE_BLOCKS` values on the same honest authority lane.","learning":"Unlike recent warmup/postprocessing tweaks, larger initial cache reservation materially helps the current slowed regime: `INITIAL_CACHE_BLOCKS=64` raised throughput to ~99.28 tok/s from the recent ~77–81 tok/s band."}}
{"run":332,"commit":"e9874e2","metric":102.84705128356451,"metrics":{},"status":"discard","description":"Continue the cache-reservation bracket on the broader request-driven block-15 authority lane with `INITIAL_CACHE_BLOCKS=128`. It improved further over the 64-block probe, but still did not beat the historical best.","timestamp":1776185198421,"segment":19,"confidence":2.869126822474359,"iterationTokens":1468,"asi":{"hypothesis":"If the current slowdown is tied to too-small initial cache reservation, raising `INITIAL_CACHE_BLOCKS` further from 64 to 128 should continue restoring the missing throughput.","rollback_reason":"Primary metric improved again but remained below the current best 107.15 tok/s keep.","next_action_hint":"Keep bracketing `INITIAL_CACHE_BLOCKS` upward; this is the first live lever that is consistently clawing back the slowed regime without cheating the benchmark.","learning":"`INITIAL_CACHE_BLOCKS` is now the most promising active lever: 128 blocks improved the slowed broader winner further to ~102.85 tok/s, above the 64-block result (~99.28 tok/s)."}}
{"run":333,"commit":"e9874e2","metric":103.87501570787803,"metrics":{},"status":"discard","description":"Continue the cache-reservation bracket on the broader request-driven block-15 authority lane with `INITIAL_CACHE_BLOCKS=256`. It improved slightly again over 128 blocks, but still did not beat the historical best.","timestamp":1776185232304,"segment":19,"confidence":2.7827152657795584,"iterationTokens":882,"asi":{"hypothesis":"If the current slowdown is due to under-provisioned initial cache blocks, moving from 128 to 256 should continue recovering throughput on the honest authority lane.","rollback_reason":"Primary metric improved again but remained below the current best 107.15 tok/s keep.","next_action_hint":"Continue the bracket upward once more; the improvement has not yet turned over, so the optimum may still lie above 256.","learning":"The cache-reservation lever continues to help: `INITIAL_CACHE_BLOCKS=256` reached ~103.88 tok/s, slightly above the 128-block result (~102.85 tok/s)."}}
{"run":334,"commit":"e9874e2","metric":103.43323335587628,"metrics":{},"status":"discard","description":"Continue the cache-reservation bracket on the broader request-driven block-15 authority lane with `INITIAL_CACHE_BLOCKS=512`. It remained strong but slipped slightly below the 256-block point, suggesting the benefit is starting to turn over.","timestamp":1776185269510,"segment":19,"confidence":2.7791188398904736,"iterationTokens":854,"asi":{"hypothesis":"If the current slowdown is still caused by too-small initial cache reservation, pushing `INITIAL_CACHE_BLOCKS` up to 512 may recover the remaining gap after the 256-block improvement.","rollback_reason":"Primary metric remained below the current best 107.15 tok/s keep and slipped slightly below the 256-block probe.","next_action_hint":"Narrow the search around the 256 region rather than continuing upward blindly; the cache-reservation benefit appears to peak somewhere below 512.","learning":"`INITIAL_CACHE_BLOCKS` is a real lever, but bigger is not always better: 512 blocks (~103.43 tok/s) underperformed 256 blocks (~103.88 tok/s) on the current slowed authority lane."}}
{"run":335,"commit":"e9874e2","metric":101.17554738207373,"metrics":{},"status":"discard","description":"Narrow the promising cache-reservation bracket by testing `INITIAL_CACHE_BLOCKS=192` on the broader request-driven block-15 authority lane. It stayed strong but was worse than the 256-block point.","timestamp":1776185313182,"segment":19,"confidence":2.9125720291750485,"iterationTokens":959,"asi":{"hypothesis":"If the cache-reservation benefit peaks near 256 but not exactly at it, a slightly smaller value like 192 may recover even more throughput on the current slowed regime.","rollback_reason":"Primary metric remained below the current best 107.15 tok/s keep and below the 256-block probe.","next_action_hint":"Explore the upper side of the local peak next; 192 is clearly not better than 256.","learning":"The local cache-reservation optimum is not below 256 on the current slowed authority lane: 192 blocks (~101.18 tok/s) underperformed 256 blocks (~103.88 tok/s)."}}
