{"run":2393,"commit":"26f9501","metric":29.245132125321405,"metrics":{},"status":"discard","description":"Disabling tree-aware linear commit path (DDTREE_TREE_AWARE_LINEAR=0) caused catastrophic DDTree collapse (~29 tok/s) with cycle explosion (360) and severe tree-build inflation.","timestamp":1776477317682,"segment":25,"confidence":6.876843556996689,"iterationTokens":4376,"asi":{"hypothesis":"Turning off tree-aware linear commit might reduce per-cycle overhead enough to improve throughput.","rollback_reason":"Primary metric collapsed catastrophically with strongly degraded acceptance/cycle/build profile.","next_action_hint":"Add DDTREE_TREE_AWARE_LINEAR=0 to do-not-retry and keep tree-aware linear enabled.","diagnostic_findings":{"completion_tok_s":29.245132125321405,"dflash_eval_s":35.0082755,"dflash_ddtree_cycles_completed":360,"dflash_ddtree_avg_acceptance":2.8444444444444446,"dflash_ddtree_tree_build_s":7.057158424}}}
{"run":2394,"commit":"26f9501","metric":78.03238496133696,"metrics":{},"status":"discard","description":"Post-cliff recovery run with default DDTree stayed in degraded window (~78 tok/s, tree_build ~2.61s) despite restored settings, indicating transient regime impact after catastrophic probe.","timestamp":1776477350773,"segment":25,"confidence":6.497387124995946,"iterationTokens":1719,"asi":{"hypothesis":"After reverting the catastrophic tree-aware-linear toggle, DDTree should recover toward the ~103 tok/s band if window remains stable.","rollback_reason":"Primary metric remained heavily degraded; sample is regime recovery monitoring, not variant validation.","next_action_hint":"Run immediate no-DDTree control parity to confirm shared degradation before drawing conclusions from this low sample.","diagnostic_findings":{"completion_tok_s":78.03238496133696,"dflash_eval_s":13.116644417,"dflash_ddtree_tree_build_s":2.6125418700000003,"dflash_ddtree_cycles_completed":98,"dflash_ddtree_avg_acceptance":10.448979591836734}}}
{"run":2395,"commit":"26f9501","metric":60.05451310819008,"metrics":{},"status":"discard","description":"Immediate control parity after catastrophic DDTree probe also collapsed (~60 tok/s) with safe mode active and unfused-dominant execution, confirming shared transition instability.","timestamp":1776477386109,"segment":25,"confidence":6.066005130832455,"iterationTokens":1691,"asi":{"hypothesis":"If the post-probe DDTree degradation is regime-driven, immediate no-DDTree control should also show severe collapse telemetry.","rollback_reason":"Primary metric remained deeply degraded in shared collapse window; diagnostic-only run.","next_action_hint":"Pause new optimization probes and run passive recovery sampling until healthy fused-only high window returns.","diagnostic_findings":{"completion_tok_s":60.05451310819008,"dflash_eval_s":13.50980753917247,"safe_mode_active":1,"safe_mode_step":11,"verify_eval_wait_fused_steps":11,"verify_eval_wait_unfused_steps":93}}}
{"run":2396,"commit":"26f9501","metric":54.862193730252855,"metrics":{},"status":"discard","description":"Follow-up control sample deepened into severe shared collapse (~54.9 tok/s) with early safe mode and heavily unfused execution.","timestamp":1776477424483,"segment":25,"confidence":5.619058695550896,"iterationTokens":4264,"asi":{"hypothesis":"If collapse transition is active, adjacent control runs should remain degraded and show early safe-mode triggers plus unfused-dominant waits.","rollback_reason":"Primary metric regressed further in shared instability wave; monitoring-only run.","next_action_hint":"Continue passive recovery sampling only; defer any new optimization probes until healthy fused-only window returns.","diagnostic_findings":{"completion_tok_s":54.862193730252855,"dflash_eval_s":14.655247172689997,"safe_mode_active":1,"safe_mode_step":6,"verify_eval_wait_fused_steps":6,"verify_eval_wait_unfused_steps":100}}}
{"run":2397,"commit":"26f9501","metric":67.96234375070499,"metrics":{},"status":"discard","description":"Passive control recovery climbed from severe trough to ~68 tok/s, now fused-only with safe mode off but still far below healthy high band.","timestamp":1776477460586,"segment":25,"confidence":5.561228550346746,"iterationTokens":4220,"asi":{"hypothesis":"Collapse recovery should climb in stages, potentially passing through fused-only inflated shelves before full high-window return.","rollback_reason":"No code change; monitoring-only run still in degraded regime.","next_action_hint":"Continue passive recovery sampling and postpone new DDTree probes until control approaches near-floor high band.","diagnostic_findings":{"completion_tok_s":67.96234375070499,"dflash_eval_s":14.301436165696941,"safe_mode_active":0,"verify_eval_wait_fused_steps":96,"verify_eval_wait_unfused_steps":0}}}
{"run":2398,"commit":"26f9501","metric":71.74069361309397,"metrics":{},"status":"discard","description":"Recovery continued to ~71.7 tok/s but remains on degraded fused-only shelf (safe mode off, elevated eval wait) below healthy high window.","timestamp":1776477494672,"segment":25,"confidence":5.504576629972488,"iterationTokens":4098,"asi":{"hypothesis":"After severe collapse, recovery should progress through low/mid fused-only shelves before full ~108 tok/s re-entry.","rollback_reason":"No code changes; monitoring-only run still below healthy baseline.","next_action_hint":"Keep passive sampling until high-window re-entry, then resume DDTree overhead experiments in matched windows.","diagnostic_findings":{"completion_tok_s":71.74069361309397,"dflash_eval_s":13.527475962997414,"safe_mode_active":0,"verify_eval_wait_fused_steps":96,"verify_eval_wait_unfused_steps":0}}}
{"run":2399,"commit":"26f9501","metric":79.15856888998779,"metrics":{},"status":"discard","description":"Recovery climbed to ~79.2 tok/s but remains on degraded fused-only shelf; safe mode remains off yet eval wait still elevated.","timestamp":1776477541010,"segment":25,"confidence":5.425587749094779,"iterationTokens":4656,"asi":{"hypothesis":"Shared collapse rebound should continue upward in steps even after safe mode clears, before full return to ~108 tok/s high band.","rollback_reason":"No code changes; monitoring-only sample still below healthy window.","next_action_hint":"Continue passive monitoring until near-floor re-entry; avoid concluding on optimization variants in this recovery phase.","diagnostic_findings":{"completion_tok_s":79.15856888998779,"dflash_eval_s":12.1909407468047,"safe_mode_active":0,"verify_eval_wait_fused_steps":96,"verify_eval_wait_unfused_steps":0}}}
{"run":2400,"commit":"26f9501","metric":108.22394726391782,"metrics":{},"status":"discard","description":"Control recovered sharply back into high fused-only regime (~108.2 tok/s, eval_s ~8.76) after the collapse ladder.","timestamp":1776477652099,"segment":25,"confidence":5.445421877216685,"iterationTokens":15381,"asi":{"hypothesis":"Passive recovery sampling should eventually return from degraded fused-only shelves to the high near-floor control band.","rollback_reason":"No code changes; run is regime monitoring only.","next_action_hint":"Run immediate DDTree sample in this recovered window before testing new variants.","diagnostic_findings":{"completion_tok_s":108.22394726391782,"dflash_eval_s":8.764951452496462,"safe_mode_active":0,"verify_eval_wait_fused_steps":96,"verify_eval_wait_unfused_steps":0}}}
{"run":2401,"commit":"26f9501","metric":102.97470008140436,"metrics":{},"status":"discard","description":"Matched DDTree sample in recovered high-window regime returned to expected budget-13 band (~103.0 tok/s), preserving ~5.2 tok/s gap vs control.","timestamp":1776477684051,"segment":25,"confidence":5.52340693008464,"iterationTokens":4141,"asi":{"hypothesis":"After control high-window recovery, DDTree should also recover to its ~103 tok/s budget-13 baseline if no code regression occurred.","rollback_reason":"No new code change; parity-monitoring run only.","next_action_hint":"Proceed with new DDTree overhead probes in this stable window, keeping immediate control parity checks.","diagnostic_findings":{"completion_tok_s":102.97470008140436,"dflash_eval_s":9.937679958,"dflash_ddtree_tree_build_s":1.943250582,"dflash_ddtree_cycles_completed":98,"dflash_ddtree_avg_acceptance":10.448979591836734}}}
{"run":2402,"commit":"26f9501","metric":50.02824613111904,"metrics":{},"status":"discard","description":"DDTree exact-commit mode (DDTREE_EXACT_COMMIT=1) was catastrophic (~50.0 tok/s): commit phase exploded (~8.60s), cycles increased (117), and acceptance dropped.","timestamp":1776477745853,"segment":25,"confidence":5.445421877216685,"iterationTokens":3897,"asi":{"hypothesis":"Exact commit replay might improve correctness/consistency without major throughput cost and could potentially help DDTree stability.","rollback_reason":"Primary metric collapsed due extreme commit overhead and worse cycle/acceptance profile.","next_action_hint":"Add DDTREE_EXACT_COMMIT=1 to do-not-retry and keep exact_commit disabled.","diagnostic_findings":{"completion_tok_s":50.02824613111904,"dflash_eval_s":20.461851792,"dflash_ddtree_commit_s":8.596670966,"dflash_ddtree_cycles_completed":117,"dflash_ddtree_avg_acceptance":8.752136752136753}}}
{"run":2403,"commit":"26f9501","metric":102.15961841780316,"metrics":{},"status":"discard","description":"Immediate default-path back-check recovered DDTree to ~102.2 tok/s with exact_commit disabled, confirming prior exact-commit collapse was variant-specific.","timestamp":1776477784134,"segment":25,"confidence":5.52340693008464,"iterationTokens":1911,"asi":{"hypothesis":"If exact-commit was the direct cause of collapse, reverting to default commit mode should restore near-baseline DDTree behavior.","rollback_reason":"No code changes; this run is attribution-only after a bad variant.","next_action_hint":"Record DDTREE_EXACT_COMMIT=1 as do-not-retry and continue with default commit path.","diagnostic_findings":{"completion_tok_s":102.15961841780316,"dflash_eval_s":10.017347292,"dflash_ddtree_commit_s":0.013425957,"dflash_ddtree_cycles_completed":98,"dflash_ddtree_avg_acceptance":10.448979591836734}}}
{"run":2404,"commit":"26f9501","metric":78.07651118810006,"metrics":{},"status":"discard","description":"Control re-collapsed into mixed fused/unfused regime (~78.1 tok/s) with safe mode reactivating late (step ~75), indicating another shared transition wave.","timestamp":1776477822471,"segment":25,"confidence":5.445421877216685,"iterationTokens":1730,"asi":{"hypothesis":"The recovered high window may be fragile and can relapse into shared collapse even on unchanged control settings.","rollback_reason":"No code change; this is regime-monitoring and not attributable to a new optimization.","next_action_hint":"Continue passive control monitoring until a stable high window reappears before evaluating new DDTree variants.","diagnostic_findings":{"completion_tok_s":78.07651118810006,"dflash_eval_s":11.42181970900856,"safe_mode_active":1,"safe_mode_step":75,"verify_eval_wait_fused_steps":75,"verify_eval_wait_unfused_steps":25}}}
{"run":2405,"commit":"26f9501","metric":52.219346222976284,"metrics":{},"status":"discard","description":"Control wave deepened to near-baseline collapse (~52.2 tok/s) with early safe mode (step ~8) and heavily unfused execution.","timestamp":1776477863424,"segment":25,"confidence":5.099908373371004,"iterationTokens":4302,"asi":{"hypothesis":"The current transition wave may deepen before rebound; early safe-mode triggers should reappear in severe trough samples.","rollback_reason":"Primary metric regressed sharply in shared instability regime with no code changes.","next_action_hint":"Remain in passive monitoring mode; resume optimization A/B only after stable high-window re-entry.","diagnostic_findings":{"completion_tok_s":52.219346222976284,"dflash_eval_s":15.485550328856334,"safe_mode_active":1,"safe_mode_step":8,"verify_eval_wait_fused_steps":8,"verify_eval_wait_unfused_steps":96}}}
{"run":2406,"commit":"26f9501","metric":58.061621279651156,"metrics":{},"status":"discard","description":"Control remained in collapse regime (~58.1 tok/s) with early safe-mode activation (step ~9) and predominantly unfused verify waits.","timestamp":1776477986521,"segment":25,"confidence":4.795624679041117,"iterationTokens":4242,"asi":{"hypothesis":"During severe transition waves, repeated control samples should show persistent early safe-mode and mostly unfused execution before recovery.","rollback_reason":"No code changes; monitoring-only run during instability wave.","next_action_hint":"Continue passive control monitoring until stable fused-only high window returns, then resume DDTree A/B.","diagnostic_findings":{"completion_tok_s":58.061621279651156,"dflash_eval_s":13.922709827194922,"safe_mode_active":1,"safe_mode_step":9,"verify_eval_wait_fused_steps":9,"verify_eval_wait_unfused_steps":95}}}
{"run":2407,"commit":"26f9501","metric":107.76151949538404,"metrics":{},"status":"discard","description":"Control sharply rebounded to fused-only high window (~107.8 tok/s, eval_s ~8.80), indicating collapse wave exited and A/B conditions are healthy again.","timestamp":1776478094731,"segment":25,"confidence":4.934689817390486,"iterationTokens":4242,"asi":{"hypothesis":"Passive monitoring should eventually re-enter a healthy fused-only high band after collapse troughs.","rollback_reason":"No code changes; this run was stability gating before DDTree probes.","next_action_hint":"Run immediate matched DDTree baseline and then test a new DDTree overhead lever in this window.","diagnostic_findings":{"completion_tok_s":107.76151949538404,"dflash_eval_s":8.801482581649907,"safe_mode_active":0,"verify_eval_wait_fused_steps":96,"verify_eval_wait_unfused_steps":0}}}
{"run":2408,"commit":"26f9501","metric":102.67433212906147,"metrics":{},"status":"discard","description":"Matched DDTree baseline in recovered high window is back in expected budget-13 band (~102.7 tok/s, tree_build_s ~1.95), preserving ~5.1 tok/s gap vs control.","timestamp":1776478119866,"segment":25,"confidence":5.082061136530693,"iterationTokens":4149,"asi":{"hypothesis":"Stable-window DDTree baseline should return to prior budget-13 unnormalized band before any new probe.","rollback_reason":"No code changes; this is baseline anchoring for upcoming DDTree micro-probes.","next_action_hint":"Test a fresh DDTree lever not yet exhausted (block-size interaction) with immediate control/DDTree parity checks.","diagnostic_findings":{"completion_tok_s":102.67433212906147,"dflash_eval_s":9.967069125,"dflash_ddtree_tree_build_s":1.948531328,"dflash_ddtree_cycles_completed":98,"dflash_ddtree_avg_acceptance":10.448979591836734}}}
{"run":2409,"commit":"26f9501","metric":102.33460222304208,"metrics":{},"status":"discard","description":"DDTree block-size probe (DFLASH_BLOCK_TOKENS=16) was slightly worse than matched default (~102.3 vs ~102.7 tok/s) with no tree-build benefit.","timestamp":1776478148005,"segment":25,"confidence":5.302242410811257,"iterationTokens":1787,"asi":{"hypothesis":"Allowing DDTree block size 16 might reduce cycle count or improve acceptance enough to offset extra per-cycle tree costs.","rollback_reason":"Primary metric regressed and core DDTree timing terms were flat/slightly worse versus baseline.","next_action_hint":"Treat DDTree block-size 16 as non-winning and test the lower side (block-size 14) before closing this branch.","diagnostic_findings":{"completion_tok_s":102.33460222304208,"dflash_ddtree_tree_build_s":1.954263506,"dflash_ddtree_cycles_completed":98,"dflash_ddtree_avg_acceptance":10.448979591836734}}}
{"run":2410,"commit":"26f9501","metric":101.85118423294512,"metrics":{},"status":"discard","description":"DDTree block-size 14 probe regressed further (~101.9 tok/s) versus default block-size 15 baseline (~102.7); tree-build/verify both slightly higher.","timestamp":1776478175843,"segment":25,"confidence":5.54236650347376,"iterationTokens":1707,"asi":{"hypothesis":"Reducing DDTree block size to 14 could lower per-cycle tree cost enough to offset any cycle increase.","rollback_reason":"Primary metric and component timings regressed in matched high-window conditions.","next_action_hint":"Close this branch: keep DDTree block-size at 15; record 14/16 as non-winning for budget-13 path.","diagnostic_findings":{"completion_tok_s":101.85118423294512,"dflash_ddtree_tree_build_s":1.960522294,"dflash_ddtree_tree_verify_s":0.136158044,"dflash_ddtree_cycles_completed":98}}}
{"run":2411,"commit":"26f9501","metric":47.99550089030927,"metrics":{},"status":"discard","description":"Control immediately re-entered severe collapse (~48.0 tok/s) with safe-mode activation (step ~25) and mostly unfused waits, ending the short high-window A/B pocket.","timestamp":1776478215985,"segment":25,"confidence":5.302242410811257,"iterationTokens":1700,"asi":{"hypothesis":"The recovered high window can relapse abruptly; control parity checks after DDTree probes are needed to avoid over-attributing regressions.","rollback_reason":"No code change; shared instability wave resumed.","next_action_hint":"Pause new DDTree probes and return to passive control monitoring until another stable fused-only high window appears.","diagnostic_findings":{"completion_tok_s":47.99550089030927,"dflash_eval_s":17.09644158568699,"safe_mode_active":1,"safe_mode_step":25,"verify_eval_wait_fused_steps":25,"verify_eval_wait_unfused_steps":79}}}
{"run":2412,"commit":"26f9501","metric":37.80205843966574,"metrics":{},"status":"discard","description":"Control collapse intensified (~37.8 tok/s) with severe spike activity (48 events), mixed fused/unfused waits, and large eval inflation (~21.94s).","timestamp":1776478309686,"segment":25,"confidence":5.082061136530693,"iterationTokens":8655,"asi":{"hypothesis":"In severe collapse troughs, control should show high spike counts and extreme verify-wait inflation while acceptance remains broadly stable.","rollback_reason":"No code change; this is shared-regime monitoring.","next_action_hint":"Continue passive monitoring until high-window recovery before any new DDTree tuning.","diagnostic_findings":{"completion_tok_s":37.80205843966574,"dflash_eval_s":21.943583715707064,"safe_mode_active":1,"safe_mode_step":45,"collapse_spike_events":48,"verify_eval_wait_unfused_steps":58}}}
{"run":2413,"commit":"26f9501","metric":39.02361164247598,"metrics":{},"status":"discard","description":"Control remained in deep collapse pocket (~39.0 tok/s) with sustained early safe-mode (step ~23) and unfused-dominant verify waits.","timestamp":1776478351604,"segment":25,"confidence":4.934689817390486,"iterationTokens":4233,"asi":{"hypothesis":"Deep-collapse samples should persist for multiple consecutive runs before rebound, with high spike counts and unfused-heavy execution.","rollback_reason":"No code changes; still shared instability monitoring.","next_action_hint":"Keep passive control sampling; defer DDTree variant testing until safe-mode clears and fused-only high window returns.","diagnostic_findings":{"completion_tok_s":39.02361164247598,"dflash_eval_s":20.96746732899919,"safe_mode_active":1,"safe_mode_step":23,"collapse_spike_events":53,"verify_eval_wait_unfused_steps":81}}}
{"run":2414,"commit":"26f9501","metric":48.78147610160898,"metrics":{},"status":"discard","description":"Control showed partial rebound (~48.8 tok/s) but remained in collapse regime with safe mode active and substantial unfused wait share.","timestamp":1776478393471,"segment":25,"confidence":4.795624679041117,"iterationTokens":4392,"asi":{"hypothesis":"Recovery from deep collapse should first appear as partial tok/s rebound while safe mode and unfused waits remain elevated.","rollback_reason":"No code changes; still regime tracking.","next_action_hint":"Continue monitoring for full high-window re-entry (safe_mode=0, fused-only) before resuming DDTree A/B.","diagnostic_findings":{"completion_tok_s":48.78147610160898,"dflash_eval_s":17.214155117748305,"safe_mode_active":1,"safe_mode_step":45,"verify_eval_wait_fused_steps":45,"verify_eval_wait_unfused_steps":58}}}
{"run":2415,"commit":"26f9501","metric":65.56021025097354,"metrics":{},"status":"discard","description":"Control entered a mid-recovery shelf (~65.6 tok/s): spike activity dropped, safe mode shifted late (step ~63), but unfused share remained non-zero.","timestamp":1776478423963,"segment":25,"confidence":4.733201409651859,"iterationTokens":4222,"asi":{"hypothesis":"As collapse eases, safe-mode should trigger later with reduced spike counts before full fused-only recovery.","rollback_reason":"No code changes; monitoring-only sample.","next_action_hint":"Continue control sampling; wait for safe_mode=0 and unfused=0 before restarting DDTree variant exploration.","diagnostic_findings":{"completion_tok_s":65.56021025097354,"dflash_eval_s":13.389140706392936,"safe_mode_active":1,"safe_mode_step":63,"collapse_spike_events":2,"verify_eval_wait_fused_steps":63,"verify_eval_wait_unfused_steps":39}}}
{"run":2416,"commit":"26f9501","metric":47.455708878073644,"metrics":{},"status":"discard","description":"Recovery failed to hold; control slipped back to ~47.5 tok/s with safe mode still active and unfused-heavy verify waits.","timestamp":1776478462063,"segment":25,"confidence":4.672382350267365,"iterationTokens":4250,"asi":{"hypothesis":"During unstable recovery, mid-shelf improvements can relapse quickly before reaching fused-only stability.","rollback_reason":"No code changes; this run reflects ongoing shared collapse oscillation.","next_action_hint":"Keep passive control loop; avoid promoting DDTree conclusions until stable high-window re-entry is observed again.","diagnostic_findings":{"completion_tok_s":47.455708878073644,"dflash_eval_s":17.33719813346397,"safe_mode_active":1,"safe_mode_step":27,"verify_eval_wait_fused_steps":27,"verify_eval_wait_unfused_steps":77}}}
