{"run":1873,"commit":"c50119f","metric":8.751157452934422,"metrics":{},"status":"discard","description":"Another near-best high-window sample (~108.39 tok/s, eval_s ~8.751) with watchdog inactive; still above current best.","timestamp":1776385539294,"segment":24,"confidence":0.08590206844181725,"iterationTokens":1517,"asi":{"hypothesis":"Stable high-window has narrow jitter around the new floor.","rollback_reason":"Primary metric above best floor.","next_action_hint":"Keep looping unchanged and wait for either lower floor or transition onset.","diagnostic_findings":{"completion_tok_s":108.39356720197162,"dflash_eval_s":8.751157452934422,"safe_mode_activations":0}}}
{"run":1874,"commit":"c50119f","metric":12.785413213074207,"metrics":{},"status":"discard","description":"New degradation edge entered (~67.60 tok/s, eval_s ~12.79); safe mode activated late at step 57 with low spike count.","timestamp":1776385571167,"segment":24,"confidence":0.08506372083232924,"iterationTokens":1433,"asi":{"hypothesis":"This is a fresh collapse transition from high window into degraded band.","rollback_reason":"Primary metric significantly above best floor.","next_action_hint":"Run immediate control parity check to confirm shared attribution at this transition edge.","diagnostic_findings":{"completion_tok_s":67.60475303662635,"dflash_eval_s":12.785413213074207,"safe_mode_activations":1,"safe_mode_step":57,"severe_spike_events":2}}}
{"run":1875,"commit":"c50119f","metric":20.64462645619642,"metrics":{},"status":"discard","description":"Transition control parity also collapsed hard (~40.56 tok/s, eval_s ~20.64), confirming shared instability at this edge.","timestamp":1776385611941,"segment":24,"confidence":0.08439258658467265,"iterationTokens":1552,"asi":{"hypothesis":"This degraded window is shared runtime-state behavior rather than mirror-only.","rollback_reason":"Parity diagnostic run on non-authoritative lane; metric far above best.","next_action_hint":"Resume mirror loop unchanged and monitor rebound ladder.","parity_check":{"lane":"control_DFLASH_MIRROR_SD_RUNTIME=0","completion_tok_s":40.55520491371928,"dflash_eval_s":20.64462645619642,"safe_mode_step":47,"severe_spike_events":58}}}
{"run":1876,"commit":"c50119f","metric":26.545178080326878,"metrics":{},"status":"discard","description":"Mirror lane deepened into severe collapse (~30.78 tok/s, eval_s ~26.55) with early safe-mode activation at step 19.","timestamp":1776385660671,"segment":24,"confidence":0.08399624739247298,"iterationTokens":1454,"asi":{"hypothesis":"Shared collapse episode intensified after transition edge.","rollback_reason":"Primary metric catastrophically above best.","next_action_hint":"Continue unchanged mirror loop to map rebound ladder; parity already confirmed shared attribution in-window.","diagnostic_findings":{"completion_tok_s":30.777567478163096,"dflash_eval_s":26.545178080326878,"safe_mode_step":19,"severe_spike_events":88}}}
{"run":1877,"commit":"c50119f","metric":17.60980891645886,"metrics":{},"status":"discard","description":"Partial rebound from severe trough (~47.20 tok/s, eval_s ~17.61); safe mode activation moved later to step 34.","timestamp":1776385698335,"segment":24,"confidence":0.08360361351329229,"iterationTokens":1437,"asi":{"hypothesis":"Recovery ladder is underway with decreasing collapse intensity.","rollback_reason":"Primary metric still far above best floor.","next_action_hint":"Continue mirror loop to track activation step migration and eventual return to activation-free samples.","diagnostic_findings":{"completion_tok_s":47.201358817411574,"dflash_eval_s":17.60980891645886,"safe_mode_step":34,"severe_spike_events":10}}}
{"run":1878,"commit":"c50119f","metric":13.462312086368911,"metrics":{},"status":"discard","description":"Rebound continued (~63.83 tok/s, eval_s ~13.46) with late safe-mode activation at step 56 and reduced spike count.","timestamp":1776385730335,"segment":24,"confidence":0.08212623997475664,"iterationTokens":1438,"asi":{"hypothesis":"As recovery proceeds, activation drifts later and spike density declines.","rollback_reason":"Primary metric still above best floor.","next_action_hint":"Continue unchanged loop to reach activation-free soft/high band.","diagnostic_findings":{"completion_tok_s":63.829999436265375,"dflash_eval_s":13.462312086368911,"safe_mode_step":56,"severe_spike_events":7}}}
{"run":1879,"commit":"c50119f","metric":11.437852085917257,"metrics":{},"status":"discard","description":"Further rebound (~78.31 tok/s, eval_s ~11.44); safe-mode activation pushed very late to step 74.","timestamp":1776385759725,"segment":24,"confidence":0.08056207970648036,"iterationTokens":1432,"asi":{"hypothesis":"Recovery is approaching activation-free mode as trigger moves to request tail.","rollback_reason":"Primary metric still above best floor.","next_action_hint":"Continue loop until safe-mode activations disappear and high-soft window reopens.","diagnostic_findings":{"completion_tok_s":78.31155145506764,"dflash_eval_s":11.437852085917257,"safe_mode_step":74,"severe_spike_events":2}}}
{"run":1880,"commit":"c50119f","metric":13.396199408802204,"metrics":{},"status":"discard","description":"Recovery whipsawed (~60.51 tok/s, eval_s ~13.40) with renewed early safe-mode activation at step 10 despite low spike count.","timestamp":1776385795611,"segment":24,"confidence":0.07993254964550857,"iterationTokens":1441,"asi":{"hypothesis":"Current regime remains unstable and can re-trigger early activation before full recovery.","rollback_reason":"Primary metric above best floor.","next_action_hint":"Continue unchanged loop; do not retune thresholds during active whipsaw.","diagnostic_findings":{"completion_tok_s":60.507734641585074,"dflash_eval_s":13.396199408802204,"safe_mode_step":10,"severe_spike_events":2}}}
{"run":1881,"commit":"c50119f","metric":13.28010991611518,"metrics":{},"status":"discard","description":"Mid-band degraded sample (~73.08 tok/s, eval_s ~13.28) without watchdog activation; slowdown stayed below severe trigger thresholds.","timestamp":1776385827032,"segment":24,"confidence":0.07917939143303572,"iterationTokens":1447,"asi":{"hypothesis":"Some degraded states are broad/medium latency inflation rather than sharp spikes.","rollback_reason":"Primary metric above best floor.","next_action_hint":"Continue loop to observe whether this medium-band state recovers or re-collapses.","diagnostic_findings":{"completion_tok_s":73.08244971620937,"dflash_eval_s":13.28010991611518,"safe_mode_activations":0,"eval_step_max_s":0.17142516700550914}}}
{"run":1882,"commit":"c50119f","metric":12.524317159783095,"metrics":{},"status":"discard","description":"Slight rebound (~77.25 tok/s, eval_s ~12.52) in medium-band degraded state, still with no watchdog activation.","timestamp":1776385857845,"segment":24,"confidence":0.07718614028779182,"iterationTokens":1473,"asi":{"hypothesis":"Current degraded pocket may be sustained medium-latency inflation without crossing activation thresholds.","rollback_reason":"Primary metric above best floor.","next_action_hint":"Continue unchanged loop; wait for either high-band reopening or renewed sharp collapse.","diagnostic_findings":{"completion_tok_s":77.25201773227825,"dflash_eval_s":12.524317159783095,"safe_mode_activations":0,"eval_step_max_s":0.15408166695851833}}}
{"run":1883,"commit":"c50119f","metric":11.467264298000373,"metrics":{},"status":"discard","description":"Continued rebound into upper mid-band (~84.08 tok/s, eval_s ~11.47) with no watchdog activation.","timestamp":1776385887160,"segment":24,"confidence":0.07529078050106036,"iterationTokens":1520,"asi":{"hypothesis":"Degraded pocket is easing without spike-trigger conditions.","rollback_reason":"Primary metric above best floor.","next_action_hint":"Keep looping for full recovery back to high-soft band.","diagnostic_findings":{"completion_tok_s":84.07616232717072,"dflash_eval_s":11.467264298000373,"safe_mode_activations":0}}}
{"run":1884,"commit":"c50119f","metric":10.996720206108876,"metrics":{},"status":"discard","description":"Rebound progressed (~87.44 tok/s, eval_s ~11.00) with watchdog inactive and no spike events.","timestamp":1776385914520,"segment":24,"confidence":0.07481960780791719,"iterationTokens":1409,"asi":{"hypothesis":"Regime is climbing toward soft-band recovery without requiring safe mode.","rollback_reason":"Primary metric still above best floor.","next_action_hint":"Continue unchanged loop to test re-entry into ~9 and then high-soft band.","diagnostic_findings":{"completion_tok_s":87.44160788303992,"dflash_eval_s":10.996720206108876,"safe_mode_activations":0}}}
{"run":1885,"commit":"c50119f","metric":10.53308896033559,"metrics":{},"status":"discard","description":"Recovery continued (~91.15 tok/s, eval_s ~10.53) with no collapse spikes and watchdog inactive.","timestamp":1776385940527,"segment":24,"confidence":0.07420064438117652,"iterationTokens":1468,"asi":{"hypothesis":"System is moving from degraded mid-band toward soft-band normal operation.","rollback_reason":"Primary metric above best floor.","next_action_hint":"Continue loop for full high-soft re-entry and potential new floor touch.","diagnostic_findings":{"completion_tok_s":91.15439981273815,"dflash_eval_s":10.53308896033559,"safe_mode_activations":0}}}
{"run":1886,"commit":"c50119f","metric":10.593473922112025,"metrics":{},"status":"discard","description":"Stable mid-soft rebound (~90.51 tok/s, eval_s ~10.59) with watchdog idle.","timestamp":1776385966872,"segment":24,"confidence":0.07335755628656898,"iterationTokens":1417,"asi":{"hypothesis":"Recovery is flattening in ~10.5 eval band before possible return to high-soft.","rollback_reason":"Primary metric above best.","next_action_hint":"Continue unchanged loop for additional recovery samples.","diagnostic_findings":{"completion_tok_s":90.51023198779744,"dflash_eval_s":10.593473922112025,"safe_mode_activations":0}}}
{"run":1887,"commit":"c50119f","metric":10.104744419804774,"metrics":{},"status":"discard","description":"Rebound reached ~94.75 tok/s (eval_s ~10.10) with no spikes/activations.","timestamp":1776385994540,"segment":24,"confidence":0.07263350726121356,"iterationTokens":1411,"asi":{"hypothesis":"System is approaching soft-band but not yet high-window floor.","rollback_reason":"Primary metric above best floor.","next_action_hint":"Continue unchanged loop for high-soft re-entry.","diagnostic_findings":{"completion_tok_s":94.74908300771624,"dflash_eval_s":10.104744419804774,"safe_mode_activations":0}}}
{"run":1888,"commit":"c50119f","metric":10.011683793622069,"metrics":{},"status":"discard","description":"Soft-band rebound improved to ~95.60 tok/s (eval_s ~10.01) with watchdog inactive.","timestamp":1776386020785,"segment":24,"confidence":0.07178488034748114,"iterationTokens":1404,"asi":{"hypothesis":"Recovery is nearing sub-10 eval territory before high-window re-entry.","rollback_reason":"Primary metric still above best floor.","next_action_hint":"Continue unchanged loop; watch for return to ~9 or better.","diagnostic_findings":{"completion_tok_s":95.60262358657124,"dflash_eval_s":10.011683793622069,"safe_mode_activations":0}}}
{"run":1889,"commit":"c50119f","metric":9.89518179523293,"metrics":{},"status":"discard","description":"Crossed into sub-10 eval rebound (~96.64 tok/s, eval_s ~9.90) with no watchdog activation.","timestamp":1776386048847,"segment":24,"confidence":0.07095585459658363,"iterationTokens":1418,"asi":{"hypothesis":"Recovery is entering soft band and may soon reopen high window.","rollback_reason":"Primary metric above best floor.","next_action_hint":"Continue unchanged loop for high-soft re-entry confirmation.","diagnostic_findings":{"completion_tok_s":96.63810707968199,"dflash_eval_s":9.89518179523293,"safe_mode_activations":0}}}
{"run":1890,"commit":"c50119f","metric":9.794995458447374,"metrics":{},"status":"discard","description":"Soft-band improvement continued (~97.59 tok/s, eval_s ~9.79) with watchdog idle.","timestamp":1776386074508,"segment":24,"confidence":0.0695936358286147,"iterationTokens":1415,"asi":{"hypothesis":"Recovery is steadily advancing toward high-soft, still without collapse triggers.","rollback_reason":"Primary metric above best floor.","next_action_hint":"Continue loop for high-window reopening.","diagnostic_findings":{"completion_tok_s":97.58587259569534,"dflash_eval_s":9.794995458447374,"safe_mode_activations":0}}}
{"run":1891,"commit":"c50119f","metric":9.755120952264406,"metrics":{},"status":"discard","description":"Another soft-band gain (~97.97 tok/s, eval_s ~9.76), still below collapse thresholds and no safe-mode activation.","timestamp":1776386102902,"segment":24,"confidence":0.06829391983860726,"iterationTokens":1402,"asi":{"hypothesis":"Recovery is gradual and stable, with eval-step latency now well below severe trigger levels.","rollback_reason":"Primary metric above best floor.","next_action_hint":"Continue unchanged loop toward high-soft re-entry.","diagnostic_findings":{"completion_tok_s":97.96916412280216,"dflash_eval_s":9.755120952264406,"safe_mode_activations":0,"eval_step_max_s":0.1059033329365775}}}
{"run":1892,"commit":"c50119f","metric":9.6815761300968,"metrics":{},"status":"discard","description":"Soft-band recovery continued (~98.67 tok/s, eval_s ~9.68) with watchdog inactive.","timestamp":1776386128860,"segment":24,"confidence":0.06712142656396852,"iterationTokens":1436,"asi":{"hypothesis":"System is steadily recovering but not yet back to high-window floor.","rollback_reason":"Primary metric above best floor.","next_action_hint":"Continue unchanged loop to monitor high-soft re-entry.","diagnostic_findings":{"completion_tok_s":98.66525374973872,"dflash_eval_s":9.6815761300968,"safe_mode_activations":0}}}
{"run":1893,"commit":"c50119f","metric":9.591602713800967,"metrics":{},"status":"discard","description":"Recovery reached ~99.54 tok/s (eval_s ~9.59) with no collapse events.","timestamp":1776386154843,"segment":24,"confidence":0.06592808920251247,"iterationTokens":1405,"asi":{"hypothesis":"Soft-band is tightening and approaching high-window conditions.","rollback_reason":"Primary metric above best floor.","next_action_hint":"Continue unchanged loop for potential return to <=9 eval band.","diagnostic_findings":{"completion_tok_s":99.53701477302228,"dflash_eval_s":9.591602713800967,"safe_mode_activations":0}}}
{"run":1894,"commit":"c50119f","metric":9.629793377011083,"metrics":{},"status":"discard","description":"Soft-band plateau sample (~99.12 tok/s, eval_s ~9.63) with watchdog idle.","timestamp":1776386180780,"segment":24,"confidence":0.06568461486416073,"iterationTokens":1412,"asi":{"hypothesis":"Recovery has reached a stable ~9.6 eval plateau before full high-window return.","rollback_reason":"Primary metric above best floor.","next_action_hint":"Continue unchanged loop.","diagnostic_findings":{"completion_tok_s":99.12100367973937,"dflash_eval_s":9.629793377011083,"safe_mode_activations":0}}}
{"run":1895,"commit":"c50119f","metric":9.646601208951324,"metrics":{},"status":"discard","description":"Another soft-band plateau run (~98.87 tok/s, eval_s ~9.65) with no activation.","timestamp":1776386208544,"segment":24,"confidence":0.06544293222454674,"iterationTokens":1403,"asi":{"hypothesis":"Current recovery is stable but still below historical high-soft throughput.","rollback_reason":"Primary metric above best floor.","next_action_hint":"Continue unchanged loop for transition into high-soft window.","diagnostic_findings":{"completion_tok_s":98.8682486123213,"dflash_eval_s":9.646601208951324,"safe_mode_activations":0}}}
{"run":1896,"commit":"c50119f","metric":9.404243206023239,"metrics":{},"status":"discard","description":"Soft-to-high rebound advanced (~101.41 tok/s, eval_s ~9.40) with watchdog idle.","timestamp":1776386238270,"segment":24,"confidence":0.06608029533175033,"iterationTokens":1408,"asi":{"hypothesis":"Recovery is re-entering low-9 band en route to high-soft.","rollback_reason":"Primary metric above best floor.","next_action_hint":"Continue unchanged loop for high-soft confirmation.","diagnostic_findings":{"completion_tok_s":101.40857149494535,"dflash_eval_s":9.404243206023239,"safe_mode_activations":0}}}
{"run":1897,"commit":"c50119f","metric":9.370359122287482,"metrics":{},"status":"discard","description":"Low-9 rebound held (~101.64 tok/s, eval_s ~9.37) with no collapse activation.","timestamp":1776386268893,"segment":24,"confidence":0.06673019537786079,"iterationTokens":1414,"asi":{"hypothesis":"Regime is recovering toward high-soft but still above best floor.","rollback_reason":"Primary metric above best.","next_action_hint":"Continue unchanged loop.","diagnostic_findings":{"completion_tok_s":101.64253063928025,"dflash_eval_s":9.370359122287482,"safe_mode_activations":0}}}
{"run":1898,"commit":"c50119f","metric":9.16715891403146,"metrics":{},"status":"discard","description":"Rebound progressed into low-9 band (~103.94 tok/s, eval_s ~9.17) with watchdog inactive.","timestamp":1776386294347,"segment":24,"confidence":0.06814892638551298,"iterationTokens":1407,"asi":{"hypothesis":"High-soft window is reopening gradually after shared collapse cycle.","rollback_reason":"Primary metric above best floor.","next_action_hint":"Continue unchanged loop for near-best re-entry.","diagnostic_findings":{"completion_tok_s":103.94334867853556,"dflash_eval_s":9.16715891403146,"safe_mode_activations":0}}}
{"run":1899,"commit":"c50119f","metric":9.103118789033033,"metrics":{},"status":"discard","description":"Low-9 recovery continued (~104.55 tok/s, eval_s ~9.10) with watchdog idle.","timestamp":1776386319536,"segment":24,"confidence":0.06897223412672925,"iterationTokens":1408,"asi":{"hypothesis":"Rebound is nearing historical high-soft range while remaining activation-free.","rollback_reason":"Primary metric above best floor.","next_action_hint":"Continue unchanged loop for high-soft and floor retest.","diagnostic_findings":{"completion_tok_s":104.54940107919049,"dflash_eval_s":9.103118789033033,"safe_mode_activations":0}}}
{"run":1900,"commit":"c50119f","metric":9.129222707706504,"metrics":{},"status":"discard","description":"Low-9 plateau persisted (~104.16 tok/s, eval_s ~9.13) with no collapse activity.","timestamp":1776386344884,"segment":24,"confidence":0.07066482258984005,"iterationTokens":1411,"asi":{"hypothesis":"Recovery has stabilized in low-9 band but not yet near best floor.","rollback_reason":"Primary metric above best.","next_action_hint":"Continue unchanged loop.","diagnostic_findings":{"completion_tok_s":104.1637191858984,"dflash_eval_s":9.129222707706504,"safe_mode_activations":0}}}
{"run":1901,"commit":"c50119f","metric":9.094241827493533,"metrics":{},"status":"discard","description":"Low-9 rebound continued (~104.58 tok/s, eval_s ~9.09), watchdog remained inactive.","timestamp":1776386369656,"segment":24,"confidence":0.07244257368058357,"iterationTokens":1401,"asi":{"hypothesis":"Regime is close to high-soft boundary but still above best eval floor.","rollback_reason":"Primary metric above best floor.","next_action_hint":"Continue unchanged loop for high-window reopening.","diagnostic_findings":{"completion_tok_s":104.57776618048085,"dflash_eval_s":9.094241827493533,"safe_mode_activations":0}}}
{"run":1902,"commit":"c50119f","metric":9.055684830876999,"metrics":{},"status":"discard","description":"Near-soft/high boundary (~105.09 tok/s, eval_s ~9.06) with watchdog inactive.","timestamp":1776386395338,"segment":24,"confidence":0.0735537777433792,"iterationTokens":1408,"asi":{"hypothesis":"Recovery is close to high-soft re-entry; collapse protections remain dormant in this state.","rollback_reason":"Primary metric above best floor.","next_action_hint":"Continue unchanged loop.","diagnostic_findings":{"completion_tok_s":105.09084180896112,"dflash_eval_s":9.055684830876999,"safe_mode_activations":0}}}
{"run":1903,"commit":"c50119f","metric":9.088553584297188,"metrics":{},"status":"discard","description":"Low-9 plateau sample (~104.59 tok/s, eval_s ~9.09) with no collapse activation.","timestamp":1776386424588,"segment":24,"confidence":0.07469960260417129,"iterationTokens":1412,"asi":{"hypothesis":"Recovery has stabilized near ~9.1 eval without re-opening peak high window yet.","rollback_reason":"Primary metric above best floor.","next_action_hint":"Continue unchanged loop.","diagnostic_findings":{"completion_tok_s":104.59389798024019,"dflash_eval_s":9.088553584297188,"safe_mode_activations":0}}}
{"run":1904,"commit":"c50119f","metric":9.019124040729366,"metrics":{},"status":"discard","description":"Recovered near high-soft edge (~105.38 tok/s, eval_s ~9.02) with watchdog inactive.","timestamp":1776386471141,"segment":24,"confidence":0.07552083015659809,"iterationTokens":2383,"asi":{"hypothesis":"System has mostly recovered from the prior collapse wave.","rollback_reason":"Primary metric above best floor.","next_action_hint":"Continue unchanged loop for floor retest.","diagnostic_findings":{"completion_tok_s":105.38017550570605,"dflash_eval_s":9.019124040729366,"safe_mode_activations":0}}}
{"run":1905,"commit":"c50119f","metric":9.008320832974277,"metrics":{},"status":"discard","description":"Another near-edge recovery sample (~105.35 tok/s, eval_s ~9.01), watchdog inactive.","timestamp":1776386497525,"segment":24,"confidence":0.07635818165093494,"iterationTokens":1401,"asi":{"hypothesis":"Recovery has converged near ~9.0 eval with little collapse risk in current window.","rollback_reason":"Primary metric above best floor.","next_action_hint":"Continue unchanged loop.","diagnostic_findings":{"completion_tok_s":105.3461544427636,"dflash_eval_s":9.008320832974277,"safe_mode_activations":0}}}
