{"run":2346,"commit":"828f148","metric":84.78638197942065,"metrics":{},"status":"discard","description":"DDTree budget-14 probe regressed sharply (~84.8 tok/s): acceptance dropped and cycle count rose (117 cycles), with higher tree-build/eval time.","timestamp":1776475247392,"segment":25,"confidence":4.603627536120734,"iterationTokens":1683,"asi":{"hypothesis":"Raising DDTree budget from 12 to 14 might increase accepted tokens per cycle and improve tok/s.","rollback_reason":"Primary metric regressed heavily and telemetry moved in the wrong direction (lower acceptance, more cycles, higher build/eval time).","next_action_hint":"Run immediate budget-12 back-check to separate variant effect from regime drift before updating do-not-retry guidance.","diagnostic_findings":{"completion_tok_s":84.78638197942065,"dflash_eval_s":12.070919875,"dflash_ddtree_tree_build_s":2.3416070839999996,"dflash_ddtree_tree_budget":14,"dflash_ddtree_cycles_completed":117,"dflash_ddtree_avg_acceptance":8.752136752136753}}}
{"run":2347,"commit":"828f148","metric":96.9762500573839,"metrics":{},"status":"discard","description":"Immediate budget-12 back-check recovered to expected native DDTree band (~97.0 tok/s), confirming budget-14 regression was variant-driven, not regime-only drift.","timestamp":1776475273996,"segment":25,"confidence":4.949715804286557,"iterationTokens":1929,"asi":{"hypothesis":"If budget-14 regression is primarily variant-driven, reverting to budget 12 should immediately restore the prior ~97 tok/s band.","rollback_reason":"No code change; this run is an attribution confirmation sample.","next_action_hint":"Mark budget 14 as non-promising for this lane and test a different overhead lever (e.g., top-k branching cap below budget).","diagnostic_findings":{"completion_tok_s":96.9762500573839,"dflash_eval_s":10.552864875,"dflash_ddtree_tree_build_s":2.071181417,"dflash_ddtree_tree_budget":12,"dflash_ddtree_cycles_completed":103,"dflash_ddtree_avg_acceptance":9.941747572815533}}}
{"run":2348,"commit":"828f148","metric":25.22457723098899,"metrics":{},"status":"discard","description":"Top-k-cap instrumentation run landed in severe collapse window (~25.2 tok/s, eval_s ~40.6; tree_build ~8.52s), so this sample is unusable for assessing the code change.","timestamp":1776475377048,"segment":25,"confidence":4.603627536120734,"iterationTokens":6892,"asi":{"hypothesis":"Adding an env-gated top-k cap (default off) should be neutral unless explicitly enabled and may allow budget-vs-branching A/Bs.","rollback_reason":"Primary metric collapsed due transition/regime instability, so the run cannot validate neutrality or improvement.","next_action_hint":"Run immediate no-DDTree control parity in the same window to confirm shared collapse attribution, then resume DDTree overhead probes after recovery.","diagnostic_findings":{"completion_tok_s":25.22457723098899,"dflash_eval_s":40.587912209,"dflash_ddtree_tree_build_s":8.519051206,"dflash_ddtree_cycles_completed":103,"dflash_ddtree_avg_acceptance":9.941747572815533}}}
{"run":2349,"commit":"828f148","metric":58.133549030329476,"metrics":{},"status":"discard","description":"Immediate no-DDTree control parity after DDTree trough also landed in degraded shared wave (~58.1 tok/s, safe mode active, mixed fused/unfused), confirming transition instability is active.","timestamp":1776475413018,"segment":25,"confidence":3.6767638888041025,"iterationTokens":2133,"asi":{"hypothesis":"A fresh control run on the same edge should show whether the severe DDTree trough occurred during a shared collapse regime.","rollback_reason":"Diagnostic parity run only; no code changes and metric remains far below healthy-window leader.","next_action_hint":"Stay in passive sampling until rebound toward healthy window, then resume DDTree overhead A/B work.","diagnostic_findings":{"completion_tok_s":58.133549030329476,"dflash_eval_s":14.745215125847608,"safe_mode_active":1,"safe_mode_step":53,"verify_eval_wait_fused_steps":53,"verify_eval_wait_unfused_steps":50,"verify_eval_wait_unfused_target_posterior_mean_s":0.17703785413410514}}}
{"run":2350,"commit":"828f148","metric":69.62670620172794,"metrics":{},"status":"discard","description":"Passive control sampling shows rebound from the trough (~69.6 tok/s) but still in degraded mixed fused/unfused regime with watchdog safe mode active.","timestamp":1776475446571,"segment":25,"confidence":4.2501500416045275,"iterationTokens":4556,"asi":{"hypothesis":"After fresh collapse edge, unchanged control runs should climb through staged recovery bands before returning to healthy fused-only floor.","rollback_reason":"No code changes; monitoring-only run remains far below healthy leader.","next_action_hint":"Continue passive sampling until healthy re-entry, then resume DDTree optimization A/Bs in stable windows.","diagnostic_findings":{"completion_tok_s":69.62670620172794,"dflash_eval_s":12.749789791181684,"safe_mode_active":1,"safe_mode_step":72,"verify_eval_wait_fused_steps":72,"verify_eval_wait_unfused_steps":29}}}
{"run":2351,"commit":"828f148","metric":78.53264488195065,"metrics":{},"status":"discard","description":"Further control rebound reached ~78.5 tok/s with safe mode off and fused-only steps, indicating transition into a fused-only inflated shelf rather than full recovery.","timestamp":1776475475824,"segment":25,"confidence":3.503787088441027,"iterationTokens":4246,"asi":{"hypothesis":"Recovery can hand off from mixed safe-mode execution into fused-only inflated shelves before returning to near-floor throughput.","rollback_reason":"No code change and primary metric remains well below healthy window.","next_action_hint":"Keep passive sampling until near-floor (~106+) returns; avoid promoting code changes from this inflated-shelf regime.","diagnostic_findings":{"completion_tok_s":78.53264488195065,"dflash_eval_s":12.3090606238693,"safe_mode_active":0,"verify_eval_wait_fused_steps":96,"verify_eval_wait_unfused_steps":0,"dflash_acceptance_rate":0.6972201352366642}}}
{"run":2352,"commit":"828f148","metric":71.43613394672043,"metrics":{},"status":"discard","description":"Control follow-up stayed in fused-only inflated regime (~71.4 tok/s, safe mode off) rather than continuing monotonic recovery.","timestamp":1776475558019,"segment":25,"confidence":2.97183756302055,"iterationTokens":8822,"asi":{"hypothesis":"If rebound is complete, fused-only control should climb toward near-floor throughput; otherwise an inflated shelf persists.","rollback_reason":"No code change and run remains in degraded fused-only shelf.","next_action_hint":"Continue passive sampling for healthy re-entry before evaluating new DDTree code variants.","diagnostic_findings":{"completion_tok_s":71.43613394672043,"dflash_eval_s":13.58420470613055,"safe_mode_active":0,"verify_eval_wait_fused_steps":96,"verify_eval_wait_unfused_steps":0}}}
{"run":2353,"commit":"828f148","metric":76.45064206564597,"metrics":{},"status":"discard","description":"Control resample remained in fused-only inflated shelf (~76.5 tok/s, safe mode off); still below healthy-window floor.","timestamp":1776475590285,"segment":25,"confidence":2.891626250364997,"iterationTokens":4173,"asi":{"hypothesis":"Additional unchanged samples should reveal whether fused-only inflated shelf self-resolves quickly or persists.","rollback_reason":"No code changes; this is monitoring-only and still in degraded regime.","next_action_hint":"Keep passive monitoring; defer new DDTree optimization patches until window returns to near-floor behavior.","diagnostic_findings":{"completion_tok_s":76.45064206564597,"dflash_eval_s":12.650338244624436,"safe_mode_active":0,"verify_eval_wait_fused_steps":96,"verify_eval_wait_unfused_steps":0}}}
{"run":2354,"commit":"828f148","metric":73.03065814431557,"metrics":{},"status":"discard","description":"Native DDTree check during fused-only inflated shelf landed at ~73.0 tok/s (tree_build ~2.83s), still below contemporaneous no-DDTree control (~76.5 tok/s).","timestamp":1776475622273,"segment":25,"confidence":2.887074246603556,"iterationTokens":4195,"asi":{"hypothesis":"In the current inflated shelf, DDTree should still trail control if overhead gap persists independent of collapse safe-mode behavior.","rollback_reason":"No code change and primary metric remains below matched control sample.","next_action_hint":"Continue passive window monitoring; re-run DDTree optimization A/B only after healthy-window re-entry.","diagnostic_findings":{"completion_tok_s":73.03065814431557,"dflash_eval_s":14.015074541999999,"dflash_ddtree_tree_build_s":2.830276492,"dflash_ddtree_cycles_completed":103,"dflash_ddtree_avg_acceptance":9.941747572815533}}}
{"run":2355,"commit":"828f148","metric":106.90686467678869,"metrics":{},"status":"discard","description":"Control lane re-entered healthy fused-only window (~106.9 tok/s, eval_s ~8.88) after inflated-shelf regime; safe mode remained inactive.","timestamp":1776475722070,"segment":25,"confidence":2.891626250364997,"iterationTokens":11218,"asi":{"hypothesis":"Passive monitoring should eventually show self-recovery from fused-only inflated shelf back to healthy near-floor behavior.","rollback_reason":"No code change; this is regime-state monitoring rather than a candidate keep.","next_action_hint":"Run immediate native DDTree parity in the same healthy window, then resume DDTree overhead A/B probes.","diagnostic_findings":{"completion_tok_s":106.90686467678869,"dflash_eval_s":8.88403649663087,"safe_mode_active":0,"verify_eval_wait_fused_steps":96,"verify_eval_wait_unfused_steps":0}}}
{"run":2356,"commit":"828f148","metric":97.44275068528988,"metrics":{},"status":"discard","description":"Immediate native DDTree parity in recovered healthy window remained in expected ~97.4 tok/s band, confirming persistent ~9–10 tok/s gap vs no-DDTree control.","timestamp":1776475748381,"segment":25,"confidence":2.97183756302055,"iterationTokens":4188,"asi":{"hypothesis":"Once control re-enters healthy fused-only regime, native DDTree parity should return to its usual ~97 tok/s band if overhead gap remains unchanged.","rollback_reason":"No code change; diagnostic parity sample only, still below control lane leader.","next_action_hint":"Try a new env-gated overhead lever in native DDTree tree-build path with immediate healthy-window A/B.","diagnostic_findings":{"completion_tok_s":97.44275068528988,"dflash_eval_s":10.502712541,"dflash_ddtree_tree_build_s":2.0694175439999998,"dflash_ddtree_avg_acceptance":9.941747572815533}}}
{"run":2357,"commit":"828f148","metric":77.20369352968434,"metrics":{},"status":"discard","description":"DDTree budget-11 probe regressed severely in healthy window (~77.2 tok/s): acceptance collapsed (~7.88), cycle count rose (130), and tree-build time increased.","timestamp":1776475786491,"segment":25,"confidence":2.8969690082156725,"iterationTokens":1988,"asi":{"hypothesis":"Slightly reducing DDTree budget (12→11) might lower tree-build overhead while preserving enough acceptance to improve tok/s.","rollback_reason":"Primary metric dropped sharply and telemetry moved opposite of hypothesis (lower acceptance, more cycles, higher build/verify costs).","next_action_hint":"Add budget 11 to lane do-not-retry list and avoid sub-12 budgets on this workload.","diagnostic_findings":{"completion_tok_s":77.20369352968434,"dflash_eval_s":13.256742584000001,"dflash_ddtree_tree_build_s":2.611541626,"dflash_ddtree_tree_budget":11,"dflash_ddtree_cycles_completed":130,"dflash_ddtree_avg_acceptance":7.876923076923077}}}
{"run":2358,"commit":"828f148","metric":97.29826904123891,"metrics":{},"status":"discard","description":"Immediate budget-12 back-check restored native DDTree to normal ~97.3 tok/s band, confirming budget-11 cliff is variant-driven.","timestamp":1776475815407,"segment":25,"confidence":2.97183756302055,"iterationTokens":1790,"asi":{"hypothesis":"If the budget-11 regression is causal, reverting to budget 12 should immediately recover acceptance/cycle profile and tok/s.","rollback_reason":"No code change; this run is attribution-only validation.","next_action_hint":"Prune budget 11 as stale for this lane and avoid further sub-12 budget sweeps.","diagnostic_findings":{"completion_tok_s":97.29826904123891,"dflash_eval_s":10.517829083,"dflash_ddtree_tree_build_s":2.061094422,"dflash_ddtree_tree_budget":12,"dflash_ddtree_cycles_completed":103,"dflash_ddtree_avg_acceptance":9.941747572815533}}}
{"run":2359,"commit":"828f148","metric":48.60931289517537,"metrics":{},"status":"discard","description":"Top-k-cap instrumentation baseline (flag off) landed in a severe degraded window (~48.6 tok/s, tree_build ~4.34s), so this run cannot assess patch neutrality.","timestamp":1776475912040,"segment":25,"confidence":2.8822013594210363,"iterationTokens":4062,"asi":{"hypothesis":"Adding env-gated DFLASH_DDTREE_TOPK_CAP should be default-off neutral and enable future top-k cap A/Bs.","rollback_reason":"Primary metric fell into collapse/inflation regime, making this sample unusable for code-quality attribution.","next_action_hint":"Run immediate no-DDTree control parity to confirm shared regime degradation, then retry instrumentation only after healthy-window recovery.","diagnostic_findings":{"completion_tok_s":48.60931289517537,"dflash_eval_s":21.059650292,"dflash_ddtree_tree_build_s":4.3418714210000005,"dflash_ddtree_cycles_completed":103,"dflash_ddtree_avg_acceptance":9.941747572815533}}}
{"run":2360,"commit":"828f148","metric":68.80938675020339,"metrics":{},"status":"discard","description":"Immediate no-DDTree parity after DDTree trough also landed in degraded fused-only shelf (~68.8 tok/s, eval_s ~14.13), confirming shared regime drift.","timestamp":1776475942314,"segment":25,"confidence":2.8017108900033096,"iterationTokens":1816,"asi":{"hypothesis":"If the DDTree trough was regime-driven, immediate control parity should also show inflated eval time and depressed tok/s.","rollback_reason":"Diagnostic parity run only; no code change and metric remained far below healthy window.","next_action_hint":"Continue passive recovery sampling and avoid judging new code deltas until healthy-window behavior returns.","diagnostic_findings":{"completion_tok_s":68.80938675020339,"dflash_eval_s":14.127653291332535,"safe_mode_active":0,"verify_eval_wait_fused_steps":96,"verify_eval_wait_unfused_steps":0}}}
{"run":2361,"commit":"828f148","metric":88.83520219853726,"metrics":{},"status":"discard","description":"Passive control recovery climbed from trough to mid-shelf (~88.8 tok/s, fused-only, safe mode off) but still below healthy near-floor band.","timestamp":1776475970279,"segment":25,"confidence":2.8969690082156725,"iterationTokens":4139,"asi":{"hypothesis":"After fresh degraded parity edge, control should recover in staged fused-only bands before full near-floor return.","rollback_reason":"No code changes; monitoring-only sample still below healthy-window regime.","next_action_hint":"Continue passive monitoring until ~106+ near-floor re-entry before resuming DDTree code A/Bs.","diagnostic_findings":{"completion_tok_s":88.83520219853726,"dflash_eval_s":10.813857793458737,"safe_mode_active":0,"verify_eval_wait_fused_steps":96,"verify_eval_wait_unfused_steps":0}}}
{"run":2362,"commit":"828f148","metric":108.59917531496488,"metrics":{},"status":"discard","description":"Control recovered fully into healthy near-floor fused-only band (~108.60 tok/s, eval_s ~8.74), confirming the prior trough was transient regime drift.","timestamp":1776475998511,"segment":25,"confidence":2.97183756302055,"iterationTokens":4112,"asi":{"hypothesis":"The degraded fused-only shelf should eventually self-resolve back to near-floor throughput without code changes.","rollback_reason":"No code delta; this is monitoring-only recovery confirmation.","next_action_hint":"Use this healthy window for immediate DDTree parity and only then retry any code-level DDTree overhead probe.","diagnostic_findings":{"completion_tok_s":108.59917531496488,"dflash_eval_s":8.73684520914685,"safe_mode_active":0,"verify_eval_wait_fused_steps":96,"verify_eval_wait_unfused_steps":0}}}
{"run":2363,"commit":"828f148","metric":90.96552105223033,"metrics":{},"status":"discard","description":"Immediate DDTree parity after high control sample came in below usual DDTree healthy band (~91.0 tok/s, tree_build ~2.22s), indicating unstable cross-backend matching in this moment.","timestamp":1776476028663,"segment":25,"confidence":3.5243499125261075,"iterationTokens":4282,"asi":{"hypothesis":"In a stable healthy window, native DDTree should remain near its ~97 tok/s band when control is near-floor.","rollback_reason":"No code change and this sample is inconsistent with recent DDTree healthy-band expectations, so treat as window noise/drift.","next_action_hint":"Collect one more control/DDTree pair before attempting new code probes.","diagnostic_findings":{"completion_tok_s":90.96552105223033,"dflash_eval_s":11.251079665999999,"dflash_ddtree_tree_build_s":2.22144329,"dflash_ddtree_avg_acceptance":9.941747572815533}}}
{"run":2364,"commit":"828f148","metric":98.56886953437044,"metrics":{},"status":"discard","description":"Control follow-up settled below near-floor at ~98.6 tok/s (still fused-only, safe mode off), indicating continued inter-run regime wobble.","timestamp":1776476058525,"segment":25,"confidence":4.326897973631386,"iterationTokens":1723,"asi":{"hypothesis":"A second control sample would clarify whether the prior ~108.6 run reflected stable re-entry or short-lived high pocket.","rollback_reason":"No code change; monitoring-only sample with window drift.","next_action_hint":"Pair with immediate DDTree run for matched attribution, then wait for tighter control stability before code A/B.","diagnostic_findings":{"completion_tok_s":98.56886953437044,"dflash_eval_s":9.68738446047064,"safe_mode_active":0,"verify_eval_wait_fused_steps":96,"verify_eval_wait_unfused_steps":0}}}
{"run":2365,"commit":"828f148","metric":89.79332343303308,"metrics":{},"status":"discard","description":"Matched DDTree pair against ~98.6 control came in at ~89.8 tok/s with tree_build ~2.26s, maintaining large gap under current wobbling window.","timestamp":1776476088774,"segment":25,"confidence":4.8935987251793405,"iterationTokens":4169,"asi":{"hypothesis":"A same-window control/DDTree pair would clarify whether DDTree gap remains structural when control is below peak but still fused-only.","rollback_reason":"No code change; diagnostic pairing confirms continued DDTree deficit in this window.","next_action_hint":"Pause new code probes until control stabilizes around consistent high-window samples, then re-run targeted DDTree optimization A/B.","diagnostic_findings":{"completion_tok_s":89.79332343303308,"dflash_eval_s":11.397944584000001,"dflash_ddtree_tree_build_s":2.256210999,"dflash_ddtree_avg_acceptance":9.941747572815533}}}
{"run":2366,"commit":"828f148","metric":101.88176186328576,"metrics":{},"status":"discard","description":"Control monitoring moved to mid-high fused-only band (~101.9 tok/s, eval_s ~9.35) but still below consistent near-floor highs.","timestamp":1776476129747,"segment":25,"confidence":4.425784853860328,"iterationTokens":2368,"asi":{"hypothesis":"Additional passive samples are needed to distinguish stable high-window re-entry from ongoing wobble.","rollback_reason":"No code change; run is monitoring-only and not a structural improvement.","next_action_hint":"Collect another matched DDTree sample only if control remains in this band; defer code probes until tighter stability.","diagnostic_findings":{"completion_tok_s":101.88176186328576,"dflash_eval_s":9.354457542300224,"safe_mode_active":0,"verify_eval_wait_fused_steps":96,"verify_eval_wait_unfused_steps":0}}}
{"run":2367,"commit":"828f148","metric":94.67056236818794,"metrics":{},"status":"discard","description":"Matched DDTree run against ~101.9 control reached ~94.7 tok/s (tree_build ~2.13s), preserving a ~7 tok/s gap in this mid-high fused-only window.","timestamp":1776476165166,"segment":25,"confidence":4.426858864737843,"iterationTokens":4460,"asi":{"hypothesis":"When control sits in the ~100 tok/s band, DDTree should remain lower if per-cycle tree-build overhead is still dominant.","rollback_reason":"No code change; this pair is for window attribution only.","next_action_hint":"Continue monitoring for a tighter stable high window before retrying code-level DDTree optimization experiments.","diagnostic_findings":{"completion_tok_s":94.67056236818794,"dflash_eval_s":10.810357833000001,"dflash_ddtree_tree_build_s":2.125595798,"dflash_ddtree_avg_acceptance":9.941747572815533}}}
{"run":2368,"commit":"828f148","metric":108.49817088732003,"metrics":{},"status":"discard","description":"Control re-entered high fused-only near-floor window (~108.5 tok/s, eval_s ~8.75), suitable for matched DDTree parity/overhead checks.","timestamp":1776476241197,"segment":25,"confidence":4.324482426371606,"iterationTokens":10718,"asi":{"hypothesis":"A fresh high control sample is needed before any DDTree comparison to avoid collapse-window bias.","rollback_reason":"No code delta; window characterization only.","next_action_hint":"Run immediate native DDTree parity with unnormalized top-k in same window.","diagnostic_findings":{"completion_tok_s":108.49817088732003,"dflash_eval_s":8.746558124083094,"safe_mode_active":0,"verify_eval_wait_fused_steps":96,"verify_eval_wait_unfused_steps":0}}}
