{"run":1083,"commit":"8b55918","metric":104.58769924785953,"metrics":{},"status":"discard","description":"Mirror stability sample in recovered mid-104 band.","timestamp":1776308594900,"segment":23,"confidence":2.317802040955473,"iterationTokens":710,"asi":{"hypothesis":"Recovered regime may be stabilizing around 104-105 after transient trough.","rollback_reason":"~104.59 remains below keep.","next_action_hint":"Take control parity sample to verify backend gap in this recovered band.","backend":"mirror_sd_mlx","context_only_draft_cache":1,"draft_sink":48,"delta_vs_keep":-2.272300752140473,"recovered_band":true}}
{"run":1084,"commit":"8b55918","metric":105.67553700453013,"metrics":{},"status":"discard","description":"Control parity sample in recovered mirror mid-104 band (mirror disabled).","timestamp":1776308625669,"segment":23,"confidence":2.326906172606928,"iterationTokens":678,"asi":{"hypothesis":"Control should sit near mirror if recovery is shared.","rollback_reason":"Control at ~105.68 outperformed paired mirror by ~1.09 tok/s but still below keep.","next_action_hint":"Return to mirror and check whether gap persists or flips in next sample.","backend":"bstnxbt_mlx","mirror_runtime_enabled":0,"context_only_draft_cache":1,"draft_sink":48,"paired_mirror_tok_s":104.58769924785953,"paired_delta_tok_s":-1.0878377566705977,"shared_recovery":true}}
{"run":1085,"commit":"8b55918","metric":101.746096073513,"metrics":{},"status":"discard","description":"Mirror follow-up after control 105.68 parity sample; mirror dipped to low-101.","timestamp":1776308663503,"segment":23,"confidence":2.329931779585391,"iterationTokens":1033,"asi":{"hypothesis":"Mirror/control ordering may continue flipping in recovered band.","rollback_reason":"Mirror dipped to ~101.75 and remains below keep.","next_action_hint":"Take another mirror sample to see if this is transient or new local band shift.","backend":"mirror_sd_mlx","context_only_draft_cache":1,"draft_sink":48,"paired_control_tok_s":105.67553700453013,"paired_delta_tok_s":-3.9294409310171323,"delta_vs_keep":-5.113903926486993,"band_wobble":true}}
{"run":1086,"commit":"8b55918","metric":102.05591889806058,"metrics":{},"status":"discard","description":"Mirror follow-up sample to validate low-101 dip.","timestamp":1776308693358,"segment":23,"confidence":2.331035123043287,"iterationTokens":665,"asi":{"hypothesis":"If previous dip was transient, mirror should rebound modestly while staying in 102-104 cluster.","rollback_reason":"Minor rebound to ~102.06 but still below keep.","next_action_hint":"Collect control parity in this lower recovered band before further probing.","backend":"mirror_sd_mlx","context_only_draft_cache":1,"draft_sink":48,"delta_vs_keep":-4.804081101939424,"recovered_band_shift":true}}
{"run":1087,"commit":"8b55918","metric":101.54653102738679,"metrics":{},"status":"discard","description":"Control parity sample in mirror low-102 band (mirror disabled).","timestamp":1776308726805,"segment":23,"confidence":2.3319997946491804,"iterationTokens":693,"asi":{"hypothesis":"If drift is shared, control should cluster near mirror in low-102 region.","rollback_reason":"Control ~101.55 matched mirror band and remains below keep.","next_action_hint":"Return to mirror and continue stability tracking; avoid major probes until 104+ sustained again.","backend":"bstnxbt_mlx","mirror_runtime_enabled":0,"context_only_draft_cache":1,"draft_sink":48,"paired_mirror_tok_s":102.05591889806058,"paired_delta_tok_s":0.509387870673796,"shared_band_shift":true}}
{"run":1088,"commit":"8b55918","metric":99.45560198474332,"metrics":{},"status":"discard","description":"Mirror follow-up after shared low-102 parity; dipped below 100.","timestamp":1776308764776,"segment":23,"confidence":2.3322371425986774,"iterationTokens":1058,"asi":{"hypothesis":"Recovered band remains unstable and can slide from 102 into high-90s.","rollback_reason":"Dropped to ~99.46 and below keep by a wide margin.","next_action_hint":"Continue recovery-only bundle; if sub-100 persists, recheck control symmetry.","backend":"mirror_sd_mlx","context_only_draft_cache":1,"draft_sink":48,"delta_vs_keep":-7.404398015256676,"band_deterioration":true}}
{"run":1089,"commit":"8b55918","metric":103.08145474751939,"metrics":{},"status":"discard","description":"Control parity check after mirror dipped below 100 (mirror disabled).","timestamp":1776308800419,"segment":23,"confidence":2.33567290082042,"iterationTokens":727,"asi":{"hypothesis":"If sub-100 dip is shared, control should also degrade near that level.","rollback_reason":"Control held ~103.08, suggesting mirror-side transient dip rather than full shared collapse.","next_action_hint":"Return to mirror immediately and test whether mirror rebounds toward control band.","backend":"bstnxbt_mlx","mirror_runtime_enabled":0,"context_only_draft_cache":1,"draft_sink":48,"paired_mirror_tok_s":99.45560198474332,"paired_delta_tok_s":-3.6258527627760744,"shared_collapse":false}}
{"run":1090,"commit":"8b55918","metric":101.75563624906754,"metrics":{},"status":"discard","description":"Mirror rebound check after control held ~103.08; recovered to low-101.","timestamp":1776308829555,"segment":23,"confidence":2.3395964443047985,"iterationTokens":696,"asi":{"hypothesis":"Mirror sub-100 dip was transient and should rebound toward low-100s.","rollback_reason":"Recovered to ~101.76 but still below keep and still under paired control.","next_action_hint":"Continue mirror/control monitoring; wait for sustained 104+ mirror band before new major probes.","backend":"mirror_sd_mlx","context_only_draft_cache":1,"draft_sink":48,"paired_control_tok_s":103.08145474751939,"paired_delta_tok_s":-1.3258184984518535,"delta_vs_keep":-5.104363750932462}}
{"run":1091,"commit":"8b55918","metric":102.78030253546233,"metrics":{},"status":"discard","description":"Mirror stability sample nudging up within low-102 band.","timestamp":1776308873263,"segment":23,"confidence":2.3620387079316947,"iterationTokens":1445,"asi":{"hypothesis":"Mirror should oscillate within low-100s while regime stabilizes.","rollback_reason":"~102.78 still below keep.","next_action_hint":"Take control parity sample after one more mirror datapoint to confirm band center.","backend":"mirror_sd_mlx","context_only_draft_cache":1,"draft_sink":48,"delta_vs_keep":-4.079697464537673,"band_tracking":true}}
{"run":1092,"commit":"8b55918","metric":102.96116408563593,"metrics":{},"status":"discard","description":"Mirror follow-up sample confirming low-102 plateau.","timestamp":1776308902627,"segment":23,"confidence":2.3948407889265235,"iterationTokens":588,"asi":{"hypothesis":"Consecutive mirror runs should cluster if regime is locally stable.","rollback_reason":"~102.96 remains below keep.","next_action_hint":"Take immediate control parity sample for shared-plateau confirmation.","backend":"mirror_sd_mlx","context_only_draft_cache":1,"draft_sink":48,"delta_vs_keep":-3.8988359143640676,"local_plateau":true}}
{"run":1093,"commit":"8b55918","metric":102.45536559912418,"metrics":{},"status":"discard","description":"Control parity sample against mirror low-102 plateau (mirror disabled).","timestamp":1776308938061,"segment":23,"confidence":2.4138556036562844,"iterationTokens":673,"asi":{"hypothesis":"Control should co-cluster with mirror if plateau is shared.","rollback_reason":"Control ~102.46 closely matched mirror (~102.96), still below keep.","next_action_hint":"Resume mirror sampling; defer major probes until 104+ sustained across both backends.","backend":"bstnxbt_mlx","mirror_runtime_enabled":0,"context_only_draft_cache":1,"draft_sink":48,"paired_mirror_tok_s":102.96116408563593,"paired_delta_tok_s":0.5057984865117496,"shared_plateau":true}}
{"run":1094,"commit":"8b55918","metric":102.20477949859536,"metrics":{},"status":"discard","description":"Mirror sample after shared low-102 parity checkpoint.","timestamp":1776308969003,"segment":23,"confidence":2.436274111588882,"iterationTokens":680,"asi":{"hypothesis":"Mirror should remain near shared ~102 plateau absent another collapse wave.","rollback_reason":"Mirror held ~102.20 but still below keep.","next_action_hint":"Continue plateau tracking; trigger control check if mirror drifts >2 tok/s from plateau center.","backend":"mirror_sd_mlx","context_only_draft_cache":1,"draft_sink":48,"delta_vs_keep":-4.65522050140464,"plateau_tracking":true}}
{"run":1095,"commit":"8b55918","metric":103.61328917367592,"metrics":{},"status":"discard","description":"Mirror rebound within plateau, back to low-103.","timestamp":1776309014839,"segment":23,"confidence":2.4386482026602367,"iterationTokens":1400,"asi":{"hypothesis":"Current regime oscillates around low-102/103 without clear breakout.","rollback_reason":"Still below keep.","next_action_hint":"Collect control parity sample to confirm shared drift up from ~102 baseline.","backend":"mirror_sd_mlx","context_only_draft_cache":1,"draft_sink":48,"delta_vs_keep":-3.246710826324087,"plateau_rebound":true}}
{"run":1096,"commit":"8b55918","metric":104.13943534523582,"metrics":{},"status":"discard","description":"Control parity sample after mirror low-103 rebound (mirror disabled).","timestamp":1776309051268,"segment":23,"confidence":2.439485430447728,"iterationTokens":670,"asi":{"hypothesis":"Control should remain close to mirror in same recovered plateau.","rollback_reason":"Control ~104.14 slightly above mirror (~103.61) but below keep.","next_action_hint":"Return to mirror and track whether parity gap narrows or flips.","backend":"bstnxbt_mlx","mirror_runtime_enabled":0,"context_only_draft_cache":1,"draft_sink":48,"paired_mirror_tok_s":103.61328917367592,"paired_delta_tok_s":-0.5261461715599004,"shared_plateau":true}}
{"run":1097,"commit":"8b55918","metric":105.44369282334057,"metrics":{},"status":"discard","description":"Mirror sample climbed into mid-105 band after low-103 plateau.","timestamp":1776309078943,"segment":23,"confidence":2.443277955836243,"iterationTokens":656,"asi":{"hypothesis":"Recovered regime may be stepping back toward high-105 local median.","rollback_reason":"Mid-105 remains below keep.","next_action_hint":"Take immediate mirror repeat to test whether 105+ holds before any major-bet probe.","backend":"mirror_sd_mlx","context_only_draft_cache":1,"draft_sink":48,"delta_vs_keep":-1.41630717665943,"high_band_reentry":true}}
{"run":1098,"commit":"8b55918","metric":105.27481751365951,"metrics":{},"status":"discard","description":"Mirror repeat after first mid-105 sample; high-band hold check.","timestamp":1776309105414,"segment":23,"confidence":2.448768932523429,"iterationTokens":618,"asi":{"hypothesis":"If high-band re-entry is real, consecutive mirror runs should stay around mid-105.","rollback_reason":"Held mid-105 (~105.27) but still below keep.","next_action_hint":"Run control parity sample; if both remain ~105, schedule one repo-sourced major bet.","backend":"mirror_sd_mlx","context_only_draft_cache":1,"draft_sink":48,"delta_vs_keep":-1.5851824863404942,"high_band_hold":true}}
{"run":1099,"commit":"8b55918","metric":104.46952606937842,"metrics":{},"status":"discard","description":"Control parity sample during mirror mid-105 hold window (mirror disabled).","timestamp":1776309139834,"segment":23,"confidence":2.47735135137011,"iterationTokens":717,"asi":{"hypothesis":"Control should be near mirror if high-band recovery is shared.","rollback_reason":"Control at ~104.47 trails recent mirror ~105.27 but still below keep.","next_action_hint":"Return to mirror; if mirror remains in mid-105, run one major-bet repo-sourced probe in same window.","backend":"bstnxbt_mlx","mirror_runtime_enabled":0,"context_only_draft_cache":1,"draft_sink":48,"paired_mirror_tok_s":105.27481751365951,"paired_delta_tok_s":0.8052914442810898,"shared_high_band":true}}
{"run":1100,"commit":"8b55918","metric":105.02469760129586,"metrics":{},"status":"discard","description":"Mirror follow-up in high-105 recovery window after control ~104.47 parity sample.","timestamp":1776309189036,"segment":23,"confidence":2.506608887330708,"iterationTokens":682,"asi":{"hypothesis":"Mirror should stay in mid/high-105 if high-band recovery is holding.","rollback_reason":"~105.02 still below keep.","next_action_hint":"Given sustained high-band window, run one repo-derived major-bet candidate next.","backend":"mirror_sd_mlx","context_only_draft_cache":1,"draft_sink":48,"delta_vs_keep":-1.8353023987041437,"high_band_hold":true}}
{"run":1101,"commit":"e0adecf","metric":107.51918883520496,"metrics":{},"status":"keep","description":"Major-bet combo from repo patterns: enable async draft kickoff + fused draft/verify eval boundary (`DFLASH_BSTNXBT_ASYNC_DRAFT_EVAL=1`, `DFLASH_BSTNXBT_FUSED_DRAFT_VERIFY_EVAL=1`) in bstnxbt loop on mirror lane.","timestamp":1776309270474,"segment":23,"confidence":2.6589434021349385,"iterationTokens":4658,"asi":{"hypothesis":"Combining async draft kickoff with a fused eval boundary should reduce per-step synchronization overhead more than either tweak alone.","backend":"mirror_sd_mlx","context_only_draft_cache":1,"draft_sink":48,"async_draft_eval":1,"fused_draft_verify_eval":1,"major_bet":true,"delta_vs_keep":0.6591888352049569,"source_hint":"combines bstnxbt async_eval pattern with mirror-sd fused eval concept","validation_plan":"Run immediate baseline and immediate combo rerun to check reproducibility in same regime window."}}
{"run":1102,"commit":"e0adecf","metric":106.01004440451366,"metrics":{},"status":"discard","description":"Post-keep baseline anchor without combo env overrides (mirror lane).","timestamp":1776309306871,"segment":23,"confidence":2.6618286867850114,"iterationTokens":1472,"asi":{"hypothesis":"Immediate baseline run should be lower than combo-on sample if the env-gated optimization is genuinely causal.","rollback_reason":"Baseline dropped to ~106.01 versus keep 107.52, consistent with combo-on benefit but still below current keep threshold.","next_action_hint":"Run immediate combo-on rerun (`ASYNC_DRAFT_EVAL=1` + `FUSED_DRAFT_VERIFY_EVAL=1`) to confirm reproducibility over baseline.","backend":"mirror_sd_mlx","context_only_draft_cache":1,"draft_sink":48,"async_draft_eval":0,"fused_draft_verify_eval":0,"paired_keep_tok_s":107.51918883520496,"paired_delta_tok_s":-1.5091444306912984}}
{"run":1103,"commit":"39d0187","metric":107.74937721402837,"metrics":{},"status":"keep","description":"Combo-on confirmation rerun (`DFLASH_BSTNXBT_ASYNC_DRAFT_EVAL=1` + `DFLASH_BSTNXBT_FUSED_DRAFT_VERIFY_EVAL=1`) after baseline anchor; new best in same regime window.","timestamp":1776309342991,"segment":23,"confidence":2.769128964608292,"iterationTokens":801,"asi":{"hypothesis":"The async+fused combo should reproducibly outperform baseline in contiguous A/B runs.","backend":"mirror_sd_mlx","context_only_draft_cache":1,"draft_sink":48,"async_draft_eval":1,"fused_draft_verify_eval":1,"paired_baseline_tok_s":106.01004440451366,"paired_delta_tok_s":1.7393328095147182,"delta_vs_keep":0.2301883788234047,"validation":"A/B confirmation successful in immediate window"}}
{"run":1104,"commit":"582c76d","metric":107.7761080283005,"metrics":{},"status":"keep","description":"Promote combo toggles into authoritative workload env (`DFLASH_BSTNXBT_ASYNC_DRAFT_EVAL=1`, `DFLASH_BSTNXBT_FUSED_DRAFT_VERIFY_EVAL=1`) and validate on default mirror lane.","timestamp":1776309388329,"segment":23,"confidence":2.835689526564001,"iterationTokens":1630,"asi":{"hypothesis":"Persisting proven combo env toggles in workload defaults should retain/improve the new high-band throughput without manual command overrides.","backend":"mirror_sd_mlx","context_only_draft_cache":1,"draft_sink":48,"async_draft_eval":1,"fused_draft_verify_eval":1,"delta_vs_keep":0.02673081427212491,"workload_env_promoted":true}}
{"run":1105,"commit":"582c76d","metric":107.80560197027236,"metrics":{},"status":"discard","description":"Control parity run with new combo defaults (`DFLASH_MIRROR_SD_RUNTIME=0`) to measure backend delta in same regime.","timestamp":1776309437050,"segment":23,"confidence":2.862077162871726,"iterationTokens":984,"asi":{"hypothesis":"Need immediate control check to determine whether new combo gain is mirror-specific or shared.","rollback_reason":"Although control hit ~107.81, this is a non-authoritative parity sample (mirror disabled), not the target mirror-lane configuration.","next_action_hint":"Re-enable mirror runtime and run immediate anchor under combo defaults to validate mirror-side reproducibility.","backend":"bstnxbt_mlx","mirror_runtime_enabled":0,"context_only_draft_cache":1,"draft_sink":48,"async_draft_eval":1,"fused_draft_verify_eval":1,"paired_mirror_tok_s":107.7761080283005,"paired_delta_tok_s":-0.029493941971856064,"authoritative_lane":"mirror_sd_mlx"}}
{"run":1106,"commit":"5f083af","metric":107.93150065488467,"metrics":{},"status":"keep","description":"Mirror anchor after control parity check, with combo defaults active in workload; new mirror best.","timestamp":1776309473895,"segment":23,"confidence":2.934445437621744,"iterationTokens":1550,"asi":{"hypothesis":"If combo defaults are robust on authoritative lane, mirror should reproduce at/above prior 107.78 sample after control parity detour.","backend":"mirror_sd_mlx","context_only_draft_cache":1,"draft_sink":48,"async_draft_eval":1,"fused_draft_verify_eval":1,"delta_vs_keep":0.15539262658417397,"paired_control_tok_s":107.80560197027236,"paired_delta_tok_s":0.12589868461231657,"validation":"Mirror still leads by a small margin in immediate pair."}}
{"run":1107,"commit":"a6a31dd","metric":107.94985213208706,"metrics":{},"status":"keep","description":"Mirror reproducibility check with combo defaults active; slight new best.","timestamp":1776309524010,"segment":23,"confidence":2.9436226051646925,"iterationTokens":2123,"asi":{"hypothesis":"If combo optimization is robust, repeated mirror samples should remain in ~107.8-108.0 range.","backend":"mirror_sd_mlx","context_only_draft_cache":1,"draft_sink":48,"async_draft_eval":1,"fused_draft_verify_eval":1,"delta_vs_keep":0.018351477202387664,"stability_check":true}}
{"run":1108,"commit":"a6a31dd","metric":108.05260356604818,"metrics":{},"status":"discard","description":"Control parity run with combo defaults (`DFLASH_MIRROR_SD_RUNTIME=0`) after mirror 107.95 check.","timestamp":1776309564273,"segment":23,"confidence":2.9482971320492335,"iterationTokens":742,"asi":{"hypothesis":"Immediate control pair quantifies whether combo uplift is mirror-specific or shared.","rollback_reason":"Control reached ~108.05, but this parity backend is non-authoritative for the active mirror lane objective.","next_action_hint":"Re-enable mirror runtime and collect immediate mirror anchor to track backend delta in same regime.","backend":"bstnxbt_mlx","mirror_runtime_enabled":0,"context_only_draft_cache":1,"draft_sink":48,"async_draft_eval":1,"fused_draft_verify_eval":1,"paired_mirror_tok_s":107.94985213208706,"paired_delta_tok_s":-0.10275143396112515,"authoritative_lane":"mirror_sd_mlx"}}
{"run":1109,"commit":"a6a31dd","metric":107.77931217117165,"metrics":{},"status":"discard","description":"Mirror anchor after control 108.05 parity run with combo defaults.","timestamp":1776309601389,"segment":23,"confidence":2.977813060366485,"iterationTokens":1142,"asi":{"hypothesis":"Mirror should remain near high-107s after control parity detour in same regime.","rollback_reason":"Mirror at ~107.78 is strong but below current mirror keep 107.95.","next_action_hint":"Continue paired monitoring; mirror/control remain near-parity under combo defaults.","backend":"mirror_sd_mlx","context_only_draft_cache":1,"draft_sink":48,"async_draft_eval":1,"fused_draft_verify_eval":1,"paired_control_tok_s":108.05260356604818,"paired_delta_tok_s":-0.27329139487653015,"delta_vs_keep":-0.17053996091540935}}
{"run":1110,"commit":"a6a31dd","metric":107.79991135916111,"metrics":{},"status":"discard","description":"Mirror repeat in combo-default high-107 band.","timestamp":1776309631177,"segment":23,"confidence":3.0179357400864535,"iterationTokens":742,"asi":{"hypothesis":"Mirror should stay tightly clustered near 107.8 under new combo defaults.","rollback_reason":"~107.80 remains just below keep 107.95.","next_action_hint":"Take periodic control parity checks while searching for >108 mirror breakouts.","backend":"mirror_sd_mlx","context_only_draft_cache":1,"draft_sink":48,"async_draft_eval":1,"fused_draft_verify_eval":1,"delta_vs_keep":-0.14994077292594982,"high_band_cluster":true}}
{"run":1111,"commit":"a6a31dd","metric":107.85790526753874,"metrics":{},"status":"discard","description":"Mirror high-band sample, narrowly below current keep.","timestamp":1776309660837,"segment":23,"confidence":3.048379007495719,"iterationTokens":652,"asi":{"hypothesis":"Mirror may continue to inch upward within high-107 cluster toward occasional >108 breakout.","rollback_reason":"~107.86 remains below keep by ~0.09 tok/s.","next_action_hint":"Keep combo defaults and continue paired mirror/control sampling; look for reproducible >108 mirror hits.","backend":"mirror_sd_mlx","context_only_draft_cache":1,"draft_sink":48,"async_draft_eval":1,"fused_draft_verify_eval":1,"delta_vs_keep":-0.09194686454832136,"high_band_cluster":true}}
