{"run":95,"commit":"e7b14c4","metric":27.877790789059002,"metrics":{},"status":"discard","description":"Re-test a smaller scheduler stream interval (`4`) on top of the current hybrid-native DFlash baseline. It also regressed on the full server benchmark.","timestamp":1776009636443,"segment":4,"confidence":31.807538725713247,"iterationTokens":1059,"asi":{"hypothesis":"If DFlash steps create different coordinator behavior than stock generation, a smaller stream interval may reduce internal waiting and improve throughput.","rollback_reason":"The full benchmark remained below the kept cached-mask baseline, so stream_interval=4 is also not beneficial for this workload.","next_action_hint":"Restore stream_interval=8 and stop spending time on global scheduler cadence variants for the current DFlash benchmark.","learning":"The current DFlash path still prefers stream_interval=8 over both 4 and 16 on the warmed 256-token server benchmark."}}
{"run":96,"commit":"e7b14c4","metric":27.208814459358024,"metrics":{},"status":"discard","description":"Construct the DFlash runtime lazily on first DFlash request instead of during engine startup. This reduced startup-path eagerness but regressed the warmed benchmark request throughput.","timestamp":1776009769158,"segment":4,"confidence":29.55718646858769,"iterationTokens":4397,"asi":{"hypothesis":"Moving DFlash runtime construction off startup and onto the first DFlash request may reduce startup overhead without hurting the warmed benchmark request, or at least reveal a better placement of that cost.","rollback_reason":"The full benchmark request slowed materially, so lazy DFlash construction is not a win for the current warmed workload.","next_action_hint":"Keep eager DFlash runtime construction and continue targeting request-path costs directly.","learning":"Deferring DFlash runtime construction pushes enough work into the request/warmup path to hurt the actual benchmark."}}
{"run":97,"commit":"e7b14c4","metric":28.103004517955604,"metrics":{},"status":"discard","description":"Cache the torch mask-token ID tensor across requests in the hybrid-native DFlash loop so it is not recreated per request. This did not beat the kept cached-mask baseline.","timestamp":1776009843694,"segment":4,"confidence":33.6835786911662,"iterationTokens":1301,"asi":{"hypothesis":"The mask-token ID tensor is constant for a given block size and device, so caching it across requests may shave a small amount of request setup overhead in the hybrid-native path.","rollback_reason":"The full benchmark remained below the kept cached-mask baseline, so this cross-request tensor cache is not a win.","next_action_hint":"Keep the simpler per-request mask-token ID construction and continue focusing on larger repeated costs than this tiny setup allocation.","learning":"Cross-request caching of the mask-token ID tensor is too small to matter on the current workload."}}
{"run":98,"commit":"e7b14c4","metric":28.021343687630722,"metrics":{},"status":"discard","description":"Persist the cached mask embedding block on the drafter model so it survives across requests instead of being rebuilt per request. This did not improve the full benchmark.","timestamp":1776009947345,"segment":4,"confidence":38.03328286757434,"iterationTokens":1301,"asi":{"hypothesis":"The reusable mask embedding block may still be costing enough per request that persisting it across requests could improve the warmed benchmark.","rollback_reason":"The full benchmark remained below the kept cached-mask baseline, so cross-request mask-embedding persistence is not a win.","next_action_hint":"Keep only the within-request mask-embedding cache and continue targeting bigger structural costs.","learning":"The main gain is caching the repeated mask positions within a request; persisting that cache across requests does not materially help on this workload."}}
{"run":99,"commit":"e7b14c4","metric":27.71849388049012,"metrics":{},"status":"discard","description":"Wrap the DFlash runtime generate path in torch.inference_mode() to reduce bridge-side torch overhead. This regressed the full server benchmark.","timestamp":1776010026267,"segment":4,"confidence":38.58310880185047,"iterationTokens":2757,"asi":{"hypothesis":"The hybrid-native path still does enough torch-side work that forcing inference_mode around the whole DFlash generate path might reduce autograd-related overhead and improve throughput.","rollback_reason":"The full benchmark dropped below the kept cached-mask baseline, so this torch.inference_mode wrap is not a win.","next_action_hint":"Keep the simpler runtime generate path and continue targeting overheads that have shown real benchmark sensitivity.","learning":"Autograd disabling at this outer runtime scope does not improve the current DFlash bridge path on the real workload."}}
{"run":100,"commit":"e7b14c4","metric":27.74433615906004,"metrics":{},"status":"discard","description":"Delay construction of the torch input_ids tensor inside DFlashRuntime.generate() until right before the selected execution path needs it. This regressed the full server benchmark.","timestamp":1776010108883,"segment":4,"confidence":42.9771342963815,"iterationTokens":2606,"asi":{"hypothesis":"A tiny amount of request-path work may be removable by delaying torch tensor construction until after DFlash request setup is complete.","rollback_reason":"The full benchmark dropped below the kept cached-mask baseline, so this request-path rearrangement is not a win.","next_action_hint":"Keep the simpler input_ids construction path and continue focusing on larger measured costs.","learning":"Reordering torch input tensor construction does not help the current DFlash request path on the warmed workload."}}
{"run":101,"commit":"e7b14c4","metric":27.860412929431,"metrics":{},"status":"discard","description":"Cache prompt tokenization inside the DFlash runtime so repeated deterministic requests can skip tokenizer.encode(prompt). This did not improve the full server benchmark.","timestamp":1776010169367,"segment":4,"confidence":43.87426936741292,"iterationTokens":1122,"asi":{"hypothesis":"The warmed benchmark repeatedly uses the same deterministic prompt, so caching its tokenization inside the DFlash runtime may shave a bit of request-path overhead.","rollback_reason":"The full benchmark stayed below the kept cached-mask baseline, so prompt-token caching is not a win for the current workload.","next_action_hint":"Keep prompt handling simple and continue focusing on more material runtime costs than tokenization setup.","learning":"Prompt tokenization is not a meaningful bottleneck in the current warmed DFlash benchmark path."}}
{"run":102,"commit":"e7b14c4","metric":28.0763190575052,"metrics":{},"status":"discard","description":"Try a direct bf16 DLPack MLX->torch bridge path by removing the current bf16->fp16 cast before conversion. This did not improve the full benchmark.","timestamp":1776010267689,"segment":4,"confidence":44.80965782962778,"iterationTokens":2838,"asi":{"hypothesis":"If torch in this environment can consume MLX bf16 arrays directly through DLPack efficiently, removing the cast to fp16 could reduce bridge overhead.","rollback_reason":"The full benchmark remained below the kept cached-mask baseline, so the direct bf16 DLPack conversion path is not a win.","next_action_hint":"Keep the existing bf16->fp16 bridge conversion and continue targeting larger remaining costs.","learning":"The bf16->fp16 cast is not the main remaining bridge bottleneck on the real server workload."}}
{"run":103,"commit":"e7b14c4","metric":27.96140941291489,"metrics":{},"status":"discard","description":"Port only the packed-QKV attention layout into the native MLX drafter while keeping the current float32 loading path, to isolate dispatch reduction from the earlier full public-style rewrite. This still regressed the full server benchmark.","timestamp":1776010382879,"segment":4,"confidence":46.660316834566096,"iterationTokens":7650,"asi":{"hypothesis":"The public packed-QKV draft attention may reduce MLX dispatch overhead enough to improve the hybrid-native path even without adopting the full public bf16 rewrite.","rollback_reason":"The full benchmark fell below the kept cached-mask baseline, so packed-QKV alone is not a net win in this current runtime shape.","next_action_hint":"Keep the simpler native drafter attention path for now and continue prioritizing empirically winning request-path optimizations over isolated architecture cleanups.","learning":"The packed-QKV draft attention layout does not transfer as a standalone performance win into the current hybrid-native server path."}}
{"run":104,"commit":"e7b14c4","metric":27.430931833778498,"metrics":{},"status":"discard","description":"Change the harness so the warmup request runs with dflash=false and only the measured benchmark request uses dflash=true, isolating DFlash to the primary request. This regressed the actual benchmark request throughput.","timestamp":1776011020800,"segment":4,"confidence":45.45390913744517,"iterationTokens":7650,"asi":{"hypothesis":"Warming the target model without exercising the DFlash path might leave a cleaner benchmark request and improve measured DFlash throughput.","rollback_reason":"The benchmark request got materially slower, so this warmup isolation does not help the primary workload.","next_action_hint":"Keep warmup and benchmark on the same effective serving path and continue optimizing the request path itself rather than trying to separate warmup behavior.","learning":"For the current workload, exercising the same DFlash path during warmup appears beneficial rather than harmful."}}
{"run":105,"commit":"e7b14c4","metric":27.483955647215073,"metrics":{},"status":"discard","description":"Cache the loaded DFlash drafter model process-wide in BatchedEngine startup so repeated server startups in the same Python process can reuse it. This regressed the full benchmark request throughput.","timestamp":1776011081557,"segment":4,"confidence":45.72297701506581,"iterationTokens":1287,"asi":{"hypothesis":"The autoresearch workload repeatedly starts new servers in the same process tree, so process-wide drafter reuse may reduce startup/path setup overhead enough to help the warmed benchmark request.","rollback_reason":"The full benchmark request slowed materially, so this process-wide drafter cache is not a win for the current workload.","next_action_hint":"Keep per-start drafter initialization as-is and continue targeting request-path costs instead of cross-start caches.","learning":"Cross-start/process-local drafter caching does not translate into better benchmark request throughput in the current harness."}}
{"run":106,"commit":"e7b14c4","metric":27.124061938264088,"metrics":{},"status":"discard","description":"Batch the MLX->torch bridge outputs into a single pre-cast + single mx.eval() step in the target bridge, then convert them to torch without per-array syncs. This regressed the full benchmark.","timestamp":1776011281342,"segment":4,"confidence":45.232158236095415,"iterationTokens":1287,"asi":{"hypothesis":"The hybrid-native path may still be paying too many decode-cycle syncs in the MLX target bridge; evaluating sampled tokens and selected hidden states together could cut bridge overhead.","rollback_reason":"The primary benchmark slowed materially, so collapsing bridge evals this way is not a win in the current server path.","next_action_hint":"Do not assume the public single-sync idea transfers directly to the current bridge structure; continue looking for structural target-path mismatches rather than local eval reshaping alone.","learning":"In the current hybrid bridge, grouped pre-eval of sampled tokens plus selected hidden states is slower than the existing per-array conversion path."}}
{"run":107,"commit":"e7b14c4","metric":27.725612375034164,"metrics":{},"status":"discard","description":"Bypass RequestOutputCollector and RequestStreamState entirely for non-streaming generate() requests, storing only the final RequestOutput behind an event. This did not beat the kept baseline.","timestamp":1776011640560,"segment":4,"confidence":45.72297701506581,"iterationTokens":1287,"asi":{"hypothesis":"The remaining non-streaming engine overhead may come from per-request collector/state setup and final drain logic even after finish-only scheduler outputs, so a direct final-output path could help.","rollback_reason":"Full-server benchmark throughput stayed below the kept cached-mask baseline, so the direct non-streaming final-output path is not a win.","next_action_hint":"Keep the current finish-only non-streaming path and continue prioritizing larger structural target/runtime differences over more engine-core cleanup.","learning":"Collector/state setup for non-streaming generate() requests is not a dominant remaining cost on the current workload."}}
{"run":108,"commit":"e7b14c4","metric":27.878350530566816,"metrics":{},"status":"discard","description":"Return one pre-concatenated context-feature tensor from the MLX target bridge instead of converting each selected hidden state separately and concatenating them later in torch. This still failed to beat the kept baseline.","timestamp":1776011735033,"segment":4,"confidence":46.224564495944655,"iterationTokens":13641,"asi":{"hypothesis":"The hybrid bridge may still be paying unnecessary MLX->torch conversion overhead on selected hidden states; concatenating in MLX and converting once could reduce bridge cost.","rollback_reason":"The full benchmark remained below the kept cached-mask baseline, so this bridge simplification is not a win.","next_action_hint":"Stop spending more time on local hidden-state conversion reshaping unless profiling reveals a dominant bridge hotspot again; prioritize larger target-path differences.","learning":"Per-layer hidden-state conversion is not the main remaining limiter in the current hybrid path."}}
{"run":109,"commit":"e7b14c4","metric":27.59939108401353,"metrics":{},"status":"discard","description":"Add a dedicated no-parser, non-streaming hot branch in Scheduler._process_batch_responses() so ordinary generate() requests skip the streaming/parser scaffolding on every token. This still regressed the benchmark.","timestamp":1776011908931,"segment":4,"confidence":47.35453075575041,"iterationTokens":11473,"asi":{"hypothesis":"Even after finish-only outputs, non-streaming requests may still be paying avoidable per-token branching in Scheduler._process_batch_responses(); an explicit hot branch could reduce that overhead.","rollback_reason":"The full-server benchmark remained below the kept cached-mask baseline, so this scheduler split-path change is not a win.","next_action_hint":"Prune this scheduler-branch idea and keep focusing on structural target-path differences rather than more response-shaping cleanup.","learning":"Per-token parser/stream-branch overhead in Scheduler._process_batch_responses() is not a dominant limiter for the current workload."}}
{"run":110,"commit":"e7b14c4","metric":27.458714110451524,"metrics":{},"status":"discard","description":"Precompute a set for target_layer_ids in the MLX target bridge so hidden-state capture uses O(1) membership checks during each verify loop. This did not improve the benchmark.","timestamp":1776011970202,"segment":4,"confidence":48.541125693857005,"iterationTokens":2078,"asi":{"hypothesis":"The manual MLX target loop still checks target-layer membership for every layer on every verify pass; replacing tuple membership with a precomputed set might trim some Python overhead.","rollback_reason":"The primary benchmark stayed well below the kept cached-mask baseline, so this per-layer membership cleanup is not a meaningful win.","next_action_hint":"Stop chasing tiny target-bridge Python cleanups unless profiling points back there; focus on larger target-path behavior mismatches.","learning":"Per-layer target-layer membership checks are not a meaningful part of the remaining DFlash cost."}}
{"run":111,"commit":"e7b14c4","metric":27.58963441805107,"metrics":{},"status":"discard","description":"Keep stream_interval=8 but reduce the non-streaming finish-only engine-loop yield frequency from every 8 steps to every 16 steps, isolating event-loop yielding from token batching. This regressed the benchmark.","timestamp":1776012023321,"segment":4,"confidence":46.38619005721888,"iterationTokens":1032,"asi":{"hypothesis":"Some of the kept win may come from the reduced-yield cadence itself rather than stream_interval, and yielding even less often could trim scheduler overhead further on the single-request non-streaming workload.","rollback_reason":"The primary benchmark stayed below the kept cached-mask baseline, so a looser 16-step yield cadence is not a win.","next_action_hint":"Keep the current 8-step non-streaming yield cadence and deprioritize further event-loop cadence tuning unless profiling exposes a new async bottleneck.","learning":"The current 8-step finish-only yield cadence remains better than a 16-step variant on the real server workload."}}
{"run":112,"commit":"e7b14c4","metric":27.83402431567211,"metrics":{},"status":"discard","description":"Remove the hybrid DFlash loop's unused position_ids allocation and per-step slicing, since the current MLX target bridge ignores position_ids entirely. This still did not beat the kept baseline.","timestamp":1776012280219,"segment":4,"confidence":49.40714935817067,"iterationTokens":1032,"asi":{"hypothesis":"The hybrid-native loop is doing dead work by building and slicing position_ids tensors that the MLX target bridge never consumes; removing that overhead might improve the real server path.","rollback_reason":"The full benchmark remained below the kept cached-mask baseline, so this dead-work cleanup is not a meaningful win.","next_action_hint":"Keep looking for larger structural target-path differences; tiny bookkeeping removals in the hybrid loop are not moving the primary metric enough.","learning":"Unused position_ids construction/slicing was not a significant contributor to the current hybrid-path cost."}}
{"run":113,"commit":"e7b14c4","metric":27.662761777391367,"metrics":{},"status":"discard","description":"Memoize tokenizer.apply_chat_template() results inside BatchedEngine for identical messages/tools/template kwargs within a server lifetime. This did not improve the primary benchmark.","timestamp":1776012351126,"segment":4,"confidence":48.99933124735495,"iterationTokens":3045,"asi":{"hypothesis":"The benchmark repeatedly hits deterministic chat-template rendering on warmup and measured requests, so engine-local memoization might trim legitimate request-path overhead without changing semantics.","rollback_reason":"The full benchmark remained below the kept cached-mask baseline, so chat-template memoization is not a meaningful win on this workload.","next_action_hint":"Deprioritize chat-template caching and keep focusing on structural DFlash target-path differences rather than frontend request formatting overhead.","learning":"Chat-template rendering is not a dominant remaining cost for the current warmed single-request benchmark."}}
{"run":114,"commit":"e7b14c4","metric":28.07622077844214,"metrics":{},"status":"discard","description":"Reintroduce an opt-in MLX-native target loop using the corrected Qwen3.5/Omni semantics discovered from the hybrid-vs-native trace: start indexes the already-sampled first token, draft cache crops at the current start, and target cache trims to the new start after the bonus token. This recovers most native-path loss but still does not beat the kept hybrid baseline.","timestamp":1776014992313,"segment":4,"confidence":49.42065073556743,"iterationTokens":94499,"asi":{"hypothesis":"The earlier native target-loop regressions were partly caused by incorrect Qwen3.5/Omni bookkeeping rather than an inherent native-path ceiling; restoring the hybrid-matching start/crop/trim semantics should improve the real server benchmark.","rollback_reason":"Even with corrected semantics, the full server benchmark stayed below the kept cached-mask hybrid baseline, so this native target-loop variant is not yet a win.","next_action_hint":"Keep the corrected semantic findings as structured memory and continue tracing later-step divergence/correctness in the native loop rather than promoting this path into the default runtime.","learning":"A corrected native target loop can climb back to about 28.08 tok/s, which is materially better than the earlier broken native path and confirms the semantic fixes matter, but it is still not enough to beat the kept hybrid path.","native_loop_learning":"The critical Qwen3.5/Omni-specific fixes were: start points at the first sampled token in the block, draft cache crops at current start, and target cache trims to the new start after acceptance plus bonus token. With those fixes, the native loop matches the hybrid path across the first several decode steps and regains much of the lost throughput."}}
