{"run":1660,"commit":"b304c02","metric":107.91521905372488,"metrics":{},"status":"discard","description":"Control parity check (`DFLASH_MIRROR_SD_RUNTIME=0`) scored ~107.92, above paired mirror ~107.46.","timestamp":1776364275526,"segment":23,"confidence":2.638096977208017,"iterationTokens":757,"asi":{"hypothesis":"Current reopened high-window remains slightly control-favored in immediate pair.","rollback_reason":"Control non-authoritative and mirror did not beat control in this parity check.","next_action_hint":"Restore mirror lane and continue scanning for mirror-led crossover.","backend":"bstnxbt_mlx","mirror_runtime_enabled":0,"paired_mirror_tok_s":107.45791652455873,"paired_delta_tok_s":-0.45730252916614994,"authoritative_lane":"mirror_sd_mlx","context_only_draft_cache":1,"draft_sink":48,"async_draft_eval":1,"fused_draft_verify_eval":1}}
{"run":1661,"commit":"b304c02","metric":107.7108575144073,"metrics":{},"status":"discard","description":"Mirror sample at ~107.71 remains in high window but below latest control marker.","timestamp":1776364319554,"segment":23,"confidence":2.644163884658246,"iterationTokens":1115,"asi":{"hypothesis":"Mirror is stable in high-window and may still overtake control on top-tail spikes.","rollback_reason":"Below keep and below latest control parity sample.","next_action_hint":"Continue mirror scans; trigger parity when mirror exceeds ~107.92.","backend":"mirror_sd_mlx","delta_vs_keep":-1.1514749800676354,"context_only_draft_cache":1,"draft_sink":48,"async_draft_eval":1,"fused_draft_verify_eval":1}}
{"run":1662,"commit":"b304c02","metric":28.65455536452569,"metrics":{},"status":"discard","description":"Mirror collapsed sharply to ~28.65, indicating another deep instability trough.","timestamp":1776364389070,"segment":23,"confidence":2.638096977208017,"iterationTokens":658,"asi":{"hypothesis":"High-window remains punctuated by extreme collapse outliers.","rollback_reason":"Catastrophically below keep and control reference.","next_action_hint":"Run immediate mirror follow-up to characterize rebound onset.","backend":"mirror_sd_mlx","delta_vs_keep":-80.20777712994924,"request_s":35.736028250074014,"context_only_draft_cache":1,"draft_sink":48,"async_draft_eval":1,"fused_draft_verify_eval":1,"collapse_reappeared":true}}
{"run":1663,"commit":"b304c02","metric":41.91337389673851,"metrics":{},"status":"discard","description":"Mirror follow-up improved to ~41.91 but remained in deep-collapse regime.","timestamp":1776364439647,"segment":23,"confidence":2.627405311462663,"iterationTokens":657,"asi":{"hypothesis":"Current collapse branch is persistent with slow rebound from extreme trough.","rollback_reason":"Still far below keep/control levels.","next_action_hint":"Continue mirror recovery tracking before next parity check.","backend":"mirror_sd_mlx","delta_vs_keep":-66.94895859773642,"paired_prev_tok_s":28.65455536452569,"paired_delta_tok_s":13.258818532212825,"request_s":24.431342666968703,"context_only_draft_cache":1,"draft_sink":48,"async_draft_eval":1,"fused_draft_verify_eval":1}}
{"run":1664,"commit":"b304c02","metric":44.89762292555035,"metrics":{},"status":"discard","description":"Mirror rose to ~44.90, continuing slow rebound within collapse branch.","timestamp":1776364489935,"segment":23,"confidence":2.6215172650788565,"iterationTokens":785,"asi":{"hypothesis":"Recovery is progressing but still trapped in deep-degraded mode.","rollback_reason":"Still far below keep.","next_action_hint":"Continue mirror runs to detect transition into 60+/80+ bands.","backend":"mirror_sd_mlx","delta_vs_keep":-63.96470956892458,"paired_prev_tok_s":41.91337389673851,"paired_delta_tok_s":2.9842490288118433,"context_only_draft_cache":1,"draft_sink":48,"async_draft_eval":1,"fused_draft_verify_eval":1}}
{"run":1665,"commit":"b304c02","metric":52.85156039271972,"metrics":{},"status":"discard","description":"Mirror climbed to ~52.85, crossing out of 40s into low-50 recovery band.","timestamp":1776364534613,"segment":23,"confidence":2.613138146930379,"iterationTokens":659,"asi":{"hypothesis":"Recovery ladder is stepping up from deep-collapse toward moderate degraded band.","rollback_reason":"Below keep.","next_action_hint":"Continue mirror sequence for 60+/80+ transitions.","backend":"mirror_sd_mlx","delta_vs_keep":-56.0107721017552,"paired_prev_tok_s":44.89762292555035,"paired_delta_tok_s":7.953937467169373,"context_only_draft_cache":1,"draft_sink":48,"async_draft_eval":1,"fused_draft_verify_eval":1}}
{"run":1666,"commit":"b304c02","metric":64.06073474940624,"metrics":{},"status":"discard","description":"Mirror advanced to ~64.06, entering mid-60 recovery stage.","timestamp":1776364574958,"segment":23,"confidence":2.600550040541982,"iterationTokens":653,"asi":{"hypothesis":"Collapse recovery remains monotonic in this branch.","rollback_reason":"Below keep.","next_action_hint":"Continue mirror runs for 80+/90+ re-entry.","backend":"mirror_sd_mlx","delta_vs_keep":-44.80159774506868,"paired_prev_tok_s":52.85156039271972,"paired_delta_tok_s":11.209174356686518,"context_only_draft_cache":1,"draft_sink":48,"async_draft_eval":1,"fused_draft_verify_eval":1}}
{"run":1667,"commit":"b304c02","metric":66.41780134441669,"metrics":{},"status":"discard","description":"Mirror rose to ~66.42, sustaining gradual rebound.","timestamp":1776364612540,"segment":23,"confidence":2.596934913771324,"iterationTokens":634,"asi":{"hypothesis":"Recovery branch is progressing steadily toward 70/80 bands.","rollback_reason":"Below keep.","next_action_hint":"Continue mirror sequence for further recovery.","backend":"mirror_sd_mlx","delta_vs_keep":-42.44453115005823,"paired_prev_tok_s":64.06073474940624,"paired_delta_tok_s":2.3570665950104503,"context_only_draft_cache":1,"draft_sink":48,"async_draft_eval":1,"fused_draft_verify_eval":1}}
{"run":1668,"commit":"b304c02","metric":68.52085448341612,"metrics":{},"status":"discard","description":"Mirror reached ~68.52, crossing into upper-60 recovery band.","timestamp":1776364658573,"segment":23,"confidence":2.5941462472252708,"iterationTokens":629,"asi":{"hypothesis":"Recovery remains intact and should continue toward 80+ if branch persists.","rollback_reason":"Below keep.","next_action_hint":"Continue mirror scans through 70/80/90 ladder.","backend":"mirror_sd_mlx","delta_vs_keep":-40.3414780110588,"paired_prev_tok_s":66.41780134441669,"paired_delta_tok_s":2.1030531389994276,"context_only_draft_cache":1,"draft_sink":48,"async_draft_eval":1,"fused_draft_verify_eval":1}}
{"run":1669,"commit":"b304c02","metric":76.51029019961277,"metrics":{},"status":"discard","description":"Mirror jumped to ~76.51, accelerating into upper-70 recovery stage.","timestamp":1776364698948,"segment":23,"confidence":2.570103815302378,"iterationTokens":644,"asi":{"hypothesis":"Recovery has transitioned from slow crawl to faster step-up phase.","rollback_reason":"Below keep.","next_action_hint":"Continue mirror scans for 90+ re-entry.","backend":"mirror_sd_mlx","delta_vs_keep":-32.35204229486216,"paired_prev_tok_s":68.52085448341612,"paired_delta_tok_s":7.98943571619665,"context_only_draft_cache":1,"draft_sink":48,"async_draft_eval":1,"fused_draft_verify_eval":1}}
{"run":1670,"commit":"b304c02","metric":78.11588552268852,"metrics":{},"status":"discard","description":"Mirror climbed to ~78.12, continuing steady rebound.","timestamp":1776364744505,"segment":23,"confidence":2.545715817467532,"iterationTokens":638,"asi":{"hypothesis":"Recovery branch is healthy and moving through expected bands.","rollback_reason":"Below keep/control highs.","next_action_hint":"Continue mirror sequence toward 90+/100+ zones.","backend":"mirror_sd_mlx","delta_vs_keep":-30.746446971786416,"paired_prev_tok_s":76.51029019961277,"paired_delta_tok_s":1.6055953230757534,"context_only_draft_cache":1,"draft_sink":48,"async_draft_eval":1,"fused_draft_verify_eval":1}}
{"run":1671,"commit":"b304c02","metric":80.76154721780875,"metrics":{},"status":"discard","description":"Mirror entered low-80 band at ~80.76, continuing rebound ladder.","timestamp":1776364784924,"segment":23,"confidence":2.5430420454115907,"iterationTokens":634,"asi":{"hypothesis":"Recovery is transitioning toward mid-band plateau before 90+ step.","rollback_reason":"Below keep/control highs.","next_action_hint":"Continue mirror scans for sustained move into high-80/low-90.","backend":"mirror_sd_mlx","delta_vs_keep":-28.100785276666183,"paired_prev_tok_s":78.11588552268852,"paired_delta_tok_s":2.6456616951202263,"context_only_draft_cache":1,"draft_sink":48,"async_draft_eval":1,"fused_draft_verify_eval":1}}
{"run":1672,"commit":"b304c02","metric":86.19780755345175,"metrics":{},"status":"discard","description":"Mirror jumped to ~86.20, accelerating recovery into high-80 threshold.","timestamp":1776364829205,"segment":23,"confidence":2.540373884002489,"iterationTokens":667,"asi":{"hypothesis":"Recovery is moving from low-80 plateau to high-80/low-90 basin.","rollback_reason":"Below keep/control highs.","next_action_hint":"Continue mirror runs for 90+/100+ re-entry.","backend":"mirror_sd_mlx","delta_vs_keep":-22.66452494102318,"paired_prev_tok_s":80.76154721780875,"paired_delta_tok_s":5.436260335643001,"context_only_draft_cache":1,"draft_sink":48,"async_draft_eval":1,"fused_draft_verify_eval":1}}
{"run":1673,"commit":"b304c02","metric":86.74957435306183,"metrics":{},"status":"discard","description":"Mirror edged up to ~86.75, consolidating in high-80 recovery stage.","timestamp":1776364866263,"segment":23,"confidence":2.5400454944167143,"iterationTokens":669,"asi":{"hypothesis":"Recovery is stabilizing before next step into low-90 basin.","rollback_reason":"Below keep/control highs.","next_action_hint":"Continue mirror scans for 90+ transition.","backend":"mirror_sd_mlx","delta_vs_keep":-22.112758141413103,"paired_prev_tok_s":86.19780755345175,"paired_delta_tok_s":0.5517667996100845,"context_only_draft_cache":1,"draft_sink":48,"async_draft_eval":1,"fused_draft_verify_eval":1}}
{"run":1674,"commit":"b304c02","metric":85.75117708164429,"metrics":{},"status":"discard","description":"Mirror dipped to ~85.75, minor retrace within high-80 stage.","timestamp":1776364903675,"segment":23,"confidence":2.5397171897206268,"iterationTokens":646,"asi":{"hypothesis":"Recovery remains choppy but broadly stable in high-80 zone.","rollback_reason":"Below keep/control highs.","next_action_hint":"Continue mirror scans for renewed push into 90+.","backend":"mirror_sd_mlx","delta_vs_keep":-23.11115541283065,"paired_prev_tok_s":86.74957435306183,"paired_delta_tok_s":-0.9983972714175414,"context_only_draft_cache":1,"draft_sink":48,"async_draft_eval":1,"fused_draft_verify_eval":1}}
{"run":1675,"commit":"b304c02","metric":88.68138125388573,"metrics":{},"status":"discard","description":"Mirror rose to ~88.68, returning toward low-90 basin.","timestamp":1776364940577,"segment":23,"confidence":2.53008400308548,"iterationTokens":652,"asi":{"hypothesis":"Recovery is re-accelerating after minor pullback.","rollback_reason":"Below keep/control highs.","next_action_hint":"Continue mirror scans for 90+/100+ progression.","backend":"mirror_sd_mlx","delta_vs_keep":-20.180951240589206,"paired_prev_tok_s":85.75117708164429,"paired_delta_tok_s":2.9302041722414356,"context_only_draft_cache":1,"draft_sink":48,"async_draft_eval":1,"fused_draft_verify_eval":1}}
{"run":1676,"commit":"b304c02","metric":83.8239498155984,"metrics":{},"status":"discard","description":"Mirror dropped to ~83.82, indicating renewed choppiness in recovery band.","timestamp":1776364980768,"segment":23,"confidence":2.520450768703208,"iterationTokens":644,"asi":{"hypothesis":"Recovery remains non-monotonic with recurrent dips.","rollback_reason":"Below keep/control highs.","next_action_hint":"Continue mirror sequence for next rebound leg.","backend":"mirror_sd_mlx","delta_vs_keep":-25.038382678876538,"paired_prev_tok_s":88.68138125388573,"paired_delta_tok_s":-4.857431438287325,"context_only_draft_cache":1,"draft_sink":48,"async_draft_eval":1,"fused_draft_verify_eval":1}}
{"run":1677,"commit":"b304c02","metric":83.46473838867267,"metrics":{},"status":"discard","description":"Mirror stayed low at ~83.46, consolidating in low-80 pocket.","timestamp":1776365020712,"segment":23,"confidence":2.5012966694177834,"iterationTokens":637,"asi":{"hypothesis":"Recovery has temporarily stalled in low-80s.","rollback_reason":"Below keep/control highs.","next_action_hint":"Continue mirror scans for pocket exit.","backend":"mirror_sd_mlx","delta_vs_keep":-25.39759410580227,"paired_prev_tok_s":83.8239498155984,"paired_delta_tok_s":-0.3592114269257274,"context_only_draft_cache":1,"draft_sink":48,"async_draft_eval":1,"fused_draft_verify_eval":1}}
{"run":1678,"commit":"b304c02","metric":86.8000740477522,"metrics":{},"status":"discard","description":"Mirror rebounded to ~86.80, exiting low-80 pocket.","timestamp":1776365056400,"segment":23,"confidence":2.487233997957389,"iterationTokens":637,"asi":{"hypothesis":"Lower-pocket stall has broken and recovery can resume.","rollback_reason":"Below keep/control highs.","next_action_hint":"Continue mirror scans for return to low-90/bridge band.","backend":"mirror_sd_mlx","delta_vs_keep":-22.062258446722737,"paired_prev_tok_s":83.46473838867267,"paired_delta_tok_s":3.3353356590795316,"context_only_draft_cache":1,"draft_sink":48,"async_draft_eval":1,"fused_draft_verify_eval":1}}
{"run":1679,"commit":"b304c02","metric":84.68453366052448,"metrics":{},"status":"discard","description":"Mirror pulled back to ~84.68, staying in choppy mid-80 regime.","timestamp":1776365098256,"segment":23,"confidence":2.4834957538301725,"iterationTokens":644,"asi":{"hypothesis":"Current branch remains range-bound in 80s without strong upward trend.","rollback_reason":"Below keep/control highs.","next_action_hint":"Continue mirror scans for next breakout attempt.","backend":"mirror_sd_mlx","delta_vs_keep":-24.17779883395045,"paired_prev_tok_s":86.8000740477522,"paired_delta_tok_s":-2.1155403872277225,"context_only_draft_cache":1,"draft_sink":48,"async_draft_eval":1,"fused_draft_verify_eval":1}}
{"run":1680,"commit":"b304c02","metric":88.92503656123564,"metrics":{},"status":"discard","description":"Mirror rebounded to ~88.93, returning to high-80 pocket.","timestamp":1776365139241,"segment":23,"confidence":2.4772741628024475,"iterationTokens":956,"asi":{"hypothesis":"Regime remains oscillatory with recurring 80s-to-90s swings.","rollback_reason":"Below keep/control highs.","next_action_hint":"Continue mirror scans for re-entry into 95+/100+ bridge.","backend":"mirror_sd_mlx","delta_vs_keep":-19.937295933239284,"paired_prev_tok_s":84.68453366052448,"paired_delta_tok_s":4.24050290071116,"context_only_draft_cache":1,"draft_sink":48,"async_draft_eval":1,"fused_draft_verify_eval":1}}
{"run":1681,"commit":"b304c02","metric":87.61421112511447,"metrics":{},"status":"discard","description":"Mirror eased to ~87.61, still in high-80 band.","timestamp":1776365173746,"segment":23,"confidence":2.4727796640054747,"iterationTokens":650,"asi":{"hypothesis":"Local center is stable in upper-80s absent a regime jump.","rollback_reason":"Below keep/control highs.","next_action_hint":"Continue mirror-only scans for upward shift.","backend":"mirror_sd_mlx","delta_vs_keep":-21.24812136936047,"paired_prev_tok_s":88.92503656123564,"paired_delta_tok_s":-1.3108254361211709,"context_only_draft_cache":1,"draft_sink":48,"async_draft_eval":1,"fused_draft_verify_eval":1}}
{"run":1682,"commit":"b304c02","metric":86.68463145462269,"metrics":{},"status":"discard","description":"Mirror slid to ~86.68, slight downward drift within high-80 regime.","timestamp":1776365214616,"segment":23,"confidence":2.4683014443401876,"iterationTokens":635,"asi":{"hypothesis":"No breakout yet; drift remains within expected oscillation.","rollback_reason":"Below keep/control highs.","next_action_hint":"Continue mirror scans for fresh high-window reopen.","backend":"mirror_sd_mlx","delta_vs_keep":-22.177701039852252,"paired_prev_tok_s":87.61421112511447,"paired_delta_tok_s":-0.9295796704917823,"context_only_draft_cache":1,"draft_sink":48,"async_draft_eval":1,"fused_draft_verify_eval":1}}
{"type":"config","name":"Mirror SD instability diagnosis: eval-phase telemetry","metricName":"dflash_eval_s","metricUnit":"s","bestDirection":"lower"}
{"run":1683,"commit":"cb4dd2f","metric":8.78630217362661,"metrics":{},"status":"keep","description":"Pivot baseline: added per-request DFlash telemetry plumbing and captured first eval-phase profile (mirror high-window sample).","timestamp":1776368383475,"segment":24,"confidence":null,"iterationTokens":134,"asi":{"hypothesis":"If collapses are runtime-speed driven, exposing dflash_eval_s and speculative counters on honest server runs will separate acceptance behavior from execution-speed regressions.","diagnostic_findings":{"completion_tok_s":107.62676230995172,"dflash_acceptance_rate":0.6972201352366642,"dflash_full_accept_rate":0.4479166666666667,"dflash_draft_steps":96,"dflash_eval_s":8.78630217362661,"dflash_total_s":9.2996484170435},"next_action_hint":"Run immediate repeat and control parity with telemetry enabled; test whether eval_s inflation occurs while acceptance remains flat.","files_touched":["omlx/dflash/bstnxbt_runtime.py","omlx/dflash/mirror_sd_runtime.py","omlx/dflash/runtime.py","omlx/engine/batched.py","omlx/server.py","omlx/api/openai_models.py","scripts/siliconflash_benchmark.py","autoresearch.sh","tests/test_siliconflash_benchmark.py","autoresearch.ideas.md"]}}
{"run":1684,"commit":"cb4dd2f","metric":8.781235575675964,"metrics":{},"status":"discard","description":"Mirror telemetry repeat at ~8.78s eval-phase confirmed same acceptance profile and near-identical timing; tiny delta treated as noise.","timestamp":1776368419182,"segment":24,"confidence":null,"iterationTokens":1558,"asi":{"hypothesis":"In stable high-window samples, telemetry should remain tightly clustered if instrumentation is trustworthy.","rollback_reason":"Primary improvement vs baseline was only ~0.005s eval_s and treated as noise-level unchanged behavior.","next_action_hint":"Run parity control telemetry and then wait for next collapse sample to compare eval_s inflation at constant acceptance.","diagnostic_findings":{"completion_tok_s":107.94645671629931,"dflash_acceptance_rate":0.6972201352366642,"dflash_full_accept_rate":0.4479166666666667,"dflash_draft_steps":96,"dflash_eval_s":8.781235575675964,"dflash_total_s":9.291196041041985}}}
{"run":1685,"commit":"cb4dd2f","metric":8.85215012729168,"metrics":{},"status":"discard","description":"Control parity telemetry (`DFLASH_MIRROR_SD_RUNTIME=0`) showed slightly worse eval-phase time (~8.85s) than mirror baseline (~8.79s) in this high-window pair.","timestamp":1776368468607,"segment":24,"confidence":null,"iterationTokens":2180,"asi":{"hypothesis":"Immediate mirror/control telemetry pairing can attribute whether eval_s inflation is backend-specific or shared.","rollback_reason":"Primary metric (dflash_eval_s, lower-better) was worse than baseline.","next_action_hint":"Restore mirror lane and wait for collapse-window sample to compare whether both backends share eval_s inflation with stable acceptance.","backend":"bstnxbt_mlx","paired_mirror_eval_s":8.78630217362661,"paired_delta_eval_s":0.0658479536650686,"paired_control_tok_s":106.7377626336815,"paired_mirror_tok_s":107.62676230995172,"dflash_acceptance_rate":0.6972201352366642,"dflash_full_accept_rate":0.4479166666666667,"dflash_draft_steps":96}}
{"run":1686,"commit":"cb4dd2f","metric":15.782265207031742,"metrics":{},"status":"discard","description":"Mirror collapse-window telemetry: eval-phase time spiked to ~15.78s with throughput ~61.65 tok/s while speculative acceptance stats remained unchanged.","timestamp":1776368506800,"segment":24,"confidence":null,"iterationTokens":1454,"asi":{"hypothesis":"Collapse events should manifest as eval_s inflation with stable draft/acceptance counters if runtime-speed is the dominant failure mode.","rollback_reason":"Primary metric (dflash_eval_s, lower-better) regressed sharply vs baseline.","next_action_hint":"Capture additional collapse/rebound telemetry pairs and prioritize interventions targeting eval-path/runtime-state behavior rather than acceptance tuning.","diagnostic_findings":{"completion_tok_s":61.64834366074884,"dflash_draft_steps":96,"dflash_acceptance_rate":0.6972201352366642,"dflash_full_accept_rate":0.4479166666666667,"dflash_eval_s":15.782265207031742,"dflash_total_s":16.396902208100073,"dflash_draft_s":0.270424414658919,"dflash_verify_s":0.1253198361955583},"delta_vs_baseline_eval_s":6.995963033405132}}
{"run":1687,"commit":"cb4dd2f","metric":34.376391453202814,"metrics":{},"status":"discard","description":"Mirror severe collapse telemetry: eval-phase expanded to ~34.38s (throughput ~28.82 tok/s) with unchanged speculative acceptance profile.","timestamp":1776368561784,"segment":24,"confidence":null,"iterationTokens":1272,"asi":{"hypothesis":"If runtime-speed collapse is systemic, deeper troughs should keep speculative structure fixed while eval_s continues to inflate.","rollback_reason":"Primary metric massively worse than baseline.","next_action_hint":"Run immediate control telemetry in this degraded window to verify shared vs mirror-specific eval_s inflation; then test runtime-state mitigation ideas.","diagnostic_findings":{"completion_tok_s":28.815791447721004,"dflash_draft_steps":96,"dflash_acceptance_rate":0.6972201352366642,"dflash_full_accept_rate":0.4479166666666667,"dflash_eval_s":34.376391453202814,"dflash_total_s":35.323753166012466,"dflash_draft_s":0.538642747560516,"dflash_verify_s":0.16371778887696564},"delta_vs_baseline_eval_s":25.5900892795762}}
