{"run":1171,"commit":"284703c","metric":94.52012862186848,"metrics":{},"status":"discard","description":"Mirror recovery plateau persisted around mid-90.","timestamp":1776316448551,"segment":23,"confidence":3.0730740443598354,"iterationTokens":595,"asi":{"hypothesis":"Recovery can stall temporarily in mid-90 before crossing 100.","rollback_reason":"Stalled below keep at ~94.52.","next_action_hint":"Continue sampling for 100+ re-entry; avoid tuning probes while stalled.","backend":"mirror_sd_mlx","context_only_draft_cache":1,"draft_sink":48,"async_draft_eval":1,"fused_draft_verify_eval":1,"delta_vs_keep":-13.79204439968073,"recovery_plateau":true}}
{"run":1172,"commit":"284703c","metric":93.16335948230942,"metrics":{},"status":"discard","description":"Mirror recovery regressed from mid-94 plateau to low-93.","timestamp":1776316485880,"segment":23,"confidence":3.064748448490698,"iterationTokens":776,"asi":{"hypothesis":"Mid-90 plateau may wobble before eventual 100+ return.","rollback_reason":"Dropped further to ~93.16, still below keep.","next_action_hint":"Take control parity sample to confirm whether this downward wobble is shared.","backend":"mirror_sd_mlx","context_only_draft_cache":1,"draft_sink":48,"async_draft_eval":1,"fused_draft_verify_eval":1,"delta_vs_keep":-15.148813539239782,"recovery_wobble":true}}
{"run":1173,"commit":"284703c","metric":95.2851595667521,"metrics":{},"status":"discard","description":"Control parity sample after mirror low-93 wobble (mirror disabled).","timestamp":1776316528268,"segment":23,"confidence":3.0335725179809634,"iterationTokens":741,"asi":{"hypothesis":"If wobble is shared, control should also be in low/mid-90 band.","rollback_reason":"Control at ~95.29 confirms shared sub-100 regime during this recovery segment.","next_action_hint":"Re-enable mirror and continue recovery sampling toward 100+ re-entry before any new probes.","backend":"bstnxbt_mlx","mirror_runtime_enabled":0,"context_only_draft_cache":1,"draft_sink":48,"async_draft_eval":1,"fused_draft_verify_eval":1,"paired_mirror_tok_s":93.16335948230942,"paired_delta_tok_s":-2.121800084442683,"shared_recovery":true}}
{"run":1174,"commit":"284703c","metric":108.1694963760562,"metrics":{},"status":"discard","description":"Mirror sample after recovery phase unexpectedly snapped back into >108 high band.","timestamp":1776316716171,"segment":23,"confidence":3.0623675674139,"iterationTokens":23148,"asi":{"hypothesis":"Current regime may have completed recovery and re-entered high-108 window without config changes.","rollback_reason":"Strong at ~108.17 but still below keep 108.31.","next_action_hint":"Take immediate mirror follow-up and control parity to verify whether >108 window is stable or a spike.","backend":"mirror_sd_mlx","context_only_draft_cache":1,"draft_sink":48,"async_draft_eval":1,"fused_draft_verify_eval":1,"delta_vs_keep":-0.14267664549300968,"high_band_reentry":true}}
{"run":1175,"commit":"284703c","metric":108.2679820729143,"metrics":{},"status":"discard","description":"Immediate mirror follow-up in re-entered >108 window.","timestamp":1776316749987,"segment":23,"confidence":3.069235113541588,"iterationTokens":650,"asi":{"hypothesis":"If high-band re-entry is real, consecutive mirror runs should stay near 108.","rollback_reason":"Improved to ~108.27 but remains just below keep 108.31.","next_action_hint":"Run control parity sample now to check shared high-band stability and then mirror retest.","backend":"mirror_sd_mlx","context_only_draft_cache":1,"draft_sink":48,"async_draft_eval":1,"fused_draft_verify_eval":1,"paired_prev_tok_s":108.1694963760562,"paired_delta_tok_s":0.09848569685808999,"delta_vs_keep":-0.04419094863490127,"high_band_hold":true}}
{"run":1176,"commit":"284703c","metric":108.35515890061312,"metrics":{},"status":"discard","description":"Control parity sample during mirror >108 recovery window (`DFLASH_MIRROR_SD_RUNTIME=0`).","timestamp":1776316793461,"segment":23,"confidence":3.067717982994146,"iterationTokens":808,"asi":{"hypothesis":"Control parity reveals whether >108 window is shared or mirror-specific.","rollback_reason":"Control reached ~108.36 but parity backend is non-authoritative for active mirror objective.","next_action_hint":"Re-enable mirror runtime immediately; run mirror anchor to check for >108.3 breakout on authoritative lane.","backend":"bstnxbt_mlx","mirror_runtime_enabled":0,"context_only_draft_cache":1,"draft_sink":48,"async_draft_eval":1,"fused_draft_verify_eval":1,"paired_mirror_tok_s":108.2679820729143,"paired_delta_tok_s":-0.08717682769882662,"authoritative_lane":"mirror_sd_mlx"}}
{"run":1177,"commit":"284703c","metric":108.24848428910609,"metrics":{},"status":"discard","description":"Mirror anchor after control 108.36 parity check; sustained >108 on authoritative lane.","timestamp":1776316836754,"segment":23,"confidence":3.0704525660455277,"iterationTokens":1284,"asi":{"hypothesis":"If >108 window is shared and stable, mirror should remain above 108 after parity detour.","rollback_reason":"Mirror held at ~108.25 but remains slightly below keep 108.31.","next_action_hint":"Continue mirror high-band sampling for clear >108.31 breakouts; avoid code changes while this window is active.","backend":"mirror_sd_mlx","context_only_draft_cache":1,"draft_sink":48,"async_draft_eval":1,"fused_draft_verify_eval":1,"paired_control_tok_s":108.35515890061312,"paired_delta_tok_s":-0.10667461150703104,"delta_vs_keep":-0.06368873244312216,"high_band_stable":true}}
{"run":1178,"commit":"284703c","metric":108.30170893846041,"metrics":{},"status":"discard","description":"Mirror high-band continuity sample nearly matching current best.","timestamp":1776316892749,"segment":23,"confidence":3.093449560676102,"iterationTokens":2159,"asi":{"hypothesis":"Current regime can sustain repeat measurements near the 108.3 frontier.","rollback_reason":"~108.3017 is effectively tied but still fractionally below keep 108.3122.","next_action_hint":"Continue sampling for a clean >108.31 mirror confirmation; keep parity checks sparse while stable.","backend":"mirror_sd_mlx","context_only_draft_cache":1,"draft_sink":48,"async_draft_eval":1,"fused_draft_verify_eval":1,"delta_vs_keep":-0.010464083088801195,"near_tie":true}}
{"run":1179,"commit":"284703c","metric":108.10556487718281,"metrics":{},"status":"discard","description":"Mirror high-band sample remained above 108.","timestamp":1776316931893,"segment":23,"confidence":3.0905385742583795,"iterationTokens":669,"asi":{"hypothesis":"Stabilized combo window should continue yielding >108 mirror throughput.","rollback_reason":"Above 108 but below keep 108.31.","next_action_hint":"Take one control parity sample to ensure shared high-band before resuming mirror-only scans.","backend":"mirror_sd_mlx","context_only_draft_cache":1,"draft_sink":48,"async_draft_eval":1,"fused_draft_verify_eval":1,"delta_vs_keep":-0.20660814436641237,"high_band_stable":true}}
{"run":1180,"commit":"284703c","metric":108.00142742911282,"metrics":{},"status":"discard","description":"Control parity check during sustained mirror >108 window (mirror disabled).","timestamp":1776316972272,"segment":23,"confidence":3.0988692000167966,"iterationTokens":716,"asi":{"hypothesis":"Control should remain in same high-band if regime stability is shared.","rollback_reason":"Control ~108.00 is high but parity backend remains non-authoritative for mirror objective.","next_action_hint":"Restore mirror runtime and continue mirror-side >108.31 pursuit in same regime.","backend":"bstnxbt_mlx","mirror_runtime_enabled":0,"context_only_draft_cache":1,"draft_sink":48,"async_draft_eval":1,"fused_draft_verify_eval":1,"paired_mirror_tok_s":108.10556487718281,"paired_delta_tok_s":0.10413744806998418,"authoritative_lane":"mirror_sd_mlx"}}
{"run":1181,"commit":"db2e923","metric":108.31511027981271,"metrics":{},"status":"keep","description":"Mirror anchor after control parity check; tiny new best in sustained >108 window.","timestamp":1776317001918,"segment":23,"confidence":3.100907594737367,"iterationTokens":690,"asi":{"hypothesis":"Mirror-side continuation in shared high-band can still yield incremental bests without code changes.","backend":"mirror_sd_mlx","context_only_draft_cache":1,"draft_sink":48,"async_draft_eval":1,"fused_draft_verify_eval":1,"paired_control_tok_s":108.00142742911282,"paired_delta_tok_s":0.3136828506998869,"delta_vs_keep":0.002937258263498089,"near_tie_break":true}}
{"run":1182,"commit":"db2e923","metric":108.27762435292884,"metrics":{},"status":"discard","description":"Immediate mirror follow-up after tiny 108.315 keep; remained in same high-band.","timestamp":1776317036189,"segment":23,"confidence":3.1022071505899973,"iterationTokens":745,"asi":{"hypothesis":"Post-keep run should stay near 108.3 if high-band stability holds.","rollback_reason":"~108.28 remains close but below new keep.","next_action_hint":"Continue high-band mirror sampling; only pursue new code bets if fresh structural leads emerge.","backend":"mirror_sd_mlx","context_only_draft_cache":1,"draft_sink":48,"async_draft_eval":1,"fused_draft_verify_eval":1,"paired_keep_tok_s":108.31511027981271,"paired_delta_tok_s":-0.03748592688386619,"delta_vs_keep":-0.03748592688386619,"high_band_stable":true}}
{"run":1183,"commit":"db2e923","metric":41.682621880903156,"metrics":{},"status":"discard","description":"Mirror run collapsed abruptly from stable high-108 band to severe trough.","timestamp":1776317083856,"segment":23,"confidence":3.095625437607469,"iterationTokens":797,"asi":{"hypothesis":"Regime may still be prone to sudden collapses even during apparent high-band stability.","rollback_reason":"Catastrophic drop to ~41.68 invalidates local high-band continuity assumptions.","next_action_hint":"Run immediate control parity sample to determine whether this collapse is shared.","backend":"mirror_sd_mlx","context_only_draft_cache":1,"draft_sink":48,"async_draft_eval":1,"fused_draft_verify_eval":1,"paired_prev_tok_s":108.27762435292884,"paired_delta_tok_s":-66.59500247202568,"severe_collapse":true,"window_invalidated":true}}
{"run":1184,"commit":"db2e923","metric":47.040271609469876,"metrics":{},"status":"discard","description":"Control parity check after mirror severe collapse (mirror disabled).","timestamp":1776317136874,"segment":23,"confidence":3.0890715933208663,"iterationTokens":796,"asi":{"hypothesis":"If collapse is shared, control should also show severe degradation.","rollback_reason":"Control collapsed to ~47.04, confirming shared instability wave.","next_action_hint":"Re-enable mirror runtime and switch to recovery-only sampling until 100+ re-entry.","backend":"bstnxbt_mlx","mirror_runtime_enabled":0,"context_only_draft_cache":1,"draft_sink":48,"async_draft_eval":1,"fused_draft_verify_eval":1,"paired_mirror_tok_s":41.682621880903156,"paired_delta_tok_s":-5.35764972856672,"shared_collapse_confirmed":true,"severe_collapse":true}}
{"run":1185,"commit":"db2e923","metric":62.52647790239328,"metrics":{},"status":"discard","description":"Mirror recovery anchor after shared severe collapse, rebounded into low-60s.","timestamp":1776317178637,"segment":23,"confidence":3.080533027449783,"iterationTokens":713,"asi":{"hypothesis":"Post-collapse recovery should climb from 40s into 60s before 80/90 re-entry.","rollback_reason":"Low-60 remains far below keep.","next_action_hint":"Continue recovery-only mirror runs; parity check again once mirror reaches ~80.","backend":"mirror_sd_mlx","context_only_draft_cache":1,"draft_sink":48,"async_draft_eval":1,"fused_draft_verify_eval":1,"delta_vs_keep":-45.78863237741944,"recovery_phase":true}}
{"run":1186,"commit":"db2e923","metric":74.61325478289338,"metrics":{},"status":"discard","description":"Mirror recovery continued from low-60s into mid-70s.","timestamp":1776317216379,"segment":23,"confidence":3.0642596808037466,"iterationTokens":646,"asi":{"hypothesis":"Recovery should advance through 70s as collapse wave clears.","rollback_reason":"Mid-70 remains below keep.","next_action_hint":"Continue recovery loop; control parity after mirror reaches upper-70/80 band.","backend":"mirror_sd_mlx","context_only_draft_cache":1,"draft_sink":48,"async_draft_eval":1,"fused_draft_verify_eval":1,"delta_vs_keep":-33.70185549691934}}
{"run":1187,"commit":"db2e923","metric":80.66606907805749,"metrics":{},"status":"discard","description":"Mirror recovery reached low-80 band after shared collapse.","timestamp":1776317252070,"segment":23,"confidence":3.0428710090760935,"iterationTokens":608,"asi":{"hypothesis":"Recovery should proceed into 80s before low-90 return.","rollback_reason":"Low-80 still well below keep.","next_action_hint":"Take control parity sample to validate shared recovery stage.","backend":"mirror_sd_mlx","context_only_draft_cache":1,"draft_sink":48,"async_draft_eval":1,"fused_draft_verify_eval":1,"delta_vs_keep":-27.64904120175523,"recovery_stage":"80s"}}
{"run":1188,"commit":"db2e923","metric":90.66182367930773,"metrics":{},"status":"discard","description":"Control parity sample during mirror low-80 recovery (mirror disabled).","timestamp":1776317297675,"segment":23,"confidence":3.0216600482318223,"iterationTokens":697,"asi":{"hypothesis":"Control should lead mirror modestly if shared recovery is asynchronous.","rollback_reason":"Control recovered to ~90.66, indicating shared rebound but mirror still lagging.","next_action_hint":"Re-enable mirror and continue recovery tracking toward 90+ and 100+ bands.","backend":"bstnxbt_mlx","mirror_runtime_enabled":0,"context_only_draft_cache":1,"draft_sink":48,"async_draft_eval":1,"fused_draft_verify_eval":1,"paired_mirror_tok_s":80.66606907805749,"paired_delta_tok_s":-9.995754601250244,"shared_recovery":true}}
{"run":1189,"commit":"db2e923","metric":93.6419672439467,"metrics":{},"status":"discard","description":"Mirror recovery progressed into low-90s after control 90.66 parity sample.","timestamp":1776317331629,"segment":23,"confidence":3.0162021053446564,"iterationTokens":842,"asi":{"hypothesis":"Mirror should catch up into low-90 band as shared recovery continues.","rollback_reason":"Low-90 still below keep.","next_action_hint":"Continue mirror recovery cadence; parity check once mirror re-enters 100+.","backend":"mirror_sd_mlx","context_only_draft_cache":1,"draft_sink":48,"async_draft_eval":1,"fused_draft_verify_eval":1,"delta_vs_keep":-14.67314303586601,"recovery_stage":"90s"}}
{"run":1190,"commit":"db2e923","metric":93.51589882575779,"metrics":{},"status":"discard","description":"Mirror low-90 recovery follow-up showed slight wobble.","timestamp":1776317362977,"segment":23,"confidence":3.0005243621719755,"iterationTokens":641,"asi":{"hypothesis":"Recovery in low-90s may oscillate before renewed climb.","rollback_reason":"~93.52 remains below keep.","next_action_hint":"Continue recovery-only mirror runs; if low-90 stall persists, interleave control parity check.","backend":"mirror_sd_mlx","context_only_draft_cache":1,"draft_sink":48,"async_draft_eval":1,"fused_draft_verify_eval":1,"delta_vs_keep":-14.79921145405492,"recovery_wobble":true}}
{"run":1191,"commit":"db2e923","metric":107.06792835476388,"metrics":{},"status":"discard","description":"Mirror run after low-90 recovery stage snapped back into high-107 band.","timestamp":1776317469788,"segment":23,"confidence":3.006878738202255,"iterationTokens":6784,"asi":{"hypothesis":"Current collapse wave may have cleared, allowing quick return to high-band throughput under unchanged combo defaults.","rollback_reason":"Strong rebound to ~107.07 but still below best 108.32.","next_action_hint":"Take immediate mirror follow-up and then control parity to verify whether high-band recovery is stable.","backend":"mirror_sd_mlx","context_only_draft_cache":1,"draft_sink":48,"async_draft_eval":1,"fused_draft_verify_eval":1,"delta_vs_keep":-1.2471819250488294,"recovery_jump":true}}
{"run":1192,"commit":"db2e923","metric":107.08573115947966,"metrics":{},"status":"discard","description":"Immediate mirror follow-up confirmed high-107 recovery band.","timestamp":1776317500647,"segment":23,"confidence":3.0132600853763947,"iterationTokens":683,"asi":{"hypothesis":"If recovery is real, consecutive mirror runs should hold in similar high-107 range.","rollback_reason":"Held ~107.09 but below best 108.32.","next_action_hint":"Run control parity sample now to confirm shared high-band re-entry.","backend":"mirror_sd_mlx","context_only_draft_cache":1,"draft_sink":48,"async_draft_eval":1,"fused_draft_verify_eval":1,"paired_prev_tok_s":107.06792835476388,"paired_delta_tok_s":0.017802804715777033,"delta_vs_keep":-1.2293791203330482,"high_band_recovery_hold":true}}
{"run":1193,"commit":"db2e923","metric":106.93230806231335,"metrics":{},"status":"discard","description":"Control parity sample during mirror high-107 recovery window (`DFLASH_MIRROR_SD_RUNTIME=0`).","timestamp":1776317544760,"segment":23,"confidence":3.0345012652675325,"iterationTokens":805,"asi":{"hypothesis":"Control should be near mirror if high-band recovery is shared.","rollback_reason":"Control ~106.93 is close to mirror ~107.09 but parity backend is non-authoritative for the mirror objective.","next_action_hint":"Re-enable mirror runtime and continue high-band sampling for >108.32 breakthroughs.","backend":"bstnxbt_mlx","mirror_runtime_enabled":0,"context_only_draft_cache":1,"draft_sink":48,"async_draft_eval":1,"fused_draft_verify_eval":1,"paired_mirror_tok_s":107.08573115947966,"paired_delta_tok_s":0.15342309716631466,"authoritative_lane":"mirror_sd_mlx"}}
{"run":1194,"commit":"db2e923","metric":106.98406479485443,"metrics":{},"status":"discard","description":"Mirror continuation sample in recovered high-107 neighborhood.","timestamp":1776317586179,"segment":23,"confidence":3.04138395475894,"iterationTokens":1116,"asi":{"hypothesis":"Mirror should remain around high-106/107 while waiting for next >108.32 breakout.","rollback_reason":"~106.98 below keep.","next_action_hint":"Keep mirror sampling; if this band persists, wait for natural high-window instead of code changes.","backend":"mirror_sd_mlx","context_only_draft_cache":1,"draft_sink":48,"async_draft_eval":1,"fused_draft_verify_eval":1,"delta_vs_keep":-1.3310454849582862}}
{"run":1195,"commit":"db2e923","metric":106.90845051744986,"metrics":{},"status":"discard","description":"Mirror follow-up remained in high-106/107 band.","timestamp":1776317618902,"segment":23,"confidence":3.0312972917330314,"iterationTokens":611,"asi":{"hypothesis":"Current regime center may have shifted slightly below 107 after recent collapse/recovery.","rollback_reason":"~106.91 below keep.","next_action_hint":"Take control parity sample to verify if both backends share this lower center.","backend":"mirror_sd_mlx","context_only_draft_cache":1,"draft_sink":48,"async_draft_eval":1,"fused_draft_verify_eval":1,"paired_prev_tok_s":106.98406479485443,"paired_delta_tok_s":-0.07561427740457426,"delta_vs_keep":-1.4066597623628574}}
{"run":1196,"commit":"db2e923","metric":106.99770055466546,"metrics":{},"status":"discard","description":"Control parity sample for mirror high-106/107 band (`DFLASH_MIRROR_SD_RUNTIME=0`).","timestamp":1776317663944,"segment":23,"confidence":3.0361309810115245,"iterationTokens":759,"asi":{"hypothesis":"Control should match mirror if current center is shared and not mirror-specific.","rollback_reason":"Control ~106.998 is effectively tied with mirror band but parity backend is non-authoritative.","next_action_hint":"Re-enable mirror runtime and continue scanning for next >108.32 breakout.","backend":"bstnxbt_mlx","mirror_runtime_enabled":0,"context_only_draft_cache":1,"draft_sink":48,"async_draft_eval":1,"fused_draft_verify_eval":1,"paired_mirror_tok_s":106.90845051744986,"paired_delta_tok_s":-0.08925003721560154,"authoritative_lane":"mirror_sd_mlx","metric_line_mismatch_note":"dashboard line showed 106.00 while METRIC parsed 106.9977; used METRIC value"}}
{"run":1197,"commit":"db2e923","metric":106.97684100302457,"metrics":{},"status":"discard","description":"Mirror anchor after control parity check; remained in high-106/107 cluster.","timestamp":1776317704608,"segment":23,"confidence":3.0335380949734803,"iterationTokens":1202,"asi":{"hypothesis":"Mirror should continue matching control around ~107 in current regime center.","rollback_reason":"~106.98 remains below keep 108.32.","next_action_hint":"Continue sampling for potential high-window resurgence; defer code changes while centered near 107.","backend":"mirror_sd_mlx","context_only_draft_cache":1,"draft_sink":48,"async_draft_eval":1,"fused_draft_verify_eval":1,"paired_control_tok_s":106.99770055466546,"paired_delta_tok_s":-0.020859551640884644,"delta_vs_keep":-1.3382692767877054}}
{"run":1198,"commit":"db2e923","metric":106.95853022376471,"metrics":{},"status":"discard","description":"Mirror continuity sample; high-106/107 center persists.","timestamp":1776317748054,"segment":23,"confidence":3.0309496338573996,"iterationTokens":1073,"asi":{"hypothesis":"Current regime remains centered around ~107 despite occasional >108 spikes.","rollback_reason":"~106.96 still below keep.","next_action_hint":"Continue mirror-only sampling until either >108.32 breakout or clear band shift occurs.","backend":"mirror_sd_mlx","context_only_draft_cache":1,"draft_sink":48,"async_draft_eval":1,"fused_draft_verify_eval":1,"delta_vs_keep":-1.3565800560475647}}
