{"run":336,"commit":"e9874e2","metric":102.54561990793981,"metrics":{},"status":"discard","description":"Probe the upper side of the promising cache-reservation bracket with `INITIAL_CACHE_BLOCKS=320` on the broader request-driven block-15 authority lane. It remained strong but still underperformed the 256-block point.","timestamp":1776185350969,"segment":19,"confidence":2.8934583728259184,"iterationTokens":836,"asi":{"hypothesis":"If the cache-reservation optimum lies slightly above 256 rather than below it, `INITIAL_CACHE_BLOCKS=320` may outperform the 256-block probe on the current slowed regime.","rollback_reason":"Primary metric remained below the current best 107.15 tok/s keep and below the 256-block probe.","next_action_hint":"Re-check 256 directly; it remains the strongest point discovered in this cache-reservation bracket so far.","learning":"The current local optimum for `INITIAL_CACHE_BLOCKS` is not above 256 either: 320 blocks (~102.55 tok/s) still underperformed 256 blocks (~103.88 tok/s)."}}
{"run":337,"commit":"e9874e2","metric":103.89949438670374,"metrics":{},"status":"discard","description":"Immediate confirmation rerun of the strongest cache-reservation point found so far, `INITIAL_CACHE_BLOCKS=256`, on the broader request-driven block-15 authority lane. It repeated almost exactly, confirming a real stabilizing fallback point under the current slowdown.","timestamp":1776185389830,"segment":19,"confidence":2.872356509988262,"iterationTokens":918,"asi":{"hypothesis":"If `INITIAL_CACHE_BLOCKS=256` is the real local optimum in the current slowed regime, an immediate rerun should reproduce near the first sample.","rollback_reason":"Primary metric remained below the current best 107.15 tok/s keep.","next_action_hint":"Treat `INITIAL_CACHE_BLOCKS=256` as a stable recovery lever during the present instability, and test whether it combines profitably with the stable block-14 fallback ridge.","learning":"`INITIAL_CACHE_BLOCKS=256` is a reproducible stabilizer on the slowed authority lane: back-to-back runs land at ~103.88–103.90 tok/s, far above the recent ~77–81 baseline reruns."}}
{"run":338,"commit":"e9874e2","metric":98.48857508138752,"metrics":{},"status":"discard","description":"Combine the two best live recovery levers on the current slowed authority lane: broader request-driven block 14 plus `INITIAL_CACHE_BLOCKS=256`. The combination underperformed cache-256 with block 15 alone.","timestamp":1776185432848,"segment":19,"confidence":3.073053933219796,"iterationTokens":1025,"asi":{"hypothesis":"If the current slowdown involves both a shifted block-size optimum and under-provisioned initial cache reservation, combining broader-lane block 14 with `INITIAL_CACHE_BLOCKS=256` may beat either lever alone.","rollback_reason":"Primary metric remained below the current best 107.15 tok/s keep and below the stronger recovery point at cache-256 with block 15.","next_action_hint":"Use `INITIAL_CACHE_BLOCKS=256` with block 15 as the stronger recovery baseline while continuing to diagnose the missing gap to the old frontier.","learning":"The present slowdown is not resolved by simply stacking the two best independent recovery levers: block 14 does not combine profitably with `INITIAL_CACHE_BLOCKS=256`."}}
{"run":339,"commit":"e9874e2","metric":105.27227596952562,"metrics":{},"status":"discard","description":"Combine the most promising live recovery lever with the explicit-request DFlash lane: test `INITIAL_CACHE_BLOCKS=256` together with `BENCHMARK_DFLASH=1` on block 15 and request-driven thinking. This restored the explicit lane strongly, but still did not beat the historical best broader result.","timestamp":1776185487463,"segment":19,"confidence":3.057784129910416,"iterationTokens":3778,"asi":{"hypothesis":"If the current slowdown is partly about under-provisioned initial cache reservation, then the simpler explicit-request DFlash lane may recover even more strongly than the broader lane when combined with `INITIAL_CACHE_BLOCKS=256`.","rollback_reason":"Primary metric improved substantially but remained below the current best 107.15 tok/s keep.","next_action_hint":"This is now the strongest live recovery point. Re-run it once to check whether it is a stable near-frontier fallback or whether it can edge higher on confirmation.","learning":"`INITIAL_CACHE_BLOCKS=256` materially restores the explicit-request DFlash lane too, lifting it to ~105.27 tok/s — stronger than the same cache setting on the broader lane (~103.90 tok/s)."}}
{"run":340,"commit":"e9874e2","metric":104.55328759864335,"metrics":{},"status":"discard","description":"Immediate confirmation rerun of the strongest live recovery point: explicit-request DFlash with request-driven thinking, block 15, and `INITIAL_CACHE_BLOCKS=256`. It repeated in the same high band, but still stayed below the historical best.","timestamp":1776185523296,"segment":19,"confidence":3.1632668235061634,"iterationTokens":918,"asi":{"hypothesis":"If explicit-request DFlash plus `INITIAL_CACHE_BLOCKS=256` is the real near-frontier fallback under the current slowdown, an immediate rerun should reproduce near the first ~105.27 tok/s sample.","rollback_reason":"Primary metric remained below the current best 107.15 tok/s keep.","next_action_hint":"Treat this explicit-request + cache-256 configuration as the strongest current recovery baseline while investigating whether nearby cache values or related scheduler/cache settings can close the remaining ~2 tok/s gap honestly.","learning":"The explicit-request DFlash lane with `INITIAL_CACHE_BLOCKS=256` is reproducibly in the ~104.6–105.3 tok/s band, making it the strongest current recovery point under the present slowdown."}}
{"run":341,"commit":"e9874e2","metric":104.51314740828911,"metrics":{},"status":"discard","description":"Bracket the promising explicit-request recovery lane around `INITIAL_CACHE_BLOCKS=256` by testing `INITIAL_CACHE_BLOCKS=384`. It remained strong but was slightly worse than 256.","timestamp":1776185563319,"segment":19,"confidence":3.3578207330338787,"iterationTokens":900,"asi":{"hypothesis":"If the explicit-request recovery lane peaks slightly above 256 initial cache blocks, then 384 may outperform the confirmed ~104.6–105.3 tok/s band at 256.","rollback_reason":"Primary metric remained below the current best 107.15 tok/s keep and slightly below the 256-block explicit recovery point.","next_action_hint":"Keep 256 as the peak cache-reservation point on the explicit recovery lane for now; if further bracketing continues, prefer nearer values rather than larger jumps upward.","learning":"On the explicit-request recovery lane, the cache-reservation benefit also appears to peak near 256 rather than above it: 384 blocks (~104.51 tok/s) did not improve over 256."}}
{"run":342,"commit":"e9874e2","metric":104.09048323131056,"metrics":{},"status":"discard","description":"Bracket the promising explicit-request recovery lane below the current peak by testing `INITIAL_CACHE_BLOCKS=224`. It stayed strong but underperformed the 256-block point.","timestamp":1776185602915,"segment":19,"confidence":3.404792653823205,"iterationTokens":855,"asi":{"hypothesis":"If the explicit-request recovery lane peaks slightly below 256 initial cache blocks, then 224 may outperform the confirmed ~104.6–105.3 tok/s band at 256.","rollback_reason":"Primary metric remained below the current best 107.15 tok/s keep and below the 256-block explicit recovery point.","next_action_hint":"Treat 256 as the local optimum on the explicit recovery lane for now and look for other honest levers besides simple cache-reservation bracketing.","learning":"On the explicit-request recovery lane, the cache-reservation peak is not below 256 either: 224 blocks (~104.09 tok/s) also underperformed the 256-block point."}}
{"type":"config","name":"Qwen long-context DFlash vs stock sweep (starting at 2046 tokens)","metricName":"completion_tok_s","metricUnit":"","bestDirection":"higher"}
{"run":343,"commit":"bf01e15","metric":56.615578089602636,"metrics":{},"status":"keep","description":"Establish the first long-context baseline at 2046 completion tokens using the strongest current DFlash recovery configuration: explicit request-level DFlash, request-driven thinking, and INITIAL_CACHE_BLOCKS=256 on the real Qwen server path.","timestamp":1776186407581,"segment":20,"confidence":null,"iterationTokens":301,"asi":{"hypothesis":"Before sweeping longer contexts, the honest first checkpoint should be a 2046-token DFlash measurement on the current strongest recovery shape.","context_tokens":2046,"lane":"explicit_dflash_request_driven_thinking_cache256","learning":"At 2046 completion tokens, the current strongest DFlash recovery shape delivers about 56.62 tok/s on the real server path."}}
{"run":344,"commit":"bf01e15","metric":19.853986238940976,"metrics":{},"status":"discard","description":"Honest 2046-token stock comparison under the same server settings as the new DFlash baseline, except with request-level DFlash disabled. Stock is dramatically slower than DFlash on this real server path.","timestamp":1776186540928,"segment":20,"confidence":null,"iterationTokens":845,"asi":{"hypothesis":"At 2046 completion tokens, the current DFlash recovery configuration should still beat stock materially on the same honest server workload.","context_tokens":2046,"lane":"stock_same_server_settings","rollback_reason":"Stock throughput is far below the new 2046-token DFlash baseline (19.85 tok/s vs 56.62 tok/s), so this is not a better configuration.","next_action_hint":"Continue the long-context sweep upward with the same honest DFlash-vs-stock comparison pattern.","learning":"At 2046 completion tokens, DFlash beats stock by a very large margin on the real server path: ~56.62 tok/s vs ~19.85 tok/s."}}
{"run":345,"commit":"bf01e15","metric":30.408710516412757,"metrics":{},"status":"discard","description":"Establish the 4000-token DFlash checkpoint on the real Qwen server path using the strongest current long-context recovery shape: explicit request-level DFlash, request-driven thinking, and INITIAL_CACHE_BLOCKS=256.","timestamp":1776186736645,"segment":20,"confidence":null,"iterationTokens":1678,"asi":{"hypothesis":"At 4000 completion tokens, the same DFlash recovery shape that won at 2046 should still provide a strong long-context checkpoint before honest stock comparison.","context_tokens":4000,"lane":"explicit_dflash_request_driven_thinking_cache256","rollback_reason":"This is a characterization checkpoint for a longer workload and not a primary-metric improvement over the shorter-context baseline in this sweep.","next_action_hint":"Run the matched stock comparison at 4000 next to judge whether DFlash still leads at this longer decode length.","learning":"At 4000 completion tokens, the current DFlash recovery shape delivers about 30.41 tok/s on the real server path."}}
{"run":346,"commit":"bf01e15","metric":34.77126277746768,"metrics":{},"status":"discard","description":"Attempted matched stock comparison after the 4000-token DFlash checkpoint, but the preserved workload had reverted to MAX_TOKENS=2046, so this run is not a valid 4000-token stock comparison.","timestamp":1776186850260,"segment":20,"confidence":null,"iterationTokens":1034,"asi":{"hypothesis":"The next honest step after the 4000-token DFlash checkpoint was a matched stock comparison at the same token target.","context_tokens":2046,"lane":"stock_invalid_workload_drift","rollback_reason":"Invalid comparison: workload drifted back to 2046 tokens before the stock run, so this does not answer the 4000-token DFlash-vs-stock question.","next_action_hint":"Restore MAX_TOKENS=4000 explicitly and rerun the stock comparison before drawing any 4000-token conclusion.","learning":"Because workload files are preserved/reverted across autoresearch actions in non-obvious ways, long-context comparisons need an explicit read-back before each run."}}
{"run":347,"commit":"bf01e15","metric":36.06962694585407,"metrics":{},"status":"discard","description":"Honest 4000-token stock comparison under the same server settings as the 4000-token DFlash checkpoint, except with request-level DFlash disabled. On this context length, stock is currently faster than the tested DFlash shape.","timestamp":1776187002443,"segment":20,"confidence":null,"iterationTokens":2244,"asi":{"hypothesis":"At 4000 completion tokens, DFlash may still outperform stock on the same real server workload under the current strongest recovery configuration.","context_tokens":4000,"lane":"stock_same_server_settings","rollback_reason":"The matched stock run was faster than the tested DFlash shape at this context length (36.07 tok/s stock vs 30.41 tok/s DFlash), so the current DFlash configuration is not yet good enough at 4000.","next_action_hint":"Pivot to long-context-specific DFlash tuning at 4000 tokens, especially adaptive block-size or other tail-behavior controls, and retest against this 36.07 tok/s stock checkpoint.","learning":"At 4000 completion tokens, the current tested DFlash shape loses to stock on the real server path: ~30.41 tok/s vs ~36.07 tok/s."}}
{"run":348,"commit":"bf01e15","metric":32.08650463895998,"metrics":{},"status":"discard","description":"Test the deferred long-context adaptive-block path honestly at 4000 completion tokens by enabling tail-only adaptive block sizing (`DFLASH_BSTNXBT_ADAPTIVE_BLOCK=1`, start at 768`) on the explicit-request DFlash recovery shape. It improves DFlash at 4000, but still does not beat stock.","timestamp":1776187184294,"segment":20,"confidence":null,"iterationTokens":2075,"asi":{"hypothesis":"The 1024-token lane showed neutral results for late adaptive block sizing, but at 4000 tokens the long tail may benefit enough for DFlash to catch or exceed stock.","context_tokens":4000,"lane":"explicit_dflash_request_driven_thinking_cache256_adaptive_from_768","rollback_reason":"Although adaptive block sizing improved DFlash at 4000 (~32.09 tok/s vs ~30.41), it still remained below the matched 4000-token stock checkpoint (~36.07 tok/s).","next_action_hint":"Continue long-context-specific DFlash tuning at 4000; try earlier adaptive start or nearby block-size adjustments rather than assuming the 1024-token optimum transfers unchanged.","learning":"Tail-only adaptive block sizing is a real long-context lever: at 4000 tokens it improved DFlash from ~30.41 to ~32.09 tok/s, but DFlash still trails stock at this length."}}
{"run":349,"commit":"bf01e15","metric":28.702748412116733,"metrics":{},"status":"discard","description":"Retest long-context adaptive block sizing at 4000 tokens with an earlier start (`DFLASH_BSTNXBT_ADAPTIVE_BLOCK_START=256`) on the explicit-request DFlash recovery shape. This was worse than the tail-only 768-start version.","timestamp":1776187359316,"segment":20,"confidence":null,"iterationTokens":1425,"asi":{"hypothesis":"If adaptive block sizing helps at 4000, starting it earlier in the decode may recover more of the long tail and possibly beat stock.","context_tokens":4000,"lane":"explicit_dflash_request_driven_thinking_cache256_adaptive_from_256","rollback_reason":"Starting adaptive shrink earlier regressed badly (~28.70 tok/s), below both the non-adaptive 4000 DFlash result (~30.41) and the tail-only 768-start adaptive result (~32.09).","next_action_hint":"Keep any future adaptive-block experiments tail-only at long lengths; do not start shrink this early again.","learning":"At 4000 tokens, adaptive block sizing only helps when deferred into the tail; starting at 256 tokens is clearly harmful."}}
{"run":350,"commit":"bf01e15","metric":25.210353555329377,"metrics":{},"status":"discard","description":"Test a nearby fixed block-size shift for long-context DFlash by moving from block 15 to block 14 at 4000 tokens on the explicit-request recovery shape with cache256. It regressed heavily.","timestamp":1776187551566,"segment":20,"confidence":null,"iterationTokens":966,"asi":{"hypothesis":"If the 4000-token slowdown reflects a shifted fixed block-size optimum, lowering the explicit DFlash block from 15 to 14 may improve long-context throughput.","context_tokens":4000,"lane":"explicit_dflash_request_driven_thinking_cache256_block14","rollback_reason":"Throughput collapsed to ~25.21 tok/s, well below the fixed block-15 result (~30.41) and the matched stock checkpoint (~36.07).","next_action_hint":"Do not pursue smaller fixed blocks on this 4000-token explicit lane; tail-only adaptive strategies are more promising than retuning the whole decode to 14.","learning":"At 4000 tokens on the explicit-request recovery shape, fixed block 14 is much worse than fixed block 15."}}
{"run":351,"commit":"bf01e15","metric":29.66037497013292,"metrics":{},"status":"discard","description":"Test the other nearby fixed block-size shift for long-context DFlash by moving from block 15 to block 16 at 4000 tokens on the explicit-request recovery shape with cache256. It remained worse than block 15.","timestamp":1776187717778,"segment":20,"confidence":null,"iterationTokens":909,"asi":{"hypothesis":"If the 4000-token slowdown reflects a shifted fixed block-size optimum, raising the explicit DFlash block from 15 to 16 may improve long-context throughput.","context_tokens":4000,"lane":"explicit_dflash_request_driven_thinking_cache256_block16","rollback_reason":"Throughput reached only ~29.66 tok/s, below the fixed block-15 result (~30.41) and below the matched stock checkpoint (~36.07).","next_action_hint":"The 4000-token problem is not solved by simple nearby fixed block retunes; continue focusing on tail-specific strategies or other long-context-specific levers.","learning":"At 4000 tokens on the explicit-request recovery shape, fixed block 16 is still worse than fixed block 15."}}
{"run":352,"commit":"bf01e15","metric":29.951282198922186,"metrics":{},"status":"discard","description":"Retest long-context adaptive block sizing at 4000 tokens with a later tail-only start (`DFLASH_BSTNXBT_ADAPTIVE_BLOCK_START=1024`) on the explicit-request DFlash recovery shape. It was worse than the 768-start version.","timestamp":1776187883104,"segment":20,"confidence":null,"iterationTokens":971,"asi":{"hypothesis":"If the helpful long-context adaptive-block effect is too aggressive at start=768, delaying it to start=1024 may preserve more mid-decode throughput while still helping the tail.","context_tokens":4000,"lane":"explicit_dflash_request_driven_thinking_cache256_adaptive_from_1024","rollback_reason":"Throughput reached only ~29.95 tok/s, below the 768-start adaptive result (~32.09) and below the matched stock checkpoint (~36.07).","next_action_hint":"Among the tested adaptive starts at 4000, 768 remains the best. Look for other long-context levers rather than moving the adaptive start later.","learning":"At 4000 tokens, the helpful adaptive-block effect is not improved by delaying its start from 768 to 1024; that makes DFlash worse, not better."}}
{"run":353,"commit":"bf01e15","metric":32.82871018864086,"metrics":{},"status":"discard","description":"Test the broader normal-request DFlash lane at 4000 completion tokens with request-driven thinking and INITIAL_CACHE_BLOCKS=256, to see whether the normal-request shape beats the explicit-request DFlash variant at this longer decode length. It improved over the earlier explicit fixed-block run, but still trailed stock.","timestamp":1776188049234,"segment":20,"confidence":null,"iterationTokens":3188,"asi":{"hypothesis":"At 4000 tokens, the broader normal-request DFlash lane may outperform the explicit-request DFlash shape just as it did on the 1024-token authority lane.","context_tokens":4000,"lane":"broader_request_driven_thinking_cache256","rollback_reason":"Although this improved over the earlier explicit 4000-token DFlash result (~32.83 vs ~30.41), it still remained below the matched stock checkpoint (~36.07 tok/s).","next_action_hint":"Use the broader 4000-token DFlash lane as the new long-context baseline for further tuning, since it is stronger than the explicit fixed-block variant.","learning":"At 4000 tokens, the broader normal-request DFlash lane is stronger than the earlier explicit fixed-block DFlash shape (~32.83 vs ~30.41 tok/s), but DFlash still trails stock at this length."}}
{"run":354,"commit":"bf01e15","metric":30.73238501333078,"metrics":{},"status":"discard","description":"Test tail-only adaptive block sizing (`DFLASH_BSTNXBT_ADAPTIVE_BLOCK=1`, start at 768) on the stronger broader normal-request 4000-token DFlash lane with cache256. Unlike the explicit lane, this regressed.","timestamp":1776188218275,"segment":20,"confidence":null,"iterationTokens":1034,"asi":{"hypothesis":"Since the broader 4000-token DFlash lane is stronger than the explicit fixed-block lane, adding the same tail-only adaptive block sizing may push it past stock.","context_tokens":4000,"lane":"broader_request_driven_thinking_cache256_adaptive_from_768","rollback_reason":"Throughput regressed to ~30.73 tok/s, below the broader fixed-block baseline (~32.83) and below stock (~36.07).","next_action_hint":"Do not combine tail-only adaptive block sizing with the broader 4000-token lane again; any future long-context adaptive work should stay on the explicit-request DFlash shape unless new evidence appears.","learning":"At 4000 tokens, tail-only adaptive block sizing is shape-dependent: it helped the explicit DFlash lane but hurt the broader normal-request lane."}}
