{"run":622,"commit":"8b55918","metric":105.48536563619338,"metrics":{},"status":"discard","description":"Confirmation rerun for INITIAL_CACHE_BLOCKS=112 candidate.","timestamp":1776280357440,"segment":23,"confidence":4.023273339323101,"iterationTokens":789,"asi":{"hypothesis":"If 112 was a real near-win, confirmation should stay near prior 106.61 sample.","rollback_reason":"Confirmation dropped to 105.49, failing reproducibility vs keep.","next_action_hint":"Add 112 to non-winning cache reservation set; keep default reservation.","backend":"mirror_sd_mlx","context_only_draft_cache":1,"draft_sink":48,"initial_cache_blocks":112,"confirmation_run":true}}
{"run":623,"commit":"8b55918","metric":104.63529904281877,"metrics":{},"status":"discard","description":"Context-only window neighborhood test: DFLASH_DRAFT_WINDOW=960 with sink=48.","timestamp":1776280407536,"segment":23,"confidence":4.150062099617719,"iterationTokens":896,"asi":{"hypothesis":"A near-default window (960) might balance attention cost and draft quality better than 1024 in current regime.","rollback_reason":"Below keep (104.64 vs 106.86).","next_action_hint":"Treat 960 as non-winning and keep default window.","backend":"mirror_sd_mlx","context_only_draft_cache":1,"draft_sink":48,"draft_window":960}}
{"run":624,"commit":"8b55918","metric":105.5315489018312,"metrics":{},"status":"discard","description":"Context-only window neighborhood test: DFLASH_DRAFT_WINDOW=1088 with sink=48.","timestamp":1776280442500,"segment":23,"confidence":4.219817933201449,"iterationTokens":686,"asi":{"hypothesis":"A slightly larger near-default window (1088) may improve acceptance with modest overhead increase.","rollback_reason":"Below keep (105.53 vs 106.86).","next_action_hint":"Treat 1088 as non-winning; retain default window.","backend":"mirror_sd_mlx","context_only_draft_cache":1,"draft_sink":48,"draft_window":1088}}
{"run":625,"commit":"8b55918","metric":104.4753674758023,"metrics":{},"status":"discard","description":"Stability-lever extension under mirror keep shape: INITIAL_CACHE_BLOCKS=160.","timestamp":1776280491586,"segment":23,"confidence":4.252209448076962,"iterationTokens":910,"asi":{"hypothesis":"A higher mid-range reservation (160) might be a better tradeoff than 128/256 in this lane.","rollback_reason":"Below keep (104.48 vs 106.86).","next_action_hint":"Add 160 to non-winning cache reservation set.","backend":"mirror_sd_mlx","context_only_draft_cache":1,"draft_sink":48,"initial_cache_blocks":160}}
{"run":626,"commit":"8b55918","metric":106.8100508155187,"metrics":{},"status":"discard","description":"Stability-lever extension under mirror keep shape: INITIAL_CACHE_BLOCKS=192.","timestamp":1776280534646,"segment":23,"confidence":4.210362667658198,"iterationTokens":687,"asi":{"hypothesis":"A high mid-range cache reservation (192) may recover performance without the penalties seen at 256+.","rollback_reason":"Very close but below keep (106.81 vs 106.86).","next_action_hint":"Run confirmation at 192 due near-keep proximity before final pruning.","backend":"mirror_sd_mlx","context_only_draft_cache":1,"draft_sink":48,"initial_cache_blocks":192}}
{"run":627,"commit":"8b55918","metric":105.72934800081396,"metrics":{},"status":"discard","description":"Confirmation rerun for INITIAL_CACHE_BLOCKS=192 candidate.","timestamp":1776280576243,"segment":23,"confidence":4.261341237923992,"iterationTokens":720,"asi":{"hypothesis":"If 192 is a true improvement candidate, confirmation should remain near 106.81 sample.","rollback_reason":"Confirmation dropped to 105.73, below keep and non-reproducible.","next_action_hint":"Add 192 to non-winning cache reservation set; retain default reservation.","backend":"mirror_sd_mlx","context_only_draft_cache":1,"draft_sink":48,"initial_cache_blocks":192,"confirmation_run":true}}
{"run":628,"commit":"8b55918","metric":105.7819785591026,"metrics":{},"status":"discard","description":"Stability-lever extension under mirror keep shape: INITIAL_CACHE_BLOCKS=224.","timestamp":1776280619365,"segment":23,"confidence":4.362268147215566,"iterationTokens":915,"asi":{"hypothesis":"A reservation of 224 may outperform 192/256 by reducing realloc churn without over-reserving.","rollback_reason":"Below keep (105.78 vs 106.86).","next_action_hint":"Add 224 to non-winning cache set for this lane.","backend":"mirror_sd_mlx","context_only_draft_cache":1,"draft_sink":48,"initial_cache_blocks":224}}
{"run":629,"commit":"8b55918","metric":105.82487843809807,"metrics":{},"status":"discard","description":"Stability-lever extension under mirror keep shape: INITIAL_CACHE_BLOCKS=384.","timestamp":1776280672667,"segment":23,"confidence":4.459671576901708,"iterationTokens":699,"asi":{"hypothesis":"A high reservation value (384) may reduce allocator churn and improve consistency versus 256/512.","rollback_reason":"Below keep (105.82 vs 106.86).","next_action_hint":"Add 384 to non-winning cache set for this lane.","backend":"mirror_sd_mlx","context_only_draft_cache":1,"draft_sink":48,"initial_cache_blocks":384}}
{"run":630,"commit":"8b55918","metric":65.96638598433782,"metrics":{},"status":"discard","description":"Unchanged mirror anchor run during paired-bundle tracking.","timestamp":1776280717862,"segment":23,"confidence":4.362268147215566,"iterationTokens":923,"asi":{"hypothesis":"Keep-shape mirror run should stay in high-100 band if current window is stable.","rollback_reason":"Severe transient collapse to 65.97 tok/s on unchanged config.","next_action_hint":"Run immediate control symmetry check to classify this as global or mirror-specific instability.","backend":"mirror_sd_mlx","context_only_draft_cache":1,"draft_sink":48,"collapse_regime":true}}
{"run":631,"commit":"8b55918","metric":61.309140541760044,"metrics":{},"status":"discard","description":"Control symmetry check after mirror collapse (mirror disabled).","timestamp":1776280767140,"segment":23,"confidence":4.261341237923992,"iterationTokens":681,"asi":{"hypothesis":"If mirror collapse is backend-specific, control should remain near normal band.","rollback_reason":"Control also collapsed to 61.31 tok/s, indicating global instability window.","next_action_hint":"Treat this as regime collapse; run recovery probes before any tuning conclusions.","backend":"bstnxbt_mlx","mirror_runtime_enabled":0,"context_only_draft_cache":1,"draft_sink":48,"collapse_regime":true}}
{"run":632,"commit":"8b55918","metric":68.7355815694867,"metrics":{},"status":"discard","description":"Recovery probe after global collapse pair (unchanged mirror keep config).","timestamp":1776280801065,"segment":23,"confidence":4.210362667658198,"iterationTokens":593,"asi":{"hypothesis":"Throughput should begin recovering from ~61-66 collapse trough on immediate reruns.","rollback_reason":"Only partial rebound to 68.74 tok/s.","next_action_hint":"Continue sparse recovery probes until high-band resumes; avoid tuning claims during trough.","backend":"mirror_sd_mlx","context_only_draft_cache":1,"draft_sink":48,"stability_probe":true}}
{"run":633,"commit":"8b55918","metric":68.93089337152692,"metrics":{},"status":"discard","description":"Second recovery probe after global collapse pair (unchanged mirror keep config).","timestamp":1776280836863,"segment":23,"confidence":4.180926939762,"iterationTokens":596,"asi":{"hypothesis":"A second rerun may continue recovery toward normal high-band performance.","rollback_reason":"Still stuck near ~69 tok/s.","next_action_hint":"Record renewed collapse trough in ideas and keep experiments focused on stability characterization until recovery.","backend":"mirror_sd_mlx","context_only_draft_cache":1,"draft_sink":48,"stability_probe":true}}
{"run":634,"commit":"8b55918","metric":71.7580332465883,"metrics":{},"status":"discard","description":"Control symmetry probe in renewed ~69 trough (mirror disabled).","timestamp":1776280883289,"segment":23,"confidence":4.142746259892584,"iterationTokens":665,"asi":{"hypothesis":"If trough is global, control should remain similarly depressed.","rollback_reason":"Control also low (71.76), confirming shared instability.","next_action_hint":"Treat current session segment as instability characterization; avoid micro-tuning conclusions.","backend":"bstnxbt_mlx","mirror_runtime_enabled":0,"context_only_draft_cache":1,"draft_sink":48,"collapse_regime":true}}
{"run":635,"commit":"8b55918","metric":73.99057864985673,"metrics":{},"status":"discard","description":"Mirror follow-up after trough control symmetry probe.","timestamp":1776280918431,"segment":23,"confidence":4.075432811673992,"iterationTokens":587,"asi":{"hypothesis":"Mirror should show similar depressed behavior if trough remains globally driven.","rollback_reason":"Mirror remained low (73.99), consistent with global degraded window.","next_action_hint":"Pause new tuning probes until throughput recovers into high-100 band.","backend":"mirror_sd_mlx","context_only_draft_cache":1,"draft_sink":48,"collapse_regime":true}}
{"run":636,"commit":"8b55918","metric":77.12970514930937,"metrics":{},"status":"discard","description":"Additional recovery probe in renewed collapse segment (unchanged mirror keep config).","timestamp":1776280980919,"segment":23,"confidence":4.006969744393482,"iterationTokens":1353,"asi":{"hypothesis":"Throughput may start returning from ~61–74 trough toward high-100 band with continued reruns.","rollback_reason":"Only slight rebound to 77.13; still deep below keep.","next_action_hint":"Maintain instability-tracking mode and defer new tuning sweeps until band normalizes.","backend":"mirror_sd_mlx","context_only_draft_cache":1,"draft_sink":48,"stability_probe":true}}
{"run":637,"commit":"8b55918","metric":84.08554818147354,"metrics":{},"status":"discard","description":"Control symmetry check after 77.13 mirror recovery sample (mirror disabled).","timestamp":1776281041706,"segment":23,"confidence":3.8481996883802596,"iterationTokens":690,"asi":{"hypothesis":"If the renewed trough is fully global, control should remain near the same depressed level as mirror.","rollback_reason":"Control recovered higher (84.09), indicating local backend ordering can still swing materially in unstable windows.","next_action_hint":"Run immediate mirror follow-up for paired comparison; keep treating ordering as noise-prone.","backend":"bstnxbt_mlx","mirror_runtime_enabled":0,"context_only_draft_cache":1,"draft_sink":48,"paired_delta_tok_s":-6.955843032164171}}
{"run":638,"commit":"8b55918","metric":85.38958906205954,"metrics":{},"status":"discard","description":"Mirror follow-up after control-leading sample in renewed collapse/recovery window.","timestamp":1776281080026,"segment":23,"confidence":3.7015321312720246,"iterationTokens":639,"asi":{"hypothesis":"If control's lead was transient, mirror should rebound toward or above paired control on immediate rerun.","rollback_reason":"Mirror rebounded above control (85.39 vs 84.09) but remains far below keep.","next_action_hint":"Continue stability characterization; delay new tuning dimensions until high-band recovery is sustained.","backend":"mirror_sd_mlx","context_only_draft_cache":1,"draft_sink":48,"paired_control_tok_s":84.08554818147354,"paired_delta_tok_s":1.3040408805860035}}
{"run":639,"commit":"8b55918","metric":105.18067059201951,"metrics":{},"status":"discard","description":"Context-only cache optimization v2: pre-overflow trim in append_context (skip per-append apply_window scan, reduce extra concat work).","timestamp":1776281292027,"segment":23,"confidence":3.8481996883802596,"iterationTokens":3651,"asi":{"hypothesis":"Handling overflow in append_context directly and avoiding always calling _apply_window can reduce draft-cache overhead and improve mirror throughput.","rollback_reason":"Below keep (105.18 vs 106.86).","next_action_hint":"Revert this context-only cache rewrite; current simple append+apply_window remains better under benchmark.","backend":"mirror_sd_mlx","context_only_draft_cache":1,"draft_sink":48,"optimization":"context_cache_pretrim_v2"}}
{"run":640,"commit":"8b55918","metric":103.51331983084226,"metrics":{},"status":"discard","description":"Mirror split chunk extension: DFLASH_BSTNXBT_SPLIT_CHUNK_SIZE=18.","timestamp":1776281338969,"segment":23,"confidence":3.814765683937666,"iterationTokens":918,"asi":{"hypothesis":"A larger split chunk than previously tested may reduce split-SDPA overhead on this lane.","rollback_reason":"Clear regression versus keep (103.51 vs 106.86).","next_action_hint":"Add chunk size 18 to mirror do-not-retry set; large chunks remain non-winning on 1024 lane.","backend":"mirror_sd_mlx","context_only_draft_cache":1,"draft_sink":48,"split_chunk_size":18}}
{"run":641,"commit":"8b55918","metric":105.55833711365895,"metrics":{},"status":"discard","description":"Mirror split chunk extension: DFLASH_BSTNXBT_SPLIT_CHUNK_SIZE=20.","timestamp":1776281390613,"segment":23,"confidence":3.91624614942682,"iterationTokens":722,"asi":{"hypothesis":"Chunk size 20 might hit a non-monotonic sweet spot beyond previously tested values.","rollback_reason":"Below keep (105.56 vs 106.86).","next_action_hint":"Add chunk size 20 to do-not-retry set; no evidence large chunks beat default 8.","backend":"mirror_sd_mlx","context_only_draft_cache":1,"draft_sink":48,"split_chunk_size":20}}
{"run":642,"commit":"8b55918","metric":102.59122020665922,"metrics":{},"status":"discard","description":"Mirror split chunk extension: DFLASH_BSTNXBT_SPLIT_CHUNK_SIZE=24.","timestamp":1776281433778,"segment":23,"confidence":3.829539824666601,"iterationTokens":725,"asi":{"hypothesis":"Long-context winner chunk size 24 might transfer partially to 1024 mirror lane.","rollback_reason":"Large regression versus keep (102.59 vs 106.86).","next_action_hint":"Add chunk size 24 to mirror do-not-retry set for 1024 lane.","backend":"mirror_sd_mlx","context_only_draft_cache":1,"draft_sink":48,"split_chunk_size":24}}
{"run":643,"commit":"8b55918","metric":39.83804918752218,"metrics":{},"status":"discard","description":"Baseline anchor rerun after large split-chunk extension sweeps (unchanged keep config).","timestamp":1776281485919,"segment":23,"confidence":3.750478617045227,"iterationTokens":654,"asi":{"hypothesis":"After reverting chunk overrides, baseline should return to current operating band.","rollback_reason":"Severe collapse to 39.84 tok/s on unchanged keep config.","next_action_hint":"Run immediate control symmetry check (mirror off) to confirm global instability vs backend-specific regression.","backend":"mirror_sd_mlx","context_only_draft_cache":1,"draft_sink":48,"collapse_regime":true}}
{"run":644,"commit":"8b55918","metric":64.28957228776586,"metrics":{},"status":"discard","description":"Control symmetry check after 39.84 mirror collapse (mirror disabled).","timestamp":1776281535697,"segment":23,"confidence":3.6746158297787983,"iterationTokens":694,"asi":{"hypothesis":"If collapse was global, control should also show strong degradation in the same window.","rollback_reason":"Control also degraded sharply to 64.29 tok/s, confirming broad instability (though less extreme than mirror sample).","next_action_hint":"Run immediate mirror follow-up to complete pair and characterize rebound dynamics.","backend":"bstnxbt_mlx","mirror_runtime_enabled":0,"context_only_draft_cache":1,"draft_sink":48,"collapse_regime":true}}
{"run":645,"commit":"8b55918","metric":67.33625617984691,"metrics":{},"status":"discard","description":"Mirror follow-up after control degradation sample in collapse window.","timestamp":1776281578454,"segment":23,"confidence":3.3843027922525493,"iterationTokens":633,"asi":{"hypothesis":"Mirror should remain similarly depressed if the regime collapse is global.","rollback_reason":"Mirror remained low at 67.34 tok/s, confirming continued trough.","next_action_hint":"Pause tuning sweeps and continue sparse recovery probes until throughput exits collapse regime.","backend":"mirror_sd_mlx","context_only_draft_cache":1,"draft_sink":48,"collapse_regime":true}}
{"run":646,"commit":"8b55918","metric":51.888398629103655,"metrics":{},"status":"discard","description":"Additional recovery probe during persistent collapse regime (unchanged mirror keep config).","timestamp":1776281624876,"segment":23,"confidence":3.2190831490123717,"iterationTokens":583,"asi":{"hypothesis":"Repeated unchanged runs may recover from trough without code/env changes.","rollback_reason":"Further collapse to 51.89 tok/s.","next_action_hint":"Treat current environment as severely unstable; avoid interpreting optimization deltas and prioritize regime diagnostics/monitoring.","backend":"mirror_sd_mlx","context_only_draft_cache":1,"draft_sink":48,"collapse_regime":true}}
{"run":647,"commit":"8b55918","metric":70.17211261050036,"metrics":{},"status":"discard","description":"Continued recovery monitoring run in collapse regime (unchanged mirror keep config).","timestamp":1776281687473,"segment":23,"confidence":3.190497153511411,"iterationTokens":2917,"asi":{"hypothesis":"Repeated unchanged runs may indicate whether throughput is climbing out of trough.","rollback_reason":"Still in low-throughput trough (~70 tok/s).","next_action_hint":"Remain in stability-monitoring mode; avoid introducing fresh tuning knobs while collapse persists.","backend":"mirror_sd_mlx","context_only_draft_cache":1,"draft_sink":48,"collapse_regime":true}}
{"run":648,"commit":"8b55918","metric":78.41527377783656,"metrics":{},"status":"discard","description":"Control symmetry run after 70 tok/s mirror trough sample (mirror disabled).","timestamp":1776281740762,"segment":23,"confidence":3.160787518196917,"iterationTokens":669,"asi":{"hypothesis":"If trough remains global, control should also remain in depressed range.","rollback_reason":"Control also depressed (78.42), though somewhat above mirror in this pair.","next_action_hint":"Continue paired tracking; treat backend ordering during trough as unstable/noise-prone.","backend":"bstnxbt_mlx","mirror_runtime_enabled":0,"context_only_draft_cache":1,"draft_sink":48,"paired_delta_tok_s":-8.243161167336208}}
{"run":649,"commit":"8b55918","metric":81.2694470162378,"metrics":{},"status":"discard","description":"Mirror follow-up after control sample in depressed regime.","timestamp":1776281773279,"segment":23,"confidence":3.0447751591353116,"iterationTokens":607,"asi":{"hypothesis":"Mirror should move toward control as trough recovers if degradation is mostly global.","rollback_reason":"Mirror recovered to 81.27 and now sits slightly above paired control, but still far below keep.","next_action_hint":"Continue stability monitoring until high-band resumes before resuming optimization sweeps.","backend":"mirror_sd_mlx","context_only_draft_cache":1,"draft_sink":48,"paired_control_tok_s":78.41527377783656,"paired_delta_tok_s":2.854173238401237}}
{"run":650,"commit":"8b55918","metric":90.9087919609394,"metrics":{},"status":"discard","description":"Recovery monitoring run after extended collapse characterization (unchanged mirror keep config).","timestamp":1776281835276,"segment":23,"confidence":2.930639033223776,"iterationTokens":1770,"asi":{"hypothesis":"Throughput may continue climbing from trough toward normal high-band values with unchanged config.","rollback_reason":"Recovered into low-90s but still materially below keep (106.86).","next_action_hint":"If recovery continues into ~100+, resume targeted A/B bundles; otherwise remain in stability-monitoring mode.","backend":"mirror_sd_mlx","context_only_draft_cache":1,"draft_sink":48,"stability_probe":true}}
{"run":651,"commit":"8b55918","metric":94.54694166201647,"metrics":{},"status":"discard","description":"Control pair run after 90.91 mirror recovery sample (mirror disabled).","timestamp":1776281879466,"segment":23,"confidence":2.9047320521655022,"iterationTokens":697,"asi":{"hypothesis":"Control comparison will indicate whether mirror recovery is backend-specific or shared regime rebound.","rollback_reason":"Control run is comparison-only; not a mirror keep candidate.","next_action_hint":"Current pair favors control by ~3.64 tok/s; run immediate mirror follow-up before interpreting direction.","backend":"bstnxbt_mlx","mirror_runtime_enabled":0,"context_only_draft_cache":1,"draft_sink":48,"paired_delta_tok_s":-3.63814970107707}}
{"run":652,"commit":"8b55918","metric":96.74703373549951,"metrics":{},"status":"discard","description":"Mirror follow-up after control-leading recovery pair.","timestamp":1776281918014,"segment":23,"confidence":2.879279095272134,"iterationTokens":629,"asi":{"hypothesis":"If control lead was transient, immediate mirror rerun should close the gap.","rollback_reason":"Mirror improved to 96.75 and now slightly exceeds paired control, but still below keep.","next_action_hint":"Recovery appears ongoing into mid/high-90s; continue conservative paired bundles before resuming parameter sweeps.","backend":"mirror_sd_mlx","context_only_draft_cache":1,"draft_sink":48,"paired_control_tok_s":94.54694166201647,"paired_delta_tok_s":2.200092073483041}}
{"run":653,"commit":"8b55918","metric":97.40532753830927,"metrics":{},"status":"discard","description":"Additional unchanged recovery-monitoring run on mirror keep config.","timestamp":1776281961810,"segment":23,"confidence":2.8132367112018164,"iterationTokens":652,"asi":{"hypothesis":"If the collapse trough is lifting, repeated unchanged runs should trend upward toward pre-collapse bands.","rollback_reason":"Still below keep at 97.41 despite gradual recovery.","next_action_hint":"Keep monitoring until stable >100 band returns, then resume targeted A/B optimization probes.","backend":"mirror_sd_mlx","context_only_draft_cache":1,"draft_sink":48,"stability_probe":true}}
