{"run":654,"commit":"8b55918","metric":100.9595383329615,"metrics":{},"status":"discard","description":"Paired control run after 97.41 mirror recovery sample (mirror disabled).","timestamp":1776282013125,"segment":23,"confidence":2.778680709943429,"iterationTokens":1407,"asi":{"hypothesis":"Control pair will show whether recovery trend is shared or mirror-specific.","rollback_reason":"Control run is comparison-only; not a mirror keep candidate.","next_action_hint":"This pair favors control by ~3.55 tok/s; run immediate mirror follow-up for symmetry before concluding direction.","backend":"bstnxbt_mlx","mirror_runtime_enabled":0,"context_only_draft_cache":1,"draft_sink":48,"paired_delta_tok_s":-3.5542107946522314}}
{"run":655,"commit":"8b55918","metric":102.98628589979897,"metrics":{},"status":"discard","description":"Mirror follow-up after control-leading pair in recovering regime.","timestamp":1776282047088,"segment":23,"confidence":2.8224359926198694,"iterationTokens":638,"asi":{"hypothesis":"If control lead was transient, immediate mirror rerun should close gap and possibly flip ordering.","rollback_reason":"Mirror improved and now exceeds paired control (102.99 vs 100.96), but still below keep.","next_action_hint":"Ordering flips persist; continue paired bundles and prioritize only robust >106.86 candidates.","backend":"mirror_sd_mlx","context_only_draft_cache":1,"draft_sink":48,"paired_control_tok_s":100.9595383329615,"paired_delta_tok_s":2.026747566837474}}
{"run":656,"commit":"8b55918","metric":104.83140545156307,"metrics":{},"status":"discard","description":"Mirror anchor run after resume to check if throughput band recovered before new candidate testing.","timestamp":1776283133962,"segment":23,"confidence":2.888228427608669,"iterationTokens":638,"asi":{"hypothesis":"Current mirror keep-shape config may have recovered toward historical ~105-107 band after prior collapse cycles.","rollback_reason":"Below keep (104.83 vs 106.86), used as stability anchor only.","next_action_hint":"Run immediate control pair to measure current backend delta in the recovered band.","backend":"mirror_sd_mlx","context_only_draft_cache":1,"draft_sink":48,"stability_probe":true}}
{"run":657,"commit":"8b55918","metric":105.13125571273311,"metrics":{},"status":"discard","description":"Control pair run for recovered-band mirror anchor comparison (mirror disabled).","timestamp":1776283165855,"segment":23,"confidence":2.9093014174440266,"iterationTokens":719,"asi":{"hypothesis":"If recovered band is shared, control should be near mirror anchor; pair delta should stay small and noisy.","rollback_reason":"Comparison run only; not a mirror candidate keep.","next_action_hint":"Mirror/control are near-tied (~0.30 tok/s control lead); proceed with structural candidate test rather than micro-knob churn.","backend":"bstnxbt_mlx","mirror_runtime_enabled":0,"context_only_draft_cache":1,"draft_sink":48,"paired_mirror_tok_s":104.83140545156307,"paired_delta_tok_s":-0.2998502611700385}}
{"run":658,"commit":"8b55918","metric":105.39612778601517,"metrics":{},"status":"discard","description":"Structural cache-key optimization: pass capture layers as frozenset and remove per-call capture-layer sorting/conversion in mirror target caches.","timestamp":1776283272981,"segment":23,"confidence":2.9306841713715337,"iterationTokens":5766,"asi":{"hypothesis":"Eliminating repeated capture-layer key normalization in mirror target forward path should reduce Python overhead and improve combined DFlash+Mirror throughput.","rollback_reason":"Did not beat keep (105.40 vs 106.86).","next_action_hint":"Revert this cache-key normalization change; pursue larger structural reductions in per-layer loop overhead.","backend":"mirror_sd_mlx","context_only_draft_cache":1,"draft_sink":48,"optimization":"mirror_capture_key_frozenset_fastpath"}}
{"run":659,"commit":"8b55918","metric":103.45115685978655,"metrics":{},"status":"discard","description":"Extended mirror split sweep into untested high band: DFLASH_MIRROR_SD_EXIT_LAYER=26.","timestamp":1776283325141,"segment":23,"confidence":3.0497961232513537,"iterationTokens":2182,"asi":{"hypothesis":"High-layer split points (beyond previously tested <=25) might unlock additional mirror target-forward efficiency.","rollback_reason":"Regression versus keep (103.45 vs 106.86).","next_action_hint":"Add exit layer 26 to do-not-retry set; continue sparse high-band sweep only if clear rationale remains.","backend":"mirror_sd_mlx","context_only_draft_cache":1,"draft_sink":48,"mirror_exit_layer":26}}
{"run":660,"commit":"8b55918","metric":103.82649426823683,"metrics":{},"status":"discard","description":"Extended mirror split sweep into untested high band: DFLASH_MIRROR_SD_EXIT_LAYER=28.","timestamp":1776283355404,"segment":23,"confidence":3.162414386081056,"iterationTokens":715,"asi":{"hypothesis":"Another high-layer split candidate may outperform both mid-layer keep and nearby high-layer points.","rollback_reason":"Still below keep (103.83 vs 106.86).","next_action_hint":"Mark exit layer 28 non-winning on 1024 lane; continue with broader-structure ideas instead of split-point churn.","backend":"mirror_sd_mlx","context_only_draft_cache":1,"draft_sink":48,"mirror_exit_layer":28}}
{"run":661,"commit":"8b55918","metric":54.02936355886297,"metrics":{},"status":"discard","description":"Extended mirror split sweep high endpoint: DFLASH_MIRROR_SD_EXIT_LAYER=31.","timestamp":1776283395407,"segment":23,"confidence":3.0497961232513537,"iterationTokens":705,"asi":{"hypothesis":"Final-layer split might maximize shared-prefix execution and reduce speculative overhead.","rollback_reason":"Severe cliff at 54.03 tok/s.","next_action_hint":"Add exit layer 31 as a hard do-not-retry cliff and stop high-exit sweep; revert to keep exit layer 14.","backend":"mirror_sd_mlx","context_only_draft_cache":1,"draft_sink":48,"mirror_exit_layer":31,"cliff":true}}
{"run":662,"commit":"8b55918","metric":52.26146108812446,"metrics":{},"status":"discard","description":"High-exit mirror sweep confirmation: DFLASH_MIRROR_SD_EXIT_LAYER=30.","timestamp":1776283445673,"segment":23,"confidence":2.9306841713715337,"iterationTokens":801,"asi":{"hypothesis":"If only the absolute top split was pathological, one-step-lower high split could still be viable.","rollback_reason":"Also catastrophic at 52.26 tok/s, confirming high-end exit-layer cliff.","next_action_hint":"Treat high exit layers near top stack as exhausted/non-viable for 1024 lane; return to keep layer 14 and refocus.","backend":"mirror_sd_mlx","context_only_draft_cache":1,"draft_sink":48,"mirror_exit_layer":30,"cliff":true}}
{"run":663,"commit":"8b55918","metric":52.87384038355879,"metrics":{},"status":"discard","description":"Post-sweep anchor run on restored keep config after high-exit cliffs.","timestamp":1776283481200,"segment":23,"confidence":2.9093014174440266,"iterationTokens":670,"asi":{"hypothesis":"Reverting to exit layer 14 should restore recovered ~104-105 band if prior cliffs were purely parameter-induced.","rollback_reason":"Throughput remained collapsed (~52.87), indicating a renewed global instability window.","next_action_hint":"Run immediate control symmetry check to classify this collapse as global versus mirror-specific.","backend":"mirror_sd_mlx","context_only_draft_cache":1,"draft_sink":48,"collapse_regime":true}}
{"run":664,"commit":"8b55918","metric":62.81966158640009,"metrics":{},"status":"discard","description":"Control symmetry check after renewed ~53 tok/s mirror collapse (mirror disabled).","timestamp":1776283520008,"segment":23,"confidence":2.888228427608669,"iterationTokens":717,"asi":{"hypothesis":"If collapse is global, control should also drop substantially in the same window.","rollback_reason":"Control also degraded (62.82), confirming shared instability window though with control-leading gap.","next_action_hint":"Run immediate mirror follow-up and remain in stability-monitoring mode before further candidate changes.","backend":"bstnxbt_mlx","mirror_runtime_enabled":0,"context_only_draft_cache":1,"draft_sink":48,"collapse_regime":true,"paired_delta_tok_s":-9.945821202841302}}
{"run":665,"commit":"8b55918","metric":66.02775375450726,"metrics":{},"status":"discard","description":"Mirror follow-up after control symmetry run in renewed collapse window.","timestamp":1776283553829,"segment":23,"confidence":2.8224359926198694,"iterationTokens":642,"asi":{"hypothesis":"Mirror should remain similarly depressed if the renewed drop is predominantly global.","rollback_reason":"Mirror stayed low (66.03), only partial rebound from ~53 anchor.","next_action_hint":"Track recovery with unchanged paired samples until band normalizes; defer new tuning claims.","backend":"mirror_sd_mlx","context_only_draft_cache":1,"draft_sink":48,"collapse_regime":true,"paired_control_tok_s":62.81966158640009,"paired_delta_tok_s":3.208092168107174}}
{"run":666,"commit":"8b55918","metric":77.57806165578063,"metrics":{},"status":"discard","description":"Recovery probe after renewed collapse wave on unchanged mirror keep config.","timestamp":1776283611276,"segment":23,"confidence":2.778680709943429,"iterationTokens":1553,"asi":{"hypothesis":"Throughput may rebound from mid-60 trough toward high-90/100 band with unchanged reruns.","rollback_reason":"Only partial rebound to 77.58; still well below keep.","next_action_hint":"Run paired control check to classify whether rebound pace is shared across backends.","backend":"mirror_sd_mlx","context_only_draft_cache":1,"draft_sink":48,"stability_probe":true}}
{"run":667,"commit":"8b55918","metric":83.81315735003247,"metrics":{},"status":"discard","description":"Control pair run during post-collapse recovery monitoring (mirror disabled).","timestamp":1776283643519,"segment":23,"confidence":2.733541751642825,"iterationTokens":679,"asi":{"hypothesis":"If rebound is global, control should rise similarly from the same trough window.","rollback_reason":"Control recovered higher to 83.81, keeping recovery window noisy and backend-order sensitive.","next_action_hint":"Run immediate mirror follow-up to complete pair before drawing any directional conclusion.","backend":"bstnxbt_mlx","mirror_runtime_enabled":0,"context_only_draft_cache":1,"draft_sink":48,"paired_mirror_tok_s":77.57806165578063,"paired_delta_tok_s":-6.235095694251841}}
{"run":668,"commit":"8b55918","metric":86.36442319055442,"metrics":{},"status":"discard","description":"Mirror follow-up after control-leading recovery sample in renewed trough window.","timestamp":1776283676825,"segment":23,"confidence":2.678215524843781,"iterationTokens":643,"asi":{"hypothesis":"Mirror may close or flip control lead on immediate rerun if ordering remains unstable.","rollback_reason":"Mirror rebounded above control (86.36 vs 83.81) but stays far below keep.","next_action_hint":"Continue sparse stability tracking until high-100 band returns before claiming any optimization effect.","backend":"mirror_sd_mlx","context_only_draft_cache":1,"draft_sink":48,"paired_control_tok_s":83.81315735003247,"paired_delta_tok_s":2.5512658405219524}}
{"run":669,"commit":"8b55918","metric":102.56912152706207,"metrics":{},"status":"discard","description":"Recovery tracking run on unchanged mirror keep config after renewed collapse wave.","timestamp":1776283926907,"segment":23,"confidence":2.733541751642825,"iterationTokens":643,"asi":{"hypothesis":"Repeated unchanged runs can re-enter the high-100 band, enabling meaningful candidate comparisons.","rollback_reason":"Recovered to 102.57 but still below keep (106.86).","next_action_hint":"Run paired control immediately to estimate current mirror-vs-control delta in recovered band.","backend":"mirror_sd_mlx","context_only_draft_cache":1,"draft_sink":48,"stability_probe":true}}
{"run":670,"commit":"8b55918","metric":102.76227083411034,"metrics":{},"status":"discard","description":"Control pair run after 102.57 mirror recovery sample (mirror disabled).","timestamp":1776283959436,"segment":23,"confidence":2.778680709943429,"iterationTokens":678,"asi":{"hypothesis":"If current recovered band is shared, control should be near the mirror sample and pair delta should be small.","rollback_reason":"Comparison-only run; control near-tied with mirror (lead ~0.19 tok/s).","next_action_hint":"Proceed with structural candidate testing while band is stable around ~102-103.","backend":"bstnxbt_mlx","mirror_runtime_enabled":0,"context_only_draft_cache":1,"draft_sink":48,"paired_mirror_tok_s":102.56912152706207,"paired_delta_tok_s":-0.19314930704827135}}
{"run":671,"commit":"8b55918","metric":101.54249352385952,"metrics":{},"status":"discard","description":"Stability/cache-reservation extension: AR_INITIAL_CACHE_BLOCKS=1024 on mirror keep-shape lane.","timestamp":1776284082161,"segment":23,"confidence":2.740235235660561,"iterationTokens":9598,"asi":{"hypothesis":"A much larger initial paged-cache reservation may reduce collapse churn and recover throughput beyond previously tested <=512 values.","rollback_reason":"Regression versus keep and current recovered samples (101.54 tok/s).","next_action_hint":"Add 1024 to INITIAL_CACHE_BLOCKS do-not-retry set for 1024 lane; oversized reservation does not help here.","backend":"mirror_sd_mlx","context_only_draft_cache":1,"draft_sink":48,"initial_cache_blocks":1024}}
{"run":672,"commit":"8b55918","metric":100.74822859088837,"metrics":{},"status":"discard","description":"Split-SDPA chunk sweep extension: DFLASH_BSTNXBT_SPLIT_CHUNK_SIZE=17 on mirror lane.","timestamp":1776284109680,"segment":23,"confidence":2.6910963426553325,"iterationTokens":722,"asi":{"hypothesis":"An odd chunk size near the known long-context sweet region could outperform default chunk 8 on the 1024 mirror lane.","rollback_reason":"Clear regression (100.75 vs 106.86).","next_action_hint":"Add chunk size 17 to do-not-retry set; extended chunk-size neighborhood remains non-winning for this lane.","backend":"mirror_sd_mlx","context_only_draft_cache":1,"draft_sink":48,"split_chunk_size":17}}
{"run":673,"commit":"8b55918","metric":100.99817686739182,"metrics":{},"status":"discard","description":"Split-SDPA chunk sweep extension: DFLASH_BSTNXBT_SPLIT_CHUNK_SIZE=19 on mirror lane.","timestamp":1776284136942,"segment":23,"confidence":2.606062281240795,"iterationTokens":654,"asi":{"hypothesis":"Chunk size 19 may capture a non-monotonic performance pocket missed by adjacent tested values.","rollback_reason":"Regression versus keep and baseline recovered band (101.00 tok/s).","next_action_hint":"Add chunk size 19 to do-not-retry set; continue away from split-chunk micro-sweeps.","backend":"mirror_sd_mlx","context_only_draft_cache":1,"draft_sink":48,"split_chunk_size":19}}
{"run":674,"commit":"8b55918","metric":44.74550687148986,"metrics":{},"status":"discard","description":"Post-chunk-sweep anchor rerun on unchanged mirror keep config.","timestamp":1776284177788,"segment":23,"confidence":2.5089555395835452,"iterationTokens":659,"asi":{"hypothesis":"After reverting chunk overrides, mirror throughput should remain near recovered ~100 band.","rollback_reason":"Severe collapse to 44.75 tok/s on unchanged keep shape.","next_action_hint":"Run immediate control symmetry check to confirm whether this is another global instability trough.","backend":"mirror_sd_mlx","context_only_draft_cache":1,"draft_sink":48,"collapse_regime":true}}
{"run":675,"commit":"8b55918","metric":28.41708425232339,"metrics":{},"status":"discard","description":"Control symmetry check after 44.75 mirror collapse (mirror disabled).","timestamp":1776284237390,"segment":23,"confidence":2.4235681350322156,"iterationTokens":686,"asi":{"hypothesis":"If collapse is global, control should also degrade significantly in the same window.","rollback_reason":"Control collapsed even harder to 28.42 tok/s, confirming severe shared instability regime.","next_action_hint":"Run immediate mirror follow-up recovery probe and avoid any tuning conclusions during this trough.","backend":"bstnxbt_mlx","mirror_runtime_enabled":0,"context_only_draft_cache":1,"draft_sink":48,"collapse_regime":true,"paired_delta_tok_s":16.32842261916647}}
{"run":676,"commit":"8b55918","metric":46.57891002542459,"metrics":{},"status":"discard","description":"Mirror follow-up after extreme control collapse sample in same trough window.","timestamp":1776284280271,"segment":23,"confidence":2.341307904906078,"iterationTokens":634,"asi":{"hypothesis":"Mirror should remain similarly depressed if the trough is global rather than backend-specific.","rollback_reason":"Mirror remained very low at 46.58 tok/s.","next_action_hint":"Continue sparse recovery probes; defer candidate testing until throughput leaves collapse band.","backend":"mirror_sd_mlx","context_only_draft_cache":1,"draft_sink":48,"collapse_regime":true,"paired_control_tok_s":28.41708425232339,"paired_delta_tok_s":18.1618257731012}}
{"run":677,"commit":"8b55918","metric":71.61331273021335,"metrics":{},"status":"discard","description":"Recovery probe after severe ~28-46 trough on unchanged mirror keep config.","timestamp":1776284312383,"segment":23,"confidence":2.3324818651580403,"iterationTokens":636,"asi":{"hypothesis":"Repeated unchanged runs should rebound toward prior bands as instability wave passes.","rollback_reason":"Partial rebound to 71.61 only; still far below keep.","next_action_hint":"Continue paired recovery monitoring until at least low-100 band returns before resuming candidate sweeps.","backend":"mirror_sd_mlx","context_only_draft_cache":1,"draft_sink":48,"stability_probe":true}}
{"run":678,"commit":"8b55918","metric":57.284942661161395,"metrics":{},"status":"discard","description":"Control pair run during rebound from severe trough (mirror disabled).","timestamp":1776284359035,"segment":23,"confidence":2.3237221186336883,"iterationTokens":675,"asi":{"hypothesis":"If rebound is global, control should recover in the same direction as mirror, though ordering may flip.","rollback_reason":"Control remained low at 57.28 and trailed paired mirror, confirming instability persists.","next_action_hint":"Run immediate mirror follow-up and continue treating backend deltas as unreliable in this window.","backend":"bstnxbt_mlx","mirror_runtime_enabled":0,"context_only_draft_cache":1,"draft_sink":48,"paired_mirror_tok_s":71.61331273021335,"paired_delta_tok_s":14.328370069051953}}
{"run":679,"commit":"8b55918","metric":66.72068265851682,"metrics":{},"status":"discard","description":"Mirror follow-up after low control sample during trough rebound.","timestamp":1776284391204,"segment":23,"confidence":2.3253627924819624,"iterationTokens":651,"asi":{"hypothesis":"Immediate mirror rerun should remain in the same depressed band if instability wave is ongoing.","rollback_reason":"Mirror stayed low at 66.72, still far below keep.","next_action_hint":"Keep sparse recovery probes running until throughput climbs back above ~100 before testing new candidates.","backend":"mirror_sd_mlx","context_only_draft_cache":1,"draft_sink":48,"collapse_regime":true,"paired_control_tok_s":57.284942661161395,"paired_delta_tok_s":9.435739997355428}}
{"run":680,"commit":"8b55918","metric":80.20561958135511,"metrics":{},"status":"discard","description":"Recovery monitoring run on unchanged mirror keep config after deep trough.","timestamp":1776284450210,"segment":23,"confidence":2.310104050874441,"iterationTokens":5598,"asi":{"hypothesis":"Throughput should continue recovering upward from the 40-60 collapse trough on repeated unchanged runs.","rollback_reason":"Still below keep (80.21 tok/s) despite rebound.","next_action_hint":"Run paired control check to keep backend-order tracking honest during recovery.","backend":"mirror_sd_mlx","context_only_draft_cache":1,"draft_sink":48,"stability_probe":true}}
{"run":681,"commit":"8b55918","metric":100.86116953784516,"metrics":{},"status":"discard","description":"Control pair run after 80.21 mirror recovery sample (mirror disabled).","timestamp":1776284484967,"segment":23,"confidence":2.2864195732600594,"iterationTokens":665,"asi":{"hypothesis":"Control pair will show whether recovery is shared and whether backend ordering is stable.","rollback_reason":"Control surged to 100.86, showing persistent ordering flips in unstable regime.","next_action_hint":"Run immediate mirror follow-up before interpreting backend advantage.","backend":"bstnxbt_mlx","mirror_runtime_enabled":0,"context_only_draft_cache":1,"draft_sink":48,"paired_mirror_tok_s":80.20561958135511,"paired_delta_tok_s":-20.655549956490045}}
{"run":682,"commit":"8b55918","metric":102.43476465861728,"metrics":{},"status":"discard","description":"Mirror follow-up after control-leading recovery pair.","timestamp":1776284510955,"segment":23,"confidence":2.314852802148446,"iterationTokens":641,"asi":{"hypothesis":"If control lead was transient, immediate mirror rerun should close or flip the gap.","rollback_reason":"Mirror rebounded to 102.43 and surpassed paired control but remains below keep.","next_action_hint":"Recovered band is back near ~100; continue structural-only tests with immediate confirmation if any near-keep result appears.","backend":"mirror_sd_mlx","context_only_draft_cache":1,"draft_sink":48,"paired_control_tok_s":100.86116953784516,"paired_delta_tok_s":1.573595120772123}}
