{"run":1540,"commit":"b304c02","metric":92.24225207097808,"metrics":{},"status":"discard","description":"Immediate mirror follow-up rebounded to ~92.24, indicating deep-70 break was transient.","timestamp":1776357792911,"segment":23,"confidence":3.094918693011367,"iterationTokens":710,"asi":{"hypothesis":"Volatility continues as fast toggling between deep and upper pockets.","rollback_reason":"Below keep.","next_action_hint":"Continue mirror-only scanning for regime stabilization.","backend":"mirror_sd_mlx","context_only_draft_cache":1,"draft_sink":48,"async_draft_eval":1,"fused_draft_verify_eval":1,"paired_prev_tok_s":75.8069044392296,"paired_delta_tok_s":16.43534763174848,"delta_vs_keep":-16.62008042349685,"oscillatory_recovery":true}}
{"run":1541,"commit":"b304c02","metric":96.40041493574493,"metrics":{},"status":"discard","description":"Mirror bounced up to ~96.40, breaking above the recent 76–92 pocket.","timestamp":1776357860295,"segment":23,"confidence":3.0940098720630465,"iterationTokens":2899,"asi":{"hypothesis":"Current pocket can still release into mid-90s without structural changes.","rollback_reason":"Below keep.","next_action_hint":"Continue mirror scans for follow-through into 100+ and 107+ windows.","backend":"mirror_sd_mlx","context_only_draft_cache":1,"draft_sink":48,"async_draft_eval":1,"fused_draft_verify_eval":1,"warmup_s":2.009865083033219,"paired_prev_tok_s":92.24225207097808,"paired_delta_tok_s":4.158162864766847,"delta_vs_keep":-12.46191755873001,"range_break_up":true}}
{"run":1542,"commit":"b304c02","metric":98.27941284618501,"metrics":{},"status":"discard","description":"Mirror improved to ~98.28, extending upward break from recent low band.","timestamp":1776357889499,"segment":23,"confidence":3.0931015847074383,"iterationTokens":712,"asi":{"hypothesis":"Upswing from degraded pocket is progressing toward 100+.","rollback_reason":"Below keep.","next_action_hint":"Continue immediate mirror scans for 100+ transition.","backend":"mirror_sd_mlx","context_only_draft_cache":1,"draft_sink":48,"async_draft_eval":1,"fused_draft_verify_eval":1,"paired_prev_tok_s":96.40041493574493,"paired_delta_tok_s":1.8789979104400865,"delta_vs_keep":-10.58291964828993,"recovery_stage":"96->98"}}
{"run":1543,"commit":"b304c02","metric":101.39981755001688,"metrics":{},"status":"discard","description":"Mirror re-entered 100+ at ~101.40, continuing staged recovery.","timestamp":1776357921949,"segment":23,"confidence":3.0903694752166038,"iterationTokens":655,"asi":{"hypothesis":"Current rebound is progressing through the expected 100+ ladder.","rollback_reason":"Below keep/high-window.","next_action_hint":"Continue mirror scans for 105+/107+/108 re-entry.","backend":"mirror_sd_mlx","context_only_draft_cache":1,"draft_sink":48,"async_draft_eval":1,"fused_draft_verify_eval":1,"paired_prev_tok_s":98.27941284618501,"paired_delta_tok_s":3.120404703831871,"delta_vs_keep":-7.462514944458057,"recovery_stage":"98->101"}}
{"run":1544,"commit":"b304c02","metric":100.0788340720116,"metrics":{},"status":"discard","description":"Mirror held around ~100.08, stabilizing in low-100 recovery tier.","timestamp":1776357950707,"segment":23,"confidence":3.087642187963013,"iterationTokens":681,"asi":{"hypothesis":"Recovery may consolidate near 100 before next push upward.","rollback_reason":"Below keep.","next_action_hint":"Continue mirror scans for progression into mid/high-100s.","backend":"mirror_sd_mlx","context_only_draft_cache":1,"draft_sink":48,"async_draft_eval":1,"fused_draft_verify_eval":1,"paired_prev_tok_s":101.39981755001688,"paired_delta_tok_s":-1.3209834780052834,"delta_vs_keep":-8.783498422463342,"recovery_stage":"~100 plateau"}}
{"run":1545,"commit":"b304c02","metric":102.91170271411893,"metrics":{},"status":"discard","description":"Mirror advanced to ~102.91, extending low-100 recovery step.","timestamp":1776357980665,"segment":23,"confidence":3.087194565850624,"iterationTokens":678,"asi":{"hypothesis":"Rebound is progressing toward the familiar 103–106 staging zone.","rollback_reason":"Below keep.","next_action_hint":"Continue mirror runs for 105+/107+ re-entry attempts.","backend":"mirror_sd_mlx","context_only_draft_cache":1,"draft_sink":48,"async_draft_eval":1,"fused_draft_verify_eval":1,"paired_prev_tok_s":100.0788340720116,"paired_delta_tok_s":2.832868642107332,"delta_vs_keep":-5.950629780356012,"recovery_stage":"100->103"}}
{"run":1546,"commit":"b304c02","metric":87.32404907045841,"metrics":{},"status":"discard","description":"Mirror fell back to ~87.32 after touching ~102.9, reasserting large oscillation amplitude.","timestamp":1776358011759,"segment":23,"confidence":3.085382920334781,"iterationTokens":678,"asi":{"hypothesis":"Upward steps remain unstable and can retrace quickly to high-80s.","rollback_reason":"Below keep/high-window.","next_action_hint":"Continue mirror scans; parity check only if low-band persists for several runs.","backend":"mirror_sd_mlx","context_only_draft_cache":1,"draft_sink":48,"async_draft_eval":1,"fused_draft_verify_eval":1,"warmup_s":2.227925125043839,"paired_prev_tok_s":102.91170271411893,"paired_delta_tok_s":-15.587653643660515,"delta_vs_keep":-21.538283424016527,"oscillatory_recovery":true}}
{"run":1547,"commit":"b304c02","metric":101.43011299652966,"metrics":{},"status":"discard","description":"Mirror rebounded to ~101.43, continuing rapid toggling between high-80 and low-100 states.","timestamp":1776358044269,"segment":23,"confidence":3.073302511773791,"iterationTokens":736,"asi":{"hypothesis":"Regime is still bi-modal with frequent jumps between two throughput basins.","rollback_reason":"Below keep.","next_action_hint":"Continue mirror scans for migration into 105+/107+ basin.","backend":"mirror_sd_mlx","context_only_draft_cache":1,"draft_sink":48,"async_draft_eval":1,"fused_draft_verify_eval":1,"warmup_s":2.0980137090664357,"paired_prev_tok_s":87.32404907045841,"paired_delta_tok_s":14.106063926071245,"delta_vs_keep":-7.43221949794528,"bimodal_behavior":true}}
{"run":1548,"commit":"b304c02","metric":89.439392097812,"metrics":{},"status":"discard","description":"Mirror dropped to ~89.44, returning to lower basin of the current bi-modal regime.","timestamp":1776358074487,"segment":23,"confidence":3.0608723381229903,"iterationTokens":756,"asi":{"hypothesis":"Bi-modal oscillation between ~89 and ~101 remains active.","rollback_reason":"Below keep.","next_action_hint":"Continue mirror runs for basin-shift persistence checks.","backend":"mirror_sd_mlx","context_only_draft_cache":1,"draft_sink":48,"async_draft_eval":1,"fused_draft_verify_eval":1,"paired_prev_tok_s":101.43011299652966,"paired_delta_tok_s":-11.99072089871766,"delta_vs_keep":-19.42294039666294,"bimodal_behavior":true}}
{"run":1549,"commit":"b304c02","metric":96.28370897803885,"metrics":{},"status":"discard","description":"Mirror landed at ~96.28, mid-point between current low and high basins.","timestamp":1776358106464,"segment":23,"confidence":3.0521450925884652,"iterationTokens":659,"asi":{"hypothesis":"State is transitioning between bi-modal basins, with mid-range bridge samples.","rollback_reason":"Below keep.","next_action_hint":"Continue mirror sampling for next basin selection.","backend":"mirror_sd_mlx","context_only_draft_cache":1,"draft_sink":48,"async_draft_eval":1,"fused_draft_verify_eval":1,"paired_prev_tok_s":89.439392097812,"paired_delta_tok_s":6.844316880226856,"delta_vs_keep":-12.578623516436092,"bimodal_behavior":true}}
{"run":1550,"commit":"b304c02","metric":98.2447953285465,"metrics":{},"status":"discard","description":"Mirror rose to ~98.24, favoring the upper side of current regime.","timestamp":1776358135477,"segment":23,"confidence":3.0426490664846826,"iterationTokens":657,"asi":{"hypothesis":"Current phase may be shifting back toward the low-100 basin.","rollback_reason":"Below keep.","next_action_hint":"Continue mirror runs for 100+ confirmation.","backend":"mirror_sd_mlx","context_only_draft_cache":1,"draft_sink":48,"async_draft_eval":1,"fused_draft_verify_eval":1,"warmup_s":2.072664458071813,"paired_prev_tok_s":96.28370897803885,"paired_delta_tok_s":1.9610863505076424,"delta_vs_keep":-10.617537165928445,"upper_basin_probe":true}}
{"run":1551,"commit":"b304c02","metric":98.38010133366977,"metrics":{},"status":"discard","description":"Mirror held near ~98.38, sustaining upper-side probe but still below 100.","timestamp":1776358166862,"segment":23,"confidence":3.041712053016971,"iterationTokens":679,"asi":{"hypothesis":"Upper basin is active, with potential to cross back into 100+ soon.","rollback_reason":"Below keep.","next_action_hint":"Continue immediate mirror scans for 100+ re-entry.","backend":"mirror_sd_mlx","context_only_draft_cache":1,"draft_sink":48,"async_draft_eval":1,"fused_draft_verify_eval":1,"paired_prev_tok_s":98.2447953285465,"paired_delta_tok_s":0.1353060051232704,"delta_vs_keep":-10.482231160805174,"upper_basin_probe":true}}
{"run":1552,"commit":"b304c02","metric":91.16485233219771,"metrics":{},"status":"discard","description":"Mirror fell to ~91.16, dropping back from upper probe into lower basin.","timestamp":1776358200828,"segment":23,"confidence":3.0407756164964526,"iterationTokens":668,"asi":{"hypothesis":"Bi-modal switching remains dominant; upper-side occupancy is short-lived.","rollback_reason":"Below keep.","next_action_hint":"Continue mirror scans for next basin switch.","backend":"mirror_sd_mlx","context_only_draft_cache":1,"draft_sink":48,"async_draft_eval":1,"fused_draft_verify_eval":1,"paired_prev_tok_s":98.38010133366977,"paired_delta_tok_s":-7.215249001472056,"delta_vs_keep":-17.69748016227723,"bimodal_behavior":true}}
{"run":1553,"commit":"b304c02","metric":89.66589700849276,"metrics":{},"status":"discard","description":"Mirror ticked down to ~89.67, remaining in the lower basin of the current regime.","timestamp":1776358241812,"segment":23,"confidence":3.039455005331881,"iterationTokens":710,"asi":{"hypothesis":"Lower basin around high-80/low-90 remains sticky.","rollback_reason":"Below keep.","next_action_hint":"Continue mirror tracking for next upward swing.","backend":"mirror_sd_mlx","context_only_draft_cache":1,"draft_sink":48,"async_draft_eval":1,"fused_draft_verify_eval":1,"warmup_s":2.245482709025964,"paired_prev_tok_s":91.16485233219771,"paired_delta_tok_s":-1.4989553237049447,"delta_vs_keep":-19.19643548598218,"lower_basin_sticky":true}}
{"run":1554,"commit":"b304c02","metric":99.60703734845363,"metrics":{},"status":"discard","description":"Mirror jumped to ~99.61, switching back to the upper basin and nearing 100+.","timestamp":1776358274929,"segment":23,"confidence":3.0381355407542134,"iterationTokens":686,"asi":{"hypothesis":"Bi-modal regime still alternates quickly; upper basin remains reachable.","rollback_reason":"Below keep.","next_action_hint":"Continue immediate mirror scans for sustained 100+ hold.","backend":"mirror_sd_mlx","context_only_draft_cache":1,"draft_sink":48,"async_draft_eval":1,"fused_draft_verify_eval":1,"paired_prev_tok_s":89.66589700849276,"paired_delta_tok_s":9.941140339960867,"delta_vs_keep":-9.255295146021313,"bimodal_behavior":true}}
{"run":1555,"commit":"b304c02","metric":91.9082184692358,"metrics":{},"status":"discard","description":"Mirror dropped to ~91.91, reverting from upper basin back to low-90 band.","timestamp":1776358312230,"segment":23,"confidence":3.02682860283857,"iterationTokens":661,"asi":{"hypothesis":"Upper-basin gains are still short-lived under current instability.","rollback_reason":"Below keep.","next_action_hint":"Continue mirror scanning; monitor for sustained high-side occupancy.","backend":"mirror_sd_mlx","context_only_draft_cache":1,"draft_sink":48,"async_draft_eval":1,"fused_draft_verify_eval":1,"warmup_s":2.183672707993537,"paired_prev_tok_s":99.60703734845363,"paired_delta_tok_s":-7.698818879217828,"delta_vs_keep":-16.95411402523914,"bimodal_behavior":true}}
{"run":1556,"commit":"b304c02","metric":95.35679754675633,"metrics":{},"status":"discard","description":"Mirror improved to ~95.36, climbing from low-90 basin toward mid-range bridge.","timestamp":1776358346500,"segment":23,"confidence":3.015605514246809,"iterationTokens":685,"asi":{"hypothesis":"Current transition state can rise from low-90s back toward upper basin.","rollback_reason":"Below keep.","next_action_hint":"Continue mirror runs for 100+ retest.","backend":"mirror_sd_mlx","context_only_draft_cache":1,"draft_sink":48,"async_draft_eval":1,"fused_draft_verify_eval":1,"warmup_s":2.2540141249774024,"paired_prev_tok_s":91.9082184692358,"paired_delta_tok_s":3.4485790775205296,"delta_vs_keep":-13.50553494771861,"bimodal_behavior":true}}
{"run":1557,"commit":"b304c02","metric":101.43847191752234,"metrics":{},"status":"discard","description":"Mirror re-entered low-100 upper basin at ~101.44.","timestamp":1776358397023,"segment":23,"confidence":3.0069892057593752,"iterationTokens":692,"asi":{"hypothesis":"Bi-modal behavior persists with recurring returns to low-100 throughput.","rollback_reason":"Below keep.","next_action_hint":"Continue scans for expansion from low-100 into 105+/107+ bands.","backend":"mirror_sd_mlx","context_only_draft_cache":1,"draft_sink":48,"async_draft_eval":1,"fused_draft_verify_eval":1,"paired_prev_tok_s":95.35679754675633,"paired_delta_tok_s":6.081674370766013,"delta_vs_keep":-7.423860576952596,"upper_basin_active":true}}
{"run":1558,"commit":"b304c02","metric":95.49356183212275,"metrics":{},"status":"discard","description":"Mirror slid to ~95.49 from low-100, staying within active bi-modal envelope.","timestamp":1776358440156,"segment":23,"confidence":2.9970186732025255,"iterationTokens":691,"asi":{"hypothesis":"Upper-basin occupancy remains unstable and tends to relax into mid/high-90 bridge.","rollback_reason":"Below keep.","next_action_hint":"Continue mirror loop for next basin jump.","backend":"mirror_sd_mlx","context_only_draft_cache":1,"draft_sink":48,"async_draft_eval":1,"fused_draft_verify_eval":1,"warmup_s":2.2937557080294937,"paired_prev_tok_s":101.43847191752234,"paired_delta_tok_s":-5.944910085399592,"delta_vs_keep":-13.368770662352189,"bimodal_behavior":true}}
{"run":1559,"commit":"b304c02","metric":98.9353077816605,"metrics":{},"status":"discard","description":"Mirror rebounded to ~98.94, returning to upper side of the current bi-modal regime.","timestamp":1776358479799,"segment":23,"confidence":2.991496029038648,"iterationTokens":1026,"asi":{"hypothesis":"Upper basin remains intermittently reachable despite rapid reversions.","rollback_reason":"Below keep.","next_action_hint":"Continue mirror scans for sustained hold above 100.","backend":"mirror_sd_mlx","context_only_draft_cache":1,"draft_sink":48,"async_draft_eval":1,"fused_draft_verify_eval":1,"warmup_s":2.2729807500727475,"paired_prev_tok_s":95.49356183212275,"paired_delta_tok_s":3.44174594953774,"delta_vs_keep":-9.927024712814438,"upper_basin_active":true}}
{"run":1560,"commit":"b304c02","metric":89.39393227836445,"metrics":{},"status":"discard","description":"Mirror reverted to ~89.39, another quick drop from upper-side sample.","timestamp":1776358510886,"segment":23,"confidence":2.9859937007308086,"iterationTokens":687,"asi":{"hypothesis":"Basin switching remains fast, limiting sustained gains.","rollback_reason":"Below keep.","next_action_hint":"Continue mirror loop to capture next high-side swing.","backend":"mirror_sd_mlx","context_only_draft_cache":1,"draft_sink":48,"async_draft_eval":1,"fused_draft_verify_eval":1,"warmup_s":2.213707832968794,"paired_prev_tok_s":98.9353077816605,"paired_delta_tok_s":-9.54137550329605,"delta_vs_keep":-19.46840021611049,"bimodal_behavior":true}}
{"run":1561,"commit":"b304c02","metric":87.73054801854396,"metrics":{},"status":"discard","description":"Mirror drifted down to ~87.73, staying in lower basin.","timestamp":1776358545533,"segment":23,"confidence":2.984771190731947,"iterationTokens":679,"asi":{"hypothesis":"Lower basin remains the dominant occupancy state in this segment.","rollback_reason":"Below keep.","next_action_hint":"Continue mirror scans for evidence of basin shift.","backend":"mirror_sd_mlx","context_only_draft_cache":1,"draft_sink":48,"async_draft_eval":1,"fused_draft_verify_eval":1,"warmup_s":2.1886747078970075,"paired_prev_tok_s":89.39393227836445,"paired_delta_tok_s":-1.6633842598204898,"delta_vs_keep":-21.131784475930978,"lower_basin_sticky":true}}
{"run":1562,"commit":"b304c02","metric":87.18686152794002,"metrics":{},"status":"discard","description":"Mirror stayed low at ~87.19, extending the lower-basin run.","timestamp":1776358582322,"segment":23,"confidence":2.983549681350769,"iterationTokens":685,"asi":{"hypothesis":"Lower basin remains active until a fresh regime jump occurs.","rollback_reason":"Below keep.","next_action_hint":"Continue mirror loop for eventual upper-basin return.","backend":"mirror_sd_mlx","context_only_draft_cache":1,"draft_sink":48,"async_draft_eval":1,"fused_draft_verify_eval":1,"warmup_s":2.240089499973692,"paired_prev_tok_s":87.73054801854396,"paired_delta_tok_s":-0.5436864906039396,"delta_vs_keep":-21.67547096653492,"lower_basin_sticky":true}}
{"run":1563,"commit":"b304c02","metric":104.09072173599024,"metrics":{},"status":"discard","description":"Mirror run rose to ~104.09, exiting recent lower-basin range.","timestamp":1776360143816,"segment":23,"confidence":2.984771190731947,"iterationTokens":685,"asi":{"hypothesis":"Regime can still jump from high-80/low-90 into low-100 basin.","rollback_reason":"Below keep 108.8623.","next_action_hint":"Continue mirror scans; take parity check after another high-side sample.","backend":"mirror_sd_mlx","delta_vs_keep":-4.771610758484699,"context_only_draft_cache":1,"draft_sink":48,"async_draft_eval":1,"fused_draft_verify_eval":1}}
{"run":1564,"commit":"b304c02","metric":105.29304756845801,"metrics":{},"status":"discard","description":"Mirror run improved to ~105.29 in the upper recovery basin.","timestamp":1776360175395,"segment":23,"confidence":2.9859937007308086,"iterationTokens":647,"asi":{"hypothesis":"Upper basin has expanded from ~101 to ~105 this cycle.","rollback_reason":"Below keep.","next_action_hint":"Run immediate control parity sample to check if mirror now beats control in this basin.","backend":"mirror_sd_mlx","delta_vs_keep":-3.5692849260169273,"context_only_draft_cache":1,"draft_sink":48,"async_draft_eval":1,"fused_draft_verify_eval":1}}
{"run":1565,"commit":"b304c02","metric":108.36513159742503,"metrics":{},"status":"discard","description":"Control parity sample (`DFLASH_MIRROR_SD_RUNTIME=0`) jumped to ~108.37, far above recent mirror upper-basin values.","timestamp":1776360223003,"segment":23,"confidence":2.9878571982436246,"iterationTokens":1072,"asi":{"hypothesis":"Current window can rapidly reopen into 108+ and may currently favor control ordering.","rollback_reason":"Control lane is non-authoritative despite outperforming paired mirror sample.","next_action_hint":"Restore mirror lane and immediately resample to test whether mirror can rejoin 108+ band.","backend":"bstnxbt_mlx","mirror_runtime_enabled":0,"paired_mirror_tok_s":105.29304756845801,"paired_delta_tok_s":-3.0720840289670166,"authoritative_lane":"mirror_sd_mlx","shared_window_shift":true,"context_only_draft_cache":1,"draft_sink":48,"async_draft_eval":1,"fused_draft_verify_eval":1}}
{"run":1566,"commit":"b304c02","metric":107.90996414360939,"metrics":{},"status":"discard","description":"Mirror anchor after control spike reached ~107.91, re-entering 107+ but still below paired control.","timestamp":1776360264669,"segment":23,"confidence":2.9925704628909706,"iterationTokens":1201,"asi":{"hypothesis":"Mirror can rejoin 107+/108- band after control-led window reopen.","rollback_reason":"Below keep and below immediate control parity sample.","next_action_hint":"Continue mirror scans for a mirror-led >control reclaim.","backend":"mirror_sd_mlx","paired_control_tok_s":108.36513159742503,"paired_delta_tok_s":-0.45516745381564344,"delta_vs_keep":-0.952368350865546,"context_only_draft_cache":1,"draft_sink":48,"async_draft_eval":1,"fused_draft_verify_eval":1}}
{"run":1567,"commit":"b304c02","metric":37.7694551167537,"metrics":{},"status":"discard","description":"Mirror hard-collapsed to ~37.77, reopening deep trough regime.","timestamp":1776360313339,"segment":23,"confidence":2.9878571982436246,"iterationTokens":700,"asi":{"hypothesis":"Window remains highly unstable and can revert from 107+ to deep collapse abruptly.","rollback_reason":"Catastrophically below keep and below control parity reference.","next_action_hint":"Run immediate mirror follow-up to measure collapse depth and rebound onset.","backend":"mirror_sd_mlx","delta_vs_keep":-71.09287737772124,"request_s":27.111855250084773,"context_only_draft_cache":1,"draft_sink":48,"async_draft_eval":1,"fused_draft_verify_eval":1,"collapse_reappeared":true}}
{"run":1568,"commit":"b304c02","metric":40.191619761241164,"metrics":{},"status":"discard","description":"Mirror follow-up stayed deeply degraded at ~40.19 with severe warmup inflation.","timestamp":1776360368525,"segment":23,"confidence":2.984601985794251,"iterationTokens":664,"asi":{"hypothesis":"Current collapse branch is persistent, not a one-off outlier.","rollback_reason":"Still catastrophically below keep/control levels.","next_action_hint":"Run control parity check now to confirm shared deep-collapse attribution.","backend":"mirror_sd_mlx","delta_vs_keep":-68.67071273323378,"request_s":25.477948041982017,"warmup_s":6.7546941669425,"paired_prev_tok_s":37.7694551167537,"paired_delta_tok_s":2.422164644487463,"deep_collapse_persistent":true}}
