{"run":295,"commit":"e9874e2","metric":103.98249661805069,"metrics":{},"status":"discard","description":"Probe DFLASH_BSTNXBT_SPLIT_CHUNK_SIZE=12 on the new broader normal-request 15-token lane. It regressed materially below the current best, so the default split behavior remains better.","timestamp":1776181002714,"segment":19,"confidence":5.068449208560502,"iterationTokens":2274,"asi":{"hypothesis":"The new broader 15-token lane may prefer a larger split-SDPA chunk than the older lanes did.","rollback_reason":"Primary metric regressed materially below the current best 107.15 tok/s keep.","next_action_hint":"Stop spending more broad-lane runs on split chunk retunes unless profiling points there.","learning":"Split chunk retunes remain unhelpful even on the new broader 15-token lane."}}
{"run":296,"commit":"e9874e2","metric":105.96343964799873,"metrics":{},"status":"discard","description":"Re-test the minimal launcher-only end-to-end fix on the new broader 15-token baseline: persist greedy sampling defaults in scripts/siliconflash_start_qwen35_fast.sh and add auth to launcher warmup/example requests. It remained functionally useful but did not beat the current best on the authoritative benchmark.","timestamp":1776181064543,"segment":19,"confidence":4.506928480457743,"iterationTokens":1950,"asi":{"hypothesis":"Now that the broader 15-token lane is much faster and more stable, the minimal launcher fix may become benchmark-neutral enough to keep while also making normal launcher requests stay on DFlash.","rollback_reason":"No primary-metric improvement over the current best 107.15 tok/s keep.","next_action_hint":"Leave launcher productization for later branch cleanup/finalization unless it can be paired with a true benchmark win.","learning":"Even on the new fast broader lane, the launcher-only fix remains slightly slower than the current benchmark winner, though much closer than before."}}
{"run":297,"commit":"e9874e2","metric":106.2649487207883,"metrics":{},"status":"discard","description":"Productize the newly discovered normal-EOS thinking optimum by changing the general runtime default block size from 11 to 15, then remove the explicit DFLASH_BLOCK_TOKENS override and benchmark the broader normal-request lane. The generalized default stayed close to the best band but did not beat the explicit override.","timestamp":1776181155936,"segment":19,"confidence":4.05741741906235,"iterationTokens":2965,"asi":{"hypothesis":"The new broader normal-request optimum is robust enough that the general normal-EOS thinking runtime default can move from 11 to 15, eliminating the workload-specific block override without losing throughput.","rollback_reason":"No primary-metric improvement over the current best 107.15 tok/s explicit-override keep.","next_action_hint":"Keep the explicit 15-token workload override for the benchmark lane for now. If productization becomes the priority again, revisit generalized defaults separately or condition them more narrowly.","learning":"The broader lane’s new optimum is close to generalizable, but not fully free yet: a hardcoded default of 15 is slightly slower than keeping the explicit override in workload.env."}}
{"run":298,"commit":"e9874e2","metric":105.9381834761821,"metrics":{},"status":"discard","description":"Probe the current best broader 15-token lane with WARMUP_ENABLE_THINKING=0, leaving the measured request unchanged. The idea was to see whether a simpler warmup shape compiles the path more favorably, but it regressed the authoritative workload.","timestamp":1776181200165,"segment":19,"confidence":3.7042909356603184,"iterationTokens":1324,"asi":{"hypothesis":"The current broader lane may benefit from a simpler non-thinking warmup even when the measured request is thinking-enabled.","rollback_reason":"Primary metric regressed below the current best 107.15 tok/s keep.","next_action_hint":"Keep warmup thinking aligned with the measured request on the current broader lane.","learning":"On the new broader 15-token path, thinking-enabled warmup is helpful; explicitly disabling it hurts throughput."}}
{"run":299,"commit":"e9874e2","metric":105.94634783252945,"metrics":{},"status":"discard","description":"Re-test a model-settings-only request shape on the new broader 15-token lane by removing explicit greedy sampling fields from scripts/siliconflash_benchmark.py. It remained functionally valid but still underperformed the current best broader lane.","timestamp":1776181265273,"segment":19,"confidence":3.4134742495388046,"iterationTokens":2143,"asi":{"hypothesis":"Now that the broader normal-request path is fast, omitting explicit greedy sampling fields from the benchmark request and relying on model settings alone might finally become neutral or beneficial.","rollback_reason":"Primary metric regressed below the current best 107.15 tok/s keep.","next_action_hint":"Keep explicit greedy sampling fields in the benchmark request for the authority lane; broader productization should be handled separately from the benchmark contract.","learning":"Even on the new broader 15-token lane, the benchmark path still prefers explicitly supplied greedy sampling fields over relying on model settings alone."}}
{"run":300,"commit":"e9874e2","metric":105.55672941043191,"metrics":{},"status":"discard","description":"Retry the launcher end-to-end fix on the new broader lane by persisting greedy sampling defaults plus warmup auth in scripts/siliconflash_start_qwen35_fast.sh. It still regressed slightly on the authoritative benchmark, so it cannot be kept via the optimization loop yet.","timestamp":1776181330717,"segment":19,"confidence":3.3719161179070687,"iterationTokens":1983,"asi":{"hypothesis":"On the new broader lane, the launcher end-to-end fix might finally be benchmark-neutral enough to keep.","rollback_reason":"No primary-metric improvement over the current best 107.15 tok/s keep.","next_action_hint":"Keep launcher productization as a deferred follow-up unless paired with a true benchmark win; continue optimizing the active authority lane instead.","learning":"Even after the recent bigger wins, launcher-only defaulting/auth changes still cost a bit on the authoritative benchmark path."}}
{"run":301,"commit":"e9874e2","metric":106.76922026010512,"metrics":{},"status":"discard","description":"Retry productizing the new optimum by changing the general normal-EOS thinking default to 15, removing the explicit DFLASH_BLOCK_TOKENS override, and explicitly matching warmup depth to 15. It stayed close to the top band but still did not beat the explicit-override winner.","timestamp":1776181401593,"segment":19,"confidence":3.3313577327981916,"iterationTokens":2077,"asi":{"hypothesis":"The earlier generalized-default regression was partly a warmup mismatch; with the runtime default at 15 and warmup explicitly matched to 15, the broader lane might equal or beat the explicit override.","rollback_reason":"No primary-metric improvement over the current best 107.15 tok/s keep.","next_action_hint":"Keep the explicit 15-token override for the authority lane. The generalized default path is close enough to note for later productization, but not yet the benchmark winner.","learning":"The remaining gap between generalized-default 15 and explicit-override 15 is small but persistent even after matching warmup depth. For now, the explicit override is still the fastest authority-lane contract."}}
{"run":302,"commit":"e9874e2","metric":104.95154343869652,"metrics":{},"status":"discard","description":"Probe a 32-token DFlash warmup on the current broader normal-request 15-token winner. It regressed materially, so the present warmup depth remains better.","timestamp":1776181464760,"segment":19,"confidence":3.2694620887309807,"iterationTokens":1356,"asi":{"hypothesis":"A somewhat deeper DFlash warmup might help the new 15-token broader lane by compiling a bit more of the speculative path.","rollback_reason":"Primary metric regressed materially below the current best 107.15 tok/s keep.","next_action_hint":"Keep the current warmup depth behavior on the new winner; deeper warmups are not helping.","learning":"The current broader 15-token winner is not under-warmed. Increasing warmup depth to 32 hurts throughput."}}
{"run":303,"commit":"e9874e2","metric":49.369797230961886,"metrics":{},"status":"discard","description":"Probe the next non-monotonic candidate above the current best by setting DFLASH_BLOCK_TOKENS=17 on the broader normal-request lane. It collapsed badly, so the upper cliff is real beyond 15.","timestamp":1776182083981,"segment":19,"confidence":3.1990543753141023,"iterationTokens":4049,"asi":{"hypothesis":"Despite the 16-token cliff, the block-size landscape is non-monotonic enough that 17 could still rebound on the new broader lane.","rollback_reason":"Primary metric collapsed catastrophically below the current best 107.15 tok/s keep.","next_action_hint":"Stop exploring higher block sizes on this lane; the upper side is now clearly unsafe beyond 15.","learning":"On the broader normal-request lane, 15 is not just locally better than 14/16 — the higher side can collapse all the way down to ~49 tok/s by 17."}}
{"run":304,"commit":"e9874e2","metric":105.445144170569,"metrics":{},"status":"discard","description":"Add a no-tool server fast path that skips tool-call extraction work in non-stream chat/Anthropic/Responses requests when no tools were requested, and verify it with focused integration coverage. It cleaned the path but did not improve the authoritative broader-lane benchmark.","timestamp":1776182230427,"segment":19,"confidence":3.201724362794806,"iterationTokens":17186,"asi":{"hypothesis":"The authoritative benchmark uses no tools, so skipping unnecessary tool-call extraction/sanitization work in non-stream server responses may shave enough postprocessing overhead to improve completion tok/s.","rollback_reason":"No primary-metric improvement over the current best 107.15 tok/s keep.","next_action_hint":"Do not spend more authority-lane runs on small response-postprocessing trims unless profiling shows they dominate; the main gains are still elsewhere.","learning":"Non-stream no-tool response postprocessing overhead is not a dominant limiter on the current broader 15-token lane."}}
{"run":305,"commit":"e9874e2","metric":105.50625719600136,"metrics":{},"status":"discard","description":"Probe the settings-driven thinking lane with explicit WARMUP_ENABLE_THINKING=1, since otherwise warmup inherits ENABLE_THINKING=0 even though model settings force thinking. It did not improve the broader benchmark path.","timestamp":1776182290724,"segment":19,"confidence":3.20439881083612,"iterationTokens":1623,"asi":{"hypothesis":"The settings-driven thinking lane may be under-aligned during warmup because warmup thinking defaults from ENABLE_THINKING rather than SETTINGS_ENABLE_THINKING; explicitly enabling warmup thinking might recover that gap.","rollback_reason":"Primary metric regressed below the current best 107.15 tok/s keep.","next_action_hint":"Do not chase warmup-thinking alignment further on the settings-driven lane; it is not the missing lever.","learning":"The settings-driven thinking lane’s remaining small gap is not explained by warmup-thinking misalignment."}}
{"run":306,"commit":"e9874e2","metric":104.93291843559088,"metrics":{},"status":"discard","description":"Probe a semantically greedy-equivalent benchmark request shape by changing top_k from 0 to 1 on the current broader 15-token winner. It regressed materially, so the authority lane still prefers top_k=0.","timestamp":1776182364481,"segment":19,"confidence":3.2035745220173393,"iterationTokens":1984,"asi":{"hypothesis":"Since DFlash supports top_k=1 as a greedy-equivalent shape, using it in the benchmark request might slightly improve compatibility or performance on the broader winner.","rollback_reason":"Primary metric regressed below the current best 107.15 tok/s keep.","next_action_hint":"Keep top_k=0 in the authority benchmark request even though top_k=1 is semantically allowed.","learning":"Greedy-equivalent does not mean performance-equivalent here: top_k=1 is slower than top_k=0 on the current broader winner."}}
{"run":307,"commit":"e9874e2","metric":67.4260997557499,"metrics":{},"status":"discard","description":"Add a server-side omitted-sampling fallback so DFlash-enabled models default to greedy-compatible sampling when the request omits sampling knobs. Despite targeted test coverage, this change regressed the authoritative broader lane badly and is not safe to keep.","timestamp":1776182568863,"segment":19,"confidence":3.1952290797528597,"iterationTokens":9887,"asi":{"hypothesis":"A server-side omitted-sampling fallback could make plain launcher/UI/client requests stay on DFlash without relying on launcher-specific model-setting writes, while leaving the benchmark lane intact because it already sends explicit sampling fields.","rollback_reason":"Primary metric collapsed badly to 67.43 tok/s on the authoritative benchmark after the server-side fallback change.","next_action_hint":"Avoid broad server-side sampling-default coercion in the hot path; keep omitted-sampling productization work isolated from the benchmarked authority lane or much more narrowly scoped.","learning":"A seemingly narrow server-side omitted-sampling fallback can still perturb the measured fast lane substantially, even when the benchmark request already sends explicit sampling fields."}}
{"run":308,"commit":"e9874e2","metric":88.12832151553015,"metrics":{},"status":"discard","description":"A rerun intended to hit the current best broader lane instead landed on preserved autoresearch-file drift and came back far below the winner band, so treat it as a noisy non-baseline run rather than evidence against the current best.","timestamp":1776182649627,"segment":19,"confidence":3.2035745220173393,"iterationTokens":3034,"asi":{"hypothesis":"The current best broader lane might edge slightly higher on a clean rerun.","rollback_reason":"Run landed far below the current winner band due to preserved autoresearch-file drift / non-baseline config, so it is not a valid keep candidate.","next_action_hint":"Read .omlx-autoresearch/workload.env, restore the exact winner config (BENCHMARK_DFLASH=0, ENABLE_THINKING=1, SETTINGS_ENABLE_THINKING=0, DFLASH_BLOCK_TOKENS=15, no stray warmup overrides), then continue from there.","learning":"Because autoresearch preserves workload files on discard, the authority lane can silently drift away from the true best config between runs. Re-read and reset workload.env before assuming a rerun is on the current winner."}}
{"run":309,"commit":"e9874e2","metric":99.93931460355087,"metrics":{},"status":"discard","description":"Clean rerun of the nominal current-best broader lane (BENCHMARK_DFLASH=0, ENABLE_THINKING=1, SETTINGS_ENABLE_THINKING=0, DFLASH_BLOCK_TOKENS=15). It stayed strong but landed below the prior best band, so record it as noise/instability rather than a new result.","timestamp":1776182689695,"segment":19,"confidence":3.20275065716409,"iterationTokens":1254,"asi":{"hypothesis":"The restored broader winner would reproduce near the 107 tok/s band on a clean rerun.","rollback_reason":"No primary-metric improvement over the current best 107.15 tok/s keep.","next_action_hint":"Treat the new 100–107 tok/s broader lane as somewhat noisy and prefer back-to-back confirmation whenever a new tweak claims a small gain.","learning":"The current best broader lane is materially faster than the old baseline but still noisy enough that single reruns can land around ~100 tok/s. Small claimed wins on top of it need confirmation."}}
{"run":310,"commit":"e9874e2","metric":100.66463357367691,"metrics":{},"status":"discard","description":"Re-check the fully explicit 15-token lane (BENCHMARK_DFLASH=1, ENABLE_THINKING=1, SETTINGS_ENABLE_THINKING=0 via current preserved files) against the broader winner. It stayed strong but did not beat the current best.","timestamp":1776182735761,"segment":19,"confidence":3.20916471725575,"iterationTokens":1024,"asi":{"hypothesis":"The fully explicit 15-token lane might be the more stable member of the current ~107 tok/s family and could edge above the broader winner on a rerun.","rollback_reason":"No primary-metric improvement over the current best 107.15 tok/s keep.","next_action_hint":"Treat both the broader and explicit 15-token lanes as noisy ~100–107 tok/s family members and focus future keeps on larger gains or clearly stabilized reruns.","learning":"The explicit and broader 15-token lanes are both fast, but neither is trivially reproducing the peak 107 tok/s figure on every rerun. Noise management matters again at this level."}}
{"run":311,"commit":"e9874e2","metric":106.202435719098,"metrics":{},"status":"discard","description":"Add an env-gated second DFlash warmup pass to autoresearch.sh and probe WARMUP_REPEAT=2 on the current broader 15-token winner. It did not improve the measured request and only increased warmup cost.","timestamp":1776182848287,"segment":19,"confidence":3.215604519421573,"iterationTokens":3081,"asi":{"hypothesis":"The current 100–107 tok/s family is warmup-sensitive enough that a second identical DFlash warmup pass may stabilize or lift the measured request.","rollback_reason":"No primary-metric improvement over the current best 107.15 tok/s keep.","next_action_hint":"Keep a single warmup pass in the harness; the remaining noise is not fixed by simply repeating the same warmup twice.","learning":"The current winner is not materially under-warmed in a way that a duplicate warmup pass can solve."}}
{"run":312,"commit":"e9874e2","metric":105.44447458995755,"metrics":{},"status":"discard","description":"Add an env-gated split-SDPA exact-KV threshold override and probe earlier activation with DFLASH_BSTNXBT_SPLIT_EXACT_KV_THRESHOLD=512 on the broader 15-token winner. It did not beat the current best.","timestamp":1776183837026,"segment":19,"confidence":2.9471834406020037,"iterationTokens":3081,"asi":{"hypothesis":"The current 1024-token authority lane barely benefits from split SDPA when the exact-KV threshold is hard-coded at 1024; activating the split path earlier at 512 cached tokens might lift throughput on the current 15-token winner.","rollback_reason":"Primary metric stayed below the current best 107.15 tok/s keep.","next_action_hint":"Do not spend more authority-lane runs on earlier split-SDPA activation without stronger evidence; the hard-coded 1024 threshold is not obviously the blocker.","learning":"The current broader 15-token lane does not improve from earlier split-SDPA activation at a 512-token exact-KV threshold."}}
{"run":313,"commit":"e9874e2","metric":104.16770954067671,"metrics":{},"status":"discard","description":"Probe DFLASH_BSTNXBT_SPLIT_CHUNK_SIZE=15 on the broader 15-token authority lane to see if matching the split chunk size to the now-best speculative block size helps. It regressed.","timestamp":1776183877033,"segment":19,"confidence":2.7201224916224906,"iterationTokens":1546,"asi":{"hypothesis":"Matching split-SDPA chunk size to the current best block size (15) might improve cache/attention behavior on the reopened fast lane.","rollback_reason":"Primary metric regressed below the current best 107.15 tok/s keep.","next_action_hint":"Do not keep chasing split chunk retunes on the 1024 authority lane; this family continues to underperform.","learning":"The reopened 15-token fast lane still does not benefit from matching split chunk size to block size."}}
{"run":314,"commit":"e9874e2","metric":27.37336052080922,"metrics":{},"status":"discard","description":"Probe the remaining request-shape quadrant on the 15-token lane: explicit request-level DFlash (BENCHMARK_DFLASH=1) with settings-driven thinking only (ENABLE_THINKING=0, SETTINGS_ENABLE_THINKING=1). This collapsed badly on the authoritative workload.","timestamp":1776183952932,"segment":19,"confidence":2.5964041610197452,"iterationTokens":1641,"asi":{"hypothesis":"Explicit request-level DFlash combined with settings-driven thinking only might be a stronger or more stable member of the current 15-token fast family than the broader winner or the fully explicit thinking lane.","rollback_reason":"Primary metric collapsed catastrophically to 27.37 tok/s, far below the current best 107.15 tok/s keep.","next_action_hint":"Avoid mixing explicit request-level DFlash with settings-only thinking on the authority lane; that combination appears to fall onto a very slow path.","learning":"The 15-token fast family is highly shape-sensitive: explicit request-level DFlash + settings-driven thinking only is a severe cliff, unlike broader request-driven thinking or fully explicit thinking."}}
{"run":315,"commit":"e9874e2","metric":55.95936688717877,"metrics":{},"status":"discard","description":"Add an env-gated exact-small-proj padding override and probe DFLASH_BSTNXBT_EXACT_SMALL_PROJ_PAD_M=15 on the broader 15-token authority lane, to avoid padding 15-token speculative windows up to 16. It regressed badly.","timestamp":1776184060867,"segment":19,"confidence":2.529575619462082,"iterationTokens":4567,"asi":{"hypothesis":"Because the current winner uses DFLASH_BLOCK_TOKENS=15, the hard-coded exact-small-proj pad-to-16 may be wasting work; matching pad_m to 15 might reduce overhead on the fast lane.","rollback_reason":"Primary metric collapsed to 55.96 tok/s, far below the current best 107.15 tok/s keep.","next_action_hint":"Do not disturb the hard-coded pad-to-16 exact-small-proj behavior on the authority lane without stronger evidence; that padding appears performance-critical.","learning":"The exact-small-proj pad-to-16 path is not accidental overhead on the current winner; avoiding that one-token pad is a severe cliff."}}
