{"run":2280,"commit":"7406585","metric":8.791469703079201,"metrics":{},"status":"discard","description":"Host-time decomposition probe validation run: emitted new per-step submit/gap/eval-wait fields (draft+verify), sidecar healthy and watchdog idle.","timestamp":1776443265192,"segment":24,"confidence":0.04439647576541445,"iterationTokens":9805,"asi":{"hypothesis":"Per-step submit-vs-eval decomposition will localize where host/runtime time inflates during collapse.","rollback_reason":"Primary metric did not improve on this validation sample; re-run probe after re-applying patch.","next_action_hint":"Re-apply host-time decomposition patch and keep collecting until a keep-worthy sample lands.","diagnostic_findings":{"completion_tok_s":107.44134065729148,"dflash_eval_s":8.791469703079201,"draft_submit_mean_s":0.00016615491040283814,"verify_submit_mean_s":0.0013358962144896698,"verify_host_gap_mean_s":0.000007574264600407332,"verify_eval_wait_mean_s":0.09157729116971798,"verify_eval_fused_steps":96}}}
{"run":2281,"commit":"c903169","metric":8.778411207022145,"metrics":{},"status":"keep","description":"Add per-step host-time decomposition telemetry (draft submit/sync-wait, verify submit/host-gap/eval-wait, fused vs unfused step counts) through runtime→API→harness.","timestamp":1776443323753,"segment":24,"confidence":0.04436663374806903,"iterationTokens":5670,"asi":{"hypothesis":"Per-step submit-vs-eval decomposition will reveal whether collapse inflation is in host submit path, host gap, or kernel wait path.","learning":"Healthy fused run emitted stable decomposition: draft_submit_mean≈0.159ms, verify_submit_mean≈1.31ms, verify_host_gap≈0.0069ms, verify_eval_wait_mean≈91.4ms, fused_steps=96/unfused=0.","next_action_hint":"Continue sidecar-enabled sampling until next collapse to compare decomposition shift across fused→unfused safe-mode transitions.","diagnostic_findings":{"completion_tok_s":107.63338592276239,"dflash_eval_s":8.778411207022145,"draft_submit_mean_s":0.00015862063567813797,"verify_submit_mean_s":0.0013104422638813655,"verify_host_gap_mean_s":0.000006866307861249273,"verify_eval_wait_mean_s":0.09144155686468973,"verify_eval_fused_steps":96,"verify_eval_unfused_steps":0}}}
{"run":2282,"commit":"c903169","metric":8.763168332981877,"metrics":{},"status":"discard","description":"Host-time decomposition sampling: healthy fused floor-band run (~107.79 tok/s, eval_s ~8.763), sidecar warning-free.","timestamp":1776443355202,"segment":24,"confidence":0.04433683182164466,"iterationTokens":3966,"asi":{"hypothesis":"Healthy baseline should keep verify submit/gap/eval-wait decomposition tight in fused mode.","rollback_reason":"Unchanged-code sample in noise band; continuing until a collapse transition provides contrast.","next_action_hint":"Continue sidecar-enabled mirror runs and trigger immediate control parity on first fresh collapse.","diagnostic_findings":{"completion_tok_s":107.79469558936769,"dflash_eval_s":8.763168332981877,"verify_submit_mean_s":0.0012919926739414223,"verify_host_gap_mean_s":0.000006417110853362829,"verify_eval_wait_mean_s":0.09128279209350391,"verify_eval_fused_steps":96,"verify_eval_unfused_steps":0,"thermal_warning_samples":0,"performance_warning_samples":0}}}
{"run":2283,"commit":"c903169","metric":19.249296081601642,"metrics":{},"status":"discard","description":"Host-time decomposition captured fresh mirror collapse (~42.92 tok/s, eval_s ~19.25): safe-mode activated at step 36 and path flipped from fused to unfused.","timestamp":1776443402203,"segment":24,"confidence":0.04433701270878881,"iterationTokens":3752,"asi":{"hypothesis":"Collapse inflation should concentrate in kernel wait paths and unfused fallback rather than host submit/gap overhead.","rollback_reason":"Primary metric regressed sharply during collapse transition.","next_action_hint":"Run immediate control parity with sidecar enabled to confirm shared collapse and compare decomposition profile.","diagnostic_findings":{"completion_tok_s":42.924570601946414,"dflash_eval_s":19.249296081601642,"safe_mode_active":1,"spike_events":53,"safe_mode_step":36,"verify_eval_fused_steps":36,"verify_eval_unfused_steps":66,"verify_eval_wait_mean_s":0.18871845911238708,"draft_sync_eval_wait_mean_s":0.058704079575060554,"verify_submit_mean_s":0.0016986997375794339,"verify_host_gap_mean_s":0.000008228390167156855,"thermal_warning_samples":0,"performance_warning_samples":0}}}
{"run":2284,"commit":"c903169","metric":45.33266387693584,"metrics":{},"status":"discard","description":"Immediate control parity after mirror collapse: control entered severe trough (~17.74 tok/s, eval_s ~45.33), confirming shared failure mode with decomposition telemetry.","timestamp":1776443481872,"segment":24,"confidence":0.04433719359740894,"iterationTokens":3828,"asi":{"hypothesis":"If collapse is shared-path, control parity should show same fused→unfused shift and wait-time inflation.","rollback_reason":"Control parity diagnostic run only; primary metric massively regressed.","next_action_hint":"Resume mirror lane to map rebound and compare decomposition metrics through recovery.","diagnostic_findings":{"completion_tok_s":17.735966404571155,"dflash_eval_s":45.33266387693584,"mirror_runtime":0,"safe_mode_active":1,"spike_events":92,"safe_mode_step":15,"verify_eval_fused_steps":15,"verify_eval_unfused_steps":90,"verify_eval_wait_mean_s":0.43173957343900665,"verify_eval_wait_max_s":1.0305287090595812,"draft_sync_eval_wait_mean_s":0.12367180926699398,"verify_submit_mean_s":0.004529672297870829,"verify_host_gap_mean_s":0.000030244763807526657,"thermal_warning_samples":0,"performance_warning_samples":0}}}
{"run":2285,"commit":"c903169","metric":24.370947625720873,"metrics":{},"status":"discard","description":"Host-time decomposition: post-parity mirror remained in deep trough (~33.43 tok/s, eval_s ~24.37) with mostly unfused verify steps.","timestamp":1776443534984,"segment":24,"confidence":0.044249031069587254,"iterationTokens":3807,"asi":{"hypothesis":"During trough continuation, unfused path should persist and kernel wait components should stay elevated.","rollback_reason":"Primary metric remained far above floor in collapse regime.","next_action_hint":"Keep running mirror lane to capture recovery and observe when fused steps return.","diagnostic_findings":{"completion_tok_s":33.427500336213754,"dflash_eval_s":24.370947625720873,"safe_mode_active":1,"spike_events":89,"safe_mode_step":17,"verify_eval_fused_steps":17,"verify_eval_unfused_steps":88,"verify_eval_wait_mean_s":0.23210413452082623,"draft_sync_eval_wait_mean_s":0.0630505743280413,"verify_submit_mean_s":0.0016922241786406153,"verify_host_gap_mean_s":0.00000853454361536673,"thermal_warning_samples":0,"performance_warning_samples":0}}}
{"run":2286,"commit":"c903169","metric":14.387656998005696,"metrics":{},"status":"discard","description":"Host-time decomposition: rebound leg improved but still degraded (~59.98 tok/s, eval_s ~14.39); mixed fused/unfused verify phases.","timestamp":1776443570804,"segment":24,"confidence":0.044093073374777074,"iterationTokens":3748,"asi":{"hypothesis":"Recovery should show gradual return from unfused/high-wait regime toward fused/lower-wait regime.","rollback_reason":"Primary metric still above floor.","next_action_hint":"Continue tracking until stable floor returns, then summarize decomposition deltas healthy vs collapse.","diagnostic_findings":{"completion_tok_s":59.98298363561584,"dflash_eval_s":14.387656998005696,"safe_mode_active":1,"spike_events":8,"safe_mode_step":60,"verify_eval_fused_steps":60,"verify_eval_unfused_steps":42,"verify_eval_wait_mean_s":0.14105527899479128,"draft_sync_eval_wait_mean_s":0.04715576389017293,"verify_submit_mean_s":0.0012716695006626348,"verify_host_gap_mean_s":0.000006501674743405744,"thermal_warning_samples":0,"performance_warning_samples":0}}}
{"run":2287,"commit":"c903169","metric":12.256028579431586,"metrics":{},"status":"discard","description":"Host-time decomposition: continued recovery (~73.46 tok/s, eval_s ~12.26) with fused majority restored but residual unfused tail remains.","timestamp":1776443604817,"segment":24,"confidence":0.044010949297820436,"iterationTokens":3750,"asi":{"hypothesis":"As collapse unwinds, verify_eval_unfused_steps and draft_sync_eval_wait should shrink while eval-wait mean declines.","rollback_reason":"Primary metric still above floor.","next_action_hint":"Continue sidecar-enabled runs to near-floor and then summarize healthy vs collapse decomposition deltas.","diagnostic_findings":{"completion_tok_s":73.45735540736015,"dflash_eval_s":12.256028579431586,"safe_mode_active":1,"spike_events":4,"safe_mode_step":76,"verify_eval_fused_steps":76,"verify_eval_unfused_steps":22,"verify_eval_wait_mean_s":0.1250612699516992,"draft_sync_eval_wait_mean_s":0.04344749251190065,"verify_submit_mean_s":0.001292014926938074,"verify_host_gap_mean_s":0.000006320992038034054,"thermal_warning_samples":0,"performance_warning_samples":0}}}
{"run":2288,"commit":"c903169","metric":11.720331036136486,"metrics":{},"status":"discard","description":"Host-time decomposition: recovery continues (~76.80 tok/s, eval_s ~11.72) with mostly fused verify and smaller unfused tail.","timestamp":1776443639463,"segment":24,"confidence":0.04392913056704921,"iterationTokens":3748,"asi":{"hypothesis":"Near-recovery should further reduce unfused-step share and eval-wait inflation toward healthy baseline.","rollback_reason":"Primary metric still above floor.","next_action_hint":"Collect a short summary across healthy/collapse/recovery bands from runs #2282–#2288.","diagnostic_findings":{"completion_tok_s":76.80210821961813,"dflash_eval_s":11.720331036136486,"safe_mode_active":1,"spike_events":2,"safe_mode_step":78,"verify_eval_fused_steps":78,"verify_eval_unfused_steps":22,"verify_eval_wait_mean_s":0.11720309494296088,"draft_sync_eval_wait_mean_s":0.03941491660027003,"verify_submit_mean_s":0.001307964561274275,"verify_host_gap_mean_s":0.000006549641257151961,"thermal_warning_samples":0,"performance_warning_samples":0}}}
{"run":2289,"commit":"c903169","metric":8.82898237509653,"metrics":{},"status":"discard","description":"Host-time decomposition: recovery returned to healthy fused profile (~107.01 tok/s, eval_s ~8.829), watchdog idle.","timestamp":1776443777001,"segment":24,"confidence":0.044010949297820436,"iterationTokens":11247,"asi":{"hypothesis":"Full recovery should converge back to fused-only and healthy eval-wait baseline.","rollback_reason":"Primary metric still above floor and no optimization delta.","next_action_hint":"Summarize collapse-wave decomposition evidence and move to next attribution probe.","diagnostic_findings":{"completion_tok_s":107.00716541766766,"dflash_eval_s":8.82898237509653,"safe_mode_active":0,"spike_events":0,"verify_eval_fused_steps":96,"verify_eval_unfused_steps":0,"verify_eval_wait_mean_s":0.09196835459685342,"draft_sync_eval_wait_mean_s":0,"verify_submit_mean_s":0.0013056362768111285,"verify_host_gap_mean_s":0.000006901917610472689,"thermal_warning_samples":0,"performance_warning_samples":0}}}
{"run":2290,"commit":"68fb119","metric":8.7411108011147,"metrics":{},"status":"keep","description":"Add split fused/unfused verify-eval wait telemetry fields (counts/mean/min/max) through runtime→API→harness for direct wait attribution.","timestamp":1776443999348,"segment":24,"confidence":0.04408747718318928,"iterationTokens":12497,"asi":{"hypothesis":"Separating fused vs unfused verify wait distributions will sharpen attribution of collapse-time latency inflation.","learning":"Healthy fused sample emitted expected split: verify_eval_wait_fused_mean≈0.091s with 96 fused steps and 0 unfused steps; unfused bucket remained zero.","next_action_hint":"Use new split wait fields on next collapse transition to quantify fused vs unfused wait inflation directly.","diagnostic_findings":{"completion_tok_s":108.311705698682,"dflash_eval_s":8.7411108011147,"verify_eval_wait_fused_steps":96,"verify_eval_wait_fused_mean_s":0.09105306955461856,"verify_eval_wait_unfused_steps":0,"verify_eval_wait_unfused_mean_s":0}}}
{"run":2291,"commit":"68fb119","metric":8.74461787508335,"metrics":{},"status":"discard","description":"Split fused/unfused wait probe continuation: healthy fused sample (~108.09 tok/s, eval_s ~8.745) with unfused wait bucket at zero.","timestamp":1776444031022,"segment":24,"confidence":0.044148024962972265,"iterationTokens":4035,"asi":{"hypothesis":"Healthy runs should populate only fused wait bucket and keep unfused bucket empty.","rollback_reason":"Unchanged-code sample within noise band; no new optimization delta.","next_action_hint":"Continue until next collapse transition to populate unfused wait bucket and compare fused vs unfused wait inflation.","diagnostic_findings":{"completion_tok_s":108.0883251028968,"dflash_eval_s":8.74461787508335,"verify_eval_wait_fused_steps":96,"verify_eval_wait_fused_mean_s":0.09108955770958953,"verify_eval_wait_unfused_steps":0,"verify_eval_wait_unfused_mean_s":0,"safe_mode_active":0,"spike_events":0}}}
{"run":2292,"commit":"68fb119","metric":9.44437595421914,"metrics":{},"status":"discard","description":"Split fused/unfused wait probe: healthy fused regime but in high-soft band (~99.53 tok/s, eval_s ~9.44); unfused bucket remained empty.","timestamp":1776452319176,"segment":24,"confidence":0.04421320804706007,"iterationTokens":4035,"asi":{"hypothesis":"Until collapse onset, fused wait bucket should remain dominant and unfused bucket should stay at zero.","rollback_reason":"Primary metric above floor and no collapse transition yet.","next_action_hint":"Continue sidecar-enabled mirror sampling until next collapse edge, then trigger immediate control parity.","diagnostic_findings":{"completion_tok_s":99.5332979399875,"dflash_eval_s":9.44437595421914,"verify_eval_wait_fused_steps":96,"verify_eval_wait_fused_mean_s":0.09837863754485927,"verify_eval_wait_unfused_steps":0,"verify_eval_wait_unfused_mean_s":0,"safe_mode_active":0,"spike_events":0,"thermal_warning_samples":0}}}
{"run":2293,"commit":"68fb119","metric":9.468237671302631,"metrics":{},"status":"discard","description":"Split fused/unfused wait probe: another fused-only high-soft sample (~99.22 tok/s, eval_s ~9.47), no watchdog events.","timestamp":1776452349569,"segment":24,"confidence":0.04423735458813524,"iterationTokens":3916,"asi":{"hypothesis":"Pre-collapse regime should keep unfused wait bucket empty and fused wait near ~0.09–0.10s.","rollback_reason":"Primary metric above floor; still no collapse transition to stress split wait telemetry.","next_action_hint":"Continue mirror runs; trigger immediate control parity on first safe-mode/spike transition.","diagnostic_findings":{"completion_tok_s":99.22218984055749,"dflash_eval_s":9.468237671302631,"verify_eval_wait_fused_steps":96,"verify_eval_wait_fused_mean_s":0.09862714546034113,"verify_eval_wait_unfused_steps":0,"verify_eval_wait_unfused_mean_s":0,"safe_mode_active":0,"spike_events":0,"thermal_warning_samples":0}}}
{"run":2294,"commit":"68fb119","metric":20.686258207191713,"metrics":{},"status":"discard","description":"Split wait telemetry captured fresh mirror collapse (~37.87 tok/s, eval_s ~20.69): early safe-mode (step 6), unfused steps dominated, wait inflation spiked.","timestamp":1776452403267,"segment":24,"confidence":0.04421320804706007,"iterationTokens":3898,"asi":{"hypothesis":"Collapse transition should populate unfused wait bucket and show large eval-wait inflation versus fused healthy baseline.","rollback_reason":"Primary metric regressed in collapse event.","next_action_hint":"Run immediate control parity with sidecar enabled to confirm shared collapse and compare fused/unfused wait split.","diagnostic_findings":{"completion_tok_s":37.87317455524259,"dflash_eval_s":20.686258207191713,"safe_mode_active":1,"spike_events":30,"safe_mode_step":6,"verify_eval_wait_fused_steps":6,"verify_eval_wait_fused_mean_s":0.1986791598222529,"verify_eval_wait_unfused_steps":100,"verify_eval_wait_unfused_mean_s":0.194941734141903,"draft_sync_eval_wait_mean_s":0.049139524523634466,"verify_submit_mean_s":0.0055613683060004885,"verify_host_gap_mean_s":0.000022954035128624934,"thermal_warning_samples":0,"performance_warning_samples":0}}}
{"run":2295,"commit":"68fb119","metric":38.2544873295119,"metrics":{},"status":"discard","description":"Immediate control parity after mirror collapse: control also entered severe trough (~20.37 tok/s, eval_s ~38.25) with dominant unfused wait inflation.","timestamp":1776452482241,"segment":24,"confidence":0.044148024962972265,"iterationTokens":4048,"asi":{"hypothesis":"Shared collapse should reproduce fused→unfused shift and unfused wait inflation in control parity.","rollback_reason":"Control parity run is diagnostic-only and far above floor.","next_action_hint":"Resume mirror lane to track rebound and compare fused/unfused wait buckets through recovery.","diagnostic_findings":{"completion_tok_s":20.36698338836642,"dflash_eval_s":38.2544873295119,"mirror_runtime":0,"safe_mode_active":1,"spike_events":95,"safe_mode_step":11,"verify_eval_wait_fused_steps":11,"verify_eval_wait_fused_mean_s":0.1556852347407998,"verify_eval_wait_unfused_steps":93,"verify_eval_wait_unfused_mean_s":0.3929240761327267,"draft_sync_eval_wait_mean_s":0.09983919848692954,"verify_submit_mean_s":0.013334332959717497,"verify_host_gap_mean_s":0.000024161846690381375,"thermal_warning_samples":0,"performance_warning_samples":0}}}
{"run":2296,"commit":"68fb119","metric":39.69750466675032,"metrics":{},"status":"discard","description":"Split wait probe: mirror deepened into severe trough (~19.73 tok/s, eval_s ~39.70), safe-mode triggered at step 2 with almost fully unfused verify path.","timestamp":1776452559232,"segment":24,"confidence":0.044083033793465946,"iterationTokens":4052,"asi":{"hypothesis":"In deep trough, unfused wait bucket should dominate and control total wait inflation; thermal sidecar remains flat.","rollback_reason":"Primary metric catastrophic regression during collapse wave.","next_action_hint":"Continue mirror recovery mapping to observe when unfused wait share declines and fused bucket normalizes.","diagnostic_findings":{"completion_tok_s":19.733751574682422,"dflash_eval_s":39.69750466675032,"safe_mode_active":1,"spike_events":105,"safe_mode_step":2,"verify_eval_wait_fused_steps":2,"verify_eval_wait_fused_mean_s":1.289718770480249,"verify_eval_wait_unfused_steps":104,"verify_eval_wait_unfused_mean_s":0.3569043974499576,"draft_sync_eval_wait_mean_s":0.0885957480025424,"verify_submit_mean_s":0.012507919371479525,"verify_host_gap_mean_s":0.00003819659962933862,"thermal_warning_samples":0,"performance_warning_samples":0}}}
{"run":2297,"commit":"68fb119","metric":23.919838411384262,"metrics":{},"status":"discard","description":"Split wait probe: rebound from trough started (~33.64 tok/s, eval_s ~23.92) but unfused wait bucket still dominant.","timestamp":1776452613238,"segment":24,"confidence":0.0439489644642354,"iterationTokens":4041,"asi":{"hypothesis":"Early rebound should reduce wait inflation gradually while unfused share remains elevated before full recovery.","rollback_reason":"Primary metric still deeply above floor.","next_action_hint":"Continue recovery sampling until fused share retakes majority and wait means approach healthy band.","diagnostic_findings":{"completion_tok_s":33.636968888458036,"dflash_eval_s":23.919838411384262,"safe_mode_active":1,"spike_events":68,"safe_mode_step":17,"verify_eval_wait_fused_steps":17,"verify_eval_wait_fused_mean_s":0.13995160046718358,"verify_eval_wait_unfused_steps":88,"verify_eval_wait_unfused_mean_s":0.24478010459543756,"draft_sync_eval_wait_mean_s":0.06176552980667276,"verify_submit_mean_s":0.0033780027901576387,"verify_host_gap_mean_s":0.000013969500460440204,"thermal_warning_samples":0,"performance_warning_samples":0}}}
{"run":2298,"commit":"68fb119","metric":19.447024957742542,"metrics":{},"status":"discard","description":"Split wait probe: rebound progressed (~42.48 tok/s, eval_s ~19.45) with fused share increasing but unfused waits still heavier.","timestamp":1776452658077,"segment":24,"confidence":0.04381570815004976,"iterationTokens":4004,"asi":{"hypothesis":"Recovery path should show fused-step share climbing while unfused wait mean remains above fused mean until near-floor return.","rollback_reason":"Primary metric remains far above floor.","next_action_hint":"Continue sampling through rebound to capture when unfused wait bucket collapses back toward zero.","diagnostic_findings":{"completion_tok_s":42.47767970851781,"dflash_eval_s":19.447024957742542,"safe_mode_active":1,"spike_events":55,"safe_mode_step":35,"verify_eval_wait_fused_steps":35,"verify_eval_wait_fused_mean_s":0.11770824403502048,"verify_eval_wait_unfused_steps":67,"verify_eval_wait_unfused_mean_s":0.22876450994726158,"draft_sync_eval_wait_mean_s":0.05767937678385025,"verify_submit_mean_s":0.001795805543295893,"verify_host_gap_mean_s":0.000010971839347963824,"thermal_warning_samples":0,"performance_warning_samples":0}}}
