{"run":590,"commit":"8b55918","metric":99.56023350387402,"metrics":{},"status":"discard","description":"Confirmation rerun for context-only DFLASH_DRAFT_WINDOW=512 candidate.","timestamp":1776278783151,"segment":23,"confidence":1.7822964503376635,"iterationTokens":786,"asi":{"hypothesis":"If window=512 was a true near-win, immediate rerun should remain close to prior 105.81 sample.","rollback_reason":"Confirmation dropped to 99.56, failing reproducibility.","next_action_hint":"Add window=512 to non-winning set; keep default window 1024.","backend":"mirror_sd_mlx","context_only_draft_cache":1,"draft_sink":48,"draft_window":512,"confirmation_run":true}}
{"run":591,"commit":"8b55918","metric":105.39044962374871,"metrics":{},"status":"discard","description":"Baseline recovery run after window=512 confirmation discard (keep config restored).","timestamp":1776278821551,"segment":23,"confidence":1.8396942212275706,"iterationTokens":782,"asi":{"hypothesis":"Reverting the failed 512-window candidate should return throughput toward high-band samples.","rollback_reason":"Recovered to 105.39 but still below keep 106.86.","next_action_hint":"Stay on keep config and continue paired checks; still no reproducible improvement over 8b55918.","backend":"mirror_sd_mlx","context_only_draft_cache":1,"draft_sink":48,"stability_probe":true}}
{"run":592,"commit":"8b55918","metric":101.14196421725944,"metrics":{},"status":"discard","description":"Paired control run after 105.39 mirror recovery sample (mirror disabled).","timestamp":1776278859416,"segment":23,"confidence":1.9009119313897245,"iterationTokens":699,"asi":{"hypothesis":"If mirror is genuinely stronger in this recovered window, control should remain noticeably lower.","rollback_reason":"Control run is comparison-only; not a mirror keep candidate.","next_action_hint":"Pair favors mirror by ~4.25 tok/s, but given recent ordering flips continue paired bundles before asserting robust backend lead.","backend":"bstnxbt_mlx","mirror_runtime_enabled":0,"context_only_draft_cache":1,"draft_sink":48,"paired_delta_tok_s":4.248485406489271}}
{"run":593,"commit":"8b55918","metric":102.1841058500745,"metrics":{},"status":"discard","description":"Immediate mirror follow-up after control pair to test persistence of mirror-leading window.","timestamp":1776278893353,"segment":23,"confidence":1.9223538551869368,"iterationTokens":644,"asi":{"hypothesis":"If mirror lead is real in this window, follow-up mirror run should stay above the paired control sample.","rollback_reason":"Mirror stayed above paired control but still below keep (102.18 vs 101.14 control; keep 106.86).","next_action_hint":"Directionally mirror-favoring but not near keep; continue robust A/B monitoring and avoid new code churn.","backend":"mirror_sd_mlx","context_only_draft_cache":1,"draft_sink":48,"paired_control_tok_s":101.14196421725944,"paired_delta_tok_s":1.0421416328150617}}
{"run":594,"commit":"8b55918","metric":99.69579517297817,"metrics":{},"status":"discard","description":"Additional unchanged baseline run on keep config to continue band characterization.","timestamp":1776278926113,"segment":23,"confidence":1.9027431183317143,"iterationTokens":690,"asi":{"hypothesis":"Repeated unchanged runs should reveal whether current mirror band can re-approach keep territory.","rollback_reason":"Run returned to ~99.70, still below keep.","next_action_hint":"Maintain conservative paired checks; no reproducible path above 106.86 yet.","backend":"mirror_sd_mlx","context_only_draft_cache":1,"draft_sink":48,"stability_probe":true}}
{"run":595,"commit":"8b55918","metric":105.49666378511705,"metrics":{},"status":"discard","description":"Paired control run after 99.70 mirror baseline (mirror disabled) under keep shape.","timestamp":1776278960812,"segment":23,"confidence":1.9390728408785671,"iterationTokens":680,"asi":{"hypothesis":"Control pair checks whether current mirror dip is backend-specific or just sampling variance.","rollback_reason":"Control run is comparison-only; not a mirror keep candidate.","next_action_hint":"Large control lead in this pair (~-5.80 for mirror) reinforces that backend ordering is still unstable; continue paired bundles.","backend":"bstnxbt_mlx","mirror_runtime_enabled":0,"context_only_draft_cache":1,"draft_sink":48,"paired_delta_tok_s":-5.800868612138882}}
{"run":596,"commit":"8b55918","metric":105.91630481148098,"metrics":{},"status":"discard","description":"Immediate mirror follow-up after control-leading pair to test ordering flip.","timestamp":1776279006312,"segment":23,"confidence":1.9641017457118048,"iterationTokens":654,"asi":{"hypothesis":"If control lead was transient, immediate mirror rerun should rebound toward or above control.","rollback_reason":"Mirror rebounded above paired control but still below keep (105.92 vs 106.86).","next_action_hint":"Ordering flips continue; prioritize stability-aware A/B bundles and avoid inferring from single-run extremes.","backend":"mirror_sd_mlx","context_only_draft_cache":1,"draft_sink":48,"paired_control_tok_s":105.49666378511705,"paired_delta_tok_s":0.41964102636393397}}
{"run":597,"commit":"8b55918","metric":106.7924616010624,"metrics":{},"status":"discard","description":"Sink micro-neighborhood test in recovered band: DFLASH_DRAFT_SINK=50 with context-only cache.","timestamp":1776279045254,"segment":23,"confidence":1.9796811938762797,"iterationTokens":816,"asi":{"hypothesis":"A slight sink increase from 48 to 50 could balance anchor retention and overhead for a small throughput gain.","rollback_reason":"Very close but still below keep (106.79 vs 106.86).","next_action_hint":"Run one confirmation sample for sink=50 since it is near keep; keep sink=48 unless 50 reproduces above keep.","backend":"mirror_sd_mlx","context_only_draft_cache":1,"draft_sink":50}}
{"run":598,"commit":"8b55918","metric":103.93388485461467,"metrics":{},"status":"discard","description":"Confirmation rerun for DFLASH_DRAFT_SINK=50 candidate.","timestamp":1776279081941,"segment":23,"confidence":1.9952585503270472,"iterationTokens":750,"asi":{"hypothesis":"If sink=50 was a true near-optimal setting, confirmation should stay near prior 106.79 sample.","rollback_reason":"Confirmation dropped to 103.93, so sink=50 is not reproducibly better than keep.","next_action_hint":"Add sink=50 to non-winning set; continue using sink=48.","backend":"mirror_sd_mlx","context_only_draft_cache":1,"draft_sink":50,"confirmation_run":true}}
{"run":599,"commit":"8b55918","metric":105.763382654015,"metrics":{},"status":"discard","description":"Sink micro-neighborhood test: DFLASH_DRAFT_SINK=46 with context-only cache.","timestamp":1776279132476,"segment":23,"confidence":2.0914803209190813,"iterationTokens":914,"asi":{"hypothesis":"A slight sink reduction from 48 to 46 may lower overhead without hurting acceptance.","rollback_reason":"Below keep (105.76 vs 106.86).","next_action_hint":"Treat sink=46 as non-winning; keep sink=48.","backend":"mirror_sd_mlx","context_only_draft_cache":1,"draft_sink":46}}
{"run":600,"commit":"8b55918","metric":104.39038980721381,"metrics":{},"status":"discard","description":"Baseline re-anchor after sink=46 probe (keep config restored).","timestamp":1776279187634,"segment":23,"confidence":2.223900603181434,"iterationTokens":789,"asi":{"hypothesis":"After reverting sink=46, baseline should settle back into current high-100 operating band.","rollback_reason":"Recovered but still below keep at 104.39.","next_action_hint":"Continue paired mirror/control checks; no sink variant has beaten sink=48.","backend":"mirror_sd_mlx","context_only_draft_cache":1,"draft_sink":48,"stability_probe":true}}
{"run":601,"commit":"8b55918","metric":105.32580651349728,"metrics":{},"status":"discard","description":"Paired control run after 104.39 mirror baseline (mirror disabled) under keep shape.","timestamp":1776279232179,"segment":23,"confidence":2.236059929428926,"iterationTokens":673,"asi":{"hypothesis":"Paired control will test whether mirror retains any edge in current high-100 window.","rollback_reason":"Control run is comparison-only; not a mirror keep candidate.","next_action_hint":"Current pair slightly favors control (~0.94 tok/s); continue paired bundles because ordering still flips.","backend":"bstnxbt_mlx","mirror_runtime_enabled":0,"context_only_draft_cache":1,"draft_sink":48,"paired_delta_tok_s":-0.9354167062834698}}
{"run":602,"commit":"8b55918","metric":103.98686909208614,"metrics":{},"status":"discard","description":"Mirror follow-up after near-tie/slight-control pair to check immediate ordering.","timestamp":1776279266807,"segment":23,"confidence":2.2636748749234346,"iterationTokens":812,"asi":{"hypothesis":"Mirror may regain lead on immediate rerun if prior control advantage was local variance.","rollback_reason":"Mirror remained below paired control and below keep (103.99 vs 105.33 control; keep 106.86).","next_action_hint":"Backend ordering remains unstable in high-100 band; continue cautious A/B tracking and avoid over-claiming deltas <~2 tok/s.","backend":"mirror_sd_mlx","context_only_draft_cache":1,"draft_sink":48,"paired_control_tok_s":105.32580651349728,"paired_delta_tok_s":-1.3389374214111402}}
{"run":603,"commit":"8b55918","metric":106.04932290337565,"metrics":{},"status":"discard","description":"Mirror split sweep into previously-untested shallow range: DFLASH_MIRROR_SD_EXIT_LAYER=5.","timestamp":1776279376094,"segment":23,"confidence":2.2864195732600594,"iterationTokens":812,"asi":{"hypothesis":"Very shallow mirror split points (below previously-tested 6+) may reveal a new non-monotonic pocket.","rollback_reason":"Close but below keep (106.05 vs 106.86).","next_action_hint":"Continue shallow-range bracket (0-4) before concluding this region is exhausted.","backend":"mirror_sd_mlx","context_only_draft_cache":1,"draft_sink":48,"mirror_exit_layer":5}}
{"run":604,"commit":"8b55918","metric":105.60327060754241,"metrics":{},"status":"discard","description":"Mirror shallow split sweep: DFLASH_MIRROR_SD_EXIT_LAYER=4.","timestamp":1776279434602,"segment":23,"confidence":2.314852802148446,"iterationTokens":1270,"asi":{"hypothesis":"Exit layer 4 could outperform both very shallow and mid-stack splits under context-only cache mode.","rollback_reason":"Below keep (105.60 vs 106.86).","next_action_hint":"Continue shallow sweep with exit layers 0-3, then mark shallow range exhausted if no win.","backend":"mirror_sd_mlx","context_only_draft_cache":1,"draft_sink":48,"mirror_exit_layer":4}}
{"run":605,"commit":"8b55918","metric":105.67307194239926,"metrics":{},"status":"discard","description":"Mirror shallow split sweep: DFLASH_MIRROR_SD_EXIT_LAYER=3.","timestamp":1776279470377,"segment":23,"confidence":2.3353578818204523,"iterationTokens":688,"asi":{"hypothesis":"Exit layer 3 might hit a shallow non-monotonic sweet spot missed by deeper sweeps.","rollback_reason":"Still below keep (105.67 vs 106.86).","next_action_hint":"Continue with exit layers 2,1,0; likely shallow region remains suboptimal.","backend":"mirror_sd_mlx","context_only_draft_cache":1,"draft_sink":48,"mirror_exit_layer":3}}
{"run":606,"commit":"8b55918","metric":105.22844682911682,"metrics":{},"status":"discard","description":"Mirror shallow split sweep: DFLASH_MIRROR_SD_EXIT_LAYER=2.","timestamp":1776279508412,"segment":23,"confidence":2.3403706889629348,"iterationTokens":684,"asi":{"hypothesis":"Exit layer 2 may reduce split overhead enough to offset shallower feature capture.","rollback_reason":"Below keep (105.23 vs 106.86).","next_action_hint":"Test final shallow points 1 and 0, then close shallow sweep as exhausted.","backend":"mirror_sd_mlx","context_only_draft_cache":1,"draft_sink":48,"mirror_exit_layer":2}}
{"run":607,"commit":"8b55918","metric":103.75817155584087,"metrics":{},"status":"discard","description":"Mirror shallow split sweep: DFLASH_MIRROR_SD_EXIT_LAYER=1.","timestamp":1776279547067,"segment":23,"confidence":2.4121714620920973,"iterationTokens":673,"asi":{"hypothesis":"Near-front split at layer 1 could unlock a lightweight verification path.","rollback_reason":"Materially below keep (103.76 vs 106.86).","next_action_hint":"Only exit layer 0 remains to finish shallow sweep; likely no win in this region.","backend":"mirror_sd_mlx","context_only_draft_cache":1,"draft_sink":48,"mirror_exit_layer":1}}
{"run":608,"commit":"8b55918","metric":105.48834536608094,"metrics":{},"status":"discard","description":"Mirror shallow split sweep completion: DFLASH_MIRROR_SD_EXIT_LAYER=0.","timestamp":1776279587210,"segment":23,"confidence":2.5166265626034936,"iterationTokens":675,"asi":{"hypothesis":"Minimal split (exit at first layer) could reduce overhead enough to outperform deeper splits.","rollback_reason":"Below keep (105.49 vs 106.86).","next_action_hint":"Mark shallow exit-layer range 0-5 as exhausted and keep exit layer 14.","backend":"mirror_sd_mlx","context_only_draft_cache":1,"draft_sink":48,"mirror_exit_layer":0}}
{"run":609,"commit":"8b55918","metric":105.42658960241336,"metrics":{},"status":"discard","description":"Sink micro-neighborhood extension: DFLASH_DRAFT_SINK=49 with context-only cache.","timestamp":1776279643122,"segment":23,"confidence":2.610689225317673,"iterationTokens":1339,"asi":{"hypothesis":"A one-step sink adjustment from 48 to 49 may offer a slightly better balance than both 48 and 50.","rollback_reason":"Below keep (105.43 vs 106.86).","next_action_hint":"Treat sink=49 as non-winning; keep sink=48.","backend":"mirror_sd_mlx","context_only_draft_cache":1,"draft_sink":49}}
{"run":610,"commit":"8b55918","metric":105.4317759484947,"metrics":{},"status":"discard","description":"Sink micro-neighborhood extension: DFLASH_DRAFT_SINK=47 with context-only cache.","timestamp":1776279677735,"segment":23,"confidence":2.6971551851590267,"iterationTokens":679,"asi":{"hypothesis":"A one-step sink reduction from 48 to 47 may slightly reduce overhead without harming acceptance.","rollback_reason":"Below keep (105.43 vs 106.86).","next_action_hint":"Treat sink=47 as non-winning; keep sink=48.","backend":"mirror_sd_mlx","context_only_draft_cache":1,"draft_sink":47}}
{"run":611,"commit":"8b55918","metric":106.31003985998953,"metrics":{},"status":"discard","description":"Context-only window sweep extension: DFLASH_DRAFT_WINDOW=640 with sink=48.","timestamp":1776279801848,"segment":23,"confidence":2.744023040859345,"iterationTokens":1037,"asi":{"hypothesis":"A mid-point window between 512 and 768 may preserve enough context while reducing draft attention overhead.","rollback_reason":"Improved but still below keep (106.31 vs 106.86).","next_action_hint":"Run one confirmation sample at window=640 due proximity before final pruning.","backend":"mirror_sd_mlx","context_only_draft_cache":1,"draft_sink":48,"draft_window":640}}
{"run":612,"commit":"8b55918","metric":106.5523213195909,"metrics":{},"status":"discard","description":"Confirmation rerun for DFLASH_DRAFT_WINDOW=640 candidate (sink=48, context-only cache).","timestamp":1776279843034,"segment":23,"confidence":2.7912020391085557,"iterationTokens":784,"asi":{"hypothesis":"If window=640 is a true improvement, confirmation should match or exceed keep.","rollback_reason":"Confirmation improved vs first sample but still below keep (106.55 vs 106.86).","next_action_hint":"Mark window=640 as non-winning; retain default window.","backend":"mirror_sd_mlx","context_only_draft_cache":1,"draft_sink":48,"draft_window":640,"confirmation_run":true}}
{"run":613,"commit":"8b55918","metric":105.72020333073789,"metrics":{},"status":"discard","description":"Context-only window sweep extension: DFLASH_DRAFT_WINDOW=1280 with sink=48.","timestamp":1776279881502,"segment":23,"confidence":2.8372513244036797,"iterationTokens":760,"asi":{"hypothesis":"A larger mid-range window (1280) may improve acceptance without the full cost of 1536+.","rollback_reason":"Below keep (105.72 vs 106.86).","next_action_hint":"Add 1280 to non-winning window set; keep default window.","backend":"mirror_sd_mlx","context_only_draft_cache":1,"draft_sink":48,"draft_window":1280}}
{"run":614,"commit":"8b55918","metric":106.06324232129523,"metrics":{},"status":"discard","description":"Paired-bundle anchor run: unchanged mirror keep config.","timestamp":1776279931024,"segment":23,"confidence":2.888272268770434,"iterationTokens":1519,"asi":{"hypothesis":"Current keep shape should remain in low-to-mid 106 band when regime is favorable.","rollback_reason":"Unchanged anchor run below keep (106.06 vs 106.86).","next_action_hint":"Run immediate paired control sample for contemporaneous backend delta.","backend":"mirror_sd_mlx","context_only_draft_cache":1,"draft_sink":48,"stability_probe":true}}
{"run":615,"commit":"8b55918","metric":104.6967027770727,"metrics":{},"status":"discard","description":"Paired-bundle control run: mirror disabled under same keep-shape env.","timestamp":1776279970158,"segment":23,"confidence":3.026670863764883,"iterationTokens":668,"asi":{"hypothesis":"Mirror backend should hold a meaningful edge in immediate paired A/B under current favorable window.","rollback_reason":"Control run is comparison-only; not a mirror keep candidate.","next_action_hint":"Current pair favors mirror by ~1.37 tok/s; run immediate mirror follow-up to test persistence.","backend":"bstnxbt_mlx","mirror_runtime_enabled":0,"context_only_draft_cache":1,"draft_sink":48,"paired_delta_tok_s":1.366539544222536}}
{"run":616,"commit":"8b55918","metric":105.77273418830723,"metrics":{},"status":"discard","description":"Paired-bundle mirror follow-up after control sample.","timestamp":1776280000438,"segment":23,"confidence":3.162414386081056,"iterationTokens":615,"asi":{"hypothesis":"If the mirror edge is persistent, follow-up mirror sample should remain above paired control.","rollback_reason":"Mirror remained above paired control but below keep (105.77 vs 104.70 control; keep 106.86).","next_action_hint":"Mirror currently trends ahead in this bundle, but continue multi-bundle validation before drawing robust conclusions.","backend":"mirror_sd_mlx","context_only_draft_cache":1,"draft_sink":48,"paired_control_tok_s":104.6967027770727,"paired_delta_tok_s":1.0760314112345273}}
{"run":617,"commit":"8b55918","metric":104.5163044842943,"metrics":{},"status":"discard","description":"Second paired-bundle control run (mirror disabled) under unchanged keep-shape env.","timestamp":1776280040529,"segment":23,"confidence":3.1915576109643355,"iterationTokens":759,"asi":{"hypothesis":"Control should remain below mirror if current mirror-leading trend is real.","rollback_reason":"Control run is comparison-only; not a mirror keep candidate.","next_action_hint":"Run immediate mirror sample to complete this pair; current trailing control suggests mirror advantage in this local window.","backend":"bstnxbt_mlx","mirror_runtime_enabled":0,"context_only_draft_cache":1,"draft_sink":48,"paired_delta_tok_s":1.2564297040129417}}
{"run":618,"commit":"8b55918","metric":105.35561029092626,"metrics":{},"status":"discard","description":"Second paired-bundle mirror follow-up after control sample.","timestamp":1776280071631,"segment":23,"confidence":3.220770596219739,"iterationTokens":605,"asi":{"hypothesis":"Mirror should remain above immediate control sample if the local window still favors mirror backend.","rollback_reason":"Mirror stayed above paired control (105.36 vs 104.52) but below keep 106.86.","next_action_hint":"Record this as a mirror-favoring local bundle; still require reproducible >106.86 or robust median gain for a new keep.","backend":"mirror_sd_mlx","context_only_draft_cache":1,"draft_sink":48,"paired_control_tok_s":104.5163044842943,"paired_delta_tok_s":0.8393058066319626}}
{"run":619,"commit":"8b55918","metric":106.2049581239332,"metrics":{},"status":"discard","description":"Stability-lever extension under mirror keep shape: INITIAL_CACHE_BLOCKS=40.","timestamp":1776280232812,"segment":23,"confidence":3.4944941281062807,"iterationTokens":9363,"asi":{"hypothesis":"An intermediate cache reservation of 40 may smooth current variance and improve mirror throughput.","rollback_reason":"Below keep (106.20 vs 106.86).","next_action_hint":"Mark 40 as non-winning cache reservation for this lane; keep default reservation.","backend":"mirror_sd_mlx","context_only_draft_cache":1,"draft_sink":48,"initial_cache_blocks":40}}
{"run":620,"commit":"8b55918","metric":105.13952239828382,"metrics":{},"status":"discard","description":"Stability-lever extension under mirror keep shape: INITIAL_CACHE_BLOCKS=80.","timestamp":1776280268951,"segment":23,"confidence":3.829539824666601,"iterationTokens":704,"asi":{"hypothesis":"A higher intermediate cache reservation (80) might stabilize throughput while avoiding heavier overhead than 96+.","rollback_reason":"Below keep (105.14 vs 106.86).","next_action_hint":"Add 80 to non-winning cache reservation set for this lane.","backend":"mirror_sd_mlx","context_only_draft_cache":1,"draft_sink":48,"initial_cache_blocks":80}}
{"run":621,"commit":"8b55918","metric":106.60944737757151,"metrics":{},"status":"discard","description":"Stability-lever extension under mirror keep shape: INITIAL_CACHE_BLOCKS=112.","timestamp":1776280320031,"segment":23,"confidence":3.91624614942682,"iterationTokens":771,"asi":{"hypothesis":"A larger intermediate cache reservation (112) may hit a better stability/perf balance than 96 or 128.","rollback_reason":"Close but still below keep (106.61 vs 106.86).","next_action_hint":"Run one confirmation sample at 112 before final pruning due near-keep proximity.","backend":"mirror_sd_mlx","context_only_draft_cache":1,"draft_sink":48,"initial_cache_blocks":112}}
