{"run":1972,"commit":"e299525","metric":10.93535621499177,"metrics":{},"status":"discard","description":"Loop sample: soft-band run (~87.62 tok/s, eval_s ~10.94) with watchdog idle.","timestamp":1776389836451,"segment":24,"confidence":0.07678392706416165,"iterationTokens":1391,"asi":{"hypothesis":"Recovery remains noisy in upper-soft band but without spike-triggered collapse.","rollback_reason":"Primary metric above best floor.","next_action_hint":"Continue unchanged loop for eventual low-9 re-entry.","diagnostic_findings":{"completion_tok_s":87.61805160670325,"dflash_eval_s":10.93535621499177,"safe_mode_activations":0}}}
{"run":1973,"commit":"e299525","metric":10.399932701722719,"metrics":{},"status":"discard","description":"Loop sample: soft-band rebound (~91.79 tok/s, eval_s ~10.40), watchdog inactive.","timestamp":1776389872646,"segment":24,"confidence":0.0764207613490059,"iterationTokens":1403,"asi":{"hypothesis":"Regime remains in non-spiking recovery; unchanged loop still best diagnostic.","rollback_reason":"Primary metric above best floor.","next_action_hint":"Continue unchanged mirror loop and monitor for low-9 re-entry.","diagnostic_findings":{"completion_tok_s":91.79325942562753,"dflash_eval_s":10.399932701722719,"safe_mode_activations":0}}}
{"run":1974,"commit":"e299525","metric":9.880572378169745,"metrics":{},"status":"discard","description":"Loop sample: sub-10 rebound (~96.44 tok/s, eval_s ~9.88) with watchdog inactive.","timestamp":1776389910459,"segment":24,"confidence":0.0757652087267593,"iterationTokens":1408,"asi":{"hypothesis":"Recovery remains gradual and stable without spike-triggered collapse.","rollback_reason":"Primary metric above best floor.","next_action_hint":"Continue unchanged loop for high-soft return.","diagnostic_findings":{"completion_tok_s":96.43767674507365,"dflash_eval_s":9.880572378169745,"safe_mode_activations":0}}}
{"run":1975,"commit":"e299525","metric":9.578946752124466,"metrics":{},"status":"discard","description":"Loop sample: low-soft rebound (~99.29 tok/s, eval_s ~9.58), watchdog idle.","timestamp":1776389945757,"segment":24,"confidence":0.07527051607757956,"iterationTokens":1389,"asi":{"hypothesis":"Regime is moving from soft recovery toward high-soft plateau.","rollback_reason":"Primary metric above best floor.","next_action_hint":"Continue unchanged loop to monitor for high-window re-entry.","diagnostic_findings":{"completion_tok_s":99.29156703224272,"dflash_eval_s":9.578946752124466,"safe_mode_activations":0}}}
{"run":1976,"commit":"e299525","metric":9.405716381268576,"metrics":{},"status":"discard","description":"Loop sample: low-9 recovery (~101.02 tok/s, eval_s ~9.41), no collapse triggers.","timestamp":1776389982795,"segment":24,"confidence":0.07603039135333466,"iterationTokens":1397,"asi":{"hypothesis":"Regime is climbing toward high-soft after recent collapse cycle.","rollback_reason":"Primary metric above best floor.","next_action_hint":"Continue unchanged loop and monitor for near-best retest.","diagnostic_findings":{"completion_tok_s":101.01826335553234,"dflash_eval_s":9.405716381268576,"safe_mode_activations":0}}}
{"run":1977,"commit":"e299525","metric":0,"metrics":{},"status":"crash","description":"Previous run_experiment returned no output after compaction/interruption; marking as crash to close the run/log cycle.","timestamp":1776390141707,"segment":24,"confidence":0.07603039135333466,"iterationTokens":1402,"asi":{"hypothesis":"The active benchmark run was interrupted by context compaction/tool response loss.","rollback_reason":"No benchmark metrics were returned, so the run cannot be evaluated.","next_action_hint":"Resume normal mirror telemetry loop and continue transition-aware parity policy.","error_details":"run_experiment response: No result provided"}}
{"run":1978,"commit":"7f0ef90","metric":8.765500665293075,"metrics":{},"status":"keep","description":"Unchanged mirror telemetry loop hit a new eval-time best (~108.07 tok/s, eval_s ~8.766) with watchdog fully idle.","timestamp":1776390275249,"segment":24,"confidence":0.07664986250728253,"iterationTokens":1402,"asi":{"hypothesis":"Staying on unchanged keep-shape can still capture high-window local minima without intervention.","diagnostic_findings":{"completion_tok_s":108.07059658937278,"dflash_eval_s":8.765500665293075,"safe_mode_activations":0,"severe_spike_events":0}}}
{"run":1979,"commit":"7f0ef90","metric":8.778340875986032,"metrics":{},"status":"discard","description":"Immediate confirmation stayed high-window (~108.08 tok/s, eval_s ~8.778) but did not beat the new low.","timestamp":1776390304260,"segment":24,"confidence":0.07716334758801904,"iterationTokens":1617,"asi":{"hypothesis":"The latest keep is real but very small and near the noise floor.","rollback_reason":"Primary metric is above the newly kept best floor.","next_action_hint":"Continue unchanged loop and treat this region as high-window noise band.","diagnostic_findings":{"completion_tok_s":108.07898077738156,"dflash_eval_s":8.778340875986032,"safe_mode_activations":0}}}
{"run":1980,"commit":"7f0ef90","metric":8.77060463221278,"metrics":{},"status":"discard","description":"High-window retest remained near-best (~107.88 tok/s, eval_s ~8.771) with watchdog idle.","timestamp":1776390333059,"segment":24,"confidence":0.07755922213843074,"iterationTokens":1633,"asi":{"hypothesis":"Current lane is hovering in a tight near-floor band.","rollback_reason":"Primary metric still above the current best floor.","next_action_hint":"Continue unchanged loop and watch for either a cleaner low or fresh collapse transition.","diagnostic_findings":{"completion_tok_s":107.8836845307531,"dflash_eval_s":8.77060463221278,"safe_mode_activations":0}}}
{"run":1981,"commit":"7f0ef90","metric":8.921401757746935,"metrics":{},"status":"discard","description":"High-soft sample (~105.92 tok/s, eval_s ~8.92) with stable acceptance and no collapse activity.","timestamp":1776390358383,"segment":24,"confidence":0.07822077028302343,"iterationTokens":1453,"asi":{"hypothesis":"Window remains healthy but above local eval floor.","rollback_reason":"Primary metric above best floor.","next_action_hint":"Continue unchanged loop for additional floor retests.","diagnostic_findings":{"completion_tok_s":105.91962986001778,"dflash_eval_s":8.921401757746935,"safe_mode_activations":0}}}
{"run":1982,"commit":"7f0ef90","metric":16.994365622173063,"metrics":{},"status":"discard","description":"Fresh hard collapse on unchanged mirror lane (~47.73 tok/s, eval_s ~16.99) with safe mode firing at step 11.","timestamp":1776390397495,"segment":24,"confidence":0.07755922213843074,"iterationTokens":1405,"asi":{"hypothesis":"Shared collapse/rebound behavior re-triggered after high-window samples.","rollback_reason":"Primary metric far above best floor.","next_action_hint":"Run immediate control parity check for this new transition.","diagnostic_findings":{"completion_tok_s":47.726995246873535,"dflash_eval_s":16.994365622173063,"safe_mode_step":11,"severe_spike_events":7}}}
{"run":1983,"commit":"7f0ef90","metric":27.240312659647316,"metrics":{},"status":"discard","description":"Immediate control parity was even worse (~29.80 tok/s, eval_s ~27.24), confirming severe shared collapse state.","timestamp":1776390450907,"segment":24,"confidence":0.07698361026279746,"iterationTokens":1478,"asi":{"hypothesis":"Current transition is shared runtime degradation, not mirror-only behavior.","rollback_reason":"Parity run on non-authoritative lane; metric far above best floor.","next_action_hint":"Resume unchanged mirror loop to map rebound ladder after this severe parity collapse.","parity_check":{"lane":"control_DFLASH_MIRROR_SD_RUNTIME=0","completion_tok_s":29.797903178410536,"dflash_eval_s":27.240312659647316,"safe_mode_step":31,"severe_spike_events":75}}}
{"run":1984,"commit":"7f0ef90","metric":29.453950824332424,"metrics":{},"status":"discard","description":"Post-parity mirror trough deepened (~26.71 tok/s, eval_s ~29.45) with early safe-mode activation (step 10).","timestamp":1776390511668,"segment":24,"confidence":0.0764207613490059,"iterationTokens":1481,"asi":{"hypothesis":"Severe collapse wave is still unfolding immediately after parity confirmation.","rollback_reason":"Primary metric far above best floor.","next_action_hint":"Continue unchanged mirror loop to capture staged rebound.","diagnostic_findings":{"completion_tok_s":26.710872552078136,"dflash_eval_s":29.453950824332424,"safe_mode_step":10,"severe_spike_events":79}}}
{"run":1985,"commit":"7f0ef90","metric":20.384300365461968,"metrics":{},"status":"discard","description":"Recovery step after deep trough (~40.44 tok/s, eval_s ~20.38) with safe mode activating later (step 30).","timestamp":1776390556526,"segment":24,"confidence":0.07559191847548576,"iterationTokens":1428,"asi":{"hypothesis":"Collapse ladder is rebounding in staged steps while remaining far from floor.","rollback_reason":"Primary metric above best floor.","next_action_hint":"Continue unchanged loop to track rebound progression.","diagnostic_findings":{"completion_tok_s":40.43533561618561,"dflash_eval_s":20.384300365461968,"safe_mode_step":30,"severe_spike_events":69}}}
{"run":1986,"commit":"7f0ef90","metric":19.29517041821964,"metrics":{},"status":"discard","description":"Rebound continued (~42.91 tok/s, eval_s ~19.30) with safe mode shifting later to step 35.","timestamp":1776390598543,"segment":24,"confidence":0.07478496225516172,"iterationTokens":1435,"asi":{"hypothesis":"Recovery ladder is progressing with later watchdog activation points.","rollback_reason":"Primary metric above best floor.","next_action_hint":"Continue unchanged loop to monitor whether safe-mode activation eventually disappears in rebound.","diagnostic_findings":{"completion_tok_s":42.9053525700473,"dflash_eval_s":19.29517041821964,"safe_mode_step":35,"severe_spike_events":65}}}
{"run":1987,"commit":"7f0ef90","metric":14.653420454706065,"metrics":{},"status":"discard","description":"Recovery advanced (~58.40 tok/s, eval_s ~14.65); safe mode activation drifted later to step 55.","timestamp":1776390636586,"segment":24,"confidence":0.07369294583635427,"iterationTokens":1424,"asi":{"hypothesis":"Collapse wave is exiting deep-trough phase with progressively later interventions.","rollback_reason":"Primary metric above best floor.","next_action_hint":"Continue unchanged loop to observe transition from safe-mode-active to watchdog-idle samples.","diagnostic_findings":{"completion_tok_s":58.40436494468523,"dflash_eval_s":14.653420454706065,"safe_mode_step":55,"severe_spike_events":7}}}
{"run":1988,"commit":"7f0ef90","metric":13.615420704474673,"metrics":{},"status":"discard","description":"Rebound step improved to (~64.32 tok/s, eval_s ~13.62) with safe mode now very late (step 66).","timestamp":1776390669380,"segment":24,"confidence":0.07263236187254926,"iterationTokens":1437,"asi":{"hypothesis":"Recovery ladder continues with decreasing severity and delayed watchdog intervention.","rollback_reason":"Primary metric above best floor.","next_action_hint":"Continue unchanged loop; expect eventual watchdog-idle transition if rebound continues.","diagnostic_findings":{"completion_tok_s":64.32256964655319,"dflash_eval_s":13.615420704474673,"safe_mode_step":66,"severe_spike_events":2}}}
{"run":1989,"commit":"7f0ef90","metric":15.802351085701957,"metrics":{},"status":"discard","description":"Recovery wobble (~53.54 tok/s, eval_s ~15.80); safe mode still active at step 48.","timestamp":1776390705014,"segment":24,"confidence":0.07100386257240503,"iterationTokens":1437,"asi":{"hypothesis":"Rebound path remains noisy with temporary setbacks before full recovery.","rollback_reason":"Primary metric above best floor.","next_action_hint":"Continue unchanged loop and monitor for sustained downward eval trend.","diagnostic_findings":{"completion_tok_s":53.542944549404304,"dflash_eval_s":15.802351085701957,"safe_mode_step":48,"severe_spike_events":12}}}
{"run":1990,"commit":"7f0ef90","metric":15.27614504029043,"metrics":{},"status":"discard","description":"Recovery resumed (~56.32 tok/s, eval_s ~15.28); safe mode still present but pushed late (step 60).","timestamp":1776390740248,"segment":24,"confidence":0.06977416562282172,"iterationTokens":1439,"asi":{"hypothesis":"Collapse unwind remains active with late-stage watchdog interventions.","rollback_reason":"Primary metric above best floor.","next_action_hint":"Continue unchanged loop until safe-mode deactivates and low-soft band returns.","diagnostic_findings":{"completion_tok_s":56.316456227326164,"dflash_eval_s":15.27614504029043,"safe_mode_step":60,"severe_spike_events":23}}}
{"run":1991,"commit":"7f0ef90","metric":14.552065874449909,"metrics":{},"status":"discard","description":"Recovery held (~58.92 tok/s, eval_s ~14.55) with late safe-mode activation around step 56.","timestamp":1776390772907,"segment":24,"confidence":0.06849309067327197,"iterationTokens":1448,"asi":{"hypothesis":"System is still in mid-rebound with watchdog interventions tapering but not gone.","rollback_reason":"Primary metric above best floor.","next_action_hint":"Continue unchanged loop until watchdog-idle low-soft samples reappear.","diagnostic_findings":{"completion_tok_s":58.922762858633135,"dflash_eval_s":14.552065874449909,"safe_mode_step":56,"severe_spike_events":7}}}
{"run":1992,"commit":"7f0ef90","metric":13.480320036876947,"metrics":{},"status":"discard","description":"Rebound improved (~64.79 tok/s, eval_s ~13.48) with safe mode very late (step 64).","timestamp":1776390808006,"segment":24,"confidence":0.0672548926551713,"iterationTokens":1451,"asi":{"hypothesis":"Recovery is continuing toward non-collapse band as intervention moves later.","rollback_reason":"Primary metric above best floor.","next_action_hint":"Continue unchanged loop for transition to watchdog-idle state.","diagnostic_findings":{"completion_tok_s":64.78684107601143,"dflash_eval_s":13.480320036876947,"safe_mode_step":64,"severe_spike_events":2}}}
{"run":1993,"commit":"7f0ef90","metric":13.909734788932838,"metrics":{},"status":"discard","description":"Recovery oscillation (~62.31 tok/s, eval_s ~13.91) with late safe-mode step 58.","timestamp":1776390841080,"segment":24,"confidence":0.0669624060561434,"iterationTokens":1439,"asi":{"hypothesis":"Rebound remains noisy but still in late-activation collapse phase.","rollback_reason":"Primary metric above best floor.","next_action_hint":"Continue unchanged loop to seek watchdog-idle transition.","diagnostic_findings":{"completion_tok_s":62.30669468876272,"dflash_eval_s":13.909734788932838,"safe_mode_step":58,"severe_spike_events":2}}}
{"run":1994,"commit":"7f0ef90","metric":16.718587830197066,"metrics":{},"status":"discard","description":"Recovery path re-dipped (~49.80 tok/s, eval_s ~16.72) with safe mode reactivating earlier (step 37).","timestamp":1776390878590,"segment":24,"confidence":0.06667245244689408,"iterationTokens":1424,"asi":{"hypothesis":"Collapse rebound is still unstable and can retrace into heavier degradation before recovering.","rollback_reason":"Primary metric above best floor.","next_action_hint":"Continue unchanged loop to map full oscillation cycle.","diagnostic_findings":{"completion_tok_s":49.80346720164623,"dflash_eval_s":16.718587830197066,"safe_mode_step":37,"severe_spike_events":24}}}
{"run":1995,"commit":"7f0ef90","metric":13.134668203187175,"metrics":{},"status":"discard","description":"Oscillation recovered again (~66.98 tok/s, eval_s ~13.13) with very late safe-mode activation (step 67).","timestamp":1776390915555,"segment":24,"confidence":0.06644451755884158,"iterationTokens":1607,"asi":{"hypothesis":"This cycle alternates between re-dips and late-activation recovery phases.","rollback_reason":"Primary metric above best floor.","next_action_hint":"Continue unchanged loop until safe mode turns off and low-soft band is restored.","diagnostic_findings":{"completion_tok_s":66.98395609561706,"dflash_eval_s":13.134668203187175,"safe_mode_step":67,"severe_spike_events":2}}}
{"run":1996,"commit":"7f0ef90","metric":14.401152168633416,"metrics":{},"status":"discard","description":"Mid-recovery wobble (~59.73 tok/s, eval_s ~14.40) with safe mode still active at step 55.","timestamp":1776390948512,"segment":24,"confidence":0.06592320636545551,"iterationTokens":1453,"asi":{"hypothesis":"Cycle remains in noisy recovery band with intermittent re-worsening.","rollback_reason":"Primary metric above best floor.","next_action_hint":"Continue unchanged loop and wait for watchdog-idle breakout.","diagnostic_findings":{"completion_tok_s":59.73371523385197,"dflash_eval_s":14.401152168633416,"safe_mode_step":55,"severe_spike_events":2}}}
{"run":1997,"commit":"7f0ef90","metric":18.042941375053488,"metrics":{},"status":"discard","description":"Fresh re-collapse inside recovery wave (~44.72 tok/s, eval_s ~18.04) with very early safe-mode trigger at step 7.","timestamp":1776390996914,"segment":24,"confidence":0.06545570970467234,"iterationTokens":1427,"asi":{"hypothesis":"Recovery is unstable and can snap back into severe early-spike collapse mode.","rollback_reason":"Primary metric far above best floor.","next_action_hint":"Run immediate control parity check for this new early-trigger transition.","diagnostic_findings":{"completion_tok_s":44.72045235486612,"dflash_eval_s":18.042941375053488,"safe_mode_step":7,"severe_spike_events":11}}}
{"run":1998,"commit":"7f0ef90","metric":12.718982952646911,"metrics":{},"status":"discard","description":"Immediate control parity also degraded (~69.46 tok/s, eval_s ~12.72) with late safe-mode activation, confirming shared instability.","timestamp":1776391030832,"segment":24,"confidence":0.06471064063875212,"iterationTokens":1535,"asi":{"hypothesis":"Re-collapse remains shared across mirror/control even when severity differs run-to-run.","rollback_reason":"Parity diagnostic on non-authoritative lane; metric above best floor.","next_action_hint":"Resume unchanged mirror loop to continue rebound mapping.","parity_check":{"lane":"control_DFLASH_MIRROR_SD_RUNTIME=0","completion_tok_s":69.45718893085626,"dflash_eval_s":12.718982952646911,"safe_mode_step":69,"severe_spike_events":2}}}
{"run":1999,"commit":"7f0ef90","metric":10.914404160808772,"metrics":{},"status":"discard","description":"Post-parity mirror rebound accelerated (~84.91 tok/s, eval_s ~10.91) with very late safe mode at step 87.","timestamp":1776391059001,"segment":24,"confidence":0.06438193302880361,"iterationTokens":1478,"asi":{"hypothesis":"Cycle is moving back toward soft band with watchdog nearly inactive.","rollback_reason":"Primary metric above best floor.","next_action_hint":"Continue unchanged mirror loop to confirm transition into watchdog-idle low-soft/high-soft states.","diagnostic_findings":{"completion_tok_s":84.91013356448983,"dflash_eval_s":10.914404160808772,"safe_mode_step":87,"severe_spike_events":2}}}
{"run":2000,"commit":"7f0ef90","metric":14.012832952546887,"metrics":{},"status":"discard","description":"Mirror remained degraded (~57.78 tok/s, eval_s ~14.01) with early safe-mode reactivation (step 10).","timestamp":1776391124000,"segment":24,"confidence":0.06405654798267985,"iterationTokens":3451,"asi":{"hypothesis":"Current oscillation still includes abrupt early-trigger collapse pockets.","rollback_reason":"Primary metric above best floor.","next_action_hint":"Continue unchanged mirror loop; only trigger another parity check if a new deeper edge appears.","diagnostic_findings":{"completion_tok_s":57.78252139498407,"dflash_eval_s":14.012832952546887,"safe_mode_step":10,"severe_spike_events":2}}}
{"run":2001,"commit":"7f0ef90","metric":13.96133991656825,"metrics":{},"status":"discard","description":"Shifted into non-spike inflated mode (~69.48 tok/s, eval_s ~13.96): watchdog idle, acceptance back to baseline structure.","timestamp":1776391158756,"segment":24,"confidence":0.0635266334555945,"iterationTokens":1499,"asi":{"hypothesis":"Current degraded state can persist without triggering collapse spikes or safe mode.","rollback_reason":"Primary metric above best floor.","next_action_hint":"Continue unchanged loop to track return from broad inflation toward low-soft band.","diagnostic_findings":{"completion_tok_s":69.48292394995609,"dflash_eval_s":13.96133991656825,"safe_mode_activations":0,"dflash_draft_steps":96}}}
{"run":2002,"commit":"7f0ef90","metric":13.225091959233396,"metrics":{},"status":"discard","description":"Broad-inflation rebound improved (~72.95 tok/s, eval_s ~13.23) with watchdog still idle.","timestamp":1776391189638,"segment":24,"confidence":0.06300541454041,"iterationTokens":1476,"asi":{"hypothesis":"Non-spike inflation band is gradually recovering while speculative structure stays fixed.","rollback_reason":"Primary metric above best floor.","next_action_hint":"Continue unchanged loop toward sub-12/sub-11 re-entry.","diagnostic_findings":{"completion_tok_s":72.9526013179333,"dflash_eval_s":13.225091959233396,"safe_mode_activations":0,"dflash_draft_steps":96}}}
{"run":2003,"commit":"7f0ef90","metric":12.500187251134776,"metrics":{},"status":"discard","description":"Recovery advanced into upper-soft degraded band (~77.18 tok/s, eval_s ~12.50) with watchdog idle.","timestamp":1776391223652,"segment":24,"confidence":0.06237108364853259,"iterationTokens":1649,"asi":{"hypothesis":"System is steadily climbing out of broad inflation without spike events.","rollback_reason":"Primary metric above best floor.","next_action_hint":"Continue unchanged loop toward sub-11 and low-soft re-entry.","diagnostic_findings":{"completion_tok_s":77.1824668608695,"dflash_eval_s":12.500187251134776,"safe_mode_activations":0}}}
