{"run":1401,"commit":"b304c02","metric":108.57406415737265,"metrics":{},"status":"discard","description":"Mirror sample rebounded to ~108.57 with warmup variance.","timestamp":1776325505982,"segment":23,"confidence":3.572616056377745,"iterationTokens":641,"asi":{"hypothesis":"Lower-edge dwell may be temporary within an otherwise stable high-window.","rollback_reason":"Still below keep.","next_action_hint":"Continue immediate mirror scans while window remains open.","backend":"mirror_sd_mlx","context_only_draft_cache":1,"draft_sink":48,"async_draft_eval":1,"fused_draft_verify_eval":1,"warmup_s":2.166736708022654,"paired_prev_tok_s":108.48270672795874,"paired_delta_tok_s":0.0913574294139099,"delta_vs_keep":-0.2882723371022919}}
{"run":1402,"commit":"b304c02","metric":108.56419731659034,"metrics":{},"status":"discard","description":"Mirror follow-up remained around ~108.56 in persistent high-window.","timestamp":1776325537918,"segment":23,"confidence":3.573291033008699,"iterationTokens":667,"asi":{"hypothesis":"Current band remains stable but lacking fresh top-tail outlier.","rollback_reason":"Below keep.","next_action_hint":"Continue mirror-only loop; no structural changes.","backend":"mirror_sd_mlx","context_only_draft_cache":1,"draft_sink":48,"async_draft_eval":1,"fused_draft_verify_eval":1,"paired_prev_tok_s":108.57406415737265,"paired_delta_tok_s":-0.009866840782314113,"delta_vs_keep":-0.29813917788459615}}
{"run":1403,"commit":"b304c02","metric":108.66843450754092,"metrics":{},"status":"discard","description":"Mirror sample moved up to ~108.67, upper segment of current high-window.","timestamp":1776325585637,"segment":23,"confidence":3.573417680484953,"iterationTokens":639,"asi":{"hypothesis":"Upward swing from mid-108.5 may precede another top-tail attempt.","rollback_reason":"Still below keep 108.8623.","next_action_hint":"Continue immediate mirror reruns while upper segment is active.","backend":"mirror_sd_mlx","context_only_draft_cache":1,"draft_sink":48,"async_draft_eval":1,"fused_draft_verify_eval":1,"paired_prev_tok_s":108.56419731659034,"paired_delta_tok_s":0.10423719095058492,"delta_vs_keep":-0.19390198693401003,"near_best_band":true}}
{"run":1404,"commit":"b304c02","metric":108.55632844466095,"metrics":{},"status":"discard","description":"Immediate follow-up after upper-band sample returned to ~108.56.","timestamp":1776325623191,"segment":23,"confidence":3.573544336938996,"iterationTokens":694,"asi":{"hypothesis":"Upper-band bump did not convert to top-tail this cycle; window remains stable.","rollback_reason":"Below keep.","next_action_hint":"Continue mirror scans; no code or env changes in this stable window.","backend":"mirror_sd_mlx","context_only_draft_cache":1,"draft_sink":48,"async_draft_eval":1,"fused_draft_verify_eval":1,"paired_prev_tok_s":108.66843450754092,"paired_delta_tok_s":-0.11210606287997411,"delta_vs_keep":-0.305,"high_window_stable":true}}
{"run":1405,"commit":"b304c02","metric":108.62702136109681,"metrics":{},"status":"discard","description":"Mirror sample returned to ~108.63 from mid-band, high-window intact.","timestamp":1776325687452,"segment":23,"confidence":3.5589542162609513,"iterationTokens":1652,"asi":{"hypothesis":"Window remains stable with values cycling between ~108.5 and ~108.7.","rollback_reason":"Below keep 108.8623.","next_action_hint":"Continue mirror scans for sporadic top-tail exceedances.","backend":"mirror_sd_mlx","context_only_draft_cache":1,"draft_sink":48,"async_draft_eval":1,"fused_draft_verify_eval":1,"paired_prev_tok_s":108.55632844466095,"paired_delta_tok_s":0.07069291643586084,"delta_vs_keep":-0.23531113337815168,"high_window_stable":true}}
{"run":1406,"commit":"b304c02","metric":108.61569229862357,"metrics":{},"status":"discard","description":"Mirror sample held at ~108.62 with warmup outlier; steady-state unchanged.","timestamp":1776325724301,"segment":23,"confidence":3.5421834493373927,"iterationTokens":686,"asi":{"hypothesis":"Warmup outliers do not materially alter request-path throughput in this regime.","rollback_reason":"Below keep.","next_action_hint":"Continue mirror-only top-tail scan.","backend":"mirror_sd_mlx","context_only_draft_cache":1,"draft_sink":48,"async_draft_eval":1,"fused_draft_verify_eval":1,"warmup_s":2.1279318750603124,"paired_prev_tok_s":108.62702136109681,"paired_delta_tok_s":-0.011329062473248835,"delta_vs_keep":-0.24664019585138558}}
{"run":1407,"commit":"b304c02","metric":108.42454238818321,"metrics":{},"status":"discard","description":"Mirror sample dropped to ~108.42, low edge of reopened high-window.","timestamp":1776325757085,"segment":23,"confidence":3.5399869671489945,"iterationTokens":685,"asi":{"hypothesis":"This may be transient jitter; needs one follow-up before interpreting as downshift.","rollback_reason":"Below keep and lower than recent cluster.","next_action_hint":"Run immediate mirror follow-up; parity check if low side persists.","backend":"mirror_sd_mlx","context_only_draft_cache":1,"draft_sink":48,"async_draft_eval":1,"fused_draft_verify_eval":1,"paired_prev_tok_s":108.61569229862357,"paired_delta_tok_s":-0.19114991044036053,"delta_vs_keep":-0.43779010629173865,"plateau_lower_edge":true}}
{"run":1408,"commit":"b304c02","metric":108.51568444922573,"metrics":{},"status":"discard","description":"Mirror follow-up rebounded from 108.42 to ~108.52, indicating transient dip.","timestamp":1776325790852,"segment":23,"confidence":3.5386968004193795,"iterationTokens":703,"asi":{"hypothesis":"Prior low sample was likely jitter, not sustained regime shift.","rollback_reason":"Still below keep.","next_action_hint":"Continue mirror scans; no immediate parity check needed after rebound.","backend":"mirror_sd_mlx","context_only_draft_cache":1,"draft_sink":48,"async_draft_eval":1,"fused_draft_verify_eval":1,"paired_prev_tok_s":108.42454238818321,"paired_delta_tok_s":0.09114206104251535,"delta_vs_keep":-0.34664804524922266,"high_window_stable":true}}
{"run":1409,"commit":"b304c02","metric":108.50985873456717,"metrics":{},"status":"discard","description":"Mirror sample stayed around ~108.51 with warmup variance; elevated regime persists.","timestamp":1776325839880,"segment":23,"confidence":3.53448201824923,"iterationTokens":1128,"asi":{"hypothesis":"Lower-half high-window values are still part of stable reopened regime.","rollback_reason":"Below keep 108.8623.","next_action_hint":"Continue mirror scans for return to upper-half/top-tail.","backend":"mirror_sd_mlx","context_only_draft_cache":1,"draft_sink":48,"async_draft_eval":1,"fused_draft_verify_eval":1,"warmup_s":2.019922334002331,"delta_vs_keep":-0.3524737599077812,"high_window_stable":true}}
{"run":1410,"commit":"b304c02","metric":107.97851518295496,"metrics":{},"status":"discard","description":"Mirror sample downshifted to ~107.98 with large warmup spike; possible regime dip.","timestamp":1776352299558,"segment":23,"confidence":3.541695019348753,"iterationTokens":641,"asi":{"hypothesis":"A temporary regime softening can drag mirror into high-107s without structural change.","rollback_reason":"Below keep and below recent high-window center.","next_action_hint":"Run immediate mirror follow-up; trigger control parity if low-107/107.9 persists.","backend":"mirror_sd_mlx","context_only_draft_cache":1,"draft_sink":48,"async_draft_eval":1,"fused_draft_verify_eval":1,"warmup_s":3.159607082954608,"delta_vs_keep":-0.8838173115198856,"possible_downshift":true}}
{"run":1411,"commit":"b304c02","metric":108.3749727941791,"metrics":{},"status":"discard","description":"Immediate mirror follow-up rebounded to ~108.37, ruling out sustained 107.9 collapse.","timestamp":1776352323834,"segment":23,"confidence":3.5416323324866035,"iterationTokens":748,"asi":{"hypothesis":"The 107.98 reading was partly transient, but local band may have softened to low-108s.","rollback_reason":"Below keep.","next_action_hint":"Run another mirror sample; parity-check control if low-108 band persists.","backend":"mirror_sd_mlx","context_only_draft_cache":1,"draft_sink":48,"async_draft_eval":1,"fused_draft_verify_eval":1,"paired_prev_tok_s":107.97851518295496,"paired_delta_tok_s":0.39645761122414636,"delta_vs_keep":-0.4873597002957469,"possible_band_softening":true}}
{"run":1412,"commit":"b304c02","metric":108.34735851036788,"metrics":{},"status":"discard","description":"Mirror sample held at ~108.35, confirming low-108 local band.","timestamp":1776352347474,"segment":23,"confidence":3.541569647843489,"iterationTokens":754,"asi":{"hypothesis":"High-window may have temporarily downshifted from mid/high-108.5 to ~108.3–108.4.","rollback_reason":"Below keep.","next_action_hint":"Run control parity spot-check now to verify shared downshift.","backend":"mirror_sd_mlx","context_only_draft_cache":1,"draft_sink":48,"async_draft_eval":1,"fused_draft_verify_eval":1,"paired_prev_tok_s":108.3749727941791,"paired_delta_tok_s":-0.02761428381121347,"delta_vs_keep":-0.5149739841069518,"shared_downshift_check_due":true}}
{"run":1413,"commit":"b304c02","metric":108.26984943320073,"metrics":{},"status":"discard","description":"Control parity spot-check (`DFLASH_MIRROR_SD_RUNTIME=0`) also landed low at ~108.27, confirming shared downshift.","timestamp":1776352376554,"segment":23,"confidence":3.5362426282553954,"iterationTokens":867,"asi":{"hypothesis":"If mirror low-band is environmental/regime-driven, control should co-move downward.","rollback_reason":"Control confirms shared low-108 regime; parity backend remains non-authoritative.","next_action_hint":"Restore mirror lane and continue scans for rebound into upper-108 band.","backend":"bstnxbt_mlx","mirror_runtime_enabled":0,"context_only_draft_cache":1,"draft_sink":48,"async_draft_eval":1,"fused_draft_verify_eval":1,"paired_mirror_tok_s":108.34735851036788,"paired_delta_tok_s":0.0775090771671496,"authoritative_lane":"mirror_sd_mlx","shared_downshift_confirmed":true}}
{"run":1414,"commit":"b304c02","metric":108.11532379042973,"metrics":{},"status":"discard","description":"Mirror anchor after parity check fell further to ~108.12, extending shared downshift.","timestamp":1776352403198,"segment":23,"confidence":3.5419994939174817,"iterationTokens":1153,"asi":{"hypothesis":"The regime has shifted downward across both backends, not a mirror-specific issue.","rollback_reason":"Below keep and below recent low-108 cluster.","next_action_hint":"Continue mirror tracking for rebound; parity-check only if divergence appears.","backend":"mirror_sd_mlx","context_only_draft_cache":1,"draft_sink":48,"async_draft_eval":1,"fused_draft_verify_eval":1,"paired_control_tok_s":108.26984943320073,"paired_delta_tok_s":-0.1545256427709917,"delta_vs_keep":-0.7470087040452085,"shared_downshift_confirmed":true}}
{"run":1415,"commit":"b304c02","metric":108.01383120262611,"metrics":{},"status":"discard","description":"Mirror sample continued down to ~108.01, indicating broad regime cooling.","timestamp":1776352430125,"segment":23,"confidence":3.5461524537324545,"iterationTokens":742,"asi":{"hypothesis":"Current environment has cooled from upper-108.5 band toward ~108.0 without code changes.","rollback_reason":"Below keep.","next_action_hint":"Continue measurement-only tracking; hold off structural bets during unstable cooling.","backend":"mirror_sd_mlx","context_only_draft_cache":1,"draft_sink":48,"async_draft_eval":1,"fused_draft_verify_eval":1,"paired_prev_tok_s":108.11532379042973,"paired_delta_tok_s":-0.10149258780361314,"delta_vs_keep":-0.8485012918488257,"regime_cooling":true}}
{"run":1416,"commit":"b304c02","metric":107.69375707072139,"metrics":{},"status":"discard","description":"Mirror sample dropped further to ~107.69, suggesting active cooling phase.","timestamp":1776352457095,"segment":23,"confidence":3.550315163588905,"iterationTokens":709,"asi":{"hypothesis":"Cooling phase may be entering high-107 band similar to prior shared downshifts.","rollback_reason":"Below keep and below 108.0 threshold.","next_action_hint":"Run immediate mirror follow-up; if still <108, do control parity confirmation.","backend":"mirror_sd_mlx","context_only_draft_cache":1,"draft_sink":48,"async_draft_eval":1,"fused_draft_verify_eval":1,"warmup_s":2.0980254999594763,"paired_prev_tok_s":108.01383120262611,"paired_delta_tok_s":-0.3200741319047213,"delta_vs_keep":-1.1685754237549335,"possible_collapse_onset":true}}
{"run":1417,"commit":"b304c02","metric":107.82572630528479,"metrics":{},"status":"discard","description":"Mirror follow-up stayed sub-108 at ~107.83, confirming cooled band.","timestamp":1776352480775,"segment":23,"confidence":3.553770389410172,"iterationTokens":772,"asi":{"hypothesis":"Sub-108 readings are now persistent enough to require parity attribution.","rollback_reason":"Below keep and confirms local downshift.","next_action_hint":"Run control parity spot-check immediately.","backend":"mirror_sd_mlx","context_only_draft_cache":1,"draft_sink":48,"async_draft_eval":1,"fused_draft_verify_eval":1,"paired_prev_tok_s":107.69375707072139,"paired_delta_tok_s":0.1319692345633996,"delta_vs_keep":-1.0366061891901535,"shared_downshift_check_due":true}}
{"run":1418,"commit":"b304c02","metric":59.5860780907288,"metrics":{},"status":"discard","description":"Control parity check (`DFLASH_MIRROR_SD_RUNTIME=0`) collapsed sharply to ~59.59 tok/s, matching prior shared-collapse signature.","timestamp":1776352517650,"segment":23,"confidence":3.550315163588905,"iterationTokens":793,"asi":{"hypothesis":"A shared server/runtime regime collapse has reappeared; control lane hits ~59 tok/s in collapse mode.","rollback_reason":"Catastrophically below keep; control remains non-authoritative parity lane.","next_action_hint":"Restore mirror lane and sample immediately to characterize paired collapse depth/recovery.","backend":"bstnxbt_mlx","mirror_runtime_enabled":0,"context_only_draft_cache":1,"draft_sink":48,"async_draft_eval":1,"fused_draft_verify_eval":1,"paired_mirror_tok_s":107.82572630528479,"paired_delta_tok_s":48.23964821455599,"authoritative_lane":"mirror_sd_mlx","shared_collapse_signature":true,"request_s":17.185222333995625}}
{"run":1419,"commit":"b304c02","metric":76.05992175129765,"metrics":{},"status":"discard","description":"Mirror anchor after control collapse also dropped hard to ~76.06, confirming active shared collapse regime.","timestamp":1776352548226,"segment":23,"confidence":3.5461524537324545,"iterationTokens":1205,"asi":{"hypothesis":"Control collapse to ~59 was a true shared regime event; mirror now in degraded recovery band.","rollback_reason":"Far below keep and below normal high-window.","next_action_hint":"Run consecutive mirror samples to track staged recovery before any structural conclusions.","backend":"mirror_sd_mlx","context_only_draft_cache":1,"draft_sink":48,"async_draft_eval":1,"fused_draft_verify_eval":1,"paired_control_tok_s":59.5860780907288,"paired_delta_tok_s":16.473843660568857,"delta_vs_keep":-32.80241074317729,"shared_collapse_confirmed":true,"request_s":13.463069332996383}}
{"run":1420,"commit":"b304c02","metric":82.25194417115921,"metrics":{},"status":"discard","description":"Mirror recovery step improved from ~76.06 to ~82.25 tok/s after collapse.","timestamp":1776352576424,"segment":23,"confidence":3.5419994939174817,"iterationTokens":761,"asi":{"hypothesis":"Collapse is transient and tends to recover in staged increments.","rollback_reason":"Still far below keep/high-window.","next_action_hint":"Continue consecutive mirror samples to map full recovery trajectory.","backend":"mirror_sd_mlx","context_only_draft_cache":1,"draft_sink":48,"async_draft_eval":1,"fused_draft_verify_eval":1,"paired_prev_tok_s":76.05992175129765,"paired_delta_tok_s":6.192022419861557,"delta_vs_keep":-26.61038832331573,"recovery_stage":"76->82"}}
{"run":1421,"commit":"b304c02","metric":96.0045958512766,"metrics":{},"status":"discard","description":"Mirror recovery jumped to ~96.00 tok/s, clearing deep-collapse band.","timestamp":1776352602616,"segment":23,"confidence":3.5362426282553954,"iterationTokens":682,"asi":{"hypothesis":"Recovery passes through a ~96 tok/s intermediate plateau before returning to 100+ and 108+.","rollback_reason":"Still below keep.","next_action_hint":"Continue mirror samples to confirm climb through 100+ toward 108 window.","backend":"mirror_sd_mlx","context_only_draft_cache":1,"draft_sink":48,"async_draft_eval":1,"fused_draft_verify_eval":1,"paired_prev_tok_s":82.25194417115921,"paired_delta_tok_s":13.752651680117387,"delta_vs_keep":-12.857736643198336,"recovery_stage":"82->96"}}
{"run":1422,"commit":"b304c02","metric":69.66668468356704,"metrics":{},"status":"discard","description":"Mirror re-collapsed to ~69.67 after touching 96, showing non-monotonic unstable regime.","timestamp":1776352632271,"segment":23,"confidence":3.5305044456701142,"iterationTokens":705,"asi":{"hypothesis":"Collapse/recovery is oscillatory; short rebounds do not guarantee sustained recovery.","rollback_reason":"Far below keep/high-window.","next_action_hint":"Keep measurement-only tracking; defer structural bets until regime re-stabilizes.","backend":"mirror_sd_mlx","context_only_draft_cache":1,"draft_sink":48,"async_draft_eval":1,"fused_draft_verify_eval":1,"paired_prev_tok_s":96.0045958512766,"paired_delta_tok_s":-26.33791116770956,"delta_vs_keep":-39.1956478109079,"oscillatory_collapse":true}}
{"run":1423,"commit":"b304c02","metric":77.49614178477388,"metrics":{},"status":"discard","description":"Mirror sample lifted to ~77.50 from 69.67, continuing oscillatory recovery pattern.","timestamp":1776352660245,"segment":23,"confidence":3.5263292173131573,"iterationTokens":734,"asi":{"hypothesis":"Regime is in churn zone with wide swings (roughly 60–96+) before full recovery.","rollback_reason":"Still far below keep.","next_action_hint":"Take one control parity sample to ensure oscillation remains shared, then return to mirror tracking.","backend":"mirror_sd_mlx","context_only_draft_cache":1,"draft_sink":48,"async_draft_eval":1,"fused_draft_verify_eval":1,"paired_prev_tok_s":69.66668468356704,"paired_delta_tok_s":7.8294571012068435,"delta_vs_keep":-31.36619070970106,"oscillatory_collapse":true,"shared_oscillation_check_due":true}}
{"run":1424,"commit":"b304c02","metric":83.86924882413958,"metrics":{},"status":"discard","description":"Control parity sample (`DFLASH_MIRROR_SD_RUNTIME=0`) also in degraded-recovery band at ~83.87, confirming shared oscillation.","timestamp":1776352692638,"segment":23,"confidence":3.5253606296373374,"iterationTokens":862,"asi":{"hypothesis":"Collapse/recovery oscillation is shared across mirror and control backends.","rollback_reason":"Below keep and control remains non-authoritative.","next_action_hint":"Restore mirror lane and keep recovery tracking until 100+/108+ re-entry.","backend":"bstnxbt_mlx","mirror_runtime_enabled":0,"context_only_draft_cache":1,"draft_sink":48,"async_draft_eval":1,"fused_draft_verify_eval":1,"paired_mirror_tok_s":77.49614178477388,"paired_delta_tok_s":-6.373107039365704,"authoritative_lane":"mirror_sd_mlx","shared_oscillation_confirmed":true}}
{"run":1425,"commit":"b304c02","metric":101.03480092793907,"metrics":{},"status":"discard","description":"Mirror recovery climbed back to ~101.03, exiting severe-collapse band.","timestamp":1776352736054,"segment":23,"confidence":3.5239058579117635,"iterationTokens":7810,"asi":{"hypothesis":"Oscillatory phase is lifting toward prior 100+ intermediate plateau.","rollback_reason":"Still below keep/high-window.","next_action_hint":"Continue mirror recovery tracking for re-entry into 106+/108+ window.","backend":"mirror_sd_mlx","context_only_draft_cache":1,"draft_sink":48,"async_draft_eval":1,"fused_draft_verify_eval":1,"paired_prev_tok_s":77.49614178477388,"paired_delta_tok_s":23.53865914316519,"delta_vs_keep":-7.827531566535875,"recovery_stage":"77->101"}}
{"run":1426,"commit":"b304c02","metric":108.22357124530356,"metrics":{},"status":"discard","description":"Mirror sample snapped back to ~108.22, confirming rapid re-entry into high-performance band post-collapse.","timestamp":1776352760160,"segment":23,"confidence":3.527298337371342,"iterationTokens":690,"asi":{"hypothesis":"Latest collapse wave is transient; regime can rebound quickly back to 108+ without code changes.","rollback_reason":"Below keep 108.8623.","next_action_hint":"Continue mirror-only scans immediately to test whether upper-108.5 window reopens.","backend":"mirror_sd_mlx","context_only_draft_cache":1,"draft_sink":48,"async_draft_eval":1,"fused_draft_verify_eval":1,"paired_prev_tok_s":101.03480092793907,"paired_delta_tok_s":7.188770317364489,"delta_vs_keep":-0.638761249171383,"high_band_reentry":true}}
{"run":1427,"commit":"b304c02","metric":108.26163354065346,"metrics":{},"status":"discard","description":"Mirror follow-up held at ~108.26, sustaining high-band re-entry after collapse.","timestamp":1776352784277,"segment":23,"confidence":3.5263292173131573,"iterationTokens":747,"asi":{"hypothesis":"Recovery has stabilized into low-108 band; upper-108.5 tail may reopen with continued scans.","rollback_reason":"Below keep.","next_action_hint":"Continue mirror scans; parity check only if mirror/control divergence reappears.","backend":"mirror_sd_mlx","context_only_draft_cache":1,"draft_sink":48,"async_draft_eval":1,"fused_draft_verify_eval":1,"paired_prev_tok_s":108.22357124530356,"paired_delta_tok_s":0.03806229534990319,"delta_vs_keep":-0.6006989538214812,"high_band_reentry":true}}
