{"run":496,"commit":"2486190","metric":105.5985819224298,"metrics":{},"status":"discard","description":"Contemporaneous control pair run: disable mirror runtime (DFLASH_MIRROR_SD_RUNTIME=0) to measure bstnxbt lane against latest mirror rerun.","timestamp":1776274990658,"segment":23,"confidence":13.188572068131036,"iterationTokens":717,"asi":{"hypothesis":"Mirror should retain at least slight edge over control in immediate paired reruns.","rollback_reason":"Control run measured higher than immediate mirror rerun (105.60 vs 105.11).","next_action_hint":"Treat mirror/control as near-tied with local control advantage in this pair; prioritize structural mirror changes over env retunes.","backend":"bstnxbt_mlx","mirror_runtime_enabled":0,"paired_delta_tok_s":-0.4857871131988818}}
{"run":497,"commit":"2486190","metric":40.78511438061261,"metrics":{},"status":"discard","description":"Mirror paired rerun after control sample (unchanged config) to complete immediate A/B cycle.","timestamp":1776275032890,"segment":23,"confidence":13.012323189831042,"iterationTokens":690,"asi":{"hypothesis":"Immediate mirror rerun should stay near prior ~105 tok/s band after control pairing.","rollback_reason":"Severe transient collapse to 40.79 tok/s on unchanged mirror config.","next_action_hint":"Run immediate unchanged rerun and inspect server logs/fallback markers to determine whether this was scheduler noise or runtime-path degradation.","backend":"mirror_sd_mlx","stability_probe":true}}
{"run":498,"commit":"2486190","metric":25.11183305386012,"metrics":{},"status":"discard","description":"Immediate mirror rerun (unchanged) after anomalous 40.79 sample to verify whether collapse was transient.","timestamp":1776275109866,"segment":23,"confidence":12.58720245542503,"iterationTokens":719,"asi":{"hypothesis":"If 40.79 was transient noise, an immediate unchanged rerun should rebound to the normal ~105 band.","rollback_reason":"Second unchanged rerun collapsed further to 25.11 tok/s, confirming severe instability episode.","next_action_hint":"Run immediate control comparison in same regime (mirror off) to determine whether slowdown is mirror-specific or system-wide drift.","backend":"mirror_sd_mlx","anomaly_confirmed":true}}
{"run":499,"commit":"2486190","metric":39.56558348160351,"metrics":{},"status":"discard","description":"Anomaly isolation run: disable mirror runtime (control bstnxbt) after consecutive mirror collapses.","timestamp":1776275153010,"segment":23,"confidence":12.56192218431992,"iterationTokens":4620,"asi":{"hypothesis":"If collapse is mirror-specific, control should remain near the historical ~105 band.","rollback_reason":"Control also collapsed to 39.57 tok/s, indicating system-wide/regime degradation rather than mirror-only issue.","next_action_hint":"Pause micro-optimization conclusions until throughput band recovers; run baseline rerun(s) to confirm recovery before testing new code.","backend":"bstnxbt_mlx","mirror_runtime_enabled":0,"collapse_regime":true}}
{"run":500,"commit":"2486190","metric":76.97210071540508,"metrics":{},"status":"discard","description":"Recovery probe: rerun baseline mirror config after mirror/control collapse episode.","timestamp":1776275184406,"segment":23,"confidence":12.536743256006869,"iterationTokens":655,"asi":{"hypothesis":"If collapse was transient system pressure, baseline mirror rerun should recover toward prior 105+ band.","rollback_reason":"Only partial recovery to 76.97 tok/s; lane remains unstable and far below historical mirror band.","next_action_hint":"Record instability episode in ideas and deprioritize fine-grained tuning until stable measurement conditions return.","backend":"mirror_sd_mlx","stability_probe":true}}
{"run":501,"commit":"2486190","metric":77.43407960785112,"metrics":{},"status":"discard","description":"Second recovery probe: unchanged mirror baseline rerun after partial rebound.","timestamp":1776275211549,"segment":23,"confidence":12.185800900592632,"iterationTokens":618,"asi":{"hypothesis":"Another immediate rerun may complete recovery toward the prior 105+ operating band.","rollback_reason":"Still stuck in degraded ~77 tok/s band.","next_action_hint":"Mark current session as measurement-regime degraded; avoid declaring code-level regressions from this band without independent recovery.","backend":"mirror_sd_mlx","stability_probe":true}}
{"run":502,"commit":"2486190","metric":57.296059756534426,"metrics":{},"status":"discard","description":"Third recovery probe: unchanged mirror baseline rerun to characterize current instability band.","timestamp":1776275260435,"segment":23,"confidence":11.853971447298818,"iterationTokens":1525,"asi":{"hypothesis":"If environment is stabilizing, repeated unchanged runs should converge back upward.","rollback_reason":"Run dropped to 57.30 tok/s, confirming high variance and degraded regime persists.","next_action_hint":"Treat this session as instability characterization; postpone fine mirror micro-optimization until stable measurement window returns.","backend":"mirror_sd_mlx","stability_probe":true}}
{"run":503,"commit":"2486190","metric":88.60577344466681,"metrics":{},"status":"discard","description":"Control probe in degraded window: disable mirror runtime to compare against unstable mirror samples.","timestamp":1776275289490,"segment":23,"confidence":11.365673225023556,"iterationTokens":684,"asi":{"hypothesis":"If degradation is purely global, control should show similar depressed range as mirror samples.","rollback_reason":"Control recovered higher (88.61 tok/s) than immediate mirror probes, so mirror-specific instability may be contributing.","next_action_hint":"Run immediate mirror rerun for paired comparison; avoid code changes until pair confirms direction.","backend":"bstnxbt_mlx","mirror_runtime_enabled":0,"collapse_regime":true}}
{"run":504,"commit":"2486190","metric":78.59669565970164,"metrics":{},"status":"discard","description":"Paired mirror rerun after control recovery sample to compare live backend deltas under current instability.","timestamp":1776275319644,"segment":23,"confidence":10.62264288943635,"iterationTokens":623,"asi":{"hypothesis":"Mirror should rebound to at least control-adjacent performance on immediate paired rerun.","rollback_reason":"Mirror remained much lower than paired control (78.60 vs 88.61).","next_action_hint":"Document instability episode and avoid further mirror micro-tuning in this unstable window; revisit when baseline recovers.","backend":"mirror_sd_mlx","paired_control_tok_s":88.60577344466681,"paired_delta_tok_s":-10.009077784965175}}
{"run":505,"commit":"2486190","metric":63.7226370979122,"metrics":{},"status":"discard","description":"Additional unchanged mirror baseline probe during instability window.","timestamp":1776275392544,"segment":23,"confidence":10.19563755070732,"iterationTokens":3081,"asi":{"hypothesis":"Baseline may continue recovering with additional reruns after severe collapse.","rollback_reason":"Still heavily degraded at 63.72 tok/s.","next_action_hint":"Stop interpreting small tuning deltas while instability persists; treat current session as diagnostics-only until normal band returns.","backend":"mirror_sd_mlx","stability_probe":true}}
{"run":506,"commit":"2486190","metric":73.87052179414762,"metrics":{},"status":"discard","description":"Control check during continued low-throughput window (mirror disabled).","timestamp":1776275425887,"segment":23,"confidence":9.85491956967066,"iterationTokens":711,"asi":{"hypothesis":"If instability is still backend-specific, control should remain notably above mirror.","rollback_reason":"Control is also degraded (73.87), supporting broader system/regime instability.","next_action_hint":"Capture instability notes and avoid making backend keep/discard decisions from this window.","backend":"bstnxbt_mlx","mirror_runtime_enabled":0,"collapse_regime":true}}
{"run":507,"commit":"2486190","metric":71.12929765743192,"metrics":{},"status":"discard","description":"Mirror follow-up after degraded control sample to maintain paired tracking.","timestamp":1776275455537,"segment":23,"confidence":9.699545991494995,"iterationTokens":598,"asi":{"hypothesis":"Mirror and control should now be similarly degraded if instability is global.","rollback_reason":"Mirror remained degraded at 71.13 tok/s; paired with low control confirms unstable measurement regime.","next_action_hint":"Suspend performance-claiming optimization changes and keep session notes focused on instability diagnostics/pruning.","backend":"mirror_sd_mlx","collapse_regime":true}}
{"run":508,"commit":"2486190","metric":80.47795654057663,"metrics":{},"status":"discard","description":"Ongoing regime check: unchanged mirror baseline rerun after instability logging updates.","timestamp":1776275494329,"segment":23,"confidence":9.548995638461529,"iterationTokens":1947,"asi":{"hypothesis":"Throughput may continue recovering toward historical band with additional cooldown/reruns.","rollback_reason":"Still in degraded range at 80.48 tok/s.","next_action_hint":"Continue occasional paired mirror/control checks; defer optimization claims until band normalizes.","backend":"mirror_sd_mlx","stability_probe":true}}
{"run":509,"commit":"2486190","metric":77.42739783040408,"metrics":{},"status":"discard","description":"Paired control rerun after 80.48 mirror sample (mirror disabled).","timestamp":1776275527264,"segment":23,"confidence":9.427292748113022,"iterationTokens":647,"asi":{"hypothesis":"Control comparison will indicate whether 80.48 reflects global recovery or mirror-specific movement.","rollback_reason":"Control remained similarly degraded (77.43), indicating both backends still in low-throughput regime.","next_action_hint":"Continue monitoring for full regime recovery before evaluating new optimization attempts.","backend":"bstnxbt_mlx","mirror_runtime_enabled":0,"paired_delta_tok_s":3.050558710172549}}
{"run":510,"commit":"2486190","metric":77.16991786155319,"metrics":{},"status":"discard","description":"Mirror follow-up after paired degraded control run.","timestamp":1776275562330,"segment":23,"confidence":9.308653047765747,"iterationTokens":613,"asi":{"hypothesis":"Immediate mirror rerun should stay near control if both are currently dominated by global instability.","rollback_reason":"Mirror remained degraded at 77.17 tok/s, consistent with unstable low-throughput regime.","next_action_hint":"Hold off on new code-tuning attempts until benchmark band returns near historical values.","backend":"mirror_sd_mlx","collapse_regime":true}}
{"run":511,"commit":"2486190","metric":99.24834041646784,"metrics":{},"status":"discard","description":"Mirror helper id-cache experiment: add per-request-object ID fast caches for exit-layer and capture-flag resolution to avoid repeated set sorting/frozenset construction.","timestamp":1776275665222,"segment":23,"confidence":9.202791854797354,"iterationTokens":5180,"asi":{"hypothesis":"ID-keyed fast caches should reduce repeated capture-layer key construction overhead in mirror split helper and improve throughput.","rollback_reason":"Improved versus degraded window but still below established mirror keep (99.25 vs 106.47).","next_action_hint":"Do not promote in unstable regime; if benchmark conditions recover, re-test this optimization with paired baseline/control before reconsidering.","backend":"mirror_sd_mlx","optimization":"mirror_id_key_fast_caches"}}
{"run":512,"commit":"2486190","metric":106.20594261042652,"metrics":{},"status":"discard","description":"Post-instability baseline rerun (unchanged mirror config) after discard reversion.","timestamp":1776275690700,"segment":23,"confidence":9.308653047765747,"iterationTokens":1026,"asi":{"hypothesis":"If instability episode ends, unchanged mirror baseline should return to historical ~105-106 band.","rollback_reason":"Recovered strongly to 106.21 tok/s but still below best keep 106.47.","next_action_hint":"Resume normal optimization experiments now that measurement band has recovered; require >106.47 for keep.","backend":"mirror_sd_mlx","stability_recovered":true}}
{"run":513,"commit":"2486190","metric":102.53686877596216,"metrics":{},"status":"discard","description":"Mirror split sweep (new shallow region): DFLASH_MIRROR_SD_EXIT_LAYER=8.","timestamp":1776275731936,"segment":23,"confidence":9.202791854797354,"iterationTokens":1251,"asi":{"hypothesis":"A shallower mirror split (8) might reduce early-stage overhead and outperform the current mid-stack split.","rollback_reason":"Regressed materially to 102.54 tok/s versus 106.47 keep.","next_action_hint":"Add exit layer 8 to mirror do-not-retry set; keep split anchored at 14.","backend":"mirror_sd_mlx","mirror_exit_layer":8}}
{"run":514,"commit":"2486190","metric":102.8803957173655,"metrics":{},"status":"discard","description":"Mirror split sweep (shallow region): DFLASH_MIRROR_SD_EXIT_LAYER=7.","timestamp":1776275761115,"segment":23,"confidence":9.099311367171937,"iterationTokens":746,"asi":{"hypothesis":"Exit layer 7 may be a better shallow split than layer 8 and potentially recover throughput.","rollback_reason":"Still far below keep at 102.88 tok/s.","next_action_hint":"Add exit layer 7 to mirror do-not-retry set; shallow split region appears non-competitive.","backend":"mirror_sd_mlx","mirror_exit_layer":7}}
{"run":515,"commit":"2486190","metric":102.94254539554575,"metrics":{},"status":"discard","description":"Mirror split sweep (shallow region): DFLASH_MIRROR_SD_EXIT_LAYER=6.","timestamp":1776275789131,"segment":23,"confidence":8.978806319912836,"iterationTokens":713,"asi":{"hypothesis":"Exit layer 6 may expose a shallower split sweet spot not covered by previous sweeps.","rollback_reason":"Throughput remains non-competitive at 102.94 tok/s.","next_action_hint":"Add exit layer 6 to mirror do-not-retry set; continue anchoring near 14.","backend":"mirror_sd_mlx","mirror_exit_layer":6}}
{"run":516,"commit":"2486190","metric":96.54777549241201,"metrics":{},"status":"discard","description":"Mirror SDPA chunk sweep: DFLASH_BSTNXBT_SPLIT_CHUNK_SIZE=13.","timestamp":1776275821454,"segment":23,"confidence":8.906559311140482,"iterationTokens":811,"asi":{"hypothesis":"Chunk size 13 could be an untested non-monotonic sweet spot for mirror split path.","rollback_reason":"Major regression to 96.55 tok/s.","next_action_hint":"Add chunk size 13 to mirror do-not-retry set; default 8 remains safest.","backend":"mirror_sd_mlx","split_chunk_size":13}}
{"run":517,"commit":"2486190","metric":99.3649449546367,"metrics":{},"status":"discard","description":"Mirror SDPA chunk sweep: DFLASH_BSTNXBT_SPLIT_CHUNK_SIZE=14.","timestamp":1776275853420,"segment":23,"confidence":8.786559837477759,"iterationTokens":723,"asi":{"hypothesis":"Chunk size 14 may recover throughput if 13 was an outlier.","rollback_reason":"Still significantly below keep at 99.36 tok/s.","next_action_hint":"Add chunk size 14 to mirror do-not-retry set; avoid large split chunks on 1024 mirror lane.","backend":"mirror_sd_mlx","split_chunk_size":14}}
{"run":518,"commit":"2486190","metric":101.25635628647768,"metrics":{},"status":"discard","description":"Baseline re-anchor rerun after shallow-exit and large-chunk sweeps (unchanged mirror config).","timestamp":1776275888654,"segment":23,"confidence":8.669750920487324,"iterationTokens":919,"asi":{"hypothesis":"After reverting failed sweeps, baseline should return close to historical ~106 mirror band.","rollback_reason":"Baseline landed at 101.26 tok/s, indicating ongoing volatility despite reversion.","next_action_hint":"Continue tracking instability and avoid interpreting sub-1 tok/s deltas as meaningful in this regime.","backend":"mirror_sd_mlx","stability_probe":true}}
{"run":519,"commit":"2486190","metric":101.36327208322031,"metrics":{},"status":"discard","description":"Control pair run after 101.26 mirror baseline (mirror runtime disabled).","timestamp":1776275917419,"segment":23,"confidence":8.528731834841059,"iterationTokens":696,"asi":{"hypothesis":"Control comparison will show whether recent 101 band is mirror-specific or regime-wide.","rollback_reason":"Control matched mirror (~101.36 vs 101.26), confirming shared regime drift.","next_action_hint":"Treat mirror/control delta as neutral in current window; prioritize only large structural changes.","backend":"bstnxbt_mlx","mirror_runtime_enabled":0,"paired_delta_tok_s":-0.10691579674262512}}
{"run":520,"commit":"2486190","metric":100.37729831621999,"metrics":{},"status":"discard","description":"Mirror follow-up run after near-tie control pair in ~101 regime.","timestamp":1776275943977,"segment":23,"confidence":8.392226856929359,"iterationTokens":619,"asi":{"hypothesis":"Mirror may bounce above control on immediate rerun if local noise favors split path.","rollback_reason":"Throughput remained degraded at 100.38 tok/s and below historical mirror keep.","next_action_hint":"Current environment appears settled around lower band; postpone fine retunes and preserve do-not-retry pruning updates.","backend":"mirror_sd_mlx","stability_probe":true}}
{"run":521,"commit":"8239837","metric":106.84230214539674,"metrics":{},"status":"keep","description":"Mirror lane structural cache mode: enable DFLASH_BSTNXBT_CONTEXT_ONLY_DRAFT_CACHE=1 (context-only draft KV cache in mlx native drafter).","timestamp":1776276067817,"segment":23,"confidence":8.788505626154231,"iterationTokens":2721,"asi":{"hypothesis":"Using context-only draft cache should reduce draft-cache churn/overhead on the 1024 mirror lane and improve throughput.","backend":"mirror_sd_mlx","context_only_draft_cache":1,"observed_delta_vs_best":0.37696817905241803}}
{"run":522,"commit":"8239837","metric":106.57610426584966,"metrics":{},"status":"discard","description":"Confirmation rerun of kept context-only draft cache configuration (unchanged).","timestamp":1776276100444,"segment":23,"confidence":8.884221333371846,"iterationTokens":1036,"asi":{"hypothesis":"If the new context-only draft cache keep is robust, immediate rerun should stay near or above prior keep value.","rollback_reason":"Rerun landed lower than new keep (106.58 vs 106.84), so no additional keep.","next_action_hint":"Treat context-only draft cache as current winner but continue paired mirror/control checks and sink/window tuning around this mode.","backend":"mirror_sd_mlx","context_only_draft_cache":1,"confirmation_run":true}}
{"run":523,"commit":"8239837","metric":106.73781687204821,"metrics":{},"status":"discard","description":"Paired control measurement with context-only draft cache keep active: disable mirror runtime (DFLASH_MIRROR_SD_RUNTIME=0).","timestamp":1776276132004,"segment":23,"confidence":8.96308301075964,"iterationTokens":920,"asi":{"hypothesis":"Context-only draft cache may improve both backends, but mirror should remain at least slightly ahead in contemporaneous A/B.","rollback_reason":"Control probe is not a mirror keep candidate; used for paired delta only.","next_action_hint":"Mirror edge under context-only mode appears narrow (~+0.10 tok/s); seek additional structural gains or robustness improvements.","backend":"bstnxbt_mlx","mirror_runtime_enabled":0,"context_only_draft_cache":1,"paired_delta_tok_s":0.10448527334853329}}
{"run":524,"commit":"8239837","metric":106.6353980578559,"metrics":{},"status":"discard","description":"Context-only draft cache tuning: set DFLASH_DRAFT_WINDOW=768 (sink default 64).","timestamp":1776276170259,"segment":23,"confidence":9.04335727420942,"iterationTokens":1348,"asi":{"hypothesis":"A slightly smaller context-only draft window may reduce drafter attention cost and improve 1024-lane throughput.","rollback_reason":"Below new keep (106.64 vs 106.84).","next_action_hint":"Keep default draft window 1024 with context-only cache on this lane; add 768 as non-winning window value.","backend":"mirror_sd_mlx","context_only_draft_cache":1,"draft_window":768}}
{"run":525,"commit":"8239837","metric":106.6673828710824,"metrics":{},"status":"discard","description":"Context-only draft cache tuning: set DFLASH_DRAFT_WINDOW=1536 (sink default 64).","timestamp":1776276199828,"segment":23,"confidence":9.130398328382187,"iterationTokens":745,"asi":{"hypothesis":"A larger context-only draft window may improve draft quality/acceptance enough to raise throughput.","rollback_reason":"Still below keep (106.67 vs 106.84).","next_action_hint":"Do not retune window upward for 1024 mirror lane without new evidence; default 1024 remains best so far.","backend":"mirror_sd_mlx","context_only_draft_cache":1,"draft_window":1536}}
{"run":526,"commit":"8b55918","metric":106.85823882223694,"metrics":{},"status":"keep","description":"Context-only draft cache micro-tune: set DFLASH_DRAFT_SINK=48 (from default 64) on mirror 1024 lane.","timestamp":1776276234549,"segment":23,"confidence":9.17005557588975,"iterationTokens":772,"asi":{"hypothesis":"A slightly smaller sink segment may trim draft attention overhead without hurting acceptance, giving a small throughput gain.","backend":"mirror_sd_mlx","context_only_draft_cache":1,"draft_sink":48,"observed_delta_vs_prev_keep":0.01593667684020679}}
{"run":527,"commit":"8b55918","metric":106.23438401903529,"metrics":{},"status":"discard","description":"Confirmation rerun of sink=48 + context-only draft cache keep (unchanged).","timestamp":1776276262042,"segment":23,"confidence":9.228437763863662,"iterationTokens":947,"asi":{"hypothesis":"If sink=48 is a robust gain, immediate rerun should stay near or above the new keep.","rollback_reason":"Confirmation landed below keep (106.23 vs 106.86).","next_action_hint":"Keep sink=48 as current best but continue with paired A/B validation versus control and nearby sink values.","backend":"mirror_sd_mlx","context_only_draft_cache":1,"draft_sink":48,"confirmation_run":true}}
