{"run":1112,"commit":"a6a31dd","metric":107.80566959178987,"metrics":{},"status":"discard","description":"Periodic control parity check in combo-default high-107 regime (`DFLASH_MIRROR_SD_RUNTIME=0`).","timestamp":1776309696212,"segment":23,"confidence":3.084090904868883,"iterationTokens":758,"asi":{"hypothesis":"Control should remain near mirror in the new high-107 cluster, confirming shared uplift from combo defaults.","rollback_reason":"Control ~107.81 is near mirror cluster but parity backend remains non-authoritative for active mirror objective.","next_action_hint":"Switch back to mirror runtime and continue searching for reproducible >108 mirror samples.","backend":"bstnxbt_mlx","mirror_runtime_enabled":0,"context_only_draft_cache":1,"draft_sink":48,"async_draft_eval":1,"fused_draft_verify_eval":1,"paired_mirror_tok_s":107.85790526753874,"paired_delta_tok_s":0.05223567574887016,"authoritative_lane":"mirror_sd_mlx"}}
{"run":1113,"commit":"a6a31dd","metric":107.37185790675304,"metrics":{},"status":"discard","description":"Mirror anchor after periodic control parity run in high-107 regime.","timestamp":1776309727443,"segment":23,"confidence":3.08886065968198,"iterationTokens":772,"asi":{"hypothesis":"Mirror should remain in high-107 cluster after parity detour, with modest jitter.","rollback_reason":"Mirror at ~107.37 stays strong but below keep 107.95.","next_action_hint":"Continue high-band mirror sampling; evaluate another major-bet only if fresh structural repo lead emerges.","backend":"mirror_sd_mlx","context_only_draft_cache":1,"draft_sink":48,"async_draft_eval":1,"fused_draft_verify_eval":1,"paired_control_tok_s":107.80566959178987,"paired_delta_tok_s":-0.4338116850368328,"delta_vs_keep":-0.5779942253340157}}
{"run":1114,"commit":"a6a31dd","metric":107.72422398664888,"metrics":{},"status":"discard","description":"Mirror continuity sample in combo-default high-107 regime.","timestamp":1776313348327,"segment":23,"confidence":3.096915803275917,"iterationTokens":306,"asi":{"hypothesis":"Combo-default mirror lane should sustain ~107+ even with occasional warmup variance.","rollback_reason":"Strong at ~107.72 but below current keep 107.95.","next_action_hint":"Continue sampling and periodic control parity; pursue >108 mirror breakout or new structural repo lead.","backend":"mirror_sd_mlx","context_only_draft_cache":1,"draft_sink":48,"async_draft_eval":1,"fused_draft_verify_eval":1,"startup_s":2.076919291052036,"warmup_s":3.1667080000042915,"delta_vs_keep":-0.22562814543818152}}
{"run":1115,"commit":"a6a31dd","metric":107.94952590073996,"metrics":{},"status":"discard","description":"Mirror high-band sample nearly matching current best under combo defaults.","timestamp":1776313385231,"segment":23,"confidence":3.125528075423007,"iterationTokens":662,"asi":{"hypothesis":"Mirror should repeatedly hit near-best values if combo optimization is stable.","rollback_reason":"~107.9495 is effectively tied but still infinitesimally below current keep 107.94985.","next_action_hint":"Continue sampling; seek clear >108 mirror datapoints for meaningful new keep.","backend":"mirror_sd_mlx","context_only_draft_cache":1,"draft_sink":48,"async_draft_eval":1,"fused_draft_verify_eval":1,"delta_vs_keep":-0.0003262313471008247,"near_tie":true}}
{"run":1116,"commit":"a6a31dd","metric":107.82580340930782,"metrics":{},"status":"discard","description":"Control parity check in sustained combo-default high-107 regime (mirror disabled).","timestamp":1776313422311,"segment":23,"confidence":3.155395592707389,"iterationTokens":784,"asi":{"hypothesis":"Control should remain tightly coupled to mirror under shared combo uplift.","rollback_reason":"Control ~107.83 remains high but parity backend is non-authoritative for mirror objective and below mirror keep.","next_action_hint":"Re-enable mirror runtime and continue monitoring for >108 mirror breakthroughs.","backend":"bstnxbt_mlx","mirror_runtime_enabled":0,"context_only_draft_cache":1,"draft_sink":48,"async_draft_eval":1,"fused_draft_verify_eval":1,"paired_mirror_tok_s":107.94952590073996,"paired_delta_tok_s":0.12372249143213929,"authoritative_lane":"mirror_sd_mlx"}}
{"run":1117,"commit":"a6a31dd","metric":107.84299833277431,"metrics":{},"status":"discard","description":"Mirror anchor after control parity check in high-107 regime.","timestamp":1776313450260,"segment":23,"confidence":3.1466952429567243,"iterationTokens":692,"asi":{"hypothesis":"Mirror should remain in tight high-107 cluster after parity checks.","rollback_reason":"~107.84 remains slightly below current keep 107.95.","next_action_hint":"Maintain combo defaults and keep sampling; initiate new major-bet only with fresh repo-derived structural lead.","backend":"mirror_sd_mlx","context_only_draft_cache":1,"draft_sink":48,"async_draft_eval":1,"fused_draft_verify_eval":1,"paired_control_tok_s":107.82580340930782,"paired_delta_tok_s":0.01719492346648851,"delta_vs_keep":-0.10685379931275137}}
{"run":1118,"commit":"a6a31dd","metric":107.91632364270689,"metrics":{},"status":"discard","description":"Mirror high-band sample approaching current best under combo defaults.","timestamp":1776313481748,"segment":23,"confidence":3.148874906248587,"iterationTokens":684,"asi":{"hypothesis":"Mirror should continue clustering near upper-107 with occasional small variance.","rollback_reason":"~107.92 is close but still below keep 107.95.","next_action_hint":"Continue loop for potential >108 mirror breakout; consider fresh structural probe only if new repo evidence appears.","backend":"mirror_sd_mlx","context_only_draft_cache":1,"draft_sink":48,"async_draft_eval":1,"fused_draft_verify_eval":1,"delta_vs_keep":-0.03352848938017699,"near_best":true}}
{"run":1119,"commit":"a6a31dd","metric":107.5904766033732,"metrics":{},"status":"discard","description":"Mirror continuity sample in combo-default high-107 regime.","timestamp":1776313666018,"segment":23,"confidence":3.1509539915888936,"iterationTokens":684,"asi":{"hypothesis":"Combo-default mirror lane should remain in a tight high-107 cluster with small jitter.","rollback_reason":"Strong sample but below current keep 107.95.","next_action_hint":"Continue mirror sampling and periodically pair control checks to monitor backend parity.","backend":"mirror_sd_mlx","context_only_draft_cache":1,"draft_sink":48,"async_draft_eval":1,"fused_draft_verify_eval":1,"delta_vs_keep":-0.3593755287138607}}
{"run":1120,"commit":"8a67058","metric":108.03920915975327,"metrics":{},"status":"keep","description":"Mirror breakout sample in combo-default regime; first clear >108 tok/s hit.","timestamp":1776313697251,"segment":23,"confidence":3.175277713068162,"iterationTokens":622,"asi":{"hypothesis":"Sustained combo defaults can produce occasional >108 mirror throughput in stable windows.","backend":"mirror_sd_mlx","context_only_draft_cache":1,"draft_sink":48,"async_draft_eval":1,"fused_draft_verify_eval":1,"delta_vs_keep":0.08935702766621348,"breakout":true,"next_validation":"Run immediate mirror follow-up and control parity check to confirm >108 window robustness."}}
{"run":1121,"commit":"8a67058","metric":106.75128234868478,"metrics":{},"status":"discard","description":"Immediate mirror follow-up after >108 breakout keep.","timestamp":1776313730662,"segment":23,"confidence":3.173876920903643,"iterationTokens":696,"asi":{"hypothesis":"If breakout is robust, follow-up should remain in upper-107/108 band.","rollback_reason":"Dropped to ~106.75, indicating high-band breakout is currently spiky rather than locked.","next_action_hint":"Run control parity sample to classify whether drop is shared regime wobble or mirror-local.","backend":"mirror_sd_mlx","context_only_draft_cache":1,"draft_sink":48,"async_draft_eval":1,"fused_draft_verify_eval":1,"paired_breakout_tok_s":108.03920915975327,"paired_delta_tok_s":-1.2879268110684883,"delta_vs_keep":-1.2879268110684883,"breakout_repro":false}}
{"run":1122,"commit":"8a67058","metric":107.49416412127684,"metrics":{},"status":"discard","description":"Control parity sample after mirror follow-up dip (mirror disabled).","timestamp":1776313767574,"segment":23,"confidence":3.1624179005123545,"iterationTokens":829,"asi":{"hypothesis":"Control run clarifies whether mirror drop was shared regime drift.","rollback_reason":"Control at ~107.49 stayed higher than paired mirror 106.75, suggesting mirror-local wobble in that sample.","next_action_hint":"Re-enable mirror runtime and re-anchor mirror in same regime before new candidate probes.","backend":"bstnxbt_mlx","mirror_runtime_enabled":0,"context_only_draft_cache":1,"draft_sink":48,"async_draft_eval":1,"fused_draft_verify_eval":1,"paired_mirror_tok_s":106.75128234868478,"paired_delta_tok_s":-0.7428817725920634,"authoritative_lane":"mirror_sd_mlx"}}
{"run":1123,"commit":"636a5fa","metric":108.09325698184952,"metrics":{},"status":"keep","description":"Mirror re-anchor after control parity detour; new >108 best with combo defaults.","timestamp":1776313801708,"segment":23,"confidence":3.234391699769611,"iterationTokens":1103,"asi":{"hypothesis":"Mirror-side dip was transient and high-band >108 should reappear under unchanged combo defaults.","backend":"mirror_sd_mlx","context_only_draft_cache":1,"draft_sink":48,"async_draft_eval":1,"fused_draft_verify_eval":1,"paired_control_tok_s":107.49416412127684,"paired_delta_tok_s":0.5990928605726825,"delta_vs_keep":0.05404782209624957,"breakout_recovered":true}}
{"run":1124,"commit":"ba36bd1","metric":108.3037158700435,"metrics":{},"status":"keep","description":"Immediate mirror follow-up after 108.09 keep; new best in same combo-default window.","timestamp":1776313831037,"segment":23,"confidence":3.3648206169810133,"iterationTokens":724,"asi":{"hypothesis":"If >108 breakout is real, consecutive mirror runs should remain above prior best.","backend":"mirror_sd_mlx","context_only_draft_cache":1,"draft_sink":48,"async_draft_eval":1,"fused_draft_verify_eval":1,"paired_prev_keep_tok_s":108.09325698184952,"paired_delta_tok_s":0.21045888819397354,"delta_vs_keep":0.21045888819397354,"stability_check":true}}
{"run":1125,"commit":"ba36bd1","metric":38.5520786132837,"metrics":{},"status":"discard","description":"Control parity check after new 108.30 mirror keep (`DFLASH_MIRROR_SD_RUNTIME=0`) encountered severe collapse.","timestamp":1776313894052,"segment":23,"confidence":3.2891148786463753,"iterationTokens":832,"asi":{"hypothesis":"Control should remain near mirror in high-108 window if regime is stable.","rollback_reason":"Control collapsed catastrophically to ~38.55, indicating fresh instability wave and invalid parity window.","next_action_hint":"Re-enable mirror runtime and run immediate mirror anchor to classify whether collapse is shared or control-local.","backend":"bstnxbt_mlx","mirror_runtime_enabled":0,"context_only_draft_cache":1,"draft_sink":48,"async_draft_eval":1,"fused_draft_verify_eval":1,"paired_mirror_tok_s":108.3037158700435,"paired_delta_tok_s":69.7516372567598,"severe_collapse":true,"window_invalidated":true}}
{"run":1126,"commit":"ba36bd1","metric":88.65319221794856,"metrics":{},"status":"discard","description":"Mirror anchor after control-collapse event; confirms severe shared instability.","timestamp":1776313925408,"segment":23,"confidence":3.216740815889782,"iterationTokens":778,"asi":{"hypothesis":"If control collapse was regime-wide, mirror should also degrade sharply on immediate rerun.","rollback_reason":"Mirror dropped to ~88.65, validating shared collapse and invalidating prior high-band parity comparison window.","next_action_hint":"Switch to recovery-only mirror/control bundle until 100+ and 107+ re-entry is re-established.","backend":"mirror_sd_mlx","context_only_draft_cache":1,"draft_sink":48,"async_draft_eval":1,"fused_draft_verify_eval":1,"paired_control_tok_s":38.5520786132837,"paired_delta_tok_s":50.10111360466486,"shared_collapse_confirmed":true,"delta_vs_keep":-19.65052365209494}}
{"run":1127,"commit":"ba36bd1","metric":58.32142883007515,"metrics":{},"status":"discard","description":"Mirror trough continuation after initial collapse confirmation.","timestamp":1776313966210,"segment":23,"confidence":3.2106052125324593,"iterationTokens":751,"asi":{"hypothesis":"Recovery may be non-monotonic and can dip further before rebound.","rollback_reason":"Throughput plunged further to ~58.32, indicating deeper trough phase.","next_action_hint":"Collect control parity sample now to verify collapse symmetry depth.","backend":"mirror_sd_mlx","context_only_draft_cache":1,"draft_sink":48,"async_draft_eval":1,"fused_draft_verify_eval":1,"delta_vs_keep":-49.98228704096835,"deep_trough":true}}
{"run":1128,"commit":"ba36bd1","metric":71.82245894946988,"metrics":{},"status":"discard","description":"Control parity sample during mirror deep trough phase (mirror disabled).","timestamp":1776314007892,"segment":23,"confidence":3.203826480392868,"iterationTokens":722,"asi":{"hypothesis":"Control should also remain degraded if trough is shared.","rollback_reason":"Control at ~71.82 confirms shared degraded regime, though less severe than mirror's 58 sample.","next_action_hint":"Return to mirror and continue recovery-only tracking toward 90+ and 100+ bands.","backend":"bstnxbt_mlx","mirror_runtime_enabled":0,"context_only_draft_cache":1,"draft_sink":48,"async_draft_eval":1,"fused_draft_verify_eval":1,"paired_mirror_tok_s":58.32142883007515,"paired_delta_tok_s":-13.501030119394732,"shared_collapse":true}}
{"run":1129,"commit":"ba36bd1","metric":81.12001737427939,"metrics":{},"status":"discard","description":"Mirror recovery step from deep trough into low-80s.","timestamp":1776314042246,"segment":23,"confidence":3.1998383506782413,"iterationTokens":706,"asi":{"hypothesis":"After shared collapse, mirror should climb from 50/70 bands toward 80+ before high-band return.","rollback_reason":"Low-80 remains far below keep.","next_action_hint":"Continue recovery bundle and recheck control parity after further rise.","backend":"mirror_sd_mlx","context_only_draft_cache":1,"draft_sink":48,"async_draft_eval":1,"fused_draft_verify_eval":1,"delta_vs_keep":-27.18369849576411,"recovery_phase":true}}
{"run":1130,"commit":"ba36bd1","metric":86.27671165776647,"metrics":{},"status":"discard","description":"Mirror recovery continuation into mid/high-80 band.","timestamp":1776314074378,"segment":23,"confidence":3.195860137483448,"iterationTokens":633,"asi":{"hypothesis":"Recovery should proceed 80s → 90s before 100+ re-entry.","rollback_reason":"Mid-80 still below keep.","next_action_hint":"Keep recovery-only cadence; take control parity sample near low-90 boundary.","backend":"mirror_sd_mlx","context_only_draft_cache":1,"draft_sink":48,"async_draft_eval":1,"fused_draft_verify_eval":1,"delta_vs_keep":-22.02700421227703}}
{"run":1131,"commit":"ba36bd1","metric":87.00691897471243,"metrics":{},"status":"discard","description":"Mirror recovery sample around high-80 plateau.","timestamp":1776314111163,"segment":23,"confidence":3.1802869178672952,"iterationTokens":611,"asi":{"hypothesis":"Recovery may stabilize briefly in high-80 before 90+ climb.","rollback_reason":"Still far below keep.","next_action_hint":"Take control parity check now to verify shared high-80 plateau.","backend":"mirror_sd_mlx","context_only_draft_cache":1,"draft_sink":48,"async_draft_eval":1,"fused_draft_verify_eval":1,"delta_vs_keep":-21.29679689533107,"recovery_plateau":true}}
{"run":1132,"commit":"ba36bd1","metric":93.08591524227896,"metrics":{},"status":"discard","description":"Control parity check during mirror high-80 recovery plateau (mirror disabled).","timestamp":1776314148476,"segment":23,"confidence":3.169286055685029,"iterationTokens":702,"asi":{"hypothesis":"Control should indicate whether rebound pace is shared.","rollback_reason":"Control already reached ~93.09, ahead of mirror high-80 plateau; recovery is asynchronous.","next_action_hint":"Return to mirror and continue recovery tracking toward low-90 and 100+ re-entry.","backend":"bstnxbt_mlx","mirror_runtime_enabled":0,"context_only_draft_cache":1,"draft_sink":48,"async_draft_eval":1,"fused_draft_verify_eval":1,"paired_mirror_tok_s":87.00691897471243,"paired_delta_tok_s":-6.078996267566533,"shared_recovery":true}}
{"run":1133,"commit":"ba36bd1","metric":95.79945095643383,"metrics":{},"status":"discard","description":"Mirror recovery step after control reached low-90; mirror climbed to mid-95.","timestamp":1776314180845,"segment":23,"confidence":3.1374836396864207,"iterationTokens":702,"asi":{"hypothesis":"Mirror should catch up toward control recovery and re-enter upper-90/100 soon.","rollback_reason":"Mid-95 still below keep.","next_action_hint":"Continue mirror recovery bundle until 100+ re-entry, then resume parity cadence.","backend":"mirror_sd_mlx","context_only_draft_cache":1,"draft_sink":48,"async_draft_eval":1,"fused_draft_verify_eval":1,"delta_vs_keep":-12.504264913609676,"recovery_phase":true}}
{"run":1134,"commit":"ba36bd1","metric":96.13170983661291,"metrics":{},"status":"discard","description":"Mirror recovery continuation from mid-95 to baseline-adjacent mid-96.","timestamp":1776314213757,"segment":23,"confidence":3.1063131297861775,"iterationTokens":641,"asi":{"hypothesis":"Recovery should continue through mid/high-90 before 100+ return.","rollback_reason":"Still below keep.","next_action_hint":"Maintain recovery cadence; trigger control parity once mirror crosses 100.","backend":"mirror_sd_mlx","context_only_draft_cache":1,"draft_sink":48,"async_draft_eval":1,"fused_draft_verify_eval":1,"delta_vs_keep":-12.172006033430595}}
{"run":1135,"commit":"ba36bd1","metric":98.24648140155101,"metrics":{},"status":"discard","description":"Mirror recovery moved into upper-90 band.","timestamp":1776314246423,"segment":23,"confidence":3.099405284934981,"iterationTokens":610,"asi":{"hypothesis":"Recovery should transition from mid-90 to upper-90 en route to 100+ re-entry.","rollback_reason":"Upper-90 still below keep.","next_action_hint":"Continue mirror recovery loop; control parity once mirror crosses 100.","backend":"mirror_sd_mlx","context_only_draft_cache":1,"draft_sink":48,"async_draft_eval":1,"fused_draft_verify_eval":1,"delta_vs_keep":-10.057234468492492}}
{"run":1136,"commit":"ba36bd1","metric":99.30051522407899,"metrics":{},"status":"discard","description":"Mirror recovery continuation approaching 100 tok/s boundary.","timestamp":1776314278882,"segment":23,"confidence":3.108011534703405,"iterationTokens":611,"asi":{"hypothesis":"Recovery should cross back into 100+ with continued stabilization.","rollback_reason":"~99.30 remains below keep.","next_action_hint":"Run another mirror sample to check 100+ re-entry, then control parity.","backend":"mirror_sd_mlx","context_only_draft_cache":1,"draft_sink":48,"async_draft_eval":1,"fused_draft_verify_eval":1,"delta_vs_keep":-9.003200645964506}}
{"run":1137,"commit":"ba36bd1","metric":99.50916826762952,"metrics":{},"status":"discard","description":"Mirror sample holding just below 100 during recovery.","timestamp":1776314311458,"segment":23,"confidence":3.093951933619925,"iterationTokens":606,"asi":{"hypothesis":"Recovery may briefly plateau around high-99 before crossing 100.","rollback_reason":"Still below keep and below 100 re-entry.","next_action_hint":"Take control parity sample to verify whether both backends are similarly near-100.","backend":"mirror_sd_mlx","context_only_draft_cache":1,"draft_sink":48,"async_draft_eval":1,"fused_draft_verify_eval":1,"delta_vs_keep":-8.794547602413973,"near_100_plateau":true}}
{"run":1138,"commit":"ba36bd1","metric":101.77284603605845,"metrics":{},"status":"discard","description":"Control parity sample while mirror hovered high-99 (mirror disabled).","timestamp":1776314347958,"segment":23,"confidence":3.080919047688145,"iterationTokens":726,"asi":{"hypothesis":"If recovery is shared, control should be near mirror around 100.","rollback_reason":"Control crossed to ~101.77 while mirror remained ~99.51, indicating asynchronous backend rebound.","next_action_hint":"Return to mirror and check whether mirror follows control into 100+ band.","backend":"bstnxbt_mlx","mirror_runtime_enabled":0,"context_only_draft_cache":1,"draft_sink":48,"async_draft_eval":1,"fused_draft_verify_eval":1,"paired_mirror_tok_s":99.50916826762952,"paired_delta_tok_s":-2.2636777684289244,"shared_recovery":true}}
{"run":1139,"commit":"ba36bd1","metric":102.71110080084205,"metrics":{},"status":"discard","description":"Mirror re-entry above 100 after near-100 plateau and control lead.","timestamp":1776314377995,"segment":23,"confidence":3.1088279548683317,"iterationTokens":703,"asi":{"hypothesis":"Mirror should follow control into low-100 as recovery synchronization resumes.","rollback_reason":"Low-102 still below keep.","next_action_hint":"Continue mirror recovery cadence; next control check after mirror reaches 105+ again.","backend":"mirror_sd_mlx","context_only_draft_cache":1,"draft_sink":48,"async_draft_eval":1,"fused_draft_verify_eval":1,"delta_vs_keep":-5.592615069201442,"reentry_100_plus":true}}
{"run":1140,"commit":"ba36bd1","metric":101.98527052321069,"metrics":{},"status":"discard","description":"Mirror recovery wobble within low-100 band after re-entry.","timestamp":1776314411835,"segment":23,"confidence":3.0821000415750177,"iterationTokens":641,"asi":{"hypothesis":"Recovery remains noisy with small oscillations in low-100s before high-band return.","rollback_reason":"Low-102 remains below keep.","next_action_hint":"Continue mirror sampling; avoid new probes until 105+ returns.","backend":"mirror_sd_mlx","context_only_draft_cache":1,"draft_sink":48,"async_draft_eval":1,"fused_draft_verify_eval":1,"delta_vs_keep":-6.318445346832806,"recovery_wobble":true}}
