{"run":1766,"commit":"54028e7","metric":14.49187825457193,"metrics":{},"status":"discard","description":"Immediate control parity also landed in degraded band (~67.21 tok/s, eval_s ~14.49), reaffirming shared collapse attribution for the renewed transition.","timestamp":1776372071001,"segment":24,"confidence":0.09892372314780933,"iterationTokens":1293,"asi":{"hypothesis":"Renewed collapse after soft-band recovery remains shared across mirror and control lanes.","rollback_reason":"Parity diagnostic run; metric far from best.","next_action_hint":"Return to mirror default and continue recovery tracking after shared-collapse confirmation.","diagnostic_findings":{"completion_tok_s":67.2090464454845,"dflash_eval_s":14.49187825457193,"dflash_total_s":15.04837087506894,"dflash_acceptance_rate":0.6972201352366642,"attribution":"shared_collapse_reconfirmed"}}}
{"run":1767,"commit":"54028e7","metric":14.087408714112826,"metrics":{},"status":"discard","description":"Back on mirror after parity, run stayed degraded (~68.97 tok/s, eval_s ~14.09) with slight improvement but no return to soft/high bands.","timestamp":1776372102502,"segment":24,"confidence":0.09691198941533712,"iterationTokens":1188,"asi":{"hypothesis":"Post-transition shared collapse persists for several runs before a stronger rebound resumes.","rollback_reason":"Primary metric still far from best.","next_action_hint":"Continue unchanged mirror loop to capture recovery trajectory; avoid further parity unless another major regime jump occurs.","diagnostic_findings":{"completion_tok_s":68.97129581728693,"dflash_eval_s":14.087408714112826,"dflash_total_s":14.65292825002689,"dflash_acceptance_rate":0.6972201352366642}}}
{"run":1768,"commit":"54028e7","metric":12.907560916035436,"metrics":{},"status":"discard","description":"Mirror moved upward from renewed collapse into mid-degraded recovery (~75.08 tok/s, eval_s ~12.91), still far from soft/high windows.","timestamp":1776372140427,"segment":24,"confidence":0.09643389339769115,"iterationTokens":1617,"asi":{"hypothesis":"After re-collapse, recovery resumes in staged eval_s drops with acceptance invariant.","rollback_reason":"Primary metric still well above best.","next_action_hint":"Keep unchanged mirror monitoring through rebound; hold code changes until stability returns.","diagnostic_findings":{"completion_tok_s":75.07684814615197,"dflash_eval_s":12.907560916035436,"dflash_total_s":13.446121499990113,"dflash_acceptance_rate":0.6972201352366642}}}
{"run":1769,"commit":"54028e7","metric":12.341165588935837,"metrics":{},"status":"discard","description":"Recovery improved again (~78.36 tok/s, eval_s ~12.34) but remains in degraded pocket versus high-window baseline.","timestamp":1776372172634,"segment":24,"confidence":0.09596049140615828,"iterationTokens":1335,"asi":{"hypothesis":"Current post-collapse regime is oscillatory within a degraded 12–13 eval_s pocket before potential soft-band return.","rollback_reason":"Primary metric still above best.","next_action_hint":"Continue mirror telemetry loop unchanged and wait for either soft-band re-entry (<10 eval_s) or another hard collapse transition.","diagnostic_findings":{"completion_tok_s":78.36151430290579,"dflash_eval_s":12.341165588935837,"dflash_total_s":12.875081124948338,"dflash_acceptance_rate":0.6972201352366642}}}
{"run":1770,"commit":"54028e7","metric":11.569599668611772,"metrics":{},"status":"discard","description":"Degraded-pocket rebound improved further (~83.33 tok/s, eval_s ~11.57) but still well above high-window best.","timestamp":1776372210937,"segment":24,"confidence":0.09576702368146231,"iterationTokens":1667,"asi":{"hypothesis":"Current oscillatory recovery can continue stepping down eval_s toward soft-band without acceptance changes.","rollback_reason":"Primary metric above best.","next_action_hint":"Keep unchanged mirror telemetry loop and watch for next soft-band re-entry (<10 eval_s).","diagnostic_findings":{"completion_tok_s":83.3324065176148,"dflash_eval_s":11.569599668611772,"dflash_total_s":12.098325000028126,"dflash_acceptance_rate":0.6972201352366642}}}
{"run":1771,"commit":"54028e7","metric":8.888149456353858,"metrics":{},"status":"discard","description":"Recovery snapped back from degraded pocket into near-high soft band (~106.84 tok/s, eval_s ~8.89) with unchanged acceptance structure.","timestamp":1776372288932,"segment":24,"confidence":0.09596049140615828,"iterationTokens":16236,"asi":{"hypothesis":"Post-collapse rebounds can rapidly return to sub-9 eval_s without any speculative-structure change.","rollback_reason":"Primary metric still above current best (~8.743).","next_action_hint":"Continue unchanged mirror loop to test whether this soft-band re-entry can reopen the 8.75 high window.","diagnostic_findings":{"completion_tok_s":106.83923614964712,"dflash_eval_s":8.888149456353858,"dflash_total_s":9.384256332996301,"dflash_acceptance_rate":0.6972201352366642,"dflash_draft_steps":96}}}
{"run":1772,"commit":"54028e7","metric":8.88170804316178,"metrics":{},"status":"discard","description":"Second run confirmed soft-band rebound persistence (~106.90 tok/s, eval_s ~8.88) with fixed acceptance profile.","timestamp":1776372313638,"segment":24,"confidence":0.09643389339769115,"iterationTokens":1204,"asi":{"hypothesis":"If rebound is stable, adjacent runs should cluster in high-soft band around 8.88–8.90 eval_s.","rollback_reason":"Primary metric did not beat best.","next_action_hint":"Continue unchanged mirror loop and watch for reopening into 8.75–8.80 high window.","diagnostic_findings":{"completion_tok_s":106.89903890897409,"dflash_eval_s":8.88170804316178,"dflash_total_s":9.382474125013687,"dflash_acceptance_rate":0.6972201352366642}}}
{"run":1773,"commit":"54028e7","metric":8.872905622585677,"metrics":{},"status":"discard","description":"Third rebound sample held near-soft/high band (~106.91 tok/s, eval_s ~8.873) and slightly improved within the cluster.","timestamp":1776372339103,"segment":24,"confidence":0.09691198941533712,"iterationTokens":1167,"asi":{"hypothesis":"Rebound is settling into a tight ~8.87–8.89 eval_s plateau before possible high-window breakout.","rollback_reason":"Primary metric remains above best.","next_action_hint":"Keep unchanged loop; look for sustained sub-8.80 values before considering any probing.","diagnostic_findings":{"completion_tok_s":106.90650659276223,"dflash_eval_s":8.872905622585677,"dflash_total_s":9.378448000061326,"dflash_acceptance_rate":0.6972201352366642}}}
{"run":1774,"commit":"54028e7","metric":8.889157041325234,"metrics":{},"status":"discard","description":"Cluster remained stable around soft-high band (~106.86 tok/s, eval_s ~8.889) with no structural telemetry change.","timestamp":1776372364602,"segment":24,"confidence":0.09892372314780933,"iterationTokens":1169,"asi":{"hypothesis":"Current regime is a high-soft plateau rather than immediate breakout to prior 8.75 high window.","rollback_reason":"Primary metric above best floor.","next_action_hint":"Continue unchanged monitoring to detect either breakout (<8.80) or renewed collapse transition.","diagnostic_findings":{"completion_tok_s":106.86061265662826,"dflash_eval_s":8.889157041325234,"dflash_total_s":9.39084545802325,"dflash_acceptance_rate":0.6972201352366642}}}
{"run":1775,"commit":"54028e7","metric":8.881251207669266,"metrics":{},"status":"discard","description":"Soft-high plateau persisted (~106.51 tok/s, eval_s ~8.881) with invariant acceptance and draft-step telemetry.","timestamp":1776372391512,"segment":24,"confidence":0.10102074795945186,"iterationTokens":1158,"asi":{"hypothesis":"Plateau behavior is primarily eval_s jitter around a stable runtime state.","rollback_reason":"Primary metric still above best.","next_action_hint":"Keep unchanged loop; hold parity checks unless a new sharp degradation begins.","diagnostic_findings":{"completion_tok_s":106.51251106499078,"dflash_eval_s":8.881251207669266,"dflash_total_s":9.39946600003168,"dflash_acceptance_rate":0.6972201352366642}}}
{"run":1776,"commit":"54028e7","metric":8.88856867107097,"metrics":{},"status":"discard","description":"Unchanged mirror stayed in the same soft-high cluster (~106.80 tok/s, eval_s ~8.889), no structural telemetry movement.","timestamp":1776372417830,"segment":24,"confidence":0.10177890874919779,"iterationTokens":1134,"asi":{"hypothesis":"Current state remains a stable post-recovery plateau rather than active breakout/collapse.","rollback_reason":"Primary metric did not improve.","next_action_hint":"Continue unchanged runs; trigger parity only on large eval_s jump.","diagnostic_findings":{"completion_tok_s":106.79512395780256,"dflash_eval_s":8.88856867107097,"dflash_total_s":9.388305416097865,"dflash_acceptance_rate":0.6972201352366642}}}
{"run":1777,"commit":"54028e7","metric":13.155928668915294,"metrics":{},"status":"discard","description":"Abrupt renewed collapse from soft-high plateau: eval_s jumped to ~13.16 and throughput dropped to ~73.69 with acceptance unchanged.","timestamp":1776372461200,"segment":24,"confidence":0.10102074795945186,"iterationTokens":1851,"asi":{"hypothesis":"Regime transitions are driven by eval-phase inflation while speculative structure stays fixed.","rollback_reason":"Primary metric regressed far above best.","next_action_hint":"Run immediate control parity sample (mirror runtime off) to re-check shared attribution for this fresh collapse onset.","diagnostic_findings":{"completion_tok_s":73.69004741149239,"dflash_eval_s":13.155928668915294,"dflash_total_s":13.707878582994454,"dflash_acceptance_rate":0.6972201352366642,"transition":"soft_high_to_collapse"}}}
{"run":1778,"commit":"54028e7","metric":13.084188370849006,"metrics":{},"status":"discard","description":"Immediate control parity also collapsed (~74.09 tok/s, eval_s ~13.08), confirming renewed transition is shared rather than mirror-specific.","timestamp":1776372491700,"segment":24,"confidence":0.09892372314780933,"iterationTokens":1243,"asi":{"hypothesis":"Fresh collapse events should appear in both mirror and control lanes with near-parity eval inflation.","rollback_reason":"Parity diagnostic run; metric far above best.","next_action_hint":"Return to mirror default and track rebound trajectory after this shared-collapse confirmation.","diagnostic_findings":{"completion_tok_s":74.08734890394415,"dflash_eval_s":13.084188370849006,"dflash_total_s":13.629982082988136,"dflash_acceptance_rate":0.6972201352366642,"attribution":"shared_collapse_confirmed_again"}}}
{"run":1779,"commit":"54028e7","metric":12.44430857966654,"metrics":{},"status":"discard","description":"Back on mirror after parity: still degraded but rebounding (~77.60 tok/s, eval_s ~12.44) with unchanged speculative telemetry.","timestamp":1776372521844,"segment":24,"confidence":0.09691198941533712,"iterationTokens":1181,"asi":{"hypothesis":"Post-collapse rebound should proceed via eval_s contraction while acceptance counters stay fixed.","rollback_reason":"Primary metric remains far above best.","next_action_hint":"Continue unchanged mirror loop to map rebound toward soft-band re-entry.","diagnostic_findings":{"completion_tok_s":77.60492997440318,"dflash_eval_s":12.44430857966654,"dflash_total_s":12.981770707992837,"dflash_acceptance_rate":0.6972201352366642}}}
{"run":1780,"commit":"54028e7","metric":12.04519990971312,"metrics":{},"status":"discard","description":"Recovery improved further (~80.21 tok/s, eval_s ~12.05) but remains in degraded regime relative to high-window best.","timestamp":1776372550121,"segment":24,"confidence":0.09643389339769115,"iterationTokens":1147,"asi":{"hypothesis":"After renewed collapse, rebounds track a similar staircase shape back toward soft band.","rollback_reason":"Primary metric still above best.","next_action_hint":"Continue unchanged mirror monitoring for soft-band return (<10 eval_s).","diagnostic_findings":{"completion_tok_s":80.21201089179166,"dflash_eval_s":12.04519990971312,"dflash_total_s":12.576222833013162,"dflash_acceptance_rate":0.6972201352366642}}}
{"run":1781,"commit":"54028e7","metric":11.997016500448808,"metrics":{},"status":"discard","description":"Recovery continued (~80.44 tok/s, eval_s ~11.997) with acceptance invariants intact, still above soft/high regime.","timestamp":1776372580250,"segment":24,"confidence":0.09596049140615828,"iterationTokens":1143,"asi":{"hypothesis":"The rebound is progressing but still in mid-degraded state before soft-band re-entry.","rollback_reason":"Primary metric remains above best.","next_action_hint":"Keep unchanged mirror loop and watch for transition below ~10 eval_s.","diagnostic_findings":{"completion_tok_s":80.4423272700767,"dflash_eval_s":11.997016500448808,"dflash_total_s":12.534158374997787,"dflash_acceptance_rate":0.6972201352366642}}}
{"run":1782,"commit":"54028e7","metric":11.262990954332054,"metrics":{},"status":"discard","description":"Rebound strengthened (~85.54 tok/s, eval_s ~11.26), indicating ongoing recovery from latest shared collapse.","timestamp":1776372608745,"segment":24,"confidence":0.09576702368146231,"iterationTokens":1220,"asi":{"hypothesis":"Recovery ladder can continue with eval_s contraction toward soft-band thresholds.","rollback_reason":"Primary metric still above best by large margin.","next_action_hint":"Continue unchanged mirror loop and monitor for first sub-10 eval_s sample.","diagnostic_findings":{"completion_tok_s":85.54397586490862,"dflash_eval_s":11.262990954332054,"dflash_total_s":11.780443166964687,"dflash_acceptance_rate":0.6972201352366642}}}
{"run":1783,"commit":"54028e7","metric":11.037400583503768,"metrics":{},"status":"discard","description":"Recovery continued (~87.13 tok/s, eval_s ~11.04), moving closer to soft band while acceptance remained constant.","timestamp":1776372637073,"segment":24,"confidence":0.09557433449486998,"iterationTokens":1152,"asi":{"hypothesis":"Post-collapse rebound remains eval-driven with stable speculative counters and may soon cross into sub-10 territory.","rollback_reason":"Primary metric still above best.","next_action_hint":"Continue unchanged mirror loop to detect soft-band re-entry and possible high-window reopen.","diagnostic_findings":{"completion_tok_s":87.12819162996853,"dflash_eval_s":11.037400583503768,"dflash_total_s":11.560497250058688,"dflash_acceptance_rate":0.6972201352366642}}}
{"run":1784,"commit":"54028e7","metric":10.811020745779388,"metrics":{},"status":"discard","description":"Recovery advanced (~88.90 tok/s, eval_s ~10.81), narrowing toward soft-band territory with fixed acceptance metrics.","timestamp":1776372665654,"segment":24,"confidence":0.09502458057433298,"iterationTokens":1153,"asi":{"hypothesis":"Rebound staircase remains active and should eventually re-enter <10 eval_s if collapse wave dissipates.","rollback_reason":"Primary metric still above best baseline.","next_action_hint":"Continue unchanged mirror loop for soft-band/high-window re-entry detection.","diagnostic_findings":{"completion_tok_s":88.90061240219485,"dflash_eval_s":10.811020745779388,"dflash_total_s":11.324938709032722,"dflash_acceptance_rate":0.6972201352366642}}}
{"run":1785,"commit":"54028e7","metric":10.636875752359629,"metrics":{},"status":"discard","description":"Rebound progressed again (~90.26 tok/s, eval_s ~10.64), still above soft-band/high-window levels.","timestamp":1776372692564,"segment":24,"confidence":0.0944811149708688,"iterationTokens":1143,"asi":{"hypothesis":"Current recovery follows a gradual eval_s descent with acceptance invariance.","rollback_reason":"Primary metric remains above best.","next_action_hint":"Continue unchanged mirror monitoring until sub-10 eval_s returns or a new collapse interrupts.","diagnostic_findings":{"completion_tok_s":90.25674805082613,"dflash_eval_s":10.636875752359629,"dflash_total_s":11.155494416016154,"dflash_acceptance_rate":0.6972201352366642}}}
{"run":1786,"commit":"54028e7","metric":10.452237044810317,"metrics":{},"status":"discard","description":"Recovery continued toward soft band (~91.80 tok/s, eval_s ~10.45) with unchanged speculative telemetry.","timestamp":1776372719711,"segment":24,"confidence":0.09112220101968772,"iterationTokens":1144,"asi":{"hypothesis":"Rebound remains eval-latency driven and may soon cross back under 10s.","rollback_reason":"Primary metric still above best.","next_action_hint":"Keep mirror loop unchanged and watch for soft-band threshold crossing.","diagnostic_findings":{"completion_tok_s":91.79777916210287,"dflash_eval_s":10.452237044810317,"dflash_total_s":10.964771500090137,"dflash_acceptance_rate":0.6972201352366642}}}
{"run":1787,"commit":"54028e7","metric":10.326150414068252,"metrics":{},"status":"discard","description":"Gradual rebound persisted (~92.84 tok/s, eval_s ~10.33), approaching soft band while acceptance remained fixed.","timestamp":1776372747579,"segment":24,"confidence":0.08799391461544714,"iterationTokens":1139,"asi":{"hypothesis":"This recovery wave is a smooth eval_s descent without speculative-structure changes.","rollback_reason":"Primary metric not yet competitive with best.","next_action_hint":"Continue unchanged runs and capture first sub-10 eval_s sample before considering any probe.","diagnostic_findings":{"completion_tok_s":92.83893823706559,"dflash_eval_s":10.326150414068252,"dflash_total_s":10.836375167011283,"dflash_acceptance_rate":0.6972201352366642}}}
{"run":1788,"commit":"54028e7","metric":10.335377242881805,"metrics":{},"status":"discard","description":"Recovery plateaued around ~10.33 eval_s (~92.71 tok/s), with telemetry counters unchanged.","timestamp":1776372776732,"segment":24,"confidence":0.07829966217631233,"iterationTokens":1152,"asi":{"hypothesis":"The current wave may pause in a mid-soft plateau before either sub-10 re-entry or another whipsaw.","rollback_reason":"Primary metric still above best.","next_action_hint":"Continue unchanged mirror loop; parity checks deferred unless a new hard jump occurs.","diagnostic_findings":{"completion_tok_s":92.71306122388509,"dflash_eval_s":10.335377242881805,"dflash_total_s":10.848235707962885,"dflash_acceptance_rate":0.6972201352366642}}}
{"run":1789,"commit":"54028e7","metric":10.099262831034139,"metrics":{},"status":"discard","description":"Rebound progressed to near-soft threshold (~94.74 tok/s, eval_s ~10.10) with stable acceptance counters.","timestamp":1776372819244,"segment":24,"confidence":0.07076157676008793,"iterationTokens":1823,"asi":{"hypothesis":"Current rebound may cross into sub-10 soft band within a few more unchanged runs.","rollback_reason":"Primary metric still above best.","next_action_hint":"Continue unchanged mirror telemetry for sub-10 and potential high-window reopening.","diagnostic_findings":{"completion_tok_s":94.74453498566675,"dflash_eval_s":10.099262831034139,"dflash_total_s":10.612727875006385,"dflash_acceptance_rate":0.6972201352366642}}}
{"run":1790,"commit":"54028e7","metric":9.883947002585046,"metrics":{},"status":"discard","description":"Soft-band re-entry achieved (~96.72 tok/s, eval_s ~9.88) after collapse recovery; acceptance/steps remained invariant.","timestamp":1776372846577,"segment":24,"confidence":0.07025775107658334,"iterationTokens":1148,"asi":{"hypothesis":"Recovery has crossed back into soft band and may continue toward prior high-window values.","rollback_reason":"Primary metric remains above best 8.743.","next_action_hint":"Continue unchanged mirror loop to test for renewed high-window breakout (<8.9 eval_s).","diagnostic_findings":{"completion_tok_s":96.71684865634832,"dflash_eval_s":9.883947002585046,"dflash_total_s":10.3937752089696,"dflash_acceptance_rate":0.6972201352366642,"regime":"soft_band_reentry"}}}
{"run":1791,"commit":"54028e7","metric":10.191298123216256,"metrics":{},"status":"discard","description":"Soft-band re-entry whipsawed upward (~93.64 tok/s, eval_s ~10.19) while acceptance stayed fixed.","timestamp":1776372875700,"segment":24,"confidence":0.06975247022374297,"iterationTokens":1281,"asi":{"hypothesis":"Post-collapse soft-band recovery remains oscillatory and can bounce between ~9.9 and ~10.3 eval_s.","rollback_reason":"Primary metric above best.","next_action_hint":"Continue unchanged mirror runs to see whether oscillation dampens toward high-window values.","diagnostic_findings":{"completion_tok_s":93.63526943475487,"dflash_eval_s":10.191298123216256,"dflash_total_s":10.730176082928665,"dflash_acceptance_rate":0.6972201352366642}}}
{"run":1792,"commit":"54028e7","metric":9.703816411900334,"metrics":{},"status":"discard","description":"Oscillation dropped back toward stronger soft-band performance (~98.46 tok/s, eval_s ~9.70) with unchanged speculative structure.","timestamp":1776372904591,"segment":24,"confidence":0.06822366805171363,"iterationTokens":1164,"asi":{"hypothesis":"Current post-collapse state is a soft-band oscillation pocket, not yet reopened high-window minima.","rollback_reason":"Primary metric still above best 8.743.","next_action_hint":"Continue unchanged mirror loop; trigger parity only on next hard-collapse transition.","diagnostic_findings":{"completion_tok_s":98.46088599647611,"dflash_eval_s":9.703816411900334,"dflash_total_s":10.209252333035693,"dflash_acceptance_rate":0.6972201352366642}}}
