{"run":1428,"commit":"b304c02","metric":108.26854250758305,"metrics":{},"status":"discard","description":"Mirror sample remained steady at ~108.27, confirming low-108 post-collapse plateau.","timestamp":1776352808758,"segment":23,"confidence":3.5221638526685815,"iterationTokens":718,"asi":{"hypothesis":"Current immediate post-collapse center is ~108.22–108.27 with room for later top-tail rebounds.","rollback_reason":"Below keep.","next_action_hint":"Keep mirror measurement loop active; harvest any upward tail as window evolves.","backend":"mirror_sd_mlx","context_only_draft_cache":1,"draft_sink":48,"async_draft_eval":1,"fused_draft_verify_eval":1,"paired_prev_tok_s":108.26163354065346,"paired_delta_tok_s":0.006908966929587494,"delta_vs_keep":-0.5937899868918958,"post_collapse_plateau":"108.22-108.27"}}
{"run":1429,"commit":"b304c02","metric":108.26783470132852,"metrics":{},"status":"discard","description":"Mirror sample repeated ~108.27, reinforcing low-108 post-collapse plateau.","timestamp":1776352860582,"segment":23,"confidence":3.519979178235542,"iterationTokens":1674,"asi":{"hypothesis":"Post-collapse local center is currently sticky near 108.26-108.27.","rollback_reason":"Below keep.","next_action_hint":"Continue mirror scans for eventual upward drift into upper-108.5 band.","backend":"mirror_sd_mlx","context_only_draft_cache":1,"draft_sink":48,"async_draft_eval":1,"fused_draft_verify_eval":1,"warmup_s":2.0109013749752194,"paired_prev_tok_s":108.26854250758305,"paired_delta_tok_s":-0.0007078062545221532,"delta_vs_keep":-0.5944977931464285}}
{"run":1430,"commit":"b304c02","metric":108.29767190989672,"metrics":{},"status":"discard","description":"Mirror sample ticked up to ~108.30, slight lift from low-108 plateau center.","timestamp":1776352887283,"segment":23,"confidence":3.5182213067734054,"iterationTokens":709,"asi":{"hypothesis":"Plateau may be slowly drifting upward after collapse recovery.","rollback_reason":"Still below keep.","next_action_hint":"Continue mirror scans to see if drift reaches upper-108.5 band.","backend":"mirror_sd_mlx","context_only_draft_cache":1,"draft_sink":48,"async_draft_eval":1,"fused_draft_verify_eval":1,"paired_prev_tok_s":108.26783470132852,"paired_delta_tok_s":0.02983720856819934,"delta_vs_keep":-0.5646605845782285,"post_collapse_rebound":true}}
{"run":1431,"commit":"b304c02","metric":108.3454975543879,"metrics":{},"status":"discard","description":"Mirror sample rose to ~108.35, continuing gradual rebound from low-108 plateau.","timestamp":1776352912171,"segment":23,"confidence":3.518155464281883,"iterationTokens":704,"asi":{"hypothesis":"Post-collapse band is trending upward toward prior mid/high-108 window.","rollback_reason":"Below keep.","next_action_hint":"Continue mirror-only scanning; consider control parity only if rebound stalls or diverges.","backend":"mirror_sd_mlx","context_only_draft_cache":1,"draft_sink":48,"async_draft_eval":1,"fused_draft_verify_eval":1,"paired_prev_tok_s":108.29767190989672,"paired_delta_tok_s":0.04782564449117522,"delta_vs_keep":-0.5168349400870496,"post_collapse_rebound":true}}
{"run":1432,"commit":"b304c02","metric":108.24326552689159,"metrics":{},"status":"discard","description":"Mirror sample eased back to ~108.24 after rebound run-up; still in recovered low-108 band.","timestamp":1776353019046,"segment":23,"confidence":3.5187894663283528,"iterationTokens":704,"asi":{"hypothesis":"Post-collapse recovery remains intact but local center is still below prior upper-108.6 window.","rollback_reason":"Below keep 108.8623.","next_action_hint":"Continue mirror scans for renewed upward drift/top-tail reopening.","backend":"mirror_sd_mlx","context_only_draft_cache":1,"draft_sink":48,"async_draft_eval":1,"fused_draft_verify_eval":1,"paired_prev_tok_s":108.3454975543879,"paired_delta_tok_s":-0.10223202749631057,"delta_vs_keep":-0.6190669675833492}}
{"run":1433,"commit":"b304c02","metric":107.92434883391475,"metrics":{},"status":"discard","description":"Mirror sample dipped sub-108 (~107.92), suggesting renewed softening after recovery.","timestamp":1776353045888,"segment":23,"confidence":3.5256534599269234,"iterationTokens":691,"asi":{"hypothesis":"Recovered band can still oscillate back into high-107s before full upper-window re-open.","rollback_reason":"Below keep and below 108.","next_action_hint":"Run immediate mirror follow-up; parity check if sub-108 persists.","backend":"mirror_sd_mlx","context_only_draft_cache":1,"draft_sink":48,"async_draft_eval":1,"fused_draft_verify_eval":1,"paired_prev_tok_s":108.24326552689159,"paired_delta_tok_s":-0.318916692976836,"delta_vs_keep":-0.9379836605601839,"possible_re_softening":true}}
{"run":1434,"commit":"b304c02","metric":107.85864419403114,"metrics":{},"status":"discard","description":"Immediate mirror follow-up stayed sub-108 at ~107.86, confirming local softening.","timestamp":1776353077795,"segment":23,"confidence":3.5332498899245635,"iterationTokens":717,"asi":{"hypothesis":"Current regime has slipped from low-108 plateau into sustained high-107 band.","rollback_reason":"Below keep and second consecutive sub-108 sample.","next_action_hint":"Run control parity spot-check now to confirm shared softening.","backend":"mirror_sd_mlx","context_only_draft_cache":1,"draft_sink":48,"async_draft_eval":1,"fused_draft_verify_eval":1,"warmup_s":1.9960225420072675,"paired_prev_tok_s":107.92434883391475,"paired_delta_tok_s":-0.06570463988360896,"delta_vs_keep":-1.0036883004437929,"shared_softening_check_due":true}}
{"run":1435,"commit":"b304c02","metric":106.94430550174889,"metrics":{},"status":"discard","description":"Control parity spot-check (`DFLASH_MIRROR_SD_RUNTIME=0`) dropped to ~106.94, confirming shared regime softening.","timestamp":1776353107857,"segment":23,"confidence":3.538703986930682,"iterationTokens":872,"asi":{"hypothesis":"Sub-108 mirror behavior is shared environment/regime drift, not mirror-specific regression.","rollback_reason":"Control remains non-authoritative and score is far below keep.","next_action_hint":"Restore mirror runtime and track whether shared band rebounds from ~107 toward 108+.","backend":"bstnxbt_mlx","mirror_runtime_enabled":0,"context_only_draft_cache":1,"draft_sink":48,"async_draft_eval":1,"fused_draft_verify_eval":1,"paired_mirror_tok_s":107.85864419403114,"paired_delta_tok_s":0.9143386922822431,"authoritative_lane":"mirror_sd_mlx","shared_softening_confirmed":true}}
{"run":1436,"commit":"b304c02","metric":108.04286548039629,"metrics":{},"status":"discard","description":"Mirror anchor after parity check rebounded to ~108.04, indicating shared dip remains transient.","timestamp":1776353141077,"segment":23,"confidence":3.5389301663595414,"iterationTokens":1414,"asi":{"hypothesis":"Shared softening can recover quickly back to low-108 without config changes.","rollback_reason":"Below keep.","next_action_hint":"Continue mirror scans for further climb into upper-108.5 range.","backend":"mirror_sd_mlx","context_only_draft_cache":1,"draft_sink":48,"async_draft_eval":1,"fused_draft_verify_eval":1,"paired_control_tok_s":106.94430550174889,"paired_delta_tok_s":1.0985599786474007,"delta_vs_keep":-0.8194670140786479,"post_parity_rebound":true}}
{"run":1437,"commit":"b304c02","metric":108.14062764503045,"metrics":{},"status":"discard","description":"Mirror sample improved to ~108.14 as rebound continues.","timestamp":1776353166068,"segment":23,"confidence":3.547874835603929,"iterationTokens":698,"asi":{"hypothesis":"Local center is climbing from high-107/low-108 back toward prior high-window.","rollback_reason":"Below keep 108.8623.","next_action_hint":"Keep mirror-only scans while upward momentum persists.","backend":"mirror_sd_mlx","context_only_draft_cache":1,"draft_sink":48,"async_draft_eval":1,"fused_draft_verify_eval":1,"paired_prev_tok_s":108.04286548039629,"paired_delta_tok_s":0.09776216463415799,"delta_vs_keep":-0.7217048494444885,"rebound_continues":true}}
{"run":1438,"commit":"b304c02","metric":55.64784532748975,"metrics":{},"status":"discard","description":"Mirror run hard-collapsed to ~55.65 tok/s, another severe shared-instability signature.","timestamp":1776353200743,"segment":23,"confidence":3.5389301663595414,"iterationTokens":668,"asi":{"hypothesis":"Regime remains highly non-stationary with abrupt collapses even during rebound phases.","rollback_reason":"Catastrophically below keep/high-window.","next_action_hint":"Run immediate mirror follow-up to characterize collapse depth and early recovery path before parity check.","backend":"mirror_sd_mlx","context_only_draft_cache":1,"draft_sink":48,"async_draft_eval":1,"fused_draft_verify_eval":1,"request_s":18.40143124992028,"paired_prev_tok_s":108.14062764503045,"paired_delta_tok_s":-52.492782317540694,"delta_vs_keep":-53.21448716698519,"collapse_reappeared":true}}
{"run":1439,"commit":"b304c02","metric":62.899421307095096,"metrics":{},"status":"discard","description":"Immediate mirror follow-up rose only to ~62.90, confirming active deep-collapse regime.","timestamp":1776353238483,"segment":23,"confidence":3.538703986930682,"iterationTokens":766,"asi":{"hypothesis":"Current collapse is not a single outlier; degraded regime persists across consecutive runs.","rollback_reason":"Still catastrophically below keep.","next_action_hint":"Run control parity sample now to confirm shared collapse depth across backends.","backend":"mirror_sd_mlx","context_only_draft_cache":1,"draft_sink":48,"async_draft_eval":1,"fused_draft_verify_eval":1,"request_s":16.279958999948576,"paired_prev_tok_s":55.64784532748975,"paired_delta_tok_s":7.251575979605347,"delta_vs_keep":-45.962911187379845,"deep_collapse_confirmed":true}}
{"run":1440,"commit":"b304c02","metric":58.48271103884993,"metrics":{},"status":"discard","description":"Control parity check (`DFLASH_MIRROR_SD_RUNTIME=0`) also collapsed to ~58.48, confirming shared collapse episode.","timestamp":1776353293324,"segment":23,"confidence":3.5332498899245635,"iterationTokens":931,"asi":{"hypothesis":"Deep-collapse behavior is backend-agnostic and driven by shared runtime/system regime.","rollback_reason":"Control is non-authoritative and far below keep.","next_action_hint":"Restore mirror lane and track staged recovery (60s→80s→100s→108+) before any structural probes.","backend":"bstnxbt_mlx","mirror_runtime_enabled":0,"context_only_draft_cache":1,"draft_sink":48,"async_draft_eval":1,"fused_draft_verify_eval":1,"request_s":17.509448208031245,"paired_mirror_tok_s":62.899421307095096,"paired_delta_tok_s":4.416710268245166,"authoritative_lane":"mirror_sd_mlx","shared_collapse_confirmed":true}}
{"run":1441,"commit":"b304c02","metric":67.01810923887541,"metrics":{},"status":"discard","description":"Mirror recovery step reached ~67.02 after shared ~58–63 collapse trough.","timestamp":1776353328818,"segment":23,"confidence":3.5256534599269234,"iterationTokens":1158,"asi":{"hypothesis":"Current collapse is following familiar staged rebound dynamics.","rollback_reason":"Still far below keep/high-window.","next_action_hint":"Continue consecutive mirror samples to map recovery trajectory.","backend":"mirror_sd_mlx","context_only_draft_cache":1,"draft_sink":48,"async_draft_eval":1,"fused_draft_verify_eval":1,"request_s":15.279452249989845,"paired_prev_tok_s":62.899421307095096,"paired_delta_tok_s":4.118687931780313,"delta_vs_keep":-41.84422325559953,"recovery_stage":"63->67"}}
{"run":1442,"commit":"b304c02","metric":77.76278738920236,"metrics":{},"status":"discard","description":"Mirror recovery advanced to ~77.76, continuing climb out of collapse zone.","timestamp":1776353357681,"segment":23,"confidence":3.5187894663283528,"iterationTokens":689,"asi":{"hypothesis":"Recovery remains in staged ascent with improving request-time each run.","rollback_reason":"Still below keep/high-window.","next_action_hint":"Continue mirror tracking through 80s/90s toward 100+ re-entry.","backend":"mirror_sd_mlx","context_only_draft_cache":1,"draft_sink":48,"async_draft_eval":1,"fused_draft_verify_eval":1,"request_s":13.168252249946818,"paired_prev_tok_s":67.01810923887541,"paired_delta_tok_s":10.744678150326953,"delta_vs_keep":-31.09954510527258,"recovery_stage":"67->78"}}
{"run":1443,"commit":"b304c02","metric":81.56107147151089,"metrics":{},"status":"discard","description":"Mirror sample rose to ~81.56, sustaining rebound into low-80s band.","timestamp":1776353385158,"segment":23,"confidence":3.518155464281883,"iterationTokens":703,"asi":{"hypothesis":"Recovery is progressing but may pause in 80s before 90+/100+ jump.","rollback_reason":"Below keep.","next_action_hint":"Continue consecutive mirror samples to detect next recovery step.","backend":"mirror_sd_mlx","context_only_draft_cache":1,"draft_sink":48,"async_draft_eval":1,"fused_draft_verify_eval":1,"request_s":12.555009167059325,"paired_prev_tok_s":77.76278738920236,"paired_delta_tok_s":3.79828408230853,"delta_vs_keep":-27.30126102296405,"recovery_stage":"78->82"}}
{"run":1444,"commit":"b304c02","metric":86.04986367094932,"metrics":{},"status":"discard","description":"Mirror recovery advanced to ~86.05, extending staged climb from collapse trough.","timestamp":1776353414826,"segment":23,"confidence":3.5151463897957873,"iterationTokens":693,"asi":{"hypothesis":"Rebound is still monotonic this cycle and may soon re-enter 90+/100+ bands.","rollback_reason":"Below keep/high-window.","next_action_hint":"Continue mirror tracking without structural edits.","backend":"mirror_sd_mlx","context_only_draft_cache":1,"draft_sink":48,"async_draft_eval":1,"fused_draft_verify_eval":1,"request_s":11.90007695904933,"paired_prev_tok_s":81.56107147151089,"paired_delta_tok_s":4.488792199438434,"delta_vs_keep":-22.812468823525624,"recovery_stage":"82->86"}}
{"run":1445,"commit":"b304c02","metric":88.8288988628134,"metrics":{},"status":"discard","description":"Mirror sample climbed to ~88.83, continuing steady post-collapse recovery.","timestamp":1776353441906,"segment":23,"confidence":3.513490512288153,"iterationTokens":701,"asi":{"hypothesis":"Recovery trajectory remains healthy and likely to revisit 90s then 100+ if uninterrupted.","rollback_reason":"Below keep.","next_action_hint":"Continue mirror scans to capture transition into 90+/100+ bands.","backend":"mirror_sd_mlx","context_only_draft_cache":1,"draft_sink":48,"async_draft_eval":1,"fused_draft_verify_eval":1,"request_s":11.527779957978055,"paired_prev_tok_s":86.04986367094932,"paired_delta_tok_s":2.7790351918640828,"delta_vs_keep":-20.03343363166154,"recovery_stage":"86->89"}}
{"run":1446,"commit":"b304c02","metric":88.20888478150279,"metrics":{},"status":"discard","description":"Mirror held near ~88.21, slight pause in high-80s recovery band.","timestamp":1776353471781,"segment":23,"confidence":3.511836194112056,"iterationTokens":697,"asi":{"hypothesis":"Recovery may temporarily plateau in high-80s before next jump.","rollback_reason":"Below keep.","next_action_hint":"Continue mirror measurements; no parity check needed unless mirror/control divergence is suspected.","backend":"mirror_sd_mlx","context_only_draft_cache":1,"draft_sink":48,"async_draft_eval":1,"fused_draft_verify_eval":1,"request_s":11.608807916985825,"paired_prev_tok_s":88.8288988628134,"paired_delta_tok_s":-0.6200140813106094,"delta_vs_keep":-20.65344771297215,"recovery_stage":"high-80s plateau"}}
{"run":1447,"commit":"b304c02","metric":90.5271820432789,"metrics":{},"status":"discard","description":"Mirror recovery moved into 90s at ~90.53, resuming upward climb.","timestamp":1776353503144,"segment":23,"confidence":3.5092189398381026,"iterationTokens":708,"asi":{"hypothesis":"High-80s pause has broken; trajectory likely heading toward 100+ if regime stays favorable.","rollback_reason":"Below keep/high-window.","next_action_hint":"Continue mirror scans to track 90s→100s transition.","backend":"mirror_sd_mlx","context_only_draft_cache":1,"draft_sink":48,"async_draft_eval":1,"fused_draft_verify_eval":1,"request_s":11.311519666109234,"paired_prev_tok_s":88.20888478150279,"paired_delta_tok_s":2.3182972617761166,"delta_vs_keep":-18.335150451196036,"recovery_stage":"88->90"}}
{"run":1448,"commit":"b304c02","metric":90.01249604641062,"metrics":{},"status":"discard","description":"Mirror remained around ~90.01, holding early-90s recovery band.","timestamp":1776353535381,"segment":23,"confidence":3.50660558376342,"iterationTokens":715,"asi":{"hypothesis":"Recovery is stable but still below the faster 100+/108 windows.","rollback_reason":"Below keep.","next_action_hint":"Continue mirror tracking for next step-up.","backend":"mirror_sd_mlx","context_only_draft_cache":1,"draft_sink":48,"async_draft_eval":1,"fused_draft_verify_eval":1,"request_s":11.376198249985464,"paired_prev_tok_s":90.5271820432789,"paired_delta_tok_s":-0.5146859968682744,"delta_vs_keep":-18.849836448064316,"recovery_stage":"~90 plateau"}}
{"run":1449,"commit":"b304c02","metric":92.11243014705545,"metrics":{},"status":"discard","description":"Mirror recovery stepped up to ~92.11, continuing gradual ascent.","timestamp":1776353565124,"segment":23,"confidence":3.499471192753298,"iterationTokens":678,"asi":{"hypothesis":"Recovery remains active and may progress into mid/high-90s next.","rollback_reason":"Below keep/high-window.","next_action_hint":"Continue mirror-only measurement loop.","backend":"mirror_sd_mlx","context_only_draft_cache":1,"draft_sink":48,"async_draft_eval":1,"fused_draft_verify_eval":1,"request_s":11.116849250043742,"paired_prev_tok_s":90.01249604641062,"paired_delta_tok_s":2.099934100644833,"delta_vs_keep":-16.749902347419486,"recovery_stage":"90->92"}}
{"run":1450,"commit":"b304c02","metric":94.9236470430455,"metrics":{},"status":"discard","description":"Mirror recovery rose to ~94.92, nearing 96 intermediate band.","timestamp":1776353590961,"segment":23,"confidence":3.4923657734573195,"iterationTokens":681,"asi":{"hypothesis":"Recovery is approaching the familiar pre-108 staging zone around mid/high-90s.","rollback_reason":"Below keep.","next_action_hint":"Continue mirror tracking for 100+ re-entry.","backend":"mirror_sd_mlx","context_only_draft_cache":1,"draft_sink":48,"async_draft_eval":1,"fused_draft_verify_eval":1,"request_s":10.787617542082444,"paired_prev_tok_s":92.11243014705545,"paired_delta_tok_s":2.811216895990044,"delta_vs_keep":-13.938685451429434,"recovery_stage":"92->95"}}
{"run":1451,"commit":"b304c02","metric":96.61136882400511,"metrics":{},"status":"discard","description":"Mirror recovery crossed into ~96.61, clearing the mid-recovery threshold.","timestamp":1776353621274,"segment":23,"confidence":3.491305780802939,"iterationTokens":683,"asi":{"hypothesis":"Collapse rebound has reached the known 96-ish intermediate plateau and can continue toward 100+.","rollback_reason":"Still below keep/high-window.","next_action_hint":"Continue mirror scans for transition into 100+ and eventual 107/108 windows.","backend":"mirror_sd_mlx","context_only_draft_cache":1,"draft_sink":48,"async_draft_eval":1,"fused_draft_verify_eval":1,"request_s":10.599166666041128,"paired_prev_tok_s":94.9236470430455,"paired_delta_tok_s":1.68772178095961,"delta_vs_keep":-12.250963670469828,"recovery_stage":"95->96.6"}}
{"run":1452,"commit":"b304c02","metric":97.48566477612813,"metrics":{},"status":"discard","description":"Mirror recovery improved to ~97.49, extending climb beyond the 96 plateau.","timestamp":1776353647265,"segment":23,"confidence":3.490246431405065,"iterationTokens":747,"asi":{"hypothesis":"Recovery remains on track toward 100+ and later 107+ re-entry.","rollback_reason":"Below keep.","next_action_hint":"Continue mirror-only measurement sequence.","backend":"mirror_sd_mlx","context_only_draft_cache":1,"draft_sink":48,"async_draft_eval":1,"fused_draft_verify_eval":1,"request_s":10.504108499968424,"paired_prev_tok_s":96.61136882400511,"paired_delta_tok_s":0.874295952123019,"delta_vs_keep":-11.37666771834681,"recovery_stage":"96.6->97.5"}}
{"run":1453,"commit":"b304c02","metric":96.51915238422384,"metrics":{},"status":"discard","description":"Mirror sample eased to ~96.52, hovering near the mid-recovery plateau.","timestamp":1776353676424,"segment":23,"confidence":3.4854527090901906,"iterationTokens":691,"asi":{"hypothesis":"Recovery can wobble around ~96-98 before next upward step.","rollback_reason":"Below keep.","next_action_hint":"Continue mirror scans; watch for 100+ breakout.","backend":"mirror_sd_mlx","context_only_draft_cache":1,"draft_sink":48,"async_draft_eval":1,"fused_draft_verify_eval":1,"request_s":10.609293334069662,"paired_prev_tok_s":97.48566477612813,"paired_delta_tok_s":-0.9665123919042939,"delta_vs_keep":-12.3431801102511,"recovery_stage":"~96-98 plateau"}}
{"run":1454,"commit":"b304c02","metric":97.08546250268947,"metrics":{},"status":"discard","description":"Mirror sample rose to ~97.09, still in mid-recovery band.","timestamp":1776353702242,"segment":23,"confidence":3.4806721367092917,"iterationTokens":725,"asi":{"hypothesis":"Recovery remains stable but not yet breaking into 100+ tier.","rollback_reason":"Below keep.","next_action_hint":"Continue mirror-only run sequence.","backend":"mirror_sd_mlx","context_only_draft_cache":1,"draft_sink":48,"async_draft_eval":1,"fused_draft_verify_eval":1,"request_s":10.547408165992238,"paired_prev_tok_s":96.51915238422384,"paired_delta_tok_s":0.5663101184656328,"delta_vs_keep":-11.776869991785475,"recovery_stage":"96-97 band"}}
