{"run":142,"commit":"e7b14c4","metric":27.79738439563257,"metrics":{},"status":"discard","description":"Override the drafter conditioning layers to a shifted set `(4,10,16,22,28)` that improved acceptance in a standalone corrected-semantic diagnostic, and benchmark it on the strongest sequential-verify branch (`block_size=2`). The acceptance-only improvement did not translate to a server-path win.","timestamp":1776021377053,"segment":4,"confidence":69.07867107499393,"iterationTokens":27260,"asi":{"hypothesis":"Because low acceptance is the main bottleneck now, a conditioning-layer set that improves acceptance under corrected semantics might finally unlock a throughput win when paired with the strongest small-block sequential-verify path.","rollback_reason":"Despite looking better in the acceptance diagnostic, the shifted-layer variant regressed on the real server benchmark, so it is not a win.","next_action_hint":"Do not trust acceptance-only layer changes, even under corrected semantics, without end-to-end benchmarking. The next path should focus on a different structural bottleneck.","learning":"The earlier lesson still holds after the rollback/correctness work: better acceptance in a narrow diagnostic does not guarantee better end-to-end throughput. Conditioning-layer changes remain dangerous to optimize by proxy.","acceptance_learning":"Even on the strongest corrected sequential branch, the shifted layer set `(4,10,16,22,28)` did not pay off in the real server benchmark."}}
{"run":143,"commit":"e7b14c4","metric":27.88468685334959,"metrics":{},"status":"discard","description":"Add a parity-correct sequential-verify path for the official z-lab torch drafter and benchmark it on the real server workload. The torch drafter clearly improved acceptance in diagnostics versus the native MLX drafter, but the end-to-end server path still did not beat the kept baseline.","timestamp":1776021697824,"segment":4,"confidence":69.56625708232431,"iterationTokens":15175,"asi":{"hypothesis":"Our native MLX drafter port may still be suppressing acceptance materially; if so, the official torch drafter combined with corrected sequential verification should outperform the native sequential branch despite the bridge overhead.","rollback_reason":"Even with materially better acceptance in diagnostics, the torch-drafter sequential path still stayed below the kept baseline on the real server benchmark.","next_action_hint":"If revisiting this branch, test whether smaller block sizes help the torch sequential path the same way they helped the native sequential path. Otherwise focus on other structural bottlenecks.","learning":"Higher acceptance alone was not enough to overcome the end-to-end cost of the torch sequential path in this first benchmark. The bridge/runtime overhead is still substantial.","drafter_learning":"The official torch drafter appears stronger than the native MLX port on corrected-semantics acceptance diagnostics, but that strength did not automatically transfer into higher full-server throughput."}}
{"run":144,"commit":"e7b14c4","metric":28.005277611242636,"metrics":{},"status":"discard","description":"Benchmark the parity-correct torch-drafter sequential-verify path at block_size=8 after the initial block_size=16 result suggested acceptance might benefit from smaller speculative blocks. It remained below the kept baseline.","timestamp":1776023506034,"segment":4,"confidence":70.0607751891924,"iterationTokens":5364,"asi":{"hypothesis":"The official torch drafter has materially better corrected-semantics acceptance than the native MLX port, and smaller blocks previously helped the native sequential branch, so block_size=8 might be the best torch sequential operating point.","rollback_reason":"The torch sequential block_size=8 rerun still stayed below the kept e7b14c4 baseline, so it is not a win.","next_action_hint":"Do not spend more time on torch sequential block-size tuning unless a new profile suggests a qualitatively different bottleneck; return to structural drafter/runtime work.","learning":"Even with the stronger official torch drafter and a smaller block, the parity-correct sequential server path still does not convert better acceptance into a throughput win.","drafter_learning":"The native-vs-torch acceptance gap is real, but bridge/runtime cost remains high enough that simply swapping to the stronger torch drafter is insufficient."}}
{"run":145,"commit":"e7b14c4","metric":24.692914133132465,"metrics":{},"status":"discard","description":"Ported an env-gated server path for boundary-snapshot speculative verify plus native-MLX fresh linear-SSM refresh at completion token 168. It restored exact server-path parity on the benchmark prompt, but full benchmark throughput fell to 24.69 tok/s, well below the ~28.36 tok/s baseline, so the refresh/reanchor control is useful only as a correctness probe, not a throughput win.","timestamp":1776035364312,"segment":4,"confidence":69.56625708232431,"iterationTokens":43622}
{"run":146,"commit":"e7b14c4","metric":28.161741370596445,"metrics":{},"status":"discard","description":"Retested a parity-correct boundary-snapshot server path that does a native-MLX fresh linear-SSM refresh at completion token 168, then hands off to plain greedy at token 172. It preserved exact benchmark-prompt parity and materially improved over the full-refresh-all-the-way variant, but three real-server runs still stayed below the kept ~28.36 tok/s baseline (28.26, 28.13, 28.16 tok/s), so this late-greedy fallback is a near-miss, not a reproducible win.","timestamp":1776036070836,"segment":4,"confidence":69.88055057185946,"iterationTokens":1368}
{"run":147,"commit":"e7b14c4","metric":27.805384034662374,"metrics":{},"status":"discard","description":"Ported a cheaper parity-correct boundary-snapshot server path that refreshes exact linear SSM state from a text-model-only fresh prefix rebuild (embed + transformer stack only), then hands off to greedy at completion token 172. Real benchmark-prompt parity held, but throughput was still only 27.81 tok/s, below the kept ~28.36 tok/s baseline.","timestamp":1776037353844,"segment":4,"confidence":69.56625708232431,"iterationTokens":23956}
{"run":148,"commit":"e7b14c4","metric":27.78236295286357,"metrics":{},"status":"discard","description":"Tested a parity-correct boundary-snapshot server path that refreshes exact late linear SSM state from a text-model rebuild with fresh attention-cache writes disabled (only linear caches materialized), then hands off to greedy at completion token 170. Exact benchmark-prompt parity held, but throughput was still only 27.78 tok/s, below the kept ~28.36 tok/s baseline.","timestamp":1776037723059,"segment":4,"confidence":69.25477805584225,"iterationTokens":13451}
{"run":149,"commit":"6d46c12","metric":28.43515799585408,"metrics":{},"status":"keep","description":"Restore DFlash benchmark flag; add env-gated boundary snapshot path with late sparse exact refresh. New candidate uses boundary restore + two late native-text linear-only reanchors at completion tokens 168 and 170, refreshing only linear layer 6 before handoff to greedy at 170. Server reruns stayed above the kept ~28.36 baseline (28.47, 28.40, 28.40, 28.44 tok/s), so keep as a small but consistent win.","timestamp":1776063062538,"segment":4,"confidence":69.86018270105026,"iterationTokens":582}
{"run":150,"commit":"6d46c12","metric":25.640473703243163,"metrics":{},"status":"discard","description":"Candidate env-only variant: boundary snapshot path with a single late native-text linear-only reanchor at 168 refreshing only layer 6, no greedy handoff. Parity path stayed correct in the probe but full server throughput dropped to 25.64 tok/s, well below the kept dual-reanchor+cutoff variant and below baseline.","timestamp":1776063496540,"segment":4,"confidence":69.37053658548786,"iterationTokens":2965}
{"run":151,"commit":"6d46c12","metric":27.659265260167654,"metrics":{},"status":"discard","description":"Candidate env-only variant: boundary snapshot path with two late linear-only reanchors at 168 and 170, refreshing layers 1 and 18 before greedy handoff at 170. Probe parity held, but full server throughput only reached 27.66 tok/s, below the kept single-layer-6 dual-reanchor variant and below stock baseline.","timestamp":1776063531144,"segment":4,"confidence":68.66435512371517,"iterationTokens":652}
{"run":152,"commit":"6d46c12","metric":28.297753865649987,"metrics":{},"status":"discard","description":"Candidate env-only variant: kept boundary snapshot schedule (reanchor 168 and 170, layer 6 only, greedy handoff at 170) but stop the fresh native-text rebuild at the highest refreshed layer instead of running the full text stack. This reduced throughput to 28.30 tok/s, so the shorter rebuild path is not a win in the real server path.","timestamp":1776063555766,"segment":4,"confidence":69.37053658548786,"iterationTokens":590}
{"run":153,"commit":"6d46c12","metric":28.4188628608231,"metrics":{},"status":"discard","description":"Candidate env-only variant: move the first sparse exact refresh one token earlier (reanchors at 167 and 170 instead of 168 and 170) while keeping the single-layer-6 boundary snapshot schedule and greedy handoff at 170. Three server reruns clustered at 28.46, 28.45, and 28.42 tok/s—effectively tied with the kept 168/170 schedule, so discard as no material gain.","timestamp":1776063628799,"segment":4,"confidence":69.62821142555761,"iterationTokens":395}
{"run":154,"commit":"6d46c12","metric":28.39408044438221,"metrics":{},"status":"discard","description":"Candidate env-only variant: delay the first sparse exact refresh to 169 while keeping the second refresh and greedy handoff at 170 on the single-layer-6 boundary snapshot path. Full server throughput was 28.39 tok/s, effectively tied to or slightly worse than the kept 168/170 schedule, so discard.","timestamp":1776063654228,"segment":4,"confidence":69.88780765396314,"iterationTokens":722}
{"run":155,"commit":"6d46c12","metric":25.58217380916372,"metrics":{},"status":"discard","description":"Candidate env-only variant: boundary snapshot path with dual reanchors at 168 and 170, refreshing layers 2 and 4 before greedy handoff at 170. This looked slightly better than the single-layer-6 schedule in the standalone probe, but full server throughput collapsed to 25.58 tok/s, so discard.","timestamp":1776064792554,"segment":4,"confidence":69.21481387017504,"iterationTokens":5316}
{"run":156,"commit":"6d46c12","metric":28.391145982735704,"metrics":{},"status":"discard","description":"Env-gated bridge micro-opt: prefer numpy conversion instead of DLPack for small integer MLX->torch token-id tensors on the kept boundary snapshot schedule (layer 6, reanchors 168/170, greedy cutoff 170). Full server throughput was 28.39 tok/s, slightly below the kept path, so discard.","timestamp":1776064863210,"segment":4,"confidence":68.55465782699612,"iterationTokens":2452}
{"run":157,"commit":"7a66d9a","metric":28.37796564196898,"metrics":{},"status":"keep","description":"Fix the env-gated Qwen3.5 boundary-capture patch to match the real mlx-lm GatedDeltaNet forward (`self.norm(out, z)` / `out_proj`) instead of the earlier incorrect output-path assumption. Verified exact-match parity against stock on the benchmark prompt with the kept boundary schedule (layer 6, reanchors 168/170, greedy handoff 170). Server reruns after the fix still stayed above the kept ~28.36 baseline (28.40 and 28.38 tok/s), so keep the corrected patch.","timestamp":1776065080278,"segment":4,"confidence":67.25919472982966,"iterationTokens":361}
{"type":"config","name":"oMLX bstnxbt-style DFlash long-decode bringup (1024-token exact workload)","metricName":"completion_tok_s","metricUnit":"","bestDirection":"higher"}
{"run":158,"commit":"1dcb678","metric":28.199218427794776,"metrics":{},"status":"keep","description":"Port the first bstnxbt-style MLX DFlash path into oMLX serving: add a new `bstnxbt_mlx` backend, recurrent rollback cache with innovation-tape replay semantics, exact-small-projection padding hooks, direct MLX target forward/capture/verify, and oMLX runtime dispatch behind `DFLASH_BSTNXBT_RUNTIME=1`. Verified exact-match server output against stock on the benchmark prompt at 64, 256, and 1024 completion tokens. On the 1024-token workload this new path reaches 28.20 tok/s, beating the manual stock comparator for the same workload (~26.30 tok/s) while serving through normal oMLX.","timestamp":1776094366093,"segment":5,"confidence":null,"iterationTokens":208}
{"run":159,"commit":"1dcb678","metric":27.928005615503725,"metrics":{},"status":"discard","description":"Tried porting bstnxbt's draft-side ContextOnlyDraftKVCache / sink+window behavior into the oMLX native drafter on top of the kept bstnxbt-style backend. Exactness was preserved, but real 1024-token server throughput dropped to 27.93 tok/s versus the kept 28.20+ band, so this draft-cache port is not a win in this tree and should stay out.","timestamp":1776095044082,"segment":5,"confidence":null,"iterationTokens":6736}
{"type":"config","name":"oMLX Qwen3.5-9B official long-decode DFlash bringup","metricName":"completion_tok_s","metricUnit":"","bestDirection":"higher"}
{"run":160,"commit":"436535c","metric":28.336557167731716,"metrics":{},"status":"keep","description":"Baseline for the new official Qwen3.5-9B oMLX bringup target: restore missing config/tokenizer metadata into `mlx_models/Qwen3.5-9B-bf16/` so oMLX can discover the model, then measure plain stock generation on the 1024-token warmed long-decode workload. This establishes the non-DFlash comparator at 28.34 tok/s before testing the new bstnxbt-style backend on the same official target.","timestamp":1776095218972,"segment":6,"confidence":null,"iterationTokens":282}
{"run":161,"commit":"436535c","metric":26.655953293347586,"metrics":{},"status":"discard","description":"Test the new bstnxbt-style oMLX backend on the official `mlx_models/Qwen3.5-9B-bf16` target for the same 1024-token warmed workload. Restored model metadata allowed oMLX discovery and the DFlash path matched stock output exactly through 1024 tokens, but throughput was only 26.66 tok/s versus the official-target stock baseline of 28.34 tok/s. Discard as a correctness-preserving but slower cross-target transfer; the remaining missing wins are still target-side/runtime details, not basic bringup.","timestamp":1776095404509,"segment":6,"confidence":null,"iterationTokens":763}
{"run":162,"commit":"436535c","metric":28.080395538702934,"metrics":{},"status":"discard","description":"Port the rollback path onto the dedicated bstnxbt-style tape-replay-kernel module and re-test the official `mlx_models/Qwen3.5-9B-bf16` target on the 1024-token workload. Exact output vs stock was preserved and throughput recovered sharply from the earlier 26.66 tok/s cross-target run to 28.08 tok/s, but that is still below the stock baseline of 28.34 tok/s, so discard for now while keeping the learning that target-side tape-replay details materially matter on official Qwen3.5.","timestamp":1776095708021,"segment":6,"confidence":null,"iterationTokens":6959}
{"run":163,"commit":"436535c","metric":27.717307883373408,"metrics":{},"status":"discard","description":"Try the next bstnxbt-style target-side port on the official `mlx_models/Qwen3.5-9B-bf16` workload: keep the dedicated tape-replay-kernel module and add the long-context full-attention split verify hook for cached prefixes >=1024. Exactness was preserved, but throughput regressed to 27.72 tok/s from the earlier tape-replay-only 28.08 tok/s and remained below the 28.34 tok/s stock baseline, so discard this naive split-verify port.","timestamp":1776095969276,"segment":6,"confidence":null,"iterationTokens":10557}
{"run":164,"commit":"436535c","metric":27.888740091049563,"metrics":{},"status":"discard","description":"Try a targeted bstnxbt-style target optimization on the official `mlx_models/Qwen3.5-9B-bf16` path: pack Qwen3Next MLP gate/up projections into a single linear while leaving attention unpacked. Exactness vs stock was preserved, but throughput only reached 27.89 tok/s on the 1024-token workload, still below the 28.34 tok/s stock baseline and below the earlier tape-replay-only 28.08 tok/s result, so discard.","timestamp":1776096282609,"segment":6,"confidence":null,"iterationTokens":21879}
{"run":165,"commit":"436535c","metric":28.112079975461388,"metrics":{},"status":"discard","description":"Trim a few explicit sync points in the bstnxbt-style official-target path by evaluating greedy sampled IDs together with the already-needed context tensors instead of forcing separate `mx.eval()` boundaries on logits first. This improved the official Qwen3.5-9B 1024-token run slightly to 28.11 tok/s from the earlier 28.08 tok/s tape-replay-only shape, but it still does not beat the 28.34 tok/s stock baseline, so discard.","timestamp":1776096421493,"segment":6,"confidence":null,"iterationTokens":4545}
{"run":166,"commit":"436535c","metric":21.50256674672322,"metrics":{},"status":"discard","description":"Try a more aggressive bstnxbt-style sync-reduction variant on the official Qwen3.5-9B path: evaluate sampled IDs together with context tensors and add `mx.async_eval(draft_logits)` before greedy draft token extraction. First run looked promising at 28.27 tok/s, but confirmation runs collapsed to 27.44 and then 21.50 tok/s, so this async-overlap shape is too unstable to trust and is discarded.","timestamp":1776096722051,"segment":6,"confidence":null,"iterationTokens":334}
{"type":"config","name":"bstnxbt dflash-mlx reference validation on local Qwen3.5-9B","metricName":"generation_tok_s","metricUnit":"","bestDirection":"higher"}
{"run":167,"commit":"436535c","metric":0,"metrics":{},"status":"crash","description":"Attempted to time the external `bstnxbt/dflash-mlx` benchmark with `run_experiment`, but the autoresearch harness correctly rejected the custom command because this repo contains `autoresearch.sh`. No model benchmark ran; switching to plain bash for external-repo validation instead.","timestamp":1776097459952,"segment":7,"confidence":null,"iterationTokens":3426}
{"type":"config","name":"oMLX Qwen3.5-9B official long-decode DFlash parity port","metricName":"completion_tok_s","metricUnit":"","bestDirection":"higher"}
{"run":168,"commit":"d591b0a","metric":28.317477625663344,"metrics":{},"status":"keep","description":"Re-anchor the official `mlx_models/Qwen3.5-9B-bf16` oMLX DFlash port target at current HEAD before further bstnxbt parity work. The in-tree `DFLASH_BSTNXBT_RUNTIME=1` path now measures 28.32 tok/s on the 1024-token workload, essentially back at the prior near-baseline band and close to the 28.34 stock comparator.","timestamp":1776097745441,"segment":8,"confidence":null,"iterationTokens":166}
{"run":169,"commit":"d591b0a","metric":27.616773359293674,"metrics":{},"status":"discard","description":"Restore the dedicated bstnxbt kernel layer into the in-tree official Qwen3.5-9B path: add `omlx/dflash/bstnxbt_kernels.py`, wire `make_target_cache()` to `tape_replay_kernel`, and use `gated_delta_kernel_with_tape` in `_forward_linear_with_tape()` when speculative tape recording is armed. Exact output parity vs stock still held, but the official 1024-token oMLX workload regressed to 27.62 tok/s from the new 28.32 tok/s baseline, so the missing gap is not solved by the kernel drop-in alone.","timestamp":1776098082181,"segment":8,"confidence":null,"iterationTokens":14522}
{"run":170,"commit":"d591b0a","metric":27.95142339182639,"metrics":{},"status":"discard","description":"Port the external bstnxbt delegation shape into the in-tree official Qwen3.5-9B path: install a speculative `linear_attn.__call__` hook and let `target_forward_with_hidden_states()` use the normal layer forward instead of reimplementing whole linear layers in Python. The first run nearly tied stock at 28.34 tok/s, but the confirmation run fell to 27.95 tok/s, so this is a structurally better match to the reference runtime but not a reliable throughput win yet.","timestamp":1776098336629,"segment":8,"confidence":null,"iterationTokens":385}
{"run":171,"commit":"d591b0a","metric":27.71981958198719,"metrics":{},"status":"discard","description":"Port the actual bstnxbt long-context full-attention verify path back into oMLX: add `batched_sdpa_2pass_exact`, install the split-full-attention hook on target full-attention layers, and enable it behind `DFLASH_BSTNXBT_SPLIT_SDPA=1`. The first official Qwen3.5-9B run looked promising at 28.60 tok/s and exact-match parity held, but the confirmation run dropped to 27.72 tok/s, below the 28.32 baseline, so discard as non-reproducible on the oMLX server path.","timestamp":1776098772178,"segment":8,"confidence":null,"iterationTokens":379}
{"run":172,"commit":"b081691","metric":28.772317119175902,"metrics":{},"status":"keep","description":"Port the combined external bstnxbt target-runtime shape into oMLX for the official Qwen3.5-9B path: install speculative `linear_attn.__call__` hooks for recurrent rollback, let the normal Qwen3.5 layers run instead of reimplementing full linear layers in Python, and enable the actual long-context full-attention split path with `batched_sdpa_2pass_exact` behind `DFLASH_BSTNXBT_SPLIT_SDPA=1`. Exact-match parity vs stock held on the benchmark prompt, and the official 1024-token oMLX workload improved to 28.77 tok/s from the 28.32 baseline.","timestamp":1776099138815,"segment":8,"confidence":1.359149706546331,"iterationTokens":15854}
