{"run":2102,"commit":"a0f1200","metric":12.377801881055348,"metrics":{},"status":"discard","description":"Another watchdog-idle inflation sample (~78.00 tok/s, eval_s ~12.38) with stable acceptance.","timestamp":1776395249221,"segment":24,"confidence":0.03334023679697215,"iterationTokens":1451,"asi":{"hypothesis":"System remains in shared non-spike inflation pocket without safe-mode activity.","rollback_reason":"Primary metric above best floor.","next_action_hint":"Continue unchanged loop; no parity run needed absent new transition edge.","diagnostic_findings":{"completion_tok_s":77.99671505285586,"dflash_eval_s":12.377801881055348,"safe_mode_active":0,"spike_events":0}}}
{"run":2103,"commit":"a0f1200","metric":12.48137091472745,"metrics":{},"status":"discard","description":"Inflation plateau persisted (~77.29 tok/s, eval_s ~12.48) with no collapse spikes and safe mode off.","timestamp":1776395278944,"segment":24,"confidence":0.03320833322282354,"iterationTokens":1443,"asi":{"hypothesis":"Current regime remains a stable non-spike slowdown shelf.","rollback_reason":"Primary metric above best floor.","next_action_hint":"Continue unchanged loop and look for either sub-10 climb or renewed spike onset.","diagnostic_findings":{"completion_tok_s":77.28890886578414,"dflash_eval_s":12.48137091472745,"safe_mode_active":0,"spike_events":0}}}
{"run":2104,"commit":"a0f1200","metric":12.666503455257043,"metrics":{},"status":"discard","description":"Non-spike shelf slightly worsened (~76.27 tok/s, eval_s ~12.67), watchdog remained idle.","timestamp":1776395306512,"segment":24,"confidence":0.03307746923279952,"iterationTokens":1427,"asi":{"hypothesis":"Regime is still stuck in broad inflation without collapse-trigger signatures.","rollback_reason":"Primary metric above best floor.","next_action_hint":"Continue unchanged loop.","diagnostic_findings":{"completion_tok_s":76.26515958557259,"dflash_eval_s":12.666503455257043,"safe_mode_active":0,"spike_events":0}}}
{"run":2105,"commit":"a0f1200","metric":12.38413399970159,"metrics":{},"status":"discard","description":"Repeated watchdog-idle plateau sample (~78.00 tok/s, eval_s ~12.38) confirmed persistent inflation pocket.","timestamp":1776395335981,"segment":24,"confidence":0.03233761870217763,"iterationTokens":1411,"asi":{"hypothesis":"System is currently parked in a stable non-spike degraded regime.","rollback_reason":"Primary metric above best floor.","next_action_hint":"Continue unchanged loop until a genuine transition edge appears.","diagnostic_findings":{"completion_tok_s":77.99800325836448,"dflash_eval_s":12.38413399970159,"safe_mode_active":0,"spike_events":0}}}
{"run":2106,"commit":"a0f1200","metric":11.941618201090023,"metrics":{},"status":"discard","description":"Inflation shelf persisted (~80.72 tok/s, eval_s ~11.94) with watchdog idle and zero spike events.","timestamp":1776395388519,"segment":24,"confidence":0.031924584196146015,"iterationTokens":2563,"asi":{"hypothesis":"Current non-spike slowdown pocket continues with stable speculative quality.","rollback_reason":"Primary metric above best floor.","next_action_hint":"Continue unchanged loop.","diagnostic_findings":{"completion_tok_s":80.72344631336838,"dflash_eval_s":11.941618201090023,"safe_mode_active":0,"spike_events":0}}}
{"run":2107,"commit":"a0f1200","metric":12.010729130008258,"metrics":{},"status":"discard","description":"Another stable non-spike inflation sample (~80.01 tok/s, eval_s ~12.01), watchdog idle.","timestamp":1776395418269,"segment":24,"confidence":0.03193229260131727,"iterationTokens":1408,"asi":{"hypothesis":"No transition yet; regime remains broad slowdown without collapse signatures.","rollback_reason":"Primary metric above best floor.","next_action_hint":"Continue unchanged loop and defer interventions until a clear edge appears.","diagnostic_findings":{"completion_tok_s":80.0139954172931,"dflash_eval_s":12.010729130008258,"safe_mode_active":0,"spike_events":0}}}
{"run":2108,"commit":"a0f1200","metric":11.736823372310027,"metrics":{},"status":"discard","description":"Upper edge of the same watchdog-idle inflation pocket (~82.03 tok/s, eval_s ~11.74), still no spikes.","timestamp":1776395446433,"segment":24,"confidence":0.031940004729879914,"iterationTokens":1434,"asi":{"hypothesis":"Recovery remains constrained to non-spike inflation and has not reached high-soft.","rollback_reason":"Primary metric above best floor.","next_action_hint":"Continue unchanged loop; parity remains unnecessary until a fresh collapse edge.","diagnostic_findings":{"completion_tok_s":82.0292698256208,"dflash_eval_s":11.736823372310027,"safe_mode_active":0,"spike_events":0}}}
{"run":2109,"commit":"a0f1200","metric":12.571198161924258,"metrics":{},"status":"discard","description":"Inflation shelf dipped again (~76.60 tok/s, eval_s ~12.57) with watchdog idle and no spikes.","timestamp":1776395475098,"segment":24,"confidence":0.031890339379881324,"iterationTokens":1448,"asi":{"hypothesis":"Wave remains in prolonged non-spike broad slowdown mode.","rollback_reason":"Primary metric above best floor.","next_action_hint":"Continue unchanged loop and hold parity checks for new hard transitions only.","diagnostic_findings":{"completion_tok_s":76.60323119678309,"dflash_eval_s":12.571198161924258,"safe_mode_active":0,"spike_events":0}}}
{"run":2110,"commit":"a0f1200","metric":11.79284645570442,"metrics":{},"status":"discard","description":"Another upper-shelf non-spike run (~81.55 tok/s, eval_s ~11.79) with watchdog idle.","timestamp":1776395512696,"segment":24,"confidence":0.03191443595006872,"iterationTokens":1903,"asi":{"hypothesis":"Persistent inflation mode continues with stable acceptance and no collapse triggers.","rollback_reason":"Primary metric above best floor.","next_action_hint":"Continue unchanged loop.","diagnostic_findings":{"completion_tok_s":81.54763528277029,"dflash_eval_s":11.79284645570442,"safe_mode_active":0,"spike_events":0}}}
{"run":2111,"commit":"a0f1200","metric":11.240288249100558,"metrics":{},"status":"discard","description":"Best sample of current inflation shelf (~85.57 tok/s, eval_s ~11.24) but still far from high-soft floor.","timestamp":1776395555174,"segment":24,"confidence":0.03187050503856811,"iterationTokens":1996,"asi":{"hypothesis":"Non-spike recovery can tighten substantially without exiting the inflated regime.","rollback_reason":"Primary metric still above best floor.","next_action_hint":"Continue unchanged loop for sub-10 transition.","diagnostic_findings":{"completion_tok_s":85.56838195602711,"dflash_eval_s":11.240288249100558,"safe_mode_active":0,"spike_events":0}}}
{"run":2112,"commit":"a0f1200","metric":11.015572088304907,"metrics":{},"status":"discard","description":"Recovery improved to the best non-spike sample in this shelf (~87.11 tok/s, eval_s ~11.02), watchdog idle.","timestamp":1776395592291,"segment":24,"confidence":0.031791147991950645,"iterationTokens":1728,"asi":{"hypothesis":"Inflation shelf is tightening toward rebound without collapse triggers.","rollback_reason":"Primary metric still above best floor.","next_action_hint":"Continue unchanged loop for sub-10/high-soft re-entry.","diagnostic_findings":{"completion_tok_s":87.10975006783927,"dflash_eval_s":11.015572088304907,"safe_mode_active":0,"spike_events":0}}}
{"run":2113,"commit":"a0f1200","metric":11.186962378793396,"metrics":{},"status":"discard","description":"High end of non-spike recovery shelf (~85.83 tok/s, eval_s ~11.19), still above floor.","timestamp":1776395626004,"segment":24,"confidence":0.03146651858505056,"iterationTokens":1711,"asi":{"hypothesis":"Rebound is advancing within inflation mode but not yet crossing to high-soft.","rollback_reason":"Primary metric above best floor.","next_action_hint":"Continue unchanged loop and monitor for sub-10 transition edge.","diagnostic_findings":{"completion_tok_s":85.82778991361067,"dflash_eval_s":11.186962378793396,"safe_mode_active":0,"spike_events":0}}}
{"run":2114,"commit":"a0f1200","metric":10.742123581818305,"metrics":{},"status":"discard","description":"Strongest rebound of this shelf so far (~89.30 tok/s, eval_s ~10.74) with watchdog still idle.","timestamp":1776395662627,"segment":24,"confidence":0.03110672410661248,"iterationTokens":1716,"asi":{"hypothesis":"Non-spike recovery is tightening toward sub-10 re-entry while acceptance remains fixed.","rollback_reason":"Primary metric still above best floor.","next_action_hint":"Continue unchanged loop for transition into high-soft band.","diagnostic_findings":{"completion_tok_s":89.2993879818377,"dflash_eval_s":10.742123581818305,"safe_mode_active":0,"spike_events":0}}}
{"run":2115,"commit":"a0f1200","metric":10.51317353756167,"metrics":{},"status":"discard","description":"Further rebound in watchdog-idle mode (~90.98 tok/s, eval_s ~10.51), still above floor.","timestamp":1776395703221,"segment":24,"confidence":0.03148881325347901,"iterationTokens":1727,"asi":{"hypothesis":"Non-spike inflation regime is recovering toward sub-10 without any spike-trigger behavior.","rollback_reason":"Primary metric still above best floor.","next_action_hint":"Continue unchanged loop; reassess only after sub-10/high-soft transition.","diagnostic_findings":{"completion_tok_s":90.98109337374268,"dflash_eval_s":10.51317353756167,"safe_mode_active":0,"spike_events":0}}}
{"run":2116,"commit":"a0f1200","metric":10.253740708576515,"metrics":{},"status":"discard","description":"Best rebound in this non-spike wave so far (~93.21 tok/s, eval_s ~10.25) with watchdog idle.","timestamp":1776395741297,"segment":24,"confidence":0.03184768316279069,"iterationTokens":1722,"asi":{"hypothesis":"Recovery is approaching high-soft re-entry while remaining in zero-spike mode.","rollback_reason":"Primary metric still above best floor.","next_action_hint":"Continue unchanged loop; parity remains unnecessary without a fresh collapse edge.","diagnostic_findings":{"completion_tok_s":93.20994984773957,"dflash_eval_s":10.253740708576515,"safe_mode_active":0,"spike_events":0}}}
{"run":2117,"commit":"a0f1200","metric":10.23403736925684,"metrics":{},"status":"discard","description":"Near-repeat best of the current rebound shelf (~93.34 tok/s, eval_s ~10.23), watchdog idle and spike-free.","timestamp":1776395777177,"segment":24,"confidence":0.03196227495550666,"iterationTokens":1732,"asi":{"hypothesis":"Current non-spike rebound is still tightening but remains above the established floor.","rollback_reason":"Primary metric above best floor.","next_action_hint":"Continue unchanged loop for sub-10 transition or fresh collapse edge.","diagnostic_findings":{"completion_tok_s":93.34355189926936,"dflash_eval_s":10.23403736925684,"safe_mode_active":0,"spike_events":0}}}
{"run":2118,"commit":"a0f1200","metric":10.010349121293984,"metrics":{},"status":"discard","description":"Rebound reached near-sub10 non-spike sample (~95.40 tok/s, eval_s ~10.01) with watchdog idle.","timestamp":1776395817268,"segment":24,"confidence":0.03205885085504353,"iterationTokens":1730,"asi":{"hypothesis":"Current inflation wave is approaching high-soft boundary without spike-safe-mode involvement.","rollback_reason":"Primary metric remains above best floor.","next_action_hint":"Continue unchanged loop for potential sub-10 crossover.","diagnostic_findings":{"completion_tok_s":95.40380189035278,"dflash_eval_s":10.010349121293984,"safe_mode_active":0,"spike_events":0}}}
{"run":2119,"commit":"a0f1200","metric":10.536233786027879,"metrics":{},"status":"discard","description":"Follow-up stayed in the same non-spike rebound shelf (~90.50 tok/s, eval_s ~10.54), watchdog idle.","timestamp":1776395860540,"segment":24,"confidence":0.032064967814718695,"iterationTokens":1713,"asi":{"hypothesis":"Current regime is still a broad recovery shelf without spike-driven transitions.","rollback_reason":"Primary metric above best floor.","next_action_hint":"Continue unchanged loop for sub-10/high-soft re-entry.","diagnostic_findings":{"completion_tok_s":90.50296847985295,"dflash_eval_s":10.536233786027879,"safe_mode_active":0,"spike_events":0}}}
{"run":2120,"commit":"a0f1200","metric":9.710503710550256,"metrics":{},"status":"discard","description":"Rebound crossed below 10s into high-soft edge (~98.24 tok/s, eval_s ~9.71) with watchdog idle and no spikes.","timestamp":1776395893092,"segment":24,"confidence":0.03208465165273683,"iterationTokens":1707,"asi":{"hypothesis":"The prolonged non-spike inflation shelf has transitioned into stronger recovery near high-soft.","rollback_reason":"Primary metric still above established best floor.","next_action_hint":"Continue unchanged loop to test whether recovery extends toward ~8.8 floor or re-collapses.","diagnostic_findings":{"completion_tok_s":98.24392619987177,"dflash_eval_s":9.710503710550256,"safe_mode_active":0,"spike_events":0}}}
{"run":2121,"commit":"a0f1200","metric":9.752700788434595,"metrics":{},"status":"discard","description":"Follow-up held high-soft edge (~97.83 tok/s, eval_s ~9.75) with watchdog idle and spike-free telemetry.","timestamp":1776395933624,"segment":24,"confidence":0.03211570554547369,"iterationTokens":1786,"asi":{"hypothesis":"Recovery is now in sub-10 territory but still above the best floor.","rollback_reason":"Primary metric above best floor.","next_action_hint":"Continue unchanged loop for possible return to ~8.8 band.","diagnostic_findings":{"completion_tok_s":97.82847300977302,"dflash_eval_s":9.752700788434595,"safe_mode_active":0,"spike_events":0}}}
{"run":2122,"commit":"a0f1200","metric":9.897106663673185,"metrics":{},"status":"discard","description":"High-soft follow-up drifted slightly upward (~96.21 tok/s, eval_s ~9.90), still watchdog idle.","timestamp":1776395969135,"segment":24,"confidence":0.03213340704961435,"iterationTokens":1750,"asi":{"hypothesis":"Recovery has reached sub-10 plateau but has not returned to best-band latency.","rollback_reason":"Primary metric above best floor.","next_action_hint":"Continue unchanged loop for potential 8.8-band re-entry.","diagnostic_findings":{"completion_tok_s":96.20701118783604,"dflash_eval_s":9.897106663673185,"safe_mode_active":0,"spike_events":0}}}
{"run":2123,"commit":"a0f1200","metric":10.062390085542575,"metrics":{},"status":"discard","description":"Sub-10 plateau softened slightly (~94.59 tok/s, eval_s ~10.06) while watchdog remained idle.","timestamp":1776396004330,"segment":24,"confidence":0.03215446490739623,"iterationTokens":1770,"asi":{"hypothesis":"Recovery is hovering near the high-soft threshold but not yet back to best-band latency.","rollback_reason":"Primary metric above best floor.","next_action_hint":"Continue unchanged loop and monitor for 8.8-band re-entry versus relapse.","diagnostic_findings":{"completion_tok_s":94.5878168238947,"dflash_eval_s":10.062390085542575,"safe_mode_active":0,"spike_events":0}}}
{"run":2124,"commit":"a0f1200","metric":9.526737291598693,"metrics":{},"status":"discard","description":"High-soft sample improved to ~9.53 eval_s (~95.84 tok/s) with watchdog idle; timing mix shifted (draft/verify higher).","timestamp":1776396040393,"segment":24,"confidence":0.03220671065117646,"iterationTokens":1763,"asi":{"hypothesis":"Recovery advanced while phase timing redistributed within total runtime.","rollback_reason":"Primary metric remains above best floor.","next_action_hint":"Continue unchanged loop; watch whether phase-shift persists or reverts as eval_s approaches floor.","diagnostic_findings":{"completion_tok_s":95.83560786313215,"dflash_eval_s":9.526737291598693,"safe_mode_active":0,"spike_events":0,"dflash_draft_s":0.2973294119583443,"dflash_verify_s":0.35699725546874106}}}
{"run":2125,"commit":"a0f1200","metric":34.6698400011519,"metrics":{},"status":"discard","description":"Abrupt hard relapse from high-soft edge to extreme trough (~24.53 tok/s, eval_s ~34.67) with immediate safe mode at step 2.","timestamp":1776396111821,"segment":24,"confidence":0.03215446490739623,"iterationTokens":1882,"asi":{"hypothesis":"A fresh severe spike-collapse transition just reappeared after high-soft recovery.","rollback_reason":"Primary metric far above best floor.","next_action_hint":"Run one immediate control parity check on this new collapse edge, then return to mirror loop.","diagnostic_findings":{"completion_tok_s":24.530287490770842,"dflash_eval_s":34.6698400011519,"safe_mode_step":2,"severe_spike_events":106}}}
{"run":2126,"commit":"a0f1200","metric":26.75262312043924,"metrics":{},"status":"discard","description":"Immediate control parity on fresh collapse edge was also severely degraded (~30.04 tok/s, eval_s ~26.75) with safe mode at step 2.","timestamp":1776396169392,"segment":24,"confidence":0.03213340704961435,"iterationTokens":1513,"asi":{"hypothesis":"New hard collapse transition is shared across mirror/control rather than mirror-specific.","rollback_reason":"Parity run is diagnostic and remains far above best floor.","next_action_hint":"Return to unchanged mirror loop and track rebound ladder.","diagnostic_findings":{"lane":"control","completion_tok_s":30.035003832353315,"dflash_eval_s":26.75262312043924,"safe_mode_step":2,"severe_spike_events":46}}}
{"run":2127,"commit":"a0f1200","metric":20.749117871862836,"metrics":{},"status":"discard","description":"Post-parity mirror remained in severe trough (~38.86 tok/s, eval_s ~20.75) with early safe mode at step 5.","timestamp":1776396229091,"segment":24,"confidence":0.03211570554547369,"iterationTokens":4202,"asi":{"hypothesis":"Fresh shared collapse persists beyond the transition edge and remains spike-driven.","rollback_reason":"Primary metric far above best floor.","next_action_hint":"Continue unchanged mirror loop to track rebound ladder; parity already confirmed.","diagnostic_findings":{"completion_tok_s":38.86347118361911,"dflash_eval_s":20.749117871862836,"safe_mode_step":5,"severe_spike_events":27}}}
{"run":2128,"commit":"a0f1200","metric":18.00383070576936,"metrics":{},"status":"discard","description":"Severe trough persisted but improved slightly (~42.44 tok/s, eval_s ~18.00), safe mode still early at step 5.","timestamp":1776396289206,"segment":24,"confidence":0.03208465165273683,"iterationTokens":1895,"asi":{"hypothesis":"Fresh collapse is rebounding slowly but remains in safe-mode-managed severe band.","rollback_reason":"Primary metric far above best floor.","next_action_hint":"Continue unchanged mirror loop to map trough exit.","diagnostic_findings":{"completion_tok_s":42.444607607222814,"dflash_eval_s":18.00383070576936,"safe_mode_step":5,"severe_spike_events":19,"dflash_verify_s":0.9055099132237956}}}
{"run":2129,"commit":"a0f1200","metric":11.484230420435779,"metrics":{},"status":"discard","description":"Strong rebound out of severe trough (~78.65 tok/s, eval_s ~11.48) with safe mode now very late (step 79).","timestamp":1776396332535,"segment":24,"confidence":0.03209390393315909,"iterationTokens":1933,"asi":{"hypothesis":"Fresh collapse wave transitioned into late-safe-mode recovery band.","rollback_reason":"Primary metric above best floor.","next_action_hint":"Continue unchanged mirror loop for sub-10/high-soft re-entry.","diagnostic_findings":{"completion_tok_s":78.64923472444825,"dflash_eval_s":11.484230420435779,"safe_mode_step":79,"severe_spike_events":5}}}
{"run":2130,"commit":"a0f1200","metric":16.98967646236997,"metrics":{},"status":"discard","description":"Recovery relapsed back into severe collapse (~47.70 tok/s, eval_s ~16.99) with early safe mode at step 10.","timestamp":1776396381844,"segment":24,"confidence":0.032071087109121106,"iterationTokens":1932,"asi":{"hypothesis":"Current collapse wave remains oscillatory and can snap back from rebound into early-trigger troughs.","rollback_reason":"Primary metric far above best floor.","next_action_hint":"Continue unchanged mirror loop; parity already confirmed for this transition family.","diagnostic_findings":{"completion_tok_s":47.699655764882955,"dflash_eval_s":16.98967646236997,"safe_mode_step":10,"severe_spike_events":15}}}
{"run":2131,"commit":"a0f1200","metric":14.023274663370103,"metrics":{},"status":"discard","description":"Partial rebound from latest trough (~57.62 tok/s, eval_s ~14.02) but still in safe-mode collapse band (step 10).","timestamp":1776396432880,"segment":24,"confidence":0.03198428176627562,"iterationTokens":1941,"asi":{"hypothesis":"Current wave is climbing from deep trough yet remains in collapse-managed regime.","rollback_reason":"Primary metric above best floor.","next_action_hint":"Continue unchanged mirror loop for further rebound mapping.","diagnostic_findings":{"completion_tok_s":57.617933265478406,"dflash_eval_s":14.023274663370103,"safe_mode_step":10,"severe_spike_events":2}}}
{"run":2132,"commit":"a0f1200","metric":11.76215124456212,"metrics":{},"status":"discard","description":"Post-collapse rebound returned to watchdog-idle inflation (~81.90 tok/s, eval_s ~11.76) with no spikes.","timestamp":1776396512015,"segment":24,"confidence":0.031893392464371215,"iterationTokens":9708,"asi":{"hypothesis":"Current severe wave handed off into non-spike recovery shelf again.","rollback_reason":"Primary metric above best floor.","next_action_hint":"Continue unchanged mirror loop for sub-10 re-entry.","diagnostic_findings":{"completion_tok_s":81.89747382437938,"dflash_eval_s":11.76215124456212,"safe_mode_active":0,"spike_events":0}}}
