{"run":2517,"commit":"26f9501","metric":96.71067841747353,"metrics":{},"status":"discard","description":"Control stayed in high fused-only shelf (~96.7 tok/s, safe_mode=0) with eval ~9.87; stable rebound but still above floor gate.","timestamp":1776483226771,"segment":25,"confidence":3.3601797254078947,"iterationTokens":4082,"asi":{"hypothesis":"Current band is a persistent high shelf and not yet true floor re-entry.","rollback_reason":"No code changes; monitoring-only sample.","next_action_hint":"Continue passive control monitoring and wait for repeated ~8.8–9.0 eval before DDTree parity checks.","diagnostic_findings":{"completion_tok_s":96.71067841747353,"dflash_eval_s":9.873292258242145,"safe_mode_active":0,"verify_eval_wait_fused_steps":96,"verify_eval_wait_unfused_steps":0}}}
{"run":2518,"commit":"26f9501","metric":95.37717697551486,"metrics":{},"status":"discard","description":"Control remained fused-only/safe_mode=0 in the high shelf (~95.4 tok/s), with eval ~10.02 still above floor gate.","timestamp":1776483263685,"segment":25,"confidence":3.37001793610245,"iterationTokens":4245,"asi":{"hypothesis":"High-shelf behavior persists and has not yet transitioned to stable near-floor timing.","rollback_reason":"No code changes; monitoring-only sample.","next_action_hint":"Continue passive control tracking; only run DDTree parity once multiple runs show eval near ~8.8–9.0.","diagnostic_findings":{"completion_tok_s":95.37717697551486,"dflash_eval_s":10.021462422679178,"safe_mode_active":0,"verify_eval_wait_fused_steps":96,"verify_eval_wait_unfused_steps":0}}}
{"run":2519,"commit":"26f9501","metric":94.89213580087504,"metrics":{},"status":"discard","description":"Control remained in fused-only/safe_mode=0 high shelf (~94.9 tok/s) with eval ~10.08; still short of floor gate.","timestamp":1776483290996,"segment":25,"confidence":3.446524249554261,"iterationTokens":4104,"asi":{"hypothesis":"High shelf persists with minor oscillation; no robust floor re-entry yet.","rollback_reason":"No code changes; monitoring-only sample.","next_action_hint":"Continue passive controls and only reopen DDTree parity when eval repeatedly reaches ~8.8–9.0.","diagnostic_findings":{"completion_tok_s":94.89213580087504,"dflash_eval_s":10.078318750485778,"safe_mode_active":0,"verify_eval_wait_fused_steps":96,"verify_eval_wait_unfused_steps":0}}}
{"run":2520,"commit":"26f9501","metric":96.2677589906287,"metrics":{},"status":"discard","description":"Control stayed in fused-only/safe_mode=0 high shelf (~96.3 tok/s) with eval ~9.94; still above near-floor threshold.","timestamp":1776483335091,"segment":25,"confidence":3.462455033904281,"iterationTokens":4405,"asi":{"hypothesis":"The current recovery has plateaued in a high shelf that remains distinct from floor behavior.","rollback_reason":"No code changes; monitoring-only sample.","next_action_hint":"Maintain passive control monitoring and defer DDTree parity until eval repeatedly falls into ~8.8–9.0.","diagnostic_findings":{"completion_tok_s":96.2677589906287,"dflash_eval_s":9.938484871876426,"safe_mode_active":0,"verify_eval_wait_fused_steps":96,"verify_eval_wait_unfused_steps":0}}}
{"run":2521,"commit":"26f9501","metric":93.52763781573809,"metrics":{},"status":"discard","description":"Control dropped back to ~93.5 tok/s while staying fused-only/safe_mode=0; eval rose to ~10.21, keeping regime in non-floor shelf.","timestamp":1776483366801,"segment":25,"confidence":3.5663400835569177,"iterationTokens":4131,"asi":{"hypothesis":"Recent high samples are still shelf oscillations, not stable floor re-entry.","rollback_reason":"No code changes; monitoring-only sample.","next_action_hint":"Continue passive controls and hold DDTree parity until multiple near-floor eval readings (~8.8–9.0) are observed.","diagnostic_findings":{"completion_tok_s":93.52763781573809,"dflash_eval_s":10.211132167489268,"safe_mode_active":0,"verify_eval_wait_fused_steps":96,"verify_eval_wait_unfused_steps":0}}}
{"run":2522,"commit":"26f9501","metric":97.91717857413182,"metrics":{},"status":"discard","description":"Control returned to near-100 fused-only shelf (~97.9 tok/s, safe_mode=0) with eval ~9.76, still above strict near-floor gate.","timestamp":1776483427755,"segment":25,"confidence":3.6469041415928567,"iterationTokens":7316,"asi":{"hypothesis":"Shelf remains elevated and can touch high throughput without true floor timing.","rollback_reason":"No code changes; monitoring-only sample.","next_action_hint":"Continue confirmation controls and require repeated ~8.8–9.0 eval before DDTree parity/probe runs.","diagnostic_findings":{"completion_tok_s":97.91717857413182,"dflash_eval_s":9.75512574648019,"safe_mode_active":0,"verify_eval_wait_fused_steps":96,"verify_eval_wait_unfused_steps":0}}}
{"run":2523,"commit":"26f9501","metric":100.91778558633517,"metrics":{},"status":"discard","description":"Control hit a stronger rebound sample (~100.9 tok/s, fused-only/safe_mode=0) with eval ~9.45; improving, but still above strict near-floor gate.","timestamp":1776483474013,"segment":25,"confidence":3.6271928163732157,"iterationTokens":4793,"asi":{"hypothesis":"The recovery can briefly reach ~101 tok/s while remaining in a high-shelf regime above floor timing.","rollback_reason":"No code changes; monitoring-only sample.","next_action_hint":"Run immediate confirmation controls and only re-open DDTree parity if eval repeatedly contracts toward ~8.8–9.0.","diagnostic_findings":{"completion_tok_s":100.91778558633517,"dflash_eval_s":9.453306711511686,"safe_mode_active":0,"verify_eval_wait_fused_steps":96,"verify_eval_wait_unfused_steps":0}}}
{"run":2524,"commit":"26f9501","metric":101.01804078453821,"metrics":{},"status":"discard","description":"Second near-101 control sample confirmed fused-only/safe_mode=0 high shelf with eval ~9.44; still not at strict floor timing.","timestamp":1776483505607,"segment":25,"confidence":3.61944538885122,"iterationTokens":4416,"asi":{"hypothesis":"The system can sustain ~101 tok/s in this regime while eval remains materially above near-floor target.","rollback_reason":"No code changes; monitoring-only confirmation run.","next_action_hint":"Continue passive controls; keep DDTree parity gated until repeated eval near ~8.8–9.0 appears.","diagnostic_findings":{"completion_tok_s":101.01804078453821,"dflash_eval_s":9.436231746338308,"safe_mode_active":0,"verify_eval_wait_fused_steps":96,"verify_eval_wait_unfused_steps":0}}}
{"run":2525,"commit":"26f9501","metric":101.87405269952677,"metrics":{},"status":"discard","description":"Control produced a new high shelf sample (~101.9 tok/s, fused-only/safe_mode=0) with eval ~9.35, still above strict near-floor criterion.","timestamp":1776483535960,"segment":25,"confidence":3.6152003355913984,"iterationTokens":4399,"asi":{"hypothesis":"Recovery can push above 101 tok/s while remaining in a not-yet-floor regime.","rollback_reason":"No code changes; monitoring-only sample.","next_action_hint":"Take additional confirmation controls; only resume DDTree parity after repeated eval near ~8.8–9.0.","diagnostic_findings":{"completion_tok_s":101.87405269952677,"dflash_eval_s":9.349245415069163,"safe_mode_active":0,"verify_eval_wait_fused_steps":96,"verify_eval_wait_unfused_steps":0}}}
{"run":2526,"commit":"26f9501","metric":100.43748378687637,"metrics":{},"status":"discard","description":"Control remained in ~100 tok/s fused-only shelf (safe_mode=0) with eval ~9.47; still above strict near-floor target.","timestamp":1776483569771,"segment":25,"confidence":3.61873876305915,"iterationTokens":4228,"asi":{"hypothesis":"Current regime sustains high throughput but remains distinct from the historical ~8.8–9.0 floor.","rollback_reason":"No code changes; monitoring-only sample.","next_action_hint":"Continue passive controls and keep DDTree parity gated until repeated near-floor eval samples appear.","diagnostic_findings":{"completion_tok_s":100.43748378687637,"dflash_eval_s":9.473976787296124,"safe_mode_active":0,"verify_eval_wait_fused_steps":96,"verify_eval_wait_unfused_steps":0}}}
{"run":2527,"commit":"26f9501","metric":101.02070206578078,"metrics":{},"status":"discard","description":"Control again held ~101 tok/s fused-only/safe_mode=0 with eval ~9.42; strong rebound but still outside strict near-floor gate.","timestamp":1776483607584,"segment":25,"confidence":3.6037326644575325,"iterationTokens":4271,"asi":{"hypothesis":"This regime can stabilize around ~100 tok/s while remaining above the historical floor timing band.","rollback_reason":"No code changes; monitoring-only sample.","next_action_hint":"Continue passive controls and wait for repeated eval near ~8.8–9.0 before DDTree parity tests.","diagnostic_findings":{"completion_tok_s":101.02070206578078,"dflash_eval_s":9.419941080268472,"safe_mode_active":0,"verify_eval_wait_fused_steps":96,"verify_eval_wait_unfused_steps":0}}}
{"run":2528,"commit":"26f9501","metric":101.24645484466654,"metrics":{},"status":"discard","description":"Control maintained a ~101 tok/s fused-only/safe_mode=0 band with eval ~9.40, still above strict floor gate despite continued recovery.","timestamp":1776483650373,"segment":25,"confidence":3.585315995556868,"iterationTokens":4657,"asi":{"hypothesis":"The recovered regime is stabilizing near ~101 tok/s without fully returning to historical floor timing.","rollback_reason":"No code changes; monitoring-only sample.","next_action_hint":"Keep passive monitoring and only restart DDTree parity once eval repeatedly lands near ~8.8–9.0.","diagnostic_findings":{"completion_tok_s":101.24645484466654,"dflash_eval_s":9.401363585260697,"safe_mode_active":0,"verify_eval_wait_fused_steps":96,"verify_eval_wait_unfused_steps":0}}}
{"run":2529,"commit":"26f9501","metric":99.54437104660231,"metrics":{},"status":"discard","description":"Control stayed in the near-100 fused-only shelf (~99.5 tok/s, safe_mode=0) with eval ~9.57, still above strict floor band.","timestamp":1776483686089,"segment":25,"confidence":3.5978463412190558,"iterationTokens":4270,"asi":{"hypothesis":"Recovered high shelf remains stable but distinct from the ~8.8–9.0 floor regime required for DDTree attribution.","rollback_reason":"No code changes; monitoring-only sample.","next_action_hint":"Continue passive control monitoring and keep DDTree probes paused until repeated near-floor eval appears.","diagnostic_findings":{"completion_tok_s":99.54437104660231,"dflash_eval_s":9.568525453330949,"safe_mode_active":0,"verify_eval_wait_fused_steps":96,"verify_eval_wait_unfused_steps":0}}}
{"run":2530,"commit":"26f9501","metric":98.88617654537553,"metrics":{},"status":"discard","description":"Control remained in fused-only/safe_mode=0 upper shelf (~98.9 tok/s) with eval ~9.64, still above strict floor gate for DDTree attribution.","timestamp":1776483715628,"segment":25,"confidence":3.610464578838836,"iterationTokens":4344,"asi":{"hypothesis":"Post-collapse recovery is robust but still not at true floor timing.","rollback_reason":"No code changes; monitoring-only sample.","next_action_hint":"Continue passive monitoring and require repeated ~8.8–9.0 eval before DDTree parity probes.","diagnostic_findings":{"completion_tok_s":98.88617654537553,"dflash_eval_s":9.637955378508195,"safe_mode_active":0,"verify_eval_wait_fused_steps":96,"verify_eval_wait_unfused_steps":0}}}
{"run":2531,"commit":"26f9501","metric":100.77051515425514,"metrics":{},"status":"discard","description":"Control stayed in ~100 tok/s fused-only shelf (safe_mode=0) with eval ~9.46; robust rebound but still not near-floor by strict gate.","timestamp":1776483748042,"segment":25,"confidence":3.619687341184922,"iterationTokens":4346,"asi":{"hypothesis":"Recovered shelf can remain stable around ~100 tok/s while eval stays above floor target.","rollback_reason":"No code changes; monitoring-only sample.","next_action_hint":"Continue passive controls; only trigger DDTree parity after repeated ~8.8–9.0 eval samples.","diagnostic_findings":{"completion_tok_s":100.77051515425514,"dflash_eval_s":9.455387294408865,"safe_mode_active":0,"verify_eval_wait_fused_steps":96,"verify_eval_wait_unfused_steps":0}}}
{"run":2532,"commit":"26f9501","metric":100.82493017156342,"metrics":{},"status":"discard","description":"Control sustained ~100.8 tok/s fused-only/safe_mode=0 with eval ~9.44; high and stable but still above strict floor threshold.","timestamp":1776483776994,"segment":25,"confidence":3.6198000634909944,"iterationTokens":4203,"asi":{"hypothesis":"Current regime is a steady high shelf, not full floor recovery, despite repeated ~100 tok/s samples.","rollback_reason":"No code changes; monitoring-only sample.","next_action_hint":"Continue passive controls and keep DDTree parity gated until eval repeatedly reaches ~8.8–9.0.","diagnostic_findings":{"completion_tok_s":100.82493017156342,"dflash_eval_s":9.44349671015516,"safe_mode_active":0,"verify_eval_wait_fused_steps":96,"verify_eval_wait_unfused_steps":0}}}
{"run":2533,"commit":"26f9501","metric":96.96713505420274,"metrics":{},"status":"discard","description":"Control dipped within fused-only high shelf (~97.0 tok/s, safe_mode=0) with eval ~9.84, still above floor gate.","timestamp":1776483809352,"segment":25,"confidence":3.65441723412081,"iterationTokens":4203,"asi":{"hypothesis":"Recent ~100 tok/s band remains shelf-like and can wobble by a few tok/s without floor re-entry.","rollback_reason":"No code changes; monitoring-only sample.","next_action_hint":"Continue passive controls and hold DDTree parity until repeated ~8.8–9.0 eval appears.","diagnostic_findings":{"completion_tok_s":96.96713505420274,"dflash_eval_s":9.835826213937253,"safe_mode_active":0,"verify_eval_wait_fused_steps":96,"verify_eval_wait_unfused_steps":0}}}
{"run":2534,"commit":"26f9501","metric":98.86012497601413,"metrics":{},"status":"discard","description":"Control remained fused-only/safe_mode=0 in the high shelf (~98.9 tok/s) with eval ~9.63, still above strict floor gate.","timestamp":1776483857062,"segment":25,"confidence":3.658088242416195,"iterationTokens":4790,"asi":{"hypothesis":"Near-100 performance can persist while eval remains elevated versus floor.","rollback_reason":"No code changes; monitoring-only sample.","next_action_hint":"Continue passive controls and keep DDTree parity paused until repeated ~8.8–9.0 eval is observed.","diagnostic_findings":{"completion_tok_s":98.86012497601413,"dflash_eval_s":9.634897044859827,"safe_mode_active":0,"verify_eval_wait_fused_steps":96,"verify_eval_wait_unfused_steps":0}}}
{"run":2535,"commit":"26f9501","metric":108.4043478924683,"metrics":{},"status":"discard","description":"Control re-entered near-floor fused-only regime (~108.4 tok/s, eval ~8.76, safe_mode=0); treat as first floor-confirmation sample before any DDTree A/B.","timestamp":1776483988727,"segment":25,"confidence":3.660746496671465,"iterationTokens":4790,"asi":{"hypothesis":"System may have returned to healthy floor timing after extended high-shelf regime.","rollback_reason":"No code changes; monitoring-only control sample.","next_action_hint":"Run additional immediate control confirmations; only open DDTree parity after repeated near-floor eval samples.","diagnostic_findings":{"completion_tok_s":108.4043478924683,"dflash_eval_s":8.762950951349922,"safe_mode_active":0,"verify_eval_wait_fused_steps":96,"verify_eval_wait_unfused_steps":0}}}
{"run":2536,"commit":"26f9501","metric":107.88320336068331,"metrics":{},"status":"discard","description":"Second consecutive control confirmed near-floor fused regime (~107.9 tok/s, eval ~8.78, safe_mode=0).","timestamp":1776484013658,"segment":25,"confidence":3.6518894317119126,"iterationTokens":4273,"asi":{"hypothesis":"Floor re-entry may now be sustained enough to reopen DDTree attribution sequence.","rollback_reason":"No code changes; control confirmation sample.","next_action_hint":"Run one more control confirmation, then execute DDTree baseline with required DFLASH_DDTREE_PATH guard.","diagnostic_findings":{"completion_tok_s":107.88320336068331,"dflash_eval_s":8.78271311800927,"safe_mode_active":0,"verify_eval_wait_fused_steps":96,"verify_eval_wait_unfused_steps":0}}}
{"run":2537,"commit":"26f9501","metric":108.16196118460233,"metrics":{},"status":"discard","description":"Third consecutive control sample stayed near-floor (108.2 tok/s, eval ~8.76, fused-only, safe_mode=0), satisfying the stability gate for DDTree attribution runs.","timestamp":1776484044008,"segment":25,"confidence":3.68704637512732,"iterationTokens":4081,"asi":{"hypothesis":"Near-floor regime is currently sustained long enough to run matched DDTree parity checks.","rollback_reason":"No code changes; control confirmation sample.","next_action_hint":"Run DDTree baseline with DFLASH_DDTREE_PATH=/tmp/ddtree-mlx and immediate no-DDTree control parity.","diagnostic_findings":{"completion_tok_s":108.16196118460233,"dflash_eval_s":8.763624121784233,"safe_mode_active":0,"verify_eval_wait_fused_steps":96,"verify_eval_wait_unfused_steps":0}}}
{"run":2538,"commit":"26f9501","metric":102.96753991497472,"metrics":{},"status":"discard","description":"DDTree baseline (native runtime, budget13, unnormalized top-k, guarded path) underperformed floor control at ~103.0 tok/s with elevated eval ~9.94.","timestamp":1776484074703,"segment":25,"confidence":3.7286784458551065,"iterationTokens":4505,"asi":{"hypothesis":"Even in fresh floor window, DDTree path still trails control, likely due tree-build/eval overhead.","rollback_reason":"No code changes; baseline attribution run only.","next_action_hint":"Run immediate no-DDTree control parity sample to confirm this is DDTree-specific and not shared regime drift.","diagnostic_findings":{"completion_tok_s":102.96753991497472,"dflash_eval_s":9.93843075,"dflash_ddtree_tree_build_s":1.938190289,"dflash_ddtree_tree_verify_s":0.13179179000000002,"dflash_ddtree_cycles_completed":98,"dflash_ddtree_tokens_per_second":103.03437491879691}}}
{"run":2539,"commit":"26f9501","metric":108.2766840909848,"metrics":{},"status":"discard","description":"Immediate no-DDTree parity after DDTree baseline stayed at floor (~108.3 tok/s, eval ~8.76), confirming DDTree lag (~5.3 tok/s) is DDTree-specific in this stable window.","timestamp":1776484206410,"segment":25,"confidence":3.701860424303593,"iterationTokens":1719,"asi":{"hypothesis":"Current DDTree overhead remains the limiting factor, not shared regime drift.","rollback_reason":"No code changes; parity attribution sample.","next_action_hint":"Prune stale ideas and keep DDTree work focused on tree-build/commit overhead only; avoid reopening failed env sweeps.","diagnostic_findings":{"completion_tok_s":108.2766840909848,"dflash_eval_s":8.763195711537264,"safe_mode_active":0,"ddtree_delta_vs_prior_baseline_tok_s":-5.30885582398993}}}
{"run":2540,"commit":"26f9501","metric":102.45297373013001,"metrics":{},"status":"discard","description":"DDTree hot-path micro-trim (skip DFS materialization/comparison in tree-aware-linear mode + remove redundant int-list casts) regressed baseline (~102.45 tok/s vs ~102.97 prior).","timestamp":1776484299830,"segment":25,"confidence":3.6754254180397674,"iterationTokens":25417,"asi":{"hypothesis":"Reducing Python list/DFS bookkeeping in tree-aware-linear path would lower DDTree per-cycle overhead.","rollback_reason":"Primary metric regressed and tree-build/verify timings did not improve in matched DDTree lane.","next_action_hint":"Revert this micro-trim and avoid further bookkeeping-only tweaks; target tree-build algorithmic cost instead.","diagnostic_findings":{"completion_tok_s":102.45297373013001,"dflash_eval_s":9.98844225,"dflash_ddtree_tree_build_s":1.954916834,"dflash_ddtree_tree_verify_s":0.13466771,"delta_vs_recent_ddtree_baseline_tok_s":-0.5145661848447092}}}
{"run":2541,"commit":"26f9501","metric":108.33378252006668,"metrics":{},"status":"discard","description":"Immediate no-DDTree parity after discarded DDTree micro-trim remained at floor (~108.3 tok/s, eval ~8.76), confirming regression was DDTree-path-specific.","timestamp":1776484325244,"segment":25,"confidence":3.658543724555719,"iterationTokens":1748,"asi":{"hypothesis":"Control lane should remain unaffected if DDTree micro-trim regression is isolated to DDTree runtime path.","rollback_reason":"No code changes; parity attribution sample after discarded candidate.","next_action_hint":"Continue DDTree exploration only with higher-leverage tree-build/commit changes; keep immediate control parity checks.","diagnostic_findings":{"completion_tok_s":108.33378252006668,"dflash_eval_s":8.760712037445046,"safe_mode_active":0,"verify_eval_wait_fused_steps":96,"verify_eval_wait_unfused_steps":0}}}
{"run":2542,"commit":"26f9501","metric":102.98375527108769,"metrics":{},"status":"discard","description":"Matched DDTree baseline refresh in current floor window stayed at ~103.0 tok/s (eval ~9.94, tree_build ~1.94s), still trailing control band.","timestamp":1776484500247,"segment":25,"confidence":3.6418164015323504,"iterationTokens":11514,"asi":{"hypothesis":"Reconfirm DDTree baseline before testing next code-level tree-build trim candidate.","rollback_reason":"No code changes; attribution baseline sample.","next_action_hint":"Apply one tree-build candidate and then run immediate no-DDTree control parity.","diagnostic_findings":{"completion_tok_s":102.98375527108769,"dflash_eval_s":9.936983541,"dflash_ddtree_tree_build_s":1.9384483270000001,"dflash_ddtree_tree_verify_s":0.13443433,"dflash_ddtree_cycles_completed":98}}}
