{"run":461,"commit":"2486190","metric":106.21687140859669,"metrics":{},"status":"discard","description":"Mirror baseline stability rerun (unchanged config/code) on latest keep.","timestamp":1776272162093,"segment":23,"confidence":21.355868727565618,"iterationTokens":662,"asi":{"hypothesis":"Current mirror keep should stay in ~106.2-106.5 band across immediate reruns.","rollback_reason":"No new change and slightly below top keep.","next_action_hint":"Treat current mirror lane as ~106.2-106.5; seek structural gains for clear separation from bstnxbt control.","backend":"mirror_sd_mlx","stability_probe":true}}
{"run":462,"commit":"2486190","metric":105.51337615229126,"metrics":{},"status":"discard","description":"Mirror split scheduling experiment: add prefill/verify split-function selection with env gate DFLASH_MIRROR_SD_PREFILL_SPLIT (default on).","timestamp":1776272236692,"segment":23,"confidence":20.427056754819723,"iterationTokens":2441,"asi":{"hypothesis":"Separating prefill and verify forward-mode selection could enable future mirror tuning without regressing default path.","rollback_reason":"Default-path regression to 105.51 tok/s.","next_action_hint":"Do not add extra forward-mode dispatch in hot loop without proven gain; keep simpler call path.","backend":"mirror_sd_mlx"}}
{"run":463,"commit":"2486190","metric":105.4222951137874,"metrics":{},"status":"discard","description":"Mirror baseline rerun after discard reversion (unchanged code/config).","timestamp":1776272267562,"segment":23,"confidence":16.951237416682048,"iterationTokens":609,"asi":{"hypothesis":"Reverted tree should return to ~106.4 mirror band.","rollback_reason":"Rerun landed lower at 105.42, indicating ongoing lane noise/drift.","next_action_hint":"Treat mirror gains as narrow/noisy; require larger deterministic improvements (>~0.5 tok/s) before claiming robust win.","backend":"mirror_sd_mlx","stability_probe":true}}
{"run":464,"commit":"2486190","metric":105.38442274699497,"metrics":{},"status":"discard","description":"Control rerun after mirror drift: disabled mirror runtime (DFLASH_MIRROR_SD_RUNTIME=0) to re-check bstnxbt in same regime.","timestamp":1776272307471,"segment":23,"confidence":13.786583963480437,"iterationTokens":767,"asi":{"hypothesis":"After recent mirror baseline dip, control rerun can show whether mirror still holds a meaningful edge.","rollback_reason":"Control run is non-mirror candidate; measured for comparison only.","next_action_hint":"Mirror and control are now near-tied (~105.4); prioritize larger structural mirror gains over micro-tweaks.","backend":"bstnxbt_mlx","mirror_runtime_enabled":false,"mirror_minus_control_tok_s_recent":0.03787236679243963}}
{"run":465,"commit":"2486190","metric":105.48241188195912,"metrics":{},"status":"discard","description":"Mirror runtime direct-dispatch experiment: call bstnxbt generate/iterate directly from DFlashRuntime for mirror backend with target_forward_fn_override (bypassing mirror wrapper functions).","timestamp":1776272467276,"segment":23,"confidence":13.717638209376645,"iterationTokens":7033,"asi":{"hypothesis":"Removing mirror wrapper call indirection in runtime dispatch would trim overhead and improve mirror lane throughput.","rollback_reason":"Regressed to 105.48 tok/s.","next_action_hint":"Keep prior mirror wrapper-based dispatch from 2486190; this direct runtime override path is worse.","backend":"mirror_sd_mlx"}}
{"run":466,"commit":"2486190","metric":105.46041103400947,"metrics":{},"status":"discard","description":"Mirror split micro-sweep: DFLASH_MIRROR_SD_EXIT_LAYER=11.","timestamp":1776272524820,"segment":23,"confidence":13.5207171797846,"iterationTokens":1732,"asi":{"hypothesis":"Layer 11 could be an untested non-monotonic mirror split pocket above 14.","rollback_reason":"Below keep (105.46 vs 106.47).","next_action_hint":"Add 11 to mirror exit-layer do-not-retry set; keep split at 14.","backend":"mirror_sd_mlx","mirror_exit_layer":11}}
{"run":467,"commit":"2486190","metric":105.47403594677577,"metrics":{},"status":"discard","description":"Mirror split micro-sweep: DFLASH_MIRROR_SD_EXIT_LAYER=10.","timestamp":1776272568980,"segment":23,"confidence":13.41829547975629,"iterationTokens":711,"asi":{"hypothesis":"Layer 10 might be another non-monotonic split point worth probing.","rollback_reason":"Below keep (105.47 vs 106.47).","next_action_hint":"Add 10 to mirror do-not-retry set; keep split at 14.","backend":"mirror_sd_mlx","mirror_exit_layer":10}}
{"run":468,"commit":"2486190","metric":105.50080267203231,"metrics":{},"status":"discard","description":"Mirror cache-reservation probe: INITIAL_CACHE_BLOCKS=32.","timestamp":1776272624040,"segment":23,"confidence":13.636881863248043,"iterationTokens":1124,"asi":{"hypothesis":"A modest cache-reservation increase from 16 to 32 might improve mirror stability/perf.","rollback_reason":"Below keep (105.50 vs 106.47).","next_action_hint":"Keep default initial cache blocks (16) on mirror 1024 lane.","backend":"mirror_sd_mlx","initial_cache_blocks":32}}
{"run":469,"commit":"2486190","metric":105.42970985047215,"metrics":{},"status":"discard","description":"Mirror cache-reservation probe: INITIAL_CACHE_BLOCKS=8.","timestamp":1776272666932,"segment":23,"confidence":13.659924759921164,"iterationTokens":656,"asi":{"hypothesis":"Reducing initial cache reservation might lower overhead for short 1024 mirror lane.","rollback_reason":"Below keep (105.43 vs 106.47).","next_action_hint":"Default 16 remains best among tested cache-reservation values (8/16/32/128/256).","backend":"mirror_sd_mlx","initial_cache_blocks":8}}
{"run":470,"commit":"2486190","metric":105.48637168761624,"metrics":{},"status":"discard","description":"Mirror split micro-sweep: DFLASH_MIRROR_SD_EXIT_LAYER=9.","timestamp":1776272816124,"segment":23,"confidence":13.754329010722012,"iterationTokens":656,"asi":{"hypothesis":"Layer 9 might be another non-monotonic mirror split pocket above current 14.","rollback_reason":"Below keep (105.49 vs 106.47).","next_action_hint":"Add 9 to mirror exit-layer do-not-retry set; keep split anchored at 14.","backend":"mirror_sd_mlx","mirror_exit_layer":9}}
{"run":471,"commit":"2486190","metric":105.36451762869574,"metrics":{},"status":"discard","description":"Mirror split micro-sweep: DFLASH_MIRROR_SD_EXIT_LAYER=23.","timestamp":1776272854188,"segment":23,"confidence":13.990262030040672,"iterationTokens":714,"asi":{"hypothesis":"A deeper split at 23 may uncover a higher-throughput non-monotonic region.","rollback_reason":"Below keep (105.36 vs 106.47).","next_action_hint":"Extend mirror exit-layer do-not-retry set to include 23; no evidence of upside beyond 14.","backend":"mirror_sd_mlx","mirror_exit_layer":23}}
{"run":472,"commit":"2486190","metric":89.31258030374255,"metrics":{},"status":"discard","description":"Mirror block-size sweep: DFLASH_BLOCK_TOKENS=17.","timestamp":1776272900428,"segment":23,"confidence":13.68304566178983,"iterationTokens":948,"asi":{"hypothesis":"Mirror split path may prefer a larger speculative block size than 15.","rollback_reason":"Severe regression to 89.31 tok/s.","next_action_hint":"Add block size 17 to mirror do-not-retry set; keep DFLASH_BLOCK_TOKENS=15.","backend":"mirror_sd_mlx","dflash_block_tokens":17}}
{"run":473,"commit":"2486190","metric":98.47950426701571,"metrics":{},"status":"discard","description":"Mirror block-size sweep: DFLASH_BLOCK_TOKENS=14.","timestamp":1776272942850,"segment":23,"confidence":13.425164167880412,"iterationTokens":717,"asi":{"hypothesis":"Mirror split path might benefit from a smaller block size than 15.","rollback_reason":"Regression to 98.48 tok/s.","next_action_hint":"Retain DFLASH_BLOCK_TOKENS=15 as mirror optimum; smaller 14 is materially worse.","backend":"mirror_sd_mlx","dflash_block_tokens":14}}
{"run":474,"commit":"2486190","metric":89.59734339735294,"metrics":{},"status":"discard","description":"Mirror block-size sweep: DFLASH_BLOCK_TOKENS=16.","timestamp":1776272981487,"segment":23,"confidence":13.176823339976663,"iterationTokens":657,"asi":{"hypothesis":"Mirror split path may prefer a slightly larger block size than 15.","rollback_reason":"Severe regression to 89.60 tok/s.","next_action_hint":"Add block size 16 to mirror do-not-retry set; keep DFLASH_BLOCK_TOKENS=15.","backend":"mirror_sd_mlx","dflash_block_tokens":16}}
{"run":475,"commit":"2486190","metric":105.15601921774483,"metrics":{},"status":"discard","description":"Mirror split micro-sweep: DFLASH_MIRROR_SD_EXIT_LAYER=24.","timestamp":1776273026964,"segment":23,"confidence":13.23816110097001,"iterationTokens":683,"asi":{"hypothesis":"A deeper split at 24 could expose a late-layer non-monotonic gain.","rollback_reason":"Below keep (105.16 vs 106.47).","next_action_hint":"Extend exit-layer do-not-retry range to include 24; keep split layer at 14.","backend":"mirror_sd_mlx","mirror_exit_layer":24}}
{"run":476,"commit":"2486190","metric":36.10702915043612,"metrics":{},"status":"discard","description":"Mirror split micro-sweep: DFLASH_MIRROR_SD_EXIT_LAYER=25.","timestamp":1776273086341,"segment":23,"confidence":12.954363021202733,"iterationTokens":667,"asi":{"hypothesis":"Layer 25 might be a deeper non-monotonic sweet spot.","rollback_reason":"Catastrophic collapse to 36.11 tok/s.","next_action_hint":"Hard-ban deep split values at/above 25 on this lane; keep split anchored at 14.","backend":"mirror_sd_mlx","mirror_exit_layer":25}}
{"run":477,"commit":"2486190","metric":59.77980744129553,"metrics":{},"status":"discard","description":"Mirror warmup-shape probe: WARMUP_ENABLE_THINKING=1.","timestamp":1776273158327,"segment":23,"confidence":12.566172267599686,"iterationTokens":1604,"asi":{"hypothesis":"Thinking-enabled warmup may better prime mirror path kernels for thinking workload.","rollback_reason":"Severe regression to 59.78 tok/s.","next_action_hint":"Hard-ban WARMUP_ENABLE_THINKING=1 on mirror lane; keep warmup thinking disabled.","backend":"mirror_sd_mlx","warmup_enable_thinking":1}}
{"run":478,"commit":"2486190","metric":76.00149128376279,"metrics":{},"status":"discard","description":"Mirror warmup-length probe: WARMUP_MAX_TOKENS=32.","timestamp":1776273205357,"segment":23,"confidence":12.200569702693485,"iterationTokens":740,"asi":{"hypothesis":"Longer warmup may improve mirror path readiness.","rollback_reason":"Major regression to 76.00 tok/s.","next_action_hint":"Do not override warmup length above block-matched default on mirror lane.","backend":"mirror_sd_mlx","warmup_max_tokens":32}}
{"run":479,"commit":"2486190","metric":94.56486077383202,"metrics":{},"status":"discard","description":"Mirror warmup-length probe: WARMUP_MAX_TOKENS=8.","timestamp":1776273250182,"segment":23,"confidence":12.105985589228009,"iterationTokens":698,"asi":{"hypothesis":"Shorter warmup may reduce cold-start overhead while still priming mirror path.","rollback_reason":"Regression to 94.56 tok/s.","next_action_hint":"Keep block-matched warmup length (implicit 15); shorter warmups under-prime mirror lane.","backend":"mirror_sd_mlx","warmup_max_tokens":8}}
{"run":480,"commit":"2486190","metric":105.91532614769316,"metrics":{},"status":"discard","description":"Mirror prefill-forward experiment scaffold: added env-gated fallback to default target_forward_with_hidden_states for prefill-shaped calls in mirror target helper.","timestamp":1776273340344,"segment":23,"confidence":12.200569702693485,"iterationTokens":2672,"asi":{"hypothesis":"Prefill-specific fallback path can improve mirror throughput when enabled without hurting default path.","rollback_reason":"Even with gate disabled by default, baseline regressed to 105.92 tok/s.","next_action_hint":"Revert this scaffold; any extra branch in mirror helper hot path appears costly.","backend":"mirror_sd_mlx","feature_gate":"DFLASH_MIRROR_SD_PREFILL_DEFAULT"}}
{"run":481,"commit":"2486190","metric":106.00759389066585,"metrics":{},"status":"discard","description":"Mirror exit-layer resolver optimization: add env-specific cache path that avoids capture-layer sorting when DFLASH_MIRROR_SD_EXIT_LAYER is explicitly set.","timestamp":1776273435566,"segment":23,"confidence":12.566172267599686,"iterationTokens":2926,"asi":{"hypothesis":"Skipping capture-layer sort in exit-layer resolution under explicit env split should reduce helper overhead.","rollback_reason":"Regressed to 106.01 tok/s versus 106.47 keep.","next_action_hint":"Revert this resolver refactor; extra cache branching outweighed the saved sort work.","backend":"mirror_sd_mlx"}}
{"run":482,"commit":"2486190","metric":104.61182036553633,"metrics":{},"status":"discard","description":"Mirror dispatch simplification experiment: remove mirror wrapper dispatch in DFlashRuntime and call bstnxbt runtime directly with target_forward_mode='mirror_sd_split'.","timestamp":1776273554910,"segment":23,"confidence":12.479613690451691,"iterationTokens":4365,"asi":{"hypothesis":"Eliminating mirror wrapper indirection in runtime dispatch will reduce overhead and improve throughput.","rollback_reason":"Regression to 104.61 tok/s.","next_action_hint":"Keep mirror wrapper-based dispatch path; direct mode dispatch in runtime is materially worse.","backend":"mirror_sd_mlx"}}
{"run":483,"commit":"2486190","metric":105.52249051164081,"metrics":{},"status":"discard","description":"Mirror runtime specialization: build per-request mirror forward closure with pre-resolved exit layer + capture flags inside mirror_sd_runtime wrapper.","timestamp":1776273822283,"segment":23,"confidence":12.629205677573191,"iterationTokens":11438,"asi":{"hypothesis":"Pre-resolving mirror split metadata once per request in mirror wrapper should reduce per-step helper overhead and improve throughput.","rollback_reason":"Regressed to 105.52 tok/s versus 106.47 keep.","next_action_hint":"Revert per-request closure specialization in mirror runtime; current wrapper approach remains better.","backend":"mirror_sd_mlx"}}
{"run":484,"commit":"2486190","metric":105.1443381993449,"metrics":{},"status":"discard","description":"Mirror SDPA chunk sweep: DFLASH_BSTNXBT_SPLIT_CHUNK_SIZE=12.","timestamp":1776273877033,"segment":23,"confidence":12.782427465703869,"iterationTokens":1742,"asi":{"hypothesis":"A larger split chunk size may improve mirror lane throughput versus default 8.","rollback_reason":"Below keep (105.14 vs 106.47).","next_action_hint":"Do not pursue chunk size 12; continue with default 8 or sweep only if compelling rationale.","backend":"mirror_sd_mlx","split_chunk_size":12}}
{"run":485,"commit":"2486190","metric":105.60407380067768,"metrics":{},"status":"discard","description":"Mirror SDPA chunk sweep: DFLASH_BSTNXBT_SPLIT_CHUNK_SIZE=11.","timestamp":1776273918569,"segment":23,"confidence":12.876787260766756,"iterationTokens":685,"asi":{"hypothesis":"Chunk size 11 may be a non-monotonic sweet spot for mirror split path.","rollback_reason":"Still below keep (105.60 vs 106.47).","next_action_hint":"Add chunk size 11 to mirror do-not-retry set; default 8 remains best.","backend":"mirror_sd_mlx","split_chunk_size":11}}
{"run":486,"commit":"2486190","metric":105.23268949407986,"metrics":{},"status":"discard","description":"Mirror wrapper micro-trim: omit redundant target_forward_mode kwarg when target_forward_fn_override is already provided.","timestamp":1776274057292,"segment":23,"confidence":12.800135077199366,"iterationTokens":3371,"asi":{"hypothesis":"Removing one redundant kwarg from mirror wrapper delegation will shave small dispatch overhead.","rollback_reason":"Regression to 105.23 tok/s.","next_action_hint":"Revert this kwarg trim; keep explicit target_forward_mode path as currently fastest.","backend":"mirror_sd_mlx"}}
{"run":487,"commit":"2486190","metric":105.151628854303,"metrics":{},"status":"discard","description":"Mirror mixed-loop micro-tweak: replace mixed-mask for-loops with while-loops in mirror target forward helper.","timestamp":1776274142557,"segment":23,"confidence":13.02714086428074,"iterationTokens":2449,"asi":{"hypothesis":"While-loops may reduce Python iteration overhead in mixed-mask mirror split execution.","rollback_reason":"Regression to 105.15 tok/s.","next_action_hint":"Revert while-loop variant; range-for implementation remains better.","backend":"mirror_sd_mlx"}}
{"run":488,"commit":"2486190","metric":105.87292622194607,"metrics":{},"status":"discard","description":"Mirror lane compatibility probe: disable split SDPA (DFLASH_BSTNXBT_SPLIT_SDPA=0).","timestamp":1776274188367,"segment":23,"confidence":13.281406984689108,"iterationTokens":734,"asi":{"hypothesis":"Mirror target split might reduce dependence on split SDPA and perform similarly or better without it.","rollback_reason":"Still below keep (105.87 vs 106.47).","next_action_hint":"Keep split SDPA enabled on mirror lane.","backend":"mirror_sd_mlx","split_sdpa_enabled":0}}
{"run":489,"commit":"2486190","metric":26.068709476826687,"metrics":{},"status":"discard","description":"Mirror lane dependency check: disable recurrent rollback kernels (DFLASH_BSTNXBT_RECURRENT_KERNELS=0).","timestamp":1776274262408,"segment":23,"confidence":13.02714086428074,"iterationTokens":699,"asi":{"hypothesis":"Mirror split path might tolerate non-recurrent kernel mode without major throughput loss.","rollback_reason":"Catastrophic collapse to 26.07 tok/s.","next_action_hint":"Hard-require recurrent kernels for mirror lane; add to mirror do-not-retry list.","backend":"mirror_sd_mlx","recurrent_kernels_enabled":0}}
{"run":490,"commit":"2486190","metric":23.723392334592695,"metrics":{},"status":"discard","description":"Mirror lane dependency check: disable external draft loader path (DFLASH_BSTNXBT_EXTERNAL_DRAFT=0).","timestamp":1776274340913,"segment":23,"confidence":12.899369213802313,"iterationTokens":693,"asi":{"hypothesis":"Mirror split path might perform similarly with native draft loader.","rollback_reason":"Catastrophic collapse to 23.72 tok/s.","next_action_hint":"Hard-require external draft path for mirror lane; add to do-not-retry list.","backend":"mirror_sd_mlx","external_draft_enabled":0}}
{"run":491,"commit":"2486190","metric":93.33157552061103,"metrics":{},"status":"discard","description":"Context-feature extraction micro-optimization: precompute capture layer IDs tuple once per request and pass into extract_context_feature_from_dict to avoid repeated +1 conversion each cycle.","timestamp":1776274468349,"segment":23,"confidence":12.621607910667079,"iterationTokens":4376,"asi":{"hypothesis":"Precomputing capture IDs should reduce per-cycle Python overhead in context-feature extraction.","rollback_reason":"Large regression to 93.33 tok/s.","next_action_hint":"Revert this extraction refactor; it unexpectedly perturbs hot-path performance and is not worth pursuing.","backend":"mirror_sd_mlx"}}
{"run":492,"commit":"2486190","metric":106.05895575510536,"metrics":{},"status":"discard","description":"Mirror prefill-path experiment: enable DFLASH_MIRROR_SD_PREFILL_DEFAULT=1 to use default target forward on first (prefill) call, mirror split on verify calls.","timestamp":1776274655664,"segment":23,"confidence":12.899369213802313,"iterationTokens":6065,"asi":{"hypothesis":"Using default forward for prefill only may reduce overhead while keeping mirror split benefits during verify cycles.","rollback_reason":"Below keep (106.06 vs 106.47).","next_action_hint":"Do not pursue prefill-default split strategy on 1024 lane; keep full mirror forward path.","backend":"mirror_sd_mlx","mirror_prefill_default":1}}
{"run":493,"commit":"2486190","metric":105.1376598107663,"metrics":{},"status":"discard","description":"Mirror stability lever probe: set INITIAL_CACHE_BLOCKS=64 on authoritative 1024 mirror lane.","timestamp":1776274906416,"segment":23,"confidence":12.866019810799234,"iterationTokens":6065,"asi":{"hypothesis":"A moderate cache reservation (64) might stabilize mirror lane and improve throughput under drift.","rollback_reason":"Regressed to 105.14 tok/s versus 106.47 mirror keep.","next_action_hint":"Add 64 to mirror cache do-not-retry set; keep default cache reservation for 1024 mirror lane.","backend":"mirror_sd_mlx","initial_cache_blocks":64}}
{"run":494,"commit":"2486190","metric":105.5291585230011,"metrics":{},"status":"discard","description":"Mirror stability lever probe: set INITIAL_CACHE_BLOCKS=512 on authoritative 1024 mirror lane.","timestamp":1776274936016,"segment":23,"confidence":13.157469061751044,"iterationTokens":723,"asi":{"hypothesis":"A larger cache reservation (512) might recover degraded mirror throughput in the noisy regime.","rollback_reason":"Still below keep (105.53 vs 106.47).","next_action_hint":"Add 512 to mirror cache do-not-retry set for 1024 lane; default reservation remains best.","backend":"mirror_sd_mlx","initial_cache_blocks":512}}
{"run":495,"commit":"2486190","metric":105.11279480923092,"metrics":{},"status":"discard","description":"Mirror baseline rerun (unchanged config) to refresh contemporaneous A/B band before control pairing.","timestamp":1776274962661,"segment":23,"confidence":13.012323189831042,"iterationTokens":635,"asi":{"hypothesis":"Current mirror keep should still land near historical 106+ band on immediate rerun.","rollback_reason":"Rerun landed at 105.11 tok/s, indicating current regime remains slower/noisy.","next_action_hint":"Run immediate control paired rerun (mirror off) to measure live delta instead of relying on historical control numbers.","backend":"mirror_sd_mlx","stability_probe":true}}
