{"run":2133,"commit":"a0f1200","metric":10.860300248372369,"metrics":{},"status":"discard","description":"Recovery tightened within watchdog-idle mode (~88.43 tok/s, eval_s ~10.86) without spikes.","timestamp":1776396540139,"segment":24,"confidence":0.031544493964890945,"iterationTokens":1421,"asi":{"hypothesis":"Rebound is climbing from inflation shelf toward high-soft boundary.","rollback_reason":"Primary metric above best floor.","next_action_hint":"Continue unchanged mirror loop for sub-10 retest.","diagnostic_findings":{"completion_tok_s":88.42806570547639,"dflash_eval_s":10.860300248372369,"safe_mode_active":0,"spike_events":0}}}
{"run":2134,"commit":"a0f1200","metric":10.541852837312035,"metrics":{},"status":"discard","description":"Further rebound in spike-free mode (~90.93 tok/s, eval_s ~10.54), watchdog idle.","timestamp":1776396569435,"segment":24,"confidence":0.03192465069947929,"iterationTokens":1409,"asi":{"hypothesis":"Recovery continues smoothly in non-spike regime.","rollback_reason":"Primary metric above best floor.","next_action_hint":"Continue unchanged loop for sub-10/high-soft confirmation.","diagnostic_findings":{"completion_tok_s":90.9288692545131,"dflash_eval_s":10.541852837312035,"safe_mode_active":0,"spike_events":0}}}
{"run":2135,"commit":"a0f1200","metric":10.445717081893235,"metrics":{},"status":"discard","description":"Incremental recovery continued (~91.73 tok/s, eval_s ~10.45) with watchdog idle, no spikes.","timestamp":1776396596492,"segment":24,"confidence":0.03200032799304297,"iterationTokens":1402,"asi":{"hypothesis":"System is approaching sub-10 threshold through stable non-spike rebound.","rollback_reason":"Primary metric above best floor.","next_action_hint":"Continue unchanged loop for high-soft re-entry.","diagnostic_findings":{"completion_tok_s":91.72903794324041,"dflash_eval_s":10.445717081893235,"safe_mode_active":0,"spike_events":0}}}
{"run":2136,"commit":"a0f1200","metric":10.391829913831316,"metrics":{},"status":"discard","description":"Recovery kept improving in spike-free mode (~92.17 tok/s, eval_s ~10.39), watchdog idle.","timestamp":1776396628478,"segment":24,"confidence":0.03207391178963715,"iterationTokens":1409,"asi":{"hypothesis":"Non-spike rebound remains orderly and trending toward high-soft baseline.","rollback_reason":"Primary metric above best floor.","next_action_hint":"Continue unchanged loop for sub-10 crossover and possible 8.8-band return.","diagnostic_findings":{"completion_tok_s":92.17483542244848,"dflash_eval_s":10.391829913831316,"safe_mode_active":0,"spike_events":0}}}
{"run":2137,"commit":"a0f1200","metric":10.746868626098149,"metrics":{},"status":"discard","description":"Recovery sample regressed slightly (~89.12 tok/s, eval_s ~10.75) but remained watchdog-idle and spike-free.","timestamp":1776396657344,"segment":24,"confidence":0.03200221049704988,"iterationTokens":1422,"asi":{"hypothesis":"Rebound remains in non-spike plateau with small noise oscillations.","rollback_reason":"Primary metric above best floor.","next_action_hint":"Continue unchanged loop for sub-10 retest.","diagnostic_findings":{"completion_tok_s":89.11505508625109,"dflash_eval_s":10.746868626098149,"safe_mode_active":0,"spike_events":0}}}
{"run":2138,"commit":"a0f1200","metric":10.287535950425081,"metrics":{},"status":"discard","description":"Recovered back toward high-soft edge (~93.09 tok/s, eval_s ~10.29) with watchdog idle and zero spikes.","timestamp":1776396686806,"segment":24,"confidence":0.03207636492474557,"iterationTokens":1540,"asi":{"hypothesis":"Post-collapse rebound remains healthy in non-spike mode.","rollback_reason":"Primary metric above best floor.","next_action_hint":"Continue unchanged loop for sub-10 crossover.","diagnostic_findings":{"completion_tok_s":93.08957621713415,"dflash_eval_s":10.287535950425081,"safe_mode_active":0,"spike_events":0}}}
{"run":2139,"commit":"a0f1200","metric":10.381107497261837,"metrics":{},"status":"discard","description":"Stable high-soft-edge sample (~92.32 tok/s, eval_s ~10.38) with watchdog idle and no collapse events.","timestamp":1776396715092,"segment":24,"confidence":0.03210657583146508,"iterationTokens":1411,"asi":{"hypothesis":"Recovery has settled into a calm sub-collapse plateau awaiting further improvement.","rollback_reason":"Primary metric above best floor.","next_action_hint":"Continue unchanged loop.","diagnostic_findings":{"completion_tok_s":92.32311474230885,"dflash_eval_s":10.381107497261837,"safe_mode_active":0,"spike_events":0}}}
{"run":2140,"commit":"a0f1200","metric":10.188695580349304,"metrics":{},"status":"discard","description":"Mild improvement in watchdog-idle plateau (~93.89 tok/s, eval_s ~10.19), still above floor.","timestamp":1776396744066,"segment":24,"confidence":0.03213930647117566,"iterationTokens":1412,"asi":{"hypothesis":"Rebound is inching toward sub-10 without spike activity.","rollback_reason":"Primary metric above best floor.","next_action_hint":"Continue unchanged loop for sub-10 crossover.","diagnostic_findings":{"completion_tok_s":93.88682002971578,"dflash_eval_s":10.188695580349304,"safe_mode_active":0,"spike_events":0}}}
{"run":2141,"commit":"a0f1200","metric":10.266130920033902,"metrics":{},"status":"discard","description":"Another stable non-spike plateau sample (~93.21 tok/s, eval_s ~10.27), watchdog idle.","timestamp":1776396773543,"segment":24,"confidence":0.03215821583638581,"iterationTokens":1416,"asi":{"hypothesis":"Recovery has plateaued near 10.2–10.8 eval_s pending next regime shift.","rollback_reason":"Primary metric above best floor.","next_action_hint":"Continue unchanged loop and wait for sub-10 or relapse edge.","diagnostic_findings":{"completion_tok_s":93.21421172332948,"dflash_eval_s":10.266130920033902,"safe_mode_active":0,"spike_events":0}}}
{"run":2142,"commit":"a0f1200","metric":9.860463083605282,"metrics":{},"status":"discard","description":"Recovery crossed below 10 again (~96.86 tok/s, eval_s ~9.86) with watchdog idle and no spikes.","timestamp":1776396822250,"segment":24,"confidence":0.03216523698426952,"iterationTokens":3004,"asi":{"hypothesis":"Non-spike rebound is strengthening toward high-soft edge after collapse oscillation.","rollback_reason":"Primary metric above best floor.","next_action_hint":"Continue unchanged loop for potential return to ~8.8 band.","diagnostic_findings":{"completion_tok_s":96.8561084923399,"dflash_eval_s":9.860463083605282,"safe_mode_active":0,"spike_events":0}}}
{"run":2143,"commit":"a0f1200","metric":9.618052006349899,"metrics":{},"status":"discard","description":"High-soft recovery strengthened (~99.11 tok/s, eval_s ~9.62) with watchdog idle and zero spikes.","timestamp":1776396851671,"segment":24,"confidence":0.03219693569374128,"iterationTokens":1425,"asi":{"hypothesis":"Rebound is nearing pre-collapse soft-band levels while remaining non-spike.","rollback_reason":"Primary metric above best floor.","next_action_hint":"Continue unchanged loop for potential 8.8-band return.","diagnostic_findings":{"completion_tok_s":99.10583758500955,"dflash_eval_s":9.618052006349899,"safe_mode_active":0,"spike_events":0}}}
{"run":2144,"commit":"a0f1200","metric":9.514817246701568,"metrics":{},"status":"discard","description":"Recovery entered stronger high-soft (~100.13 tok/s, eval_s ~9.51) with watchdog idle and no spikes.","timestamp":1776396880070,"segment":24,"confidence":0.032228696942742524,"iterationTokens":1417,"asi":{"hypothesis":"Post-collapse rebound is continuing toward pre-collapse soft-band performance.","rollback_reason":"Primary metric above best floor.","next_action_hint":"Continue unchanged loop for 8.8-band re-entry.","diagnostic_findings":{"completion_tok_s":100.12911710273478,"dflash_eval_s":9.514817246701568,"safe_mode_active":0,"spike_events":0}}}
{"run":2145,"commit":"a0f1200","metric":9.451446286635473,"metrics":{},"status":"discard","description":"High-soft rebound improved further (~100.76 tok/s, eval_s ~9.45) with watchdog idle and zero spike events.","timestamp":1776396913560,"segment":24,"confidence":0.03226566009195897,"iterationTokens":1425,"asi":{"hypothesis":"Recovery is steadily approaching the prior ~8.8 best-band without collapse triggers.","rollback_reason":"Primary metric remains above best floor.","next_action_hint":"Continue unchanged loop for 8.8-band re-entry.","diagnostic_findings":{"completion_tok_s":100.7629922550189,"dflash_eval_s":9.451446286635473,"safe_mode_active":0,"spike_events":0}}}
{"run":2146,"commit":"a0f1200","metric":9.807150119100697,"metrics":{},"status":"discard","description":"Sub-10 sample remained watchdog-idle (~96.98 tok/s, eval_s ~9.81) but above best floor.","timestamp":1776396941841,"segment":24,"confidence":0.03230270812473023,"iterationTokens":1432,"asi":{"hypothesis":"Rebound entered high-soft but remains noisy around ~9.5–9.9 rather than ~8.8 band.","rollback_reason":"Primary metric above best floor.","next_action_hint":"Continue unchanged loop for deeper recovery or fresh collapse edge.","diagnostic_findings":{"completion_tok_s":96.98463154691855,"dflash_eval_s":9.807150119100697,"safe_mode_active":0,"spike_events":0}}}
{"run":2147,"commit":"a0f1200","metric":9.244598622783087,"metrics":{},"status":"discard","description":"Recovery pushed deeper into high-soft (~102.86 tok/s, eval_s ~9.24) with watchdog idle and no spikes.","timestamp":1776396993119,"segment":24,"confidence":0.03245779984686134,"iterationTokens":2701,"asi":{"hypothesis":"Non-spike rebound continues toward pre-collapse window and may approach the 8.8 floor.","rollback_reason":"Primary metric above best floor.","next_action_hint":"Continue unchanged loop for 8.8-band retest.","diagnostic_findings":{"completion_tok_s":102.85880641735766,"dflash_eval_s":9.244598622783087,"safe_mode_active":0,"spike_events":0}}}
{"run":2148,"commit":"a0f1200","metric":9.382891371496953,"metrics":{},"status":"discard","description":"Follow-up stayed strong high-soft (~101.24 tok/s, eval_s ~9.38) with watchdog idle and spike-free telemetry.","timestamp":1776397019945,"segment":24,"confidence":0.03267538917987807,"iterationTokens":1448,"asi":{"hypothesis":"Recovery remains robust but has not yet re-entered the ~8.8 best band.","rollback_reason":"Primary metric above best floor.","next_action_hint":"Continue unchanged loop for best-band retest.","diagnostic_findings":{"completion_tok_s":101.24069241642655,"dflash_eval_s":9.382891371496953,"safe_mode_active":0,"spike_events":0}}}
{"run":2149,"commit":"a0f1200","metric":9.180008330498822,"metrics":{},"status":"discard","description":"Recovery advanced further (~103.43 tok/s, eval_s ~9.18) with watchdog idle and no spikes.","timestamp":1776397046101,"segment":24,"confidence":0.03318258075415466,"iterationTokens":1432,"asi":{"hypothesis":"Rebound is nearing the prior best window while remaining in stable non-spike mode.","rollback_reason":"Primary metric above best floor.","next_action_hint":"Continue unchanged loop for 8.8-band crossover.","diagnostic_findings":{"completion_tok_s":103.43437520744195,"dflash_eval_s":9.180008330498822,"safe_mode_active":0,"spike_events":0}}}
{"run":2150,"commit":"a0f1200","metric":9.074129254091531,"metrics":{},"status":"discard","description":"Recovery reached near-best soft band (~104.74 tok/s, eval_s ~9.07) with watchdog idle and spike-free telemetry.","timestamp":1776397083843,"segment":24,"confidence":0.033705765968869005,"iterationTokens":1426,"asi":{"hypothesis":"Rebound is approaching historical floor without collapse signatures.","rollback_reason":"Primary metric above best floor.","next_action_hint":"Continue unchanged loop for 8.8-band retest.","diagnostic_findings":{"completion_tok_s":104.74045782106721,"dflash_eval_s":9.074129254091531,"safe_mode_active":0,"spike_events":0}}}
{"run":2151,"commit":"a0f1200","metric":9.124771912116557,"metrics":{},"status":"discard","description":"Near-best high-soft sample held (~104.07 tok/s, eval_s ~9.12) with watchdog idle.","timestamp":1776397112195,"segment":24,"confidence":0.03382962601618451,"iterationTokens":1428,"asi":{"hypothesis":"Recovery is stable in high-soft but has not yet reached best-floor regime.","rollback_reason":"Primary metric above best floor.","next_action_hint":"Continue unchanged loop for 8.8-band check.","diagnostic_findings":{"completion_tok_s":104.07244946667097,"dflash_eval_s":9.124771912116557,"safe_mode_active":0,"spike_events":0}}}
{"run":2152,"commit":"a0f1200","metric":9.111197381513193,"metrics":{},"status":"discard","description":"Repeat near-best high-soft run (~104.22 tok/s, eval_s ~9.11) with watchdog idle and no spike events.","timestamp":1776397138705,"segment":24,"confidence":0.033954399728814706,"iterationTokens":1422,"asi":{"hypothesis":"Recovery has stabilized around ~9.1 eval_s without entering best-floor band yet.","rollback_reason":"Primary metric above best floor.","next_action_hint":"Continue unchanged loop and monitor for either 8.8-band return or new collapse edge.","diagnostic_findings":{"completion_tok_s":104.22354110098605,"dflash_eval_s":9.111197381513193,"safe_mode_active":0,"spike_events":0}}}
{"run":2153,"commit":"a0f1200","metric":9.026837622164749,"metrics":{},"status":"discard","description":"Best sample in current rebound band (~105.18 tok/s, eval_s ~9.03) with watchdog idle and spike-free telemetry.","timestamp":1776397168018,"segment":24,"confidence":0.03402451222577888,"iterationTokens":1437,"asi":{"hypothesis":"Rebound is nearing the pre-collapse local plateau but still above global best floor.","rollback_reason":"Primary metric above best floor.","next_action_hint":"Continue unchanged loop for 8.8-band retest.","diagnostic_findings":{"completion_tok_s":105.18429580662604,"dflash_eval_s":9.026837622164749,"safe_mode_active":0,"spike_events":0}}}
{"run":2154,"commit":"a0f1200","metric":9.06951666448731,"metrics":{},"status":"discard","description":"Near-repeat high-soft sample (~104.57 tok/s, eval_s ~9.07) with watchdog idle and no spikes.","timestamp":1776397195154,"segment":24,"confidence":0.03409323194713127,"iterationTokens":1433,"asi":{"hypothesis":"Rebound has formed a stable ~9.0 eval_s shelf after collapse recovery.","rollback_reason":"Primary metric above best floor.","next_action_hint":"Continue unchanged loop for 8.8-band crossover or next collapse edge.","diagnostic_findings":{"completion_tok_s":104.567261051907,"dflash_eval_s":9.06951666448731,"safe_mode_active":0,"spike_events":0}}}
{"run":2155,"commit":"a0f1200","metric":9.023151293280534,"metrics":{},"status":"discard","description":"Strong high-soft repeat (~105.21 tok/s, eval_s ~9.02) with watchdog idle and zero spikes.","timestamp":1776397237539,"segment":24,"confidence":0.0343488780668287,"iterationTokens":2052,"asi":{"hypothesis":"Recovered regime is stable near ~9.0 eval_s but still not in 8.8-floor band.","rollback_reason":"Primary metric above best floor.","next_action_hint":"Continue unchanged loop for best-band retest.","diagnostic_findings":{"completion_tok_s":105.21463393922001,"dflash_eval_s":9.023151293280534,"safe_mode_active":0,"spike_events":0}}}
{"run":2156,"commit":"a0f1200","metric":9.030288251116872,"metrics":{},"status":"discard","description":"Near-identical high-soft confirmation (~105.15 tok/s, eval_s ~9.03), watchdog idle and spike-free.","timestamp":1776397263642,"segment":24,"confidence":0.034539962581969626,"iterationTokens":1446,"asi":{"hypothesis":"Recovered regime has stabilized near ~9.0 eval_s with low short-term noise.","rollback_reason":"Primary metric above best floor.","next_action_hint":"Continue unchanged loop for possible ~8.8 crossover.","diagnostic_findings":{"completion_tok_s":105.14534765535834,"dflash_eval_s":9.030288251116872,"safe_mode_active":0,"spike_events":0}}}
{"run":2157,"commit":"a0f1200","metric":8.962106791441329,"metrics":{},"status":"discard","description":"Recovery tightened to sub-9 shelf (~105.84 tok/s, eval_s ~8.96) with watchdog idle and no spikes.","timestamp":1776397292252,"segment":24,"confidence":0.034769404855746915,"iterationTokens":1435,"asi":{"hypothesis":"Regime is now close to best-band latency but still above floor.","rollback_reason":"Primary metric above best floor.","next_action_hint":"Continue unchanged loop for ~8.8 retest.","diagnostic_findings":{"completion_tok_s":105.84408721525493,"dflash_eval_s":8.962106791441329,"safe_mode_active":0,"spike_events":0}}}
{"run":2158,"commit":"a0f1200","metric":9.00219538109377,"metrics":{},"status":"discard","description":"High-soft stayed near sub-9 boundary (~105.46 tok/s, eval_s ~9.00), watchdog idle and spike-free.","timestamp":1776397318239,"segment":24,"confidence":0.03494809704618119,"iterationTokens":1430,"asi":{"hypothesis":"Recovered regime is hovering at the edge of best-band re-entry.","rollback_reason":"Primary metric above best floor.","next_action_hint":"Continue unchanged loop for possible 8.8 crossover.","diagnostic_findings":{"completion_tok_s":105.46439182585168,"dflash_eval_s":9.00219538109377,"safe_mode_active":0,"spike_events":0}}}
{"run":2159,"commit":"a0f1200","metric":9.051079705939628,"metrics":{},"status":"discard","description":"Another near-best high-soft sample (~104.93 tok/s, eval_s ~9.05) with watchdog idle and no spikes.","timestamp":1776397350070,"segment":24,"confidence":0.035004837798529004,"iterationTokens":1418,"asi":{"hypothesis":"Recovered regime remains stable around ~9.0 eval_s with limited drift.","rollback_reason":"Primary metric above best floor.","next_action_hint":"Continue unchanged loop for eventual 8.8-band crossover or next transition.","diagnostic_findings":{"completion_tok_s":104.93033737506632,"dflash_eval_s":9.051079705939628,"safe_mode_active":0,"spike_events":0}}}
{"run":2160,"commit":"a0f1200","metric":9.09249416703824,"metrics":{},"status":"discard","description":"High-soft plateau remained steady (~104.42 tok/s, eval_s ~9.09) with watchdog idle and no spikes.","timestamp":1776397377302,"segment":24,"confidence":0.03506176309589421,"iterationTokens":1443,"asi":{"hypothesis":"Recovered regime is currently stable but bounded above the best-floor band.","rollback_reason":"Primary metric above best floor.","next_action_hint":"Continue unchanged loop and watch for either 8.8 crossover or fresh collapse transition.","diagnostic_findings":{"completion_tok_s":104.4221945357352,"dflash_eval_s":9.09249416703824,"safe_mode_active":0,"spike_events":0}}}
{"run":2161,"commit":"a0f1200","metric":9.045833664946258,"metrics":{},"status":"discard","description":"Another stable high-soft sample (~105.03 tok/s, eval_s ~9.05), watchdog idle and spike-free.","timestamp":1776397405647,"segment":24,"confidence":0.035114789397078884,"iterationTokens":1537,"asi":{"hypothesis":"Current regime remains a steady ~9.0 eval_s plateau after rebound.","rollback_reason":"Primary metric above best floor.","next_action_hint":"Continue unchanged loop.","diagnostic_findings":{"completion_tok_s":105.03278684357039,"dflash_eval_s":9.045833664946258,"safe_mode_active":0,"spike_events":0}}}
{"run":2162,"commit":"a0f1200","metric":9.053272207151167,"metrics":{},"status":"discard","description":"Plateau persisted near ~9.05 eval_s (~104.89 tok/s), watchdog idle and no spikes.","timestamp":1776397434512,"segment":24,"confidence":0.03516797633180106,"iterationTokens":1411,"asi":{"hypothesis":"Recovered regime remains stable but capped above the 8.8 best-floor zone.","rollback_reason":"Primary metric above best floor.","next_action_hint":"Continue unchanged loop.","diagnostic_findings":{"completion_tok_s":104.88609634713006,"dflash_eval_s":9.053272207151167,"safe_mode_active":0,"spike_events":0}}}
{"run":2163,"commit":"a0f1200","metric":9.173526085098274,"metrics":{},"status":"discard","description":"Minor drift upward within high-soft (~103.39 tok/s, eval_s ~9.17), watchdog idle and spike-free.","timestamp":1776397463860,"segment":24,"confidence":0.03520691990857159,"iterationTokens":1405,"asi":{"hypothesis":"Recovered shelf is oscillating around ~9.0–9.2 without structural change.","rollback_reason":"Primary metric above best floor.","next_action_hint":"Continue unchanged loop.","diagnostic_findings":{"completion_tok_s":103.38795940859897,"dflash_eval_s":9.173526085098274,"safe_mode_active":0,"spike_events":0}}}
{"run":2164,"commit":"a0f1200","metric":9.076904043671675,"metrics":{},"status":"discard","description":"High-soft shelf held (~104.75 tok/s, eval_s ~9.08) with watchdog idle and no spikes.","timestamp":1776397492802,"segment":24,"confidence":0.03526241099668549,"iterationTokens":1445,"asi":{"hypothesis":"Recovered regime remains stable around ~9.0 eval_s with low variance.","rollback_reason":"Primary metric above best floor.","next_action_hint":"Continue unchanged loop for eventual ~8.8 retest.","diagnostic_findings":{"completion_tok_s":104.74665949185963,"dflash_eval_s":9.076904043671675,"safe_mode_active":0,"spike_events":0}}}
{"run":2165,"commit":"a0f1200","metric":9.034002695814706,"metrics":{},"status":"discard","description":"High-soft plateau persisted (~105.13 tok/s, eval_s ~9.03) with watchdog idle and no spikes.","timestamp":1776397541247,"segment":24,"confidence":0.03539716330847864,"iterationTokens":2349,"asi":{"hypothesis":"Recovered regime remains stable around ~9.0 eval_s after collapse-recovery cycle.","rollback_reason":"Primary metric above best floor.","next_action_hint":"Continue unchanged loop for eventual 8.8-band crossover or next collapse transition.","diagnostic_findings":{"completion_tok_s":105.12623560878045,"dflash_eval_s":9.034002695814706,"safe_mode_active":0,"spike_events":0}}}
