{"run":75,"commit":"84dbeb4","metric":28.037589042786056,"metrics":{},"status":"discard","description":"Switch the native drafter from MLX KVCache trim semantics to an exact-crop draft KV cache so the native target-side loop matches the hybrid path's token/state evolution step-for-step. This fixed a real correctness divergence in direct probes but did not improve the full omni9b-phase2prime server benchmark.","timestamp":1775973785359,"segment":4,"confidence":12.777015323267605,"iterationTokens":13792,"asi":{"hypothesis":"The native drafter was leaking rejected draft tokens because KVCache trim semantics did not match DFlash's exact draft-cache crop behavior; replacing it with an exact-crop draft cache should improve end-to-end throughput.","rollback_reason":"Despite fixing the native/hybrid divergence in direct token traces, the full server benchmark remained flat at 28.04 tok/s versus the kept baseline, so it is not a primary-metric win by itself.","next_action_hint":"Keep using the exact-crop insight for future native-target integration work, but focus the next experiment on reducing runtime overhead in the native target loop or validating against a standard Qwen3.5-9B bf16 reference target outside the primary path.","learning":"Exact draft-cache crop semantics were a real correctness bug in the native target-side probe, but they are not the main throughput limiter in the current server path."}}
{"run":76,"commit":"e7b14c4","metric":28.36006144493717,"metrics":{},"status":"keep","description":"Cache the repeated draft mask-token embeddings in the hybrid-native DFlash loop and only embed the current last token each step. This removes redundant target embedding work for the 15 masked positions in every draft block and lifts omni9b-phase2prime DFlash throughput into a stable ~28.3 tok/s band.","timestamp":1775974199303,"segment":4,"confidence":11.69013783575035,"iterationTokens":342,"asi":{"hypothesis":"In the hybrid-native DFlash loop, the draft input is always [last_token] + [mask×15], so re-embedding all 16 tokens every step wastes work. Reusing a precomputed mask embedding block should cut per-step target embedding overhead and improve throughput.","learning":"The repeated masked positions are worth caching. Across repeated full server runs the change improved the DFlash path from the prior ~28.0 tok/s baseline to roughly 28.28–28.36 tok/s.","next_action_hint":"Continue trimming repeated per-step work in the hybrid-native loop, especially other fixed-shape conversions around the draft input and target-hidden handoff, but keep validating with the full 256-token server benchmark rather than microprobes alone.","reruns":"Observed 28.33, 28.36, and 28.28 tok/s on repeated full benchmark runs after this change."}}
{"run":77,"commit":"e7b14c4","metric":28.014224550771548,"metrics":{},"status":"discard","description":"Switch the cached draft-input embedding path to use direct MLX token embeddings inside the target bridge instead of the existing torch-facing embed proxy. This regressed the full server benchmark versus the new cached-mask baseline.","timestamp":1775974268375,"segment":4,"confidence":12.019139562755962,"iterationTokens":2293,"asi":{"hypothesis":"After caching the repeated mask embeddings, using direct MLX token embeddings for the remaining last-token embed should remove another torch->MLX conversion and improve throughput.","rollback_reason":"The full benchmark dropped from the kept ~28.3 tok/s cached-mask baseline to 28.01 tok/s, so this narrower embedding-path rewrite is not a win.","next_action_hint":"Keep the cached-mask optimization but leave the remaining last-token embedding on the prior bridge path; continue targeting other repeated per-step work instead of this embedding handoff.","learning":"The per-step draft-input embedding cost is only partly worth attacking. Caching the repeated mask embeddings helped, but replacing the remaining last-token embed proxy with the direct MLX path did not improve end-to-end throughput."}}
{"run":78,"commit":"e7b14c4","metric":28.189531987976363,"metrics":{},"status":"discard","description":"Build each verify block as torch.cat([last_token, predicted_ids]) instead of cloning and mutating the masked output slice in the hybrid-native DFlash loop. This regressed versus the cached-mask baseline.","timestamp":1775974329851,"segment":4,"confidence":12.36719609824847,"iterationTokens":1745,"asi":{"hypothesis":"Avoiding the per-step clone and mutation of the 16-token masked block should shave Python/tensor overhead in the hybrid-native DFlash loop.","rollback_reason":"The full server benchmark fell below the kept cached-mask baseline, so this block-construction rewrite is not a win.","next_action_hint":"Keep the cached-mask optimization and continue focusing on genuinely repeated cross-framework work rather than small tensor assembly changes.","learning":"The block clone/mutation is not a dominant cost in the current hybrid-native path; removing it did not improve end-to-end throughput."}}
{"run":79,"commit":"e7b14c4","metric":28.273174456477452,"metrics":{},"status":"discard","description":"Fuse the selected target hidden states into one tensor before converting MLX->torch in the hybrid-native path, reducing per-step conversion count. This remained slightly below the cached-mask baseline on the full server benchmark.","timestamp":1775974399059,"segment":4,"confidence":12.742776241576642,"iterationTokens":3747,"asi":{"hypothesis":"Halving the number of MLX->torch conversions for target hidden states should improve hybrid-native DFlash throughput on top of the cached-mask baseline.","rollback_reason":"The full benchmark stayed below the kept cached-mask result, so the fused hidden-state handoff is not a net win in this runtime shape.","next_action_hint":"Keep the cached-mask optimization and continue looking for repeated per-step work that can be removed without perturbing the hidden-state handoff layout.","learning":"The dominant remaining bridge cost is not solved simply by fusing the selected hidden states; that handoff shape still performs slightly worse end-to-end here."}}
{"run":80,"commit":"e7b14c4","metric":27.881217773373198,"metrics":{},"status":"discard","description":"Reuse a preallocated verify-block tensor in the hybrid-native DFlash loop instead of cloning a fresh block slice each step. This regressed the full server benchmark relative to the cached-mask baseline.","timestamp":1775974485395,"segment":4,"confidence":13.372907692389957,"iterationTokens":3652,"asi":{"hypothesis":"Reusing a preallocated verify block should remove small per-step tensor allocation and mutation costs in the hybrid-native DFlash loop.","rollback_reason":"The full benchmark dropped below the kept cached-mask baseline, so this buffer reuse does not help end-to-end throughput.","next_action_hint":"Keep the simpler cached-mask implementation and continue focusing on costs with proven impact rather than small tensor assembly optimizations.","learning":"Per-step verify-block tensor allocation is not a dominant bottleneck in the current hybrid-native path."}}
{"run":81,"commit":"e7b14c4","metric":27.84111977221367,"metrics":{},"status":"discard","description":"Limit the hybrid-native stop-token check to the newly produced output slice instead of scanning the full generated suffix each step. This regressed the full server benchmark.","timestamp":1775974547776,"segment":4,"confidence":13.825802039369126,"iterationTokens":1478,"asi":{"hypothesis":"The per-step stop-token scan over the entire generated suffix is unnecessary work for the benchmark workload; restricting it to newly produced tokens should slightly improve throughput.","rollback_reason":"The full benchmark dropped below the kept cached-mask baseline, so this narrower stop-token check is not a win.","next_action_hint":"Keep the simpler existing stop check and keep focusing on costs that have already shown measurable impact in repeated runs.","learning":"The stop-token scan is not a meaningful bottleneck on the current warmed 256-token workload."}}
{"run":82,"commit":"e7b14c4","metric":27.856799204748967,"metrics":{},"status":"discard","description":"Re-test exact-crop draft KV cache semantics on top of the cached-mask baseline. The full server benchmark still regressed despite the native direct-loop correctness benefits.","timestamp":1775974611965,"segment":4,"confidence":14.310447636759937,"iterationTokens":1890,"asi":{"hypothesis":"Now that repeated mask embeddings are cached, exact draft-cache crop semantics might turn into an end-to-end win in the hybrid-native path as well.","rollback_reason":"The full server benchmark remained below the kept cached-mask baseline, so exact-crop draft cache semantics are still not a primary-metric win in the server path.","next_action_hint":"Keep exact-crop semantics as a known correctness requirement for native-target integration, but continue optimizing the current hybrid-native server path separately.","learning":"Exact draft-cache crop is important for native-loop parity but does not improve the current server benchmark even after the cached-mask optimization."}}
{"run":83,"commit":"e7b14c4","metric":28.130141812847366,"metrics":{},"status":"discard","description":"Keep target posterior token IDs on MLX through acceptance computation and convert only the single bonus token needed for output assembly. This reduced some MLX->torch traffic but still underperformed the cached-mask baseline.","timestamp":1775974724051,"segment":4,"confidence":15.620363304635585,"iterationTokens":4454,"asi":{"hypothesis":"Avoiding full posterior MLX->torch conversion in the hybrid-native loop should reduce bridge overhead enough to improve throughput.","rollback_reason":"The full benchmark remained below the kept cached-mask baseline, so the MX-posterior path is not a net win.","next_action_hint":"Keep the cached-mask optimization and continue chasing larger structural costs rather than shaving this particular posterior conversion path.","learning":"Posterior-token conversion is not the dominant remaining overhead once the mask-embedding cache is in place."}}
{"run":84,"commit":"e7b14c4","metric":28.380253564324544,"metrics":{},"status":"discard","description":"Materialize the cached mask-token embeddings through the existing torch embed proxy first, then convert once to MLX, instead of calling _torch_to_mx on the proxy result directly. Repeated runs landed effectively tied with the kept cached-mask baseline.","timestamp":1775976724548,"segment":4,"confidence":17.194249564030613,"iterationTokens":300,"asi":{"hypothesis":"Building the reusable mask-token embedding block through the existing torch embed path and converting once might be marginally cheaper than the current materialization route.","rollback_reason":"Across repeated runs this variant was effectively tied with the kept cached-mask baseline, so the tiny difference is not actionable.","next_action_hint":"Keep the simpler cached-mask baseline and continue looking for larger structural wins rather than sub-noise embedding materialization variants.","learning":"The cached mask-embedding idea is the real win; the exact one-time construction route for that cache block is within noise on the full benchmark.","reruns":"Observed 28.37, 28.36, and 28.38 tok/s; treat as tied with the kept ~28.3 tok/s baseline."}}
{"run":85,"commit":"e7b14c4","metric":28.36414999837841,"metrics":{},"status":"discard","description":"Re-measure the current stock omni9b-phase2prime non-DFlash path against the latest hybrid-native DFlash baseline. Stock remains effectively tied with the kept ~28.3 tok/s DFlash path on the warmed 256-token workload.","timestamp":1775976770222,"segment":4,"confidence":21.448951666406128,"iterationTokens":1118,"asi":{"hypothesis":"The latest cached-mask DFlash baseline may now have pulled clearly ahead of stock on the current workload, so a fresh stock comparator is needed.","rollback_reason":"No code change and the stock path measured essentially tied with the kept DFlash baseline, so there is no new optimization to keep.","next_action_hint":"Treat the current situation as parity between stock and DFlash on this workload and continue pursuing structural acceptance/runtime improvements rather than assuming DFlash is already ahead in a meaningful way.","learning":"On the current warmed 256-token benchmark, stock is still about 28.36 tok/s, essentially matching the latest DFlash result."}}
{"run":86,"commit":"e7b14c4","metric":28.02819243939543,"metrics":{},"status":"discard","description":"Load the MLX-native drafter weights as bf16 instead of float32 to reduce MLX-side bandwidth and compute cost. This regressed the full omni9b-phase2prime server benchmark versus the kept cached-mask baseline.","timestamp":1776008234585,"segment":4,"confidence":21.311454820799952,"iterationTokens":647,"asi":{"hypothesis":"The hybrid-native path may benefit from lower-precision drafter weights now that the main state/caching bugs are fixed, potentially improving MLX-side throughput without hurting acceptance too much.","rollback_reason":"The full server benchmark dropped below the kept cached-mask baseline, so bf16-loading the native drafter is not a win here.","next_action_hint":"Keep float32-loaded native drafter weights for the current hybrid path and test fp16 loading separately if continuing to probe precision/bandwidth tradeoffs.","learning":"The native drafter is sensitive to precision in this hybrid runtime. Lowering weight precision to bf16 lost more than it gained."}}
{"run":87,"commit":"e7b14c4","metric":28.04186811671889,"metrics":{},"status":"discard","description":"Load the MLX-native drafter weights as fp16 instead of float32 to reduce MLX-side cost while staying closer to the previous float32 baseline than bf16. This still regressed the full server benchmark.","timestamp":1776008284686,"segment":4,"confidence":22.38458134487644,"iterationTokens":1222,"asi":{"hypothesis":"fp16 drafter weights might preserve enough acceptance quality while reducing MLX-side overhead better than float32 in the hybrid-native path.","rollback_reason":"The full benchmark still fell below the kept cached-mask baseline, so fp16-loading the native drafter is not a win.","next_action_hint":"Keep float32-loaded native drafter weights and continue targeting bridge/runtime overhead rather than further simple precision downgrades.","learning":"Both bf16 and fp16 native drafter loads underperform the float32-loaded hybrid baseline on this workload."}}
{"run":88,"commit":"e7b14c4","metric":28.109523763247946,"metrics":{},"status":"discard","description":"Re-test DFlash block_size=8 on the current cached-mask hybrid-native baseline to see whether smaller speculative blocks help when acceptance remains low. It still underperformed the kept block_size=16 baseline on the full server workload.","timestamp":1776008329927,"segment":4,"confidence":22.41334946552943,"iterationTokens":938,"asi":{"hypothesis":"With acceptance still relatively low, reducing the speculative block size from 16 to 8 might reduce wasted verify work and improve end-to-end throughput.","rollback_reason":"The full benchmark stayed below the kept cached-mask block_size=16 baseline, so block_size=8 is still not the right setting for this workload.","next_action_hint":"Keep block_size=16 and continue targeting runtime overhead or acceptance quality instead of smaller speculative blocks.","learning":"Even after recent hybrid-native improvements, block_size=8 still loses to 16 on the real omni9b-phase2prime server benchmark."}}
{"run":89,"commit":"e7b14c4","metric":27.99390305083864,"metrics":{},"status":"discard","description":"Re-test the hybrid-native DFlash path with a much smaller speculative block (`block_size=4`) to see whether the low-acceptance regime benefits from less wasted verify work. It still underperformed the kept block_size=16 baseline.","timestamp":1776008994673,"segment":4,"confidence":23.526033749452825,"iterationTokens":9665,"asi":{"hypothesis":"If acceptance remains relatively low on omni9b-phase2prime, reducing the speculative block to 4 may cut wasted verify work enough to beat the current block_size=16 baseline.","rollback_reason":"The full benchmark stayed below the kept cached-mask block_size=16 baseline, so block_size=4 is not beneficial on this workload.","next_action_hint":"Keep block_size=16 and continue looking for structural acceptance or bridge/runtime wins rather than smaller speculative blocks.","learning":"Even aggressively shrinking the speculative block does not help the current hybrid-native server path on omni9b-phase2prime."}}
{"run":90,"commit":"e7b14c4","metric":28.0299184179655,"metrics":{},"status":"discard","description":"Return fused conditioning hidden states directly on MLX from the target bridge so the hybrid-native loop can skip the per-step torch.cat plus torch->MLX round-trip for target_hidden. This still regressed versus the cached-mask baseline.","timestamp":1776009101353,"segment":4,"confidence":23.79649075833077,"iterationTokens":3834,"asi":{"hypothesis":"Eliminating the per-step hidden-state torch handoff should reduce bridge overhead enough to improve the hybrid-native path.","rollback_reason":"The full benchmark stayed below the kept cached-mask baseline, so this MLX hidden-state handoff variant is not a win.","next_action_hint":"Keep the cached-mask baseline and continue focusing on larger remaining bridge/runtime costs rather than the target_hidden handoff alone.","learning":"Even removing the explicit target_hidden bounce is not sufficient to beat the current cached-mask baseline in the server path."}}
{"run":91,"commit":"e7b14c4","metric":28.082737228829348,"metrics":{},"status":"discard","description":"Elide the explicit mx.eval() inside the MLX->torch bridge conversion and rely on the conversion itself as the synchronization point. This did not beat the cached-mask baseline.","timestamp":1776009326183,"segment":4,"confidence":25.008505969864064,"iterationTokens":3834,"asi":{"hypothesis":"The target bridge may be over-synchronizing by calling mx.eval before every MLX->torch conversion; removing that explicit sync could improve the hybrid-native path.","rollback_reason":"The full benchmark remained below the kept cached-mask baseline, so this sync-elision attempt is not a win in the current bridge implementation.","next_action_hint":"Keep the current bridge conversion behavior and continue searching for larger wins than this local synchronization tweak.","learning":"The explicit mx.eval in _mx_to_torch is not the dominant remaining cost on the full server workload."}}
{"run":92,"commit":"e7b14c4","metric":27.957104608876275,"metrics":{},"status":"discard","description":"Cache the single-token draft-input embedding across steps when the same last token repeats, on top of the cached-mask baseline. This regressed the full server benchmark.","timestamp":1776009388924,"segment":4,"confidence":27.03902050187735,"iterationTokens":1399,"asi":{"hypothesis":"The hybrid-native path may waste work re-embedding the same last token across repeated low-acceptance steps, so caching the one-token embedding could help.","rollback_reason":"The full benchmark fell below the kept cached-mask baseline, so the one-token embedding cache is not a win.","next_action_hint":"Keep only the repeated mask-embedding cache and avoid further small embedding memoization ideas unless a profile clearly points there.","learning":"Re-embedding the current last token is not a dominant enough cost to justify this memoization in the current server path."}}
{"run":93,"commit":"e7b14c4","metric":27.85975170541522,"metrics":{},"status":"discard","description":"Add an opt-in full MLX native target-loop DFlash execution path in the runtime, using rollback-capable Qwen3.5 target caches and the corrected native probe semantics. This remained slower than the kept cached-mask hybrid path on the full server benchmark.","timestamp":1776009502515,"segment":4,"confidence":28.242082417961914,"iterationTokens":6648,"asi":{"hypothesis":"Now that native target rollback and draft crop semantics are understood, wiring the full native target loop into the real runtime may beat the hybrid bridge path on the benchmark workload.","rollback_reason":"The full benchmark stayed below the kept cached-mask hybrid baseline, so this first in-runtime native target-loop integration is not yet competitive.","next_action_hint":"Keep the hybrid-native cached-mask path as the main baseline and continue using the native target loop as a structural debugging scaffold rather than the shipping path.","learning":"The corrected native target-loop semantics are runnable in the real runtime now, but they still do not outperform the bridge-based hybrid path on this workload."}}
{"run":94,"commit":"e7b14c4","metric":27.676137693662717,"metrics":{},"status":"discard","description":"Re-test a larger scheduler stream interval (`16`) on top of the current hybrid-native DFlash baseline. It still regressed on the full server benchmark.","timestamp":1776009584201,"segment":4,"confidence":29.417524378591356,"iterationTokens":1638,"asi":{"hypothesis":"DFlash may prefer a more aggressive non-streaming scheduler cadence than the current global stream_interval=8, reducing coordinator overhead on the one-request benchmark.","rollback_reason":"The full benchmark dropped below the kept cached-mask baseline, so stream_interval=16 is still not beneficial for this workload even with DFlash enabled.","next_action_hint":"Restore stream_interval=8 and, if continuing scheduler experiments, test only narrower DFlash-specific cadence changes rather than global 16-token batching.","learning":"The current DFlash path still prefers the existing stream_interval=8 setting over 16 on the real server benchmark."}}
