{"run":1021,"commit":"8b55918","metric":40.62667888753775,"metrics":{},"status":"discard","description":"Mirror trough follow-up showing stalled recovery near ~40 tok/s.","timestamp":1776305961020,"segment":23,"confidence":3.6373788485755227,"iterationTokens":612,"asi":{"hypothesis":"Recovery might continue upward, but trough may temporarily plateau.","rollback_reason":"Flat/slightly worse (~40.63) and still far below keep.","next_action_hint":"Take immediate control parity sample to confirm symmetric trough persistence.","backend":"mirror_sd_mlx","context_only_draft_cache":1,"draft_sink":48,"delta_vs_keep":-66.23332111246225,"recovery_stall":true}}
{"run":1022,"commit":"8b55918","metric":42.5417204513971,"metrics":{},"status":"discard","description":"Control parity sample during mirror ~40 tok/s trough (mirror disabled).","timestamp":1776306003911,"segment":23,"confidence":3.6262841688374574,"iterationTokens":686,"asi":{"hypothesis":"Control should also sit in low-40s if trough is shared.","rollback_reason":"Control at ~42.54 confirms shared deep trough.","next_action_hint":"Return to mirror and continue recovery tracking; no candidate probes in this band.","backend":"bstnxbt_mlx","mirror_runtime_enabled":0,"context_only_draft_cache":1,"draft_sink":48,"paired_mirror_tok_s":40.62667888753775,"paired_delta_tok_s":-1.9150415638593485,"shared_trough":true}}
{"run":1023,"commit":"8b55918","metric":52.36213325698658,"metrics":{},"status":"discard","description":"Mirror recovery step from low-40 trough into low-50s.","timestamp":1776306038217,"segment":23,"confidence":3.540439152870124,"iterationTokens":649,"asi":{"hypothesis":"Shared recovery should progress from 40s toward 50/60 bands.","rollback_reason":"Improved to ~52.36 but still deeply below keep.","next_action_hint":"Continue recovery-only samples; add control parity check once mirror reaches 60+.","backend":"mirror_sd_mlx","context_only_draft_cache":1,"draft_sink":48,"delta_vs_keep":-54.49786674301342}}
{"run":1024,"commit":"8b55918","metric":37.89316512202081,"metrics":{},"status":"discard","description":"Mirror recovery interruption: relapsed from low-50 back to high-30 band.","timestamp":1776306081114,"segment":23,"confidence":3.4535329590316572,"iterationTokens":589,"asi":{"hypothesis":"Recovery might be non-monotonic with secondary dips before full rebound.","rollback_reason":"Relapse to ~37.89 confirms ongoing severe oscillation.","next_action_hint":"Take control parity sample to verify shared relapse before proceeding.","backend":"mirror_sd_mlx","context_only_draft_cache":1,"draft_sink":48,"delta_vs_keep":-68.9668348779792,"recovery_relapse":true}}
{"run":1025,"commit":"8b55918","metric":52.63751800722274,"metrics":{},"status":"discard","description":"Control parity sample after mirror relapse to high-30s (mirror disabled).","timestamp":1776306119699,"segment":23,"confidence":3.361029531160674,"iterationTokens":695,"asi":{"hypothesis":"If relapse is shared, control should also remain in low/mid-50 degraded band.","rollback_reason":"Control at ~52.64 confirms shared degraded oscillation.","next_action_hint":"Return to mirror and keep recovery tracking until 90+ re-entry.","backend":"bstnxbt_mlx","mirror_runtime_enabled":0,"context_only_draft_cache":1,"draft_sink":48,"paired_mirror_tok_s":37.89316512202081,"paired_delta_tok_s":-14.74435288520193,"shared_instability":true}}
{"run":1026,"commit":"8b55918","metric":44.647237175912096,"metrics":{},"status":"discard","description":"Mirror follow-up after control low-50 parity sample in degraded regime.","timestamp":1776306158672,"segment":23,"confidence":3.2793597243134536,"iterationTokens":658,"asi":{"hypothesis":"Mirror should stay in same degraded 40-50 band during unstable trough.","rollback_reason":"Mirror at ~44.65 remains far below keep.","next_action_hint":"Continue recovery-only bundle; next control check after mirror reaches 60+.","backend":"mirror_sd_mlx","context_only_draft_cache":1,"draft_sink":48,"paired_control_tok_s":52.63751800722274,"paired_delta_tok_s":-7.990280831310641,"delta_vs_keep":-62.21276282408791}}
{"run":1027,"commit":"8b55918","metric":45.86803321139797,"metrics":{},"status":"discard","description":"Mirror degraded-band sample with elevated startup variance.","timestamp":1776306198334,"segment":23,"confidence":3.258536500246825,"iterationTokens":645,"asi":{"hypothesis":"Throughput remains trough-bound even with occasional startup-time variation.","rollback_reason":"~45.87 tok/s remains far below keep.","next_action_hint":"Continue recovery-only runs; ignore startup variance unless persistent.","backend":"mirror_sd_mlx","context_only_draft_cache":1,"draft_sink":48,"startup_s":4.136481374967843,"delta_vs_keep":-60.99196678860203}}
{"run":1028,"commit":"8b55918","metric":59.11038111669918,"metrics":{},"status":"discard","description":"Mirror recovery step from 40s into upper-50s.","timestamp":1776306247650,"segment":23,"confidence":3.236561443323202,"iterationTokens":3858,"asi":{"hypothesis":"Degraded regime should recover through 50s before reaching 70+.","rollback_reason":"Upper-50s still far below keep.","next_action_hint":"Continue recovery tracking; take control parity sample near 70+.","backend":"mirror_sd_mlx","context_only_draft_cache":1,"draft_sink":48,"delta_vs_keep":-47.74961888330082}}
{"run":1029,"commit":"8b55918","metric":65.56695459775933,"metrics":{},"status":"discard","description":"Mirror recovery continuation into mid-60s after severe trough.","timestamp":1776306278929,"segment":23,"confidence":3.221779094885963,"iterationTokens":574,"asi":{"hypothesis":"Recovery should progress 50s→60s→70s before high-band return.","rollback_reason":"Mid-60 remains well below keep.","next_action_hint":"Continue recovery-only cadence and check control parity after next step.","backend":"mirror_sd_mlx","context_only_draft_cache":1,"draft_sink":48,"delta_vs_keep":-41.29304540224067}}
{"run":1030,"commit":"8b55918","metric":70.96637153937445,"metrics":{},"status":"discard","description":"Control parity sample during mirror mid-60 recovery stage (mirror disabled).","timestamp":1776306311413,"segment":23,"confidence":3.210851593622171,"iterationTokens":668,"asi":{"hypothesis":"Control should recover in tandem if instability remains shared.","rollback_reason":"Control in low-70 confirms shared rebound but still far below keep.","next_action_hint":"Return to mirror and continue staged recovery tracking toward 90+.","backend":"bstnxbt_mlx","mirror_runtime_enabled":0,"context_only_draft_cache":1,"draft_sink":48,"paired_mirror_tok_s":65.56695459775933,"paired_delta_tok_s":-5.399416941615116,"shared_recovery":true}}
{"run":1031,"commit":"8b55918","metric":71.91006312393067,"metrics":{},"status":"discard","description":"Mirror follow-up after control low-70 parity sample.","timestamp":1776306339903,"segment":23,"confidence":3.1893638534348643,"iterationTokens":639,"asi":{"hypothesis":"Mirror should track control in low-70 band during shared rebound.","rollback_reason":"Mirror reached ~71.91 but still below keep.","next_action_hint":"Continue recovery bundle; next control check once mirror reaches 80+.","backend":"mirror_sd_mlx","context_only_draft_cache":1,"draft_sink":48,"paired_control_tok_s":70.96637153937445,"paired_delta_tok_s":0.9436915845562166,"delta_vs_keep":-34.94993687606933}}
{"run":1032,"commit":"8b55918","metric":69.28596268154118,"metrics":{},"status":"discard","description":"Mirror recovery wobble within high-60/low-70 band.","timestamp":1776306369685,"segment":23,"confidence":3.1681618029172696,"iterationTokens":631,"asi":{"hypothesis":"Recovery in this phase is noisy and may oscillate before climbing further.","rollback_reason":"~69.29 remains well below keep.","next_action_hint":"Continue recovery tracking; if band stalls, re-check control parity.","backend":"mirror_sd_mlx","context_only_draft_cache":1,"draft_sink":48,"delta_vs_keep":-37.57403731845882,"recovery_wobble":true}}
{"run":1033,"commit":"8b55918","metric":71.24225767863815,"metrics":{},"status":"discard","description":"Mirror recovery sample returning to low-70 after wobble.","timestamp":1776306399468,"segment":23,"confidence":3.1539303940656387,"iterationTokens":597,"asi":{"hypothesis":"Recovery remains in low-70 holding pattern before next upward step.","rollback_reason":"Still far below keep.","next_action_hint":"Take control parity sample now to verify shared low-70 stall.","backend":"mirror_sd_mlx","context_only_draft_cache":1,"draft_sink":48,"delta_vs_keep":-35.61774232136185}}
{"run":1034,"commit":"8b55918","metric":72.01032694194221,"metrics":{},"status":"discard","description":"Control parity sample during mirror low-70 stall (mirror disabled).","timestamp":1776306431803,"segment":23,"confidence":3.1305750428431924,"iterationTokens":652,"asi":{"hypothesis":"Control should also cluster in low-70 if stall is shared.","rollback_reason":"Control ~72.01 confirms shared low-70 stall, still below keep.","next_action_hint":"Return to mirror and continue recovery monitoring toward 80+.","backend":"bstnxbt_mlx","mirror_runtime_enabled":0,"context_only_draft_cache":1,"draft_sink":48,"paired_mirror_tok_s":71.24225767863815,"paired_delta_tok_s":-0.7680692633040626,"shared_stall":true}}
{"run":1035,"commit":"8b55918","metric":77.15929442847782,"metrics":{},"status":"discard","description":"Mirror recovery step from low-70 stall into upper-70s.","timestamp":1776306462598,"segment":23,"confidence":3.1006839478111625,"iterationTokens":645,"asi":{"hypothesis":"Shared rebound should resume upward progression after low-70 stall.","rollback_reason":"Upper-70 still below keep.","next_action_hint":"Continue recovery-only tracking; next control check after mirror enters 80s.","backend":"mirror_sd_mlx","context_only_draft_cache":1,"draft_sink":48,"delta_vs_keep":-29.70070557152218}}
{"run":1036,"commit":"8b55918","metric":78.94621654539732,"metrics":{},"status":"discard","description":"Mirror recovery continuation approaching 80 tok/s.","timestamp":1776306491536,"segment":23,"confidence":3.0713582615025397,"iterationTokens":580,"asi":{"hypothesis":"Recovery should cross into 80+ after upper-70 transition.","rollback_reason":"~78.95 still below keep.","next_action_hint":"Take control parity sample now to confirm shared upper-70/80 approach.","backend":"mirror_sd_mlx","context_only_draft_cache":1,"draft_sink":48,"delta_vs_keep":-27.91378345460268}}
{"run":1037,"commit":"8b55918","metric":81.09191236245286,"metrics":{},"status":"discard","description":"Control parity sample after mirror upper-70 recovery (mirror disabled).","timestamp":1776306524375,"segment":23,"confidence":2.9999799703777685,"iterationTokens":659,"asi":{"hypothesis":"Control should also reach low-80 if rebound remains shared.","rollback_reason":"Control at ~81.09 confirms shared climb but still below keep.","next_action_hint":"Return to mirror and continue recovery tracking toward 90+.","backend":"bstnxbt_mlx","mirror_runtime_enabled":0,"context_only_draft_cache":1,"draft_sink":48,"paired_mirror_tok_s":78.94621654539732,"paired_delta_tok_s":-2.1456958170555342,"shared_recovery":true}}
{"run":1038,"commit":"8b55918","metric":82.7166423277635,"metrics":{},"status":"discard","description":"Mirror recovery sample entering low-80 band.","timestamp":1776306553342,"segment":23,"confidence":2.9306841713715337,"iterationTokens":638,"asi":{"hypothesis":"Recovery should move through low-80s before returning to 90+.","rollback_reason":"Low-80 still below keep.","next_action_hint":"Continue recovery bundle; check control parity after further climb.","backend":"mirror_sd_mlx","context_only_draft_cache":1,"draft_sink":48,"delta_vs_keep":-24.143357672236494}}
{"run":1039,"commit":"8b55918","metric":74.28366408895165,"metrics":{},"status":"discard","description":"Mirror rebound wobble: dropped from low-80 back to mid-70.","timestamp":1776306581921,"segment":23,"confidence":2.924575868951467,"iterationTokens":558,"asi":{"hypothesis":"Recovery remains noisy with occasional reversions before full restoration.","rollback_reason":"Mid-70 is still far below keep.","next_action_hint":"Run control parity sample to verify shared wobble before continuing.","backend":"mirror_sd_mlx","context_only_draft_cache":1,"draft_sink":48,"delta_vs_keep":-32.57633591104835,"recovery_wobble":true}}
{"run":1040,"commit":"8b55918","metric":84.56619374909599,"metrics":{},"status":"discard","description":"Control parity sample after mirror mid-70 wobble (mirror disabled).","timestamp":1776306620175,"segment":23,"confidence":2.918492976129642,"iterationTokens":684,"asi":{"hypothesis":"Control should indicate whether wobble is shared and upward trend continues.","rollback_reason":"Control rebounded to ~84.57 while still below keep.","next_action_hint":"Return to mirror and continue recovery tracking toward 90+.","backend":"bstnxbt_mlx","mirror_runtime_enabled":0,"context_only_draft_cache":1,"draft_sink":48,"paired_mirror_tok_s":74.28366408895165,"paired_delta_tok_s":-10.28252966014434,"shared_instability":true}}
{"run":1041,"commit":"8b55918","metric":86.9227640624078,"metrics":{},"status":"discard","description":"Mirror recovery sample entering upper-80s after control rebound.","timestamp":1776306650039,"segment":23,"confidence":2.915293406298053,"iterationTokens":642,"asi":{"hypothesis":"Mirror should follow control rebound into upper-80 band.","rollback_reason":"Upper-80 still below keep.","next_action_hint":"Continue recovery bundle; perform control parity check near low-90 boundary.","backend":"mirror_sd_mlx","context_only_draft_cache":1,"draft_sink":48,"paired_control_tok_s":84.56619374909599,"paired_delta_tok_s":2.3565703133118063,"delta_vs_keep":-19.93723593759221}}
{"run":1042,"commit":"8b55918","metric":83.78333123287365,"metrics":{},"status":"discard","description":"Mirror recovery wobble: slipped from upper-80 back to mid-80.","timestamp":1776306676713,"segment":23,"confidence":2.9121008442175738,"iterationTokens":623,"asi":{"hypothesis":"Rebound remains noisy with local reversions before 90+ re-entry.","rollback_reason":"Mid-80 still below keep.","next_action_hint":"Take control parity sample to classify whether both backends wobble similarly.","backend":"mirror_sd_mlx","context_only_draft_cache":1,"draft_sink":48,"delta_vs_keep":-23.076668767126353,"recovery_wobble":true}}
{"run":1043,"commit":"8b55918","metric":80.24256318814658,"metrics":{},"status":"discard","description":"Control parity sample after mirror mid-80 wobble (mirror disabled).","timestamp":1776306708478,"segment":23,"confidence":2.8955969636551866,"iterationTokens":689,"asi":{"hypothesis":"Control should show whether wobble is shared or mirror-specific.","rollback_reason":"Control at ~80.24 shows shared degraded wobble; still below keep.","next_action_hint":"Return to mirror and continue recovery-only monitoring.","backend":"bstnxbt_mlx","mirror_runtime_enabled":0,"context_only_draft_cache":1,"draft_sink":48,"paired_mirror_tok_s":83.78333123287365,"paired_delta_tok_s":3.5407680447270686,"shared_instability":true}}
{"run":1044,"commit":"8b55918","metric":85.86844550664694,"metrics":{},"status":"discard","description":"Mirror rebound sample after control low-80 parity.","timestamp":1776306736326,"segment":23,"confidence":2.8871028560972305,"iterationTokens":641,"asi":{"hypothesis":"Mirror should recover back into mid/upper-80s as shared wobble rebounds.","rollback_reason":"~85.87 remains below keep.","next_action_hint":"Continue recovery tracking; add control parity check near 90 boundary.","backend":"mirror_sd_mlx","context_only_draft_cache":1,"draft_sink":48,"paired_control_tok_s":80.24256318814658,"paired_delta_tok_s":5.625882318500358,"delta_vs_keep":-20.99155449335306}}
{"run":1045,"commit":"8b55918","metric":86.90039856701091,"metrics":{},"status":"discard","description":"Mirror recovery continuation holding high-80s.","timestamp":1776306765809,"segment":23,"confidence":2.84951665384804,"iterationTokens":627,"asi":{"hypothesis":"Recovery may establish high-80 foothold before low-90 transition.","rollback_reason":"High-80 still below keep.","next_action_hint":"Take control parity sample now to verify shared high-80 foothold.","backend":"mirror_sd_mlx","context_only_draft_cache":1,"draft_sink":48,"delta_vs_keep":-19.95960143298909}}
{"run":1046,"commit":"8b55918","metric":85.19023651007436,"metrics":{},"status":"discard","description":"Control parity sample for mirror high-80 foothold (mirror disabled).","timestamp":1776306799530,"segment":23,"confidence":2.811828885584341,"iterationTokens":656,"asi":{"hypothesis":"Control should remain in similar high-80 band if rebound is shared.","rollback_reason":"Control ~85.19 confirms parity in high-80 zone but still below keep.","next_action_hint":"Return to mirror and continue monitoring for 90+ re-entry.","backend":"bstnxbt_mlx","mirror_runtime_enabled":0,"context_only_draft_cache":1,"draft_sink":48,"paired_mirror_tok_s":86.90039856701091,"paired_delta_tok_s":1.7101620569365545,"shared_recovery":true}}
{"run":1047,"commit":"8b55918","metric":87.2971022649068,"metrics":{},"status":"discard","description":"Mirror recovery sample nudging upward within high-80 band.","timestamp":1776306827293,"segment":23,"confidence":2.7833443112264544,"iterationTokens":655,"asi":{"hypothesis":"High-80 band should eventually transition to low-90 if rebound continues.","rollback_reason":"Still below keep at ~87.30.","next_action_hint":"Continue recovery-only cadence; check control once mirror reaches 90+.","backend":"mirror_sd_mlx","context_only_draft_cache":1,"draft_sink":48,"delta_vs_keep":-19.5628977350932}}
{"run":1048,"commit":"8b55918","metric":88.83409918572521,"metrics":{},"status":"discard","description":"Mirror recovery continuation approaching 90 tok/s.","timestamp":1776306853541,"segment":23,"confidence":2.770106183118362,"iterationTokens":578,"asi":{"hypothesis":"Recovery should cross into low-90 after high-80 build-up.","rollback_reason":"~88.83 still below keep.","next_action_hint":"Take control parity sample near this boundary to validate shared progression.","backend":"mirror_sd_mlx","context_only_draft_cache":1,"draft_sink":48,"delta_vs_keep":-18.02590081427479}}
{"run":1049,"commit":"8b55918","metric":85.73881840633258,"metrics":{},"status":"discard","description":"Control parity sample near mirror 90-boundary recovery (mirror disabled).","timestamp":1776306887963,"segment":23,"confidence":2.7224811640914317,"iterationTokens":654,"asi":{"hypothesis":"Control should indicate whether high-80 progression is shared or diverging.","rollback_reason":"Control slipped to ~85.74; still below keep and shows continued wobble.","next_action_hint":"Return to mirror and keep recovery tracking; no structural probes until 100+ re-entry.","backend":"bstnxbt_mlx","mirror_runtime_enabled":0,"context_only_draft_cache":1,"draft_sink":48,"paired_mirror_tok_s":88.83409918572521,"paired_delta_tok_s":3.0952807793926316,"shared_wobble":true}}
{"run":1050,"commit":"8b55918","metric":87.47470250458784,"metrics":{},"status":"discard","description":"Mirror follow-up after control mid-80 wobble sample.","timestamp":1776306922086,"segment":23,"confidence":2.6764660519538377,"iterationTokens":672,"asi":{"hypothesis":"Mirror should remain around high-80 while shared wobble persists.","rollback_reason":"~87.47 still below keep.","next_action_hint":"Continue monitoring for low-90 and then 100+ re-entry before major probes.","backend":"mirror_sd_mlx","context_only_draft_cache":1,"draft_sink":48,"paired_control_tok_s":85.73881840633258,"paired_delta_tok_s":1.7358840982552601,"delta_vs_keep":-19.385297495412154}}
{"run":1051,"commit":"8b55918","metric":87.8231206332039,"metrics":{},"status":"discard","description":"Mirror stability sample in high-80 rebound band.","timestamp":1776306953391,"segment":23,"confidence":2.5976742936208135,"iterationTokens":833,"asi":{"hypothesis":"High-80 band may be re-stabilizing before low-90 transition.","rollback_reason":"Still below keep.","next_action_hint":"Take control parity sample to confirm shared high-80 hold.","backend":"mirror_sd_mlx","context_only_draft_cache":1,"draft_sink":48,"delta_vs_keep":-19.036879366796096}}
{"run":1052,"commit":"8b55918","metric":91.10345782310519,"metrics":{},"status":"discard","description":"Control parity sample after mirror high-80 hold (mirror disabled).","timestamp":1776306989751,"segment":23,"confidence":2.5052707961444955,"iterationTokens":653,"asi":{"hypothesis":"Control may confirm upward shift into low-90 band.","rollback_reason":"Control reached ~91.10 but still below keep.","next_action_hint":"Return to mirror and verify low-90 re-entry on mirror side.","backend":"bstnxbt_mlx","mirror_runtime_enabled":0,"context_only_draft_cache":1,"draft_sink":48,"paired_mirror_tok_s":87.8231206332039,"paired_delta_tok_s":-3.2803371899012896,"shared_recovery":true}}
{"run":1053,"commit":"8b55918","metric":80.92803299990298,"metrics":{},"status":"discard","description":"Mirror follow-up after control low-90 sample; rebound slipped back to low-80.","timestamp":1776307019307,"segment":23,"confidence":2.5042990943271417,"iterationTokens":641,"asi":{"hypothesis":"If regime remains unstable, mirror can revert despite control low-90 sample.","rollback_reason":"Dropped to ~80.93, confirming continued oscillatory instability.","next_action_hint":"Take control parity check to classify whether drop is shared or mirror-local.","backend":"mirror_sd_mlx","context_only_draft_cache":1,"draft_sink":48,"paired_control_tok_s":91.10345782310519,"paired_delta_tok_s":-10.175424823202215,"delta_vs_keep":-25.93196700009702,"instability_flip":true}}
