{"run":1740,"commit":"9a55d76","metric":8.764923377311788,"metrics":{},"status":"discard","description":"Immediate confirmation rerun stayed in the reopened high window (~108.13 tok/s, eval_s ~8.765) but did not beat the new best 8.756.","timestamp":1776371050457,"segment":24,"confidence":0.07585598221986059,"iterationTokens":1484,"asi":{"hypothesis":"If the new lower eval_s is real, adjacent reruns should remain near the same low-latency band even if not strictly better.","rollback_reason":"Primary metric did not improve versus current best.","next_action_hint":"Continue unchanged mirror loop while high window is open; trigger parity only on meaningful regime shift.","diagnostic_findings":{"completion_tok_s":108.13329726415944,"dflash_eval_s":8.764923377311788,"dflash_total_s":9.277223750017583,"dflash_acceptance_rate":0.6972201352366642}}}
{"run":1741,"commit":"63054b9","metric":8.747257996350527,"metrics":{},"status":"keep","description":"Unchanged mirror loop posted a fresh best eval-phase time (~8.747s) while keeping high throughput (~108.17 tok/s) in reopened high window.","timestamp":1776371093767,"segment":24,"confidence":0.09879361071482254,"iterationTokens":1403,"asi":{"hypothesis":"High-window re-entry can continue to lower eval_s at constant speculative acceptance without code changes.","diagnostic_findings":{"completion_tok_s":108.1696744341026,"dflash_eval_s":8.747257996350527,"dflash_total_s":9.264543542056344,"dflash_draft_s":0.17477725236676633,"dflash_verify_s":0.11770891072228551,"dflash_acceptance_rate":0.6972201352366642},"next_action_hint":"Run immediate unchanged confirmation to test persistence of the new best band before exploring further probes."}}
{"run":1742,"commit":"63054b9","metric":8.760838248068467,"metrics":{},"status":"discard","description":"Immediate confirmation remained in high window (~108.08 tok/s, eval_s ~8.761) but did not beat the new best 8.747.","timestamp":1776371126788,"segment":24,"confidence":0.09807232913894712,"iterationTokens":1268,"asi":{"hypothesis":"True high-window improvement should hold nearby, even if exact minima vary by noise.","rollback_reason":"Primary metric did not improve over current best.","next_action_hint":"Continue unchanged mirror loop while high-window remains open; avoid structural probes until regime shifts.","diagnostic_findings":{"completion_tok_s":108.07788852866031,"dflash_eval_s":8.760838248068467,"dflash_total_s":9.271747375023551,"dflash_acceptance_rate":0.6972201352366642}}}
{"run":1743,"commit":"63054b9","metric":8.757574041257612,"metrics":{},"status":"discard","description":"Mirror high-window repeat (~108.18 tok/s, eval_s ~8.758) stayed near the best band but did not beat 8.747.","timestamp":1776371156733,"segment":24,"confidence":0.09736150322653515,"iterationTokens":1191,"asi":{"hypothesis":"High-window remains open with tightly clustered low eval_s values.","rollback_reason":"Primary metric not better than current best.","next_action_hint":"Continue unchanged loop while this window persists; watch for drop into soft-band/collapse.","diagnostic_findings":{"completion_tok_s":108.18137400073057,"dflash_eval_s":8.757574041257612,"dflash_total_s":9.27059554203879,"dflash_acceptance_rate":0.6972201352366642}}}
{"run":1744,"commit":"63054b9","metric":8.759653790271841,"metrics":{},"status":"discard","description":"Mirror high-window sample (~108.26 tok/s, eval_s ~8.760) remained near-best but did not exceed 8.747.","timestamp":1776371186960,"segment":24,"confidence":0.09702304898894858,"iterationTokens":1170,"asi":{"hypothesis":"The current open high window is stable and low-latency but appears bounded just above the current best.","rollback_reason":"Primary metric not improved vs best.","next_action_hint":"Continue loop; trigger control parity only if regime shifts or mirror/control divergence appears.","diagnostic_findings":{"completion_tok_s":108.25914077563077,"dflash_eval_s":8.759653790271841,"dflash_total_s":9.271442582947202,"dflash_acceptance_rate":0.6972201352366642}}}
{"run":1745,"commit":"63054b9","metric":8.750731630250812,"metrics":{},"status":"discard","description":"Mirror high-window run (~108.37 tok/s, eval_s ~8.751) nearly matched best but did not improve it.","timestamp":1776371221582,"segment":24,"confidence":0.09668693971186992,"iterationTokens":1182,"asi":{"hypothesis":"High-window tail remains near the current best with minor jitter.","rollback_reason":"Primary metric not lower than best 8.747.","next_action_hint":"Keep running unchanged loop while this window holds; no new structural probes yet.","diagnostic_findings":{"completion_tok_s":108.3745173511303,"dflash_eval_s":8.750731630250812,"dflash_total_s":9.258371333009563,"dflash_acceptance_rate":0.6972201352366642}}}
{"run":1746,"commit":"54028e7","metric":8.743218171177432,"metrics":{},"status":"keep","description":"Unchanged mirror loop set a new best eval-phase time (~8.743s) with high throughput (~108.49 tok/s) in sustained high-window conditions.","timestamp":1776371253869,"segment":24,"confidence":0.10697396284511186,"iterationTokens":1175,"asi":{"hypothesis":"Sustained high-window occupancy can produce incremental eval_s minima without changing speculative acceptance dynamics.","diagnostic_findings":{"completion_tok_s":108.48783605859522,"dflash_eval_s":8.743218171177432,"dflash_total_s":9.249471874907613,"dflash_draft_s":0.17373883235268295,"dflash_verify_s":0.1146450883243233,"dflash_acceptance_rate":0.6972201352366642,"dflash_draft_steps":96},"next_action_hint":"Run immediate unchanged confirmation; if close, continue monitoring until collapse transition."}}
{"run":1747,"commit":"54028e7","metric":8.751389549230225,"metrics":{},"status":"discard","description":"Immediate confirmation remained in the same high window (~108.35 tok/s, eval_s ~8.751) but did not beat the new best 8.743.","timestamp":1776371286261,"segment":24,"confidence":0.10725848161812915,"iterationTokens":1280,"asi":{"hypothesis":"A real high-window low-latency state should persist across immediate reruns even if exact minima fluctuate.","rollback_reason":"Primary metric did not improve over current best.","next_action_hint":"Continue unchanged mirror loop; parity checks only on regime transitions.","diagnostic_findings":{"completion_tok_s":108.34925678923086,"dflash_eval_s":8.751389549230225,"dflash_total_s":9.260615708073601,"dflash_acceptance_rate":0.6972201352366642}}}
{"run":1748,"commit":"54028e7","metric":8.759821529849432,"metrics":{},"status":"discard","description":"Mirror high-window run (~108.34 tok/s, eval_s ~8.760) stayed close to best but did not set a new low.","timestamp":1776371318032,"segment":24,"confidence":0.10965125564527528,"iterationTokens":1226,"asi":{"hypothesis":"High-window remains active with tight eval_s clustering around 8.75–8.76.","rollback_reason":"Primary metric not better than current best (8.743).","next_action_hint":"Continue continuous mirror telemetry loop and wait for either a true new low or regime collapse.","diagnostic_findings":{"completion_tok_s":108.34067587213623,"dflash_eval_s":8.759821529849432,"dflash_total_s":9.267567583010532,"dflash_acceptance_rate":0.6972201352366642}}}
{"run":1749,"commit":"54028e7","metric":8.766188377281651,"metrics":{},"status":"discard","description":"Mirror high-window sample (~108.04 tok/s, eval_s ~8.766) remained close to the new best but did not exceed it.","timestamp":1776371370274,"segment":24,"confidence":0.11252376000235403,"iterationTokens":1626,"asi":{"hypothesis":"Current regime is a stable high-window cluster with low eval latency and fixed acceptance.","rollback_reason":"Primary metric not lower than current best 8.743.","next_action_hint":"Keep looping unchanged while high window remains open.","diagnostic_findings":{"completion_tok_s":108.039074755416,"dflash_eval_s":8.766188377281651,"dflash_total_s":9.278901665937155,"dflash_acceptance_rate":0.6972201352366642}}}
{"run":1750,"commit":"54028e7","metric":8.766931622987613,"metrics":{},"status":"discard","description":"Resumed unchanged mirror telemetry; high-window sample stayed strong (~108.31 tok/s) but above current best eval_s floor.","timestamp":1776371546977,"segment":24,"confidence":0.11486533129688598,"iterationTokens":1626,"asi":{"hypothesis":"Post-resume runs should stay in low-latency high-window unless regime shifts.","rollback_reason":"Primary metric did not beat current best (~8.743s).","next_action_hint":"Continue unchanged mirror loop; only trigger control parity if eval_s jumps into degraded band.","diagnostic_findings":{"completion_tok_s":108.30884308869861,"dflash_eval_s":8.766931622987613,"dflash_total_s":9.266736667021178,"dflash_acceptance_rate":0.6972201352366642,"dflash_draft_steps":96}}}
{"run":1751,"commit":"54028e7","metric":8.759577831369825,"metrics":{},"status":"discard","description":"Unchanged mirror telemetry remained in high band (~108.23 tok/s, eval_s ~8.760) with invariant acceptance profile.","timestamp":1776371571122,"segment":24,"confidence":0.11706951861751098,"iterationTokens":1201,"asi":{"hypothesis":"The reopened high-window should keep eval_s clustered near 8.75–8.77 absent a collapse transition.","rollback_reason":"Primary metric did not improve over best (~8.743s).","next_action_hint":"Continue unchanged loop; watch for abrupt eval_s inflation before triggering parity check.","diagnostic_findings":{"completion_tok_s":108.23218223847067,"dflash_eval_s":8.759577831369825,"dflash_total_s":9.271952833049,"dflash_acceptance_rate":0.6972201352366642}}}
{"run":1752,"commit":"54028e7","metric":8.770644495030865,"metrics":{},"status":"discard","description":"Mirror run softened slightly within high window (~108.06 tok/s, eval_s ~8.771) while acceptance/steps stayed fixed.","timestamp":1776371596270,"segment":24,"confidence":0.11956140518565912,"iterationTokens":1168,"asi":{"hypothesis":"Minor within-window drift should appear first in eval_s while speculative counters remain constant.","rollback_reason":"Primary metric worse than current best.","next_action_hint":"Keep monitoring unchanged lane; consider parity only if this drift expands into degraded band.","diagnostic_findings":{"completion_tok_s":108.05633729160478,"dflash_eval_s":8.770644495030865,"dflash_total_s":9.280767249991186,"dflash_acceptance_rate":0.6972201352366642}}}
{"run":1753,"commit":"54028e7","metric":8.802961918991059,"metrics":{},"status":"discard","description":"Mirror sample slipped out of prior 8.75–8.77 cluster to ~8.803 eval_s (~107.64 tok/s), with unchanged acceptance signature.","timestamp":1776371623769,"segment":24,"confidence":0.12190477639995143,"iterationTokens":1159,"asi":{"hypothesis":"If a new downshift is starting, eval_s should continue rising before acceptance metrics move.","rollback_reason":"Primary metric regressed versus best.","next_action_hint":"Run another mirror sample to confirm whether this is a temporary blip or onset of a soft-band transition; parity only if degradation deepens.","diagnostic_findings":{"completion_tok_s":107.63847625508262,"dflash_eval_s":8.802961918991059,"dflash_total_s":9.321778207900934,"dflash_acceptance_rate":0.6972201352366642,"dflash_draft_steps":96}}}
{"run":1754,"commit":"54028e7","metric":8.80828704929445,"metrics":{},"status":"discard","description":"Follow-up confirmed soft downshift from tight high window: eval_s stayed elevated (~8.808) with throughput ~107.65 tok/s and unchanged speculative counters.","timestamp":1776371648373,"segment":24,"confidence":0.1301629427431556,"iterationTokens":1246,"asi":{"hypothesis":"A regime softening should present as sustained eval_s lift with fixed acceptance structure.","rollback_reason":"Primary metric above current best.","next_action_hint":"Continue mirror monitoring; trigger immediate control parity if eval_s crosses into clear degraded zone (~9+).","diagnostic_findings":{"completion_tok_s":107.6544999614007,"dflash_eval_s":8.80828704929445,"dflash_total_s":9.32135370792821,"dflash_acceptance_rate":0.6972201352366642}}}
{"run":1755,"commit":"54028e7","metric":19.18204137380235,"metrics":{},"status":"discard","description":"Hard collapse onset on unchanged mirror shape: throughput dropped to ~51.17 tok/s with eval_s exploding to ~19.18 while acceptance stayed fixed.","timestamp":1776371685886,"segment":24,"confidence":0.12190477639995143,"iterationTokens":1214,"asi":{"hypothesis":"Collapse episodes are dominated by eval-phase inflation rather than speculative-quality degradation.","rollback_reason":"Primary metric catastrophically worse than best.","next_action_hint":"Run immediate control parity sample (mirror runtime off) to confirm shared-vs-mirror attribution in this collapse window.","diagnostic_findings":{"completion_tok_s":51.173141456920085,"dflash_eval_s":19.18204137380235,"dflash_total_s":19.821198333986104,"dflash_draft_s":0.3027442075544968,"dflash_verify_s":0.11320408363826573,"dflash_acceptance_rate":0.6972201352366642,"dflash_draft_steps":96}}}
{"run":1756,"commit":"54028e7","metric":27.001544167287648,"metrics":{},"status":"discard","description":"Immediate control parity in collapse window was even worse (~36.61 tok/s, eval_s ~27.00), confirming collapse is shared and not mirror-specific.","timestamp":1776371731391,"segment":24,"confidence":0.11956140518565912,"iterationTokens":1387,"asi":{"hypothesis":"If collapse is shared runtime-state behavior, control should also show severe eval inflation during the same window.","rollback_reason":"Parity run is diagnostic-only and far above best metric.","next_action_hint":"Return to mirror default and track rebound trajectory (recovery ladder) after shared collapse confirmation.","diagnostic_findings":{"completion_tok_s":36.61215708962097,"dflash_eval_s":27.001544167287648,"dflash_total_s":27.77879687503446,"dflash_draft_s":0.41708678426221013,"dflash_verify_s":0.12882703950162977,"dflash_acceptance_rate":0.6972201352366642,"attribution":"shared_collapse_confirmed_control_worse"}}}
{"run":1757,"commit":"54028e7","metric":29.242653629160486,"metrics":{},"status":"discard","description":"Post-parity mirror follow-up stayed in severe collapse (~33.86 tok/s, eval_s ~29.24), extending the shared degraded window.","timestamp":1776371779167,"segment":24,"confidence":0.11706951861751098,"iterationTokens":1277,"asi":{"hypothesis":"After shared collapse confirmation, mirror may remain in a deep degraded pocket before rebound begins.","rollback_reason":"Primary metric catastrophically worse than best.","next_action_hint":"Continue unchanged mirror monitoring to capture recovery staircase; avoid new code probes during acute collapse.","diagnostic_findings":{"completion_tok_s":33.85614503316819,"dflash_eval_s":29.242653629160486,"dflash_total_s":30.05681220907718,"dflash_draft_s":0.45335524738766253,"dflash_verify_s":0.12435529695358127,"dflash_acceptance_rate":0.6972201352366642}}}
{"run":1758,"commit":"54028e7","metric":20.246740585775115,"metrics":{},"status":"discard","description":"Mirror began rebound from severe trough (eval_s improved 29.24→20.25, tok/s 33.86→48.57) but remains deeply degraded versus best window.","timestamp":1776371814961,"segment":24,"confidence":0.1145586497405098,"iterationTokens":1242,"asi":{"hypothesis":"Collapse recovery proceeds in staged eval_s reductions while acceptance remains constant.","rollback_reason":"Primary metric still far above best.","next_action_hint":"Keep unchanged mirror tracking to map recovery ladder back toward soft/high bands.","diagnostic_findings":{"completion_tok_s":48.56758748413943,"dflash_eval_s":20.246740585775115,"dflash_total_s":20.89443254098296,"dflash_acceptance_rate":0.6972201352366642}}}
{"run":1759,"commit":"54028e7","metric":17.256754627102055,"metrics":{},"status":"discard","description":"Recovery continued (eval_s ~17.26, tok/s ~56.69) with unchanged acceptance signature, still far from soft/high bands.","timestamp":1776371850861,"segment":24,"confidence":0.1121532239491113,"iterationTokens":1178,"asi":{"hypothesis":"Shared collapse rebound should climb monotonically in tok/s as eval_s deflates, without acceptance-structure changes.","rollback_reason":"Primary metric still much worse than best.","next_action_hint":"Continue unchanged mirror monitoring through recovery phases; no new probe until near soft-band return.","diagnostic_findings":{"completion_tok_s":56.685155091145,"dflash_eval_s":17.256754627102055,"dflash_total_s":17.87313833308872,"dflash_acceptance_rate":0.6972201352366642}}}
{"run":1760,"commit":"54028e7","metric":12.269641414983198,"metrics":{},"status":"discard","description":"Rebound accelerated into mid-degraded band (~78.76 tok/s, eval_s ~12.27) while speculative structure remained constant.","timestamp":1776371879563,"segment":24,"confidence":0.10785923372037114,"iterationTokens":1179,"asi":{"hypothesis":"Recovery staircase will continue reducing eval_s toward prior soft-band levels without changing acceptance metrics.","rollback_reason":"Primary metric still above best by a wide margin.","next_action_hint":"Continue unchanged mirror tracking; if rebound stalls near 9–10 eval_s, resume normal high-window watch loop.","diagnostic_findings":{"completion_tok_s":78.76353808006057,"dflash_eval_s":12.269641414983198,"dflash_total_s":12.813420458929613,"dflash_acceptance_rate":0.6972201352366642}}}
{"run":1761,"commit":"54028e7","metric":12.004702708916739,"metrics":{},"status":"discard","description":"Mirror rebound continued modestly (~80.33 tok/s, eval_s ~12.00) but remains in degraded regime after collapse.","timestamp":1776371907240,"segment":24,"confidence":0.10388192521243804,"iterationTokens":1178,"asi":{"hypothesis":"Recovery should continue as eval_s slowly contracts while acceptance remains invariant.","rollback_reason":"Primary metric remains far from best.","next_action_hint":"Keep unchanged mirror loop to observe whether recovery reaches 9–10 eval_s soft band or re-collapses.","diagnostic_findings":{"completion_tok_s":80.33458518119608,"dflash_eval_s":12.004702708916739,"dflash_total_s":12.555562791996635,"dflash_acceptance_rate":0.6972201352366642}}}
{"run":1762,"commit":"54028e7","metric":16.410871873958968,"metrics":{},"status":"discard","description":"Recovery was not monotonic: mirror whipsawed back to degraded eval_s (~16.41, ~59.50 tok/s) after reaching ~12.00.","timestamp":1776371951510,"segment":24,"confidence":0.10258404045259391,"iterationTokens":1654,"asi":{"hypothesis":"Post-collapse rebound exhibits oscillatory whipsaws, not smooth monotonic recovery.","rollback_reason":"Primary metric remains far above best.","next_action_hint":"Continue unchanged monitoring to map oscillation envelope and wait for re-entry into soft/high bands before any new probe.","diagnostic_findings":{"completion_tok_s":59.5009562102628,"dflash_eval_s":16.410871873958968,"dflash_total_s":17.015905625070445,"dflash_acceptance_rate":0.6972201352366642,"regime":"post-collapse_whipsaw"}}}
{"run":1763,"commit":"54028e7","metric":9.471592248301022,"metrics":{},"status":"discard","description":"Large rebound jump re-entered soft band (~100.65 tok/s, eval_s ~9.47) after degraded whipsaw, with acceptance still unchanged.","timestamp":1776371978019,"segment":24,"confidence":0.10156101478199564,"iterationTokens":1221,"asi":{"hypothesis":"Even deep collapse windows can rapidly snap back toward soft-band eval_s without any speculative-structure change.","rollback_reason":"Primary metric still above best (~8.743).","next_action_hint":"Continue mirror loop to see whether soft-band recovery progresses back into high-window (<8.9 eval_s) or oscillates.","diagnostic_findings":{"completion_tok_s":100.65249157182116,"dflash_eval_s":9.471592248301022,"dflash_total_s":9.987388583016582,"dflash_acceptance_rate":0.6972201352366642,"regime":"soft_band_reentry"}}}
{"run":1764,"commit":"54028e7","metric":9.42917166405823,"metrics":{},"status":"discard","description":"Soft-band recovery held and improved slightly (~100.96 tok/s, eval_s ~9.43), still above high-window best.","timestamp":1776372003534,"segment":24,"confidence":0.10177890874919779,"iterationTokens":1234,"asi":{"hypothesis":"After deep collapse, regime may stabilize in ~9.4–9.5 eval_s pocket before any high-window re-entry.","rollback_reason":"Primary metric not better than best.","next_action_hint":"Continue unchanged mirror telemetry; monitor for either sub-9 breakout or renewed collapse.","diagnostic_findings":{"completion_tok_s":100.95745634179576,"dflash_eval_s":9.42917166405823,"dflash_total_s":9.949304791982286,"dflash_acceptance_rate":0.6972201352366642}}}
{"run":1765,"commit":"54028e7","metric":15.252288250834681,"metrics":{},"status":"discard","description":"Soft-band recovery snapped back into a fresh collapse (~63.91 tok/s, eval_s ~15.25) with acceptance unchanged, indicating renewed regime whipsaw.","timestamp":1776372039462,"segment":24,"confidence":0.10102074795945186,"iterationTokens":1262,"asi":{"hypothesis":"This is another shared runtime-state transition, not speculative-quality drift, given unchanged acceptance counters.","rollback_reason":"Primary metric far above best.","next_action_hint":"Run immediate control parity sample to verify shared attribution for this renewed collapse onset.","diagnostic_findings":{"completion_tok_s":63.90762751592479,"dflash_eval_s":15.252288250834681,"dflash_total_s":15.829728167038411,"dflash_acceptance_rate":0.6972201352366642,"transition":"soft_to_collapse"}}}
