{"run":2543,"commit":"26f9501","metric":103.0962800581677,"metrics":{},"status":"discard","description":"Candidate trimmed unreachable draft depth rows (max depth=min(block,budget)); DDTree ticked up only marginally (~103.10 vs 102.98 tok/s, tree_build 1.938→1.931s), treated as noise-level/non-robust.","timestamp":1776484555450,"segment":25,"confidence":3.6676890678342042,"iterationTokens":3054,"asi":{"hypothesis":"Budget-limited trees never reach depth > budget, so skipping deeper top-k rows should cut tree-build work without quality loss.","rollback_reason":"Primary gain was tiny (~+0.11 tok/s) with minimal timing movement and not strong enough to treat as robust keep.","next_action_hint":"Run immediate no-DDTree control parity to confirm floor stability, then seek higher-leverage tree-build reductions.","diagnostic_findings":{"completion_tok_s":103.0962800581677,"dflash_eval_s":9.926200125,"dflash_ddtree_tree_build_s":1.931438583,"delta_vs_matched_ddtree_baseline_tok_s":0.11252478708001833,"delta_tree_build_s":-0.007009744000000095}}}
{"run":2544,"commit":"26f9501","metric":108.24753119058235,"metrics":{},"status":"discard","description":"Immediate no-DDTree control parity remained in floor band (~108.25 tok/s, eval ~8.76, fused-only, safe_mode=0), confirming DDTree gap persists and window is stable.","timestamp":1776484582107,"segment":25,"confidence":3.693931980417853,"iterationTokens":2170,"asi":{"hypothesis":"Control should stay near-floor if the DDTree candidate result was DDTree-path-specific rather than regime drift.","rollback_reason":"No code changes; parity attribution sample.","next_action_hint":"Continue DDTree-only experiments on higher-leverage tree-build costs while floor pocket persists.","diagnostic_findings":{"completion_tok_s":108.24753119058235,"dflash_eval_s":8.758985752356239,"safe_mode_active":0,"verify_eval_wait_fused_steps":96,"verify_eval_wait_unfused_steps":0}}}
{"run":2545,"commit":"26f9501","metric":102.5283702257278,"metrics":{},"status":"discard","description":"DDTree candidate with top-k cap 11 regressed (~102.53 tok/s vs ~102.98 baseline) and increased tree-build/verify time.","timestamp":1776484714135,"segment":25,"confidence":3.71631525228777,"iterationTokens":12700,"asi":{"hypothesis":"A moderate top-k cap (11) might cut tree-build cost without major acceptance loss compared with uncapped budget-13 path.","rollback_reason":"Primary metric regressed and phase timings worsened (tree_build ~1.951s, verify ~0.138s).","next_action_hint":"Treat top-k cap 11 as non-winning in this lane and return to code-level tree-build experiments.","diagnostic_findings":{"completion_tok_s":102.5283702257278,"dflash_eval_s":9.98079775,"dflash_ddtree_tree_build_s":1.9509694979999999,"dflash_ddtree_tree_verify_s":0.138427081,"delta_vs_recent_ddtree_baseline_tok_s":-0.45538504535989255}}}
{"run":2546,"commit":"26f9501","metric":107.44628741442311,"metrics":{},"status":"discard","description":"Control parity after top-k-cap=11 DDTree trial stayed healthy (~107.45 tok/s, eval ~8.81, safe_mode=0), confirming DDTree regression is not shared instability.","timestamp":1776484742756,"segment":25,"confidence":3.7067381037088016,"iterationTokens":1716,"asi":{"hypothesis":"No-DDTree lane should remain near-floor if top-k-cap=11 loss is DDTree-specific.","rollback_reason":"No code changes; parity attribution sample.","next_action_hint":"Add cap=11 to stale/non-winning list and continue with code-level DDTree tree-build hypotheses.","diagnostic_findings":{"completion_tok_s":107.44628741442311,"dflash_eval_s":8.810315499431454,"safe_mode_active":0,"verify_eval_wait_fused_steps":96,"verify_eval_wait_unfused_steps":0}}}
{"run":2547,"commit":"26f9501","metric":93.53303336282886,"metrics":{},"status":"discard","description":"DDTree depth-cap candidate (`DFLASH_DDTREE_DEPTH_CAP=11`) collapsed throughput (~93.5 tok/s), lowered acceptance (avg ~9.48), and increased tree_build (~2.12s).","timestamp":1776484824490,"segment":25,"confidence":3.7631065146244986,"iterationTokens":6912,"asi":{"hypothesis":"Capping DDTree depth might cut tree-build cost enough to offset any acceptance loss.","rollback_reason":"Severe primary regression with worse tree-build time and more cycles; depth cap harms tree quality/commit cadence.","next_action_hint":"Do not pursue depth-cap trims; keep full budget-reachable depth and continue other tree-build hypotheses.","diagnostic_findings":{"completion_tok_s":93.53303336282886,"dflash_eval_s":10.941417915999999,"dflash_ddtree_tree_build_s":2.1208646260000004,"dflash_ddtree_avg_acceptance":9.481481481481481,"dflash_ddtree_cycles_completed":108,"dflash_ddtree_fast_path_ratio":0.9259259259259259}}}
{"run":2548,"commit":"26f9501","metric":47.86029943233256,"metrics":{},"status":"discard","description":"Immediate control parity entered collapse wave (~47.9 tok/s): safe mode activated at step 7, unfused verify dominated (99/106 steps), and eval spiked to ~16.86s.","timestamp":1776484866090,"segment":25,"confidence":3.7067381037088016,"iterationTokens":1785,"asi":{"hypothesis":"Post-candidate parity should validate regime stability; instead run hit shared instability transition.","rollback_reason":"No code changes; this is an unstable control collapse sample and not suitable for DDTree attribution.","next_action_hint":"Return to passive control monitoring until fused-only safe_mode=0 near-floor timing reappears before any further DDTree A/B.","diagnostic_findings":{"completion_tok_s":47.86029943233256,"dflash_eval_s":16.86137208424043,"safe_mode_active":1,"safe_mode_step":7,"verify_eval_wait_fused_steps":7,"verify_eval_wait_unfused_steps":99,"dflash_draft_sync_eval_wait_steps":99,"collapse_spike_events":6,"collapse_severe_spike_events":6}}}
{"run":2549,"commit":"26f9501","metric":49.65085836163915,"metrics":{},"status":"discard","description":"Follow-up control remained in collapse regime (~49.7 tok/s): safe mode activated early (step 6), unfused verify dominated (100/106 steps), eval stayed elevated (~16.20s).","timestamp":1776484929269,"segment":25,"confidence":3.6909304956016697,"iterationTokens":5419,"asi":{"hypothesis":"Second control sample would test whether prior collapse was transient or sustained.","rollback_reason":"No code changes; collapse monitoring sample shows instability persists.","next_action_hint":"Continue passive control monitoring only; keep DDTree experiments paused until fused-only safe_mode=0 floor conditions recover.","diagnostic_findings":{"completion_tok_s":49.65085836163915,"dflash_eval_s":16.200230215094052,"safe_mode_active":1,"safe_mode_step":6,"verify_eval_wait_fused_steps":6,"verify_eval_wait_unfused_steps":100,"draft_sync_eval_wait_steps":100,"collapse_spike_events":6,"collapse_severe_spike_events":6}}}
{"run":2550,"commit":"26f9501","metric":69.65073630155642,"metrics":{},"status":"discard","description":"Control partially recovered from collapse (~69.7 tok/s) but still unstable: safe mode remained active (step 74) with mixed fused/unfused verify waits and elevated eval (~12.66s).","timestamp":1776484960830,"segment":25,"confidence":3.639635471891338,"iterationTokens":4269,"asi":{"hypothesis":"Additional control monitoring would show whether collapse wave is clearing toward floor conditions.","rollback_reason":"No code changes; still outside stable floor gate for DDTree attribution.","next_action_hint":"Continue passive control monitoring until fully fused-only safe_mode=0 and repeated eval near ~8.8–9.0.","diagnostic_findings":{"completion_tok_s":69.65073630155642,"dflash_eval_s":12.655574497533962,"safe_mode_active":1,"safe_mode_step":74,"verify_eval_wait_fused_steps":74,"verify_eval_wait_unfused_steps":27,"collapse_spike_events":9,"collapse_severe_spike_events":9}}}
{"run":2551,"commit":"26f9501","metric":81.44356383719256,"metrics":{},"status":"discard","description":"Control recovery continued to ~81.4 tok/s but stability gate still not met: safe mode remained active (step 83) with residual unfused waits (14/97) and eval elevated (~11.22s).","timestamp":1776484995903,"segment":25,"confidence":3.6174462404134657,"iterationTokens":4272,"asi":{"hypothesis":"Control should climb toward floor if collapse wave is dissipating.","rollback_reason":"No code changes; monitoring-only sample still outside fused-only near-floor gate.","next_action_hint":"Keep passive control monitoring; defer DDTree probes until safe_mode=0 and repeated near-floor eval reappear.","diagnostic_findings":{"completion_tok_s":81.44356383719256,"dflash_eval_s":11.220598207204603,"safe_mode_active":1,"safe_mode_step":83,"verify_eval_wait_fused_steps":83,"verify_eval_wait_unfused_steps":14,"collapse_spike_events":2,"collapse_severe_spike_events":2}}}
{"run":2552,"commit":"26f9501","metric":50.20120313752965,"metrics":{},"status":"discard","description":"Control relapsed back to collapse (~50.2 tok/s): safe mode triggered early (step 7), unfused verify dominated (99/106), and eval remained high (~16.04s).","timestamp":1776485035471,"segment":25,"confidence":3.561425878873204,"iterationTokens":4287,"asi":{"hypothesis":"Recovery might continue toward stability; instead this sample confirms oscillatory collapse behavior persists.","rollback_reason":"No code changes; unstable collapse sample invalid for DDTree attribution.","next_action_hint":"Stay in passive monitoring mode and avoid DDTree candidate runs until repeated fused-only safe_mode=0 floor samples return.","diagnostic_findings":{"completion_tok_s":50.20120313752965,"dflash_eval_s":16.039745374466293,"safe_mode_active":1,"safe_mode_step":7,"verify_eval_wait_fused_steps":7,"verify_eval_wait_unfused_steps":99,"collapse_spike_events":5,"collapse_severe_spike_events":5}}}
{"run":2553,"commit":"26f9501","metric":56.77970873887391,"metrics":{},"status":"discard","description":"Control remained unstable (~56.8 tok/s): safe mode activation at step 9 with predominantly unfused waits (95/104) and elevated eval (~14.24s).","timestamp":1776485090010,"segment":25,"confidence":3.5609975458229104,"iterationTokens":6428,"asi":{"hypothesis":"Another control sample might confirm sustained recovery trend; instead instability persists.","rollback_reason":"No code changes; still in collapse/recovery regime and below stability gate.","next_action_hint":"Continue passive control monitoring only; keep DDTree work paused until stable fused-only floor returns.","diagnostic_findings":{"completion_tok_s":56.77970873887391,"dflash_eval_s":14.23548490833491,"safe_mode_active":1,"safe_mode_step":9,"verify_eval_wait_fused_steps":9,"verify_eval_wait_unfused_steps":95,"collapse_spike_events":3,"collapse_severe_spike_events":3}}}
{"run":2554,"commit":"26f9501","metric":107.78990531999129,"metrics":{},"status":"discard","description":"Control snapped back to near-floor fused-only regime (~107.8 tok/s, eval ~8.79, safe_mode=0) after collapse wave; treat as first recovery confirmation.","timestamp":1776485701607,"segment":25,"confidence":3.5605693157915455,"iterationTokens":6428,"asi":{"hypothesis":"Collapse wave may have cleared and floor conditions could be returning.","rollback_reason":"No code changes; monitoring-only control confirmation sample.","next_action_hint":"Run additional immediate control confirmations before re-opening DDTree A/B.","diagnostic_findings":{"completion_tok_s":107.78990531999129,"dflash_eval_s":8.789323417586274,"safe_mode_active":0,"verify_eval_wait_fused_steps":96,"verify_eval_wait_unfused_steps":0}}}
{"run":2555,"commit":"26f9501","metric":107.62808678424301,"metrics":{},"status":"discard","description":"Second consecutive control stayed near-floor (107.6 tok/s, eval ~8.80) with fused-only verify and safe_mode=0.","timestamp":1776485731075,"segment":25,"confidence":3.531269056442666,"iterationTokens":4143,"asi":{"hypothesis":"Recovery from collapse may be sustained enough to satisfy stability gate again.","rollback_reason":"No code changes; monitoring-only confirmation sample.","next_action_hint":"Take one more control confirmation, then resume strict DDTree baseline→candidate→control triplet if floor holds.","diagnostic_findings":{"completion_tok_s":107.62808678424301,"dflash_eval_s":8.799669543164782,"safe_mode_active":0,"verify_eval_wait_fused_steps":96,"verify_eval_wait_unfused_steps":0}}}
{"run":2556,"commit":"26f9501","metric":107.66424458543428,"metrics":{},"status":"discard","description":"Third consecutive control remained near-floor (107.7 tok/s, eval ~8.80, fused-only, safe_mode=0), re-opening DDTree attribution gate.","timestamp":1776485761863,"segment":25,"confidence":3.568461433867194,"iterationTokens":4121,"asi":{"hypothesis":"Sustained floor timing has returned after oscillatory collapse/recovery wave.","rollback_reason":"No code changes; control confirmation sample.","next_action_hint":"Run strict DDTree triplet now: DDTree baseline (guarded path) → one DDTree candidate → immediate no-DDTree control parity.","diagnostic_findings":{"completion_tok_s":107.66424458543428,"dflash_eval_s":8.796291459933855,"safe_mode_active":0,"verify_eval_wait_fused_steps":96,"verify_eval_wait_unfused_steps":0}}}
{"run":2557,"commit":"26f9501","metric":36.12549099500102,"metrics":{},"status":"discard","description":"DDTree baseline in re-opened window collapsed severely (~36.1 tok/s): eval jumped to ~28.34s and tree_build ballooned to ~5.88s.","timestamp":1776485812701,"segment":25,"confidence":3.5294254830282186,"iterationTokens":4200,"asi":{"hypothesis":"With floor gate restored, DDTree baseline should return near prior ~103 tok/s band for matched attribution.","rollback_reason":"No code changes; baseline attribution run only, but result is unstable/collapsed for DDTree lane.","next_action_hint":"Run immediate no-DDTree control parity to determine whether this is DDTree-specific collapse or shared regime failure.","diagnostic_findings":{"completion_tok_s":36.12549099500102,"dflash_eval_s":28.33689525,"dflash_ddtree_tree_build_s":5.8795430070000005,"dflash_ddtree_tree_verify_s":0.276575625,"dflash_ddtree_cycles_completed":98,"dflash_ddtree_tokens_per_second":36.136633564328115}}}
{"run":2558,"commit":"26f9501","metric":24.378116973740784,"metrics":{},"status":"discard","description":"Immediate no-DDTree parity after DDTree collapse also collapsed harder (~24.4 tok/s): safe mode activated at step 11 with severe unfused waits and eval ~33.0s.","timestamp":1776485872397,"segment":25,"confidence":3.496022217347307,"iterationTokens":1849,"asi":{"hypothesis":"Parity run would disambiguate whether DDTree collapse was path-specific versus shared regime failure.","rollback_reason":"No code changes; parity confirms shared instability wave, so DDTree attribution is invalid in this window.","next_action_hint":"Revert to passive control monitoring only until stable fused-only near-floor conditions return.","diagnostic_findings":{"completion_tok_s":24.378116973740784,"dflash_eval_s":33.017574630561285,"safe_mode_active":1,"safe_mode_step":11,"verify_eval_wait_fused_steps":11,"verify_eval_wait_unfused_steps":93,"collapse_spike_events":95,"collapse_severe_spike_events":95}}}
{"run":2559,"commit":"26f9501","metric":32.28046164593506,"metrics":{},"status":"discard","description":"Passive control monitoring remained in deep collapse (~32.3 tok/s): safe mode step 13 with dominant unfused waits (91/104) and eval ~25.10s.","timestamp":1776485924883,"segment":25,"confidence":3.49543298886452,"iterationTokens":4335,"asi":{"hypothesis":"After shared collapse, control might recover quickly enough to restore floor gate.","rollback_reason":"No code changes; still unstable and unsuitable for DDTree attribution.","next_action_hint":"Continue passive controls only until safe_mode=0 and fused-only verify return consistently.","diagnostic_findings":{"completion_tok_s":32.28046164593506,"dflash_eval_s":25.099858750822023,"safe_mode_active":1,"safe_mode_step":13,"verify_eval_wait_fused_steps":13,"verify_eval_wait_unfused_steps":91,"collapse_spike_events":76,"collapse_severe_spike_events":76}}}
{"run":2560,"commit":"26f9501","metric":43.57271737410541,"metrics":{},"status":"discard","description":"Control remains in collapse state (~43.6 tok/s): safe mode step 6, heavily unfused verify (100/106), and eval still high (~18.53s).","timestamp":1776485976113,"segment":25,"confidence":3.486539127621373,"iterationTokens":4805,"asi":{"hypothesis":"Collapse wave may begin recovering with continued passive control runs.","rollback_reason":"No code changes; still far from stable fused-only floor gate.","next_action_hint":"Continue passive control monitoring and avoid DDTree experiments until repeated safe_mode=0 fused-only near-floor samples return.","diagnostic_findings":{"completion_tok_s":43.57271737410541,"dflash_eval_s":18.534489339217544,"safe_mode_active":1,"safe_mode_step":6,"verify_eval_wait_fused_steps":6,"verify_eval_wait_unfused_steps":100,"collapse_spike_events":17,"collapse_severe_spike_events":17}}}
{"run":2561,"commit":"26f9501","metric":91.95890885850581,"metrics":{},"status":"discard","description":"Control rebounded to ~92.0 tok/s with safe_mode=0 and fused-only verify, but eval remained elevated (~10.40), so floor gate is not yet restored.","timestamp":1776486006435,"segment":25,"confidence":3.49543298886452,"iterationTokens":4297,"asi":{"hypothesis":"Collapse wave might be transitioning into a higher shelf before true floor re-entry.","rollback_reason":"No code changes; monitoring-only sample with eval still above near-floor target.","next_action_hint":"Continue passive control monitoring and require repeated eval near ~8.8–9.0 before any DDTree A/B.","diagnostic_findings":{"completion_tok_s":91.95890885850581,"dflash_eval_s":10.404692745418288,"safe_mode_active":0,"verify_eval_wait_fused_steps":96,"verify_eval_wait_unfused_steps":0}}}
{"run":2562,"commit":"26f9501","metric":62.09331057746655,"metrics":{},"status":"discard","description":"Control dropped back into unstable mixed regime (~62.1 tok/s): safe mode reactivated at step 11 with substantial unfused waits (93/104) and eval ~13.05s.","timestamp":1776486046514,"segment":25,"confidence":3.486539127621373,"iterationTokens":4300,"asi":{"hypothesis":"Post-rebound sample would clarify whether lane was stabilizing or oscillating; oscillation persisted.","rollback_reason":"No code changes; monitoring-only sample below stability gate.","next_action_hint":"Keep passive monitoring; require repeated safe_mode=0 fused-only samples with eval near ~8.8–9.0 before DDTree resumes.","diagnostic_findings":{"completion_tok_s":62.09331057746655,"dflash_eval_s":13.053207578253932,"safe_mode_active":1,"safe_mode_step":11,"verify_eval_wait_fused_steps":11,"verify_eval_wait_unfused_steps":93,"collapse_spike_events":2,"collapse_severe_spike_events":2}}}
{"run":2563,"commit":"26f9501","metric":69.35676935746783,"metrics":{},"status":"discard","description":"Control sampled a mixed rebound (~69.4 tok/s): safe_mode=0 with fused-only verify, but eval remained very elevated (~13.98), still outside floor gate.","timestamp":1776486080978,"segment":25,"confidence":3.478570060399592,"iterationTokens":4297,"asi":{"hypothesis":"Mixed regime may intermittently disable safe mode before returning to true floor timing.","rollback_reason":"No code changes; monitoring-only sample with poor eval timing despite fused-only path.","next_action_hint":"Continue passive controls; do not resume DDTree until repeated eval near ~8.8–9.0 is restored.","diagnostic_findings":{"completion_tok_s":69.35676935746783,"dflash_eval_s":13.984078375040554,"safe_mode_active":0,"verify_eval_wait_fused_steps":96,"verify_eval_wait_unfused_steps":0}}}
{"run":2564,"commit":"26f9501","metric":75.14952848418133,"metrics":{},"status":"discard","description":"Control moved into a fused-only/safe_mode=0 rebound shelf (~75.1 tok/s), but eval remains high (~12.86), so stability gate still fails.","timestamp":1776486135519,"segment":25,"confidence":3.4810447726172464,"iterationTokens":6630,"asi":{"hypothesis":"Regime may recover from collapse into an elevated shelf before true floor timing returns.","rollback_reason":"No code changes; monitoring-only sample with non-floor eval timing.","next_action_hint":"Continue passive monitoring; require sustained near-floor eval (~8.8–9.0) before any DDTree attribution.","diagnostic_findings":{"completion_tok_s":75.14952848418133,"dflash_eval_s":12.85642871062737,"safe_mode_active":0,"verify_eval_wait_fused_steps":96,"verify_eval_wait_unfused_steps":0}}}
{"run":2565,"commit":"26f9501","metric":107.44614930747835,"metrics":{},"status":"discard","description":"Control returned to near-floor fused-only timing (~107.45 tok/s, eval ~8.81, safe_mode=0) after rebound shelf samples.","timestamp":1776490470684,"segment":25,"confidence":3.478570060399592,"iterationTokens":3203,"asi":{"hypothesis":"Even during oscillation, floor-like controls can reappear abruptly; need extended streak before DDTree re-entry.","rollback_reason":"No code changes; monitoring-only sample.","next_action_hint":"Keep passive control monitoring and wait for a longer uninterrupted floor streak before re-opening DDTree.","diagnostic_findings":{"completion_tok_s":107.44614930747835,"dflash_eval_s":8.806972128222696,"safe_mode_active":0,"verify_eval_wait_fused_steps":96,"verify_eval_wait_unfused_steps":0}}}
