{"run":2229,"commit":"79733ef","metric":8.781904122326523,"metrics":{},"status":"discard","description":"Telemetry robustness batch v2 sample 06/30: another near-best healthy run (~107.97 tok/s, eval_s ~8.782), watchdog idle and spike-free.","timestamp":1776436193301,"segment":24,"confidence":0.043688848683495325,"iterationTokens":2065,"asi":{"hypothesis":"Instrumentation overhead remains negligible in healthy lane.","rollback_reason":"Primary metric above current best floor.","next_action_hint":"Continue fixed batch.","diagnostic_findings":{"completion_tok_s":107.97021487947276,"dflash_eval_s":8.781904122326523,"safe_mode_active":0,"spike_events":0,"mx_peak_over_recommended_ratio":0.17537298070300922}}}
{"run":2230,"commit":"79733ef","metric":9.27246400702279,"metrics":{},"status":"discard","description":"Telemetry robustness batch v2 sample 07/30: entered slower non-spike shelf (~96.63 tok/s, eval_s ~9.27) with watchdog idle.","timestamp":1776436224424,"segment":24,"confidence":0.04411958120066382,"iterationTokens":2056,"asi":{"hypothesis":"Root-cause telemetry should capture non-spike inflation signatures when throughput softens.","rollback_reason":"Primary metric above current best floor.","next_action_hint":"Continue fixed batch; only parity-check on fresh spike/safe-mode transition.","diagnostic_findings":{"completion_tok_s":96.632440062849,"dflash_eval_s":9.27246400702279,"safe_mode_active":0,"spike_events":0,"dflash_draft_s":0.5715258736163378,"dflash_verify_s":0.23644749936647713,"cache_restore_s":0.039086001459509134,"split_path_hit_rate":0.052083333333333336}}}
{"run":2231,"commit":"79733ef","metric":51.6814009147929,"metrics":{},"status":"discard","description":"Telemetry robustness batch v2 sample 08/30: severe collapse (~15.66 tok/s, eval_s ~51.68) with immediate safe-mode activation at step 2.","timestamp":1776436312167,"segment":24,"confidence":0.043688848683495325,"iterationTokens":2170,"asi":{"hypothesis":"Fixed batch should still expose occasional severe shared collapse transitions under unchanged settings.","rollback_reason":"Primary metric far above best floor due collapse event.","next_action_hint":"Run immediate control parity check on this fresh transition edge, then resume mirror batch.","diagnostic_findings":{"completion_tok_s":15.655880495426711,"dflash_eval_s":51.6814009147929,"safe_mode_active":1,"safe_mode_activations":1,"safe_mode_step":2,"spike_events":104,"severe_spike_events":104,"cache_restore_s":0.03298704279586673,"split_path_hit_rate":0.04716981132075472,"mx_peak_over_recommended_ratio":0.17549878709832967}}}
{"run":2232,"commit":"79733ef","metric":53.35610662109684,"metrics":{},"status":"discard","description":"Transition-edge control parity after sample 08 collapse: control also collapsed deeply (~15.23 tok/s, eval_s ~53.36), confirming shared failure mode.","timestamp":1776436413753,"segment":24,"confidence":0.04326644519864393,"iterationTokens":2202,"asi":{"hypothesis":"Fresh mirror severe-collapse edges should reproduce in control if instability is shared-path runtime pressure.","rollback_reason":"Diagnostic control lane; metric far above floor.","next_action_hint":"Return to mirror batch to measure recovery length under new telemetry.","diagnostic_findings":{"completion_tok_s":15.228383819676607,"dflash_eval_s":53.35610662109684,"safe_mode_active":1,"safe_mode_activations":1,"safe_mode_step":2,"spike_events":106,"severe_spike_events":106,"parity":"shared_collapse_confirmed","cache_restore_s":0.031262082513421774,"split_path_hit_rate":0.04716981132075472}}}
{"run":2233,"commit":"79733ef","metric":20.44062812870834,"metrics":{},"status":"discard","description":"Telemetry robustness batch v2 sample 09/30: post-transition trough remained severe (~38.25 tok/s, eval_s ~20.44), safe mode active from step 2.","timestamp":1776436466918,"segment":24,"confidence":0.043157672158015074,"iterationTokens":2138,"asi":{"hypothesis":"After severe transition, mirror should remain degraded for several follow-up runs before rebound.","rollback_reason":"Primary metric far above best floor.","next_action_hint":"Continue mirror batch to capture recovery duration and tail shape.","diagnostic_findings":{"completion_tok_s":38.2523056956541,"dflash_eval_s":20.44062812870834,"safe_mode_active":1,"safe_mode_activations":1,"safe_mode_step":2,"spike_events":20,"severe_spike_events":20,"dflash_draft_s":4.547268830821849,"cache_restore_s":0.02604675234761089}}}
{"run":2234,"commit":"79733ef","metric":13.119986209319904,"metrics":{},"status":"discard","description":"Telemetry robustness batch v2 sample 10/30: rebound improved but still degraded (~61.93 tok/s, eval_s ~13.12), safe mode activated at step 12.","timestamp":1776436503643,"segment":24,"confidence":0.043049444662738974,"iterationTokens":2104,"asi":{"hypothesis":"Post-collapse trough should improve in stages with safe-mode step drifting later during recovery.","rollback_reason":"Primary metric above best floor.","next_action_hint":"Continue mirror batch for full recovery curve.","diagnostic_findings":{"completion_tok_s":61.927134945955395,"dflash_eval_s":13.119986209319904,"safe_mode_active":1,"safe_mode_activations":1,"safe_mode_step":12,"spike_events":2,"severe_spike_events":2,"dflash_draft_s":2.859631667146459,"cache_restore_s":0.025863085058517754}}}
{"run":2235,"commit":"79733ef","metric":12.793860082514584,"metrics":{},"status":"discard","description":"Telemetry robustness batch v2 sample 11/30: rebound remained degraded (~63.28 tok/s, eval_s ~12.79), safe mode step ~11.","timestamp":1776436540691,"segment":24,"confidence":0.042716854948064875,"iterationTokens":2132,"asi":{"hypothesis":"Recovery from severe collapse should pass through mid-12s eval with early safe-mode before exiting trough.","rollback_reason":"Primary metric above best floor.","next_action_hint":"Continue mirror batch to observe handoff into watchdog-idle inflation mode.","diagnostic_findings":{"completion_tok_s":63.276510384168745,"dflash_eval_s":12.793860082514584,"safe_mode_active":1,"safe_mode_activations":1,"safe_mode_step":11,"spike_events":2,"severe_spike_events":2,"dflash_draft_s":2.804834292270243}}}
{"run":2236,"commit":"79733ef","metric":11.800474582472816,"metrics":{},"status":"discard","description":"Telemetry robustness batch v2 sample 12/30: moved into watchdog-idle inflation shelf (~81.57 tok/s, eval_s ~11.80) with no spikes.","timestamp":1776436572450,"segment":24,"confidence":0.04238936485215667,"iterationTokens":2118,"asi":{"hypothesis":"After spike-safe-mode trough, runtime can hand off into slower non-spike inflation before full recovery.","rollback_reason":"Primary metric above best floor.","next_action_hint":"Continue mirror batch to measure inflation-to-high-soft recovery length.","diagnostic_findings":{"completion_tok_s":81.56643858525393,"dflash_eval_s":11.800474582472816,"safe_mode_active":0,"spike_events":0,"dflash_draft_s":0.20845628762617707,"dflash_verify_s":0.11704621242824942}}}
{"run":2237,"commit":"79733ef","metric":10.7909390788991,"metrics":{},"status":"discard","description":"Telemetry robustness batch v2 sample 13/30: inflation shelf improved (~88.95 tok/s, eval_s ~10.79), watchdog idle and no spikes.","timestamp":1776436603557,"segment":24,"confidence":0.042140441894607535,"iterationTokens":2228,"asi":{"hypothesis":"Non-spike inflation should decay steadily toward high-soft after collapse wave.","rollback_reason":"Primary metric above best floor.","next_action_hint":"Continue mirror batch.","diagnostic_findings":{"completion_tok_s":88.94984372254953,"dflash_eval_s":10.7909390788991,"safe_mode_active":0,"spike_events":0,"dflash_draft_s":0.19616582617163658}}}
{"run":2238,"commit":"79733ef","metric":8.984274206799455,"metrics":{},"status":"discard","description":"Telemetry robustness batch v2 sample 14/30: recovered into high-soft (~105.80 tok/s, eval_s ~8.98), watchdog idle and spike-free.","timestamp":1776436635697,"segment":24,"confidence":0.042466868110548915,"iterationTokens":2056,"asi":{"hypothesis":"Recovery should rejoin sub-9/high-soft band after inflation shelf decay.","rollback_reason":"Primary metric above best floor.","next_action_hint":"Continue mirror batch for tail-floor confirmations.","diagnostic_findings":{"completion_tok_s":105.80203853303716,"dflash_eval_s":8.984274206799455,"safe_mode_active":0,"spike_events":0,"split_path_hit_rate":0.052083333333333336}}}
{"run":2239,"commit":"79733ef","metric":9.522817869321443,"metrics":{},"status":"discard","description":"Telemetry robustness batch v2 sample 15/30: high-soft sample (~100.01 tok/s, eval_s ~9.52), watchdog idle and no spikes.","timestamp":1776436664694,"segment":24,"confidence":0.042770504348357795,"iterationTokens":2068,"asi":{"hypothesis":"Recovered lane may oscillate in ~9.3–9.6 high-soft zone before tighter sub-9 stabilization.","rollback_reason":"Primary metric above best floor.","next_action_hint":"Continue mirror batch.","diagnostic_findings":{"completion_tok_s":100.01498841794462,"dflash_eval_s":9.522817869321443,"safe_mode_active":0,"spike_events":0}}}
{"run":2240,"commit":"79733ef","metric":9.581463872920722,"metrics":{},"status":"discard","description":"Telemetry robustness batch v2 sample 16/30: high-soft band persisted (~99.35 tok/s, eval_s ~9.58), watchdog idle and no spikes.","timestamp":1776436697113,"segment":24,"confidence":0.04307851382611133,"iterationTokens":2095,"asi":{"hypothesis":"Post-recovery variance should remain spike-free while converging back toward sub-9.","rollback_reason":"Primary metric above best floor.","next_action_hint":"Continue mirror batch.","diagnostic_findings":{"completion_tok_s":99.35458291631703,"dflash_eval_s":9.581463872920722,"safe_mode_active":0,"spike_events":0}}}
{"run":2241,"commit":"79733ef","metric":9.549031830742024,"metrics":{},"status":"discard","description":"Telemetry robustness batch v2 sample 17/30: stable high-soft repeat (~99.53 tok/s, eval_s ~9.55), watchdog idle and spike-free.","timestamp":1776436724826,"segment":24,"confidence":0.04321243525286598,"iterationTokens":2036,"asi":{"hypothesis":"Recovered regime should remain non-spike while slowly tightening.","rollback_reason":"Primary metric above best floor.","next_action_hint":"Continue mirror batch.","diagnostic_findings":{"completion_tok_s":99.52573049344593,"dflash_eval_s":9.549031830742024,"safe_mode_active":0,"spike_events":0}}}
{"run":2242,"commit":"79733ef","metric":9.274458246887662,"metrics":{},"status":"discard","description":"Telemetry robustness batch v2 sample 18/30: improved high-soft sample (~102.43 tok/s, eval_s ~9.27), watchdog idle and no spikes.","timestamp":1776436752716,"segment":24,"confidence":0.04334719193954706,"iterationTokens":2028,"asi":{"hypothesis":"Recovered shelf should drift toward low-9 as cycle settles.","rollback_reason":"Primary metric above best floor.","next_action_hint":"Continue mirror batch.","diagnostic_findings":{"completion_tok_s":102.43276269964595,"dflash_eval_s":9.274458246887662,"safe_mode_active":0,"spike_events":0}}}
{"run":2243,"commit":"79733ef","metric":9.339282459812239,"metrics":{},"status":"discard","description":"Telemetry robustness batch v2 sample 19/30: stable low high-soft run (~101.72 tok/s, eval_s ~9.34), watchdog idle and spike-free.","timestamp":1776436782586,"segment":24,"confidence":0.04373183837841872,"iterationTokens":2029,"asi":{"hypothesis":"Recovered regime should remain non-spike and cluster in low-9/high-soft.","rollback_reason":"Primary metric above best floor.","next_action_hint":"Continue mirror batch.","diagnostic_findings":{"completion_tok_s":101.71971254817201,"dflash_eval_s":9.339282459812239,"safe_mode_active":0,"spike_events":0}}}
{"run":2244,"commit":"79733ef","metric":9.44080645579379,"metrics":{},"status":"discard","description":"Telemetry robustness batch v2 sample 20/30: stable high-soft run (~100.59 tok/s, eval_s ~9.44), watchdog idle and no spikes.","timestamp":1776436809291,"segment":24,"confidence":0.044123372346006974,"iterationTokens":2042,"asi":{"hypothesis":"Batch tail after recovery should stay spike-free while fluctuating within high-soft.","rollback_reason":"Primary metric above best floor.","next_action_hint":"Continue mirror batch.","diagnostic_findings":{"completion_tok_s":100.58805085960151,"dflash_eval_s":9.44080645579379,"safe_mode_active":0,"spike_events":0}}}
{"run":2245,"commit":"79733ef","metric":9.282275247504003,"metrics":{},"status":"discard","description":"Telemetry robustness batch v2 sample 21/30: low high-soft sample (~102.36 tok/s, eval_s ~9.28), watchdog idle and no spikes.","timestamp":1776436839521,"segment":24,"confidence":0.044390164174374976,"iterationTokens":2042,"asi":{"hypothesis":"Recovered lane is approaching stable low-9 cluster again.","rollback_reason":"Primary metric above best floor.","next_action_hint":"Continue mirror batch.","diagnostic_findings":{"completion_tok_s":102.36083504612958,"dflash_eval_s":9.282275247504003,"safe_mode_active":0,"spike_events":0}}}
{"run":2246,"commit":"79733ef","metric":9.385161212296225,"metrics":{},"status":"discard","description":"Telemetry robustness batch v2 sample 22/30: stable low-9/high-soft run (~101.25 tok/s, eval_s ~9.39), watchdog idle.","timestamp":1776436867603,"segment":24,"confidence":0.044660201941156046,"iterationTokens":2031,"asi":{"hypothesis":"Recovered phase remains stationary without new spike-triggered transitions.","rollback_reason":"Primary metric above best floor.","next_action_hint":"Continue mirror batch.","diagnostic_findings":{"completion_tok_s":101.25213617366784,"dflash_eval_s":9.385161212296225,"safe_mode_active":0,"spike_events":0}}}
{"run":2247,"commit":"79733ef","metric":9.212224296294153,"metrics":{},"status":"discard","description":"Telemetry robustness batch v2 sample 23/30: improved low-9 sample (~103.06 tok/s, eval_s ~9.21), watchdog idle and no spikes.","timestamp":1776436896543,"segment":24,"confidence":0.04464024285473546,"iterationTokens":2036,"asi":{"hypothesis":"Recovered trajectory continues toward the stable low-9/sub-9 shelf.","rollback_reason":"Primary metric above best floor.","next_action_hint":"Continue mirror batch.","diagnostic_findings":{"completion_tok_s":103.05670783703495,"dflash_eval_s":9.212224296294153,"safe_mode_active":0,"spike_events":0}}}
{"run":2248,"commit":"79733ef","metric":9.151561080478132,"metrics":{},"status":"discard","description":"Telemetry robustness batch v2 sample 24/30: low-9 recovery sample (~103.72 tok/s, eval_s ~9.15), watchdog idle and spike-free.","timestamp":1776436926010,"segment":24,"confidence":0.04473753619587958,"iterationTokens":2035,"asi":{"hypothesis":"Recovered window should now hold low-9 values without spike activity.","rollback_reason":"Primary metric above best floor.","next_action_hint":"Continue mirror batch for final tail checks.","diagnostic_findings":{"completion_tok_s":103.72239878715399,"dflash_eval_s":9.151561080478132,"safe_mode_active":0,"spike_events":0}}}
{"run":2249,"commit":"79733ef","metric":9.010115750250407,"metrics":{},"status":"discard","description":"Telemetry robustness batch v2 sample 25/30: near-sub-9 sample (~105.27 tok/s, eval_s ~9.01), watchdog idle and spike-free.","timestamp":1776436955805,"segment":24,"confidence":0.044845429747597365,"iterationTokens":2041,"asi":{"hypothesis":"Recovered cycle should approach prior sub-9 neighborhood late in the batch.","rollback_reason":"Primary metric above best floor.","next_action_hint":"Continue mirror batch.","diagnostic_findings":{"completion_tok_s":105.26881874424078,"dflash_eval_s":9.010115750250407,"safe_mode_active":0,"spike_events":0}}}
{"run":2250,"commit":"79733ef","metric":9.098062415607274,"metrics":{},"status":"discard","description":"Telemetry robustness batch v2 sample 26/30: low-9 sample (~104.25 tok/s, eval_s ~9.10), watchdog idle and no spikes.","timestamp":1776436987111,"segment":24,"confidence":0.04495384497136146,"iterationTokens":2036,"asi":{"hypothesis":"Late-batch regime remains healthy but above current best floor.","rollback_reason":"Primary metric above best floor.","next_action_hint":"Continue mirror batch.","diagnostic_findings":{"completion_tok_s":104.25466132703515,"dflash_eval_s":9.098062415607274,"safe_mode_active":0,"spike_events":0}}}
{"run":2251,"commit":"79733ef","metric":8.95366637094412,"metrics":{},"status":"discard","description":"Telemetry robustness batch v2 sample 27/30: near-sub-9 healthy run (~105.95 tok/s, eval_s ~8.95), watchdog idle.","timestamp":1776437016154,"segment":24,"confidence":0.04496868628824207,"iterationTokens":2029,"asi":{"hypothesis":"Late healthy runs can revisit sub-9 without crossing the best floor.","rollback_reason":"Primary metric above best floor.","next_action_hint":"Continue final samples.","diagnostic_findings":{"completion_tok_s":105.95067098166103,"dflash_eval_s":8.95366637094412,"safe_mode_active":0,"spike_events":0}}}
{"run":2252,"commit":"79733ef","metric":8.796113829128444,"metrics":{},"status":"discard","description":"Telemetry robustness batch v2 sample 28/30: very low-tail run (~107.99 tok/s, eval_s ~8.796), watchdog idle and spike-free.","timestamp":1776437047498,"segment":24,"confidence":0.044939442636737326,"iterationTokens":2029,"asi":{"hypothesis":"Healthy tail can revisit ~8.8 band with root telemetry enabled.","rollback_reason":"Primary metric still above best floor.","next_action_hint":"Complete final two samples.","diagnostic_findings":{"completion_tok_s":107.9906474724825,"dflash_eval_s":8.796113829128444,"safe_mode_active":0,"spike_events":0}}}
{"run":2253,"commit":"79733ef","metric":9.012899915804155,"metrics":{},"status":"discard","description":"Telemetry robustness batch v2 sample 29/30: near-sub-9 run (~105.19 tok/s, eval_s ~9.01), watchdog idle and no spikes.","timestamp":1776437075732,"segment":24,"confidence":0.04533448756010946,"iterationTokens":2069,"asi":{"hypothesis":"Batch tail should end in healthy low-9 band after collapse/rebound cycle.","rollback_reason":"Primary metric above best floor.","next_action_hint":"Run final sample to close 30-run batch.","diagnostic_findings":{"completion_tok_s":105.18966002609018,"dflash_eval_s":9.012899915804155,"safe_mode_active":0,"spike_events":0}}}
{"run":2254,"commit":"79733ef","metric":8.962380460114218,"metrics":{},"status":"discard","description":"Telemetry robustness batch v2 sample 30/30: batch closed in healthy sub-9 shelf (~105.71 tok/s, eval_s ~8.96), watchdog idle.","timestamp":1776437107089,"segment":24,"confidence":0.04587573450925489,"iterationTokens":2052,"asi":{"hypothesis":"After collapse/recovery cycle, lane should return to stable sub-9 operation.","rollback_reason":"Primary metric above best floor.","next_action_hint":"Compute v2 batch robustness summary vs pre-telemetry batch.","diagnostic_findings":{"completion_tok_s":105.70724813819744,"dflash_eval_s":8.962380460114218,"safe_mode_active":0,"spike_events":0}}}
{"run":2255,"commit":"79733ef","metric":8.912988169002347,"metrics":{},"status":"discard","description":"Add async submit→consume backlog telemetry probe fields; first run stayed healthy (~105.97 tok/s, eval_s ~8.913) and emitted new async lag metrics.","timestamp":1776437567663,"segment":24,"confidence":0.04618972972862895,"iterationTokens":7323,"asi":{"hypothesis":"Measuring async draft submit-to-consume lag will expose queue/backpressure buildup before collapse.","rollback_reason":"Primary metric above best floor.","next_action_hint":"Re-apply probe patch and continue runs until a valid keep sample confirms no meaningful overhead.","diagnostic_findings":{"completion_tok_s":105.96551667353445,"dflash_eval_s":8.912988169002347,"async_submit_calls":96,"async_submit_to_consume_mean_s":0.0013062230633901588,"async_submit_to_consume_max_s":0.0015851249918341637,"async_submit_unconsumed_steps":0}}}
{"run":2256,"commit":"d561c06","metric":8.90143012185581,"metrics":{},"status":"keep","description":"Add async submit→consume backlog telemetry (calls/samples/mean/max/min/unconsumed) through runtime→API→harness; healthy validation run emitted all new fields.","timestamp":1776437656376,"segment":24,"confidence":0.046474172779705454,"iterationTokens":3672,"asi":{"hypothesis":"Async submit-to-consume lag can expose queue/backpressure buildup before collapse transitions.","learning":"New backlog fields are now emitted in honest runs: async_submit_calls=96, samples=96, mean≈1.36ms, max≈2.44ms, unconsumed_steps=0 on a healthy run.","next_action_hint":"Use these fields on the next collapse transition to compare lag profile versus healthy runs."}}
{"run":2257,"commit":"d561c06","metric":8.772755913785659,"metrics":{},"status":"discard","description":"Async-backlog probe continuation: healthy near-floor sample (~107.93 tok/s, eval_s ~8.773) with stable submit→consume lag profile.","timestamp":1776438633478,"segment":24,"confidence":0.04645731748976438,"iterationTokens":3672,"asi":{"hypothesis":"Healthy runs should show low, tight async submit→consume lag and zero unconsumed steps.","rollback_reason":"Single-run floor crossover on unchanged code is within noise; no optimization delta to keep yet.","next_action_hint":"Continue mirror runs until a collapse transition appears, then compare lag inflation against this healthy baseline.","diagnostic_findings":{"completion_tok_s":107.92607021339686,"dflash_eval_s":8.772755913785659,"async_submit_to_consume_mean_s":0.0012748124681820627,"async_submit_to_consume_max_s":0.0015812920173630118,"async_submit_unconsumed_steps":0,"safe_mode_active":0,"spike_events":0}}}
