{"run":744,"commit":"8b55918","metric":105.25519901962305,"metrics":{},"status":"discard","description":"Recovery lever recheck: AR_INITIAL_CACHE_BLOCKS=192 in current band.","timestamp":1776287197126,"segment":23,"confidence":4.09610964751564,"iterationTokens":658,"asi":{"hypothesis":"Historically near-keep 192 sample might reappear as a true gain in a steadier regime.","rollback_reason":"No uplift; result matches current ~105 baseline and remains below keep.","next_action_hint":"Treat prior 192 spikes as non-reproducible noise; keep it in do-not-retry set.","backend":"mirror_sd_mlx","context_only_draft_cache":1,"draft_sink":48,"initial_cache_blocks":192,"delta_vs_keep":-1.6048009803769496}}
{"run":745,"commit":"8b55918","metric":105.10886524429742,"metrics":{},"status":"discard","description":"Mirror anchor after cache-block rechecks.","timestamp":1776287232390,"segment":23,"confidence":4.157433574651198,"iterationTokens":641,"asi":{"hypothesis":"Anchor should confirm current operating median after non-winning cache reservation retests.","rollback_reason":"Anchor remains in ~105 band and below keep.","next_action_hint":"Current regime appears stable around ~105; new improvements likely need deeper structural changes than env tuning.","backend":"mirror_sd_mlx","context_only_draft_cache":1,"draft_sink":48,"stability_probe":true,"delta_vs_keep":-1.7511347557025865}}
{"run":746,"commit":"8b55918","metric":105.36997795586802,"metrics":{},"status":"discard","description":"Control anchor in current ~105 stability regime (mirror disabled).","timestamp":1776287292552,"segment":23,"confidence":4.22062160278242,"iterationTokens":1382,"asi":{"hypothesis":"Control should remain near the current mirror local median in shared jitter regime.","rollback_reason":"Comparison-only sample; control sits in same ~105 band below keep.","next_action_hint":"Run mirror follow-up to keep paired trend tracking current.","backend":"bstnxbt_mlx","mirror_runtime_enabled":0,"context_only_draft_cache":1,"draft_sink":48,"bundle_tracking":true}}
{"run":747,"commit":"8b55918","metric":105.34345728747802,"metrics":{},"status":"discard","description":"Mirror follow-up after control anchor in ~105 regime.","timestamp":1776287326145,"segment":23,"confidence":4.249588377159977,"iterationTokens":578,"asi":{"hypothesis":"Mirror should stay near control in the same local median band if regime remains shared.","rollback_reason":"Mirror nearly matched control (~105.34 vs 105.37), still below keep.","next_action_hint":"Given near-identical parity around ~105, continue hunting only for larger structural shifts.","backend":"mirror_sd_mlx","context_only_draft_cache":1,"draft_sink":48,"paired_control_tok_s":105.36997795586802,"paired_delta_tok_s":-0.026520668389993306,"delta_vs_keep":-1.516542712521984}}
{"run":748,"commit":"8b55918","metric":105.02104927892556,"metrics":{},"status":"discard","description":"Recheck dependency lever in current regime: disable context-only draft cache (DFLASH_BSTNXBT_CONTEXT_ONLY_DRAFT_CACHE=0).","timestamp":1776287361983,"segment":23,"confidence":4.278955506076369,"iterationTokens":787,"asi":{"hypothesis":"Context-only cache-off might become competitive again if current ~105 regime favors simpler cache behavior.","rollback_reason":"Still below keep and current cache-on baseline (105.02 vs 106.86).","next_action_hint":"Keep context-only cache-off in do-not-retry set; no sign of regime-dependent comeback.","backend":"mirror_sd_mlx","context_only_draft_cache":0,"draft_sink":48,"delta_vs_keep":-1.8389507210744411}}
{"run":749,"commit":"8b55918","metric":105.22402428167071,"metrics":{},"status":"discard","description":"Mirror anchor after context-only cache-off recheck reverted.","timestamp":1776287394295,"segment":23,"confidence":4.327279934025387,"iterationTokens":699,"asi":{"hypothesis":"Reverting to keep-shape cache-on config should hold near current ~105 median.","rollback_reason":"Anchor remains in ~105 band and below keep.","next_action_hint":"Continue paired monitoring and reserve effort for genuinely new structural avenues.","backend":"mirror_sd_mlx","context_only_draft_cache":1,"draft_sink":48,"stability_probe":true,"delta_vs_keep":-1.6359757183292907}}
{"run":750,"commit":"8b55918","metric":105.14264456920505,"metrics":{},"status":"discard","description":"Control follow-up in sustained ~105 regime (mirror disabled).","timestamp":1776287433556,"segment":23,"confidence":4.362268147215566,"iterationTokens":759,"asi":{"hypothesis":"Control should continue to track mirror closely in shared local median conditions.","rollback_reason":"Comparison-only sample; control remains ~105 and below keep.","next_action_hint":"Run mirror follow-up; maintain parity tracking while searching for larger structural shifts.","backend":"bstnxbt_mlx","mirror_runtime_enabled":0,"context_only_draft_cache":1,"draft_sink":48,"bundle_tracking":true}}
{"run":751,"commit":"8b55918","metric":105.09997904937177,"metrics":{},"status":"discard","description":"Mirror follow-up after control sample in sustained ~105 regime.","timestamp":1776287467484,"segment":23,"confidence":4.393820829039771,"iterationTokens":581,"asi":{"hypothesis":"Mirror should remain tightly coupled to control in current stable local band.","rollback_reason":"Mirror matched control closely (~105.10), still below keep.","next_action_hint":"Current parity band appears saturated; meaningful progress likely requires new algorithmic change rather than parameter sweeps.","backend":"mirror_sd_mlx","context_only_draft_cache":1,"draft_sink":48,"paired_control_tok_s":105.14264456920505,"paired_delta_tok_s":-0.04266551983327799,"delta_vs_keep":-1.7600209506282336}}
{"run":752,"commit":"8b55918","metric":105.29048484496526,"metrics":{},"status":"discard","description":"Structural cache-entry classification: precompute rollback/armable/trim cache subsets to avoid repeated hasattr checks each decode block.","timestamp":1776287628480,"segment":23,"confidence":4.411067665099776,"iterationTokens":6312,"asi":{"hypothesis":"Preclassifying target cache entry capabilities should reduce Python overhead in arm/restore hot path.","rollback_reason":"No improvement; remained in ~105 band below keep.","next_action_hint":"Revert cache-classification optimization; this overhead is not a winning lever on 1024 lane.","backend":"mirror_sd_mlx","context_only_draft_cache":1,"draft_sink":48,"optimization":"target_cache_entry_preclassification","delta_vs_keep":-1.5695151550347455}}
{"run":753,"commit":"8b55918","metric":105.17591583442285,"metrics":{},"status":"discard","description":"Post-revert mirror anchor after cache-entry classification structural trial.","timestamp":1776287665264,"segment":23,"confidence":4.527785208151041,"iterationTokens":811,"asi":{"hypothesis":"Reverted baseline should remain near the local ~105 median if candidate had no positive effect.","rollback_reason":"Anchor remained ~105 and below keep.","next_action_hint":"No uplift from latest structural patch; continue parity monitoring and seek larger algorithmic opportunities.","backend":"mirror_sd_mlx","context_only_draft_cache":1,"draft_sink":48,"stability_probe":true,"delta_vs_keep":-1.6840841655771457}}
{"run":754,"commit":"8b55918","metric":105.14662390655177,"metrics":{},"status":"discard","description":"Control parity sample after ~105 mirror anchor (mirror disabled).","timestamp":1776287710299,"segment":23,"confidence":4.63216042207968,"iterationTokens":835,"asi":{"hypothesis":"Control should remain tightly coupled to mirror in the sustained ~105 median band.","rollback_reason":"Comparison-only sample; control nearly identical to mirror and below keep.","next_action_hint":"Run mirror follow-up to continue paired median tracking.","backend":"bstnxbt_mlx","mirror_runtime_enabled":0,"context_only_draft_cache":1,"draft_sink":48,"paired_mirror_tok_s":105.17591583442285,"paired_delta_tok_s":0.029291927871084963}}
{"run":755,"commit":"8b55918","metric":104.9099379211923,"metrics":{},"status":"discard","description":"Mirror follow-up after near-identical control parity sample.","timestamp":1776287742525,"segment":23,"confidence":4.674598934699107,"iterationTokens":627,"asi":{"hypothesis":"Mirror should remain near control if ~105 band is stable; minor drift expected from jitter.","rollback_reason":"Mirror dipped slightly to 104.91, still below keep.","next_action_hint":"Continue parity bundles; current regime remains saturated around ~105 with no actionable edge.","backend":"mirror_sd_mlx","context_only_draft_cache":1,"draft_sink":48,"paired_control_tok_s":105.14662390655177,"paired_delta_tok_s":-0.23668598535947968,"delta_vs_keep":-1.9500620788077014}}
{"run":756,"commit":"8b55918","metric":104.51522795022782,"metrics":{},"status":"discard","description":"Split-SDPA small-chunk extension: DFLASH_BSTNXBT_SPLIT_CHUNK_SIZE=3.","timestamp":1776288028190,"segment":23,"confidence":4.717822256241113,"iterationTokens":627,"asi":{"hypothesis":"Untested tiny chunk 3 could potentially reduce per-chunk cache pressure enough to offset launch overhead.","rollback_reason":"Regression versus keep (104.52 vs 106.86).","next_action_hint":"Add chunk size 3 to do-not-retry set; tiny-chunk extension is non-winning.","backend":"mirror_sd_mlx","context_only_draft_cache":1,"draft_sink":48,"split_chunk_size":3,"delta_vs_keep":-2.3447720497721893}}
{"run":757,"commit":"8b55918","metric":106.41278856526905,"metrics":{},"status":"discard","description":"Split-SDPA small-chunk extension: DFLASH_BSTNXBT_SPLIT_CHUNK_SIZE=2.","timestamp":1776288059387,"segment":23,"confidence":4.934258658112728,"iterationTokens":640,"asi":{"hypothesis":"Tiny chunk 2 might hit a favorable balance between split granularity and compute locality.","rollback_reason":"Near-keep but still below winner (106.41 vs 106.86).","next_action_hint":"Add chunk size 2 to do-not-retry set; no robust advantage over default.","backend":"mirror_sd_mlx","context_only_draft_cache":1,"draft_sink":48,"split_chunk_size":2,"delta_vs_keep":-0.447211434731052}}
{"run":758,"commit":"8b55918","metric":106.07169835671864,"metrics":{},"status":"discard","description":"Split-SDPA small-chunk extension: DFLASH_BSTNXBT_SPLIT_CHUNK_SIZE=1.","timestamp":1776288089517,"segment":23,"confidence":5.171508523913269,"iterationTokens":638,"asi":{"hypothesis":"Per-token split chunking (1) may maximize exact-prefix handling and improve latency under current regime.","rollback_reason":"Below keep (106.07 vs 106.86).","next_action_hint":"Add chunk size 1 to do-not-retry set; full small-chunk sweep now exhausted.","backend":"mirror_sd_mlx","context_only_draft_cache":1,"draft_sink":48,"split_chunk_size":1,"delta_vs_keep":-0.7883016432814636}}
{"run":759,"commit":"8b55918","metric":106.44861841467906,"metrics":{},"status":"discard","description":"Split-SDPA chunk extension: DFLASH_BSTNXBT_SPLIT_CHUNK_SIZE=27.","timestamp":1776288129919,"segment":23,"confidence":5.199531656532719,"iterationTokens":994,"asi":{"hypothesis":"Large chunk 27 might recover performance if small/medium chunks are saturated in the current regime.","rollback_reason":"Near-keep but still below winner (106.45 vs 106.86).","next_action_hint":"Add chunk size 27 to do-not-retry set; continued extension has not surpassed keep.","backend":"mirror_sd_mlx","context_only_draft_cache":1,"draft_sink":48,"split_chunk_size":27,"delta_vs_keep":-0.4113815853209432}}
{"run":760,"commit":"8b55918","metric":96.28591123722443,"metrics":{},"status":"discard","description":"Split-SDPA chunk extension: DFLASH_BSTNXBT_SPLIT_CHUNK_SIZE=28.","timestamp":1776288161085,"segment":23,"confidence":5.171508523913269,"iterationTokens":638,"asi":{"hypothesis":"Another large chunk candidate (28) could outperform 27 if alignment effects dominate.","rollback_reason":"Major regression to 96.29 tok/s.","next_action_hint":"Add chunk size 28 to do-not-retry set and treat high-chunk extension as unstable/non-viable.","backend":"mirror_sd_mlx","context_only_draft_cache":1,"draft_sink":48,"split_chunk_size":28,"delta_vs_keep":-10.574088762775562}}
{"run":761,"commit":"8b55918","metric":38.14225182618162,"metrics":{},"status":"discard","description":"Post-chunk28 anchor run on restored keep config.","timestamp":1776288208244,"segment":23,"confidence":4.934258658112728,"iterationTokens":646,"asi":{"hypothesis":"Reverting from chunk28 should restore baseline if regression was purely candidate-local.","rollback_reason":"Anchor collapsed severely to 38.14 tok/s, indicating a fresh instability trough.","next_action_hint":"Run immediate control symmetry check to classify this as global collapse window.","backend":"mirror_sd_mlx","context_only_draft_cache":1,"draft_sink":48,"collapse_regime":true}}
{"run":762,"commit":"8b55918","metric":35.87060544283047,"metrics":{},"status":"discard","description":"Control symmetry check after 38.14 mirror collapse (mirror disabled).","timestamp":1776288267748,"segment":23,"confidence":4.717822256241113,"iterationTokens":662,"asi":{"hypothesis":"If collapse is global, control should also collapse in the same window.","rollback_reason":"Control also collapsed to 35.87 tok/s, confirming shared severe instability.","next_action_hint":"Run mirror follow-up recovery sample; avoid any tuning conclusions in this trough.","backend":"bstnxbt_mlx","mirror_runtime_enabled":0,"context_only_draft_cache":1,"draft_sink":48,"collapse_regime":true,"paired_delta_tok_s":2.27164638335115}}
{"run":763,"commit":"8b55918","metric":44.82984270093186,"metrics":{},"status":"discard","description":"Mirror recovery follow-up after shared ~36-38 collapse window.","timestamp":1776288314133,"segment":23,"confidence":4.674598934699107,"iterationTokens":618,"asi":{"hypothesis":"Mirror should begin rebounding from collapse trough on immediate rerun.","rollback_reason":"Only partial rebound to 44.83, still deep trough.","next_action_hint":"Continue sparse recovery probes until throughput exits collapse regime.","backend":"mirror_sd_mlx","context_only_draft_cache":1,"draft_sink":48,"collapse_regime":true,"paired_control_tok_s":35.87060544283047,"paired_delta_tok_s":8.95923725810139}}
{"run":764,"commit":"8b55918","metric":80.88738250550765,"metrics":{},"status":"discard","description":"Additional recovery probe after deep collapse wave on unchanged mirror config.","timestamp":1776288349914,"segment":23,"confidence":4.63216042207968,"iterationTokens":653,"asi":{"hypothesis":"Throughput may rapidly rebound from deep trough on consecutive unchanged runs.","rollback_reason":"Rebounded strongly to 80.89 but still below keep and prior high-band.","next_action_hint":"Run control pair sample to verify shared rebound and avoid backend-specific misread.","backend":"mirror_sd_mlx","context_only_draft_cache":1,"draft_sink":48,"stability_probe":true}}
{"run":765,"commit":"8b55918","metric":56.88911078478538,"metrics":{},"status":"discard","description":"Control pair sample during rebound from deep collapse (mirror disabled).","timestamp":1776288393043,"segment":23,"confidence":4.527785208151041,"iterationTokens":647,"asi":{"hypothesis":"If rebound is global but noisy, control may still lag/lead substantially in adjacent samples.","rollback_reason":"Control dropped back to 56.89 while paired mirror was 80.89, showing strong ordering instability.","next_action_hint":"Run immediate mirror follow-up to complete pair and avoid overinterpreting backend advantage.","backend":"bstnxbt_mlx","mirror_runtime_enabled":0,"context_only_draft_cache":1,"draft_sink":48,"paired_mirror_tok_s":80.88738250550765,"paired_delta_tok_s":23.99827172072227}}
{"run":766,"commit":"8b55918","metric":64.7300593254494,"metrics":{},"status":"discard","description":"Mirror follow-up after low control rebound sample.","timestamp":1776288428420,"segment":23,"confidence":4.411067665099776,"iterationTokens":638,"asi":{"hypothesis":"Mirror should remain in depressed band if rebound remains unstable.","rollback_reason":"Mirror also low at 64.73, confirming ongoing trough volatility.","next_action_hint":"Continue sparse recovery probes and defer candidate tuning until >100 band returns.","backend":"mirror_sd_mlx","context_only_draft_cache":1,"draft_sink":48,"collapse_regime":true,"paired_control_tok_s":56.88911078478538,"paired_delta_tok_s":7.840948540664026}}
{"run":767,"commit":"8b55918","metric":76.865229757454,"metrics":{},"status":"discard","description":"Recovery probe after latest ~36-65 collapse wave.","timestamp":1776288480949,"segment":23,"confidence":4.393820829039771,"iterationTokens":1290,"asi":{"hypothesis":"Unchanged reruns should gradually climb out of trough after instability spike.","rollback_reason":"Recovered to 76.87 but still below high-band baseline and keep.","next_action_hint":"Run control pair sample to validate shared recovery pace.","backend":"mirror_sd_mlx","context_only_draft_cache":1,"draft_sink":48,"stability_probe":true}}
{"run":768,"commit":"8b55918","metric":92.3605672006695,"metrics":{},"status":"discard","description":"Control pair sample during rebound from latest collapse wave (mirror disabled).","timestamp":1776288522135,"segment":23,"confidence":4.362268147215566,"iterationTokens":634,"asi":{"hypothesis":"If recovery is global, control should rebound alongside mirror and may temporarily lead.","rollback_reason":"Control rebounded higher (92.36), confirming shared but uneven recovery.","next_action_hint":"Run immediate mirror follow-up to complete pair and track ordering flips.","backend":"bstnxbt_mlx","mirror_runtime_enabled":0,"context_only_draft_cache":1,"draft_sink":48,"paired_mirror_tok_s":76.865229757454,"paired_delta_tok_s":-15.495337443215488}}
{"run":769,"commit":"8b55918","metric":92.2190087537204,"metrics":{},"status":"discard","description":"Mirror follow-up after control-leading rebound sample.","timestamp":1776288555074,"segment":23,"confidence":4.327279934025387,"iterationTokens":615,"asi":{"hypothesis":"Mirror should catch up as rebound progresses if ordering differences are transient.","rollback_reason":"Mirror matched control (~92.22), still below high-band and keep.","next_action_hint":"Continue recovery monitoring until >100 returns before resuming candidate experiments.","backend":"mirror_sd_mlx","context_only_draft_cache":1,"draft_sink":48,"paired_control_tok_s":92.3605672006695,"paired_delta_tok_s":-0.14155844694909703,"stability_probe":true}}
{"run":770,"commit":"8b55918","metric":93.41175760500093,"metrics":{},"status":"discard","description":"Additional mirror recovery probe in post-collapse rebound.","timestamp":1776288588161,"segment":23,"confidence":4.278955506076369,"iterationTokens":618,"asi":{"hypothesis":"Consecutive unchanged runs should continue lifting toward >100 as trough decays.","rollback_reason":"Only marginal rise to 93.41, still below high-band baseline.","next_action_hint":"Run paired control check to confirm shared plateau before waiting for further rebound.","backend":"mirror_sd_mlx","context_only_draft_cache":1,"draft_sink":48,"stability_probe":true}}
{"run":771,"commit":"8b55918","metric":105.34108490429449,"metrics":{},"status":"discard","description":"Mirror anchor after rebound from latest collapse wave (unchanged keep config).","timestamp":1776288852933,"segment":23,"confidence":4.327279934025387,"iterationTokens":618,"asi":{"hypothesis":"Throughput should have recovered back into the shared ~105 local band after the recent ~36–93 oscillation window.","rollback_reason":"Anchor is still below keep (105.34 vs 106.86).","next_action_hint":"Run immediate control pair to confirm shared band and backend ordering before new candidate probes.","backend":"mirror_sd_mlx","context_only_draft_cache":1,"draft_sink":48,"stability_probe":true,"delta_vs_keep":-1.5189150957055197}}
{"run":772,"commit":"8b55918","metric":104.27796843087107,"metrics":{},"status":"discard","description":"Control pair after 105.34 mirror anchor (mirror disabled).","timestamp":1776288891780,"segment":23,"confidence":4.362268147215566,"iterationTokens":756,"asi":{"hypothesis":"If current regime is shared, control should land near mirror anchor with modest jitter.","rollback_reason":"Comparison-only control sample remains below keep and slightly below paired mirror.","next_action_hint":"Run mirror follow-up to complete pair and track short-window ordering.","backend":"bstnxbt_mlx","mirror_runtime_enabled":0,"context_only_draft_cache":1,"draft_sink":48,"paired_mirror_tok_s":105.34108490429449,"paired_delta_tok_s":1.063116473423411}}
{"run":773,"commit":"8b55918","metric":105.684707118379,"metrics":{},"status":"discard","description":"Mirror follow-up completing current mirror/control/mirror mini-bundle.","timestamp":1776288924762,"segment":23,"confidence":4.393820829039771,"iterationTokens":637,"asi":{"hypothesis":"Mirror should rebound toward or above control on immediate rerun if ordering remains jitter-driven.","rollback_reason":"Mirror recovered above paired control but still below keep.","next_action_hint":"Current local band remains ~104-106; continue only structural candidates with immediate confirmation near keep.","backend":"mirror_sd_mlx","context_only_draft_cache":1,"draft_sink":48,"paired_control_tok_s":104.27796843087107,"paired_delta_tok_s":1.4067386875079397,"delta_vs_keep":-1.1752928816209978}}
