{"run":1285,"commit":"366dfde","metric":106.94445675437518,"metrics":{},"status":"discard","description":"Mirror sample rebounded slightly to ~106.94.","timestamp":1776321211407,"segment":23,"confidence":3.6920937691554805,"iterationTokens":604,"asi":{"hypothesis":"Plateau remains bounded in high-106/low-107 with low short-term variance.","rollback_reason":"Below keep and unchanged shape.","next_action_hint":"Continue mirror scans; hold major-bet attempts until clear regime shift.","backend":"mirror_sd_mlx","context_only_draft_cache":1,"draft_sink":48,"async_draft_eval":1,"fused_draft_verify_eval":1,"paired_prev_tok_s":106.90789617218525,"paired_delta_tok_s":0.03656058218993007,"delta_vs_keep":-1.527012740408311}}
{"run":1286,"commit":"366dfde","metric":107.03994804807638,"metrics":{},"status":"discard","description":"Mirror sample touched top of current plateau (~107.04).","timestamp":1776321238893,"segment":23,"confidence":3.7202010054240624,"iterationTokens":647,"asi":{"hypothesis":"Regime remains plateaued below keep with occasional 107.0+ samples.","rollback_reason":"Still below 108.47 keep.","next_action_hint":"Continue sampling; parity check if mirror deviates >0.3 from control trend.","backend":"mirror_sd_mlx","context_only_draft_cache":1,"draft_sink":48,"async_draft_eval":1,"fused_draft_verify_eval":1,"paired_prev_tok_s":106.94445675437518,"paired_delta_tok_s":0.09549129370119336,"delta_vs_keep":-1.4315214467071138}}
{"run":1287,"commit":"366dfde","metric":106.85488802255408,"metrics":{},"status":"discard","description":"Mirror sample dipped to ~106.85, still within shared plateau envelope.","timestamp":1776321266239,"segment":23,"confidence":3.7479536272333855,"iterationTokens":689,"asi":{"hypothesis":"Current plateau width is roughly 106.85–107.08.","rollback_reason":"Below keep and no breakout signal.","next_action_hint":"Take a control parity check to verify this lower edge is shared.","backend":"mirror_sd_mlx","context_only_draft_cache":1,"draft_sink":48,"async_draft_eval":1,"fused_draft_verify_eval":1,"delta_vs_keep":-1.6165814722294165,"plateau_lower_edge":true}}
{"run":1288,"commit":"366dfde","metric":106.94546895889461,"metrics":{},"status":"discard","description":"Control parity check at mirror lower-edge sample (`DFLASH_MIRROR_SD_RUNTIME=0`) remained within same ~107 envelope.","timestamp":1776321299833,"segment":23,"confidence":3.7761234291558874,"iterationTokens":703,"asi":{"hypothesis":"Lower-edge mirror sample should be shared if regime is backend-agnostic.","rollback_reason":"Control ~106.95 aligns with mirror ~106.85; parity backend remains non-authoritative.","next_action_hint":"Restore mirror runtime and continue passive monitoring for any 108+ regime shift.","backend":"bstnxbt_mlx","mirror_runtime_enabled":0,"context_only_draft_cache":1,"draft_sink":48,"async_draft_eval":1,"fused_draft_verify_eval":1,"paired_mirror_tok_s":106.85488802255408,"paired_delta_tok_s":-0.09058093634052765,"authoritative_lane":"mirror_sd_mlx","shared_plateau":true}}
{"run":1289,"commit":"366dfde","metric":106.99351933012765,"metrics":{},"status":"discard","description":"Mirror anchor after parity check returned to ~106.99 center.","timestamp":1776321334251,"segment":23,"confidence":3.781029479028442,"iterationTokens":1123,"asi":{"hypothesis":"Shared plateau remains stable with mirror/control near-identical.","rollback_reason":"Below keep.","next_action_hint":"Continue mirror-only sampling while waiting for fresh high-window signal.","backend":"mirror_sd_mlx","context_only_draft_cache":1,"draft_sink":48,"async_draft_eval":1,"fused_draft_verify_eval":1,"paired_control_tok_s":106.94546895889461,"paired_delta_tok_s":0.04805037123303903,"delta_vs_keep":-1.4779486976565757}}
{"run":1290,"commit":"366dfde","metric":107.003559761877,"metrics":{},"status":"discard","description":"Mirror sample stayed centered at ~107.00.","timestamp":1776321361718,"segment":23,"confidence":3.785948293651968,"iterationTokens":628,"asi":{"hypothesis":"Regime is stationary around 107 with very low spread.","rollback_reason":"Still below keep 108.47.","next_action_hint":"Maintain loop; no structural edits in stationary regime.","backend":"mirror_sd_mlx","context_only_draft_cache":1,"draft_sink":48,"async_draft_eval":1,"fused_draft_verify_eval":1,"paired_prev_tok_s":106.99351933012765,"paired_delta_tok_s":0.01004043174934904,"delta_vs_keep":-1.467908265907232}}
{"run":1291,"commit":"366dfde","metric":107.0096446599155,"metrics":{},"status":"discard","description":"Mirror continuity sample ~107.01; still flat.","timestamp":1776321391591,"segment":23,"confidence":3.790679783378459,"iterationTokens":625,"asi":{"hypothesis":"Recovered plateau remains tightly bounded and backend-agnostic.","rollback_reason":"Below best.","next_action_hint":"Continue measurements; re-open exploration only after regime transition.","backend":"mirror_sd_mlx","context_only_draft_cache":1,"draft_sink":48,"async_draft_eval":1,"fused_draft_verify_eval":1,"delta_vs_keep":-1.4618233678687287,"stable_plateau":true}}
{"run":1292,"commit":"366dfde","metric":106.90779990393132,"metrics":{},"status":"discard","description":"Mirror sample moved to lower edge (~106.91) but still inside stable envelope.","timestamp":1776321425392,"segment":23,"confidence":3.80287609062151,"iterationTokens":661,"asi":{"hypothesis":"Current plateau envelope remains approximately 106.9–107.1.","rollback_reason":"Below keep.","next_action_hint":"Continue loop; no code changes while plateau persists.","backend":"mirror_sd_mlx","context_only_draft_cache":1,"draft_sink":48,"async_draft_eval":1,"fused_draft_verify_eval":1,"paired_prev_tok_s":107.0096446599155,"paired_delta_tok_s":-0.10184475598417522,"delta_vs_keep":-1.5636696351229085}}
{"run":1293,"commit":"366dfde","metric":106.94059658644264,"metrics":{},"status":"discard","description":"Mirror sample rebounded slightly to ~106.94; plateau unchanged.","timestamp":1776321451816,"segment":23,"confidence":3.81014493086466,"iterationTokens":641,"asi":{"hypothesis":"Plateau remains stationary with small alternating jitter.","rollback_reason":"Still below keep 108.47.","next_action_hint":"Continue passive benchmarking until high-band reopens.","backend":"mirror_sd_mlx","context_only_draft_cache":1,"draft_sink":48,"async_draft_eval":1,"fused_draft_verify_eval":1,"paired_prev_tok_s":106.90779990393132,"paired_delta_tok_s":0.03279668251131794,"delta_vs_keep":-1.5308729526115945}}
{"run":1294,"commit":"366dfde","metric":106.97241648720758,"metrics":{},"status":"discard","description":"Mirror sample returned to ~106.97 center.","timestamp":1776321480033,"segment":23,"confidence":3.8174416117325087,"iterationTokens":629,"asi":{"hypothesis":"No meaningful movement; center remains ~106.95–106.98.","rollback_reason":"Below keep.","next_action_hint":"Keep running baseline loop; defer all configuration experiments.","backend":"mirror_sd_mlx","context_only_draft_cache":1,"draft_sink":48,"async_draft_eval":1,"fused_draft_verify_eval":1,"delta_vs_keep":-1.4990530518466525,"stationary_regime":true}}
{"run":1295,"commit":"366dfde","metric":106.97205890318118,"metrics":{},"status":"discard","description":"Mirror continuity sample held at ~106.97 in stationary plateau.","timestamp":1776321560034,"segment":23,"confidence":3.826484318167403,"iterationTokens":1582,"asi":{"hypothesis":"Current recovered regime remains flat around ~107 with no new edge signal.","rollback_reason":"Still below keep 108.47.","next_action_hint":"Continue measurement-only loop; defer structural bets until plateau breaks.","backend":"mirror_sd_mlx","context_only_draft_cache":1,"draft_sink":48,"async_draft_eval":1,"fused_draft_verify_eval":1,"delta_vs_keep":-1.4994106358730537,"stationary_regime":true}}
{"run":1296,"commit":"366dfde","metric":107.01366731154155,"metrics":{},"status":"discard","description":"Mirror sample nudged to ~107.01; plateau remains unchanged.","timestamp":1776321588587,"segment":23,"confidence":3.8317375468582386,"iterationTokens":626,"asi":{"hypothesis":"Regime continues oscillating narrowly around ~107.0.","rollback_reason":"No primary improvement versus keep.","next_action_hint":"Maintain mirror sampling; parity check only on significant drift.","backend":"mirror_sd_mlx","context_only_draft_cache":1,"draft_sink":48,"async_draft_eval":1,"fused_draft_verify_eval":1,"paired_prev_tok_s":106.97205890318118,"paired_delta_tok_s":0.041608408360378796,"delta_vs_keep":-1.4578022275126847}}
{"run":1297,"commit":"366dfde","metric":106.94237329573794,"metrics":{},"status":"discard","description":"Mirror sample dipped to ~106.94 within same flat regime.","timestamp":1776321615161,"segment":23,"confidence":3.8411510890928673,"iterationTokens":642,"asi":{"hypothesis":"Plateau remains stable with low-amplitude jitter.","rollback_reason":"Still below keep 108.47.","next_action_hint":"Continue baseline scanning; wait for spontaneous 108+ window.","backend":"mirror_sd_mlx","context_only_draft_cache":1,"draft_sink":48,"async_draft_eval":1,"fused_draft_verify_eval":1,"paired_prev_tok_s":107.01366731154155,"paired_delta_tok_s":-0.07129401580360348,"delta_vs_keep":-1.5290962433162905}}
{"run":1298,"commit":"366dfde","metric":106.97665007485062,"metrics":{},"status":"discard","description":"Mirror sample returned to ~106.98 center.","timestamp":1776321644827,"segment":23,"confidence":3.8590773801025984,"iterationTokens":642,"asi":{"hypothesis":"Recovered band remains stationary around ~107.","rollback_reason":"No improvement over keep.","next_action_hint":"Continue mirror-only sampling until regime shift evidence appears.","backend":"mirror_sd_mlx","context_only_draft_cache":1,"draft_sink":48,"async_draft_eval":1,"fused_draft_verify_eval":1,"paired_prev_tok_s":106.94237329573794,"paired_delta_tok_s":0.03427677911268231,"delta_vs_keep":-1.494819464203608}}
{"run":1299,"commit":"366dfde","metric":106.91942343632188,"metrics":{},"status":"discard","description":"Mirror sample at ~106.92 despite elevated warmup variance; steady-state unchanged.","timestamp":1776321673864,"segment":23,"confidence":3.8594469968711023,"iterationTokens":638,"asi":{"hypothesis":"Warmup fluctuations are not materially shifting request throughput in this regime.","rollback_reason":"Still below keep.","next_action_hint":"Run control parity sample to reconfirm shared center after warmup outlier.","backend":"mirror_sd_mlx","context_only_draft_cache":1,"draft_sink":48,"async_draft_eval":1,"fused_draft_verify_eval":1,"warmup_s":2.9132062500575557,"delta_vs_keep":-1.552046102732349,"shared_center_check_due":true}}
{"run":1300,"commit":"366dfde","metric":107.07088714836996,"metrics":{},"status":"discard","description":"Control parity after warmup-variance mirror sample (`DFLASH_MIRROR_SD_RUNTIME=0`) stayed in same ~107 envelope.","timestamp":1776321708353,"segment":23,"confidence":3.8590228653558456,"iterationTokens":738,"asi":{"hypothesis":"Control should remain near mirror if warmup outlier did not indicate backend-specific drift.","rollback_reason":"Control ~107.07 remains near mirror band; parity backend non-authoritative.","next_action_hint":"Restore mirror runtime and continue baseline scans.","backend":"bstnxbt_mlx","mirror_runtime_enabled":0,"context_only_draft_cache":1,"draft_sink":48,"async_draft_eval":1,"fused_draft_verify_eval":1,"paired_mirror_tok_s":106.91942343632188,"paired_delta_tok_s":-0.15146371204807707,"authoritative_lane":"mirror_sd_mlx","shared_plateau":true}}
{"run":1301,"commit":"366dfde","metric":106.99520976853618,"metrics":{},"status":"discard","description":"Mirror anchor after parity check returned to ~106.995 center.","timestamp":1776321744371,"segment":23,"confidence":3.8677581792477973,"iterationTokens":1145,"asi":{"hypothesis":"Shared plateau remains intact around ~107.","rollback_reason":"Below keep by ~1.48 tok/s.","next_action_hint":"Continue passive sampling; no structural adjustments yet.","backend":"mirror_sd_mlx","context_only_draft_cache":1,"draft_sink":48,"async_draft_eval":1,"fused_draft_verify_eval":1,"paired_control_tok_s":107.07088714836996,"paired_delta_tok_s":-0.0756773798337823,"delta_vs_keep":-1.4762582592480356}}
{"run":1302,"commit":"366dfde","metric":107.04432312044605,"metrics":{},"status":"discard","description":"Mirror sample rose to ~107.04, still inside flat regime.","timestamp":1776321773304,"segment":23,"confidence":3.8915427066952106,"iterationTokens":641,"asi":{"hypothesis":"Current regime remains bounded in ~106.9–107.1 without breakout.","rollback_reason":"No improvement vs keep.","next_action_hint":"Continue mirror loop; watch for sustained move toward 108.","backend":"mirror_sd_mlx","context_only_draft_cache":1,"draft_sink":48,"async_draft_eval":1,"fused_draft_verify_eval":1,"paired_prev_tok_s":106.99520976853618,"paired_delta_tok_s":0.04911335190987374,"delta_vs_keep":-1.427144907338169}}
{"run":1303,"commit":"366dfde","metric":107.03552670114699,"metrics":{},"status":"discard","description":"Mirror repeat remained ~107.04, reinforcing stationary plateau.","timestamp":1776321800570,"segment":23,"confidence":3.904465719575175,"iterationTokens":657,"asi":{"hypothesis":"Regime remains steady with low variance around ~107.","rollback_reason":"Still below keep 108.47.","next_action_hint":"Continue passive benchmarking; defer new ideas until regime transition.","backend":"mirror_sd_mlx","context_only_draft_cache":1,"draft_sink":48,"async_draft_eval":1,"fused_draft_verify_eval":1,"paired_prev_tok_s":107.04432312044605,"paired_delta_tok_s":-0.008796419299056847,"delta_vs_keep":-1.435941326637226}}
{"run":1304,"commit":"366dfde","metric":106.89284245724585,"metrics":{},"status":"discard","description":"Mirror sample touched lower side of plateau (~106.89) but no regime break.","timestamp":1776321832620,"segment":23,"confidence":3.9174748477616728,"iterationTokens":688,"asi":{"hypothesis":"Current envelope still spans roughly 106.85–107.08.","rollback_reason":"Below keep and within expected jitter.","next_action_hint":"Keep monitoring; parity check if consecutive lower-edge samples continue.","backend":"mirror_sd_mlx","context_only_draft_cache":1,"draft_sink":48,"async_draft_eval":1,"fused_draft_verify_eval":1,"delta_vs_keep":-1.5786255705383605,"plateau_lower_edge":true}}
{"run":1305,"commit":"366dfde","metric":106.9029486315254,"metrics":{},"status":"discard","description":"Mirror follow-up stayed near lower-mid plateau (~106.90).","timestamp":1776321859954,"segment":23,"confidence":3.9261097393863276,"iterationTokens":648,"asi":{"hypothesis":"Regime remains stable and backend-neutral despite lower-edge touches.","rollback_reason":"No keep improvement.","next_action_hint":"Take control parity spot-check now to reconfirm shared lower-edge behavior.","backend":"mirror_sd_mlx","context_only_draft_cache":1,"draft_sink":48,"async_draft_eval":1,"fused_draft_verify_eval":1,"paired_prev_tok_s":106.89284245724585,"paired_delta_tok_s":0.010106174279543726,"delta_vs_keep":-1.5685193962588166,"shared_center_check_due":true}}
{"run":1306,"commit":"366dfde","metric":107.06400470906048,"metrics":{},"status":"discard","description":"Control parity spot-check for lower-edge mirror samples (`DFLASH_MIRROR_SD_RUNTIME=0`) stayed within same shared envelope.","timestamp":1776321898559,"segment":23,"confidence":3.9281661784717867,"iterationTokens":761,"asi":{"hypothesis":"If lower-edge mirror samples are regime noise, control should remain in same ~107 band.","rollback_reason":"Control ~107.06 confirms shared plateau; parity backend remains non-authoritative.","next_action_hint":"Restore mirror runtime and continue passive scans for high-window return.","backend":"bstnxbt_mlx","mirror_runtime_enabled":0,"context_only_draft_cache":1,"draft_sink":48,"async_draft_eval":1,"fused_draft_verify_eval":1,"paired_mirror_tok_s":106.9029486315254,"paired_delta_tok_s":-0.16105607753508733,"authoritative_lane":"mirror_sd_mlx","shared_plateau":true}}
{"run":1307,"commit":"366dfde","metric":107.07191154617409,"metrics":{},"status":"discard","description":"Mirror anchor after parity check rose to ~107.07, still within stable shared plateau.","timestamp":1776321947784,"segment":23,"confidence":3.9495291322871138,"iterationTokens":1468,"asi":{"hypothesis":"Post-collapse plateau remains active with mirror/control near-tied around ~107.","rollback_reason":"Below keep 108.47.","next_action_hint":"Continue passive mirror sampling; wait for a sustained 108+ reopening before new structural probes.","backend":"mirror_sd_mlx","context_only_draft_cache":1,"draft_sink":48,"async_draft_eval":1,"fused_draft_verify_eval":1,"paired_control_tok_s":107.06400470906048,"paired_delta_tok_s":0.007906837113610876,"delta_vs_keep":-1.3995579486099623}}
{"run":1308,"commit":"366dfde","metric":107.06710646669737,"metrics":{},"status":"discard","description":"Mirror follow-up stayed near ~107.07, confirming unchanged plateau.","timestamp":1776321978975,"segment":23,"confidence":3.980917384520494,"iterationTokens":677,"asi":{"hypothesis":"Regime remains stable around 107 with no directional trend.","rollback_reason":"No improvement against keep.","next_action_hint":"Continue autonomous loop and monitor for any return to 108+ windows.","backend":"mirror_sd_mlx","context_only_draft_cache":1,"draft_sink":48,"async_draft_eval":1,"fused_draft_verify_eval":1,"paired_prev_tok_s":107.07191154617409,"paired_delta_tok_s":-0.004805079476716924,"delta_vs_keep":-1.404363028086678,"stationary_regime":true}}
{"run":1309,"commit":"366dfde","metric":106.83236022958388,"metrics":{},"status":"discard","description":"Mirror sample dipped to ~106.83, lower edge of current shared plateau.","timestamp":1776322012539,"segment":23,"confidence":3.9854956409834554,"iterationTokens":664,"asi":{"hypothesis":"Occasional lower-edge hits are expected within the post-collapse ~107 regime.","rollback_reason":"Still below keep and no breakout.","next_action_hint":"Take control parity check if another sub-106.85 sample occurs; otherwise continue mirror scanning.","backend":"mirror_sd_mlx","context_only_draft_cache":1,"draft_sink":48,"async_draft_eval":1,"fused_draft_verify_eval":1,"request_s":9.585110708023421,"delta_vs_keep":-1.6391092652001695,"plateau_lower_edge":true}}
{"run":1310,"commit":"366dfde","metric":106.97511343692666,"metrics":{},"status":"discard","description":"Mirror sample rebounded from lower edge back to ~106.98 center.","timestamp":1776322043785,"segment":23,"confidence":3.990084440024183,"iterationTokens":689,"asi":{"hypothesis":"Sub-106.85 dip was routine jitter, not a sustained shift.","rollback_reason":"Still below keep 108.47.","next_action_hint":"Resume standard mirror-only monitoring for high-window return.","backend":"mirror_sd_mlx","context_only_draft_cache":1,"draft_sink":48,"async_draft_eval":1,"fused_draft_verify_eval":1,"paired_prev_tok_s":106.83236022958388,"paired_delta_tok_s":0.14275320734277744,"delta_vs_keep":-1.4963560578573885}}
{"run":1311,"commit":"366dfde","metric":107.5513964073817,"metrics":{},"status":"discard","description":"Mirror sample jumped to ~107.55, above recent center but still below keep.","timestamp":1776322076231,"segment":23,"confidence":3.9891784785361613,"iterationTokens":734,"asi":{"hypothesis":"A mild upward drift may be starting from the ~107 plateau.","rollback_reason":"Despite jump, still short of 108.47 keep.","next_action_hint":"Run immediate follow-up to see if >107.5 persists before parity check.","backend":"mirror_sd_mlx","context_only_draft_cache":1,"draft_sink":48,"async_draft_eval":1,"fused_draft_verify_eval":1,"paired_prev_tok_s":106.97511343692666,"paired_delta_tok_s":0.5762829704550362,"delta_vs_keep":-0.9200730874023489,"upshift_hint":true}}
{"run":1312,"commit":"e36eed1","metric":108.70793173452478,"metrics":{},"status":"keep","description":"Mirror follow-up after 107.55 upshift broke out to a clear new best in a reopened high-window.","timestamp":1776322105822,"segment":23,"confidence":4.0639566601638055,"iterationTokens":709,"asi":{"hypothesis":"If the upshift was real, immediate follow-up should climb further and challenge/exceed the prior 108.47 keep.","backend":"mirror_sd_mlx","context_only_draft_cache":1,"draft_sink":48,"async_draft_eval":1,"fused_draft_verify_eval":1,"paired_prev_tok_s":107.5513964073817,"paired_delta_tok_s":1.1565353271430867,"delta_vs_keep":0.2364622397407272,"high_window_reopened":true}}
{"run":1313,"commit":"e36eed1","metric":108.67585444178869,"metrics":{},"status":"discard","description":"Immediate mirror confirmation after new keep stayed in reopened >108.6 high-window.","timestamp":1776322138163,"segment":23,"confidence":4.091956115539451,"iterationTokens":844,"asi":{"hypothesis":"Post-keep rerun should remain in the same high-window if breakout is real.","rollback_reason":"Strong at 108.68 but narrowly below new keep 108.71.","next_action_hint":"Take control parity sample to verify shared high-window, then continue mirror scans for further exceedance.","backend":"mirror_sd_mlx","context_only_draft_cache":1,"draft_sink":48,"async_draft_eval":1,"fused_draft_verify_eval":1,"paired_keep_tok_s":108.70793173452478,"paired_delta_tok_s":-0.03207729273608895,"delta_vs_keep":-0.03207729273608895,"high_window_stable":true}}
