{"run":2037,"commit":"7f0ef90","metric":10.549777624662966,"metrics":{},"status":"discard","description":"Repeat around ~10.55 eval_s (~90.74 tok/s), watchdog idle.","timestamp":1776392570753,"segment":24,"confidence":0.04901742761292047,"iterationTokens":1414,"asi":{"hypothesis":"Rebound remains stable in upper-soft recovery band.","rollback_reason":"Primary metric above best floor.","next_action_hint":"Continue unchanged loop for sub-10 break.","diagnostic_findings":{"completion_tok_s":90.737615624988,"dflash_eval_s":10.549777624662966,"safe_mode_activations":0}}}
{"run":2038,"commit":"7f0ef90","metric":10.177771538030356,"metrics":{},"status":"discard","description":"Recovery strengthened (~93.91 tok/s, eval_s ~10.18) with watchdog idle.","timestamp":1776392606623,"segment":24,"confidence":0.04902732663750112,"iterationTokens":1442,"asi":{"hypothesis":"System is moving from upper-soft toward sub-10 recovery without collapse markers.","rollback_reason":"Primary metric above best floor.","next_action_hint":"Continue unchanged mirror loop for low-soft/high-soft re-entry.","diagnostic_findings":{"completion_tok_s":93.90727814027109,"dflash_eval_s":10.177771538030356,"safe_mode_activations":0}}}
{"run":2039,"commit":"7f0ef90","metric":10.395969826262444,"metrics":{},"status":"discard","description":"Recovery held in ~10.4 band (~91.84 tok/s), watchdog inactive.","timestamp":1776392637367,"segment":24,"confidence":0.04907974394702514,"iterationTokens":1413,"asi":{"hypothesis":"Current rebound remains stable without spike-triggered collapse.","rollback_reason":"Primary metric above best floor.","next_action_hint":"Continue unchanged loop for deeper soft-band recovery.","diagnostic_findings":{"completion_tok_s":91.84324710873962,"dflash_eval_s":10.395969826262444,"safe_mode_activations":0}}}
{"run":2040,"commit":"7f0ef90","metric":10.244055336923338,"metrics":{},"status":"discard","description":"Recovery improved again (~93.21 tok/s, eval_s ~10.24), watchdog idle.","timestamp":1776392666415,"segment":24,"confidence":0.04904385544389054,"iterationTokens":1397,"asi":{"hypothesis":"Broad inflation is continuing to relax toward the high-soft regime.","rollback_reason":"Primary metric above best floor.","next_action_hint":"Continue unchanged loop for sub-10 and low-9 retest.","diagnostic_findings":{"completion_tok_s":93.21323451354182,"dflash_eval_s":10.244055336923338,"safe_mode_activations":0}}}
{"run":2041,"commit":"7f0ef90","metric":10.402583874878474,"metrics":{},"status":"discard","description":"Recovery drifted slightly higher (~91.78 tok/s, eval_s ~10.40), watchdog idle.","timestamp":1776392697049,"segment":24,"confidence":0.0490882239393416,"iterationTokens":1462,"asi":{"hypothesis":"Upper-soft recovery remains noisy but stable without collapse markers.","rollback_reason":"Primary metric above best floor.","next_action_hint":"Continue unchanged loop for sub-10 retest.","diagnostic_findings":{"completion_tok_s":91.78257078900431,"dflash_eval_s":10.402583874878474,"safe_mode_activations":0}}}
{"run":2042,"commit":"7f0ef90","metric":10.620037586195394,"metrics":{},"status":"discard","description":"Stable recovery sample (~89.93 tok/s, eval_s ~10.62), watchdog idle.","timestamp":1776392731135,"segment":24,"confidence":0.049188802496081166,"iterationTokens":1555,"asi":{"hypothesis":"Current regime is an upper-soft non-spike recovery pocket.","rollback_reason":"Primary metric above best floor.","next_action_hint":"Continue unchanged loop.","diagnostic_findings":{"completion_tok_s":89.9319146680325,"dflash_eval_s":10.620037586195394,"safe_mode_activations":0}}}
{"run":2043,"commit":"7f0ef90","metric":10.340931502636522,"metrics":{},"status":"discard","description":"Recovery moved lower (~92.50 tok/s, eval_s ~10.34), watchdog still idle.","timestamp":1776392759554,"segment":24,"confidence":0.048119282135054675,"iterationTokens":1389,"asi":{"hypothesis":"Non-spike recovery is continuing toward sub-10 region.","rollback_reason":"Primary metric above best floor.","next_action_hint":"Continue unchanged loop for sub-10 break.","diagnostic_findings":{"completion_tok_s":92.50120375854137,"dflash_eval_s":10.340931502636522,"safe_mode_activations":0}}}
{"run":2044,"commit":"7f0ef90","metric":10.160607159952633,"metrics":{},"status":"discard","description":"Recovery continued (~94.02 tok/s, eval_s ~10.16) with watchdog idle.","timestamp":1776392792679,"segment":24,"confidence":0.04660455930879753,"iterationTokens":1406,"asi":{"hypothesis":"Trend remains toward lower eval_s without spike collapse behavior.","rollback_reason":"Primary metric above best floor.","next_action_hint":"Continue unchanged loop for sub-10 crossover.","diagnostic_findings":{"completion_tok_s":94.01811106908215,"dflash_eval_s":10.160607159952633,"safe_mode_activations":0}}}
{"run":2045,"commit":"7f0ef90","metric":10.164066213765182,"metrics":{},"status":"discard","description":"Near-identical confirmation (~94.07 tok/s, eval_s ~10.16), watchdog idle.","timestamp":1776392823431,"segment":24,"confidence":0.04648104418012523,"iterationTokens":1396,"asi":{"hypothesis":"Rebound is stable in low-upper-soft band with minimal run-to-run drift.","rollback_reason":"Primary metric above best floor.","next_action_hint":"Continue unchanged loop for sub-10 crossing.","diagnostic_findings":{"completion_tok_s":94.0657001829098,"dflash_eval_s":10.164066213765182,"safe_mode_activations":0}}}
{"run":2046,"commit":"7f0ef90","metric":10.238661879324354,"metrics":{},"status":"discard","description":"Recovery stayed near ~10.24 eval_s (~92.40 tok/s), watchdog inactive.","timestamp":1776392867108,"segment":24,"confidence":0.04635818202023859,"iterationTokens":1985,"asi":{"hypothesis":"Rebound remains in non-spike upper-soft recovery with small jitter.","rollback_reason":"Primary metric above best floor.","next_action_hint":"Continue unchanged loop toward sub-10/high-soft re-entry.","diagnostic_findings":{"completion_tok_s":92.3958681774846,"dflash_eval_s":10.238661879324354,"safe_mode_activations":0}}}
{"run":2047,"commit":"7f0ef90","metric":12.282425047364086,"metrics":{},"status":"discard","description":"Non-spike regression sample (~75.49 tok/s, eval_s ~12.28) with watchdog still idle.","timestamp":1776392904527,"segment":24,"confidence":0.04576441163457683,"iterationTokens":1641,"asi":{"hypothesis":"Recovery can temporarily backslide without triggering collapse spikes.","rollback_reason":"Primary metric above best floor.","next_action_hint":"Continue unchanged loop; monitor whether this is transient jitter or new inflation pocket.","diagnostic_findings":{"completion_tok_s":75.48871502073104,"dflash_eval_s":12.282425047364086,"safe_mode_activations":0}}}
{"run":2048,"commit":"7f0ef90","metric":12.20573375443928,"metrics":{},"status":"discard","description":"Recovery backslid into higher non-spike inflation (~78.79 tok/s, eval_s ~12.21), watchdog idle.","timestamp":1776392985492,"segment":24,"confidence":0.04518565929407924,"iterationTokens":10743,"asi":{"hypothesis":"Upper-soft rebound remains unstable and can re-enter slower inflation pockets without spike triggers.","rollback_reason":"Primary metric above best floor.","next_action_hint":"Continue unchanged loop; watch for return toward ~10 eval_s band.","diagnostic_findings":{"completion_tok_s":78.78914750222248,"dflash_eval_s":12.20573375443928,"safe_mode_activations":0}}}
{"run":2049,"commit":"7f0ef90","metric":11.625863092835061,"metrics":{},"status":"discard","description":"Partial recovery (~82.43 tok/s, eval_s ~11.63), still watchdog-idle non-spike mode.","timestamp":1776393014781,"segment":24,"confidence":0.04489627617787622,"iterationTokens":1413,"asi":{"hypothesis":"Current pocket is fluctuating inside broad inflation rather than spike collapse.","rollback_reason":"Primary metric above best floor.","next_action_hint":"Continue unchanged loop for drift back toward ~10 eval_s.","diagnostic_findings":{"completion_tok_s":82.42548030428625,"dflash_eval_s":11.625863092835061,"safe_mode_activations":0}}}
{"run":2050,"commit":"7f0ef90","metric":13.0352953778347,"metrics":{},"status":"discard","description":"Shifted into deeper non-spike inflation (~73.85 tok/s, eval_s ~13.04), watchdog idle.","timestamp":1776393048383,"segment":24,"confidence":0.044619742807631306,"iterationTokens":1401,"asi":{"hypothesis":"Recovery remains highly non-stationary and can revisit slower pockets without spike events.","rollback_reason":"Primary metric above best floor.","next_action_hint":"Continue unchanged loop; parity not needed unless a fresh hard spike transition appears.","diagnostic_findings":{"completion_tok_s":73.85182632548116,"dflash_eval_s":13.0352953778347,"safe_mode_activations":0}}}
{"run":2051,"commit":"7f0ef90","metric":12.730805409140885,"metrics":{},"status":"discard","description":"Fresh spike-mode edge inside degraded pocket (~63.50 tok/s, eval_s ~12.73) with safe mode reactivating at step 11.","timestamp":1776393088515,"segment":24,"confidence":0.04415467196131105,"iterationTokens":1409,"asi":{"hypothesis":"The current non-spike inflation pocket can abruptly flip back into spike-triggered mode.","rollback_reason":"Primary metric above best floor.","next_action_hint":"Run immediate control parity check for this new spike transition.","diagnostic_findings":{"completion_tok_s":63.497319993463535,"dflash_eval_s":12.730805409140885,"safe_mode_step":11,"severe_spike_events":2}}}
{"run":2052,"commit":"7f0ef90","metric":13.884963124408387,"metrics":{},"status":"discard","description":"Immediate control parity also degraded (~69.69 tok/s, eval_s ~13.88), confirming shared transition despite lane shape differences.","timestamp":1776393121199,"segment":24,"confidence":0.044063544693599875,"iterationTokens":1427,"asi":{"hypothesis":"The new transition remains shared across mirror/control, but control expressed it as broad non-spike inflation.","rollback_reason":"Parity diagnostic lane; metric above best floor.","next_action_hint":"Resume unchanged mirror loop to follow rebound path from this transition.","parity_check":{"lane":"control_DFLASH_MIRROR_SD_RUNTIME=0","completion_tok_s":69.69065148820887,"dflash_eval_s":13.884963124408387,"safe_mode_activations":0}}}
{"run":2053,"commit":"7f0ef90","metric":13.787492497242056,"metrics":{},"status":"discard","description":"Post-parity mirror remained in deep non-spike inflation (~70.04 tok/s, eval_s ~13.79).","timestamp":1776393158372,"segment":24,"confidence":0.043950711990000835,"iterationTokens":1427,"asi":{"hypothesis":"After the transition, mirror is now in a watchdog-idle but still heavily degraded pocket.","rollback_reason":"Primary metric above best floor.","next_action_hint":"Continue unchanged loop to capture rebound ladder.","diagnostic_findings":{"completion_tok_s":70.04128180731362,"dflash_eval_s":13.787492497242056,"safe_mode_activations":0}}}
{"run":2054,"commit":"7f0ef90","metric":13.946047249250114,"metrics":{},"status":"discard","description":"Degraded non-spike pocket persisted (~69.38 tok/s, eval_s ~13.95), watchdog idle.","timestamp":1776393190582,"segment":24,"confidence":0.043838455667705625,"iterationTokens":1429,"asi":{"hypothesis":"This transition currently manifests as broad eval inflation without spike flags.","rollback_reason":"Primary metric above best floor.","next_action_hint":"Continue unchanged loop for rebound detection.","diagnostic_findings":{"completion_tok_s":69.37542646686425,"dflash_eval_s":13.946047249250114,"safe_mode_activations":0}}}
{"run":2055,"commit":"7f0ef90","metric":13.370482461410575,"metrics":{},"status":"discard","description":"Regime flipped back to spike-triggered collapse (~60.36 tok/s, eval_s ~13.37) with early safe mode at step 10.","timestamp":1776393225561,"segment":24,"confidence":0.04368619433502585,"iterationTokens":1387,"asi":{"hypothesis":"The degraded pocket can quickly transition from broad inflation to early-spike safe-mode behavior.","rollback_reason":"Primary metric above best floor.","next_action_hint":"Run immediate control parity check for this renewed spike transition.","diagnostic_findings":{"completion_tok_s":60.35858288568195,"dflash_eval_s":13.370482461410575,"safe_mode_step":10,"severe_spike_events":2}}}
{"run":2056,"commit":"7f0ef90","metric":12.577200414496474,"metrics":{},"status":"discard","description":"Immediate control parity also in spike-safe-mode collapse (~64.13 tok/s, eval_s ~12.58, step 12), confirming shared transition.","timestamp":1776393260573,"segment":24,"confidence":0.043588180645993374,"iterationTokens":1481,"asi":{"hypothesis":"Renewed spike transition is shared across mirror/control lanes.","rollback_reason":"Parity diagnostic lane; metric above best floor.","next_action_hint":"Resume unchanged mirror loop for rebound tracking.","parity_check":{"lane":"control_DFLASH_MIRROR_SD_RUNTIME=0","completion_tok_s":64.13337888964095,"dflash_eval_s":12.577200414496474,"safe_mode_step":12,"severe_spike_events":2}}}
{"run":2057,"commit":"7f0ef90","metric":13.134583248058334,"metrics":{},"status":"discard","description":"Post-parity mirror remained in spike-safe-mode degradation (~61.38 tok/s, eval_s ~13.13, step 11).","timestamp":1776393295070,"segment":24,"confidence":0.043288461425568824,"iterationTokens":1415,"asi":{"hypothesis":"The shared transition is still in early-intervention collapse state.","rollback_reason":"Primary metric above best floor.","next_action_hint":"Continue unchanged mirror loop to capture rebound progression.","diagnostic_findings":{"completion_tok_s":61.38302213013865,"dflash_eval_s":13.134583248058334,"safe_mode_step":11,"severe_spike_events":2}}}
{"run":2058,"commit":"7f0ef90","metric":12.215715413331054,"metrics":{},"status":"discard","description":"Rebound step inside spike cycle (~72.23 tok/s, eval_s ~12.22) with safe mode pushed late to step 72.","timestamp":1776393327003,"segment":24,"confidence":0.04287031596289479,"iterationTokens":1401,"asi":{"hypothesis":"Collapse is easing; intervention point drifting later indicates partial recovery.","rollback_reason":"Primary metric above best floor.","next_action_hint":"Continue unchanged loop for watchdog-idle transition.","diagnostic_findings":{"completion_tok_s":72.22916635514524,"dflash_eval_s":12.215715413331054,"safe_mode_step":72,"severe_spike_events":7}}}
{"run":2059,"commit":"7f0ef90","metric":14.547320129233412,"metrics":{},"status":"discard","description":"Recovery slipped back into heavier safe-mode collapse (~57.56 tok/s, eval_s ~14.55, step 42).","timestamp":1776393364006,"segment":24,"confidence":0.042491691379958486,"iterationTokens":1450,"asi":{"hypothesis":"Current cycle is still oscillatory with repeated relapses before full recovery.","rollback_reason":"Primary metric above best floor.","next_action_hint":"Continue unchanged loop to map rebound/relapse pattern.","diagnostic_findings":{"completion_tok_s":57.56498430182889,"dflash_eval_s":14.547320129233412,"safe_mode_step":42,"severe_spike_events":10}}}
{"run":2060,"commit":"7f0ef90","metric":15.274593877256848,"metrics":{},"status":"discard","description":"Another relapse in same collapse cycle (~55.17 tok/s, eval_s ~15.27) with safe mode at step 48.","timestamp":1776393405165,"segment":24,"confidence":0.04214068682253169,"iterationTokens":1404,"asi":{"hypothesis":"Current cycle remains trapped in high-latency oscillation despite watchdog intervention.","rollback_reason":"Primary metric above best floor.","next_action_hint":"Continue unchanged mirror loop.","diagnostic_findings":{"completion_tok_s":55.173510723235154,"dflash_eval_s":15.274593877256848,"safe_mode_step":48,"severe_spike_events":10}}}
{"run":2061,"commit":"7f0ef90","metric":15.545915328431875,"metrics":{},"status":"discard","description":"Collapse remained severe (~54.83 tok/s, eval_s ~15.55) with safe mode at step 56.","timestamp":1776393442913,"segment":24,"confidence":0.04204089478838399,"iterationTokens":1401,"asi":{"hypothesis":"The active collapse wave is not yet yielding a sustained rebound.","rollback_reason":"Primary metric above best floor.","next_action_hint":"Continue unchanged loop for eventual transition back to watchdog-idle mode.","diagnostic_findings":{"completion_tok_s":54.82993900726005,"dflash_eval_s":15.545915328431875,"safe_mode_step":56,"severe_spike_events":16}}}
{"run":2062,"commit":"7f0ef90","metric":17.39334283466451,"metrics":{},"status":"discard","description":"Collapse deepened again (~47.71 tok/s, eval_s ~17.39) with safe mode active from step 38.","timestamp":1776393489477,"segment":24,"confidence":0.04194157426641366,"iterationTokens":1401,"asi":{"hypothesis":"Current wave has re-entered deep-trough territory after brief mid-band attempts.","rollback_reason":"Primary metric far above best floor.","next_action_hint":"Continue unchanged loop; trigger control parity only if a new hard transition edge appears.","diagnostic_findings":{"completion_tok_s":47.712613138431564,"dflash_eval_s":17.39334283466451,"safe_mode_step":38,"severe_spike_events":33}}}
{"run":2063,"commit":"7f0ef90","metric":14.348401539144106,"metrics":{},"status":"discard","description":"Post-trough sample remained degraded (~60.46 tok/s, eval_s ~14.35) with late safe-mode activation at step 67.","timestamp":1776393547999,"segment":24,"confidence":0.04160825745178822,"iterationTokens":2293,"asi":{"hypothesis":"Cycle is still in partial-rebound collapse mode with late interventions.","rollback_reason":"Primary metric above best floor.","next_action_hint":"Continue unchanged loop for watchdog-idle recovery.","diagnostic_findings":{"completion_tok_s":60.46059801454141,"dflash_eval_s":14.348401539144106,"safe_mode_step":67,"severe_spike_events":17}}}
{"run":2064,"commit":"7f0ef90","metric":15.94329666311387,"metrics":{},"status":"discard","description":"Relapse worsened (~53.13 tok/s, eval_s ~15.94) with safe mode at step 52.","timestamp":1776393593712,"segment":24,"confidence":0.04130821546713086,"iterationTokens":1412,"asi":{"hypothesis":"Active collapse cycle remains unstable with frequent backslides.","rollback_reason":"Primary metric above best floor.","next_action_hint":"Continue unchanged loop.","diagnostic_findings":{"completion_tok_s":53.1298555556451,"dflash_eval_s":15.94329666311387,"safe_mode_step":52,"severe_spike_events":13}}}
{"run":2065,"commit":"7f0ef90","metric":16.39394262561109,"metrics":{},"status":"discard","description":"Deep trough persisted (~51.50 tok/s, eval_s ~16.39) with safe mode at step 49.","timestamp":1776393633955,"segment":24,"confidence":0.040955907108057375,"iterationTokens":1389,"asi":{"hypothesis":"System remains in collapse phase with elevated severe spike counts.","rollback_reason":"Primary metric above best floor.","next_action_hint":"Continue unchanged loop for rebound onset.","diagnostic_findings":{"completion_tok_s":51.50083234749474,"dflash_eval_s":16.39394262561109,"safe_mode_step":49,"severe_spike_events":31}}}
{"run":2066,"commit":"7f0ef90","metric":16.941954328794964,"metrics":{},"status":"discard","description":"Collapse worsened further (~49.29 tok/s, eval_s ~16.94) with safe mode at step 42.","timestamp":1776393678251,"segment":24,"confidence":0.040381346450269376,"iterationTokens":1395,"asi":{"hypothesis":"Current collapse wave is still descending toward deeper trough before rebound.","rollback_reason":"Primary metric above best floor.","next_action_hint":"Continue unchanged mirror loop; parity already established for this transition.","diagnostic_findings":{"completion_tok_s":49.29286253735134,"dflash_eval_s":16.941954328794964,"safe_mode_step":42,"severe_spike_events":24}}}
{"run":2067,"commit":"7f0ef90","metric":17.022983705508523,"metrics":{},"status":"discard","description":"Trough extended (~48.95 tok/s, eval_s ~17.02) with safe mode active from step 38.","timestamp":1776393718806,"segment":24,"confidence":0.04025282695662299,"iterationTokens":1447,"asi":{"hypothesis":"The collapse wave remains severe with no rebound yet.","rollback_reason":"Primary metric above best floor.","next_action_hint":"Continue unchanged loop and watch for step-drift later in the cycle.","diagnostic_findings":{"completion_tok_s":48.947081769614094,"dflash_eval_s":17.022983705508523,"safe_mode_step":38,"severe_spike_events":23}}}
{"run":2068,"commit":"7f0ef90","metric":16.830686415196396,"metrics":{},"status":"discard","description":"Deep collapse held (~49.55 tok/s, eval_s ~16.83) with safe mode at step 39.","timestamp":1776393757705,"segment":24,"confidence":0.040125122931498274,"iterationTokens":1403,"asi":{"hypothesis":"No meaningful rebound yet; cycle remains in severe trough regime.","rollback_reason":"Primary metric above best floor.","next_action_hint":"Continue unchanged loop.","diagnostic_findings":{"completion_tok_s":49.54673107654693,"dflash_eval_s":16.830686415196396,"safe_mode_step":39,"severe_spike_events":26}}}
{"run":2069,"commit":"7f0ef90","metric":16.877800256945193,"metrics":{},"status":"discard","description":"Collapse plateau persisted (~49.29 tok/s, eval_s ~16.88) with safe mode at step 37.","timestamp":1776393798270,"segment":24,"confidence":0.039913779398854314,"iterationTokens":1384,"asi":{"hypothesis":"System is still in a severe trough with little movement.","rollback_reason":"Primary metric above best floor.","next_action_hint":"Continue unchanged loop for eventual rebound onset.","diagnostic_findings":{"completion_tok_s":49.287233028635086,"dflash_eval_s":16.877800256945193,"safe_mode_step":37,"severe_spike_events":26}}}
