{"run":2166,"commit":"a0f1200","metric":8.938096211641096,"metrics":{},"status":"discard","description":"Best sample this cycle reached sub-9 high-soft (~106.41 tok/s, eval_s ~8.94) with watchdog idle and no spikes.","timestamp":1776397608930,"segment":24,"confidence":0.035532949460055786,"iterationTokens":11228,"asi":{"hypothesis":"Recovered plateau is tightening toward the best-band floor without collapse signs.","rollback_reason":"Primary metric still above best floor.","next_action_hint":"Continue unchanged loop for potential ~8.8 crossover.","diagnostic_findings":{"completion_tok_s":106.40719291516727,"dflash_eval_s":8.938096211641096,"safe_mode_active":0,"spike_events":0}}}
{"run":2167,"commit":"a0f1200","metric":8.935737503226846,"metrics":{},"status":"discard","description":"Immediate confirmation repeated sub-9 high-soft (~106.33 tok/s, eval_s ~8.94) with watchdog idle.","timestamp":1776397641206,"segment":24,"confidence":0.035993578397433626,"iterationTokens":1429,"asi":{"hypothesis":"Recovered plateau near ~8.94 appears stable but still above best floor.","rollback_reason":"Primary metric above best floor.","next_action_hint":"Continue unchanged loop for best-band retest.","diagnostic_findings":{"completion_tok_s":106.33269662394936,"dflash_eval_s":8.935737503226846,"safe_mode_active":0,"spike_events":0}}}
{"run":2168,"commit":"a0f1200","metric":8.933220618288033,"metrics":{},"status":"discard","description":"Third consecutive sub-9 repeat (~106.34 tok/s, eval_s ~8.93) remained watchdog-idle and spike-free.","timestamp":1776397670806,"segment":24,"confidence":0.03649117252613922,"iterationTokens":1443,"asi":{"hypothesis":"Current regime is stably centered near ~8.93 eval_s but has not crossed best-floor ~8.79.","rollback_reason":"Primary metric above best floor.","next_action_hint":"Continue unchanged loop for potential low-tail crossover.","diagnostic_findings":{"completion_tok_s":106.33592869867145,"dflash_eval_s":8.933220618288033,"safe_mode_active":0,"spike_events":0}}}
{"run":2169,"commit":"a0f1200","metric":8.921860876958817,"metrics":{},"status":"discard","description":"Slightly lower sub-9 sample (~106.38 tok/s, eval_s ~8.92) still watchdog-idle and spike-free.","timestamp":1776397700612,"segment":24,"confidence":0.03653766285200322,"iterationTokens":1472,"asi":{"hypothesis":"Recovered shelf is drifting lower within non-spike mode but remains above floor.","rollback_reason":"Primary metric above best floor.","next_action_hint":"Continue unchanged loop for ~8.8 crossover attempt.","diagnostic_findings":{"completion_tok_s":106.3766844665778,"dflash_eval_s":8.921860876958817,"safe_mode_active":0,"spike_events":0}}}
{"run":2170,"commit":"a0f1200","metric":8.927270665299147,"metrics":{},"status":"discard","description":"Sub-9 plateau persisted (~106.27 tok/s, eval_s ~8.93) with watchdog idle and no spikes.","timestamp":1776397727183,"segment":24,"confidence":0.036602674605726415,"iterationTokens":1449,"asi":{"hypothesis":"Current stable regime remains narrowly centered in high-soft, above floor.","rollback_reason":"Primary metric above best floor.","next_action_hint":"Continue unchanged loop for rare low-tail sample.","diagnostic_findings":{"completion_tok_s":106.27331105044459,"dflash_eval_s":8.927270665299147,"safe_mode_active":0,"spike_events":0}}}
{"run":2171,"commit":"a0f1200","metric":8.932976913056336,"metrics":{},"status":"discard","description":"Another near-identical sub-9 sample (~106.30 tok/s, eval_s ~8.93), watchdog idle and spike-free.","timestamp":1776397756753,"segment":24,"confidence":0.03672932052268484,"iterationTokens":1413,"asi":{"hypothesis":"Regime remains locked in a tight high-soft cluster near ~8.93 eval_s.","rollback_reason":"Primary metric above best floor.","next_action_hint":"Continue unchanged loop; monitor for either 8.8-tail hit or abrupt collapse.","diagnostic_findings":{"completion_tok_s":106.29898981125389,"dflash_eval_s":8.932976913056336,"safe_mode_active":0,"spike_events":0}}}
{"run":2172,"commit":"a0f1200","metric":8.93275516317226,"metrics":{},"status":"discard","description":"Sub-9 cluster remained unchanged (~106.35 tok/s, eval_s ~8.93), watchdog idle and no spikes.","timestamp":1776397791197,"segment":24,"confidence":0.03685684587684401,"iterationTokens":1551,"asi":{"hypothesis":"High-soft plateau is currently stationary around ~8.93 eval_s.","rollback_reason":"Primary metric above best floor.","next_action_hint":"Continue unchanged loop.","diagnostic_findings":{"completion_tok_s":106.35241972631029,"dflash_eval_s":8.93275516317226,"safe_mode_active":0,"spike_events":0}}}
{"run":2173,"commit":"a0f1200","metric":8.923520333948545,"metrics":{},"status":"discard","description":"Lowest sample in this stable cluster (~106.35 tok/s, eval_s ~8.924) but still above floor.","timestamp":1776397818478,"segment":24,"confidence":0.03733265138907987,"iterationTokens":1403,"asi":{"hypothesis":"Non-spike plateau is drifting slightly downward while remaining tightly clustered.","rollback_reason":"Primary metric above best floor.","next_action_hint":"Continue unchanged loop for rare best-floor crossover.","diagnostic_findings":{"completion_tok_s":106.35497227164983,"dflash_eval_s":8.923520333948545,"safe_mode_active":0,"spike_events":0}}}
{"run":2174,"commit":"a0f1200","metric":8.929987087729387,"metrics":{},"status":"discard","description":"Cluster remained unchanged (~106.35 tok/s, eval_s ~8.93) with watchdog idle and no spikes.","timestamp":1776397848936,"segment":24,"confidence":0.0377358047168715,"iterationTokens":1430,"asi":{"hypothesis":"No regime transition; same high-soft plateau persists.","rollback_reason":"Primary metric above best floor.","next_action_hint":"Continue unchanged loop.","diagnostic_findings":{"completion_tok_s":106.35345021647545,"dflash_eval_s":8.929987087729387,"safe_mode_active":0,"spike_events":0}}}
{"run":2175,"commit":"a0f1200","metric":8.943691750522703,"metrics":{},"status":"discard","description":"Slightly higher sample in the same stable cluster (~106.24 tok/s, eval_s ~8.94), watchdog idle.","timestamp":1776397882343,"segment":24,"confidence":0.03801995898664176,"iterationTokens":1393,"asi":{"hypothesis":"Plateau remains stable around ~8.93–8.94 eval_s with no collapse activity.","rollback_reason":"Primary metric above best floor.","next_action_hint":"Continue unchanged loop and monitor for tail crossover or abrupt shift.","diagnostic_findings":{"completion_tok_s":106.23890474765949,"dflash_eval_s":8.943691750522703,"safe_mode_active":0,"spike_events":0}}}
{"run":2176,"commit":"a0f1200","metric":8.957282500923611,"metrics":{},"status":"discard","description":"High-soft plateau drifted slightly up (~106.08 tok/s, eval_s ~8.96), watchdog idle and spike-free.","timestamp":1776397912784,"segment":24,"confidence":0.03830492622934526,"iterationTokens":1437,"asi":{"hypothesis":"No transition yet; same stable non-spike shelf persists.","rollback_reason":"Primary metric above best floor.","next_action_hint":"Continue unchanged loop.","diagnostic_findings":{"completion_tok_s":106.0763563510593,"dflash_eval_s":8.957282500923611,"safe_mode_active":0,"spike_events":0}}}
{"run":2177,"commit":"a0f1200","metric":8.930570667376742,"metrics":{},"status":"discard","description":"Stable sub-9 repeat (~106.35 tok/s, eval_s ~8.93) with watchdog idle and no spikes.","timestamp":1776397966303,"segment":24,"confidence":0.03847462501939722,"iterationTokens":2782,"asi":{"hypothesis":"Recovered shelf remains tightly clustered with no transition signal.","rollback_reason":"Primary metric above best floor.","next_action_hint":"Continue unchanged loop.","diagnostic_findings":{"completion_tok_s":106.34602324831336,"dflash_eval_s":8.930570667376742,"safe_mode_active":0,"spike_events":0}}}
{"run":2178,"commit":"a0f1200","metric":8.930692749796435,"metrics":{},"status":"discard","description":"Another near-identical sub-9 run (~106.33 tok/s, eval_s ~8.93), watchdog idle and spike-free.","timestamp":1776397993029,"segment":24,"confidence":0.038645834102229826,"iterationTokens":1397,"asi":{"hypothesis":"No new signal; high-soft plateau remains stationary.","rollback_reason":"Primary metric above best floor.","next_action_hint":"Continue unchanged loop.","diagnostic_findings":{"completion_tok_s":106.3259354267599,"dflash_eval_s":8.930692749796435,"safe_mode_active":0,"spike_events":0}}}
{"run":2179,"commit":"a0f1200","metric":8.923303748480976,"metrics":{},"status":"discard","description":"Slightly better repeat in the sub-9 cluster (~106.46 tok/s, eval_s ~8.923), watchdog idle and spike-free.","timestamp":1776398027022,"segment":24,"confidence":0.03877753788684282,"iterationTokens":1489,"asi":{"hypothesis":"Recovered regime remains tightly clustered just above the best floor.","rollback_reason":"Primary metric above best floor.","next_action_hint":"Continue unchanged loop for rare ~8.8 crossover.","diagnostic_findings":{"completion_tok_s":106.4562349366336,"dflash_eval_s":8.923303748480976,"safe_mode_active":0,"spike_events":0}}}
{"run":2180,"commit":"a0f1200","metric":8.93296183925122,"metrics":{},"status":"discard","description":"Continued stable sub-9 shelf (~106.34 tok/s, eval_s ~8.93), watchdog idle and no spikes.","timestamp":1776398098543,"segment":24,"confidence":0.03891375278438767,"iterationTokens":3200,"asi":{"hypothesis":"No regime break; same high-soft cluster persists.","rollback_reason":"Primary metric above best floor.","next_action_hint":"Continue unchanged loop.","diagnostic_findings":{"completion_tok_s":106.34450697264226,"dflash_eval_s":8.93296183925122,"safe_mode_active":0,"spike_events":0}}}
{"run":2181,"commit":"a0f1200","metric":8.934516165987588,"metrics":{},"status":"discard","description":"Stable repeat in sub-9 plateau (~106.33 tok/s, eval_s ~8.93), watchdog idle and spike-free.","timestamp":1776398173428,"segment":24,"confidence":0.03902248187008351,"iterationTokens":12079,"asi":{"hypothesis":"No fresh transition; regime remains in steady recovered shelf.","rollback_reason":"Primary metric above best floor.","next_action_hint":"Continue unchanged loop.","diagnostic_findings":{"completion_tok_s":106.33187356276382,"dflash_eval_s":8.934516165987588,"safe_mode_active":0,"spike_events":0}}}
{"run":2182,"commit":"a0f1200","metric":8.932555881212465,"metrics":{},"status":"discard","description":"Another near-identical sub-9 run (~106.30 tok/s, eval_s ~8.93), watchdog idle and spike-free.","timestamp":1776398202700,"segment":24,"confidence":0.03913182025905761,"iterationTokens":1388,"asi":{"hypothesis":"Plateau persists with effectively unchanged telemetry.","rollback_reason":"Primary metric above best floor.","next_action_hint":"Continue unchanged loop.","diagnostic_findings":{"completion_tok_s":106.30208006420884,"dflash_eval_s":8.932555881212465,"safe_mode_active":0,"spike_events":0}}}
{"run":2183,"commit":"a0f1200","metric":8.939993918407708,"metrics":{},"status":"discard","description":"Stable high-soft run (~106.22 tok/s, eval_s ~8.94), watchdog idle and no spikes.","timestamp":1776398235739,"segment":24,"confidence":0.03916328897911309,"iterationTokens":1417,"asi":{"hypothesis":"No change from current steady sub-9 regime.","rollback_reason":"Primary metric above best floor.","next_action_hint":"Continue unchanged loop.","diagnostic_findings":{"completion_tok_s":106.21598312316986,"dflash_eval_s":8.939993918407708,"safe_mode_active":0,"spike_events":0}}}
{"run":2184,"commit":"a0f1200","metric":8.934315084246919,"metrics":{},"status":"discard","description":"Near-identical repeat (~106.30 tok/s, eval_s ~8.93) in watchdog-idle, spike-free regime.","timestamp":1776398268510,"segment":24,"confidence":0.03926251400044003,"iterationTokens":1382,"asi":{"hypothesis":"Recovered shelf remains tightly stable; no transition signal.","rollback_reason":"Primary metric above best floor.","next_action_hint":"Continue unchanged loop.","diagnostic_findings":{"completion_tok_s":106.30239364305625,"dflash_eval_s":8.934315084246919,"safe_mode_active":0,"spike_events":0}}}
{"run":2185,"commit":"a0f1200","metric":8.924334007315338,"metrics":{},"status":"discard","description":"Lower edge of current sub-9 cluster (~106.40 tok/s, eval_s ~8.924), watchdog idle and spike-free.","timestamp":1776398300793,"segment":24,"confidence":0.039474925240888255,"iterationTokens":1385,"asi":{"hypothesis":"Recovered shelf remains stable with slight low-tail touches but no floor crossover yet.","rollback_reason":"Primary metric above best floor.","next_action_hint":"Continue unchanged loop for potential 8.8-band hit.","diagnostic_findings":{"completion_tok_s":106.39947007791946,"dflash_eval_s":8.924334007315338,"safe_mode_active":0,"spike_events":0}}}
{"run":2186,"commit":"a0f1200","metric":8.927829877240583,"metrics":{},"status":"discard","description":"Stable repeat near low edge (~106.40 tok/s, eval_s ~8.928), watchdog idle and no spikes.","timestamp":1776398330632,"segment":24,"confidence":0.03968964728370983,"iterationTokens":1419,"asi":{"hypothesis":"No regime change; tight non-spike cluster persists.","rollback_reason":"Primary metric above best floor.","next_action_hint":"Continue unchanged loop.","diagnostic_findings":{"completion_tok_s":106.39607337993273,"dflash_eval_s":8.927829877240583,"safe_mode_active":0,"spike_events":0}}}
{"run":2187,"commit":"a0f1200","metric":8.930979293421842,"metrics":{},"status":"discard","description":"Plateau unchanged (~106.31 tok/s, eval_s ~8.93), watchdog idle and no spikes.","timestamp":1776398360545,"segment":24,"confidence":0.04005113675525872,"iterationTokens":1386,"asi":{"hypothesis":"Sub-9 recovered shelf remains stationary in this window.","rollback_reason":"Primary metric above best floor.","next_action_hint":"Continue unchanged loop for rare tail breakthrough or transition.","diagnostic_findings":{"completion_tok_s":106.31463464688187,"dflash_eval_s":8.930979293421842,"safe_mode_active":0,"spike_events":0}}}
{"run":2188,"commit":"a0f1200","metric":8.921461787307635,"metrics":{},"status":"discard","description":"Lowest recent point in stable sub-9 shelf (~106.47 tok/s, eval_s ~8.921), watchdog idle and no spikes.","timestamp":1776398409374,"segment":24,"confidence":0.04051300427318048,"iterationTokens":2198,"asi":{"hypothesis":"Recovered regime remains tight and slightly improving but still above floor.","rollback_reason":"Primary metric above best floor.","next_action_hint":"Continue unchanged loop for best-floor crossover.","diagnostic_findings":{"completion_tok_s":106.46624673061075,"dflash_eval_s":8.921461787307635,"safe_mode_active":0,"spike_events":0}}}
{"run":2189,"commit":"a0f1200","metric":8.931798961246386,"metrics":{},"status":"discard","description":"Sub-9 shelf stayed stable (~106.40 tok/s, eval_s ~8.932), watchdog idle and spike-free.","timestamp":1776398437635,"segment":24,"confidence":0.040563221650404366,"iterationTokens":1412,"asi":{"hypothesis":"Recovered cluster remains stationary with no transition edge.","rollback_reason":"Primary metric above best floor.","next_action_hint":"Continue unchanged loop.","diagnostic_findings":{"completion_tok_s":106.40376853591641,"dflash_eval_s":8.931798961246386,"safe_mode_active":0,"spike_events":0}}}
{"run":2190,"commit":"a0f1200","metric":8.931521588005126,"metrics":{},"status":"discard","description":"Continued stationary sub-9 shelf (~106.42 tok/s, eval_s ~8.93), watchdog idle and spike-free.","timestamp":1776398503122,"segment":24,"confidence":0.04061356367475065,"iterationTokens":3135,"asi":{"hypothesis":"No fresh transition; recovered plateau remains tightly clustered.","rollback_reason":"Primary metric above best floor.","next_action_hint":"Continue unchanged loop.","diagnostic_findings":{"completion_tok_s":106.41638631225716,"dflash_eval_s":8.931521588005126,"safe_mode_active":0,"spike_events":0}}}
{"run":2191,"commit":"a0f1200","metric":8.926659008371644,"metrics":{},"status":"discard","description":"Stable low-end shelf sample (~106.47 tok/s, eval_s ~8.927), watchdog idle and spike-free.","timestamp":1776398552499,"segment":24,"confidence":0.0407955067875933,"iterationTokens":2068,"asi":{"hypothesis":"Regime remains tightly clustered near best-adjacent band without crossing floor.","rollback_reason":"Primary metric above best floor.","next_action_hint":"Continue unchanged loop for rare low-tail crossover.","diagnostic_findings":{"completion_tok_s":106.47013591621477,"dflash_eval_s":8.926659008371644,"safe_mode_active":0,"spike_events":0}}}
{"run":2192,"commit":"a0f1200","metric":8.882007634267211,"metrics":{},"status":"discard","description":"Robustness batch sample 01/30: low-edge sub-9 run (~106.20 tok/s, eval_s ~8.882), watchdog idle and spike-free.","timestamp":1776403132110,"segment":24,"confidence":0.04097908739583439,"iterationTokens":2102,"asi":{"hypothesis":"Fixed-shape mirror run stays in recovered non-spike shelf during robustness batch.","rollback_reason":"Primary metric remains above best floor.","next_action_hint":"Continue robustness batch without config changes.","diagnostic_findings":{"completion_tok_s":106.20104376702965,"dflash_eval_s":8.882007634267211,"safe_mode_active":0,"spike_events":0,"warmup_s":4.314259667065926}}}
{"run":2193,"commit":"a0f1200","metric":8.8835790787125,"metrics":{},"status":"discard","description":"Robustness batch sample 02/30: repeated low-edge sub-9 run (~106.25 tok/s, eval_s ~8.884), watchdog idle and spike-free.","timestamp":1776403158906,"segment":24,"confidence":0.041193087438833466,"iterationTokens":1486,"asi":{"hypothesis":"Recovered shelf remains stable under repeated fixed-shape honest runs.","rollback_reason":"Primary metric remains above best floor.","next_action_hint":"Continue robustness batch unchanged.","diagnostic_findings":{"completion_tok_s":106.25220283223477,"dflash_eval_s":8.8835790787125,"safe_mode_active":0,"spike_events":0}}}
{"run":2194,"commit":"a0f1200","metric":8.824985959683545,"metrics":{},"status":"discard","description":"Robustness batch sample 03/30: stronger low-tail run (~107.34 tok/s, eval_s ~8.825) but still above best floor; watchdog idle.","timestamp":1776403184888,"segment":24,"confidence":0.04137483866442006,"iterationTokens":1470,"asi":{"hypothesis":"Batch can dip into lower sub-8.9 tail while staying in non-spike regime.","rollback_reason":"Primary metric remains above best floor.","next_action_hint":"Continue robustness batch to test repeatability of low-tail dips.","diagnostic_findings":{"completion_tok_s":107.3375065157424,"dflash_eval_s":8.824985959683545,"safe_mode_active":0,"spike_events":0}}}
{"run":2195,"commit":"a0f1200","metric":20.74123192008119,"metrics":{},"status":"discard","description":"Robustness batch sample 04/30: severe collapse episode (~38.68 tok/s, eval_s ~20.74); watchdog activated safe mode at step 9.","timestamp":1776403230382,"segment":24,"confidence":0.0411760121400235,"iterationTokens":1485,"asi":{"hypothesis":"Long-window batch should capture occasional shared-collapse transitions, not only steady shelf samples.","rollback_reason":"Primary metric far above best floor due collapse event.","next_action_hint":"Run immediate control parity check on this fresh transition edge, then resume mirror batch.","diagnostic_findings":{"completion_tok_s":38.67797571118422,"dflash_eval_s":20.74123192008119,"safe_mode_active":1,"safe_mode_activations":1,"safe_mode_step":9,"spike_events":49,"severe_spike_events":48}}}
{"run":2196,"commit":"a0f1200","metric":33.05969542032108,"metrics":{},"status":"discard","description":"Transition-edge control parity check after sample 04 collapse: control also collapsed deeply (~23.61 tok/s, eval_s ~33.06), confirming shared instability.","timestamp":1776403293606,"segment":24,"confidence":0.04094773196112035,"iterationTokens":1669,"asi":{"hypothesis":"If mirror collapse is shared-path runtime state, immediate control parity should also degrade on the same edge.","rollback_reason":"Diagnostic control lane; metric far above floor.","next_action_hint":"Return to mirror robustness batch immediately.","diagnostic_findings":{"completion_tok_s":23.612441980014452,"dflash_eval_s":33.05969542032108,"safe_mode_active":1,"safe_mode_activations":1,"safe_mode_step":17,"spike_events":89,"severe_spike_events":89,"parity":"shared_collapse_confirmed"}}}
{"run":2197,"commit":"a0f1200","metric":29.882761996937916,"metrics":{},"status":"discard","description":"Robustness batch sample 05/30: post-transition mirror remained in deep collapse (~27.23 tok/s, eval_s ~29.88), safe mode active from step 6.","timestamp":1776403349943,"segment":24,"confidence":0.040768953289163315,"iterationTokens":1540,"asi":{"hypothesis":"After shared-collapse edge, immediate mirror follow-ups may remain in degraded trough before rebound.","rollback_reason":"Primary metric far above best floor.","next_action_hint":"Continue mirror batch to measure trough depth and recovery length.","diagnostic_findings":{"completion_tok_s":27.23451807078613,"dflash_eval_s":29.882761996937916,"safe_mode_active":1,"safe_mode_activations":1,"safe_mode_step":6,"spike_events":92,"severe_spike_events":92}}}
{"run":2198,"commit":"a0f1200","metric":14.30901846056804,"metrics":{},"status":"discard","description":"Robustness batch sample 06/30: collapse depth improved but still degraded (~59.31 tok/s, eval_s ~14.31); safe mode triggered late (step 49).","timestamp":1776403384476,"segment":24,"confidence":0.040591728934023075,"iterationTokens":1506,"asi":{"hypothesis":"Trough should rebound in stages after severe edge, with safe-mode trigger step drifting later as recovery starts.","rollback_reason":"Primary metric remains far above best floor.","next_action_hint":"Continue mirror batch to observe rebound trajectory.","diagnostic_findings":{"completion_tok_s":59.30552205584933,"dflash_eval_s":14.30901846056804,"safe_mode_active":1,"safe_mode_activations":1,"safe_mode_step":49,"spike_events":7,"severe_spike_events":7}}}
