{"run":2258,"commit":"d561c06","metric":8.778761542751454,"metrics":{},"status":"discard","description":"Async-backlog probe continuation: second near-floor healthy sample (~107.86 tok/s, eval_s ~8.779) with tight submit→consume lag.","timestamp":1776438658197,"segment":24,"confidence":0.046440474421570635,"iterationTokens":3045,"asi":{"hypothesis":"Healthy baseline should keep async lag near ~1.2–1.4ms with zero unconsumed steps.","rollback_reason":"Unchanged-code run and confidence remains within noise; continuing robustness evidence collection.","next_action_hint":"Keep running until a collapse transition to compare lag distribution shift.","diagnostic_findings":{"completion_tok_s":107.86414357990711,"dflash_eval_s":8.778761542751454,"async_submit_to_consume_mean_s":0.001272268638179715,"async_submit_to_consume_max_s":0.0014198330463841558,"async_submit_unconsumed_steps":0,"safe_mode_active":0,"spike_events":0}}}
{"run":2259,"commit":"d561c06","metric":8.786925340420566,"metrics":{},"status":"discard","description":"Async-backlog probe continuation: healthy run in floor band (~107.65 tok/s, eval_s ~8.787), no watchdog activity.","timestamp":1776438682127,"segment":24,"confidence":0.04695641849153022,"iterationTokens":2303,"asi":{"hypothesis":"Healthy mirror path should maintain low async lag without backlog accumulation.","rollback_reason":"No code delta and result remains noise-level around existing floor.","next_action_hint":"Continue until regime transition/collapse is observed for lag contrast.","diagnostic_findings":{"completion_tok_s":107.64676569910301,"dflash_eval_s":8.786925340420566,"async_submit_to_consume_mean_s":0.0012795546717825346,"async_submit_to_consume_max_s":0.0014270830433815718,"async_submit_unconsumed_steps":0,"safe_mode_active":0,"spike_events":0}}}
{"run":2260,"commit":"d561c06","metric":8.854473408544436,"metrics":{},"status":"discard","description":"Async-backlog probe continuation: healthy non-collapse run (~106.77 tok/s, eval_s ~8.854); backlog metrics remained low/tight.","timestamp":1776438708117,"segment":24,"confidence":0.04759736323885717,"iterationTokens":2285,"asi":{"hypothesis":"If lane is healthy, async submit→consume lag should stay near baseline and not accumulate unconsumed work.","rollback_reason":"Primary metric above floor and no collapse event to diagnose yet.","next_action_hint":"Continue mirror sampling; trigger immediate control parity when first severe collapse appears.","diagnostic_findings":{"completion_tok_s":106.7711355490582,"dflash_eval_s":8.854473408544436,"async_submit_to_consume_mean_s":0.0013242426114932944,"async_submit_to_consume_max_s":0.001557416981086135,"async_submit_unconsumed_steps":0,"safe_mode_active":0,"spike_events":0}}}
{"run":2261,"commit":"d561c06","metric":10.706157129490748,"metrics":{},"status":"discard","description":"Async-backlog probe: first fresh collapse transition in this block (eval_s ~10.71, tok/s ~84.63), watchdog activated late (step 80) with severe spikes.","timestamp":1776438736451,"segment":24,"confidence":0.047056227659201755,"iterationTokens":2289,"asi":{"hypothesis":"Collapse transition should show async backlog lag inflation versus healthy baseline.","rollback_reason":"Primary metric regressed due collapse event; capture parity immediately for attribution.","next_action_hint":"Run immediate control parity (DFLASH_MIRROR_SD_RUNTIME=0) with telemetry to compare async lag profile at transition edge.","diagnostic_findings":{"completion_tok_s":84.62875224878574,"dflash_eval_s":10.706157129490748,"safe_mode_active":1,"spike_events":2,"safe_mode_step":80,"dflash_draft_s":0.8276508776471019,"async_submit_calls":80,"async_submit_to_consume_mean_s":0.0013063385369605385,"async_submit_to_consume_max_s":0.0015250829746946692,"async_submit_unconsumed_steps":0}}}
{"run":2262,"commit":"d561c06","metric":17.255118326516822,"metrics":{},"status":"discard","description":"Immediate transition-edge control parity after mirror collapse: control also collapsed hard (~49.66 tok/s, eval_s ~17.26, severe spikes), confirming shared failure mode.","timestamp":1776438774029,"segment":24,"confidence":0.046440474421570635,"iterationTokens":2427,"asi":{"hypothesis":"If collapse is shared-path, control parity should reproduce slowdown and reveal whether async lag inflates.","rollback_reason":"Control parity run is diagnostic only and far above floor.","next_action_hint":"Resume mirror lane to map recovery while comparing async submit→consume lag against healthy baseline.","diagnostic_findings":{"completion_tok_s":49.658423255300505,"dflash_eval_s":17.255118326516822,"safe_mode_active":1,"spike_events":38,"safe_mode_step":66,"dflash_draft_s":2.7866757082520053,"async_submit_calls":66,"async_submit_to_consume_mean_s":0.0012827582223425534,"async_submit_to_consume_max_s":0.0014307500096037984,"async_submit_unconsumed_steps":0,"mirror_runtime":0}}}
{"run":2263,"commit":"d561c06","metric":29.29438104259316,"metrics":{},"status":"discard","description":"Async-backlog probe: deep mirror collapse run (eval_s ~29.29, tok/s ~27.53) with early safe-mode (step 16) and sustained severe spikes.","timestamp":1776438827791,"segment":24,"confidence":0.04636003017859388,"iterationTokens":2385,"asi":{"hypothesis":"If queue/backpressure is primary root cause, collapse should show larger submit→consume lag and/or unconsumed async steps.","rollback_reason":"Primary metric catastrophic regression during collapse wave.","next_action_hint":"Continue mirror recovery mapping; focus on whether async lag remains flat even as draft/eval time inflates.","diagnostic_findings":{"completion_tok_s":27.526519201385156,"dflash_eval_s":29.29438104259316,"safe_mode_active":1,"spike_events":92,"safe_mode_step":16,"dflash_draft_s":7.031358955078758,"async_submit_calls":16,"async_submit_to_consume_mean_s":0.0012372916171443649,"async_submit_to_consume_max_s":0.0013956669718027115,"async_submit_unconsumed_steps":0}}}
{"run":2264,"commit":"d561c06","metric":25.067125752568245,"metrics":{},"status":"discard","description":"Async-backlog probe: continued deep-collapse mirror sample (~32.41 tok/s, eval_s ~25.07), safe-mode engaged early with sustained severe spikes.","timestamp":1776438877739,"segment":24,"confidence":0.046279864144922266,"iterationTokens":2375,"asi":{"hypothesis":"If async queueing drives collapse, submit→consume lag should rise during deep troughs.","rollback_reason":"Primary metric remains far above floor in collapse regime.","next_action_hint":"Continue until rebound shelf; compare lag metrics through collapse→recovery.","diagnostic_findings":{"completion_tok_s":32.40764739891551,"dflash_eval_s":25.067125752568245,"safe_mode_active":1,"spike_events":71,"safe_mode_step":17,"dflash_draft_s":5.836360213346779,"async_submit_calls":17,"async_submit_to_consume_mean_s":0.00117715446771506,"async_submit_to_consume_max_s":0.0013467080425471067,"async_submit_unconsumed_steps":0}}}
{"run":2265,"commit":"d561c06","metric":16.67625054193195,"metrics":{},"status":"discard","description":"Async-backlog probe: collapse wave rebound attempt still degraded (~50.12 tok/s, eval_s ~16.68), safe-mode remained active.","timestamp":1776438915474,"segment":24,"confidence":0.046034317176832255,"iterationTokens":2339,"asi":{"hypothesis":"Backpressure signature should emerge as elevated submit→consume lag during collapse and partial rebounds.","rollback_reason":"Primary metric remains heavily regressed.","next_action_hint":"Continue mirror runs to observe full recovery; keep comparing lag stats against healthy ~1.2–1.3ms baseline.","diagnostic_findings":{"completion_tok_s":50.11630925519886,"dflash_eval_s":16.67625054193195,"safe_mode_active":1,"spike_events":18,"safe_mode_step":36,"dflash_draft_s":3.182568663614802,"async_submit_calls":36,"async_submit_to_consume_mean_s":0.0012752893380820751,"async_submit_to_consume_max_s":0.0015996670117601752,"async_submit_unconsumed_steps":0}}}
{"run":2266,"commit":"d561c06","metric":13.665967957815155,"metrics":{},"status":"discard","description":"Async-backlog probe: rebound into non-spike inflation shelf (~70.89 tok/s, eval_s ~13.67) with watchdog idle.","timestamp":1776438946920,"segment":24,"confidence":0.04568638760563766,"iterationTokens":2323,"asi":{"hypothesis":"If async backlog is causal, non-spike inflation should still show elevated submit→consume lag.","rollback_reason":"Primary metric still far above floor despite spike-free run.","next_action_hint":"Continue runs until low-9 recovery to complete collapse→recovery lag profile.","diagnostic_findings":{"completion_tok_s":70.8931546611865,"dflash_eval_s":13.665967957815155,"safe_mode_active":0,"spike_events":0,"dflash_draft_s":0.23504342383239418,"async_submit_calls":96,"async_submit_to_consume_mean_s":0.0012077608625986613,"async_submit_to_consume_max_s":0.0014113750075921416,"async_submit_unconsumed_steps":0}}}
{"run":2267,"commit":"d561c06","metric":9.897836912306957,"metrics":{},"status":"discard","description":"Async-backlog probe: recovery progressed to high-soft band (~96.44 tok/s, eval_s ~9.90), watchdog inactive.","timestamp":1776438974861,"segment":24,"confidence":0.046034317176832255,"iterationTokens":2344,"asi":{"hypothesis":"As recovery proceeds, async lag should remain close to healthy baseline if collapse is not queue-backpressure driven.","rollback_reason":"Primary metric still above floor.","next_action_hint":"Continue until near-floor sub-9 to complete post-collapse comparison window.","diagnostic_findings":{"completion_tok_s":96.44217948138298,"dflash_eval_s":9.897836912306957,"safe_mode_active":0,"spike_events":0,"async_submit_calls":96,"async_submit_to_consume_mean_s":0.001226881494706807,"async_submit_to_consume_max_s":0.001405874965712428,"async_submit_unconsumed_steps":0}}}
{"run":2268,"commit":"d561c06","metric":14.32080620888155,"metrics":{},"status":"discard","description":"Async-backlog probe: relapse to spike-triggered degradation (~56.50 tok/s, eval_s ~14.32) with early safe-mode activation.","timestamp":1776439012970,"segment":24,"confidence":0.04568638760563766,"iterationTokens":2290,"asi":{"hypothesis":"Relapse events should show async lag growth if backlog pressure is a root driver.","rollback_reason":"Primary metric regressed and run remained in collapse regime.","next_action_hint":"Keep sampling until stable recovery; aggregate healthy vs collapse lag distributions.","diagnostic_findings":{"completion_tok_s":56.50356699840932,"dflash_eval_s":14.32080620888155,"safe_mode_active":1,"spike_events":2,"safe_mode_step":10,"async_submit_calls":10,"async_submit_to_consume_mean_s":0.0012384625966660678,"async_submit_to_consume_max_s":0.0013619170058518648,"async_submit_unconsumed_steps":0}}}
{"run":2269,"commit":"d561c06","metric":12.857929580728523,"metrics":{},"status":"discard","description":"Async-backlog probe continuation: spike-free inflation persisted (~75.20 tok/s, eval_s ~12.86) with normal async lag.","timestamp":1776439078686,"segment":24,"confidence":0.04524591992165364,"iterationTokens":8614,"asi":{"hypothesis":"Non-spike inflation should not require async backlog growth if slowdown is elsewhere.","rollback_reason":"Primary metric still above floor.","next_action_hint":"Continue until floor-band return, then finalize healthy-vs-collapse lag comparison.","diagnostic_findings":{"completion_tok_s":75.19846745241377,"dflash_eval_s":12.857929580728523,"safe_mode_active":0,"spike_events":0,"async_submit_calls":96,"async_submit_to_consume_mean_s":0.0012554370320382684,"async_submit_to_consume_max_s":0.0014766659587621689,"async_submit_unconsumed_steps":0}}}
{"run":2270,"commit":"d561c06","metric":12.102682454162277,"metrics":{},"status":"discard","description":"Async-backlog probe continuation: another spike-free inflation sample (~79.53 tok/s, eval_s ~12.10) with no async backlog buildup.","timestamp":1776439107105,"segment":24,"confidence":0.04487936634310941,"iterationTokens":2281,"asi":{"hypothesis":"Persistent inflation without spikes should still avoid async queue buildup if backlog is not the root cause.","rollback_reason":"Primary metric above floor.","next_action_hint":"Take one more sample, then summarize healthy/collapse lag distributions for this probe block.","diagnostic_findings":{"completion_tok_s":79.53359578214798,"dflash_eval_s":12.102682454162277,"safe_mode_active":0,"spike_events":0,"async_submit_calls":96,"async_submit_to_consume_mean_s":0.001386524767440278,"async_submit_to_consume_max_s":0.001836540992371738,"async_submit_unconsumed_steps":0}}}
{"run":2271,"commit":"d561c06","metric":12.376759372185916,"metrics":{},"status":"discard","description":"Async-backlog probe continuation: sustained spike-free inflation (~77.74 tok/s, eval_s ~12.38); no unconsumed async work.","timestamp":1776439136874,"segment":24,"confidence":0.04481703805582295,"iterationTokens":2305,"asi":{"hypothesis":"Even prolonged non-spike inflation should not manifest as async backlog accumulation if queue pressure is secondary.","rollback_reason":"Primary metric above floor.","next_action_hint":"Summarize this block’s healthy vs collapse lag stats and decide next root-cause probe.","diagnostic_findings":{"completion_tok_s":77.73637324292267,"dflash_eval_s":12.376759372185916,"safe_mode_active":0,"spike_events":0,"async_submit_calls":96,"async_submit_to_consume_mean_s":0.0014308680680793866,"async_submit_to_consume_max_s":0.0017386249965056777,"async_submit_unconsumed_steps":0}}}
{"run":2272,"commit":"7406585","metric":8.751976452535018,"metrics":{},"status":"keep","description":"Add optional pmset thermal/power sidecar telemetry (1s sampling) through runtime→API→harness; validation run emitted all new fields with low overhead.","timestamp":1776439943525,"segment":24,"confidence":0.04479861580762041,"iterationTokens":31498,"asi":{"hypothesis":"Coarse thermal/power sidecar sampling can correlate collapse onset with platform throttling signals.","learning":"Sidecar emitted cleanly in honest run: samples=9, failures=0, no thermal/perf warnings observed on this healthy sample.","next_action_hint":"Continue mirror runs with DFLASH_BSTNXBT_THERMAL_SIDECAR=1 until next collapse transition; compare warning/limit fields versus healthy baseline.","diagnostic_findings":{"completion_tok_s":108.14649800279602,"dflash_eval_s":8.751976452535018,"thermal_sidecar_samples":9,"thermal_sidecar_failures":0,"thermal_warning_samples":0,"performance_warning_samples":0,"cpu_power_status_samples":0,"async_submit_to_consume_mean_s":0.0012842934544702682}}}
{"run":2273,"commit":"7406585","metric":8.781043877475895,"metrics":{},"status":"discard","description":"Thermal-sidecar continuation sample: healthy floor-band run (~107.55 tok/s, eval_s ~8.781), no thermal/perf warnings.","timestamp":1776439972357,"segment":24,"confidence":0.045151021630673915,"iterationTokens":3339,"asi":{"hypothesis":"If host throttling is involved, warning/limit fields should diverge around collapse transitions, not healthy floor runs.","rollback_reason":"Unchanged-code near-floor sample within noise; no new optimization delta.","next_action_hint":"Continue sidecar-enabled mirror runs until a fresh collapse transition appears.","diagnostic_findings":{"completion_tok_s":107.54694400439608,"dflash_eval_s":8.781043877475895,"thermal_sidecar_samples":9,"thermal_warning_samples":0,"performance_warning_samples":0,"cpu_power_status_samples":0,"safe_mode_active":0,"spike_events":0}}}
{"run":2274,"commit":"7406585","metric":8.7533767077839,"metrics":{},"status":"discard","description":"Thermal-sidecar continuation sample: healthy low-tail run (~107.69 tok/s, eval_s ~8.753), no thermal/perf warnings.","timestamp":1776440004021,"segment":24,"confidence":0.04523035509362832,"iterationTokens":3302,"asi":{"hypothesis":"Healthy runs establish sidecar baseline prior to collapse edge detection.","rollback_reason":"Unchanged-code sample within floor-band noise; no optimization delta.","next_action_hint":"Continue sidecar-enabled mirror runs until collapse transition and trigger immediate control parity then.","diagnostic_findings":{"completion_tok_s":107.6861559030033,"dflash_eval_s":8.7533767077839,"thermal_sidecar_samples":9,"thermal_warning_samples":0,"performance_warning_samples":0,"cpu_power_status_samples":0,"safe_mode_active":0,"spike_events":0}}}
{"run":2275,"commit":"7406585","metric":14.044889004784636,"metrics":{},"status":"discard","description":"Thermal-sidecar probe: fresh mirror collapse transition (eval_s ~14.04, tok/s ~60.77) with safe-mode activation and severe spikes.","timestamp":1776440041443,"segment":24,"confidence":0.045023640443124034,"iterationTokens":3035,"asi":{"hypothesis":"If thermal/power throttling contributes to collapse, sidecar warning/limit fields should shift at transition edge.","rollback_reason":"Primary metric regressed in collapse event; capture immediate control parity for attribution.","next_action_hint":"Run immediate control parity with sidecar enabled (DFLASH_MIRROR_SD_RUNTIME=0) and compare thermal-sidecar fields.","diagnostic_findings":{"completion_tok_s":60.77092157436033,"dflash_eval_s":14.044889004784636,"safe_mode_active":1,"spike_events":7,"safe_mode_step":56,"dflash_draft_s":2.1999185399618,"thermal_sidecar_samples":17,"thermal_warning_samples":0,"performance_warning_samples":0,"cpu_power_status_samples":0,"cpu_speed_limit_samples":0}}}
{"run":2276,"commit":"7406585","metric":28.21735129749868,"metrics":{},"status":"discard","description":"Immediate control parity with thermal sidecar: control collapsed harder (~28.22 eval_s, ~28.74 tok/s) with severe spikes; sidecar still showed no thermal/perf/power warnings.","timestamp":1776440098855,"segment":24,"confidence":0.04462805746676,"iterationTokens":3164,"asi":{"hypothesis":"If collapse is thermal-throttle driven, control parity collapse should coincide with sidecar warning/limit signals.","rollback_reason":"Control parity run is diagnostic-only and far above floor.","next_action_hint":"Resume mirror runs to track recovery and verify whether sidecar remains flat throughout collapse wave.","diagnostic_findings":{"completion_tok_s":28.742078581834857,"dflash_eval_s":28.21735129749868,"mirror_runtime":0,"safe_mode_active":1,"spike_events":72,"safe_mode_step":33,"dflash_draft_s":6.290339295635931,"thermal_sidecar_samples":34,"thermal_warning_samples":0,"performance_warning_samples":0,"cpu_power_status_samples":0,"cpu_speed_limit_samples":0}}}
{"run":2277,"commit":"7406585","metric":30.7946003342513,"metrics":{},"status":"discard","description":"Thermal-sidecar probe: deep mirror collapse after parity (~30.79 eval_s, ~25.20 tok/s), safe-mode triggered at step 2 with sustained severe spikes.","timestamp":1776440161508,"segment":24,"confidence":0.04451680002341836,"iterationTokens":3153,"asi":{"hypothesis":"If thermal throttling is driving this trough, sidecar warning/limit signals should rise during deepest collapse.","rollback_reason":"Primary metric catastrophic regression in trough.","next_action_hint":"Continue rebound mapping with sidecar enabled; check if warning/limit fields remain flat as performance recovers.","diagnostic_findings":{"completion_tok_s":25.195216589267176,"dflash_eval_s":30.7946003342513,"safe_mode_active":1,"spike_events":94,"safe_mode_step":2,"dflash_draft_s":7.617842794279568,"async_submit_to_consume_mean_s":0.022289395972620696,"async_submit_calls":2,"thermal_sidecar_samples":38,"thermal_warning_samples":0,"performance_warning_samples":0,"cpu_power_status_samples":0,"cpu_speed_limit_samples":0}}}
{"run":2278,"commit":"7406585","metric":17.149067376041785,"metrics":{},"status":"discard","description":"Thermal-sidecar probe: partial rebound but still collapsed (~17.15 eval_s, ~48.78 tok/s); sidecar remained warning-free.","timestamp":1776440200098,"segment":24,"confidence":0.04440609592867958,"iterationTokens":3156,"asi":{"hypothesis":"If thermal throttling is causal, collapse/rebound phase should surface warning/limit sidecar signals.","rollback_reason":"Primary metric remains deeply regressed in shared collapse regime.","next_action_hint":"Continue sidecar-enabled recovery mapping; if warnings stay zero, deprioritize thermal-throttle hypothesis.","diagnostic_findings":{"completion_tok_s":48.77647373253111,"dflash_eval_s":17.149067376041785,"safe_mode_active":1,"spike_events":34,"safe_mode_step":42,"dflash_draft_s":3.247707122587599,"thermal_sidecar_samples":21,"thermal_warning_samples":0,"performance_warning_samples":0,"cpu_power_status_samples":0,"cpu_speed_limit_samples":0}}}
{"run":2279,"commit":"7406585","metric":13.558218215592206,"metrics":{},"status":"discard","description":"Thermal-sidecar probe: continued rebound still degraded (~13.56 eval_s, ~64.20 tok/s); sidecar signals remained flat.","timestamp":1776440233834,"segment":24,"confidence":0.044451747601217485,"iterationTokens":3095,"asi":{"hypothesis":"If thermal limits are active, warning/limit telemetry should appear across collapse and rebound phases.","rollback_reason":"Primary metric still above floor and no optimization change.","next_action_hint":"Summarize sidecar findings from this collapse wave; likely deprioritize thermal-throttle root cause.","diagnostic_findings":{"completion_tok_s":64.20434168948098,"dflash_eval_s":13.558218215592206,"safe_mode_active":1,"spike_events":2,"safe_mode_step":63,"dflash_draft_s":1.8200084593845531,"thermal_sidecar_samples":16,"thermal_warning_samples":0,"performance_warning_samples":0,"cpu_power_status_samples":0,"cpu_speed_limit_samples":0}}}
