{"run":1372,"commit":"b304c02","metric":108.70523807728084,"metrics":{},"status":"discard","description":"Mirror post-update sample remained high at ~108.71 but below new best.","timestamp":1776324389164,"segment":23,"confidence":3.7287897282857614,"iterationTokens":2865,"asi":{"hypothesis":"High-window remains active after latest best commit, with throughput still in upper-108 band.","rollback_reason":"Below keep 108.8623.","next_action_hint":"Continue mirror-only top-tail scanning.","backend":"mirror_sd_mlx","context_only_draft_cache":1,"draft_sink":48,"async_draft_eval":1,"fused_draft_verify_eval":1,"delta_vs_keep":-0.15709441719409759,"high_window_stable":true}}
{"run":1373,"commit":"b304c02","metric":108.61764271338872,"metrics":{},"status":"discard","description":"Mirror sample drifted to ~108.62 with warmup variance; high-window still open.","timestamp":1776324422831,"segment":23,"confidence":3.724950158084882,"iterationTokens":638,"asi":{"hypothesis":"Current high-window continues but near-best spikes are intermittent.","rollback_reason":"Below keep.","next_action_hint":"Keep scanning mirror lane; run control parity only if sustained drift below ~108.5 appears.","backend":"mirror_sd_mlx","context_only_draft_cache":1,"draft_sink":48,"async_draft_eval":1,"fused_draft_verify_eval":1,"warmup_s":2.034934875089675,"delta_vs_keep":-0.2446897810862237}}
{"run":1374,"commit":"b304c02","metric":108.56482606152663,"metrics":{},"status":"discard","description":"Mirror high-window continuation held near ~108.56.","timestamp":1776324484105,"segment":23,"confidence":3.707551384617833,"iterationTokens":8530,"asi":{"hypothesis":"Current window remains healthy around upper-108.5 with intermittent top-tail spikes.","rollback_reason":"Still below keep 108.8623.","next_action_hint":"Continue mirror-only scanning for >108.86 tail events.","backend":"mirror_sd_mlx","context_only_draft_cache":1,"draft_sink":48,"async_draft_eval":1,"fused_draft_verify_eval":1,"delta_vs_keep":-0.2975064329483079,"high_window_stable":true}}
{"run":1375,"commit":"b304c02","metric":108.53596453523505,"metrics":{},"status":"discard","description":"Mirror sample dipped slightly to ~108.54 within active high-window.","timestamp":1776324518501,"segment":23,"confidence":3.6946983332320156,"iterationTokens":604,"asi":{"hypothesis":"Short dips toward low-108.5 are normal jitter, not closure of the high-window.","rollback_reason":"Below keep.","next_action_hint":"Continue mirror scanning; parity check if sub-108.5 persists.","backend":"mirror_sd_mlx","context_only_draft_cache":1,"draft_sink":48,"async_draft_eval":1,"fused_draft_verify_eval":1,"warmup_s":2.0108168330043554,"paired_prev_tok_s":108.56482606152663,"paired_delta_tok_s":-0.028861526291585306,"delta_vs_keep":-0.3263679592398909}}
{"run":1376,"commit":"b304c02","metric":108.58011022712837,"metrics":{},"status":"discard","description":"Mirror sample bounced back to ~108.58, confirming continued high-window stability.","timestamp":1776324552103,"segment":23,"confidence":3.6876925401700484,"iterationTokens":679,"asi":{"hypothesis":"High-window remains open with oscillation around mid/high-108.","rollback_reason":"Still below keep 108.8623.","next_action_hint":"Continue mirror scans for another top-tail >108.86 run.","backend":"mirror_sd_mlx","context_only_draft_cache":1,"draft_sink":48,"async_draft_eval":1,"fused_draft_verify_eval":1,"paired_prev_tok_s":108.53596453523505,"paired_delta_tok_s":0.04414569189331757,"delta_vs_keep":-0.2822222673465655,"high_window_stable":true}}
{"run":1377,"commit":"b304c02","metric":108.61551756128327,"metrics":{},"status":"discard","description":"Mirror sample moved up to ~108.62, upper half of current window.","timestamp":1776324587725,"segment":23,"confidence":3.6887752066428603,"iterationTokens":669,"asi":{"hypothesis":"Repeated mid/high-108 anchors indicate robust regime despite missing top-tail spike.","rollback_reason":"Below keep.","next_action_hint":"Continue mirror-only scans; parity check can remain deferred while band is steady.","backend":"mirror_sd_mlx","context_only_draft_cache":1,"draft_sink":48,"async_draft_eval":1,"fused_draft_verify_eval":1,"delta_vs_keep":-0.2468149331916654,"high_window_stable":true}}
{"run":1378,"commit":"b304c02","metric":108.51508503311695,"metrics":{},"status":"discard","description":"Mirror sample returned to lower edge (~108.52) while remaining in elevated regime.","timestamp":1776324621292,"segment":23,"confidence":3.689858509020584,"iterationTokens":609,"asi":{"hypothesis":"Window remains open but with broad oscillation between low-108.5 and high-108.7.","rollback_reason":"Below keep.","next_action_hint":"Take control parity spot-check now to reconfirm shared behavior at lower edge.","backend":"mirror_sd_mlx","context_only_draft_cache":1,"draft_sink":48,"async_draft_eval":1,"fused_draft_verify_eval":1,"warmup_s":1.9920070000225678,"delta_vs_keep":-0.3472474613579917,"shared_center_check_due":true}}
{"run":1379,"commit":"b304c02","metric":108.46810820487588,"metrics":{},"status":"discard","description":"Control parity check at mirror lower edge (`DFLASH_MIRROR_SD_RUNTIME=0`) remained elevated, confirming shared high-window.","timestamp":1776324659011,"segment":23,"confidence":3.685827438794508,"iterationTokens":738,"asi":{"hypothesis":"Lower-edge mirror samples should still be shared across backends if regime remains healthy.","rollback_reason":"Control ~108.47 remains high but parity backend is non-authoritative.","next_action_hint":"Restore mirror runtime and continue high-window mirror scanning.","backend":"bstnxbt_mlx","mirror_runtime_enabled":0,"context_only_draft_cache":1,"draft_sink":48,"async_draft_eval":1,"fused_draft_verify_eval":1,"paired_mirror_tok_s":108.51508503311695,"paired_delta_tok_s":0.04697682824107369,"authoritative_lane":"mirror_sd_mlx","shared_high_window":true}}
{"run":1380,"commit":"b304c02","metric":108.48392975748935,"metrics":{},"status":"discard","description":"Mirror anchor after control parity stayed at lower side (~108.48) but above old pre-breakout plateau.","timestamp":1776324696545,"segment":23,"confidence":3.6818051666263165,"iterationTokens":1060,"asi":{"hypothesis":"Shared high-window persists even when local samples sit near 108.48–108.55.","rollback_reason":"Below keep 108.8623.","next_action_hint":"Continue mirror scans; if lower-side persists, wait for spontaneous upward wave.","backend":"mirror_sd_mlx","context_only_draft_cache":1,"draft_sink":48,"async_draft_eval":1,"fused_draft_verify_eval":1,"paired_control_tok_s":108.46810820487588,"paired_delta_tok_s":0.01582155261347056,"delta_vs_keep":-0.3784027369855894}}
{"run":1381,"commit":"b304c02","metric":108.65821758049772,"metrics":{},"status":"discard","description":"Mirror sample rebounded back to ~108.66 after lower-side cluster.","timestamp":1776324727562,"segment":23,"confidence":3.6777077726712877,"iterationTokens":679,"asi":{"hypothesis":"Lower-side spell was transient; high-window remains broad and healthy.","rollback_reason":"Still below keep.","next_action_hint":"Continue mirror loop; keep chasing top-tail >108.86 samples.","backend":"mirror_sd_mlx","context_only_draft_cache":1,"draft_sink":48,"async_draft_eval":1,"fused_draft_verify_eval":1,"paired_prev_tok_s":108.48392975748935,"paired_delta_tok_s":0.17428782300836895,"delta_vs_keep":-0.20411491397721976}}
{"run":1382,"commit":"b304c02","metric":108.60105268938695,"metrics":{},"status":"discard","description":"Mirror sample held near ~108.60, maintaining elevated regime.","timestamp":1776324758493,"segment":23,"confidence":3.692645836258965,"iterationTokens":643,"asi":{"hypothesis":"Current regime continues to oscillate in upper-108 without collapsing.","rollback_reason":"Below keep.","next_action_hint":"Continue mirror high-window scans; no config changes.","backend":"mirror_sd_mlx","context_only_draft_cache":1,"draft_sink":48,"async_draft_eval":1,"fused_draft_verify_eval":1,"delta_vs_keep":-0.26127980508800003,"high_window_stable":true}}
{"run":1383,"commit":"b304c02","metric":108.64967892518773,"metrics":{},"status":"discard","description":"Mirror sample rose to ~108.65, still in stable high-window.","timestamp":1776324792651,"segment":23,"confidence":3.676977003776933,"iterationTokens":684,"asi":{"hypothesis":"Regime remains healthy with top-tail opportunities despite warmup variance.","rollback_reason":"Below keep 108.8623.","next_action_hint":"Continue immediate mirror reruns while high-window remains open.","backend":"mirror_sd_mlx","context_only_draft_cache":1,"draft_sink":48,"async_draft_eval":1,"fused_draft_verify_eval":1,"warmup_s":2.011795957922004,"delta_vs_keep":-0.21265356928722204,"high_window_stable":true}}
{"run":1384,"commit":"b304c02","metric":108.55941658197784,"metrics":{},"status":"discard","description":"Mirror sample settled near ~108.56, still within active high-window.","timestamp":1776324826803,"segment":23,"confidence":3.6553572492150406,"iterationTokens":645,"asi":{"hypothesis":"Open high-window persists with oscillation around mid-108.5/108.6.","rollback_reason":"Below keep.","next_action_hint":"Maintain mirror-only scanning for next >108.86 tail event.","backend":"mirror_sd_mlx","context_only_draft_cache":1,"draft_sink":48,"async_draft_eval":1,"fused_draft_verify_eval":1,"paired_prev_tok_s":108.64967892518773,"paired_delta_tok_s":-0.0902623432098917,"delta_vs_keep":-0.30291591249711375}}
{"run":1385,"commit":"b304c02","metric":108.57912585706637,"metrics":{},"status":"discard","description":"Mirror continuity sample stayed near ~108.58 in active high-window.","timestamp":1776324899638,"segment":23,"confidence":3.650046562451132,"iterationTokens":9484,"asi":{"hypothesis":"High-window remains open with stable upper-108 throughput.","rollback_reason":"Below keep 108.8623.","next_action_hint":"Continue mirror-only scanning for another top-tail exceedance.","backend":"mirror_sd_mlx","context_only_draft_cache":1,"draft_sink":48,"async_draft_eval":1,"fused_draft_verify_eval":1,"warmup_s":2.027333208010532,"delta_vs_keep":-0.2832066374085682,"high_window_stable":true}}
{"run":1386,"commit":"b304c02","metric":108.51587705765289,"metrics":{},"status":"discard","description":"Mirror sample touched lower side (~108.52) but stayed elevated.","timestamp":1776324928949,"segment":23,"confidence":3.6427044731939073,"iterationTokens":631,"asi":{"hypothesis":"Lower-side touches are normal within a broad open high-window.","rollback_reason":"Below keep.","next_action_hint":"Continue scanning; parity check if multiple sub-108.5 samples stack.","backend":"mirror_sd_mlx","context_only_draft_cache":1,"draft_sink":48,"async_draft_eval":1,"fused_draft_verify_eval":1,"paired_prev_tok_s":108.57912585706637,"paired_delta_tok_s":-0.06324879941347643,"delta_vs_keep":-0.3464554368220493,"plateau_lower_edge":true}}
{"run":1387,"commit":"b304c02","metric":108.61101454284751,"metrics":{},"status":"discard","description":"Mirror sample rebounded to ~108.61 after lower-edge touch.","timestamp":1776324959113,"segment":23,"confidence":3.6331515216704546,"iterationTokens":664,"asi":{"hypothesis":"Window remains stable in upper-108 with intermittent low/high oscillations.","rollback_reason":"Below keep 108.8623.","next_action_hint":"Continue mirror scans; keep watching for >108.86 top-tail.","backend":"mirror_sd_mlx","context_only_draft_cache":1,"draft_sink":48,"async_draft_eval":1,"fused_draft_verify_eval":1,"paired_prev_tok_s":108.51587705765289,"paired_delta_tok_s":0.09513748519462989,"delta_vs_keep":-0.25131795162743037}}
{"run":1388,"commit":"b304c02","metric":108.55418938446292,"metrics":{},"status":"discard","description":"Mirror sample slid to ~108.55 with warmup variance; still elevated.","timestamp":1776324992361,"segment":23,"confidence":3.6239635770411343,"iterationTokens":680,"asi":{"hypothesis":"High-window still open; warmup swings do not dominate request throughput.","rollback_reason":"Below keep.","next_action_hint":"Continue mirror-only loop; parity check only if sustained downturn emerges.","backend":"mirror_sd_mlx","context_only_draft_cache":1,"draft_sink":48,"async_draft_eval":1,"fused_draft_verify_eval":1,"warmup_s":2.0394257500302047,"delta_vs_keep":-0.308143109,"high_window_stable":true}}
{"run":1389,"commit":"b304c02","metric":108.54257300747324,"metrics":{},"status":"discard","description":"Mirror sample stayed near lower-mid high-window (~108.54).","timestamp":1776325026627,"segment":23,"confidence":3.630567538719444,"iterationTokens":646,"asi":{"hypothesis":"Current local center may be around 108.54–108.62 while top-tail is sparse.","rollback_reason":"Below keep.","next_action_hint":"Take a control parity spot-check now to ensure lower-side drift is still shared.","backend":"mirror_sd_mlx","context_only_draft_cache":1,"draft_sink":48,"async_draft_eval":1,"fused_draft_verify_eval":1,"paired_prev_tok_s":108.55418938446292,"paired_delta_tok_s":-0.011616376989683772,"delta_vs_keep":-0.319759486,"shared_center_check_due":true}}
{"run":1390,"commit":"b304c02","metric":108.53467418475316,"metrics":{},"status":"discard","description":"Control parity spot-check at mirror lower-mid band (`DFLASH_MIRROR_SD_RUNTIME=0`) matched the same 108.53 regime.","timestamp":1776325070933,"segment":23,"confidence":3.633092139496814,"iterationTokens":972,"asi":{"hypothesis":"Any mirror-side lower drift should be shared if regime remains backend-agnostic.","rollback_reason":"Control ~108.53 tracks mirror ~108.54; parity backend remains non-authoritative.","next_action_hint":"Restore mirror lane and continue top-tail scans within shared high-window.","backend":"bstnxbt_mlx","mirror_runtime_enabled":0,"context_only_draft_cache":1,"draft_sink":48,"async_draft_eval":1,"fused_draft_verify_eval":1,"paired_mirror_tok_s":108.54257300747324,"paired_delta_tok_s":0.007898822720079511,"authoritative_lane":"mirror_sd_mlx","shared_high_window":true}}
{"run":1391,"commit":"b304c02","metric":108.56623078104215,"metrics":{},"status":"discard","description":"Mirror anchor after control parity returned to ~108.57.","timestamp":1776325111236,"segment":23,"confidence":3.623711645660986,"iterationTokens":1122,"asi":{"hypothesis":"Shared high-window remains centered around mid/high-108 after parity check.","rollback_reason":"Below keep.","next_action_hint":"Continue mirror scans for fresh top-tail event.","backend":"mirror_sd_mlx","context_only_draft_cache":1,"draft_sink":48,"async_draft_eval":1,"fused_draft_verify_eval":1,"paired_control_tok_s":108.53467418475316,"paired_delta_tok_s":0.03155659628899368,"delta_vs_keep":-0.2961017134327931}}
{"run":1392,"commit":"b304c02","metric":108.4820334570308,"metrics":{},"status":"discard","description":"Mirror sample dipped to ~108.48 at lower edge of active high-window.","timestamp":1776325149682,"segment":23,"confidence":3.613285495159375,"iterationTokens":634,"asi":{"hypothesis":"Lower-edge values still belong to shared elevated regime, not collapse onset.","rollback_reason":"Below keep.","next_action_hint":"Continue mirror scans; consider parity recheck only if repeated sub-108.45 occurs.","backend":"mirror_sd_mlx","context_only_draft_cache":1,"draft_sink":48,"async_draft_eval":1,"fused_draft_verify_eval":1,"paired_prev_tok_s":108.56623078104215,"paired_delta_tok_s":-0.0841973240113524,"delta_vs_keep":-0.380299037444121,"plateau_lower_edge":true}}
{"run":1393,"commit":"b304c02","metric":108.58510149225451,"metrics":{},"status":"discard","description":"Mirror sample rebounded to ~108.59 after lower-edge dip.","timestamp":1776325182245,"segment":23,"confidence":3.6030609495057355,"iterationTokens":674,"asi":{"hypothesis":"High-window remains stable with routine oscillation.","rollback_reason":"Below keep.","next_action_hint":"Continue mirror-only top-tail hunting.","backend":"mirror_sd_mlx","context_only_draft_cache":1,"draft_sink":48,"async_draft_eval":1,"fused_draft_verify_eval":1,"paired_prev_tok_s":108.4820334570308,"paired_delta_tok_s":0.10306803522370989,"delta_vs_keep":-0.2772310022204117}}
{"run":1394,"commit":"b304c02","metric":108.51348470018614,"metrics":{},"status":"discard","description":"Mirror sample slipped to ~108.51, still above old pre-breakout band.","timestamp":1776325213492,"segment":23,"confidence":3.5982143010980407,"iterationTokens":679,"asi":{"hypothesis":"High-window remains elevated even with occasional lower-side excursions.","rollback_reason":"Below keep.","next_action_hint":"Continue monitoring; parity check if multiple sub-108.5 readings stack.","backend":"mirror_sd_mlx","context_only_draft_cache":1,"draft_sink":48,"async_draft_eval":1,"fused_draft_verify_eval":1,"paired_prev_tok_s":108.58510149225451,"paired_delta_tok_s":-0.07161679206836721,"delta_vs_keep":-0.348847794288776}}
{"run":1395,"commit":"b304c02","metric":108.56145418438989,"metrics":{},"status":"discard","description":"Control parity check after mirror lower-side readings (`DFLASH_MIRROR_SD_RUNTIME=0`) remained elevated.","timestamp":1776325252238,"segment":23,"confidence":3.594405033600386,"iterationTokens":788,"asi":{"hypothesis":"If lower-side mirror values are shared noise, control should stay in same 108.5+ regime.","rollback_reason":"Control ~108.56 confirms shared elevated regime; parity backend remains non-authoritative.","next_action_hint":"Restore mirror lane and continue high-window top-tail scans.","backend":"bstnxbt_mlx","mirror_runtime_enabled":0,"context_only_draft_cache":1,"draft_sink":48,"async_draft_eval":1,"fused_draft_verify_eval":1,"paired_mirror_tok_s":108.51348470018614,"paired_delta_tok_s":-0.04796948420374296,"authoritative_lane":"mirror_sd_mlx","shared_high_window":true}}
{"run":1396,"commit":"b304c02","metric":108.59253308117958,"metrics":{},"status":"discard","description":"Mirror anchor after parity check sat at ~108.59 in shared high-window.","timestamp":1776325291749,"segment":23,"confidence":3.5906038229733164,"iterationTokens":1102,"asi":{"hypothesis":"After parity confirmation, mirror should continue oscillating in same elevated band.","rollback_reason":"Below keep.","next_action_hint":"Continue mirror scans for another >108.86 top-tail event.","backend":"mirror_sd_mlx","context_only_draft_cache":1,"draft_sink":48,"async_draft_eval":1,"fused_draft_verify_eval":1,"paired_control_tok_s":108.56145418438989,"paired_delta_tok_s":0.031078896789691994,"delta_vs_keep":-0.26979941328273227,"high_window_stable":true}}
{"run":1397,"commit":"b304c02","metric":108.5036729331382,"metrics":{},"status":"discard","description":"Mirror sample dipped to ~108.50 while staying in elevated shared regime.","timestamp":1776325340305,"segment":23,"confidence":3.5929173382469153,"iterationTokens":1297,"asi":{"hypothesis":"Even lower-edge samples should remain within the open high-window rather than collapse.","rollback_reason":"Below keep.","next_action_hint":"Continue mirror scans; if sub-108.5 repeats, parity check again.","backend":"mirror_sd_mlx","context_only_draft_cache":1,"draft_sink":48,"async_draft_eval":1,"fused_draft_verify_eval":1,"warmup_s":2.0049910000525415,"delta_vs_keep":-0.3586595613246507,"plateau_lower_edge":true}}
{"run":1398,"commit":"b304c02","metric":108.49808897911616,"metrics":{},"status":"discard","description":"Mirror sample slipped just below 108.5, extending lower-edge sequence.","timestamp":1776325375315,"segment":23,"confidence":3.5876478778576613,"iterationTokens":670,"asi":{"hypothesis":"Lower-side drift may still be shared noise, but should be parity-checked now.","rollback_reason":"Below keep and local center appears slightly lower than prior 108.6 median.","next_action_hint":"Run immediate control parity sample to validate shared lower-side shift.","backend":"mirror_sd_mlx","context_only_draft_cache":1,"draft_sink":48,"async_draft_eval":1,"fused_draft_verify_eval":1,"paired_prev_tok_s":108.5036729331382,"paired_delta_tok_s":-0.005583954022042287,"delta_vs_keep":-0.36424351534669636,"plateau_lower_edge":true}}
{"run":1399,"commit":"b304c02","metric":108.55703764594868,"metrics":{},"status":"discard","description":"Control parity check after mirror lower-edge samples (`DFLASH_MIRROR_SD_RUNTIME=0`) stayed elevated at ~108.56.","timestamp":1776325424910,"segment":23,"confidence":3.587166402705322,"iterationTokens":786,"asi":{"hypothesis":"If lower-side mirror movement is shared noise, control should remain in same high band.","rollback_reason":"Control stayed in high-window; parity backend remains non-authoritative.","next_action_hint":"Restore mirror runtime and continue top-tail scanning.","backend":"bstnxbt_mlx","mirror_runtime_enabled":0,"context_only_draft_cache":1,"draft_sink":48,"async_draft_eval":1,"fused_draft_verify_eval":1,"paired_mirror_tok_s":108.49808897911616,"paired_delta_tok_s":-0.05894866683251996,"authoritative_lane":"mirror_sd_mlx","shared_high_window":true}}
{"run":1400,"commit":"b304c02","metric":108.48270672795874,"metrics":{},"status":"discard","description":"Mirror anchor after parity check sat at ~108.48 lower edge but still elevated.","timestamp":1776325472758,"segment":23,"confidence":3.5795268034038146,"iterationTokens":1106,"asi":{"hypothesis":"Shared high-window persists despite occasional lower-edge anchors.","rollback_reason":"Below keep.","next_action_hint":"Continue mirror scans for upward swing toward top-tail.","backend":"mirror_sd_mlx","context_only_draft_cache":1,"draft_sink":48,"async_draft_eval":1,"fused_draft_verify_eval":1,"paired_control_tok_s":108.55703764594868,"paired_delta_tok_s":-0.07433091798993384,"delta_vs_keep":-0.3796297665161976}}
