{"run":173,"commit":"b081691","metric":28.74673771844583,"metrics":{},"status":"discard","description":"On top of the kept combined external-style official-target port, add the recurrent bstnxbt kernel pair: use `gated_delta_kernel_with_tape` while recording speculative linear state and switch rollback replay to `tape_replay_kernel`. The official Qwen3.5-9B 1024-token result reached 28.75 tok/s, effectively flat-to-slightly-worse than the kept 28.77 tok/s combined path, so discard.","timestamp":1776099357922,"segment":8,"confidence":0.9757278846325445,"iterationTokens":9973}
{"run":174,"commit":"b081691","metric":28.685364621830455,"metrics":{},"status":"discard","description":"Keep the combined external-style official-target port but lower the long-context split-attention activation threshold from 1024 to 512 KV tokens via `DFLASH_BSTNXBT_SPLIT_THRESHOLD=512`. This reached 28.69 tok/s on the official Qwen3.5-9B 1024-token workload, below the kept 28.77 tok/s path, so discard.","timestamp":1776099485090,"segment":8,"confidence":1.0595895149820862,"iterationTokens":3662}
{"run":175,"commit":"b081691","metric":28.480682189300342,"metrics":{},"status":"discard","description":"On top of the kept combined external-style official-target port, reintroduce the external-style `ContextOnlyDraftKVCache` for the MLX-native drafter via `DFLASH_BSTNXBT_CONTEXT_ONLY_DRAFT_CACHE=1`. Exact-match parity vs stock held, but the official Qwen3.5-9B 1024-token workload reached only 28.48 tok/s, below the kept 28.77 tok/s path, so discard.","timestamp":1776099829409,"segment":8,"confidence":1.2618744178188301,"iterationTokens":23677}
{"run":176,"commit":"b081691","metric":28.25601161129617,"metrics":{},"status":"discard","description":"Try making the long-context split-attention verify path the default bstnxbt behavior in oMLX by enabling it unless `DFLASH_BSTNXBT_SPLIT_SDPA` is explicitly disabled. On the official Qwen3.5-9B 1024-token workload this measured 28.26 tok/s, below both the explicit kept combined path at 28.77 tok/s and the 28.32 baseline, so discard.","timestamp":1776099985146,"segment":8,"confidence":1.2363565395117928,"iterationTokens":5939}
{"type":"config","name":"oMLX OmniCoder long-decode bstnxbt combined-port transfer","metricName":"completion_tok_s","metricUnit":"","bestDirection":"higher"}
{"run":177,"commit":"e22b22d","metric":28.002571036682152,"metrics":{},"status":"keep","description":"Start a new OmniCoder 1024-token long-decode transfer segment by measuring the kept official-Qwen combined-port shape on the real Omni target: `DFLASH_BSTNXBT_RUNTIME=1 DFLASH_BSTNXBT_SPLIT_SDPA=1` with the normal oMLX server path. This establishes the transferred combined-port result at 28.00 tok/s on `models/omni9b-phase2prime`.","timestamp":1776100068255,"segment":9,"confidence":null,"iterationTokens":167}
{"run":178,"commit":"e22b22d","metric":24.492723344745283,"metrics":{},"status":"discard","description":"On the new OmniCoder 1024-token transfer segment, retest the current `DFLASH_BSTNXBT_RUNTIME=1` path without the split-attention env to see if the official-Qwen combined-port win generalizes cleanly. The first sample was slightly above the split-enabled baseline at 28.09 tok/s, but the confirmation run collapsed to 24.49 tok/s, so treat this Omni long-decode branch as unstable/noisy and discard the no-split follow-up.","timestamp":1776100192302,"segment":9,"confidence":null,"iterationTokens":588}
{"type":"config","name":"oMLX OmniCoder main 256-token bstnxbt combined-port transfer","metricName":"completion_tok_s","metricUnit":"","bestDirection":"higher"}
{"run":179,"commit":"b9fdc6b","metric":28.016715965484355,"metrics":{},"status":"keep","description":"Re-anchor the real primary target around the current bstnxbt combined-port shape on the honest OmniCoder 256-token main workload: `DFLASH_BSTNXBT_RUNTIME=1 DFLASH_BSTNXBT_SPLIT_SDPA=1` through the normal oMLX server path. This establishes the transferred combined-port baseline at 28.02 tok/s on `models/omni9b-phase2prime`.","timestamp":1776100292477,"segment":10,"confidence":null,"iterationTokens":167}
{"run":180,"commit":"b9fdc6b","metric":27.993154744210255,"metrics":{},"status":"discard","description":"On the real OmniCoder 256-token main workload, retest the current bstnxbt combined-port code without `DFLASH_BSTNXBT_SPLIT_SDPA=1` to verify whether the long-context split path is adding overhead when it should never trigger below the 1024-KV threshold. Result was effectively flat-to-worse at 27.99 tok/s versus the 28.02 baseline, so discard.","timestamp":1776100345347,"segment":10,"confidence":null,"iterationTokens":1126}
{"type":"config","name":"oMLX Qwen3.5-9B official long-decode DFlash to 60 tok/s","metricName":"completion_tok_s","metricUnit":"","bestDirection":"higher"}
{"run":181,"commit":"03968ea","metric":28.342388652561713,"metrics":{},"status":"keep","description":"Re-anchor the loop on the agreed target again: official `mlx_models/Qwen3.5-9B-bf16` through the oMLX server, using the current kept combined bstnxbt-style path (`DFLASH_BSTNXBT_RUNTIME=1 DFLASH_BSTNXBT_SPLIT_SDPA=1`). This re-establishes the active Qwen long-decode baseline at 28.34 tok/s before further parity-port work toward the 60 tok/s goal.","timestamp":1776100511274,"segment":11,"confidence":null,"iterationTokens":181}
{"run":182,"commit":"03968ea","metric":27.334166357038058,"metrics":{},"status":"discard","description":"Retest bstnxbt-style target MLP packing only on the agreed target and current kept combined path: `DFLASH_BSTNXBT_PACK_MLP=1` together with `DFLASH_BSTNXBT_RUNTIME=1 DFLASH_BSTNXBT_SPLIT_SDPA=1` on official `Qwen3.5-9B-bf16` through the normal oMLX server. Throughput regressed to 27.33 tok/s versus the 28.34 baseline, so discard.","timestamp":1776101297224,"segment":11,"confidence":null,"iterationTokens":4867}
{"run":183,"commit":"03968ea","metric":27.558541817824405,"metrics":{},"status":"discard","description":"Port one concrete external-style hot-loop delta into the kept combined official-Qwen path: replace Python-list token accumulation with preallocated MLX generated/block token buffers in `execute_bstnxbt_mlx_generate(...)`, while keeping `DFLASH_BSTNXBT_RUNTIME=1 DFLASH_BSTNXBT_SPLIT_SDPA=1` on the normal oMLX server path. Throughput regressed to 27.56 tok/s versus the 28.34 baseline, so discard.","timestamp":1776101508324,"segment":11,"confidence":null,"iterationTokens":44637}
{"type":"config","name":"oMLX Qwen3.5-9B external-style no-EOS DFlash to 60 tok/s","metricName":"completion_tok_s","metricUnit":"","bestDirection":"higher"}
{"run":184,"commit":"03968ea","metric":0,"metrics":{},"status":"crash","description":"Tried to re-anchor the new external-style official-Qwen target using an env-prefixed `run_experiment` command. The harness rejected it because `autoresearch.sh` exists and requires being invoked directly, so this attempt is a command-shape crash rather than a model/runtime failure.","timestamp":1776102125957,"segment":12,"confidence":null,"iterationTokens":44637}
{"run":185,"commit":"e4d64ff","metric":26.96888006591071,"metrics":{},"status":"keep","description":"Re-anchor the active target on the external-style official-Qwen workload through the normal oMLX server: official `Qwen3.5-9B-bf16`, math prompt matching the external reference shape, 1024-token decode, `ignore_eos=true`, and current combined bstnxbt path via `DFLASH_BSTNXBT_RUNTIME=1 DFLASH_BSTNXBT_SPLIT_SDPA=1`. Current oMLX DFlash baseline on this workload is 26.97 tok/s.","timestamp":1776102407630,"segment":12,"confidence":null,"iterationTokens":11079}
{"run":186,"commit":"e4d64ff","metric":27.29277076424394,"metrics":{},"status":"discard","description":"Aligned external-style official-Qwen workload follow-up: drop `DFLASH_BSTNXBT_SPLIT_SDPA=1` while keeping the rest of the combined bstnxbt path the same (`ignore_eos=true`, math prompt, 1024 tokens through normal oMLX server). First run improved to 27.29 tok/s, but a mandatory confirmation rerun fell back to 26.96 tok/s, so treat the no-split result as noise and discard.","timestamp":1776102595310,"segment":12,"confidence":null,"iterationTokens":413}
{"run":187,"commit":"e4d64ff","metric":26.961716459602144,"metrics":{},"status":"discard","description":"Confirmation rerun of the aligned external-style official-Qwen no-split variant (`DFLASH_BSTNXBT_SPLIT_SDPA=0`) came in at 26.96 tok/s, effectively matching/slightly missing the 26.97 split baseline. This confirms the earlier 27.29 sample was not a reliable improvement.","timestamp":1776102604322,"segment":12,"confidence":3764.707174605785,"iterationTokens":413}
{"run":188,"commit":"e4d64ff","metric":27.50743182839831,"metrics":{},"status":"discard","description":"Aligned external-style official-Qwen retest of the external draft-side `ContextOnlyDraftKVCache` (`DFLASH_BSTNXBT_CONTEXT_ONLY_DRAFT_CACHE=1`) on top of the current combined bstnxbt path. First run improved to 27.51 tok/s, but later reruns proved the variant unstable, so discard rather than trust the initial sample.","timestamp":1776102993652,"segment":12,"confidence":162.9272278763527,"iterationTokens":369}
{"run":189,"commit":"e4d64ff","metric":28.169515999696443,"metrics":{},"status":"discard","description":"Confirmation rerun of aligned external-style official-Qwen with `DFLASH_BSTNXBT_CONTEXT_ONLY_DRAFT_CACHE=1` reached 28.17 tok/s, but a third rerun collapsed to 19.95 tok/s. Despite the strong middle sample, the variant is not stable enough to keep.","timestamp":1776102998880,"segment":12,"confidence":83.26537379645339,"iterationTokens":369}
{"run":190,"commit":"e4d64ff","metric":19.951836254428958,"metrics":{},"status":"discard","description":"Third rerun of the aligned external-style official-Qwen `ContextOnlyDraftKVCache` variant collapsed to 19.95 tok/s, confirming severe instability on this server path. Discard the variant.","timestamp":1776103003195,"segment":12,"confidence":98.83863130116104,"iterationTokens":369}
{"run":191,"commit":"e4d64ff","metric":27.17154784287773,"metrics":{},"status":"discard","description":"Aligned external-style official-Qwen parity test: make `ignore_eos=true` behave more like external `dflash-mlx` by suppressing EOS during greedy sampling inside the bstnxbt DFlash loop, not just removing EOS from stop tokens. First two runs improved to 27.17 and 27.62 tok/s versus the 26.97 baseline, but a third confirmation run collapsed to 23.67 tok/s, so treat the patch as unstable and discard.","timestamp":1776103449661,"segment":12,"confidence":128.5264370129551,"iterationTokens":337}
{"run":192,"commit":"dfce15a","metric":28.10224377948951,"metrics":{},"status":"keep","description":"Restore the external bstnxbt recurrent tape-kernel path in-tree and enable it on the aligned external-style official-Qwen workload via `DFLASH_BSTNXBT_RECURRENT_KERNELS=1`, while keeping the current combined split-SDPA bstnxbt server path. On the exact active math/no-EOS 1024-token workload this improved oMLX from the 26.97 baseline to 28.10 tok/s, so the remaining large gap is now more clearly in other runtime-port differences, not this recurrent rollback layer.","timestamp":1776105208354,"segment":12,"confidence":102.99231205997482,"iterationTokens":29870}
{"run":193,"commit":"97bd580","metric":28.22695279985161,"metrics":{},"status":"keep","description":"Stack the external-style no-EOS sampling semantics back on top of the kept recurrent-kernel path: when `ignore_eos=true`, suppress EOS from greedy token selection inside the bstnxbt DFlash loop instead of only omitting EOS from stop tokens. On the exact aligned official-Qwen math/no-EOS workload this nudged throughput from 28.10 to 28.23 tok/s while matching the external runtime shape more closely, so keep the parity fix.","timestamp":1776105361716,"segment":12,"confidence":85.26381443791657,"iterationTokens":12697}
{"run":194,"commit":"97bd580","metric":27.73159146440456,"metrics":{},"status":"discard","description":"Replace the old custom native drafter with an in-tree copy of the external bstnxbt draft-model implementation and load it automatically for the bstnxbt oMLX runtime, keeping recurrent kernels + split SDPA + no-EOS suppression on the aligned official-Qwen workload. Despite a strong direct-loop diagnostic on a raw prompt, the real oMLX server benchmark regressed to 27.73 tok/s versus the kept 28.23 path, so discard; the draft-side acceptance gain did not transfer honestly to the chat-templated server workload.","timestamp":1776105937091,"segment":12,"confidence":64.91894172962681,"iterationTokens":41253}
{"run":195,"commit":"97bd580","metric":24.93997896620646,"metrics":{},"status":"discard","description":"Wire the exact external bstnxbt draft model into the oMLX server behind `DFLASH_BSTNXBT_EXTERNAL_DRAFT=1`, keeping recurrent kernels + split SDPA + no-EOS suppression on the aligned official-Qwen workload. Despite strong direct-loop diagnostics, the real oMLX server benchmark fell hard to 24.94 tok/s, so discard; naive external-draft injection is not enough and likely fights the server/runtime integration shape.","timestamp":1776106197122,"segment":12,"confidence":64.32456989727207,"iterationTokens":6342}
{"run":196,"commit":"97bd580","metric":27.8832713726864,"metrics":{},"status":"discard","description":"Port the missing external-style chunked verify path into the in-tree bstnxbt runtime and test it honestly on the aligned official-Qwen workload via `DFLASH_BSTNXBT_VERIFY_CHUNK_TOKENS=8`, which disables speculative linear rollback caches and verifies the target block in smaller chunks. This regressed to 27.88 tok/s versus the kept 28.23 path, so discard; chunked verify is not the next win here.","timestamp":1776107414765,"segment":12,"confidence":61.25940494502215,"iterationTokens":32612}
{"run":197,"commit":"97bd580","metric":27.509051307298293,"metrics":{},"status":"discard","description":"Port the remaining external target-side packing delta that was still missing in the live tree: env-gated Qwen3Next attention QKV packing via `DFLASH_BSTNXBT_PACK_ATTENTION=1`, while keeping the aligned official-Qwen path on split SDPA + recurrent kernels + EOS suppression. This regressed to 27.51 tok/s versus the kept 28.23 path, so discard; target attention packing is not the missing server-path win here.","timestamp":1776107645725,"segment":12,"confidence":52.41270155624366,"iterationTokens":15309}
{"run":198,"commit":"97bd580","metric":27.80506538863143,"metrics":{},"status":"discard","description":"Port more of bstnxbt’s current outer generate-loop shape into the live in-tree runtime while keeping the aligned official-Qwen workload unchanged: add `DFLASH_VERIFY_LEN` support, prefix-aware rollback arming, reusable token buffers, and `mx.async_eval` on draft logits. The honest server benchmark regressed to 27.81 tok/s versus the kept 28.23 path, and follow-up in-process diagnostics showed no meaningful external-draft runtime improvement either, so discard; the remaining gap is not just the outer loop shape.","timestamp":1776111554281,"segment":12,"confidence":61.73932886432383,"iterationTokens":15309}
{"run":199,"commit":"97bd580","metric":27.755182302214685,"metrics":{},"status":"discard","description":"Port external-style context-only draft-cache semantics into the native MLX drafter behind `DFLASH_BSTNXBT_CONTEXT_ONLY_DRAFT_CACHE=1`: add an in-tree `ContextOnlyDraftKVCache`, teach native draft attention to use `append_context/fetch`, and let native `make_cache()` emit context-only caches when env-gated. This was a strong direct runtime win on the exact aligned prompt (repeated `DFlashRuntime.generate(...)` stabilized around 31.7–32.9 tok/s with acceptance ratio 0.8662 and 137 cycles), and the first honest server run improved to 28.74 tok/s. But the confirmation `./autoresearch.sh` rerun dropped to 27.76 tok/s, below the kept 28.23 path, so discard for now; the draft-runtime semantics look much better, but the full server lifecycle still cancels the gain.","timestamp":1776112827731,"segment":12,"confidence":75.42875278635064,"iterationTokens":423}
{"type":"config","name":"Aligned official-Qwen actual DFlash server benchmark after greedy request fix","metricName":"completion_tok_s","metricUnit":"","bestDirection":"higher"}
{"run":200,"commit":"03d69ba","metric":37.381389550516346,"metrics":{},"status":"keep","description":"Fix the HTTP benchmark so DFlash requests are actually greedy and no longer silently fall back to stock generation: `scripts/siliconflash_benchmark.py` now sends `top_p=1`, `top_k=0`, and `min_p=0.0` alongside `temperature=0`, with tests updated to lock that contract. This starts a fresh corrected-benchmark segment and establishes the first honest aligned official-Qwen server-path DFlash baseline at 37.38 tok/s.","timestamp":1776112991449,"segment":13,"confidence":null,"iterationTokens":513}
{"run":201,"commit":"aef93f7","metric":62.796116840487755,"metrics":{},"status":"keep","description":"Re-try the strongest real draft-side lead on the corrected greedy HTTP benchmark: add env-gated external-style context-only draft-cache semantics to the native MLX drafter. This ports an in-tree `ContextOnlyDraftKVCache`, teaches native draft attention to use `append_context/fetch`, and lets native `make_cache()` emit context-only caches when `DFLASH_BSTNXBT_CONTEXT_ONLY_DRAFT_CACHE=1`. On the honest aligned official-Qwen server benchmark this jumps the actual DFlash path from the corrected 37.38 tok/s baseline to 62.80 tok/s, clearing the 60 tok/s target.","timestamp":1776113109265,"segment":13,"confidence":null,"iterationTokens":4303}
{"run":202,"commit":"aef93f7","metric":50.61181844161006,"metrics":{},"status":"discard","description":"Tune the new native context-only draft-cache path by shrinking `DFLASH_DRAFT_WINDOW` from 1024 to 256 on the corrected aligned official-Qwen server benchmark. A quick direct-runtime probe made 256 look promising, but the honest full server path dropped to 50.61 tok/s versus the kept 62.80 path, so discard; the direct sweep overpredicted and the current best remains the default window.","timestamp":1776113618923,"segment":13,"confidence":2.08585890282467,"iterationTokens":5162}
{"run":203,"commit":"aef93f7","metric":35.27315815048598,"metrics":{},"status":"discard","description":"Tune the kept native context-only draft-cache path by shrinking the draft sink to zero (`DFLASH_DRAFT_SINK=0`) while keeping the default 1024 window on the corrected aligned official-Qwen server benchmark. This collapsed to 35.27 tok/s versus the kept 62.80 path, so discard; preserving some sink context is essential in the honest server path.","timestamp":1776114097132,"segment":13,"confidence":3.3138131763277894,"iterationTokens":4560}
{"run":204,"commit":"e5e9041","metric":73.06691365282404,"metrics":{},"status":"keep","description":"Retry the exact external bstnxbt draft-loader integration on the corrected greedy HTTP benchmark, since the old server regression was measured before the benchmark fix and was therefore stale. Add an env-gated `DFLASH_BSTNXBT_EXTERNAL_DRAFT=1` loader path in `omlx/dflash/drafter.py` that imports `external/dflash-mlx-bstnxbt`, uses its `load_draft_bundle(...)`, and overrides `make_cache()` to return the exact external `ContextOnlyDraftKVCache` shape. On the honest aligned official-Qwen server benchmark this reached 73.07 tok/s and then 72.11 tok/s on confirmation, a large real win over the 62.80 native context-only keep.","timestamp":1776114334279,"segment":13,"confidence":2.6972310872197047,"iterationTokens":346}
{"run":205,"commit":"e5e9041","metric":29.08614726717996,"metrics":{},"status":"discard","description":"Test the external runtime’s own verify-length cap on top of the corrected external-draft keep by setting `DFLASH_VERIFY_LEN=8` while keeping the aligned official-Qwen server workload otherwise unchanged. This collapsed the honest server path to 29.09 tok/s versus the kept ~73 tok/s band, so discard; partial verify is not a safe optimization for this path.","timestamp":1776114598005,"segment":13,"confidence":3.019858780400542,"iterationTokens":10004}
{"run":206,"commit":"e5e9041","metric":26.08426887962497,"metrics":{},"status":"discard","description":"Test whether the extra in-tree recurrent tape-kernel path is now just overhead on the corrected external-draft keep by disabling it (`DFLASH_BSTNXBT_RECURRENT_KERNELS=0`) while keeping the aligned official-Qwen server workload otherwise unchanged. This collapsed the honest server path to 26.08 tok/s versus the kept ~72–73 tok/s band, so discard; recurrent rollback semantics remain essential even with the exact external draft integration.","timestamp":1776114736680,"segment":13,"confidence":3.158815873699259,"iterationTokens":8869}
{"run":207,"commit":"e5e9041","metric":47.55059008657964,"metrics":{},"status":"discard","description":"Tune the target-side split-attention chunking on top of the corrected external-draft keep by setting `DFLASH_BSTNXBT_SPLIT_CHUNK_SIZE=4` while keeping the aligned official-Qwen server workload otherwise unchanged. A quick direct runtime scout made chunk 4 look promising, but the honest full server path dropped to 47.55 tok/s versus the kept ~72–73 tok/s band, so discard; direct split-chunk sweeps are not predictive of server-path performance here.","timestamp":1776115849194,"segment":13,"confidence":3.315624754567262,"iterationTokens":4127}
