{"run":1688,"commit":"cb4dd2f","metric":34.94179283536505,"metrics":{},"status":"discard","description":"Control telemetry in the same degraded window also collapsed (eval_s ~34.94s, ~28.03 tok/s), confirming shared eval-phase inflation.","timestamp":1776368618826,"segment":24,"confidence":null,"iterationTokens":1279,"asi":{"hypothesis":"If collapse is shared runtime-state behavior, control should exhibit similarly inflated eval_s with the same acceptance profile in the same window.","rollback_reason":"Primary metric far worse than baseline (lower-better eval_s target).","next_action_hint":"Focus next bets on runtime-state mitigation and cache/eval-path stabilization, not mirror-only acceptance tuning.","backend":"bstnxbt_mlx","paired_mirror_eval_s":34.376391453202814,"paired_delta_eval_s":0.5654013821622383,"paired_control_tok_s":28.028959531252934,"paired_mirror_tok_s":28.815791447721004,"dflash_acceptance_rate":0.6972201352366642,"dflash_full_accept_rate":0.4479166666666667,"dflash_draft_steps":96,"shared_collapse_confirmed":true}}
{"run":1689,"commit":"cb4dd2f","metric":8.77389449684415,"metrics":{},"status":"discard","description":"Mirror telemetry re-anchor landed at ~8.774s eval (slightly below baseline) but treated as noise-level drift on unchanged code/env.","timestamp":1776368748639,"segment":24,"confidence":null,"iterationTokens":8652,"asi":{"hypothesis":"Unchanged baseline reruns should quantify eval_s noise floor before trying toggles.","rollback_reason":"Tiny delta (~0.012s) on unchanged configuration is within expected jitter; not promoting as a meaningful improvement.","next_action_hint":"Probe eval-boundary toggles (fused/async) with telemetry enabled to seek larger, repeatable eval_s movement.","diagnostic_findings":{"completion_tok_s":108.16973870737901,"dflash_eval_s":8.77389449684415,"dflash_total_s":9.2744142919546,"dflash_acceptance_rate":0.6972201352366642,"dflash_full_accept_rate":0.4479166666666667}}}
{"run":1690,"commit":"cb4dd2f","metric":7.594075665343553,"metrics":{},"status":"discard","description":"Variant async=1,fused=0 lowered eval_s but shifted cost to draft phase (draft_s jumped to ~1.87s) and reduced completion throughput to ~101.79 tok/s.","timestamp":1776368803507,"segment":24,"confidence":null,"iterationTokens":2296,"asi":{"hypothesis":"Removing fused draft+verify eval boundary might reduce eval-phase inflation and improve runtime stability.","rollback_reason":"Discarding despite primary eval_s improvement because it is metric-shifting: completion_tok_s regressed materially (~107.6→101.8) while total_s worsened (~9.30→9.82), indicating work moved from eval_s into draft_s rather than real speedup.","next_action_hint":"Treat fused toggle as an eval accounting shift, not a stability fix; test async=0,fused=1 next.","variant":{"DFLASH_BSTNXBT_ASYNC_DRAFT_EVAL":1,"DFLASH_BSTNXBT_FUSED_DRAFT_VERIFY_EVAL":0},"diagnostic_findings":{"completion_tok_s":101.79366139394985,"dflash_eval_s":7.594075665343553,"dflash_draft_s":1.8721014520851895,"dflash_verify_s":0.12434883182868361,"dflash_total_s":9.816941000055522,"dflash_acceptance_rate":0.6972201352366642}}}
{"run":1691,"commit":"cb4dd2f","metric":9.377247747732326,"metrics":{},"status":"discard","description":"Variant async=0,fused=1 regressed eval_s (~9.38) and throughput (~102.99 tok/s) relative to baseline.","timestamp":1776368834176,"segment":24,"confidence":null,"iterationTokens":1652,"asi":{"hypothesis":"Disabling async draft kickoff might reduce runtime jitter without harming fused eval behavior.","rollback_reason":"Primary metric worsened vs baseline and completion_tok_s also regressed.","next_action_hint":"Test async=0,fused=0 to complete the eval-boundary matrix, then refocus on runtime-state mitigations.","variant":{"DFLASH_BSTNXBT_ASYNC_DRAFT_EVAL":0,"DFLASH_BSTNXBT_FUSED_DRAFT_VERIFY_EVAL":1},"diagnostic_findings":{"completion_tok_s":102.99411641084343,"dflash_eval_s":9.377247747732326,"dflash_draft_s":0.015884000342339277,"dflash_verify_s":0.11168983206152916,"dflash_total_s":9.723944249912165,"dflash_acceptance_rate":0.6972201352366642}}}
{"run":1692,"commit":"cb4dd2f","metric":7.537057583103888,"metrics":{},"status":"discard","description":"Variant async=0,fused=0 further lowered eval_s but again shifted large cost into draft_s (~1.84s) with throughput still degraded (~103.03 tok/s).","timestamp":1776368866744,"segment":24,"confidence":null,"iterationTokens":1286,"asi":{"hypothesis":"Disabling both async and fused eval boundaries may reduce eval-side collapse without harming total decode runtime.","rollback_reason":"Discarding primary eval_s improvement due catastrophic metric-shift pattern: completion_tok_s remains well below baseline and total_s worsened while draft_s ballooned.","next_action_hint":"Prune fused-off style ideas for stability; next probe should target true total/runtime stabilization (e.g., split chunk tuning under telemetry) not eval-boundary accounting.","variant":{"DFLASH_BSTNXBT_ASYNC_DRAFT_EVAL":0,"DFLASH_BSTNXBT_FUSED_DRAFT_VERIFY_EVAL":0},"diagnostic_findings":{"completion_tok_s":103.02769235116091,"dflash_eval_s":7.537057583103888,"dflash_draft_s":1.8415021649561822,"dflash_verify_s":0.11850687814876437,"dflash_total_s":9.718152957968414,"dflash_acceptance_rate":0.6972201352366642}}}
{"run":1693,"commit":"cb4dd2f","metric":8.824829455465078,"metrics":{},"status":"discard","description":"Major bet: deferred hidden-state feature extraction until after acceptance and limited extraction to committed tokens to cut wasted eval work; did not improve eval_s.","timestamp":1776369006185,"segment":24,"confidence":null,"iterationTokens":7877,"asi":{"hypothesis":"Computing committed_hidden only for accepted tokens (instead of full block) should reduce eval-phase work, especially when acceptance < block length.","rollback_reason":"Primary eval_s regressed slightly versus baseline and no throughput gain was observed.","next_action_hint":"Abandon commit-count-limited extraction path; next test should target runtime-state stabilization (e.g., controlled split-path settings) rather than this micro-optimization.","files_touched":["omlx/dflash/bstnxbt_runtime.py"],"diagnostic_findings":{"completion_tok_s":107.70548891201943,"dflash_eval_s":8.824829455465078,"dflash_total_s":9.314045749953948,"dflash_acceptance_rate":0.6972201352366642,"dflash_mean_commit_tokens":10.666666666666666}}}
{"run":1694,"commit":"cb4dd2f","metric":8.86798408802133,"metrics":{},"status":"discard","description":"Major bet: reintroduced env-gated split exact-KV threshold and tested 2048 (effectively delaying exact path for 1024 lane); eval_s and throughput both regressed.","timestamp":1776369107466,"segment":24,"confidence":null,"iterationTokens":5789,"asi":{"hypothesis":"If late-tail exact SDPA path contributes to collapse, delaying activation (threshold=2048) should improve eval stability.","rollback_reason":"Primary eval_s worsened and completion throughput dropped versus baseline.","next_action_hint":"Prune high-threshold split-exact idea for 1024 lane; next experiments should target shared runtime-state factors outside this exact-path gate.","files_touched":["omlx/dflash/bstnxbt_runtime.py"],"variant":{"DFLASH_BSTNXBT_SPLIT_EXACT_KV_THRESHOLD":2048},"diagnostic_findings":{"completion_tok_s":106.66757500779602,"dflash_eval_s":8.86798408802133,"dflash_total_s":9.386621250072494,"dflash_acceptance_rate":0.6972201352366642}}}
{"run":1695,"commit":"cb4dd2f","metric":8.809180333511904,"metrics":{},"status":"discard","description":"Major bet: env-gated periodic MLX metal cache clears every 8 draft steps (12 clears/request) to mitigate runtime-state collapse; no eval or throughput benefit in high-window sample.","timestamp":1776369247631,"segment":24,"confidence":null,"iterationTokens":5747,"asi":{"hypothesis":"Periodic mx.metal.clear_cache() during decode may prevent allocator/cache-state buildup that inflates eval time in collapse windows.","rollback_reason":"Primary eval_s slightly worsened and completion_tok_s also dropped versus baseline.","next_action_hint":"Do not pursue frequent cache-clear cadence on 1024 lane; if revisited, test only rare/on-threshold clears triggered by telemetry anomalies.","files_touched":["omlx/dflash/bstnxbt_runtime.py","omlx/server.py","omlx/api/openai_models.py","autoresearch.sh"],"variant":{"DFLASH_BSTNXBT_CLEAR_CACHE_EVERY_STEPS":8},"diagnostic_findings":{"completion_tok_s":106.91184652433785,"dflash_eval_s":8.809180333511904,"dflash_total_s":9.355465541942976,"dflash_clear_cache_calls":12,"dflash_acceptance_rate":0.6972201352366642}}}
{"run":1696,"commit":"cb4dd2f","metric":8.83698366198223,"metrics":{},"status":"discard","description":"Mirror telemetry anchor remained in high-window but eval_s stayed above baseline (~8.84s).","timestamp":1776369289638,"segment":24,"confidence":null,"iterationTokens":1519,"asi":{"hypothesis":"Post-major-bet revert baseline should re-center near original high-window telemetry profile.","rollback_reason":"Primary eval_s remained slightly worse than baseline.","next_action_hint":"Continue monitoring for collapse-window transition; trigger immediate control telemetry pair once collapse appears.","diagnostic_findings":{"completion_tok_s":106.86733095303899,"dflash_eval_s":8.83698366198223,"dflash_total_s":9.355364291928709,"dflash_acceptance_rate":0.6972201352366642}}}
{"run":1697,"commit":"cb4dd2f","metric":8.85010429250542,"metrics":{},"status":"discard","description":"Mirror telemetry sample remained in stable high-window band but eval_s stayed above baseline (~8.85s).","timestamp":1776369365500,"segment":24,"confidence":null,"iterationTokens":2565,"asi":{"hypothesis":"After pruning stale knobs, unchanged baseline runs can continue monitoring for spontaneous collapse onset.","rollback_reason":"Primary eval_s worse than baseline.","next_action_hint":"Keep running mirror telemetry until collapse/recovery transition appears; then do immediate control telemetry attribution.","diagnostic_findings":{"completion_tok_s":106.8063219516601,"dflash_eval_s":8.85010429250542,"dflash_total_s":9.366050457931124,"dflash_acceptance_rate":0.6972201352366642}}}
{"run":1698,"commit":"cb4dd2f","metric":8.89667584199924,"metrics":{},"status":"discard","description":"Mirror telemetry sample drifted slightly slower (eval_s ~8.90, tok/s ~106.32) while acceptance profile stayed constant.","timestamp":1776369394118,"segment":24,"confidence":null,"iterationTokens":1122,"asi":{"hypothesis":"Stable-window drift should primarily appear as small eval_s movement with unchanged speculative counters.","rollback_reason":"Primary eval_s worse than baseline.","next_action_hint":"Continue monitoring for either renewed high-side eval_s improvement (<8.79) or collapse-window transition for attribution.","diagnostic_findings":{"completion_tok_s":106.32458669042157,"dflash_eval_s":8.89667584199924,"dflash_total_s":9.41844195802696,"dflash_acceptance_rate":0.6972201352366642}}}
{"run":1699,"commit":"cb4dd2f","metric":8.925128952367231,"metrics":{},"status":"discard","description":"Mirror telemetry sample continued slow softening (eval_s ~8.93, tok/s ~105.75) with unchanged acceptance profile.","timestamp":1776369424327,"segment":24,"confidence":null,"iterationTokens":1155,"asi":{"hypothesis":"If no structural change occurs, high-window softening should track gradual eval_s increase at fixed speculative acceptance.","rollback_reason":"Primary eval_s worse than baseline.","next_action_hint":"Continue loop; trigger immediate control parity if/when collapse onset appears to confirm shared inflation in real time.","diagnostic_findings":{"completion_tok_s":105.75467443214288,"dflash_eval_s":8.925128952367231,"dflash_total_s":9.455861749942414,"dflash_acceptance_rate":0.6972201352366642}}}
{"run":1700,"commit":"cb4dd2f","metric":15.188834410626441,"metrics":{},"status":"discard","description":"Mirror collapse-window hit immediately: eval_s rose to ~15.19s with throughput ~64.06 while acceptance profile remained unchanged.","timestamp":1776369546047,"segment":24,"confidence":null,"iterationTokens":2044,"asi":{"hypothesis":"On unchanged keep shape, collapse onset appears as eval-phase inflation rather than acceptance degradation.","rollback_reason":"Primary eval_s regressed sharply vs baseline.","next_action_hint":"Run immediate control parity telemetry in this degraded window to verify shared collapse attribution.","diagnostic_findings":{"completion_tok_s":64.06287086940834,"dflash_eval_s":15.188834410626441,"dflash_total_s":15.784432209096849,"dflash_draft_s":0.2540821237489581,"dflash_verify_s":0.12429399997927248,"dflash_acceptance_rate":0.6972201352366642,"dflash_full_accept_rate":0.4479166666666667,"dflash_draft_steps":96}}}
{"run":1701,"commit":"cb4dd2f","metric":14.376815708703361,"metrics":{},"status":"discard","description":"Immediate control telemetry in degraded window also collapsed (eval_s ~14.38, tok/s ~67.42), confirming shared collapse attribution.","timestamp":1776369591758,"segment":24,"confidence":null,"iterationTokens":1414,"asi":{"hypothesis":"If collapse is shared runtime-state inflation, control should show similarly elevated eval_s with unchanged acceptance counters.","rollback_reason":"Primary metric still far worse than baseline.","next_action_hint":"Restore mirror lane and track rebound trajectory; keep parity checks sparse outside degraded transitions.","backend":"bstnxbt_mlx","paired_mirror_eval_s":15.188834410626441,"paired_delta_eval_s":-0.8120187019230803,"paired_control_tok_s":67.41522418283684,"paired_mirror_tok_s":64.06287086940834,"dflash_acceptance_rate":0.6972201352366642,"dflash_full_accept_rate":0.4479166666666667,"dflash_draft_steps":96,"shared_collapse_confirmed":true}}
{"run":1702,"commit":"cb4dd2f","metric":12.872203627950512,"metrics":{},"status":"discard","description":"Mirror rebound sample improved from deep collapse to ~74.98 tok/s with eval_s ~12.87, still degraded vs baseline.","timestamp":1776369626185,"segment":24,"confidence":null,"iterationTokens":1330,"asi":{"hypothesis":"Post-collapse recovery should present monotonic eval_s contraction while acceptance counters remain stable.","rollback_reason":"Primary eval_s still significantly above baseline.","next_action_hint":"Continue recovery tracking until eval_s approaches high-window (~<9.5) before next structural probe.","diagnostic_findings":{"completion_tok_s":74.98312444956655,"dflash_eval_s":12.872203627950512,"dflash_total_s":13.438499916926958,"dflash_acceptance_rate":0.6972201352366642,"dflash_draft_steps":96}}}
{"run":1703,"commit":"cb4dd2f","metric":12.515818082029,"metrics":{},"status":"discard","description":"Mirror recovery continued to ~77.10 tok/s with eval_s contracting to ~12.52; acceptance profile unchanged.","timestamp":1776369658674,"segment":24,"confidence":null,"iterationTokens":1132,"asi":{"hypothesis":"Recovery branch remains driven by eval-time contraction rather than acceptance shifts.","rollback_reason":"Primary eval_s still above baseline.","next_action_hint":"Continue tracking rebound until sub-10 eval_s band returns.","diagnostic_findings":{"completion_tok_s":77.09866359833788,"dflash_eval_s":12.515818082029,"dflash_total_s":13.07005412504077,"dflash_acceptance_rate":0.6972201352366642,"dflash_draft_steps":96}}}
{"run":1704,"commit":"cb4dd2f","metric":13.579876209259965,"metrics":{},"status":"discard","description":"Mirror recovery branch oscillated back to slower band (~71.09 tok/s, eval_s ~13.58) while acceptance stayed fixed.","timestamp":1776369694302,"segment":24,"confidence":null,"iterationTokens":1097,"asi":{"hypothesis":"Degraded regime remains oscillatory with eval_s swings at near-constant speculative structure.","rollback_reason":"Primary eval_s worsened vs prior rebound samples and baseline.","next_action_hint":"Continue collapse-window monitoring; no structural conclusions from this oscillation alone.","diagnostic_findings":{"completion_tok_s":71.09320636133968,"dflash_eval_s":13.579876209259965,"dflash_total_s":14.164012958994135,"dflash_acceptance_rate":0.6972201352366642,"dflash_draft_steps":96}}}
{"run":1705,"commit":"cb4dd2f","metric":12.592472088057548,"metrics":{},"status":"discard","description":"Mirror sample rebounded again (~76.62 tok/s, eval_s ~12.59) within degraded oscillatory regime.","timestamp":1776369728689,"segment":24,"confidence":null,"iterationTokens":1147,"asi":{"hypothesis":"Degraded branch rebounds remain correlated with eval_s contraction while acceptance stays flat.","rollback_reason":"Primary eval_s remains materially above baseline.","next_action_hint":"Continue baseline loop until either high-window re-entry (eval_s near 9) or deeper collapse triggers another parity check.","diagnostic_findings":{"completion_tok_s":76.61968180449064,"dflash_eval_s":12.592472088057548,"dflash_total_s":13.146400541998446,"dflash_acceptance_rate":0.6972201352366642,"dflash_draft_steps":96}}}
{"run":1706,"commit":"cb4dd2f","metric":12.22808558435645,"metrics":{},"status":"discard","description":"Mirror rebound strengthened to ~78.95 tok/s with eval_s ~12.23; still in degraded recovery band.","timestamp":1776369763335,"segment":24,"confidence":null,"iterationTokens":1136,"asi":{"hypothesis":"Recovery trajectory should continue via gradual eval_s contraction with fixed speculative counters.","rollback_reason":"Primary eval_s still above baseline.","next_action_hint":"Continue mirror recovery tracking; defer parity until deeper collapse or near-high-window re-entry.","diagnostic_findings":{"completion_tok_s":78.95129980308754,"dflash_eval_s":12.22808558435645,"dflash_total_s":12.768091541947797,"dflash_acceptance_rate":0.6972201352366642,"dflash_draft_steps":96}}}
{"run":1707,"commit":"cb4dd2f","metric":12.39708695828449,"metrics":{},"status":"discard","description":"Mirror recovery remained range-bound (~77.81 tok/s, eval_s ~12.40) with unchanged acceptance.","timestamp":1776369796406,"segment":24,"confidence":null,"iterationTokens":1193,"asi":{"hypothesis":"Recovery branch is currently oscillating around low-12 eval band before further contraction.","rollback_reason":"Primary eval_s still above baseline.","next_action_hint":"Keep running unchanged baseline to watch for transition out of low-12 eval plateau.","diagnostic_findings":{"completion_tok_s":77.80514472511273,"dflash_eval_s":12.39708695828449,"dflash_total_s":12.950993042089976,"dflash_acceptance_rate":0.6972201352366642,"dflash_draft_steps":96}}}
{"run":1708,"commit":"cb4dd2f","metric":11.825935709173791,"metrics":{},"status":"discard","description":"Mirror recovery improved to ~81.47 tok/s with eval_s ~11.83, indicating continued contraction from collapse band.","timestamp":1776369833724,"segment":24,"confidence":null,"iterationTokens":1121,"asi":{"hypothesis":"Current degraded regime is recovering through eval_s contraction at fixed speculative behavior.","rollback_reason":"Primary eval_s still above baseline high-window level.","next_action_hint":"Continue baseline loop toward sub-10 eval_s re-entry before considering further mitigation probes.","diagnostic_findings":{"completion_tok_s":81.46680100066291,"dflash_eval_s":11.825935709173791,"dflash_total_s":12.365213084034622,"dflash_acceptance_rate":0.6972201352366642,"dflash_draft_steps":96}}}
{"run":1709,"commit":"cb4dd2f","metric":9.889904168318026,"metrics":{},"status":"discard","description":"Mirror recovery climbed into upper band (~96.55 tok/s) with eval_s ~9.89 while acceptance counters remained unchanged.","timestamp":1776369912933,"segment":24,"confidence":null,"iterationTokens":591,"asi":{"hypothesis":"Unchanged keep-shape recovery should continue via eval_s contraction at fixed speculative acceptance.","rollback_reason":"Primary metric still above baseline best (8.79s).","next_action_hint":"Continue mirror telemetry loop until either sub-9 eval_s re-entry or renewed collapse triggers immediate parity check.","diagnostic_findings":{"completion_tok_s":96.54897065873087,"dflash_eval_s":9.889904168318026,"dflash_total_s":10.410773584037088,"dflash_acceptance_rate":0.6972201352366642,"dflash_full_accept_rate":0.4479166666666667,"dflash_draft_steps":96}}}
{"run":1710,"commit":"cb4dd2f","metric":8.918748666066676,"metrics":{},"status":"discard","description":"Mirror recovered near high-window (~106.10 tok/s) but eval_s remained slightly above baseline (~8.92s).","timestamp":1776369946916,"segment":24,"confidence":null,"iterationTokens":1212,"asi":{"hypothesis":"Recovery into 100+ band should approach, but not always surpass, baseline eval_s floor under unchanged config.","rollback_reason":"Primary metric did not beat baseline best 8.79s.","next_action_hint":"Continue monitoring for either true sub-baseline eval_s improvement or another collapse transition for parity attribution.","diagnostic_findings":{"completion_tok_s":106.09860029442183,"dflash_eval_s":8.918748666066676,"dflash_total_s":9.43961850006599,"dflash_acceptance_rate":0.6972201352366642}}}
{"run":1711,"commit":"cb4dd2f","metric":9.187324918573722,"metrics":{},"status":"discard","description":"Mirror remained in post-recovery soft band (~103.21 tok/s) with eval_s ~9.19 and stable acceptance counters.","timestamp":1776369982990,"segment":24,"confidence":null,"iterationTokens":1322,"asi":{"hypothesis":"After rebound, short-term softening should primarily show as moderate eval_s increase at constant acceptance.","rollback_reason":"Primary metric above baseline best.","next_action_hint":"Continue unchanged loop; monitor for either sub-9 eval_s breakout or renewed collapse trigger.","diagnostic_findings":{"completion_tok_s":103.20542546145133,"dflash_eval_s":9.187324918573722,"dflash_total_s":9.704324375023134,"dflash_acceptance_rate":0.6972201352366642,"dflash_draft_steps":96}}}
