{"run":1141,"commit":"ba36bd1","metric":103.0088833669653,"metrics":{},"status":"discard","description":"Mirror recovery step from low-102 to low-103.","timestamp":1776314451041,"segment":23,"confidence":3.120869912459416,"iterationTokens":633,"asi":{"hypothesis":"Recovery should gradually climb from low-100 toward 105+ over successive runs.","rollback_reason":"Still below keep.","next_action_hint":"Continue mirror cadence and check control parity once mirror nears mid-104/105.","backend":"mirror_sd_mlx","context_only_draft_cache":1,"draft_sink":48,"async_draft_eval":1,"fused_draft_verify_eval":1,"delta_vs_keep":-5.294832503078953}}
{"run":1142,"commit":"ba36bd1","metric":102.159364047694,"metrics":{},"status":"discard","description":"Mirror wobble back to low-102 during recovery climb.","timestamp":1776314482811,"segment":23,"confidence":3.0873325949197477,"iterationTokens":610,"asi":{"hypothesis":"Recovery remains oscillatory around low-102/103 before stronger rebound.","rollback_reason":"Low-102 remains below keep.","next_action_hint":"Take control parity sample now to verify shared low-100 regime.","backend":"mirror_sd_mlx","context_only_draft_cache":1,"draft_sink":48,"async_draft_eval":1,"fused_draft_verify_eval":1,"delta_vs_keep":-6.144351822350254,"recovery_wobble":true}}
{"run":1143,"commit":"ba36bd1","metric":102.14483836373269,"metrics":{},"status":"discard","description":"Control parity sample during mirror low-102 wobble (mirror disabled).","timestamp":1776314521660,"segment":23,"confidence":3.040845643843844,"iterationTokens":712,"asi":{"hypothesis":"If regime is shared, control should match mirror low-102 cluster.","rollback_reason":"Control ~102.14 closely matched mirror ~102.16, confirming shared low-102 regime.","next_action_hint":"Return to mirror and continue recovery tracking toward 105+.","backend":"bstnxbt_mlx","mirror_runtime_enabled":0,"context_only_draft_cache":1,"draft_sink":48,"async_draft_eval":1,"fused_draft_verify_eval":1,"paired_mirror_tok_s":102.159364047694,"paired_delta_tok_s":0.014525683961315502,"shared_plateau":true}}
{"run":1144,"commit":"ba36bd1","metric":105.85726063880904,"metrics":{},"status":"discard","description":"Mirror rebound from shared low-102 plateau back into mid-105 band.","timestamp":1776314557179,"segment":23,"confidence":3.088702121052799,"iterationTokens":702,"asi":{"hypothesis":"Shared low-102 plateau can recover abruptly into mid/high-105.","rollback_reason":"Mid-105 still below keep 108.30.","next_action_hint":"Run immediate mirror follow-up to check whether 105+ rebound holds or spikes.","backend":"mirror_sd_mlx","context_only_draft_cache":1,"draft_sink":48,"async_draft_eval":1,"fused_draft_verify_eval":1,"delta_vs_keep":-2.446455231234962,"rebound":true}}
{"run":1145,"commit":"ba36bd1","metric":105.50224425496916,"metrics":{},"status":"discard","description":"Mirror follow-up after mid-105 rebound; high-band hold check.","timestamp":1776314590710,"segment":23,"confidence":3.124953243839703,"iterationTokens":647,"asi":{"hypothesis":"If rebound is real, mirror should remain around mid-105 or higher on immediate repeat.","rollback_reason":"Held ~105.50 but still below keep.","next_action_hint":"Take control parity sample to measure shared 105-band state before further actions.","backend":"mirror_sd_mlx","context_only_draft_cache":1,"draft_sink":48,"async_draft_eval":1,"fused_draft_verify_eval":1,"paired_prev_tok_s":105.85726063880904,"paired_delta_tok_s":-0.35501638383988104,"delta_vs_keep":-2.8014716150743393,"rebound_hold":true}}
{"run":1146,"commit":"ba36bd1","metric":106.49176780471628,"metrics":{},"status":"discard","description":"Control parity sample during mirror mid-105 rebound (mirror disabled).","timestamp":1776314632431,"segment":23,"confidence":3.131246074353464,"iterationTokens":792,"asi":{"hypothesis":"Control should be near mirror if 105-band rebound is shared.","rollback_reason":"Control ~106.49 outpaced mirror ~105.50, indicating uneven backend rebound but same general band.","next_action_hint":"Return to mirror and continue high-band sampling; wait for mirror >108 before new structural probes.","backend":"bstnxbt_mlx","mirror_runtime_enabled":0,"context_only_draft_cache":1,"draft_sink":48,"async_draft_eval":1,"fused_draft_verify_eval":1,"paired_mirror_tok_s":105.50224425496916,"paired_delta_tok_s":-0.9895235497471124,"shared_rebound":true}}
{"run":1147,"commit":"ba36bd1","metric":106.9058704005729,"metrics":{},"status":"discard","description":"Mirror follow-up after control 106.49 parity sample; mirror climbed into high-106.","timestamp":1776314665270,"segment":23,"confidence":3.13880552158065,"iterationTokens":715,"asi":{"hypothesis":"Mirror should continue catching up toward prior 108 highs as rebound strengthens.","rollback_reason":"High-106 still below keep.","next_action_hint":"Continue mirror sampling; run control parity if mirror crosses back above 107.5.","backend":"mirror_sd_mlx","context_only_draft_cache":1,"draft_sink":48,"async_draft_eval":1,"fused_draft_verify_eval":1,"delta_vs_keep":-1.3978454694705944,"rebound_strengthening":true}}
{"run":1148,"commit":"ba36bd1","metric":107.57210584340538,"metrics":{},"status":"discard","description":"Mirror sample crossed back above 107.5 during rebound.","timestamp":1776314698269,"segment":23,"confidence":3.1464015571402673,"iterationTokens":646,"asi":{"hypothesis":"Recovery has re-entered high-band and may approach prior >108 keeps.","rollback_reason":"~107.57 still below keep 108.30.","next_action_hint":"Take control parity sample now to verify shared high-band re-entry.","backend":"mirror_sd_mlx","context_only_draft_cache":1,"draft_sink":48,"async_draft_eval":1,"fused_draft_verify_eval":1,"delta_vs_keep":-0.7316100266381202,"high_band_reentry":true}}
{"run":1149,"commit":"ba36bd1","metric":107.74839696651979,"metrics":{},"status":"discard","description":"Control parity sample after mirror high-band re-entry (mirror disabled).","timestamp":1776314732631,"segment":23,"confidence":3.1572778405730446,"iterationTokens":754,"asi":{"hypothesis":"Control should also be in high-107 if rebound is shared.","rollback_reason":"Control ~107.75 matched mirror high-band re-entry but remains below mirror keep objective.","next_action_hint":"Return to mirror and continue high-band sampling for >108 repeat breakthroughs.","backend":"bstnxbt_mlx","mirror_runtime_enabled":0,"context_only_draft_cache":1,"draft_sink":48,"async_draft_eval":1,"fused_draft_verify_eval":1,"paired_mirror_tok_s":107.57210584340538,"paired_delta_tok_s":-0.17629112311441358,"shared_high_band":true}}
{"run":1150,"commit":"ba36bd1","metric":107.1900780500418,"metrics":{},"status":"discard","description":"Mirror anchor after control high-107 parity sample.","timestamp":1776314764221,"segment":23,"confidence":3.171632951168856,"iterationTokens":694,"asi":{"hypothesis":"Mirror should remain in high-107 band after shared high-band parity.","rollback_reason":"~107.19 remains below keep 108.30.","next_action_hint":"Continue mirror-only high-band sampling; seek reproducible >108 samples.","backend":"mirror_sd_mlx","context_only_draft_cache":1,"draft_sink":48,"async_draft_eval":1,"fused_draft_verify_eval":1,"paired_control_tok_s":107.74839696651979,"paired_delta_tok_s":-0.5583189164779935,"delta_vs_keep":-1.1136378200011066}}
{"run":1151,"commit":"ba36bd1","metric":107.85982477915226,"metrics":{},"status":"discard","description":"Mirror high-band sample rebounded to upper-107.","timestamp":1776314796280,"segment":23,"confidence":3.1802869178672952,"iterationTokens":757,"asi":{"hypothesis":"Mirror should continue oscillating in upper-107 with occasional >108 spikes.","rollback_reason":"Upper-107 still below keep 108.30.","next_action_hint":"Keep sampling in current high-band window; trigger parity check if mirror falls below 107.","backend":"mirror_sd_mlx","context_only_draft_cache":1,"draft_sink":48,"async_draft_eval":1,"fused_draft_verify_eval":1,"delta_vs_keep":-0.4438910908906372}}
{"run":1152,"commit":"ba36bd1","metric":104.78400685930336,"metrics":{},"status":"discard","description":"Mirror dip from upper-107 back to mid-104 within unstable high-band window.","timestamp":1776314830475,"segment":23,"confidence":3.195860137483448,"iterationTokens":629,"asi":{"hypothesis":"High-band remains jittery with intermittent downward excursions.","rollback_reason":"Mid-104 significantly below keep.","next_action_hint":"Run immediate mirror follow-up to determine if dip is transient.","backend":"mirror_sd_mlx","context_only_draft_cache":1,"draft_sink":48,"async_draft_eval":1,"fused_draft_verify_eval":1,"delta_vs_keep":-3.5197090107395335,"band_dip":true}}
{"run":1153,"commit":"ba36bd1","metric":107.0625387686366,"metrics":{},"status":"discard","description":"Mirror follow-up after mid-104 dip; partial rebound to low-107.","timestamp":1776314862471,"segment":23,"confidence":3.1963901395060423,"iterationTokens":628,"asi":{"hypothesis":"Previous dip was transient and mirror should bounce back toward high-107.","rollback_reason":"Recovered to ~107.06 but still below keep.","next_action_hint":"Take control parity sample to gauge whether both backends are in low/high-107 split.","backend":"mirror_sd_mlx","context_only_draft_cache":1,"draft_sink":48,"async_draft_eval":1,"fused_draft_verify_eval":1,"paired_prev_tok_s":104.78400685930336,"paired_delta_tok_s":2.2785319093332395,"delta_vs_keep":-1.2411761014062939,"dip_recovery":true}}
{"run":1154,"commit":"ba36bd1","metric":107.31732312372843,"metrics":{},"status":"discard","description":"Control parity sample after mirror low-107 rebound (mirror disabled).","timestamp":1776314900464,"segment":23,"confidence":3.196920317349045,"iterationTokens":813,"asi":{"hypothesis":"Control should indicate whether current regime center is low/high-107.","rollback_reason":"Control at ~107.32 slightly above mirror ~107.06; both still below mirror keep.","next_action_hint":"Return to mirror and continue high-band sampling for >108 breakthroughs.","backend":"bstnxbt_mlx","mirror_runtime_enabled":0,"context_only_draft_cache":1,"draft_sink":48,"async_draft_eval":1,"fused_draft_verify_eval":1,"paired_mirror_tok_s":107.0625387686366,"paired_delta_tok_s":-0.2547843550918269,"shared_high_band":true}}
{"run":1155,"commit":"ba36bd1","metric":107.2645253310514,"metrics":{},"status":"discard","description":"Mirror anchor after control 107.32 parity sample.","timestamp":1776314932870,"segment":23,"confidence":3.2009080678414352,"iterationTokens":743,"asi":{"hypothesis":"Mirror should remain in low/high-107 band under current combo defaults.","rollback_reason":"~107.26 remains below keep 108.30.","next_action_hint":"Continue mirror high-band sampling and await next >108 window.","backend":"mirror_sd_mlx","context_only_draft_cache":1,"draft_sink":48,"async_draft_eval":1,"fused_draft_verify_eval":1,"paired_control_tok_s":107.31732312372843,"paired_delta_tok_s":-0.05279779267703512,"delta_vs_keep":-1.0391905389920912}}
{"run":1156,"commit":"ba36bd1","metric":107.83334624875518,"metrics":{},"status":"discard","description":"Mirror continuity sample in combo-default high-107 regime.","timestamp":1776315834453,"segment":23,"confidence":3.20490577917931,"iterationTokens":743,"asi":{"hypothesis":"Post-recovery mirror should remain in high-107 cluster with combo defaults active.","rollback_reason":"Strong sample but still below keep 108.30.","next_action_hint":"Maintain high-band sampling and schedule next control parity check after another mirror datapoint.","backend":"mirror_sd_mlx","context_only_draft_cache":1,"draft_sink":48,"async_draft_eval":1,"fused_draft_verify_eval":1,"delta_vs_keep":-0.4703698708888169}}
{"run":1157,"commit":"ba36bd1","metric":107.37501694584246,"metrics":{},"status":"discard","description":"Mirror follow-up in high-band window; mild dip from prior sample.","timestamp":1776315865834,"segment":23,"confidence":3.2333897496464923,"iterationTokens":614,"asi":{"hypothesis":"High-band jitter should stay within ~107-108 under current combo defaults.","rollback_reason":"Sample dipped to ~107.38 and remains below keep.","next_action_hint":"Take control parity now to verify shared band and detect backend divergence.","backend":"mirror_sd_mlx","context_only_draft_cache":1,"draft_sink":48,"async_draft_eval":1,"fused_draft_verify_eval":1,"paired_prev_tok_s":107.83334624875518,"paired_delta_tok_s":-0.45832930291272617,"delta_vs_keep":-0.9286991738015384}}
{"run":1158,"commit":"ba36bd1","metric":108.11339706913564,"metrics":{},"status":"discard","description":"Control parity check in combo-default high-band regime (mirror disabled).","timestamp":1776315913194,"segment":23,"confidence":3.2840319614272797,"iterationTokens":771,"asi":{"hypothesis":"Control should indicate whether current high-band center is shared or mirror-lagged.","rollback_reason":"Control reached ~108.11, but parity backend is non-authoritative for active mirror objective.","next_action_hint":"Re-enable mirror runtime and sample immediately to check whether mirror follows into >108 band.","backend":"bstnxbt_mlx","mirror_runtime_enabled":0,"context_only_draft_cache":1,"draft_sink":48,"async_draft_eval":1,"fused_draft_verify_eval":1,"paired_mirror_tok_s":107.37501694584246,"paired_delta_tok_s":-0.7383801232931722,"authoritative_lane":"mirror_sd_mlx"}}
{"run":1159,"commit":"284703c","metric":108.31217302154921,"metrics":{},"status":"keep","description":"Mirror follow-up after control 108.11 parity check; new mirror best in same high-band window.","timestamp":1776315952059,"segment":23,"confidence":3.304032635758587,"iterationTokens":1106,"asi":{"hypothesis":"Mirror should catch control-side >108 highs when sampled immediately in same regime.","backend":"mirror_sd_mlx","context_only_draft_cache":1,"draft_sink":48,"async_draft_eval":1,"fused_draft_verify_eval":1,"paired_control_tok_s":108.11339706913564,"paired_delta_tok_s":0.1987759524135726,"delta_vs_keep":0.008457151505717037,"breakout_followthrough":true}}
{"run":1160,"commit":"284703c","metric":33.22147306270293,"metrics":{},"status":"discard","description":"Immediate mirror follow-up after 108.31 keep hit severe collapse.","timestamp":1776316006334,"segment":23,"confidence":3.276688348607967,"iterationTokens":705,"asi":{"hypothesis":"If >108 window is stable, immediate mirror rerun should remain high.","rollback_reason":"Catastrophic drop to ~33.22 indicates a fresh regime collapse and invalidates immediate follow-through comparison.","next_action_hint":"Run control parity sample now to determine whether collapse is shared or mirror-local.","backend":"mirror_sd_mlx","context_only_draft_cache":1,"draft_sink":48,"async_draft_eval":1,"fused_draft_verify_eval":1,"paired_keep_tok_s":108.31217302154921,"paired_delta_tok_s":-75.09069995884629,"severe_collapse":true,"window_invalidated":true}}
{"run":1161,"commit":"284703c","metric":47.47282118364476,"metrics":{},"status":"discard","description":"Control parity sample after mirror severe collapse (mirror disabled).","timestamp":1776316061857,"segment":23,"confidence":3.2212214857909744,"iterationTokens":808,"asi":{"hypothesis":"If collapse is regime-level, control should also degrade sharply.","rollback_reason":"Control also collapsed to ~47.47, confirming shared severe instability wave.","next_action_hint":"Re-enable mirror runtime and switch to recovery-only sampling until 100+ re-entry.","backend":"bstnxbt_mlx","mirror_runtime_enabled":0,"context_only_draft_cache":1,"draft_sink":48,"async_draft_eval":1,"fused_draft_verify_eval":1,"paired_mirror_tok_s":33.22147306270293,"paired_delta_tok_s":-14.25134812094183,"shared_collapse_confirmed":true,"severe_collapse":true}}
{"run":1162,"commit":"284703c","metric":50.57427713242305,"metrics":{},"status":"discard","description":"Mirror recovery anchor after shared collapse confirmation.","timestamp":1776316114571,"segment":23,"confidence":3.184311473573426,"iterationTokens":1078,"asi":{"hypothesis":"Mirror should begin recovery from severe trough in 30-50 band.","rollback_reason":"Only modest rebound to ~50.57; still deep trough.","next_action_hint":"Continue recovery-only loop; interleave control parity after mirror crosses ~70.","backend":"mirror_sd_mlx","context_only_draft_cache":1,"draft_sink":48,"async_draft_eval":1,"fused_draft_verify_eval":1,"delta_vs_keep":-57.73789588912616,"recovery_phase":true}}
{"run":1163,"commit":"284703c","metric":63.69444183867787,"metrics":{},"status":"discard","description":"Mirror recovery progression from low-50s into low-60s.","timestamp":1776316152821,"segment":23,"confidence":3.1734783911328237,"iterationTokens":623,"asi":{"hypothesis":"Post-collapse recovery should climb through 60s before 80/90 re-entry.","rollback_reason":"Low-60 still far below keep.","next_action_hint":"Continue recovery-only cadence; take control parity once mirror reaches 70+.","backend":"mirror_sd_mlx","context_only_draft_cache":1,"draft_sink":48,"async_draft_eval":1,"fused_draft_verify_eval":1,"delta_vs_keep":-44.61773118287134}}
{"run":1164,"commit":"284703c","metric":70.59301982982075,"metrics":{},"status":"discard","description":"Mirror recovery step reached low-70 band.","timestamp":1776316189411,"segment":23,"confidence":3.162718767450089,"iterationTokens":599,"asi":{"hypothesis":"Recovery should continue through 70s toward 90+ once trough clears.","rollback_reason":"Low-70 remains below keep.","next_action_hint":"Run control parity sample now to verify shared recovery pace.","backend":"mirror_sd_mlx","context_only_draft_cache":1,"draft_sink":48,"async_draft_eval":1,"fused_draft_verify_eval":1,"delta_vs_keep":-37.71915319172845,"recovery_phase":true}}
{"run":1165,"commit":"284703c","metric":78.82067363981452,"metrics":{},"status":"discard","description":"Control parity sample during mirror low-70 recovery stage (mirror disabled).","timestamp":1776316237355,"segment":23,"confidence":3.159878813742202,"iterationTokens":695,"asi":{"hypothesis":"Control should also recover through 70s if collapse is shared.","rollback_reason":"Control reached upper-70s, confirming shared staged recovery.","next_action_hint":"Return to mirror and continue climb toward 90+ and 100+ before any new probes.","backend":"bstnxbt_mlx","mirror_runtime_enabled":0,"context_only_draft_cache":1,"draft_sink":48,"async_draft_eval":1,"fused_draft_verify_eval":1,"paired_mirror_tok_s":70.59301982982075,"paired_delta_tok_s":-8.227653809993775,"shared_recovery":true}}
{"run":1166,"commit":"284703c","metric":81.78146546876846,"metrics":{},"status":"discard","description":"Mirror recovery continuation into low-80 band.","timestamp":1776316273868,"segment":23,"confidence":3.1572847382071987,"iterationTokens":697,"asi":{"hypothesis":"Recovery should progress 70s to 80s before low-90 re-entry.","rollback_reason":"Low-80 still below keep.","next_action_hint":"Continue recovery-only mirror sampling; parity check again near 90.","backend":"mirror_sd_mlx","context_only_draft_cache":1,"draft_sink":48,"async_draft_eval":1,"fused_draft_verify_eval":1,"delta_vs_keep":-26.53070755278075}}
{"run":1167,"commit":"284703c","metric":87.5158687946696,"metrics":{},"status":"discard","description":"Mirror recovery progressed into high-80 band (with warmup variance spike).","timestamp":1776316313822,"segment":23,"confidence":3.148685134521308,"iterationTokens":582,"asi":{"hypothesis":"Recovery should continue into high-80/low-90 regardless of occasional warmup outliers.","rollback_reason":"High-80 still below keep.","next_action_hint":"Take control parity sample now to verify shared high-80 recovery.","backend":"mirror_sd_mlx","context_only_draft_cache":1,"draft_sink":48,"async_draft_eval":1,"fused_draft_verify_eval":1,"warmup_s":4.145058916998096,"delta_vs_keep":-20.796304226879606}}
{"run":1168,"commit":"284703c","metric":91.97444179430695,"metrics":{},"status":"discard","description":"Control parity sample during mirror high-80 recovery phase (mirror disabled).","timestamp":1776316352061,"segment":23,"confidence":3.1313633888053434,"iterationTokens":729,"asi":{"hypothesis":"Control should similarly reach low-90 if rebound is shared.","rollback_reason":"Control at ~91.97 confirms shared continued recovery but below keep.","next_action_hint":"Re-enable mirror runtime and continue toward low-90/100 re-entry.","backend":"bstnxbt_mlx","mirror_runtime_enabled":0,"context_only_draft_cache":1,"draft_sink":48,"async_draft_eval":1,"fused_draft_verify_eval":1,"paired_mirror_tok_s":87.5158687946696,"paired_delta_tok_s":-4.45857301963735,"shared_recovery":true}}
{"run":1169,"commit":"284703c","metric":93.87710889244113,"metrics":{},"status":"discard","description":"Mirror recovery re-entered mid-90 band.","timestamp":1776316384439,"segment":23,"confidence":3.103502761898895,"iterationTokens":673,"asi":{"hypothesis":"Mirror should continue climbing through 90s toward 100+ after shared collapse.","rollback_reason":"Mid-90 still below keep.","next_action_hint":"Continue mirror recovery loop and check control again once mirror crosses 100.","backend":"mirror_sd_mlx","context_only_draft_cache":1,"draft_sink":48,"async_draft_eval":1,"fused_draft_verify_eval":1,"delta_vs_keep":-14.43506412910808,"reentry_90s":true}}
{"run":1170,"commit":"284703c","metric":94.57379466363263,"metrics":{},"status":"discard","description":"Mirror recovery continuation within mid-90 band.","timestamp":1776316416208,"segment":23,"confidence":3.0781537928418916,"iterationTokens":604,"asi":{"hypothesis":"Recovery should advance from mid-90 toward upper-90/100 shortly.","rollback_reason":"Still below keep.","next_action_hint":"Continue mirror-only recovery until 100+ re-entry, then run control parity.","backend":"mirror_sd_mlx","context_only_draft_cache":1,"draft_sink":48,"async_draft_eval":1,"fused_draft_verify_eval":1,"delta_vs_keep":-13.738378357916583}}
