{"run":926,"commit":"8b55918","metric":69.17676794406363,"metrics":{},"status":"discard","description":"Mirror recovery sample edging back toward ~70 band.","timestamp":1776301277200,"segment":23,"confidence":3.872719237556452,"iterationTokens":569,"asi":{"hypothesis":"Shared rebound should gradually move from high-60 into 70+ zone after trough.","rollback_reason":"Still far below keep despite slight improvement.","next_action_hint":"Take control parity sample to keep shared-recovery attribution current.","backend":"mirror_sd_mlx","context_only_draft_cache":1,"draft_sink":48,"delta_vs_keep":-37.683232055936365}}
{"run":927,"commit":"8b55918","metric":73.11839425052145,"metrics":{},"status":"discard","description":"Control parity sample during mirror ~69 recovery (mirror disabled).","timestamp":1776301321054,"segment":23,"confidence":3.8100938928476094,"iterationTokens":653,"asi":{"hypothesis":"Control should stay in same recovering band if slowdown remains shared.","rollback_reason":"Control recovered into low-70s but still far below keep.","next_action_hint":"Return to mirror and continue recovery bundle; defer candidate probes.","backend":"bstnxbt_mlx","mirror_runtime_enabled":0,"context_only_draft_cache":1,"draft_sink":48,"paired_mirror_tok_s":69.17676794406363,"paired_delta_tok_s":-3.941626306457821,"shared_recovery":true}}
{"run":928,"commit":"8b55918","metric":77.93403717134952,"metrics":{},"status":"discard","description":"Mirror recovery sample moving into upper-70s after low-70 parity check.","timestamp":1776301359837,"segment":23,"confidence":3.742452220952022,"iterationTokens":636,"asi":{"hypothesis":"Recovery wave should continue upward from 70s toward 80s/90s.","rollback_reason":"Upper-70 rebound still below keep.","next_action_hint":"Continue recovery-only sampling; revisit structural tests once 90+ returns.","backend":"mirror_sd_mlx","context_only_draft_cache":1,"draft_sink":48,"paired_control_tok_s":73.11839425052145,"paired_delta_tok_s":4.815642920828075,"delta_vs_keep":-28.92596282865048}}
{"run":929,"commit":"8b55918","metric":78.73176529554094,"metrics":{},"status":"discard","description":"Mirror recovery continuation sample in upper-70 band.","timestamp":1776301394598,"segment":23,"confidence":3.7327449117513933,"iterationTokens":648,"asi":{"hypothesis":"Recovery should keep drifting upward from upper-70s toward low-80s+.","rollback_reason":"Still below keep by ~28.13 tok/s.","next_action_hint":"Continue recovery bundle and interleave control check after additional rise.","backend":"mirror_sd_mlx","context_only_draft_cache":1,"draft_sink":48,"delta_vs_keep":-28.128234704459057}}
{"run":930,"commit":"8b55918","metric":78.70537144609732,"metrics":{},"status":"discard","description":"Mirror recovery sample (upper-70 plateau).","timestamp":1776301433420,"segment":23,"confidence":3.723087830613364,"iterationTokens":572,"asi":{"hypothesis":"Short-term recovery may plateau in upper-70s before next upward step.","rollback_reason":"Upper-70 plateau remains far below keep.","next_action_hint":"Take control parity sample to confirm shared plateau before further waiting.","backend":"mirror_sd_mlx","context_only_draft_cache":1,"draft_sink":48,"stability_probe":true,"delta_vs_keep":-28.15462855390268}}
{"run":931,"commit":"8b55918","metric":80.97329825407878,"metrics":{},"status":"discard","description":"Control parity sample during mirror upper-70 plateau (mirror disabled).","timestamp":1776301472744,"segment":23,"confidence":3.6901632865048635,"iterationTokens":670,"asi":{"hypothesis":"Control should remain near mirror if plateau is shared-regime behavior.","rollback_reason":"Control slightly higher (~80.97) but still far below keep.","next_action_hint":"Return to mirror; continue recovery tracking and defer candidate probes until >90.","backend":"bstnxbt_mlx","mirror_runtime_enabled":0,"context_only_draft_cache":1,"draft_sink":48,"paired_mirror_tok_s":78.70537144609732,"paired_delta_tok_s":-2.2679268079814663,"shared_recovery":true}}
{"run":932,"commit":"8b55918","metric":81.78603175219737,"metrics":{},"status":"discard","description":"Mirror recovery continuation after control ~80.97 parity check.","timestamp":1776301506625,"segment":23,"confidence":3.6591367927899827,"iterationTokens":713,"asi":{"hypothesis":"Mirror should continue gradual rebound from upper-70 plateau into low-80s.","rollback_reason":"Low-80 improvement remains far below keep.","next_action_hint":"Keep recovery-only monitoring; reassess structural tests only after 90+ re-entry.","backend":"mirror_sd_mlx","context_only_draft_cache":1,"draft_sink":48,"paired_control_tok_s":80.97329825407878,"paired_delta_tok_s":0.8127334981185914,"delta_vs_keep":-25.07396824780263}}
{"run":933,"commit":"8b55918","metric":81.58004399409117,"metrics":{},"status":"discard","description":"Mirror recovery sample confirming low-80 plateau.","timestamp":1776301542929,"segment":23,"confidence":3.623284589627073,"iterationTokens":635,"asi":{"hypothesis":"Recovery currently may be temporarily plateaued around ~81 before next upward phase.","rollback_reason":"No escape from low-80 plateau; still well below keep.","next_action_hint":"Maintain recovery sampling cadence and avoid tuning probes until plateau breaks upward.","backend":"mirror_sd_mlx","context_only_draft_cache":1,"draft_sink":48,"stability_probe":true,"delta_vs_keep":-25.27995600590883}}
{"run":934,"commit":"8b55918","metric":84.15195183751055,"metrics":{},"status":"discard","description":"Mirror recovery sample climbing from low-80 plateau.","timestamp":1776301589368,"segment":23,"confidence":3.5847248270304126,"iterationTokens":3483,"asi":{"hypothesis":"Recovery should continue from low-80 plateau toward upper-80s.","rollback_reason":"Still materially below keep at ~84.15.","next_action_hint":"Continue recovery bundle and recheck control parity at upper-80 approach.","backend":"mirror_sd_mlx","context_only_draft_cache":1,"draft_sink":48,"delta_vs_keep":-22.70804816248945}}
{"run":935,"commit":"8b55918","metric":84.13591594141818,"metrics":{},"status":"discard","description":"Mirror recovery sample confirming mid-80 shelf.","timestamp":1776301623972,"segment":23,"confidence":3.488308035297511,"iterationTokens":569,"asi":{"hypothesis":"Recovery may briefly stall around ~84 before further climb.","rollback_reason":"No further gain and still below keep.","next_action_hint":"Take control parity sample to confirm shared mid-80 shelf.","backend":"mirror_sd_mlx","context_only_draft_cache":1,"draft_sink":48,"stability_probe":true,"delta_vs_keep":-22.724084058581823}}
{"run":936,"commit":"8b55918","metric":89.78639135773624,"metrics":{},"status":"discard","description":"Control parity sample after mirror mid-80 shelf (mirror disabled).","timestamp":1776301663260,"segment":23,"confidence":3.393538079163039,"iterationTokens":652,"asi":{"hypothesis":"If shared recovery continues, control should rise toward upper-80/90 band.","rollback_reason":"Control rose to ~89.79 but still below keep.","next_action_hint":"Run mirror follow-up immediately to see if mirror joins upper-80/90 rebound.","backend":"bstnxbt_mlx","mirror_runtime_enabled":0,"context_only_draft_cache":1,"draft_sink":48,"paired_mirror_tok_s":84.13591594141818,"paired_delta_tok_s":-5.650475416318059}}
{"run":937,"commit":"8b55918","metric":90.01205131111219,"metrics":{},"status":"discard","description":"Mirror follow-up after control rebound to ~89.79 (re-entered 90+ band).","timestamp":1776301701798,"segment":23,"confidence":3.303288304974468,"iterationTokens":662,"asi":{"hypothesis":"Mirror should track control into upper-80/90 as shared recovery advances.","rollback_reason":"Recovered to ~90.01 but still below keep.","next_action_hint":"Continue recovery bundle toward 100+ before resuming structural candidates.","backend":"mirror_sd_mlx","context_only_draft_cache":1,"draft_sink":48,"paired_control_tok_s":89.78639135773624,"paired_delta_tok_s":0.22565995337594694,"delta_vs_keep":-16.84794868888781}}
{"run":938,"commit":"8b55918","metric":93.22242298079993,"metrics":{},"status":"discard","description":"Mirror recovery continuation sample climbing through low-90s.","timestamp":1776301734565,"segment":23,"confidence":3.243480444465376,"iterationTokens":671,"asi":{"hypothesis":"Shared recovery should progress from 90 into low/mid-90s before 100+ re-entry.","rollback_reason":"Still below keep by ~13.64 tok/s.","next_action_hint":"Take paired control sample to verify shared low-90 climb.","backend":"mirror_sd_mlx","context_only_draft_cache":1,"draft_sink":48,"delta_vs_keep":-13.637577019200066}}
{"run":939,"commit":"8b55918","metric":95.28483298937584,"metrics":{},"status":"discard","description":"Control parity sample during mirror low-90 climb (mirror disabled).","timestamp":1776301779824,"segment":23,"confidence":3.217482857592253,"iterationTokens":672,"asi":{"hypothesis":"Control should stay near mirror and potentially lead slightly during shared rebound.","rollback_reason":"Control climbed to ~95.28 but still below keep.","next_action_hint":"Return to mirror; continue rebound sampling toward 100+ and keep paired confirmations.","backend":"bstnxbt_mlx","mirror_runtime_enabled":0,"context_only_draft_cache":1,"draft_sink":48,"paired_mirror_tok_s":93.22242298079993,"paired_delta_tok_s":-2.062410008575913}}
{"run":940,"commit":"8b55918","metric":94.25379672923654,"metrics":{},"status":"discard","description":"Mirror follow-up after control ~95.28 parity sample.","timestamp":1776301812199,"segment":23,"confidence":3.207131163378654,"iterationTokens":632,"asi":{"hypothesis":"Mirror should remain in same low/mid-90 recovery band as control.","rollback_reason":"Mirror remained ~94.25 and below keep.","next_action_hint":"Continue recovery sampling; resume structural experiments only after 100+ re-entry.","backend":"mirror_sd_mlx","context_only_draft_cache":1,"draft_sink":48,"paired_control_tok_s":95.28483298937584,"paired_delta_tok_s":-1.0310362601392937,"delta_vs_keep":-12.606203270763457}}
{"run":941,"commit":"8b55918","metric":97.9616549710715,"metrics":{},"status":"discard","description":"Mirror recovery sample approaching 100 tok/s.","timestamp":1776301857592,"segment":23,"confidence":3.16773657560239,"iterationTokens":657,"asi":{"hypothesis":"Recovery should continue from mid-90s toward 100+ band.","rollback_reason":"Near-100 but still below keep.","next_action_hint":"Take control parity sample after next mirror/control transition to verify shared approach to 100+.","backend":"mirror_sd_mlx","context_only_draft_cache":1,"draft_sink":48,"delta_vs_keep":-8.898345028928498}}
{"run":942,"commit":"8b55918","metric":97.14725097708518,"metrics":{},"status":"discard","description":"Control parity sample as mirror approached 100 (mirror disabled).","timestamp":1776301899042,"segment":23,"confidence":3.1523213474269105,"iterationTokens":666,"asi":{"hypothesis":"Control should cluster near mirror in high-90 recovery band if rebound is shared.","rollback_reason":"Control also high-90 and below keep.","next_action_hint":"Return to mirror and monitor for 100+ re-entry before candidate probes.","backend":"bstnxbt_mlx","mirror_runtime_enabled":0,"context_only_draft_cache":1,"draft_sink":48,"paired_mirror_tok_s":97.9616549710715,"paired_delta_tok_s":0.8144039939863189}}
{"run":943,"commit":"8b55918","metric":100.61421424776196,"metrics":{},"status":"discard","description":"Mirror follow-up after control high-90 parity sample (re-entered 100+).","timestamp":1776301934190,"segment":23,"confidence":3.1043056589899876,"iterationTokens":631,"asi":{"hypothesis":"Mirror should cross back into 100+ as shared recovery advances.","rollback_reason":"100+ restored but still below keep.","next_action_hint":"Continue recovery tracking toward high-100/105 before re-attempting structural changes.","backend":"mirror_sd_mlx","context_only_draft_cache":1,"draft_sink":48,"paired_control_tok_s":97.14725097708518,"paired_delta_tok_s":3.466963270676778,"delta_vs_keep":-6.245785752238044}}
{"run":944,"commit":"8b55918","metric":98.78764693204103,"metrics":{},"status":"discard","description":"Split-chunk extension beyond prior sweep: DFLASH_BSTNXBT_SPLIT_CHUNK_SIZE=32.","timestamp":1776301976183,"segment":23,"confidence":3.0571347496403867,"iterationTokens":1068,"asi":{"hypothesis":"Larger split SDPA chunk might improve throughput in recovered high-90/100 regime.","rollback_reason":"No gain; regressed to ~98.79 and below keep.","next_action_hint":"Add split_chunk_size=32 to do-not-retry set; high chunk extension remains non-winning.","backend":"mirror_sd_mlx","context_only_draft_cache":1,"draft_sink":48,"split_chunk_size":32,"delta_vs_keep":-8.072353067958973}}
{"run":945,"commit":"8b55918","metric":102.91570889873576,"metrics":{},"status":"discard","description":"Mirror anchor after split_chunk_size=32 probe (restored keep shape).","timestamp":1776302018567,"segment":23,"confidence":3.1043056589899876,"iterationTokens":898,"asi":{"hypothesis":"Restored default chunk should return to current high-90/100+ recovery band.","rollback_reason":"Anchor remained low at ~102.92 and below keep.","next_action_hint":"Run paired control sample to check if this low-103 level is shared or mirror-local.","backend":"mirror_sd_mlx","context_only_draft_cache":1,"draft_sink":48,"stability_probe":true,"delta_vs_keep":-3.944291101264241}}
{"run":946,"commit":"8b55918","metric":97.9992622785581,"metrics":{},"status":"discard","description":"Control parity sample after mirror low-103 anchor (mirror disabled).","timestamp":1776302059620,"segment":23,"confidence":3.0571347496403867,"iterationTokens":713,"asi":{"hypothesis":"If low-103 mirror was shared, control should land in similar neighborhood.","rollback_reason":"Control dropped further to ~98.00, indicating renewed shared downward drift.","next_action_hint":"Return to mirror and continue stability monitoring before additional candidate probes.","backend":"bstnxbt_mlx","mirror_runtime_enabled":0,"context_only_draft_cache":1,"draft_sink":48,"paired_mirror_tok_s":102.91570889873576,"paired_delta_tok_s":4.916446620177665,"shared_slowdown":true}}
{"run":947,"commit":"8b55918","metric":100.26580024909289,"metrics":{},"status":"discard","description":"Mirror follow-up after control dipped to ~98.00.","timestamp":1776302093654,"segment":23,"confidence":2.987262920933009,"iterationTokens":679,"asi":{"hypothesis":"Mirror should remain near 100 band if shared slowdown is moderate.","rollback_reason":"Mirror stayed ~100.27 and below keep.","next_action_hint":"Maintain paired monitoring and watch for return to high-105 before structural retries.","backend":"mirror_sd_mlx","context_only_draft_cache":1,"draft_sink":48,"paired_control_tok_s":97.9992622785581,"paired_delta_tok_s":2.266537970534785,"delta_vs_keep":-6.594199750907113}}
{"run":948,"commit":"8b55918","metric":102.57581580938317,"metrics":{},"status":"discard","description":"Mirror stability sample climbing from ~100 toward low-103.","timestamp":1776302127986,"segment":23,"confidence":2.9201748363103017,"iterationTokens":643,"asi":{"hypothesis":"Recovery should continue upward from ~100 toward low/mid-100s.","rollback_reason":"Low-103 remains below keep.","next_action_hint":"Take control pair sample to track parity as band shifts upward.","backend":"mirror_sd_mlx","context_only_draft_cache":1,"draft_sink":48,"stability_probe":true,"delta_vs_keep":-4.284184190616829}}
{"run":949,"commit":"8b55918","metric":103.31917472960293,"metrics":{},"status":"discard","description":"Control parity sample after mirror low-103 recovery run (mirror disabled).","timestamp":1776302174859,"segment":23,"confidence":2.988966244117947,"iterationTokens":671,"asi":{"hypothesis":"Control should be close to mirror if both backends are recovering together.","rollback_reason":"Control near mirror at ~103.32, still below keep.","next_action_hint":"Return to mirror and continue tracking approach to high-105 band.","backend":"bstnxbt_mlx","mirror_runtime_enabled":0,"context_only_draft_cache":1,"draft_sink":48,"paired_mirror_tok_s":102.57581580938317,"paired_delta_tok_s":-0.7433589202197614}}
{"run":950,"commit":"8b55918","metric":103.472334241666,"metrics":{},"status":"discard","description":"Mirror follow-up after control ~103.32 parity sample.","timestamp":1776302210010,"segment":23,"confidence":3.0610769233647623,"iterationTokens":636,"asi":{"hypothesis":"Mirror should stay aligned with control in low-103 recovery band.","rollback_reason":"Mirror near control at ~103.47 but still below keep.","next_action_hint":"Keep monitoring; wait for sustained >105 before structural retries.","backend":"mirror_sd_mlx","context_only_draft_cache":1,"draft_sink":48,"paired_control_tok_s":103.31917472960293,"paired_delta_tok_s":0.15315951206306402,"delta_vs_keep":-3.387665758334004}}
{"run":951,"commit":"8b55918","metric":104.70414070089582,"metrics":{},"status":"discard","description":"Mirror recovery sample after ideas update; band rising into mid-104.","timestamp":1776302273248,"segment":23,"confidence":3.1091035680126917,"iterationTokens":1755,"asi":{"hypothesis":"Post-collapse recovery should continue from low-103 into mid-104 before high-105 retest.","rollback_reason":"Still below keep despite improvement.","next_action_hint":"Take control parity sample to verify shared move into mid-104 band.","backend":"mirror_sd_mlx","context_only_draft_cache":1,"draft_sink":48,"delta_vs_keep":-2.1558592991041845}}
{"run":952,"commit":"8b55918","metric":103.80283695264951,"metrics":{},"status":"discard","description":"Control parity sample after mirror mid-104 rebound (mirror disabled).","timestamp":1776302312603,"segment":23,"confidence":3.160787518196917,"iterationTokens":676,"asi":{"hypothesis":"Control should remain close to mirror if recovery is shared.","rollback_reason":"Control slightly below mirror at ~103.80 and still below keep.","next_action_hint":"Return to mirror and continue monitoring in low/mid-104 band.","backend":"bstnxbt_mlx","mirror_runtime_enabled":0,"context_only_draft_cache":1,"draft_sink":48,"paired_mirror_tok_s":104.70414070089582,"paired_delta_tok_s":0.9013037482463071}}
{"run":953,"commit":"8b55918","metric":105.08930404049816,"metrics":{},"status":"discard","description":"Mirror follow-up after control low-104 parity sample (back to low-105).","timestamp":1776302348138,"segment":23,"confidence":3.1779550159407783,"iterationTokens":637,"asi":{"hypothesis":"Mirror should recover toward low-105 as rebound stabilizes.","rollback_reason":"Low-105 is still below keep.","next_action_hint":"Continue paired checks and only escalate candidate probing on sustained high-105/106 samples.","backend":"mirror_sd_mlx","context_only_draft_cache":1,"draft_sink":48,"paired_control_tok_s":103.80283695264951,"paired_delta_tok_s":1.2864670878486546,"delta_vs_keep":-1.7706959595018374}}
{"run":954,"commit":"8b55918","metric":103.33692923503254,"metrics":{},"status":"discard","description":"Split-chunk high extension probe: DFLASH_BSTNXBT_SPLIT_CHUNK_SIZE=30.","timestamp":1776302386476,"segment":23,"confidence":3.1953100191572137,"iterationTokens":770,"asi":{"hypothesis":"Chunk size 30 might outperform both 28 and 32 in current recovery regime.","rollback_reason":"No gain; ~103.34 below keep and below nearby baseline samples.","next_action_hint":"Add split_chunk_size=30 to do-not-retry set; high chunk extensions continue to underperform.","backend":"mirror_sd_mlx","context_only_draft_cache":1,"draft_sink":48,"split_chunk_size":30,"delta_vs_keep":-3.523070764967461}}
{"run":955,"commit":"8b55918","metric":104.1487887872008,"metrics":{},"status":"discard","description":"Mirror anchor after split_chunk_size=30 probe (restored keep shape).","timestamp":1776302429708,"segment":23,"confidence":3.2082240899411096,"iterationTokens":871,"asi":{"hypothesis":"Restored default chunk should return to low/mid-104+ band after high-chunk probe.","rollback_reason":"Anchor ~104.15 remains below keep.","next_action_hint":"Take paired control sample to maintain parity mapping before next experiment.","backend":"mirror_sd_mlx","context_only_draft_cache":1,"draft_sink":48,"stability_probe":true,"delta_vs_keep":-2.711211212799195}}
{"run":956,"commit":"8b55918","metric":104.70670083866081,"metrics":{},"status":"discard","description":"Control parity sample after mirror 104.15 anchor (mirror disabled).","timestamp":1776302469345,"segment":23,"confidence":3.220770596219739,"iterationTokens":697,"asi":{"hypothesis":"Control should remain near mirror in low/mid-104 band if recovery has plateaued.","rollback_reason":"Control slightly above mirror at ~104.71 but still below keep.","next_action_hint":"Return to mirror; continue monitoring and only trust sustained >105.5 before structural retries.","backend":"bstnxbt_mlx","mirror_runtime_enabled":0,"context_only_draft_cache":1,"draft_sink":48,"paired_mirror_tok_s":104.1487887872008,"paired_delta_tok_s":-0.5579120514600187}}
{"run":957,"commit":"8b55918","metric":103.64943259086338,"metrics":{},"status":"discard","description":"Mirror follow-up after control 104.71 parity sample.","timestamp":1776302503308,"segment":23,"confidence":3.24206084339608,"iterationTokens":662,"asi":{"hypothesis":"Mirror should remain near control in low/mid-104 plateau.","rollback_reason":"Mirror dipped to ~103.65 and remains below keep.","next_action_hint":"Current plateau unstable around 103.6-104.7; continue paired monitoring before new code changes.","backend":"mirror_sd_mlx","context_only_draft_cache":1,"draft_sink":48,"paired_control_tok_s":104.70670083866081,"paired_delta_tok_s":-1.0572682477974333,"delta_vs_keep":-3.210567409136624}}
