{"run":1847,"commit":"b5b72c1","metric":9.021340702893212,"metrics":{},"status":"discard","description":"Stability block run 4/10: low-9 soft-band (~104.49 tok/s, eval_s ~9.021), still without watchdog spike or safe-mode activation.","timestamp":1776378662513,"segment":24,"confidence":0.08424847965001654,"iterationTokens":1457,"asi":{"hypothesis":"Current slowdown remains below collapse-threshold patterns.","rollback_reason":"Primary metric above best floor.","next_action_hint":"Continue block; trigger control parity only if hard transition appears.","stability_block":{"run_index":4,"run_count_target":10,"completion_tok_s":104.4904867504494,"dflash_eval_s":9.021340702893212,"safe_mode_activations":0,"spike_events":0,"severe_spike_events":0}}}
{"run":1848,"commit":"b5b72c1","metric":15.965356753906235,"metrics":{},"status":"discard","description":"Stability block run 5/10 hit hard collapse (~50.93 tok/s, eval_s ~15.97); v2 watchdog triggered safe mode at step 11 with severe spikes=3 and one cache clear.","timestamp":1776378699835,"segment":24,"confidence":0.07996457662640512,"iterationTokens":1454,"asi":{"hypothesis":"During collapse transitions, v2 should fire safe mode via severe-step path and emit clear activation telemetry.","rollback_reason":"Primary metric far above best floor despite activation.","next_action_hint":"Run immediate control parity check (DFLASH_MIRROR_SD_RUNTIME=0) to confirm shared vs mirror-specific collapse attribution.","stability_block":{"run_index":5,"run_count_target":10,"completion_tok_s":50.92536227860094,"dflash_eval_s":15.965356753906235,"safe_mode_activations":1,"safe_mode_step":11,"spike_events":3,"severe_spike_events":3,"clear_cache_calls":1}}}
{"run":1849,"commit":"b5b72c1","metric":27.8839633326279,"metrics":{},"status":"discard","description":"Transition-triggered control parity check: control lane also hard-collapsed (~29.36 tok/s, eval_s ~27.88), confirming shared instability; watchdog activated at step 34 with severe spikes=70.","timestamp":1776378751263,"segment":24,"confidence":0.07620756730724663,"iterationTokens":1749,"asi":{"hypothesis":"If collapse is shared runtime-state behavior, immediate control parity should also degrade strongly.","rollback_reason":"Parity diagnostic run; primary metric far above best and non-authoritative lane.","next_action_hint":"Resume mirror authoritative stability block after parity confirmation.","parity_check":{"lane":"control_DFLASH_MIRROR_SD_RUNTIME=0","completion_tok_s":29.36495889037381,"dflash_eval_s":27.8839633326279,"safe_mode_activations":1,"safe_mode_step":34,"spike_events":70,"severe_spike_events":70}}}
{"run":1850,"commit":"b5b72c1","metric":31.01414212421514,"metrics":{},"status":"discard","description":"Stability block run 6/10: deeper collapse persisted (~26.06 tok/s, eval_s ~31.01); watchdog activated early (step 7) with severe spikes=101.","timestamp":1776378807530,"segment":24,"confidence":0.07598895996857626,"iterationTokens":1524,"asi":{"hypothesis":"In sustained degraded regime, v2 watchdog repeatedly enters safe mode early but may not be sufficient alone to restore performance.","rollback_reason":"Primary metric catastrophically above best floor.","next_action_hint":"Continue block to observe recovery ladder and collapse duration under active safeguards.","stability_block":{"run_index":6,"run_count_target":10,"completion_tok_s":26.064683125610767,"dflash_eval_s":31.01414212421514,"safe_mode_activations":1,"safe_mode_step":7,"spike_events":101,"severe_spike_events":101,"clear_cache_calls":1}}}
{"run":1851,"commit":"b5b72c1","metric":18.818990125670098,"metrics":{},"status":"discard","description":"Stability block run 7/10: partial rebound from deep trough but still collapsed (~43.90 tok/s, eval_s ~18.82); safe mode activated at step 29.","timestamp":1776378846430,"segment":24,"confidence":0.07577160322680522,"iterationTokens":1557,"asi":{"hypothesis":"Post-collapse regime may recover in stages even with watchdog active.","rollback_reason":"Primary metric still far above best floor.","next_action_hint":"Continue block to measure rebound trajectory and whether safe-mode activation frequency drops.","stability_block":{"run_index":7,"run_count_target":10,"completion_tok_s":43.89892582476586,"dflash_eval_s":18.818990125670098,"safe_mode_activations":1,"safe_mode_step":29,"spike_events":33,"severe_spike_events":33}}}
{"run":1852,"commit":"b5b72c1","metric":14.734374626888894,"metrics":{},"status":"discard","description":"Stability block run 8/10: continued rebound (~57.67 tok/s, eval_s ~14.73) but still degraded; safe mode activated later (step 49) with reduced spike count.","timestamp":1776378878233,"segment":24,"confidence":0.07516855876736243,"iterationTokens":1478,"asi":{"hypothesis":"As regime recovers, safe-mode trigger shifts later and spike density drops.","rollback_reason":"Primary metric remains above best floor.","next_action_hint":"Continue block to determine if rebound reaches soft/high band without activation.","stability_block":{"run_index":8,"run_count_target":10,"completion_tok_s":57.6749226524145,"dflash_eval_s":14.734374626888894,"safe_mode_activations":1,"safe_mode_step":49,"spike_events":10,"severe_spike_events":10}}}
{"run":1853,"commit":"b5b72c1","metric":12.98804241756443,"metrics":{},"status":"discard","description":"Stability block run 9/10: rebound continued (~66.38 tok/s, eval_s ~12.99); safe-mode activation moved late (step 56) with only 2 severe spikes.","timestamp":1776378907917,"segment":24,"confidence":0.07457503743191647,"iterationTokens":1497,"asi":{"hypothesis":"Recovery phase should show declining spike counts and later trigger point before safe-mode ceases.","rollback_reason":"Primary metric still above best floor.","next_action_hint":"Run final block sample to see if regime exits safe-mode activation entirely.","stability_block":{"run_index":9,"run_count_target":10,"completion_tok_s":66.37543758957746,"dflash_eval_s":12.98804241756443,"safe_mode_activations":1,"safe_mode_step":56,"spike_events":2,"severe_spike_events":2}}}
{"run":1854,"commit":"b5b72c1","metric":11.42248287925031,"metrics":{},"status":"discard","description":"Stability block run 10/10: rebound reached ~80.38 tok/s (eval_s ~11.42) but still degraded; safe mode activated very late (step 82).","timestamp":1776378937106,"segment":24,"confidence":0.07350514584658539,"iterationTokens":1492,"asi":{"hypothesis":"Late-stage recovery should continue to push safe-mode activation toward request tail before returning to no-activation high window.","rollback_reason":"Primary metric still above best floor.","next_action_hint":"Continue post-block loop to confirm full recovery to soft/high band and eventual zero-activation runs.","stability_block":{"run_index":10,"run_count_target":10,"completion_tok_s":80.38224189511473,"dflash_eval_s":11.42248287925031,"safe_mode_activations":1,"safe_mode_step":82,"spike_events":2,"severe_spike_events":2}}}
{"run":1855,"commit":"b5b72c1","metric":9.975053377100267,"metrics":{},"status":"discard","description":"Post-block follow-up: regime rebounded into sub-10 eval (~95.80 tok/s, eval_s ~9.98) and safe mode no longer activated.","timestamp":1776378964790,"segment":24,"confidence":0.07246551849758141,"iterationTokens":1636,"asi":{"hypothesis":"Collapse episode is unwinding; safe-mode activation should disappear before throughput fully re-enters high window.","rollback_reason":"Primary metric above best floor.","next_action_hint":"Continue honest loop to confirm return to ~8.8 high-soft band.","post_block_followup":{"completion_tok_s":95.79923997181987,"dflash_eval_s":9.975053377100267,"safe_mode_activations":0,"spike_events":0}}}
{"run":1856,"commit":"b5b72c1","metric":11.377242080168799,"metrics":{},"status":"discard","description":"Post-block follow-up: oscillatory rebound (~84.65 tok/s, eval_s ~11.38) with watchdog still inactive (no spikes/safe-mode).","timestamp":1776378991322,"segment":24,"confidence":0.0717380338835806,"iterationTokens":1480,"asi":{"hypothesis":"Recovery phase can oscillate in mid-band even after safe-mode triggers cease.","rollback_reason":"Primary metric above best floor.","next_action_hint":"Continue honest loop; wait for renewed high-soft re-entry or next hard transition.","post_block_followup":{"completion_tok_s":84.65036711755492,"dflash_eval_s":11.377242080168799,"safe_mode_activations":0,"spike_events":0}}}
{"run":1857,"commit":"b5b72c1","metric":13.786532418685965,"metrics":{},"status":"discard","description":"Post-block run: still degraded (~70.40 tok/s, eval_s ~13.79) but watchdog did not trigger (max eval-step ~0.189s below severe threshold 0.20).","timestamp":1776379061225,"segment":24,"confidence":0.07140759146611819,"iterationTokens":3444,"asi":{"hypothesis":"Current severe threshold may be too high to catch medium-band degradations that avoid sharp spikes.","rollback_reason":"Primary metric above best floor.","next_action_hint":"Try a small-threshold A/B (e.g., DFLASH_BSTNXBT_COLLAPSE_SEVERE_EVAL_STEP_S=0.18) to test earlier mitigation in medium-band collapse states.","diagnostic_findings":{"completion_tok_s":70.40118160149942,"dflash_eval_s":13.786532418685965,"safe_mode_activations":0,"spike_events":0,"severe_spike_events":0,"eval_step_max_s":0.1892289590323344}}}
{"run":1858,"commit":"b5b72c1","metric":11.746920251753181,"metrics":{},"status":"discard","description":"Env A/B (`severe_eval_step_s=0.18`) in rebound regime: still mid-band (~82.04 tok/s, eval_s ~11.75) with no spikes/activations; trigger path remained idle.","timestamp":1776379102780,"segment":24,"confidence":0.0705297899441268,"iterationTokens":2274,"asi":{"hypothesis":"Lowering severe threshold slightly may catch medium-band collapse states that miss current trigger.","rollback_reason":"Primary metric above best floor.","next_action_hint":"Need transition-window A/B (near collapse onset) to evaluate threshold sensitivity; current sample stayed below trigger envelope.","ab_test":{"variant":"DFLASH_BSTNXBT_COLLAPSE_SEVERE_EVAL_STEP_S=0.18","completion_tok_s":82.04047287706113,"dflash_eval_s":11.746920251753181,"safe_mode_activations":0,"eval_step_max_s":0.13475829199887812}}}
{"run":1859,"commit":"b5b72c1","metric":10.054438545252196,"metrics":{},"status":"discard","description":"Control after threshold A/B: default threshold run improved to ~95.14 tok/s (eval_s ~10.05) with no watchdog activation; no evidence yet that 0.18 threshold helps in rebound state.","timestamp":1776379129499,"segment":24,"confidence":0.06967330768125979,"iterationTokens":1607,"asi":{"hypothesis":"Slightly lower severe threshold may only matter near true transition edges, not in smooth rebound windows.","rollback_reason":"Primary metric above best floor.","next_action_hint":"Reserve threshold tuning for edge-triggered A/B when step-latency maxima approach threshold.","ab_test_control":{"variant":"default_severe_eval_step_s=0.20","completion_tok_s":95.14192721702038,"dflash_eval_s":10.054438545252196,"safe_mode_activations":0}}}
{"run":1860,"commit":"b5b72c1","metric":10.678907669032924,"metrics":{},"status":"discard","description":"Rebound run stayed mid-band (~89.87 tok/s, eval_s ~10.68) with zero spikes/safe-mode activation; still above best floor.","timestamp":1776379155347,"segment":24,"confidence":0.06884634925799621,"iterationTokens":1531,"asi":{"hypothesis":"Current phase is non-triggered mid-band recovery, not acute collapse.","rollback_reason":"Primary metric above best floor.","next_action_hint":"Continue honest loop until either high-soft re-entry (~8.8 eval) or new hard transition for parity check.","diagnostic_findings":{"completion_tok_s":89.87012319080316,"dflash_eval_s":10.678907669032924,"safe_mode_activations":0,"eval_step_max_s":0.11622687499038875}}}
{"run":1861,"commit":"b5b72c1","metric":8.993256127461791,"metrics":{},"status":"discard","description":"Aggressive watchdog defaults A/B (earlier trigger thresholds + stronger safe block=10): healthy-window sample stayed stable with no activations but primary eval_s was above best.","timestamp":1776384642309,"segment":24,"confidence":0.06967330768125979,"iterationTokens":16852,"asi":{"hypothesis":"Earlier detection and stronger safe mode may cut collapse depth while staying neutral in stable windows.","rollback_reason":"Primary metric above current best floor.","next_action_hint":"Continue runs until collapse transition to evaluate whether new defaults reduce trough depth/recovery time.","ab_test":{"watchdog_defaults":{"spike_ratio":1.6,"warmup_steps":4,"consecutive_spikes":2,"severe_eval_step_s":0.18,"severe_consecutive":1,"safe_block_tokens_default":10},"completion_tok_s":105.24206593746992,"dflash_eval_s":8.993256127461791,"safe_mode_activations":0}}}
{"run":1862,"commit":"b5b72c1","metric":8.808537411503494,"metrics":{},"status":"discard","description":"Returned to high-soft window (~107.21 tok/s, eval_s ~8.809) with watchdog idle and stable acceptance.","timestamp":1776384677202,"segment":24,"confidence":0.0705297899441268,"iterationTokens":2100,"asi":{"hypothesis":"Current regime has re-entered healthy lane after prior collapse ladder.","rollback_reason":"Primary metric above best floor.","next_action_hint":"Keep looping unchanged; only branch to transition A/B when hard degradation reappears.","diagnostic_findings":{"completion_tok_s":107.20763247169612,"dflash_eval_s":8.808537411503494,"safe_mode_activations":0,"spike_events":0}}}
{"run":1863,"commit":"b5b72c1","metric":9.192657290492207,"metrics":{},"status":"discard","description":"Soft-band drift (~102.82 tok/s, eval_s ~9.19) with no collapse spikes; watchdog remained inactive.","timestamp":1776384705463,"segment":24,"confidence":0.07140759146611819,"iterationTokens":1534,"asi":{"hypothesis":"Current slowdown is gradual drift, not a sharp collapse transition.","rollback_reason":"Primary metric above best floor.","next_action_hint":"Continue unchanged loop; transition A/B only when hard collapse appears.","diagnostic_findings":{"completion_tok_s":102.82052566807565,"dflash_eval_s":9.192657290492207,"safe_mode_activations":0,"eval_step_max_s":0.09847074991557747}}}
{"run":1864,"commit":"b5b72c1","metric":20.29257295874413,"metrics":{},"status":"discard","description":"Hard collapse reappeared (~38.79 tok/s, eval_s ~20.29); watchdog activated early at step 7 but trough remained deep.","timestamp":1776384748804,"segment":24,"confidence":0.0705297899441268,"iterationTokens":1441,"asi":{"hypothesis":"Current safe mode catches collapse onset but mitigation strength is still insufficient to prevent severe slowdown.","rollback_reason":"Primary metric catastrophically above best floor.","next_action_hint":"Run immediate control parity check to confirm shared attribution, then do edge A/B with stronger thresholds/block clamp.","diagnostic_findings":{"completion_tok_s":38.78549993206322,"dflash_eval_s":20.29257295874413,"safe_mode_activations":1,"safe_mode_step":7,"spike_events":29,"severe_spike_events":29}}}
{"run":1865,"commit":"b5b72c1","metric":28.902637628139928,"metrics":{},"status":"discard","description":"Immediate control parity check also hard-collapsed (~27.88 tok/s, eval_s ~28.90), confirming shared instability in this transition window.","timestamp":1776384801598,"segment":24,"confidence":0.06967330768125979,"iterationTokens":1526,"asi":{"hypothesis":"This collapse is shared runtime behavior, not mirror-only.","rollback_reason":"Parity diagnostic (non-authoritative lane) and metric far above best.","next_action_hint":"Run edge-window mitigation A/B in mirror lane: stricter collapse env (safe block 10 + lower severe threshold) right after this collapse.","parity_check":{"lane":"control_DFLASH_MIRROR_SD_RUNTIME=0","completion_tok_s":27.878952641650162,"dflash_eval_s":28.902637628139928,"safe_mode_activations":1,"safe_mode_step":26,"severe_spike_events":80}}}
{"run":1866,"commit":"b5b72c1","metric":44.73912358551752,"metrics":{},"status":"discard","description":"Edge-window strict mitigation A/B catastrophically worsened collapse (~17.66 tok/s, eval_s ~44.74): watchdog fired immediately at step 1 and stayed in very small-block regime.","timestamp":1776384882770,"segment":24,"confidence":0.06884634925799621,"iterationTokens":1648,"asi":{"hypothesis":"Overly aggressive thresholds and small safe block could prevent deep collapse.","rollback_reason":"Catastrophic primary regression; immediate safe-mode from step 1 increased total work and worsened runtime.","next_action_hint":"Do not use always-on aggressive thresholds. Rebound with default watchdog and consider gentler two-stage safe mode only after confirmed collapse.","ab_test":{"variant":"safe_block=10,severe=0.18,severe_consecutive=1,spike_ratio=1.6,warmup=4,consecutive=2","completion_tok_s":17.660428382901838,"dflash_eval_s":44.73912358551752,"safe_mode_step":1,"block_tokens_mean":9.991803278688524}}}
{"run":1867,"commit":"b5b72c1","metric":22.84502945537679,"metrics":{},"status":"discard","description":"Recovery check after failed strict A/B: still hard-collapsed (~36.00 tok/s, eval_s ~22.85) under default watchdog with activation at step 24.","timestamp":1776384926881,"segment":24,"confidence":0.0684400835674096,"iterationTokens":1552,"asi":{"hypothesis":"Strict A/B did not help; system remained in degraded shared regime afterward.","rollback_reason":"Primary metric remains catastrophically above best.","next_action_hint":"Keep default settings during rebound; avoid aggressive always-on collapse thresholds.","diagnostic_findings":{"completion_tok_s":36.00499013652625,"dflash_eval_s":22.84502945537679,"safe_mode_activations":1,"safe_mode_step":24,"severe_spike_events":82}}}
{"run":1868,"commit":"b5b72c1","metric":13.329184741480276,"metrics":{},"status":"discard","description":"Rebound stage improved from deep trough (~66.18 tok/s, eval_s ~13.33) with safe mode now activating late (step 70), indicating recovery ladder progression.","timestamp":1776384973275,"segment":24,"confidence":0.06797789585409442,"iterationTokens":2235,"asi":{"hypothesis":"After severe shared collapse, recovery should push activation later before it disappears.","rollback_reason":"Primary metric still above best floor.","next_action_hint":"Continue default loop until safe-mode activations cease and high-soft band returns.","diagnostic_findings":{"completion_tok_s":66.1781652070871,"dflash_eval_s":13.329184741480276,"safe_mode_step":70,"severe_spike_events":10}}}
{"run":1869,"commit":"b5b72c1","metric":15.688299707369879,"metrics":{},"status":"discard","description":"Recovery remained unstable (~54.70 tok/s, eval_s ~15.69); safe mode still activated (step 53) after partial rebound.","timestamp":1776385007270,"segment":24,"confidence":0.06752190873412309,"iterationTokens":1469,"asi":{"hypothesis":"Current collapse episode is still active and can whipsaw during rebound.","rollback_reason":"Primary metric above best floor.","next_action_hint":"Continue unchanged mirror loop and wait for activation-free soft/high re-entry before further tuning attempts.","diagnostic_findings":{"completion_tok_s":54.69789835275152,"dflash_eval_s":15.688299707369879,"safe_mode_step":53,"severe_spike_events":15}}}
{"run":1870,"commit":"b5b72c1","metric":8.851120166364126,"metrics":{},"status":"discard","description":"Mirror loop resumed into healthy high-soft window (~107.27 tok/s, eval_s ~8.851); watchdog remained inactive.","timestamp":1776385459810,"segment":24,"confidence":0.06797789585409442,"iterationTokens":1469,"asi":{"hypothesis":"Post-collapse recovery can return quickly to high-soft band without safe-mode activation.","rollback_reason":"Primary metric above current best floor.","next_action_hint":"Continue unchanged honest loop and monitor for next hard transition.","diagnostic_findings":{"completion_tok_s":107.2720844206253,"dflash_eval_s":8.851120166364126,"safe_mode_activations":0,"spike_events":0}}}
{"run":1871,"commit":"c50119f","metric":8.73278895020485,"metrics":{},"status":"keep","description":"Unchanged mirror loop hit a new telemetry best in the current regime (~108.59 tok/s, eval_s ~8.733) with watchdog idle and stable acceptance.","timestamp":1776385488576,"segment":24,"confidence":0.08450874616855311,"iterationTokens":1448,"asi":{"hypothesis":"After rebound, unchanged defaults can re-enter the high window and occasionally beat prior eval-time floor.","diagnostic_findings":{"completion_tok_s":108.59052406755991,"dflash_eval_s":8.73278895020485,"dflash_total_s":9.241260041948408,"safe_mode_activations":0,"spike_events":0},"next_action_hint":"Continue unchanged loop to test whether this lower eval floor repeats before trying new mitigation code."}}
{"run":1872,"commit":"c50119f","metric":8.756208967184648,"metrics":{},"status":"discard","description":"Confirmation run stayed in high window (~108.42 tok/s, eval_s ~8.756) with no collapse activation, but above new best floor.","timestamp":1776385513623,"segment":24,"confidence":0.08514933093600384,"iterationTokens":1760,"asi":{"hypothesis":"The new low eval floor can recur near-best in stable windows.","rollback_reason":"Primary metric above current best.","next_action_hint":"Continue unchanged loop for confidence accumulation and transition capture.","diagnostic_findings":{"completion_tok_s":108.4220540778896,"dflash_eval_s":8.756208967184648,"safe_mode_activations":0}}}
