{"run":2369,"commit":"828f148","metric":98.90279987457583,"metrics":{},"status":"discard","description":"Matched native DDTree parity in the same high-window regime landed at ~98.9 tok/s with tree_build ~2.03s, keeping a ~9.6 tok/s gap vs control.","timestamp":1776476269475,"segment":25,"confidence":4.146645624712237,"iterationTokens":4165,"asi":{"hypothesis":"In a stable high control window, native DDTree should reveal its true remaining overhead gap.","rollback_reason":"No code changes; this run is a parity measurement and remains below control lane leader.","next_action_hint":"Test a new DDTree runtime toggle (verify bind mode) in this stable window to probe tree-verify overhead.","diagnostic_findings":{"completion_tok_s":98.90279987457583,"dflash_eval_s":10.347623792,"dflash_ddtree_tree_build_s":2.026398339,"dflash_ddtree_avg_acceptance":9.941747572815533}}}
{"run":2370,"commit":"828f148","metric":98.80701743609798,"metrics":{},"status":"discard","description":"DDTree verify bind-mode probe (DFLASH_DDTREE_NATIVE_VERIFY_BIND_MODE=all) was essentially flat/slightly worse than default target_only in matched high window.","timestamp":1776476300615,"segment":25,"confidence":3.9828575505742463,"iterationTokens":1812,"asi":{"hypothesis":"Binding all verify helpers to oMLX BST implementations might reduce native DDTree verify overhead and improve tok/s.","rollback_reason":"Primary metric showed no improvement versus immediate default-mode baseline; tree-build/verify timings were effectively unchanged.","next_action_hint":"Do not prioritize verify bind-mode=all for this lane; consider one quick model_only spot-check only if in stable high window.","diagnostic_findings":{"completion_tok_s":98.80701743609798,"dflash_eval_s":10.357563791999999,"dflash_ddtree_tree_build_s":2.027515501,"dflash_ddtree_tree_verify_s":0.135855706}}}
{"run":2371,"commit":"828f148","metric":98.69970408376939,"metrics":{},"status":"discard","description":"DDTree verify bind-mode=model_only also stayed flat/slightly worse than default target_only (~98.7 tok/s), with no tree-build/verify timing benefit.","timestamp":1776476328565,"segment":25,"confidence":3.8867192958168073,"iterationTokens":1756,"asi":{"hypothesis":"A lighter bind set (model_only) might outperform bind-mode=all and reduce verify overhead.","rollback_reason":"Primary metric did not improve and timing breakdown was effectively unchanged from baseline.","next_action_hint":"Prune non-default verify bind modes (all/model_only) for this lane; keep default target_only.","diagnostic_findings":{"completion_tok_s":98.69970408376939,"dflash_eval_s":10.368966792,"dflash_ddtree_tree_build_s":2.027547666,"dflash_ddtree_tree_verify_s":0.136900959}}}
{"run":2372,"commit":"828f148","metric":103.41553060237194,"metrics":{},"status":"discard","description":"Unexpected DDTree uplift with budget=13 (~103.4 tok/s, tree_build ~1.93s, cycles 98, avg_acceptance ~10.45) versus recent budget-12 ~99 tok/s; treat as promising but unconfirmed.","timestamp":1776476416519,"segment":25,"confidence":4.479408670652613,"iterationTokens":3508,"asi":{"hypothesis":"DDTree budget 13 might improve token throughput by reducing cycle count while keeping tree-build overhead manageable.","rollback_reason":"No code change yet and result needs immediate replication/control parity before promoting as a lane update.","next_action_hint":"Run immediate budget-13 replication, then matched budget-12 and no-DDTree control checks in the same window to confirm robustness.","diagnostic_findings":{"completion_tok_s":103.41553060237194,"dflash_eval_s":9.895693625,"dflash_ddtree_tree_build_s":1.92652892,"dflash_ddtree_cycles_completed":98,"dflash_ddtree_avg_acceptance":10.448979591836734}}}
{"run":2373,"commit":"828f148","metric":103.39232855254754,"metrics":{},"status":"discard","description":"Budget-13 DDTree replication confirmed uplift (~103.4 tok/s) with consistent lower tree_build (~1.93s), fewer cycles (98), and higher avg_acceptance (~10.45).","timestamp":1776476447459,"segment":25,"confidence":4.955714521039307,"iterationTokens":3065,"asi":{"hypothesis":"If budget-13 uplift is real, a second run should reproduce the same acceptance/cycle/tree-build profile.","rollback_reason":"Still env-only tuning without code change; need matched budget-12 and control checks before promoting any default update.","next_action_hint":"Run immediate budget-12 back-check in same window, then control parity to measure remaining gap.","diagnostic_findings":{"completion_tok_s":103.39232855254754,"dflash_eval_s":9.898053583000001,"dflash_ddtree_tree_build_s":1.927887338,"dflash_ddtree_cycles_completed":98,"dflash_ddtree_avg_acceptance":10.448979591836734}}}
{"run":2374,"commit":"828f148","metric":98.76522014590178,"metrics":{},"status":"discard","description":"Immediate budget-12 back-check stayed at ~98.8 tok/s, confirming a large matched gap versus budget-13 (~103.4 tok/s) in this window.","timestamp":1776476475599,"segment":25,"confidence":5.3520699489710255,"iterationTokens":1799,"asi":{"hypothesis":"If budget-13 uplift is causal, reverting to budget 12 should restore prior ~99 tok/s profile with higher tree-build and more cycles.","rollback_reason":"Variant under test (budget 12) underperformed matched budget-13 and this is env-only characterization.","next_action_hint":"Run immediate no-DDTree control parity, then consider promoting DDTree default budget from 12→13 via code change behind current lane assumptions.","diagnostic_findings":{"completion_tok_s":98.76522014590178,"dflash_eval_s":10.362343292,"dflash_ddtree_tree_build_s":2.029336798,"dflash_ddtree_cycles_completed":103,"dflash_ddtree_avg_acceptance":9.941747572815533}}}
{"run":2375,"commit":"828f148","metric":108.59791322205308,"metrics":{},"status":"discard","description":"Matched no-DDTree control parity remained high (~108.6 tok/s), so budget-13 DDTree narrows but does not close the control gap in this window.","timestamp":1776476504108,"segment":25,"confidence":4.955714521039307,"iterationTokens":1677,"asi":{"hypothesis":"After budget-13 DDTree uplift, immediate control parity should quantify remaining gap for promotion decisions.","rollback_reason":"Diagnostic control sample only; no code changes.","next_action_hint":"Promote a code-level default-budget change (12→13) only if neutral/stable in additional windows, and keep DDTree experimental since control still leads.","diagnostic_findings":{"completion_tok_s":108.59791322205308,"dflash_eval_s":8.73739137116354,"safe_mode_active":0,"ddtree_gap_tok_s_estimate":5.182382619681139}}}
{"run":2376,"commit":"66ab83f","metric":103.32205548702122,"metrics":{},"status":"keep","description":"Promote DDTree default budget from 12→13; default-path native DDTree improved to ~103.3 tok/s with lower tree-build time and fewer cycles in matched healthy window.","timestamp":1776476562715,"segment":25,"confidence":5.144747559684366,"iterationTokens":5265,"asi":{"hypothesis":"Raising default DDTree budget to 13 will reduce cycle count and total tree overhead enough to improve native DDTree throughput versus default 12.","diagnostic_findings":{"completion_tok_s":103.32205548702122,"dflash_eval_s":9.904817875,"dflash_ddtree_tree_budget":13,"dflash_ddtree_cycles_completed":98,"dflash_ddtree_avg_acceptance":10.448979591836734,"dflash_ddtree_tree_build_s":1.9286501200000001},"learning":"Budget 13 reproducibly outperformed budget 12 in this lane window; DDTree still trails no-DDTree control but gap narrowed."}}
{"run":2377,"commit":"66ab83f","metric":108.56479248641952,"metrics":{},"status":"discard","description":"Post-keep control parity stayed high (~108.6 tok/s), confirming DDTree default-budget 13 narrows but does not eliminate the no-DDTree leader gap.","timestamp":1776476591189,"segment":25,"confidence":4.955714521039307,"iterationTokens":1862,"asi":{"hypothesis":"After promoting DDTree default budget 13, immediate control parity should verify remaining headroom and guard against over-claiming.","rollback_reason":"Diagnostic control sample only; no further code changes in this run.","next_action_hint":"Run one post-keep DDTree confirmation sample without env budget override, then update ideas with new default and do-not-retry notes.","diagnostic_findings":{"completion_tok_s":108.56479248641952,"dflash_eval_s":8.737669873982668,"ddtree_gap_tok_s_estimate":5.242736999398301}}}
{"run":2378,"commit":"66ab83f","metric":103.36528663156572,"metrics":{},"status":"discard","description":"Post-keep confirmation with default budget (no env override) reproduced ~103.4 tok/s DDTree band and retained improved cycles/tree-build profile.","timestamp":1776476621132,"segment":25,"confidence":5.102242387807658,"iterationTokens":4189,"asi":{"hypothesis":"If the default-budget keep is robust, repeated default-path runs should preserve budget=13 telemetry shape (cycles 98, acceptance ~10.45, tree_build ~1.93s).","rollback_reason":"No new code change; this is confirmation-only after keep.","next_action_hint":"Update autoresearch.ideas.md to reflect default-budget shift and prune stale budget-12-as-default assumption; continue matched control/DDTree monitoring.","diagnostic_findings":{"completion_tok_s":103.36528663156572,"dflash_eval_s":9.900525666,"dflash_ddtree_tree_budget":13,"dflash_ddtree_cycles_completed":98,"dflash_ddtree_avg_acceptance":10.448979591836734}}}
{"run":2379,"commit":"66ab83f","metric":82.6226633429467,"metrics":{},"status":"discard","description":"DDTree budget-15 probe regressed sharply (~82.6 tok/s): acceptance dropped (~8.39), cycles increased (122), and fast-path ratio degraded (0.93).","timestamp":1776476697451,"segment":25,"confidence":4.955714521039307,"iterationTokens":4953,"asi":{"hypothesis":"Increasing budget beyond 13 might further reduce cycle count and improve DDTree throughput.","rollback_reason":"Primary metric collapsed with worse acceptance/cycle/tree-build profile, indicating over-budget cliff behavior.","next_action_hint":"Add budget 15 to DDTree do-not-retry list and stay centered on budget 13.","diagnostic_findings":{"completion_tok_s":82.6226633429467,"dflash_eval_s":12.387660875,"dflash_ddtree_tree_budget":15,"dflash_ddtree_cycles_completed":122,"dflash_ddtree_avg_acceptance":8.39344262295082,"dflash_ddtree_fast_path_ratio":0.9262295081967213}}}
{"run":2380,"commit":"66ab83f","metric":103.31563350996635,"metrics":{},"status":"discard","description":"Immediate default-budget (13) back-check returned to ~103.3 tok/s, confirming budget-15 was a variant cliff rather than regime drift.","timestamp":1776476724662,"segment":25,"confidence":5.102242387807658,"iterationTokens":1774,"asi":{"hypothesis":"If budget-15 regression is causal, restoring default budget 13 should immediately recover the improved DDTree profile.","rollback_reason":"No new code change; this run is attribution confirmation after a bad variant.","next_action_hint":"Update ideas do-not-retry with budget 15 and continue budget-13 DDTree vs control monitoring.","diagnostic_findings":{"completion_tok_s":103.31563350996635,"dflash_eval_s":9.905258959000001,"dflash_ddtree_tree_budget":13,"dflash_ddtree_cycles_completed":98,"dflash_ddtree_avg_acceptance":10.448979591836734}}}
{"run":2381,"commit":"66ab83f","metric":108.69172705235317,"metrics":{},"status":"discard","description":"Control monitoring stayed in high fused-only band (~108.7 tok/s), confirming stable no-DDTree leader after DDTree budget-13 keep.","timestamp":1776476759464,"segment":25,"confidence":5.088248925755622,"iterationTokens":1923,"asi":{"hypothesis":"A fresh control sample after DDTree budget probes should verify whether high-window control behavior remains stable.","rollback_reason":"No code changes; monitoring-only control run.","next_action_hint":"Continue matched DDTree/control sampling around the new budget-13 default and avoid overfitting to a single high pocket.","diagnostic_findings":{"completion_tok_s":108.69172705235317,"dflash_eval_s":8.72215196036268,"safe_mode_active":0,"verify_eval_wait_fused_steps":96,"verify_eval_wait_unfused_steps":0}}}
{"run":2382,"commit":"66ab83f","metric":103.34147702509252,"metrics":{},"status":"discard","description":"Matched DDTree sample after high control run held stable at ~103.34 tok/s with budget=13 profile (98 cycles, ~1.92s tree-build).","timestamp":1776476788466,"segment":25,"confidence":5.405662981993035,"iterationTokens":4142,"asi":{"hypothesis":"If the new default is robust, DDTree should repeatedly stay near ~103.3 tok/s with the same telemetry signature across adjacent runs.","rollback_reason":"No new code change; this is post-keep stability monitoring.","next_action_hint":"Keep budget 13 default, continue collapse-edge parity discipline, and pursue next overhead levers only when matched windows remain stable.","diagnostic_findings":{"completion_tok_s":103.34147702509252,"dflash_eval_s":9.902317334000001,"dflash_ddtree_tree_budget":13,"dflash_ddtree_cycles_completed":98,"dflash_ddtree_tree_build_s":1.924534791}}}
{"run":2383,"commit":"66ab83f","metric":99.35072626719747,"metrics":{},"status":"discard","description":"Turning off unnormalized top-k at budget 13 regressed DDTree (~99.35 tok/s): cycles rose (102), tree-build increased (~2.01s), and fast-path ratio fell (~0.81).","timestamp":1776476835650,"segment":25,"confidence":6.066005130832455,"iterationTokens":2451,"asi":{"hypothesis":"After default budget moved to 13, normalized scoring might be close enough to unnormalized and potentially safer for defaults.","rollback_reason":"Primary metric and telemetry clearly regressed versus unnormalized mode; optimization benefit remains tied to DFLASH_DDTREE_TOPK_UNNORMALIZED=1.","next_action_hint":"Keep unnormalized top-k enabled for DDTree experiments; do not attempt default-off DDTree comparisons as representative of best path.","diagnostic_findings":{"completion_tok_s":99.35072626719747,"dflash_eval_s":10.300353333,"dflash_ddtree_tree_build_s":2.010645419,"dflash_ddtree_cycles_completed":102,"dflash_ddtree_fast_path_ratio":0.8137254901960784}}}
{"run":2384,"commit":"66ab83f","metric":103.43453585389305,"metrics":{},"status":"discard","description":"Re-enabling unnormalized top-k immediately restored DDTree to ~103.4 tok/s and fast-path ratio 1.0, confirming prior regression was mode-specific.","timestamp":1776476875773,"segment":25,"confidence":6.88647229526353,"iterationTokens":2226,"asi":{"hypothesis":"If normalized scoring caused the regression, restoring DFLASH_DDTREE_TOPK_UNNORMALIZED=1 should immediately recover the improved budget-13 profile.","rollback_reason":"No new code changes; this run validates mode attribution only.","next_action_hint":"Keep unnormalized top-k on for DDTree optimization work; focus future probes on remaining ~5 tok/s control gap.","diagnostic_findings":{"completion_tok_s":103.43453585389305,"dflash_eval_s":9.893118542,"dflash_ddtree_tree_budget":13,"dflash_ddtree_fast_path_ratio":1,"dflash_ddtree_tree_build_s":1.924494293}}}
{"run":2385,"commit":"66ab83f","metric":108.63346181155997,"metrics":{},"status":"discard","description":"Control remained in stable high fused-only regime (~108.63 tok/s), reinforcing that DDTree budget-13 sits consistently ~5 tok/s below lane leader.","timestamp":1776476905603,"segment":25,"confidence":6.066005130832455,"iterationTokens":1716,"asi":{"hypothesis":"Repeated control samples should stay near the high floor if this window is stable and suitable for fair DDTree gap tracking.","rollback_reason":"No code changes; run is monitoring-only.","next_action_hint":"Keep using matched control/DDTree pairs for attribution and prioritize new DDTree overhead ideas only if they can target the remaining ~5 tok/s gap.","diagnostic_findings":{"completion_tok_s":108.63346181155997,"dflash_eval_s":8.724902624380775,"safe_mode_active":0,"ddtree_gap_tok_s_estimate":5.198925957666915}}}
{"run":2386,"commit":"66ab83f","metric":103.41596272991814,"metrics":{},"status":"discard","description":"Verify bind-mode=none produced essentially identical DDTree performance (~103.4 tok/s) to current default behavior; no meaningful uplift signal.","timestamp":1776476995121,"segment":25,"confidence":6.732720358388613,"iterationTokens":1716,"asi":{"hypothesis":"Using upstream verify helper bindings (bind_mode=none) might reduce native DDTree overhead versus default target_only binding.","rollback_reason":"No primary improvement versus adjacent default-path samples; differences are within noise.","next_action_hint":"Keep default bind mode unchanged and prioritize other overhead levers.","diagnostic_findings":{"completion_tok_s":103.41596272991814,"dflash_eval_s":9.895881208,"dflash_ddtree_tree_build_s":1.928469042,"dflash_ddtree_tree_verify_s":0.128977206}}}
{"run":2387,"commit":"26f9501","metric":103.46282575721976,"metrics":{},"status":"keep","description":"Add env-gated DDTree top-k cap knob (DFLASH_DDTREE_TOPK_CAP) and confirm default-off path remains in expected budget-13 ~103.4 tok/s band.","timestamp":1776477063116,"segment":25,"confidence":7.072421478915191,"iterationTokens":3453,"asi":{"hypothesis":"A top-k cap below budget may reduce tree-build overhead in native DDTree; adding it as default-off knob should be neutral until enabled.","diagnostic_findings":{"completion_tok_s":103.46282575721976,"dflash_eval_s":9.891186625,"dflash_ddtree_tree_budget":13,"dflash_ddtree_tree_build_s":1.924748207,"dflash_ddtree_cycles_completed":98},"next_action_hint":"Run immediate A/B with DFLASH_DDTREE_TOPK_CAP=12 in same window."}}
{"run":2388,"commit":"26f9501","metric":103.35055510311477,"metrics":{},"status":"discard","description":"Top-k cap variant (DFLASH_DDTREE_TOPK_CAP=12) was effectively flat/slightly worse than uncapped budget-13 baseline in matched window.","timestamp":1776477093758,"segment":25,"confidence":7.448223492304266,"iterationTokens":1832,"asi":{"hypothesis":"Capping top-k below budget 13 might shave tree-build overhead without hurting acceptance enough to drop throughput.","rollback_reason":"Primary metric did not improve versus immediate uncapped baseline; tree-build and cycle profile were unchanged to slightly worse.","next_action_hint":"De-prioritize top-k-cap=12 as active lever; if revisited, test only with stronger evidence or different cap values.","diagnostic_findings":{"completion_tok_s":103.35055510311477,"dflash_eval_s":9.90200225,"dflash_ddtree_tree_build_s":1.9300433719999999,"dflash_ddtree_cycles_completed":98,"dflash_ddtree_avg_acceptance":10.448979591836734}}}
{"run":2389,"commit":"26f9501","metric":103.3273487481393,"metrics":{},"status":"discard","description":"Top-k cap=10 was also flat/slightly worse than uncapped budget-13 baseline; no measurable DDTree uplift.","timestamp":1776477128642,"segment":25,"confidence":8.019516344920621,"iterationTokens":2040,"asi":{"hypothesis":"A stronger top-k cap might reduce tree-build work enough to improve throughput while preserving acceptance.","rollback_reason":"Primary metric remained slightly below uncapped baseline with effectively unchanged telemetry profile.","next_action_hint":"Prune top-k-cap tuning for now; pursue different overhead sources for the remaining ~5 tok/s gap.","diagnostic_findings":{"completion_tok_s":103.3273487481393,"dflash_eval_s":9.904132541,"dflash_ddtree_tree_build_s":1.929018455,"dflash_ddtree_cycles_completed":98,"dflash_ddtree_avg_acceptance":10.448979591836734}}}
{"run":2390,"commit":"26f9501","metric":108.66937580873778,"metrics":{},"status":"discard","description":"Control parity remained high (~108.67 tok/s) in fused-only stable regime, keeping DDTree budget-13 gap at roughly ~5.2 tok/s.","timestamp":1776477155373,"segment":25,"confidence":7.329890085921021,"iterationTokens":1661,"asi":{"hypothesis":"Stable high-window control samples are needed to prevent overfitting DDTree improvements to drifting windows.","rollback_reason":"No code change; this run is parity monitoring only.","next_action_hint":"Continue DDTree overhead scouting but keep immediate control parity checks to validate any apparent gains.","diagnostic_findings":{"completion_tok_s":108.66937580873778,"dflash_eval_s":8.72617545479443,"safe_mode_active":0,"ddtree_gap_tok_s_estimate":5.234840707227806}}}
{"run":2391,"commit":"26f9501","metric":103.00982761490887,"metrics":{},"status":"discard","description":"External-cache toggle (DFLASH_DDTREE_NATIVE_USE_EXTERNAL_CACHE=1) was slightly worse than default cache path in matched budget-13 window.","timestamp":1776477219157,"segment":25,"confidence":7.937618062604743,"iterationTokens":7569,"asi":{"hypothesis":"Using dflash_mlx external target cache in native DDTree might reduce cache-management overhead and improve throughput.","rollback_reason":"Primary metric regressed and verify timing slightly worsened versus adjacent default-cache runs.","next_action_hint":"Keep default cache path; deprioritize external-cache toggle on this lane.","diagnostic_findings":{"completion_tok_s":103.00982761490887,"dflash_eval_s":9.9348675,"dflash_ddtree_tree_build_s":1.926921832,"dflash_ddtree_tree_verify_s":0.140489043}}}
{"run":2392,"commit":"26f9501","metric":108.61468998071999,"metrics":{},"status":"discard","description":"Control parity remained high and stable (~108.6 tok/s, fused-only), reaffirming DDTree budget-13 still trails by about ~5.3 tok/s.","timestamp":1776477259406,"segment":25,"confidence":7.303370539813445,"iterationTokens":1906,"asi":{"hypothesis":"A fresh control sample after DDTree variant scouting should confirm whether leader lane stayed stable.","rollback_reason":"No code changes; parity-monitoring run only.","next_action_hint":"Continue exploring DDTree overhead levers, but keep immediate control checks to avoid overfitting to DDTree-only windows.","diagnostic_findings":{"completion_tok_s":108.61468998071999,"dflash_eval_s":8.737844671006314,"safe_mode_active":0,"ddtree_gap_tok_s_estimate":5.180154126826938}}}
