{"run":1630,"commit":"b304c02","metric":107.62528518366932,"metrics":{},"status":"discard","description":"Control parity (`DFLASH_MIRROR_SD_RUNTIME=0`) matched reopened window at ~107.63, narrowly above paired mirror.","timestamp":1776362742975,"segment":23,"confidence":2.7222754492809265,"iterationTokens":790,"asi":{"hypothesis":"Reopened high-window remains shared and near-tied across backends.","rollback_reason":"Control non-authoritative; paired result was essentially tie with slight control edge.","next_action_hint":"Restore mirror lane and continue scans for mirror-led over-control confirmation.","backend":"bstnxbt_mlx","mirror_runtime_enabled":0,"paired_mirror_tok_s":107.61239795813952,"paired_delta_tok_s":-0.012887225529806343,"authoritative_lane":"mirror_sd_mlx","context_only_draft_cache":1,"draft_sink":48,"async_draft_eval":1,"fused_draft_verify_eval":1}}
{"run":1631,"commit":"b304c02","metric":107.25051023548323,"metrics":{},"status":"discard","description":"Mirror sample held high at ~107.25 in reopened shared window.","timestamp":1776362788840,"segment":23,"confidence":2.7295167140843186,"iterationTokens":1195,"asi":{"hypothesis":"High-window remains active with mirror within striking distance of control.","rollback_reason":"Below keep.","next_action_hint":"Continue mirror scans; parity check after mirror surpasses recent control ceiling.","backend":"mirror_sd_mlx","delta_vs_keep":-1.6118222589917075,"context_only_draft_cache":1,"draft_sink":48,"async_draft_eval":1,"fused_draft_verify_eval":1}}
{"run":1632,"commit":"b304c02","metric":107.23156618801863,"metrics":{},"status":"discard","description":"Mirror sample repeated near ~107.23, stable in high window.","timestamp":1776362824999,"segment":23,"confidence":2.7367966052271164,"iterationTokens":590,"asi":{"hypothesis":"Mirror currently centered around low-107 within reopened regime.","rollback_reason":"Below keep and below latest control high marker.","next_action_hint":"Continue mirror scans for >107.63 attempt before parity refresh.","backend":"mirror_sd_mlx","delta_vs_keep":-1.6307663064563034,"context_only_draft_cache":1,"draft_sink":48,"async_draft_eval":1,"fused_draft_verify_eval":1}}
{"run":1633,"commit":"b304c02","metric":107.07289164882583,"metrics":{},"status":"discard","description":"Mirror dipped slightly to ~107.07 but remained in high-window band.","timestamp":1776362859446,"segment":23,"confidence":2.737531776948048,"iterationTokens":610,"asi":{"hypothesis":"High-window persists with modest drift.","rollback_reason":"Below keep and below control parity ceiling.","next_action_hint":"Continue mirror-only scans for renewed peak.","backend":"mirror_sd_mlx","delta_vs_keep":-1.7894408456491118,"context_only_draft_cache":1,"draft_sink":48,"async_draft_eval":1,"fused_draft_verify_eval":1}}
{"run":1634,"commit":"b304c02","metric":106.35003344733633,"metrics":{},"status":"discard","description":"Mirror eased to ~106.35, still elevated but off recent highs.","timestamp":1776362894996,"segment":23,"confidence":2.7382673437459704,"iterationTokens":590,"asi":{"hypothesis":"Reopened high-window may be softening temporarily.","rollback_reason":"Below keep and control high marker.","next_action_hint":"Continue mirror scans; parity refresh only on renewed mirror spike.","backend":"mirror_sd_mlx","delta_vs_keep":-2.5122990471386117,"context_only_draft_cache":1,"draft_sink":48,"async_draft_eval":1,"fused_draft_verify_eval":1}}
{"run":1635,"commit":"b304c02","metric":104.45854452174423,"metrics":{},"status":"discard","description":"Mirror dropped to ~104.46 as high-window softened further.","timestamp":1776362930002,"segment":23,"confidence":2.7399068769275243,"iterationTokens":600,"asi":{"hypothesis":"Current local center may be shifting down from 107 toward mid-104s.","rollback_reason":"Below keep and below control parity peak.","next_action_hint":"Continue mirror scans for either rebound or further downshift.","backend":"mirror_sd_mlx","delta_vs_keep":-4.403787972730716,"context_only_draft_cache":1,"draft_sink":48,"async_draft_eval":1,"fused_draft_verify_eval":1}}
{"run":1636,"commit":"b304c02","metric":43.301396427927315,"metrics":{},"status":"discard","description":"Mirror hard-collapsed to ~43.30, ending the softened high-window phase abruptly.","timestamp":1776362980028,"segment":23,"confidence":2.7382673437459704,"iterationTokens":607,"asi":{"hypothesis":"Regime remains collapse-prone even after extended high-window occupancy.","rollback_reason":"Catastrophically below keep/control levels.","next_action_hint":"Run immediate mirror follow-up to characterize collapse depth and rebound onset.","backend":"mirror_sd_mlx","delta_vs_keep":-65.56093606654763,"request_s":23.6481980830431,"context_only_draft_cache":1,"draft_sink":48,"async_draft_eval":1,"fused_draft_verify_eval":1,"collapse_reappeared":true}}
{"run":1637,"commit":"b304c02","metric":52.000250269946605,"metrics":{},"status":"discard","description":"Mirror rebound reached ~52.00, still in deep-collapse regime.","timestamp":1776363028062,"segment":23,"confidence":2.737531776948048,"iterationTokens":660,"asi":{"hypothesis":"Current collapse branch is persistent with slow recovery from 40s to low-50s.","rollback_reason":"Still far below keep and high-window bands.","next_action_hint":"Run control parity sample now to confirm shared deep-collapse attribution.","backend":"mirror_sd_mlx","delta_vs_keep":-56.86208222452834,"paired_prev_tok_s":43.301396427927315,"paired_delta_tok_s":8.69885384201929,"request_s":19.692212915979326,"context_only_draft_cache":1,"draft_sink":48,"async_draft_eval":1,"fused_draft_verify_eval":1}}
{"run":1638,"commit":"b304c02","metric":68.30596650448834,"metrics":{},"status":"discard","description":"Control parity (`DFLASH_MIRROR_SD_RUNTIME=0`) recovered to ~68.31, clearly above paired mirror ~52.00.","timestamp":1776363080049,"segment":23,"confidence":2.7367966052271164,"iterationTokens":862,"asi":{"hypothesis":"In this collapse branch control is recovering faster than mirror.","rollback_reason":"Control non-authoritative and mirror remains behind in immediate parity.","next_action_hint":"Restore mirror lane and continue tracking for mirror recovery crossover.","backend":"bstnxbt_mlx","mirror_runtime_enabled":0,"paired_mirror_tok_s":52.000250269946605,"paired_delta_tok_s":-16.30571623454174,"authoritative_lane":"mirror_sd_mlx","context_only_draft_cache":1,"draft_sink":48,"async_draft_eval":1,"fused_draft_verify_eval":1}}
{"run":1639,"commit":"b304c02","metric":74.9376641614433,"metrics":{},"status":"discard","description":"Mirror recovered to ~74.94 after parity-confirmed deep-collapse branch.","timestamp":1776363131131,"segment":23,"confidence":2.7295167140843186,"iterationTokens":1192,"asi":{"hypothesis":"Mirror recovery is progressing from low-50s toward mid/high-70s.","rollback_reason":"Below keep and still below recent control parity levels.","next_action_hint":"Continue mirror sequence through 80/90 recovery ladder.","backend":"mirror_sd_mlx","delta_vs_keep":-33.92466833303164,"paired_prev_tok_s":52.000250269946605,"paired_delta_tok_s":22.9374138914967,"context_only_draft_cache":1,"draft_sink":48,"async_draft_eval":1,"fused_draft_verify_eval":1}}
{"run":1640,"commit":"b304c02","metric":80.56314820769576,"metrics":{},"status":"discard","description":"Mirror climbed to ~80.56, entering low-80 recovery stage.","timestamp":1776363166614,"segment":23,"confidence":2.7222754492809265,"iterationTokens":660,"asi":{"hypothesis":"Recovery ladder is progressing normally through expected bands.","rollback_reason":"Below keep and below control reference.","next_action_hint":"Continue mirror runs for 90+ re-entry.","backend":"mirror_sd_mlx","delta_vs_keep":-28.299184286779177,"paired_prev_tok_s":74.9376641614433,"paired_delta_tok_s":5.62548404625246,"context_only_draft_cache":1,"draft_sink":48,"async_draft_eval":1,"fused_draft_verify_eval":1}}
{"run":1641,"commit":"b304c02","metric":86.91632251220001,"metrics":{},"status":"discard","description":"Mirror reached ~86.92, continuing staged rebound into high-80s.","timestamp":1776363203725,"segment":23,"confidence":2.7157200078932946,"iterationTokens":640,"asi":{"hypothesis":"Recovery remains healthy and may soon re-enter low-90 basin.","rollback_reason":"Below keep/control highs.","next_action_hint":"Continue mirror runs toward 90+/100+ zones.","backend":"mirror_sd_mlx","delta_vs_keep":-21.94600998227493,"paired_prev_tok_s":80.56314820769576,"paired_delta_tok_s":6.353174304504252,"context_only_draft_cache":1,"draft_sink":48,"async_draft_eval":1,"fused_draft_verify_eval":1}}
{"run":1642,"commit":"b304c02","metric":86.36943334904124,"metrics":{},"status":"discard","description":"Mirror held around ~86.37, slight pause in high-80 rebound stage.","timestamp":1776363238443,"segment":23,"confidence":2.7091960626397276,"iterationTokens":648,"asi":{"hypothesis":"Recovery may consolidate in high-80s before next jump.","rollback_reason":"Below keep.","next_action_hint":"Continue mirror scans for 90+ transition.","backend":"mirror_sd_mlx","delta_vs_keep":-22.4928991454337,"paired_prev_tok_s":86.91632251220001,"paired_delta_tok_s":-0.5468891631587698,"context_only_draft_cache":1,"draft_sink":48,"async_draft_eval":1,"fused_draft_verify_eval":1}}
{"run":1643,"commit":"b304c02","metric":90.6886073882539,"metrics":{},"status":"discard","description":"Mirror moved to ~90.69, re-entering low-90 basin.","timestamp":1776363274099,"segment":23,"confidence":2.70086225906113,"iterationTokens":641,"asi":{"hypothesis":"Recovery remains on track toward mid-90 and upper-basin tests.","rollback_reason":"Below keep/control highs.","next_action_hint":"Continue mirror scans for >95 transition.","backend":"mirror_sd_mlx","delta_vs_keep":-18.173725106221,"paired_prev_tok_s":86.36943334904124,"paired_delta_tok_s":4.319174039212658,"context_only_draft_cache":1,"draft_sink":48,"async_draft_eval":1,"fused_draft_verify_eval":1}}
{"run":1644,"commit":"b304c02","metric":88.61069304170465,"metrics":{},"status":"discard","description":"Mirror slipped to ~88.61, slight pullback within low-90 basin.","timestamp":1776363314574,"segment":23,"confidence":2.692579569755793,"iterationTokens":640,"asi":{"hypothesis":"Recovery remains choppy but still above collapse bands.","rollback_reason":"Below keep.","next_action_hint":"Continue mirror runs for next upward leg.","backend":"mirror_sd_mlx","delta_vs_keep":-20.251639452770288,"paired_prev_tok_s":90.6886073882539,"paired_delta_tok_s":-2.0779143465492456,"context_only_draft_cache":1,"draft_sink":48,"async_draft_eval":1,"fused_draft_verify_eval":1}}
{"run":1645,"commit":"b304c02","metric":91.83694963903842,"metrics":{},"status":"discard","description":"Mirror rebounded to ~91.84, top of current low-basin range.","timestamp":1776363367137,"segment":23,"confidence":2.685403687354639,"iterationTokens":635,"asi":{"hypothesis":"Local center remains near low-90 while waiting for upper-basin jump.","rollback_reason":"Below keep.","next_action_hint":"Continue mirror scans for transition toward mid/high-90s.","backend":"mirror_sd_mlx","delta_vs_keep":-17.025382855436515,"paired_prev_tok_s":88.61069304170465,"paired_delta_tok_s":3.2262565973337654,"context_only_draft_cache":1,"draft_sink":48,"async_draft_eval":1,"fused_draft_verify_eval":1}}
{"run":1646,"commit":"b304c02","metric":96.04799810472582,"metrics":{},"status":"discard","description":"Mirror jumped to ~96.05, entering the bridge zone again.","timestamp":1776363401998,"segment":23,"confidence":2.6709503668970696,"iterationTokens":665,"asi":{"hypothesis":"Upper-basin transition may be restarting from low-90 base.","rollback_reason":"Below keep and still below control highs.","next_action_hint":"Continue immediate mirror scans for >100 retest.","backend":"mirror_sd_mlx","delta_vs_keep":-12.81433438974998,"paired_prev_tok_s":91.83694963903842,"paired_delta_tok_s":4.211048465687394,"context_only_draft_cache":1,"draft_sink":48,"async_draft_eval":1,"fused_draft_verify_eval":1}}
{"run":1647,"commit":"b304c02","metric":97.1857096963593,"metrics":{},"status":"discard","description":"Mirror improved to ~97.19, pushing deeper into bridge zone.","timestamp":1776363438580,"segment":23,"confidence":2.665481059372034,"iterationTokens":647,"asi":{"hypothesis":"Bridge-to-upper transition is active.","rollback_reason":"Below keep/control highs.","next_action_hint":"Continue immediate mirror scans for 100+ crossover.","backend":"mirror_sd_mlx","delta_vs_keep":-11.676622798116515,"paired_prev_tok_s":96.04799810472582,"paired_delta_tok_s":1.1377115916334835,"context_only_draft_cache":1,"draft_sink":48,"async_draft_eval":1,"fused_draft_verify_eval":1}}
{"run":1648,"commit":"b304c02","metric":99.43147859537068,"metrics":{},"status":"discard","description":"Mirror reached ~99.43, pressing just below 100+ crossover.","timestamp":1776363476121,"segment":23,"confidence":2.6658242938856445,"iterationTokens":630,"asi":{"hypothesis":"Crossover into low-100 basin is imminent if trend continues.","rollback_reason":"Below keep and below latest control highs.","next_action_hint":"Continue immediate mirror reruns for >100.","backend":"mirror_sd_mlx","delta_vs_keep":-9.43085389910514,"paired_prev_tok_s":97.1857096963593,"paired_delta_tok_s":2.2457688990113747,"context_only_draft_cache":1,"draft_sink":48,"async_draft_eval":1,"fused_draft_verify_eval":1}}
{"run":1649,"commit":"b304c02","metric":94.49436190395502,"metrics":{},"status":"discard","description":"Mirror retraced to ~94.49 from near-100 probe.","timestamp":1776363511993,"segment":23,"confidence":2.660664801799532,"iterationTokens":657,"asi":{"hypothesis":"Upper pressure remains fragile with recurring pullbacks.","rollback_reason":"Below keep.","next_action_hint":"Continue mirror scans for renewed near-100 push.","backend":"mirror_sd_mlx","delta_vs_keep":-14.367970590520798,"paired_prev_tok_s":99.43147859537068,"paired_delta_tok_s":-4.937116691415655,"context_only_draft_cache":1,"draft_sink":48,"async_draft_eval":1,"fused_draft_verify_eval":1}}
{"run":1650,"commit":"b304c02","metric":100.7994091253748,"metrics":{},"status":"discard","description":"Mirror crossed back into 100+ at ~100.80.","timestamp":1776363547245,"segment":23,"confidence":2.654966677815636,"iterationTokens":694,"asi":{"hypothesis":"Upper-basin occupancy has resumed after pullback.","rollback_reason":"Below keep and still below control highs.","next_action_hint":"Continue mirror scans for extension toward 105+ and parity crossover test.","backend":"mirror_sd_mlx","delta_vs_keep":-8.062923369100995,"paired_prev_tok_s":94.49436190395502,"paired_delta_tok_s":6.305047221419776,"context_only_draft_cache":1,"draft_sink":48,"async_draft_eval":1,"fused_draft_verify_eval":1}}
{"run":1651,"commit":"b304c02","metric":100.2076658751064,"metrics":{},"status":"discard","description":"Mirror held around ~100.21, stable low-100 occupancy.","timestamp":1776363582133,"segment":23,"confidence":2.651895190962602,"iterationTokens":655,"asi":{"hypothesis":"Upper basin is present but currently capped around ~100-101.","rollback_reason":"Below keep/control highs.","next_action_hint":"Continue mirror scans for expansion above 103/105.","backend":"mirror_sd_mlx","delta_vs_keep":-8.654666619369392,"paired_prev_tok_s":100.7994091253748,"paired_delta_tok_s":-0.5917432502683982,"context_only_draft_cache":1,"draft_sink":48,"async_draft_eval":1,"fused_draft_verify_eval":1}}
{"run":1652,"commit":"b304c02","metric":98.57238698664702,"metrics":{},"status":"discard","description":"Mirror eased to ~98.57, slight retreat within upper basin.","timestamp":1776363620170,"segment":23,"confidence":2.6438117291970644,"iterationTokens":647,"asi":{"hypothesis":"Upper-basin occupancy remains but with oscillatory drift.","rollback_reason":"Below keep and well below control highs.","next_action_hint":"Continue mirror scans; parity deferred until >105.8.","backend":"mirror_sd_mlx","delta_vs_keep":-10.289945507828236,"paired_prev_tok_s":100.2076658751064,"paired_delta_tok_s":-1.6352788884593767,"context_only_draft_cache":1,"draft_sink":48,"async_draft_eval":1,"fused_draft_verify_eval":1}}
{"run":1653,"commit":"b304c02","metric":99.97546988677246,"metrics":{},"status":"discard","description":"Mirror returned to ~99.98, near top of current upper-basin band.","timestamp":1776363654854,"segment":23,"confidence":2.641084445886239,"iterationTokens":647,"asi":{"hypothesis":"Near-100 cap persists with repeated tests.","rollback_reason":"Below keep and below control parity highs.","next_action_hint":"Continue mirror scans for expansion above 102/105.","backend":"mirror_sd_mlx","delta_vs_keep":-8.886862607702794,"paired_prev_tok_s":98.57238698664702,"paired_delta_tok_s":1.4030829001254388,"context_only_draft_cache":1,"draft_sink":48,"async_draft_eval":1,"fused_draft_verify_eval":1}}
{"run":1654,"commit":"b304c02","metric":99.53770737334077,"metrics":{},"status":"discard","description":"Mirror held near ~99.54, still bounded by ~100 cap.","timestamp":1776363688934,"segment":23,"confidence":2.6327071579017955,"iterationTokens":659,"asi":{"hypothesis":"Upper-basin plateau is stable but not extending higher yet.","rollback_reason":"Below keep/control highs.","next_action_hint":"Continue mirror scans for breakout trigger.","backend":"mirror_sd_mlx","delta_vs_keep":-9.324625121134485,"paired_prev_tok_s":99.97546988677246,"paired_delta_tok_s":-0.4377625134316968,"context_only_draft_cache":1,"draft_sink":48,"async_draft_eval":1,"fused_draft_verify_eval":1}}
{"run":1655,"commit":"b304c02","metric":99.93879765613582,"metrics":{},"status":"discard","description":"Mirror retested ~99.94, near-cap behavior persists.","timestamp":1776363724250,"segment":23,"confidence":2.624588250785334,"iterationTokens":635,"asi":{"hypothesis":"Repeated near-100 touches indicate persistent cap at current regime.","rollback_reason":"Below keep and under control parity highs.","next_action_hint":"Continue mirror scans; parity check deferred until clear >105 mirror spike.","backend":"mirror_sd_mlx","delta_vs_keep":-8.923534838339123,"paired_prev_tok_s":99.53770737334077,"paired_delta_tok_s":0.4010902827950515,"context_only_draft_cache":1,"draft_sink":48,"async_draft_eval":1,"fused_draft_verify_eval":1}}
{"run":1656,"commit":"b304c02","metric":100.60302252459994,"metrics":{},"status":"discard","description":"Mirror crossed 100 again at ~100.60, modest break above cap.","timestamp":1776363762991,"segment":23,"confidence":2.61933154530761,"iterationTokens":653,"asi":{"hypothesis":"Cap is porous but still far from parity-control highs.","rollback_reason":"Below keep/control highs.","next_action_hint":"Continue mirror scans for sustained expansion beyond low-100.","backend":"mirror_sd_mlx","delta_vs_keep":-8.259309969875002,"paired_prev_tok_s":99.93879765613582,"paired_delta_tok_s":0.6642248684641219,"context_only_draft_cache":1,"draft_sink":48,"async_draft_eval":1,"fused_draft_verify_eval":1}}
{"run":1657,"commit":"b304c02","metric":99.83692976113946,"metrics":{},"status":"discard","description":"Mirror eased back to ~99.84 after brief 100+ break.","timestamp":1776363800691,"segment":23,"confidence":2.613138146930379,"iterationTokens":645,"asi":{"hypothesis":"Upper band remains pinned near 100 with no acceleration yet.","rollback_reason":"Below keep and below control parity highs.","next_action_hint":"Continue mirror-only loop until a strong >105 mirror event appears.","backend":"mirror_sd_mlx","delta_vs_keep":-9.025402733335483,"paired_prev_tok_s":100.60302252459994,"paired_delta_tok_s":-0.7660927634604852,"context_only_draft_cache":1,"draft_sink":48,"async_draft_eval":1,"fused_draft_verify_eval":1}}
{"run":1658,"commit":"b304c02","metric":107.33527365024545,"metrics":{},"status":"discard","description":"Major bet: reduced mirror capture-id normalization overhead (frozenset-friendly capture/exit caches + frozen capture ids for mirror mode); produced ~107.34 in high window but no new best.","timestamp":1776364196522,"segment":23,"confidence":2.6215172650788565,"iterationTokens":17364,"asi":{"hypothesis":"Avoiding per-call capture-id sorting/conversion in mirror target-forward could trim mirror overhead and improve mirror-vs-control headroom.","rollback_reason":"Primary metric still below keep (108.8623) and no clear uplift vs nearby mirror high-window samples.","next_action_hint":"Revert and continue search for stronger mirror-specific optimizations; avoid parity loops unless mirror posts a clear high spike.","backend":"mirror_sd_mlx","files_touched":["omlx/dflash/mirror_sd_target.py","omlx/dflash/bstnxbt_runtime.py"],"delta_vs_keep":-1.5270588442294974,"context_only_draft_cache":1,"draft_sink":48,"async_draft_eval":1,"fused_draft_verify_eval":1}}
{"run":1659,"commit":"b304c02","metric":107.45791652455873,"metrics":{},"status":"discard","description":"Mirror-only sample at ~107.46 reopened high window after major-bet revert.","timestamp":1776364231590,"segment":23,"confidence":2.627405311462663,"iterationTokens":1019,"asi":{"hypothesis":"Mirror baseline remains competitive in reopened high-window despite code rollback.","rollback_reason":"Below keep.","next_action_hint":"Run immediate control parity check to verify mirror-over-control in this window.","backend":"mirror_sd_mlx","delta_vs_keep":-1.4044159699162118,"context_only_draft_cache":1,"draft_sink":48,"async_draft_eval":1,"fused_draft_verify_eval":1}}
