{"run":990,"commit":"8b55918","metric":27.304943390484542,"metrics":{},"status":"discard","description":"Major-bet structural control probe: env-gated split exact-KV threshold override with always-on split (`DFLASH_BSTNXBT_SPLIT_EXACT_KV_THRESHOLD=0`).","timestamp":1776304477881,"segment":23,"confidence":4.03841818933533,"iterationTokens":14217,"asi":{"hypothesis":"Activating split SDPA from the start of decode might reduce attention overhead enough for a step-change gain.","rollback_reason":"Catastrophic collapse to ~27.30 tok/s indicates always-on split is a hard cliff for this workload.","next_action_hint":"Treat low-threshold split activation as non-viable; if revisiting threshold control, only test values above current default or narrowly around late-decode activation.","backend":"mirror_sd_mlx","context_only_draft_cache":1,"draft_sink":48,"split_exact_kv_threshold":0,"severe_cliff":true,"delta_vs_keep":-79.55505660951546}}
{"run":991,"commit":"8b55918","metric":104.33518687553148,"metrics":{},"status":"discard","description":"Mirror anchor after always-on split-threshold cliff probe revert.","timestamp":1776304534724,"segment":23,"confidence":4.055944757054534,"iterationTokens":2410,"asi":{"hypothesis":"Restored keep-shape should return to familiar low/mid-104 regime after threshold=0 cliff.","rollback_reason":"Recovered to ~104.34 but still below keep.","next_action_hint":"Continue paired parity bundle; avoid further split-threshold activation probes.","backend":"mirror_sd_mlx","context_only_draft_cache":1,"draft_sink":48,"split_exact_kv_threshold_reverted":true,"delta_vs_keep":-2.52481312446852}}
{"run":992,"commit":"8b55918","metric":36.30151615600251,"metrics":{},"status":"discard","description":"Control parity sample after mirror 104.34 anchor (mirror disabled).","timestamp":1776304593449,"segment":23,"confidence":4.03841818933533,"iterationTokens":691,"asi":{"hypothesis":"Control should remain near mirror if regime stayed in low-104 band.","rollback_reason":"Control collapsed catastrophically to ~36.30, indicating another fresh shared instability wave.","next_action_hint":"Run mirror follow-up immediately to classify collapse symmetry and begin recovery tracking.","backend":"bstnxbt_mlx","mirror_runtime_enabled":0,"context_only_draft_cache":1,"draft_sink":48,"paired_mirror_tok_s":104.33518687553148,"paired_delta_tok_s":68.03367071952897,"severe_collapse":true}}
{"run":993,"commit":"8b55918","metric":60.3314535824934,"metrics":{},"status":"discard","description":"Mirror follow-up after catastrophic control collapse at 36.30.","timestamp":1776304633309,"segment":23,"confidence":4.035079405743432,"iterationTokens":660,"asi":{"hypothesis":"If collapse is shared, mirror should also degrade sharply on immediate rerun.","rollback_reason":"Mirror also degraded heavily (~60.33), confirming shared collapse with partial rebound.","next_action_hint":"Continue recovery-only bundle until 90+ re-entry before any candidate probing.","backend":"mirror_sd_mlx","context_only_draft_cache":1,"draft_sink":48,"paired_control_tok_s":36.30151615600251,"paired_delta_tok_s":24.02993742649089,"shared_collapse_confirmed":true,"delta_vs_keep":-46.5285464175066}}
{"run":994,"commit":"8b55918","metric":69.80213506053364,"metrics":{},"status":"discard","description":"Mirror recovery continuation after shared collapse confirmation.","timestamp":1776304679746,"segment":23,"confidence":4.031746138305025,"iterationTokens":668,"asi":{"hypothesis":"Recovery should move from ~60 toward high-60/70 before returning to 90+.","rollback_reason":"Improved to ~69.80 but still far below keep.","next_action_hint":"Take control parity sample to track shared recovery pace.","backend":"mirror_sd_mlx","context_only_draft_cache":1,"draft_sink":48,"delta_vs_keep":-37.05786493946636}}
{"run":995,"commit":"8b55918","metric":43.19896764714363,"metrics":{},"status":"discard","description":"Control parity sample during mirror ~69 recovery stage (mirror disabled).","timestamp":1776304733097,"segment":23,"confidence":4.025414583137635,"iterationTokens":659,"asi":{"hypothesis":"Control should indicate whether recovery is shared and monotonic.","rollback_reason":"Control re-collapsed to ~43.20, indicating highly unstable shared regime.","next_action_hint":"Return to mirror and continue recovery monitoring; avoid candidate probes.","backend":"bstnxbt_mlx","mirror_runtime_enabled":0,"context_only_draft_cache":1,"draft_sink":48,"paired_mirror_tok_s":69.80213506053364,"paired_delta_tok_s":26.60316741339001,"shared_instability":true}}
{"run":996,"commit":"8b55918","metric":59.090159557993395,"metrics":{},"status":"discard","description":"Mirror follow-up after control re-collapse to ~43.20.","timestamp":1776304777595,"segment":23,"confidence":4.019102883254803,"iterationTokens":647,"asi":{"hypothesis":"Mirror should also stay degraded if instability remains shared.","rollback_reason":"Mirror degraded to ~59.09 confirming persistent unstable trough.","next_action_hint":"Stay in recovery-only mode until >=90 reappears across paired samples.","backend":"mirror_sd_mlx","context_only_draft_cache":1,"draft_sink":48,"paired_control_tok_s":43.19896764714363,"paired_delta_tok_s":15.891191910849766,"delta_vs_keep":-47.769840442006604}}
{"run":997,"commit":"8b55918","metric":70.78777361546744,"metrics":{},"status":"discard","description":"Mirror recovery sample rising from high-50 toward low-70.","timestamp":1776304815947,"segment":23,"confidence":3.9828933941714864,"iterationTokens":649,"asi":{"hypothesis":"Recovery should climb from trough in staged bands (60s then 70s).","rollback_reason":"Still far below keep despite rebound to ~70.79.","next_action_hint":"Continue recovery bundle and interleave control parity checks periodically.","backend":"mirror_sd_mlx","context_only_draft_cache":1,"draft_sink":48,"delta_vs_keep":-36.07222638453256}}
{"run":998,"commit":"8b55918","metric":77.72882963674851,"metrics":{},"status":"discard","description":"Control parity sample during mirror rebound to low-70s (mirror disabled).","timestamp":1776304862255,"segment":23,"confidence":3.9495278639147027,"iterationTokens":672,"asi":{"hypothesis":"Control should recover similarly if instability remains shared.","rollback_reason":"Control in upper-70s confirms shared rebound but still far below keep.","next_action_hint":"Return to mirror and continue recovery tracking toward 90+ before any tuning probes.","backend":"bstnxbt_mlx","mirror_runtime_enabled":0,"context_only_draft_cache":1,"draft_sink":48,"paired_mirror_tok_s":70.78777361546744,"paired_delta_tok_s":-6.941056021281067,"shared_recovery":true}}
{"run":999,"commit":"8b55918","metric":80.31156678522493,"metrics":{},"status":"discard","description":"Mirror recovery sample climbing into low-80s.","timestamp":1776304898101,"segment":23,"confidence":3.9128568298013837,"iterationTokens":638,"asi":{"hypothesis":"Shared rebound should continue from 70s into low-80s before 90+ re-entry.","rollback_reason":"Low-80 still far below keep.","next_action_hint":"Continue recovery bundle; avoid introducing new candidates in this degraded band.","backend":"mirror_sd_mlx","context_only_draft_cache":1,"draft_sink":48,"paired_control_tok_s":77.72882963674851,"paired_delta_tok_s":2.5827371484764234,"delta_vs_keep":-26.548433214775066}}
{"run":1000,"commit":"8b55918","metric":82.41319158554178,"metrics":{},"status":"discard","description":"Mirror recovery continuation sample in low-80 band.","timestamp":1776304933248,"segment":23,"confidence":3.8789800658324882,"iterationTokens":645,"asi":{"hypothesis":"Recovery should keep stepping upward through low-80s.","rollback_reason":"Still materially below keep.","next_action_hint":"Keep recovery-only cadence and check control parity again after further rise.","backend":"mirror_sd_mlx","context_only_draft_cache":1,"draft_sink":48,"delta_vs_keep":-24.44680841445822}}
{"run":1001,"commit":"8b55918","metric":87.00686937648697,"metrics":{},"status":"discard","description":"Control parity check during mirror low-80 recovery stage (mirror disabled).","timestamp":1776304977109,"segment":23,"confidence":3.8715172732716505,"iterationTokens":640,"asi":{"hypothesis":"Control should continue recovering in tandem if instability remains shared.","rollback_reason":"Control climbed to ~87.01 but still below keep.","next_action_hint":"Return to mirror and continue rebound tracking toward 90+ and 100+ bands.","backend":"bstnxbt_mlx","mirror_runtime_enabled":0,"context_only_draft_cache":1,"draft_sink":48,"paired_mirror_tok_s":82.41319158554178,"paired_delta_tok_s":-4.5936777909451925,"shared_recovery":true}}
{"run":1002,"commit":"8b55918","metric":88.91516755037905,"metrics":{},"status":"discard","description":"Mirror follow-up after control rebound to 87.01 (approaching 90).","timestamp":1776305013417,"segment":23,"confidence":3.8640831409921015,"iterationTokens":642,"asi":{"hypothesis":"Mirror should join control in upper-80 recovery band before low-90 re-entry.","rollback_reason":"Upper-80 still below keep.","next_action_hint":"Continue recovery bundle toward 90+ and only then consider candidate probes.","backend":"mirror_sd_mlx","context_only_draft_cache":1,"draft_sink":48,"paired_control_tok_s":87.00686937648697,"paired_delta_tok_s":1.9082981738920832,"delta_vs_keep":-17.94483244962095}}
{"run":1003,"commit":"8b55918","metric":91.48858664998703,"metrics":{},"status":"discard","description":"Mirror recovery sample re-entering low-90 band.","timestamp":1776305051722,"segment":23,"confidence":3.8154932414591713,"iterationTokens":639,"asi":{"hypothesis":"Recovery should transition from upper-80 to low-90 before 100+ re-entry.","rollback_reason":"Low-90 still below keep.","next_action_hint":"Take paired control sample to verify shared low-90 re-entry.","backend":"mirror_sd_mlx","context_only_draft_cache":1,"draft_sink":48,"delta_vs_keep":-15.371413350012968}}
{"run":1004,"commit":"8b55918","metric":92.00769241532821,"metrics":{},"status":"discard","description":"Control parity sample after mirror low-90 re-entry (mirror disabled).","timestamp":1776305097265,"segment":23,"confidence":3.7953332593392934,"iterationTokens":658,"asi":{"hypothesis":"Control should track mirror into low-90s if rebound remains shared.","rollback_reason":"Control matched mirror low-90 and still below keep.","next_action_hint":"Return to mirror and continue rebound tracking toward 100+ before any new probes.","backend":"bstnxbt_mlx","mirror_runtime_enabled":0,"context_only_draft_cache":1,"draft_sink":48,"paired_mirror_tok_s":91.48858664998703,"paired_delta_tok_s":-0.5191057653411802,"shared_recovery":true}}
{"run":1005,"commit":"8b55918","metric":90.93884410568744,"metrics":{},"status":"discard","description":"Mirror recovery follow-up after low-90 parity checkpoint.","timestamp":1776305134177,"segment":23,"confidence":3.7742312121060766,"iterationTokens":638,"asi":{"hypothesis":"Mirror should hold around low-90 while rebound continues.","rollback_reason":"Held low-90 but still below keep.","next_action_hint":"Continue recovery monitoring; next control check after move into high-90s.","backend":"mirror_sd_mlx","context_only_draft_cache":1,"draft_sink":48,"delta_vs_keep":-15.921155894312564}}
{"run":1006,"commit":"8b55918","metric":93.88030016894423,"metrics":{},"status":"discard","description":"Mirror recovery sample climbing back into mid-90s.","timestamp":1776305171288,"segment":23,"confidence":3.7432170633757464,"iterationTokens":563,"asi":{"hypothesis":"Recovery should advance from low-90 toward mid/high-90 before 100+ re-entry.","rollback_reason":"Mid-90 still below keep.","next_action_hint":"Continue rebound tracking; take paired control sample near high-90 boundary.","backend":"mirror_sd_mlx","context_only_draft_cache":1,"draft_sink":48,"delta_vs_keep":-12.97969983105577}}
{"run":1007,"commit":"8b55918","metric":95.32010589293596,"metrics":{},"status":"discard","description":"Mirror recovery continuation nearing high-90 threshold.","timestamp":1776305208555,"segment":23,"confidence":3.754334184443189,"iterationTokens":579,"asi":{"hypothesis":"Recovery should keep stepping from mid-90 toward high-90/100.","rollback_reason":"Still below keep at ~95.32.","next_action_hint":"Take control parity sample now to verify shared high-90 approach.","backend":"mirror_sd_mlx","context_only_draft_cache":1,"draft_sink":48,"delta_vs_keep":-11.53989410706404}}
{"run":1008,"commit":"8b55918","metric":95.63879766842243,"metrics":{},"status":"discard","description":"Control parity sample during mirror ~95.32 recovery stage (mirror disabled).","timestamp":1776305253467,"segment":23,"confidence":3.7355939778603893,"iterationTokens":652,"asi":{"hypothesis":"Control should mirror high-90 approach if rebound remains shared.","rollback_reason":"Control matched mirror around ~95.64, still below keep.","next_action_hint":"Return to mirror and continue rebound tracking toward 100+.","backend":"bstnxbt_mlx","mirror_runtime_enabled":0,"context_only_draft_cache":1,"draft_sink":48,"paired_mirror_tok_s":95.32010589293596,"paired_delta_tok_s":-0.3186917754864667,"shared_recovery":true}}
{"run":1009,"commit":"8b55918","metric":95.98947265471107,"metrics":{},"status":"discard","description":"Mirror recovery continuation after control ~95.64 parity sample.","timestamp":1776305289305,"segment":23,"confidence":3.7168543211658,"iterationTokens":635,"asi":{"hypothesis":"Mirror should continue edging upward through mid/high-90s in shared rebound.","rollback_reason":"Still below keep and below 100 re-entry threshold.","next_action_hint":"Continue monitoring; next control check once mirror crosses/approaches 100.","backend":"mirror_sd_mlx","context_only_draft_cache":1,"draft_sink":48,"paired_control_tok_s":95.63879766842243,"paired_delta_tok_s":0.3506749862886387,"delta_vs_keep":-10.870527345288926}}
{"run":1010,"commit":"8b55918","metric":96.05978595667032,"metrics":{},"status":"discard","description":"Mirror recovery sample reaching baseline-adjacent mid-90s.","timestamp":1776305325055,"segment":23,"confidence":3.7011000295066085,"iterationTokens":636,"asi":{"hypothesis":"Recovery should move from mid-90 toward upper-90 and then 100+.","rollback_reason":"Still below keep despite gradual climb.","next_action_hint":"Continue rebound tracking; run control check once mirror reaches high-90/100 boundary.","backend":"mirror_sd_mlx","context_only_draft_cache":1,"draft_sink":48,"delta_vs_keep":-10.800214043329674}}
{"run":1011,"commit":"8b55918","metric":100.01093869680308,"metrics":{},"status":"discard","description":"Mirror recovery sample re-entering 100+ band.","timestamp":1776305358941,"segment":23,"confidence":3.671848521969226,"iterationTokens":577,"asi":{"hypothesis":"Recovery should cross from mid-90s into 100+ before returning to low-104/105 plateau.","rollback_reason":"100+ re-entry still below keep.","next_action_hint":"Take control parity sample to confirm shared 100+ re-entry.","backend":"mirror_sd_mlx","context_only_draft_cache":1,"draft_sink":48,"delta_vs_keep":-6.849061303196915}}
{"run":1012,"commit":"8b55918","metric":100.476964267394,"metrics":{},"status":"discard","description":"Control parity sample after mirror 100+ re-entry (mirror disabled).","timestamp":1776305406331,"segment":23,"confidence":3.6479356297371197,"iterationTokens":667,"asi":{"hypothesis":"Control should similarly re-enter 100+ if rebound remains shared.","rollback_reason":"Control also in 100+ band and below keep.","next_action_hint":"Return to mirror and continue climb monitoring toward low-104/105 plateau.","backend":"bstnxbt_mlx","mirror_runtime_enabled":0,"context_only_draft_cache":1,"draft_sink":48,"paired_mirror_tok_s":100.01093869680308,"paired_delta_tok_s":-0.4660255705909148,"shared_recovery":true}}
{"run":1013,"commit":"8b55918","metric":101.07646643037636,"metrics":{},"status":"discard","description":"Mirror follow-up after control 100.48 parity sample.","timestamp":1776305440697,"segment":23,"confidence":3.6373788485755227,"iterationTokens":743,"asi":{"hypothesis":"Mirror should remain in 100+ as shared rebound continues toward prior low-104 plateau.","rollback_reason":"Still below keep at ~101.08.","next_action_hint":"Continue recovery monitoring and only resume structural probes after sustained high-104/105 return.","backend":"mirror_sd_mlx","context_only_draft_cache":1,"draft_sink":48,"paired_control_tok_s":100.476964267394,"paired_delta_tok_s":0.5995021629823593,"delta_vs_keep":-5.783533569623641}}
{"run":1014,"commit":"8b55918","metric":103.93961023629693,"metrics":{},"status":"discard","description":"Mirror recovery continuation after re-entry into 100+ band.","timestamp":1776305670437,"segment":23,"confidence":3.648541625390598,"iterationTokens":743,"asi":{"hypothesis":"Shared rebound should continue toward prior low-104/105 plateau.","rollback_reason":"Improved to ~103.94 but still below keep.","next_action_hint":"Take paired control sample to verify parity in this recovered band.","backend":"mirror_sd_mlx","context_only_draft_cache":1,"draft_sink":48,"delta_vs_keep":-2.920389763703064}}
{"run":1015,"commit":"8b55918","metric":104.62429909087895,"metrics":{},"status":"discard","description":"Control parity sample in recovered low-104 band (mirror disabled).","timestamp":1776305701272,"segment":23,"confidence":3.678563047095448,"iterationTokens":689,"asi":{"hypothesis":"If recovery is shared, control should remain near mirror in low-104 range.","rollback_reason":"Control at ~104.62 confirms parity but still below keep.","next_action_hint":"Return to mirror and verify whether both backends can sustain 104+ without collapse.","backend":"bstnxbt_mlx","mirror_runtime_enabled":0,"context_only_draft_cache":1,"draft_sink":48,"paired_mirror_tok_s":103.93961023629693,"paired_delta_tok_s":-0.6846888545820222,"shared_recovery":true}}
{"run":1016,"commit":"8b55918","metric":103.87400941119068,"metrics":{},"status":"discard","description":"Mirror follow-up after control 104.62 parity sample.","timestamp":1776305724593,"segment":23,"confidence":3.7090826203708187,"iterationTokens":660,"asi":{"hypothesis":"Mirror should hold in the same low-104 plateau if regime is stable.","rollback_reason":"Mirror held ~103.87 but still below keep.","next_action_hint":"Take another mirror/control cycle, then attempt one major structural candidate only if 104+ holds.","backend":"mirror_sd_mlx","context_only_draft_cache":1,"draft_sink":48,"paired_control_tok_s":104.62429909087895,"paired_delta_tok_s":-0.7502896796882659,"delta_vs_keep":-2.9859905888093166}}
{"run":1017,"commit":"8b55918","metric":104.09960475597677,"metrics":{},"status":"discard","description":"Mirror stability sample in recovered low-104 plateau.","timestamp":1776305779671,"segment":23,"confidence":3.7206792894103087,"iterationTokens":3051,"asi":{"hypothesis":"Recovered regime may stabilize around 104+ before higher-band re-entry.","rollback_reason":"Stable ~104.10 but still below keep.","next_action_hint":"Collect another control parity check, then consider a single major candidate if plateau persists.","backend":"mirror_sd_mlx","context_only_draft_cache":1,"draft_sink":48,"delta_vs_keep":-2.7603952440232273}}
{"run":1018,"commit":"8b55918","metric":32.40294876802335,"metrics":{},"status":"discard","description":"Control parity check after mirror low-104 plateau sample (mirror disabled).","timestamp":1776305829015,"segment":23,"confidence":3.7090826203708187,"iterationTokens":672,"asi":{"hypothesis":"Control should remain near mirror in same recovered band if regime is stable.","rollback_reason":"Control collapsed to ~32.40, signaling fresh severe instability wave.","next_action_hint":"Run immediate mirror follow-up to classify collapse symmetry and recovery pace.","backend":"bstnxbt_mlx","mirror_runtime_enabled":0,"context_only_draft_cache":1,"draft_sink":48,"paired_mirror_tok_s":104.09960475597677,"paired_delta_tok_s":71.69665598795343,"severe_collapse":true}}
{"run":1019,"commit":"8b55918","metric":27.686255566758078,"metrics":{},"status":"discard","description":"Mirror follow-up after control severe collapse to 32.40.","timestamp":1776305881994,"segment":23,"confidence":3.678563047095448,"iterationTokens":658,"asi":{"hypothesis":"If collapse is shared, mirror should also drop sharply on immediate rerun.","rollback_reason":"Mirror collapsed further to ~27.69, confirming symmetric severe trough.","next_action_hint":"Stay in recovery-only loop (no candidate probes) until high-band re-entry is re-established.","backend":"mirror_sd_mlx","context_only_draft_cache":1,"draft_sink":48,"paired_control_tok_s":32.40294876802335,"paired_delta_tok_s":-4.71669320126527,"shared_collapse_confirmed":true,"severe_collapse":true,"delta_vs_keep":-79.17374443324192}}
{"run":1020,"commit":"8b55918","metric":40.84937308892752,"metrics":{},"status":"discard","description":"Mirror recovery sample after symmetric severe trough (~27-32 tok/s).","timestamp":1776305921527,"segment":23,"confidence":3.648541625390598,"iterationTokens":693,"asi":{"hypothesis":"Shared recovery should begin with a climb from high-20/30 into 40s/50s.","rollback_reason":"Recovered to ~40.85 but still deep in degraded trough.","next_action_hint":"Continue recovery-only sampling; interleave control parity after another rebound step.","backend":"mirror_sd_mlx","context_only_draft_cache":1,"draft_sink":48,"delta_vs_keep":-66.01062691107246}}
