{"run":1569,"commit":"b304c02","metric":44.367715241266666,"metrics":{},"status":"discard","description":"Control parity sample (`DFLASH_MIRROR_SD_RUNTIME=0`) also deeply degraded at ~44.37, confirming shared collapse.","timestamp":1776360440315,"segment":23,"confidence":2.9811486917171983,"iterationTokens":778,"asi":{"hypothesis":"Deep-collapse branch is shared across backends with inflated warmup/request time.","rollback_reason":"Control remains non-authoritative and still far below keep.","next_action_hint":"Restore mirror lane and track rebound ladder from 40s.","backend":"bstnxbt_mlx","mirror_runtime_enabled":0,"paired_mirror_tok_s":40.191619761241164,"paired_delta_tok_s":-4.176095480025501,"authoritative_lane":"mirror_sd_mlx","warmup_s":6.038444709032774,"request_s":23.079845207976177,"shared_deep_collapse_confirmed":true}}
{"run":1570,"commit":"b304c02","metric":60.08538109170791,"metrics":{},"status":"discard","description":"Mirror rebounded from deep trough to ~60.09, beginning recovery from shared collapse.","timestamp":1776360495028,"segment":23,"confidence":2.9777033795808068,"iterationTokens":1532,"asi":{"hypothesis":"Post-collapse ladder is restarting from 40s into 60s.","rollback_reason":"Below keep and not yet validated against refreshed control sample.","next_action_hint":"Run immediate control parity to test if mirror has reclaimed lead in this branch.","backend":"mirror_sd_mlx","paired_last_control_tok_s":44.367715241266666,"paired_delta_tok_s":15.71766585044124,"delta_vs_keep":-48.77695140276703,"warmup_s":4.213520833989605,"request_s":17.042415000032634}}
{"run":1571,"commit":"b304c02","metric":62.582756440315386,"metrics":{},"status":"discard","description":"Control parity (`DFLASH_MIRROR_SD_RUNTIME=0`) recovered to ~62.58 and stayed above paired mirror ~60.09.","timestamp":1776360543318,"segment":23,"confidence":2.973468526635356,"iterationTokens":800,"asi":{"hypothesis":"In this collapse branch control currently recovers slightly faster than mirror.","rollback_reason":"Control non-authoritative; mirror did not reclaim lead in immediate parity.","next_action_hint":"Restore mirror lane and continue tracking for a mirror-led crossover.","backend":"bstnxbt_mlx","mirror_runtime_enabled":0,"paired_mirror_tok_s":60.08538109170791,"paired_delta_tok_s":-2.497375348607475,"authoritative_lane":"mirror_sd_mlx","warmup_s":4.1354850000934675,"request_s":16.362334582954645}}
{"run":1572,"commit":"b304c02","metric":71.88717055842714,"metrics":{},"status":"discard","description":"Mirror climbed to ~71.89, continuing staged rebound from deep-collapse band.","timestamp":1776360583415,"segment":23,"confidence":2.9692457020942906,"iterationTokens":1110,"asi":{"hypothesis":"Recovery ladder is progressing through 60s into low-70s.","rollback_reason":"Below keep and still below prior control-led peaks.","next_action_hint":"Continue mirror scans for 80+/90+ transition before next parity check.","backend":"mirror_sd_mlx","delta_vs_keep":-36.97516193604795,"paired_prev_tok_s":60.08538109170791,"paired_delta_tok_s":11.801789466719226,"context_only_draft_cache":1,"draft_sink":48,"async_draft_eval":1,"fused_draft_verify_eval":1}}
{"run":1573,"commit":"b304c02","metric":74.89370570227763,"metrics":{},"status":"discard","description":"Mirror advanced to ~74.89, sustaining gradual rebound.","timestamp":1776360620835,"segment":23,"confidence":2.9566913656780933,"iterationTokens":664,"asi":{"hypothesis":"Current recovery branch is steady but slower than prior sharp rebounds.","rollback_reason":"Below keep.","next_action_hint":"Continue mirror run sequence toward 80/90 bands.","backend":"mirror_sd_mlx","delta_vs_keep":-33.96862679219746,"paired_prev_tok_s":71.88717055842714,"paired_delta_tok_s":3.0065351438504884,"context_only_draft_cache":1,"draft_sink":48,"async_draft_eval":1,"fused_draft_verify_eval":1}}
{"run":1574,"commit":"b304c02","metric":76.35858320176455,"metrics":{},"status":"discard","description":"Mirror reached ~76.36, entering upper-70 rebound range.","timestamp":1776360655128,"segment":23,"confidence":2.944242744843645,"iterationTokens":636,"asi":{"hypothesis":"Recovery is climbing stepwise toward the high-80/low-90 basin.","rollback_reason":"Below keep.","next_action_hint":"Continue mirror scans; parity check once mirror returns near/above prior control levels.","backend":"mirror_sd_mlx","delta_vs_keep":-32.50374929271054,"paired_prev_tok_s":74.89370570227763,"paired_delta_tok_s":1.4648774994869227,"context_only_draft_cache":1,"draft_sink":48,"async_draft_eval":1,"fused_draft_verify_eval":1}}
{"run":1575,"commit":"b304c02","metric":76.60444464903865,"metrics":{},"status":"discard","description":"Mirror held near ~76.60, showing a temporary upper-70 plateau.","timestamp":1776360690135,"segment":23,"confidence":2.9407208515450747,"iterationTokens":653,"asi":{"hypothesis":"Recovery may pause in high-70s before next jump.","rollback_reason":"Below keep.","next_action_hint":"Continue mirror runs for transition into 80s.","backend":"mirror_sd_mlx","delta_vs_keep":-32.25788784543644,"paired_prev_tok_s":76.35858320176455,"paired_delta_tok_s":0.24586144727410247,"context_only_draft_cache":1,"draft_sink":48,"async_draft_eval":1,"fused_draft_verify_eval":1}}
{"run":1576,"commit":"b304c02","metric":77.35201735745197,"metrics":{},"status":"discard","description":"Mirror edged up to ~77.35, sustaining gradual rebound continuation.","timestamp":1776360722225,"segment":23,"confidence":2.9372073739335955,"iterationTokens":642,"asi":{"hypothesis":"Rebound remains intact but slow, with small incremental gains.","rollback_reason":"Below keep.","next_action_hint":"Continue mirror sequence toward 80+/90+ ranges.","backend":"mirror_sd_mlx","delta_vs_keep":-31.51031513702308,"paired_prev_tok_s":76.60444464903865,"paired_delta_tok_s":0.747572708413319,"context_only_draft_cache":1,"draft_sink":48,"async_draft_eval":1,"fused_draft_verify_eval":1}}
{"run":1577,"commit":"b304c02","metric":77.99641033305326,"metrics":{},"status":"discard","description":"Mirror advanced to ~78.00, continuing slow climb out of collapse trough.","timestamp":1776360758117,"segment":23,"confidence":2.936916822977504,"iterationTokens":636,"asi":{"hypothesis":"Recovery remains gradual and stable in upper-70s.","rollback_reason":"Below keep.","next_action_hint":"Continue mirror scans for break into 80s/90s.","backend":"mirror_sd_mlx","delta_vs_keep":-30.865922161421683,"paired_prev_tok_s":77.35201735745197,"paired_delta_tok_s":0.6443929756012937,"context_only_draft_cache":1,"draft_sink":48,"async_draft_eval":1,"fused_draft_verify_eval":1}}
{"run":1578,"commit":"b304c02","metric":78.6108752075018,"metrics":{},"status":"discard","description":"Mirror moved up to ~78.61, maintaining steady recovery progression.","timestamp":1776360790658,"segment":23,"confidence":2.936626329498793,"iterationTokens":677,"asi":{"hypothesis":"Upper-70 recovery shelf is still rising incrementally.","rollback_reason":"Below keep.","next_action_hint":"Continue mirror sequence toward 80+.","backend":"mirror_sd_mlx","delta_vs_keep":-30.251457286973146,"paired_prev_tok_s":77.99641033305326,"paired_delta_tok_s":0.6144648744485478,"context_only_draft_cache":1,"draft_sink":48,"async_draft_eval":1,"fused_draft_verify_eval":1}}
{"run":1579,"commit":"b304c02","metric":77.66672423789167,"metrics":{},"status":"discard","description":"Mirror dipped to ~77.67, minor pullback within upper-70 recovery shelf.","timestamp":1776360826448,"segment":23,"confidence":2.93498084587066,"iterationTokens":631,"asi":{"hypothesis":"Recovery remains range-bound in upper-70s before next jump.","rollback_reason":"Below keep.","next_action_hint":"Continue mirror scans to detect breakout from upper-70 shelf.","backend":"mirror_sd_mlx","delta_vs_keep":-31.195608256583274,"paired_prev_tok_s":78.6108752075018,"paired_delta_tok_s":-0.9441509696101348,"context_only_draft_cache":1,"draft_sink":48,"async_draft_eval":1,"fused_draft_verify_eval":1}}
{"run":1580,"commit":"b304c02","metric":80.6317053162608,"metrics":{},"status":"discard","description":"Mirror crossed into ~80.63, breaking above upper-70 shelf.","timestamp":1776360860917,"segment":23,"confidence":2.932789465282418,"iterationTokens":651,"asi":{"hypothesis":"Recovery is resuming upward after consolidation in high-70s.","rollback_reason":"Below keep.","next_action_hint":"Continue mirror sequence toward 90+ and potential control crossover.","backend":"mirror_sd_mlx","delta_vs_keep":-28.230627178214142,"paired_prev_tok_s":77.66672423789167,"paired_delta_tok_s":2.964981078369137,"context_only_draft_cache":1,"draft_sink":48,"async_draft_eval":1,"fused_draft_verify_eval":1}}
{"run":1581,"commit":"b304c02","metric":84.88552798542177,"metrics":{},"status":"discard","description":"Mirror climbed to ~84.89, continuing rebound into mid-80s.","timestamp":1776360896590,"segment":23,"confidence":2.9160202070688106,"iterationTokens":640,"asi":{"hypothesis":"Recovery ladder is progressing normally from 80s toward 90s.","rollback_reason":"Below keep.","next_action_hint":"Continue mirror scans for 90+/100+ transition.","backend":"mirror_sd_mlx","delta_vs_keep":-23.976804509053167,"paired_prev_tok_s":80.6317053162608,"paired_delta_tok_s":4.253822669160971,"context_only_draft_cache":1,"draft_sink":48,"async_draft_eval":1,"fused_draft_verify_eval":1}}
{"run":1582,"commit":"b304c02","metric":86.53989782989021,"metrics":{},"status":"discard","description":"Mirror reached ~86.54, sustaining upward movement.","timestamp":1776360931965,"segment":23,"confidence":2.8994416268836107,"iterationTokens":646,"asi":{"hypothesis":"Rebound is intact and approaching the low-90 basin.","rollback_reason":"Below keep.","next_action_hint":"Continue mirror runs for basin transition into 90s.","backend":"mirror_sd_mlx","delta_vs_keep":-22.322434664584733,"paired_prev_tok_s":84.88552798542177,"paired_delta_tok_s":1.6543698444684398,"context_only_draft_cache":1,"draft_sink":48,"async_draft_eval":1,"fused_draft_verify_eval":1}}
{"run":1583,"commit":"b304c02","metric":89.3337293740994,"metrics":{},"status":"discard","description":"Mirror moved up to ~89.33, entering high-80/low-90 basin.","timestamp":1776360967906,"segment":23,"confidence":2.8963457799653,"iterationTokens":632,"asi":{"hypothesis":"Recovery has returned to the lower basin seen in prior oscillations.","rollback_reason":"Below keep.","next_action_hint":"Continue mirror scans for low-basin hold and possible upper-basin jump.","backend":"mirror_sd_mlx","delta_vs_keep":-19.52860312037554,"paired_prev_tok_s":86.53989782989021,"paired_delta_tok_s":2.793831544209192,"context_only_draft_cache":1,"draft_sink":48,"async_draft_eval":1,"fused_draft_verify_eval":1}}
{"run":1584,"commit":"b304c02","metric":90.88392751849995,"metrics":{},"status":"discard","description":"Mirror climbed to ~90.88, strengthening low-90 occupancy.","timestamp":1776361001521,"segment":23,"confidence":2.8937896085823827,"iterationTokens":654,"asi":{"hypothesis":"Lower basin is stabilizing before the next possible upper-basin jump.","rollback_reason":"Below keep.","next_action_hint":"Continue mirror scans for transition above mid-90/100.","backend":"mirror_sd_mlx","delta_vs_keep":-17.978404975975,"paired_prev_tok_s":89.3337293740994,"paired_delta_tok_s":1.5501981444005533,"context_only_draft_cache":1,"draft_sink":48,"async_draft_eval":1,"fused_draft_verify_eval":1}}
{"run":1585,"commit":"b304c02","metric":91.34270385501621,"metrics":{},"status":"discard","description":"Mirror inched up to ~91.34, continuing gradual low-basin improvement.","timestamp":1776361035532,"segment":23,"confidence":2.8891394103074886,"iterationTokens":644,"asi":{"hypothesis":"Recovery is building slowly and may retest the upper basin soon.","rollback_reason":"Below keep.","next_action_hint":"Continue mirror sequence for 95+/100+ attempts.","backend":"mirror_sd_mlx","delta_vs_keep":-17.519628639458727,"paired_prev_tok_s":90.88392751849995,"paired_delta_tok_s":0.4587763365162678,"context_only_draft_cache":1,"draft_sink":48,"async_draft_eval":1,"fused_draft_verify_eval":1}}
{"run":1586,"commit":"b304c02","metric":90.3088714431132,"metrics":{},"status":"discard","description":"Mirror eased to ~90.31, remaining in the same low-90 basin.","timestamp":1776361072493,"segment":23,"confidence":2.884504133400952,"iterationTokens":646,"asi":{"hypothesis":"Current basin is stable but lacks momentum for immediate 100+ jump.","rollback_reason":"Below keep.","next_action_hint":"Continue mirror scans and wait for regime jump.","backend":"mirror_sd_mlx","delta_vs_keep":-18.55346105136174,"paired_prev_tok_s":91.34270385501621,"paired_delta_tok_s":-1.0338324119030171,"context_only_draft_cache":1,"draft_sink":48,"async_draft_eval":1,"fused_draft_verify_eval":1}}
{"run":1587,"commit":"b304c02","metric":95.1489465683444,"metrics":{},"status":"discard","description":"Mirror jumped to ~95.15, moving toward the mid-range bridge.","timestamp":1776361109781,"segment":23,"confidence":2.8715529255306174,"iterationTokens":647,"asi":{"hypothesis":"A basin transition toward upper-side samples may be underway.","rollback_reason":"Below keep.","next_action_hint":"Continue mirror runs for 100+ retest.","backend":"mirror_sd_mlx","delta_vs_keep":-13.713385926130544,"paired_prev_tok_s":90.3088714431132,"paired_delta_tok_s":4.840075125231193,"context_only_draft_cache":1,"draft_sink":48,"async_draft_eval":1,"fused_draft_verify_eval":1}}
{"run":1588,"commit":"b304c02","metric":95.62397367083295,"metrics":{},"status":"discard","description":"Mirror held near ~95.62, sustaining mid-90 bridge state.","timestamp":1776361143375,"segment":23,"confidence":2.8626640587510606,"iterationTokens":634,"asi":{"hypothesis":"Current transition state is stabilizing just below the upper basin.","rollback_reason":"Below keep.","next_action_hint":"Continue immediate mirror scans for >100 jump.","backend":"mirror_sd_mlx","delta_vs_keep":-13.238358823641995,"paired_prev_tok_s":95.1489465683444,"paired_delta_tok_s":0.4750271024885475,"context_only_draft_cache":1,"draft_sink":48,"async_draft_eval":1,"fused_draft_verify_eval":1}}
{"run":1589,"commit":"b304c02","metric":96.64796381535663,"metrics":{},"status":"discard","description":"Mirror climbed to ~96.65, highest in current transition sequence.","timestamp":1776361178335,"segment":23,"confidence":2.8568369391781925,"iterationTokens":636,"asi":{"hypothesis":"Momentum is building for a possible return into 100+ basin.","rollback_reason":"Below keep.","next_action_hint":"Continue mirror scans for low-100 breakout.","backend":"mirror_sd_mlx","delta_vs_keep":-12.214368679118309,"paired_prev_tok_s":95.62397367083295,"paired_delta_tok_s":1.0239901445236819,"context_only_draft_cache":1,"draft_sink":48,"async_draft_eval":1,"fused_draft_verify_eval":1}}
{"run":1590,"commit":"b304c02","metric":96.23945730408263,"metrics":{},"status":"discard","description":"Mirror held around ~96.24, maintaining mid-90 transition plateau.","timestamp":1776361211023,"segment":23,"confidence":2.851033494297275,"iterationTokens":636,"asi":{"hypothesis":"Recovery is pausing just below 100 before another basin switch.","rollback_reason":"Below keep.","next_action_hint":"Continue mirror scans for 100+ jump.","backend":"mirror_sd_mlx","delta_vs_keep":-12.62287519039231,"paired_prev_tok_s":96.64796381535663,"paired_delta_tok_s":-0.4085065112740018,"context_only_draft_cache":1,"draft_sink":48,"async_draft_eval":1,"fused_draft_verify_eval":1}}
{"run":1591,"commit":"b304c02","metric":93.43463672107352,"metrics":{},"status":"discard","description":"Mirror dipped to ~93.43, pulling back within the transition plateau.","timestamp":1776361245331,"segment":23,"confidence":2.8452654911463635,"iterationTokens":705,"asi":{"hypothesis":"State remains volatile and can retrace before 100+ breakout.","rollback_reason":"Below keep.","next_action_hint":"Continue mirror scans for renewed upward push.","backend":"mirror_sd_mlx","delta_vs_keep":-15.427695773401418,"paired_prev_tok_s":96.23945730408263,"paired_delta_tok_s":-2.80482058300911,"context_only_draft_cache":1,"draft_sink":48,"async_draft_eval":1,"fused_draft_verify_eval":1}}
{"run":1592,"commit":"b304c02","metric":93.75829984701726,"metrics":{},"status":"discard","description":"Mirror recovered slightly to ~93.76, still below 100+ threshold.","timestamp":1776361279073,"segment":23,"confidence":2.8361488243449724,"iterationTokens":633,"asi":{"hypothesis":"Transition plateau is stabilizing in low/mid-90s.","rollback_reason":"Below keep.","next_action_hint":"Continue mirror-only scans for decisive basin jump.","backend":"mirror_sd_mlx","delta_vs_keep":-15.104032647457679,"paired_prev_tok_s":93.43463672107352,"paired_delta_tok_s":0.32366312594373775,"context_only_draft_cache":1,"draft_sink":48,"async_draft_eval":1,"fused_draft_verify_eval":1}}
{"run":1593,"commit":"b304c02","metric":86.75845574286886,"metrics":{},"status":"discard","description":"Mirror slid to ~86.76, re-entering lower basin from mid-90 plateau.","timestamp":1776361316509,"segment":23,"confidence":2.830458172244416,"iterationTokens":638,"asi":{"hypothesis":"Lower-basin pullbacks remain frequent before high-side jumps.","rollback_reason":"Below keep.","next_action_hint":"Continue mirror runs for rebound back to mid/high-90s.","backend":"mirror_sd_mlx","delta_vs_keep":-22.103876751606077,"paired_prev_tok_s":93.75829984701726,"paired_delta_tok_s":-6.999844104148395,"context_only_draft_cache":1,"draft_sink":48,"async_draft_eval":1,"fused_draft_verify_eval":1}}
{"run":1594,"commit":"b304c02","metric":83.1323945287982,"metrics":{},"status":"discard","description":"Mirror dropped further to ~83.13, deepening current downswing branch.","timestamp":1776361355731,"segment":23,"confidence":2.826536753036737,"iterationTokens":651,"asi":{"hypothesis":"Lower basin is strengthening and may trend toward sub-80 again.","rollback_reason":"Below keep.","next_action_hint":"Run one more mirror sample; parity check if downtrend continues.","backend":"mirror_sd_mlx","delta_vs_keep":-25.729937965676744,"paired_prev_tok_s":86.75845574286886,"paired_delta_tok_s":-3.6260612140706594,"warmup_s":2.283438832964748,"context_only_draft_cache":1,"draft_sink":48,"async_draft_eval":1,"fused_draft_verify_eval":1}}
{"run":1595,"commit":"b304c02","metric":91.48265714306928,"metrics":{},"status":"discard","description":"Mirror rebounded to ~91.48, reversing the brief downswing.","timestamp":1776361392387,"segment":23,"confidence":2.825663262004389,"iterationTokens":684,"asi":{"hypothesis":"Regime continues rapid oscillation rather than sustained directional moves.","rollback_reason":"Below keep.","next_action_hint":"Continue mirror scans for next upper-basin jump and potential control crossover test.","backend":"mirror_sd_mlx","delta_vs_keep":-17.37967535140566,"paired_prev_tok_s":83.1323945287982,"paired_delta_tok_s":8.350262614271076,"context_only_draft_cache":1,"draft_sink":48,"async_draft_eval":1,"fused_draft_verify_eval":1}}
{"run":1596,"commit":"b304c02","metric":88.87831080384855,"metrics":{},"status":"discard","description":"Mirror eased to ~88.88, still within lower basin.","timestamp":1776361424323,"segment":23,"confidence":2.822029135628865,"iterationTokens":656,"asi":{"hypothesis":"Lower-basin residency remains dominant this segment.","rollback_reason":"Below keep.","next_action_hint":"Continue mirror loop for upper-basin re-entry.","backend":"mirror_sd_mlx","delta_vs_keep":-19.984021690626392,"paired_prev_tok_s":91.48265714306928,"paired_delta_tok_s":-2.6043463392207338,"context_only_draft_cache":1,"draft_sink":48,"async_draft_eval":1,"fused_draft_verify_eval":1}}
{"run":1597,"commit":"b304c02","metric":87.16521783196478,"metrics":{},"status":"discard","description":"Mirror dipped to ~87.17, lower side of current basin.","timestamp":1776361461997,"segment":23,"confidence":2.820297907663496,"iterationTokens":629,"asi":{"hypothesis":"Lower basin remains sticky; upward transitions are currently short-lived.","rollback_reason":"Below keep.","next_action_hint":"Continue mirror scans; parity check deferred until mirror regains upper basin.","backend":"mirror_sd_mlx","delta_vs_keep":-21.69711466251016,"paired_prev_tok_s":88.87831080384855,"paired_delta_tok_s":-1.713092971883773,"context_only_draft_cache":1,"draft_sink":48,"async_draft_eval":1,"fused_draft_verify_eval":1}}
{"run":1598,"commit":"b304c02","metric":89.89746443785992,"metrics":{},"status":"discard","description":"Mirror rebounded to ~89.90, returning to mid-lower basin center.","timestamp":1776361493949,"segment":23,"confidence":2.819067594523875,"iterationTokens":643,"asi":{"hypothesis":"Regime remains bounded around high-80/low-90 absent a major shift.","rollback_reason":"Below keep.","next_action_hint":"Continue mirror sampling for next basin switch.","backend":"mirror_sd_mlx","delta_vs_keep":-18.96486805661502,"paired_prev_tok_s":87.16521783196478,"paired_delta_tok_s":2.7322466058951416,"context_only_draft_cache":1,"draft_sink":48,"async_draft_eval":1,"fused_draft_verify_eval":1}}
{"run":1599,"commit":"b304c02","metric":87.66107892440832,"metrics":{},"status":"discard","description":"Mirror eased to ~87.66, remaining in lower basin.","timestamp":1776361530116,"segment":23,"confidence":2.810280225996958,"iterationTokens":650,"asi":{"hypothesis":"Lower basin remains dominant while upper-basin jumps are sporadic.","rollback_reason":"Below keep.","next_action_hint":"Continue mirror loop for spontaneous upper-basin re-entry.","backend":"mirror_sd_mlx","delta_vs_keep":-21.20125357006662,"paired_prev_tok_s":89.89746443785992,"paired_delta_tok_s":-2.2363855134515935,"context_only_draft_cache":1,"draft_sink":48,"async_draft_eval":1,"fused_draft_verify_eval":1}}
