{"run":2467,"commit":"26f9501","metric":51.4982100410509,"metrics":{},"status":"discard","description":"Control relapsed within the rebound wave (~51.5 tok/s) with safe_mode still active and unfused wait inflation persisting (eval ~16.46s).","timestamp":1776481140590,"segment":25,"confidence":3.0262836312916948,"iterationTokens":4240,"asi":{"hypothesis":"Recovery remains unstable and can whipsaw between mid-60 and low-50 bands before safe-mode clears.","rollback_reason":"No code changes; monitoring-only sample.","next_action_hint":"Continue passive control tracking; wait for sustained fused-only/safe_mode=0 before new DDTree optimization probes.","diagnostic_findings":{"completion_tok_s":51.4982100410509,"dflash_eval_s":16.45997420733329,"safe_mode_active":1,"safe_mode_step":54,"verify_eval_wait_fused_steps":54,"verify_eval_wait_unfused_steps":49}}}
{"run":2468,"commit":"26f9501","metric":64.62653813045907,"metrics":{},"status":"discard","description":"Control bounced back to ~64.6 tok/s, but safe mode remained active (step ~73) with residual unfused share and eval still elevated (~13.59s).","timestamp":1776481189442,"segment":25,"confidence":2.992976098703212,"iterationTokens":4974,"asi":{"hypothesis":"Rebound is progressing (later safe-mode step) but has not yet cleared mixed-mode inflation.","rollback_reason":"No code changes; monitoring-only run.","next_action_hint":"Continue passive monitoring and only resume DDTree variant A/B after fused-only/safe_mode=0 and near-floor eval reappear.","diagnostic_findings":{"completion_tok_s":64.62653813045907,"dflash_eval_s":13.59353650198318,"safe_mode_active":1,"safe_mode_step":73,"verify_eval_wait_fused_steps":73,"verify_eval_wait_unfused_steps":28}}}
{"run":2469,"commit":"26f9501","metric":47.41120368821958,"metrics":{},"status":"discard","description":"Control remains in severe shared-collapse state (~47.4 tok/s) with early safe-mode activation, unfused-dominant verify waits, and elevated eval (~16.95s).","timestamp":1776481270444,"segment":25,"confidence":2.9536680855829838,"iterationTokens":8620,"asi":{"hypothesis":"The current wave is still in deep trough mode, so unchanged control should stay far below floor with early safe-mode triggers.","rollback_reason":"No code changes; monitoring-only run.","next_action_hint":"Continue passive control monitoring until safe_mode clears and fused-only near-floor timing returns before any DDTree A/B.","diagnostic_findings":{"completion_tok_s":47.41120368821958,"dflash_eval_s":16.954497548984364,"safe_mode_active":1,"safe_mode_step":6,"verify_eval_wait_fused_steps":6,"verify_eval_wait_unfused_steps":100}}}
{"run":2470,"commit":"26f9501","metric":92.82686694192998,"metrics":{},"status":"discard","description":"Control rebounded sharply to fused-only/safe_mode=0 (~92.8 tok/s), but eval remains inflated (~10.30s) versus true near-floor high-window timing.","timestamp":1776481299560,"segment":25,"confidence":2.992976098703212,"iterationTokens":4228,"asi":{"hypothesis":"The wave can rebound from safe-mode troughs into a fused-only inflation shelf before full floor re-entry.","rollback_reason":"No code changes; monitoring-only run.","next_action_hint":"Run additional control samples to check whether eval contracts toward ~8.8–9.0; defer DDTree A/B until floor-like timing is sustained.","diagnostic_findings":{"completion_tok_s":92.82686694192998,"dflash_eval_s":10.30303487693891,"safe_mode_active":0,"verify_eval_wait_fused_steps":96,"verify_eval_wait_unfused_steps":0}}}
{"run":2471,"commit":"26f9501","metric":52.83275706264629,"metrics":{},"status":"discard","description":"Control immediately relapsed from fused-only shelf to mixed safe-mode collapse (~52.8 tok/s), with unfused-dominant waits and eval inflation (~15.21s).","timestamp":1776481335483,"segment":25,"confidence":2.9536680855829838,"iterationTokens":4159,"asi":{"hypothesis":"This wave remains unstable and can rapidly toggle between fused-only shelf and early safe-mode collapse.","rollback_reason":"No code changes; monitoring-only run.","next_action_hint":"Continue passive monitoring; require sustained fused-only/safe_mode=0 near-floor window before any DDTree comparison or variant probe.","diagnostic_findings":{"completion_tok_s":52.83275706264629,"dflash_eval_s":15.214777245884761,"safe_mode_active":1,"safe_mode_step":8,"verify_eval_wait_fused_steps":8,"verify_eval_wait_unfused_steps":96}}}
{"run":2472,"commit":"26f9501","metric":57.16787606391652,"metrics":{},"status":"discard","description":"Control remains in mixed-mode rebound (~57.2 tok/s) with safe mode still active (step ~10) and unfused-heavy execution; no floor recovery yet.","timestamp":1776481374074,"segment":25,"confidence":2.9318508077956382,"iterationTokens":4301,"asi":{"hypothesis":"This rebound segment is still pre-floor and should continue showing safe-mode/unfused traces despite modest tok/s improvement.","rollback_reason":"No code changes; monitoring-only sample.","next_action_hint":"Continue passive monitoring and avoid DDTree variant probes until fused-only/safe_mode=0 near-floor runs persist.","diagnostic_findings":{"completion_tok_s":57.16787606391652,"dflash_eval_s":14.11016504035797,"safe_mode_active":1,"safe_mode_step":10,"verify_eval_wait_fused_steps":10,"verify_eval_wait_unfused_steps":94}}}
{"run":2473,"commit":"26f9501","metric":87.88736927268086,"metrics":{},"status":"discard","description":"Control returned to fused-only/safe_mode=0 shelf (~87.9 tok/s), but eval remains inflated (~10.89s), so this is still not the near-floor attribution window.","timestamp":1776481404171,"segment":25,"confidence":2.9536680855829838,"iterationTokens":4227,"asi":{"hypothesis":"The regime is oscillating between mixed collapse and fused-only inflated shelf rather than stabilizing at floor.","rollback_reason":"No code changes; monitoring-only run.","next_action_hint":"Keep passive control sampling and wait for sustained ~8.8–9.0 eval before resuming DDTree variant experiments.","diagnostic_findings":{"completion_tok_s":87.88736927268086,"dflash_eval_s":10.892452212516218,"safe_mode_active":0,"verify_eval_wait_fused_steps":96,"verify_eval_wait_unfused_steps":0}}}
{"run":2474,"commit":"26f9501","metric":59.77747542753907,"metrics":{},"status":"discard","description":"Control stayed in the oscillatory rebound pocket (~59.8 tok/s) with safe_mode still active and mostly unfused waits; still below stable floor regime.","timestamp":1776481438526,"segment":25,"confidence":2.9318508077956382,"iterationTokens":4176,"asi":{"hypothesis":"This instability wave has not cleared and should keep alternating between mixed-mode shelves and fused-only inflation pockets.","rollback_reason":"No code changes; monitoring-only run.","next_action_hint":"Continue passive monitoring, and only switch back to DDTree parity checks after sustained fused-only/safe_mode=0 behavior.","diagnostic_findings":{"completion_tok_s":59.77747542753907,"dflash_eval_s":13.492794836638495,"safe_mode_active":1,"safe_mode_step":9,"verify_eval_wait_fused_steps":9,"verify_eval_wait_unfused_steps":95}}}
{"run":2475,"commit":"26f9501","metric":91.58189581024449,"metrics":{},"status":"discard","description":"Control bounced back to fused-only/safe_mode=0 (~91.6 tok/s) but remained on an inflated shelf (eval ~10.44s), still short of near-floor attribution criteria.","timestamp":1776481466863,"segment":25,"confidence":2.9536680855829838,"iterationTokens":4228,"asi":{"hypothesis":"Current wave continues alternating between mixed collapse and fused-only inflation without sustained floor re-entry.","rollback_reason":"No code changes; monitoring-only run.","next_action_hint":"Keep passive monitoring; wait for sustained eval contraction toward ~8.8–9.0 before resuming DDTree optimization tests.","diagnostic_findings":{"completion_tok_s":91.58189581024449,"dflash_eval_s":10.442167836707085,"safe_mode_active":0,"verify_eval_wait_fused_steps":96,"verify_eval_wait_unfused_steps":0}}}
{"run":2476,"commit":"26f9501","metric":56.70470439478109,"metrics":{},"status":"discard","description":"Control dropped back into mixed safe-mode behavior (~56.7 tok/s) with unfused-heavy waits and elevated eval (~14.23s), confirming continued whipsaw instability.","timestamp":1776481523003,"segment":25,"confidence":2.9318508077956382,"iterationTokens":5072,"asi":{"hypothesis":"The current regime still alternates rapidly between fused-only inflation shelves and safe-mode mixed collapse pockets.","rollback_reason":"No code changes; monitoring-only sample.","next_action_hint":"Continue passive monitoring and defer DDTree parity/variant runs until floor-like control timing is sustained.","diagnostic_findings":{"completion_tok_s":56.70470439478109,"dflash_eval_s":14.23030633595772,"safe_mode_active":1,"safe_mode_step":9,"verify_eval_wait_fused_steps":9,"verify_eval_wait_unfused_steps":95}}}
{"run":2477,"commit":"26f9501","metric":60.33079673610352,"metrics":{},"status":"discard","description":"Control held the mixed rebound band (~60.3 tok/s) with safe_mode still active and residual unfused waits; floor conditions remain absent.","timestamp":1776481558859,"segment":25,"confidence":2.9071446639793885,"iterationTokens":4270,"asi":{"hypothesis":"Near-term behavior will stay in the oscillatory mid-band until a full fused-only recovery reopens.","rollback_reason":"No code changes; monitoring-only run.","next_action_hint":"Continue passive control loop and postpone DDTree comparisons until sustained fused-only near-floor timing returns.","diagnostic_findings":{"completion_tok_s":60.33079673610352,"dflash_eval_s":13.390549634234048,"safe_mode_active":1,"safe_mode_step":10,"verify_eval_wait_fused_steps":10,"verify_eval_wait_unfused_steps":94}}}
{"run":2478,"commit":"26f9501","metric":56.07341400791518,"metrics":{},"status":"discard","description":"Control remained in mixed safe-mode rebound (~56.1 tok/s) with unfused share still dominant and eval elevated (~14.37s); no stable floor re-entry.","timestamp":1776481594049,"segment":25,"confidence":2.903975626752887,"iterationTokens":4212,"asi":{"hypothesis":"Short-term dynamics remain stuck in mid-band recovery with periodic spikes, not a true return to healthy near-floor mode.","rollback_reason":"No code changes; monitoring-only run.","next_action_hint":"Continue passive control monitoring and defer DDTree checks until sustained fused-only near-floor timing appears.","diagnostic_findings":{"completion_tok_s":56.07341400791518,"dflash_eval_s":14.367998583358712,"safe_mode_active":1,"safe_mode_step":9,"verify_eval_wait_fused_steps":9,"verify_eval_wait_unfused_steps":95}}}
{"run":2479,"commit":"26f9501","metric":56.07341400791518,"metrics":{},"status":"discard","description":"Control remained in mixed safe-mode rebound (~56.1 tok/s) with unfused-dominant waits and elevated eval (~14.37s), reinforcing unresolved oscillatory instability.","timestamp":1776481644850,"segment":25,"confidence":2.891909415148937,"iterationTokens":4212,"asi":{"hypothesis":"The current wave remains pre-floor and should continue to oscillate in mixed safe-mode shelves.","rollback_reason":"No code changes; monitoring-only run.","next_action_hint":"Continue passive control monitoring and defer DDTree optimization A/B until sustained fused-only near-floor behavior reappears.","diagnostic_findings":{"completion_tok_s":56.07341400791518,"dflash_eval_s":14.367998583358712,"safe_mode_active":1,"safe_mode_step":9,"verify_eval_wait_fused_steps":9,"verify_eval_wait_unfused_steps":95}}}
{"run":2480,"commit":"26f9501","metric":77.45376910979853,"metrics":{},"status":"discard","description":"Control rose to a fused-only shelf (~77.5 tok/s, safe_mode=0) but still with inflated eval (~12.45s), so attribution remains non-floor.","timestamp":1776481676055,"segment":25,"confidence":2.8505259958077436,"iterationTokens":17927,"asi":{"hypothesis":"Recovery can step through intermediate fused-only shelves before near-floor timing returns.","rollback_reason":"No code changes; monitoring-only run.","next_action_hint":"Continue passive control monitoring and wait for sustained eval contraction toward ~9s before DDTree comparisons.","diagnostic_findings":{"completion_tok_s":77.45376910979853,"dflash_eval_s":12.454068500199355,"safe_mode_active":0,"verify_eval_wait_fused_steps":96,"verify_eval_wait_unfused_steps":0}}}
{"run":2481,"commit":"26f9501","metric":83.63841451027628,"metrics":{},"status":"discard","description":"Control climbed further in fused-only/safe_mode=0 shelf (~83.6 tok/s), but eval still sits at ~11.49s, so the regime is improved yet still non-floor.","timestamp":1776481707586,"segment":25,"confidence":2.9027182191371517,"iterationTokens":4245,"asi":{"hypothesis":"The ongoing oscillation can trend upward in fused-only mode without fully returning to floor timing.","rollback_reason":"No code changes; monitoring-only run.","next_action_hint":"Continue monitoring for sustained near-floor eval (~8.8–9.0) before resuming DDTree parity/variant work.","diagnostic_findings":{"completion_tok_s":83.63841451027628,"dflash_eval_s":11.494571254472248,"safe_mode_active":0,"verify_eval_wait_fused_steps":96,"verify_eval_wait_unfused_steps":0}}}
{"run":2482,"commit":"26f9501","metric":85.1690508082521,"metrics":{},"status":"discard","description":"Control remained in fused-only/safe_mode=0 upper shelf (~85.2 tok/s) with eval still inflated (~11.27s), so floor criteria are not yet met.","timestamp":1776481740805,"segment":25,"confidence":2.9103206253469063,"iterationTokens":4222,"asi":{"hypothesis":"The wave is climbing in fused-only mode but remains above near-floor eval, indicating partial recovery only.","rollback_reason":"No code changes; monitoring-only run.","next_action_hint":"Keep passive monitoring and wait for sustained ~8.8–9.0 eval before resuming DDTree parity or optimization probes.","diagnostic_findings":{"completion_tok_s":85.1690508082521,"dflash_eval_s":11.269729208666831,"safe_mode_active":0,"verify_eval_wait_fused_steps":96,"verify_eval_wait_unfused_steps":0}}}
{"run":2483,"commit":"26f9501","metric":86.29042447520183,"metrics":{},"status":"discard","description":"Control held fused-only/safe_mode=0 shelf around ~86.3 tok/s, but eval remained elevated (~11.11s), still short of near-floor trust window.","timestamp":1776481773286,"segment":25,"confidence":2.9346484306306557,"iterationTokens":4175,"asi":{"hypothesis":"Upper-shelf recovery persists without re-entering true floor timing.","rollback_reason":"No code changes; monitoring-only run.","next_action_hint":"Continue passive monitoring and only resume DDTree attribution/optimization when eval stabilizes near ~8.8–9.0.","diagnostic_findings":{"completion_tok_s":86.29042447520183,"dflash_eval_s":11.11052325507626,"safe_mode_active":0,"verify_eval_wait_fused_steps":96,"verify_eval_wait_unfused_steps":0}}}
{"run":2484,"commit":"26f9501","metric":83.74535250072954,"metrics":{},"status":"discard","description":"Control dipped within the fused-only inflated shelf (~83.7 tok/s, eval ~11.47) while remaining safe_mode=0; still not at near-floor timing.","timestamp":1776481807009,"segment":25,"confidence":2.959386383927116,"iterationTokens":4263,"asi":{"hypothesis":"Upper-shelf oscillation can vary several tok/s without signaling true floor recovery.","rollback_reason":"No code changes; monitoring-only run.","next_action_hint":"Continue passive monitoring and keep DDTree tests paused until sustained eval near ~8.8–9.0 appears.","diagnostic_findings":{"completion_tok_s":83.74535250072954,"dflash_eval_s":11.470888917217962,"safe_mode_active":0,"verify_eval_wait_fused_steps":96,"verify_eval_wait_unfused_steps":0}}}
{"run":2485,"commit":"26f9501","metric":83.99382116573243,"metrics":{},"status":"discard","description":"Control stayed in the same fused-only inflated shelf (~84.0 tok/s, eval ~11.43) with safe_mode=0; still below near-floor stability threshold.","timestamp":1776481837346,"segment":25,"confidence":2.975063825894689,"iterationTokens":4246,"asi":{"hypothesis":"Current recovery is plateauing in upper-shelf mode rather than converging to floor timing.","rollback_reason":"No code changes; monitoring-only run.","next_action_hint":"Continue passive control sampling and wait for sustained floor-like eval before DDTree parity checks.","diagnostic_findings":{"completion_tok_s":83.99382116573243,"dflash_eval_s":11.433242712751962,"safe_mode_active":0,"verify_eval_wait_fused_steps":96,"verify_eval_wait_unfused_steps":0}}}
{"run":2486,"commit":"26f9501","metric":87.24667843843457,"metrics":{},"status":"discard","description":"Control returned to fused-only/safe_mode=0 upper shelf (~87.25 tok/s) but remains above floor with eval ~10.99s; still not a stable near-floor window.","timestamp":1776481889906,"segment":25,"confidence":2.9907393517942995,"iterationTokens":5092,"asi":{"hypothesis":"Recovery remains shelf-bound and may oscillate near high-80 tok/s until eval wait contracts further.","rollback_reason":"No code changes; monitoring-only sample.","next_action_hint":"Continue passive monitoring and trigger DDTree parity only after sustained control eval ~8.8–9.0.","diagnostic_findings":{"completion_tok_s":87.24667843843457,"dflash_eval_s":10.9943267905619,"safe_mode_active":0,"verify_eval_wait_fused_steps":96,"verify_eval_wait_unfused_steps":0}}}
{"run":2487,"commit":"26f9501","metric":84.74645121361367,"metrics":{},"status":"discard","description":"Control stayed fused-only/safe_mode=0 in the upper shelf (~84.7 tok/s) with eval ~11.31; still no sustained near-floor re-entry.","timestamp":1776481920703,"segment":25,"confidence":2.9976685738179376,"iterationTokens":4182,"asi":{"hypothesis":"The rebound is currently capped in a non-floor fused shelf rather than transitioning back to ~9s eval.","rollback_reason":"No code changes; monitoring-only run.","next_action_hint":"Continue passive control monitoring and defer DDTree A/B until floor-like timing persists for multiple samples.","diagnostic_findings":{"completion_tok_s":84.74645121361367,"dflash_eval_s":11.30588966596406,"safe_mode_active":0,"verify_eval_wait_fused_steps":96,"verify_eval_wait_unfused_steps":0}}}
{"run":2488,"commit":"26f9501","metric":87.18180866168896,"metrics":{},"status":"discard","description":"Control remained fused-only/safe_mode=0 around ~87.2 tok/s with eval ~10.99s; still an inflated shelf rather than near-floor recovery.","timestamp":1776481952367,"segment":25,"confidence":3.0140758815679978,"iterationTokens":4245,"asi":{"hypothesis":"The current regime is stabilizing in a high-but-inflated fused shelf and can persist without reaching floor.","rollback_reason":"No code changes; monitoring-only run.","next_action_hint":"Keep passive monitoring and continue deferring DDTree variant/parity tests until sustained ~8.8–9.0 eval reappears.","diagnostic_findings":{"completion_tok_s":87.18180866168896,"dflash_eval_s":10.989203465520404,"safe_mode_active":0,"verify_eval_wait_fused_steps":96,"verify_eval_wait_unfused_steps":0}}}
{"run":2489,"commit":"26f9501","metric":90.71616871332235,"metrics":{},"status":"discard","description":"Control improved to a higher fused-only shelf (~90.7 tok/s, safe_mode=0), but eval is still elevated (~10.54s) relative to floor.","timestamp":1776482017864,"segment":25,"confidence":3.0197282076945724,"iterationTokens":16667,"asi":{"hypothesis":"The system can rebound into high-80/low-90 fused shelves without fully re-entering the near-floor regime.","rollback_reason":"No code changes; monitoring-only sample.","next_action_hint":"Continue passive monitoring and wait for sustained ~8.8–9.0 eval before DDTree parity checks.","diagnostic_findings":{"completion_tok_s":90.71616871332235,"dflash_eval_s":10.5365982883377,"safe_mode_active":0,"verify_eval_wait_fused_steps":96,"verify_eval_wait_unfused_steps":0}}}
{"run":2490,"commit":"26f9501","metric":84.74645121361367,"metrics":{},"status":"discard","description":"Control slipped back to ~84.7 tok/s while staying fused-only and safe_mode=0; eval remains inflated (~11.31s), indicating ongoing upper-shelf oscillation.","timestamp":1776482024928,"segment":25,"confidence":3.0641536432066614,"iterationTokens":16667,"asi":{"hypothesis":"High fused-only shelf still has multi-tok/s variance without meaningful structural regime change.","rollback_reason":"No code changes; monitoring-only run.","next_action_hint":"Keep passive monitoring and defer DDTree probes until floor-like timing stabilizes.","diagnostic_findings":{"completion_tok_s":84.74645121361367,"dflash_eval_s":11.30588966596406,"safe_mode_active":0,"verify_eval_wait_fused_steps":96,"verify_eval_wait_unfused_steps":0}}}
{"run":2491,"commit":"26f9501","metric":84.74645121361367,"metrics":{},"status":"discard","description":"Control stayed in fused-only/safe_mode=0 shelf (~84.7 tok/s) with eval still inflated (~11.31s), reinforcing that floor recovery remains incomplete.","timestamp":1776482060329,"segment":25,"confidence":3.098602965748857,"iterationTokens":4725,"asi":{"hypothesis":"Repeated fused-only samples in this band indicate shelf stabilization, not true floor return.","rollback_reason":"No code changes; monitoring-only run.","next_action_hint":"Continue passive monitoring and only resume DDTree parity when eval consistently falls near ~8.8–9.0.","diagnostic_findings":{"completion_tok_s":84.74645121361367,"dflash_eval_s":11.30588966596406,"safe_mode_active":0,"verify_eval_wait_fused_steps":96,"verify_eval_wait_unfused_steps":0}}}
