{"run":2299,"commit":"68fb119","metric":18.77465913328342,"metrics":{},"status":"discard","description":"Split wait probe: continued rebound (~44.38 tok/s, eval_s ~18.77) with fused share rising but unfused wait bucket still slower.","timestamp":1776452707559,"segment":24,"confidence":0.04360769810587191,"iterationTokens":4046,"asi":{"hypothesis":"Mid-recovery should show fused wait mean near healthy while unfused wait remains elevated until safe-mode clears.","rollback_reason":"Primary metric still above floor.","next_action_hint":"Continue mirror sampling through rebound to identify clear handoff back to fused-dominant healthy shelf.","diagnostic_findings":{"completion_tok_s":44.37548725235207,"dflash_eval_s":18.77465913328342,"safe_mode_active":1,"spike_events":50,"safe_mode_step":42,"verify_eval_wait_fused_steps":42,"verify_eval_wait_fused_mean_s":0.11625595744200316,"verify_eval_wait_unfused_steps":60,"verify_eval_wait_unfused_mean_s":0.23153153129581672,"draft_sync_eval_wait_mean_s":0.05839718895731494,"verify_submit_mean_s":0.0017438521563057222,"verify_host_gap_mean_s":0.000010003613116329207,"thermal_warning_samples":0,"performance_warning_samples":0}}}
{"run":2300,"commit":"68fb119","metric":16.862796539906412,"metrics":{},"status":"discard","description":"Split wait probe: rebound advanced (~49.99 tok/s, eval_s ~16.86) to near-balanced fused/unfused step mix; unfused waits still ~2x fused.","timestamp":1776452751572,"segment":24,"confidence":0.04329522049876085,"iterationTokens":4098,"asi":{"hypothesis":"Late rebound should approach 50/50 mode mix before fully returning to fused-only healthy band.","rollback_reason":"Primary metric still above floor.","next_action_hint":"Continue mirror runs until safe mode clears and unfused wait bucket returns to zero.","diagnostic_findings":{"completion_tok_s":49.99433800448693,"dflash_eval_s":16.862796539906412,"safe_mode_active":1,"spike_events":48,"safe_mode_step":52,"verify_eval_wait_fused_steps":52,"verify_eval_wait_fused_mean_s":0.10709011050102372,"verify_eval_wait_unfused_steps":51,"verify_eval_wait_unfused_mean_s":0.22145277213113493,"draft_sync_eval_wait_mean_s":0.056026060476570445,"verify_submit_mean_s":0.001456578526627815,"verify_host_gap_mean_s":0.00000752102203884171,"thermal_warning_samples":0,"performance_warning_samples":0}}}
{"run":2301,"commit":"68fb119","metric":16.504458696581423,"metrics":{},"status":"discard","description":"Split wait probe: rebound continued (~48.83 tok/s, eval_s ~16.50) with near-all unfused execution but narrowing fused/unfused wait gap.","timestamp":1776452843705,"segment":24,"confidence":0.04288343544768956,"iterationTokens":7511,"asi":{"hypothesis":"As trough lifts, unfused wait mean should fall and converge toward fused bucket even before safe mode fully clears.","rollback_reason":"Primary metric remains above floor.","next_action_hint":"Keep sampling; look for transition back to fused-only profile and sub-10 eval band.","diagnostic_findings":{"completion_tok_s":48.83457341636078,"dflash_eval_s":16.504458696581423,"safe_mode_active":1,"spike_events":8,"safe_mode_step":7,"verify_eval_wait_fused_steps":7,"verify_eval_wait_fused_mean_s":0.1832679642830044,"verify_eval_wait_unfused_steps":99,"verify_eval_wait_unfused_mean_s":0.1537533134299641,"draft_sync_eval_wait_mean_s":0.038477982413211854,"verify_submit_mean_s":0.0014565106545012655,"verify_host_gap_mean_s":0.000007204017338325393,"thermal_warning_samples":0,"performance_warning_samples":0}}}
{"run":2302,"commit":"68fb119","metric":8.80928429402411,"metrics":{},"status":"discard","description":"Split wait probe: recovered to healthy fused-only profile (~107.24 tok/s, eval_s ~8.809), unfused wait bucket returned to zero.","timestamp":1776454101185,"segment":24,"confidence":0.04322091850751462,"iterationTokens":2400,"asi":{"hypothesis":"Post-collapse recovery should end with fused-only execution and unfused wait bucket empty.","rollback_reason":"Primary metric above best floor and no code delta.","next_action_hint":"Keep sampling to catch the next transition edge and reuse split wait attribution.","diagnostic_findings":{"completion_tok_s":107.23763446192294,"dflash_eval_s":8.80928429402411,"safe_mode_active":0,"spike_events":0,"verify_eval_wait_fused_steps":96,"verify_eval_wait_fused_mean_s":0.0917631719057681,"verify_eval_wait_unfused_steps":0,"verify_eval_wait_unfused_mean_s":0,"thermal_warning_samples":0}}}
{"run":2303,"commit":"68fb119","metric":8.816871417802759,"metrics":{},"status":"discard","description":"Split wait probe continuation: healthy fused-only sample (~107.17 tok/s, eval_s ~8.817), unfused wait bucket stayed empty.","timestamp":1776454135017,"segment":24,"confidence":0.043433633472179906,"iterationTokens":4008,"asi":{"hypothesis":"In healthy shelf, fused wait bucket should remain stable and unfused bucket zero.","rollback_reason":"Primary metric above floor and no code change.","next_action_hint":"Continue mirror sampling until a fresh collapse transition appears for split wait attribution.","diagnostic_findings":{"completion_tok_s":107.17043095522605,"dflash_eval_s":8.816871417802759,"verify_eval_wait_fused_steps":96,"verify_eval_wait_fused_mean_s":0.09184218055816018,"verify_eval_wait_unfused_steps":0,"verify_eval_wait_unfused_mean_s":0,"safe_mode_active":0,"spike_events":0}}}
{"run":2304,"commit":"68fb119","metric":8.859134833561257,"metrics":{},"status":"discard","description":"Split wait probe continuation: healthy fused-only run (~106.67 tok/s, eval_s ~8.859), no spikes.","timestamp":1776454165972,"segment":24,"confidence":0.04373961049899687,"iterationTokens":4055,"asi":{"hypothesis":"Healthy shelf remains fused-only with stable fused wait and empty unfused bucket.","rollback_reason":"Primary metric above best floor and unchanged code.","next_action_hint":"Continue mirror sampling for next collapse-edge capture.","diagnostic_findings":{"completion_tok_s":106.67091360227553,"dflash_eval_s":8.859134833561257,"verify_eval_wait_fused_steps":96,"verify_eval_wait_fused_mean_s":0.09228243446462632,"verify_eval_wait_unfused_steps":0,"verify_eval_wait_unfused_mean_s":0,"safe_mode_active":0,"spike_events":0}}}
{"run":2305,"commit":"68fb119","metric":26.836953749880195,"metrics":{},"status":"discard","description":"Split wait telemetry caught fresh mirror collapse transition (~29.62 tok/s, eval_s ~26.84): early safe-mode (step 5), nearly all unfused verify steps.","timestamp":1776454227158,"segment":24,"confidence":0.043433633472179906,"iterationTokens":3910,"asi":{"hypothesis":"New collapse edges should rapidly flip to unfused-dominant execution with large wait inflation.","rollback_reason":"Primary metric regressed sharply during collapse transition.","next_action_hint":"Run immediate control parity with sidecar enabled to confirm shared collapse and compare split wait buckets.","diagnostic_findings":{"completion_tok_s":29.62208543303619,"dflash_eval_s":26.836953749880195,"safe_mode_active":1,"spike_events":94,"safe_mode_step":5,"verify_eval_wait_fused_steps":5,"verify_eval_wait_fused_mean_s":0.22293475822079928,"verify_eval_wait_unfused_steps":100,"verify_eval_wait_unfused_mean_s":0.2572227308375295,"draft_sync_eval_wait_mean_s":0.06608250130200759,"verify_submit_mean_s":0.003974416754430249,"verify_host_gap_mean_s":0.000017672933505049773,"thermal_warning_samples":0,"performance_warning_samples":0}}}
{"run":2306,"commit":"68fb119","metric":29.356587163405493,"metrics":{},"status":"discard","description":"Immediate control parity after fresh mirror collapse: control also degraded hard (~27.41 tok/s, eval_s ~29.36) with unfused-dominant wait inflation.","timestamp":1776454299669,"segment":24,"confidence":0.04313190758361305,"iterationTokens":4088,"asi":{"hypothesis":"Shared collapse should reproduce unfused-heavy wait inflation on control lane at transition edge.","rollback_reason":"Control parity is diagnostic only and remains far above floor.","next_action_hint":"Resume mirror lane to map rebound and track fused/unfused wait-bucket convergence.","diagnostic_findings":{"completion_tok_s":27.407191586156888,"dflash_eval_s":29.356587163405493,"mirror_runtime":0,"safe_mode_active":1,"spike_events":92,"safe_mode_step":16,"verify_eval_wait_fused_steps":16,"verify_eval_wait_fused_mean_s":0.13204829432652332,"verify_eval_wait_unfused_steps":90,"verify_eval_wait_unfused_mean_s":0.3027089633901293,"draft_sync_eval_wait_mean_s":0.07679873338331365,"verify_submit_mean_s":0.0034203729921741025,"verify_host_gap_mean_s":0.00004086642578806517,"thermal_warning_samples":0,"performance_warning_samples":0}}}
{"run":2307,"commit":"68fb119","metric":23.919838411384262,"metrics":{},"status":"discard","description":"Mirror rebound sample after parity (~33.64 tok/s, eval_s ~23.92): fused share increased but unfused wait bucket remained dominant.","timestamp":1776454310739,"segment":24,"confidence":0.042716585533468215,"iterationTokens":4088,"asi":{"hypothesis":"Early rebound should reduce trough severity while unfused wait remains materially above fused wait.","rollback_reason":"Primary metric still far above floor.","next_action_hint":"Continue mirror sampling to observe progressive fused-share recovery.","diagnostic_findings":{"completion_tok_s":33.636968888458036,"dflash_eval_s":23.919838411384262,"safe_mode_active":1,"spike_events":68,"safe_mode_step":17,"verify_eval_wait_fused_steps":17,"verify_eval_wait_fused_mean_s":0.13995160046718358,"verify_eval_wait_unfused_steps":88,"verify_eval_wait_unfused_mean_s":0.24478010459543756,"draft_sync_eval_wait_mean_s":0.06176552980667276,"verify_submit_mean_s":0.0033780027901576387,"verify_host_gap_mean_s":0.000013969500460440204,"thermal_warning_samples":0,"performance_warning_samples":0}}}
{"run":2308,"commit":"68fb119","metric":19.447024957742542,"metrics":{},"status":"discard","description":"Mirror rebound progressed (~42.48 tok/s, eval_s ~19.45) with fused bucket rising and unfused bucket still slower.","timestamp":1776454320004,"segment":24,"confidence":0.04239342367890997,"iterationTokens":4088,"asi":{"hypothesis":"Mid-recovery should keep shrinking unfused share while fused wait approaches healthy baseline.","rollback_reason":"Primary metric still above floor.","next_action_hint":"Continue mirror runs through rebound to identify handoff back to healthy fused-only profile.","diagnostic_findings":{"completion_tok_s":42.47767970851781,"dflash_eval_s":19.447024957742542,"safe_mode_active":1,"spike_events":55,"safe_mode_step":35,"verify_eval_wait_fused_steps":35,"verify_eval_wait_fused_mean_s":0.11770824403502048,"verify_eval_wait_unfused_steps":67,"verify_eval_wait_unfused_mean_s":0.22876450994726158,"draft_sync_eval_wait_mean_s":0.05767937678385025,"verify_submit_mean_s":0.001795805543295893,"verify_host_gap_mean_s":0.000010971839347963824,"thermal_warning_samples":0,"performance_warning_samples":0}}}
{"run":2309,"commit":"68fb119","metric":18.77465913328342,"metrics":{},"status":"discard","description":"Mirror rebound continued (~44.38 tok/s, eval_s ~18.77) with near-balanced mode mix and persistent unfused wait penalty.","timestamp":1776454329332,"segment":24,"confidence":0.04226103006571988,"iterationTokens":4088,"asi":{"hypothesis":"Late rebound should approach balanced fused/unfused counts before safe-mode fully clears.","rollback_reason":"Primary metric still above floor.","next_action_hint":"Keep sampling until unfused bucket collapses toward zero and fused-only profile returns.","diagnostic_findings":{"completion_tok_s":44.37548725235207,"dflash_eval_s":18.77465913328342,"safe_mode_active":1,"spike_events":50,"safe_mode_step":42,"verify_eval_wait_fused_steps":42,"verify_eval_wait_fused_mean_s":0.11625595744200316,"verify_eval_wait_unfused_steps":60,"verify_eval_wait_unfused_mean_s":0.23153153129581672,"draft_sync_eval_wait_mean_s":0.05839718895731494,"verify_submit_mean_s":0.0017438521563057222,"verify_host_gap_mean_s":0.000010003613116329207,"thermal_warning_samples":0,"performance_warning_samples":0}}}
{"run":2310,"commit":"68fb119","metric":16.504458696581423,"metrics":{},"status":"discard","description":"Mirror rebound sample (~48.83 tok/s, eval_s ~16.50): mostly unfused execution with narrowed fused/unfused wait gap.","timestamp":1776454338400,"segment":24,"confidence":0.04221298405883419,"iterationTokens":4088,"asi":{"hypothesis":"As trough lifts, unfused wait mean should decline and converge toward fused bucket even before full recovery.","rollback_reason":"Primary metric remains above floor.","next_action_hint":"Continue mirror sampling to capture safe-mode exit and fused-only return.","diagnostic_findings":{"completion_tok_s":48.83457341636078,"dflash_eval_s":16.504458696581423,"safe_mode_active":1,"spike_events":8,"safe_mode_step":7,"verify_eval_wait_fused_steps":7,"verify_eval_wait_fused_mean_s":0.1832679642830044,"verify_eval_wait_unfused_steps":99,"verify_eval_wait_unfused_mean_s":0.1537533134299641,"draft_sync_eval_wait_mean_s":0.038477982413211854,"verify_submit_mean_s":0.0014565106545012655,"verify_host_gap_mean_s":0.000007204017338325393,"thermal_warning_samples":0,"performance_warning_samples":0}}}
{"run":2311,"commit":"68fb119","metric":17.03346712864004,"metrics":{},"status":"discard","description":"Split wait probe: collapse wave remained active (~47.28 tok/s, eval_s ~17.03) with unfused-dominant step mix and elevated waits.","timestamp":1776454387753,"segment":24,"confidence":0.04183824966572201,"iterationTokens":6645,"asi":{"hypothesis":"In late collapse/rebound, unfused bucket should still dominate step count until safe mode fully clears.","rollback_reason":"Primary metric remains above floor.","next_action_hint":"Continue mirror sampling until fused-only profile reappears; capture parity only on fresh transition edges.","diagnostic_findings":{"completion_tok_s":47.27554538820245,"dflash_eval_s":17.03346712864004,"safe_mode_active":1,"spike_events":7,"safe_mode_step":6,"verify_eval_wait_fused_steps":6,"verify_eval_wait_fused_mean_s":0.16788643749896437,"verify_eval_wait_unfused_steps":100,"verify_eval_wait_unfused_mean_s":0.16026144670671782,"draft_sync_eval_wait_mean_s":0.04002211247454397,"verify_submit_mean_s":0.001291883219789081,"verify_host_gap_mean_s":0.000005915523770282853,"thermal_warning_samples":0,"performance_warning_samples":0}}}
{"run":2312,"commit":"68fb119","metric":13.656413377728313,"metrics":{},"status":"discard","description":"Split wait probe: rebound improved (~59.20 tok/s, eval_s ~13.66) with mostly unfused steps but lower waits than trough.","timestamp":1776454430001,"segment":24,"confidence":0.04155103676524376,"iterationTokens":4385,"asi":{"hypothesis":"As recovery advances, unfused wait bucket should compress toward fused bucket while throughput rises.","rollback_reason":"Primary metric still above floor.","next_action_hint":"Continue mirror sampling toward full safe-mode exit and fused-only profile.","diagnostic_findings":{"completion_tok_s":59.20165013711377,"dflash_eval_s":13.656413377728313,"safe_mode_active":1,"spike_events":2,"safe_mode_step":10,"verify_eval_wait_fused_steps":10,"verify_eval_wait_fused_mean_s":0.15016366250347346,"verify_eval_wait_unfused_steps":94,"verify_eval_wait_unfused_mean_s":0.12930604125165004,"draft_sync_eval_wait_mean_s":0.032098715446215675,"verify_submit_mean_s":0.0012967464023789105,"verify_host_gap_mean_s":0.000006135002387544284,"thermal_warning_samples":0,"performance_warning_samples":0}}}
{"run":2313,"commit":"68fb119","metric":14.086889286525548,"metrics":{},"status":"discard","description":"Mirror run exited safe mode and returned to fused-only verify steps, but still sat on inflated shelf (~68.84 tok/s, eval_s ~14.09).","timestamp":1776454585355,"segment":24,"confidence":0.04143464729407372,"iterationTokens":4204,"asi":{"hypothesis":"Post-collapse recovery may clear safe mode before fully returning to near-floor eval_s.","rollback_reason":"Primary metric remains above floor despite fused-only profile.","next_action_hint":"Keep mirror sampling to see whether this fused-only inflated shelf relaxes toward ~8.8s floor or represents separate inflation mode.","diagnostic_findings":{"completion_tok_s":68.8380284204504,"dflash_eval_s":14.086889286525548,"safe_mode_active":0,"spike_events":0,"safe_mode_step":-1,"verify_eval_wait_fused_steps":96,"verify_eval_wait_fused_mean_s":0.14673821219063635,"verify_eval_wait_unfused_steps":0,"verify_eval_wait_unfused_mean_s":0,"draft_sync_eval_wait_steps":0,"draft_sync_eval_wait_mean_s":0,"async_submit_calls":96,"async_unconsumed_steps":0,"verify_submit_mean_s":0.0012652561053982936,"verify_host_gap_mean_s":0.000006140215797737862,"thermal_warning_samples":0,"performance_warning_samples":0}}}
{"run":2314,"commit":"68fb119","metric":8.836712908698246,"metrics":{},"status":"discard","description":"Mirror recovered to near-floor fused-only regime (~106.37 tok/s, eval_s ~8.84) with safe mode inactive and no spikes.","timestamp":1776454611911,"segment":24,"confidence":0.04155103676524376,"iterationTokens":4204,"asi":{"hypothesis":"Fused-only inflated shelf can relax back to near-floor without new mode transition once transient clears.","rollback_reason":"Primary metric remains above best floor (8.79s) and no code change.","next_action_hint":"Continue baseline mirror sampling; trigger immediate control parity only on next fresh collapse edge.","diagnostic_findings":{"completion_tok_s":106.36829437168697,"dflash_eval_s":8.836712908698246,"safe_mode_active":0,"spike_events":0,"verify_eval_wait_fused_steps":96,"verify_eval_wait_fused_mean_s":0.09204885451739149,"verify_eval_wait_unfused_steps":0,"verify_eval_wait_unfused_mean_s":0,"draft_sync_eval_wait_steps":0,"async_submit_calls":96,"async_unconsumed_steps":0,"thermal_warning_samples":0,"performance_warning_samples":0}}}
{"run":2315,"commit":"68fb119","metric":8.807490582112223,"metrics":{},"status":"discard","description":"Post-recovery confirmation run stayed near floor (~107.40 tok/s, eval_s ~8.81), fused-only with watchdog idle.","timestamp":1776454718395,"segment":24,"confidence":0.041760804291894146,"iterationTokens":31972,"asi":{"hypothesis":"After the transient inflated shelf clears, consecutive runs should hold near-floor fused-only behavior.","rollback_reason":"Primary metric is still above best floor (8.79s) with unchanged code.","next_action_hint":"Continue passive mirror sampling; capture next transition edge and immediate control parity if collapse reappears.","diagnostic_findings":{"completion_tok_s":107.39948918207868,"dflash_eval_s":8.807490582112223,"safe_mode_active":0,"spike_events":0,"verify_eval_wait_fused_steps":96,"verify_eval_wait_fused_mean_s":0.09174448393120353,"verify_eval_wait_unfused_steps":0,"verify_eval_wait_unfused_mean_s":0,"draft_sync_eval_wait_steps":0,"async_submit_calls":96,"async_unconsumed_steps":0,"thermal_warning_samples":0,"performance_warning_samples":0}}}
{"run":2316,"commit":"68fb119","metric":8.809486250160262,"metrics":{},"status":"discard","description":"Mirror baseline check remained near floor (~107.08 tok/s, eval_s ~8.81), fused-only with watchdog idle.","timestamp":1776455138783,"segment":24,"confidence":0.042055602794290874,"iterationTokens":8530,"asi":{"hypothesis":"With no fresh transition, mirror should stay on fused-only near-floor shelf.","rollback_reason":"Primary metric is above best floor (8.79s) and code is unchanged.","next_action_hint":"Continue mirror sampling; run immediate control parity only on the next fresh collapse edge.","diagnostic_findings":{"completion_tok_s":107.08150711756021,"dflash_eval_s":8.809486250160262,"safe_mode_active":0,"spike_events":0,"verify_eval_wait_fused_steps":96,"verify_eval_wait_fused_mean_s":0.09176525260530373,"verify_eval_wait_unfused_steps":0,"verify_eval_wait_unfused_mean_s":0,"draft_sync_eval_wait_steps":0,"async_submit_calls":96,"async_unconsumed_steps":0,"thermal_warning_samples":0,"performance_warning_samples":0}}}
{"run":2317,"commit":"68fb119","metric":8.871046582004055,"metrics":{},"status":"discard","description":"Mirror resample stayed healthy fused-only (~106.36 tok/s, eval_s ~8.87), no spike/safe-mode events.","timestamp":1776455165708,"segment":24,"confidence":0.042176544807213986,"iterationTokens":4004,"asi":{"hypothesis":"Near-floor regime should keep fused-only wait profile and zero spike events across adjacent runs.","rollback_reason":"Primary metric remains above best floor and no code changes were applied.","next_action_hint":"Continue mirror sampling until next transition edge; then run immediate control parity.","diagnostic_findings":{"completion_tok_s":106.3585288355449,"dflash_eval_s":8.871046582004055,"safe_mode_active":0,"spike_events":0,"verify_eval_wait_fused_steps":96,"verify_eval_wait_fused_mean_s":0.09240648998214358,"verify_eval_wait_unfused_steps":0,"verify_eval_wait_unfused_mean_s":0,"draft_sync_eval_wait_steps":0,"async_submit_calls":96,"async_unconsumed_steps":0,"thermal_warning_samples":0,"performance_warning_samples":0}}}
