{"run":233,"commit":"688e0a2","metric":50.258156392174456,"metrics":{},"status":"discard","description":"Retune split-attention chunking for the thinking-enabled path to match the tuned 9-token speculative block by setting DFLASH_BSTNXBT_SPLIT_CHUNK_SIZE=9.","timestamp":1776131697057,"segment":18,"confidence":4.263461279907769,"iterationTokens":1983,"asi":{"hypothesis":"Matching split-attention chunk size to the tuned 9-token speculative block might reduce overhead on the thinking-enabled DFlash path.","rollback_reason":"Setting DFLASH_BSTNXBT_SPLIT_CHUNK_SIZE=9 dropped the honest thinking-enabled server benchmark to 50.26 tok/s from the current 70+ tok/s band.","next_action_hint":"Keep the default split-attention chunking and continue productizing the tuned thinking path rather than retuning this knob.","learning":"The tuned thinking-enabled DFlash path is highly sensitive to split-attention chunk-size changes; matching chunk size to block size is actively harmful here."}}
{"run":234,"commit":"72b4326","metric":76.70905063331637,"metrics":{},"status":"keep","description":"Propagate `enable_thinking` through the general oMLX DFlash runtime so the bstnxbt path can apply the tuned 9-token thinking block-size default outside benchmark-only glue, and adjust the fast Qwen launcher so thinking-enabled warmup keeps the safer 16-token warmup length.","timestamp":1776131808251,"segment":18,"confidence":3.9836027707745023,"iterationTokens":6238,"asi":{"hypothesis":"The tuned thinking-enabled DFlash path should work through normal oMLX request flow, not only through autoresearch/launcher-specific env fallbacks; once `enable_thinking` reaches the runtime, the general path should preserve the 70+ tok/s band honestly.","learning":"Runtime-level thinking propagation preserved and slightly improved the honest thinking-enabled warmed Qwen benchmark to 76.71 tok/s. The fast launcher also now avoids the harmful under-warmed 9-token thinking warmup default.","next_action_hint":"Prune stale ideas around warmup/ chunk-size tuning, then keep broadening normal oMLX usage so thinking-capable DFlash defaults engage safely in user-facing flows without benchmark-specific setup."}}
{"run":235,"commit":"72b4326","metric":72.42465268915315,"metrics":{},"status":"discard","description":"Validate the tuned thinking-enabled Qwen path without explicit request-level `dflash=true`, relying only on normal model-settings enablement (`BENCHMARK_DFLASH=0`).","timestamp":1776131917048,"segment":18,"confidence":4.0122692462603675,"iterationTokens":10976,"asi":{"hypothesis":"If the thinking-tuned DFlash path is truly productized enough for normal oMLX usage, the same workload should stay near the high band even without an explicit request-level DFlash override.","rollback_reason":"The normal model-settings path stayed fast at 72.42 tok/s but did not beat the current best 76.71 tok/s benchmark configuration, so keep the stronger benchmark shape as the optimization baseline.","next_action_hint":"Restore the explicit benchmark override for optimization runs, but keep the result as evidence that the normal model-settings path can still hold the 70+ tok/s band with thinking enabled.","learning":"Normal model-settings enablement is good enough to keep the thinking-enabled path in the 70+ tok/s band; the explicit request-level override is not required for the path to work, only slightly faster on the benchmark."}}
{"run":236,"commit":"72b4326","metric":61.14009758166115,"metrics":{},"status":"discard","description":"Probe the remaining nearby thinking-path block-size candidate by overriding DFLASH_BLOCK_TOKENS=7 on the honest Qwen reasoning workload.","timestamp":1776131993877,"segment":18,"confidence":4.641189703288919,"iterationTokens":3864,"asi":{"hypothesis":"Because the thinking-path block-size landscape is non-monotonic, the untested 7-token block might outperform the current 9-token default.","rollback_reason":"DFLASH_BLOCK_TOKENS=7 dropped the honest thinking-enabled benchmark to 61.14 tok/s, well below the tuned 70+ tok/s band.","next_action_hint":"Keep the 9-token thinking default and focus further work on broader normal-usage rollout rather than more nearby block-size probing.","learning":"The local optimum around the tuned thinking path is not between 6 and 8; 7 is materially worse than the current 9-token default."}}
{"run":237,"commit":"72b4326","metric":73.03571092733762,"metrics":{},"status":"discard","description":"Rerun the current best thinking-enabled Qwen configuration unchanged to tighten the noise band before the next productization change.","timestamp":1776132062242,"segment":18,"confidence":5.4773813369164515,"iterationTokens":1505,"asi":{"hypothesis":"If the tuned thinking-enabled path is robust, an unchanged rerun should remain in the same 70+ tok/s band even if it does not beat the top sample.","rollback_reason":"The unchanged rerun stayed healthy at 73.04 tok/s but did not beat the current best 76.71 tok/s sample, so keep the existing baseline.","next_action_hint":"Use the stable 70+ tok/s band as the working baseline and continue productizing the tuned path for broader normal oMLX usage.","learning":"The tuned thinking-enabled path remains stable in the low-to-mid 70 tok/s band on immediate rerun; the 76.71 top sample does not appear to be a bogus one-off."}}
{"type":"config","name":"Aligned official-Qwen DFlash server benchmark with thinking enabled and normal EOS semantics","metricName":"completion_tok_s","metricUnit":"","bestDirection":"higher"}
{"run":238,"commit":"3b218b8","metric":75.02736891977864,"metrics":{},"status":"keep","description":"Re-anchor the active target on the more normal thinking-enabled Qwen reasoning workload by restoring standard EOS semantics (`IGNORE_EOS=0`) while keeping the tuned runtime-level thinking DFlash path.","timestamp":1776132145386,"segment":19,"confidence":null,"iterationTokens":111,"asi":{"hypothesis":"The tuned thinking-capable DFlash path should remain in the 60-80 tok/s band even without the benchmark-specific no-EOS setting, making the result more representative of normal oMLX usage.","learning":"With normal EOS semantics restored, the honest warmed thinking-enabled Qwen DFlash server benchmark still reaches 75.03 tok/s, so the tuned path generalizes beyond the no-EOS benchmark shape.","next_action_hint":"Use this normal-EOS thinking workload as the new authority for further productization and continue validating broader normal-usage request flows on top of it."}}
{"run":239,"commit":"3b218b8","metric":74.22497600072327,"metrics":{},"status":"discard","description":"Validate the new normal-EOS thinking target without explicit request-level `dflash=true`, relying only on normal model-settings enablement.","timestamp":1776132192340,"segment":19,"confidence":null,"iterationTokens":901,"asi":{"hypothesis":"If the productized thinking-capable DFlash path is robust in normal usage, the normal-EOS workload should remain in the same band without an explicit request-level DFlash override.","rollback_reason":"The normal model-settings path remained strong at 74.22 tok/s but did not beat the new normal-EOS best of 75.03 tok/s, so keep the stronger benchmark shape as the optimization baseline.","next_action_hint":"Continue using the explicit benchmark override for optimization runs while treating this result as evidence that the normal request path still holds the target band.","learning":"On the more normal EOS-enabled thinking workload, model-settings enablement alone still sustains the mid-70 tok/s band even without an explicit request-level DFlash override."}}
{"run":240,"commit":"9d0541d","metric":81.78749716843244,"metrics":{},"status":"keep","description":"Retune speculative block size on the authoritative normal-EOS thinking workload by overriding DFLASH_BLOCK_TOKENS=10, while pruning stale/tried directions in autoresearch.ideas.md.","timestamp":1776132243478,"segment":19,"confidence":8.42496000165644,"iterationTokens":1410,"asi":{"hypothesis":"Restoring normal EOS semantics may shift the thinking-path block-size optimum away from the earlier no-EOS-tuned default of 9.","learning":"On the honest warmed thinking-enabled Qwen benchmark with normal EOS semantics, DFLASH_BLOCK_TOKENS=10 improved throughput from 75.03 tok/s to 81.79 tok/s. The ideas list was also pruned down to the active target, live directions, and concise do-not-retry notes.","next_action_hint":"Confirm the new 10-token normal-EOS thinking baseline, then continue productizing and validating broader normal-usage flows on top of this more general workload."}}
{"run":241,"commit":"d6e6aaa","metric":81.16433353671442,"metrics":{},"status":"keep","description":"Confirm the new normal-EOS thinking-path block-size retune at DFLASH_BLOCK_TOKENS=10 on the honest warmed Qwen reasoning benchmark.","timestamp":1776132281231,"segment":19,"confidence":2,"iterationTokens":839,"asi":{"hypothesis":"If the normal-EOS thinking workload truly prefers a 10-token speculative block, an immediate confirmation run should stay in the 80 tok/s band.","learning":"The normal-EOS thinking-enabled Qwen DFlash path confirmed at 81.16 tok/s with DFLASH_BLOCK_TOKENS=10, validating the new workload-specific optimum.","next_action_hint":"Use this 80+ tok/s normal-EOS thinking path as the new productization baseline and keep validating broader normal-usage request flows from here."}}
{"run":242,"commit":"769a0c6","metric":82.34091523089904,"metrics":{},"status":"keep","description":"Continue the block-size sweep on the authoritative normal-EOS thinking workload by increasing DFLASH_BLOCK_TOKENS from 10 to 11.","timestamp":1776132320605,"segment":19,"confidence":6.215927331921265,"iterationTokens":861,"asi":{"hypothesis":"The restored normal-EOS thinking workload may still prefer a slightly larger speculative block than 10 if acceptance remains strong enough to amortize the extra verify work.","learning":"On the honest warmed thinking-enabled Qwen benchmark with normal EOS semantics, DFLASH_BLOCK_TOKENS=11 improved throughput further to 82.34 tok/s.","next_action_hint":"Probe the upper neighbor at 12 and keep validating broader normal-usage flows once the local optimum is pinned down."}}
{"run":243,"commit":"769a0c6","metric":48.49859022964703,"metrics":{},"status":"discard","description":"Probe the next larger speculative block on the authoritative normal-EOS thinking workload by increasing DFLASH_BLOCK_TOKENS from 11 to 12.","timestamp":1776132377380,"segment":19,"confidence":1.9341555941286235,"iterationTokens":801,"asi":{"hypothesis":"If the normal-EOS thinking path still benefits from more drafted tokens per cycle, DFLASH_BLOCK_TOKENS=12 might improve on the new 11-token baseline.","rollback_reason":"DFLASH_BLOCK_TOKENS=12 collapsed the honest normal-EOS thinking benchmark to 48.50 tok/s from the current 80+ tok/s band.","next_action_hint":"Keep 11 as the current normal-EOS thinking block-size baseline and use it as the productization default for this workload shape.","learning":"On the normal-EOS thinking workload, the block-size neighborhood is sharply non-monotonic: 11 is strong, while 12 collapses throughput."}}
{"run":244,"commit":"3eef1e1","metric":87.39432051545612,"metrics":{},"status":"keep","description":"Generalize the thinking-aware block-size default in the bstnxbt runtime so thinking requests use 11 tokens under normal EOS semantics and 9 only for no-EOS thinking, then benchmark without any explicit workload block-token override.","timestamp":1776132526383,"segment":19,"confidence":2.0151577151918394,"iterationTokens":3720,"asi":{"hypothesis":"The runtime-level thinking default should reflect the newer authoritative normal-EOS workload, where the optimum moved from 9 to 11; if generalized cleanly, benchmark-specific block overrides should become unnecessary.","learning":"With the explicit workload override removed, the authoritative normal-EOS thinking benchmark improved further to 87.39 tok/s. The general runtime default now captures the right workload split: 11 for normal-EOS thinking, 9 for no-EOS thinking.","next_action_hint":"Use this override-free 87+ tok/s normal-EOS thinking path as the new productization baseline and continue validating broader normal-usage flows from it."}}
{"run":245,"commit":"e8addba","metric":86.40283391148674,"metrics":{},"status":"keep","description":"Confirm the new general runtime-level thinking default on the authoritative normal-EOS Qwen reasoning workload, still without any explicit block-token override in workload.env.","timestamp":1776132561616,"segment":19,"confidence":2.2806053397601094,"iterationTokens":821,"asi":{"hypothesis":"If the new runtime-level thinking block-size split is a real general improvement, an immediate confirmation run should stay near the new high-80 tok/s band without workload-specific overrides.","learning":"The override-free authoritative normal-EOS thinking benchmark confirmed at 86.40 tok/s, validating the new general runtime-level block-size default.","next_action_hint":"Keep broadening normal-usage validation from this override-free 86+ tok/s baseline, especially default model-settings flows and other user-facing request paths."}}
{"run":246,"commit":"e8addba","metric":87.29210388297108,"metrics":{},"status":"discard","description":"Validate the override-free normal-EOS thinking baseline through the normal model-settings path as well, removing explicit request-level `dflash=true`.","timestamp":1776132606139,"segment":19,"confidence":2.2466548905327195,"iterationTokens":943,"asi":{"hypothesis":"After the new runtime-level thinking default landed, the normal model-settings path should be able to hold essentially the same high-band throughput as the explicit benchmark override.","rollback_reason":"The normal model-settings path was essentially tied at 87.29 tok/s but did not beat the current best 87.39 tok/s sample, so keep the stronger benchmark shape as the optimization baseline.","next_action_hint":"Treat this as strong evidence that the tuned path now works in normal oMLX usage too, then continue pushing other user-facing flows from the same baseline.","learning":"With the new runtime-level thinking default, normal model-settings enablement now reaches the same 87 tok/s band as the explicit benchmark override on the authoritative workload."}}
{"run":247,"commit":"a8e40e8","metric":86.97008681277671,"metrics":{},"status":"keep","description":"Broaden the tuned normal-EOS thinking path to work through model settings alone: teach autoresearch and the fast Qwen launcher to persist `enable_thinking` into model settings/forced chat-template kwargs, then validate the authoritative workload with no request-level `dflash=true` and no request-level `enable_thinking=true`.","timestamp":1776133039304,"segment":19,"confidence":2.440738534816947,"iterationTokens":30281,"asi":{"hypothesis":"If the tuned 80+ tok/s thinking path is truly productized, normal requests should be able to rely on model settings alone for both DFlash and thinking without losing the high band.","learning":"The authoritative normal-EOS thinking workload still reached 86.97 tok/s through the pure model-settings path. That means the tuned fast path now works in a much more normal oMLX request shape, not just through benchmark-specific request overrides.","next_action_hint":"Use this model-settings-driven 86+ tok/s path as the new productization baseline, then keep checking other user-facing flows like launcher defaults and streaming visibility from the same configuration."}}
{"run":248,"commit":"a8e40e8","metric":85.54075302196762,"metrics":{},"status":"discard","description":"Rerun the fully model-settings-driven normal-EOS thinking path unchanged to tighten the noise band.","timestamp":1776133085070,"segment":19,"confidence":2.671525860931953,"iterationTokens":1956,"asi":{"hypothesis":"If the model-settings-only productized path is robust, an unchanged rerun should remain in the mid/high-80 tok/s band even if it does not beat the top sample.","rollback_reason":"The unchanged rerun stayed healthy at 85.54 tok/s but did not beat the current 86.97 tok/s model-settings-only keep.","next_action_hint":"Treat the model-settings-only path as stable in the mid/high-80 tok/s band and move on to validating another user-facing flow, such as streaming or launcher behavior.","learning":"The pure model-settings path is stable, not a one-off: immediate reruns remain in the same high band."}}
{"run":249,"commit":"a8e40e8","metric":82.55441970612019,"metrics":{},"status":"discard","description":"Make the benchmark and warmup requests omit explicit `chat_template_kwargs.enable_thinking=false` when relying on model settings, so the authoritative workload more closely matches a plain normal request shape.","timestamp":1776133470563,"segment":19,"confidence":2.917564482634997,"iterationTokens":4016,"asi":{"hypothesis":"Now that model settings can drive thinking and DFlash by themselves, omitting explicit false `chat_template_kwargs` from the benchmark/warmup requests should preserve or improve throughput while making the request shape more representative of normal clients.","rollback_reason":"The more normal request shape regressed the authoritative model-settings-driven benchmark from the mid/high-80 tok/s band down to 82.55 tok/s.","next_action_hint":"Keep the stronger current benchmark/request shape for optimization work, and only revisit request-shape normalization if another user-facing flow demonstrates a real problem.","learning":"Even semantically neutral request-shape cleanup can perturb the tuned path materially. Do not assume removing explicit false `chat_template_kwargs` is free on this benchmark; keep judging productization changes by honest server metrics."}}
{"run":250,"commit":"a8e40e8","metric":82.203439649533,"metrics":{},"status":"discard","description":"Probe whether the fully model-settings-driven authoritative workload prefers DFLASH_BLOCK_TOKENS=10 instead of the new runtime-level normal-EOS thinking default of 11.","timestamp":1776133529665,"segment":19,"confidence":3.0446083656918943,"iterationTokens":1944,"asi":{"hypothesis":"The model-settings-driven request path might have a slightly different local optimum than the explicit-request path and could still prefer a 10-token speculative block.","rollback_reason":"On the authoritative model-settings-driven workload, DFLASH_BLOCK_TOKENS=10 fell to 82.20 tok/s, below the current mid/high-80 tok/s band from the runtime default of 11.","next_action_hint":"Keep 11 as the general normal-EOS thinking default and move on to other user-facing validations instead of more nearby block-size probing.","learning":"The runtime-level normal-EOS thinking default of 11 remains the better general setting even on the model-settings-driven path."}}
{"run":251,"commit":"a8e40e8","metric":85.40184281271866,"metrics":{},"status":"discard","description":"Probe whether restoring explicit request-level `dflash=true` still improves the authoritative model-settings-driven normal-EOS thinking workload.","timestamp":1776133581760,"segment":19,"confidence":3.509225153111005,"iterationTokens":1271,"asi":{"hypothesis":"Even after productizing DFlash + thinking through model settings, the explicit request-level DFlash override might still buy a small throughput edge on the authoritative workload.","rollback_reason":"Restoring explicit request-level `dflash=true` produced 85.40 tok/s, below the stronger model-settings-driven baseline in the mid/high-80 tok/s band.","next_action_hint":"Keep the more normal model-settings-driven request shape as the active baseline and continue validating other user-facing flows from it.","learning":"On the current productized path, explicit request-level DFlash forcing is no longer beneficial; the settings-driven path is at least as good and more representative of normal usage."}}
{"run":252,"commit":"a8e40e8","metric":45.31925765534383,"metrics":{},"status":"discard","description":"Validate a more purely client-driven thinking flow: remove settings-forced `enable_thinking`, keep DFlash enabled via model settings, and let the benchmark request explicitly ask for thinking.","timestamp":1776133682686,"segment":19,"confidence":3.0446083656918943,"iterationTokens":2935,"asi":{"hypothesis":"A client-requested thinking flow without settings-forced `enable_thinking` might keep the same fast path while better matching ordinary API usage.","rollback_reason":"This client-driven thinking shape regressed hard to 45.32 tok/s from the current mid/high-80 tok/s model-settings-driven baseline.","next_action_hint":"Keep settings-forced `enable_thinking` in the productized fast path for now; if client-driven thinking is important later, debug its routing/prompt-shape differences separately before widening it.","learning":"Today’s tuned high-band path depends on model-settings-driven thinking enablement. Simply moving thinking control back to the request level loses a large amount of throughput."}}
