{"run":1256,"commit":"366dfde","metric":102.90776406238014,"metrics":{},"status":"discard","description":"Mirror recovery advanced marginally to ~102.91 within low-100 plateau.","timestamp":1776320221147,"segment":23,"confidence":3.275587127413454,"iterationTokens":959,"asi":{"hypothesis":"Recovery remains gradual and may require more samples to re-enter mid-100s.","rollback_reason":"Still below keep by ~5.56 tok/s.","next_action_hint":"Continue mirror-only recovery sampling; defer parity until clearer upward step.","backend":"mirror_sd_mlx","context_only_draft_cache":1,"draft_sink":48,"async_draft_eval":1,"fused_draft_verify_eval":1,"request_s":9.950658333022147,"delta_vs_keep":-5.563705432403354,"recovery_phase":true}}
{"run":1257,"commit":"366dfde","metric":103.21649971576274,"metrics":{},"status":"discard","description":"Mirror recovery continued upward to ~103.22 in post-collapse regime.","timestamp":1776320246974,"segment":23,"confidence":3.3116078469346744,"iterationTokens":670,"asi":{"hypothesis":"Recovery staircase is still active and may approach pre-collapse mid/high-100s.","rollback_reason":"Improving but still below keep 108.47.","next_action_hint":"Continue recovery loop; run control parity spot-check if mirror crosses ~104.","backend":"mirror_sd_mlx","context_only_draft_cache":1,"draft_sink":48,"async_draft_eval":1,"fused_draft_verify_eval":1,"request_s":9.920894457958639,"delta_vs_keep":-5.254969779020752,"recovery_phase":true}}
{"run":1258,"commit":"366dfde","metric":102.85862819048256,"metrics":{},"status":"discard","description":"Mirror recovery plateaued around ~102.9 after brief rise to 103.2.","timestamp":1776320283854,"segment":23,"confidence":3.323928229692692,"iterationTokens":663,"asi":{"hypothesis":"Recovery may be pausing in low-103 range before next move.","rollback_reason":"Still below keep and below pre-collapse 106/108 bands.","next_action_hint":"Continue monitoring; parity check if mirror drifts back below 100 or climbs above 104.","backend":"mirror_sd_mlx","context_only_draft_cache":1,"draft_sink":48,"async_draft_eval":1,"fused_draft_verify_eval":1,"request_s":9.955411792034283,"delta_vs_keep":-5.612841304300925,"recovery_phase":true}}
{"run":1259,"commit":"366dfde","metric":107.0548207829129,"metrics":{},"status":"discard","description":"Mirror sample jumped from low-103 recovery band back into ~107 regime.","timestamp":1776320366147,"segment":23,"confidence":3.3479302216835616,"iterationTokens":2062,"asi":{"hypothesis":"Recovery may have re-entered the prior ~107 plateau after collapse.","rollback_reason":"Strong rebound but still below keep 108.47.","next_action_hint":"Run immediate mirror follow-up, then control parity if ~107 persists.","backend":"mirror_sd_mlx","context_only_draft_cache":1,"draft_sink":48,"async_draft_eval":1,"fused_draft_verify_eval":1,"paired_prev_tok_s":102.85862819048256,"paired_delta_tok_s":4.196192592430334,"delta_vs_keep":-1.4166487118705824,"rebound_to_107":true}}
{"run":1260,"commit":"366dfde","metric":106.96284277794965,"metrics":{},"status":"discard","description":"Immediate mirror follow-up confirmed ~107 re-entry after low-103 recovery phase.","timestamp":1776320393302,"segment":23,"confidence":3.3679702816677355,"iterationTokens":710,"asi":{"hypothesis":"The post-collapse regime has shifted back from low-100s into high-106/107 plateau.","rollback_reason":"Below keep 108.47.","next_action_hint":"Take control parity sample now to confirm shared ~107 re-entry.","backend":"mirror_sd_mlx","context_only_draft_cache":1,"draft_sink":48,"async_draft_eval":1,"fused_draft_verify_eval":1,"paired_prev_tok_s":107.0548207829129,"paired_delta_tok_s":-0.09197800496324696,"delta_vs_keep":-1.5086267168338294,"reentry_confirmed":true}}
{"run":1261,"commit":"366dfde","metric":106.96079539426445,"metrics":{},"status":"discard","description":"Control parity sample after mirror ~107 re-entry (`DFLASH_MIRROR_SD_RUNTIME=0`) matched mirror almost exactly.","timestamp":1776320429419,"segment":23,"confidence":3.3723562875123565,"iterationTokens":810,"asi":{"hypothesis":"If re-entry is shared, control should align with mirror near ~107.","rollback_reason":"Control ~106.96 matches mirror ~106.96; parity backend remains non-authoritative.","next_action_hint":"Restore mirror runtime and continue monitoring for 108+ window return.","backend":"bstnxbt_mlx","mirror_runtime_enabled":0,"context_only_draft_cache":1,"draft_sink":48,"async_draft_eval":1,"fused_draft_verify_eval":1,"paired_mirror_tok_s":106.96284277794965,"paired_delta_tok_s":0.002047383685196838,"authoritative_lane":"mirror_sd_mlx","shared_reentry":true}}
{"run":1262,"commit":"366dfde","metric":107.00652849552584,"metrics":{},"status":"discard","description":"Mirror anchor after control parity stayed centered near ~107.0.","timestamp":1776320465892,"segment":23,"confidence":3.3717035833297886,"iterationTokens":1133,"asi":{"hypothesis":"Shared post-collapse regime has stabilized around ~107 for both backends.","rollback_reason":"Still below keep 108.47.","next_action_hint":"Continue mirror scans for possible transition back into 108+ band.","backend":"mirror_sd_mlx","context_only_draft_cache":1,"draft_sink":48,"async_draft_eval":1,"fused_draft_verify_eval":1,"paired_control_tok_s":106.96079539426445,"paired_delta_tok_s":0.04573310126139296,"delta_vs_keep":-1.4649409992576454}}
{"run":1263,"commit":"366dfde","metric":106.992073954108,"metrics":{},"status":"discard","description":"Mirror continuity sample remained flat at ~106.99.","timestamp":1776320491327,"segment":23,"confidence":3.383933575354859,"iterationTokens":664,"asi":{"hypothesis":"Current local center is tightly clustered around ~107.","rollback_reason":"No improvement vs keep.","next_action_hint":"Keep mirror-only monitoring unless drift exceeds ~0.5 tok/s.","backend":"mirror_sd_mlx","context_only_draft_cache":1,"draft_sink":48,"async_draft_eval":1,"fused_draft_verify_eval":1,"paired_prev_tok_s":107.00652849552584,"paired_delta_tok_s":-0.014454541417834242,"delta_vs_keep":-1.4793955406754866,"stable_cluster":true}}
{"run":1264,"commit":"366dfde","metric":106.93924011861787,"metrics":{},"status":"discard","description":"Mirror sample dipped slightly within stable ~107 regime.","timestamp":1776320518255,"segment":23,"confidence":3.42839285064229,"iterationTokens":651,"asi":{"hypothesis":"Minor jitter around ~107 persists without configuration changes.","rollback_reason":"Below keep.","next_action_hint":"Continue sampling; hold off new structural probes while regime center remains ~107.","backend":"mirror_sd_mlx","context_only_draft_cache":1,"draft_sink":48,"async_draft_eval":1,"fused_draft_verify_eval":1,"paired_prev_tok_s":106.992073954108,"paired_delta_tok_s":-0.05283383549013295,"delta_vs_keep":-1.5322293761656196}}
{"run":1265,"commit":"366dfde","metric":106.91373763258542,"metrics":{},"status":"discard","description":"Mirror continuity sample stayed near ~106.91; stable post-collapse ~107 plateau persists.","timestamp":1776320545525,"segment":23,"confidence":3.446876430195347,"iterationTokens":636,"asi":{"hypothesis":"Current regime remains anchored around high-106/107 with low variance.","rollback_reason":"Still below keep 108.47.","next_action_hint":"Take a control parity spot-check to reconfirm shared center before any future major bet.","backend":"mirror_sd_mlx","context_only_draft_cache":1,"draft_sink":48,"async_draft_eval":1,"fused_draft_verify_eval":1,"warmup_s":1.9989822920178995,"delta_vs_keep":-1.557731862198072,"shared_center_check_due":true}}
{"run":1266,"commit":"366dfde","metric":106.88939884443822,"metrics":{},"status":"discard","description":"Control parity spot-check in stable ~107 plateau (`DFLASH_MIRROR_SD_RUNTIME=0`) matched mirror level.","timestamp":1776320580244,"segment":23,"confidence":3.4655603920377454,"iterationTokens":795,"asi":{"hypothesis":"Shared center should keep control within a few hundredths of mirror in this regime.","rollback_reason":"Control ~106.89 closely matches mirror ~106.91; parity backend remains non-authoritative.","next_action_hint":"Restore mirror runtime and continue waiting for a fresh 108+ window.","backend":"bstnxbt_mlx","mirror_runtime_enabled":0,"context_only_draft_cache":1,"draft_sink":48,"async_draft_eval":1,"fused_draft_verify_eval":1,"paired_mirror_tok_s":106.91373763258542,"paired_delta_tok_s":0.024338788147198843,"authoritative_lane":"mirror_sd_mlx","shared_plateau":true}}
{"run":1267,"commit":"366dfde","metric":106.95078160770055,"metrics":{},"status":"discard","description":"Mirror anchor after control parity remained in shared ~107 cluster.","timestamp":1776320612315,"segment":23,"confidence":3.476768717736779,"iterationTokens":747,"asi":{"hypothesis":"Regime remains stable around ~106.9–107.0.","rollback_reason":"Below keep 108.47.","next_action_hint":"Continue mirror-only scans; defer structural probes while shared plateau persists.","backend":"mirror_sd_mlx","context_only_draft_cache":1,"draft_sink":48,"async_draft_eval":1,"fused_draft_verify_eval":1,"paired_control_tok_s":106.88939884443822,"paired_delta_tok_s":0.061382763262327805,"delta_vs_keep":-1.52068788708294}}
{"run":1268,"commit":"366dfde","metric":106.92701120482896,"metrics":{},"status":"discard","description":"Mirror continuity sample held at ~106.93.","timestamp":1776320638592,"segment":23,"confidence":3.5055192323819617,"iterationTokens":655,"asi":{"hypothesis":"No meaningful drift; shared plateau remains intact.","rollback_reason":"Still below keep.","next_action_hint":"Continue autonomous sampling for spontaneous high-window return.","backend":"mirror_sd_mlx","context_only_draft_cache":1,"draft_sink":48,"async_draft_eval":1,"fused_draft_verify_eval":1,"paired_prev_tok_s":106.95078160770055,"paired_delta_tok_s":-0.023770402871587434,"delta_vs_keep":-1.5444582899545307}}
{"run":1269,"commit":"366dfde","metric":106.92725218911427,"metrics":{},"status":"discard","description":"Mirror repeat produced near-identical ~106.93 result, reinforcing stable plateau.","timestamp":1776320666163,"segment":23,"confidence":3.512344783331153,"iterationTokens":718,"asi":{"hypothesis":"Current measurement regime is tightly centered near ~106.93.","rollback_reason":"No improvement versus keep.","next_action_hint":"Maintain mirror sampling cadence; postpone changes until regime shifts.","backend":"mirror_sd_mlx","context_only_draft_cache":1,"draft_sink":48,"async_draft_eval":1,"fused_draft_verify_eval":1,"paired_prev_tok_s":106.92701120482896,"paired_delta_tok_s":0.0002409842853079019,"delta_vs_keep":-1.5442173056692257,"stable_plateau":true}}
{"run":1270,"commit":"366dfde","metric":106.9213924949766,"metrics":{},"status":"discard","description":"Mirror sample remained locked at ~106.92, continuing stable shared plateau.","timestamp":1776320706101,"segment":23,"confidence":3.5146674713873653,"iterationTokens":1290,"asi":{"hypothesis":"Post-collapse regime has fully re-stabilized around ~106.9–107.0.","rollback_reason":"Below keep by ~1.55 tok/s.","next_action_hint":"Keep sampling for spontaneous 108-window return; no new code changes in this flat regime.","backend":"mirror_sd_mlx","context_only_draft_cache":1,"draft_sink":48,"async_draft_eval":1,"fused_draft_verify_eval":1,"paired_prev_tok_s":106.92725218911427,"paired_delta_tok_s":-0.005859694137665335,"delta_vs_keep":-1.5500769998068908}}
{"run":1271,"commit":"366dfde","metric":107.04792873736069,"metrics":{},"status":"discard","description":"Mirror sample nudged back to ~107.05 within recovered plateau.","timestamp":1776320736112,"segment":23,"confidence":3.531462889460082,"iterationTokens":690,"asi":{"hypothesis":"Recovered regime oscillates in a narrow ~106.9–107.1 range.","rollback_reason":"Still below keep 108.47.","next_action_hint":"Continue mirror-only sampling; consider parity spot-check only if sustained drift appears.","backend":"mirror_sd_mlx","context_only_draft_cache":1,"draft_sink":48,"async_draft_eval":1,"fused_draft_verify_eval":1,"paired_prev_tok_s":106.9213924949766,"paired_delta_tok_s":0.1265362423840844,"delta_vs_keep":-1.4235407574228014}}
{"run":1272,"commit":"366dfde","metric":107.01865259888915,"metrics":{},"status":"discard","description":"Mirror continuity sample held near ~107.02.","timestamp":1776320769566,"segment":23,"confidence":3.5648945484351753,"iterationTokens":717,"asi":{"hypothesis":"No regime breakout yet; plateau remains stable.","rollback_reason":"Below keep.","next_action_hint":"Run control parity spot-check to verify ongoing shared plateau before deciding next exploration.","backend":"mirror_sd_mlx","context_only_draft_cache":1,"draft_sink":48,"async_draft_eval":1,"fused_draft_verify_eval":1,"paired_prev_tok_s":107.04792873736069,"paired_delta_tok_s":-0.029276138471541806,"delta_vs_keep":-1.4528168958943461}}
{"run":1273,"commit":"366dfde","metric":107.08968580595332,"metrics":{},"status":"discard","description":"Control parity spot-check in recovered plateau (`DFLASH_MIRROR_SD_RUNTIME=0`) remained near mirror level.","timestamp":1776320807193,"segment":23,"confidence":3.5766426601497696,"iterationTokens":731,"asi":{"hypothesis":"Shared plateau should keep control and mirror nearly tied around ~107.","rollback_reason":"Control ~107.09 aligns with mirror ~107.02; parity backend remains non-authoritative.","next_action_hint":"Restore mirror runtime and continue monitoring for spontaneous 108+ re-entry.","backend":"bstnxbt_mlx","mirror_runtime_enabled":0,"context_only_draft_cache":1,"draft_sink":48,"async_draft_eval":1,"fused_draft_verify_eval":1,"paired_mirror_tok_s":107.01865259888915,"paired_delta_tok_s":-0.0710332070641765,"authoritative_lane":"mirror_sd_mlx","shared_plateau":true}}
{"run":1274,"commit":"366dfde","metric":106.99487111564513,"metrics":{},"status":"discard","description":"Mirror anchor after parity spot-check returned to ~106.99.","timestamp":1776320833581,"segment":23,"confidence":3.6069609273266754,"iterationTokens":724,"asi":{"hypothesis":"Recovered shared plateau remains steady around ~107 with no backend edge.","rollback_reason":"Below keep 108.47.","next_action_hint":"Continue autonomous mirror scans and wait for high-window reopening before major-bet changes.","backend":"mirror_sd_mlx","context_only_draft_cache":1,"draft_sink":48,"async_draft_eval":1,"fused_draft_verify_eval":1,"paired_control_tok_s":107.08968580595332,"paired_delta_tok_s":-0.094814690308185,"delta_vs_keep":-1.4765971373035147}}
{"run":1275,"commit":"366dfde","metric":106.87888991066096,"metrics":{},"status":"discard","description":"Mirror sample dipped to ~106.88, still within post-collapse ~107 plateau.","timestamp":1776320862465,"segment":23,"confidence":3.6133253001011467,"iterationTokens":670,"asi":{"hypothesis":"Current regime remains flat and sub-keep, with normal jitter around 107.","rollback_reason":"Below keep and no upward breakout signal.","next_action_hint":"Continue measurement-only loop until 108+ window reappears.","backend":"mirror_sd_mlx","context_only_draft_cache":1,"draft_sink":48,"async_draft_eval":1,"fused_draft_verify_eval":1,"paired_prev_tok_s":106.99487111564513,"paired_delta_tok_s":-0.11598120498416398,"delta_vs_keep":-1.5925783422876867}}
{"run":1276,"commit":"366dfde","metric":107.03889814701822,"metrics":{},"status":"discard","description":"Mirror continuity sample in recovered ~107 plateau; no breakout.","timestamp":1776320931077,"segment":23,"confidence":3.6197121720588497,"iterationTokens":8570,"asi":{"hypothesis":"Recovered regime remains centered near 107 until a spontaneous high-window reopens.","rollback_reason":"107.04 remains below keep 108.47.","next_action_hint":"Continue mirror-only sampling and watch for sustained >108 re-entry.","backend":"mirror_sd_mlx","context_only_draft_cache":1,"draft_sink":48,"async_draft_eval":1,"fused_draft_verify_eval":1,"warmup_s":2.083365749916993,"delta_vs_keep":-1.4325713477652628}}
{"run":1277,"commit":"366dfde","metric":106.94635598604502,"metrics":{},"status":"discard","description":"Mirror sample eased to ~106.95 within same plateau.","timestamp":1776320958120,"segment":23,"confidence":3.6246724641479675,"iterationTokens":622,"asi":{"hypothesis":"Near-term jitter remains within tight 106.9–107.1 band.","rollback_reason":"Below keep and no upward shift.","next_action_hint":"Continue scans; parity check only if sustained drift >0.4 tok/s occurs.","backend":"mirror_sd_mlx","context_only_draft_cache":1,"draft_sink":48,"async_draft_eval":1,"fused_draft_verify_eval":1,"paired_prev_tok_s":107.03889814701822,"paired_delta_tok_s":-0.0925421609731964,"delta_vs_keep":-1.5251135087384664}}
{"run":1278,"commit":"366dfde","metric":106.95361290543127,"metrics":{},"status":"discard","description":"Mirror repeat remained flat at ~106.95.","timestamp":1776320985935,"segment":23,"confidence":3.6296463696182673,"iterationTokens":671,"asi":{"hypothesis":"Plateau remains stable around ~106.95 with low variance.","rollback_reason":"No primary improvement.","next_action_hint":"Continue measurement loop; hold configuration constant.","backend":"mirror_sd_mlx","context_only_draft_cache":1,"draft_sink":48,"async_draft_eval":1,"fused_draft_verify_eval":1,"paired_prev_tok_s":106.94635598604502,"paired_delta_tok_s":0.007256919386251395,"delta_vs_keep":-1.5178565893522118,"stable_plateau":true}}
{"run":1279,"commit":"366dfde","metric":106.96320125117936,"metrics":{},"status":"discard","description":"Mirror sample held at ~106.96, unchanged regime.","timestamp":1776321015369,"segment":23,"confidence":3.6338876949514827,"iterationTokens":629,"asi":{"hypothesis":"Current recovered operating band remains narrowly centered near 107.","rollback_reason":"Still below keep 108.47.","next_action_hint":"Take one control parity check now to reconfirm shared center before further mirror-only scans.","backend":"mirror_sd_mlx","context_only_draft_cache":1,"draft_sink":48,"async_draft_eval":1,"fused_draft_verify_eval":1,"delta_vs_keep":-1.5082682436041237,"shared_center_check_due":true}}
{"run":1280,"commit":"366dfde","metric":106.97010474101359,"metrics":{},"status":"discard","description":"Control parity check in stable post-collapse plateau (`DFLASH_MIRROR_SD_RUNTIME=0`).","timestamp":1776321054453,"segment":23,"confidence":3.63813894405343,"iterationTokens":801,"asi":{"hypothesis":"Control should remain nearly identical to mirror if current ~107 center is shared.","rollback_reason":"Control ~106.97 essentially matches mirror ~106.96; parity backend remains non-authoritative.","next_action_hint":"Restore mirror lane and continue waiting for a fresh 108+ regime window.","backend":"bstnxbt_mlx","mirror_runtime_enabled":0,"context_only_draft_cache":1,"draft_sink":48,"async_draft_eval":1,"fused_draft_verify_eval":1,"paired_mirror_tok_s":106.96320125117936,"paired_delta_tok_s":-0.006903489834229815,"authoritative_lane":"mirror_sd_mlx","shared_plateau":true}}
{"run":1281,"commit":"366dfde","metric":107.07414513317919,"metrics":{},"status":"discard","description":"Mirror anchor after control parity edged up to ~107.07.","timestamp":1776321090321,"segment":23,"confidence":3.6486028866986886,"iterationTokens":1117,"asi":{"hypothesis":"Recovered shared plateau may oscillate in ~106.9–107.1 envelope.","rollback_reason":"Still below keep 108.47.","next_action_hint":"Continue mirror scans for any transition toward 108+ band.","backend":"mirror_sd_mlx","context_only_draft_cache":1,"draft_sink":48,"async_draft_eval":1,"fused_draft_verify_eval":1,"paired_control_tok_s":106.97010474101359,"paired_delta_tok_s":0.10404039216559274,"delta_vs_keep":-1.3973243616042972}}
{"run":1282,"commit":"366dfde","metric":106.97278246597834,"metrics":{},"status":"discard","description":"Mirror follow-up returned to ~106.97 within tight plateau.","timestamp":1776321116330,"segment":23,"confidence":3.6648678346949435,"iterationTokens":651,"asi":{"hypothesis":"No high-window reopening yet; plateau remains constrained.","rollback_reason":"No primary metric improvement.","next_action_hint":"Keep measurement-only loop active.","backend":"mirror_sd_mlx","context_only_draft_cache":1,"draft_sink":48,"async_draft_eval":1,"fused_draft_verify_eval":1,"paired_prev_tok_s":107.07414513317919,"paired_delta_tok_s":-0.10136266720084246,"delta_vs_keep":-1.498687028805146}}
{"run":1283,"commit":"366dfde","metric":107.00964697588047,"metrics":{},"status":"discard","description":"Mirror sample held near 107.01, consistent with shared center.","timestamp":1776321141874,"segment":23,"confidence":3.665588608687267,"iterationTokens":619,"asi":{"hypothesis":"Recovered regime remains stable around ~107 with low jitter.","rollback_reason":"Below keep.","next_action_hint":"Continue passive monitoring for 108+ breakout.","backend":"mirror_sd_mlx","context_only_draft_cache":1,"draft_sink":48,"async_draft_eval":1,"fused_draft_verify_eval":1,"delta_vs_keep":-1.46182251890302,"stable_cluster":true}}
{"run":1284,"commit":"366dfde","metric":106.90789617218525,"metrics":{},"status":"discard","description":"Mirror sample dipped to ~106.91 while staying inside stable plateau.","timestamp":1776321185073,"segment":23,"confidence":3.670165299501883,"iterationTokens":1144,"asi":{"hypothesis":"Small downward wiggles in current 107 plateau are noise, not structural shifts.","rollback_reason":"Still below keep 108.47.","next_action_hint":"Continue measurement loop; parity check only if persistent sub-106.7 appears.","backend":"mirror_sd_mlx","context_only_draft_cache":1,"draft_sink":48,"async_draft_eval":1,"fused_draft_verify_eval":1,"delta_vs_keep":-1.5635733225982462}}
