{"run":1054,"commit":"8b55918","metric":90.72457706189661,"metrics":{},"status":"discard","description":"Control parity sample after mirror low-80 relapse (mirror disabled).","timestamp":1776307051060,"segment":23,"confidence":2.502931028374051,"iterationTokens":761,"asi":{"hypothesis":"Control indicates whether relapse was shared or mirror-skewed.","rollback_reason":"Control stayed near ~90.72 while still below keep, showing widened but noisy backend gap.","next_action_hint":"Return to mirror for immediate follow-up; keep treating gaps as unstable until repeated.","backend":"bstnxbt_mlx","mirror_runtime_enabled":0,"context_only_draft_cache":1,"draft_sink":48,"paired_mirror_tok_s":80.92803299990298,"paired_delta_tok_s":-9.796544061993629,"shared_instability":true}}
{"run":1055,"commit":"8b55918","metric":89.83838258860172,"metrics":{},"status":"discard","description":"Mirror immediate follow-up after control ~90.72 sample.","timestamp":1776307078970,"segment":23,"confidence":2.4678788901402395,"iterationTokens":663,"asi":{"hypothesis":"Mirror should rebound toward control if prior low-80 result was transient instability.","rollback_reason":"Mirror rebounded to ~89.84 but remains below keep.","next_action_hint":"Continue recovery tracking; only attempt major candidate after sustained 100+ re-entry.","backend":"mirror_sd_mlx","context_only_draft_cache":1,"draft_sink":48,"paired_control_tok_s":90.72457706189661,"paired_delta_tok_s":-0.8861944732948898,"delta_vs_keep":-17.02161741139828}}
{"run":1056,"commit":"8b55918","metric":91.50303747468921,"metrics":{},"status":"discard","description":"Mirror recovery sample re-entering low-90 band.","timestamp":1776307105101,"segment":23,"confidence":2.4347083140773416,"iterationTokens":658,"asi":{"hypothesis":"Rebound should advance from high-80 into low-90 before eventual 100+ return.","rollback_reason":"Low-90 still below keep.","next_action_hint":"Take control parity sample to confirm shared low-90 re-entry.","backend":"mirror_sd_mlx","context_only_draft_cache":1,"draft_sink":48,"delta_vs_keep":-15.356962525310795}}
{"run":1057,"commit":"8b55918","metric":91.58221866345082,"metrics":{},"status":"discard","description":"Control parity sample after mirror low-90 re-entry (mirror disabled).","timestamp":1776307137256,"segment":23,"confidence":2.412902281206287,"iterationTokens":670,"asi":{"hypothesis":"Control should match mirror near low-90 if rebound is shared.","rollback_reason":"Control matched mirror (~91.58) and remains below keep.","next_action_hint":"Return to mirror and continue climb tracking toward high-90 and 100+.","backend":"bstnxbt_mlx","mirror_runtime_enabled":0,"context_only_draft_cache":1,"draft_sink":48,"paired_mirror_tok_s":91.50303747468921,"paired_delta_tok_s":-0.07918118876161391,"shared_recovery":true}}
{"run":1058,"commit":"8b55918","metric":89.78248340894007,"metrics":{},"status":"discard","description":"Mirror wobble after low-90 parity checkpoint.","timestamp":1776307164513,"segment":23,"confidence":2.3918459223447397,"iterationTokens":647,"asi":{"hypothesis":"Recovery remains noisy around 90 before next upward move.","rollback_reason":"Dropped to ~89.78, still below keep.","next_action_hint":"Continue recovery runs; re-check control after mirror crosses back above 92.","backend":"mirror_sd_mlx","context_only_draft_cache":1,"draft_sink":48,"paired_control_tok_s":91.58221866345082,"paired_delta_tok_s":-1.7997352545107537,"delta_vs_keep":-17.07751659105993,"recovery_wobble":true}}
{"run":1059,"commit":"8b55918","metric":90.94126933491108,"metrics":{},"status":"discard","description":"Mirror recovery sample returning to low-90 after wobble.","timestamp":1776307190756,"segment":23,"confidence":2.360404515990432,"iterationTokens":645,"asi":{"hypothesis":"Band should hold around low-90 before climbing to high-90.","rollback_reason":"Still below keep.","next_action_hint":"Continue rebound tracking; take control parity after mirror reaches mid/high-90s.","backend":"mirror_sd_mlx","context_only_draft_cache":1,"draft_sink":48,"delta_vs_keep":-15.918730665088924}}
{"run":1060,"commit":"8b55918","metric":93.11482125565891,"metrics":{},"status":"discard","description":"Major-bet cache-reservation probe: raise INITIAL_CACHE_BLOCKS to 2048 on authoritative mirror lane.","timestamp":1776307241175,"segment":23,"confidence":2.332965265021743,"iterationTokens":3127,"asi":{"hypothesis":"Large upfront paged-cache reservation might dampen recovery oscillation and raise throughput beyond current low-90 band.","rollback_reason":"Result improved locally to ~93.11 but remains below keep and lacks paired confirmation.","next_action_hint":"Run immediate baseline mirror/control anchors without override to determine whether gain was regime drift vs true effect.","backend":"mirror_sd_mlx","context_only_draft_cache":1,"draft_sink":48,"initial_cache_blocks":2048,"delta_vs_keep":-13.745178744341088,"major_bet":true}}
{"run":1061,"commit":"8b55918","metric":93.9102866549227,"metrics":{},"status":"discard","description":"Mirror anchor after INITIAL_CACHE_BLOCKS=2048 probe (override removed).","timestamp":1776307272179,"segment":23,"confidence":2.3319997946491804,"iterationTokens":748,"asi":{"hypothesis":"If cache2048 was causal, baseline revert should fall back below probe result.","rollback_reason":"Baseline rose further to ~93.91, indicating cache2048 gain was not causal.","next_action_hint":"Mark cache2048 as non-evidential on this lane and continue shared recovery monitoring.","backend":"mirror_sd_mlx","context_only_draft_cache":1,"draft_sink":48,"initial_cache_blocks_override_removed":true,"paired_probe_tok_s":93.11482125565891,"paired_delta_tok_s":0.7954653992637882,"delta_vs_keep":-12.949713345077297}}
{"run":1062,"commit":"8b55918","metric":94.85980807850397,"metrics":{},"status":"discard","description":"Control parity sample after mirror ~93.91 anchor (mirror disabled).","timestamp":1776307303572,"segment":23,"confidence":2.3297405264014026,"iterationTokens":800,"asi":{"hypothesis":"Control should track mirror into mid-90 if recovery remains shared.","rollback_reason":"Control reached ~94.86, still below keep.","next_action_hint":"Return to mirror and continue climb tracking toward high-90/100 re-entry.","backend":"bstnxbt_mlx","mirror_runtime_enabled":0,"context_only_draft_cache":1,"draft_sink":48,"paired_mirror_tok_s":93.9102866549227,"paired_delta_tok_s":-0.9495214235812718,"shared_recovery":true}}
{"run":1063,"commit":"8b55918","metric":95.34789822206109,"metrics":{},"status":"discard","description":"Mirror recovery continuation into mid-95 band.","timestamp":1776307330963,"segment":23,"confidence":2.322479212877367,"iterationTokens":653,"asi":{"hypothesis":"Recovery should progress from low/mid-90 into high-90 and then 100+.","rollback_reason":"~95.35 still below keep.","next_action_hint":"Continue rebound tracking; check control again near 100 re-entry.","backend":"mirror_sd_mlx","context_only_draft_cache":1,"draft_sink":48,"delta_vs_keep":-11.512101777938902}}
{"run":1064,"commit":"8b55918","metric":92.82174956854742,"metrics":{},"status":"discard","description":"Mirror rebound wobble: dropped from mid-95 back to low-90.","timestamp":1776307359849,"segment":23,"confidence":2.308768872358405,"iterationTokens":576,"asi":{"hypothesis":"Recovery remains oscillatory and can pull back before reaching 100.","rollback_reason":"Low-90 still below keep.","next_action_hint":"Continue recovery monitoring; take control parity check if wobble persists.","backend":"mirror_sd_mlx","context_only_draft_cache":1,"draft_sink":48,"delta_vs_keep":-14.038250431452578,"recovery_wobble":true}}
{"run":1065,"commit":"8b55918","metric":94.85407861532128,"metrics":{},"status":"discard","description":"Mirror recovery sample rebounding from low-90 wobble to mid-94.","timestamp":1776307398964,"segment":23,"confidence":2.286327054870142,"iterationTokens":996,"asi":{"hypothesis":"Oscillatory recovery should revisit mid-90 range before 100+ re-entry.","rollback_reason":"Still below keep.","next_action_hint":"Take control parity sample now to measure shared mid-90 state.","backend":"mirror_sd_mlx","context_only_draft_cache":1,"draft_sink":48,"delta_vs_keep":-12.005921384678718}}
{"run":1066,"commit":"8b55918","metric":95.92888521637352,"metrics":{},"status":"discard","description":"Control parity sample after mirror mid-94 rebound (mirror disabled).","timestamp":1776307433633,"segment":23,"confidence":2.2541124787916433,"iterationTokens":667,"asi":{"hypothesis":"Control should similarly occupy mid/high-90 if rebound is shared.","rollback_reason":"Control reached ~95.93 but still below keep.","next_action_hint":"Return to mirror and continue toward 100+ re-entry.","backend":"bstnxbt_mlx","mirror_runtime_enabled":0,"context_only_draft_cache":1,"draft_sink":48,"paired_mirror_tok_s":94.85407861532128,"paired_delta_tok_s":-1.0748066010522408,"shared_recovery":true}}
{"run":1067,"commit":"8b55918","metric":94.83855848236855,"metrics":{},"status":"discard","description":"Mirror follow-up after control ~95.93 parity sample.","timestamp":1776307462871,"segment":23,"confidence":2.2310053250434834,"iterationTokens":646,"asi":{"hypothesis":"Mirror should hold in mid-90 zone if shared rebound is stable.","rollback_reason":"Held ~94.84 but remains below keep.","next_action_hint":"Continue monitoring for high-90/100 breakthrough before any structural probe.","backend":"mirror_sd_mlx","context_only_draft_cache":1,"draft_sink":48,"paired_control_tok_s":95.92888521637352,"paired_delta_tok_s":-1.090326734004977,"delta_vs_keep":-12.021441517631448}}
{"run":1068,"commit":"8b55918","metric":92.69927187511837,"metrics":{},"status":"discard","description":"Mirror wobble from mid-90 back to low-90.","timestamp":1776307490967,"segment":23,"confidence":2.208367112056872,"iterationTokens":637,"asi":{"hypothesis":"Recovery remains noisy around 90-96 without clean 100+ breakout yet.","rollback_reason":"Low-90 result below keep.","next_action_hint":"Take control parity sample to verify shared wobble state.","backend":"mirror_sd_mlx","context_only_draft_cache":1,"draft_sink":48,"delta_vs_keep":-14.160728124881631,"recovery_wobble":true}}
{"run":1069,"commit":"8b55918","metric":92.50181234933501,"metrics":{},"status":"discard","description":"Control parity sample after mirror low-90 wobble (mirror disabled).","timestamp":1776307525702,"segment":23,"confidence":2.2063744763509447,"iterationTokens":677,"asi":{"hypothesis":"Control should reflect whether low-90 wobble is shared.","rollback_reason":"Control ~92.50 matches mirror low-90 range and remains below keep.","next_action_hint":"Return to mirror monitoring; continue until 100+ re-entry before candidate probing.","backend":"bstnxbt_mlx","mirror_runtime_enabled":0,"context_only_draft_cache":1,"draft_sink":48,"paired_mirror_tok_s":92.69927187511837,"paired_delta_tok_s":0.1974595257833607,"shared_wobble":true}}
{"run":1070,"commit":"8b55918","metric":106.05333820589173,"metrics":{},"status":"discard","description":"Major-bet from Grok/Mirror-SD pattern: fuse draft+verify into a single eval boundary (`DFLASH_BSTNXBT_FUSED_DRAFT_VERIFY_EVAL=1`) in bstnxbt loop; mirror lane sample.","timestamp":1776307824229,"segment":23,"confidence":2.208367112056872,"iterationTokens":5281,"asi":{"hypothesis":"Reducing per-step eval boundaries from two to one (draft+verify fused eval) may cut synchronization overhead and approach step-change gains.","rollback_reason":"Strong improvement to ~106.05 tok/s but still below current keep 106.86 in this sample.","next_action_hint":"Immediately run baseline anchor and then rerun fused mode for paired confirmation; if repeated samples exceed keep, re-land code with env gate.","backend":"mirror_sd_mlx","context_only_draft_cache":1,"draft_sink":48,"fused_draft_verify_eval":1,"major_bet":true,"delta_vs_keep":-0.8066617941082626,"source_hint":"mirror-sd single mx.eval draft+verify+cache pattern"}}
{"run":1071,"commit":"8b55918","metric":104.66651277601139,"metrics":{},"status":"discard","description":"Baseline mirror anchor after fused-eval major-bet discard/revert.","timestamp":1776307859104,"segment":23,"confidence":2.2310053250434834,"iterationTokens":1672,"asi":{"hypothesis":"Immediate baseline anchor is needed to measure whether fused-eval sample reflected true code effect or regime drift.","rollback_reason":"Baseline at ~104.67 is below fused sample but still below keep.","next_action_hint":"Re-run fused-eval patch for A/B confirmation in same regime window.","backend":"mirror_sd_mlx","context_only_draft_cache":1,"draft_sink":48,"fused_eval_reverted":true,"paired_fused_tok_s":106.05333820589173,"paired_delta_tok_s":1.3868254298803466,"delta_vs_keep":-2.193487223988601}}
{"run":1072,"commit":"8b55918","metric":104.25059664679446,"metrics":{},"status":"discard","description":"A/B confirmation rerun for fused draft+verify eval (`DFLASH_BSTNXBT_FUSED_DRAFT_VERIFY_EVAL=1`) after baseline anchor.","timestamp":1776307904495,"segment":23,"confidence":2.2541124787916433,"iterationTokens":1409,"asi":{"hypothesis":"If fused eval is a real win, repeat run should stay above immediate baseline in same regime window.","rollback_reason":"Rerun landed at ~104.25, below paired baseline ~104.67; first 106.05 sample not reproducible.","next_action_hint":"Treat fused-eval as currently non-winning; keep idea parked unless a more robust fused graph rewrite is implemented.","backend":"mirror_sd_mlx","context_only_draft_cache":1,"draft_sink":48,"fused_draft_verify_eval":1,"paired_baseline_tok_s":104.66651277601139,"paired_delta_tok_s":-0.4159161292169299,"delta_vs_keep":-2.609403353205531,"major_bet":true,"repro_check":false}}
{"run":1073,"commit":"8b55918","metric":106.07921937512774,"metrics":{},"status":"discard","description":"Repo-sourced major-bet probe: env-gated async draft eval kickoff (`DFLASH_BSTNXBT_ASYNC_DRAFT_EVAL=1`) before blocking eval in speculative loop.","timestamp":1776308150605,"segment":23,"confidence":2.286327054870142,"iterationTokens":22764,"asi":{"hypothesis":"Starting draft logits with `mx.async_eval` may reduce scheduler/host sync overhead and improve mirror lane throughput.","rollback_reason":"Near-keep sample (~106.08) remains below keep and lacks immediate reproducibility.","next_action_hint":"Take immediate baseline anchor, then rerun async mode for A/B confirmation in same regime.","backend":"mirror_sd_mlx","context_only_draft_cache":1,"draft_sink":48,"async_draft_eval":1,"major_bet":true,"delta_vs_keep":-0.7807806248722517,"source_hint":"bstnxbt runtime uses async_eval in draft phase"}}
{"run":1074,"commit":"8b55918","metric":105.95684868124795,"metrics":{},"status":"discard","description":"Baseline mirror anchor after async-draft-eval probe revert.","timestamp":1776308179863,"segment":23,"confidence":2.308768872358405,"iterationTokens":761,"asi":{"hypothesis":"Baseline anchor determines whether async sample gain was code effect or regime drift.","rollback_reason":"Baseline remained high (~105.96), only ~0.12 below async sample, insufficient separation.","next_action_hint":"Re-land async patch and rerun for A/B confirmation.","backend":"mirror_sd_mlx","context_only_draft_cache":1,"draft_sink":48,"async_eval_reverted":true,"paired_async_tok_s":106.07921937512774,"paired_delta_tok_s":0.1223706938797884,"delta_vs_keep":-0.9031513187520401}}
{"run":1075,"commit":"8b55918","metric":106.36732850717803,"metrics":{},"status":"discard","description":"A/B confirmation rerun for async draft eval (`DFLASH_BSTNXBT_ASYNC_DRAFT_EVAL=1`) after high baseline anchor.","timestamp":1776308224597,"segment":23,"confidence":2.317802040955473,"iterationTokens":1068,"asi":{"hypothesis":"If async draft kickoff is beneficial, rerun should stay above paired baseline in same regime.","rollback_reason":"Rerun improved to ~106.37 and beat paired baseline (~105.96) but remains below keep 106.86.","next_action_hint":"Run another baseline+async mini-pair; keep only if async repeatedly exceeds both baseline and keep threshold.","backend":"mirror_sd_mlx","context_only_draft_cache":1,"draft_sink":48,"async_draft_eval":1,"paired_baseline_tok_s":105.95684868124795,"paired_delta_tok_s":0.41047982593008664,"delta_vs_keep":-0.4926714928219576,"major_bet":true,"repro_check":true}}
{"run":1076,"commit":"8b55918","metric":105.73909204767294,"metrics":{},"status":"discard","description":"Second baseline anchor in async-eval mini-pair sequence.","timestamp":1776308250651,"segment":23,"confidence":2.326906172606928,"iterationTokens":989,"asi":{"hypothesis":"Need contemporaneous baseline before final async confirmation run.","rollback_reason":"Baseline held high (~105.74) but still below keep.","next_action_hint":"Re-run async-eval mode now for final A/B read.","backend":"mirror_sd_mlx","context_only_draft_cache":1,"draft_sink":48,"async_eval_reverted":true,"delta_vs_keep":-1.1209079523270582}}
{"run":1077,"commit":"8b55918","metric":66.05517731194685,"metrics":{},"status":"discard","description":"Final async-eval A/B sample (`DFLASH_BSTNXBT_ASYNC_DRAFT_EVAL=1`) triggered during fresh instability wave.","timestamp":1776308299202,"segment":23,"confidence":2.317802040955473,"iterationTokens":936,"asi":{"hypothesis":"Async-draft-eval should remain near high-105 if beneficial and regime stable.","rollback_reason":"Severe drop to ~66.06 invalidates this A/B window; likely fresh shared regime collapse rather than isolated code effect.","next_action_hint":"Run immediate baseline mirror sample to classify collapse symmetry before drawing conclusions on async-eval.","backend":"mirror_sd_mlx","context_only_draft_cache":1,"draft_sink":48,"async_draft_eval":1,"paired_baseline_tok_s":105.73909204767294,"paired_delta_tok_s":-39.68391473572609,"delta_vs_keep":-40.80482268805316,"major_bet":true,"window_invalidated":true}}
{"run":1078,"commit":"8b55918","metric":42.65145986633943,"metrics":{},"status":"discard","description":"Immediate baseline mirror anchor after async-eval collapse sample.","timestamp":1776308345213,"segment":23,"confidence":2.3059852864846513,"iterationTokens":794,"asi":{"hypothesis":"If async collapse was regime-driven, reverted baseline should also collapse.","rollback_reason":"Baseline collapsed further to ~42.65, confirming shared severe trough and invalidating async-eval comparison window.","next_action_hint":"Switch to recovery-only mirror/control bundle until >=100 re-entry before new major probes.","backend":"mirror_sd_mlx","context_only_draft_cache":1,"draft_sink":48,"async_eval_reverted":true,"paired_async_tok_s":66.05517731194685,"paired_delta_tok_s":-23.403717445607416,"shared_collapse_confirmed":true,"severe_collapse":true,"delta_vs_keep":-64.20854013366058}}
{"run":1079,"commit":"8b55918","metric":62.51597654112269,"metrics":{},"status":"discard","description":"Control parity check after mirror severe trough (~42.65), mirror disabled.","timestamp":1776308388831,"segment":23,"confidence":2.2843410849359036,"iterationTokens":873,"asi":{"hypothesis":"If collapse is shared, control should also be deeply degraded.","rollback_reason":"Control at ~62.52 confirms shared collapse/recovery wave, still far below keep.","next_action_hint":"Return to mirror and continue recovery-only bundle until 90+ and 100+ re-entry.","backend":"bstnxbt_mlx","mirror_runtime_enabled":0,"context_only_draft_cache":1,"draft_sink":48,"paired_mirror_tok_s":42.65145986633943,"paired_delta_tok_s":-19.86451667478326,"shared_collapse":true}}
{"run":1080,"commit":"8b55918","metric":73.21524610284095,"metrics":{},"status":"discard","description":"Mirror recovery sample after severe collapse window; rebounded into low-70s.","timestamp":1776308483187,"segment":23,"confidence":2.2526270484236472,"iterationTokens":873,"asi":{"hypothesis":"Post-collapse recovery should climb from low-40/60 into 70+ before returning to 90/100 bands.","rollback_reason":"Low-70 remains far below keep.","next_action_hint":"Continue recovery-only cadence and recheck control parity in this band.","backend":"mirror_sd_mlx","context_only_draft_cache":1,"draft_sink":48,"delta_vs_keep":-33.644753897159056,"recovery_phase":true}}
{"run":1081,"commit":"8b55918","metric":105.29864487020558,"metrics":{},"status":"discard","description":"Control parity check after mirror low-70 sample (mirror disabled).","timestamp":1776308522729,"segment":23,"confidence":2.2843410849359036,"iterationTokens":741,"asi":{"hypothesis":"If collapse/recovery was shared, control should be in similar degraded band.","rollback_reason":"Control snapped to ~105.30, far above paired mirror low-70 sample; indicates asymmetric transient or mirror-local wobble in prior sample.","next_action_hint":"Return to mirror immediately for symmetry check before interpreting backend gap as real.","backend":"bstnxbt_mlx","mirror_runtime_enabled":0,"context_only_draft_cache":1,"draft_sink":48,"paired_mirror_tok_s":73.21524610284095,"paired_delta_tok_s":-32.08339876736463,"shared_recovery":false}}
{"run":1082,"commit":"8b55918","metric":103.2088897856942,"metrics":{},"status":"discard","description":"Mirror follow-up after control 105.30 parity shock; mirror recovered to low-103.","timestamp":1776308568026,"segment":23,"confidence":2.3059852864846513,"iterationTokens":1367,"asi":{"hypothesis":"Prior mirror low-70 was a transient instability outlier rather than persistent backend regression.","rollback_reason":"Mirror recovered strongly to ~103.21 but still below keep.","next_action_hint":"Continue paired sampling in recovered 103-105 band; only test new major bet if this band sustains.","backend":"mirror_sd_mlx","context_only_draft_cache":1,"draft_sink":48,"paired_control_tok_s":105.29864487020558,"paired_delta_tok_s":-2.0897550845113844,"delta_vs_keep":-3.6511102143058003,"outlier_recovered":true}}
