{"type":"config","name":"SiliconFlash OmniCoder DFlash bootstrap","metricName":"completion_tok_s","metricUnit":"","bestDirection":"higher"}
{"run":1,"commit":"035de0a","metric":6.58872007732111,"metrics":{},"status":"keep","description":"Bootstrap baseline: isolated local oMLX server + OmniCoder-9B bf16 benchmark harness with DFlash scaffolding and autoresearch scripts.","timestamp":1775926977746,"segment":0,"confidence":null,"iterationTokens":114}
{"run":2,"commit":"9f1d5fa","metric":7.064878058474399,"metrics":{},"status":"keep","description":"Tune autoresearch harness for the Day-1 single-request target by setting max-concurrent-requests=1, reducing scheduler overhead during the OmniCoder baseline benchmark.","timestamp":1775927527522,"segment":0,"confidence":null,"iterationTokens":114}
{"run":3,"commit":"adc81c2","metric":7.427962653705679,"metrics":{},"status":"keep","description":"Reduce per-token collector overhead for non-streaming batched LLM requests by raising BatchedEngine's default stream_interval from 1 to 8.","timestamp":1775927589988,"segment":0,"confidence":2.311424355114771,"iterationTokens":13016}
{"run":4,"commit":"adc81c2","metric":6.523830761436984,"metrics":{},"status":"discard","description":"Test a more aggressive stream_interval=16 to see if batching collector updates further improves non-streaming throughput; it regressed request performance versus the 8-token setting.","timestamp":1775927621979,"segment":0,"confidence":3.1022891380475115,"iterationTokens":690}
{"run":5,"commit":"adc81c2","metric":5.921885746785415,"metrics":{},"status":"discard","description":"Probe whether stream_interval=4 gives a better balance than 8 for non-streaming OmniCoder requests; it significantly regressed throughput.","timestamp":1775927652899,"segment":0,"confidence":1.7625296846896548,"iterationTokens":689}
{"run":6,"commit":"adc81c2","metric":6.962761104186831,"metrics":{},"status":"discard","description":"Try a non-aggregating output collector for non-streaming generate() requests so only the latest cumulative output is retained; it did not beat the stream_interval=8 baseline.","timestamp":1775927719209,"segment":0,"confidence":3.1022891380475115,"iterationTokens":8123}
{"run":7,"commit":"adc81c2","metric":6.981133333127175,"metrics":{},"status":"discard","description":"Re-run the current stream_interval=8 baseline unchanged to estimate noise; result was below the best sample, so keep existing code but treat future small wins cautiously.","timestamp":1775927745447,"segment":0,"confidence":2.243717977722943,"iterationTokens":661}
{"run":8,"commit":"adc81c2","metric":7.256049113566927,"metrics":{},"status":"discard","description":"Test a smaller initial_cache_blocks=64 in the autoresearch harness to reduce short-context cache setup overhead; improved over stock but did not beat the current best stream_interval=8 baseline.","timestamp":1775927775570,"segment":0,"confidence":2.5152287126778803,"iterationTokens":964}
{"run":9,"commit":"adc81c2","metric":6.311364330336662,"metrics":{},"status":"discard","description":"Test yielding to the event loop less often in EngineCore when no streamed consumers are waiting, aiming to cut scheduler-loop overhead for non-streaming requests; it regressed throughput.","timestamp":1775927822776,"segment":0,"confidence":2.243717977722943,"iterationTokens":1567}
{"type":"config","name":"SiliconFlash OmniCoder DFlash warmed-request baseline","metricName":"completion_tok_s","metricUnit":"","bestDirection":"higher"}
{"run":10,"commit":"9e65153","metric":24.370831142429775,"metrics":{},"status":"keep","description":"Rebaseline the session around a warmed-model request: add a tiny distinct warmup request to exclude lazy OmniCoder model load from the primary throughput metric and better expose generation-path improvements.","timestamp":1775927913421,"segment":1,"confidence":null,"iterationTokens":130}
{"run":11,"commit":"7d108e3","metric":24.925433851054436,"metrics":{},"status":"keep","description":"Confirm the warmed-model baseline under the corrected workload; the unchanged stream_interval=8 configuration produced a slightly faster steady-state sample, so promote it to the current baseline.","timestamp":1775927936090,"segment":1,"confidence":null,"iterationTokens":600}
{"run":12,"commit":"7d108e3","metric":25.15384457833746,"metrics":{},"status":"discard","description":"Retest stream_interval=16 under the warmed-model workload; the initial +0.9% sample looked promising but was too small relative to expected noise, so hold judgment pending confirmation.","timestamp":1775927979825,"segment":1,"confidence":2.4280939657332863,"iterationTokens":391}
{"run":13,"commit":"7d108e3","metric":24.325510686939754,"metrics":{},"status":"discard","description":"Confirmation run for stream_interval=16 under the warmed-model workload came in below baseline, indicating the earlier uptick was noise rather than a robust win.","timestamp":1775927984696,"segment":1,"confidence":1.8489124667926278,"iterationTokens":391}
{"run":14,"commit":"7d108e3","metric":24.735401659278807,"metrics":{},"status":"discard","description":"Test mutating RequestOutput in place during collector merges to reduce allocation churn in the hot path; it did not beat the current warmed baseline.","timestamp":1775928033013,"segment":1,"confidence":1.5212494784769468,"iterationTokens":4795}
{"type":"config","name":"SiliconFlash OmniCoder DFlash warmed-request 256-token baseline","metricName":"completion_tok_s","metricUnit":"","bestDirection":"higher"}
{"run":15,"commit":"48a09ad","metric":27.25144615292934,"metrics":{},"status":"keep","description":"Rebaseline the session around a warmed-model 256-token generation workload so DFlash-style generation-path wins are easier to detect than on the noisier 64-token benchmark.","timestamp":1775928084324,"segment":2,"confidence":null,"iterationTokens":134}
{"run":16,"commit":"11d21b5","metric":27.259760251956667,"metrics":{},"status":"keep","description":"Confirm the warmed-model 256-token baseline under the corrected workload; the unchanged stream_interval=8 configuration produced a marginally better repeat sample.","timestamp":1775928105299,"segment":2,"confidence":null,"iterationTokens":536}
{"run":17,"commit":"11d21b5","metric":27.226971867863995,"metrics":{},"status":"discard","description":"Avoid copying the cumulative output_token_ids list on every scheduler step by passing the request-owned list through RequestOutput; result was effectively flat-to-worse on the warmed 256-token workload.","timestamp":1775928158399,"segment":2,"confidence":1,"iterationTokens":6074}
{"run":18,"commit":"b5b9ffa","metric":27.807114392043754,"metrics":{},"status":"keep","description":"Add a non-streaming request fast path: mark generate() requests as non-streaming and skip per-token detokenization/new_text construction in the scheduler, decoding only once at finalization.","timestamp":1775928292342,"segment":2,"confidence":33.89421311790331,"iterationTokens":371}
{"run":19,"commit":"b36201a","metric":27.523148587108444,"metrics":{},"status":"keep","description":"Confirmation run #1 for the kept non-streaming detokenization-skip fast path; throughput remained above the warmed 256-token baseline.","timestamp":1775928297030,"segment":2,"confidence":16.947106558953493,"iterationTokens":371}
{"run":20,"commit":"4661191","metric":28.037638045488084,"metrics":{},"status":"keep","description":"Confirmation run #2 for the kept non-streaming detokenization-skip fast path; throughput again remained above the warmed 256-token baseline and strengthened confidence in the change.","timestamp":1775928306398,"segment":2,"confidence":5.163977666196882,"iterationTokens":371}
{"run":21,"commit":"5b16e18","metric":28.027783290363914,"metrics":{},"status":"keep","description":"Extend the non-streaming fast path so scheduler outputs are only constructed/emitted at request finish for generate() calls, eliminating intermediate RequestOutput churn on the warmed 256-token workload.","timestamp":1775928398573,"segment":2,"confidence":2.7686146673112497,"iterationTokens":409}
{"run":22,"commit":"23f12f7","metric":28.189876028859974,"metrics":{},"status":"keep","description":"Confirmation run #1 for the kept non-streaming finish-only output fast path; throughput stayed above the prior decode-skip-only baseline.","timestamp":1775928409428,"segment":2,"confidence":2.412795129863115,"iterationTokens":409}
{"run":23,"commit":"6d98fba","metric":28.154673030305787,"metrics":{},"status":"keep","description":"Confirmation run #2 for the kept non-streaming finish-only output fast path; throughput again remained above the prior decode-skip-only baseline.","timestamp":1775928414189,"segment":2,"confidence":2.7000620114730944,"iterationTokens":409}
{"run":24,"commit":"6d98fba","metric":27.751094272495994,"metrics":{},"status":"discard","description":"Test whether the newer non-streaming finish-only output path makes the earlier stream_interval=8 tuning unnecessary by reverting BatchedEngine back to stream_interval=1; it regressed throughput.","timestamp":1775928446512,"segment":2,"confidence":2.9598684984484285,"iterationTokens":1360}
{"run":25,"commit":"6d98fba","metric":0,"metrics":{},"status":"crash","description":"Test skipping RequestStreamState allocation for non-streaming requests after adding the finish-only output path; this broke response delivery with premature chunked termination, indicating another path still assumes stream state exists.","timestamp":1775955551467,"segment":2,"confidence":2.9598684984484285,"iterationTokens":1360}
{"run":26,"commit":"6d98fba","metric":27.655741369403145,"metrics":{},"status":"discard","description":"Safer follow-up to the stream-state crash: keep RequestStreamState intact but disable RequestOutputCollector aggregation for non-streaming requests now that they only emit once on finish; it did not beat the current best.","timestamp":1775955597606,"segment":2,"confidence":3.274996577770823,"iterationTokens":2736}
{"run":27,"commit":"6d98fba","metric":28.401360763559502,"metrics":{},"status":"discard","description":"Try bypassing RequestOutputCollector entirely for non-streaming generate() calls by storing the finished RequestOutput directly in EngineCore state and waking generate() via the existing event; the first run looked strong but failed to reproduce on confirmation, so treat it as noise.","timestamp":1775955776115,"segment":2,"confidence":2.9598684984484285,"iterationTokens":346}
{"run":28,"commit":"6d98fba","metric":27.663004028110333,"metrics":{},"status":"discard","description":"On top of the kept finish-only non-streaming path, avoid copying the cumulative output_token_ids list when building the final RequestOutput; it did not improve throughput.","timestamp":1775955810254,"segment":2,"confidence":3.274996577770823,"iterationTokens":990}
{"run":29,"commit":"6d98fba","metric":28.24515513160835,"metrics":{},"status":"discard","description":"For non-streaming finish-only outputs, avoid allocating the final new_token_ids list because generate() never consumes incremental token IDs; the initial gain did not reproduce on confirmation.","timestamp":1775955901966,"segment":2,"confidence":2.9598684984484285,"iterationTokens":323}
{"run":30,"commit":"6d98fba","metric":8.074487653251508,"metrics":{},"status":"discard","description":"Assume the finish-only non-streaming path leaves exactly one final collector entry and replace the drain loop in generate() with a single get_nowait(); this badly regressed throughput, so the collector can still accumulate multiple outputs in practice.","timestamp":1775955975347,"segment":2,"confidence":2.3252707377946695,"iterationTokens":1671}
{"run":31,"commit":"6d98fba","metric":0,"metrics":{},"status":"crash","description":"Retest stream_interval=16 on top of the kept non-streaming finish-only fast path, but the run was aborted before producing a valid measurement.","timestamp":1775956325412,"segment":2,"confidence":2.3252707377946695,"iterationTokens":1671}
{"run":32,"commit":"6d98fba","metric":26.61444702014773,"metrics":{},"status":"discard","description":"Test an idle-engine direct synchronous generation fast path that bypasses the background async loop for plain non-streaming text requests; it regressed the warmed 256-token workload.","timestamp":1775956392851,"segment":2,"confidence":2.09725438866074,"iterationTokens":2150}
{"run":33,"commit":"6d98fba","metric":27.632972650635583,"metrics":{},"status":"discard","description":"Make the benchmark explicitly greedy by setting top_p=1.0 alongside temperature=0 in both warmup and measured requests; it did not improve throughput over the current baseline.","timestamp":1775956490357,"segment":2,"confidence":2.3272023808571394,"iterationTokens":7110}
{"run":34,"commit":"a6b9beb","metric":28.219531383542993,"metrics":{},"status":"keep","description":"Revisit reduced event-loop yields under the newer non-streaming finish-only fast path: yield immediately on finishes, otherwise only when a streamed consumer is waiting or every few steps.","timestamp":1775956618794,"segment":2,"confidence":2.16352979650043,"iterationTokens":299}
{"run":35,"commit":"a817ccc","metric":28.327873670549426,"metrics":{},"status":"keep","description":"Confirmation run #1 for the kept reduced-yield engine-loop change on the non-streaming finish-only path; throughput remained above the prior baseline.","timestamp":1775956623686,"segment":2,"confidence":2.453218489620074,"iterationTokens":299}
{"run":36,"commit":"afcc60c","metric":28.385323596517352,"metrics":{},"status":"keep","description":"Confirmation run #2 for the kept reduced-yield engine-loop change on the non-streaming finish-only path; throughput again remained above the prior baseline.","timestamp":1775956631739,"segment":2,"confidence":2.6641896418067064,"iterationTokens":299}
{"run":37,"commit":"afcc60c","metric":28.34365780797827,"metrics":{},"status":"discard","description":"Probe a more aggressive reduced-yield cadence by yielding every 16 scheduler steps instead of 8 on the non-streaming finish-only path; it did not beat the current best.","timestamp":1775956663824,"segment":2,"confidence":2.7493470612500355,"iterationTokens":1220}
{"run":38,"commit":"afcc60c","metric":28.328368692433102,"metrics":{},"status":"discard","description":"Bracket the reduced-yield cadence on the other side by yielding every 4 scheduler steps instead of 8 on the non-streaming finish-only path; it did not beat the current best.","timestamp":1775956715517,"segment":2,"confidence":3.140906276336839,"iterationTokens":1316}
{"run":39,"commit":"afcc60c","metric":28.28950778610164,"metrics":{},"status":"discard","description":"Diagnostic upper-bound run with --no-cache to estimate how much paged-SSD cache work contributes to latency on the warmed 256-token workload; it did not beat the current best and is not acceptable as a kept direction because SiliconFlash must preserve paged SSD caching.","timestamp":1775956770382,"segment":2,"confidence":3.5896451925011945,"iterationTokens":900}
{"run":40,"commit":"afcc60c","metric":27.251567874187803,"metrics":{},"status":"discard","description":"Test the most aggressive reduced-yield strategy on the non-streaming finish-only path by yielding only on finished outputs or waiting streamed consumers, with no periodic yield at all; it regressed back to baseline.","timestamp":1775956825018,"segment":2,"confidence":2.959127900017753,"iterationTokens":4629}
{"run":41,"commit":"afcc60c","metric":27.457779765339183,"metrics":{},"status":"discard","description":"Use a per-request asyncio.Future for non-streaming generate() completion and have the engine loop fulfill it directly on finished output instead of draining a collector; it regressed throughput versus the kept path.","timestamp":1775956918836,"segment":2,"confidence":2.588520521436126,"iterationTokens":3434}
{"run":42,"commit":"afcc60c","metric":16.794348222558362,"metrics":{},"status":"discard","description":"Re-run the unchanged current best-known code to refresh the baseline sample; this run was a severe slow outlier and should be treated as noise, not a code regression.","timestamp":1775956970650,"segment":2,"confidence":2.322438434584449,"iterationTokens":659}
{"type":"config","name":"SiliconFlash OmniCoder DFlash warmed-request 256-token median-of-3 baseline","metricName":"completion_tok_s","metricUnit":"","bestDirection":"higher"}
{"run":43,"commit":"afcc60c","metric":7.0694167874405744,"metrics":{},"status":"discard","description":"Rebaseline around a median-of-3 measured workload to reduce noise, but repeated benchmark requests inside one server run became progressively slower (about 30s, 36s, 47s) and made the workload pathological instead of cleaner.","timestamp":1775957195858,"segment":3,"confidence":null,"iterationTokens":146}
{"type":"config","name":"SiliconFlash OmniCoder DFlash warmed-request 256-token baseline","metricName":"completion_tok_s","metricUnit":"","bestDirection":"higher"}
{"run":44,"commit":"7259548","metric":10.586224684037045,"metrics":{},"status":"keep","description":"Restore the warmed-model single-request 256-token workload after discarding the pathological median-of-3 design; use this as the new session baseline and re-measure immediately to separate benchmark reset effects from real regressions.","timestamp":1775957295850,"segment":4,"confidence":null,"iterationTokens":145}
{"run":45,"commit":"7259548","metric":10.138858465666177,"metrics":{},"status":"discard","description":"Immediate rerun of the unchanged current code on the restored warmed single-request workload confirmed that throughput is still in the ~10 tok/s range, so the new low baseline is currently real rather than a one-off spike.","timestamp":1775957342658,"segment":4,"confidence":null,"iterationTokens":687}
{"run":46,"commit":"3ebfc64","metric":15.554104924223335,"metrics":{},"status":"keep","description":"Reset the per-run paged-SSD cache directory in autoresearch.sh to eliminate stale cache-state pollution between experiments; this restores a much healthier warmed-request benchmark range.","timestamp":1775957438491,"segment":4,"confidence":11.10472815376483,"iterationTokens":307}
{"run":47,"commit":"819a18d","metric":18.560705331488908,"metrics":{},"status":"keep","description":"Confirmation run #1 for the per-run paged-SSD cache reset benchmark fix; throughput climbed further into the high-teens, confirming the prior low baseline was polluted by stale cache state.","timestamp":1775957446696,"segment":4,"confidence":2.9451958312444337,"iterationTokens":307}
{"run":48,"commit":"f827d56","metric":17.27535186222216,"metrics":{},"status":"keep","description":"Confirmation run #2 for the per-run paged-SSD cache reset benchmark fix; throughput remained well above the polluted baseline, stabilizing the restored workload in the high-teens.","timestamp":1775957454308,"segment":4,"confidence":2.6523247413195326,"iterationTokens":307}
{"run":49,"commit":"f827d56","metric":16.655778512088006,"metrics":{},"status":"discard","description":"Rerun the unchanged current best-known code after fixing per-run cache pollution; the restored workload is now consistently landing in the mid-to-high teens, not back at the polluted ~10 tok/s baseline.","timestamp":1775957488545,"segment":4,"confidence":4.398289315937385,"iterationTokens":1194}
{"run":50,"commit":"d861424","metric":27.480172197344547,"metrics":{},"status":"keep","description":"Align the benchmark with the intended greedy DFlash-style workload by setting chat_template_kwargs.enable_thinking=false for both warmup and measured requests; this restores throughput to the high-20 tok/s range.","timestamp":1775957644657,"segment":4,"confidence":8.868554603383993,"iterationTokens":304}
{"run":51,"commit":"d85810f","metric":27.43917054119557,"metrics":{},"status":"keep","description":"Confirmation run #1 for the kept no-thinking benchmark configuration; throughput remained essentially unchanged in the high-20 tok/s range.","timestamp":1775957650647,"segment":4,"confidence":4.237002573629853,"iterationTokens":304}
{"run":52,"commit":"eaf9534","metric":26.4021074648186,"metrics":{},"status":"keep","description":"Confirmation run #2 for the kept no-thinking benchmark configuration; throughput dipped slightly but remained far above the polluted thinking-enabled baseline.","timestamp":1775957658119,"segment":4,"confidence":2.5255832432671954,"iterationTokens":304}
{"run":53,"commit":"eaf9534","metric":26.762181405104013,"metrics":{},"status":"discard","description":"Retest smaller initial_cache_blocks on the cleaned no-thinking workload by lowering it from 64 to 16; it did not improve throughput.","timestamp":1775957695288,"segment":4,"confidence":2.2359839232212404,"iterationTokens":1356}
{"run":54,"commit":"eaf9534","metric":26.416782137985688,"metrics":{},"status":"discard","description":"Retest stream_interval=16 on top of the cleaned no-thinking workload and current non-streaming fast path; it remained worse than the existing setting.","timestamp":1775957734178,"segment":4,"confidence":2.150430543058926,"iterationTokens":704}
{"run":55,"commit":"eaf9534","metric":27.71657685436672,"metrics":{},"status":"discard","description":"Retest stream_interval=4 on the cleaned no-thinking workload; the first two runs were competitive, but a third confirmation run collapsed into a severe slow outlier, so it is not robust enough to replace the current setting.","timestamp":1775957819415,"segment":4,"confidence":3.3109740217890646,"iterationTokens":368}
{"run":56,"commit":"eaf9534","metric":9.947566319651266,"metrics":{},"status":"discard","description":"Re-test explicit top_p=1.0 on top of the cleaned no-thinking benchmark; it caused a dramatic regression, so the server’s default greedy path is clearly preferable here.","timestamp":1775958543058,"segment":4,"confidence":2.1185012868149267,"iterationTokens":39036}
