{"run":1821,"commit":"54028e7","metric":37.45310875517316,"metrics":{},"status":"discard","description":"Immediate control parity in collapse window was dramatically worse (~26.24 tok/s, eval_s ~37.45), strongly confirming shared collapse attribution.","timestamp":1776375879609,"segment":24,"confidence":0.07925325816551651,"iterationTokens":1249,"asi":{"hypothesis":"If collapse is shared runtime-state behavior, control can degrade as much or more than mirror in the same window.","rollback_reason":"Parity diagnostic run and far above best metric.","next_action_hint":"Return to mirror default and track rebound staircase after shared-collapse confirmation.","diagnostic_findings":{"completion_tok_s":26.23585440796696,"dflash_eval_s":37.45310875517316,"dflash_total_s":38.80334816710092,"dflash_draft_s":0.7120780405821279,"dflash_verify_s":0.2923836612608284,"dflash_acceptance_rate":0.6972201352366642,"attribution":"shared_collapse_confirmed_control_worse"}}}
{"run":1822,"commit":"54028e7","metric":30.715483797248453,"metrics":{},"status":"discard","description":"Post-parity mirror remained in severe collapse (~31.86 tok/s, eval_s ~30.72), confirming continued degraded window after shared-collapse event.","timestamp":1776375932734,"segment":24,"confidence":0.07782924435875707,"iterationTokens":1237,"asi":{"hypothesis":"After extreme shared collapse, mirror may stay deeply degraded for several runs before rebound begins.","rollback_reason":"Primary metric catastrophically above best.","next_action_hint":"Continue unchanged mirror tracking to capture rebound staircase out of severe trough.","diagnostic_findings":{"completion_tok_s":31.859031749238635,"dflash_eval_s":30.715483797248453,"dflash_total_s":31.908221457968466,"dflash_acceptance_rate":0.6972201352366642}}}
{"run":1823,"commit":"54028e7","metric":22.215663292328827,"metrics":{},"status":"discard","description":"Mirror began rebounding from severe trough (eval_s 30.72→22.22; tok/s 31.86→44.05) with acceptance still unchanged.","timestamp":1776375974343,"segment":24,"confidence":0.07645550035592799,"iterationTokens":1164,"asi":{"hypothesis":"Collapse recovery proceeds as staged eval_s deflation while speculative telemetry remains constant.","rollback_reason":"Primary metric still far above best.","next_action_hint":"Continue unchanged mirror runs to map the rebound ladder toward soft/high bands.","diagnostic_findings":{"completion_tok_s":44.0467055455391,"dflash_eval_s":22.215663292328827,"dflash_total_s":23.031979124993086,"dflash_acceptance_rate":0.6972201352366642}}}
{"run":1824,"commit":"54028e7","metric":18.859914125641808,"metrics":{},"status":"discard","description":"Recovery continued (eval_s ~18.86, tok/s ~50.98) but remains deep in degraded regime after shared collapse.","timestamp":1776376012468,"segment":24,"confidence":0.07555880861653635,"iterationTokens":1172,"asi":{"hypothesis":"Rebound should keep reducing eval_s in steps while acceptance structure stays fixed.","rollback_reason":"Primary metric still far above best.","next_action_hint":"Keep unchanged mirror monitoring through the recovery staircase.","diagnostic_findings":{"completion_tok_s":50.98155656122842,"dflash_eval_s":18.859914125641808,"dflash_total_s":19.838068790966645,"dflash_acceptance_rate":0.6972201352366642}}}
{"run":1825,"commit":"54028e7","metric":16.054913837695494,"metrics":{},"status":"discard","description":"Recovery advanced into mid-degraded range (~60.76 tok/s, eval_s ~16.05) with acceptance/step telemetry unchanged.","timestamp":1776376046865,"segment":24,"confidence":0.07468290636102907,"iterationTokens":1145,"asi":{"hypothesis":"Collapse rebound remains eval-driven and should continue contracting toward soft band in stages.","rollback_reason":"Primary metric still above best.","next_action_hint":"Continue unchanged mirror loop to follow recovery trajectory.","diagnostic_findings":{"completion_tok_s":60.76162366503939,"dflash_eval_s":16.054913837695494,"dflash_total_s":16.655655625043437,"dflash_acceptance_rate":0.6972201352366642}}}
{"run":1826,"commit":"54028e7","metric":16.834963293280452,"metrics":{},"status":"discard","description":"Recovery whipsawed slightly worse (~57.98 tok/s, eval_s ~16.83) but remained within the same degraded-collapse rebound regime.","timestamp":1776376085157,"segment":24,"confidence":0.0740201322362212,"iterationTokens":1138,"asi":{"hypothesis":"Post-collapse rebound can oscillate before resuming downward eval_s trend.","rollback_reason":"Primary metric still far above best.","next_action_hint":"Continue unchanged mirror monitoring through whipsaw until soft-band re-entry.","diagnostic_findings":{"completion_tok_s":57.97585948807341,"dflash_eval_s":16.834963293280452,"dflash_total_s":17.46799670800101,"dflash_acceptance_rate":0.6972201352366642}}}
{"run":1827,"commit":"54028e7","metric":15.524810922914185,"metrics":{},"status":"discard","description":"Recovery resumed after whipsaw (~62.71 tok/s, eval_s ~15.52), still in degraded band with invariant acceptance.","timestamp":1776376144026,"segment":24,"confidence":0.07336901822351749,"iterationTokens":2460,"asi":{"hypothesis":"Post-collapse rebound remains noisy but trend continues downward in eval_s over multiple runs.","rollback_reason":"Primary metric still far above best.","next_action_hint":"Continue unchanged mirror monitoring toward soft-band re-entry.","diagnostic_findings":{"completion_tok_s":62.71074162110558,"dflash_eval_s":15.524810922914185,"dflash_total_s":16.13782516703941,"dflash_acceptance_rate":0.6972201352366642}}}
{"run":1828,"commit":"54028e7","metric":13.814417131827213,"metrics":{},"status":"discard","description":"Recovery stepped forward (~70.18 tok/s, eval_s ~13.81) but remains in degraded post-collapse regime.","timestamp":1776376176388,"segment":24,"confidence":0.07237501818569214,"iterationTokens":1202,"asi":{"hypothesis":"Rebound staircase is re-forming after whipsaw and should continue toward soft-band levels.","rollback_reason":"Primary metric still above best.","next_action_hint":"Continue unchanged mirror loop to track descent toward <=10 eval_s.","diagnostic_findings":{"completion_tok_s":70.18075734247023,"dflash_eval_s":13.814417131827213,"dflash_total_s":14.397587916930206,"dflash_acceptance_rate":0.6972201352366642}}}
{"run":1829,"commit":"54028e7","metric":24.3717908723047,"metrics":{},"status":"discard","description":"Rebound whipsawed back into severe collapse (~39.71 tok/s, eval_s ~24.37) with acceptance still fixed.","timestamp":1776376223866,"segment":24,"confidence":0.07140759146611819,"iterationTokens":1152,"asi":{"hypothesis":"This reflects another shared runtime-state jump, not speculative-quality change.","rollback_reason":"Primary metric catastrophically above best.","next_action_hint":"Run immediate control parity sample to reconfirm shared attribution for this renewed hard collapse.","diagnostic_findings":{"completion_tok_s":39.711761448260084,"dflash_eval_s":24.3717908723047,"dflash_total_s":25.4502044999972,"dflash_acceptance_rate":0.6972201352366642,"transition":"recovery_to_hard_collapse"}}}
{"run":1830,"commit":"54028e7","metric":30.649628577986732,"metrics":{},"status":"discard","description":"Immediate control parity was also severely collapsed (~31.68 tok/s, eval_s ~30.65), reconfirming shared collapse attribution.","timestamp":1776376280019,"segment":24,"confidence":0.0705297899441268,"iterationTokens":1235,"asi":{"hypothesis":"Renewed hard-collapse transitions continue to be shared across mirror/control lanes.","rollback_reason":"Parity diagnostic run and far above best metric.","next_action_hint":"Return to mirror default and continue tracking rebound trajectory.","diagnostic_findings":{"completion_tok_s":31.684986911555395,"dflash_eval_s":30.649628577986732,"dflash_total_s":31.880782625055872,"dflash_acceptance_rate":0.6972201352366642,"attribution":"shared_collapse_reconfirmed"}}}
{"run":1831,"commit":"54028e7","metric":18.411851740791462,"metrics":{},"status":"discard","description":"Back on mirror after parity, collapse rebound resumed (~52.50 tok/s, eval_s ~18.41) but remains deeply degraded.","timestamp":1776376325481,"segment":24,"confidence":0.06967330768125979,"iterationTokens":1174,"asi":{"hypothesis":"After renewed shared collapse, mirror should climb via staged eval_s recovery while acceptance remains fixed.","rollback_reason":"Primary metric still far above best.","next_action_hint":"Continue unchanged mirror monitoring through rebound before any new probes.","diagnostic_findings":{"completion_tok_s":52.49536995339927,"dflash_eval_s":18.411851740791462,"dflash_total_s":19.285733915981837,"dflash_acceptance_rate":0.6972201352366642}}}
{"run":1832,"commit":"fe74632","metric":8.780401130672544,"metrics":{},"status":"keep","description":"Implemented collapse watchdog + async backpressure hardening (safe-mode fallback with optional cache clear, periodic async drain, new collapse telemetry). First honest run stayed high-window (~107.83 tok/s, eval_s ~8.780) with watchdog armed but inactive.","timestamp":1776377677340,"segment":24,"confidence":0.0705297899441268,"iterationTokens":58526,"asi":{"hypothesis":"A per-request collapse watchdog plus async queue draining can reduce severe eval blow-ups while preserving high-window throughput when stable.","implementation":{"watchdog":"detect consecutive eval-step spikes vs rolling baseline, then one-way safe mode: disable async/fused and clamp block size","hardening":"periodic async drain every N steps and optional clear_cache on safe-mode activation","telemetry":"added collapse_* usage fields for activation/spike/drain/eval-step stats"},"diagnostic_findings":{"completion_tok_s":107.8276096647854,"dflash_eval_s":8.780401130672544,"dflash_total_s":9.297489125048742,"dflash_collapse_watchdog_enabled":1,"dflash_collapse_spike_events":0,"dflash_collapse_safe_mode_activations":0,"dflash_collapse_async_drain_calls":11},"next_action_hint":"Run extended honest loop on unchanged code to verify whether collapse amplitude/frequency drops versus prior shared-collapse behavior."}}
{"run":1833,"commit":"fe74632","metric":8.81431816064287,"metrics":{},"status":"discard","description":"Verification loop run stayed in high-soft band (~107.35 tok/s, eval_s ~8.814); watchdog telemetry remained inactive (no spikes/safe-mode).","timestamp":1776377713590,"segment":24,"confidence":0.07140759146611819,"iterationTokens":1907,"asi":{"hypothesis":"When runtime is healthy, watchdog/backpressure instrumentation should be near-noop and preserve throughput.","rollback_reason":"Primary metric above current best floor.","next_action_hint":"Continue honest loop to observe degraded-window behavior and whether safe mode activates during collapse.","diagnostic_findings":{"completion_tok_s":107.34915569637357,"dflash_eval_s":8.81431816064287,"dflash_collapse_spike_events":0,"dflash_collapse_safe_mode_activations":0,"dflash_collapse_async_drain_calls":11}}}
{"run":1834,"commit":"fe74632","metric":8.851198875694536,"metrics":{},"status":"discard","description":"Second verification run remained near-high (~106.73 tok/s, eval_s ~8.851); collapse watchdog stayed inactive with normal per-step eval stats.","timestamp":1776377744921,"segment":24,"confidence":0.07232551655778097,"iterationTokens":1492,"asi":{"hypothesis":"In non-collapsed windows, watchdog should not trigger and overhead should stay low.","rollback_reason":"Primary metric above best floor.","next_action_hint":"Keep looping to capture a transition event and validate safe-mode behavior under collapse.","diagnostic_findings":{"completion_tok_s":106.72589166468748,"dflash_eval_s":8.851198875694536,"dflash_collapse_spike_events":0,"dflash_collapse_safe_mode_activations":0,"dflash_collapse_async_drain_calls":11}}}
{"run":1835,"commit":"fe74632","metric":29.212664130493067,"metrics":{},"status":"discard","description":"Severe collapse reappeared (~33.10 tok/s, eval_s ~29.21), but watchdog did not trigger (0 spikes/activations) because latency started degraded from early steps.","timestamp":1776377801323,"segment":24,"confidence":0.07140759146611819,"iterationTokens":1446,"asi":{"hypothesis":"Relative-spike-only detection misses collapse windows that begin in a uniformly degraded state.","rollback_reason":"Primary metric catastrophically worse than best.","next_action_hint":"Strengthen watchdog with absolute severe-step threshold trigger, then rerun honest loop.","diagnostic_findings":{"completion_tok_s":33.102882931862496,"dflash_eval_s":29.212664130493067,"dflash_collapse_spike_events":0,"dflash_collapse_safe_mode_activations":0,"dflash_collapse_eval_step_mean_s":0.3042980343464781,"dflash_collapse_eval_step_max_s":0.764471499947831}}}
{"run":1836,"commit":"fe74632","metric":17.905146043398418,"metrics":{},"status":"discard","description":"Absolute-threshold watchdog fired as intended in a hard-collapse run (safe_mode activated at step 6, spikes=6, clear_cache_calls=1), but end-to-end eval_s remained far above baseline on this sample.","timestamp":1776377943176,"segment":24,"confidence":0.0705297899441268,"iterationTokens":4881,"asi":{"hypothesis":"Adding absolute severe-step triggers will activate safe mode even when collapse starts early and uniformly.","rollback_reason":"Primary metric still catastrophically above best despite successful watchdog activation telemetry.","next_action_hint":"Reapply v2 watchdog patch and continue honest loop to evaluate collapse-floor impact across more transitions.","diagnostic_findings":{"completion_tok_s":45.07666000803313,"dflash_eval_s":17.905146043398418,"dflash_collapse_safe_mode_activations":1,"dflash_collapse_safe_mode_step":6,"dflash_collapse_spike_events":6,"dflash_collapse_severe_spike_events":6,"dflash_collapse_clear_cache_calls":1,"dflash_acceptance_rate":0.7188723570869224}}}
{"run":1837,"commit":"e73b63a","metric":8.819467208930291,"metrics":{},"status":"keep","description":"Promote v2 watchdog: added absolute severe-step trigger path (with severe spike telemetry) so safe mode can engage even when collapse starts early. Healthy-window run stayed near baseline (~107.25 tok/s, eval_s ~8.819).","timestamp":1776378021944,"segment":24,"confidence":0.07140759146611819,"iterationTokens":3084,"asi":{"hypothesis":"Combining relative and absolute eval-step triggers will catch both sudden and immediately-degraded collapse regimes.","implementation":{"watchdog_v2":"added severe_eval_step_s + severe_consecutive thresholds and severe spike counters","telemetry":"added dflash_collapse_severe_spike_events usage field"},"diagnostic_findings":{"completion_tok_s":107.2524250375982,"dflash_eval_s":8.819467208930291,"dflash_collapse_watchdog_enabled":1,"dflash_collapse_spike_events":0,"dflash_collapse_severe_spike_events":0,"dflash_collapse_safe_mode_activations":0},"next_action_hint":"Continue honest loop to capture the next collapse transition and verify that v2 triggers safe mode reliably in-window."}}
{"run":1838,"commit":"e73b63a","metric":8.845193749992177,"metrics":{},"status":"discard","description":"Verification loop with v2 watchdog remained high-soft (~107.05 tok/s, eval_s ~8.845); no collapse detected and safe mode stayed inactive.","timestamp":1776378053528,"segment":24,"confidence":0.07232551655778097,"iterationTokens":2358,"asi":{"hypothesis":"In stable windows the v2 watchdog should remain dormant and preserve throughput.","rollback_reason":"Primary metric above best floor.","next_action_hint":"Continue honest loop to capture a collapse transition and validate v2 activation behavior.","diagnostic_findings":{"completion_tok_s":107.04920355036262,"dflash_eval_s":8.845193749992177,"dflash_collapse_safe_mode_activations":0,"dflash_collapse_spike_events":0,"dflash_collapse_severe_spike_events":0}}}
{"run":1839,"commit":"e73b63a","metric":8.846992380684242,"metrics":{},"status":"discard","description":"Another high-soft verification sample (~107.03 tok/s, eval_s ~8.847); v2 watchdog remained inactive in stable regime.","timestamp":1776378082153,"segment":24,"confidence":0.07326734831597351,"iterationTokens":1457,"asi":{"hypothesis":"v2 collapse safeguards are neutral during stable windows.","rollback_reason":"Primary metric above current best floor.","next_action_hint":"Continue loop until transition event to validate collapse-path behavior.","diagnostic_findings":{"completion_tok_s":107.0320449918235,"dflash_eval_s":8.846992380684242,"dflash_collapse_safe_mode_activations":0,"dflash_collapse_spike_events":0}}}
{"run":1840,"commit":"e73b63a","metric":8.849384249420837,"metrics":{},"status":"discard","description":"High-soft window persisted (~107.02 tok/s, eval_s ~8.849); collapse protections remained idle as expected.","timestamp":1776378110457,"segment":24,"confidence":0.07396711217793105,"iterationTokens":1437,"asi":{"hypothesis":"Watchdog v2 introduces minimal perturbation during stable operation.","rollback_reason":"Primary metric above best floor.","next_action_hint":"Keep looping for a transition sample to evaluate collapse handling under load.","diagnostic_findings":{"completion_tok_s":107.01943318622148,"dflash_eval_s":8.849384249420837,"dflash_collapse_safe_mode_activations":0}}}
{"run":1841,"commit":"b5b72c1","metric":8.766060037072748,"metrics":{},"status":"keep","description":"Extended honest-loop verification hit high-window performance under v2 safeguards (~107.94 tok/s, eval_s ~8.766) with watchdog remaining inactive in healthy regime.","timestamp":1776378140857,"segment":24,"confidence":0.07457503743191647,"iterationTokens":1419,"asi":{"hypothesis":"v2 safeguards can preserve near-best high-window throughput when no collapse is present.","diagnostic_findings":{"completion_tok_s":107.93779726028262,"dflash_eval_s":8.766060037072748,"dflash_total_s":9.289910916006193,"dflash_collapse_safe_mode_activations":0,"dflash_collapse_spike_events":0,"dflash_collapse_async_drain_calls":11},"next_action_hint":"Continue loop until next collapse transition to evaluate whether v2 activation reduces collapse depth/duration versus prior runs."}}
{"run":1842,"commit":"b5b72c1","metric":9.063661039457656,"metrics":{},"status":"discard","description":"Softened into low-9 band (~104.54 tok/s, eval_s ~9.06) with watchdog still inactive and acceptance invariant.","timestamp":1776378173023,"segment":24,"confidence":0.07516855876736243,"iterationTokens":1692,"asi":{"hypothesis":"Current regime drift is soft-band jitter without collapse triggers.","rollback_reason":"Primary metric above best floor.","next_action_hint":"Continue honest loop to capture next hard transition for watchdog activation validation.","diagnostic_findings":{"completion_tok_s":104.53531056016305,"dflash_eval_s":9.063661039457656,"dflash_collapse_safe_mode_activations":0,"dflash_collapse_spike_events":0}}}
{"run":1843,"commit":"b5b72c1","metric":9.044767127954401,"metrics":{},"status":"discard","description":"Another low-9 soft-band sample (~104.65 tok/s, eval_s ~9.04) with watchdog dormant and stable acceptance telemetry.","timestamp":1776378202238,"segment":24,"confidence":0.07577160322680522,"iterationTokens":1438,"asi":{"hypothesis":"v2 safeguards remain transparent in non-collapse windows.","rollback_reason":"Primary metric above best.","next_action_hint":"Continue loop for transition capture; no parity check needed absent collapse onset.","diagnostic_findings":{"completion_tok_s":104.64568550723205,"dflash_eval_s":9.044767127954401,"dflash_collapse_safe_mode_activations":0}}}
{"run":1844,"commit":"b5b72c1","metric":8.821625875658356,"metrics":{},"status":"discard","description":"Stability block run 1/10: high-soft window (~107.30 tok/s, eval_s ~8.822); watchdog idle with zero spike/activation events.","timestamp":1776378579567,"segment":24,"confidence":0.07598895996857626,"iterationTokens":1438,"asi":{"hypothesis":"In healthy regime, v2 watchdog remains dormant while preserving throughput.","rollback_reason":"Primary metric above current best floor.","next_action_hint":"Continue stability block to sample transition risk and tail behavior.","stability_block":{"run_index":1,"run_count_target":10,"completion_tok_s":107.30303279126228,"dflash_eval_s":8.821625875658356,"safe_mode_activations":0,"spike_events":0,"severe_spike_events":0}}}
{"run":1845,"commit":"b5b72c1","metric":8.783283712808043,"metrics":{},"status":"discard","description":"Stability block run 2/10: near-high sample (~107.74 tok/s, eval_s ~8.783); no collapse spikes and watchdog remained inactive.","timestamp":1776378603006,"segment":24,"confidence":0.07620756730724663,"iterationTokens":1453,"asi":{"hypothesis":"Current window remains stable without triggering safe mode.","rollback_reason":"Primary metric above best floor.","next_action_hint":"Continue stability block to capture potential collapse transition.","stability_block":{"run_index":2,"run_count_target":10,"completion_tok_s":107.7383442875519,"dflash_eval_s":8.783283712808043,"safe_mode_activations":0,"spike_events":0,"severe_spike_events":0}}}
{"run":1846,"commit":"b5b72c1","metric":8.94104708044324,"metrics":{},"status":"discard","description":"Stability block run 3/10: drifted to softer band (~105.79 tok/s, eval_s ~8.941) but still no collapse-trigger telemetry.","timestamp":1776378637197,"segment":24,"confidence":0.07996457662640512,"iterationTokens":2023,"asi":{"hypothesis":"Observed degradation is soft drift, not watchdog-triggering collapse.","rollback_reason":"Primary metric above best floor.","next_action_hint":"Continue block; wait for hard transition sample before parity check.","stability_block":{"run_index":3,"run_count_target":10,"completion_tok_s":105.78727231248672,"dflash_eval_s":8.94104708044324,"safe_mode_activations":0,"spike_events":0,"severe_spike_events":0}}}
