{"run":57,"commit":"eaf9534","metric":21.387671385974553,"metrics":{},"status":"discard","description":"Skip clean_special_tokens() in BatchedEngine.generate for the no-thinking non-streaming path; it regressed throughput substantially, so the cleanup step is not the bottleneck.","timestamp":1775958636665,"segment":4,"confidence":2.5537714594164065,"iterationTokens":1739}
{"run":58,"commit":"3e015f7","metric":28.192386885412194,"metrics":{},"status":"keep","description":"Remove accidentally retained top_p=1.0 from the warmup request in autoresearch.sh and re-anchor the OmniCoder-9B bf16 benchmark on the intended no-thinking deterministic workload.","timestamp":1775958954427,"segment":4,"confidence":3.0180786173969185,"iterationTokens":1739,"asi":{"hypothesis":"A leftover warmup top_p override from a discarded probe is polluting the bf16 benchmark setup; removing it should restore the intended warmed-model baseline.","learning":"The warmup override was indeed stray harness state. Removing it restored throughput to ~28.2 tok/s, consistent with the prior bf16 range.","next_action_hint":"Continue bf16-only optimization in scheduler/engine hot paths; avoid quantized or alternate-target detours."}}
{"run":59,"commit":"3e015f7","metric":27.53504662563222,"metrics":{},"status":"discard","description":"Try a dedicated final-output handoff for non-streaming generate() requests to bypass collector bookkeeping; it was slightly slower than the current OmniCoder-9B bf16 baseline.","timestamp":1775959160005,"segment":4,"confidence":4.336928507505509,"iterationTokens":22391,"asi":{"hypothesis":"Skipping collector/state bookkeeping for non-streaming generate() requests may reduce Python overhead on the warmed 256-token bf16 benchmark.","rollback_reason":"Measured throughput dropped from the re-anchored ~28.2 tok/s baseline to 27.5 tok/s, so the extra direct-handoff plumbing did not help.","next_action_hint":"Focus next on scheduler finish-path work such as output object construction and cache-store/finalization overhead rather than engine-core handoff changes.","learning":"Collector bypass for non-streaming requests is not a reliable win in the current architecture; the remaining cost is likely deeper in scheduler finalization or cache handling."}}
{"run":60,"commit":"3e015f7","metric":27.588194753805258,"metrics":{},"status":"discard","description":"Diagnostic upper-bound run with paged-SSD cache disabled in the harness to test whether _cleanup_finished cache storage dominates the measured request; it did not materially improve throughput.","timestamp":1775959212911,"segment":4,"confidence":9.834309660744214,"iterationTokens":2338,"asi":{"hypothesis":"If paged-SSD cache storage/finalization is on the critical path, removing it should noticeably raise OmniCoder-9B bf16 request throughput.","rollback_reason":"Throughput stayed below the current ~28.2 tok/s baseline, so cache-store work is not the dominant bottleneck for this workload.","next_action_hint":"Restore full cache semantics and continue targeting scheduler response construction or MLX generation-path overhead instead of cache-store deferral.","learning":"_cleanup_finished runs before the scheduler step returns, but disabling paged-SSD cache did not yield a win here; the main remaining cost lies elsewhere."}}
{"run":61,"commit":"3e015f7","metric":27.509091398741532,"metrics":{},"status":"discard","description":"Try reusing request.output_token_ids directly in the scheduler’s final RequestOutput instead of copying the list; the first run looked neutral-to-slightly positive, but the confirmation run fell below baseline.","timestamp":1775959267724,"segment":4,"confidence":11.39530083806512,"iterationTokens":365,"asi":{"hypothesis":"Avoiding the final output_token_ids list copy may shave a small amount of Python overhead on the OmniCoder-9B bf16 non-streaming finish path.","rollback_reason":"The confirmation run dropped to 27.5 tok/s, so any apparent gain was within noise and not worth keeping.","next_action_hint":"Target larger remaining hot spots than one final list copy, likely around response construction or generation-step overhead.","learning":"The final token-list copy is not a meaningful bottleneck on this workload."}}
{"run":62,"commit":"3e015f7","metric":17.69520394782914,"metrics":{},"status":"discard","description":"First end-to-end DFlash benchmark for omni9b-phase2prime using the z-lab drafter through the new MLX target bridge; it executed successfully but was far slower than stock generation.","timestamp":1775962942795,"segment":4,"confidence":9.834309660744214,"iterationTokens":365,"asi":{"hypothesis":"With the z-lab DFlash loop bridged into oMLX, omni9b-phase2prime should begin showing speculative-decoding gains or at least establish a runnable baseline.","rollback_reason":"The bridged prototype only reached 17.7 tok/s versus the ~28.2 tok/s stock bf16 baseline, so the current bridge/interop overhead dominates any speculative gain.","next_action_hint":"Profile where time is being spent in the bridge path—especially MLX<->torch conversions and repeated target hidden-state materialization—and reduce or eliminate those crossings.","learning":"The DFlash path is now genuinely runnable through oMLX for omni9b-phase2prime, but the current torch-bridge prototype is too expensive to keep as a serving path."}}
{"run":63,"commit":"1bd0929","metric":26.481078214566526,"metrics":{},"status":"keep","description":"Rebuild and optimize the runnable DFlash path for omni9b-phase2prime: restore the z-lab drafter + MLX target bridge, capture only required conditioning layers, and switch bf16 MLX->torch transfers onto a fast fp16 DLPack path. This recovers the server benchmark from 17.7 to 26.5 tok/s and keeps a working native-integration baseline for further DFlash optimization.","timestamp":1775963533041,"segment":4,"confidence":11.39530083806512,"iterationTokens":34578,"asi":{"hypothesis":"Most of the bridged DFlash slowdown comes from excessive MLX<->torch conversion overhead, especially converting every hidden state and falling back to numpy for bf16 tensors.","learning":"Selective hidden-state capture plus bf16->fp16 DLPack transfers materially reduced bridge overhead and restored the runnable DFlash server path to near-baseline throughput. The remaining gap is still dominated by MLX->torch crossings, but the path is now viable enough to iterate on in-tree.","next_action_hint":"Target the remaining _mx_to_torch hot spots by reducing conversion frequency further—especially logits/hidden-state transfers per target pass—or by moving more of the acceptance loop fully into MLX.","profiling":"Direct 32-token DFlash probe improved from ~6.48 tok/s to ~10.04 tok/s after the transfer changes; full server benchmark improved to 26.48 tok/s."}}
{"run":64,"commit":"03b196d","metric":26.685131643698348,"metrics":{},"status":"keep","description":"Reduce greedy DFlash bridge overhead further by having the MLX target bridge return sampled token IDs directly, so the z-lab loop no longer converts full target logits just to run argmax on the target side.","timestamp":1775963627312,"segment":4,"confidence":13.545340644556003,"iterationTokens":5059,"asi":{"hypothesis":"On the current greedy-only omni9b-phase2prime DFlash path, crossing full target logits into torch is wasted work; returning only sampled token IDs should shave bridge overhead.","learning":"The direct DFlash probe improved slightly again and the full server benchmark moved from 26.48 to 26.69 tok/s, confirming that target-logit transfer was a real but smaller remaining cost than hidden-state transfer.","next_action_hint":"Keep attacking _mx_to_torch by reducing hidden-state materialization/casts further or moving the acceptance comparison loop into MLX.","profiling":"Direct 32-token DFlash probe improved from ~10.04 tok/s to ~10.25 tok/s after replacing target-logit transfer with sampled-token transfer."}}
{"run":65,"commit":"03b196d","metric":26.483786695687073,"metrics":{},"status":"discard","description":"Fuse selected conditioning layers on the MLX side before crossing to torch, to reduce DFlash bridge call count; the direct probe looked roughly flat and the full server benchmark regressed slightly versus the current kept DFlash baseline.","timestamp":1775963700154,"segment":4,"confidence":14.629672914003365,"iterationTokens":3683,"asi":{"hypothesis":"Combining the selected target hidden states into one fused tensor before MLX->torch transfer may reduce bridge overhead enough to improve end-to-end DFlash throughput.","rollback_reason":"Despite halving _mx_to_torch call count, the full server benchmark dropped back from 26.69 to 26.48 tok/s, so the extra fusion/cast work did not pay off.","next_action_hint":"Keep the sampled-token shortcut, revert fused-layer transfer, and target other bridge costs such as torch->MLX crossings or repeated cache/embedding conversions.","learning":"Reducing bridge call count alone is not sufficient if the fused transfer itself becomes more expensive; the best kept DFlash path remains the sampled-token shortcut without pre-fusing hidden states."}}
{"run":66,"commit":"03b196d","metric":26.5770486040412,"metrics":{},"status":"discard","description":"Make the DFlash loop device-aware so target outputs can be moved onto the drafter device cleanly; this enabled an MPS probe, but the normal CPU-backed server path was slightly slower than the current kept baseline.","timestamp":1775963836724,"segment":4,"confidence":15.90271807652823,"iterationTokens":4485,"asi":{"hypothesis":"Generalizing the DFlash loop to handle non-CPU drafter devices cleanly may unlock faster Apple Silicon backends without hurting the current CPU path.","rollback_reason":"The CPU-backed server benchmark slipped from the kept 26.69 tok/s baseline to 26.58 tok/s, and the direct MPS probe was much slower (~5 tok/s), so this refactor is not worth keeping yet.","next_action_hint":"Stay on the CPU-backed torch drafter path and continue optimizing bridge conversions inside the kept baseline rather than broadening device support.","learning":"Torch MPS is not a win for this bridged DFlash path right now, and even making the loop device-flexible adds enough overhead to lose a bit on the current CPU baseline."}}
{"run":67,"commit":"03b196d","metric":10.296441022592631,"metrics":{},"status":"discard","description":"Override the z-lab drafter to use deeper OmniCoder-biased conditioning layers by default; although a small acceptance sweep looked better, end-to-end DFlash throughput collapsed badly.","timestamp":1775964091960,"segment":4,"confidence":14.629672914003365,"iterationTokens":8838,"asi":{"hypothesis":"OmniCoder-9B may prefer deeper target hidden-state layers than the stock Qwen3.5 DFlash layer set, and improving acceptance should raise speculative throughput.","rollback_reason":"The full server benchmark collapsed to 10.3 tok/s, so the deeper conditioning choice severely hurt runtime despite looking better on a narrow acceptance-only probe.","next_action_hint":"Do not optimize on acceptance counts alone; profile any future conditioning-layer changes against end-to-end throughput immediately.","learning":"For the current bridged DFlash implementation, the stock Qwen3.5 conditioning layout performs much better end-to-end than the deeper OmniCoder-biased layer sets tested."}}
{"run":68,"commit":"03b196d","metric":26.39286293867811,"metrics":{},"status":"discard","description":"Allow the runtime to override the z-lab drafter block size from config and test block_size=8 instead of 16 for omni9b-phase2prime; it looked better in a tiny direct probe but not on the full server benchmark.","timestamp":1775964234599,"segment":4,"confidence":15.029855375987337,"iterationTokens":8150,"asi":{"hypothesis":"Because acceptance is low on the current bridged DFlash path, a smaller speculative block (8 instead of 16) may reduce wasted draft work and improve end-to-end throughput.","rollback_reason":"The full server benchmark slipped to 26.39 tok/s, so the smaller block did not beat the kept block_size=16 baseline.","next_action_hint":"Treat tiny direct probes as directional only; continue validating all promising DFlash changes against the full warmed 256-token server benchmark immediately.","learning":"On this workload, the current server path still prefers the original 16-token DFlash block despite a smaller block looking better in short direct probes."}}
{"run":69,"commit":"7f87d29","metric":26.980516351137062,"metrics":{},"status":"keep","description":"Add a hybrid DFlash path that replaces the torch z-lab drafter forward pass with the new MLX-native 5-layer drafter port while keeping the current MLX target bridge. This raises the full omni9b-phase2prime server benchmark from 26.69 to 26.98 tok/s and proves the native drafter port is viable in the real runtime.","timestamp":1775967046984,"segment":4,"confidence":15.823054109540495,"iterationTokens":27437,"asi":{"hypothesis":"Replacing the torch drafter forward pass with an MLX-native checkpoint-compatible drafter should reduce the remaining bridge overhead enough to beat the current kept DFlash baseline.","learning":"The native MLX drafter is now checkpoint-loadable, executable, and beneficial in the full server path. Even as a hybrid with the existing target bridge, it outperformed the torch-based drafter path and produced a new best DFlash result.","next_action_hint":"Keep replacing the remaining torch-side pieces around the hybrid path—especially draft-loop token bookkeeping and cache semantics—to convert this from a hybrid runtime into a fully MLX-native DFlash loop.","profiling":"Direct hybrid-native probe improved substantially after the native RoPE fix, and the full server benchmark reached 26.98 tok/s."}}
{"run":70,"commit":"7f87d29","metric":26.31047333002688,"metrics":{},"status":"discard","description":"Keep hybrid-native DFlash conditioning features and embeddings on MLX to halve bridge transfer count, but the full server benchmark regressed despite the reduced crossing count.","timestamp":1775967245115,"segment":4,"confidence":15.74418431048329,"iterationTokens":11803,"asi":{"hypothesis":"Removing the MLX->torch->MLX round-trip for native hybrid conditioning features and embeddings should lower bridge overhead enough to improve end-to-end DFlash throughput.","rollback_reason":"The full server benchmark dropped from the kept 26.98 tok/s hybrid-native baseline to 26.31 tok/s, so the changed dataflow did not pay off.","next_action_hint":"Keep the earlier hybrid-native path and look for correctness/performance wins in native draft-cache semantics or acceptance behavior rather than this particular hidden-state handoff shape.","learning":"Halving bridge transfer count is not sufficient by itself; the resulting fused/native handoff shape can still cost more in the real server path than the simpler previous hybrid-native baseline."}}
{"run":71,"commit":"7f87d29","metric":28.115145799334904,"metrics":{},"status":"discard","description":"Port the native drafter toward the public eauchs/mlx-dflash structure with packed QKV, packed gate/up, explicit draft KV cache objects, and bf16 weight loading. The full omni9b-phase2prime server benchmark stayed essentially flat/slightly worse versus the kept precision-fix hybrid-native path.","timestamp":1775968281754,"segment":4,"confidence":15.823054109540495,"iterationTokens":20276,"asi":{"hypothesis":"Adopting the public MLX-native drafter structure from eauchs/mlx-dflash should improve speculative quality or dispatch efficiency enough to beat the current hybrid-native baseline.","rollback_reason":"The full server benchmark came in slightly below the kept 28.13 tok/s baseline, and the short direct probe showed worse local generation behavior, so this exact port shape is not a net win yet.","next_action_hint":"Keep the simpler precision-fixed native drafter path, then port only the reference implementation pieces that are clearly isolated wins in our stack—especially single-sync decode structure and any target-side hidden-state / head_dim=256 fast-path patches.","learning":"The public reference architecture does not transfer 1:1 into the current oMLX hybrid runtime. Precision alignment was a real win, but the packed/bf16 drafter rewrite alone did not improve end-to-end throughput here and may require accompanying target/runtime changes to pay off.","reference_repo":"https://github.com/eauchs/mlx-dflash"}}
{"run":72,"commit":"7f87d29","metric":28.004199629274975,"metrics":{},"status":"discard","description":"Restore the native-drafter precision fix and additionally remove the draft embedding proxy round-trip by using target.embed_tokens_mx() directly in the hybrid-native loop. The full server benchmark stayed below the earlier precision-fix-only result, so the embedding handoff change is not a net win in this stack.","timestamp":1775968393302,"segment":4,"confidence":15.90271807652823,"iterationTokens":5462,"asi":{"hypothesis":"Keeping native-drafter inputs at the draft weight dtype and removing one torch<->MLX embedding round-trip should preserve the acceptance gain while shaving sync/transfer cost.","rollback_reason":"The full benchmark reached 28.00 tok/s, below the earlier 28.13 precision-fix result, so the direct embed_tokens_mx handoff did not improve end-to-end throughput.","next_action_hint":"Keep only the precision-alignment fix and benchmark it cleanly as its own experiment; continue using the public reference repo mainly for target-side hidden-state and single-sync decode ideas rather than blindly removing every bridge crossing.","learning":"In this hybrid runtime, eliminating the draft embedding proxy round-trip is not automatically beneficial. The useful signal was precision alignment into the native drafter, not this particular embedding-path rewrite.","reference_repo":"https://github.com/eauchs/mlx-dflash"}}
{"run":73,"commit":"84dbeb4","metric":28.03941304493097,"metrics":{},"status":"keep","description":"Align hybrid-native drafter inputs with the native drafter weight dtype instead of forcing fp16 downcasts. Across repeated runs this lifts the MLX-native hybrid DFlash path from the prior kept 26.98 tok/s baseline into an approximately 28.0 tok/s band on omni9b-phase2prime, effectively recovering stock-level throughput while preserving the native drafter integration path.","timestamp":1775968522914,"segment":4,"confidence":15.048601909672602,"iterationTokens":444,"asi":{"hypothesis":"The native MLX drafter was loaded in float32, so forcing target_hidden and noise embeddings to fp16 before the draft forward was hurting speculative quality and acceptance; matching the draft input dtype to the model weights should improve end-to-end throughput.","learning":"Precision alignment into the native drafter is a real win. The effect is modest but repeatable: the hybrid-native DFlash path now runs around 28.0 tok/s instead of 26.98 tok/s, while extra embedding-path handoff changes were not beneficial.","next_action_hint":"Keep this precision-aligned hybrid-native path and focus next on target-side ideas from the public MLX reference: head_dim=256 fast-path verification, hidden-state extraction/patching strategy, and single-sync decode structure.","reruns":"Observed 28.09, 27.84, and 28.04 tok/s on confirmation runs after the fix; treat this as a stable ~28.0 tok/s band rather than a single-sample spike.","reference_repo":"https://github.com/eauchs/mlx-dflash"}}
{"run":74,"commit":"84dbeb4","metric":15.710501243469794,"metrics":{},"status":"discard","description":"Override native-hybrid DFlash conditioning layers to an OmniCoder-tuned evenly spaced set (1,7,13,19,25). Although the direct native probe looked much better, the full omni9b-phase2prime server benchmark collapsed badly.","timestamp":1775973474723,"segment":4,"confidence":14.250248146143182,"iterationTokens":48377,"asi":{"hypothesis":"Retargeting the native drafter conditioning to OmniCoder-local hidden-state layers should improve acceptance enough to unlock the native path on omni9b-phase2prime.","rollback_reason":"The full server benchmark dropped from the kept ~28.0 tok/s DFlash baseline to 15.71 tok/s, so this layer override is not viable despite promising microprobe acceptance.","next_action_hint":"Do not trust native-path acceptance microprobes alone. Keep the official layer set in the shipped path and continue structural debugging around target-side native integration or reference-target validation.","learning":"A layer set that improves the narrow native probe can still catastrophically hurt the real server workload on omni9b-phase2prime."}}
