{"run":2070,"commit":"7f0ef90","metric":15.47370612132363,"metrics":{},"status":"discard","description":"Still in collapse trough (~55.05 tok/s, eval_s ~15.47) with safe mode at step 55.","timestamp":1776393846684,"segment":24,"confidence":0.03970465054155036,"iterationTokens":1870,"asi":{"hypothesis":"No structural recovery yet; collapse wave remains active.","rollback_reason":"Primary metric above best floor.","next_action_hint":"Continue unchanged mirror loop for rebound onset.","diagnostic_findings":{"completion_tok_s":55.04954162052241,"dflash_eval_s":15.47370612132363,"safe_mode_step":55,"severe_spike_events":14}}}
{"run":2071,"commit":"7f0ef90","metric":16.28066862502601,"metrics":{},"status":"discard","description":"Collapse deepened again (~51.37 tok/s, eval_s ~16.28) with safe mode at step 41.","timestamp":1776393888863,"segment":24,"confidence":0.03950590048768291,"iterationTokens":1385,"asi":{"hypothesis":"The trough phase is persisting with no sustained rebound.","rollback_reason":"Primary metric above best floor.","next_action_hint":"Continue unchanged loop; parity already confirmed shared behavior this cycle.","diagnostic_findings":{"completion_tok_s":51.373998596026425,"dflash_eval_s":16.28066862502601,"safe_mode_step":41,"severe_spike_events":13}}}
{"run":2072,"commit":"7f0ef90","metric":16.217792378389277,"metrics":{},"status":"discard","description":"Collapse trough remained (~51.90 tok/s, eval_s ~16.22) with safe mode at step 47.","timestamp":1776393932919,"segment":24,"confidence":0.03931624759281352,"iterationTokens":1404,"asi":{"hypothesis":"Cycle remains in sustained severe trough with little directional change.","rollback_reason":"Primary metric above best floor.","next_action_hint":"Continue unchanged loop for eventual rebound signal.","diagnostic_findings":{"completion_tok_s":51.898842128003785,"dflash_eval_s":16.217792378389277,"safe_mode_step":47,"severe_spike_events":16}}}
{"run":2073,"commit":"7f0ef90","metric":16.71844237379264,"metrics":{},"status":"discard","description":"Severe trough persisted (~48.15 tok/s, eval_s ~16.72) with very early safe-mode trigger at step 7.","timestamp":1776394013623,"segment":24,"confidence":0.038910915240089154,"iterationTokens":11590,"asi":{"hypothesis":"Collapse phase intensified again with early-step interventions.","rollback_reason":"Primary metric above best floor.","next_action_hint":"Continue unchanged loop; parity already established for this transition.","diagnostic_findings":{"completion_tok_s":48.14850522537322,"dflash_eval_s":16.71844237379264,"safe_mode_step":7,"severe_spike_events":7}}}
{"run":2074,"commit":"7f0ef90","metric":10.932762794196606,"metrics":{},"status":"discard","description":"Strong rebound (~84.06 tok/s, eval_s ~10.93) with very late safe-mode activation (step 85).","timestamp":1776394044949,"segment":24,"confidence":0.0385382433672346,"iterationTokens":1436,"asi":{"hypothesis":"Collapse wave transitioned back toward recovery with intervention pushed to tail.","rollback_reason":"Primary metric above best floor.","next_action_hint":"Continue unchanged loop for watchdog-idle and sub-10 re-entry.","diagnostic_findings":{"completion_tok_s":84.05987353280035,"dflash_eval_s":10.932762794196606,"safe_mode_step":85,"severe_spike_events":2}}}
{"run":2075,"commit":"7f0ef90","metric":14.362489912193269,"metrics":{},"status":"discard","description":"Recovery relapsed quickly (~56.09 tok/s, eval_s ~14.36) with early safe mode at step 9.","timestamp":1776394082436,"segment":24,"confidence":0.03827440140541756,"iterationTokens":1448,"asi":{"hypothesis":"Current regime is still oscillatory and can snap back to early-trigger collapse.","rollback_reason":"Primary metric above best floor.","next_action_hint":"Continue unchanged loop to map relapse/rebound cadence.","diagnostic_findings":{"completion_tok_s":56.089778592271905,"dflash_eval_s":14.362489912193269,"safe_mode_step":9,"severe_spike_events":3}}}
{"run":2076,"commit":"7f0ef90","metric":11.440419127349742,"metrics":{},"status":"discard","description":"Rebound returned (~79.02 tok/s, eval_s ~11.44) with late safe mode at step 80.","timestamp":1776394113377,"segment":24,"confidence":0.03816842928449861,"iterationTokens":1426,"asi":{"hypothesis":"Collapse wave is easing again with intervention pushed late in decode.","rollback_reason":"Primary metric above best floor.","next_action_hint":"Continue unchanged loop for watchdog-idle transition and sub-10 retest.","diagnostic_findings":{"completion_tok_s":79.01891382156613,"dflash_eval_s":11.440419127349742,"safe_mode_step":80,"severe_spike_events":2}}}
{"run":2077,"commit":"7f0ef90","metric":13.700602121884003,"metrics":{},"status":"discard","description":"Partial rebound (~63.21 tok/s, eval_s ~13.70) with safe mode late at step 63.","timestamp":1776394147869,"segment":24,"confidence":0.03802784451797337,"iterationTokens":1430,"asi":{"hypothesis":"Cycle is improving again but remains in collapse-managed regime.","rollback_reason":"Primary metric above best floor.","next_action_hint":"Continue unchanged loop.","diagnostic_findings":{"completion_tok_s":63.213725946919425,"dflash_eval_s":13.700602121884003,"safe_mode_step":63,"severe_spike_events":5}}}
{"run":2078,"commit":"7f0ef90","metric":14.825528539484367,"metrics":{},"status":"discard","description":"Recovery remained mid-collapse (~57.68 tok/s, eval_s ~14.83) with safe mode step 56.","timestamp":1776394185652,"segment":24,"confidence":0.03788829157526655,"iterationTokens":1401,"asi":{"hypothesis":"Wave is still oscillating in a degraded safe-mode-on band.","rollback_reason":"Primary metric above best floor.","next_action_hint":"Continue unchanged loop for eventual watchdog-idle return.","diagnostic_findings":{"completion_tok_s":57.682563439229654,"dflash_eval_s":14.825528539484367,"safe_mode_step":56,"severe_spike_events":11}}}
{"run":2079,"commit":"7f0ef90","metric":16.223529499955475,"metrics":{},"status":"discard","description":"Relapse back to severe trough (~51.87 tok/s, eval_s ~16.22) with safe mode at step 48.","timestamp":1776394224923,"segment":24,"confidence":0.03702805146520144,"iterationTokens":1422,"asi":{"hypothesis":"Current cycle still alternates between partial rebounds and severe relapses.","rollback_reason":"Primary metric above best floor.","next_action_hint":"Continue unchanged loop.","diagnostic_findings":{"completion_tok_s":51.86828163841816,"dflash_eval_s":16.223529499955475,"safe_mode_step":48,"severe_spike_events":22}}}
{"run":2080,"commit":"7f0ef90","metric":17.05405342206359,"metrics":{},"status":"discard","description":"Trough deepened (~48.98 tok/s, eval_s ~17.05) with safe mode active at step 40.","timestamp":1776394264647,"segment":24,"confidence":0.036082543641505614,"iterationTokens":1406,"asi":{"hypothesis":"Wave is still in severe collapse pocket rather than sustained rebound.","rollback_reason":"Primary metric above best floor.","next_action_hint":"Continue unchanged loop; no new parity needed.","diagnostic_findings":{"completion_tok_s":48.98062980528887,"dflash_eval_s":17.05405342206359,"safe_mode_step":40,"severe_spike_events":32}}}
{"run":2081,"commit":"7f0ef90","metric":17.124848379171453,"metrics":{},"status":"discard","description":"Deep trough persisted (~48.85 tok/s, eval_s ~17.12) with safe mode step 42.","timestamp":1776394306595,"segment":24,"confidence":0.035911221856608846,"iterationTokens":1427,"asi":{"hypothesis":"Regime remains locked in severe collapse state.","rollback_reason":"Primary metric above best floor.","next_action_hint":"Continue unchanged loop for rebound onset.","diagnostic_findings":{"completion_tok_s":48.854963288747086,"dflash_eval_s":17.124848379171453,"safe_mode_step":42,"severe_spike_events":26}}}
{"run":2082,"commit":"7f0ef90","metric":15.997581213829108,"metrics":{},"status":"discard","description":"Collapse remained severe (~53.17 tok/s, eval_s ~16.00) with safe mode at step 55.","timestamp":1776394355654,"segment":24,"confidence":0.03574151927306537,"iterationTokens":1395,"asi":{"hypothesis":"Current transition has not exited the safe-mode collapse regime.","rollback_reason":"Primary metric above best floor.","next_action_hint":"Continue unchanged loop and wait for clear rebound ladder.","diagnostic_findings":{"completion_tok_s":53.17141184538138,"dflash_eval_s":15.997581213829108,"safe_mode_step":55,"severe_spike_events":28}}}
{"run":2083,"commit":"7f0ef90","metric":18.06097062677145,"metrics":{},"status":"discard","description":"Wave fell into an even deeper trough (~44.45 tok/s, eval_s ~18.06) with immediate safe-mode trigger at step 6.","timestamp":1776394418409,"segment":24,"confidence":0.03561633906269257,"iterationTokens":3705,"asi":{"hypothesis":"Current collapse cycle still has unresolved severe early-spike behavior.","rollback_reason":"Primary metric far above best floor.","next_action_hint":"Continue unchanged mirror loop; only parity again on a distinctly new transition edge.","diagnostic_findings":{"completion_tok_s":44.44705053080073,"dflash_eval_s":18.06097062677145,"safe_mode_step":6,"severe_spike_events":8}}}
{"run":2084,"commit":"7f0ef90","metric":8.824705162434839,"metrics":{},"status":"discard","description":"Major rebound to high-soft band (~106.84 tok/s, eval_s ~8.82) with watchdog fully idle and no spike events.","timestamp":1776394617710,"segment":24,"confidence":0.03574151927306537,"iterationTokens":3705,"asi":{"hypothesis":"Collapse wave likely handed off into rebound/high-soft regime without safe-mode intervention.","rollback_reason":"Primary metric still above current best floor.","next_action_hint":"Continue unchanged loop to confirm whether this is sustained high-window re-entry.","diagnostic_findings":{"completion_tok_s":106.83878422631443,"dflash_eval_s":8.824705162434839,"safe_mode_active":0,"spike_events":0}}}
{"run":2085,"commit":"7f0ef90","metric":8.812051915330812,"metrics":{},"status":"discard","description":"Follow-up confirmed high-soft re-entry (~106.68 tok/s, eval_s ~8.81) with watchdog idle.","timestamp":1776394644677,"segment":24,"confidence":0.03582348596597443,"iterationTokens":1588,"asi":{"hypothesis":"System has exited severe trough and is back in stable non-collapse band.","rollback_reason":"Primary metric remains slightly above best floor.","next_action_hint":"Continue unchanged loop for sub-8.79 retest and stability evidence.","diagnostic_findings":{"completion_tok_s":106.68454466253083,"dflash_eval_s":8.812051915330812,"safe_mode_active":0,"spike_events":0}}}
{"run":2086,"commit":"a0f1200","metric":8.77611666615121,"metrics":{},"status":"keep","description":"Unchanged mirror loop reached a new local best in reopened high window (~107.44 tok/s, eval_s ~8.776) with watchdog idle and no collapse events.","timestamp":1776394687593,"segment":24,"confidence":0.035905829474533725,"iterationTokens":1447,"asi":{"hypothesis":"Severe trough fully rebounded into high-window execution with stable acceptance and no safe-mode activity.","diagnostic_findings":{"completion_tok_s":107.44414161914466,"dflash_eval_s":8.77611666615121,"safe_mode_active":0,"spike_events":0,"acceptance_rate":0.6972201352366642},"next_action_hint":"Continue unchanged loop to confirm whether sub-8.79 holds across immediate follow-ups."}}
{"run":2087,"commit":"a0f1200","metric":8.892469753162004,"metrics":{},"status":"discard","description":"Immediate confirmation was slower (~106.52 tok/s, eval_s ~8.89) despite watchdog-idle high-soft telemetry.","timestamp":1776394714811,"segment":24,"confidence":0.03687043133056235,"iterationTokens":2404,"asi":{"hypothesis":"New local best at #2086 likely sits within normal high-window noise.","rollback_reason":"Primary metric regressed versus current best floor.","next_action_hint":"Continue unchanged loop; require repeated sub-8.79 samples before treating improvement as durable.","diagnostic_findings":{"completion_tok_s":106.51809057422477,"dflash_eval_s":8.892469753162004,"safe_mode_active":0,"spike_events":0}}}
{"run":2088,"commit":"a0f1200","metric":16.2684347582981,"metrics":{},"status":"discard","description":"Fresh hard relapse after high-soft re-entry (~49.64 tok/s, eval_s ~16.27) with early safe-mode activation at step 8.","timestamp":1776394756326,"segment":24,"confidence":0.035905829474533725,"iterationTokens":1667,"asi":{"hypothesis":"A new spike-collapse transition started immediately after rebound.","rollback_reason":"Primary metric far above best floor.","next_action_hint":"Run a single immediate control parity check on this new transition edge, then return to mirror loop.","diagnostic_findings":{"completion_tok_s":49.64257407263005,"dflash_eval_s":16.2684347582981,"safe_mode_step":8,"severe_spike_events":5}}}
{"run":2089,"commit":"a0f1200","metric":14.653050922672264,"metrics":{},"status":"discard","description":"Immediate control parity check on fresh relapse stayed deeply degraded (~55.25 tok/s, eval_s ~14.65), confirming shared collapse attribution.","timestamp":1776394791665,"segment":24,"confidence":0.03576294748092098,"iterationTokens":1742,"asi":{"hypothesis":"New collapse transition is shared across mirror/control, not mirror-only.","rollback_reason":"Parity control run is diagnostic and remains above best floor.","next_action_hint":"Return to unchanged mirror telemetry loop and track rebound ladder.","diagnostic_findings":{"lane":"control","completion_tok_s":55.24949840206353,"dflash_eval_s":14.653050922672264,"safe_mode_step":67,"severe_spike_events":13}}}
{"run":2090,"commit":"a0f1200","metric":10.953936877893284,"metrics":{},"status":"discard","description":"Post-parity mirror run rebounded to watchdog-idle inflation band (~87.45 tok/s, eval_s ~10.95).","timestamp":1776394821000,"segment":24,"confidence":0.03568834675040495,"iterationTokens":1493,"asi":{"hypothesis":"Fresh collapse has transitioned from spike-safe-mode trough into non-spike recovery inflation.","rollback_reason":"Primary metric still above best floor.","next_action_hint":"Continue unchanged mirror loop to watch for sub-10 and high-soft re-entry.","diagnostic_findings":{"completion_tok_s":87.44962146061407,"dflash_eval_s":10.953936877893284,"safe_mode_active":0,"spike_events":0}}}
{"run":2091,"commit":"a0f1200","metric":11.896322959917597,"metrics":{},"status":"discard","description":"Recovery remained degraded (~77.80 tok/s, eval_s ~11.90) with late safe-mode activation at step 86.","timestamp":1776394849465,"segment":24,"confidence":0.035589918984006715,"iterationTokens":1452,"asi":{"hypothesis":"This rebound still mixes non-spike inflation with tail-end spike handling.","rollback_reason":"Primary metric above best floor.","next_action_hint":"Continue unchanged loop for sub-10 recovery confirmation.","diagnostic_findings":{"completion_tok_s":77.80067174985058,"dflash_eval_s":11.896322959917597,"safe_mode_step":86,"severe_spike_events":3}}}
{"run":2092,"commit":"a0f1200","metric":14.085841666674241,"metrics":{},"status":"discard","description":"Recovery relapsed into severe band (~61.14 tok/s, eval_s ~14.09) with safe mode at step 62.","timestamp":1776394880499,"segment":24,"confidence":0.03549203264808546,"iterationTokens":1441,"asi":{"hypothesis":"Current transition remains oscillatory and not yet in stable rebound mode.","rollback_reason":"Primary metric above best floor.","next_action_hint":"Continue unchanged loop; parity already captured for this transition edge.","diagnostic_findings":{"completion_tok_s":61.13597476988619,"dflash_eval_s":14.085841666674241,"safe_mode_step":62,"severe_spike_events":9}}}
{"run":2093,"commit":"a0f1200","metric":14.162635041051544,"metrics":{},"status":"discard","description":"Severe band persisted (~60.52 tok/s, eval_s ~14.16) with safe mode at step 51.","timestamp":1776394911341,"segment":24,"confidence":0.03489777707864438,"iterationTokens":1445,"asi":{"hypothesis":"Rebound attempt failed and remains in collapse-managed oscillation.","rollback_reason":"Primary metric above best floor.","next_action_hint":"Continue unchanged loop for next rebound ladder.","diagnostic_findings":{"completion_tok_s":60.5194267425266,"dflash_eval_s":14.162635041051544,"safe_mode_step":51,"severe_spike_events":2}}}
{"run":2094,"commit":"a0f1200","metric":11.580362380947918,"metrics":{},"status":"discard","description":"Partial rebound returned (~80.00 tok/s, eval_s ~11.58) with very late safe-mode trigger at step 87.","timestamp":1776394946698,"segment":24,"confidence":0.03437227278613072,"iterationTokens":1428,"asi":{"hypothesis":"Cycle is recovering again but still not in watchdog-idle high-soft band.","rollback_reason":"Primary metric above best floor.","next_action_hint":"Continue unchanged loop and watch for transition to safe-mode-off sub-10 samples.","diagnostic_findings":{"completion_tok_s":79.9990619862483,"dflash_eval_s":11.580362380947918,"safe_mode_step":87,"severe_spike_events":4}}}
{"run":2095,"commit":"a0f1200","metric":16.06446183216758,"metrics":{},"status":"discard","description":"Fresh early-trigger collapse recurred (~50.51 tok/s, eval_s ~16.06) with safe mode at step 8.","timestamp":1776395016077,"segment":24,"confidence":0.03430472053934162,"iterationTokens":5506,"asi":{"hypothesis":"Current wave remains volatile and can re-enter severe trough rapidly.","rollback_reason":"Primary metric above best floor.","next_action_hint":"Continue unchanged mirror loop; parity already established for this transition family.","diagnostic_findings":{"completion_tok_s":50.50910468598935,"dflash_eval_s":16.06446183216758,"safe_mode_step":8,"severe_spike_events":5}}}
{"run":2096,"commit":"a0f1200","metric":12.562950002262369,"metrics":{},"status":"discard","description":"Watchdog-idle run stayed in non-spike inflation (~76.86 tok/s, eval_s ~12.56) without re-entering high-soft.","timestamp":1776395084555,"segment":24,"confidence":0.03423743329424993,"iterationTokens":7778,"asi":{"hypothesis":"Current wave can remain degraded even with zero collapse spikes and safe mode off.","rollback_reason":"Primary metric above best floor.","next_action_hint":"Continue unchanged loop to map inflation-to-collapse transitions.","diagnostic_findings":{"completion_tok_s":76.86476841408442,"dflash_eval_s":12.562950002262369,"safe_mode_active":0,"spike_events":0}}}
{"run":2097,"commit":"a0f1200","metric":11.828839415335096,"metrics":{},"status":"discard","description":"Non-spike inflation improved modestly (~81.27 tok/s, eval_s ~11.83) but stayed far from high-soft floor.","timestamp":1776395111114,"segment":24,"confidence":0.034233283944914476,"iterationTokens":1454,"asi":{"hypothesis":"Recovery can proceed with watchdog idle before any spike-safe-mode relapse.","rollback_reason":"Primary metric above best floor.","next_action_hint":"Continue unchanged loop to track whether recovery reaches sub-10.","diagnostic_findings":{"completion_tok_s":81.27070020467707,"dflash_eval_s":11.828839415335096,"safe_mode_active":0,"spike_events":0}}}
{"run":2098,"commit":"a0f1200","metric":12.539471458410844,"metrics":{},"status":"discard","description":"Plateau held in watchdog-idle inflation (~76.90 tok/s, eval_s ~12.54) with stable acceptance.","timestamp":1776395139578,"segment":24,"confidence":0.03418036473707521,"iterationTokens":1435,"asi":{"hypothesis":"Current phase is a non-spike inflation shelf rather than immediate spike collapse.","rollback_reason":"Primary metric above best floor.","next_action_hint":"Continue unchanged loop and watch for either sub-10 recovery or fresh spike transition.","diagnostic_findings":{"completion_tok_s":76.89935468518387,"dflash_eval_s":12.539471458410844,"safe_mode_active":0,"spike_events":0}}}
{"run":2099,"commit":"a0f1200","metric":12.338563908007927,"metrics":{},"status":"discard","description":"Slight improvement inside the same watchdog-idle inflation band (~77.92 tok/s, eval_s ~12.34).","timestamp":1776395167131,"segment":24,"confidence":0.03408050765085841,"iterationTokens":1435,"asi":{"hypothesis":"System remains in shared non-spike inflation mode with stable speculative quality.","rollback_reason":"Primary metric above best floor.","next_action_hint":"Continue unchanged loop for regime transition edge.","diagnostic_findings":{"completion_tok_s":77.91877629984641,"dflash_eval_s":12.338563908007927,"safe_mode_active":0,"spike_events":0}}}
{"run":2100,"commit":"a0f1200","metric":11.706474751234055,"metrics":{},"status":"discard","description":"Inflation shelf improved again (~82.37 tok/s, eval_s ~11.71) with watchdog still fully idle.","timestamp":1776395194466,"segment":24,"confidence":0.03394631937793237,"iterationTokens":1418,"asi":{"hypothesis":"Recovery remains non-spike and gradual but still well above floor.","rollback_reason":"Primary metric above best floor.","next_action_hint":"Continue unchanged loop; wait for sub-10 re-entry before considering probes.","diagnostic_findings":{"completion_tok_s":82.36866513643153,"dflash_eval_s":11.706474751234055,"safe_mode_active":0,"spike_events":0}}}
{"run":2101,"commit":"a0f1200","metric":12.037267287727445,"metrics":{},"status":"discard","description":"Recovered sample stayed in mid-inflation (~80.09 tok/s, eval_s ~12.04), watchdog idle.","timestamp":1776395221053,"segment":24,"confidence":0.033695154788496745,"iterationTokens":1432,"asi":{"hypothesis":"Recovery remains bounded in 11.7–12.6 eval_s shelf absent spike triggers.","rollback_reason":"Primary metric above best floor.","next_action_hint":"Continue unchanged loop to detect next regime break.","diagnostic_findings":{"completion_tok_s":80.09066565598322,"dflash_eval_s":12.037267287727445,"safe_mode_active":0,"spike_events":0}}}
