{"run":115,"commit":"e7b14c4","metric":27.71948357147184,"metrics":{},"status":"discard","description":"Reapply the corrected native target loop, but avoid rescanning the nested Qwen3.5 target cache each decode step by tracking target cache length directly in the loop. This regressed the full benchmark and significantly worsened warmup.","timestamp":1776015282714,"segment":4,"confidence":52.044990291280826,"iterationTokens":15509,"asi":{"hypothesis":"Once the native target-loop semantics are corrected, one of the remaining native-only costs is Python cache-length scanning on every decode step; tracking current target length directly could recover enough overhead to beat the hybrid path.","rollback_reason":"The primary metric regressed and warmup became much slower, so this tracked-cache-length variant is not correct or not beneficial in the current native loop.","next_action_hint":"Keep the corrected semantic findings, but do not replace cache-length scanning with this simplistic tracked-length logic; continue debugging later-step native-loop behavior with correctness-first traces.","learning":"The native target loop is sensitive to target-cache bookkeeping details beyond just end-of-step trim semantics; a naive tracked-length replacement can degrade both warmup and steady-state throughput.","native_loop_learning":"The corrected native-target reconstruction still needs exact target-cache accounting. Matching the hybrid path across many steps is possible, but shortcutting cache-length bookkeeping this way is not safe."}}
{"run":116,"commit":"e7b14c4","metric":27.88244523389187,"metrics":{},"status":"discard","description":"Restore the corrected MLX-native target-loop path behind DFLASH_NATIVE_TARGET_LOOP=1 using the long-step trace-matching Qwen3.5/Omni semantics: start at the sampled first token, exact draft-cache crop at current start, and trim the target cache after acceptance plus bonus token. In the integrated server runtime this still stays below the kept cached-mask hybrid baseline.","timestamp":1776016093152,"segment":4,"confidence":54.96367604352355,"iterationTokens":15509,"asi":{"hypothesis":"The main remaining native-loop loss was due to reverted runtime wiring rather than fundamental native-path cost; restoring the exact semantics proven by the long hybrid-vs-native trace should recover the real server path.","rollback_reason":"The integrated native target-loop path still benchmarked below the kept hybrid baseline, so it is not yet ready to replace or augment the default DFlash runtime.","next_action_hint":"Compare the integrated native loop against the standalone long-step trace harness for hidden-state patching, stop handling, and output assembly differences; then probe correctness/parity directly on full decoded continuations before chasing more speed tweaks.","learning":"Long-step trace parity with the hybrid path is necessary but not sufficient for a server-path win. There is still some integrated-runtime difference or residual native-path cost keeping this version under the kept hybrid baseline.","native_loop_learning":"Restoring the trace-matching semantics yields a high-27 tok/s native path, but not a win over e7b14c4. The next leverage is in reconciling integrated runtime behavior with the standalone trace harness, not in more cache-length micro-optimizations."}}
{"run":117,"commit":"e7b14c4","metric":27.649280700830595,"metrics":{},"status":"discard","description":"Add an explicit post-load Qwen3.5 hidden-states patch so the MLX-native target loop owns per-layer hidden-state capture instead of relying on ad hoc tracing behavior, then rerun the native target-loop path behind DFLASH_NATIVE_TARGET_LOOP=1. This did not improve the integrated server benchmark.","timestamp":1776016254804,"segment":4,"confidence":55.00943972416865,"iterationTokens":8580,"asi":{"hypothesis":"Part of the remaining native-loop gap was that the standalone trace harness had explicit Qwen3.5 hidden-state capture while the integrated runtime did not own that behavior cleanly; making hidden-state capture a first-class post-load patch might align runtime semantics and recover throughput.","rollback_reason":"The native target-loop benchmark still regressed relative to the kept hybrid baseline, so this patch alone is not the missing ingredient for a server-path win.","next_action_hint":"Keep using explicit hidden-state capture as a debugging/control mechanism when tracing native-loop correctness, but focus the next experiment on end-to-end continuation parity and acceptance behavior versus the kept hybrid path rather than assuming hidden-state capture wiring is the main bottleneck.","learning":"Owning Qwen3.5 hidden-state capture explicitly is useful for native-loop debugging, but it does not by itself eliminate the native server-path gap. The remaining loss is elsewhere in runtime behavior or in native-path cost, not just in hidden-state patching.","hidden_state_patch_learning":"The live mlx-lm Qwen3_5TextModel does not retain per-layer hidden states by default. Adding that capability is viable, but it is a correctness/debugging aid rather than an immediate throughput win."}}
{"run":118,"commit":"e7b14c4","metric":27.894742640249717,"metrics":{},"status":"discard","description":"Add an opt-in correctness-first hybrid variant that rebuilds the target cache from the accepted prefix before every verify step instead of relying on replay+trim rollback. This confirms the target-cache rollback issue is real, but the end-to-end benchmark still does not beat the kept baseline.","timestamp":1776016676878,"segment":4,"confidence":55.38415504685756,"iterationTokens":20510,"asi":{"hypothesis":"The main parity bug on omni9b-phase2prime is that replaying a speculative block and trimming the target cache is not equivalent to a fresh sequential cache on the accepted prefix; rebuilding the target cache before each verify should restore correctness and may improve acceptance enough to offset the extra work.","rollback_reason":"Even though this path targets a real correctness issue, it still benchmarked below the kept baseline on the primary metric, so it is not ready to keep as the serving path.","next_action_hint":"Measure continuation parity and acceptance on this rebuild-cache path directly, then look for a cheaper way to reconstruct the correct target state than full-prefix replay each step.","learning":"For omni9b-phase2prime, fresh sequential target cache state and replay+trim cache state diverge after the first speculative block. Rebuilding the target cache each verify step is a viable correctness control and does not completely destroy throughput, which makes target-state reconstruction the most promising structural direction.","rollback_cache_learning":"The wrong token after the first divergence comes from the target verifier itself, not from accepting a bad draft token. Fresh cache predicts the stock next token while replay+trim predicts the wrong one."}}
{"run":119,"commit":"e7b14c4","metric":27.649115958744332,"metrics":{},"status":"discard","description":"Add an opt-in hybrid variant that rebuilds the target cache only on rejection steps, using replay+trim only when a block fully accepts. This targets the observed OmniCoder/Qwen3.5 rollback bug more selectively than rebuilding every verify, but it still does not beat the kept baseline on the full server benchmark.","timestamp":1776016859988,"segment":4,"confidence":55.376129181748134,"iterationTokens":8473,"asi":{"hypothesis":"If the target-state mismatch only matters on partial-accept/rejection steps, then rebuilding the target cache selectively on rejection should preserve correctness while avoiding most of the cost of rebuilding every verify.","rollback_reason":"The selective rebuild-on-rejection path still benchmarked below the kept hybrid baseline, so it is not a throughput win yet.","next_action_hint":"Use the selective rebuild path as a correctness probe: measure acceptance and continuation parity directly, then search for a cheaper way to reconstruct only the broken target-cache components rather than replaying the whole prefix.","learning":"The target-cache rollback bug is not limited to a one-off corner case; even a selective correctness-preserving workaround did not recover enough throughput to win. The next structural opportunity is partial target-state reconstruction, not more bridge micro-optimizations.","rollback_cache_learning":"Fresh cache reconstruction on the accepted prefix is the right correctness control, but replaying the entire accepted prefix—even only on rejection steps—still costs too much to become the winning serving path."}}
{"run":120,"commit":"e7b14c4","metric":27.93993866546805,"metrics":{},"status":"discard","description":"Add an opt-in hybrid variant that snapshots the pre-verify MLX target cache, then on partial acceptance restores that snapshot and replays only the accepted span instead of replaying the whole prefix or relying on replay+trim rollback. This preserves the structural correctness fix more cheaply, but still does not beat the kept baseline on the full server benchmark.","timestamp":1776017094872,"segment":4,"confidence":55.70074028391627,"iterationTokens":14853,"asi":{"hypothesis":"The real rollback bug is in partial-token trim of the Qwen3.5/Omni linear ArraysCache layers; restoring the pre-verify cache and replaying only the accepted span should reconstruct the correct target state much more cheaply than rebuilding the entire accepted prefix.","rollback_reason":"Even with the cheaper accepted-span replay reconstruction, the primary throughput metric remained below the kept hybrid baseline, so this variant is not yet a win.","next_action_hint":"Use accepted-span replay as the main correctness control for rollback semantics, then target the real bottleneck directly: make linear-layer cache rollback exact without replay, or identify a smaller subset of target state that must be reconstructed.","learning":"The wrong post-rejection target state is indeed localized enough that replaying only the accepted span from a pre-verify cache snapshot restores correctness in standalone traces. That is a stronger structural result than full-prefix rebuild, but it still needs a cheaper implementation path to become a throughput win.","rollback_cache_learning":"The dominant rollback mismatch appears to live in the Qwen3.5/Omni linear ArraysCache layers. Pre-verify snapshot + accepted-span replay is a valid correctness strategy and outperforms full-prefix rebuild conceptually, but not yet enough in the real server path."}}
{"run":121,"commit":"e7b14c4","metric":28.16672858757108,"metrics":{},"status":"discard","description":"Refine the accepted-span replay rollback fix by skipping hidden-state capture on the full verify pass when we will discard that verify state anyway, and only collect conditioning hidden states from the accepted-span replay. This is the closest rollback-correct variant so far, but it still stays below the kept baseline.","timestamp":1776017195410,"segment":4,"confidence":55.62801734521104,"iterationTokens":4012,"asi":{"hypothesis":"Accepted-span replay is the right rollback correction, and some of its remaining cost is wasted verify-side hidden-state capture on partial-accept steps; dropping that unused work should recover throughput while preserving correctness.","rollback_reason":"This improved on the earlier rollback-correct variants but still did not beat the kept e7b14c4 baseline on the primary metric.","next_action_hint":"Continue optimizing the accepted-span replay path: target cache snapshot cost, unnecessary tensor cloning, and only replaying the minimal state needed for the linear ArraysCache layers look like the best remaining structural opportunities.","learning":"Skipping verify hidden-state capture on replayed partial-accept steps helps; this is the best rollback-correct server-path variant so far at ~28.17 tok/s. The rollback fix is getting close enough that the remaining gap may be in the snapshot/replay implementation overhead rather than in the core idea.","rollback_cache_learning":"Pre-verify snapshot + accepted-span replay remains the strongest correctness-preserving rollback strategy discovered so far. It is now near stock-parity speed, which makes further optimization of that path more promising than the older full-prefix rebuild workaround."}}
{"run":122,"commit":"e7b14c4","metric":28.04228010991492,"metrics":{},"status":"discard","description":"Add an opt-in rollback-correct hybrid variant that snapshots only the linear ArraysCache layers before verify, recovers pre-verify attention state by trimming the post-verify attention caches back to the step start, and then replays the accepted span. This preserves parity in standalone traces but still does not beat the kept baseline in the full server benchmark.","timestamp":1776017465379,"segment":4,"confidence":55.55548405317739,"iterationTokens":11593,"asi":{"hypothesis":"Since the main rollback mismatch is concentrated in the linear ArraysCache layers, we can reduce accepted-span replay overhead by snapshotting only linear caches and reconstructing attention state from exact post-verify trims.","rollback_reason":"Even though the mixed rollback reconstruction preserves parity in standalone traces, it still stayed below the kept hybrid baseline on the primary metric.","next_action_hint":"Keep accepted-span replay as the rollback correctness control, but continue trimming its implementation cost elsewhere; the linear-only snapshot variant did not outperform the fuller replay variant in the real server path.","learning":"The rollback bug really is concentrated in the linear ArraysCache layers, but reducing the up-front snapshot scope alone was not enough to produce a server-path win. Some of the remaining cost is still elsewhere in the accepted-span replay machinery.","rollback_cache_learning":"Linear-snapshot plus trimmed-attention reconstruction is sufficient for parity in traces, which strengthens the diagnosis. However, the best real benchmark so far still comes from the fuller accepted-span replay path with skipped wasted verify hidden-state capture."}}
{"run":123,"commit":"e7b14c4","metric":28.130854441086708,"metrics":{},"status":"discard","description":"Tighten the accepted-span replay rollback fix by reusing the pre-verify cloned MLX cache directly during restore instead of cloning it again before replay. This keeps the rollback-correct path near parity but does not improve on the earlier best variant.","timestamp":1776017547210,"segment":4,"confidence":55.8762962037114,"iterationTokens":3317,"asi":{"hypothesis":"The accepted-span replay path still spends avoidable time cloning the same MLX cache twice; reusing the first clone directly during restore should shave enough overhead to improve the rollback-correct server path.","rollback_reason":"The single-clone accepted-span replay path still stayed below the kept baseline and even below the earlier best rollback-correct variant, so this simplification is not a win.","next_action_hint":"Return to the earlier best rollback-correct variant as the control. The next likely savings are not from the second clone alone; focus on where replay-path time is actually spent or on narrowing replay to the minimal target-state reconstruction needed.","learning":"The accepted-span replay path is close enough that small implementation changes matter, but removing the second cache clone alone is not the missing win. The major remaining cost is elsewhere in snapshot/replay or in the low-acceptance speculative workload itself.","rollback_cache_learning":"Pre-verify snapshot + accepted-span replay remains valid, but naive clone-count reduction is insufficient. The rollback-correct path still needs a more meaningful reduction in reconstruction work to beat the kept baseline."}}
{"run":124,"commit":"e7b14c4","metric":28.00186996449414,"metrics":{},"status":"discard","description":"Run the rollback-correct accepted-span replay path with a smaller speculative block size of 8 to reduce per-reject replay cost, now that profiling shows replay dominates and partial rejection happens on almost every step. This still did not beat the kept baseline.","timestamp":1776017681674,"segment":4,"confidence":56.64053160480834,"iterationTokens":5641,"asi":{"hypothesis":"With rollback-correct replay happening on most steps, the old block_size=16 setting may now be too expensive; reducing block size to 8 could lower replay waste enough to improve real server throughput on the corrected path.","rollback_reason":"The smaller block-size rollback-correct path still stayed below the kept baseline, so this is not a win.","next_action_hint":"The next lever is likely not block size alone. Focus on eliminating or approximating accepted-span replay itself, since replay cost dominates and fires on most steps.","learning":"The corrected rollback path changes the optimization landscape, but simply shrinking speculative block size to 8 does not recover enough replay overhead to beat the baseline.","rollback_cache_learning":"On the rollback-correct path, replay cost and rejection frequency remain the main bottlenecks. Smaller blocks did not solve that problem on the real server workload."}}
{"run":125,"commit":"e7b14c4","metric":28.137221160961474,"metrics":{},"status":"discard","description":"Teach the MLX target bridge to skip sampled-token computation on accepted-span replay, then use that no-sampling replay path in the rollback-correct hybrid variant. This trims replay-side work slightly but still does not beat the kept baseline.","timestamp":1776017794833,"segment":4,"confidence":58.14784279375575,"iterationTokens":4966,"asi":{"hypothesis":"A meaningful fraction of accepted-span replay cost is wasted in bridge-side lm_head/argmax and MLX->torch sampled-token conversion that the replay path never consumes; skipping that work should improve the rollback-correct server path.","rollback_reason":"The no-sampling replay path remained below the kept baseline and did not outperform the earlier best rollback-correct variant.","next_action_hint":"The replay bottleneck is not dominated by sampled-token extraction. The next structural step remains exact linear-cache rollback or another way to avoid replay entirely.","learning":"Accepted-span replay overhead is not mainly in bridge-side sampled-token extraction. The expensive part is still the target forward/reconstruction itself.","rollback_cache_learning":"No-sampling replay is a safe micro-optimization, but it is too small to matter while replay dominates and fires on most steps."}}
{"run":126,"commit":"e7b14c4","metric":28.215389949476247,"metrics":{},"status":"discard","description":"Run a rollback-correct adaptive hybrid: use accepted-span replay DFlash only for the first 128 generated tokens where acceptance is relatively higher, then fall back to plain greedy generation on the corrected target cache for the low-acceptance tail. This is the best adaptive-correctness variant so far, but it still does not beat the kept baseline.","timestamp":1776018356097,"segment":4,"confidence":58.24324799523699,"iterationTokens":23573,"asi":{"hypothesis":"Corrected DFlash is most useful early in the decode, while later low-acceptance steps mostly add replay overhead; switching to plain greedy after the high-acceptance region could outperform both all-DFlash and all-greedy on the benchmark workload.","rollback_reason":"The adaptive cutoff improved on the rollback-correct path but still stayed below the kept baseline, so it is not a primary-metric win.","next_action_hint":"Treat decode-phase acceptance collapse as a real benchmark characteristic. If pursuing adaptive policies further, optimize the cutoff rule or acceptance-based fallback logic rather than a fixed 128-token switch.","learning":"Acceptance on the rollback-correct path is materially better early than late on the 256-token benchmark prompt, and a fixed early-DFlash/late-greedy policy helps somewhat. However, the gain is still not enough to beat the kept baseline.","acceptance_learning":"On the benchmark prompt, rollback-correct DFlash averages about 2.85 accepted tokens/step in the first half of decode but only about 1.11 in the second half. Late-phase acceptance collapse is a real limit on end-to-end throughput for this workload."}}
{"run":127,"commit":"e7b14c4","metric":27.812729666331112,"metrics":{},"status":"discard","description":"Run the rollback-correct adaptive hybrid with a 96-token speculative cutoff instead of 128, using accepted-span replay for the early decode and plain greedy on the corrected cache afterward. This cutoff is too early and regresses relative to the 128-token adaptive variant.","timestamp":1776018469300,"segment":4,"confidence":59.62905434446265,"iterationTokens":23573,"asi":{"hypothesis":"Because acceptance collapses later in the benchmark decode, switching from corrected DFlash to plain greedy a bit earlier might improve end-to-end throughput further than the previous 128-token cutoff.","rollback_reason":"The 96-token cutoff reduced throughput materially, so it is too aggressive for this workload and not a win.","next_action_hint":"If pursuing adaptive fallback further, search around the later cutoff region or use an acceptance-based rule rather than an earlier fixed switch.","learning":"The adaptive-fallback idea still has some merit, but the useful speculative window on this workload extends past 96 generated tokens. The earlier cutoff leaves too much potential speedup on the table.","acceptance_learning":"A fixed speculative cutoff of 96 tokens is too short even with late-phase acceptance collapse; the rollback-correct path still contributes enough benefit between 96 and 128 tokens to matter."}}
