{"run":426,"commit":"c926eb5","metric":104.16607017833351,"metrics":{},"status":"discard","description":"Post-optimization control probe: disabled mirror runtime (DFLASH_MIRROR_SD_RUNTIME=0) to measure bstnxbt under same re-anchored workload.","timestamp":1776270016049,"segment":23,"confidence":8.889968921470008,"iterationTokens":1050,"asi":{"hypothesis":"After mirror helper optimization, mirror backend should at least match contemporaneous bstnxbt control.","rollback_reason":"Control run is non-mirror backend and not a valid keep candidate; used for comparison only.","next_action_hint":"Keep mirror backend enabled and tune from c926eb5; current mirror keep (105.38) is ahead of this control by ~1.22 tok/s.","backend":"bstnxbt_mlx","mirror_runtime_enabled":false,"mirror_minus_control_tok_s":1.2168834573084928}}
{"run":427,"commit":"c926eb5","metric":104.37718926937482,"metrics":{},"status":"discard","description":"Mirror split micro-sweep: DFLASH_MIRROR_SD_EXIT_LAYER=16 with optimized helper implementation.","timestamp":1776270057865,"segment":23,"confidence":6.448017399347232,"iterationTokens":1191,"asi":{"hypothesis":"After helper optimization, nearby split layer 16 may surpass layer 15.","rollback_reason":"Metric lower than mirror keep (104.38 vs 105.38).","next_action_hint":"Retain exit layer 15 as current optimum; probe 14/17 only if needed for map completion.","backend":"mirror_sd_mlx","mirror_exit_layer":16}}
{"run":428,"commit":"4b8c80e","metric":105.54758329710315,"metrics":{},"status":"keep","description":"Mirror split micro-sweep keep: DFLASH_MIRROR_SD_EXIT_LAYER=14 outperformed 15 on optimized helper path.","timestamp":1776270091951,"segment":23,"confidence":5.147369897158044,"iterationTokens":711,"asi":{"hypothesis":"With lower Python overhead, slightly earlier split (14) may now beat 15.","backend":"mirror_sd_mlx","mirror_exit_layer":14,"delta_vs_prior_keep_tok_s":0.16462966146114394}}
{"run":429,"commit":"4b8c80e","metric":105.01653151431529,"metrics":{},"status":"discard","description":"Mirror exit-layer=14 confirmation rerun (unchanged config/code).","timestamp":1776270122442,"segment":23,"confidence":1.963697060677537,"iterationTokens":671,"asi":{"hypothesis":"Exit-layer 14 keep should stay in the ~105.5 class on immediate rerun.","rollback_reason":"Rerun landed slightly lower at 105.02 and introduced no new code/config change.","next_action_hint":"Continue tuning from 4b8c80e; compare against contemporaneous bstnxbt control and probe nearby knobs.","backend":"mirror_sd_mlx","stability_probe":true}}
{"run":430,"commit":"4b8c80e","metric":104.44092715556485,"metrics":{},"status":"discard","description":"Control check on latest mirror keep: disabled mirror runtime (DFLASH_MIRROR_SD_RUNTIME=0) to measure bstnxbt baseline.","timestamp":1776270154270,"segment":23,"confidence":1.2795688854171927,"iterationTokens":728,"asi":{"hypothesis":"Mirror exit-layer=14 keep should remain above contemporaneous bstnxbt control.","rollback_reason":"Control backend run is not a mirror keep candidate; measured for comparison only.","next_action_hint":"Retain mirror runtime enabled on 4b8c80e; mirror still leads control by ~1.11 tok/s in this regime.","backend":"bstnxbt_mlx","mirror_runtime_enabled":false,"mirror_minus_control_tok_s":1.1066561415383007}}
{"run":431,"commit":"4b8c80e","metric":105.04688788486294,"metrics":{},"status":"discard","description":"Mirror split micro-sweep: DFLASH_MIRROR_SD_EXIT_LAYER=13.","timestamp":1776270188203,"segment":23,"confidence":2.0767381392150157,"iterationTokens":812,"asi":{"hypothesis":"A slightly earlier mirror split than 14 may unlock a small gain.","rollback_reason":"Metric lower than current mirror keep (105.05 vs 105.55).","next_action_hint":"Keep exit layer 14 as best-known point; optionally test 12 only if searching for non-monotonic pockets.","backend":"mirror_sd_mlx","mirror_exit_layer":13}}
{"run":432,"commit":"4b8c80e","metric":56.00465779361909,"metrics":{},"status":"discard","description":"Mirror split micro-sweep: DFLASH_MIRROR_SD_EXIT_LAYER=12.","timestamp":1776270230160,"segment":23,"confidence":1.2443221817422048,"iterationTokens":682,"asi":{"hypothesis":"Further earlier split could expose a better non-monotonic pocket.","rollback_reason":"Severe collapse to 56.00 tok/s.","next_action_hint":"Avoid exit layers <=12 on this lane; keep search near 14 only.","backend":"mirror_sd_mlx","mirror_exit_layer":12}}
{"run":433,"commit":"4b8c80e","metric":50.354571399753524,"metrics":{},"status":"discard","description":"Mirror lane SDPA probe: set DFLASH_BSTNXBT_SPLIT_CHUNK_SIZE=10.","timestamp":1776270278038,"segment":23,"confidence":1.2072308799950093,"iterationTokens":853,"asi":{"hypothesis":"Adjusting split-SDPA chunk granularity might improve mirror target split throughput.","rollback_reason":"Catastrophic regression to 50.35 tok/s.","next_action_hint":"Do not override split chunk size on this mirror 1024 lane; default chunking is required.","backend":"mirror_sd_mlx","split_chunk_size":10}}
{"run":434,"commit":"4b8c80e","metric":80.53257302284392,"metrics":{},"status":"discard","description":"Mirror lane cache-reservation probe: INITIAL_CACHE_BLOCKS=128 on exit-layer=14 keep.","timestamp":1776270340262,"segment":23,"confidence":1.1722868393513202,"iterationTokens":2198,"asi":{"hypothesis":"A modest initial cache reservation could improve mirror stability/performance near the current keep.","rollback_reason":"Large regression to 80.53 tok/s.","next_action_hint":"Do not apply INITIAL_CACHE_BLOCKS override on mirror 1024 lane; keep default cache reservation.","backend":"mirror_sd_mlx","initial_cache_blocks":128}}
{"run":435,"commit":"3e06c3a","metric":106.21499753541018,"metrics":{},"status":"keep","description":"Mirror target helper micro-optimization: cached linear-layer flags + capture flag indexing in mirror_sd_target split loops. Authoritative mirror lane improved to 106.21 tok/s.","timestamp":1776270425788,"segment":23,"confidence":1.2595376550530675,"iterationTokens":3202,"asi":{"hypothesis":"Precomputing per-layer linear flags and replacing set-membership checks with indexed capture flags will reduce inner-loop Python overhead in mirror split forward.","backend":"mirror_sd_mlx","optimization":"linear_flags_cache + capture_flags","mirror_exit_layer":14}}
{"run":436,"commit":"3e06c3a","metric":106.01966327293151,"metrics":{},"status":"discard","description":"Mirror optimized helper confirmation rerun (unchanged config/code) after 106.21 keep.","timestamp":1776270453376,"segment":23,"confidence":1.2647922931103315,"iterationTokens":710,"asi":{"hypothesis":"The 106.21 mirror keep should reproduce within the same high band.","rollback_reason":"No new code/config change and rerun was slightly lower than prior keep.","next_action_hint":"Treat mirror lane as ~106 tok/s on commit 3e06c3a; next step is head-to-head control rerun and final micro-sweep only if it can beat this band.","backend":"mirror_sd_mlx","stability_probe":true}}
{"run":437,"commit":"3e06c3a","metric":104.76761539876321,"metrics":{},"status":"discard","description":"Post-optimization control rerun: disabled mirror runtime (DFLASH_MIRROR_SD_RUNTIME=0) to measure bstnxbt under latest code.","timestamp":1776270488152,"segment":23,"confidence":2.129820419697237,"iterationTokens":753,"asi":{"hypothesis":"Latest mirror keep should remain ahead of contemporaneous bstnxbt control.","rollback_reason":"Control backend run is non-mirror and not keepable for mirror integration.","next_action_hint":"Stay on mirror-enabled 3e06c3a; mirror remains ahead by ~1.45 tok/s versus this control.","backend":"bstnxbt_mlx","mirror_runtime_enabled":false,"mirror_minus_control_tok_s":1.4473821366469726}}
{"run":438,"commit":"3e06c3a","metric":105.08670808656437,"metrics":{},"status":"discard","description":"Mirror helper micro-tweak: switched mixed-mask loops to zipped slices in mirror_sd_target.","timestamp":1776270565471,"segment":23,"confidence":4.98030179058127,"iterationTokens":2492,"asi":{"hypothesis":"Zipped-slice iteration in mixed-mask mirror split loops may reduce indexing overhead and improve throughput.","rollback_reason":"Regressed to 105.09 tok/s vs 106.21 keep.","next_action_hint":"Revert to prior mixed-loop style from 3e06c3a; focus on other micro-optimizations only if they preserve >106 band.","backend":"mirror_sd_mlx"}}
{"run":439,"commit":"fa78f21","metric":106.45436367533323,"metrics":{},"status":"keep","description":"Mirror target helper micro-optimization: cache capture-flag bitmaps by layer-set/size in mirror_sd_target to avoid per-call reconstruction in split loops. New mirror best on authoritative lane.","timestamp":1776270738632,"segment":23,"confidence":5.062232259371537,"iterationTokens":2492,"asi":{"hypothesis":"Caching capture flags across calls will reduce Python overhead in mirror split forward and improve throughput.","backend":"mirror_sd_mlx","optimization":"capture_flags_cache","mirror_exit_layer":14}}
{"run":440,"commit":"fa78f21","metric":106.41199052791532,"metrics":{},"status":"discard","description":"Mirror split micro-sweep after capture-flags cache: DFLASH_MIRROR_SD_EXIT_LAYER=15.","timestamp":1776270783312,"segment":23,"confidence":5.132512416782081,"iterationTokens":1125,"asi":{"hypothesis":"With capture-flags caching in place, exit layer 15 might overtake 14.","rollback_reason":"Slightly lower than current keep (106.41 vs 106.45).","next_action_hint":"Keep exit layer at 14; only probe nearby values if there is clear noise-adjusted upside.","backend":"mirror_sd_mlx","mirror_exit_layer":15}}
{"run":441,"commit":"fa78f21","metric":105.98708017996759,"metrics":{},"status":"discard","description":"Mirror split micro-sweep: DFLASH_MIRROR_SD_EXIT_LAYER=17 with capture-flags cache optimization in place.","timestamp":1776270858643,"segment":23,"confidence":5.483851238194427,"iterationTokens":3009,"asi":{"hypothesis":"A slightly deeper split (17) might outperform 14 after helper optimizations.","rollback_reason":"Lower than current keep (105.99 vs 106.45).","next_action_hint":"Keep split layer anchored at 14; deeper values are not competitive on this lane.","backend":"mirror_sd_mlx","mirror_exit_layer":17}}
{"run":442,"commit":"fa78f21","metric":103.93965771274614,"metrics":{},"status":"discard","description":"Mirror helper micro-tweak: pre-bound local aliases (layers/cache/capture tables) in mixed-mask split loops.","timestamp":1776270920340,"segment":23,"confidence":5.682661743421503,"iterationTokens":2043,"asi":{"hypothesis":"Reducing repeated attribute lookups in mixed-mask loops can improve mirror split throughput.","rollback_reason":"Regression to 103.94 tok/s versus 106.45 keep.","next_action_hint":"Revert local-alias tweak; prioritize structural knobs over further Python micro-binding in this path.","backend":"mirror_sd_mlx"}}
{"run":443,"commit":"fa78f21","metric":106.31053375360469,"metrics":{},"status":"discard","description":"Mirror helper loop variant: switched mixed-mask split execution from two loops to one loop with split boundary marker.","timestamp":1776271003597,"segment":23,"confidence":5.633921806993683,"iterationTokens":2828,"asi":{"hypothesis":"A single mixed-mask loop may reduce Python loop overhead while preserving mirror split semantics.","rollback_reason":"Slight regression versus keep (106.31 vs 106.45).","next_action_hint":"Keep two-loop mixed split implementation; one-loop variant does not improve primary metric.","backend":"mirror_sd_mlx"}}
{"run":444,"commit":"fa78f21","metric":106.36067614176108,"metrics":{},"status":"discard","description":"Mirror split micro-sweep: DFLASH_MIRROR_SD_EXIT_LAYER=19.","timestamp":1776271057077,"segment":23,"confidence":5.586010841046666,"iterationTokens":1382,"asi":{"hypothesis":"A moderately deeper split may yield a better compute balance after mirror helper optimizations.","rollback_reason":"Slightly below keep (106.36 vs 106.45).","next_action_hint":"No evidence of upside above 14 in current sweep; keep exit layer anchored at 14.","backend":"mirror_sd_mlx","mirror_exit_layer":19}}
{"run":445,"commit":"fa78f21","metric":106.04835092855875,"metrics":{},"status":"discard","description":"Mirror split micro-sweep: DFLASH_MIRROR_SD_EXIT_LAYER=18.","timestamp":1776271091303,"segment":23,"confidence":6.297062522962726,"iterationTokens":684,"asi":{"hypothesis":"Exit layer 18 could be a non-monotonic sweet spot near 14/19.","rollback_reason":"Below keep (106.05 vs 106.45).","next_action_hint":"Exit-layer sweep confirms 14 remains best-known mirror split point; shift effort to other mirror/runtime levers.","backend":"mirror_sd_mlx","mirror_exit_layer":18}}
{"run":446,"commit":"2486190","metric":106.46533396634432,"metrics":{},"status":"keep","description":"Mirror runtime call-path trim: pass mirror target-forward function override directly into bstnxbt loop to skip per-request mode dispatch/import branch in the hot path.","timestamp":1776271239438,"segment":23,"confidence":6.775869237246932,"iterationTokens":5274,"asi":{"hypothesis":"Bypassing target-forward mode dispatch in the mirror wrapper will shave Python overhead and slightly improve throughput.","backend":"mirror_sd_mlx","optimization":"target_forward_fn_override_direct"}}
{"run":447,"commit":"2486190","metric":106.29258044807004,"metrics":{},"status":"discard","description":"Head-to-head control rerun on latest code: disabled mirror runtime (DFLASH_MIRROR_SD_RUNTIME=0) to measure bstnxbt lane under same workload.","timestamp":1776271278573,"segment":23,"confidence":6.84501196824082,"iterationTokens":1361,"asi":{"hypothesis":"Latest mirror optimizations should still leave mirror backend ahead of contemporaneous bstnxbt control.","rollback_reason":"Control backend run is not a mirror keep candidate; used for comparison only.","next_action_hint":"Mirror advantage is now narrow (~0.17 tok/s); prioritize robust gains above control rather than tiny call-path tweaks.","backend":"bstnxbt_mlx","mirror_runtime_enabled":false,"mirror_minus_control_tok_s":0.1727535182742845}}
{"run":448,"commit":"2486190","metric":106.07650790441157,"metrics":{},"status":"discard","description":"Mirror path specialization attempt: pre-resolved mirror exit layer + capture flags once per request in bstnxbt loop closure.","timestamp":1776271382566,"segment":23,"confidence":6.9155803477221065,"iterationTokens":4082,"asi":{"hypothesis":"Resolving mirror split metadata once per request and passing overrides into target forward would reduce per-call overhead.","rollback_reason":"Regressed to 106.08 tok/s versus 106.47 keep.","next_action_hint":"Keep direct mirror target forward call-path from 2486190; avoid per-request closure specialization.","backend":"mirror_sd_mlx"}}
{"run":449,"commit":"2486190","metric":106.32058806919117,"metrics":{},"status":"discard","description":"Mirror lane SDPA chunk micro-sweep: DFLASH_BSTNXBT_SPLIT_CHUNK_SIZE=7.","timestamp":1776271416474,"segment":23,"confidence":7.452276976818219,"iterationTokens":812,"asi":{"hypothesis":"A slightly smaller split chunk than default 8 might improve mirror split efficiency.","rollback_reason":"Lower than keep (106.32 vs 106.47).","next_action_hint":"Retain default split chunk size; nearby chunk retunes are not outperforming current mirror keep.","backend":"mirror_sd_mlx","split_chunk_size":7}}
{"run":450,"commit":"2486190","metric":106.26744515826881,"metrics":{},"status":"discard","description":"Mirror lane SDPA chunk micro-sweep: DFLASH_BSTNXBT_SPLIT_CHUNK_SIZE=9.","timestamp":1776271454008,"segment":23,"confidence":8.192956194392552,"iterationTokens":707,"asi":{"hypothesis":"A slightly larger split chunk than default 8 might improve mirror split efficiency.","rollback_reason":"Lower than keep (106.27 vs 106.47).","next_action_hint":"Default split chunk size remains best among nearby values 7/8/9 on mirror lane.","backend":"mirror_sd_mlx","split_chunk_size":9}}
{"run":451,"commit":"2486190","metric":106.19859910691433,"metrics":{},"status":"discard","description":"Mirror warmup-shape probe: set WARMUP_MAX_TOKENS=16 instead of block-matched default.","timestamp":1776271527896,"segment":23,"confidence":8.375059699978852,"iterationTokens":720,"asi":{"hypothesis":"A slightly longer warmup might improve mirror path readiness and throughput.","rollback_reason":"Slightly below keep (106.20 vs 106.47).","next_action_hint":"Keep block-matched warmup behavior; explicit 16-token override is not beneficial on mirror lane.","backend":"mirror_sd_mlx","warmup_max_tokens":16}}
{"run":452,"commit":"2486190","metric":105.90018830688868,"metrics":{},"status":"discard","description":"Mirror request-shape probe: BENCHMARK_DFLASH=1 (explicit request-level dflash=true).","timestamp":1776271565738,"segment":23,"confidence":8.565442395817435,"iterationTokens":936,"asi":{"hypothesis":"Explicit request-level DFlash forcing could improve mirror path consistency/perf.","rollback_reason":"Lower than keep (105.90 vs 106.47).","next_action_hint":"Keep BENCHMARK_DFLASH=0 for mirror lane.","backend":"mirror_sd_mlx","benchmark_dflash":1}}
{"run":453,"commit":"2486190","metric":106.29263745698297,"metrics":{},"status":"discard","description":"Mirror split micro-sweep: DFLASH_MIRROR_SD_EXIT_LAYER=20.","timestamp":1776271626050,"segment":23,"confidence":8.61728101712308,"iterationTokens":1671,"asi":{"hypothesis":"A deeper split at 20 could be another non-monotonic pocket above 14.","rollback_reason":"Below current keep (106.29 vs 106.47).","next_action_hint":"No upside found at 20; keep split layer anchored at 14.","backend":"mirror_sd_mlx","mirror_exit_layer":20}}
{"run":454,"commit":"2486190","metric":106.17559532534247,"metrics":{},"status":"discard","description":"Mirror split micro-sweep: DFLASH_MIRROR_SD_EXIT_LAYER=21.","timestamp":1776271661459,"segment":23,"confidence":8.854310808639504,"iterationTokens":663,"asi":{"hypothesis":"Exit layer 21 could be a late-layer sweet spot near the deep split region.","rollback_reason":"Below keep (106.18 vs 106.47).","next_action_hint":"Extend do-not-retry range to include 20/21; keep split at 14.","backend":"mirror_sd_mlx","mirror_exit_layer":21}}
{"run":455,"commit":"2486190","metric":106.1854204267312,"metrics":{},"status":"discard","description":"Mirror helper micro-tweak: use frozenset-based exit-layer cache keys to avoid per-call sorting of capture layer IDs.","timestamp":1776271725339,"segment":23,"confidence":9.883559794745258,"iterationTokens":1608,"asi":{"hypothesis":"Replacing sorted-tuple cache keys with frozenset keys will reduce mirror exit-layer cache overhead.","rollback_reason":"Lower than keep (106.19 vs 106.47).","next_action_hint":"Revert this key-shape tweak; sorting overhead is not a dominant bottleneck here.","backend":"mirror_sd_mlx"}}
{"run":456,"commit":"2486190","metric":106.31229925709937,"metrics":{},"status":"discard","description":"Mirror request-shape probe: settings-driven thinking only (ENABLE_THINKING=0, SETTINGS_ENABLE_THINKING=1).","timestamp":1776271767367,"segment":23,"confidence":11.249434844013559,"iterationTokens":765,"asi":{"hypothesis":"Settings-driven thinking may yield a slightly better mirror request path than request-driven thinking.","rollback_reason":"Below keep (106.31 vs 106.47).","next_action_hint":"Keep request-driven thinking on mirror lane as current best shape.","backend":"mirror_sd_mlx","enable_thinking":0,"settings_enable_thinking":1}}
{"run":457,"commit":"2486190","metric":106.30590116930756,"metrics":{},"status":"discard","description":"Mirror helper micro-tweak: use frozenset capture IDs end-to-end (including exit/capture cache key paths) to avoid repeated set conversions.","timestamp":1776271899088,"segment":23,"confidence":12.355536542711178,"iterationTokens":5202,"asi":{"hypothesis":"Passing capture IDs as frozenset and reusing them in mirror cache keys will reduce small Python overhead in the split helper.","rollback_reason":"Still below keep (106.31 vs 106.47).","next_action_hint":"Revert this conversion path; it does not improve primary metric.","backend":"mirror_sd_mlx"}}
{"run":458,"commit":"2486190","metric":106.16836471697059,"metrics":{},"status":"discard","description":"Mirror warmup stability probe: AR_WARMUP_REPEAT=2.","timestamp":1776271939877,"segment":23,"confidence":13.63495908297377,"iterationTokens":768,"asi":{"hypothesis":"Two DFlash warmup passes may stabilize mirror path and improve throughput.","rollback_reason":"Slightly below keep (106.17 vs 106.47).","next_action_hint":"Keep single warmup repeat on mirror lane; duplicate warmup adds no benefit.","backend":"mirror_sd_mlx","ar_warmup_repeat":2}}
{"run":459,"commit":"2486190","metric":106.28660532920098,"metrics":{},"status":"discard","description":"Mirror helper micro-tweak: cache linear-layer flags directly on inner model object (attribute fast-path) in addition to id-map cache.","timestamp":1776272004507,"segment":23,"confidence":15.910526351416983,"iterationTokens":1765,"asi":{"hypothesis":"Object-attribute flag cache may reduce lookup overhead versus dict-only cache in mixed-mask mirror loops.","rollback_reason":"No gain; below keep (106.29 vs 106.47).","next_action_hint":"Stick with current id-map cache path; attribute fast-path not worthwhile.","backend":"mirror_sd_mlx"}}
{"run":460,"commit":"2486190","metric":106.24646787318838,"metrics":{},"status":"discard","description":"Mirror per-request specialization without closure: precompute exit_layer/capture_flags once and pass via kwargs into mirror target forward calls.","timestamp":1776272130924,"segment":23,"confidence":20.21251396576992,"iterationTokens":5602,"asi":{"hypothesis":"Passing pre-resolved mirror split metadata via kwargs (without closure) will reduce per-call helper overhead.","rollback_reason":"Below keep (106.25 vs 106.47).","next_action_hint":"Revert this specialization; direct helper with internal caches remains better.","backend":"mirror_sd_mlx"}}
