{"run":1483,"commit":"b304c02","metric":26.57486354654141,"metrics":{},"status":"discard","description":"Control parity check (`DFLASH_MIRROR_SD_RUNTIME=0`) also collapsed to ~26.57, confirming shared extreme-collapse mode.","timestamp":1776355942003,"segment":23,"confidence":3.4409411268632044,"iterationTokens":913,"asi":{"hypothesis":"Extreme trough behavior is backend-agnostic and driven by shared runtime/system instability.","rollback_reason":"Control non-authoritative and catastrophically below keep.","next_action_hint":"Restore mirror lane and track staged recovery from extreme trough.","backend":"bstnxbt_mlx","mirror_runtime_enabled":0,"context_only_draft_cache":1,"draft_sink":48,"async_draft_eval":1,"fused_draft_verify_eval":1,"startup_s":4.288349625072442,"warmup_s":6.170648332918063,"request_s":38.53265316702891,"paired_mirror_tok_s":23.44155913112984,"paired_delta_tok_s":-3.1333044154115703,"authoritative_lane":"mirror_sd_mlx","shared_extreme_collapse_confirmed":true}}
{"run":1484,"commit":"b304c02","metric":85.37617142520033,"metrics":{},"status":"discard","description":"Mirror snapped back to ~85.38 from extreme trough, indicating rapid staged recovery onset.","timestamp":1776355978901,"segment":23,"confidence":3.4394166605863403,"iterationTokens":1220,"asi":{"hypothesis":"Even extreme collapse states can rebound quickly into mid/high-80s.","rollback_reason":"Still below keep/high-window.","next_action_hint":"Continue consecutive mirror samples to trace 90/100/108 recovery ladder.","backend":"mirror_sd_mlx","context_only_draft_cache":1,"draft_sink":48,"async_draft_eval":1,"fused_draft_verify_eval":1,"request_s":11.99397891596891,"paired_prev_tok_s":23.44155913112984,"paired_delta_tok_s":61.93461229407049,"delta_vs_keep":-23.486161069274615,"recovery_stage":"23->85"}}
{"run":1485,"commit":"b304c02","metric":81.01849371975918,"metrics":{},"status":"discard","description":"Mirror eased to ~81.02 after initial rebound, showing non-monotonic recovery.","timestamp":1776356008834,"segment":23,"confidence":3.426979575466621,"iterationTokens":721,"asi":{"hypothesis":"Post-trough recovery can oscillate in the 80s before resuming climb.","rollback_reason":"Below keep.","next_action_hint":"Continue mirror tracking to capture next upward leg.","backend":"mirror_sd_mlx","context_only_draft_cache":1,"draft_sink":48,"async_draft_eval":1,"fused_draft_verify_eval":1,"warmup_s":2.265419541974552,"paired_prev_tok_s":85.37617142520033,"paired_delta_tok_s":-4.357677705441154,"delta_vs_keep":-27.84383877471577,"oscillatory_recovery":true}}
{"run":1486,"commit":"b304c02","metric":96.31216389490457,"metrics":{},"status":"discard","description":"Mirror jumped to ~96.31, clearing the 80s oscillation and re-entering mid-recovery plateau.","timestamp":1776356036655,"segment":23,"confidence":3.4174397059103763,"iterationTokens":704,"asi":{"hypothesis":"Recovery ladder remains intact and can quickly step from 80s to mid-90s.","rollback_reason":"Below keep/high-window.","next_action_hint":"Continue mirror runs for 100+ re-entry.","backend":"mirror_sd_mlx","context_only_draft_cache":1,"draft_sink":48,"async_draft_eval":1,"fused_draft_verify_eval":1,"request_s":10.63209420896601,"paired_prev_tok_s":81.01849371975918,"paired_delta_tok_s":15.29367017514539,"delta_vs_keep":-12.55016859957037,"recovery_stage":"81->96"}}
{"run":1487,"commit":"b304c02","metric":55.38963494531555,"metrics":{},"status":"discard","description":"Mirror re-collapsed to ~55.39 immediately after reaching ~96, showing high-frequency instability.","timestamp":1776356076351,"segment":23,"confidence":3.4114191235996945,"iterationTokens":729,"asi":{"hypothesis":"Current regime oscillates between mid-recovery and deep-collapse states with little persistence.","rollback_reason":"Catastrophically below keep.","next_action_hint":"Run immediate mirror follow-up to map this new collapse branch before parity check.","backend":"mirror_sd_mlx","context_only_draft_cache":1,"draft_sink":48,"async_draft_eval":1,"fused_draft_verify_eval":1,"request_s":18.48721337504685,"paired_prev_tok_s":96.31216389490457,"paired_delta_tok_s":-40.92252894958902,"delta_vs_keep":-53.47269754915939,"collapse_reappeared":true}}
{"run":1488,"commit":"b304c02","metric":98.36509337893473,"metrics":{},"status":"discard","description":"Immediate mirror follow-up rebounded to ~98.37, confirming collapse was transient in this branch.","timestamp":1776356107634,"segment":23,"confidence":3.4054197171802496,"iterationTokens":729,"asi":{"hypothesis":"Extreme dips can revert to upper-90s within one run during current instability phase.","rollback_reason":"Below keep/high-window.","next_action_hint":"Continue mirror tracking; parity check only if extended deep-collapse streak returns.","backend":"mirror_sd_mlx","context_only_draft_cache":1,"draft_sink":48,"async_draft_eval":1,"fused_draft_verify_eval":1,"warmup_s":2.21535249997396,"paired_prev_tok_s":55.38963494531555,"paired_delta_tok_s":42.97545843361918,"delta_vs_keep":-10.497239115540214,"oscillatory_recovery":true}}
{"run":1489,"commit":"b304c02","metric":66.85760421476064,"metrics":{},"status":"discard","description":"Mirror dropped back to ~66.86, reopening deep-recovery oscillation after brief upper-90s rebound.","timestamp":1776356143991,"segment":23,"confidence":3.403895709119293,"iterationTokens":723,"asi":{"hypothesis":"Current phase remains highly volatile with frequent toggles between 60s and ~100.","rollback_reason":"Below keep.","next_action_hint":"Run another mirror sample; parity check if sub-80 values persist.","backend":"mirror_sd_mlx","context_only_draft_cache":1,"draft_sink":48,"async_draft_eval":1,"fused_draft_verify_eval":1,"request_s":15.31613362499047,"paired_prev_tok_s":98.36509337893473,"paired_delta_tok_s":-31.50748916417409,"delta_vs_keep":-42.0047282797143,"oscillatory_recovery":true}}
{"run":1490,"commit":"b304c02","metric":68.24787328599193,"metrics":{},"status":"discard","description":"Mirror remained sub-80 at ~68.25, confirming renewed deep-degraded pocket.","timestamp":1776356177665,"segment":23,"confidence":3.402373064509427,"iterationTokens":746,"asi":{"hypothesis":"This branch is sustaining a low-band regime rather than single-run noise.","rollback_reason":"Below keep and second consecutive deep-degraded sample.","next_action_hint":"Run control parity sample now to attribute low-band as shared or mirror-specific.","backend":"mirror_sd_mlx","context_only_draft_cache":1,"draft_sink":48,"async_draft_eval":1,"fused_draft_verify_eval":1,"paired_prev_tok_s":66.85760421476064,"paired_delta_tok_s":1.3902690712312895,"delta_vs_keep":-40.61445920848301,"deep_band_persists":true}}
{"run":1491,"commit":"b304c02","metric":70.65412387852608,"metrics":{},"status":"discard","description":"Control parity check (`DFLASH_MIRROR_SD_RUNTIME=0`) also landed deep at ~70.65, confirming shared degraded pocket.","timestamp":1776356215668,"segment":23,"confidence":3.3955330737162286,"iterationTokens":821,"asi":{"hypothesis":"Current low-band episode is backend-agnostic shared regime drift.","rollback_reason":"Control non-authoritative and below keep.","next_action_hint":"Restore mirror lane and continue recovery tracking from ~70 band.","backend":"bstnxbt_mlx","mirror_runtime_enabled":0,"context_only_draft_cache":1,"draft_sink":48,"async_draft_eval":1,"fused_draft_verify_eval":1,"warmup_s":2.120533541077748,"paired_mirror_tok_s":68.24787328599193,"paired_delta_tok_s":-2.406250592534149,"authoritative_lane":"mirror_sd_mlx","shared_deep_band_confirmed":true}}
{"run":1492,"commit":"b304c02","metric":69.5200238685768,"metrics":{},"status":"discard","description":"Mirror anchor after parity stayed low at ~69.52, confirming sustained degraded regime.","timestamp":1776356251959,"segment":23,"confidence":3.388720529417732,"iterationTokens":1136,"asi":{"hypothesis":"Shared deep-band episode is persisting near ~68-71 before next recovery step.","rollback_reason":"Below keep.","next_action_hint":"Continue consecutive mirror samples to detect rebound onset.","backend":"mirror_sd_mlx","context_only_draft_cache":1,"draft_sink":48,"async_draft_eval":1,"fused_draft_verify_eval":1,"paired_control_tok_s":70.65412387852608,"paired_delta_tok_s":-1.1341000099492822,"delta_vs_keep":-39.3423086258968,"deep_band_persists":true}}
{"run":1493,"commit":"b304c02","metric":67.63538001129449,"metrics":{},"status":"discard","description":"Mirror slipped to ~67.64, still inside sustained deep-band trough.","timestamp":1776356286518,"segment":23,"confidence":3.386047034458682,"iterationTokens":681,"asi":{"hypothesis":"Recovery has not started yet; regime remains pinned in high-60s.","rollback_reason":"Below keep/high-window.","next_action_hint":"Continue mirror tracking until rebound signs appear.","backend":"mirror_sd_mlx","context_only_draft_cache":1,"draft_sink":48,"async_draft_eval":1,"fused_draft_verify_eval":1,"paired_prev_tok_s":69.5200238685768,"paired_delta_tok_s":-1.8846438572823137,"delta_vs_keep":-41.226952483179055,"deep_band_persists":true}}
{"run":1494,"commit":"b304c02","metric":71.80588037513209,"metrics":{},"status":"discard","description":"Mirror rose to ~71.81, first rebound signal out of high-60s trough.","timestamp":1776356320874,"segment":23,"confidence":3.3833777546248847,"iterationTokens":673,"asi":{"hypothesis":"Recovery onset may be starting from the deep-band floor.","rollback_reason":"Still below keep.","next_action_hint":"Continue consecutive mirror runs to confirm rebound continuation.","backend":"mirror_sd_mlx","context_only_draft_cache":1,"draft_sink":48,"async_draft_eval":1,"fused_draft_verify_eval":1,"warmup_s":2.2081647079903632,"paired_prev_tok_s":67.63538001129449,"paired_delta_tok_s":4.170500363837608,"delta_vs_keep":-37.05645211934284,"recovery_onset_signal":true}}
{"run":1495,"commit":"b304c02","metric":72.0029893897434,"metrics":{},"status":"discard","description":"Mirror held at ~72.00, confirming early rebound from deep trough.","timestamp":1776356354758,"segment":23,"confidence":3.3704409374362285,"iterationTokens":702,"asi":{"hypothesis":"Recovery is progressing slowly through low-70s before higher-band jump.","rollback_reason":"Below keep/high-window.","next_action_hint":"Continue mirror tracking for transition into 80s.","backend":"mirror_sd_mlx","context_only_draft_cache":1,"draft_sink":48,"async_draft_eval":1,"fused_draft_verify_eval":1,"paired_prev_tok_s":71.80588037513209,"paired_delta_tok_s":0.19710901461131777,"delta_vs_keep":-36.85934310473153,"recovery_stage":"~72 plateau"}}
{"run":1496,"commit":"b304c02","metric":86.17343394750917,"metrics":{},"status":"discard","description":"Mirror jumped to ~86.17 from ~72 plateau, signaling next recovery stage.","timestamp":1776356383453,"segment":23,"confidence":3.358094362854203,"iterationTokens":677,"asi":{"hypothesis":"Recovery remains stepwise with sudden jumps between plateaus.","rollback_reason":"Below keep.","next_action_hint":"Continue mirror scans to follow 90+/100+ progression.","backend":"mirror_sd_mlx","context_only_draft_cache":1,"draft_sink":48,"async_draft_eval":1,"fused_draft_verify_eval":1,"request_s":11.883012583944947,"paired_prev_tok_s":72.0029893897434,"paired_delta_tok_s":14.170444557765773,"delta_vs_keep":-22.688898546965767,"recovery_stage":"72->86"}}
{"run":1497,"commit":"b304c02","metric":83.4301539250549,"metrics":{},"status":"discard","description":"Mirror eased to ~83.43, staying in mid-80 recovery band.","timestamp":1776356415663,"segment":23,"confidence":3.356602918891812,"iterationTokens":694,"asi":{"hypothesis":"Recovery can wobble within 80s before resuming upward movement.","rollback_reason":"Below keep.","next_action_hint":"Continue mirror runs for renewed climb toward 90+.","backend":"mirror_sd_mlx","context_only_draft_cache":1,"draft_sink":48,"async_draft_eval":1,"fused_draft_verify_eval":1,"paired_prev_tok_s":86.17343394750917,"paired_delta_tok_s":-2.743280022454275,"delta_vs_keep":-25.43217856942004,"recovery_stage":"~83-86 band"}}
{"run":1498,"commit":"b304c02","metric":87.36751606542431,"metrics":{},"status":"discard","description":"Mirror rose to ~87.37, reclaiming upper-80 recovery range.","timestamp":1776356445445,"segment":23,"confidence":3.3551127991433103,"iterationTokens":682,"asi":{"hypothesis":"Recovery remains active and may step into 90s shortly.","rollback_reason":"Below keep.","next_action_hint":"Continue mirror tracking for 90+/100+ transition.","backend":"mirror_sd_mlx","context_only_draft_cache":1,"draft_sink":48,"async_draft_eval":1,"fused_draft_verify_eval":1,"paired_prev_tok_s":83.4301539250549,"paired_delta_tok_s":3.9373621403694012,"delta_vs_keep":-21.494816429050633,"recovery_stage":"83->87"}}
{"run":1499,"commit":"b304c02","metric":80.61632069636948,"metrics":{},"status":"discard","description":"Mirror dipped to ~80.62, extending choppy 80s recovery behavior.","timestamp":1776356477705,"segment":23,"confidence":3.3515819222990073,"iterationTokens":673,"asi":{"hypothesis":"Current cycle remains oscillatory and not yet in sustained ascent.","rollback_reason":"Below keep/high-window.","next_action_hint":"Continue mirror samples; consider parity check only if deeper collapse reappears.","backend":"mirror_sd_mlx","context_only_draft_cache":1,"draft_sink":48,"async_draft_eval":1,"fused_draft_verify_eval":1,"paired_prev_tok_s":87.36751606542431,"paired_delta_tok_s":-6.751195369054828,"delta_vs_keep":-28.24601179810546,"oscillatory_recovery":true}}
{"run":1500,"commit":"b304c02","metric":77.18415252166972,"metrics":{},"status":"discard","description":"Mirror slid to ~77.18, probing lower side of the current choppy recovery envelope.","timestamp":1776356510729,"segment":23,"confidence":3.3491987906490785,"iterationTokens":683,"asi":{"hypothesis":"Recovery branch is drifting downward within 70s-80s rather than advancing to 90+.","rollback_reason":"Below keep.","next_action_hint":"Run immediate mirror follow-up; parity check if sub-80 persists across additional samples.","backend":"mirror_sd_mlx","context_only_draft_cache":1,"draft_sink":48,"async_draft_eval":1,"fused_draft_verify_eval":1,"warmup_s":2.0839527079369873,"paired_prev_tok_s":80.61632069636948,"paired_delta_tok_s":-3.432168174699759,"delta_vs_keep":-31.67817997280479,"low_side_drift":true}}
{"run":1501,"commit":"b304c02","metric":77.72710559942179,"metrics":{},"status":"discard","description":"Immediate mirror follow-up stayed sub-80 at ~77.73, confirming lower-side persistence.","timestamp":1776356544475,"segment":23,"confidence":3.346252400823205,"iterationTokens":749,"asi":{"hypothesis":"Current branch may be stabilized in upper-70s/low-80s degraded band.","rollback_reason":"Below keep and second consecutive sub-80 sample.","next_action_hint":"Run control parity spot-check now to verify shared low-band attribution.","backend":"mirror_sd_mlx","context_only_draft_cache":1,"draft_sink":48,"async_draft_eval":1,"fused_draft_verify_eval":1,"paired_prev_tok_s":77.18415252166972,"paired_delta_tok_s":0.5429530777520712,"delta_vs_keep":-31.135226895052725,"sub80_persists":true}}
{"run":1502,"commit":"b304c02","metric":81.00317874787159,"metrics":{},"status":"discard","description":"Control parity check (`DFLASH_MIRROR_SD_RUNTIME=0`) measured ~81.00, confirming shared degraded sub-100 band.","timestamp":1776356579628,"segment":23,"confidence":3.3433111904943633,"iterationTokens":823,"asi":{"hypothesis":"Sub-80/low-80 mirror readings are regime-shared and not mirror-specific regression.","rollback_reason":"Control non-authoritative and below keep.","next_action_hint":"Restore mirror lane and keep recovery tracking toward 90+/100+.","backend":"bstnxbt_mlx","mirror_runtime_enabled":0,"context_only_draft_cache":1,"draft_sink":48,"async_draft_eval":1,"fused_draft_verify_eval":1,"paired_mirror_tok_s":77.72710559942179,"paired_delta_tok_s":-3.2760731484498,"authoritative_lane":"mirror_sd_mlx","shared_low_band_confirmed":true}}
{"run":1503,"commit":"b304c02","metric":91.26381477833756,"metrics":{},"status":"discard","description":"Mirror anchor after parity rebounded to ~91.26, exiting the sub-80/low-80 pocket.","timestamp":1776356625441,"segment":23,"confidence":3.3344575263991536,"iterationTokens":1118,"asi":{"hypothesis":"Shared degraded band can rebound rapidly into low-90s once trough releases.","rollback_reason":"Below keep/high-window.","next_action_hint":"Continue mirror scans for 100+ transition.","backend":"mirror_sd_mlx","context_only_draft_cache":1,"draft_sink":48,"async_draft_eval":1,"fused_draft_verify_eval":1,"warmup_s":2.1610729170497507,"paired_control_tok_s":81.00317874787159,"paired_delta_tok_s":10.260636030465973,"delta_vs_keep":-17.598517716137383,"recovery_stage":"81->91"}}
{"run":1504,"commit":"b304c02","metric":95.70283671333884,"metrics":{},"status":"discard","description":"Mirror rose to ~95.70, approaching familiar mid-recovery threshold.","timestamp":1776356653747,"segment":23,"confidence":3.3294412623509166,"iterationTokens":720,"asi":{"hypothesis":"Recovery is advancing through low-90s toward 100+ re-entry.","rollback_reason":"Below keep.","next_action_hint":"Continue mirror runs for 100+ breakout.","backend":"mirror_sd_mlx","context_only_draft_cache":1,"draft_sink":48,"async_draft_eval":1,"fused_draft_verify_eval":1,"paired_prev_tok_s":91.26381477833756,"paired_delta_tok_s":4.439021935001282,"delta_vs_keep":-13.159495781136105,"recovery_stage":"91->95.7"}}
{"run":1505,"commit":"b304c02","metric":80.40034188198675,"metrics":{},"status":"discard","description":"Mirror dropped back to ~80.40 after nearing 96, reinforcing oscillatory recovery behavior.","timestamp":1776356687296,"segment":23,"confidence":3.326018552652518,"iterationTokens":678,"asi":{"hypothesis":"Recovery remains highly non-monotonic with rapid retraces to low-80s.","rollback_reason":"Below keep/high-window.","next_action_hint":"Continue mirror follow-ups; parity check if low-80/sub-80 cluster persists.","backend":"mirror_sd_mlx","context_only_draft_cache":1,"draft_sink":48,"async_draft_eval":1,"fused_draft_verify_eval":1,"warmup_s":2.105778875062242,"paired_prev_tok_s":95.70283671333884,"paired_delta_tok_s":-15.30249483135209,"delta_vs_keep":-28.46199061248819,"oscillatory_recovery":true}}
{"run":1506,"commit":"b304c02","metric":96.2337103290378,"metrics":{},"status":"discard","description":"Mirror rebounded to ~96.23, returning to mid-recovery plateau after low-80 retrace.","timestamp":1776356715696,"segment":23,"confidence":3.3200108544537095,"iterationTokens":750,"asi":{"hypothesis":"Current regime is alternating between low-80 and mid-90 plateaus before higher breakout.","rollback_reason":"Below keep.","next_action_hint":"Continue mirror scans for 100+ transition.","backend":"mirror_sd_mlx","context_only_draft_cache":1,"draft_sink":48,"async_draft_eval":1,"fused_draft_verify_eval":1,"warmup_s":2.1175123329740018,"paired_prev_tok_s":80.40034188198675,"paired_delta_tok_s":15.83336844705106,"delta_vs_keep":-12.628622165437138,"oscillatory_recovery":true}}
{"run":1507,"commit":"b304c02","metric":91.94100262022748,"metrics":{},"status":"discard","description":"Mirror eased to ~91.94, staying within broad 80s–90s oscillation envelope.","timestamp":1776356745956,"segment":23,"confidence":3.315388970497637,"iterationTokens":720,"asi":{"hypothesis":"Recovery remains range-bound and noisy, lacking sustained directional trend.","rollback_reason":"Below keep.","next_action_hint":"Continue mirror tracking; hold parity checks unless drift deepens.","backend":"mirror_sd_mlx","context_only_draft_cache":1,"draft_sink":48,"async_draft_eval":1,"fused_draft_verify_eval":1,"warmup_s":2.1278154579922557,"paired_prev_tok_s":96.2337103290378,"paired_delta_tok_s":-4.292707708810314,"delta_vs_keep":-16.92132987424745,"oscillatory_recovery":true}}
{"run":1508,"commit":"b304c02","metric":97.30455571658291,"metrics":{},"status":"discard","description":"Mirror climbed to ~97.30, revisiting upper-mid recovery range.","timestamp":1776356774646,"segment":23,"confidence":3.310779937170782,"iterationTokens":713,"asi":{"hypothesis":"Range persists but upper edge is currently near high-90s.","rollback_reason":"Below keep/high-window.","next_action_hint":"Continue mirror scans for 100+ breakout.","backend":"mirror_sd_mlx","context_only_draft_cache":1,"draft_sink":48,"async_draft_eval":1,"fused_draft_verify_eval":1,"paired_prev_tok_s":91.94100262022748,"paired_delta_tok_s":5.363553096355429,"delta_vs_keep":-11.55777677789203,"recovery_stage":"92->97"}}
{"run":1509,"commit":"b304c02","metric":96.25089750971154,"metrics":{},"status":"discard","description":"Mirror settled near ~96.25, holding the current upper-mid recovery plateau.","timestamp":1776356809138,"segment":23,"confidence":3.3079362094456797,"iterationTokens":674,"asi":{"hypothesis":"Local center remains around mid/high-90s until next regime shift.","rollback_reason":"Below keep.","next_action_hint":"Continue mirror-only sampling.","backend":"mirror_sd_mlx","context_only_draft_cache":1,"draft_sink":48,"async_draft_eval":1,"fused_draft_verify_eval":1,"paired_prev_tok_s":97.30455571658291,"paired_delta_tok_s":-1.0536582068713665,"delta_vs_keep":-12.611434984763404,"recovery_stage":"~96-97 plateau"}}
{"run":1510,"commit":"b304c02","metric":98.29591457083681,"metrics":{},"status":"discard","description":"Mirror ticked up to ~98.30, near current upper edge of recovery band.","timestamp":1776356838689,"segment":23,"confidence":3.3050973626534725,"iterationTokens":663,"asi":{"hypothesis":"Upper bound may be inching toward 100 but still within oscillatory regime.","rollback_reason":"Below keep.","next_action_hint":"Continue mirror scans for clean 100+ re-entry.","backend":"mirror_sd_mlx","context_only_draft_cache":1,"draft_sink":48,"async_draft_eval":1,"fused_draft_verify_eval":1,"paired_prev_tok_s":96.25089750971154,"paired_delta_tok_s":2.0450170611252645,"delta_vs_keep":-10.566417923638134,"recovery_stage":"96->98"}}
