{"run":2199,"commit":"a0f1200","metric":11.435175664606504,"metrics":{},"status":"discard","description":"Robustness batch sample 07/30: continued rebound (~77.71 tok/s, eval_s ~11.44) with late safe-mode activation at step 72.","timestamp":1776403418234,"segment":24,"confidence":0.040563221650404366,"iterationTokens":1511,"asi":{"hypothesis":"Recovery stage should show shrinking collapse depth and later watchdog activation before returning to idle.","rollback_reason":"Primary metric still above best floor.","next_action_hint":"Continue mirror batch to capture full recovery back to sub-9 shelf.","diagnostic_findings":{"completion_tok_s":77.71197209184191,"dflash_eval_s":11.435175664606504,"safe_mode_active":1,"safe_mode_activations":1,"safe_mode_step":72,"spike_events":5,"severe_spike_events":5}}}
{"run":2200,"commit":"a0f1200","metric":14.208879699581303,"metrics":{},"status":"discard","description":"Robustness batch sample 08/30: entered non-spike inflation shelf (~68.34 tok/s, eval_s ~14.21) with watchdog idle (no activation).","timestamp":1776403452053,"segment":24,"confidence":0.04051300427318048,"iterationTokens":1476,"asi":{"hypothesis":"After collapse rebound, runtime can settle into slow non-spike inflation mode even without watchdog triggers.","rollback_reason":"Primary metric remains far above best floor.","next_action_hint":"Continue mirror batch to measure inflation-shelf persistence and eventual return.","diagnostic_findings":{"completion_tok_s":68.33615143483982,"dflash_eval_s":14.208879699581303,"safe_mode_active":0,"safe_mode_activations":0,"safe_mode_step":-1,"spike_events":0,"severe_spike_events":0}}}
{"run":2201,"commit":"a0f1200","metric":13.035387630108744,"metrics":{},"status":"discard","description":"Robustness batch sample 09/30: non-spike inflation improved (~74.23 tok/s, eval_s ~13.04) with watchdog idle.","timestamp":1776403483844,"segment":24,"confidence":0.04005113675525872,"iterationTokens":1525,"asi":{"hypothesis":"Inflation shelf may decay gradually toward healthy band without additional spike events.","rollback_reason":"Primary metric remains above best floor.","next_action_hint":"Continue mirror batch to track recovery slope.","diagnostic_findings":{"completion_tok_s":74.23030863033942,"dflash_eval_s":13.035387630108744,"safe_mode_active":0,"safe_mode_activations":0,"spike_events":0}}}
{"run":2202,"commit":"a0f1200","metric":12.17852554784622,"metrics":{},"status":"discard","description":"Robustness batch sample 10/30: continued non-spike recovery (~79.26 tok/s, eval_s ~12.18), watchdog idle.","timestamp":1776403513184,"segment":24,"confidence":0.03968964728370983,"iterationTokens":1441,"asi":{"hypothesis":"Post-collapse inflation shelf continues improving without new spike-triggered safe mode.","rollback_reason":"Primary metric remains above best floor.","next_action_hint":"Continue mirror batch.","diagnostic_findings":{"completion_tok_s":79.25998957222559,"dflash_eval_s":12.17852554784622,"safe_mode_active":0,"safe_mode_activations":0,"spike_events":0}}}
{"run":2203,"commit":"a0f1200","metric":11.390023285523057,"metrics":{},"status":"discard","description":"Robustness batch sample 11/30: inflation shelf kept recovering (~84.50 tok/s, eval_s ~11.39), watchdog idle.","timestamp":1776403541436,"segment":24,"confidence":0.03949981933224527,"iterationTokens":1437,"asi":{"hypothesis":"Recovered path should climb gradually from inflation shelf back toward high-soft stable band.","rollback_reason":"Primary metric remains above best floor.","next_action_hint":"Continue mirror batch.","diagnostic_findings":{"completion_tok_s":84.49569232873918,"dflash_eval_s":11.390023285523057,"safe_mode_active":0,"safe_mode_activations":0,"spike_events":0}}}
{"run":2204,"commit":"a0f1200","metric":10.959358208696358,"metrics":{},"status":"discard","description":"Robustness batch sample 12/30: continued recovery (~87.69 tok/s, eval_s ~10.96), watchdog idle and no spikes.","timestamp":1776403568259,"segment":24,"confidence":0.03931179855858056,"iterationTokens":1431,"asi":{"hypothesis":"Inflation regime continues converging back toward pre-collapse high-soft levels.","rollback_reason":"Primary metric remains above best floor.","next_action_hint":"Continue mirror batch.","diagnostic_findings":{"completion_tok_s":87.68759703345336,"dflash_eval_s":10.959358208696358,"safe_mode_active":0,"safe_mode_activations":0,"spike_events":0}}}
{"run":2205,"commit":"a0f1200","metric":10.926307247951627,"metrics":{},"status":"discard","description":"Robustness batch sample 13/30: repeat around ~10.93 eval_s (~87.84 tok/s), watchdog idle and spike-free.","timestamp":1776403596446,"segment":24,"confidence":0.039247293476410317,"iterationTokens":1432,"asi":{"hypothesis":"Recovery plateau is stabilizing around ~10.9 eval_s before further descent.","rollback_reason":"Primary metric remains above best floor.","next_action_hint":"Continue mirror batch.","diagnostic_findings":{"completion_tok_s":87.83657632784946,"dflash_eval_s":10.926307247951627,"safe_mode_active":0,"safe_mode_activations":0,"spike_events":0}}}
{"run":2206,"commit":"a0f1200","metric":10.408602755051106,"metrics":{},"status":"discard","description":"Robustness batch sample 14/30: recovery continued (~92.12 tok/s, eval_s ~10.41), watchdog idle and spike-free.","timestamp":1776403629534,"segment":24,"confidence":0.03919039428009728,"iterationTokens":1434,"asi":{"hypothesis":"Inflation shelf is decaying toward the earlier ~9–10 high-soft region without new transition spikes.","rollback_reason":"Primary metric remains above best floor.","next_action_hint":"Continue mirror batch.","diagnostic_findings":{"completion_tok_s":92.12015665377002,"dflash_eval_s":10.408602755051106,"safe_mode_active":0,"safe_mode_activations":0,"spike_events":0}}}
{"run":2207,"commit":"a0f1200","metric":10.145200163242407,"metrics":{},"status":"discard","description":"Robustness batch sample 15/30: recovery reached ~10.15 eval_s (~94.31 tok/s), watchdog idle and no spikes.","timestamp":1776403663253,"segment":24,"confidence":0.039261890105658365,"iterationTokens":1444,"asi":{"hypothesis":"Recovery should continue marching toward the usual sub-9 high-soft shelf.","rollback_reason":"Primary metric remains above best floor.","next_action_hint":"Continue mirror batch.","diagnostic_findings":{"completion_tok_s":94.30717769322794,"dflash_eval_s":10.145200163242407,"safe_mode_active":0,"safe_mode_activations":0,"spike_events":0}}}
{"run":2208,"commit":"a0f1200","metric":9.770756661659107,"metrics":{},"status":"discard","description":"Robustness batch sample 16/30: recovery re-entered high-soft range (~97.74 tok/s, eval_s ~9.77), watchdog idle.","timestamp":1776403689058,"segment":24,"confidence":0.03934109879037777,"iterationTokens":1441,"asi":{"hypothesis":"Post-collapse recovery should pass through ~9.7–10.0 before returning to sub-9 shelf.","rollback_reason":"Primary metric remains above best floor.","next_action_hint":"Continue mirror batch.","diagnostic_findings":{"completion_tok_s":97.74170526508385,"dflash_eval_s":9.770756661659107,"safe_mode_active":0,"safe_mode_activations":0,"spike_events":0}}}
{"run":2209,"commit":"a0f1200","metric":9.67778508074116,"metrics":{},"status":"discard","description":"Robustness batch sample 17/30: high-soft recovery strengthened (~98.56 tok/s, eval_s ~9.68), watchdog idle.","timestamp":1776403715735,"segment":24,"confidence":0.039773044557493205,"iterationTokens":1451,"asi":{"hypothesis":"Recovered path should continue drifting from ~9.7 toward low-9/sub-9 cluster.","rollback_reason":"Primary metric remains above best floor.","next_action_hint":"Continue mirror batch.","diagnostic_findings":{"completion_tok_s":98.56130809378352,"dflash_eval_s":9.67778508074116,"safe_mode_active":0,"safe_mode_activations":0,"spike_events":0}}}
{"run":2210,"commit":"a0f1200","metric":9.502451788866892,"metrics":{},"status":"discard","description":"Robustness batch sample 18/30: recovery reached ~9.50 eval_s (~100.32 tok/s), watchdog idle and spike-free.","timestamp":1776403746565,"segment":24,"confidence":0.03995935898111844,"iterationTokens":1443,"asi":{"hypothesis":"Rebound should cross into prior high-soft shelf around ~9.5 then approach sub-9 cluster.","rollback_reason":"Primary metric remains above best floor.","next_action_hint":"Continue mirror batch.","diagnostic_findings":{"completion_tok_s":100.32324364654691,"dflash_eval_s":9.502451788866892,"safe_mode_active":0,"safe_mode_activations":0,"spike_events":0}}}
{"run":2211,"commit":"a0f1200","metric":9.413460040697828,"metrics":{},"status":"discard","description":"Robustness batch sample 19/30: further recovery (~101.22 tok/s, eval_s ~9.41) with watchdog idle and no spikes.","timestamp":1776403772751,"segment":24,"confidence":0.04015426509958905,"iterationTokens":1440,"asi":{"hypothesis":"Recovered lane continues descending toward the familiar sub-9 shelf.","rollback_reason":"Primary metric remains above best floor.","next_action_hint":"Continue mirror batch.","diagnostic_findings":{"completion_tok_s":101.22473109954497,"dflash_eval_s":9.413460040697828,"safe_mode_active":0,"safe_mode_activations":0,"spike_events":0}}}
{"run":2212,"commit":"a0f1200","metric":9.447088747285306,"metrics":{},"status":"discard","description":"Robustness batch sample 20/30: stable high-soft sample (~100.87 tok/s, eval_s ~9.45), watchdog idle and spike-free.","timestamp":1776403801400,"segment":24,"confidence":0.04059667988061264,"iterationTokens":1431,"asi":{"hypothesis":"After rebound, runs should cluster in high-soft before sub-9 re-entry.","rollback_reason":"Primary metric remains above best floor.","next_action_hint":"Continue mirror batch.","diagnostic_findings":{"completion_tok_s":100.86738812318522,"dflash_eval_s":9.447088747285306,"safe_mode_active":0,"safe_mode_activations":0,"spike_events":0}}}
{"run":2213,"commit":"a0f1200","metric":9.31846017879434,"metrics":{},"status":"discard","description":"Robustness batch sample 21/30: high-soft improved (~102.14 tok/s, eval_s ~9.32), watchdog idle and no spikes.","timestamp":1776403829974,"segment":24,"confidence":0.04087807099842722,"iterationTokens":1454,"asi":{"hypothesis":"Recovered trajectory continues approaching low-9/sub-9 range without transition edges.","rollback_reason":"Primary metric remains above best floor.","next_action_hint":"Continue mirror batch.","diagnostic_findings":{"completion_tok_s":102.14390692161628,"dflash_eval_s":9.31846017879434,"safe_mode_active":0,"safe_mode_activations":0,"spike_events":0}}}
{"run":2214,"commit":"a0f1200","metric":9.378254866926,"metrics":{},"status":"discard","description":"Robustness batch sample 22/30: steady high-soft repeat (~101.50 tok/s, eval_s ~9.38), watchdog idle and spike-free.","timestamp":1776403856814,"segment":24,"confidence":0.04116339020226647,"iterationTokens":1441,"asi":{"hypothesis":"Recovered state is now in stable high-soft cluster post-collapse.","rollback_reason":"Primary metric remains above best floor.","next_action_hint":"Continue mirror batch.","diagnostic_findings":{"completion_tok_s":101.50176562645424,"dflash_eval_s":9.378254866926,"safe_mode_active":0,"safe_mode_activations":0,"spike_events":0}}}
{"run":2215,"commit":"a0f1200","metric":9.284894544631243,"metrics":{},"status":"discard","description":"Robustness batch sample 23/30: low-end high-soft sample (~102.49 tok/s, eval_s ~9.28), watchdog idle and no spikes.","timestamp":1776403883204,"segment":24,"confidence":0.04141181466779398,"iterationTokens":1431,"asi":{"hypothesis":"Recovered cluster continues tightening toward the sub-9 shelf.","rollback_reason":"Primary metric remains above best floor.","next_action_hint":"Continue mirror batch.","diagnostic_findings":{"completion_tok_s":102.49366853265087,"dflash_eval_s":9.284894544631243,"safe_mode_active":0,"safe_mode_activations":0,"spike_events":0}}}
{"run":2216,"commit":"a0f1200","metric":9.30053938133642,"metrics":{},"status":"discard","description":"Robustness batch sample 24/30: near-identical low high-soft repeat (~102.40 tok/s, eval_s ~9.30), watchdog idle.","timestamp":1776403912693,"segment":24,"confidence":0.04161245580359826,"iterationTokens":1435,"asi":{"hypothesis":"Post-collapse recovered regime is now stable with low variance in low-9 band.","rollback_reason":"Primary metric remains above best floor.","next_action_hint":"Continue mirror batch for sub-9 re-entry evidence.","diagnostic_findings":{"completion_tok_s":102.40282161738754,"dflash_eval_s":9.30053938133642,"safe_mode_active":0,"safe_mode_activations":0,"spike_events":0}}}
{"run":2217,"commit":"a0f1200","metric":9.245789754204452,"metrics":{},"status":"discard","description":"Robustness batch sample 25/30: low-9 high-soft sample (~102.91 tok/s, eval_s ~9.25), watchdog idle and spike-free.","timestamp":1776403941999,"segment":24,"confidence":0.04180089737130647,"iterationTokens":1499,"asi":{"hypothesis":"Recovered regime is approaching the prior sub-9 cluster boundary.","rollback_reason":"Primary metric remains above best floor.","next_action_hint":"Continue mirror batch.","diagnostic_findings":{"completion_tok_s":102.90537602042113,"dflash_eval_s":9.245789754204452,"safe_mode_active":0,"safe_mode_activations":0,"spike_events":0}}}
{"run":2218,"commit":"a0f1200","metric":9.251040167058818,"metrics":{},"status":"discard","description":"Robustness batch sample 26/30: repeated low-9 sample (~102.81 tok/s, eval_s ~9.25), watchdog idle and no spikes.","timestamp":1776403973060,"segment":24,"confidence":0.04171657644449287,"iterationTokens":1439,"asi":{"hypothesis":"Low-9 post-recovery cluster is stable across repeated honest runs.","rollback_reason":"Primary metric remains above best floor.","next_action_hint":"Continue mirror batch.","diagnostic_findings":{"completion_tok_s":102.80657515730549,"dflash_eval_s":9.251040167058818,"safe_mode_active":0,"safe_mode_activations":0,"spike_events":0,"warmup_s":5.561759000062011}}}
{"run":2219,"commit":"a0f1200","metric":9.090200954582542,"metrics":{},"status":"discard","description":"Robustness batch sample 27/30: recovered near pre-collapse high-soft edge (~104.54 tok/s, eval_s ~9.09), watchdog idle.","timestamp":1776404004029,"segment":24,"confidence":0.04183078245631113,"iterationTokens":1448,"asi":{"hypothesis":"Recovered state is rejoining the usual ~9.0 band after the collapse cycle.","rollback_reason":"Primary metric remains above best floor.","next_action_hint":"Continue mirror batch for sub-9 confirmation attempts.","diagnostic_findings":{"completion_tok_s":104.54004002671272,"dflash_eval_s":9.090200954582542,"safe_mode_active":0,"safe_mode_activations":0,"spike_events":0}}}
{"run":2220,"commit":"a0f1200","metric":9.013663543388247,"metrics":{},"status":"discard","description":"Robustness batch sample 28/30: near-sub-9 high-soft sample (~105.45 tok/s, eval_s ~9.01), watchdog idle and spike-free.","timestamp":1776404030179,"segment":24,"confidence":0.0420578617880366,"iterationTokens":1467,"asi":{"hypothesis":"Recovered regime should settle near prior ~9.0 shelf after collapse/rebound cycle.","rollback_reason":"Primary metric remains above best floor.","next_action_hint":"Continue final robustness samples.","diagnostic_findings":{"completion_tok_s":105.44974185865152,"dflash_eval_s":9.013663543388247,"safe_mode_active":0,"safe_mode_activations":0,"spike_events":0}}}
{"run":2221,"commit":"a0f1200","metric":8.953416925272904,"metrics":{},"status":"discard","description":"Robustness batch sample 29/30: returned to sub-9 shelf (~106.02 tok/s, eval_s ~8.95), watchdog idle and no spikes.","timestamp":1776404064365,"segment":24,"confidence":0.042266842083286384,"iterationTokens":1450,"asi":{"hypothesis":"Recovery cycle is converging back to the familiar stable sub-9 regime.","rollback_reason":"Primary metric remains above best floor.","next_action_hint":"Run final sample to close 30-run batch.","diagnostic_findings":{"completion_tok_s":106.02132443933735,"dflash_eval_s":8.953416925272904,"safe_mode_active":0,"safe_mode_activations":0,"spike_events":0}}}
{"run":2222,"commit":"a0f1200","metric":8.793466667993926,"metrics":{},"status":"discard","description":"Robustness batch sample 30/30: batch ended near best boundary (~107.95 tok/s, eval_s ~8.793), watchdog idle and spike-free.","timestamp":1776404111225,"segment":24,"confidence":0.04204397431793244,"iterationTokens":1457,"asi":{"hypothesis":"After collapse/rebound cycle, lane can return to near-best sub-9 floor under unchanged settings.","rollback_reason":"Primary metric remains fractionally above best floor.","next_action_hint":"Compute 30-run robustness stats and decide next optimization step from evidence.","diagnostic_findings":{"completion_tok_s":107.94618645905894,"dflash_eval_s":8.793466667993926,"safe_mode_active":0,"safe_mode_activations":0,"spike_events":0}}}
{"run":2223,"commit":"d87d640","metric":8.769431082182564,"metrics":{},"status":"keep","description":"Add root-cause telemetry pack (cache-restore cost, split-path hit-rate, MX memory pressure proxies, async-drain/safe-sync timing); first honest run improved to ~108.17 tok/s (eval_s ~8.769).","timestamp":1776436012407,"segment":24,"confidence":0.0422913511014295,"iterationTokens":53592,"asi":{"hypothesis":"Instrumentation can expose shared collapse drivers (memory pressure, split-path behavior, rollback/trim cost, queue-drain timing) without harming hot-path throughput.","learning":"New telemetry now surfaces cache restore/trim overhead, split SDPA usage rates, and MX active/cache/peak memory. First run stayed watchdog-idle and achieved a new local best sample.","next_action_hint":"Run a fixed mirror robustness batch and compare collapse frequency/tail metrics with prior baseline."}}
{"run":2224,"commit":"e5a3761","metric":8.757898171315901,"metrics":{},"status":"keep","description":"Telemetry robustness batch v2 sample 01/30: new low-tail best (~108.27 tok/s, eval_s ~8.758) with watchdog idle; root-cause telemetry active.","timestamp":1776436051875,"segment":24,"confidence":0.04260987052832329,"iterationTokens":2822,"asi":{"hypothesis":"Added telemetry should preserve performance while exposing runtime pressure signals in the same honest lane.","learning":"Sample stayed in healthy regime with split-path hit-rate ~5.2%, stable cache-restore cost (~0.022s), and peak MX memory ~17.5% of recommended working set.","next_action_hint":"Continue fixed 30-run batch; trigger control parity only on fresh collapse transition."}}
{"run":2225,"commit":"e5a3761","metric":8.781425370951183,"metrics":{},"status":"discard","description":"Telemetry robustness batch v2 sample 02/30: near-best repeat (~107.95 tok/s, eval_s ~8.781), watchdog idle and spike-free.","timestamp":1776436081815,"segment":24,"confidence":0.04287202775732613,"iterationTokens":2188,"asi":{"hypothesis":"Root-cause telemetry remains low-overhead in healthy sub-9 regime.","rollback_reason":"Primary metric above current best floor.","next_action_hint":"Continue fixed batch and watch for transition edges.","diagnostic_findings":{"completion_tok_s":107.9534307987524,"dflash_eval_s":8.781425370951183,"safe_mode_active":0,"spike_events":0,"split_path_hit_rate":0.052083333333333336,"mx_peak_over_recommended_ratio":0.17537298070300922}}}
{"run":2226,"commit":"79733ef","metric":8.73918833071366,"metrics":{},"status":"keep","description":"Telemetry robustness batch v2 sample 03/30: new best low-tail run (~108.39 tok/s, eval_s ~8.739) with watchdog idle and full root telemetry.","timestamp":1776436111403,"segment":24,"confidence":0.043162187759705394,"iterationTokens":2182,"asi":{"hypothesis":"Telemetry instrumentation can remain transparent in healthy windows while enabling collapse root-cause attribution.","learning":"Another healthy low-tail sample improved best eval_s; split usage and cache/memory telemetry stayed stable versus prior runs.","next_action_hint":"Continue fixed batch and capture collapse transition if it appears."}}
{"run":2227,"commit":"79733ef","metric":8.764684705878608,"metrics":{},"status":"discard","description":"Telemetry robustness batch v2 sample 04/30: stable high run (~108.16 tok/s, eval_s ~8.765), watchdog idle and spike-free.","timestamp":1776436140281,"segment":24,"confidence":0.043254492029767395,"iterationTokens":2247,"asi":{"hypothesis":"Healthy-window telemetry should remain consistent while preserving top-end throughput.","rollback_reason":"Primary metric above current best floor.","next_action_hint":"Continue fixed batch and detect any new collapse transition.","diagnostic_findings":{"completion_tok_s":108.15891418143369,"dflash_eval_s":8.764684705878608,"safe_mode_active":0,"spike_events":0,"cache_restore_s":0.021694291033782065,"split_path_hit_rate":0.052083333333333336}}}
{"run":2228,"commit":"79733ef","metric":8.776300128316507,"metrics":{},"status":"discard","description":"Telemetry robustness batch v2 sample 05/30: near-best repeat (~108.03 tok/s, eval_s ~8.776), watchdog idle and no spikes.","timestamp":1776436166416,"segment":24,"confidence":0.04334719193954706,"iterationTokens":2083,"asi":{"hypothesis":"Healthy regime should keep root-cause telemetry stable run-to-run.","rollback_reason":"Primary metric above current best floor.","next_action_hint":"Continue fixed batch.","diagnostic_findings":{"completion_tok_s":108.02884428178439,"dflash_eval_s":8.776300128316507,"safe_mode_active":0,"spike_events":0,"cache_restore_s":0.021349671646021307,"split_path_hit_rate":0.052083333333333336}}}
