{"run":393,"commit":"f3c13d0","metric":106.9359619620743,"metrics":{},"status":"keep","description":"Productize fast-launch defaults/UI visibility: DFlash streaming now respects thinking_budget, streamed deltas strip leaked special tokens before chat history reuse, chat UI surfaces DFlash/fallback state and warns on reasoning-only turns, and fast launcher rotates to a fresh cache generation to avoid poisoned speculative cache state.","timestamp":1776264918709,"segment":21,"confidence":60.97972415389232,"iterationTokens":98437}
{"run":394,"commit":"f3c13d0","metric":106.78635729876244,"metrics":{},"status":"discard","description":"Retest the old authoritative-lane stabilizer `INITIAL_CACHE_BLOCKS=256` on top of the current kept fast-path/UI-visibility bundle. It stayed close to the integrated baseline but did not improve the primary metric (~106.79 vs ~106.94 current state), so the earlier cache-reservation recovery does not transfer as a win on the current tree.","timestamp":1776265007276,"segment":21,"confidence":52.57871106598696,"iterationTokens":15977}
{"run":395,"commit":"f3c13d0","metric":106.79439443132576,"metrics":{},"status":"discard","description":"Re-test explicit request-level `dflash=true` (`BENCHMARK_DFLASH=1`) on top of the current integrated fast-path/UI-authority lane. It remained essentially flat and slightly below the kept baseline (~106.79 vs ~106.94), so explicit request forcing is still not a beneficial lever on the current tree.","timestamp":1776265042385,"segment":21,"confidence":34.47043401289385,"iterationTokens":901}
{"run":396,"commit":"f3c13d0","metric":105.84017570676117,"metrics":{},"status":"discard","description":"Re-test the broader normal-request authoritative lane with settings-driven thinking only (`ENABLE_THINKING=0`, `SETTINGS_ENABLE_THINKING=1`) on top of the current kept fast-path/UI bundle. It remained meaningfully below the integrated baseline (~105.84 vs ~106.94), so request-driven thinking is still the better current authority shape.","timestamp":1776265095229,"segment":21,"confidence":23.821857562268917,"iterationTokens":1457}
{"run":397,"commit":"f3c13d0","metric":29.086466827995828,"metrics":{},"status":"discard","description":"Mirror SD phase-1 backend (env-gated mirror_sd_mlx target split loop) wired into DFlash runtime and batched engine; authoritative 1024 Qwen server benchmark regressed badly versus bstnxbt baseline.","timestamp":1776268070596,"segment":21,"confidence":23.303922507896544,"iterationTokens":67747,"asi":{"hypothesis":"A pure-MLX Mirror-SD-style prefix/suffix target split backend can improve throughput over current bstnxbt on the authoritative 1024-token lane.","rollback_reason":"Primary metric dropped to 29.09 tok/s (far below ~106.9 tok/s baseline), so candidate is not viable.","next_action_hint":"Keep env-gated mirror scaffolding only in tests/design; before reattempting benchmark path, align mirror runtime with bstnxbt target-cache semantics and verify split hook reuse instead of naive full verify pass.","observed_backend":"mirror_sd_mlx","request_shape":"authoritative normal-EOS thinking 1024, warmed server path"}}
{"run":398,"commit":"e007cc1","metric":104.20036832652238,"metrics":{},"status":"keep","description":"Mirror SD phase-1 reimplementation: mirror_sd_mlx backend now reuses bstnxbt speculative loop with Mirror-style target prefix/suffix split mode (env-gated), plus runtime/engine/backend selection wiring and tests. First honest server-path mirror baseline: 104.20 tok/s.","timestamp":1776268616419,"segment":21,"confidence":22.808030099882984,"iterationTokens":47254,"asi":{"hypothesis":"A low-overhead Mirror-SD target split integrated into the existing bstnxbt DFlash loop can preserve near-baseline throughput while enabling further Mirror-specific tuning.","comparison_to_bstnxbt_baseline":"slower than current ~106.94 authoritative keep, but establishes a working mirror backend baseline for iterative tuning","backend":"mirror_sd_mlx","target_forward_mode":"mirror_sd_split"}}
{"type":"config","name":"Mirror SD + DFlash authoritative Qwen 1024 tuning","metricName":"completion_tok_s","metricUnit":"","bestDirection":"higher"}
{"run":399,"commit":"024f28a","metric":104.43144972671712,"metrics":{},"status":"keep","description":"Reinitialized experiment target to Mirror SD + DFlash authoritative Qwen 1024 lane and established clean mirror_sd_mlx baseline.","timestamp":1776268674543,"segment":22,"confidence":null,"iterationTokens":145,"asi":{"hypothesis":"Need a clean baseline under the new mirror-focused experiment config before tuning.","backend":"mirror_sd_mlx","phase":"baseline_reanchor"}}
{"run":400,"commit":"024f28a","metric":104.26489140871126,"metrics":{},"status":"discard","description":"Mirror split micro-optimization: pre-resolved mirror exit layer in bstnxbt loop (avoids per-cycle env lookup) for mirror_sd_mlx path.","timestamp":1776268765198,"segment":22,"confidence":null,"iterationTokens":3857,"asi":{"hypothesis":"Caching mirror split exit-layer resolution once per request will remove Python overhead and improve mirror_sd_mlx throughput.","rollback_reason":"Primary metric regressed slightly (104.26 tok/s vs 104.43 baseline).","next_action_hint":"Try algorithmic mirror knobs (split position and split disable A/B) instead of micro-overhead trims.","backend":"mirror_sd_mlx"}}
{"run":401,"commit":"f807b10","metric":104.88735019520539,"metrics":{},"status":"keep","description":"Mirror backend tuning: set DFLASH_MIRROR_SD_EXIT_LAYER=15 to split target forward near mid-stack instead of default capture-max split.","timestamp":1776268804948,"segment":22,"confidence":2.7371822311044296,"iterationTokens":1009,"asi":{"hypothesis":"A middle-layer mirror split point can reduce overhead versus near-tail splitting and improve mirror_sd_mlx throughput.","backend":"mirror_sd_mlx","mirror_exit_layer":15}}
{"run":402,"commit":"f807b10","metric":22.44454402379903,"metrics":{},"status":"discard","description":"Mirror split tuning: DFLASH_MIRROR_SD_EXIT_LAYER=22 (deeper split point).","timestamp":1776268884869,"segment":22,"confidence":1.4648374426716273,"iterationTokens":826,"asi":{"hypothesis":"A deeper mirror split near later captured layers might improve cache/mask locality for mirror_sd_mlx.","rollback_reason":"Catastrophic throughput collapse to 22.44 tok/s.","next_action_hint":"Avoid deep split points around 22+ on this lane; continue searching near middle/early split values around 12-18.","backend":"mirror_sd_mlx","mirror_exit_layer":22}}
{"run":403,"commit":"f807b10","metric":39.47571470608803,"metrics":{},"status":"discard","description":"Mirror split tuning: DFLASH_MIRROR_SD_EXIT_LAYER=8 (earlier split point).","timestamp":1776268959148,"segment":22,"confidence":0.7324187213358136,"iterationTokens":3473,"asi":{"hypothesis":"Moving the mirror split earlier could reduce deep-prefix overhead and improve mirror path throughput.","rollback_reason":"Major regression to 39.48 tok/s.","next_action_hint":"Do not use early split points near 8 on this workload; probe values close to 15 or test split-disable control.","backend":"mirror_sd_mlx","mirror_exit_layer":8}}
{"run":404,"commit":"f807b10","metric":46.88041958425317,"metrics":{},"status":"discard","description":"Mirror split tuning: DFLASH_MIRROR_SD_EXIT_LAYER=14 (one layer below current best).","timestamp":1776269004227,"segment":22,"confidence":0.015673822453558382,"iterationTokens":988,"asi":{"hypothesis":"A slight move from 15 to 14 could preserve mirror behavior while trimming overhead.","rollback_reason":"Severe cliff to 46.88 tok/s.","next_action_hint":"Treat mirror exit-layer tuning as sharply non-monotonic; keep 15 as anchor and test only very close/controlled variants (e.g., 16, split off).","backend":"mirror_sd_mlx","mirror_exit_layer":14}}
{"run":405,"commit":"f807b10","metric":67.11114931839735,"metrics":{},"status":"discard","description":"Mirror split tuning: DFLASH_MIRROR_SD_EXIT_LAYER=16 (one layer above current best).","timestamp":1776269038677,"segment":22,"confidence":0.01227064739212692,"iterationTokens":726,"asi":{"hypothesis":"Exit layer 16 may improve mirror split balance versus 15.","rollback_reason":"Throughput dropped heavily to 67.11 tok/s.","next_action_hint":"Keep exit layer pinned at 15; explore orthogonal mirror controls (split on/off A/B) rather than adjacent exit-layer shifts.","backend":"mirror_sd_mlx","mirror_exit_layer":16}}
{"run":406,"commit":"f807b10","metric":63.6115621263001,"metrics":{},"status":"discard","description":"Mirror runtime A/B: added DFLASH_MIRROR_SD_SPLIT=0 control to force mirror backend through default bstnxbt target-forward mode.","timestamp":1776269170102,"segment":22,"confidence":0.014073352732380306,"iterationTokens":4326,"asi":{"hypothesis":"Disabling mirror split while keeping mirror backend wiring should recover or exceed mirror-split baseline.","rollback_reason":"Regression to 63.61 tok/s on authoritative lane despite DFlash runtime path selection.","next_action_hint":"Revert split-disable branch; keep split-on path and focus on stable mirror split parameters or structural runtime gains.","backend":"mirror_sd_mlx","mirror_split_enabled":false}}
{"run":407,"commit":"f807b10","metric":76.14342335085068,"metrics":{},"status":"discard","description":"Mirror backend retune: DFLASH_BLOCK_TOKENS=14 with mirror exit layer pinned at 15.","timestamp":1776269209361,"segment":22,"confidence":0.01649695309243301,"iterationTokens":2227,"asi":{"hypothesis":"Mirror split path might prefer a smaller speculative block size than 15.","rollback_reason":"Throughput dropped to 76.14 tok/s.","next_action_hint":"Keep block tokens at 15 for mirror lane; test orthogonal knobs (cache reservation, split SDPA chunk) next.","backend":"mirror_sd_mlx","dflash_block_tokens":14}}
{"run":408,"commit":"f807b10","metric":69.08126352674385,"metrics":{},"status":"discard","description":"Mirror backend retune: DFLASH_BLOCK_TOKENS=16 with mirror exit layer 15.","timestamp":1776269247142,"segment":22,"confidence":0.018295927453208936,"iterationTokens":696,"asi":{"hypothesis":"Mirror split path may favor a slightly larger speculative block size.","rollback_reason":"Throughput regressed to 69.08 tok/s.","next_action_hint":"Block size is another sharp cliff in mirror lane; keep DFLASH_BLOCK_TOKENS=15.","backend":"mirror_sd_mlx","dflash_block_tokens":16}}
{"run":409,"commit":"f807b10","metric":77.06044503901015,"metrics":{},"status":"discard","description":"Mirror backend tuning: set INITIAL_CACHE_BLOCKS=256 on the authoritative mirror lane.","timestamp":1776269281406,"segment":22,"confidence":0.02053527648179665,"iterationTokens":769,"asi":{"hypothesis":"Larger initial cache reservation may stabilize mirror backend throughput as it did on prior bstnxbt slowdowns.","rollback_reason":"Regression to 77.06 tok/s.","next_action_hint":"Do not apply INITIAL_CACHE_BLOCKS uplift to mirror lane; keep cache reservation at default while tuning mirror-specific knobs.","backend":"mirror_sd_mlx","initial_cache_blocks":256}}
{"run":410,"commit":"f807b10","metric":78.28541535824716,"metrics":{},"status":"discard","description":"Mirror lane tuning: set DFLASH_BSTNXBT_SPLIT_CHUNK_SIZE=16 with mirror exit layer 15.","timestamp":1776269335228,"segment":22,"confidence":0.026251941292547633,"iterationTokens":1731,"asi":{"hypothesis":"Larger split-SDPA chunk size may better match mirror target split execution and improve 1024 throughput.","rollback_reason":"Regression to 78.29 tok/s.","next_action_hint":"Do not override split chunk size on the mirror 1024 lane; keep default chunking.","backend":"mirror_sd_mlx","split_chunk_size":16}}
{"run":411,"commit":"f807b10","metric":80.68846566585194,"metrics":{},"status":"discard","description":"Mirror baseline re-run (unchanged config) to check stability.","timestamp":1776269374727,"segment":22,"confidence":0.036379310329030246,"iterationTokens":867,"asi":{"hypothesis":"Unchanged mirror configuration should reproduce ~104.9 tok/s if path is stable.","rollback_reason":"Rerun collapsed to 80.69 tok/s without config/code changes, indicating major mirror-lane instability.","next_action_hint":"Prioritize stability diagnostics (cache/warmup/shape effects) before further tuning; do not trust single-run mirror wins.","backend":"mirror_sd_mlx","stability_probe":true}}
{"run":412,"commit":"f807b10","metric":83.80709811248938,"metrics":{},"status":"discard","description":"Mirror stability probe: increase warmup repeats via AR_WARMUP_REPEAT=2.","timestamp":1776269418072,"segment":22,"confidence":0.04055845253874711,"iterationTokens":1343,"asi":{"hypothesis":"Additional identical DFlash warmup may stabilize mirror backend and restore high-band throughput.","rollback_reason":"Still regressed at 83.81 tok/s.","next_action_hint":"Warmup repetition alone does not recover mirror instability; investigate runtime-state/cache interactions or deterministic startup isolation.","backend":"mirror_sd_mlx","ar_warmup_repeat":2}}
{"run":413,"commit":"f807b10","metric":88.65239176528827,"metrics":{},"status":"discard","description":"Mirror stability probe: isolate paged cache path with AR_CACHE_DIR=.omlx-autoresearch/cache-mirror-v2.","timestamp":1776269463066,"segment":22,"confidence":0.03932906864166072,"iterationTokens":1457,"asi":{"hypothesis":"Mirror instability may come from contaminated cache state; fresh cache directory should restore throughput.","rollback_reason":"Only partial recovery to 88.65 tok/s, still below mirror baseline.","next_action_hint":"Cache isolation alone is insufficient; inspect mirror split path semantics/acceptance rather than cache path rotation.","backend":"mirror_sd_mlx","cache_dir_isolated":true}}
{"run":414,"commit":"f807b10","metric":88.77244537125021,"metrics":{},"status":"discard","description":"Mirror baseline re-run (unchanged config) after cache isolation probe.","timestamp":1776269508013,"segment":22,"confidence":0.04129724614249574,"iterationTokens":710,"asi":{"hypothesis":"If mirror baseline is stable, rerun should return to ~104.9 tok/s.","rollback_reason":"Rerun remained in the ~88.8 tok/s regime, confirming sustained drift from initial mirror baseline.","next_action_hint":"Treat 104.9 as likely transient; re-anchor mirror baseline if this slower regime persists and focus on deterministic runtime-path profiling.","backend":"mirror_sd_mlx","stability_probe":true}}
{"run":415,"commit":"f807b10","metric":94.30372138935682,"metrics":{},"status":"discard","description":"Control probe: disabled mirror backend (DFLASH_MIRROR_SD_RUNTIME=0) to measure current bstnxbt lane under same harness/settings.","timestamp":1776269554938,"segment":22,"confidence":0.04079914214163404,"iterationTokens":1913,"asi":{"hypothesis":"If only mirror is regressing, bstnxbt control should stay near prior 100+ band.","rollback_reason":"bstnxbt control itself is down to 94.30 tok/s, indicating broader regime drift beyond mirror split logic.","next_action_hint":"Re-anchor the current regime with fresh bstnxbt and mirror baselines, then optimize relative gap; avoid comparing directly to stale 106-era numbers.","backend":"bstnxbt_mlx","mirror_runtime_enabled":false}}
{"type":"config","name":"Mirror SD + DFlash authoritative Qwen 1024 tuning (post-drift reanchor)","metricName":"completion_tok_s","metricUnit":"","bestDirection":"higher"}
{"run":416,"commit":"f722c7e","metric":96.01072095019032,"metrics":{},"status":"keep","description":"Reinitialized mirror experiment after regime drift and re-anchored current mirror_sd_mlx baseline (exit layer 15).","timestamp":1776269590365,"segment":23,"confidence":null,"iterationTokens":128,"asi":{"hypothesis":"Need a fresh baseline in the current runtime regime before further mirror tuning.","backend":"mirror_sd_mlx","phase":"post_drift_baseline_reanchor"}}
{"run":417,"commit":"f722c7e","metric":96.71288617581425,"metrics":{},"status":"discard","description":"Control probe in re-anchored regime: disabled mirror runtime (DFLASH_MIRROR_SD_RUNTIME=0) to measure bstnxbt baseline under same workload.","timestamp":1776269627532,"segment":23,"confidence":null,"iterationTokens":753,"asi":{"hypothesis":"Current mirror baseline should be compared against contemporaneous bstnxbt in the same regime.","rollback_reason":"Run used control (non-mirror) backend and is not a valid keep for mirror integration despite slightly higher metric.","next_action_hint":"Use ~96.71 tok/s as the immediate control target; tune mirror runtime above this while keeping mirror backend enabled.","backend":"bstnxbt_mlx","mirror_runtime_enabled":false,"mirror_vs_control_gap_tok_s":-0.7021652256239301}}
{"run":418,"commit":"f722c7e","metric":95.80066539119889,"metrics":{},"status":"discard","description":"Mirror baseline confirmation rerun (unchanged config).","timestamp":1776269660378,"segment":23,"confidence":null,"iterationTokens":1070,"asi":{"hypothesis":"Mirror baseline should reproduce around 96 tok/s in current regime.","rollback_reason":"Slight regression to 95.80 tok/s versus 96.01 baseline.","next_action_hint":"Treat current mirror lane as ~96 tok/s class; explore targeted knobs for incremental gain over 96.7 control.","backend":"mirror_sd_mlx","stability_probe":true}}
{"run":419,"commit":"f722c7e","metric":95.46420157811106,"metrics":{},"status":"discard","description":"Mirror split tuning: removed explicit exit-layer override to use default capture-max split.","timestamp":1776269694749,"segment":23,"confidence":null,"iterationTokens":839,"asi":{"hypothesis":"Default mirror exit-layer heuristic (capture-max) might outperform fixed layer 15 in current regime.","rollback_reason":"Throughput regressed to 95.46 tok/s.","next_action_hint":"Keep explicit DFLASH_MIRROR_SD_EXIT_LAYER=15; default split is weaker in current regime.","backend":"mirror_sd_mlx","mirror_exit_layer":"default"}}
{"run":420,"commit":"f722c7e","metric":94.9564728680832,"metrics":{},"status":"discard","description":"Mirror lane request-shape probe: BENCHMARK_DFLASH=1 (explicit request-level dflash=true).","timestamp":1776269725969,"segment":23,"confidence":null,"iterationTokens":691,"asi":{"hypothesis":"Explicit request-level DFlash forcing may improve mirror backend selection/perf consistency.","rollback_reason":"Metric regressed to 94.96 tok/s.","next_action_hint":"Keep BENCHMARK_DFLASH=0 for mirror lane; explicit forcing is not beneficial.","backend":"mirror_sd_mlx","benchmark_dflash":1}}
{"run":421,"commit":"f722c7e","metric":94.4528995086964,"metrics":{},"status":"discard","description":"Mirror lane request-shape probe: switch to settings-driven thinking only (ENABLE_THINKING=0, SETTINGS_ENABLE_THINKING=1).","timestamp":1776269757514,"segment":23,"confidence":null,"iterationTokens":701,"asi":{"hypothesis":"Settings-driven thinking may yield a better mirror request path than request-driven thinking.","rollback_reason":"Metric dropped to 94.45 tok/s.","next_action_hint":"Keep request-driven thinking on mirror lane (ENABLE_THINKING=1, SETTINGS_ENABLE_THINKING=0).","backend":"mirror_sd_mlx","enable_thinking":0,"settings_enable_thinking":1}}
{"run":422,"commit":"f722c7e","metric":87.11493416643238,"metrics":{},"status":"discard","description":"Mirror lane retune: DFLASH_BLOCK_TOKENS=13 (with mirror exit layer 15).","timestamp":1776269797471,"segment":23,"confidence":null,"iterationTokens":716,"asi":{"hypothesis":"Mirror split path may prefer slightly smaller block size than 15 in current regime.","rollback_reason":"Significant regression to 87.11 tok/s.","next_action_hint":"Keep block tokens pinned at 15 for mirror lane.","backend":"mirror_sd_mlx","dflash_block_tokens":13}}
{"run":423,"commit":"f722c7e","metric":96.30566364600433,"metrics":{},"status":"discard","description":"Mirror baseline rerun (unchanged config) after retune probes.","timestamp":1776269831980,"segment":23,"confidence":null,"iterationTokens":731,"asi":{"hypothesis":"Unchanged mirror path may fluctuate; rerun used to estimate current noise floor.","rollback_reason":"No code/config change; small +0.30 tok/s uplift is likely noise, not actionable improvement.","next_action_hint":"Pursue code-level mirror runtime optimization for deterministic gains rather than keeping no-op rerun improvements.","backend":"mirror_sd_mlx","stability_probe":true}}
{"run":424,"commit":"c926eb5","metric":105.382953635642,"metrics":{},"status":"keep","description":"Optimized mirror target split forward implementation: inlined prefix/suffix loops and added exit-layer resolution caching in mirror_sd_target.py. Mirror authoritative lane jumped to 105.38 tok/s.","timestamp":1776269941366,"segment":23,"confidence":11.102008639997441,"iterationTokens":4958,"asi":{"hypothesis":"Reducing Python overhead in the mirror split target-forward helper should recover most of the mirror-vs-bstnxbt gap.","backend":"mirror_sd_mlx","optimization":"inlined split loops + exit-layer cache","relative_to_recent_control_tok_s":"+8.67 vs 96.71 bstnxbt control"}}
{"run":425,"commit":"c926eb5","metric":104.78083270016084,"metrics":{},"status":"discard","description":"Mirror optimized helper confirmation rerun (unchanged config/code).","timestamp":1776269974823,"segment":23,"confidence":10.67201283911792,"iterationTokens":754,"asi":{"hypothesis":"Optimized mirror split helper should remain in the ~105 tok/s band on immediate rerun.","rollback_reason":"No new code/config change and metric was slightly below the previous keep (104.78 vs 105.38).","next_action_hint":"Proceed from commit c926eb5 and test remaining mirror knobs (exit layer micro-sweep, control comparison) for additional gains.","backend":"mirror_sd_mlx","stability_probe":true}}
