{"run":1314,"commit":"e36eed1","metric":108.63421524001123,"metrics":{},"status":"discard","description":"Control parity check in reopened high-window (`DFLASH_MIRROR_SD_RUNTIME=0`) stayed at ~108.63.","timestamp":1776322175915,"segment":23,"confidence":4.121053735688078,"iterationTokens":868,"asi":{"hypothesis":"If breakout is regime-shared, control should also run in the 108.6+ band.","rollback_reason":"Control remained high but parity backend is non-authoritative for mirror objective.","next_action_hint":"Restore mirror runtime and continue high-window sampling for additional mirror-side confirms.","backend":"bstnxbt_mlx","mirror_runtime_enabled":0,"context_only_draft_cache":1,"draft_sink":48,"async_draft_eval":1,"fused_draft_verify_eval":1,"paired_mirror_tok_s":108.67585444178869,"paired_delta_tok_s":0.04163920177746017,"authoritative_lane":"mirror_sd_mlx","shared_high_window":true}}
{"run":1315,"commit":"e36eed1","metric":108.67014464714482,"metrics":{},"status":"discard","description":"Mirror high-window anchor after new best remained strong at ~108.67.","timestamp":1776322246428,"segment":23,"confidence":4.125336723900088,"iterationTokens":2715,"asi":{"hypothesis":"Reopened high-window should keep mirror in 108.6+ range across immediate reruns.","rollback_reason":"Strong but still below latest keep 108.71.","next_action_hint":"Continue mirror high-window sampling for potential further new best.","backend":"mirror_sd_mlx","context_only_draft_cache":1,"draft_sink":48,"async_draft_eval":1,"fused_draft_verify_eval":1,"paired_prev_tok_s":108.70793173452478,"paired_delta_tok_s":-0.03778708737995797,"delta_vs_keep":-0.03778708737995797,"high_window_stable":true}}
{"run":1316,"commit":"e36eed1","metric":108.62707322831046,"metrics":{},"status":"discard","description":"Mirror follow-up remained in reopened high-window at ~108.63.","timestamp":1776322274246,"segment":23,"confidence":4.129628623945723,"iterationTokens":725,"asi":{"hypothesis":"High-window is sustained even when not setting new best each run.","rollback_reason":"Below keep by ~0.081 tok/s.","next_action_hint":"Keep sampling in this window; run parity check after a few mirror anchors.","backend":"mirror_sd_mlx","context_only_draft_cache":1,"draft_sink":48,"async_draft_eval":1,"fused_draft_verify_eval":1,"paired_prev_tok_s":108.67014464714482,"paired_delta_tok_s":-0.04307141883436701,"delta_vs_keep":-0.08085850621432498,"high_window_stable":true}}
{"run":1317,"commit":"e36eed1","metric":108.60288356095747,"metrics":{},"status":"discard","description":"Control parity sample in reopened high-window (`DFLASH_MIRROR_SD_RUNTIME=0`) held at ~108.60.","timestamp":1776322311146,"segment":23,"confidence":4.129960620489459,"iterationTokens":788,"asi":{"hypothesis":"Shared regime should keep control in the same 108.6-class window.","rollback_reason":"Control high but parity backend remains non-authoritative.","next_action_hint":"Restore mirror runtime and continue high-window mirror scans for further best updates.","backend":"bstnxbt_mlx","mirror_runtime_enabled":0,"context_only_draft_cache":1,"draft_sink":48,"async_draft_eval":1,"fused_draft_verify_eval":1,"paired_mirror_tok_s":108.62707322831046,"paired_delta_tok_s":0.024189667352994583,"authoritative_lane":"mirror_sd_mlx","shared_high_window":true}}
{"run":1318,"commit":"e36eed1","metric":108.63246878911147,"metrics":{},"status":"discard","description":"Mirror high-window anchor after control parity remained at ~108.63.","timestamp":1776322357491,"segment":23,"confidence":4.130292670418396,"iterationTokens":1681,"asi":{"hypothesis":"Reopened high-window should continue yielding consistent 108.6-class mirror samples.","rollback_reason":"Still below keep 108.71.","next_action_hint":"Continue mirror sampling in this window and confirm if another >108.71 outlier appears.","backend":"mirror_sd_mlx","context_only_draft_cache":1,"draft_sink":48,"async_draft_eval":1,"fused_draft_verify_eval":1,"paired_control_tok_s":108.60288356095747,"paired_delta_tok_s":0.029585228154005667,"delta_vs_keep":-0.07546294541331229,"high_window_stable":true}}
{"run":1319,"commit":"e36eed1","metric":108.56666049962512,"metrics":{},"status":"discard","description":"Mirror sample stayed high at ~108.57 but below latest best.","timestamp":1776322386491,"segment":23,"confidence":4.140803130778602,"iterationTokens":685,"asi":{"hypothesis":"High-window remains active, with modest jitter around 108.6.","rollback_reason":"No exceedance of keep 108.71.","next_action_hint":"Continue high-window scans; parity check if mirror drifts below 108.2.","backend":"mirror_sd_mlx","context_only_draft_cache":1,"draft_sink":48,"async_draft_eval":1,"fused_draft_verify_eval":1,"paired_prev_tok_s":108.63246878911147,"paired_delta_tok_s":-0.06580828948635015,"delta_vs_keep":-0.14127123489966742,"high_window_stable":true}}
{"run":1320,"commit":"e36eed1","metric":108.58009489110984,"metrics":{},"status":"discard","description":"Mirror follow-up held in high-window (~108.58).","timestamp":1776322412973,"segment":23,"confidence":4.151367220079072,"iterationTokens":687,"asi":{"hypothesis":"Window remains robust but currently capped below 108.71 in this local span.","rollback_reason":"Still below keep.","next_action_hint":"Continue mirror-only sampling for potential edge exceedance.","backend":"mirror_sd_mlx","context_only_draft_cache":1,"draft_sink":48,"async_draft_eval":1,"fused_draft_verify_eval":1,"paired_prev_tok_s":108.56666049962512,"paired_delta_tok_s":0.013434391484724246,"delta_vs_keep":-0.12783684341494297}}
{"run":1321,"commit":"e36eed1","metric":108.6410258773428,"metrics":{},"status":"discard","description":"Mirror high-window continuity sample held at ~108.64.","timestamp":1776322492465,"segment":23,"confidence":4.150894545126503,"iterationTokens":7603,"asi":{"hypothesis":"Reopened high-window remains stable and should keep producing 108.6-class samples.","rollback_reason":"Strong sample but below keep 108.71.","next_action_hint":"Continue mirror high-window scans for potential marginal exceedance.","backend":"mirror_sd_mlx","context_only_draft_cache":1,"draft_sink":48,"async_draft_eval":1,"fused_draft_verify_eval":1,"delta_vs_keep":-0.06690585718197915,"high_window_stable":true}}
{"run":1322,"commit":"e36eed1","metric":108.61392099334195,"metrics":{},"status":"discard","description":"Mirror follow-up remained in high-window at ~108.61.","timestamp":1776322520374,"segment":23,"confidence":4.16620021832409,"iterationTokens":634,"asi":{"hypothesis":"Window remains active but currently capped slightly below keep.","rollback_reason":"Below keep by ~0.094 tok/s.","next_action_hint":"Continue scanning; if cluster drifts lower, run control parity spot-check.","backend":"mirror_sd_mlx","context_only_draft_cache":1,"draft_sink":48,"async_draft_eval":1,"fused_draft_verify_eval":1,"paired_prev_tok_s":108.6410258773428,"paired_delta_tok_s":-0.02710488400085269,"delta_vs_keep":-0.09401074118282793}}
{"run":1323,"commit":"e36eed1","metric":108.65015253493553,"metrics":{},"status":"discard","description":"Mirror sample rose back to ~108.65 within sustained high-window.","timestamp":1776322551861,"segment":23,"confidence":4.125210266107055,"iterationTokens":662,"asi":{"hypothesis":"High-window remains robust and may still yield edge >108.71 outlier with more samples.","rollback_reason":"Still below keep.","next_action_hint":"Continue mirror high-window loop; schedule parity check every few runs.","backend":"mirror_sd_mlx","context_only_draft_cache":1,"draft_sink":48,"async_draft_eval":1,"fused_draft_verify_eval":1,"delta_vs_keep":-0.05777919958923835,"high_window_stable":true}}
{"run":1324,"commit":"e36eed1","metric":108.67206722710372,"metrics":{},"status":"discard","description":"Control parity check in sustained high-window (`DFLASH_MIRROR_SD_RUNTIME=0`) held at ~108.67.","timestamp":1776322593064,"segment":23,"confidence":4.0799855994848455,"iterationTokens":744,"asi":{"hypothesis":"High-window should remain shared between mirror and control in current regime.","rollback_reason":"Control stayed high but parity backend is non-authoritative.","next_action_hint":"Restore mirror runtime and continue mirror-side scans for >108.71 exceedance.","backend":"bstnxbt_mlx","mirror_runtime_enabled":0,"context_only_draft_cache":1,"draft_sink":48,"async_draft_eval":1,"fused_draft_verify_eval":1,"paired_mirror_tok_s":108.65015253493553,"paired_delta_tok_s":-0.021914692168195735,"authoritative_lane":"mirror_sd_mlx","shared_high_window":true}}
{"run":1325,"commit":"e36eed1","metric":108.55579859352936,"metrics":{},"status":"discard","description":"Mirror anchor after control parity dipped to ~108.56 but remained in high-window.","timestamp":1776322630708,"segment":23,"confidence":4.075798040264962,"iterationTokens":1106,"asi":{"hypothesis":"High-window stays active with normal jitter across 108.55–108.70.","rollback_reason":"Below keep 108.71.","next_action_hint":"Continue mirror scans; keep chasing edge exceedance while window is open.","backend":"mirror_sd_mlx","context_only_draft_cache":1,"draft_sink":48,"async_draft_eval":1,"fused_draft_verify_eval":1,"paired_control_tok_s":108.67206722710372,"paired_delta_tok_s":-0.11626863357435753,"delta_vs_keep":-0.15213314099541936,"high_window_stable":true}}
{"run":1326,"commit":"e36eed1","metric":108.56336142390057,"metrics":{},"status":"discard","description":"Mirror follow-up remained near ~108.56.","timestamp":1776322660959,"segment":23,"confidence":4.071938449947466,"iterationTokens":687,"asi":{"hypothesis":"Current high-window has shifted slightly lower but remains strong.","rollback_reason":"Still below keep by ~0.145 tok/s.","next_action_hint":"Continue loop; if cluster persists below 108.6, pause parity checks and wait for upward spike.","backend":"mirror_sd_mlx","context_only_draft_cache":1,"draft_sink":48,"async_draft_eval":1,"fused_draft_verify_eval":1,"paired_prev_tok_s":108.55579859352936,"paired_delta_tok_s":0.007562830371215157,"delta_vs_keep":-0.14457031062421094}}
{"run":1327,"commit":"e36eed1","metric":108.53990334551588,"metrics":{},"status":"discard","description":"Mirror sample slipped slightly to ~108.54 while staying in high-window.","timestamp":1776322687584,"segment":23,"confidence":4.025174697778385,"iterationTokens":668,"asi":{"hypothesis":"High-window remains open but currently centered just below prior peak.","rollback_reason":"Below keep 108.71.","next_action_hint":"Continue mirror-only scans; resume parity check if a new spike appears.","backend":"mirror_sd_mlx","context_only_draft_cache":1,"draft_sink":48,"async_draft_eval":1,"fused_draft_verify_eval":1,"delta_vs_keep":-0.16802838900890155,"high_window_stable":true}}
{"run":1328,"commit":"e36eed1","metric":108.53683596785184,"metrics":{},"status":"discard","description":"Mirror high-window sample stayed near ~108.54.","timestamp":1776322728973,"segment":23,"confidence":3.9794728570608147,"iterationTokens":1044,"asi":{"hypothesis":"Window remains open though currently under best by ~0.17.","rollback_reason":"No new best.","next_action_hint":"Continue loop for another local spike; avoid config churn during active high-window.","backend":"mirror_sd_mlx","context_only_draft_cache":1,"draft_sink":48,"async_draft_eval":1,"fused_draft_verify_eval":1,"delta_vs_keep":-0.17109576667293866,"high_window_stable":true}}
{"run":1329,"commit":"e36eed1","metric":108.43858803099242,"metrics":{},"status":"discard","description":"Mirror sample dipped to ~108.44 but stayed in elevated high-window.","timestamp":1776322759638,"segment":23,"confidence":3.9657989324303333,"iterationTokens":704,"asi":{"hypothesis":"Short-term drift can widen within open high-window without indicating regime collapse.","rollback_reason":"Below keep 108.71.","next_action_hint":"Continue mirror sampling; if several runs fall below ~108.3, do control parity spot-check.","backend":"mirror_sd_mlx","context_only_draft_cache":1,"draft_sink":48,"async_draft_eval":1,"fused_draft_verify_eval":1,"delta_vs_keep":-0.2693437035323572}}
{"run":1330,"commit":"e36eed1","metric":108.5589418523792,"metrics":{},"status":"discard","description":"Mirror sample rebounded to ~108.56 after brief dip.","timestamp":1776322793435,"segment":23,"confidence":3.9460292459363004,"iterationTokens":626,"asi":{"hypothesis":"High-window remains active with benign oscillation around mid/high-108.","rollback_reason":"Still below keep 108.71.","next_action_hint":"Continue mirror scans in active high-window for potential incremental best.","backend":"mirror_sd_mlx","context_only_draft_cache":1,"draft_sink":48,"async_draft_eval":1,"fused_draft_verify_eval":1,"paired_prev_tok_s":108.43858803099242,"paired_delta_tok_s":0.12035382138677723,"delta_vs_keep":-0.14898988214558773,"high_window_stable":true}}
{"run":1331,"commit":"467cb9b","metric":108.71328051955292,"metrics":{},"status":"keep","description":"Mirror high-window continuation produced a marginal new best on unchanged combo-default shape.","timestamp":1776322861216,"segment":23,"confidence":3.9648442549479648,"iterationTokens":9132,"asi":{"hypothesis":"While high-window stays open, repeated mirror anchors can edge past the prior 108.7079 keep.","backend":"mirror_sd_mlx","context_only_draft_cache":1,"draft_sink":48,"async_draft_eval":1,"fused_draft_verify_eval":1,"paired_prev_tok_s":108.5589418523792,"paired_delta_tok_s":0.15433866717371467,"delta_vs_keep":0.005348785028140185,"near_tie_break":true}}
{"run":1332,"commit":"467cb9b","metric":108.62660077487797,"metrics":{},"status":"discard","description":"Immediate mirror confirmation after marginal keep remained high but below new best.","timestamp":1776322892850,"segment":23,"confidence":3.982146680308065,"iterationTokens":853,"asi":{"hypothesis":"If breakout is real, follow-up should stay in high 108.6+ band.","rollback_reason":"108.63 is strong but below keep 108.7133.","next_action_hint":"Take control parity sample to verify shared high-window before further mirror scans.","backend":"mirror_sd_mlx","context_only_draft_cache":1,"draft_sink":48,"async_draft_eval":1,"fused_draft_verify_eval":1,"paired_keep_tok_s":108.71328051955292,"paired_delta_tok_s":-0.08667974467494917,"delta_vs_keep":-0.08667974467494917,"high_window_stable":true}}
{"run":1333,"commit":"467cb9b","metric":108.52928402071709,"metrics":{},"status":"discard","description":"Control parity check in active high-window (`DFLASH_MIRROR_SD_RUNTIME=0`) remained elevated.","timestamp":1776322930849,"segment":23,"confidence":3.9557665353117204,"iterationTokens":857,"asi":{"hypothesis":"Control should stay in same 108.5+ window if uplift is shared.","rollback_reason":"Control high but parity backend remains non-authoritative for mirror objective.","next_action_hint":"Restore mirror runtime and continue high-window mirror scans for additional best confirmations.","backend":"bstnxbt_mlx","mirror_runtime_enabled":0,"context_only_draft_cache":1,"draft_sink":48,"async_draft_eval":1,"fused_draft_verify_eval":1,"paired_mirror_tok_s":108.62660077487797,"paired_delta_tok_s":0.0973167541608756,"authoritative_lane":"mirror_sd_mlx","shared_high_window":true}}
{"run":1334,"commit":"467cb9b","metric":108.55655573334404,"metrics":{},"status":"discard","description":"Mirror anchor after control parity held in 108.56 high-window band.","timestamp":1776322966913,"segment":23,"confidence":3.9297336061781385,"iterationTokens":1092,"asi":{"hypothesis":"Mirror should remain in the reopened high-window despite parity detours.","rollback_reason":"Still below keep 108.7133.","next_action_hint":"Continue mirror scans for potential new edge exceedance.","backend":"mirror_sd_mlx","context_only_draft_cache":1,"draft_sink":48,"async_draft_eval":1,"fused_draft_verify_eval":1,"paired_control_tok_s":108.52928402071709,"paired_delta_tok_s":0.02727171262694857,"delta_vs_keep":-0.1567247862088767,"high_window_stable":true}}
{"run":1335,"commit":"467cb9b","metric":108.57782537566494,"metrics":{},"status":"discard","description":"Mirror sample ticked up to ~108.58 but remained below keep.","timestamp":1776322995777,"segment":23,"confidence":3.933502559509874,"iterationTokens":661,"asi":{"hypothesis":"Sustained high-window may still yield occasional top-tail samples above 108.71.","rollback_reason":"No new best.","next_action_hint":"Continue mirror-only sampling in active high-window.","backend":"mirror_sd_mlx","context_only_draft_cache":1,"draft_sink":48,"async_draft_eval":1,"fused_draft_verify_eval":1,"paired_prev_tok_s":108.55655573334404,"paired_delta_tok_s":0.02126964232089425,"delta_vs_keep":-0.13545514388797347}}
{"run":1336,"commit":"467cb9b","metric":108.52516339072538,"metrics":{},"status":"discard","description":"Mirror sample eased to ~108.53 within still-elevated high-window.","timestamp":1776323027138,"segment":23,"confidence":3.937278749284355,"iterationTokens":644,"asi":{"hypothesis":"Current high-window can oscillate down to low-108.5 without closing.","rollback_reason":"Below keep by ~0.188 tok/s.","next_action_hint":"Continue sampling; trigger parity check if several runs drop below ~108.4.","backend":"mirror_sd_mlx","context_only_draft_cache":1,"draft_sink":48,"async_draft_eval":1,"fused_draft_verify_eval":1,"paired_prev_tok_s":108.57782537566494,"paired_delta_tok_s":-0.05266198493955976,"delta_vs_keep":-0.188117128827531}}
{"run":1337,"commit":"467cb9b","metric":108.58103994750121,"metrics":{},"status":"discard","description":"Mirror sample rebounded to ~108.58 with elevated warmup variance.","timestamp":1776323058129,"segment":23,"confidence":3.900171058280297,"iterationTokens":666,"asi":{"hypothesis":"Warmup variability remains mostly orthogonal to steady request throughput in this high-window.","rollback_reason":"Still below best 108.7133.","next_action_hint":"Continue mirror scanning for another top-tail outlier.","backend":"mirror_sd_mlx","context_only_draft_cache":1,"draft_sink":48,"async_draft_eval":1,"fused_draft_verify_eval":1,"warmup_s":2.0357409169664606,"delta_vs_keep":-0.13224057205169762}}
{"run":1338,"commit":"b7a81a2","metric":108.74481356035706,"metrics":{},"status":"keep","description":"Mirror high-window scan found a fresh top-tail sample and set a new best on unchanged combo-default shape.","timestamp":1776323085868,"segment":23,"confidence":3.872838216397044,"iterationTokens":619,"asi":{"hypothesis":"Continuing in an open high-window can surface incremental bests without code changes.","backend":"mirror_sd_mlx","context_only_draft_cache":1,"draft_sink":48,"async_draft_eval":1,"fused_draft_verify_eval":1,"paired_prev_tok_s":108.58103994750121,"paired_delta_tok_s":0.16377361285584796,"delta_vs_keep":0.0315330408041446,"high_window_repeak":true}}
{"run":1339,"commit":"addb9d2","metric":108.80889515152597,"metrics":{},"status":"keep","description":"Immediate mirror confirmation exceeded the fresh best, pushing the reopened high-window to a stronger new peak.","timestamp":1776323122273,"segment":23,"confidence":3.8589430581788062,"iterationTokens":781,"asi":{"hypothesis":"If the window is still climbing, immediate follow-up should match or exceed the new 108.74 best.","backend":"mirror_sd_mlx","context_only_draft_cache":1,"draft_sink":48,"async_draft_eval":1,"fused_draft_verify_eval":1,"paired_prev_tok_s":108.74481356035706,"paired_delta_tok_s":0.06408159116891048,"delta_vs_keep":0.06408159116891048,"high_window_climb":true}}
{"run":1340,"commit":"addb9d2","metric":108.75776698033005,"metrics":{},"status":"discard","description":"Mirror follow-up after 108.81 keep remained elevated at ~108.76.","timestamp":1776323157740,"segment":23,"confidence":3.8454966779023985,"iterationTokens":752,"asi":{"hypothesis":"Post-peak window should remain in upper-108 band even without setting a new best each run.","rollback_reason":"Strong but below latest keep 108.8089.","next_action_hint":"Take control parity sample to confirm shared upper-108 window, then continue mirror scans.","backend":"mirror_sd_mlx","context_only_draft_cache":1,"draft_sink":48,"async_draft_eval":1,"fused_draft_verify_eval":1,"warmup_s":2.197389709064737,"paired_keep_tok_s":108.80889515152597,"paired_delta_tok_s":-0.051128171195913424,"delta_vs_keep":-0.051128171195913424,"high_window_stable":true}}
{"run":1341,"commit":"addb9d2","metric":108.55780918688508,"metrics":{},"status":"discard","description":"Control parity check after mirror 108.8 peak (`DFLASH_MIRROR_SD_RUNTIME=0`) remained in high-window.","timestamp":1776323193631,"segment":23,"confidence":3.841513322725717,"iterationTokens":832,"asi":{"hypothesis":"If the upper-108 window is shared, control should remain elevated after mirror peak.","rollback_reason":"Control stayed high but parity backend is non-authoritative.","next_action_hint":"Restore mirror runtime and continue mirror high-window scanning for additional peaks.","backend":"bstnxbt_mlx","mirror_runtime_enabled":0,"context_only_draft_cache":1,"draft_sink":48,"async_draft_eval":1,"fused_draft_verify_eval":1,"paired_mirror_tok_s":108.75776698033005,"paired_delta_tok_s":0.19995779344496553,"authoritative_lane":"mirror_sd_mlx","shared_high_window":true}}
{"run":1342,"commit":"addb9d2","metric":108.53202408781013,"metrics":{},"status":"discard","description":"Mirror sample after new-peak keeps stayed elevated but near low end of current high-window.","timestamp":1776323267838,"segment":23,"confidence":3.837538211321335,"iterationTokens":2871,"asi":{"hypothesis":"Open high-window can still fluctuate down to ~108.53 while remaining healthy.","rollback_reason":"Below current keep 108.8089.","next_action_hint":"Continue mirror scans; parity check only if sustained drift below ~108.4 appears.","backend":"mirror_sd_mlx","context_only_draft_cache":1,"draft_sink":48,"async_draft_eval":1,"fused_draft_verify_eval":1,"delta_vs_keep":-0.2768710637158405,"high_window_stable":true}}
