{"run":835,"commit":"8b55918","metric":106.30596416283693,"metrics":{},"status":"discard","description":"Mirror block-size extension: DFLASH_BLOCK_TOKENS=22.","timestamp":1776291507024,"segment":23,"confidence":4.8621075846242245,"iterationTokens":621,"asi":{"hypothesis":"Block 22 might hit a high-acceptance sweet spot and challenge keep=15.","rollback_reason":"Near-keep but still below winner (106.31 vs 106.86).","next_action_hint":"Add block_tokens=22 to do-not-retry set; continue avoiding broad block-size sweeps.","backend":"mirror_sd_mlx","context_only_draft_cache":1,"draft_sink":48,"block_tokens":22,"delta_vs_keep":-0.5540358371630678}}
{"run":836,"commit":"8b55918","metric":105.21044362325786,"metrics":{},"status":"discard","description":"Mirror block-size extension: DFLASH_BLOCK_TOKENS=23.","timestamp":1776291542422,"segment":23,"confidence":4.9901851720721915,"iterationTokens":647,"asi":{"hypothesis":"Further larger block 23 may improve speculative amortization under current acceptance behavior.","rollback_reason":"Below keep (105.21 vs 106.86).","next_action_hint":"Add block_tokens=23 to do-not-retry set; large-block expansion remains non-winning.","backend":"mirror_sd_mlx","context_only_draft_cache":1,"draft_sink":48,"block_tokens":23,"delta_vs_keep":-1.6495563767421333}}
{"run":837,"commit":"8b55918","metric":105.4623561423776,"metrics":{},"status":"discard","description":"Mirror block-size extension: DFLASH_BLOCK_TOKENS=24.","timestamp":1776291580935,"segment":23,"confidence":5.083622412586746,"iterationTokens":622,"asi":{"hypothesis":"Block size 24 might realize higher acceptance amortization than smaller alternatives.","rollback_reason":"Below keep (105.46 vs 106.86).","next_action_hint":"Add block_tokens=24 to do-not-retry set; extended large-block region remains non-winning.","backend":"mirror_sd_mlx","context_only_draft_cache":1,"draft_sink":48,"block_tokens":24,"delta_vs_keep":-1.3976438576223913}}
{"run":838,"commit":"8b55918","metric":105.46284582009743,"metrics":{},"status":"discard","description":"Mirror anchor after extended large block-size sweep (restored keep shape).","timestamp":1776291626073,"segment":23,"confidence":5.1742346883607775,"iterationTokens":786,"asi":{"hypothesis":"Restored keep config should return to its local high-105/106 regime after block-size experiments.","rollback_reason":"Anchor remains below keep at 105.46.","next_action_hint":"Large block-size family now substantially exhausted; pivot back to structural/runtime-path ideas.","backend":"mirror_sd_mlx","context_only_draft_cache":1,"draft_sink":48,"stability_probe":true,"delta_vs_keep":-1.3971541799025706}}
{"run":839,"commit":"8b55918","metric":106.09491407971512,"metrics":{},"status":"discard","description":"Control parity sample after mirror 105.46 anchor (mirror disabled).","timestamp":1776291679016,"segment":23,"confidence":5.205295419269682,"iterationTokens":719,"asi":{"hypothesis":"Control may rebound to high-106 if prior mirror anchor was local jitter dip.","rollback_reason":"Control rebounded to high-106 but still below keep.","next_action_hint":"Run mirror follow-up to determine if mirror re-enters same band.","backend":"bstnxbt_mlx","mirror_runtime_enabled":0,"context_only_draft_cache":1,"draft_sink":48,"paired_mirror_tok_s":105.46284582009743,"paired_delta_tok_s":-0.6320682596176859}}
{"run":840,"commit":"8b55918","metric":105.06130125541439,"metrics":{},"status":"discard","description":"Mirror follow-up after control high-106 parity sample.","timestamp":1776291718403,"segment":23,"confidence":5.2367313150136345,"iterationTokens":639,"asi":{"hypothesis":"Mirror should rebound toward control if previous dip was transient.","rollback_reason":"Mirror remained around 105.06 and below keep.","next_action_hint":"Persistent mirror/control jitter continues; require paired medians and immediate confirms for any near-keep claims.","backend":"mirror_sd_mlx","context_only_draft_cache":1,"draft_sink":48,"paired_control_tok_s":106.09491407971512,"paired_delta_tok_s":-1.0336128243007376,"delta_vs_keep":-1.7986987445856082,"warmup_s_spike":4.300420165993273}}
{"run":841,"commit":"8b55918","metric":105.58894586845295,"metrics":{},"status":"discard","description":"Mirror stability sample after warmup-duration spike run.","timestamp":1776291753169,"segment":23,"confidence":5.26825088367735,"iterationTokens":692,"asi":{"hypothesis":"If prior warmup spike was transient, subsequent run should normalize warmup time and return to usual throughput band.","rollback_reason":"Warmup normalized, throughput returned to mid/high-105 but still below keep.","next_action_hint":"Track warmup spikes as instability signal; continue parity bundles and structural search.","backend":"mirror_sd_mlx","context_only_draft_cache":1,"draft_sink":48,"stability_probe":true,"delta_vs_keep":-1.2710541315470496}}
{"run":842,"commit":"8b55918","metric":104.2134486077397,"metrics":{},"status":"discard","description":"Structural mirror call-path attempt v2: pre-resolve both exit layer and capture_flags once per request and pass through target-forward kwargs.","timestamp":1776291852934,"segment":23,"confidence":5.2922168209123175,"iterationTokens":3264,"asi":{"hypothesis":"Eliminating per-verify capture-flag resolution and exit-layer lookup should reduce mirror hot-loop Python overhead.","rollback_reason":"Regression versus keep and recent anchors (104.21 vs 106.86).","next_action_hint":"Revert this mirror kwargs pre-resolution path; private capture-flag resolution shortcut did not help.","backend":"mirror_sd_mlx","context_only_draft_cache":1,"draft_sink":48,"optimization":"mirror_pre_resolve_exit_and_capture_flags","delta_vs_keep":-2.646551392260299}}
{"run":843,"commit":"8b55918","metric":103.6244528765195,"metrics":{},"status":"discard","description":"Post-revert mirror anchor after exit+capture pre-resolution structural attempt.","timestamp":1776291901470,"segment":23,"confidence":5.2715448516378105,"iterationTokens":870,"asi":{"hypothesis":"Reverted keep-shape baseline should recover if candidate regression was patch-local.","rollback_reason":"Anchor remained low (~103.62), indicating regime drift/jitter rather than patch-only effect.","next_action_hint":"Run control symmetry check to classify shared vs mirror-local dip.","backend":"mirror_sd_mlx","context_only_draft_cache":1,"draft_sink":48,"stability_probe":true,"delta_vs_keep":-3.235547123480507}}
{"run":844,"commit":"8b55918","metric":104.57292071917118,"metrics":{},"status":"discard","description":"Control symmetry check after 103.62 mirror anchor dip (mirror disabled).","timestamp":1776291942754,"segment":23,"confidence":5.300152178678881,"iterationTokens":716,"asi":{"hypothesis":"If dip is shared, control should land in a similar low-104 band.","rollback_reason":"Control also low (~104.57), confirming shared local slowdown.","next_action_hint":"Run mirror follow-up and continue parity-bundle tracking.","backend":"bstnxbt_mlx","mirror_runtime_enabled":0,"context_only_draft_cache":1,"draft_sink":48,"paired_mirror_tok_s":103.6244528765195,"paired_delta_tok_s":-0.9484678426516745}}
{"run":845,"commit":"8b55918","metric":103.99622549218387,"metrics":{},"status":"discard","description":"Mirror follow-up after control low-104 symmetry sample.","timestamp":1776291978661,"segment":23,"confidence":5.285984275027554,"iterationTokens":635,"asi":{"hypothesis":"Mirror should remain near control in shared local slowdown window.","rollback_reason":"Mirror stayed low at ~104.00, below keep.","next_action_hint":"Continue stability sampling; avoid new candidate claims until high-106 band returns.","backend":"mirror_sd_mlx","context_only_draft_cache":1,"draft_sink":48,"paired_control_tok_s":104.57292071917118,"paired_delta_tok_s":-0.5766952269873066,"delta_vs_keep":-2.8637745078161303}}
{"run":846,"commit":"8b55918","metric":104.68307862099898,"metrics":{},"status":"discard","description":"Mirror stability sample in low-104/high-104 regime.","timestamp":1776292012606,"segment":23,"confidence":5.307295288880625,"iterationTokens":674,"asi":{"hypothesis":"Repeated unchanged runs should map current local median before next structural attempt.","rollback_reason":"Sample remains below keep.","next_action_hint":"Collect paired control sample to maintain parity calibration.","backend":"mirror_sd_mlx","context_only_draft_cache":1,"draft_sink":48,"bundle_tracking":true,"delta_vs_keep":-2.1769213790010147}}
{"run":847,"commit":"8b55918","metric":104.60300999741449,"metrics":{},"status":"discard","description":"Control parity sample for current low-104/high-104 mirror run (mirror disabled).","timestamp":1776292055277,"segment":23,"confidence":5.331579839368641,"iterationTokens":660,"asi":{"hypothesis":"Control should closely match mirror if current dip is shared regime behavior.","rollback_reason":"Control nearly matched mirror and remains below keep.","next_action_hint":"Run mirror follow-up to complete mini-bundle and confirm local median.","backend":"bstnxbt_mlx","mirror_runtime_enabled":0,"context_only_draft_cache":1,"draft_sink":48,"bundle_tracking":true,"paired_mirror_tok_s":104.68307862099898,"paired_delta_tok_s":0.08006862358449025}}
{"run":848,"commit":"8b55918","metric":104.0716107838882,"metrics":{},"status":"discard","description":"Mirror follow-up completing low-104 parity mini-bundle.","timestamp":1776292097455,"segment":23,"confidence":5.321403176348827,"iterationTokens":640,"asi":{"hypothesis":"Mirror should remain near control in shared low-104 jitter band.","rollback_reason":"Mirror remained low and below keep.","next_action_hint":"Current local median appears ~104.1-104.7; continue structural search and avoid micro-knob overfitting.","backend":"mirror_sd_mlx","context_only_draft_cache":1,"draft_sink":48,"bundle_tracking":true,"paired_control_tok_s":104.60300999741449,"paired_delta_tok_s":-0.5313992135262908,"delta_vs_keep":-2.7883892161118036}}
{"run":849,"commit":"8b55918","metric":100.48812507174006,"metrics":{},"status":"discard","description":"Step-change prototype: env-gated adaptive block controller + per-request telemetry surfaced through usage/METRIC lines (mirror lane).","timestamp":1776294052978,"segment":23,"confidence":5.296681301493015,"iterationTokens":640,"asi":{"hypothesis":"Acceptance-aware adaptive block sizing (15 start, 13-22 bounds) plus hard telemetry visibility could improve throughput resilience under instability.","rollback_reason":"Severe regression to ~100.49 tok/s versus keep 106.86.","next_action_hint":"Telemetry shows oscillatory growth/shrink (8/7 events) with mean block 14.22 and acceptance 0.699; next try should be tail-only or growth-only adaptation to avoid mid-run thrash.","backend":"mirror_sd_mlx","adaptive_block":1,"adaptive_min_block":13,"adaptive_max_block":22,"adaptive_window":4,"adaptive_grow_threshold":0.92,"adaptive_shrink_threshold":0.6,"dflash_acceptance_rate":0.6989409984871406,"dflash_mean_commit_tokens":10.24,"dflash_full_accept_rate":0.45,"dflash_block_tokens_mean":14.22,"dflash_block_tokens_min":1,"dflash_block_tokens_max":16,"dflash_adaptive_growth_events":8,"dflash_adaptive_shrink_events":7,"delta_vs_keep":-6.371874928259939}}
{"run":850,"commit":"8b55918","metric":105.28509860372696,"metrics":{},"status":"discard","description":"Post-revert anchor after adaptive-controller prototype discard (restored keep shape).","timestamp":1776294104467,"segment":23,"confidence":5.321403176348827,"iterationTokens":2146,"asi":{"hypothesis":"If adaptive-prototype regression was patch-local, restored baseline should return to prior ~104-106 regime.","rollback_reason":"Recovered to ~105.29 but still below keep.","next_action_hint":"Use learned telemetry pattern to design a stricter tail-only adaptive concept before any reimplementation.","backend":"mirror_sd_mlx","context_only_draft_cache":1,"draft_sink":48,"stability_probe":true,"delta_vs_keep":-1.5749013962730343}}
{"run":851,"commit":"8b55918","metric":105.07733727614757,"metrics":{},"status":"discard","description":"Structural non-stream micro-optimization: avoid per-step cumulative token-list copy in execute path (copy only when callbacks require it).","timestamp":1776294440494,"segment":23,"confidence":5.342462391384887,"iterationTokens":2146,"asi":{"hypothesis":"Removing O(n^2)-style cumulative list copying in non-stream execute loop should reduce Python overhead and improve mirror throughput.","rollback_reason":"No improvement; landed in mid-105 band below keep.","next_action_hint":"Treat this execute-path list-copy reduction as non-winning in current regime; pivot to higher-leverage acceptance-control ideas.","backend":"mirror_sd_mlx","optimization":"execute_nonstream_no_cumulative_copy","delta_vs_keep":-1.7826627238524293}}
{"run":852,"commit":"8b55918","metric":105.2253411857193,"metrics":{},"status":"discard","description":"Control parity sample after structural execute-path attempt revert (mirror disabled).","timestamp":1776294482297,"segment":23,"confidence":5.363688950480606,"iterationTokens":813,"asi":{"hypothesis":"If slowdown is shared regime behavior, control should land near recent mirror mid-105 sample.","rollback_reason":"Control stayed mid-105 and below keep; no parity break.","next_action_hint":"Run mirror follow-up to complete parity bundle before next structural attempt.","backend":"bstnxbt_mlx","mirror_runtime_enabled":0,"context_only_draft_cache":1,"draft_sink":48,"paired_mirror_tok_s":105.07733727614757,"paired_delta_tok_s":-0.14800390957172754}}
{"run":853,"commit":"8b55918","metric":103.88266665855663,"metrics":{},"status":"discard","description":"Mirror follow-up completing parity bundle after control mid-105 sample.","timestamp":1776294527646,"segment":23,"confidence":5.347292629239592,"iterationTokens":1122,"asi":{"hypothesis":"Mirror should track control near mid-105 if regime remains stable.","rollback_reason":"Mirror dropped to ~103.88, indicating renewed local dip/jitter.","next_action_hint":"Treat this as another instability swing; use short parity bundles before evaluating new structural candidates.","backend":"mirror_sd_mlx","context_only_draft_cache":1,"draft_sink":48,"paired_control_tok_s":105.2253411857193,"paired_delta_tok_s":-1.342674527162662,"delta_vs_keep":-2.977333341443367}}
{"run":854,"commit":"8b55918","metric":104.63013731435043,"metrics":{},"status":"discard","description":"Mirror sink extension probe below prior sweep floor: DFLASH_DRAFT_SINK=38.","timestamp":1776294570239,"segment":23,"confidence":5.365806294470668,"iterationTokens":1434,"asi":{"hypothesis":"Dropping sink just below previously tested range may improve context-only draft cache reuse patterns.","rollback_reason":"Throughput remained below keep at 104.63.","next_action_hint":"Add sink=38 to do-not-retry set; low-sink extension did not unlock a gain.","backend":"mirror_sd_mlx","context_only_draft_cache":1,"draft_sink":38,"delta_vs_keep":-2.229862685649568}}
{"run":855,"commit":"8b55918","metric":28.661224644829783,"metrics":{},"status":"discard","description":"Mirror sink deep-cut probe: DFLASH_DRAFT_SINK=32.","timestamp":1776294636838,"segment":23,"confidence":5.347292629239592,"iterationTokens":944,"asi":{"hypothesis":"A lower sink could improve rolling-context reuse and speculative acceptance at 1024 length.","rollback_reason":"Catastrophic collapse to ~28.66 tok/s indicates severe cliff.","next_action_hint":"Mark sink=32 as hard do-not-retry; avoid further downward sink exploration without new profiling evidence.","backend":"mirror_sd_mlx","context_only_draft_cache":1,"draft_sink":32,"severe_cliff":true,"delta_vs_keep":-78.19877535517023}}
{"run":856,"commit":"8b55918","metric":37.61106006104705,"metrics":{},"status":"discard","description":"Post-revert mirror anchor after sink=32 cliff probe.","timestamp":1776294693930,"segment":23,"confidence":5.328906280290964,"iterationTokens":928,"asi":{"hypothesis":"Restoring keep-shape after sink cliff should recover near prior ~104-106 regime.","rollback_reason":"Anchor remained deeply collapsed at ~37.61 tok/s.","next_action_hint":"Run immediate control symmetry check to determine shared collapse vs mirror-only issue.","backend":"mirror_sd_mlx","context_only_draft_cache":1,"draft_sink":48,"post_probe_collapse":true,"delta_vs_keep":-69.24893993895294}}
{"run":857,"commit":"8b55918","metric":74.65406856390787,"metrics":{},"status":"discard","description":"Control symmetry check after post-probe mirror collapse (mirror disabled).","timestamp":1776294738172,"segment":23,"confidence":5.3014290738783965,"iterationTokens":774,"asi":{"hypothesis":"If collapse is regime-wide, control should also degrade substantially.","rollback_reason":"Control also collapsed to ~74.65, confirming shared slowdown though less severe than mirror sample.","next_action_hint":"Return to mirror and continue short recovery bundle; avoid interpreting near-term backend deltas during collapse recovery.","backend":"bstnxbt_mlx","mirror_runtime_enabled":0,"context_only_draft_cache":1,"draft_sink":48,"paired_mirror_tok_s":37.61106006104705,"paired_delta_tok_s":-37.04300850286082,"shared_collapse_confirmed":true}}
{"run":858,"commit":"8b55918","metric":66.52827219441097,"metrics":{},"status":"discard","description":"Mirror recovery follow-up after control collapse sample.","timestamp":1776294771884,"segment":23,"confidence":5.272188067415572,"iterationTokens":693,"asi":{"hypothesis":"Mirror should recover toward control band if collapse is shared transient.","rollback_reason":"Mirror remained deeply degraded at ~66.53 tok/s.","next_action_hint":"Continue recovery bundle; postpone new candidate testing until baseline climbs back above ~95.","backend":"mirror_sd_mlx","context_only_draft_cache":1,"draft_sink":48,"paired_control_tok_s":74.65406856390787,"paired_delta_tok_s":-8.125796369496904,"delta_vs_keep":-40.33172780558903}}
{"run":859,"commit":"8b55918","metric":58.118461354839425,"metrics":{},"status":"discard","description":"Mirror recovery continuation sample after collapse wave.","timestamp":1776294840689,"segment":23,"confidence":5.171408944818319,"iterationTokens":1675,"asi":{"hypothesis":"Repeated unchanged runs may recover from collapse back toward 90+ band.","rollback_reason":"Still deeply degraded (~58.12 tok/s).","next_action_hint":"Check paired control again to keep collapse attribution current; continue waiting out regime before new candidate probes.","backend":"mirror_sd_mlx","context_only_draft_cache":1,"draft_sink":48,"stability_probe":true,"delta_vs_keep":-48.741538645160574}}
{"run":860,"commit":"8b55918","metric":67.79233144728639,"metrics":{},"status":"discard","description":"Control parity check during ongoing collapse-recovery phase (mirror disabled).","timestamp":1776294883689,"segment":23,"confidence":5.081232698372319,"iterationTokens":693,"asi":{"hypothesis":"Control should also remain degraded if collapse is shared rather than mirror-local.","rollback_reason":"Control also low (~67.79), confirming continued shared slowdown.","next_action_hint":"Return to mirror and continue recovery sampling; hold off on candidate testing until >90 band returns.","backend":"bstnxbt_mlx","mirror_runtime_enabled":0,"context_only_draft_cache":1,"draft_sink":48,"paired_mirror_tok_s":58.118461354839425,"paired_delta_tok_s":-9.673870092446966,"shared_collapse_confirmed":true}}
{"run":861,"commit":"8b55918","metric":70.63163776345925,"metrics":{},"status":"discard","description":"Mirror recovery sample after control ~67.79 collapse check.","timestamp":1776294920142,"segment":23,"confidence":5.002279083011674,"iterationTokens":662,"asi":{"hypothesis":"Mirror may rebound gradually once shared collapse trough passes.","rollback_reason":"Still far below keep despite slight improvement to ~70.63.","next_action_hint":"Continue recovery bundle until at least high-80/90 before resuming structural candidates.","backend":"mirror_sd_mlx","context_only_draft_cache":1,"draft_sink":48,"paired_control_tok_s":67.79233144728639,"paired_delta_tok_s":2.839306316172855,"delta_vs_keep":-36.228362236540754}}
{"run":862,"commit":"8b55918","metric":72.18106062196853,"metrics":{},"status":"discard","description":"Mirror recovery continuation sample (post-collapse).","timestamp":1776294955902,"segment":23,"confidence":4.9257415328856675,"iterationTokens":664,"asi":{"hypothesis":"Recovery trend should continue upward if collapse wave is dissipating.","rollback_reason":"Still materially below keep despite incremental rebound to ~72.18.","next_action_hint":"Keep sampling to map rebound trajectory; avoid candidate tweaks while regime is this low.","backend":"mirror_sd_mlx","context_only_draft_cache":1,"draft_sink":48,"stability_probe":true,"delta_vs_keep":-34.67893937803147}}
{"run":863,"commit":"8b55918","metric":75.50564263517079,"metrics":{},"status":"discard","description":"Mirror recovery continuation sample trending upward from trough.","timestamp":1776294986109,"segment":23,"confidence":4.867394618257092,"iterationTokens":585,"asi":{"hypothesis":"If recovery persists, unchanged mirror runs should climb from 70s toward 80s/90s.","rollback_reason":"Improved locally to ~75.51 but still far below keep.","next_action_hint":"Continue rebound mapping and interleave control checks to confirm shared recovery.","backend":"mirror_sd_mlx","context_only_draft_cache":1,"draft_sink":48,"stability_probe":true,"delta_vs_keep":-31.354357364829212}}
