{"run":1938,"commit":"e299525","metric":12.244567839312367,"metrics":{},"status":"discard","description":"Transition parity check: control lane also degraded (~78.85 tok/s, eval_s ~12.24), consistent with shared regime shift.","timestamp":1776388731325,"segment":24,"confidence":0.08428561213337396,"iterationTokens":1546,"asi":{"hypothesis":"This degradation is shared runtime behavior rather than mirror-specific.","rollback_reason":"Parity diagnostic on non-authoritative lane; metric above best floor.","next_action_hint":"Resume unchanged mirror loop and track rebound or further collapse.","parity_check":{"lane":"control_DFLASH_MIRROR_SD_RUNTIME=0","completion_tok_s":78.84760351570779,"dflash_eval_s":12.244567839312367,"safe_mode_activations":0,"spike_events":0}}}
{"run":1939,"commit":"e299525","metric":11.73809895326849,"metrics":{},"status":"discard","description":"Mirror follow-up stayed in degraded band (~82.05 tok/s, eval_s ~11.74) without safe-mode activation.","timestamp":1776388760788,"segment":24,"confidence":0.08423084380806127,"iterationTokens":1438,"asi":{"hypothesis":"Current regime is degraded but not in sharp-spike collapse mode.","rollback_reason":"Primary metric above best floor.","next_action_hint":"Continue unchanged loop to monitor recovery trajectory.","diagnostic_findings":{"completion_tok_s":82.05110974407847,"dflash_eval_s":11.73809895326849,"safe_mode_activations":0,"spike_events":0}}}
{"run":1940,"commit":"e299525","metric":11.00167487654835,"metrics":{},"status":"discard","description":"Recovery sample improved (~87.28 tok/s, eval_s ~11.00) with watchdog inactive.","timestamp":1776388791296,"segment":24,"confidence":0.08268774407206853,"iterationTokens":1398,"asi":{"hypothesis":"Degraded regime is rebounding toward soft/high band without collapse spikes.","rollback_reason":"Primary metric above best floor.","next_action_hint":"Continue unchanged mirror loop for further recovery.","diagnostic_findings":{"completion_tok_s":87.28263087597207,"dflash_eval_s":11.00167487654835,"safe_mode_activations":0}}}
{"run":1941,"commit":"e299525","metric":10.722671035095118,"metrics":{},"status":"discard","description":"Recovery continued (~89.54 tok/s, eval_s ~10.72) without collapse activation.","timestamp":1776388819942,"segment":24,"confidence":0.08119095464938761,"iterationTokens":1383,"asi":{"hypothesis":"Current degraded phase is easing steadily in activation-free mode.","rollback_reason":"Primary metric above best floor.","next_action_hint":"Continue unchanged loop for soft/high re-entry.","diagnostic_findings":{"completion_tok_s":89.53891198661502,"dflash_eval_s":10.722671035095118,"safe_mode_activations":0}}}
{"run":1942,"commit":"e299525","metric":10.67832320893649,"metrics":{},"status":"discard","description":"Loop sample: gradual rebound (~89.80 tok/s, eval_s ~10.68) with watchdog inactive.","timestamp":1776388853427,"segment":24,"confidence":0.08051279818269896,"iterationTokens":1394,"asi":{"hypothesis":"Unchanged loop remains best for tracking shared regime recovery without overfitting.","rollback_reason":"Primary metric above best floor.","next_action_hint":"Continue unchanged mirror loop; parity only on fresh hard transition.","diagnostic_findings":{"completion_tok_s":89.80380937377718,"dflash_eval_s":10.67832320893649,"safe_mode_activations":0}}}
{"run":1943,"commit":"e299525","metric":10.463031960534863,"metrics":{},"status":"discard","description":"Loop sample: continued rebound (~91.53 tok/s, eval_s ~10.46) with no collapse triggers.","timestamp":1776388885983,"segment":24,"confidence":0.07981730840187101,"iterationTokens":1395,"asi":{"hypothesis":"Regime is moving back toward soft/high band after recent collapse.","rollback_reason":"Primary metric above best floor.","next_action_hint":"Continue unchanged loop to monitor re-entry into low-9/high window.","diagnostic_findings":{"completion_tok_s":91.53160168771988,"dflash_eval_s":10.463031960534863,"safe_mode_activations":0}}}
{"run":1944,"commit":"e299525","metric":10.077306338236667,"metrics":{},"status":"discard","description":"Loop sample: rebound into sub-10.1 eval (~94.88 tok/s), no safe-mode activation.","timestamp":1776388914222,"segment":24,"confidence":0.07806077081506806,"iterationTokens":1400,"asi":{"hypothesis":"Recovery is nearing soft/high boundary after shared collapse episode.","rollback_reason":"Primary metric above best floor.","next_action_hint":"Continue unchanged loop for low-9/high-window re-entry.","diagnostic_findings":{"completion_tok_s":94.88470516601011,"dflash_eval_s":10.077306338236667,"safe_mode_activations":0}}}
{"run":1945,"commit":"e299525","metric":10.053252708516084,"metrics":{},"status":"discard","description":"Loop sample: continued recovery (~95.12 tok/s, eval_s ~10.05) with watchdog idle.","timestamp":1776388945090,"segment":24,"confidence":0.07637988061883388,"iterationTokens":1411,"asi":{"hypothesis":"Unchanged loop remains best to observe natural rebound after shared collapse.","rollback_reason":"Primary metric above best floor.","next_action_hint":"Continue unchanged mirror loop until high-window re-entry or next hard transition.","diagnostic_findings":{"completion_tok_s":95.11818825229709,"dflash_eval_s":10.053252708516084,"safe_mode_activations":0}}}
{"run":1946,"commit":"e299525","metric":10.125261454144493,"metrics":{},"status":"discard","description":"Loop sample: slight rebound wobble (~94.27 tok/s, eval_s ~10.13) with no collapse triggers.","timestamp":1776388974584,"segment":24,"confidence":0.07589843713049689,"iterationTokens":1398,"asi":{"hypothesis":"Recovery remains in soft-band drift before high-window reopening.","rollback_reason":"Primary metric above best floor.","next_action_hint":"Continue unchanged mirror loop and monitor transition.","diagnostic_findings":{"completion_tok_s":94.27173072037962,"dflash_eval_s":10.125261454144493,"safe_mode_activations":0}}}
{"run":1947,"commit":"e299525","metric":9.89280424802564,"metrics":{},"status":"discard","description":"Loop sample: rebound crossed into sub-10 eval (~96.63 tok/s) with watchdog inactive.","timestamp":1776389006661,"segment":24,"confidence":0.07538165319834016,"iterationTokens":1386,"asi":{"hypothesis":"Regime is returning toward high-soft zone after collapse.","rollback_reason":"Primary metric above best floor.","next_action_hint":"Continue unchanged loop for low-9/high-window confirmation.","diagnostic_findings":{"completion_tok_s":96.63385352450366,"dflash_eval_s":9.89280424802564,"safe_mode_activations":0}}}
{"run":1948,"commit":"e299525","metric":9.82875358441379,"metrics":{},"status":"discard","description":"Loop sample: continued sub-10 rebound (~97.19 tok/s, eval_s ~9.83), no collapse triggers.","timestamp":1776389041346,"segment":24,"confidence":0.07478666644960308,"iterationTokens":1384,"asi":{"hypothesis":"Recovery continues steadily in activation-free mode.","rollback_reason":"Primary metric above best floor.","next_action_hint":"Continue unchanged loop for low-9/high-window return.","diagnostic_findings":{"completion_tok_s":97.19201641757648,"dflash_eval_s":9.82875358441379,"safe_mode_activations":0}}}
{"run":1949,"commit":"e299525","metric":9.74341371236369,"metrics":{},"status":"discard","description":"Loop sample: recovery improved (~98.01 tok/s, eval_s ~9.74) with watchdog idle.","timestamp":1776389069301,"segment":24,"confidence":0.07420099859760634,"iterationTokens":1392,"asi":{"hypothesis":"Regime is converging back toward high-soft band.","rollback_reason":"Primary metric above best floor.","next_action_hint":"Continue unchanged mirror loop.","diagnostic_findings":{"completion_tok_s":98.00560586593888,"dflash_eval_s":9.74341371236369,"safe_mode_activations":0}}}
{"run":1950,"commit":"e299525","metric":9.607055626809597,"metrics":{},"status":"discard","description":"Loop sample: near-soft rebound (~99.25 tok/s, eval_s ~9.61) with no collapse activation.","timestamp":1776389102324,"segment":24,"confidence":0.0731837549402449,"iterationTokens":1376,"asi":{"hypothesis":"Unchanged loop is recovering toward high-window after recent transition.","rollback_reason":"Primary metric above best floor.","next_action_hint":"Continue unchanged loop and monitor for high-soft re-entry.","diagnostic_findings":{"completion_tok_s":99.24796125122461,"dflash_eval_s":9.607055626809597,"safe_mode_activations":0}}}
{"run":1951,"commit":"e299525","metric":9.462985790916719,"metrics":{},"status":"discard","description":"Loop sample: recovered to low-9 band (~100.71 tok/s, eval_s ~9.46) with watchdog idle.","timestamp":1776389132171,"segment":24,"confidence":0.07431629219136503,"iterationTokens":1399,"asi":{"hypothesis":"Regime is re-entering soft/high boundary after collapse.","rollback_reason":"Primary metric above best floor.","next_action_hint":"Continue unchanged loop for high-window confirmation.","diagnostic_findings":{"completion_tok_s":100.7078141519412,"dflash_eval_s":9.462985790916719,"safe_mode_activations":0}}}
{"run":1952,"commit":"e299525","metric":9.3620464974083,"metrics":{},"status":"discard","description":"Loop sample: low-9 rebound (~101.65 tok/s, eval_s ~9.36) with no collapse triggers.","timestamp":1776389159897,"segment":24,"confidence":0.075121841033961,"iterationTokens":1393,"asi":{"hypothesis":"Recovery is progressing toward high-window conditions.","rollback_reason":"Primary metric above best floor.","next_action_hint":"Continue unchanged mirror loop and await either high-window return or next transition.","diagnostic_findings":{"completion_tok_s":101.65139002568571,"dflash_eval_s":9.3620464974083,"safe_mode_activations":0}}}
{"run":1953,"commit":"e299525","metric":9.310967252589762,"metrics":{},"status":"discard","description":"Loop sample: continued low-9 recovery (~102.22 tok/s, eval_s ~9.31), watchdog idle.","timestamp":1776389190638,"segment":24,"confidence":0.07594504468205196,"iterationTokens":1394,"asi":{"hypothesis":"Regime is approaching stable high-soft band after latest collapse.","rollback_reason":"Primary metric above best floor.","next_action_hint":"Continue unchanged loop; parity only on fresh hard transition.","diagnostic_findings":{"completion_tok_s":102.22441254140689,"dflash_eval_s":9.310967252589762,"safe_mode_activations":0}}}
{"run":1954,"commit":"e299525","metric":9.262146714143455,"metrics":{},"status":"discard","description":"Loop sample: low-9 recovery strengthened (~102.70 tok/s, eval_s ~9.26), no collapse activation.","timestamp":1776389218771,"segment":24,"confidence":0.07649612049486769,"iterationTokens":1396,"asi":{"hypothesis":"Recovery is steadily approaching high-window behavior.","rollback_reason":"Primary metric above best floor.","next_action_hint":"Continue unchanged mirror loop.","diagnostic_findings":{"completion_tok_s":102.70464938097037,"dflash_eval_s":9.262146714143455,"safe_mode_activations":0}}}
{"run":1955,"commit":"e299525","metric":9.322396712726913,"metrics":{},"status":"discard","description":"Loop sample: low-9 band stabilized (~101.94 tok/s, eval_s ~9.32), watchdog idle.","timestamp":1776389250636,"segment":24,"confidence":0.07706927157169105,"iterationTokens":1399,"asi":{"hypothesis":"Recovery is flattening in low-9 band before possible high-window return.","rollback_reason":"Primary metric above best floor.","next_action_hint":"Continue unchanged loop for further drift/rebound mapping.","diagnostic_findings":{"completion_tok_s":101.93739535793242,"dflash_eval_s":9.322396712726913,"safe_mode_activations":0}}}
{"run":1956,"commit":"e299525","metric":9.17033545661252,"metrics":{},"status":"discard","description":"Loop sample: low-9 rebound strengthened (~103.59 tok/s, eval_s ~9.17), no collapse triggers.","timestamp":1776389288718,"segment":24,"confidence":0.07758343238603765,"iterationTokens":1400,"asi":{"hypothesis":"Regime is nearing high-window re-entry with stable step-latency.","rollback_reason":"Primary metric above best floor.","next_action_hint":"Continue unchanged loop and watch for floor retest.","diagnostic_findings":{"completion_tok_s":103.59496926550025,"dflash_eval_s":9.17033545661252,"safe_mode_activations":0}}}
{"run":1957,"commit":"e299525","metric":9.164927581208758,"metrics":{},"status":"discard","description":"Loop sample: low-9 rebound held (~103.63 tok/s, eval_s ~9.165) with watchdog idle.","timestamp":1776389319289,"segment":24,"confidence":0.07810449963263663,"iterationTokens":1400,"asi":{"hypothesis":"Recovered regime is stabilizing in low-9 band.","rollback_reason":"Primary metric above best floor.","next_action_hint":"Continue unchanged loop for high-window return.","diagnostic_findings":{"completion_tok_s":103.63068432604804,"dflash_eval_s":9.164927581208758,"safe_mode_activations":0}}}
{"run":1958,"commit":"e299525","metric":9.127242834540084,"metrics":{},"status":"discard","description":"Loop sample: low-9 recovery (~104.12 tok/s, eval_s ~9.13) with no collapse activity.","timestamp":1776389352897,"segment":24,"confidence":0.07958676850364929,"iterationTokens":1389,"asi":{"hypothesis":"Recovery is nearing high-soft window while acceptance remains invariant.","rollback_reason":"Primary metric above best floor.","next_action_hint":"Continue unchanged loop for near-best retest.","diagnostic_findings":{"completion_tok_s":104.11508210496783,"dflash_eval_s":9.127242834540084,"safe_mode_activations":0}}}
{"run":1959,"commit":"e299525","metric":9.159353045048192,"metrics":{},"status":"discard","description":"Loop sample: low-9 rebound persisted (~103.61 tok/s, eval_s ~9.16), watchdog idle.","timestamp":1776389381753,"segment":24,"confidence":0.08067937853448505,"iterationTokens":1401,"asi":{"hypothesis":"Unchanged loop remains in recovered low-9 regime with no collapse indicators.","rollback_reason":"Primary metric above best floor.","next_action_hint":"Continue unchanged loop; parity check only on fresh hard transition.","diagnostic_findings":{"completion_tok_s":103.60679380316225,"dflash_eval_s":9.159353045048192,"safe_mode_activations":0}}}
{"run":1960,"commit":"e299525","metric":9.08786637475714,"metrics":{},"status":"discard","description":"Loop sample: near high-soft edge (~104.31 tok/s, eval_s ~9.09), watchdog idle.","timestamp":1776389411492,"segment":24,"confidence":0.08133457597093124,"iterationTokens":1422,"asi":{"hypothesis":"Recovered regime is approaching stable high-window behavior.","rollback_reason":"Primary metric above best floor.","next_action_hint":"Continue unchanged loop for near-best retest.","diagnostic_findings":{"completion_tok_s":104.31103155794699,"dflash_eval_s":9.08786637475714,"safe_mode_activations":0}}}
{"run":1961,"commit":"e299525","metric":8.940308794029988,"metrics":{},"status":"discard","description":"Loop sample: high-soft re-entry (~106.21 tok/s, eval_s ~8.94) with watchdog idle.","timestamp":1776389440443,"segment":24,"confidence":0.08200050225645368,"iterationTokens":1396,"asi":{"hypothesis":"Recovery completed back into high-soft conditions after prior shared collapse.","rollback_reason":"Primary metric above best floor.","next_action_hint":"Continue unchanged loop for floor retest and transition monitoring.","diagnostic_findings":{"completion_tok_s":106.21342393736018,"dflash_eval_s":8.940308794029988,"safe_mode_activations":0}}}
{"run":1962,"commit":"e299525","metric":8.964268126757815,"metrics":{},"status":"discard","description":"Loop sample: high-soft band held (~105.89 tok/s, eval_s ~8.96), watchdog inactive.","timestamp":1776389471539,"segment":24,"confidence":0.083514462722789,"iterationTokens":1396,"asi":{"hypothesis":"Post-collapse recovery has stabilized in high-soft range.","rollback_reason":"Primary metric above best floor.","next_action_hint":"Continue unchanged loop for low-floor retest.","diagnostic_findings":{"completion_tok_s":105.88877116732677,"dflash_eval_s":8.964268126757815,"safe_mode_activations":0}}}
{"run":1963,"commit":"e299525","metric":9.145031040534377,"metrics":{},"status":"discard","description":"Loop sample: high-soft edge (~103.64 tok/s, eval_s ~9.15) with watchdog idle.","timestamp":1776389503831,"segment":24,"confidence":0.08493428396136442,"iterationTokens":1399,"asi":{"hypothesis":"Regime remains recovered but not yet at local floor.","rollback_reason":"Primary metric above best floor.","next_action_hint":"Continue unchanged loop for floor retest and transition monitoring.","diagnostic_findings":{"completion_tok_s":103.63651665069254,"dflash_eval_s":9.145031040534377,"safe_mode_activations":0}}}
{"run":1964,"commit":"e299525","metric":10.057945205713622,"metrics":{},"status":"discard","description":"Loop sample: soft-band wobble (~94.48 tok/s, eval_s ~10.06) with watchdog idle.","timestamp":1776389533661,"segment":24,"confidence":0.0835704095338099,"iterationTokens":1391,"asi":{"hypothesis":"Recovered regime can still oscillate around sub-10 boundary without collapse events.","rollback_reason":"Primary metric above best floor.","next_action_hint":"Continue unchanged loop for return to low-9/high-window band.","diagnostic_findings":{"completion_tok_s":94.47818706641841,"dflash_eval_s":10.057945205713622,"safe_mode_activations":0}}}
{"run":1965,"commit":"e299525","metric":9.901362669072114,"metrics":{},"status":"discard","description":"Loop sample: sub-10 soft-band run (~96.01 tok/s, eval_s ~9.90) with no collapse triggers.","timestamp":1776389567127,"segment":24,"confidence":0.0825553827697196,"iterationTokens":1413,"asi":{"hypothesis":"Regime remains in recovery band with stable telemetry.","rollback_reason":"Primary metric above best floor.","next_action_hint":"Continue unchanged loop.","diagnostic_findings":{"completion_tok_s":96.00922626210689,"dflash_eval_s":9.901362669072114,"safe_mode_activations":0}}}
{"run":1966,"commit":"e299525","metric":10.219856009236537,"metrics":{},"status":"discard","description":"Loop sample: softer drift (~93.06 tok/s, eval_s ~10.22) with watchdog idle.","timestamp":1776389598310,"segment":24,"confidence":0.08183683911341122,"iterationTokens":1382,"asi":{"hypothesis":"Recovery remains noisy; unchanged loop still best for unbiased tracking.","rollback_reason":"Primary metric above best floor.","next_action_hint":"Continue unchanged loop for return to low-9/high band.","diagnostic_findings":{"completion_tok_s":93.06260219630988,"dflash_eval_s":10.219856009236537,"safe_mode_activations":0}}}
{"run":1967,"commit":"e299525","metric":14.336201711324975,"metrics":{},"status":"discard","description":"New transition into degraded state (~56.47 tok/s, eval_s ~14.34) with early safe-mode activation at step 9.","timestamp":1776389645814,"segment":24,"confidence":0.08152175357783183,"iterationTokens":1402,"asi":{"hypothesis":"Collapse/rebound cycles continue to recur even after high-soft recoveries.","rollback_reason":"Primary metric far above best floor.","next_action_hint":"Run immediate control parity check for this new transition.","diagnostic_findings":{"completion_tok_s":56.46815304732416,"dflash_eval_s":14.336201711324975,"safe_mode_step":9,"severe_spike_events":3}}}
{"run":1968,"commit":"e299525","metric":14.919839663780294,"metrics":{},"status":"discard","description":"Immediate control parity also degraded (~54.05 tok/s, eval_s ~14.92), confirming shared transition collapse.","timestamp":1776389690905,"segment":24,"confidence":0.08029014007736648,"iterationTokens":1431,"asi":{"hypothesis":"This transition is shared runtime-state behavior across mirror/control.","rollback_reason":"Parity diagnostic non-authoritative lane; metric above best floor.","next_action_hint":"Resume unchanged mirror loop to capture recovery ladder.","parity_check":{"lane":"control_DFLASH_MIRROR_SD_RUNTIME=0","completion_tok_s":54.050021843647805,"dflash_eval_s":14.919839663780294,"safe_mode_step":8,"severe_spike_events":4}}}
{"run":1969,"commit":"e299525","metric":13.0619070493849,"metrics":{},"status":"discard","description":"Post-parity mirror run remained degraded (~73.94 tok/s, eval_s ~13.06) without safe-mode activation.","timestamp":1776389734187,"segment":24,"confidence":0.07889370098120675,"iterationTokens":1419,"asi":{"hypothesis":"Current collapse phase may present as broad eval inflation below spike thresholds.","rollback_reason":"Primary metric above best floor.","next_action_hint":"Continue unchanged loop to observe rebound trajectory.","diagnostic_findings":{"completion_tok_s":73.93955764026924,"dflash_eval_s":13.0619070493849,"safe_mode_activations":0,"eval_step_max_s":0.16522874997463077}}}
{"run":1970,"commit":"e299525","metric":12.988796039600857,"metrics":{},"status":"discard","description":"Loop sample: degraded band persisted (~74.18 tok/s, eval_s ~12.99), watchdog remained inactive.","timestamp":1776389770191,"segment":24,"confidence":0.07822077028302343,"iterationTokens":1415,"asi":{"hypothesis":"Current regime remains in medium-latency inflation state without triggering spike logic.","rollback_reason":"Primary metric above best floor.","next_action_hint":"Continue unchanged loop; wait for rebound or hard spike transition.","diagnostic_findings":{"completion_tok_s":74.17925077530278,"dflash_eval_s":12.988796039600857,"safe_mode_activations":0}}}
{"run":1971,"commit":"e299525","metric":10.86400549823884,"metrics":{},"status":"discard","description":"Loop sample: rebound resumed (~88.24 tok/s, eval_s ~10.86) with watchdog idle.","timestamp":1776389802257,"segment":24,"confidence":0.07755922213843074,"iterationTokens":1408,"asi":{"hypothesis":"Degraded regime remains recoverable without triggering collapse guard.","rollback_reason":"Primary metric above best floor.","next_action_hint":"Continue unchanged loop for low-9 re-entry.","diagnostic_findings":{"completion_tok_s":88.23620997083373,"dflash_eval_s":10.86400549823884,"safe_mode_activations":0}}}
