{"run":804,"commit":"8b55918","metric":106.08391512265803,"metrics":{},"status":"discard","description":"Control symmetry sample after low-104 mirror anchor (mirror disabled).","timestamp":1776290210907,"segment":23,"confidence":3.173523389664768,"iterationTokens":689,"asi":{"hypothesis":"If low-104 mirror sample was jitter, control may rebound back into ~106 band on adjacent run.","rollback_reason":"Control rebounded strongly to 106.08; indicates high local variance rather than stable backend shift.","next_action_hint":"Run immediate mirror follow-up before interpreting backend delta.","backend":"bstnxbt_mlx","mirror_runtime_enabled":0,"context_only_draft_cache":1,"draft_sink":48,"paired_mirror_tok_s":104.43808662914995,"paired_delta_tok_s":-1.645828493508086}}
{"run":805,"commit":"8b55918","metric":106.20427060784641,"metrics":{},"status":"discard","description":"Mirror follow-up after control rebound to ~106 band.","timestamp":1776290242471,"segment":23,"confidence":3.190238768168484,"iterationTokens":653,"asi":{"hypothesis":"Mirror should rebound similarly if prior low-104 sample was transient jitter.","rollback_reason":"Mirror recovered to 106.20 but still below keep.","next_action_hint":"Recovery to high-106 band confirmed; resume structural candidate attempts with immediate confirmations for near-keep results.","backend":"mirror_sd_mlx","context_only_draft_cache":1,"draft_sink":48,"paired_control_tok_s":106.08391512265803,"paired_delta_tok_s":0.1203554851883793,"delta_vs_keep":-0.6557293921535863}}
{"run":806,"commit":"8b55918","metric":106.36236688189311,"metrics":{},"status":"discard","description":"Structural mirror call-path tweak: pre-resolve mirror exit layer once per request and pass fixed exit_layer into target-forward calls.","timestamp":1776290332636,"segment":23,"confidence":3.21305025844435,"iterationTokens":4819,"asi":{"hypothesis":"Avoiding per-verify exit-layer resolution/env cache lookups in mirror target-forward calls should trim hot-loop overhead.","rollback_reason":"High sample but still below keep (106.36 vs 106.86).","next_action_hint":"Revert fixed-exit pre-resolution patch; keep current runtime path unless future confirmation exceeds keep.","backend":"mirror_sd_mlx","context_only_draft_cache":1,"draft_sink":48,"optimization":"mirror_exit_layer_pre_resolve","delta_vs_keep":-0.4976331181068865}}
{"run":807,"commit":"8b55918","metric":106.29410168823541,"metrics":{},"status":"discard","description":"Post-revert mirror anchor after exit-layer pre-resolution structural trial.","timestamp":1776290365884,"segment":23,"confidence":3.251111652407759,"iterationTokens":683,"asi":{"hypothesis":"If candidate had no real gain, reverted baseline should land near the same high-106 band.","rollback_reason":"Anchor matched candidate band and still below keep.","next_action_hint":"Treat exit-layer pre-resolution as noise-equivalent; seek higher-leverage structural ideas.","backend":"mirror_sd_mlx","context_only_draft_cache":1,"draft_sink":48,"stability_probe":true,"delta_vs_keep":-0.5658983117645889}}
{"run":808,"commit":"8b55918","metric":105.88748461080004,"metrics":{},"status":"discard","description":"Control parity sample in recovered high-106 window (mirror disabled).","timestamp":1776290407308,"segment":23,"confidence":3.3411824745561836,"iterationTokens":699,"asi":{"hypothesis":"Control should remain near mirror high-band anchor with small ordering flips.","rollback_reason":"Control slightly below mirror anchor; still below keep.","next_action_hint":"Run mirror follow-up to keep paired trend current before next candidate.","backend":"bstnxbt_mlx","mirror_runtime_enabled":0,"context_only_draft_cache":1,"draft_sink":48,"paired_mirror_tok_s":106.29410168823541,"paired_delta_tok_s":0.4066170774353711}}
{"run":809,"commit":"8b55918","metric":105.70552359122715,"metrics":{},"status":"discard","description":"Mirror follow-up after control parity sample in high-105/106 band.","timestamp":1776290439126,"segment":23,"confidence":3.489894256083388,"iterationTokens":625,"asi":{"hypothesis":"Mirror should remain near control with modest jitter in recovered regime.","rollback_reason":"Mirror remained high but below keep.","next_action_hint":"Continue structural exploration, but require >106.86 with confirmations before any keep.","backend":"mirror_sd_mlx","context_only_draft_cache":1,"draft_sink":48,"paired_control_tok_s":105.88748461080004,"paired_delta_tok_s":-0.18196101957288693,"delta_vs_keep":-1.1544764087728556}}
{"run":810,"commit":"8b55918","metric":105.86373754722177,"metrics":{},"status":"discard","description":"Mirror block-size extension: DFLASH_BLOCK_TOKENS=12.","timestamp":1776290481864,"segment":23,"confidence":3.6453129261736685,"iterationTokens":750,"asi":{"hypothesis":"Lower block size 12 may reduce verify/reject overhead and outperform current 15 in recovered regime.","rollback_reason":"Below keep (105.86 vs 106.86).","next_action_hint":"Add block_tokens=12 to mirror do-not-retry set; keep block 15 remains superior.","backend":"mirror_sd_mlx","context_only_draft_cache":1,"draft_sink":48,"block_tokens":12,"delta_vs_keep":-0.9962624527782326}}
{"run":811,"commit":"8b55918","metric":105.84942366484158,"metrics":{},"status":"discard","description":"Mirror block-size extension: DFLASH_BLOCK_TOKENS=11.","timestamp":1776290514265,"segment":23,"confidence":3.670255396382278,"iterationTokens":654,"asi":{"hypothesis":"Further reduced block size 11 might better fit current acceptance dynamics than 15.","rollback_reason":"Below keep (105.85 vs 106.86).","next_action_hint":"Add block_tokens=11 to mirror do-not-retry set; smaller blocks are not outperforming keep.","backend":"mirror_sd_mlx","context_only_draft_cache":1,"draft_sink":48,"block_tokens":11,"delta_vs_keep":-1.0105763351584172}}
{"run":812,"commit":"8b55918","metric":106.23703148465442,"metrics":{},"status":"discard","description":"Mirror block-size extension: DFLASH_BLOCK_TOKENS=19.","timestamp":1776290550532,"segment":23,"confidence":3.695541547895131,"iterationTokens":628,"asi":{"hypothesis":"Larger block size 19 might improve speculative amortization beyond tested 18.","rollback_reason":"Near-keep but still below winner (106.24 vs 106.86).","next_action_hint":"Add block_tokens=19 to mirror do-not-retry set; larger block extension does not beat keep.","backend":"mirror_sd_mlx","context_only_draft_cache":1,"draft_sink":48,"block_tokens":19,"delta_vs_keep":-0.6229685153455794}}
{"run":813,"commit":"8b55918","metric":105.9591319249321,"metrics":{},"status":"discard","description":"Mirror block-size extension: DFLASH_BLOCK_TOKENS=20.","timestamp":1776290596189,"segment":23,"confidence":3.779342366719659,"iterationTokens":648,"asi":{"hypothesis":"Block size 20 might outperform nearby large block values in current high-band regime.","rollback_reason":"Below keep (105.96 vs 106.86).","next_action_hint":"Add block_tokens=20 to do-not-retry set; high block-size extension remains non-winning.","backend":"mirror_sd_mlx","context_only_draft_cache":1,"draft_sink":48,"block_tokens":20,"delta_vs_keep":-0.9008680750679}}
{"run":814,"commit":"8b55918","metric":106.31905917182254,"metrics":{},"status":"discard","description":"Mirror anchor after extended block-size neighborhood sweep.","timestamp":1776290634998,"segment":23,"confidence":3.8373229550232213,"iterationTokens":782,"asi":{"hypothesis":"Restored keep shape should stay in high-106 local band after non-winning block-size probes.","rollback_reason":"Strong anchor but still below keep.","next_action_hint":"Continue structural exploration; block-size neighborhood now largely exhausted around keep=15.","backend":"mirror_sd_mlx","context_only_draft_cache":1,"draft_sink":48,"stability_probe":true,"delta_vs_keep":-0.5409408281774554}}
{"run":815,"commit":"8b55918","metric":105.77133343938684,"metrics":{},"status":"discard","description":"Control parity sample after high-106 mirror anchor (mirror disabled).","timestamp":1776290676961,"segment":23,"confidence":3.9299663056896845,"iterationTokens":683,"asi":{"hypothesis":"Control should remain near mirror anchor with small jitter in current recovered regime.","rollback_reason":"Control remained high but below mirror anchor and below keep.","next_action_hint":"Run mirror follow-up to maintain paired trend context before next structural trial.","backend":"bstnxbt_mlx","mirror_runtime_enabled":0,"context_only_draft_cache":1,"draft_sink":48,"paired_mirror_tok_s":106.31905917182254,"paired_delta_tok_s":0.5477257324357064}}
{"run":816,"commit":"8b55918","metric":105.96778932664932,"metrics":{},"status":"discard","description":"Mirror follow-up after control parity sample in high-105/106 regime.","timestamp":1776290712020,"segment":23,"confidence":4.023273339323101,"iterationTokens":629,"asi":{"hypothesis":"Mirror should remain tightly coupled to control while staying near local high band.","rollback_reason":"Mirror remained high but below keep.","next_action_hint":"With parity sustained and no >106.86 wins, continue structural search and avoid exhausted knob churn.","backend":"mirror_sd_mlx","context_only_draft_cache":1,"draft_sink":48,"paired_control_tok_s":105.77133343938684,"paired_delta_tok_s":0.1964558872624796,"delta_vs_keep":-0.8922106733506922}}
{"run":817,"commit":"8b55918","metric":104.52633080461325,"metrics":{},"status":"discard","description":"Mirror block-size extension: DFLASH_BLOCK_TOKENS=10.","timestamp":1776290748160,"segment":23,"confidence":4.049641957666792,"iterationTokens":760,"asi":{"hypothesis":"Smaller block size 10 could improve acceptance/verify balance versus keep=15.","rollback_reason":"Regression versus keep and local baseline.","next_action_hint":"Add block_tokens=10 to mirror do-not-retry set; low block sizes remain non-winning.","backend":"mirror_sd_mlx","context_only_draft_cache":1,"draft_sink":48,"block_tokens":10,"delta_vs_keep":-2.3336691953867486}}
{"run":818,"commit":"8b55918","metric":105.27396971954155,"metrics":{},"status":"discard","description":"Mirror block-size extension: DFLASH_BLOCK_TOKENS=9.","timestamp":1776290781961,"segment":23,"confidence":4.0763584972554945,"iterationTokens":622,"asi":{"hypothesis":"No-EOS historical favorite 9 might transfer to normal-EOS mirror lane under current regime.","rollback_reason":"Still below keep (105.27 vs 106.86).","next_action_hint":"Add block_tokens=9 to mirror do-not-retry set; no transfer from no-EOS optimum.","backend":"mirror_sd_mlx","context_only_draft_cache":1,"draft_sink":48,"block_tokens":9,"delta_vs_keep":-1.5860302804584485}}
{"run":819,"commit":"8b55918","metric":105.40186216225061,"metrics":{},"status":"discard","description":"Mirror block-size extension: DFLASH_BLOCK_TOKENS=8.","timestamp":1776290815365,"segment":23,"confidence":4.101955277072173,"iterationTokens":645,"asi":{"hypothesis":"Further reduced block size 8 might improve stability and throughput in current recovered regime.","rollback_reason":"Below keep (105.40 vs 106.86).","next_action_hint":"Add block_tokens=8 to mirror do-not-retry set; reduced blocks continue to underperform.","backend":"mirror_sd_mlx","context_only_draft_cache":1,"draft_sink":48,"block_tokens":8,"delta_vs_keep":-1.4581378377493937}}
{"run":820,"commit":"8b55918","metric":105.98384184225473,"metrics":{},"status":"discard","description":"Mirror anchor after low-block-size extension sweep (restored keep shape).","timestamp":1776290864540,"segment":23,"confidence":4.132002463049588,"iterationTokens":807,"asi":{"hypothesis":"Reverting to keep block size should return to high-105/106 band.","rollback_reason":"Anchor is high but still below keep.","next_action_hint":"Block-size family is now broadly exhausted; focus on structural changes only.","backend":"mirror_sd_mlx","context_only_draft_cache":1,"draft_sink":48,"stability_probe":true,"delta_vs_keep":-0.8761581577452698}}
{"run":821,"commit":"8b55918","metric":105.82995911347064,"metrics":{},"status":"discard","description":"2D combo probe: DFLASH_BSTNXBT_SPLIT_CHUNK_SIZE=2 with DFLASH_BLOCK_TOKENS=19.","timestamp":1776290916905,"segment":23,"confidence":4.216129246933244,"iterationTokens":1423,"asi":{"hypothesis":"Two near-keep one-dimensional settings might compose into a local optimum above current keep.","rollback_reason":"Combination underperformed keep and both near-keep singles.","next_action_hint":"Avoid cross-product churn between near-keep chunk/block values; they are not composing positively.","backend":"mirror_sd_mlx","context_only_draft_cache":1,"draft_sink":48,"split_chunk_size":2,"block_tokens":19,"delta_vs_keep":-1.0300408865293647}}
{"run":822,"commit":"8b55918","metric":103.38595132115347,"metrics":{},"status":"discard","description":"Mirror anchor after 2D chunk/block combo probe reverted.","timestamp":1776290971291,"segment":23,"confidence":4.136920018361764,"iterationTokens":845,"asi":{"hypothesis":"Restored keep-shape should return to current high-105/106 band.","rollback_reason":"Anchor dipped to 103.39, indicating local instability/jitter resurgence.","next_action_hint":"Run control symmetry sample to classify whether this dip is shared.","backend":"mirror_sd_mlx","context_only_draft_cache":1,"draft_sink":48,"stability_probe":true,"delta_vs_keep":-3.4740486788465303}}
{"run":823,"commit":"8b55918","metric":105.15786265037924,"metrics":{},"status":"discard","description":"Control symmetry sample after mirror dipped to 103.39 (mirror disabled).","timestamp":1776291009918,"segment":23,"confidence":4.2208418663065626,"iterationTokens":698,"asi":{"hypothesis":"If mirror dip is mostly jitter, control should remain closer to high-105 band.","rollback_reason":"Control at 105.16 suggests mirror dip was local jitter rather than shared collapse.","next_action_hint":"Run mirror follow-up to check immediate reversion toward control band.","backend":"bstnxbt_mlx","mirror_runtime_enabled":0,"context_only_draft_cache":1,"draft_sink":48,"paired_mirror_tok_s":103.38595132115347,"paired_delta_tok_s":-1.7719113292257755}}
{"run":824,"commit":"8b55918","metric":104.7851421120369,"metrics":{},"status":"discard","description":"Mirror follow-up after control high-105 symmetry sample.","timestamp":1776291049611,"segment":23,"confidence":4.308239105192257,"iterationTokens":654,"asi":{"hypothesis":"Mirror should recover toward control if prior dip was transient.","rollback_reason":"Mirror only partially recovered to 104.79 and remains below keep.","next_action_hint":"Continue paired-bundle tracking; treat sub-1 tok/s backend deltas as noise in this jitter window.","backend":"mirror_sd_mlx","context_only_draft_cache":1,"draft_sink":48,"paired_control_tok_s":105.15786265037924,"paired_delta_tok_s":-0.3727205383423378,"delta_vs_keep":-2.074857887963102}}
{"run":825,"commit":"8b55918","metric":104.3552902868808,"metrics":{},"status":"discard","description":"Additional mirror stability sample in current low-104/105 jitter band.","timestamp":1776291080496,"segment":23,"confidence":4.315861280154095,"iterationTokens":662,"asi":{"hypothesis":"Repeated unchanged samples help estimate local median and variance for parity tracking.","rollback_reason":"Sample remains below keep and below recent local highs.","next_action_hint":"Run control pair sample to keep parity window calibrated.","backend":"mirror_sd_mlx","context_only_draft_cache":1,"draft_sink":48,"bundle_tracking":true,"delta_vs_keep":-2.504709713119203}}
{"run":826,"commit":"8b55918","metric":104.58534566665337,"metrics":{},"status":"discard","description":"Control pair sample in current low-104/105 stability window (mirror disabled).","timestamp":1776291125671,"segment":23,"confidence":4.323510473356406,"iterationTokens":673,"asi":{"hypothesis":"Control should track mirror closely if current regime is shared jitter rather than backend divergence.","rollback_reason":"Control closely matched paired mirror and remains below keep.","next_action_hint":"Run mirror follow-up to complete mini-bundle and update local median estimate.","backend":"bstnxbt_mlx","mirror_runtime_enabled":0,"context_only_draft_cache":1,"draft_sink":48,"bundle_tracking":true,"paired_mirror_tok_s":104.3552902868808,"paired_delta_tok_s":-0.23005537977256946}}
{"run":827,"commit":"8b55918","metric":104.42587236614695,"metrics":{},"status":"discard","description":"Mirror follow-up completing low-104/105 parity mini-bundle.","timestamp":1776291177932,"segment":23,"confidence":4.383727821992103,"iterationTokens":648,"asi":{"hypothesis":"Mirror should remain close to control in shared jitter band; bundle medians guide next-step decisions.","rollback_reason":"Mirror remained in low-104 band and below keep.","next_action_hint":"Local median appears around ~104.4–104.6; continue structural-only exploration when variance permits.","backend":"mirror_sd_mlx","context_only_draft_cache":1,"draft_sink":48,"bundle_tracking":true,"paired_control_tok_s":104.58534566665337,"paired_delta_tok_s":-0.1594733005064131,"delta_vs_keep":-2.434127633853051}}
{"run":828,"commit":"8b55918","metric":105.89280170822826,"metrics":{},"status":"discard","description":"Unchanged mirror recovery sample after low-104 mini-bundle.","timestamp":1776291211707,"segment":23,"confidence":4.406426670860663,"iterationTokens":715,"asi":{"hypothesis":"Band may rebound quickly from ~104.5 mini-bundle median without config changes.","rollback_reason":"Recovered to high-105 but still below keep.","next_action_hint":"Take paired control sample to keep backend parity estimate current in this rebound phase.","backend":"mirror_sd_mlx","context_only_draft_cache":1,"draft_sink":48,"stability_probe":true,"delta_vs_keep":-0.9671982917717378}}
{"run":829,"commit":"8b55918","metric":105.71072376603341,"metrics":{},"status":"discard","description":"Control pair sample after mirror rebound to high-105 (mirror disabled).","timestamp":1776291265094,"segment":23,"confidence":4.429452628938103,"iterationTokens":689,"asi":{"hypothesis":"Control should stay near mirror in shared high-105 regime.","rollback_reason":"Control slightly below paired mirror; both remain below keep.","next_action_hint":"Run mirror follow-up and keep using paired medians to avoid overfitting to single-run spikes.","backend":"bstnxbt_mlx","mirror_runtime_enabled":0,"context_only_draft_cache":1,"draft_sink":48,"paired_mirror_tok_s":105.89280170822826,"paired_delta_tok_s":0.1820779421948445}}
{"run":830,"commit":"8b55918","metric":104.60832132031388,"metrics":{},"status":"discard","description":"Mirror follow-up after control high-105 pair sample.","timestamp":1776291300660,"segment":23,"confidence":4.45843158849839,"iterationTokens":638,"asi":{"hypothesis":"Mirror should remain near control if rebound phase is stable.","rollback_reason":"Mirror fell back to low-104, indicating persistent jitter around local median.","next_action_hint":"Continue paired-bundle approach and avoid promoting sub-1 tok/s deltas.","backend":"mirror_sd_mlx","context_only_draft_cache":1,"draft_sink":48,"paired_control_tok_s":105.71072376603341,"paired_delta_tok_s":-1.1024024457195294,"delta_vs_keep":-2.2516786796861195}}
{"run":831,"commit":"8b55918","metric":105.04052984727703,"metrics":{},"status":"discard","description":"Mirror stability sample after ideas/pruning update.","timestamp":1776291349089,"segment":23,"confidence":4.565632263989713,"iterationTokens":1223,"asi":{"hypothesis":"Unchanged mirror config should continue clustering in low/mid-105 band under current regime.","rollback_reason":"Sample below keep and within known jitter band.","next_action_hint":"Run paired control sample to maintain parity tracking in this band.","backend":"mirror_sd_mlx","context_only_draft_cache":1,"draft_sink":48,"bundle_tracking":true,"delta_vs_keep":-1.8194701527239714}}
{"run":832,"commit":"8b55918","metric":105.43984025308825,"metrics":{},"status":"discard","description":"Control parity sample after mirror 105.04 run (mirror disabled).","timestamp":1776291392384,"segment":23,"confidence":4.67811511597571,"iterationTokens":675,"asi":{"hypothesis":"Control should remain in same ~105 band if parity still holds.","rollback_reason":"Control landed slightly above mirror and still below keep.","next_action_hint":"Run mirror follow-up to complete parity cycle and observe ordering.","backend":"bstnxbt_mlx","mirror_runtime_enabled":0,"context_only_draft_cache":1,"draft_sink":48,"paired_mirror_tok_s":105.04052984727703,"paired_delta_tok_s":-0.3993104058112172}}
{"run":833,"commit":"8b55918","metric":104.97218999400431,"metrics":{},"status":"discard","description":"Mirror follow-up completing current parity cycle.","timestamp":1776291430442,"segment":23,"confidence":4.714951105690558,"iterationTokens":626,"asi":{"hypothesis":"Mirror should remain within same ~105 jitter band as control in current regime.","rollback_reason":"Mirror stayed ~105 and below keep.","next_action_hint":"Continue structural exploration and avoid interpreting sub-1 tok/s parity flips as real gains.","backend":"mirror_sd_mlx","context_only_draft_cache":1,"draft_sink":48,"paired_control_tok_s":105.43984025308825,"paired_delta_tok_s":-0.46765025908393965,"delta_vs_keep":-1.887810005996696}}
{"run":834,"commit":"8b55918","metric":105.41849114173415,"metrics":{},"status":"discard","description":"Mirror block-size extension: DFLASH_BLOCK_TOKENS=21.","timestamp":1776291469711,"segment":23,"confidence":4.740439933194453,"iterationTokens":1128,"asi":{"hypothesis":"Larger block 21 might improve amortization if acceptance remains high enough.","rollback_reason":"Below keep (105.42 vs 106.86).","next_action_hint":"Add block_tokens=21 to do-not-retry set; high block-size extension remains non-winning.","backend":"mirror_sd_mlx","context_only_draft_cache":1,"draft_sink":48,"block_tokens":21,"delta_vs_keep":-1.0415088582658474}}
